Sheet: Calculations
A1: NOAA Solar Calculations - Change any of the highlighted cells to get solar position data for that location and time-of-day for a year. | D1: Date | E1: Time (hrs past local midnight) | F1: Julian Day | G1: Julian Century | I1: Geom Mean Long Sun (deg) | J1: Geom Mean Anom Sun (deg) | K1: Eccent Earth Orbit | L1: Sun Eq of Ctr | M1: Sun True Long (deg) | N1: Sun True Anom (deg) | O1: Sun Rad Vector (AUs) | P1: Sun App Long (deg) | Q1: Mean Obliq Ecliptic (deg) | R1: Obliq Corr (deg) | S1: Sun Rt Ascen (deg) | T1: Sun Declin (deg) | U1: var y | V1: Eq of Time (minutes) | W1: HA Sunrise (deg) | X1: Solar Noon (LST) | Y1: Sunrise Time (LST) | Z1: Sunset Time (LST) | AA1: Sunlight Duration (minutes) | AB1: True Solar Time (min) | AC1: Hour Angle (deg) | AD1: Solar Zenith Angle (deg) | AE1: Solar Elevation Angle (deg) | AF1: Approx Atmospheric Refraction (deg) | AG1: Solar Elevation corrected for atm refraction (deg) | AH1: Solar Azimuth Angle (deg cw from N)
A2: Latitude (+ to N) | B2: 70 | D2: =DATEVALUE("1/1/"&R6C2) -> 2017-01-01T00:00:00.000 | E2: =R5C2 -> 1899-12-31T14:00:00.000 | F2: =RC[-2]+2415018.5+RC[-1]-R4C2/24 -> 2457755.375 | G2: =(RC[-1]-2451545)/36525 -> 0.17003080082135524 | I2: =MOD(280.46646+RC[-2]*(36000.76983 + RC[-2]*0.0003032),360) -> 281.70619314584019 | J2: =357.52911+RC[-3]*(35999.05029 - 0.0001537*RC[-3]) -> 6478.4764551734015 | K2: =0.016708634-RC[-4]*(0.000042037+0.0000001267*RC[-4]) -> 1.6701482752268914E-2 | L2: =SIN(RADIANS(RC[-2]))*(1.914602-RC[-5]*(0.004817+0.000014*RC[-5]))+SIN(RADIANS(2*RC[-2]))*(0.019993-0.000101*RC[-5])+SIN(RADIANS(3*RC[-2]))*0.000289 -> -5.1968031581250899E-2 | M2: =RC[-4]+RC[-1] -> 281.65422511425896 | N2: =RC[-4]+RC[-2] -> 6478.4244871418205 | O2: =(1.000001018*(1-RC[-4]*RC[-4]))/(1+RC[-4]*COS(RADIANS(RC[-1]))) -> 0.983305624731733 | P2: =RC[-3]-0.00569-0.00478*SIN(RADIANS(125.04-1934.136*RC[-9])) -> 281.64660443569107 | Q2: =23+(26+((21.448-RC[-10]*(46.815+RC[-10]*(0.00059-RC[-10]*0.001813))))/60)/60 -> 23.437079999976245 | R2: =RC[-1]+0.00256*COS(RADIANS(125.04-1934.136*RC[-11])) -> 23.43473811257773 | S2: =DEGREES(ATAN2(COS(RADIANS(RC[-3])),COS(RADIANS(RC[-1]))*SIN(RADIANS(RC[-3])))) -> -77.338771113694563 | T2: =DEGREES(ASIN(SIN(RADIANS(RC[-2]))*SIN(RADIANS(RC[-4])))) -> -22.924390657250921 | U2: =TAN(RADIANS(RC[-3]/2))*TAN(RADIANS(RC[-3]/2)) -> 4.301733692759592E-2 | V2: =4*DEGREES(RC[-1]*SIN(2*RADIANS(RC[-13]))-2*RC[-11]*SIN(RADIANS(RC[-12]))+4*RC[-11]*RC[-1]*SIN(RADIANS(RC[-12]))*COS(2*RADIANS(RC[-13]))-0.5*RC[-1]*RC[-1]*SIN(4*RADIANS(RC[-13]))-1.25*RC[-11]*RC[-11]*SIN(2*RADIANS(RC[-12]))) -> -3.8481602452851593 | W2: =DEGREES(ACOS(COS(RADIANS(90.833))/(COS(RADIANS(R2C2))*COS(RADIANS(RC[-3])))-TAN(RADIANS(R2C2))*TAN(RADIANS(RC[-3])))) -> #NUM! | X2: =(720-4*R3C2-RC[-2]+R4C2*60)/1440 -> 1899-12-31T13:59:50.890 | Y2: =(RC[-1]*1440-RC[-2]*4)/1440 -> #NUM! | Z2: =(RC[-2]*1440+RC[-3]*4)/1440 -> #NUM! | AA2: =8*RC[-4] -> #NUM! | AB2: =MOD(RC[-23]*1440+RC[-6]+4*R3C2-60*R4C2,1440) -> 720.15183975471484 | AC2: =IF(RC[-1]/4<0,RC[-1]/4+180,RC[-1]/4-180) -> 3.7959938678710614E-2 | AD2: =DEGREES(ACOS(SIN(RADIANS(R2C2))*SIN(RADIANS(RC[-10]))+COS(RADIANS(R2C2))*COS(RADIANS(RC[-10]))*COS(RADIANS(RC[-1])))) -> 92.924394623544799 | AE2: =90-RC[-1] -> -2.9243946235447993 | AF2: =IF(RC[-1]>85,0,IF(RC[-1]>5,58.1/TAN(RADIANS(RC[-1]))-0.07/POWER(TAN(RADIANS(RC[-1])),3)+0.000086/POWER(TAN(RADIANS(RC[-1])),5),IF(RC[-1]>-0.575,1735+RC[-1]*(-518.2+RC[-1]*(103.4+RC[-1]*(-12.79+RC[-1]*0.711))),-20.772/TAN(RADIANS(RC[-1])))))/3600 -> 0.11294970748390271 | AG2: =RC[-2]+RC[-1] -> -2.8114449160608967 | AH2: =IF(RC[-5]>0,MOD(DEGREES(ACOS(((SIN(RADIANS(R2C2))*COS(RADIANS(RC[-4])))-SIN(RADIANS(RC[-14])))/(COS(RADIANS(R2C2))*SIN(RADIANS(RC[-4])))))+180,360),MOD(540-DEGREES(ACOS(((SIN(RADIANS(R2C2))*COS(RADIANS(RC[-4])))-SIN(RADIANS(RC[-14])))/(COS(RADIANS(R2C2))*SIN(RADIANS(RC[-4]))))),360)) -> 180.03500743919389
A3: Longitude (+ to E) | B3: -134 | D3: =R[-1]C+1 -> 2017-01-02T00:00:00.000 | E3: =R5C2 -> 1899-12-31T14:00:00.000 | F3: =RC[-2]+2415018.5+RC[-1]-R4C2/24 -> 2457756.375 | G3: =(RC[-1]-2451545)/36525 -> 0.17005817932922657 | I3: =MOD(280.46646+RC[-2]*(36000.76983 + RC[-2]*0.0003032),360) -> 282.69184050882723 | J3: =357.52911+RC[-3]*(35999.05029 - 0.0001537*RC[-3]) -> 6479.4620554536959 | K3: =0.016708634-RC[-4]*(0.000042037+0.0000001267*RC[-4]) -> 1.6701481600178859E-2 | L3: =SIN(RADIANS(RC[-2]))*(1.914602-RC[-5]*(0.004817+0.000014*RC[-5]))+SIN(RADIANS(2*RC[-2]))*(0.019993-0.000101*RC[-5])+SIN(RADIANS(3*RC[-2]))*0.000289 -> -1.8351273799931477E-2 | M3: =RC[-4]+RC[-1] -> 282.67348923502732 | N3: =RC[-4]+RC[-2] -> 6479.4437041798956 | O3: =(1.000001018*(1-RC[-4]*RC[-4]))/(1+RC[-4]*COS(RADIANS(RC[-1]))) -> 0.98330028074118336 | P3: =RC[-3]-0.00569-0.00478*SIN(RADIANS(125.04-1934.136*RC[-9])) -> 282.66586451591945 | Q3: =23+(26+((21.448-RC[-10]*(46.815+RC[-10]*(0.00059-RC[-10]*0.001813))))/60)/60 -> 23.437079643941235 | R3: =RC[-1]+0.00256*COS(RADIANS(125.04-1934.136*RC[-11])) -> 23.434738713186906 | S3: =DEGREES(ATAN2(COS(RADIANS(RC[-3])),COS(RADIANS(RC[-1]))*SIN(RADIANS(RC[-3])))) -> -76.237061105480436 | T3: =DEGREES(ASIN(SIN(RADIANS(RC[-2]))*SIN(RADIANS(RC[-4])))) -> -22.831743336818175 | U3: =TAN(RADIANS(RC[-3]/2))*TAN(RADIANS(RC[-3]/2)) -> 4.3017339195280398E-2 | V3: =4*DEGREES(RC[-1]*SIN(2*RADIANS(RC[-13]))-2*RC[-11]*SIN(RADIANS(RC[-12]))+4*RC[-11]*RC[-1]*SIN(RADIANS(RC[-12]))*COS(2*RADIANS(RC[-13]))-0.5*RC[-1]*RC[-1]*SIN(4*RADIANS(RC[-13]))-1.25*RC[-11]*RC[-11]*SIN(2*RADIANS(RC[-12]))) -> -4.3115587801913176 | W3: =DEGREES(ACOS(COS(RADIANS(90.833))/(COS(RADIANS(R2C2))*COS(RADIANS(RC[-3])))-TAN(RADIANS(R2C2))*TAN(RADIANS(RC[-3])))) -> #NUM! | X3: =(720-4*R3C2-RC[-2]+R4C2*60)/1440 -> 1899-12-31T14:00:18.694 | Y3: =(RC[-1]*1440-RC[-2]*4)/1440 -> #NUM! | Z3: =(RC[-2]*1440+RC[-3]*4)/1440 -> #NUM! | AA3: =8*RC[-4] -> #NUM! | AB3: =MOD(RC[-23]*1440+RC[-6]+4*R3C2-60*R4C2,1440) -> 719.68844121980874 | AC3: =IF(RC[-1]/4<0,RC[-1]/4+180,RC[-1]/4-180) -> -7.7889695047815621E-2 | AD3: =DEGREES(ACOS(SIN(RADIANS(R2C2))*SIN(RADIANS(RC[-10]))+COS(RADIANS(R2C2))*COS(RADIANS(RC[-10]))*COS(RADIANS(RC[-1])))) -> 92.831760045987735 | AE3: =90-RC[-1] -> -2.8317600459877355 | AF3: =IF(RC[-1]>85,0,IF(RC[-1]>5,58.1/TAN(RADIANS(RC[-1]))-0.07/POWER(TAN(RADIANS(RC[-1])),3)+0.000086/POWER(TAN(RADIANS(RC[-1])),5),IF(RC[-1]>-0.575,1735+RC[-1]*(-518.2+RC[-1]*(103.4+RC[-1]*(-12.79+RC[-1]*0.711))),-20.772/TAN(RADIANS(RC[-1])))))/3600 -> 0.1166509228600527 | AG3: =RC[-2]+RC[-1] -> -2.7151091231276827 | AH3: =IF(RC[-5]>0,MOD(DEGREES(ACOS(((SIN(RADIANS(R2C2))*COS(RADIANS(RC[-4])))-SIN(RADIANS(RC[-14])))/(COS(RADIANS(R2C2))*SIN(RADIANS(RC[-4])))))+180,360),MOD(540-DEGREES(ACOS(((SIN(RADIANS(R2C2))*COS(RADIANS(RC[-4])))-SIN(RADIANS(RC[-14])))/(COS(RADIANS(R2C2))*SIN(RADIANS(RC[-4]))))),360)) -> 179.9281253312389
A4: Time Zone (+ to E) | B4: -7 | D4: =R[-1]C+1 -> 2017-01-03T00:00:00.000 | E4: =R5C2 -> 1899-12-31T14:00:00.000 | F4: =RC[-2]+2415018.5+RC[-1]-R4C2/24 -> 2457757.375 | G4: =(RC[-1]-2451545)/36525 -> 0.17008555783709789 | I4: =MOD(280.46646+RC[-2]*(36000.76983 + RC[-2]*0.0003032),360) -> 283.67748787181517 | J4: =357.52911+RC[-3]*(35999.05029 - 0.0001537*RC[-3]) -> 6480.4476557339885 | K4: =0.016708634-RC[-4]*(0.000042037+0.0000001267*RC[-4]) -> 1.6701480448088613E-2 | L4: =SIN(RADIANS(RC[-2]))*(1.914602-RC[-5]*(0.004817+0.000014*RC[-5]))+SIN(RADIANS(2*RC[-2]))*(0.019993-0.000101*RC[-5])+SIN(RADIANS(3*RC[-2]))*0.000289 -> 1.5271261589375869E-2 | M4: =RC[-4]+RC[-1] -> 283.69275913340454 | N4: =RC[-4]+RC[-2] -> 6480.4629269955776 | O4: =(1.000001018*(1-RC[-4]*RC[-4]))/(1+RC[-4]*COS(RADIANS(RC[-1]))) -> 0.98330004777355384 | P4: =RC[-3]-0.00569-0.00478*SIN(RADIANS(125.04-1934.136*RC[-9])) -> 283.68513037540924 | Q4: =23+(26+((21.448-RC[-10]*(46.815+RC[-10]*(0.00059-RC[-10]*0.001813))))/60)/60 -> 23.437079287906226 | R4: =RC[-1]+0.00256*COS(RADIANS(125.04-1934.136*RC[-11])) -> 23.434739315795653 | S4: =DEGREES(ATAN2(COS(RADIANS(RC[-3])),COS(RADIANS(RC[-1]))*SIN(RADIANS(RC[-3])))) -> -75.136904950090241 | T4: =DEGREES(ASIN(SIN(RADIANS(RC[-2]))*SIN(RADIANS(RC[-4])))) -> -22.73153020345601 | U4: =TAN(RADIANS(RC[-3]/2))*TAN(RADIANS(RC[-3]/2)) -> 4.3017341470514572E-2 | V4: =4*DEGREES(RC[-1]*SIN(2*RADIANS(RC[-13]))-2*RC[-11]*SIN(RADIANS(RC[-12]))+4*RC[-11]*RC[-1]*SIN(RADIANS(RC[-12]))*COS(2*RADIANS(RC[-13]))-0.5*RC[-1]*RC[-1]*SIN(4*RADIANS(RC[-13]))-1.25*RC[-11]*RC[-11]*SIN(2*RADIANS(RC[-12]))) -> -4.7688747872032158 | W4: =DEGREES(ACOS(COS(RADIANS(90.833))/(COS(RADIANS(R2C2))*COS(RADIANS(RC[-3])))-TAN(RADIANS(R2C2))*TAN(RADIANS(RC[-3])))) -> #NUM! | X4: =(720-4*R3C2-RC[-2]+R4C2*60)/1440 -> 1899-12-31T14:00:46.132 | Y4: =(RC[-1]*1440-RC[-2]*4)/1440 -> #NUM! | Z4: =(RC[-2]*1440+RC[-3]*4)/1440 -> #NUM! | AA4: =8*RC[-4] -> #NUM! | AB4: =MOD(RC[-23]*1440+RC[-6]+4*R3C2-60*R4C2,1440) -> 719.23112521279677 | AC4: =IF(RC[-1]/4<0,RC[-1]/4+180,RC[-1]/4-180) -> -0.19221869680080772 | AD4: =DEGREES(ACOS(SIN(RADIANS(R2C2))*SIN(RADIANS(RC[-10]))+COS(RADIANS(R2C2))*COS(RADIANS(RC[-10]))*COS(RADIANS(RC[-1])))) -> 92.731632031618162 | AE4: =90-RC[-1] -> -2.7316320316181617 | AF4: =IF(RC[-1]>85,0,IF(RC[-1]>5,58.1/TAN(RADIANS(RC[-1]))-0.07/POWER(TAN(RADIANS(RC[-1])),3)+0.000086/POWER(TAN(RADIANS(RC[-1])),5),IF(RC[-1]>-0.575,1735+RC[-1]*(-518.2+RC[-1]*(103.4+RC[-1]*(-12.79+RC[-1]*0.711))),-20.772/TAN(RADIANS(RC[-1])))))/3600 -> 0.12093361189181134 | AG4: =RC[-2]+RC[-1] -> -2.6106984197263503 | AH4: =IF(RC[-5]>0,MOD(DEGREES(ACOS(((SIN(RADIANS(R2C2))*COS(RADIANS(RC[-4])))-SIN(RADIANS(RC[-14])))/(COS(RADIANS(R2C2))*SIN(RADIANS(RC[-4])))))+180,360),MOD(540-DEGREES(ACOS(((SIN(RADIANS(R2C2))*COS(RADIANS(RC[-4])))-SIN(RADIANS(RC[-14])))/(COS(RADIANS(R2C2))*SIN(RADIANS(RC[-4]))))),360)) -> 179.82251014848089
A5: Local Time (hrs) | B5: 1899-12-31T14:00:00.000 | D5: =R[-1]C+1 -> 2017-01-04T00:00:00.000 | E5: =R5C2 -> 1899-12-31T14:00:00.000 | F5: =RC[-2]+2415018.5+RC[-1]-R4C2/24 -> 2457758.375 | G5: =(RC[-1]-2451545)/36525 -> 0.17011293634496921 | I5: =MOD(280.46646+RC[-2]*(36000.76983 + RC[-2]*0.0003032),360) -> 284.66313523480403 | J5: =357.52911+RC[-3]*(35999.05029 - 0.0001537*RC[-3]) -> 6481.4332560142821 | K5: =0.016708634-RC[-4]*(0.000042037+0.0000001267*RC[-4]) -> 1.6701479295998179E-2 | L5: =SIN(RADIANS(RC[-2]))*(1.914602-RC[-5]*(0.004817+0.000014*RC[-5]))+SIN(RADIANS(2*RC[-2]))*(0.019993-0.000101*RC[-5])+SIN(RADIANS(3*RC[-2]))*0.000289 -> 4.8888980390519039E-2 | M5: =RC[-4]+RC[-1] -> 284.71202421519456 | N5: =RC[-4]+RC[-2] -> 6481.4821449946721 | O5: =(1.000001018*(1-RC[-4]*RC[-4]))/(1+RC[-4]*COS(RADIANS(RC[-1]))) -> 0.98330492590426599 | P5: =RC[-3]-0.00569-0.00478*SIN(RADIANS(125.04-1934.136*RC[-9])) -> 284.70439141996792 | Q5: =23+(26+((21.448-RC[-10]*(46.815+RC[-10]*(0.00059-RC[-10]*0.001813))))/60)/60 -> 23.437078931871216 | R5: =RC[-1]+0.00256*COS(RADIANS(125.04-1934.136*RC[-11])) -> 23.434739920403157 | S5: =DEGREES(ATAN2(COS(RADIANS(RC[-3])),COS(RADIANS(RC[-1]))*SIN(RADIANS(RC[-3])))) -> -74.038425413894117 | T5: =DEGREES(ASIN(SIN(RADIANS(RC[-2]))*SIN(RADIANS(RC[-4])))) -> -22.623800307768093 | U5: =TAN(RADIANS(RC[-3]/2))*TAN(RADIANS(RC[-3]/2)) -> 4.3017343753295412E-2 | V5: =4*DEGREES(RC[-1]*SIN(2*RADIANS(RC[-13]))-2*RC[-11]*SIN(RADIANS(RC[-12]))+4*RC[-11]*RC[-1]*SIN(RADIANS(RC[-12]))*COS(2*RADIANS(RC[-13]))-0.5*RC[-1]*RC[-1]*SIN(4*RADIANS(RC[-13]))-1.25*RC[-11]*RC[-11]*SIN(2*RADIANS(RC[-12]))) -> -5.2196254917907634 | W5: =DEGREES(ACOS(COS(RADIANS(90.833))/(COS(RADIANS(R2C2))*COS(RADIANS(RC[-3])))-TAN(RADIANS(R2C2))*TAN(RADIANS(RC[-3])))) -> #NUM! | X5: =(720-4*R3C2-RC[-2]+R4C2*60)/1440 -> 1899-12-31T14:01:13.178 | Y5: =(RC[-1]*1440-RC[-2]*4)/1440 -> #NUM! | Z5: =(RC[-2]*1440+RC[-3]*4)/1440 -> #NUM! | AA5: =8*RC[-4] -> #NUM! | AB5: =MOD(RC[-23]*1440+RC[-6]+4*R3C2-60*R4C2,1440) -> 718.78037450820921 | AC5: =IF(RC[-1]/4<0,RC[-1]/4+180,RC[-1]/4-180) -> -0.3049063729476984 | AD5: =DEGREES(ACOS(SIN(RADIANS(R2C2))*SIN(RADIANS(RC[-10]))+COS(RADIANS(R2C2))*COS(RADIANS(RC[-10]))*COS(RADIANS(RC[-1])))) -> 92.624056704260198 | AE5: =90-RC[-1] -> -2.6240567042601981 | AF5: =IF(RC[-1]>85,0,IF(RC[-1]>5,58.1/TAN(RADIANS(RC[-1]))-0.07/POWER(TAN(RADIANS(RC[-1])),3)+0.000086/POWER(TAN(RADIANS(RC[-1])),5),IF(RC[-1]>-0.575,1735+RC[-1]*(-518.2+RC[-1]*(103.4+RC[-1]*(-12.79+RC[-1]*0.711))),-20.772/TAN(RADIANS(RC[-1])))))/3600 -> 0.12589875561666075 | AG5: =RC[-2]+RC[-1] -> -2.4981579486435375 | AH5: =IF(RC[-5]>0,MOD(DEGREES(ACOS(((SIN(RADIANS(R2C2))*COS(RADIANS(RC[-4])))-SIN(RADIANS(RC[-14])))/(COS(RADIANS(R2C2))*SIN(RADIANS(RC[-4])))))+180,360),MOD(540-DEGREES(ACOS(((SIN(RADIANS(R2C2))*COS(RADIANS(RC[-4])))-SIN(RADIANS(RC[-14])))/(COS(RADIANS(R2C2))*SIN(RADIANS(RC[-4]))))),360)) -> 179.71826079129494
A6: Year | B6: 2017 | D6: =R[-1]C+1 -> 2017-01-05T00:00:00.000 | E6: =R5C2 -> 1899-12-31T14:00:00.000 | F6: =RC[-2]+2415018.5+RC[-1]-R4C2/24 -> 2457759.375 | G6: =(RC[-1]-2451545)/36525 -> 0.17014031485284051 | I6: =MOD(280.46646+RC[-2]*(36000.76983 + RC[-2]*0.0003032),360) -> 285.64878259779198 | J6: =357.52911+RC[-3]*(35999.05029 - 0.0001537*RC[-3]) -> 6482.4188562945747 | K6: =0.016708634-RC[-4]*(0.000042037+0.0000001267*RC[-4]) -> 1.6701478143907555E-2 | L6: =SIN(RADIANS(RC[-2]))*(1.914602-RC[-5]*(0.004817+0.000014*RC[-5]))+SIN(RADIANS(2*RC[-2]))*(0.019993-0.000101*RC[-5])+SIN(RADIANS(3*RC[-2]))*0.000289 -> 8.2491290204670095E-2 | M6: =RC[-4]+RC[-1] -> 285.73127388799662 | N6: =RC[-4]+RC[-2] -> 6482.5013475847791 | O6: =(1.000001018*(1-RC[-4]*RC[-4]))/(1+RC[-4]*COS(RADIANS(RC[-1]))) -> 0.98331491353835887 | P6: =RC[-3]-0.00569-0.00478*SIN(RADIANS(125.04-1934.136*RC[-9])) -> 285.72363705719806 | Q6: =23+(26+((21.448-RC[-10]*(46.815+RC[-10]*(0.00059-RC[-10]*0.001813))))/60)/60 -> 23.437078575836207 | R6: =RC[-1]+0.00256*COS(RADIANS(125.04-1934.136*RC[-11])) -> 23.434740527008586 | S6: =DEGREES(ATAN2(COS(RADIANS(RC[-3])),COS(RADIANS(RC[-1]))*SIN(RADIANS(RC[-3])))) -> -72.941742049411886 | T6: =DEGREES(ASIN(SIN(RADIANS(RC[-2]))*SIN(RADIANS(RC[-4])))) -> -22.508606354280083 | U6: =TAN(RADIANS(RC[-3]/2))*TAN(RADIANS(RC[-3]/2)) -> 4.3017346043619779E-2 | V6: =4*DEGREES(RC[-1]*SIN(2*RADIANS(RC[-13]))-2*RC[-11]*SIN(RADIANS(RC[-12]))+4*RC[-11]*RC[-1]*SIN(RADIANS(RC[-12]))*COS(2*RADIANS(RC[-13]))-0.5*RC[-1]*RC[-1]*SIN(4*RADIANS(RC[-13]))-1.25*RC[-11]*RC[-11]*SIN(2*RADIANS(RC[-12]))) -> -5.6633394264538106 | W6: =DEGREES(ACOS(COS(RADIANS(90.833))/(COS(RADIANS(R2C2))*COS(RADIANS(RC[-3])))-TAN(RADIANS(R2C2))*TAN(RADIANS(RC[-3])))) -> #NUM! | X6: =(720-4*R3C2-RC[-2]+R4C2*60)/1440 -> 1899-12-31T14:01:39.800 | Y6: =(RC[-1]*1440-RC[-2]*4)/1440 -> #NUM! | Z6: =(RC[-2]*1440+RC[-3]*4)/1440 -> #NUM! | AA6: =8*RC[-4] -> #NUM! | AB6: =MOD(RC[-23]*1440+RC[-6]+4*R3C2-60*R4C2,1440) -> 718.33666057354617 | AC6: =IF(RC[-1]/4<0,RC[-1]/4+180,RC[-1]/4-180) -> -0.41583485661345776 | AD6: =DEGREES(ACOS(SIN(RADIANS(R2C2))*SIN(RADIANS(RC[-10]))+COS(RADIANS(R2C2))*COS(RADIANS(RC[-10]))*COS(RADIANS(RC[-1])))) -> 92.509083601856332 | AE6: =90-RC[-1] -> -2.5090836018563323 | AF6: =IF(RC[-1]>85,0,IF(RC[-1]>5,58.1/TAN(RADIANS(RC[-1]))-0.07/POWER(TAN(RADIANS(RC[-1])),3)+0.000086/POWER(TAN(RADIANS(RC[-1])),5),IF(RC[-1]>-0.575,1735+RC[-1]*(-518.2+RC[-1]*(103.4+RC[-1]*(-12.79+RC[-1]*0.711))),-20.772/TAN(RADIANS(RC[-1])))))/3600 -> 0.13167568032338001 | AG6: =RC[-2]+RC[-1] -> -2.3774079215329524 | AH6: =IF(RC[-5]>0,MOD(DEGREES(ACOS(((SIN(RADIANS(R2C2))*COS(RADIANS(RC[-4])))-SIN(RADIANS(RC[-14])))/(COS(RADIANS(R2C2))*SIN(RADIANS(RC[-4])))))+180,360),MOD(540-DEGREES(ACOS(((SIN(RADIANS(R2C2))*COS(RADIANS(RC[-4])))-SIN(RADIANS(RC[-14])))/(COS(RADIANS(R2C2))*SIN(RADIANS(RC[-4]))))),360)) -> 179.61547443630582
D7: =R[-1]C+1 -> 2017-01-06T00:00:00.000 | E7: =R5C2 -> 1899-12-31T14:00:00.000 | F7: =RC[-2]+2415018.5+RC[-1]-R4C2/24 -> 2457760.375 | G7: =(RC[-1]-2451545)/36525 -> 0.17016769336071183 | I7: =MOD(280.46646+RC[-2]*(36000.76983 + RC[-2]*0.0003032),360) -> 286.63442996077993 | J7: =357.52911+RC[-3]*(35999.05029 - 0.0001537*RC[-3]) -> 6483.4044565748663 | K7: =0.016708634-RC[-4]*(0.000042037+0.0000001267*RC[-4]) -> 1.670147699181674E-2 | L7: =SIN(RADIANS(RC[-2]))*(1.914602-RC[-5]*(0.004817+0.000014*RC[-5]))+SIN(RADIANS(2*RC[-2]))*(0.019993-0.000101*RC[-5])+SIN(RADIANS(3*RC[-2]))*0.000289 -> 0.1160676043802852 | M7: =RC[-4]+RC[-1] -> 286.75049756516023 | N7: =RC[-4]+RC[-2] -> 6483.5205241792464 | O7: =(1.000001018*(1-RC[-4]*RC[-4]))/(1+RC[-4]*COS(RADIANS(RC[-1]))) -> 0.98333000741115906 | P7: =RC[-3]-0.00569-0.00478*SIN(RADIANS(125.04-1934.136*RC[-9])) -> 286.74285670045276 | Q7: =23+(26+((21.448-RC[-10]*(46.815+RC[-10]*(0.00059-RC[-10]*0.001813))))/60)/60 -> 23.437078219801197 | R7: =RC[-1]+0.00256*COS(RADIANS(125.04-1934.136*RC[-11])) -> 23.434741135611127 | S7: =DEGREES(ATAN2(COS(RADIANS(RC[-3])),COS(RADIANS(RC[-1]))*SIN(RADIANS(RC[-3])))) -> -71.8469710032888 | T7: =DEGREES(ASIN(SIN(RADIANS(RC[-2]))*SIN(RADIANS(RC[-4])))) -> -22.386004617413338 | U7: =TAN(RADIANS(RC[-3]/2))*TAN(RADIANS(RC[-3]/2)) -> 4.3017348341484574E-2 | V7: =4*DEGREES(RC[-1]*SIN(2*RADIANS(RC[-13]))-2*RC[-11]*SIN(RADIANS(RC[-12]))+4*RC[-11]*RC[-1]*SIN(RADIANS(RC[-12]))*COS(2*RADIANS(RC[-13]))-0.5*RC[-1]*RC[-1]*SIN(4*RADIANS(RC[-13]))-1.25*RC[-11]*RC[-11]*SIN(2*RADIANS(RC[-12]))) -> -6.0995571485064657 | W7: =DEGREES(ACOS(COS(RADIANS(90.833))/(COS(RADIANS(R2C2))*COS(RADIANS(RC[-3])))-TAN(RADIANS(R2C2))*TAN(RADIANS(RC[-3])))) -> #NUM! | X7: =(720-4*R3C2-RC[-2]+R4C2*60)/1440 -> 1899-12-31T14:02:05.973 | Y7: =(RC[-1]*1440-RC[-2]*4)/1440 -> #NUM! | Z7: =(RC[-2]*1440+RC[-3]*4)/1440 -> #NUM! | AA7: =8*RC[-4] -> #NUM! | AB7: =MOD(RC[-23]*1440+RC[-6]+4*R3C2-60*R4C2,1440) -> 717.90044285149349 | AC7: =IF(RC[-1]/4<0,RC[-1]/4+180,RC[-1]/4-180) -> -0.52488928712662641 | AD7: =DEGREES(ACOS(SIN(RADIANS(R2C2))*SIN(RADIANS(RC[-10]))+COS(RADIANS(R2C2))*COS(RADIANS(RC[-10]))*COS(RADIANS(RC[-1])))) -> 92.386765610112718 | AE7: =90-RC[-1] -> -2.3867656101127182 | AF7: =IF(RC[-1]>85,0,IF(RC[-1]>5,58.1/TAN(RADIANS(RC[-1]))-0.07/POWER(TAN(RADIANS(RC[-1])),3)+0.000086/POWER(TAN(RADIANS(RC[-1])),5),IF(RC[-1]>-0.575,1735+RC[-1]*(-518.2+RC[-1]*(103.4+RC[-1]*(-12.79+RC[-1]*0.711))),-20.772/TAN(RADIANS(RC[-1])))))/3600 -> 0.13843227683118864 | AG7: =RC[-2]+RC[-1] -> -2.2483333332815296 | AH7: =IF(RC[-5]>0,MOD(DEGREES(ACOS(((SIN(RADIANS(R2C2))*COS(RADIANS(RC[-4])))-SIN(RADIANS(RC[-14])))/(COS(RADIANS(R2C2))*SIN(RADIANS(RC[-4])))))+180,360),MOD(540-DEGREES(ACOS(((SIN(RADIANS(R2C2))*COS(RADIANS(RC[-4])))-SIN(RADIANS(RC[-14])))/(COS(RADIANS(R2C2))*SIN(RADIANS(RC[-4]))))),360)) -> 179.51424641975996
D8: =R[-1]C+1 -> 2017-01-07T00:00:00.000 | E8: =R5C2 -> 1899-12-31T14:00:00.000 | F8: =RC[-2]+2415018.5+RC[-1]-R4C2/24 -> 2457761.375 | G8: =(RC[-1]-2451545)/36525 -> 0.17019507186858315 | I8: =MOD(280.46646+RC[-2]*(36000.76983 + RC[-2]*0.0003032),360) -> 287.62007732376969 | J8: =357.52911+RC[-3]*(35999.05029 - 0.0001537*RC[-3]) -> 6484.3900568551599 | K8: =0.016708634-RC[-4]*(0.000042037+0.0000001267*RC[-4]) -> 1.6701475839725734E-2 | L8: =SIN(RADIANS(RC[-2]))*(1.914602-RC[-5]*(0.004817+0.000014*RC[-5]))+SIN(RADIANS(2*RC[-2]))*(0.019993-0.000101*RC[-5])+SIN(RADIANS(3*RC[-2]))*0.000289 -> 0.14960734595959033 | M8: =RC[-4]+RC[-1] -> 287.76968466972926 | N8: =RC[-4]+RC[-2] -> 6484.5396642011192 | O8: =(1.000001018*(1-RC[-4]*RC[-4]))/(1+RC[-4]*COS(RADIANS(RC[-1]))) -> 0.98335020258964601 | P8: =RC[-3]-0.00569-0.00478*SIN(RADIANS(125.04-1934.136*RC[-9])) -> 287.76203977277925 | Q8: =23+(26+((21.448-RC[-10]*(46.815+RC[-10]*(0.00059-RC[-10]*0.001813))))/60)/60 -> 23.437077863766191 | R8: =RC[-1]+0.00256*COS(RADIANS(125.04-1934.136*RC[-11])) -> 23.434741746209959 | S8: =DEGREES(ATAN2(COS(RADIANS(RC[-3])),COS(RADIANS(RC[-1]))*SIN(RADIANS(RC[-3])))) -> -70.754224836026097 | T8: =DEGREES(ASIN(SIN(RADIANS(RC[-2]))*SIN(RADIANS(RC[-4])))) -> -22.256054852827383 | U8: =TAN(RADIANS(RC[-3]/2))*TAN(RADIANS(RC[-3]/2)) -> 4.3017350646886714E-2 | V8: =4*DEGREES(RC[-1]*SIN(2*RADIANS(RC[-13]))-2*RC[-11]*SIN(RADIANS(RC[-12]))+4*RC[-11]*RC[-1]*SIN(RADIANS(RC[-12]))*COS(2*RADIANS(RC[-13]))-0.5*RC[-1]*RC[-1]*SIN(4*RADIANS(RC[-13]))-1.25*RC[-11]*RC[-11]*SIN(2*RADIANS(RC[-12]))) -> -6.5278319274624028 | W8: =DEGREES(ACOS(COS(RADIANS(90.833))/(COS(RADIANS(R2C2))*COS(RADIANS(RC[-3])))-TAN(RADIANS(R2C2))*TAN(RADIANS(RC[-3])))) -> #NUM! | X8: =(720-4*R3C2-RC[-2]+R4C2*60)/1440 -> 1899-12-31T14:02:31.670 | Y8: =(RC[-1]*1440-RC[-2]*4)/1440 -> #NUM! | Z8: =(RC[-2]*1440+RC[-3]*4)/1440 -> #NUM! | AA8: =8*RC[-4] -> #NUM! | AB8: =MOD(RC[-23]*1440+RC[-6]+4*R3C2-60*R4C2,1440) -> 717.47216807253756 | AC8: =IF(RC[-1]/4<0,RC[-1]/4+180,RC[-1]/4-180) -> -0.63195798186561092 | AD8: =DEGREES(ACOS(SIN(RADIANS(R2C2))*SIN(RADIANS(RC[-10]))+COS(RADIANS(R2C2))*COS(RADIANS(RC[-10]))*COS(RADIANS(RC[-1])))) -> 92.257158892389285 | AE8: =90-RC[-1] -> -2.2571588923892847 | AF8: =IF(RC[-1]>85,0,IF(RC[-1]>5,58.1/TAN(RADIANS(RC[-1]))-0.07/POWER(TAN(RADIANS(RC[-1])),3)+0.000086/POWER(TAN(RADIANS(RC[-1])),5),IF(RC[-1]>-0.575,1735+RC[-1]*(-518.2+RC[-1]*(103.4+RC[-1]*(-12.79+RC[-1]*0.711))),-20.772/TAN(RADIANS(RC[-1])))))/3600 -> 0.14639005147114698 | AG8: =RC[-2]+RC[-1] -> -2.1107688409181375 | AH8: =IF(RC[-5]>0,MOD(DEGREES(ACOS(((SIN(RADIANS(R2C2))*COS(RADIANS(RC[-4])))-SIN(RADIANS(RC[-14])))/(COS(RADIANS(R2C2))*SIN(RADIANS(RC[-4])))))+180,360),MOD(540-DEGREES(ACOS(((SIN(RADIANS(R2C2))*COS(RADIANS(RC[-4])))-SIN(RADIANS(RC[-14])))/(COS(RADIANS(R2C2))*SIN(RADIANS(RC[-4]))))),360)) -> 179.41467012318185
D9: =R[-1]C+1 -> 2017-01-08T00:00:00.000 | E9: =R5C2 -> 1899-12-31T14:00:00.000 | F9: =RC[-2]+2415018.5+RC[-1]-R4C2/24 -> 2457762.375 | G9: =(RC[-1]-2451545)/36525 -> 0.17022245037645448 | I9: =MOD(280.46646+RC[-2]*(36000.76983 + RC[-2]*0.0003032),360) -> 288.60572468676037 | J9: =357.52911+RC[-3]*(35999.05029 - 0.0001537*RC[-3]) -> 6485.3756571354515 | K9: =0.016708634-RC[-4]*(0.000042037+0.0000001267*RC[-4]) -> 1.6701474687634537E-2 | L9: =SIN(RADIANS(RC[-2]))*(1.914602-RC[-5]*(0.004817+0.000014*RC[-5]))+SIN(RADIANS(2*RC[-2]))*(0.019993-0.000101*RC[-5])+SIN(RADIANS(3*RC[-2]))*0.000289 -> 0.18309995161893639 | M9: =RC[-4]+RC[-1] -> 288.78882463837931 | N9: =RC[-4]+RC[-2] -> 6485.5587570870703 | O9: =(1.000001018*(1-RC[-4]*RC[-4]))/(1+RC[-4]*COS(RADIANS(RC[-1]))) -> 0.98337549247451805 | P9: =RC[-3]-0.00569-0.00478*SIN(RADIANS(125.04-1934.136*RC[-9])) -> 288.78117571085653 | Q9: =23+(26+((21.448-RC[-10]*(46.815+RC[-10]*(0.00059-RC[-10]*0.001813))))/60)/60 -> 23.437077507731182 | R9: =RC[-1]+0.00256*COS(RADIANS(125.04-1934.136*RC[-11])) -> 23.434742358804243 | S9: =DEGREES(ATAN2(COS(RADIANS(RC[-3])),COS(RADIANS(RC[-1]))*SIN(RADIANS(RC[-3])))) -> -69.663612353870491 | T9: =DEGREES(ASIN(SIN(RADIANS(RC[-2]))*SIN(RADIANS(RC[-4])))) -> -22.118820204493243 | U9: =TAN(RADIANS(RC[-3]/2))*TAN(RADIANS(RC[-3]/2)) -> 4.3017352959823049E-2 | V9: =4*DEGREES(RC[-1]*SIN(2*RADIANS(RC[-13]))-2*RC[-11]*SIN(RADIANS(RC[-12]))+4*RC[-11]*RC[-1]*SIN(RADIANS(RC[-12]))*COS(2*RADIANS(RC[-13]))-0.5*RC[-1]*RC[-1]*SIN(4*RADIANS(RC[-13]))-1.25*RC[-11]*RC[-11]*SIN(2*RADIANS(RC[-12]))) -> -6.9477304004974103 | W9: =DEGREES(ACOS(COS(RADIANS(90.833))/(COS(RADIANS(R2C2))*COS(RADIANS(RC[-3])))-TAN(RADIANS(R2C2))*TAN(RADIANS(RC[-3])))) -> #NUM! | X9: =(720-4*R3C2-RC[-2]+R4C2*60)/1440 -> 1899-12-31T14:02:56.864 | Y9: =(RC[-1]*1440-RC[-2]*4)/1440 -> #NUM! | Z9: =(RC[-2]*1440+RC[-3]*4)/1440 -> #NUM! | AA9: =8*RC[-4] -> #NUM! | AB9: =MOD(RC[-23]*1440+RC[-6]+4*R3C2-60*R4C2,1440) -> 717.05226959950255 | AC9: =IF(RC[-1]/4<0,RC[-1]/4+180,RC[-1]/4-180) -> -0.73693260012436212 | AD9: =DEGREES(ACOS(SIN(RADIANS(R2C2))*SIN(RADIANS(RC[-10]))+COS(RADIANS(R2C2))*COS(RADIANS(RC[-10]))*COS(RADIANS(RC[-1])))) -> 92.120322816090422 | AE9: =90-RC[-1] -> -2.1203228160904217 | AF9: =IF(RC[-1]>85,0,IF(RC[-1]>5,58.1/TAN(RADIANS(RC[-1]))-0.07/POWER(TAN(RADIANS(RC[-1])),3)+0.000086/POWER(TAN(RADIANS(RC[-1])),5),IF(RC[-1]>-0.575,1735+RC[-1]*(-518.2+RC[-1]*(103.4+RC[-1]*(-12.79+RC[-1]*0.711))),-20.772/TAN(RADIANS(RC[-1])))))/3600 -> 0.15584689052501025 | AG9: =RC[-2]+RC[-1] -> -1.9644759255654114 | AH9: =IF(RC[-5]>0,MOD(DEGREES(ACOS(((SIN(RADIANS(R2C2))*COS(RADIANS(RC[-4])))-SIN(RADIANS(RC[-14])))/(COS(RADIANS(R2C2))*SIN(RADIANS(RC[-4])))))+180,360),MOD(540-DEGREES(ACOS(((SIN(RADIANS(R2C2))*COS(RADIANS(RC[-4])))-SIN(RADIANS(RC[-14])))/(COS(RADIANS(R2C2))*SIN(RADIANS(RC[-4]))))),360)) -> 179.31683686160602
D10: =R[-1]C+1 -> 2017-01-09T00:00:00.000 | E10: =R5C2 -> 1899-12-31T14:00:00.000 | F10: =RC[-2]+2415018.5+RC[-1]-R4C2/24 -> 2457763.375 | G10: =(RC[-1]-2451545)/36525 -> 0.1702498288843258 | I10: =MOD(280.46646+RC[-2]*(36000.76983 + RC[-2]*0.0003032),360) -> 289.59137204975104 | J10: =357.52911+RC[-3]*(35999.05029 - 0.0001537*RC[-3]) -> 6486.3612574157441 | K10: =0.016708634-RC[-4]*(0.000042037+0.0000001267*RC[-4]) -> 1.6701473535543153E-2 | L10: =SIN(RADIANS(RC[-2]))*(1.914602-RC[-5]*(0.004817+0.000014*RC[-5]))+SIN(RADIANS(2*RC[-2]))*(0.019993-0.000101*RC[-5])+SIN(RADIANS(3*RC[-2]))*0.000289 -> 0.21653487560222937 | M10: =RC[-4]+RC[-1] -> 289.80790692535328 | N10: =RC[-4]+RC[-2] -> 6486.5777922913467 | O10: =(1.000001018*(1-RC[-4]*RC[-4]))/(1+RC[-4]*COS(RADIANS(RC[-1]))) -> 0.98340586880295267 | P10: =RC[-3]-0.00569-0.00478*SIN(RADIANS(125.04-1934.136*RC[-9])) -> 289.80025396893109 | Q10: =23+(26+((21.448-RC[-10]*(46.815+RC[-10]*(0.00059-RC[-10]*0.001813))))/60)/60 -> 23.437077151696172 | R10: =RC[-1]+0.00256*COS(RADIANS(125.04-1934.136*RC[-11])) -> 23.434742973393163 | S10: =DEGREES(ATAN2(COS(RADIANS(RC[-3])),COS(RADIANS(RC[-1]))*SIN(RADIANS(RC[-3])))) -> -68.575238453193549 | T10: =DEGREES(ASIN(SIN(RADIANS(RC[-2]))*SIN(RADIANS(RC[-4])))) -> -21.974367107869426 | U10: =TAN(RADIANS(RC[-3]/2))*TAN(RADIANS(RC[-3]/2)) -> 4.3017355280290472E-2 | V10: =4*DEGREES(RC[-1]*SIN(2*RADIANS(RC[-13]))-2*RC[-11]*SIN(RADIANS(RC[-12]))+4*RC[-11]*RC[-1]*SIN(RADIANS(RC[-12]))*COS(2*RADIANS(RC[-13]))-0.5*RC[-1]*RC[-1]*SIN(4*RADIANS(RC[-13]))-1.25*RC[-11]*RC[-11]*SIN(2*RADIANS(RC[-12]))) -> -7.3588331945878824 | W10: =DEGREES(ACOS(COS(RADIANS(90.833))/(COS(RADIANS(R2C2))*COS(RADIANS(RC[-3])))-TAN(RADIANS(R2C2))*TAN(RADIANS(RC[-3])))) -> #NUM! | X10: =(720-4*R3C2-RC[-2]+R4C2*60)/1440 -> 1899-12-31T14:03:21.530 | Y10: =(RC[-1]*1440-RC[-2]*4)/1440 -> #NUM! | Z10: =(RC[-2]*1440+RC[-3]*4)/1440 -> #NUM! | AA10: =8*RC[-4] -> #NUM! | AB10: =MOD(RC[-23]*1440+RC[-6]+4*R3C2-60*R4C2,1440) -> 716.64116680541213 | AC10: =IF(RC[-1]/4<0,RC[-1]/4+180,RC[-1]/4-180) -> -0.83970829864696839 | AD10: =DEGREES(ACOS(SIN(RADIANS(R2C2))*SIN(RADIANS(RC[-10]))+COS(RADIANS(R2C2))*COS(RADIANS(RC[-10]))*COS(RADIANS(RC[-1])))) -> 91.976319875818049 | AE10: =90-RC[-1] -> -1.9763198758180494 | AF10: =IF(RC[-1]>85,0,IF(RC[-1]>5,58.1/TAN(RADIANS(RC[-1]))-0.07/POWER(TAN(RADIANS(RC[-1])),3)+0.000086/POWER(TAN(RADIANS(RC[-1])),5),IF(RC[-1]>-0.575,1735+RC[-1]*(-518.2+RC[-1]*(103.4+RC[-1]*(-12.79+RC[-1]*0.711))),-20.772/TAN(RADIANS(RC[-1])))))/3600 -> 0.16721256929982611 | AG10: =RC[-2]+RC[-1] -> -1.8091073065182233 | AH10: =IF(RC[-5]>0,MOD(DEGREES(ACOS(((SIN(RADIANS(R2C2))*COS(RADIANS(RC[-4])))-SIN(RADIANS(RC[-14])))/(COS(RADIANS(R2C2))*SIN(RADIANS(RC[-4])))))+180,360),MOD(540-DEGREES(ACOS(((SIN(RADIANS(R2C2))*COS(RADIANS(RC[-4])))-SIN(RADIANS(RC[-14])))/(COS(RADIANS(R2C2))*SIN(RADIANS(RC[-4]))))),360)) -> 179.22083577458488
D11: =R[-1]C+1 -> 2017-01-10T00:00:00.000 | E11: =R5C2 -> 1899-12-31T14:00:00.000 | F11: =RC[-2]+2415018.5+RC[-1]-R4C2/24 -> 2457764.375 | G11: =(RC[-1]-2451545)/36525 -> 0.17027720739219712 | I11: =MOD(280.46646+RC[-2]*(36000.76983 + RC[-2]*0.0003032),360) -> 290.57701941274263 | J11: =357.52911+RC[-3]*(35999.05029 - 0.0001537*RC[-3]) -> 6487.3468576960367 | K11: =0.016708634-RC[-4]*(0.000042037+0.0000001267*RC[-4]) -> 1.6701472383451578E-2 | L11: =SIN(RADIANS(RC[-2]))*(1.914602-RC[-5]*(0.004817+0.000014*RC[-5]))+SIN(RADIANS(2*RC[-2]))*(0.019993-0.000101*RC[-5])+SIN(RADIANS(3*RC[-2]))*0.000289 -> 0.24990159364357228 | M11: =RC[-4]+RC[-1] -> 290.82692100638621 | N11: =RC[-4]+RC[-2] -> 6487.5967592896804 | O11: =(1.000001018*(1-RC[-4]*RC[-4]))/(1+RC[-4]*COS(RADIANS(RC[-1]))) -> 0.98344132165206244 | P11: =RC[-3]-0.00569-0.00478*SIN(RADIANS(125.04-1934.136*RC[-9])) -> 290.81926402274127 | Q11: =23+(26+((21.448-RC[-10]*(46.815+RC[-10]*(0.00059-RC[-10]*0.001813))))/60)/60 -> 23.437076795661167 | R11: =RC[-1]+0.00256*COS(RADIANS(125.04-1934.136*RC[-11])) -> 23.434743589975888 | S11: =DEGREES(ATAN2(COS(RADIANS(RC[-3])),COS(RADIANS(RC[-1]))*SIN(RADIANS(RC[-3])))) -> -67.489203977630154 | T11: =DEGREES(ASIN(SIN(RADIANS(RC[-2]))*SIN(RADIANS(RC[-4])))) -> -21.82276518956143 | U11: =TAN(RADIANS(RC[-3]/2))*TAN(RADIANS(RC[-3]/2)) -> 4.3017357608285858E-2 | V11: =4*DEGREES(RC[-1]*SIN(2*RADIANS(RC[-13]))-2*RC[-11]*SIN(RADIANS(RC[-12]))+4*RC[-11]*RC[-1]*SIN(RADIANS(RC[-12]))*COS(2*RADIANS(RC[-13]))-0.5*RC[-1]*RC[-1]*SIN(4*RADIANS(RC[-13]))-1.25*RC[-11]*RC[-11]*SIN(2*RADIANS(RC[-12]))) -> -7.7607355140246961 | W11: =DEGREES(ACOS(COS(RADIANS(90.833))/(COS(RADIANS(R2C2))*COS(RADIANS(RC[-3])))-TAN(RADIANS(R2C2))*TAN(RADIANS(RC[-3])))) -> #NUM! | X11: =(720-4*R3C2-RC[-2]+R4C2*60)/1440 -> 1899-12-31T14:03:45.644 | Y11: =(RC[-1]*1440-RC[-2]*4)/1440 -> #NUM! | Z11: =(RC[-2]*1440+RC[-3]*4)/1440 -> #NUM! | AA11: =8*RC[-4] -> #NUM! | AB11: =MOD(RC[-23]*1440+RC[-6]+4*R3C2-60*R4C2,1440) -> 716.23926448597535 | AC11: =IF(RC[-1]/4<0,RC[-1]/4+180,RC[-1]/4-180) -> -0.94018387850616136 | AD11: =DEGREES(ACOS(SIN(RADIANS(R2C2))*SIN(RADIANS(RC[-10]))+COS(RADIANS(R2C2))*COS(RADIANS(RC[-10]))*COS(RADIANS(RC[-1])))) -> 91.825215613555486 | AE11: =90-RC[-1] -> -1.8252156135554856 | AF11: =IF(RC[-1]>85,0,IF(RC[-1]>5,58.1/TAN(RADIANS(RC[-1]))-0.07/POWER(TAN(RADIANS(RC[-1])),3)+0.000086/POWER(TAN(RADIANS(RC[-1])),5),IF(RC[-1]>-0.575,1735+RC[-1]*(-518.2+RC[-1]*(103.4+RC[-1]*(-12.79+RC[-1]*0.711))),-20.772/TAN(RADIANS(RC[-1])))))/3600 -> 0.18106617501353317 | AG11: =RC[-2]+RC[-1] -> -1.6441494385419524 | AH11: =IF(RC[-5]>0,MOD(DEGREES(ACOS(((SIN(RADIANS(R2C2))*COS(RADIANS(RC[-4])))-SIN(RADIANS(RC[-14])))/(COS(RADIANS(R2C2))*SIN(RADIANS(RC[-4])))))+180,360),MOD(540-DEGREES(ACOS(((SIN(RADIANS(R2C2))*COS(RADIANS(RC[-4])))-SIN(RADIANS(RC[-14])))/(COS(RADIANS(R2C2))*SIN(RADIANS(RC[-4]))))),360)) -> 179.12675372015929
D12: =R[-1]C+1 -> 2017-01-11T00:00:00.000 | E12: =R5C2 -> 1899-12-31T14:00:00.000 | F12: =RC[-2]+2415018.5+RC[-1]-R4C2/24 -> 2457765.375 | G12: =(RC[-1]-2451545)/36525 -> 0.17030458590006844 | I12: =MOD(280.46646+RC[-2]*(36000.76983 + RC[-2]*0.0003032),360) -> 291.56266677573421 | J12: =357.52911+RC[-3]*(35999.05029 - 0.0001537*RC[-3]) -> 6488.3324579763275 | K12: =0.016708634-RC[-4]*(0.000042037+0.0000001267*RC[-4]) -> 1.6701471231359812E-2 | L12: =SIN(RADIANS(RC[-2]))*(1.914602-RC[-5]*(0.004817+0.000014*RC[-5]))+SIN(RADIANS(2*RC[-2]))*(0.019993-0.000101*RC[-5])+SIN(RADIANS(3*RC[-2]))*0.000289 -> 0.28318960687767947 | M12: =RC[-4]+RC[-1] -> 291.84585638261188 | N12: =RC[-4]+RC[-2] -> 6488.6156475832049 | O12: =(1.000001018*(1-RC[-4]*RC[-4]))/(1+RC[-4]*COS(RADIANS(RC[-1]))) -> 0.98348183944304302 | P12: =RC[-3]-0.00569-0.00478*SIN(RADIANS(125.04-1934.136*RC[-9])) -> 291.83819537342436 | Q12: =23+(26+((21.448-RC[-10]*(46.815+RC[-10]*(0.00059-RC[-10]*0.001813))))/60)/60 -> 23.437076439626157 | R12: =RC[-1]+0.00256*COS(RADIANS(125.04-1934.136*RC[-11])) -> 23.434744208551582 | S12: =DEGREES(ATAN2(COS(RADIANS(RC[-3])),COS(RADIANS(RC[-1]))*SIN(RADIANS(RC[-3])))) -> -66.405605588169919 | T12: =DEGREES(ASIN(SIN(RADIANS(RC[-2]))*SIN(RADIANS(RC[-4])))) -> -21.664087163851068 | U12: =TAN(RADIANS(RC[-3]/2))*TAN(RADIANS(RC[-3]/2)) -> 4.3017359943806045E-2 | V12: =4*DEGREES(RC[-1]*SIN(2*RADIANS(RC[-13]))-2*RC[-11]*SIN(RADIANS(RC[-12]))+4*RC[-11]*RC[-1]*SIN(RADIANS(RC[-12]))*COS(2*RADIANS(RC[-13]))-0.5*RC[-1]*RC[-1]*SIN(4*RADIANS(RC[-13]))-1.25*RC[-11]*RC[-11]*SIN(2*RADIANS(RC[-12]))) -> -8.1530476921348161 | W12: =DEGREES(ACOS(COS(RADIANS(90.833))/(COS(RADIANS(R2C2))*COS(RADIANS(RC[-3])))-TAN(RADIANS(R2C2))*TAN(RADIANS(RC[-3])))) -> #NUM! | X12: =(720-4*R3C2-RC[-2]+R4C2*60)/1440 -> 1899-12-31T14:04:09.183 | Y12: =(RC[-1]*1440-RC[-2]*4)/1440 -> #NUM! | Z12: =(RC[-2]*1440+RC[-3]*4)/1440 -> #NUM! | AA12: =8*RC[-4] -> #NUM! | AB12: =MOD(RC[-23]*1440+RC[-6]+4*R3C2-60*R4C2,1440) -> 715.84695230786519 | AC12: =IF(RC[-1]/4<0,RC[-1]/4+180,RC[-1]/4-180) -> -1.0382619230337014 | AD12: =DEGREES(ACOS(SIN(RADIANS(R2C2))*SIN(RADIANS(RC[-10]))+COS(RADIANS(R2C2))*COS(RADIANS(RC[-10]))*COS(RADIANS(RC[-1])))) -> 91.66707853615344 | AE12: =90-RC[-1] -> -1.6670785361534399 | AF12: =IF(RC[-1]>85,0,IF(RC[-1]>5,58.1/TAN(RADIANS(RC[-1]))-0.07/POWER(TAN(RADIANS(RC[-1])),3)+0.000086/POWER(TAN(RADIANS(RC[-1])),5),IF(RC[-1]>-0.575,1735+RC[-1]*(-518.2+RC[-1]*(103.4+RC[-1]*(-12.79+RC[-1]*0.711))),-20.772/TAN(RADIANS(RC[-1])))))/3600 -> 0.19825301773978307 | AG12: =RC[-2]+RC[-1] -> -1.4688255184136569 | AH12: =IF(RC[-5]>0,MOD(DEGREES(ACOS(((SIN(RADIANS(R2C2))*COS(RADIANS(RC[-4])))-SIN(RADIANS(RC[-14])))/(COS(RADIANS(R2C2))*SIN(RADIANS(RC[-4])))))+180,360),MOD(540-DEGREES(ACOS(((SIN(RADIANS(R2C2))*COS(RADIANS(RC[-4])))-SIN(RADIANS(RC[-14])))/(COS(RADIANS(R2C2))*SIN(RADIANS(RC[-4]))))),360)) -> 179.03467517204672
D13: =R[-1]C+1 -> 2017-01-12T00:00:00.000 | E13: =R5C2 -> 1899-12-31T14:00:00.000 | F13: =RC[-2]+2415018.5+RC[-1]-R4C2/24 -> 2457766.375 | G13: =(RC[-1]-2451545)/36525 -> 0.17033196440793977 | I13: =MOD(280.46646+RC[-2]*(36000.76983 + RC[-2]*0.0003032),360) -> 292.5483141387258 | J13: =357.52911+RC[-3]*(35999.05029 - 0.0001537*RC[-3]) -> 6489.3180582566192 | K13: =0.016708634-RC[-4]*(0.000042037+0.0000001267*RC[-4]) -> 1.6701470079267859E-2 | L13: =SIN(RADIANS(RC[-2]))*(1.914602-RC[-5]*(0.004817+0.000014*RC[-5]))+SIN(RADIANS(2*RC[-2]))*(0.019993-0.000101*RC[-5])+SIN(RADIANS(3*RC[-2]))*0.000289 -> 0.31638844573621383 | M13: =RC[-4]+RC[-1] -> 292.86470258446201 | N13: =RC[-4]+RC[-2] -> 6489.6344467023555 | O13: =(1.000001018*(1-RC[-4]*RC[-4]))/(1+RC[-4]*COS(RADIANS(RC[-1]))) -> 0.98352740894601054 | P13: =RC[-3]-0.00569-0.00478*SIN(RADIANS(125.04-1934.136*RC[-9])) -> 292.85703755141549 | Q13: =23+(26+((21.448-RC[-10]*(46.815+RC[-10]*(0.00059-RC[-10]*0.001813))))/60)/60 -> 23.437076083591148 | R13: =RC[-1]+0.00256*COS(RADIANS(125.04-1934.136*RC[-11])) -> 23.434744829119417 | S13: =DEGREES(ATAN2(COS(RADIANS(RC[-3])),COS(RADIANS(RC[-1]))*SIN(RADIANS(RC[-3])))) -> -65.324535646304 | T13: =DEGREES(ASIN(SIN(RADIANS(RC[-2]))*SIN(RADIANS(RC[-4])))) -> -21.49840872648188 | U13: =TAN(RADIANS(RC[-3]/2))*TAN(RADIANS(RC[-3]/2)) -> 4.3017362286847903E-2 | V13: =4*DEGREES(RC[-1]*SIN(2*RADIANS(RC[-13]))-2*RC[-11]*SIN(RADIANS(RC[-12]))+4*RC[-11]*RC[-1]*SIN(RADIANS(RC[-12]))*COS(2*RADIANS(RC[-13]))-0.5*RC[-1]*RC[-1]*SIN(4*RADIANS(RC[-13]))-1.25*RC[-11]*RC[-11]*SIN(2*RADIANS(RC[-12]))) -> -8.5353957061717036 | W13: =DEGREES(ACOS(COS(RADIANS(90.833))/(COS(RADIANS(R2C2))*COS(RADIANS(RC[-3])))-TAN(RADIANS(R2C2))*TAN(RADIANS(RC[-3])))) -> #NUM! | X13: =(720-4*R3C2-RC[-2]+R4C2*60)/1440 -> 1899-12-31T14:04:32.124 | Y13: =(RC[-1]*1440-RC[-2]*4)/1440 -> #NUM! | Z13: =(RC[-2]*1440+RC[-3]*4)/1440 -> #NUM! | AA13: =8*RC[-4] -> #NUM! | AB13: =MOD(RC[-23]*1440+RC[-6]+4*R3C2-60*R4C2,1440) -> 715.4646042938283 | AC13: =IF(RC[-1]/4<0,RC[-1]/4+180,RC[-1]/4-180) -> -1.1338489265429246 | AD13: =DEGREES(ACOS(SIN(RADIANS(R2C2))*SIN(RADIANS(RC[-10]))+COS(RADIANS(R2C2))*COS(RADIANS(RC[-10]))*COS(RADIANS(RC[-1])))) -> 91.50198003038895 | AE13: =90-RC[-1] -> -1.5019800303889497 | AF13: =IF(RC[-1]>85,0,IF(RC[-1]>5,58.1/TAN(RADIANS(RC[-1]))-0.07/POWER(TAN(RADIANS(RC[-1])),3)+0.000086/POWER(TAN(RADIANS(RC[-1])),5),IF(RC[-1]>-0.575,1735+RC[-1]*(-518.2+RC[-1]*(103.4+RC[-1]*(-12.79+RC[-1]*0.711))),-20.772/TAN(RADIANS(RC[-1])))))/3600 -> 0.22005679767949607 | AG13: =RC[-2]+RC[-1] -> -1.2819232327094536 | AH13: =IF(RC[-5]>0,MOD(DEGREES(ACOS(((SIN(RADIANS(R2C2))*COS(RADIANS(RC[-4])))-SIN(RADIANS(RC[-14])))/(COS(RADIANS(R2C2))*SIN(RADIANS(RC[-4])))))+180,360),MOD(540-DEGREES(ACOS(((SIN(RADIANS(R2C2))*COS(RADIANS(RC[-4])))-SIN(RADIANS(RC[-14])))/(COS(RADIANS(R2C2))*SIN(RADIANS(RC[-4]))))),360)) -> 178.94468212019319
D14: =R[-1]C+1 -> 2017-01-13T00:00:00.000 | E14: =R5C2 -> 1899-12-31T14:00:00.000 | F14: =RC[-2]+2415018.5+RC[-1]-R4C2/24 -> 2457767.375 | G14: =(RC[-1]-2451545)/36525 -> 0.17035934291581109 | I14: =MOD(280.46646+RC[-2]*(36000.76983 + RC[-2]*0.0003032),360) -> 293.5339615017183 | J14: =357.52911+RC[-3]*(35999.05029 - 0.0001537*RC[-3]) -> 6490.3036585369109 | K14: =0.016708634-RC[-4]*(0.000042037+0.0000001267*RC[-4]) -> 1.6701468927175712E-2 | L14: =SIN(RADIANS(RC[-2]))*(1.914602-RC[-5]*(0.004817+0.000014*RC[-5]))+SIN(RADIANS(2*RC[-2]))*(0.019993-0.000101*RC[-5])+SIN(RADIANS(3*RC[-2]))*0.000289 -> 0.34948767382650942 | M14: =RC[-4]+RC[-1] -> 293.8834491755448 | N14: =RC[-4]+RC[-2] -> 6490.6531462107378 | O14: =(1.000001018*(1-RC[-4]*RC[-4]))/(1+RC[-4]*COS(RADIANS(RC[-1]))) -> 0.98357801528552236 | P14: =RC[-3]-0.00569-0.00478*SIN(RADIANS(125.04-1934.136*RC[-9])) -> 293.87578012032634 | Q14: =23+(26+((21.448-RC[-10]*(46.815+RC[-10]*(0.00059-RC[-10]*0.001813))))/60)/60 -> 23.437075727556142 | R14: =RC[-1]+0.00256*COS(RADIANS(125.04-1934.136*RC[-11])) -> 23.434745451678562 | S14: =DEGREES(ATAN2(COS(RADIANS(RC[-3])),COS(RADIANS(RC[-1]))*SIN(RADIANS(RC[-3])))) -> -64.246082110282813 | T14: =DEGREES(ASIN(SIN(RADIANS(RC[-2]))*SIN(RADIANS(RC[-4])))) -> -21.325808446090392 | U14: =TAN(RADIANS(RC[-3]/2))*TAN(RADIANS(RC[-3]/2)) -> 4.3017364637408316E-2 | V14: =4*DEGREES(RC[-1]*SIN(2*RADIANS(RC[-13]))-2*RC[-11]*SIN(RADIANS(RC[-12]))+4*RC[-11]*RC[-1]*SIN(RADIANS(RC[-12]))*COS(2*RADIANS(RC[-13]))-0.5*RC[-1]*RC[-1]*SIN(4*RADIANS(RC[-13]))-1.25*RC[-11]*RC[-11]*SIN(2*RADIANS(RC[-12]))) -> -8.9074216544501255 | W14: =DEGREES(ACOS(COS(RADIANS(90.833))/(COS(RADIANS(R2C2))*COS(RADIANS(RC[-3])))-TAN(RADIANS(R2C2))*TAN(RADIANS(RC[-3])))) -> #NUM! | X14: =(720-4*R3C2-RC[-2]+R4C2*60)/1440 -> 1899-12-31T14:04:54.445 | Y14: =(RC[-1]*1440-RC[-2]*4)/1440 -> #NUM! | Z14: =(RC[-2]*1440+RC[-3]*4)/1440 -> #NUM! | AA14: =8*RC[-4] -> #NUM! | AB14: =MOD(RC[-23]*1440+RC[-6]+4*R3C2-60*R4C2,1440) -> 715.0925783455499 | AC14: =IF(RC[-1]/4<0,RC[-1]/4+180,RC[-1]/4-180) -> -1.226855413612526 | AD14: =DEGREES(ACOS(SIN(RADIANS(R2C2))*SIN(RADIANS(RC[-10]))+COS(RADIANS(R2C2))*COS(RADIANS(RC[-10]))*COS(RADIANS(RC[-1])))) -> 91.329994275870462 | AE14: =90-RC[-1] -> -1.3299942758704617 | AF14: =IF(RC[-1]>85,0,IF(RC[-1]>5,58.1/TAN(RADIANS(RC[-1]))-0.07/POWER(TAN(RADIANS(RC[-1])),3)+0.000086/POWER(TAN(RADIANS(RC[-1])),5),IF(RC[-1]>-0.575,1735+RC[-1]*(-518.2+RC[-1]*(103.4+RC[-1]*(-12.79+RC[-1]*0.711))),-20.772/TAN(RADIANS(RC[-1])))))/3600 -> 0.24852533040698127 | AG14: =RC[-2]+RC[-1] -> -1.0814689454634805 | AH14: =IF(RC[-5]>0,MOD(DEGREES(ACOS(((SIN(RADIANS(R2C2))*COS(RADIANS(RC[-4])))-SIN(RADIANS(RC[-14])))/(COS(RADIANS(R2C2))*SIN(RADIANS(RC[-4])))))+180,360),MOD(540-DEGREES(ACOS(((SIN(RADIANS(R2C2))*COS(RADIANS(RC[-4])))-SIN(RADIANS(RC[-14])))/(COS(RADIANS(R2C2))*SIN(RADIANS(RC[-4]))))),360)) -> 178.85685397494126
D15: =R[-1]C+1 -> 2017-01-14T00:00:00.000 | E15: =R5C2 -> 1899-12-31T14:00:00.000 | F15: =RC[-2]+2415018.5+RC[-1]-R4C2/24 -> 2457768.375 | G15: =(RC[-1]-2451545)/36525 -> 0.17038672142368241 | I15: =MOD(280.46646+RC[-2]*(36000.76983 + RC[-2]*0.0003032),360) -> 294.5196088647117 | J15: =357.52911+RC[-3]*(35999.05029 - 0.0001537*RC[-3]) -> 6491.2892588172008 | K15: =0.016708634-RC[-4]*(0.000042037+0.0000001267*RC[-4]) -> 1.6701467775083377E-2 | L15: =SIN(RADIANS(RC[-2]))*(1.914602-RC[-5]*(0.004817+0.000014*RC[-5]))+SIN(RADIANS(2*RC[-2]))*(0.019993-0.000101*RC[-5])+SIN(RADIANS(3*RC[-2]))*0.000289 -> 0.38247689179191091 | M15: =RC[-4]+RC[-1] -> 294.9020857565036 | N15: =RC[-4]+RC[-2] -> 6491.6717357089929 | O15: =(1.000001018*(1-RC[-4]*RC[-4]))/(1+RC[-4]*COS(RADIANS(RC[-1]))) -> 0.98363364194678249 | P15: =RC[-3]-0.00569-0.00478*SIN(RADIANS(125.04-1934.136*RC[-9])) -> 294.89441268080361 | Q15: =23+(26+((21.448-RC[-10]*(46.815+RC[-10]*(0.00059-RC[-10]*0.001813))))/60)/60 -> 23.437075371521132 | R15: =RC[-1]+0.00256*COS(RADIANS(125.04-1934.136*RC[-11])) -> 23.434746076228173 | S15: =DEGREES(ATAN2(COS(RADIANS(RC[-3])),COS(RADIANS(RC[-1]))*SIN(RADIANS(RC[-3])))) -> -63.170328444458107 | T15: =DEGREES(ASIN(SIN(RADIANS(RC[-2]))*SIN(RADIANS(RC[-4])))) -> -21.146367653669518 | U15: =TAN(RADIANS(RC[-3]/2))*TAN(RADIANS(RC[-3]/2)) -> 4.3017366995484085E-2 | V15: =4*DEGREES(RC[-1]*SIN(2*RADIANS(RC[-13]))-2*RC[-11]*SIN(RADIANS(RC[-12]))+4*RC[-11]*RC[-1]*SIN(RADIANS(RC[-12]))*COS(2*RADIANS(RC[-13]))-0.5*RC[-1]*RC[-1]*SIN(4*RADIANS(RC[-13]))-1.25*RC[-11]*RC[-11]*SIN(2*RADIANS(RC[-12]))) -> -9.2687841949468748 | W15: =DEGREES(ACOS(COS(RADIANS(90.833))/(COS(RADIANS(R2C2))*COS(RADIANS(RC[-3])))-TAN(RADIANS(R2C2))*TAN(RADIANS(RC[-3])))) -> #NUM! | X15: =(720-4*R3C2-RC[-2]+R4C2*60)/1440 -> 1899-12-31T14:05:16.127 | Y15: =(RC[-1]*1440-RC[-2]*4)/1440 -> #NUM! | Z15: =(RC[-2]*1440+RC[-3]*4)/1440 -> #NUM! | AA15: =8*RC[-4] -> #NUM! | AB15: =MOD(RC[-23]*1440+RC[-6]+4*R3C2-60*R4C2,1440) -> 714.73121580505313 | AC15: =IF(RC[-1]/4<0,RC[-1]/4+180,RC[-1]/4-180) -> -1.3171960487367187 | AD15: =DEGREES(ACOS(SIN(RADIANS(R2C2))*SIN(RADIANS(RC[-10]))+COS(RADIANS(R2C2))*COS(RADIANS(RC[-10]))*COS(RADIANS(RC[-1])))) -> 91.151198156059081 | AE15: =90-RC[-1] -> -1.1511981560590812 | AF15: =IF(RC[-1]>85,0,IF(RC[-1]>5,58.1/TAN(RADIANS(RC[-1]))-0.07/POWER(TAN(RADIANS(RC[-1])),3)+0.000086/POWER(TAN(RADIANS(RC[-1])),5),IF(RC[-1]>-0.575,1735+RC[-1]*(-518.2+RC[-1]*(103.4+RC[-1]*(-12.79+RC[-1]*0.711))),-20.772/TAN(RADIANS(RC[-1])))))/3600 -> 0.28713749927255322 | AG15: =RC[-2]+RC[-1] -> -0.86406065678652788 | AH15: =IF(RC[-5]>0,MOD(DEGREES(ACOS(((SIN(RADIANS(R2C2))*COS(RADIANS(RC[-4])))-SIN(RADIANS(RC[-14])))/(COS(RADIANS(R2C2))*SIN(RADIANS(RC[-4])))))+180,360),MOD(540-DEGREES(ACOS(((SIN(RADIANS(R2C2))*COS(RADIANS(RC[-4])))-SIN(RADIANS(RC[-14])))/(COS(RADIANS(R2C2))*SIN(RADIANS(RC[-4]))))),360)) -> 178.77126747502609
D16: =R[-1]C+1 -> 2017-01-15T00:00:00.000 | E16: =R5C2 -> 1899-12-31T14:00:00.000 | F16: =RC[-2]+2415018.5+RC[-1]-R4C2/24 -> 2457769.375 | G16: =(RC[-1]-2451545)/36525 -> 0.17041409993155374 | I16: =MOD(280.46646+RC[-2]*(36000.76983 + RC[-2]*0.0003032),360) -> 295.5052562277051 | J16: =357.52911+RC[-3]*(35999.05029 - 0.0001537*RC[-3]) -> 6492.2748590974925 | K16: =0.016708634-RC[-4]*(0.000042037+0.0000001267*RC[-4]) -> 1.6701466622990855E-2 | L16: =SIN(RADIANS(RC[-2]))*(1.914602-RC[-5]*(0.004817+0.000014*RC[-5]))+SIN(RADIANS(2*RC[-2]))*(0.019993-0.000101*RC[-5])+SIN(RADIANS(3*RC[-2]))*0.000289 -> 0.41534574115102346 | M16: =RC[-4]+RC[-1] -> 295.92060196885615 | N16: =RC[-4]+RC[-2] -> 6492.6902048386437 | O16: =(1.000001018*(1-RC[-4]*RC[-4]))/(1+RC[-4]*COS(RADIANS(RC[-1]))) -> 0.98369427078252258 | P16: =RC[-3]-0.00569-0.00478*SIN(RADIANS(125.04-1934.136*RC[-9])) -> 295.91292487436857 | Q16: =23+(26+((21.448-RC[-10]*(46.815+RC[-10]*(0.00059-RC[-10]*0.001813))))/60)/60 -> 23.437075015486126 | R16: =RC[-1]+0.00256*COS(RADIANS(125.04-1934.136*RC[-11])) -> 23.434746702767416 | S16: =DEGREES(ATAN2(COS(RADIANS(RC[-3])),COS(RADIANS(RC[-1]))*SIN(RADIANS(RC[-3])))) -> -62.097353541615917 | T16: =DEGREES(ASIN(SIN(RADIANS(RC[-2]))*SIN(RADIANS(RC[-4])))) -> -20.960170330445653 | U16: =TAN(RADIANS(RC[-3]/2))*TAN(RADIANS(RC[-3]/2)) -> 4.3017369361072075E-2 | V16: =4*DEGREES(RC[-1]*SIN(2*RADIANS(RC[-13]))-2*RC[-11]*SIN(RADIANS(RC[-12]))+4*RC[-11]*RC[-1]*SIN(RADIANS(RC[-12]))*COS(2*RADIANS(RC[-13]))-0.5*RC[-1]*RC[-1]*SIN(4*RADIANS(RC[-13]))-1.25*RC[-11]*RC[-11]*SIN(2*RADIANS(RC[-12]))) -> -9.6191589447131509 | W16: =DEGREES(ACOS(COS(RADIANS(90.833))/(COS(RADIANS(R2C2))*COS(RADIANS(RC[-3])))-TAN(RADIANS(R2C2))*TAN(RADIANS(RC[-3])))) -> #NUM! | X16: =(720-4*R3C2-RC[-2]+R4C2*60)/1440 -> 1899-12-31T14:05:37.150 | Y16: =(RC[-1]*1440-RC[-2]*4)/1440 -> #NUM! | Z16: =(RC[-2]*1440+RC[-3]*4)/1440 -> #NUM! | AA16: =8*RC[-4] -> #NUM! | AB16: =MOD(RC[-23]*1440+RC[-6]+4*R3C2-60*R4C2,1440) -> 714.38084105528685 | AC16: =IF(RC[-1]/4<0,RC[-1]/4+180,RC[-1]/4-180) -> -1.4047897361782873 | AD16: =DEGREES(ACOS(SIN(RADIANS(R2C2))*SIN(RADIANS(RC[-10]))+COS(RADIANS(R2C2))*COS(RADIANS(RC[-10]))*COS(RADIANS(RC[-1])))) -> 90.965671167672696 | AE16: =90-RC[-1] -> -0.96567116767269567 | AF16: =IF(RC[-1]>85,0,IF(RC[-1]>5,58.1/TAN(RADIANS(RC[-1]))-0.07/POWER(TAN(RADIANS(RC[-1])),3)+0.000086/POWER(TAN(RADIANS(RC[-1])),5),IF(RC[-1]>-0.575,1735+RC[-1]*(-518.2+RC[-1]*(103.4+RC[-1]*(-12.79+RC[-1]*0.711))),-20.772/TAN(RADIANS(RC[-1])))))/3600 -> 0.34231667563441703 | AG16: =RC[-2]+RC[-1] -> -0.62335449203827864 | AH16: =IF(RC[-5]>0,MOD(DEGREES(ACOS(((SIN(RADIANS(R2C2))*COS(RADIANS(RC[-4])))-SIN(RADIANS(RC[-14])))/(COS(RADIANS(R2C2))*SIN(RADIANS(RC[-4])))))+180,360),MOD(540-DEGREES(ACOS(((SIN(RADIANS(R2C2))*COS(RADIANS(RC[-4])))-SIN(RADIANS(RC[-14])))/(COS(RADIANS(R2C2))*SIN(RADIANS(RC[-4]))))),360)) -> 178.68799659956846
D17: =R[-1]C+1 -> 2017-01-16T00:00:00.000 | E17: =R5C2 -> 1899-12-31T14:00:00.000 | F17: =RC[-2]+2415018.5+RC[-1]-R4C2/24 -> 2457770.375 | G17: =(RC[-1]-2451545)/36525 -> 0.17044147843942506 | I17: =MOD(280.46646+RC[-2]*(36000.76983 + RC[-2]*0.0003032),360) -> 296.4909035906976 | J17: =357.52911+RC[-3]*(35999.05029 - 0.0001537*RC[-3]) -> 6493.2604593777833 | K17: =0.016708634-RC[-4]*(0.000042037+0.0000001267*RC[-4]) -> 1.6701465470898139E-2 | L17: =SIN(RADIANS(RC[-2]))*(1.914602-RC[-5]*(0.004817+0.000014*RC[-5]))+SIN(RADIANS(2*RC[-2]))*(0.019993-0.000101*RC[-5])+SIN(RADIANS(3*RC[-2]))*0.000289 -> 0.44808390811297916 | M17: =RC[-4]+RC[-1] -> 296.9389874988106 | N17: =RC[-4]+RC[-2] -> 6493.7085432858967 | O17: =(1.000001018*(1-RC[-4]*RC[-4]))/(1+RC[-4]*COS(RADIANS(RC[-1]))) -> 0.98375988202055475 | P17: =RC[-3]-0.00569-0.00478*SIN(RADIANS(125.04-1934.136*RC[-9])) -> 296.93130638723278 | Q17: =23+(26+((21.448-RC[-10]*(46.815+RC[-10]*(0.00059-RC[-10]*0.001813))))/60)/60 -> 23.43707465945112 | R17: =RC[-1]+0.00256*COS(RADIANS(125.04-1934.136*RC[-11])) -> 23.434747331295455 | S17: =DEGREES(ATAN2(COS(RADIANS(RC[-3])),COS(RADIANS(RC[-1]))*SIN(RADIANS(RC[-3])))) -> -61.02723165815128 | T17: =DEGREES(ASIN(SIN(RADIANS(RC[-2]))*SIN(RADIANS(RC[-4])))) -> -20.767302994546114 | U17: =TAN(RADIANS(RC[-3]/2))*TAN(RADIANS(RC[-3]/2)) -> 4.3017371734169099E-2 | V17: =4*DEGREES(RC[-1]*SIN(2*RADIANS(RC[-13]))-2*RC[-11]*SIN(RADIANS(RC[-12]))+4*RC[-11]*RC[-1]*SIN(RADIANS(RC[-12]))*COS(2*RADIANS(RC[-13]))-0.5*RC[-1]*RC[-1]*SIN(4*RADIANS(RC[-13]))-1.25*RC[-11]*RC[-11]*SIN(2*RADIANS(RC[-12]))) -> -9.9582388395760812 | W17: =DEGREES(ACOS(COS(RADIANS(90.833))/(COS(RADIANS(R2C2))*COS(RADIANS(RC[-3])))-TAN(RADIANS(R2C2))*TAN(RADIANS(RC[-3])))) -> 4.8531035541965863 | X17: =(720-4*R3C2-RC[-2]+R4C2*60)/1440 -> 1899-12-31T14:05:57.494 | Y17: =(RC[-1]*1440-RC[-2]*4)/1440 -> 1899-12-31T13:46:32.749 | Z17: =(RC[-2]*1440+RC[-3]*4)/1440 -> 1899-12-31T14:25:22.239 | AA17: =8*RC[-4] -> 38.824828433572691 | AB17: =MOD(RC[-23]*1440+RC[-6]+4*R3C2-60*R4C2,1440) -> 714.0417611604239 | AC17: =IF(RC[-1]/4<0,RC[-1]/4+180,RC[-1]/4-180) -> -1.4895597098940243 | AD17: =DEGREES(ACOS(SIN(RADIANS(R2C2))*SIN(RADIANS(RC[-10]))+COS(RADIANS(R2C2))*COS(RADIANS(RC[-10]))*COS(RADIANS(RC[-1])))) -> 90.77349532873572 | AE17: =90-RC[-1] -> -0.77349532873572002 | AF17: =IF(RC[-1]>85,0,IF(RC[-1]>5,58.1/TAN(RADIANS(RC[-1]))-0.07/POWER(TAN(RADIANS(RC[-1])),3)+0.000086/POWER(TAN(RADIANS(RC[-1])),5),IF(RC[-1]>-0.575,1735+RC[-1]*(-518.2+RC[-1]*(103.4+RC[-1]*(-12.79+RC[-1]*0.711))),-20.772/TAN(RADIANS(RC[-1])))))/3600 -> 0.42738016817854657 | AG17: =RC[-2]+RC[-1] -> -0.34611516055717345 | AH17: =IF(RC[-5]>0,MOD(DEGREES(ACOS(((SIN(RADIANS(R2C2))*COS(RADIANS(RC[-4])))-SIN(RADIANS(RC[-14])))/(COS(RADIANS(R2C2))*SIN(RADIANS(RC[-4])))))+180,360),MOD(540-DEGREES(ACOS(((SIN(RADIANS(R2C2))*COS(RADIANS(RC[-4])))-SIN(RADIANS(RC[-14])))/(COS(RADIANS(R2C2))*SIN(RADIANS(RC[-4]))))),360)) -> 178.60711248433472
D18: =R[-1]C+1 -> 2017-01-17T00:00:00.000 | E18: =R5C2 -> 1899-12-31T14:00:00.000 | F18: =RC[-2]+2415018.5+RC[-1]-R4C2/24 -> 2457771.375 | G18: =(RC[-1]-2451545)/36525 -> 0.17046885694729638 | I18: =MOD(280.46646+RC[-2]*(36000.76983 + RC[-2]*0.0003032),360) -> 297.47655095369282 | J18: =357.52911+RC[-3]*(35999.05029 - 0.0001537*RC[-3]) -> 6494.2460596580731 | K18: =0.016708634-RC[-4]*(0.000042037+0.0000001267*RC[-4]) -> 1.6701464318805235E-2 | L18: =SIN(RADIANS(RC[-2]))*(1.914602-RC[-5]*(0.004817+0.000014*RC[-5]))+SIN(RADIANS(2*RC[-2]))*(0.019993-0.000101*RC[-5])+SIN(RADIANS(3*RC[-2]))*0.000289 -> 0.48068112736784274 | M18: =RC[-4]+RC[-1] -> 297.95723208106068 | N18: =RC[-4]+RC[-2] -> 6494.7267407854406 | O18: =(1.000001018*(1-RC[-4]*RC[-4]))/(1+RC[-4]*COS(RADIANS(RC[-1]))) -> 0.98383045427199289 | P18: =RC[-3]-0.00569-0.00478*SIN(RADIANS(125.04-1934.136*RC[-9])) -> 297.94954695409336 | Q18: =23+(26+((21.448-RC[-10]*(46.815+RC[-10]*(0.00059-RC[-10]*0.001813))))/60)/60 -> 23.437074303416111 | R18: =RC[-1]+0.00256*COS(RADIANS(125.04-1934.136*RC[-11])) -> 23.434747961811443 | S18: =DEGREES(ATAN2(COS(RADIANS(RC[-3])),COS(RADIANS(RC[-1]))*SIN(RADIANS(RC[-3])))) -> -59.960032361868279 | T18: =DEGREES(ASIN(SIN(RADIANS(RC[-2]))*SIN(RADIANS(RC[-4])))) -> -20.567854586823763 | U18: =TAN(RADIANS(RC[-3]/2))*TAN(RADIANS(RC[-3]/2)) -> 4.3017374114771995E-2 | V18: =4*DEGREES(RC[-1]*SIN(2*RADIANS(RC[-13]))-2*RC[-11]*SIN(RADIANS(RC[-12]))+4*RC[-11]*RC[-1]*SIN(RADIANS(RC[-12]))*COS(2*RADIANS(RC[-13]))-0.5*RC[-1]*RC[-1]*SIN(4*RADIANS(RC[-13]))-1.25*RC[-11]*RC[-11]*SIN(2*RADIANS(RC[-12]))) -> -10.28573445375025 | W18: =DEGREES(ACOS(COS(RADIANS(90.833))/(COS(RADIANS(R2C2))*COS(RADIANS(RC[-3])))-TAN(RADIANS(R2C2))*TAN(RADIANS(RC[-3])))) -> 9.7522088324655787 | X18: =(720-4*R3C2-RC[-2]+R4C2*60)/1440 -> 1899-12-31T14:06:17.144 | Y18: =(RC[-1]*1440-RC[-2]*4)/1440 -> 1899-12-31T13:27:16.614 | Z18: =(RC[-2]*1440+RC[-3]*4)/1440 -> 1899-12-31T14:45:17.674 | AA18: =8*RC[-4] -> 78.017670659724629 | AB18: =MOD(RC[-23]*1440+RC[-6]+4*R3C2-60*R4C2,1440) -> 713.71426554624975 | AC18: =IF(RC[-1]/4<0,RC[-1]/4+180,RC[-1]/4-180) -> -1.5714336134375628 | AD18: =DEGREES(ACOS(SIN(RADIANS(R2C2))*SIN(RADIANS(RC[-10]))+COS(RADIANS(R2C2))*COS(RADIANS(RC[-10]))*COS(RADIANS(RC[-1])))) -> 90.574755085530583 | AE18: =90-RC[-1] -> -0.57475508553058319 | AF18: =IF(RC[-1]>85,0,IF(RC[-1]>5,58.1/TAN(RADIANS(RC[-1]))-0.07/POWER(TAN(RADIANS(RC[-1])),3)+0.000086/POWER(TAN(RADIANS(RC[-1])),5),IF(RC[-1]>-0.575,1735+RC[-1]*(-518.2+RC[-1]*(103.4+RC[-1]*(-12.79+RC[-1]*0.711))),-20.772/TAN(RADIANS(RC[-1])))))/3600 -> 0.57486154891691243 | AG18: =RC[-2]+RC[-1] -> 1.0646338632924746E-4 | AH18: =IF(RC[-5]>0,MOD(DEGREES(ACOS(((SIN(RADIANS(R2C2))*COS(RADIANS(RC[-4])))-SIN(RADIANS(RC[-14])))/(COS(RADIANS(R2C2))*SIN(RADIANS(RC[-4])))))+180,360),MOD(540-DEGREES(ACOS(((SIN(RADIANS(R2C2))*COS(RADIANS(RC[-4])))-SIN(RADIANS(RC[-14])))/(COS(RADIANS(R2C2))*SIN(RADIANS(RC[-4]))))),360)) -> 178.52868334239054
D19: =R[-1]C+1 -> 2017-01-18T00:00:00.000 | E19: =R5C2 -> 1899-12-31T14:00:00.000 | F19: =RC[-2]+2415018.5+RC[-1]-R4C2/24 -> 2457772.375 | G19: =(RC[-1]-2451545)/36525 -> 0.17049623545516771 | I19: =MOD(280.46646+RC[-2]*(36000.76983 + RC[-2]*0.0003032),360) -> 298.46219831668714 | J19: =357.52911+RC[-3]*(35999.05029 - 0.0001537*RC[-3]) -> 6495.2316599383639 | K19: =0.016708634-RC[-4]*(0.000042037+0.0000001267*RC[-4]) -> 1.670146316671214E-2 | L19: =SIN(RADIANS(RC[-2]))*(1.914602-RC[-5]*(0.004817+0.000014*RC[-5]))+SIN(RADIANS(2*RC[-2]))*(0.019993-0.000101*RC[-5])+SIN(RADIANS(3*RC[-2]))*0.000289 -> 0.51312718584941452 | M19: =RC[-4]+RC[-1] -> 298.97532550253658 | N19: =RC[-4]+RC[-2] -> 6495.744787124213 | O19: =(1.000001018*(1-RC[-4]*RC[-4]))/(1+RC[-4]*COS(RADIANS(RC[-1]))) -> 0.98390596454013446 | P19: =RC[-3]-0.00569-0.00478*SIN(RADIANS(125.04-1934.136*RC[-9])) -> 298.96763636188393 | Q19: =23+(26+((21.448-RC[-10]*(46.815+RC[-10]*(0.00059-RC[-10]*0.001813))))/60)/60 -> 23.437073947381105 | R19: =RC[-1]+0.00256*COS(RADIANS(125.04-1934.136*RC[-11])) -> 23.434748594314541 | S19: =DEGREES(ATAN2(COS(RADIANS(RC[-3])),COS(RADIANS(RC[-1]))*SIN(RADIANS(RC[-3])))) -> -58.89582049216299 | T19: =DEGREES(ASIN(SIN(RADIANS(RC[-2]))*SIN(RADIANS(RC[-4])))) -> -20.361916356201448 | U19: =TAN(RADIANS(RC[-3]/2))*TAN(RADIANS(RC[-3]/2)) -> 4.3017376502877562E-2 | V19: =4*DEGREES(RC[-1]*SIN(2*RADIANS(RC[-13]))-2*RC[-11]*SIN(RADIANS(RC[-12]))+4*RC[-11]*RC[-1]*SIN(RADIANS(RC[-12]))*COS(2*RADIANS(RC[-13]))-0.5*RC[-1]*RC[-1]*SIN(4*RADIANS(RC[-13]))-1.25*RC[-11]*RC[-11]*SIN(2*RADIANS(RC[-12]))) -> -10.601374279102327 | W19: =DEGREES(ACOS(COS(RADIANS(90.833))/(COS(RADIANS(R2C2))*COS(RADIANS(RC[-3])))-TAN(RADIANS(R2C2))*TAN(RADIANS(RC[-3])))) -> 13.002613422404551 | X19: =(720-4*R3C2-RC[-2]+R4C2*60)/1440 -> 1899-12-31T14:06:36.082 | Y19: =(RC[-1]*1440-RC[-2]*4)/1440 -> 1899-12-31T13:14:35.455 | Z19: =(RC[-2]*1440+RC[-3]*4)/1440 -> 1899-12-31T14:58:36.710 | AA19: =8*RC[-4] -> 104.02090737923641 | AB19: =MOD(RC[-23]*1440+RC[-6]+4*R3C2-60*R4C2,1440) -> 713.39862572089771 | AC19: =IF(RC[-1]/4<0,RC[-1]/4+180,RC[-1]/4-180) -> -1.650343569775572 | AD19: =DEGREES(ACOS(SIN(RADIANS(R2C2))*SIN(RADIANS(RC[-10]))+COS(RADIANS(R2C2))*COS(RADIANS(RC[-10]))*COS(RADIANS(RC[-1])))) -> 90.369537218705247 | AE19: =90-RC[-1] -> -0.36953721870524703 | AF19: =IF(RC[-1]>85,0,IF(RC[-1]>5,58.1/TAN(RADIANS(RC[-1]))-0.07/POWER(TAN(RADIANS(RC[-1])),3)+0.000086/POWER(TAN(RADIANS(RC[-1])),5),IF(RC[-1]>-0.575,1735+RC[-1]*(-518.2+RC[-1]*(103.4+RC[-1]*(-12.79+RC[-1]*0.711))),-20.772/TAN(RADIANS(RC[-1])))))/3600 -> 0.53924248373171813 | AG19: =RC[-2]+RC[-1] -> 0.1697052650264711 | AH19: =IF(RC[-5]>0,MOD(DEGREES(ACOS(((SIN(RADIANS(R2C2))*COS(RADIANS(RC[-4])))-SIN(RADIANS(RC[-14])))/(COS(RADIANS(R2C2))*SIN(RADIANS(RC[-4])))))+180,360),MOD(540-DEGREES(ACOS(((SIN(RADIANS(R2C2))*COS(RADIANS(RC[-4])))-SIN(RADIANS(RC[-14])))/(COS(RADIANS(R2C2))*SIN(RADIANS(RC[-4]))))),360)) -> 178.45277438939263
D20: =R[-1]C+1 -> 2017-01-19T00:00:00.000 | E20: =R5C2 -> 1899-12-31T14:00:00.000 | F20: =RC[-2]+2415018.5+RC[-1]-R4C2/24 -> 2457773.375 | G20: =(RC[-1]-2451545)/36525 -> 0.17052361396303903 | I20: =MOD(280.46646+RC[-2]*(36000.76983 + RC[-2]*0.0003032),360) -> 299.44784567968236 | J20: =357.52911+RC[-3]*(35999.05029 - 0.0001537*RC[-3]) -> 6496.2172602186538 | K20: =0.016708634-RC[-4]*(0.000042037+0.0000001267*RC[-4]) -> 1.6701462014618855E-2 | L20: =SIN(RADIANS(RC[-2]))*(1.914602-RC[-5]*(0.004817+0.000014*RC[-5]))+SIN(RADIANS(2*RC[-2]))*(0.019993-0.000101*RC[-5])+SIN(RADIANS(3*RC[-2]))*0.000289 -> 0.5454119264678432 | M20: =RC[-4]+RC[-1] -> 299.99325760615022 | N20: =RC[-4]+RC[-2] -> 6496.7626721451215 | O20: =(1.000001018*(1-RC[-4]*RC[-4]))/(1+RC[-4]*COS(RADIANS(RC[-1]))) -> 0.98398638822999629 | P20: =RC[-3]-0.00569-0.00478*SIN(RADIANS(125.04-1934.136*RC[-9])) -> 299.98556445351988 | Q20: =23+(26+((21.448-RC[-10]*(46.815+RC[-10]*(0.00059-RC[-10]*0.001813))))/60)/60 -> 23.437073591346095 | R20: =RC[-1]+0.00256*COS(RADIANS(125.04-1934.136*RC[-11])) -> 23.434749228803906 | S20: =DEGREES(ATAN2(COS(RADIANS(RC[-3])),COS(RADIANS(RC[-1]))*SIN(RADIANS(RC[-3])))) -> -57.834656132231288 | T20: =DEGREES(ASIN(SIN(RADIANS(RC[-2]))*SIN(RADIANS(RC[-4])))) -> -20.149581744874993 | U20: =TAN(RADIANS(RC[-3]/2))*TAN(RADIANS(RC[-3]/2)) -> 4.3017378898482637E-2 | V20: =4*DEGREES(RC[-1]*SIN(2*RADIANS(RC[-13]))-2*RC[-11]*SIN(RADIANS(RC[-12]))+4*RC[-11]*RC[-1]*SIN(RADIANS(RC[-12]))*COS(2*RADIANS(RC[-13]))-0.5*RC[-1]*RC[-1]*SIN(4*RADIANS(RC[-13]))-1.25*RC[-11]*RC[-11]*SIN(2*RADIANS(RC[-12]))) -> -10.904904963958392 | W20: =DEGREES(ACOS(COS(RADIANS(90.833))/(COS(RADIANS(R2C2))*COS(RADIANS(RC[-3])))-TAN(RADIANS(R2C2))*TAN(RADIANS(RC[-3])))) -> 15.665793469847783 | X20: =(720-4*R3C2-RC[-2]+R4C2*60)/1440 -> 1899-12-31T14:06:54.294 | Y20: =(RC[-1]*1440-RC[-2]*4)/1440 -> 1899-12-31T13:04:14.504 | Z20: =(RC[-2]*1440+RC[-3]*4)/1440 -> 1899-12-31T15:09:34.085 | AA20: =8*RC[-4] -> 125.32634775878226 | AB20: =MOD(RC[-23]*1440+RC[-6]+4*R3C2-60*R4C2,1440) -> 713.09509503604158 | AC20: =IF(RC[-1]/4<0,RC[-1]/4+180,RC[-1]/4-180) -> -1.7262262409896039 | AD20: =DEGREES(ACOS(SIN(RADIANS(R2C2))*SIN(RADIANS(RC[-10]))+COS(RADIANS(R2C2))*COS(RADIANS(RC[-10]))*COS(RADIANS(RC[-1])))) -> 90.157930748771392 | AE20: =90-RC[-1] -> -0.1579307487713919 | AF20: =IF(RC[-1]>85,0,IF(RC[-1]>5,58.1/TAN(RADIANS(RC[-1]))-0.07/POWER(TAN(RADIANS(RC[-1])),3)+0.000086/POWER(TAN(RADIANS(RC[-1])),5),IF(RC[-1]>-0.575,1735+RC[-1]*(-518.2+RC[-1]*(103.4+RC[-1]*(-12.79+RC[-1]*0.711))),-20.772/TAN(RADIANS(RC[-1])))))/3600 -> 0.5054082092035096 | AG20: =RC[-2]+RC[-1] -> 0.34747746043211769 | AH20: =IF(RC[-5]>0,MOD(DEGREES(ACOS(((SIN(RADIANS(R2C2))*COS(RADIANS(RC[-4])))-SIN(RADIANS(RC[-14])))/(COS(RADIANS(R2C2))*SIN(RADIANS(RC[-4])))))+180,360),MOD(540-DEGREES(ACOS(((SIN(RADIANS(R2C2))*COS(RADIANS(RC[-4])))-SIN(RADIANS(RC[-14])))/(COS(RADIANS(R2C2))*SIN(RADIANS(RC[-4]))))),360)) -> 178.37944777367534
D21: =R[-1]C+1 -> 2017-01-20T00:00:00.000 | E21: =R5C2 -> 1899-12-31T14:00:00.000 | F21: =RC[-2]+2415018.5+RC[-1]-R4C2/24 -> 2457774.375 | G21: =(RC[-1]-2451545)/36525 -> 0.17055099247091032 | I21: =MOD(280.46646+RC[-2]*(36000.76983 + RC[-2]*0.0003032),360) -> 300.43349304267758 | J21: =357.52911+RC[-3]*(35999.05029 - 0.0001537*RC[-3]) -> 6497.2028604989418 | K21: =0.016708634-RC[-4]*(0.000042037+0.0000001267*RC[-4]) -> 1.6701460862525382E-2 | L21: =SIN(RADIANS(RC[-2]))*(1.914602-RC[-5]*(0.004817+0.000014*RC[-5]))+SIN(RADIANS(2*RC[-2]))*(0.019993-0.000101*RC[-5])+SIN(RADIANS(3*RC[-2]))*0.000289 -> 0.57752525181123693 | M21: =RC[-4]+RC[-1] -> 301.01101829448879 | N21: =RC[-4]+RC[-2] -> 6497.7803857507533 | O21: =(1.000001018*(1-RC[-4]*RC[-4]))/(1+RC[-4]*COS(RADIANS(RC[-1]))) -> 0.98407169915850057 | P21: =RC[-3]-0.00569-0.00478*SIN(RADIANS(125.04-1934.136*RC[-9])) -> 301.0033211315918 | Q21: =23+(26+((21.448-RC[-10]*(46.815+RC[-10]*(0.00059-RC[-10]*0.001813))))/60)/60 -> 23.43707323531109 | R21: =RC[-1]+0.00256*COS(RADIANS(125.04-1934.136*RC[-11])) -> 23.43474986527869 | S21: =DEGREES(ATAN2(COS(RADIANS(RC[-3])),COS(RADIANS(RC[-1]))*SIN(RADIANS(RC[-3])))) -> -56.776594592986591 | T21: =DEGREES(ASIN(SIN(RADIANS(RC[-2]))*SIN(RADIANS(RC[-4])))) -> -19.930946273717321 | U21: =TAN(RADIANS(RC[-3]/2))*TAN(RADIANS(RC[-3]/2)) -> 4.3017381301584022E-2 | V21: =4*DEGREES(RC[-1]*SIN(2*RADIANS(RC[-13]))-2*RC[-11]*SIN(RADIANS(RC[-12]))+4*RC[-11]*RC[-1]*SIN(RADIANS(RC[-12]))*COS(2*RADIANS(RC[-13]))-0.5*RC[-1]*RC[-1]*SIN(4*RADIANS(RC[-13]))-1.25*RC[-11]*RC[-11]*SIN(2*RADIANS(RC[-12]))) -> -11.196091511466728 | W21: =DEGREES(ACOS(COS(RADIANS(90.833))/(COS(RADIANS(R2C2))*COS(RADIANS(RC[-3])))-TAN(RADIANS(R2C2))*TAN(RADIANS(RC[-3])))) -> 18.003617469217463 | X21: =(720-4*R3C2-RC[-2]+R4C2*60)/1440 -> 1899-12-31T14:07:11.765 | Y21: =(RC[-1]*1440-RC[-2]*4)/1440 -> 1899-12-31T12:55:10.897 | Z21: =(RC[-2]*1440+RC[-3]*4)/1440 -> 1899-12-31T15:19:12.634 | AA21: =8*RC[-4] -> 144.02893975373971 | AB21: =MOD(RC[-23]*1440+RC[-6]+4*R3C2-60*R4C2,1440) -> 712.80390848853324 | AC21: =IF(RC[-1]/4<0,RC[-1]/4+180,RC[-1]/4-180) -> -1.7990228778666904 | AD21: =DEGREES(ACOS(SIN(RADIANS(R2C2))*SIN(RADIANS(RC[-10]))+COS(RADIANS(R2C2))*COS(RADIANS(RC[-10]))*COS(RADIANS(RC[-1])))) -> 89.940026841235706 | AE21: =90-RC[-1] -> 5.9973158764293544E-2 | AF21: =IF(RC[-1]>85,0,IF(RC[-1]>5,58.1/TAN(RADIANS(RC[-1]))-0.07/POWER(TAN(RADIANS(RC[-1])),3)+0.000086/POWER(TAN(RADIANS(RC[-1])),5),IF(RC[-1]>-0.575,1735+RC[-1]*(-518.2+RC[-1]*(103.4+RC[-1]*(-12.79+RC[-1]*0.711))),-20.772/TAN(RADIANS(RC[-1])))))/3600 -> 0.47341418511690075 | AG21: =RC[-2]+RC[-1] -> 0.53338734388119424 | AH21: =IF(RC[-5]>0,MOD(DEGREES(ACOS(((SIN(RADIANS(R2C2))*COS(RADIANS(RC[-4])))-SIN(RADIANS(RC[-14])))/(COS(RADIANS(R2C2))*SIN(RADIANS(RC[-4])))))+180,360),MOD(540-DEGREES(ACOS(((SIN(RADIANS(R2C2))*COS(RADIANS(RC[-4])))-SIN(RADIANS(RC[-14])))/(COS(RADIANS(R2C2))*SIN(RADIANS(RC[-4]))))),360)) -> 178.30876251132747
D22: =R[-1]C+1 -> 2017-01-21T00:00:00.000 | E22: =R5C2 -> 1899-12-31T14:00:00.000 | F22: =RC[-2]+2415018.5+RC[-1]-R4C2/24 -> 2457775.375 | G22: =(RC[-1]-2451545)/36525 -> 0.17057837097878165 | I22: =MOD(280.46646+RC[-2]*(36000.76983 + RC[-2]*0.0003032),360) -> 301.41914040567372 | J22: =357.52911+RC[-3]*(35999.05029 - 0.0001537*RC[-3]) -> 6498.1884607792317 | K22: =0.016708634-RC[-4]*(0.000042037+0.0000001267*RC[-4]) -> 1.6701459710431719E-2 | L22: =SIN(RADIANS(RC[-2]))*(1.914602-RC[-5]*(0.004817+0.000014*RC[-5]))+SIN(RADIANS(2*RC[-2]))*(0.019993-0.000101*RC[-5])+SIN(RADIANS(3*RC[-2]))*0.000289 -> 0.60945712781322514 | M22: =RC[-4]+RC[-1] -> 302.02859753348696 | N22: =RC[-4]+RC[-2] -> 6498.7979179070453 | O22: =(1.000001018*(1-RC[-4]*RC[-4]))/(1+RC[-4]*COS(RADIANS(RC[-1]))) -> 0.98416186956530016 | P22: =RC[-3]-0.00569-0.00478*SIN(RADIANS(125.04-1934.136*RC[-9])) -> 302.02089636203783 | Q22: =23+(26+((21.448-RC[-10]*(46.815+RC[-10]*(0.00059-RC[-10]*0.001813))))/60)/60 -> 23.437072879276084 | R22: =RC[-1]+0.00256*COS(RADIANS(125.04-1934.136*RC[-11])) -> 23.434750503738044 | S22: =DEGREES(ATAN2(COS(RADIANS(RC[-3])),COS(RADIANS(RC[-1]))*SIN(RADIANS(RC[-3])))) -> -55.7216864082515 | T22: =DEGREES(ASIN(SIN(RADIANS(RC[-2]))*SIN(RADIANS(RC[-4])))) -> -19.706107428196958 | U22: =TAN(RADIANS(RC[-3]/2))*TAN(RADIANS(RC[-3]/2)) -> 4.3017383712178503E-2 | V22: =4*DEGREES(RC[-1]*SIN(2*RADIANS(RC[-13]))-2*RC[-11]*SIN(RADIANS(RC[-12]))+4*RC[-11]*RC[-1]*SIN(RADIANS(RC[-12]))*COS(2*RADIANS(RC[-13]))-0.5*RC[-1]*RC[-1]*SIN(4*RADIANS(RC[-13]))-1.25*RC[-11]*RC[-11]*SIN(2*RADIANS(RC[-12]))) -> -11.474717437666243 | W22: =DEGREES(ACOS(COS(RADIANS(90.833))/(COS(RADIANS(R2C2))*COS(RADIANS(RC[-3])))-TAN(RADIANS(R2C2))*TAN(RADIANS(RC[-3])))) -> 20.12920036388731 | X22: =(720-4*R3C2-RC[-2]+R4C2*60)/1440 -> 1899-12-31T14:07:28.483 | Y22: =(RC[-1]*1440-RC[-2]*4)/1440 -> 1899-12-31T12:46:57.475 | Z22: =(RC[-2]*1440+RC[-3]*4)/1440 -> 1899-12-31T15:27:59.491 | AA22: =8*RC[-4] -> 161.03360291109848 | AB22: =MOD(RC[-23]*1440+RC[-6]+4*R3C2-60*R4C2,1440) -> 712.52528256233381 | AC22: =IF(RC[-1]/4<0,RC[-1]/4+180,RC[-1]/4-180) -> -1.8686793594165465 | AD22: =DEGREES(ACOS(SIN(RADIANS(R2C2))*SIN(RADIANS(RC[-10]))+COS(RADIANS(R2C2))*COS(RADIANS(RC[-10]))*COS(RADIANS(RC[-1])))) -> 89.715918711582674 | AE22: =90-RC[-1] -> 0.28408128841732605 | AF22: =IF(RC[-1]>85,0,IF(RC[-1]>5,58.1/TAN(RADIANS(RC[-1]))-0.07/POWER(TAN(RADIANS(RC[-1])),3)+0.000086/POWER(TAN(RADIANS(RC[-1])),5),IF(RC[-1]>-0.575,1735+RC[-1]*(-518.2+RC[-1]*(103.4+RC[-1]*(-12.79+RC[-1]*0.711))),-20.772/TAN(RADIANS(RC[-1])))))/3600 -> 0.44329030248691054 | AG22: =RC[-2]+RC[-1] -> 0.72737159090423664 | AH22: =IF(RC[-5]>0,MOD(DEGREES(ACOS(((SIN(RADIANS(R2C2))*COS(RADIANS(RC[-4])))-SIN(RADIANS(RC[-14])))/(COS(RADIANS(R2C2))*SIN(RADIANS(RC[-4])))))+180,360),MOD(540-DEGREES(ACOS(((SIN(RADIANS(R2C2))*COS(RADIANS(RC[-4])))-SIN(RADIANS(RC[-14])))/(COS(RADIANS(R2C2))*SIN(RADIANS(RC[-4]))))),360)) -> 178.24077442639555
D23: =R[-1]C+1 -> 2017-01-22T00:00:00.000 | E23: =R5C2 -> 1899-12-31T14:00:00.000 | F23: =RC[-2]+2415018.5+RC[-1]-R4C2/24 -> 2457776.375 | G23: =(RC[-1]-2451545)/36525 -> 0.17060574948665297 | I23: =MOD(280.46646+RC[-2]*(36000.76983 + RC[-2]*0.0003032),360) -> 302.40478776866985 | J23: =357.52911+RC[-3]*(35999.05029 - 0.0001537*RC[-3]) -> 6499.1740610595207 | K23: =0.016708634-RC[-4]*(0.000042037+0.0000001267*RC[-4]) -> 1.6701458558337864E-2 | L23: =SIN(RADIANS(RC[-2]))*(1.914602-RC[-5]*(0.004817+0.000014*RC[-5]))+SIN(RADIANS(2*RC[-2]))*(0.019993-0.000101*RC[-5])+SIN(RADIANS(3*RC[-2]))*0.000289 -> 0.64119758738455601 | M23: =RC[-4]+RC[-1] -> 303.04598535605442 | N23: =RC[-4]+RC[-2] -> 6499.815258646905 | O23: =(1.000001018*(1-RC[-4]*RC[-4]))/(1+RC[-4]*COS(RADIANS(RC[-1]))) -> 0.98425687012423724 | P23: =RC[-3]-0.00569-0.00478*SIN(RADIANS(125.04-1934.136*RC[-9])) -> 303.03828017777101 | Q23: =23+(26+((21.448-RC[-10]*(46.815+RC[-10]*(0.00059-RC[-10]*0.001813))))/60)/60 -> 23.437072523241078 | R23: =RC[-1]+0.00256*COS(RADIANS(125.04-1934.136*RC[-11])) -> 23.434751144181121 | S23: =DEGREES(ATAN2(COS(RADIANS(RC[-3])),COS(RADIANS(RC[-1]))*SIN(RADIANS(RC[-3])))) -> -54.669977340808032 | T23: =DEGREES(ASIN(SIN(RADIANS(RC[-2]))*SIN(RADIANS(RC[-4])))) -> -19.475164545120297 | U23: =TAN(RADIANS(RC[-3]/2))*TAN(RADIANS(RC[-3]/2)) -> 4.3017386130262895E-2 | V23: =4*DEGREES(RC[-1]*SIN(2*RADIANS(RC[-13]))-2*RC[-11]*SIN(RADIANS(RC[-12]))+4*RC[-11]*RC[-1]*SIN(RADIANS(RC[-12]))*COS(2*RADIANS(RC[-13]))-0.5*RC[-1]*RC[-1]*SIN(4*RADIANS(RC[-13]))-1.25*RC[-11]*RC[-11]*SIN(2*RADIANS(RC[-12]))) -> -11.740584889534615 | W23: =DEGREES(ACOS(COS(RADIANS(90.833))/(COS(RADIANS(R2C2))*COS(RADIANS(RC[-3])))-TAN(RADIANS(R2C2))*TAN(RADIANS(RC[-3])))) -> 22.103344209325105 | X23: =(720-4*R3C2-RC[-2]+R4C2*60)/1440 -> 1899-12-31T14:07:44.435 | Y23: =(RC[-1]*1440-RC[-2]*4)/1440 -> 1899-12-31T12:39:19.632 | Z23: =(RC[-2]*1440+RC[-3]*4)/1440 -> 1899-12-31T15:36:09.238 | AA23: =8*RC[-4] -> 176.82675367460084 | AB23: =MOD(RC[-23]*1440+RC[-6]+4*R3C2-60*R4C2,1440) -> 712.2594151104654 | AC23: =IF(RC[-1]/4<0,RC[-1]/4+180,RC[-1]/4-180) -> -1.9351462223836506 | AD23: =DEGREES(ACOS(SIN(RADIANS(R2C2))*SIN(RADIANS(RC[-10]))+COS(RADIANS(R2C2))*COS(RADIANS(RC[-10]))*COS(RADIANS(RC[-1])))) -> 89.485701530328711 | AE23: =90-RC[-1] -> 0.51429846967128867 | AF23: =IF(RC[-1]>85,0,IF(RC[-1]>5,58.1/TAN(RADIANS(RC[-1]))-0.07/POWER(TAN(RADIANS(RC[-1])),3)+0.000086/POWER(TAN(RADIANS(RC[-1])),5),IF(RC[-1]>-0.575,1735+RC[-1]*(-518.2+RC[-1]*(103.4+RC[-1]*(-12.79+RC[-1]*0.711))),-20.772/TAN(RADIANS(RC[-1])))))/3600 -> 0.41504166933210707 | AG23: =RC[-2]+RC[-1] -> 0.92934013900339574 | AH23: =IF(RC[-5]>0,MOD(DEGREES(ACOS(((SIN(RADIANS(R2C2))*COS(RADIANS(RC[-4])))-SIN(RADIANS(RC[-14])))/(COS(RADIANS(R2C2))*SIN(RADIANS(RC[-4])))))+180,360),MOD(540-DEGREES(ACOS(((SIN(RADIANS(R2C2))*COS(RADIANS(RC[-4])))-SIN(RADIANS(RC[-14])))/(COS(RADIANS(R2C2))*SIN(RADIANS(RC[-4]))))),360)) -> 178.17553609636059
D24: =R[-1]C+1 -> 2017-01-23T00:00:00.000 | E24: =R5C2 -> 1899-12-31T14:00:00.000 | F24: =RC[-2]+2415018.5+RC[-1]-R4C2/24 -> 2457777.375 | G24: =(RC[-1]-2451545)/36525 -> 0.17063312799452429 | I24: =MOD(280.46646+RC[-2]*(36000.76983 + RC[-2]*0.0003032),360) -> 303.3904351316678 | J24: =357.52911+RC[-3]*(35999.05029 - 0.0001537*RC[-3]) -> 6500.1596613398096 | K24: =0.016708634-RC[-4]*(0.000042037+0.0000001267*RC[-4]) -> 1.6701457406243819E-2 | L24: =SIN(RADIANS(RC[-2]))*(1.914602-RC[-5]*(0.004817+0.000014*RC[-5]))+SIN(RADIANS(2*RC[-2]))*(0.019993-0.000101*RC[-5])+SIN(RADIANS(3*RC[-2]))*0.000289 -> 0.67273673400749057 | M24: =RC[-4]+RC[-1] -> 304.06317186567532 | N24: =RC[-4]+RC[-2] -> 6500.8323980738169 | O24: =(1.000001018*(1-RC[-4]*RC[-4]))/(1+RC[-4]*COS(RADIANS(RC[-1]))) -> 0.98435666995543047 | P24: =RC[-3]-0.00569-0.00478*SIN(RADIANS(125.04-1934.136*RC[-9])) -> 304.05546268227897 | Q24: =23+(26+((21.448-RC[-10]*(46.815+RC[-10]*(0.00059-RC[-10]*0.001813))))/60)/60 -> 23.437072167206072 | R24: =RC[-1]+0.00256*COS(RADIANS(125.04-1934.136*RC[-11])) -> 23.434751786607066 | S24: =DEGREES(ATAN2(COS(RADIANS(RC[-3])),COS(RADIANS(RC[-1]))*SIN(RADIANS(RC[-3])))) -> -53.621508398816317 | T24: =DEGREES(ASIN(SIN(RADIANS(RC[-2]))*SIN(RADIANS(RC[-4])))) -> -19.238218700481497 | U24: =TAN(RADIANS(RC[-3]/2))*TAN(RADIANS(RC[-3]/2)) -> 4.3017388555833945E-2 | V24: =4*DEGREES(RC[-1]*SIN(2*RADIANS(RC[-13]))-2*RC[-11]*SIN(RADIANS(RC[-12]))+4*RC[-11]*RC[-1]*SIN(RADIANS(RC[-12]))*COS(2*RADIANS(RC[-13]))-0.5*RC[-1]*RC[-1]*SIN(4*RADIANS(RC[-13]))-1.25*RC[-11]*RC[-11]*SIN(2*RADIANS(RC[-12]))) -> -11.993514723425969 | W24: =DEGREES(ACOS(COS(RADIANS(90.833))/(COS(RADIANS(R2C2))*COS(RADIANS(RC[-3])))-TAN(RADIANS(R2C2))*TAN(RADIANS(RC[-3])))) -> 23.963035338678797 | X24: =(720-4*R3C2-RC[-2]+R4C2*60)/1440 -> 1899-12-31T14:07:59.611 | Y24: =(RC[-1]*1440-RC[-2]*4)/1440 -> 1899-12-31T12:32:08.482 | Z24: =(RC[-2]*1440+RC[-3]*4)/1440 -> 1899-12-31T15:43:50.739 | AA24: =8*RC[-4] -> 191.70428270943037 | AB24: =MOD(RC[-23]*1440+RC[-6]+4*R3C2-60*R4C2,1440) -> 712.00648527657404 | AC24: =IF(RC[-1]/4<0,RC[-1]/4+180,RC[-1]/4-180) -> -1.9983786808564901 | AD24: =DEGREES(ACOS(SIN(RADIANS(R2C2))*SIN(RADIANS(RC[-10]))+COS(RADIANS(R2C2))*COS(RADIANS(RC[-10]))*COS(RADIANS(RC[-1])))) -> 89.249472328347622 | AE24: =90-RC[-1] -> 0.7505276716523781 | AF24: =IF(RC[-1]>85,0,IF(RC[-1]>5,58.1/TAN(RADIANS(RC[-1]))-0.07/POWER(TAN(RADIANS(RC[-1])),3)+0.000086/POWER(TAN(RADIANS(RC[-1])),5),IF(RC[-1]>-0.575,1735+RC[-1]*(-518.2+RC[-1]*(103.4+RC[-1]*(-12.79+RC[-1]*0.711))),-20.772/TAN(RADIANS(RC[-1])))))/3600 -> 0.38864981993468228 | AG24: =RC[-2]+RC[-1] -> 1.1391774915870605 | AH24: =IF(RC[-5]>0,MOD(DEGREES(ACOS(((SIN(RADIANS(R2C2))*COS(RADIANS(RC[-4])))-SIN(RADIANS(RC[-14])))/(COS(RADIANS(R2C2))*SIN(RADIANS(RC[-4])))))+180,360),MOD(540-DEGREES(ACOS(((SIN(RADIANS(R2C2))*COS(RADIANS(RC[-4])))-SIN(RADIANS(RC[-14])))/(COS(RADIANS(R2C2))*SIN(RADIANS(RC[-4]))))),360)) -> 178.11309680307033
D25: =R[-1]C+1 -> 2017-01-24T00:00:00.000 | E25: =R5C2 -> 1899-12-31T14:00:00.000 | F25: =RC[-2]+2415018.5+RC[-1]-R4C2/24 -> 2457778.375 | G25: =(RC[-1]-2451545)/36525 -> 0.17066050650239561 | I25: =MOD(280.46646+RC[-2]*(36000.76983 + RC[-2]*0.0003032),360) -> 304.37608249466484 | J25: =357.52911+RC[-3]*(35999.05029 - 0.0001537*RC[-3]) -> 6501.1452616200986 | K25: =0.016708634-RC[-4]*(0.000042037+0.0000001267*RC[-4]) -> 1.6701456254149583E-2 | L25: =SIN(RADIANS(RC[-2]))*(1.914602-RC[-5]*(0.004817+0.000014*RC[-5]))+SIN(RADIANS(2*RC[-2]))*(0.019993-0.000101*RC[-5])+SIN(RADIANS(3*RC[-2]))*0.000289 -> 0.70406474529047103 | M25: =RC[-4]+RC[-1] -> 305.08014723995529 | N25: =RC[-4]+RC[-2] -> 6501.8493263653891 | O25: =(1.000001018*(1-RC[-4]*RC[-4]))/(1+RC[-4]*COS(RADIANS(RC[-1]))) -> 0.98446123663797369 | P25: =RC[-3]-0.00569-0.00478*SIN(RADIANS(125.04-1934.136*RC[-9])) -> 305.07243405317075 | Q25: =23+(26+((21.448-RC[-10]*(46.815+RC[-10]*(0.00059-RC[-10]*0.001813))))/60)/60 -> 23.437071811171066 | R25: =RC[-1]+0.00256*COS(RADIANS(125.04-1934.136*RC[-11])) -> 23.434752431015031 | S25: =DEGREES(ATAN2(COS(RADIANS(RC[-3])),COS(RADIANS(RC[-1]))*SIN(RADIANS(RC[-3])))) -> -52.576315862130151 | T25: =DEGREES(ASIN(SIN(RADIANS(RC[-2]))*SIN(RADIANS(RC[-4])))) -> -18.995372598697141 | U25: =TAN(RADIANS(RC[-3]/2))*TAN(RADIANS(RC[-3]/2)) -> 4.3017390988888501E-2 | V25: =4*DEGREES(RC[-1]*SIN(2*RADIANS(RC[-13]))-2*RC[-11]*SIN(RADIANS(RC[-12]))+4*RC[-11]*RC[-1]*SIN(RADIANS(RC[-12]))*COS(2*RADIANS(RC[-13]))-0.5*RC[-1]*RC[-1]*SIN(4*RADIANS(RC[-13]))-1.25*RC[-11]*RC[-11]*SIN(2*RADIANS(RC[-12]))) -> -12.233346544420604 | W25: =DEGREES(ACOS(COS(RADIANS(90.833))/(COS(RADIANS(R2C2))*COS(RADIANS(RC[-3])))-TAN(RADIANS(R2C2))*TAN(RADIANS(RC[-3])))) -> 25.732665361009019 | X25: =(720-4*R3C2-RC[-2]+R4C2*60)/1440 -> 1899-12-31T14:08:14.001 | Y25: =(RC[-1]*1440-RC[-2]*4)/1440 -> 1899-12-31T12:25:18.161 | Z25: =(RC[-2]*1440+RC[-3]*4)/1440 -> 1899-12-31T15:51:09.840 | AA25: =8*RC[-4] -> 205.86132288807215 | AB25: =MOD(RC[-23]*1440+RC[-6]+4*R3C2-60*R4C2,1440) -> 711.76665345557944 | AC25: =IF(RC[-1]/4<0,RC[-1]/4+180,RC[-1]/4-180) -> -2.058336636105139 | AD25: =DEGREES(ACOS(SIN(RADIANS(R2C2))*SIN(RADIANS(RC[-10]))+COS(RADIANS(R2C2))*COS(RADIANS(RC[-10]))*COS(RADIANS(RC[-1])))) -> 89.007329902667919 | AE25: =90-RC[-1] -> 0.99267009733208056 | AF25: =IF(RC[-1]>85,0,IF(RC[-1]>5,58.1/TAN(RADIANS(RC[-1]))-0.07/POWER(TAN(RADIANS(RC[-1])),3)+0.000086/POWER(TAN(RADIANS(RC[-1])),5),IF(RC[-1]>-0.575,1735+RC[-1]*(-518.2+RC[-1]*(103.4+RC[-1]*(-12.79+RC[-1]*0.711))),-20.772/TAN(RADIANS(RC[-1])))))/3600 -> 0.36407435023080714 | AG25: =RC[-2]+RC[-1] -> 1.3567444475628876 | AH25: =IF(RC[-5]>0,MOD(DEGREES(ACOS(((SIN(RADIANS(R2C2))*COS(RADIANS(RC[-4])))-SIN(RADIANS(RC[-14])))/(COS(RADIANS(R2C2))*SIN(RADIANS(RC[-4])))))+180,360),MOD(540-DEGREES(ACOS(((SIN(RADIANS(R2C2))*COS(RADIANS(RC[-4])))-SIN(RADIANS(RC[-14])))/(COS(RADIANS(R2C2))*SIN(RADIANS(RC[-4]))))),360)) -> 178.05350248915693
D26: =R[-1]C+1 -> 2017-01-25T00:00:00.000 | E26: =R5C2 -> 1899-12-31T14:00:00.000 | F26: =RC[-2]+2415018.5+RC[-1]-R4C2/24 -> 2457779.375 | G26: =(RC[-1]-2451545)/36525 -> 0.17068788501026694 | I26: =MOD(280.46646+RC[-2]*(36000.76983 + RC[-2]*0.0003032),360) -> 305.36172985766279 | J26: =357.52911+RC[-3]*(35999.05029 - 0.0001537*RC[-3]) -> 6502.1308619003858 | K26: =0.016708634-RC[-4]*(0.000042037+0.0000001267*RC[-4]) -> 1.670145510205516E-2 | L26: =SIN(RADIANS(RC[-2]))*(1.914602-RC[-5]*(0.004817+0.000014*RC[-5]))+SIN(RADIANS(2*RC[-2]))*(0.019993-0.000101*RC[-5])+SIN(RADIANS(3*RC[-2]))*0.000289 -> 0.73517187648120075 | M26: =RC[-4]+RC[-1] -> 306.09690173414401 | N26: =RC[-4]+RC[-2] -> 6502.866033776867 | O26: =(1.000001018*(1-RC[-4]*RC[-4]))/(1+RC[-4]*COS(RADIANS(RC[-1]))) -> 0.9845705362232493 | P26: =RC[-3]-0.00569-0.00478*SIN(RADIANS(125.04-1934.136*RC[-9])) -> 306.08918454569942 | Q26: =23+(26+((21.448-RC[-10]*(46.815+RC[-10]*(0.00059-RC[-10]*0.001813))))/60)/60 -> 23.437071455136056 | R26: =RC[-1]+0.00256*COS(RADIANS(125.04-1934.136*RC[-11])) -> 23.434753077404157 | S26: =DEGREES(ATAN2(COS(RADIANS(RC[-3])),COS(RADIANS(RC[-1]))*SIN(RADIANS(RC[-3])))) -> -51.53443131795914 | T26: =DEGREES(ASIN(SIN(RADIANS(RC[-2]))*SIN(RADIANS(RC[-4])))) -> -18.74673046347252 | U26: =TAN(RADIANS(RC[-3]/2))*TAN(RADIANS(RC[-3]/2)) -> 4.3017393429423262E-2 | V26: =4*DEGREES(RC[-1]*SIN(2*RADIANS(RC[-13]))-2*RC[-11]*SIN(RADIANS(RC[-12]))+4*RC[-11]*RC[-1]*SIN(RADIANS(RC[-12]))*COS(2*RADIANS(RC[-13]))-0.5*RC[-1]*RC[-1]*SIN(4*RADIANS(RC[-13]))-1.25*RC[-11]*RC[-11]*SIN(2*RADIANS(RC[-12]))) -> -12.45993870723871 | W26: =DEGREES(ACOS(COS(RADIANS(90.833))/(COS(RADIANS(R2C2))*COS(RADIANS(RC[-3])))-TAN(RADIANS(R2C2))*TAN(RADIANS(RC[-3])))) -> 27.429267592349099 | X26: =(720-4*R3C2-RC[-2]+R4C2*60)/1440 -> 1899-12-31T14:08:27.596 | Y26: =(RC[-1]*1440-RC[-2]*4)/1440 -> 1899-12-31T12:18:44.572 | Z26: =(RC[-2]*1440+RC[-3]*4)/1440 -> 1899-12-31T15:58:10.621 | AA26: =8*RC[-4] -> 219.43414073879279 | AB26: =MOD(RC[-23]*1440+RC[-6]+4*R3C2-60*R4C2,1440) -> 711.54006129276127 | AC26: =IF(RC[-1]/4<0,RC[-1]/4+180,RC[-1]/4-180) -> -2.1149846768096836 | AD26: =DEGREES(ACOS(SIN(RADIANS(R2C2))*SIN(RADIANS(RC[-10]))+COS(RADIANS(R2C2))*COS(RADIANS(RC[-10]))*COS(RADIANS(RC[-1])))) -> 88.75937472291784 | AE26: =90-RC[-1] -> 1.2406252770821595 | AF26: =IF(RC[-1]>85,0,IF(RC[-1]>5,58.1/TAN(RADIANS(RC[-1]))-0.07/POWER(TAN(RADIANS(RC[-1])),3)+0.000086/POWER(TAN(RADIANS(RC[-1])),5),IF(RC[-1]>-0.575,1735+RC[-1]*(-518.2+RC[-1]*(103.4+RC[-1]*(-12.79+RC[-1]*0.711))),-20.772/TAN(RADIANS(RC[-1])))))/3600 -> 0.34125497846897029 | AG26: =RC[-2]+RC[-1] -> 1.5818802555511298 | AH26: =IF(RC[-5]>0,MOD(DEGREES(ACOS(((SIN(RADIANS(R2C2))*COS(RADIANS(RC[-4])))-SIN(RADIANS(RC[-14])))/(COS(RADIANS(R2C2))*SIN(RADIANS(RC[-4])))))+180,360),MOD(540-DEGREES(ACOS(((SIN(RADIANS(R2C2))*COS(RADIANS(RC[-4])))-SIN(RADIANS(RC[-14])))/(COS(RADIANS(R2C2))*SIN(RADIANS(RC[-4]))))),360)) -> 177.99679572012406
D27: =R[-1]C+1 -> 2017-01-26T00:00:00.000 | E27: =R5C2 -> 1899-12-31T14:00:00.000 | F27: =RC[-2]+2415018.5+RC[-1]-R4C2/24 -> 2457780.375 | G27: =(RC[-1]-2451545)/36525 -> 0.17071526351813826 | I27: =MOD(280.46646+RC[-2]*(36000.76983 + RC[-2]*0.0003032),360) -> 306.34737722066166 | J27: =357.52911+RC[-3]*(35999.05029 - 0.0001537*RC[-3]) -> 6503.1164621806747 | K27: =0.016708634-RC[-4]*(0.000042037+0.0000001267*RC[-4]) -> 1.6701453949960546E-2 | L27: =SIN(RADIANS(RC[-2]))*(1.914602-RC[-5]*(0.004817+0.000014*RC[-5]))+SIN(RADIANS(2*RC[-2]))*(0.019993-0.000101*RC[-5])+SIN(RADIANS(3*RC[-2]))*0.000289 -> 0.76604846393682158 | M27: =RC[-4]+RC[-1] -> 307.1134256845985 | N27: =RC[-4]+RC[-2] -> 6503.8825106446111 | O27: =(1.000001018*(1-RC[-4]*RC[-4]))/(1+RC[-4]*COS(RADIANS(RC[-1]))) -> 0.98468453324883598 | P27: =RC[-3]-0.00569-0.00478*SIN(RADIANS(125.04-1934.136*RC[-9])) -> 307.10570449622543 | Q27: =23+(26+((21.448-RC[-10]*(46.815+RC[-10]*(0.00059-RC[-10]*0.001813))))/60)/60 -> 23.43707109910105 | R27: =RC[-1]+0.00256*COS(RADIANS(125.04-1934.136*RC[-11])) -> 23.434753725773589 | S27: =DEGREES(ATAN2(COS(RADIANS(RC[-3])),COS(RADIANS(RC[-1]))*SIN(RADIANS(RC[-3])))) -> -50.495881705376739 | T27: =DEGREES(ASIN(SIN(RADIANS(RC[-2]))*SIN(RADIANS(RC[-4])))) -> -18.492397930543575 | U27: =TAN(RADIANS(RC[-3]/2))*TAN(RADIANS(RC[-3]/2)) -> 4.3017395877435041E-2 | V27: =4*DEGREES(RC[-1]*SIN(2*RADIANS(RC[-13]))-2*RC[-11]*SIN(RADIANS(RC[-12]))+4*RC[-11]*RC[-1]*SIN(RADIANS(RC[-12]))*COS(2*RADIANS(RC[-13]))-0.5*RC[-1]*RC[-1]*SIN(4*RADIANS(RC[-13]))-1.25*RC[-11]*RC[-11]*SIN(2*RADIANS(RC[-12]))) -> -12.673168279480263 | W27: =DEGREES(ACOS(COS(RADIANS(90.833))/(COS(RADIANS(R2C2))*COS(RADIANS(RC[-3])))-TAN(RADIANS(R2C2))*TAN(RADIANS(RC[-3])))) -> 29.065257607051478 | X27: =(720-4*R3C2-RC[-2]+R4C2*60)/1440 -> 1899-12-31T14:08:40.390 | Y27: =(RC[-1]*1440-RC[-2]*4)/1440 -> 1899-12-31T12:12:24.728 | Z27: =(RC[-2]*1440+RC[-3]*4)/1440 -> 1899-12-31T16:04:56.052 | AA27: =8*RC[-4] -> 232.52206085641183 | AB27: =MOD(RC[-23]*1440+RC[-6]+4*R3C2-60*R4C2,1440) -> 711.32683172051975 | AC27: =IF(RC[-1]/4<0,RC[-1]/4+180,RC[-1]/4-180) -> -2.1682920698700627 | AD27: =DEGREES(ACOS(SIN(RADIANS(R2C2))*SIN(RADIANS(RC[-10]))+COS(RADIANS(R2C2))*COS(RADIANS(RC[-10]))*COS(RADIANS(RC[-1])))) -> 88.505708838599546 | AE27: =90-RC[-1] -> 1.4942911614004544 | AF27: =IF(RC[-1]>85,0,IF(RC[-1]>5,58.1/TAN(RADIANS(RC[-1]))-0.07/POWER(TAN(RADIANS(RC[-1])),3)+0.000086/POWER(TAN(RADIANS(RC[-1])),5),IF(RC[-1]>-0.575,1735+RC[-1]*(-518.2+RC[-1]*(103.4+RC[-1]*(-12.79+RC[-1]*0.711))),-20.772/TAN(RADIANS(RC[-1])))))/3600 -> 0.32011402680184259 | AG27: =RC[-2]+RC[-1] -> 1.8144051882022969 | AH27: =IF(RC[-5]>0,MOD(DEGREES(ACOS(((SIN(RADIANS(R2C2))*COS(RADIANS(RC[-4])))-SIN(RADIANS(RC[-14])))/(COS(RADIANS(R2C2))*SIN(RADIANS(RC[-4])))))+180,360),MOD(540-DEGREES(ACOS(((SIN(RADIANS(R2C2))*COS(RADIANS(RC[-4])))-SIN(RADIANS(RC[-14])))/(COS(RADIANS(R2C2))*SIN(RADIANS(RC[-4]))))),360)) -> 177.94301565212379
D28: =R[-1]C+1 -> 2017-01-27T00:00:00.000 | E28: =R5C2 -> 1899-12-31T14:00:00.000 | F28: =RC[-2]+2415018.5+RC[-1]-R4C2/24 -> 2457781.375 | G28: =(RC[-1]-2451545)/36525 -> 0.17074264202600958 | I28: =MOD(280.46646+RC[-2]*(36000.76983 + RC[-2]*0.0003032),360) -> 307.33302458365961 | J28: =357.52911+RC[-3]*(35999.05029 - 0.0001537*RC[-3]) -> 6504.1020624609637 | K28: =0.016708634-RC[-4]*(0.000042037+0.0000001267*RC[-4]) -> 1.6701452797865741E-2 | L28: =SIN(RADIANS(RC[-2]))*(1.914602-RC[-5]*(0.004817+0.000014*RC[-5]))+SIN(RADIANS(2*RC[-2]))*(0.019993-0.000101*RC[-5])+SIN(RADIANS(3*RC[-2]))*0.000289 -> 0.79668492854850226 | M28: =RC[-4]+RC[-1] -> 308.12970951220814 | N28: =RC[-4]+RC[-2] -> 6504.8987473895122 | O28: =(1.000001018*(1-RC[-4]*RC[-4]))/(1+RC[-4]*COS(RADIANS(RC[-1]))) -> 0.9848031907530076 | P28: =RC[-3]-0.00569-0.00478*SIN(RADIANS(125.04-1934.136*RC[-9])) -> 308.12198432564162 | Q28: =23+(26+((21.448-RC[-10]*(46.815+RC[-10]*(0.00059-RC[-10]*0.001813))))/60)/60 -> 23.437070743066045 | R28: =RC[-1]+0.00256*COS(RADIANS(125.04-1934.136*RC[-11])) -> 23.434754376122473 | S28: =DEGREES(ATAN2(COS(RADIANS(RC[-3])),COS(RADIANS(RC[-1]))*SIN(RADIANS(RC[-3])))) -> -49.460689368101207 | T28: =DEGREES(ASIN(SIN(RADIANS(RC[-2]))*SIN(RADIANS(RC[-4])))) -> -18.232481942506954 | U28: =TAN(RADIANS(RC[-3]/2))*TAN(RADIANS(RC[-3]/2)) -> 4.3017398332920592E-2 | V28: =4*DEGREES(RC[-1]*SIN(2*RADIANS(RC[-13]))-2*RC[-11]*SIN(RADIANS(RC[-12]))+4*RC[-11]*RC[-1]*SIN(RADIANS(RC[-12]))*COS(2*RADIANS(RC[-13]))-0.5*RC[-1]*RC[-1]*SIN(4*RADIANS(RC[-13]))-1.25*RC[-11]*RC[-11]*SIN(2*RADIANS(RC[-12]))) -> -12.872930968066074 | W28: =DEGREES(ACOS(COS(RADIANS(90.833))/(COS(RADIANS(R2C2))*COS(RADIANS(RC[-3])))-TAN(RADIANS(R2C2))*TAN(RADIANS(RC[-3])))) -> 30.649992223912125 | X28: =(720-4*R3C2-RC[-2]+R4C2*60)/1440 -> 1899-12-31T14:08:52.376 | Y28: =(RC[-1]*1440-RC[-2]*4)/1440 -> 1899-12-31T12:06:16.378 | Z28: =(RC[-2]*1440+RC[-3]*4)/1440 -> 1899-12-31T16:11:28.374 | AA28: =8*RC[-4] -> 245.199937791297 | AB28: =MOD(RC[-23]*1440+RC[-6]+4*R3C2-60*R4C2,1440) -> 711.12706903193396 | AC28: =IF(RC[-1]/4<0,RC[-1]/4+180,RC[-1]/4-180) -> -2.2182327420165109 | AD28: =DEGREES(ACOS(SIN(RADIANS(R2C2))*SIN(RADIANS(RC[-10]))+COS(RADIANS(R2C2))*COS(RADIANS(RC[-10]))*COS(RADIANS(RC[-1])))) -> 88.246435787348631 | AE28: =90-RC[-1] -> 1.7535642126513693 | AF28: =IF(RC[-1]>85,0,IF(RC[-1]>5,58.1/TAN(RADIANS(RC[-1]))-0.07/POWER(TAN(RADIANS(RC[-1])),3)+0.000086/POWER(TAN(RADIANS(RC[-1])),5),IF(RC[-1]>-0.575,1735+RC[-1]*(-518.2+RC[-1]*(103.4+RC[-1]*(-12.79+RC[-1]*0.711))),-20.772/TAN(RADIANS(RC[-1])))))/3600 -> 0.30055931605959435 | AG28: =RC[-2]+RC[-1] -> 2.0541235287109636 | AH28: =IF(RC[-5]>0,MOD(DEGREES(ACOS(((SIN(RADIANS(R2C2))*COS(RADIANS(RC[-4])))-SIN(RADIANS(RC[-14])))/(COS(RADIANS(R2C2))*SIN(RADIANS(RC[-4])))))+180,360),MOD(540-DEGREES(ACOS(((SIN(RADIANS(R2C2))*COS(RADIANS(RC[-4])))-SIN(RADIANS(RC[-14])))/(COS(RADIANS(R2C2))*SIN(RADIANS(RC[-4]))))),360)) -> 177.8921980055037
D29: =R[-1]C+1 -> 2017-01-28T00:00:00.000 | E29: =R5C2 -> 1899-12-31T14:00:00.000 | F29: =RC[-2]+2415018.5+RC[-1]-R4C2/24 -> 2457782.375 | G29: =(RC[-1]-2451545)/36525 -> 0.17077002053388091 | I29: =MOD(280.46646+RC[-2]*(36000.76983 + RC[-2]*0.0003032),360) -> 308.31867194665847 | J29: =357.52911+RC[-3]*(35999.05029 - 0.0001537*RC[-3]) -> 6505.0876627412499 | K29: =0.016708634-RC[-4]*(0.000042037+0.0000001267*RC[-4]) -> 1.6701451645770748E-2 | L29: =SIN(RADIANS(RC[-2]))*(1.914602-RC[-5]*(0.004817+0.000014*RC[-5]))+SIN(RADIANS(2*RC[-2]))*(0.019993-0.000101*RC[-5])+SIN(RADIANS(3*RC[-2]))*0.000289 -> 0.82707177911967322 | M29: =RC[-4]+RC[-1] -> 309.14574372577812 | N29: =RC[-4]+RC[-2] -> 6505.9147345203692 | O29: =(1.000001018*(1-RC[-4]*RC[-4]))/(1+RC[-4]*COS(RADIANS(RC[-1]))) -> 0.98492647028981239 | P29: =RC[-3]-0.00569-0.00478*SIN(RADIANS(125.04-1934.136*RC[-9])) -> 309.13801454275654 | Q29: =23+(26+((21.448-RC[-10]*(46.815+RC[-10]*(0.00059-RC[-10]*0.001813))))/60)/60 -> 23.437070387031042 | R29: =RC[-1]+0.00256*COS(RADIANS(125.04-1934.136*RC[-11])) -> 23.434755028449949 | S29: =DEGREES(ATAN2(COS(RADIANS(RC[-3])),COS(RADIANS(RC[-1]))*SIN(RADIANS(RC[-3])))) -> -48.428872114994668 | T29: =DEGREES(ASIN(SIN(RADIANS(RC[-2]))*SIN(RADIANS(RC[-4])))) -> -17.967090645938139 | U29: =TAN(RADIANS(RC[-3]/2))*TAN(RADIANS(RC[-3]/2)) -> 4.3017400795876688E-2 | V29: =4*DEGREES(RC[-1]*SIN(2*RADIANS(RC[-13]))-2*RC[-11]*SIN(RADIANS(RC[-12]))+4*RC[-11]*RC[-1]*SIN(RADIANS(RC[-12]))*COS(2*RADIANS(RC[-13]))-0.5*RC[-1]*RC[-1]*SIN(4*RADIANS(RC[-13]))-1.25*RC[-11]*RC[-11]*SIN(2*RADIANS(RC[-12]))) -> -13.059141009865572 | W29: =DEGREES(ACOS(COS(RADIANS(90.833))/(COS(RADIANS(R2C2))*COS(RADIANS(RC[-3])))-TAN(RADIANS(R2C2))*TAN(RADIANS(RC[-3])))) -> 32.190714605015003 | X29: =(720-4*R3C2-RC[-2]+R4C2*60)/1440 -> 1899-12-31T14:09:03.548 | Y29: =(RC[-1]*1440-RC[-2]*4)/1440 -> 1899-12-31T12:00:17.777 | Z29: =(RC[-2]*1440+RC[-3]*4)/1440 -> 1899-12-31T16:17:49.320 | AA29: =8*RC[-4] -> 257.52571684012003 | AB29: =MOD(RC[-23]*1440+RC[-6]+4*R3C2-60*R4C2,1440) -> 710.94085899013442 | AC29: =IF(RC[-1]/4<0,RC[-1]/4+180,RC[-1]/4-180) -> -2.2647852524663961 | AD29: =DEGREES(ACOS(SIN(RADIANS(R2C2))*SIN(RADIANS(RC[-10]))+COS(RADIANS(R2C2))*COS(RADIANS(RC[-10]))*COS(RADIANS(RC[-1])))) -> 87.98166050433106 | AE29: =90-RC[-1] -> 2.0183394956689398 | AF29: =IF(RC[-1]>85,0,IF(RC[-1]>5,58.1/TAN(RADIANS(RC[-1]))-0.07/POWER(TAN(RADIANS(RC[-1])),3)+0.000086/POWER(TAN(RADIANS(RC[-1])),5),IF(RC[-1]>-0.575,1735+RC[-1]*(-518.2+RC[-1]*(103.4+RC[-1]*(-12.79+RC[-1]*0.711))),-20.772/TAN(RADIANS(RC[-1])))))/3600 -> 0.28248746262226099 | AG29: =RC[-2]+RC[-1] -> 2.3008269582912009 | AH29: =IF(RC[-5]>0,MOD(DEGREES(ACOS(((SIN(RADIANS(R2C2))*COS(RADIANS(RC[-4])))-SIN(RADIANS(RC[-14])))/(COS(RADIANS(R2C2))*SIN(RADIANS(RC[-4])))))+180,360),MOD(540-DEGREES(ACOS(((SIN(RADIANS(R2C2))*COS(RADIANS(RC[-4])))-SIN(RADIANS(RC[-14])))/(COS(RADIANS(R2C2))*SIN(RADIANS(RC[-4]))))),360)) -> 177.84437504417394
D30: =R[-1]C+1 -> 2017-01-29T00:00:00.000 | E30: =R5C2 -> 1899-12-31T14:00:00.000 | F30: =RC[-2]+2415018.5+RC[-1]-R4C2/24 -> 2457783.375 | G30: =(RC[-1]-2451545)/36525 -> 0.17079739904175223 | I30: =MOD(280.46646+RC[-2]*(36000.76983 + RC[-2]*0.0003032),360) -> 309.30431930965824 | J30: =357.52911+RC[-3]*(35999.05029 - 0.0001537*RC[-3]) -> 6506.073263021538 | K30: =0.016708634-RC[-4]*(0.000042037+0.0000001267*RC[-4]) -> 1.6701450493675565E-2 | L30: =SIN(RADIANS(RC[-2]))*(1.914602-RC[-5]*(0.004817+0.000014*RC[-5]))+SIN(RADIANS(2*RC[-2]))*(0.019993-0.000101*RC[-5])+SIN(RADIANS(3*RC[-2]))*0.000289 -> 0.85719961569587033 | M30: =RC[-4]+RC[-1] -> 310.16151892535413 | N30: =RC[-4]+RC[-2] -> 6506.9304626372341 | O30: =(1.000001018*(1-RC[-4]*RC[-4]))/(1+RC[-4]*COS(RADIANS(RC[-1]))) -> 0.98505433194472092 | P30: =RC[-3]-0.00569-0.00478*SIN(RADIANS(125.04-1934.136*RC[-9])) -> 310.15378574761934 | Q30: =23+(26+((21.448-RC[-10]*(46.815+RC[-10]*(0.00059-RC[-10]*0.001813))))/60)/60 -> 23.437070030996036 | R30: =RC[-1]+0.00256*COS(RADIANS(125.04-1934.136*RC[-11])) -> 23.434755682755149 | S30: =DEGREES(ATAN2(COS(RADIANS(RC[-3])),COS(RADIANS(RC[-1]))*SIN(RADIANS(RC[-3])))) -> -47.400443287733857 | T30: =DEGREES(ASIN(SIN(RADIANS(RC[-2]))*SIN(RADIANS(RC[-4])))) -> -17.696333290982707 | U30: =TAN(RADIANS(RC[-3]/2))*TAN(RADIANS(RC[-3]/2)) -> 4.3017403266300026E-2 | V30: =4*DEGREES(RC[-1]*SIN(2*RADIANS(RC[-13]))-2*RC[-11]*SIN(RADIANS(RC[-12]))+4*RC[-11]*RC[-1]*SIN(RADIANS(RC[-12]))*COS(2*RADIANS(RC[-13]))-0.5*RC[-1]*RC[-1]*SIN(4*RADIANS(RC[-13]))-1.25*RC[-11]*RC[-11]*SIN(2*RADIANS(RC[-12]))) -> -13.231731027592485 | W30: =DEGREES(ACOS(COS(RADIANS(90.833))/(COS(RADIANS(R2C2))*COS(RADIANS(RC[-3])))-TAN(RADIANS(R2C2))*TAN(RADIANS(RC[-3])))) -> 33.693156744731077 | X30: =(720-4*R3C2-RC[-2]+R4C2*60)/1440 -> 1899-12-31T14:09:13.904 | Y30: =(RC[-1]*1440-RC[-2]*4)/1440 -> 1899-12-31T11:54:27.546 | Z30: =(RC[-2]*1440+RC[-3]*4)/1440 -> 1899-12-31T16:24:00.261 | AA30: =8*RC[-4] -> 269.54525395784862 | AB30: =MOD(RC[-23]*1440+RC[-6]+4*R3C2-60*R4C2,1440) -> 710.76826897240755 | AC30: =IF(RC[-1]/4<0,RC[-1]/4+180,RC[-1]/4-180) -> -2.3079327568981114 | AD30: =DEGREES(ACOS(SIN(RADIANS(R2C2))*SIN(RADIANS(RC[-10]))+COS(RADIANS(R2C2))*COS(RADIANS(RC[-10]))*COS(RADIANS(RC[-1])))) -> 87.71148923292192 | AE30: =90-RC[-1] -> 2.2885107670780798 | AF30: =IF(RC[-1]>85,0,IF(RC[-1]>5,58.1/TAN(RADIANS(RC[-1]))-0.07/POWER(TAN(RADIANS(RC[-1])),3)+0.000086/POWER(TAN(RADIANS(RC[-1])),5),IF(RC[-1]>-0.575,1735+RC[-1]*(-518.2+RC[-1]*(103.4+RC[-1]*(-12.79+RC[-1]*0.711))),-20.772/TAN(RADIANS(RC[-1])))))/3600 -> 0.2657875630873564 | AG30: =RC[-2]+RC[-1] -> 2.5542983301654361 | AH30: =IF(RC[-5]>0,MOD(DEGREES(ACOS(((SIN(RADIANS(R2C2))*COS(RADIANS(RC[-4])))-SIN(RADIANS(RC[-14])))/(COS(RADIANS(R2C2))*SIN(RADIANS(RC[-4])))))+180,360),MOD(540-DEGREES(ACOS(((SIN(RADIANS(R2C2))*COS(RADIANS(RC[-4])))-SIN(RADIANS(RC[-14])))/(COS(RADIANS(R2C2))*SIN(RADIANS(RC[-4]))))),360)) -> 177.79957556079239
D31: =R[-1]C+1 -> 2017-01-30T00:00:00.000 | E31: =R5C2 -> 1899-12-31T14:00:00.000 | F31: =RC[-2]+2415018.5+RC[-1]-R4C2/24 -> 2457784.375 | G31: =(RC[-1]-2451545)/36525 -> 0.17082477754962355 | I31: =MOD(280.46646+RC[-2]*(36000.76983 + RC[-2]*0.0003032),360) -> 310.28996667265892 | J31: =357.52911+RC[-3]*(35999.05029 - 0.0001537*RC[-3]) -> 6507.058863301826 | K31: =0.016708634-RC[-4]*(0.000042037+0.0000001267*RC[-4]) -> 1.6701449341580191E-2 | L31: =SIN(RADIANS(RC[-2]))*(1.914602-RC[-5]*(0.004817+0.000014*RC[-5]))+SIN(RADIANS(2*RC[-2]))*(0.019993-0.000101*RC[-5])+SIN(RADIANS(3*RC[-2]))*0.000289 -> 0.88705913284384041 | M31: =RC[-4]+RC[-1] -> 311.17702580550275 | N31: =RC[-4]+RC[-2] -> 6507.9459224346701 | O31: =(1.000001018*(1-RC[-4]*RC[-4]))/(1+RC[-4]*COS(RADIANS(RC[-1]))) -> 0.98518673435083204 | P31: =RC[-3]-0.00569-0.00478*SIN(RADIANS(125.04-1934.136*RC[-9])) -> 311.16928863479995 | Q31: =23+(26+((21.448-RC[-10]*(46.815+RC[-10]*(0.00059-RC[-10]*0.001813))))/60)/60 -> 23.43706967496103 | R31: =RC[-1]+0.00256*COS(RADIANS(125.04-1934.136*RC[-11])) -> 23.434756339037214 | S31: =DEGREES(ATAN2(COS(RADIANS(RC[-3])),COS(RADIANS(RC[-1]))*SIN(RADIANS(RC[-3])))) -> -46.375411835072832 | T31: =DEGREES(ASIN(SIN(RADIANS(RC[-2]))*SIN(RADIANS(RC[-4])))) -> -17.420320133579651 | U31: =TAN(RADIANS(RC[-3]/2))*TAN(RADIANS(RC[-3]/2)) -> 4.3017405744187401E-2 | V31: =4*DEGREES(RC[-1]*SIN(2*RADIANS(RC[-13]))-2*RC[-11]*SIN(RADIANS(RC[-12]))+4*RC[-11]*RC[-1]*SIN(RADIANS(RC[-12]))*COS(2*RADIANS(RC[-13]))-0.5*RC[-1]*RC[-1]*SIN(4*RADIANS(RC[-13]))-1.25*RC[-11]*RC[-11]*SIN(2*RADIANS(RC[-12]))) -> -13.390651852146073 | W31: =DEGREES(ACOS(COS(RADIANS(90.833))/(COS(RADIANS(R2C2))*COS(RADIANS(RC[-3])))-TAN(RADIANS(R2C2))*TAN(RADIANS(RC[-3])))) -> 35.161939543414576 | X31: =(720-4*R3C2-RC[-2]+R4C2*60)/1440 -> 1899-12-31T14:09:23.439 | Y31: =(RC[-1]*1440-RC[-2]*4)/1440 -> 1899-12-31T11:48:44.574 | Z31: =(RC[-2]*1440+RC[-3]*4)/1440 -> 1899-12-31T16:30:02.305 | AA31: =8*RC[-4] -> 281.29551634731661 | AB31: =MOD(RC[-23]*1440+RC[-6]+4*R3C2-60*R4C2,1440) -> 710.60934814785389 | AC31: =IF(RC[-1]/4<0,RC[-1]/4+180,RC[-1]/4-180) -> -2.3476629630365267 | AD31: =DEGREES(ACOS(SIN(RADIANS(R2C2))*SIN(RADIANS(RC[-10]))+COS(RADIANS(R2C2))*COS(RADIANS(RC[-10]))*COS(RADIANS(RC[-1])))) -> 87.436029436792808 | AE31: =90-RC[-1] -> 2.5639705632071923 | AF31: =IF(RC[-1]>85,0,IF(RC[-1]>5,58.1/TAN(RADIANS(RC[-1]))-0.07/POWER(TAN(RADIANS(RC[-1])),3)+0.000086/POWER(TAN(RADIANS(RC[-1])),5),IF(RC[-1]>-0.575,1735+RC[-1]*(-518.2+RC[-1]*(103.4+RC[-1]*(-12.79+RC[-1]*0.711))),-20.772/TAN(RADIANS(RC[-1])))))/3600 -> 0.25034524933957986 | AG31: =RC[-2]+RC[-1] -> 2.8143158125467722 | AH31: =IF(RC[-5]>0,MOD(DEGREES(ACOS(((SIN(RADIANS(R2C2))*COS(RADIANS(RC[-4])))-SIN(RADIANS(RC[-14])))/(COS(RADIANS(R2C2))*SIN(RADIANS(RC[-4])))))+180,360),MOD(540-DEGREES(ACOS(((SIN(RADIANS(R2C2))*COS(RADIANS(RC[-4])))-SIN(RADIANS(RC[-14])))/(COS(RADIANS(R2C2))*SIN(RADIANS(RC[-4]))))),360)) -> 177.75782486775893
D32: =R[-1]C+1 -> 2017-01-31T00:00:00.000 | E32: =R5C2 -> 1899-12-31T14:00:00.000 | F32: =RC[-2]+2415018.5+RC[-1]-R4C2/24 -> 2457785.375 | G32: =(RC[-1]-2451545)/36525 -> 0.17085215605749487 | I32: =MOD(280.46646+RC[-2]*(36000.76983 + RC[-2]*0.0003032),360) -> 311.2756140356596 | J32: =357.52911+RC[-3]*(35999.05029 - 0.0001537*RC[-3]) -> 6508.0444635821123 | K32: =0.016708634-RC[-4]*(0.000042037+0.0000001267*RC[-4]) -> 1.6701448189484627E-2 | L32: =SIN(RADIANS(RC[-2]))*(1.914602-RC[-5]*(0.004817+0.000014*RC[-5]))+SIN(RADIANS(2*RC[-2]))*(0.019993-0.000101*RC[-5])+SIN(RADIANS(3*RC[-2]))*0.000289 -> 0.91664112287947064 | M32: =RC[-4]+RC[-1] -> 312.19225515853907 | N32: =RC[-4]+RC[-2] -> 6508.9611047049921 | O32: =(1.000001018*(1-RC[-4]*RC[-4]))/(1+RC[-4]*COS(RADIANS(RC[-1]))) -> 0.98532363470562867 | P32: =RC[-3]-0.00569-0.00478*SIN(RADIANS(125.04-1934.136*RC[-9])) -> 312.18451399661694 | Q32: =23+(26+((21.448-RC[-10]*(46.815+RC[-10]*(0.00059-RC[-10]*0.001813))))/60)/60 -> 23.437069318926024 | R32: =RC[-1]+0.00256*COS(RADIANS(125.04-1934.136*RC[-11])) -> 23.434756997295281 | S32: =DEGREES(ATAN2(COS(RADIANS(RC[-3])),COS(RADIANS(RC[-1]))*SIN(RADIANS(RC[-3])))) -> -45.353782393145288 | T32: =DEGREES(ASIN(SIN(RADIANS(RC[-2]))*SIN(RADIANS(RC[-4])))) -> -17.139162340463496 | U32: =TAN(RADIANS(RC[-3]/2))*TAN(RADIANS(RC[-3]/2)) -> 4.3017408229535509E-2 | V32: =4*DEGREES(RC[-1]*SIN(2*RADIANS(RC[-13]))-2*RC[-11]*SIN(RADIANS(RC[-12]))+4*RC[-11]*RC[-1]*SIN(RADIANS(RC[-12]))*COS(2*RADIANS(RC[-13]))-0.5*RC[-1]*RC[-1]*SIN(4*RADIANS(RC[-13]))-1.25*RC[-11]*RC[-11]*SIN(2*RADIANS(RC[-12]))) -> -13.535872312670426 | W32: =DEGREES(ACOS(COS(RADIANS(90.833))/(COS(RADIANS(R2C2))*COS(RADIANS(RC[-3])))-TAN(RADIANS(R2C2))*TAN(RADIANS(RC[-3])))) -> 36.60084760271328 | X32: =(720-4*R3C2-RC[-2]+R4C2*60)/1440 -> 1899-12-31T14:09:32.152 | Y32: =(RC[-1]*1440-RC[-2]*4)/1440 -> 1899-12-31T11:43:07.949 | Z32: =(RC[-2]*1440+RC[-3]*4)/1440 -> 1899-12-31T16:35:56.356 | AA32: =8*RC[-4] -> 292.80678082170624 | AB32: =MOD(RC[-23]*1440+RC[-6]+4*R3C2-60*R4C2,1440) -> 710.46412768732955 | AC32: =IF(RC[-1]/4<0,RC[-1]/4+180,RC[-1]/4-180) -> -2.3839680781676122 | AD32: =DEGREES(ACOS(SIN(RADIANS(R2C2))*SIN(RADIANS(RC[-10]))+COS(RADIANS(R2C2))*COS(RADIANS(RC[-10]))*COS(RADIANS(RC[-1])))) -> 87.155389713529416 | AE32: =90-RC[-1] -> 2.8446102864705836 | AF32: =IF(RC[-1]>85,0,IF(RC[-1]>5,58.1/TAN(RADIANS(RC[-1]))-0.07/POWER(TAN(RADIANS(RC[-1])),3)+0.000086/POWER(TAN(RADIANS(RC[-1])),5),IF(RC[-1]>-0.575,1735+RC[-1]*(-518.2+RC[-1]*(103.4+RC[-1]*(-12.79+RC[-1]*0.711))),-20.772/TAN(RADIANS(RC[-1])))))/3600 -> 0.23604709369473584 | AG32: =RC[-2]+RC[-1] -> 3.0806573801653192 | AH32: =IF(RC[-5]>0,MOD(DEGREES(ACOS(((SIN(RADIANS(R2C2))*COS(RADIANS(RC[-4])))-SIN(RADIANS(RC[-14])))/(COS(RADIANS(R2C2))*SIN(RADIANS(RC[-4])))))+180,360),MOD(540-DEGREES(ACOS(((SIN(RADIANS(R2C2))*COS(RADIANS(RC[-4])))-SIN(RADIANS(RC[-14])))/(COS(RADIANS(R2C2))*SIN(RADIANS(RC[-4]))))),360)) -> 177.71914479402562
D33: =R[-1]C+1 -> 2017-02-01T00:00:00.000 | E33: =R5C2 -> 1899-12-31T14:00:00.000 | F33: =RC[-2]+2415018.5+RC[-1]-R4C2/24 -> 2457786.375 | G33: =(RC[-1]-2451545)/36525 -> 0.1708795345653662 | I33: =MOD(280.46646+RC[-2]*(36000.76983 + RC[-2]*0.0003032),360) -> 312.26126139866119 | J33: =357.52911+RC[-3]*(35999.05029 - 0.0001537*RC[-3]) -> 6509.0300638623994 | K33: =0.016708634-RC[-4]*(0.000042037+0.0000001267*RC[-4]) -> 1.6701447037388874E-2 | L33: =SIN(RADIANS(RC[-2]))*(1.914602-RC[-5]*(0.004817+0.000014*RC[-5]))+SIN(RADIANS(2*RC[-2]))*(0.019993-0.000101*RC[-5])+SIN(RADIANS(3*RC[-2]))*0.000289 -> 0.9459364790423791 | M33: =RC[-4]+RC[-1] -> 313.20719787770355 | N33: =RC[-4]+RC[-2] -> 6509.9760003414422 | O33: =(1.000001018*(1-RC[-4]*RC[-4]))/(1+RC[-4]*COS(RADIANS(RC[-1]))) -> 0.98546498878826871 | P33: =RC[-3]-0.00569-0.00478*SIN(RADIANS(125.04-1934.136*RC[-9])) -> 313.19945272631412 | Q33: =23+(26+((21.448-RC[-10]*(46.815+RC[-10]*(0.00059-RC[-10]*0.001813))))/60)/60 -> 23.437068962891018 | R33: =RC[-1]+0.00256*COS(RADIANS(125.04-1934.136*RC[-11])) -> 23.434757657528479 | S33: =DEGREES(ATAN2(COS(RADIANS(RC[-3])),COS(RADIANS(RC[-1]))*SIN(RADIANS(RC[-3])))) -> -44.33555537124856 | T33: =DEGREES(ASIN(SIN(RADIANS(RC[-2]))*SIN(RADIANS(RC[-4])))) -> -16.852971897071654 | U33: =TAN(RADIANS(RC[-3]/2))*TAN(RADIANS(RC[-3]/2)) -> 4.3017410722341089E-2 | V33: =4*DEGREES(RC[-1]*SIN(2*RADIANS(RC[-13]))-2*RC[-11]*SIN(RADIANS(RC[-12]))+4*RC[-11]*RC[-1]*SIN(RADIANS(RC[-12]))*COS(2*RADIANS(RC[-13]))-0.5*RC[-1]*RC[-1]*SIN(4*RADIANS(RC[-13]))-1.25*RC[-11]*RC[-11]*SIN(2*RADIANS(RC[-12]))) -> -13.667378995681204 | W33: =DEGREES(ACOS(COS(RADIANS(90.833))/(COS(RADIANS(R2C2))*COS(RADIANS(RC[-3])))-TAN(RADIANS(R2C2))*TAN(RADIANS(RC[-3])))) -> 38.013023423044451 | X33: =(720-4*R3C2-RC[-2]+R4C2*60)/1440 -> 1899-12-31T14:09:40.043 | Y33: =(RC[-1]*1440-RC[-2]*4)/1440 -> 1899-12-31T11:37:36.917 | Z33: =(RC[-2]*1440+RC[-3]*4)/1440 -> 1899-12-31T16:41:43.168 | AA33: =8*RC[-4] -> 304.10418738435561 | AB33: =MOD(RC[-23]*1440+RC[-6]+4*R3C2-60*R4C2,1440) -> 710.33262100431875 | AC33: =IF(RC[-1]/4<0,RC[-1]/4+180,RC[-1]/4-180) -> -2.4168447489203118 | AD33: =DEGREES(ACOS(SIN(RADIANS(R2C2))*SIN(RADIANS(RC[-10]))+COS(RADIANS(R2C2))*COS(RADIANS(RC[-10]))*COS(RADIANS(RC[-1])))) -> 86.869679709889482 | AE33: =90-RC[-1] -> 3.130320290110518 | AF33: =IF(RC[-1]>85,0,IF(RC[-1]>5,58.1/TAN(RADIANS(RC[-1]))-0.07/POWER(TAN(RADIANS(RC[-1])),3)+0.000086/POWER(TAN(RADIANS(RC[-1])),5),IF(RC[-1]>-0.575,1735+RC[-1]*(-518.2+RC[-1]*(103.4+RC[-1]*(-12.79+RC[-1]*0.711))),-20.772/TAN(RADIANS(RC[-1])))))/3600 -> 0.22278534102717612 | AG33: =RC[-2]+RC[-1] -> 3.3531056311376943 | AH33: =IF(RC[-5]>0,MOD(DEGREES(ACOS(((SIN(RADIANS(R2C2))*COS(RADIANS(RC[-4])))-SIN(RADIANS(RC[-14])))/(COS(RADIANS(R2C2))*SIN(RADIANS(RC[-4])))))+180,360),MOD(540-DEGREES(ACOS(((SIN(RADIANS(R2C2))*COS(RADIANS(RC[-4])))-SIN(RADIANS(RC[-14])))/(COS(RADIANS(R2C2))*SIN(RADIANS(RC[-4]))))),360)) -> 177.68355368763014
D34: =R[-1]C+1 -> 2017-02-02T00:00:00.000 | E34: =R5C2 -> 1899-12-31T14:00:00.000 | F34: =RC[-2]+2415018.5+RC[-1]-R4C2/24 -> 2457787.375 | G34: =(RC[-1]-2451545)/36525 -> 0.17090691307323752 | I34: =MOD(280.46646+RC[-2]*(36000.76983 + RC[-2]*0.0003032),360) -> 313.24690876166278 | J34: =357.52911+RC[-3]*(35999.05029 - 0.0001537*RC[-3]) -> 6510.0156641426865 | K34: =0.016708634-RC[-4]*(0.000042037+0.0000001267*RC[-4]) -> 1.6701445885292928E-2 | L34: =SIN(RADIANS(RC[-2]))*(1.914602-RC[-5]*(0.004817+0.000014*RC[-5]))+SIN(RADIANS(2*RC[-2]))*(0.019993-0.000101*RC[-5])+SIN(RADIANS(3*RC[-2]))*0.000289 -> 0.97493619861538516 | M34: =RC[-4]+RC[-1] -> 314.22184496027819 | N34: =RC[-4]+RC[-2] -> 6510.9906003413016 | O34: =(1.000001018*(1-RC[-4]*RC[-4]))/(1+RC[-4]*COS(RADIANS(RC[-1]))) -> 0.98561075097739992 | P34: =RC[-3]-0.00569-0.00478*SIN(RADIANS(125.04-1934.136*RC[-9])) -> 314.21409582117695 | Q34: =23+(26+((21.448-RC[-10]*(46.815+RC[-10]*(0.00059-RC[-10]*0.001813))))/60)/60 -> 23.437068606856013 | R34: =RC[-1]+0.00256*COS(RADIANS(125.04-1934.136*RC[-11])) -> 23.434758319735945 | S34: =DEGREES(ATAN2(COS(RADIANS(RC[-3])),COS(RADIANS(RC[-1]))*SIN(RADIANS(RC[-3])))) -> -43.320727042571768 | T34: =DEGREES(ASIN(SIN(RADIANS(RC[-2]))*SIN(RADIANS(RC[-4])))) -> -16.561861518469073 | U34: =TAN(RADIANS(RC[-3]/2))*TAN(RADIANS(RC[-3]/2)) -> 4.30174132226009E-2 | V34: =4*DEGREES(RC[-1]*SIN(2*RADIANS(RC[-13]))-2*RC[-11]*SIN(RADIANS(RC[-12]))+4*RC[-11]*RC[-1]*SIN(RADIANS(RC[-12]))*COS(2*RADIANS(RC[-13]))-0.5*RC[-1]*RC[-1]*SIN(4*RADIANS(RC[-13]))-1.25*RC[-11]*RC[-11]*SIN(2*RADIANS(RC[-12]))) -> -13.785175974686332 | W34: =DEGREES(ACOS(COS(RADIANS(90.833))/(COS(RADIANS(R2C2))*COS(RADIANS(RC[-3])))-TAN(RADIANS(R2C2))*TAN(RADIANS(RC[-3])))) -> 39.401108020945514 | X34: =(720-4*R3C2-RC[-2]+R4C2*60)/1440 -> 1899-12-31T14:09:47.111 | Y34: =(RC[-1]*1440-RC[-2]*4)/1440 -> 1899-12-31T11:32:10.845 | Z34: =(RC[-2]*1440+RC[-3]*4)/1440 -> 1899-12-31T16:47:23.376 | AA34: =8*RC[-4] -> 315.20886416756412 | AB34: =MOD(RC[-23]*1440+RC[-6]+4*R3C2-60*R4C2,1440) -> 710.21482402531365 | AC34: =IF(RC[-1]/4<0,RC[-1]/4+180,RC[-1]/4-180) -> -2.4462939936715884 | AD34: =DEGREES(ACOS(SIN(RADIANS(R2C2))*SIN(RADIANS(RC[-10]))+COS(RADIANS(R2C2))*COS(RADIANS(RC[-10]))*COS(RADIANS(RC[-1])))) -> 86.579010038803816 | AE34: =90-RC[-1] -> 3.4209899611961845 | AF34: =IF(RC[-1]>85,0,IF(RC[-1]>5,58.1/TAN(RADIANS(RC[-1]))-0.07/POWER(TAN(RADIANS(RC[-1])),3)+0.000086/POWER(TAN(RADIANS(RC[-1])),5),IF(RC[-1]>-0.575,1735+RC[-1]*(-518.2+RC[-1]*(103.4+RC[-1]*(-12.79+RC[-1]*0.711))),-20.772/TAN(RADIANS(RC[-1])))))/3600 -> 0.21046294221657066 | AG34: =RC[-2]+RC[-1] -> 3.6314529034127552 | AH34: =IF(RC[-5]>0,MOD(DEGREES(ACOS(((SIN(RADIANS(R2C2))*COS(RADIANS(RC[-4])))-SIN(RADIANS(RC[-14])))/(COS(RADIANS(R2C2))*SIN(RADIANS(RC[-4])))))+180,360),MOD(540-DEGREES(ACOS(((SIN(RADIANS(R2C2))*COS(RADIANS(RC[-4])))-SIN(RADIANS(RC[-14])))/(COS(RADIANS(R2C2))*SIN(RADIANS(RC[-4]))))),360)) -> 177.65106642390936
D35: =R[-1]C+1 -> 2017-02-03T00:00:00.000 | E35: =R5C2 -> 1899-12-31T14:00:00.000 | F35: =RC[-2]+2415018.5+RC[-1]-R4C2/24 -> 2457788.375 | G35: =(RC[-1]-2451545)/36525 -> 0.17093429158110882 | I35: =MOD(280.46646+RC[-2]*(36000.76983 + RC[-2]*0.0003032),360) -> 314.23255612466346 | J35: =357.52911+RC[-3]*(35999.05029 - 0.0001537*RC[-3]) -> 6511.0012644229719 | K35: =0.016708634-RC[-4]*(0.000042037+0.0000001267*RC[-4]) -> 1.6701444733196794E-2 | L35: =SIN(RADIANS(RC[-2]))*(1.914602-RC[-5]*(0.004817+0.000014*RC[-5]))+SIN(RADIANS(2*RC[-2]))*(0.019993-0.000101*RC[-5])+SIN(RADIANS(3*RC[-2]))*0.000289 -> 1.003631385988055 | M35: =RC[-4]+RC[-1] -> 315.23618751065152 | N35: =RC[-4]+RC[-2] -> 6512.0048958089601 | O35: =(1.000001018*(1-RC[-4]*RC[-4]))/(1+RC[-4]*COS(RADIANS(RC[-1]))) -> 0.98576087426949133 | P35: =RC[-3]-0.00569-0.00478*SIN(RADIANS(125.04-1934.136*RC[-9])) -> 315.22843438559732 | Q35: =23+(26+((21.448-RC[-10]*(46.815+RC[-10]*(0.00059-RC[-10]*0.001813))))/60)/60 -> 23.43706825082101 | R35: =RC[-1]+0.00256*COS(RADIANS(125.04-1934.136*RC[-11])) -> 23.434758983916808 | S35: =DEGREES(ATAN2(COS(RADIANS(RC[-3])),COS(RADIANS(RC[-1]))*SIN(RADIANS(RC[-3])))) -> -42.309289639325101 | T35: =DEGREES(ASIN(SIN(RADIANS(RC[-2]))*SIN(RADIANS(RC[-4])))) -> -16.265944563380948 | U35: =TAN(RADIANS(RC[-3]/2))*TAN(RADIANS(RC[-3]/2)) -> 4.3017415730311627E-2 | V35: =4*DEGREES(RC[-1]*SIN(2*RADIANS(RC[-13]))-2*RC[-11]*SIN(RADIANS(RC[-12]))+4*RC[-11]*RC[-1]*SIN(RADIANS(RC[-12]))*COS(2*RADIANS(RC[-13]))-0.5*RC[-1]*RC[-1]*SIN(4*RADIANS(RC[-13]))-1.25*RC[-11]*RC[-11]*SIN(2*RADIANS(RC[-12]))) -> -13.889284511800893 | W35: =DEGREES(ACOS(COS(RADIANS(90.833))/(COS(RADIANS(R2C2))*COS(RADIANS(RC[-3])))-TAN(RADIANS(R2C2))*TAN(RADIANS(RC[-3])))) -> 40.767344911540562 | X35: =(720-4*R3C2-RC[-2]+R4C2*60)/1440 -> 1899-12-31T14:09:53.357 | Y35: =(RC[-1]*1440-RC[-2]*4)/1440 -> 1899-12-31T11:26:49.194 | Z35: =(RC[-2]*1440+RC[-3]*4)/1440 -> 1899-12-31T16:52:57.520 | AA35: =8*RC[-4] -> 326.13875929232449 | AB35: =MOD(RC[-23]*1440+RC[-6]+4*R3C2-60*R4C2,1440) -> 710.11071548819916 | AC35: =IF(RC[-1]/4<0,RC[-1]/4+180,RC[-1]/4-180) -> -2.4723211279502095 | AD35: =DEGREES(ACOS(SIN(RADIANS(R2C2))*SIN(RADIANS(RC[-10]))+COS(RADIANS(R2C2))*COS(RADIANS(RC[-10]))*COS(RADIANS(RC[-1])))) -> 86.283492198209984 | AE35: =90-RC[-1] -> 3.7165078017900157 | AF35: =IF(RC[-1]>85,0,IF(RC[-1]>5,58.1/TAN(RADIANS(RC[-1]))-0.07/POWER(TAN(RADIANS(RC[-1])),3)+0.000086/POWER(TAN(RADIANS(RC[-1])),5),IF(RC[-1]>-0.575,1735+RC[-1]*(-518.2+RC[-1]*(103.4+RC[-1]*(-12.79+RC[-1]*0.711))),-20.772/TAN(RADIANS(RC[-1])))))/3600 -> 0.19899886087945456 | AG35: =RC[-2]+RC[-1] -> 3.9155066626694701 | AH35: =IF(RC[-5]>0,MOD(DEGREES(ACOS(((SIN(RADIANS(R2C2))*COS(RADIANS(RC[-4])))-SIN(RADIANS(RC[-14])))/(COS(RADIANS(R2C2))*SIN(RADIANS(RC[-4])))))+180,360),MOD(540-DEGREES(ACOS(((SIN(RADIANS(R2C2))*COS(RADIANS(RC[-4])))-SIN(RADIANS(RC[-14])))/(COS(RADIANS(R2C2))*SIN(RADIANS(RC[-4]))))),360)) -> 177.62169441929484
D36: =R[-1]C+1 -> 2017-02-04T00:00:00.000 | E36: =R5C2 -> 1899-12-31T14:00:00.000 | F36: =RC[-2]+2415018.5+RC[-1]-R4C2/24 -> 2457789.375 | G36: =(RC[-1]-2451545)/36525 -> 0.17096167008898014 | I36: =MOD(280.46646+RC[-2]*(36000.76983 + RC[-2]*0.0003032),360) -> 315.21820348766596 | J36: =357.52911+RC[-3]*(35999.05029 - 0.0001537*RC[-3]) -> 6511.9868647032581 | K36: =0.016708634-RC[-4]*(0.000042037+0.0000001267*RC[-4]) -> 1.6701443581100473E-2 | L36: =SIN(RADIANS(RC[-2]))*(1.914602-RC[-5]*(0.004817+0.000014*RC[-5]))+SIN(RADIANS(2*RC[-2]))*(0.019993-0.000101*RC[-5])+SIN(RADIANS(3*RC[-2]))*0.000289 -> 1.0320132556627011 | M36: =RC[-4]+RC[-1] -> 316.25021674332868 | N36: =RC[-4]+RC[-2] -> 6513.0188779589207 | O36: =(1.000001018*(1-RC[-4]*RC[-4]))/(1+RC[-4]*COS(RADIANS(RC[-1]))) -> 0.98591531029766311 | P36: =RC[-3]-0.00569-0.00478*SIN(RADIANS(125.04-1934.136*RC[-9])) -> 316.24245963408379 | Q36: =23+(26+((21.448-RC[-10]*(46.815+RC[-10]*(0.00059-RC[-10]*0.001813))))/60)/60 -> 23.437067894786004 | R36: =RC[-1]+0.00256*COS(RADIANS(125.04-1934.136*RC[-11])) -> 23.434759650070191 | S36: =DEGREES(ATAN2(COS(RADIANS(RC[-3])),COS(RADIANS(RC[-1]))*SIN(RADIANS(RC[-3])))) -> -41.301231451751654 | T36: =DEGREES(ASIN(SIN(RADIANS(RC[-2]))*SIN(RADIANS(RC[-4])))) -> -15.965334951410878 | U36: =TAN(RADIANS(RC[-3]/2))*TAN(RADIANS(RC[-3]/2)) -> 4.3017418245469952E-2 | V36: =4*DEGREES(RC[-1]*SIN(2*RADIANS(RC[-13]))-2*RC[-11]*SIN(RADIANS(RC[-12]))+4*RC[-11]*RC[-1]*SIN(RADIANS(RC[-12]))*COS(2*RADIANS(RC[-13]))-0.5*RC[-1]*RC[-1]*SIN(4*RADIANS(RC[-13]))-1.25*RC[-11]*RC[-11]*SIN(2*RADIANS(RC[-12]))) -> -13.97974273291449 | W36: =DEGREES(ACOS(COS(RADIANS(90.833))/(COS(RADIANS(R2C2))*COS(RADIANS(RC[-3])))-TAN(RADIANS(R2C2))*TAN(RADIANS(RC[-3])))) -> 42.113658423632181 | X36: =(720-4*R3C2-RC[-2]+R4C2*60)/1440 -> 1899-12-31T14:09:58.785 | Y36: =(RC[-1]*1440-RC[-2]*4)/1440 -> 1899-12-31T11:21:31.507 | Z36: =(RC[-2]*1440+RC[-3]*4)/1440 -> 1899-12-31T16:58:26.063 | AA36: =8*RC[-4] -> 336.90926738905745 | AB36: =MOD(RC[-23]*1440+RC[-6]+4*R3C2-60*R4C2,1440) -> 710.02025726708553 | AC36: =IF(RC[-1]/4<0,RC[-1]/4+180,RC[-1]/4-180) -> -2.4949356832286185 | AD36: =DEGREES(ACOS(SIN(RADIANS(R2C2))*SIN(RADIANS(RC[-10]))+COS(RADIANS(R2C2))*COS(RADIANS(RC[-10]))*COS(RADIANS(RC[-1])))) -> 85.983238491801998 | AE36: =90-RC[-1] -> 4.0167615081980017 | AF36: =IF(RC[-1]>85,0,IF(RC[-1]>5,58.1/TAN(RADIANS(RC[-1]))-0.07/POWER(TAN(RADIANS(RC[-1])),3)+0.000086/POWER(TAN(RADIANS(RC[-1])),5),IF(RC[-1]>-0.575,1735+RC[-1]*(-518.2+RC[-1]*(103.4+RC[-1]*(-12.79+RC[-1]*0.711))),-20.772/TAN(RADIANS(RC[-1])))))/3600 -> 0.18833362319654662 | AG36: =RC[-2]+RC[-1] -> 4.2050951313945486 | AH36: =IF(RC[-5]>0,MOD(DEGREES(ACOS(((SIN(RADIANS(R2C2))*COS(RADIANS(RC[-4])))-SIN(RADIANS(RC[-14])))/(COS(RADIANS(R2C2))*SIN(RADIANS(RC[-4])))))+180,360),MOD(540-DEGREES(ACOS(((SIN(RADIANS(R2C2))*COS(RADIANS(RC[-4])))-SIN(RADIANS(RC[-14])))/(COS(RADIANS(R2C2))*SIN(RADIANS(RC[-4]))))),360)) -> 177.59544565055569
D37: =R[-1]C+1 -> 2017-02-05T00:00:00.000 | E37: =R5C2 -> 1899-12-31T14:00:00.000 | F37: =RC[-2]+2415018.5+RC[-1]-R4C2/24 -> 2457790.375 | G37: =(RC[-1]-2451545)/36525 -> 0.17098904859685146 | I37: =MOD(280.46646+RC[-2]*(36000.76983 + RC[-2]*0.0003032),360) -> 316.20385085066937 | J37: =357.52911+RC[-3]*(35999.05029 - 0.0001537*RC[-3]) -> 6512.9724649835443 | K37: =0.016708634-RC[-4]*(0.000042037+0.0000001267*RC[-4]) -> 1.6701442429003958E-2 | L37: =SIN(RADIANS(RC[-2]))*(1.914602-RC[-5]*(0.004817+0.000014*RC[-5]))+SIN(RADIANS(2*RC[-2]))*(0.019993-0.000101*RC[-5])+SIN(RADIANS(3*RC[-2]))*0.000289 -> 1.0600731352010793 | M37: =RC[-4]+RC[-1] -> 317.26392398587046 | N37: =RC[-4]+RC[-2] -> 6514.0325381187458 | O37: =(1.000001018*(1-RC[-4]*RC[-4]))/(1+RC[-4]*COS(RADIANS(RC[-1]))) -> 0.98607400935100564 | P37: =RC[-3]-0.00569-0.00478*SIN(RADIANS(125.04-1934.136*RC[-9])) -> 317.2561628942006 | Q37: =23+(26+((21.448-RC[-10]*(46.815+RC[-10]*(0.00059-RC[-10]*0.001813))))/60)/60 -> 23.437067538750998 | R37: =RC[-1]+0.00256*COS(RADIANS(125.04-1934.136*RC[-11])) -> 23.434760318195231 | S37: =DEGREES(ATAN2(COS(RADIANS(RC[-3])),COS(RADIANS(RC[-1]))*SIN(RADIANS(RC[-3])))) -> -40.296536930534586 | T37: =DEGREES(ASIN(SIN(RADIANS(RC[-2]))*SIN(RADIANS(RC[-4])))) -> -15.660147083510671 | U37: =TAN(RADIANS(RC[-3]/2))*TAN(RADIANS(RC[-3]/2)) -> 4.3017420768072655E-2 | V37: =4*DEGREES(RC[-1]*SIN(2*RADIANS(RC[-13]))-2*RC[-11]*SIN(RADIANS(RC[-12]))+4*RC[-11]*RC[-1]*SIN(RADIANS(RC[-12]))*COS(2*RADIANS(RC[-13]))-0.5*RC[-1]*RC[-1]*SIN(4*RADIANS(RC[-13]))-1.25*RC[-11]*RC[-11]*SIN(2*RADIANS(RC[-12]))) -> -14.05660527802408 | W37: =DEGREES(ACOS(COS(RADIANS(90.833))/(COS(RADIANS(R2C2))*COS(RADIANS(RC[-3])))-TAN(RADIANS(R2C2))*TAN(RADIANS(RC[-3])))) -> 43.441713643004391 | X37: =(720-4*R3C2-RC[-2]+R4C2*60)/1440 -> 1899-12-31T14:10:03.396 | Y37: =(RC[-1]*1440-RC[-2]*4)/1440 -> 1899-12-31T11:16:17.385 | Z37: =(RC[-2]*1440+RC[-3]*4)/1440 -> 1899-12-31T17:03:49.408 | AA37: =8*RC[-4] -> 347.53370914403513 | AB37: =MOD(RC[-23]*1440+RC[-6]+4*R3C2-60*R4C2,1440) -> 709.94339472197589 | AC37: =IF(RC[-1]/4<0,RC[-1]/4+180,RC[-1]/4-180) -> -2.514151319506027 | AD37: =DEGREES(ACOS(SIN(RADIANS(R2C2))*SIN(RADIANS(RC[-10]))+COS(RADIANS(R2C2))*COS(RADIANS(RC[-10]))*COS(RADIANS(RC[-1])))) -> 85.678361951775486 | AE37: =90-RC[-1] -> 4.3216380482245143 | AF37: =IF(RC[-1]>85,0,IF(RC[-1]>5,58.1/TAN(RADIANS(RC[-1]))-0.07/POWER(TAN(RADIANS(RC[-1])),3)+0.000086/POWER(TAN(RADIANS(RC[-1])),5),IF(RC[-1]>-0.575,1735+RC[-1]*(-518.2+RC[-1]*(103.4+RC[-1]*(-12.79+RC[-1]*0.711))),-20.772/TAN(RADIANS(RC[-1])))))/3600 -> 0.17843507871771908 | AG37: =RC[-2]+RC[-1] -> 4.5000731269422332 | AH37: =IF(RC[-5]>0,MOD(DEGREES(ACOS(((SIN(RADIANS(R2C2))*COS(RADIANS(RC[-4])))-SIN(RADIANS(RC[-14])))/(COS(RADIANS(R2C2))*SIN(RADIANS(RC[-4])))))+180,360),MOD(540-DEGREES(ACOS(((SIN(RADIANS(R2C2))*COS(RADIANS(RC[-4])))-SIN(RADIANS(RC[-14])))/(COS(RADIANS(R2C2))*SIN(RADIANS(RC[-4]))))),360)) -> 177.57232467937615
D38: =R[-1]C+1 -> 2017-02-06T00:00:00.000 | E38: =R5C2 -> 1899-12-31T14:00:00.000 | F38: =RC[-2]+2415018.5+RC[-1]-R4C2/24 -> 2457791.375 | G38: =(RC[-1]-2451545)/36525 -> 0.17101642710472278 | I38: =MOD(280.46646+RC[-2]*(36000.76983 + RC[-2]*0.0003032),360) -> 317.18949821367187 | J38: =357.52911+RC[-3]*(35999.05029 - 0.0001537*RC[-3]) -> 6513.9580652638297 | K38: =0.016708634-RC[-4]*(0.000042037+0.0000001267*RC[-4]) -> 1.6701441276907255E-2 | L38: =SIN(RADIANS(RC[-2]))*(1.914602-RC[-5]*(0.004817+0.000014*RC[-5]))+SIN(RADIANS(2*RC[-2]))*(0.019993-0.000101*RC[-5])+SIN(RADIANS(3*RC[-2]))*0.000289 -> 1.0878024681111467 | M38: =RC[-4]+RC[-1] -> 318.277300681783 | N38: =RC[-4]+RC[-2] -> 6515.0458677319411 | O38: =(1.000001018*(1-RC[-4]*RC[-4]))/(1+RC[-4]*COS(RADIANS(RC[-1]))) -> 0.98623692039437549 | P38: =RC[-3]-0.00569-0.00478*SIN(RADIANS(125.04-1934.136*RC[-9])) -> 318.26953560945719 | Q38: =23+(26+((21.448-RC[-10]*(46.815+RC[-10]*(0.00059-RC[-10]*0.001813))))/60)/60 -> 23.437067182715996 | R38: =RC[-1]+0.00256*COS(RADIANS(125.04-1934.136*RC[-11])) -> 23.434760988291046 | S38: =DEGREES(ATAN2(COS(RADIANS(RC[-3])),COS(RADIANS(RC[-1]))*SIN(RADIANS(RC[-3])))) -> -39.295186792091087 | T38: =DEGREES(ASIN(SIN(RADIANS(RC[-2]))*SIN(RADIANS(RC[-4])))) -> -15.350495765742025 | U38: =TAN(RADIANS(RC[-3]/2))*TAN(RADIANS(RC[-3]/2)) -> 4.3017423298116385E-2 | V38: =4*DEGREES(RC[-1]*SIN(2*RADIANS(RC[-13]))-2*RC[-11]*SIN(RADIANS(RC[-12]))+4*RC[-11]*RC[-1]*SIN(RADIANS(RC[-12]))*COS(2*RADIANS(RC[-13]))-0.5*RC[-1]*RC[-1]*SIN(4*RADIANS(RC[-13]))-1.25*RC[-11]*RC[-11]*SIN(2*RADIANS(RC[-12]))) -> -14.119942928396227 | W38: =DEGREES(ACOS(COS(RADIANS(90.833))/(COS(RADIANS(R2C2))*COS(RADIANS(RC[-3])))-TAN(RADIANS(R2C2))*TAN(RADIANS(RC[-3])))) -> 44.752962955217811 | X38: =(720-4*R3C2-RC[-2]+R4C2*60)/1440 -> 1899-12-31T14:10:07.197 | Y38: =(RC[-1]*1440-RC[-2]*4)/1440 -> 1899-12-31T11:11:06.485 | Z38: =(RC[-2]*1440+RC[-3]*4)/1440 -> 1899-12-31T17:09:07.908 | AA38: =8*RC[-4] -> 358.02370364174249 | AB38: =MOD(RC[-23]*1440+RC[-6]+4*R3C2-60*R4C2,1440) -> 709.8800570716038 | AC38: =IF(RC[-1]/4<0,RC[-1]/4+180,RC[-1]/4-180) -> -2.5299857320990498 | AD38: =DEGREES(ACOS(SIN(RADIANS(R2C2))*SIN(RADIANS(RC[-10]))+COS(RADIANS(R2C2))*COS(RADIANS(RC[-10]))*COS(RADIANS(RC[-1])))) -> 85.368976263628468 | AE38: =90-RC[-1] -> 4.6310237363715316 | AF38: =IF(RC[-1]>85,0,IF(RC[-1]>5,58.1/TAN(RADIANS(RC[-1]))-0.07/POWER(TAN(RADIANS(RC[-1])),3)+0.000086/POWER(TAN(RADIANS(RC[-1])),5),IF(RC[-1]>-0.575,1735+RC[-1]*(-518.2+RC[-1]*(103.4+RC[-1]*(-12.79+RC[-1]*0.711))),-20.772/TAN(RADIANS(RC[-1])))))/3600 -> 0.16930433832984351 | AG38: =RC[-2]+RC[-1] -> 4.8003280747013752 | AH38: =IF(RC[-5]>0,MOD(DEGREES(ACOS(((SIN(RADIANS(R2C2))*COS(RADIANS(RC[-4])))-SIN(RADIANS(RC[-14])))/(COS(RADIANS(R2C2))*SIN(RADIANS(RC[-4])))))+180,360),MOD(540-DEGREES(ACOS(((SIN(RADIANS(R2C2))*COS(RADIANS(RC[-4])))-SIN(RADIANS(RC[-14])))/(COS(RADIANS(R2C2))*SIN(RADIANS(RC[-4]))))),360)) -> 177.55233268209736
D39: =R[-1]C+1 -> 2017-02-07T00:00:00.000 | E39: =R5C2 -> 1899-12-31T14:00:00.000 | F39: =RC[-2]+2415018.5+RC[-1]-R4C2/24 -> 2457792.375 | G39: =(RC[-1]-2451545)/36525 -> 0.17104380561259411 | I39: =MOD(280.46646+RC[-2]*(36000.76983 + RC[-2]*0.0003032),360) -> 318.17514557667528 | J39: =357.52911+RC[-3]*(35999.05029 - 0.0001537*RC[-3]) -> 6514.943665544115 | K39: =0.016708634-RC[-4]*(0.000042037+0.0000001267*RC[-4]) -> 1.6701440124810361E-2 | L39: =SIN(RADIANS(RC[-2]))*(1.914602-RC[-5]*(0.004817+0.000014*RC[-5]))+SIN(RADIANS(2*RC[-2]))*(0.019993-0.000101*RC[-5])+SIN(RADIANS(3*RC[-2]))*0.000289 -> 1.1151928166724348 | M39: =RC[-4]+RC[-1] -> 319.29033839334772 | N39: =RC[-4]+RC[-2] -> 6516.0588583607878 | O39: =(1.000001018*(1-RC[-4]*RC[-4]))/(1+RC[-4]*COS(RADIANS(RC[-1]))) -> 0.98640399108865473 | P39: =RC[-3]-0.00569-0.00478*SIN(RADIANS(125.04-1934.136*RC[-9])) -> 319.28256934213846 | Q39: =23+(26+((21.448-RC[-10]*(46.815+RC[-10]*(0.00059-RC[-10]*0.001813))))/60)/60 -> 23.43706682668099 | R39: =RC[-1]+0.00256*COS(RADIANS(125.04-1934.136*RC[-11])) -> 23.434761660356759 | S39: =DEGREES(ATAN2(COS(RADIANS(RC[-3])),COS(RADIANS(RC[-1]))*SIN(RADIANS(RC[-3])))) -> -38.297158126296765 | T39: =DEGREES(ASIN(SIN(RADIANS(RC[-2]))*SIN(RADIANS(RC[-4])))) -> -15.036496136365241 | U39: =TAN(RADIANS(RC[-3]/2))*TAN(RADIANS(RC[-3]/2)) -> 4.3017425835597825E-2 | V39: =4*DEGREES(RC[-1]*SIN(2*RADIANS(RC[-13]))-2*RC[-11]*SIN(RADIANS(RC[-12]))+4*RC[-11]*RC[-1]*SIN(RADIANS(RC[-12]))*COS(2*RADIANS(RC[-13]))-0.5*RC[-1]*RC[-1]*SIN(4*RADIANS(RC[-13]))-1.25*RC[-11]*RC[-11]*SIN(2*RADIANS(RC[-12]))) -> -14.169842212258986 | W39: =DEGREES(ACOS(COS(RADIANS(90.833))/(COS(RADIANS(R2C2))*COS(RADIANS(RC[-3])))-TAN(RADIANS(R2C2))*TAN(RADIANS(RC[-3])))) -> 46.048682648307874 | X39: =(720-4*R3C2-RC[-2]+R4C2*60)/1440 -> 1899-12-31T14:10:10.191 | Y39: =(RC[-1]*1440-RC[-2]*4)/1440 -> 1899-12-31T11:05:58.507 | Z39: =(RC[-2]*1440+RC[-3]*4)/1440 -> 1899-12-31T17:14:21.874 | AA39: =8*RC[-4] -> 368.389461186463 | AB39: =MOD(RC[-23]*1440+RC[-6]+4*R3C2-60*R4C2,1440) -> 709.83015778774097 | AC39: =IF(RC[-1]/4<0,RC[-1]/4+180,RC[-1]/4-180) -> -2.5424605530647568 | AD39: =DEGREES(ACOS(SIN(RADIANS(R2C2))*SIN(RADIANS(RC[-10]))+COS(RADIANS(R2C2))*COS(RADIANS(RC[-10]))*COS(RADIANS(RC[-1])))) -> 85.055195693079554 | AE39: =90-RC[-1] -> 4.9448043069204459 | AF39: =IF(RC[-1]>85,0,IF(RC[-1]>5,58.1/TAN(RADIANS(RC[-1]))-0.07/POWER(TAN(RADIANS(RC[-1])),3)+0.000086/POWER(TAN(RADIANS(RC[-1])),5),IF(RC[-1]>-0.575,1735+RC[-1]*(-518.2+RC[-1]*(103.4+RC[-1]*(-12.79+RC[-1]*0.711))),-20.772/TAN(RADIANS(RC[-1])))))/3600 -> 0.16098185411533519 | AG39: =RC[-2]+RC[-1] -> 5.1057861610357813 | AH39: =IF(RC[-5]>0,MOD(DEGREES(ACOS(((SIN(RADIANS(R2C2))*COS(RADIANS(RC[-4])))-SIN(RADIANS(RC[-14])))/(COS(RADIANS(R2C2))*SIN(RADIANS(RC[-4])))))+180,360),MOD(540-DEGREES(ACOS(((SIN(RADIANS(R2C2))*COS(RADIANS(RC[-4])))-SIN(RADIANS(RC[-14])))/(COS(RADIANS(R2C2))*SIN(RADIANS(RC[-4]))))),360)) -> 177.53546748444842
D40: =R[-1]C+1 -> 2017-02-08T00:00:00.000 | E40: =R5C2 -> 1899-12-31T14:00:00.000 | F40: =RC[-2]+2415018.5+RC[-1]-R4C2/24 -> 2457793.375 | G40: =(RC[-1]-2451545)/36525 -> 0.17107118412046543 | I40: =MOD(280.46646+RC[-2]*(36000.76983 + RC[-2]*0.0003032),360) -> 319.1607929396796 | J40: =357.52911+RC[-3]*(35999.05029 - 0.0001537*RC[-3]) -> 6515.9292658243994 | K40: =0.016708634-RC[-4]*(0.000042037+0.0000001267*RC[-4]) -> 1.6701438972713277E-2 | L40: =SIN(RADIANS(RC[-2]))*(1.914602-RC[-5]*(0.004817+0.000014*RC[-5]))+SIN(RADIANS(2*RC[-2]))*(0.019993-0.000101*RC[-5])+SIN(RADIANS(3*RC[-2]))*0.000289 -> 1.1422358646984412 | M40: =RC[-4]+RC[-1] -> 320.30302880437802 | N40: =RC[-4]+RC[-2] -> 6517.0715016890981 | O40: =(1.000001018*(1-RC[-4]*RC[-4]))/(1+RC[-4]*COS(RADIANS(RC[-1]))) -> 0.98657516781145993 | P40: =RC[-3]-0.00569-0.00478*SIN(RADIANS(125.04-1934.136*RC[-9])) -> 320.2952557760612 | Q40: =23+(26+((21.448-RC[-10]*(46.815+RC[-10]*(0.00059-RC[-10]*0.001813))))/60)/60 -> 23.437066470645988 | R40: =RC[-1]+0.00256*COS(RADIANS(125.04-1934.136*RC[-11])) -> 23.434762334391497 | S40: =DEGREES(ATAN2(COS(RADIANS(RC[-3])),COS(RADIANS(RC[-1]))*SIN(RADIANS(RC[-3])))) -> -37.302424506209128 | T40: =DEGREES(ASIN(SIN(RADIANS(RC[-2]))*SIN(RADIANS(RC[-4])))) -> -14.718263596278547 | U40: =TAN(RADIANS(RC[-3]/2))*TAN(RADIANS(RC[-3]/2)) -> 4.3017428380513666E-2 | V40: =4*DEGREES(RC[-1]*SIN(2*RADIANS(RC[-13]))-2*RC[-11]*SIN(RADIANS(RC[-12]))+4*RC[-11]*RC[-1]*SIN(RADIANS(RC[-12]))*COS(2*RADIANS(RC[-13]))-0.5*RC[-1]*RC[-1]*SIN(4*RADIANS(RC[-13]))-1.25*RC[-11]*RC[-11]*SIN(2*RADIANS(RC[-12]))) -> -14.206404990755448 | W40: =DEGREES(ACOS(COS(RADIANS(90.833))/(COS(RADIANS(R2C2))*COS(RADIANS(RC[-3])))-TAN(RADIANS(R2C2))*TAN(RADIANS(RC[-3])))) -> 47.330002030397303 | X40: =(720-4*R3C2-RC[-2]+R4C2*60)/1440 -> 1899-12-31T14:10:12.384 | Y40: =(RC[-1]*1440-RC[-2]*4)/1440 -> 1899-12-31T11:00:53.184 | Z40: =(RC[-2]*1440+RC[-3]*4)/1440 -> 1899-12-31T17:19:31.585 | AA40: =8*RC[-4] -> 378.64001624317842 | AB40: =MOD(RC[-23]*1440+RC[-6]+4*R3C2-60*R4C2,1440) -> 709.79359500924454 | AC40: =IF(RC[-1]/4<0,RC[-1]/4+180,RC[-1]/4-180) -> -2.5516012476888648 | AD40: =DEGREES(ACOS(SIN(RADIANS(R2C2))*SIN(RADIANS(RC[-10]))+COS(RADIANS(R2C2))*COS(RADIANS(RC[-10]))*COS(RADIANS(RC[-1])))) -> 84.737135015159907 | AE40: =90-RC[-1] -> 5.2628649848400926 | AF40: =IF(RC[-1]>85,0,IF(RC[-1]>5,58.1/TAN(RADIANS(RC[-1]))-0.07/POWER(TAN(RADIANS(RC[-1])),3)+0.000086/POWER(TAN(RADIANS(RC[-1])),5),IF(RC[-1]>-0.575,1735+RC[-1]*(-518.2+RC[-1]*(103.4+RC[-1]*(-12.79+RC[-1]*0.711))),-20.772/TAN(RADIANS(RC[-1])))))/3600 -> 0.15393022855772714 | AG40: =RC[-2]+RC[-1] -> 5.4167952133978199 | AH40: =IF(RC[-5]>0,MOD(DEGREES(ACOS(((SIN(RADIANS(R2C2))*COS(RADIANS(RC[-4])))-SIN(RADIANS(RC[-14])))/(COS(RADIANS(R2C2))*SIN(RADIANS(RC[-4])))))+180,360),MOD(540-DEGREES(ACOS(((SIN(RADIANS(R2C2))*COS(RADIANS(RC[-4])))-SIN(RADIANS(RC[-14])))/(COS(RADIANS(R2C2))*SIN(RADIANS(RC[-4]))))),360)) -> 177.52172360106067
D41: =R[-1]C+1 -> 2017-02-09T00:00:00.000 | E41: =R5C2 -> 1899-12-31T14:00:00.000 | F41: =RC[-2]+2415018.5+RC[-1]-R4C2/24 -> 2457794.375 | G41: =(RC[-1]-2451545)/36525 -> 0.17109856262833675 | I41: =MOD(280.46646+RC[-2]*(36000.76983 + RC[-2]*0.0003032),360) -> 320.14644030268482 | J41: =357.52911+RC[-3]*(35999.05029 - 0.0001537*RC[-3]) -> 6516.9148661046856 | K41: =0.016708634-RC[-4]*(0.000042037+0.0000001267*RC[-4]) -> 1.6701437820616005E-2 | L41: =SIN(RADIANS(RC[-2]))*(1.914602-RC[-5]*(0.004817+0.000014*RC[-5]))+SIN(RADIANS(2*RC[-2]))*(0.019993-0.000101*RC[-5])+SIN(RADIANS(3*RC[-2]))*0.000289 -> 1.1689234202357563 | M41: =RC[-4]+RC[-1] -> 321.31536372292055 | N41: =RC[-4]+RC[-2] -> 6518.0837895249215 | O41: =(1.000001018*(1-RC[-4]*RC[-4]))/(1+RC[-4]*COS(RADIANS(RC[-1]))) -> 0.98675039567828915 | P41: =RC[-3]-0.00569-0.00478*SIN(RADIANS(125.04-1934.136*RC[-9])) -> 321.30758671927543 | Q41: =23+(26+((21.448-RC[-10]*(46.815+RC[-10]*(0.00059-RC[-10]*0.001813))))/60)/60 -> 23.437066114610982 | R41: =RC[-1]+0.00256*COS(RADIANS(125.04-1934.136*RC[-11])) -> 23.434763010394374 | S41: =DEGREES(ATAN2(COS(RADIANS(RC[-3])),COS(RADIANS(RC[-1]))*SIN(RADIANS(RC[-3])))) -> -36.310956099348346 | T41: =DEGREES(ASIN(SIN(RADIANS(RC[-2]))*SIN(RADIANS(RC[-4])))) -> -14.395913742809029 | U41: =TAN(RADIANS(RC[-3]/2))*TAN(RADIANS(RC[-3]/2)) -> 4.3017430932860597E-2 | V41: =4*DEGREES(RC[-1]*SIN(2*RADIANS(RC[-13]))-2*RC[-11]*SIN(RADIANS(RC[-12]))+4*RC[-11]*RC[-1]*SIN(RADIANS(RC[-12]))*COS(2*RADIANS(RC[-13]))-0.5*RC[-1]*RC[-1]*SIN(4*RADIANS(RC[-13]))-1.25*RC[-11]*RC[-11]*SIN(2*RADIANS(RC[-12]))) -> -14.229748025918756 | W41: =DEGREES(ACOS(COS(RADIANS(90.833))/(COS(RADIANS(R2C2))*COS(RADIANS(RC[-3])))-TAN(RADIANS(R2C2))*TAN(RADIANS(RC[-3])))) -> 48.597926834007907 | X41: =(720-4*R3C2-RC[-2]+R4C2*60)/1440 -> 1899-12-31T14:10:13.785 | Y41: =(RC[-1]*1440-RC[-2]*4)/1440 -> 1899-12-31T10:55:50.282 | Z41: =(RC[-2]*1440+RC[-3]*4)/1440 -> 1899-12-31T17:24:37.287 | AA41: =8*RC[-4] -> 388.78341467206326 | AB41: =MOD(RC[-23]*1440+RC[-6]+4*R3C2-60*R4C2,1440) -> 709.77025197408125 | AC41: =IF(RC[-1]/4<0,RC[-1]/4+180,RC[-1]/4-180) -> -2.5574370064796881 | AD41: =DEGREES(ACOS(SIN(RADIANS(R2C2))*SIN(RADIANS(RC[-10]))+COS(RADIANS(R2C2))*COS(RADIANS(RC[-10]))*COS(RADIANS(RC[-1])))) -> 84.414909445518163 | AE41: =90-RC[-1] -> 5.5850905544818374 | AF41: =IF(RC[-1]>85,0,IF(RC[-1]>5,58.1/TAN(RADIANS(RC[-1]))-0.07/POWER(TAN(RADIANS(RC[-1])),3)+0.000086/POWER(TAN(RADIANS(RC[-1])),5),IF(RC[-1]>-0.575,1735+RC[-1]*(-518.2+RC[-1]*(103.4+RC[-1]*(-12.79+RC[-1]*0.711))),-20.772/TAN(RADIANS(RC[-1])))))/3600 -> 0.14691693498932598 | AG41: =RC[-2]+RC[-1] -> 5.7320074894711635 | AH41: =IF(RC[-5]>0,MOD(DEGREES(ACOS(((SIN(RADIANS(R2C2))*COS(RADIANS(RC[-4])))-SIN(RADIANS(RC[-14])))/(COS(RADIANS(R2C2))*SIN(RADIANS(RC[-4])))))+180,360),MOD(540-DEGREES(ACOS(((SIN(RADIANS(R2C2))*COS(RADIANS(RC[-4])))-SIN(RADIANS(RC[-14])))/(COS(RADIANS(R2C2))*SIN(RADIANS(RC[-4]))))),360)) -> 177.51109227957238
D42: =R[-1]C+1 -> 2017-02-10T00:00:00.000 | E42: =R5C2 -> 1899-12-31T14:00:00.000 | F42: =RC[-2]+2415018.5+RC[-1]-R4C2/24 -> 2457795.375 | G42: =(RC[-1]-2451545)/36525 -> 0.17112594113620808 | I42: =MOD(280.46646+RC[-2]*(36000.76983 + RC[-2]*0.0003032),360) -> 321.13208766569005 | J42: =357.52911+RC[-3]*(35999.05029 - 0.0001537*RC[-3]) -> 6517.900466384971 | K42: =0.016708634-RC[-4]*(0.000042037+0.0000001267*RC[-4]) -> 1.6701436668518543E-2 | L42: =SIN(RADIANS(RC[-2]))*(1.914602-RC[-5]*(0.004817+0.000014*RC[-5]))+SIN(RADIANS(2*RC[-2]))*(0.019993-0.000101*RC[-5])+SIN(RADIANS(3*RC[-2]))*0.000289 -> 1.1952474181979287 | M42: =RC[-4]+RC[-1] -> 322.32733508388799 | N42: =RC[-4]+RC[-2] -> 6519.095713803169 | O42: =(1.000001018*(1-RC[-4]*RC[-4]))/(1+RC[-4]*COS(RADIANS(RC[-1]))) -> 0.98692961856409112 | P42: =RC[-3]-0.00569-0.00478*SIN(RADIANS(125.04-1934.136*RC[-9])) -> 322.3195541066973 | Q42: =23+(26+((21.448-RC[-10]*(46.815+RC[-10]*(0.00059-RC[-10]*0.001813))))/60)/60 -> 23.437065758575979 | R42: =RC[-1]+0.00256*COS(RADIANS(125.04-1934.136*RC[-11])) -> 23.434763688364516 | S42: =DEGREES(ATAN2(COS(RADIANS(RC[-3])),COS(RADIANS(RC[-1]))*SIN(RADIANS(RC[-3])))) -> -35.322719780148411 | T42: =DEGREES(ASIN(SIN(RADIANS(RC[-2]))*SIN(RADIANS(RC[-4])))) -> -14.069562306854182 | U42: =TAN(RADIANS(RC[-3]/2))*TAN(RADIANS(RC[-3]/2)) -> 4.3017433492635308E-2 | V42: =4*DEGREES(RC[-1]*SIN(2*RADIANS(RC[-13]))-2*RC[-11]*SIN(RADIANS(RC[-12]))+4*RC[-11]*RC[-1]*SIN(RADIANS(RC[-12]))*COS(2*RADIANS(RC[-13]))-0.5*RC[-1]*RC[-1]*SIN(4*RADIANS(RC[-13]))-1.25*RC[-11]*RC[-11]*SIN(2*RADIANS(RC[-12]))) -> -14.240002532438757 | W42: =DEGREES(ACOS(COS(RADIANS(90.833))/(COS(RADIANS(R2C2))*COS(RADIANS(RC[-3])))-TAN(RADIANS(R2C2))*TAN(RADIANS(RC[-3])))) -> 49.853358205599314 | X42: =(720-4*R3C2-RC[-2]+R4C2*60)/1440 -> 1899-12-31T14:10:14.400 | Y42: =(RC[-1]*1440-RC[-2]*4)/1440 -> 1899-12-31T10:50:49.594 | Z42: =(RC[-2]*1440+RC[-3]*4)/1440 -> 1899-12-31T17:29:39.206 | AA42: =8*RC[-4] -> 398.82686564479451 | AB42: =MOD(RC[-23]*1440+RC[-6]+4*R3C2-60*R4C2,1440) -> 709.75999746756122 | AC42: =IF(RC[-1]/4<0,RC[-1]/4+180,RC[-1]/4-180) -> -2.5600006331096949 | AD42: =DEGREES(ACOS(SIN(RADIANS(R2C2))*SIN(RADIANS(RC[-10]))+COS(RADIANS(R2C2))*COS(RADIANS(RC[-10]))*COS(RADIANS(RC[-1])))) -> 84.088634573980968 | AE42: =90-RC[-1] -> 5.9113654260190316 | AF42: =IF(RC[-1]>85,0,IF(RC[-1]>5,58.1/TAN(RADIANS(RC[-1]))-0.07/POWER(TAN(RADIANS(RC[-1])),3)+0.000086/POWER(TAN(RADIANS(RC[-1])),5),IF(RC[-1]>-0.575,1735+RC[-1]*(-518.2+RC[-1]*(103.4+RC[-1]*(-12.79+RC[-1]*0.711))),-20.772/TAN(RADIANS(RC[-1])))))/3600 -> 0.14036061971984939 | AG42: =RC[-2]+RC[-1] -> 6.0517260457388806 | AH42: =IF(RC[-5]>0,MOD(DEGREES(ACOS(((SIN(RADIANS(R2C2))*COS(RADIANS(RC[-4])))-SIN(RADIANS(RC[-14])))/(COS(RADIANS(R2C2))*SIN(RADIANS(RC[-4])))))+180,360),MOD(540-DEGREES(ACOS(((SIN(RADIANS(R2C2))*COS(RADIANS(RC[-4])))-SIN(RADIANS(RC[-14])))/(COS(RADIANS(R2C2))*SIN(RADIANS(RC[-4]))))),360)) -> 177.50356154907308
D43: =R[-1]C+1 -> 2017-02-11T00:00:00.000 | E43: =R5C2 -> 1899-12-31T14:00:00.000 | F43: =RC[-2]+2415018.5+RC[-1]-R4C2/24 -> 2457796.375 | G43: =(RC[-1]-2451545)/36525 -> 0.1711533196440794 | I43: =MOD(280.46646+RC[-2]*(36000.76983 + RC[-2]*0.0003032),360) -> 322.11773502869619 | J43: =357.52911+RC[-3]*(35999.05029 - 0.0001537*RC[-3]) -> 6518.8860666652545 | K43: =0.016708634-RC[-4]*(0.000042037+0.0000001267*RC[-4]) -> 1.6701435516420889E-2 | L43: =SIN(RADIANS(RC[-2]))*(1.914602-RC[-5]*(0.004817+0.000014*RC[-5]))+SIN(RADIANS(2*RC[-2]))*(0.019993-0.000101*RC[-5])+SIN(RADIANS(3*RC[-2]))*0.000289 -> 1.2211999229341037 | M43: =RC[-4]+RC[-1] -> 323.33893495163028 | N43: =RC[-4]+RC[-2] -> 6520.1072665881884 | O43: =(1.000001018*(1-RC[-4]*RC[-4]))/(1+RC[-4]*COS(RADIANS(RC[-1]))) -> 0.98711277912524609 | P43: =RC[-3]-0.00569-0.00478*SIN(RADIANS(125.04-1934.136*RC[-9])) -> 323.33115000268003 | Q43: =23+(26+((21.448-RC[-10]*(46.815+RC[-10]*(0.00059-RC[-10]*0.001813))))/60)/60 -> 23.437065402540973 | R43: =RC[-1]+0.00256*COS(RADIANS(125.04-1934.136*RC[-11])) -> 23.434764368301028 | S43: =DEGREES(ATAN2(COS(RADIANS(RC[-3])),COS(RADIANS(RC[-1]))*SIN(RADIANS(RC[-3])))) -> -34.337679243194927 | T43: =DEGREES(ASIN(SIN(RADIANS(RC[-2]))*SIN(RADIANS(RC[-4])))) -> -13.739325093355884 | U43: =TAN(RADIANS(RC[-3]/2))*TAN(RADIANS(RC[-3]/2)) -> 4.3017436059834421E-2 | V43: =4*DEGREES(RC[-1]*SIN(2*RADIANS(RC[-13]))-2*RC[-11]*SIN(RADIANS(RC[-12]))+4*RC[-11]*RC[-1]*SIN(RADIANS(RC[-12]))*COS(2*RADIANS(RC[-13]))-0.5*RC[-1]*RC[-1]*SIN(4*RADIANS(RC[-13]))-1.25*RC[-11]*RC[-11]*SIN(2*RADIANS(RC[-12]))) -> -14.237313715005619 | W43: =DEGREES(ACOS(COS(RADIANS(90.833))/(COS(RADIANS(R2C2))*COS(RADIANS(RC[-3])))-TAN(RADIANS(R2C2))*TAN(RADIANS(RC[-3])))) -> 51.097108245492635 | X43: =(720-4*R3C2-RC[-2]+R4C2*60)/1440 -> 1899-12-31T14:10:14.239 | Y43: =(RC[-1]*1440-RC[-2]*4)/1440 -> 1899-12-31T10:45:50.933 | Z43: =(RC[-2]*1440+RC[-3]*4)/1440 -> 1899-12-31T17:34:37.545 | AA43: =8*RC[-4] -> 408.77686596394108 | AB43: =MOD(RC[-23]*1440+RC[-6]+4*R3C2-60*R4C2,1440) -> 709.7626862849944 | AC43: =IF(RC[-1]/4<0,RC[-1]/4+180,RC[-1]/4-180) -> -2.5593284287513995 | AD43: =DEGREES(ACOS(SIN(RADIANS(R2C2))*SIN(RADIANS(RC[-10]))+COS(RADIANS(R2C2))*COS(RADIANS(RC[-10]))*COS(RADIANS(RC[-1])))) -> 83.758426300399478 | AE43: =90-RC[-1] -> 6.2415736996005222 | AF43: =IF(RC[-1]>85,0,IF(RC[-1]>5,58.1/TAN(RADIANS(RC[-1]))-0.07/POWER(TAN(RADIANS(RC[-1])),3)+0.000086/POWER(TAN(RADIANS(RC[-1])),5),IF(RC[-1]>-0.575,1735+RC[-1]*(-518.2+RC[-1]*(103.4+RC[-1]*(-12.79+RC[-1]*0.711))),-20.772/TAN(RADIANS(RC[-1])))))/3600 -> 0.13422704850226153 | AG43: =RC[-2]+RC[-1] -> 6.3758007481027841 | AH43: =IF(RC[-5]>0,MOD(DEGREES(ACOS(((SIN(RADIANS(R2C2))*COS(RADIANS(RC[-4])))-SIN(RADIANS(RC[-14])))/(COS(RADIANS(R2C2))*SIN(RADIANS(RC[-4])))))+180,360),MOD(540-DEGREES(ACOS(((SIN(RADIANS(R2C2))*COS(RADIANS(RC[-4])))-SIN(RADIANS(RC[-14])))/(COS(RADIANS(R2C2))*SIN(RADIANS(RC[-4]))))),360)) -> 177.49911627264885
D44: =R[-1]C+1 -> 2017-02-12T00:00:00.000 | E44: =R5C2 -> 1899-12-31T14:00:00.000 | F44: =RC[-2]+2415018.5+RC[-1]-R4C2/24 -> 2457797.375 | G44: =(RC[-1]-2451545)/36525 -> 0.17118069815195072 | I44: =MOD(280.46646+RC[-2]*(36000.76983 + RC[-2]*0.0003032),360) -> 323.10338239170233 | J44: =357.52911+RC[-3]*(35999.05029 - 0.0001537*RC[-3]) -> 6519.8716669455389 | K44: =0.016708634-RC[-4]*(0.000042037+0.0000001267*RC[-4]) -> 1.6701434364323045E-2 | L44: =SIN(RADIANS(RC[-2]))*(1.914602-RC[-5]*(0.004817+0.000014*RC[-5]))+SIN(RADIANS(2*RC[-2]))*(0.019993-0.000101*RC[-5])+SIN(RADIANS(3*RC[-2]))*0.000289 -> 1.2467731307305936 | M44: =RC[-4]+RC[-1] -> 324.35015552243294 | N44: =RC[-4]+RC[-2] -> 6521.1184400762695 | O44: =(1.000001018*(1-RC[-4]*RC[-4]))/(1+RC[-4]*COS(RADIANS(RC[-1]))) -> 0.98729981882194429 | P44: =RC[-3]-0.00569-0.00478*SIN(RADIANS(125.04-1934.136*RC[-9])) -> 324.34236660351263 | Q44: =23+(26+((21.448-RC[-10]*(46.815+RC[-10]*(0.00059-RC[-10]*0.001813))))/60)/60 -> 23.437065046505971 | R44: =RC[-1]+0.00256*COS(RADIANS(125.04-1934.136*RC[-11])) -> 23.43476505020304 | S44: =DEGREES(ATAN2(COS(RADIANS(RC[-3])),COS(RADIANS(RC[-1]))*SIN(RADIANS(RC[-3])))) -> -33.355795116907736 | T44: =DEGREES(ASIN(SIN(RADIANS(RC[-2]))*SIN(RADIANS(RC[-4])))) -> -13.405317925084349 | U44: =TAN(RADIANS(RC[-3]/2))*TAN(RADIANS(RC[-3]/2)) -> 4.301743863445464E-2 | V44: =4*DEGREES(RC[-1]*SIN(2*RADIANS(RC[-13]))-2*RC[-11]*SIN(RADIANS(RC[-12]))+4*RC[-11]*RC[-1]*SIN(RADIANS(RC[-12]))*COS(2*RADIANS(RC[-13]))-0.5*RC[-1]*RC[-1]*SIN(4*RADIANS(RC[-13]))-1.25*RC[-11]*RC[-11]*SIN(2*RADIANS(RC[-12]))) -> -14.221840293010562 | W44: =DEGREES(ACOS(COS(RADIANS(90.833))/(COS(RADIANS(R2C2))*COS(RADIANS(RC[-3])))-TAN(RADIANS(R2C2))*TAN(RADIANS(RC[-3])))) -> 52.329912824744255 | X44: =(720-4*R3C2-RC[-2]+R4C2*60)/1440 -> 1899-12-31T14:10:13.310 | Y44: =(RC[-1]*1440-RC[-2]*4)/1440 -> 1899-12-31T10:40:54.131 | Z44: =(RC[-2]*1440+RC[-3]*4)/1440 -> 1899-12-31T17:39:32.489 | AA44: =8*RC[-4] -> 418.63930259795404 | AB44: =MOD(RC[-23]*1440+RC[-6]+4*R3C2-60*R4C2,1440) -> 709.77815970698941 | AC44: =IF(RC[-1]/4<0,RC[-1]/4+180,RC[-1]/4-180) -> -2.5554600732526467 | AD44: =DEGREES(ACOS(SIN(RADIANS(R2C2))*SIN(RADIANS(RC[-10]))+COS(RADIANS(R2C2))*COS(RADIANS(RC[-10]))*COS(RADIANS(RC[-1])))) -> 83.424400772811708 | AE44: =90-RC[-1] -> 6.5755992271882917 | AF44: =IF(RC[-1]>85,0,IF(RC[-1]>5,58.1/TAN(RADIANS(RC[-1]))-0.07/POWER(TAN(RADIANS(RC[-1])),3)+0.000086/POWER(TAN(RADIANS(RC[-1])),5),IF(RC[-1]>-0.575,1735+RC[-1]*(-518.2+RC[-1]*(103.4+RC[-1]*(-12.79+RC[-1]*0.711))),-20.772/TAN(RADIANS(RC[-1])))))/3600 -> 0.12848565515868465 | AG44: =RC[-2]+RC[-1] -> 6.7040848823469767 | AH44: =IF(RC[-5]>0,MOD(DEGREES(ACOS(((SIN(RADIANS(R2C2))*COS(RADIANS(RC[-4])))-SIN(RADIANS(RC[-14])))/(COS(RADIANS(R2C2))*SIN(RADIANS(RC[-4])))))+180,360),MOD(540-DEGREES(ACOS(((SIN(RADIANS(R2C2))*COS(RADIANS(RC[-4])))-SIN(RADIANS(RC[-14])))/(COS(RADIANS(R2C2))*SIN(RADIANS(RC[-4]))))),360)) -> 177.49773820378402
D45: =R[-1]C+1 -> 2017-02-13T00:00:00.000 | E45: =R5C2 -> 1899-12-31T14:00:00.000 | F45: =RC[-2]+2415018.5+RC[-1]-R4C2/24 -> 2457798.375 | G45: =(RC[-1]-2451545)/36525 -> 0.17120807665982204 | I45: =MOD(280.46646+RC[-2]*(36000.76983 + RC[-2]*0.0003032),360) -> 324.08902975470846 | J45: =357.52911+RC[-3]*(35999.05029 - 0.0001537*RC[-3]) -> 6520.8572672258233 | K45: =0.016708634-RC[-4]*(0.000042037+0.0000001267*RC[-4]) -> 1.6701433212225014E-2 | L45: =SIN(RADIANS(RC[-2]))*(1.914602-RC[-5]*(0.004817+0.000014*RC[-5]))+SIN(RADIANS(2*RC[-2]))*(0.019993-0.000101*RC[-5])+SIN(RADIANS(3*RC[-2]))*0.000289 -> 1.2719593722450062 | M45: =RC[-4]+RC[-1] -> 325.36098912695348 | N45: =RC[-4]+RC[-2] -> 6522.1292265980683 | O45: =(1.000001018*(1-RC[-4]*RC[-4]))/(1+RC[-4]*COS(RADIANS(RC[-1]))) -> 0.98749067794094192 | P45: =RC[-3]-0.00569-0.00478*SIN(RADIANS(125.04-1934.136*RC[-9])) -> 325.35319623985589 | Q45: =23+(26+((21.448-RC[-10]*(46.815+RC[-10]*(0.00059-RC[-10]*0.001813))))/60)/60 -> 23.437064690470969 | R45: =RC[-1]+0.00256*COS(RADIANS(125.04-1934.136*RC[-11])) -> 23.434765734069657 | S45: =DEGREES(ATAN2(COS(RADIANS(RC[-3])),COS(RADIANS(RC[-1]))*SIN(RADIANS(RC[-3])))) -> -32.377025077329868 | T45: =DEGREES(ASIN(SIN(RADIANS(RC[-2]))*SIN(RADIANS(RC[-4])))) -> -13.06765658969324 | U45: =TAN(RADIANS(RC[-3]/2))*TAN(RADIANS(RC[-3]/2)) -> 4.3017441216492598E-2 | V45: =4*DEGREES(RC[-1]*SIN(2*RADIANS(RC[-13]))-2*RC[-11]*SIN(RADIANS(RC[-12]))+4*RC[-11]*RC[-1]*SIN(RADIANS(RC[-12]))*COS(2*RADIANS(RC[-13]))-0.5*RC[-1]*RC[-1]*SIN(4*RADIANS(RC[-13]))-1.25*RC[-11]*RC[-11]*SIN(2*RADIANS(RC[-12]))) -> -14.193754014379909 | W45: =DEGREES(ACOS(COS(RADIANS(90.833))/(COS(RADIANS(R2C2))*COS(RADIANS(RC[-3])))-TAN(RADIANS(R2C2))*TAN(RADIANS(RC[-3])))) -> 53.552442232402448 | X45: =(720-4*R3C2-RC[-2]+R4C2*60)/1440 -> 1899-12-31T14:10:11.625 | Y45: =(RC[-1]*1440-RC[-2]*4)/1440 -> 1899-12-31T10:35:59.039 | Z45: =(RC[-2]*1440+RC[-3]*4)/1440 -> 1899-12-31T17:44:24.211 | AA45: =8*RC[-4] -> 428.41953785921959 | AB45: =MOD(RC[-23]*1440+RC[-6]+4*R3C2-60*R4C2,1440) -> 709.80624598562008 | AC45: =IF(RC[-1]/4<0,RC[-1]/4+180,RC[-1]/4-180) -> -2.5484385035949799 | AD45: =DEGREES(ACOS(SIN(RADIANS(R2C2))*SIN(RADIANS(RC[-10]))+COS(RADIANS(R2C2))*COS(RADIANS(RC[-10]))*COS(RADIANS(RC[-1])))) -> 83.086674327938695 | AE45: =90-RC[-1] -> 6.9133256720613048 | AF45: =IF(RC[-1]>85,0,IF(RC[-1]>5,58.1/TAN(RADIANS(RC[-1]))-0.07/POWER(TAN(RADIANS(RC[-1])),3)+0.000086/POWER(TAN(RADIANS(RC[-1])),5),IF(RC[-1]>-0.575,1735+RC[-1]*(-518.2+RC[-1]*(103.4+RC[-1]*(-12.79+RC[-1]*0.711))),-20.772/TAN(RADIANS(RC[-1])))))/3600 -> 0.12310829035179453 | AG45: =RC[-2]+RC[-1] -> 7.0364339624130992 | AH45: =IF(RC[-5]>0,MOD(DEGREES(ACOS(((SIN(RADIANS(R2C2))*COS(RADIANS(RC[-4])))-SIN(RADIANS(RC[-14])))/(COS(RADIANS(R2C2))*SIN(RADIANS(RC[-4])))))+180,360),MOD(540-DEGREES(ACOS(((SIN(RADIANS(R2C2))*COS(RADIANS(RC[-4])))-SIN(RADIANS(RC[-14])))/(COS(RADIANS(R2C2))*SIN(RADIANS(RC[-4]))))),360)) -> 177.49940604631968
D46: =R[-1]C+1 -> 2017-02-14T00:00:00.000 | E46: =R5C2 -> 1899-12-31T14:00:00.000 | F46: =RC[-2]+2415018.5+RC[-1]-R4C2/24 -> 2457799.375 | G46: =(RC[-1]-2451545)/36525 -> 0.17123545516769337 | I46: =MOD(280.46646+RC[-2]*(36000.76983 + RC[-2]*0.0003032),360) -> 325.07467711771642 | J46: =357.52911+RC[-3]*(35999.05029 - 0.0001537*RC[-3]) -> 6521.8428675061068 | K46: =0.016708634-RC[-4]*(0.000042037+0.0000001267*RC[-4]) -> 1.6701432060126791E-2 | L46: =SIN(RADIANS(RC[-2]))*(1.914602-RC[-5]*(0.004817+0.000014*RC[-5]))+SIN(RADIANS(2*RC[-2]))*(0.019993-0.000101*RC[-5])+SIN(RADIANS(3*RC[-2]))*0.000289 -> 1.2967511148719437 | M46: =RC[-4]+RC[-1] -> 326.37142823258836 | N46: =RC[-4]+RC[-2] -> 6523.1396186209786 | O46: =(1.000001018*(1-RC[-4]*RC[-4]))/(1+RC[-4]*COS(RADIANS(RC[-1]))) -> 0.98768529561869145 | P46: =RC[-3]-0.00569-0.00478*SIN(RADIANS(125.04-1934.136*RC[-9])) -> 326.36363137910979 | Q46: =23+(26+((21.448-RC[-10]*(46.815+RC[-10]*(0.00059-RC[-10]*0.001813))))/60)/60 -> 23.437064334435966 | R46: =RC[-1]+0.00256*COS(RADIANS(125.04-1934.136*RC[-11])) -> 23.43476641989999 | S46: =DEGREES(ATAN2(COS(RADIANS(RC[-3])),COS(RADIANS(RC[-1]))*SIN(RADIANS(RC[-3])))) -> -31.401323961724493 | T46: =DEGREES(ASIN(SIN(RADIANS(RC[-2]))*SIN(RADIANS(RC[-4])))) -> -12.726456790004274 | U46: =TAN(RADIANS(RC[-3]/2))*TAN(RADIANS(RC[-3]/2)) -> 4.3017443805944938E-2 | V46: =4*DEGREES(RC[-1]*SIN(2*RADIANS(RC[-13]))-2*RC[-11]*SIN(RADIANS(RC[-12]))+4*RC[-11]*RC[-1]*SIN(RADIANS(RC[-12]))*COS(2*RADIANS(RC[-13]))-0.5*RC[-1]*RC[-1]*SIN(4*RADIANS(RC[-13]))-1.25*RC[-11]*RC[-11]*SIN(2*RADIANS(RC[-12]))) -> -14.153239160303769 | W46: =DEGREES(ACOS(COS(RADIANS(90.833))/(COS(RADIANS(R2C2))*COS(RADIANS(RC[-3])))-TAN(RADIANS(R2C2))*TAN(RADIANS(RC[-3])))) -> 54.765310079228826 | X46: =(720-4*R3C2-RC[-2]+R4C2*60)/1440 -> 1899-12-31T14:10:09.194 | Y46: =(RC[-1]*1440-RC[-2]*4)/1440 -> 1899-12-31T10:31:05.520 | Z46: =(RC[-2]*1440+RC[-3]*4)/1440 -> 1899-12-31T17:49:12.869 | AA46: =8*RC[-4] -> 438.12248063383061 | AB46: =MOD(RC[-23]*1440+RC[-6]+4*R3C2-60*R4C2,1440) -> 709.84676083969623 | AC46: =IF(RC[-1]/4<0,RC[-1]/4+180,RC[-1]/4-180) -> -2.5383097900759424 | AD46: =DEGREES(ACOS(SIN(RADIANS(R2C2))*SIN(RADIANS(RC[-10]))+COS(RADIANS(R2C2))*COS(RADIANS(RC[-10]))*COS(RADIANS(RC[-1])))) -> 82.745363434032086 | AE46: =90-RC[-1] -> 7.254636565967914 | AF46: =IF(RC[-1]>85,0,IF(RC[-1]>5,58.1/TAN(RADIANS(RC[-1]))-0.07/POWER(TAN(RADIANS(RC[-1])),3)+0.000086/POWER(TAN(RADIANS(RC[-1])),5),IF(RC[-1]>-0.575,1735+RC[-1]*(-518.2+RC[-1]*(103.4+RC[-1]*(-12.79+RC[-1]*0.711))),-20.772/TAN(RADIANS(RC[-1])))))/3600 -> 0.11806870677070683 | AG46: =RC[-2]+RC[-1] -> 7.3727052727386209 | AH46: =IF(RC[-5]>0,MOD(DEGREES(ACOS(((SIN(RADIANS(R2C2))*COS(RADIANS(RC[-4])))-SIN(RADIANS(RC[-14])))/(COS(RADIANS(R2C2))*SIN(RADIANS(RC[-4])))))+180,360),MOD(540-DEGREES(ACOS(((SIN(RADIANS(R2C2))*COS(RADIANS(RC[-4])))-SIN(RADIANS(RC[-14])))/(COS(RADIANS(R2C2))*SIN(RADIANS(RC[-4]))))),360)) -> 177.50409551771645
D47: =R[-1]C+1 -> 2017-02-15T00:00:00.000 | E47: =R5C2 -> 1899-12-31T14:00:00.000 | F47: =RC[-2]+2415018.5+RC[-1]-R4C2/24 -> 2457800.375 | G47: =(RC[-1]-2451545)/36525 -> 0.17126283367556469 | I47: =MOD(280.46646+RC[-2]*(36000.76983 + RC[-2]*0.0003032),360) -> 326.06032448072347 | J47: =357.52911+RC[-3]*(35999.05029 - 0.0001537*RC[-3]) -> 6522.8284677863912 | K47: =0.016708634-RC[-4]*(0.000042037+0.0000001267*RC[-4]) -> 1.6701430908028378E-2 | L47: =SIN(RADIANS(RC[-2]))*(1.914602-RC[-5]*(0.004817+0.000014*RC[-5]))+SIN(RADIANS(2*RC[-2]))*(0.019993-0.000101*RC[-5])+SIN(RADIANS(3*RC[-2]))*0.000289 -> 1.3211409650397727 | M47: =RC[-4]+RC[-1] -> 327.38146544576324 | N47: =RC[-4]+RC[-2] -> 6524.1496087514306 | O47: =(1.000001018*(1-RC[-4]*RC[-4]))/(1+RC[-4]*COS(RADIANS(RC[-1]))) -> 0.98788360986482382 | P47: =RC[-3]-0.00569-0.00478*SIN(RADIANS(125.04-1934.136*RC[-9])) -> 327.37366462770331 | Q47: =23+(26+((21.448-RC[-10]*(46.815+RC[-10]*(0.00059-RC[-10]*0.001813))))/60)/60 -> 23.43706397840096 | R47: =RC[-1]+0.00256*COS(RADIANS(125.04-1934.136*RC[-11])) -> 23.434767107693148 | S47: =DEGREES(ATAN2(COS(RADIANS(RC[-3])),COS(RADIANS(RC[-1]))*SIN(RADIANS(RC[-3])))) -> -30.428643881708361 | T47: =DEGREES(ASIN(SIN(RADIANS(RC[-2]))*SIN(RADIANS(RC[-4])))) -> -12.381834097472581 | U47: =TAN(RADIANS(RC[-3]/2))*TAN(RADIANS(RC[-3]/2)) -> 4.3017446402808295E-2 | V47: =4*DEGREES(RC[-1]*SIN(2*RADIANS(RC[-13]))-2*RC[-11]*SIN(RADIANS(RC[-12]))+4*RC[-11]*RC[-1]*SIN(RADIANS(RC[-12]))*COS(2*RADIANS(RC[-13]))-0.5*RC[-1]*RC[-1]*SIN(4*RADIANS(RC[-13]))-1.25*RC[-11]*RC[-11]*SIN(2*RADIANS(RC[-12]))) -> -14.100492042600633 | W47: =DEGREES(ACOS(COS(RADIANS(90.833))/(COS(RADIANS(R2C2))*COS(RADIANS(RC[-3])))-TAN(RADIANS(R2C2))*TAN(RADIANS(RC[-3])))) -> 55.969080789204646 | X47: =(720-4*R3C2-RC[-2]+R4C2*60)/1440 -> 1899-12-31T14:10:06.030 | Y47: =(RC[-1]*1440-RC[-2]*4)/1440 -> 1899-12-31T10:26:13.450 | Z47: =(RC[-2]*1440+RC[-3]*4)/1440 -> 1899-12-31T17:53:58.609 | AA47: =8*RC[-4] -> 447.75264631363717 | AB47: =MOD(RC[-23]*1440+RC[-6]+4*R3C2-60*R4C2,1440) -> 709.89950795739935 | AC47: =IF(RC[-1]/4<0,RC[-1]/4+180,RC[-1]/4-180) -> -2.5251230106501623 | AD47: =DEGREES(ACOS(SIN(RADIANS(R2C2))*SIN(RADIANS(RC[-10]))+COS(RADIANS(R2C2))*COS(RADIANS(RC[-10]))*COS(RADIANS(RC[-1])))) -> 82.400584636086791 | AE47: =90-RC[-1] -> 7.5994153639132094 | AF47: =IF(RC[-1]>85,0,IF(RC[-1]>5,58.1/TAN(RADIANS(RC[-1]))-0.07/POWER(TAN(RADIANS(RC[-1])),3)+0.000086/POWER(TAN(RADIANS(RC[-1])),5),IF(RC[-1]>-0.575,1735+RC[-1]*(-518.2+RC[-1]*(103.4+RC[-1]*(-12.79+RC[-1]*0.711))),-20.772/TAN(RADIANS(RC[-1])))))/3600 -> 0.11334235834323765 | AG47: =RC[-2]+RC[-1] -> 7.7127577222564474 | AH47: =IF(RC[-5]>0,MOD(DEGREES(ACOS(((SIN(RADIANS(R2C2))*COS(RADIANS(RC[-4])))-SIN(RADIANS(RC[-14])))/(COS(RADIANS(R2C2))*SIN(RADIANS(RC[-4])))))+180,360),MOD(540-DEGREES(ACOS(((SIN(RADIANS(R2C2))*COS(RADIANS(RC[-4])))-SIN(RADIANS(RC[-14])))/(COS(RADIANS(R2C2))*SIN(RADIANS(RC[-4]))))),360)) -> 177.51177941532183
D48: =R[-1]C+1 -> 2017-02-16T00:00:00.000 | E48: =R5C2 -> 1899-12-31T14:00:00.000 | F48: =RC[-2]+2415018.5+RC[-1]-R4C2/24 -> 2457801.375 | G48: =(RC[-1]-2451545)/36525 -> 0.17129021218343601 | I48: =MOD(280.46646+RC[-2]*(36000.76983 + RC[-2]*0.0003032),360) -> 327.04597184373051 | J48: =357.52911+RC[-3]*(35999.05029 - 0.0001537*RC[-3]) -> 6523.8140680666747 | K48: =0.016708634-RC[-4]*(0.000042037+0.0000001267*RC[-4]) -> 1.6701429755929774E-2 | L48: =SIN(RADIANS(RC[-2]))*(1.914602-RC[-5]*(0.004817+0.000014*RC[-5]))+SIN(RADIANS(2*RC[-2]))*(0.019993-0.000101*RC[-5])+SIN(RADIANS(3*RC[-2]))*0.000289 -> 1.3451216704373823 | M48: =RC[-4]+RC[-1] -> 328.39109351416789 | N48: =RC[-4]+RC[-2] -> 6525.1591897371118 | O48: =(1.000001018*(1-RC[-4]*RC[-4]))/(1+RC[-4]*COS(RADIANS(RC[-1]))) -> 0.98808555758596872 | P48: =RC[-3]-0.00569-0.00478*SIN(RADIANS(125.04-1934.136*RC[-9])) -> 328.38328873332961 | Q48: =23+(26+((21.448-RC[-10]*(46.815+RC[-10]*(0.00059-RC[-10]*0.001813))))/60)/60 -> 23.437063622365958 | R48: =RC[-1]+0.00256*COS(RADIANS(125.04-1934.136*RC[-11])) -> 23.434767797448245 | S48: =DEGREES(ATAN2(COS(RADIANS(RC[-3])),COS(RADIANS(RC[-1]))*SIN(RADIANS(RC[-3])))) -> -29.458934335643214 | T48: =DEGREES(ASIN(SIN(RADIANS(RC[-2]))*SIN(RADIANS(RC[-4])))) -> -12.033903908766627 | U48: =TAN(RADIANS(RC[-3]/2))*TAN(RADIANS(RC[-3]/2)) -> 4.3017449007079316E-2 | V48: =4*DEGREES(RC[-1]*SIN(2*RADIANS(RC[-13]))-2*RC[-11]*SIN(RADIANS(RC[-12]))+4*RC[-11]*RC[-1]*SIN(RADIANS(RC[-12]))*COS(2*RADIANS(RC[-13]))-0.5*RC[-1]*RC[-1]*SIN(4*RADIANS(RC[-13]))-1.25*RC[-11]*RC[-11]*SIN(2*RADIANS(RC[-12]))) -> -14.035720495423536 | W48: =DEGREES(ACOS(COS(RADIANS(90.833))/(COS(RADIANS(R2C2))*COS(RADIANS(RC[-3])))-TAN(RADIANS(R2C2))*TAN(RADIANS(RC[-3])))) -> 57.164275938874091 | X48: =(720-4*R3C2-RC[-2]+R4C2*60)/1440 -> 1899-12-31T14:10:02.143 | Y48: =(RC[-1]*1440-RC[-2]*4)/1440 -> 1899-12-31T10:21:22.717 | Z48: =(RC[-2]*1440+RC[-3]*4)/1440 -> 1899-12-31T17:58:41.569 | AA48: =8*RC[-4] -> 457.31420751099273 | AB48: =MOD(RC[-23]*1440+RC[-6]+4*R3C2-60*R4C2,1440) -> 709.96427950457644 | AC48: =IF(RC[-1]/4<0,RC[-1]/4+180,RC[-1]/4-180) -> -2.5089301238558903 | AD48: =DEGREES(ACOS(SIN(RADIANS(R2C2))*SIN(RADIANS(RC[-10]))+COS(RADIANS(R2C2))*COS(RADIANS(RC[-10]))*COS(RADIANS(RC[-1])))) -> 82.052454503417437 | AE48: =90-RC[-1] -> 7.9475454965825634 | AF48: =IF(RC[-1]>85,0,IF(RC[-1]>5,58.1/TAN(RADIANS(RC[-1]))-0.07/POWER(TAN(RADIANS(RC[-1])),3)+0.000086/POWER(TAN(RADIANS(RC[-1])),5),IF(RC[-1]>-0.575,1735+RC[-1]*(-518.2+RC[-1]*(103.4+RC[-1]*(-12.79+RC[-1]*0.711))),-20.772/TAN(RADIANS(RC[-1])))))/3600 -> 0.10890631960574221 | AG48: =RC[-2]+RC[-1] -> 8.0564518161883054 | AH48: =IF(RC[-5]>0,MOD(DEGREES(ACOS(((SIN(RADIANS(R2C2))*COS(RADIANS(RC[-4])))-SIN(RADIANS(RC[-14])))/(COS(RADIANS(R2C2))*SIN(RADIANS(RC[-4])))))+180,360),MOD(540-DEGREES(ACOS(((SIN(RADIANS(R2C2))*COS(RADIANS(RC[-4])))-SIN(RADIANS(RC[-14])))/(COS(RADIANS(R2C2))*SIN(RADIANS(RC[-4]))))),360)) -> 177.52242768533574
D49: =R[-1]C+1 -> 2017-02-17T00:00:00.000 | E49: =R5C2 -> 1899-12-31T14:00:00.000 | F49: =RC[-2]+2415018.5+RC[-1]-R4C2/24 -> 2457802.375 | G49: =(RC[-1]-2451545)/36525 -> 0.17131759069130734 | I49: =MOD(280.46646+RC[-2]*(36000.76983 + RC[-2]*0.0003032),360) -> 328.03161920673847 | J49: =357.52911+RC[-3]*(35999.05029 - 0.0001537*RC[-3]) -> 6524.7996683469573 | K49: =0.016708634-RC[-4]*(0.000042037+0.0000001267*RC[-4]) -> 1.6701428603830979E-2 | L49: =SIN(RADIANS(RC[-2]))*(1.914602-RC[-5]*(0.004817+0.000014*RC[-5]))+SIN(RADIANS(2*RC[-2]))*(0.019993-0.000101*RC[-5])+SIN(RADIANS(3*RC[-2]))*0.000289 -> 1.3686861221705802 | M49: =RC[-4]+RC[-1] -> 329.40030532890904 | N49: =RC[-4]+RC[-2] -> 6526.1683544691277 | O49: =(1.000001018*(1-RC[-4]*RC[-4]))/(1+RC[-4]*COS(RADIANS(RC[-1]))) -> 0.98829107460990617 | P49: =RC[-3]-0.00569-0.00478*SIN(RADIANS(125.04-1934.136*RC[-9])) -> 329.39249658709878 | Q49: =23+(26+((21.448-RC[-10]*(46.815+RC[-10]*(0.00059-RC[-10]*0.001813))))/60)/60 -> 23.437063266330956 | R49: =RC[-1]+0.00256*COS(RADIANS(125.04-1934.136*RC[-11])) -> 23.434768489164384 | S49: =DEGREES(ATAN2(COS(RADIANS(RC[-3])),COS(RADIANS(RC[-1]))*SIN(RADIANS(RC[-3])))) -> -28.492142320078987 | T49: =DEGREES(ASIN(SIN(RADIANS(RC[-2]))*SIN(RADIANS(RC[-4])))) -> -11.682781405407145 | U49: =TAN(RADIANS(RC[-3]/2))*TAN(RADIANS(RC[-3]/2)) -> 4.3017451618754622E-2 | V49: =4*DEGREES(RC[-1]*SIN(2*RADIANS(RC[-13]))-2*RC[-11]*SIN(RADIANS(RC[-12]))+4*RC[-11]*RC[-1]*SIN(RADIANS(RC[-12]))*COS(2*RADIANS(RC[-13]))-0.5*RC[-1]*RC[-1]*SIN(4*RADIANS(RC[-13]))-1.25*RC[-11]*RC[-11]*SIN(2*RADIANS(RC[-12]))) -> -13.959143362986714 | W49: =DEGREES(ACOS(COS(RADIANS(90.833))/(COS(RADIANS(R2C2))*COS(RADIANS(RC[-3])))-TAN(RADIANS(R2C2))*TAN(RADIANS(RC[-3])))) -> 58.351379650306136 | X49: =(720-4*R3C2-RC[-2]+R4C2*60)/1440 -> 1899-12-31T14:09:57.549 | Y49: =(RC[-1]*1440-RC[-2]*4)/1440 -> 1899-12-31T10:16:33.217 | Z49: =(RC[-2]*1440+RC[-3]*4)/1440 -> 1899-12-31T18:03:21.880 | AA49: =8*RC[-4] -> 466.81103720244909 | AB49: =MOD(RC[-23]*1440+RC[-6]+4*R3C2-60*R4C2,1440) -> 710.04085663701323 | AC49: =IF(RC[-1]/4<0,RC[-1]/4+180,RC[-1]/4-180) -> -2.4897858407466913 | AD49: =DEGREES(ACOS(SIN(RADIANS(R2C2))*SIN(RADIANS(RC[-10]))+COS(RADIANS(R2C2))*COS(RADIANS(RC[-10]))*COS(RADIANS(RC[-1])))) -> 81.701089579608521 | AE49: =90-RC[-1] -> 8.2989104203914792 | AF49: =IF(RC[-1]>85,0,IF(RC[-1]>5,58.1/TAN(RADIANS(RC[-1]))-0.07/POWER(TAN(RADIANS(RC[-1])),3)+0.000086/POWER(TAN(RADIANS(RC[-1])),5),IF(RC[-1]>-0.575,1735+RC[-1]*(-518.2+RC[-1]*(103.4+RC[-1]*(-12.79+RC[-1]*0.711))),-20.772/TAN(RADIANS(RC[-1])))))/3600 -> 0.10473923985085562 | AG49: =RC[-2]+RC[-1] -> 8.4036496602423352 | AH49: =IF(RC[-5]>0,MOD(DEGREES(ACOS(((SIN(RADIANS(R2C2))*COS(RADIANS(RC[-4])))-SIN(RADIANS(RC[-14])))/(COS(RADIANS(R2C2))*SIN(RADIANS(RC[-4])))))+180,360),MOD(540-DEGREES(ACOS(((SIN(RADIANS(R2C2))*COS(RADIANS(RC[-4])))-SIN(RADIANS(RC[-14])))/(COS(RADIANS(R2C2))*SIN(RADIANS(RC[-4]))))),360)) -> 177.53600749419491
D50: =R[-1]C+1 -> 2017-02-18T00:00:00.000 | E50: =R5C2 -> 1899-12-31T14:00:00.000 | F50: =RC[-2]+2415018.5+RC[-1]-R4C2/24 -> 2457803.375 | G50: =(RC[-1]-2451545)/36525 -> 0.17134496919917863 | I50: =MOD(280.46646+RC[-2]*(36000.76983 + RC[-2]*0.0003032),360) -> 329.01726656974643 | J50: =357.52911+RC[-3]*(35999.05029 - 0.0001537*RC[-3]) -> 6525.785268627239 | K50: =0.016708634-RC[-4]*(0.000042037+0.0000001267*RC[-4]) -> 1.6701427451731997E-2 | L50: =SIN(RADIANS(RC[-2]))*(1.914602-RC[-5]*(0.004817+0.000014*RC[-5]))+SIN(RADIANS(2*RC[-2]))*(0.019993-0.000101*RC[-5])+SIN(RADIANS(3*RC[-2]))*0.000289 -> 1.3918273568476023 | M50: =RC[-4]+RC[-1] -> 330.40909392659404 | N50: =RC[-4]+RC[-2] -> 6527.1770959840869 | O50: =(1.000001018*(1-RC[-4]*RC[-4]))/(1+RC[-4]*COS(RADIANS(RC[-1]))) -> 0.98850009571002362 | P50: =RC[-3]-0.00569-0.00478*SIN(RADIANS(125.04-1934.136*RC[-9])) -> 330.40128122562163 | Q50: =23+(26+((21.448-RC[-10]*(46.815+RC[-10]*(0.00059-RC[-10]*0.001813))))/60)/60 -> 23.437062910295953 | R50: =RC[-1]+0.00256*COS(RADIANS(125.04-1934.136*RC[-11])) -> 23.434769182840672 | S50: =DEGREES(ATAN2(COS(RADIANS(RC[-3])),COS(RADIANS(RC[-1]))*SIN(RADIANS(RC[-3])))) -> -27.528212440025644 | T50: =DEGREES(ASIN(SIN(RADIANS(RC[-2]))*SIN(RADIANS(RC[-4])))) -> -11.328581516390198 | U50: =TAN(RADIANS(RC[-3]/2))*TAN(RADIANS(RC[-3]/2)) -> 4.3017454237830856E-2 | V50: =4*DEGREES(RC[-1]*SIN(2*RADIANS(RC[-13]))-2*RC[-11]*SIN(RADIANS(RC[-12]))+4*RC[-11]*RC[-1]*SIN(RADIANS(RC[-12]))*COS(2*RADIANS(RC[-13]))-0.5*RC[-1]*RC[-1]*SIN(4*RADIANS(RC[-13]))-1.25*RC[-11]*RC[-11]*SIN(2*RADIANS(RC[-12]))) -> -13.870989984942977 | W50: =DEGREES(ACOS(COS(RADIANS(90.833))/(COS(RADIANS(R2C2))*COS(RADIANS(RC[-3])))-TAN(RADIANS(R2C2))*TAN(RADIANS(RC[-3])))) -> 59.530843201898925 | X50: =(720-4*R3C2-RC[-2]+R4C2*60)/1440 -> 1899-12-31T14:09:52.259 | Y50: =(RC[-1]*1440-RC[-2]*4)/1440 -> 1899-12-31T10:11:44.857 | Z50: =(RC[-2]*1440+RC[-3]*4)/1440 -> 1899-12-31T18:07:59.662 | AA50: =8*RC[-4] -> 476.2467456151914 | AB50: =MOD(RC[-23]*1440+RC[-6]+4*R3C2-60*R4C2,1440) -> 710.12901001505702 | AC50: =IF(RC[-1]/4<0,RC[-1]/4+180,RC[-1]/4-180) -> -2.4677474962357451 | AD50: =DEGREES(ACOS(SIN(RADIANS(R2C2))*SIN(RADIANS(RC[-10]))+COS(RADIANS(R2C2))*COS(RADIANS(RC[-10]))*COS(RADIANS(RC[-1])))) -> 81.346606334831378 | AE50: =90-RC[-1] -> 8.6533936651686219 | AF50: =IF(RC[-1]>85,0,IF(RC[-1]>5,58.1/TAN(RADIANS(RC[-1]))-0.07/POWER(TAN(RADIANS(RC[-1])),3)+0.000086/POWER(TAN(RADIANS(RC[-1])),5),IF(RC[-1]>-0.575,1735+RC[-1]*(-518.2+RC[-1]*(103.4+RC[-1]*(-12.79+RC[-1]*0.711))),-20.772/TAN(RADIANS(RC[-1])))))/3600 -> 0.10082129761617703 | AG50: =RC[-2]+RC[-1] -> 8.7542149627847987 | AH50: =IF(RC[-5]>0,MOD(DEGREES(ACOS(((SIN(RADIANS(R2C2))*COS(RADIANS(RC[-4])))-SIN(RADIANS(RC[-14])))/(COS(RADIANS(R2C2))*SIN(RADIANS(RC[-4])))))+180,360),MOD(540-DEGREES(ACOS(((SIN(RADIANS(R2C2))*COS(RADIANS(RC[-4])))-SIN(RADIANS(RC[-14])))/(COS(RADIANS(R2C2))*SIN(RADIANS(RC[-4]))))),360)) -> 177.55248330205518
D51: =R[-1]C+1 -> 2017-02-19T00:00:00.000 | E51: =R5C2 -> 1899-12-31T14:00:00.000 | F51: =RC[-2]+2415018.5+RC[-1]-R4C2/24 -> 2457804.375 | G51: =(RC[-1]-2451545)/36525 -> 0.17137234770704995 | I51: =MOD(280.46646+RC[-2]*(36000.76983 + RC[-2]*0.0003032),360) -> 330.0029139327562 | J51: =357.52911+RC[-3]*(35999.05029 - 0.0001537*RC[-3]) -> 6526.7708689075225 | K51: =0.016708634-RC[-4]*(0.000042037+0.0000001267*RC[-4]) -> 1.6701426299632824E-2 | L51: =SIN(RADIANS(RC[-2]))*(1.914602-RC[-5]*(0.004817+0.000014*RC[-5]))+SIN(RADIANS(2*RC[-2]))*(0.019993-0.000101*RC[-5])+SIN(RADIANS(3*RC[-2]))*0.000289 -> 1.4145385585930226 | M51: =RC[-4]+RC[-1] -> 331.4174524913492 | N51: =RC[-4]+RC[-2] -> 6528.185407466116 | O51: =(1.000001018*(1-RC[-4]*RC[-4]))/(1+RC[-4]*COS(RADIANS(RC[-1]))) -> 0.9887125546300769 | P51: =RC[-3]-0.00569-0.00478*SIN(RADIANS(125.04-1934.136*RC[-9])) -> 331.40963583302778 | Q51: =23+(26+((21.448-RC[-10]*(46.815+RC[-10]*(0.00059-RC[-10]*0.001813))))/60)/60 -> 23.437062554260951 | R51: =RC[-1]+0.00256*COS(RADIANS(125.04-1934.136*RC[-11])) -> 23.43476987847621 | S51: =DEGREES(ATAN2(COS(RADIANS(RC[-3])),COS(RADIANS(RC[-1]))*SIN(RADIANS(RC[-3])))) -> -26.567087017863187 | T51: =DEGREES(ASIN(SIN(RADIANS(RC[-2]))*SIN(RADIANS(RC[-4])))) -> -10.971418883718002 | U51: =TAN(RADIANS(RC[-3]/2))*TAN(RADIANS(RC[-3]/2)) -> 4.3017456864304596E-2 | V51: =4*DEGREES(RC[-1]*SIN(2*RADIANS(RC[-13]))-2*RC[-11]*SIN(RADIANS(RC[-12]))+4*RC[-11]*RC[-1]*SIN(RADIANS(RC[-12]))*COS(2*RADIANS(RC[-13]))-0.5*RC[-1]*RC[-1]*SIN(4*RADIANS(RC[-13]))-1.25*RC[-11]*RC[-11]*SIN(2*RADIANS(RC[-12]))) -> -13.771499680992296 | W51: =DEGREES(ACOS(COS(RADIANS(90.833))/(COS(RADIANS(R2C2))*COS(RADIANS(RC[-3])))-TAN(RADIANS(R2C2))*TAN(RADIANS(RC[-3])))) -> 60.703088989018603 | X51: =(720-4*R3C2-RC[-2]+R4C2*60)/1440 -> 1899-12-31T14:09:46.290 | Y51: =(RC[-1]*1440-RC[-2]*4)/1440 -> 1899-12-31T10:06:57.549 | Z51: =(RC[-2]*1440+RC[-3]*4)/1440 -> 1899-12-31T18:12:35.031 | AA51: =8*RC[-4] -> 485.62471191214883 | AB51: =MOD(RC[-23]*1440+RC[-6]+4*R3C2-60*R4C2,1440) -> 710.22850031900771 | AC51: =IF(RC[-1]/4<0,RC[-1]/4+180,RC[-1]/4-180) -> -2.4428749202480731 | AD51: =DEGREES(ACOS(SIN(RADIANS(R2C2))*SIN(RADIANS(RC[-10]))+COS(RADIANS(R2C2))*COS(RADIANS(RC[-10]))*COS(RADIANS(RC[-1])))) -> 80.989121120519172 | AE51: =90-RC[-1] -> 9.0108788794808277 | AF51: =IF(RC[-1]>85,0,IF(RC[-1]>5,58.1/TAN(RADIANS(RC[-1]))-0.07/POWER(TAN(RADIANS(RC[-1])),3)+0.000086/POWER(TAN(RADIANS(RC[-1])),5),IF(RC[-1]>-0.575,1735+RC[-1]*(-518.2+RC[-1]*(103.4+RC[-1]*(-12.79+RC[-1]*0.711))),-20.772/TAN(RADIANS(RC[-1])))))/3600 -> 9.7134144336253087E-2 | AG51: =RC[-2]+RC[-1] -> 9.1080130238170813 | AH51: =IF(RC[-5]>0,MOD(DEGREES(ACOS(((SIN(RADIANS(R2C2))*COS(RADIANS(RC[-4])))-SIN(RADIANS(RC[-14])))/(COS(RADIANS(R2C2))*SIN(RADIANS(RC[-4])))))+180,360),MOD(540-DEGREES(ACOS(((SIN(RADIANS(R2C2))*COS(RADIANS(RC[-4])))-SIN(RADIANS(RC[-14])))/(COS(RADIANS(R2C2))*SIN(RADIANS(RC[-4]))))),360)) -> 177.57181693807695
D52: =R[-1]C+1 -> 2017-02-20T00:00:00.000 | E52: =R5C2 -> 1899-12-31T14:00:00.000 | F52: =RC[-2]+2415018.5+RC[-1]-R4C2/24 -> 2457805.375 | G52: =(RC[-1]-2451545)/36525 -> 0.17139972621492128 | I52: =MOD(280.46646+RC[-2]*(36000.76983 + RC[-2]*0.0003032),360) -> 330.98856129576598 | J52: =357.52911+RC[-3]*(35999.05029 - 0.0001537*RC[-3]) -> 6527.7564691878042 | K52: =0.016708634-RC[-4]*(0.000042037+0.0000001267*RC[-4]) -> 1.6701425147533464E-2 | L52: =SIN(RADIANS(RC[-2]))*(1.914602-RC[-5]*(0.004817+0.000014*RC[-5]))+SIN(RADIANS(2*RC[-2]))*(0.019993-0.000101*RC[-5])+SIN(RADIANS(3*RC[-2]))*0.000289 -> 1.436813060989468 | M52: =RC[-4]+RC[-1] -> 332.42537435675547 | N52: =RC[-4]+RC[-2] -> 6529.1932822487934 | O52: =(1.000001018*(1-RC[-4]*RC[-4]))/(1+RC[-4]*COS(RADIANS(RC[-1]))) -> 0.98892838410922623 | P52: =RC[-3]-0.00569-0.00478*SIN(RADIANS(125.04-1934.136*RC[-9])) -> 332.41755374290159 | Q52: =23+(26+((21.448-RC[-10]*(46.815+RC[-10]*(0.00059-RC[-10]*0.001813))))/60)/60 -> 23.437062198225949 | R52: =RC[-1]+0.00256*COS(RADIANS(125.04-1934.136*RC[-11])) -> 23.4347705760701 | S52: =DEGREES(ATAN2(COS(RADIANS(RC[-3])),COS(RADIANS(RC[-1]))*SIN(RADIANS(RC[-3])))) -> -25.60870620073867 | T52: =DEGREES(ASIN(SIN(RADIANS(RC[-2]))*SIN(RADIANS(RC[-4])))) -> -10.611407830763426 | U52: =TAN(RADIANS(RC[-3]/2))*TAN(RADIANS(RC[-3]/2)) -> 4.3017459498172483E-2 | V52: =4*DEGREES(RC[-1]*SIN(2*RADIANS(RC[-13]))-2*RC[-11]*SIN(RADIANS(RC[-12]))+4*RC[-11]*RC[-1]*SIN(RADIANS(RC[-12]))*COS(2*RADIANS(RC[-13]))-0.5*RC[-1]*RC[-1]*SIN(4*RADIANS(RC[-13]))-1.25*RC[-11]*RC[-11]*SIN(2*RADIANS(RC[-12]))) -> -13.660921236251578 | W52: =DEGREES(ACOS(COS(RADIANS(90.833))/(COS(RADIANS(R2C2))*COS(RADIANS(RC[-3])))-TAN(RADIANS(R2C2))*TAN(RADIANS(RC[-3])))) -> 61.868513941287247 | X52: =(720-4*R3C2-RC[-2]+R4C2*60)/1440 -> 1899-12-31T14:09:39.655 | Y52: =(RC[-1]*1440-RC[-2]*4)/1440 -> 1899-12-31T10:02:11.212 | Z52: =(RC[-2]*1440+RC[-3]*4)/1440 -> 1899-12-31T18:17:08.099 | AA52: =8*RC[-4] -> 494.94811153029798 | AB52: =MOD(RC[-23]*1440+RC[-6]+4*R3C2-60*R4C2,1440) -> 710.33907876374838 | AC52: =IF(RC[-1]/4<0,RC[-1]/4+180,RC[-1]/4-180) -> -2.4152303090629061 | AD52: =DEGREES(ACOS(SIN(RADIANS(R2C2))*SIN(RADIANS(RC[-10]))+COS(RADIANS(R2C2))*COS(RADIANS(RC[-10]))*COS(RADIANS(RC[-1])))) -> 80.628750126394337 | AE52: =90-RC[-1] -> 9.3712498736056631 | AF52: =IF(RC[-1]>85,0,IF(RC[-1]>5,58.1/TAN(RADIANS(RC[-1]))-0.07/POWER(TAN(RADIANS(RC[-1])),3)+0.000086/POWER(TAN(RADIANS(RC[-1])),5),IF(RC[-1]>-0.575,1735+RC[-1]*(-518.2+RC[-1]*(103.4+RC[-1]*(-12.79+RC[-1]*0.711))),-20.772/TAN(RADIANS(RC[-1])))))/3600 -> 9.3660835989703997E-2 | AG52: =RC[-2]+RC[-1] -> 9.4649107095953671 | AH52: =IF(RC[-5]>0,MOD(DEGREES(ACOS(((SIN(RADIANS(R2C2))*COS(RADIANS(RC[-4])))-SIN(RADIANS(RC[-14])))/(COS(RADIANS(R2C2))*SIN(RADIANS(RC[-4])))))+180,360),MOD(540-DEGREES(ACOS(((SIN(RADIANS(R2C2))*COS(RADIANS(RC[-4])))-SIN(RADIANS(RC[-14])))/(COS(RADIANS(R2C2))*SIN(RADIANS(RC[-4]))))),360)) -> 177.59396767719124
D53: =R[-1]C+1 -> 2017-02-21T00:00:00.000 | E53: =R5C2 -> 1899-12-31T14:00:00.000 | F53: =RC[-2]+2415018.5+RC[-1]-R4C2/24 -> 2457806.375 | G53: =(RC[-1]-2451545)/36525 -> 0.1714271047227926 | I53: =MOD(280.46646+RC[-2]*(36000.76983 + RC[-2]*0.0003032),360) -> 331.97420865877666 | J53: =357.52911+RC[-3]*(35999.05029 - 0.0001537*RC[-3]) -> 6528.7420694680868 | K53: =0.016708634-RC[-4]*(0.000042037+0.0000001267*RC[-4]) -> 1.6701423995433909E-2 | L53: =SIN(RADIANS(RC[-2]))*(1.914602-RC[-5]*(0.004817+0.000014*RC[-5]))+SIN(RADIANS(2*RC[-2]))*(0.019993-0.000101*RC[-5])+SIN(RADIANS(3*RC[-2]))*0.000289 -> 1.4586443489476386 | M53: =RC[-4]+RC[-1] -> 333.4328530077243 | N53: =RC[-4]+RC[-2] -> 6530.2007138170347 | O53: =(1.000001018*(1-RC[-4]*RC[-4]))/(1+RC[-4]*COS(RADIANS(RC[-1]))) -> 0.98914751590734906 | P53: =RC[-3]-0.00569-0.00478*SIN(RADIANS(125.04-1934.136*RC[-9])) -> 333.42502844015786 | Q53: =23+(26+((21.448-RC[-10]*(46.815+RC[-10]*(0.00059-RC[-10]*0.001813))))/60)/60 -> 23.437061842190946 | R53: =RC[-1]+0.00256*COS(RADIANS(125.04-1934.136*RC[-11])) -> 23.434771275621447 | S53: =DEGREES(ATAN2(COS(RADIANS(RC[-3])),COS(RADIANS(RC[-1]))*SIN(RADIANS(RC[-3])))) -> -24.653008066284773 | T53: =DEGREES(ASIN(SIN(RADIANS(RC[-2]))*SIN(RADIANS(RC[-4])))) -> -10.248662333377581 | U53: =TAN(RADIANS(RC[-3]/2))*TAN(RADIANS(RC[-3]/2)) -> 4.3017462139431119E-2 | V53: =4*DEGREES(RC[-1]*SIN(2*RADIANS(RC[-13]))-2*RC[-11]*SIN(RADIANS(RC[-12]))+4*RC[-11]*RC[-1]*SIN(RADIANS(RC[-12]))*COS(2*RADIANS(RC[-13]))-0.5*RC[-1]*RC[-1]*SIN(4*RADIANS(RC[-13]))-1.25*RC[-11]*RC[-11]*SIN(2*RADIANS(RC[-12]))) -> -13.539512388850877 | W53: =DEGREES(ACOS(COS(RADIANS(90.833))/(COS(RADIANS(R2C2))*COS(RADIANS(RC[-3])))-TAN(RADIANS(R2C2))*TAN(RADIANS(RC[-3])))) -> 63.02749248358262 | X53: =(720-4*R3C2-RC[-2]+R4C2*60)/1440 -> 1899-12-31T14:09:32.371 | Y53: =(RC[-1]*1440-RC[-2]*4)/1440 -> 1899-12-31T09:57:25.773 | Z53: =(RC[-2]*1440+RC[-3]*4)/1440 -> 1899-12-31T18:21:38.969 | AA53: =8*RC[-4] -> 504.21993986866096 | AB53: =MOD(RC[-23]*1440+RC[-6]+4*R3C2-60*R4C2,1440) -> 710.46048761114912 | AC53: =IF(RC[-1]/4<0,RC[-1]/4+180,RC[-1]/4-180) -> -2.3848780972127201 | AD53: =DEGREES(ACOS(SIN(RADIANS(R2C2))*SIN(RADIANS(RC[-10]))+COS(RADIANS(R2C2))*COS(RADIANS(RC[-10]))*COS(RADIANS(RC[-1])))) -> 80.265609339825232 | AE53: =90-RC[-1] -> 9.7343906601747676 | AF53: =IF(RC[-1]>85,0,IF(RC[-1]>5,58.1/TAN(RADIANS(RC[-1]))-0.07/POWER(TAN(RADIANS(RC[-1])),3)+0.000086/POWER(TAN(RADIANS(RC[-1])),5),IF(RC[-1]>-0.575,1735+RC[-1]*(-518.2+RC[-1]*(103.4+RC[-1]*(-12.79+RC[-1]*0.711))),-20.772/TAN(RADIANS(RC[-1])))))/3600 -> 9.0385755350780542E-2 | AG53: =RC[-2]+RC[-1] -> 9.8247764155255481 | AH53: =IF(RC[-5]>0,MOD(DEGREES(ACOS(((SIN(RADIANS(R2C2))*COS(RADIANS(RC[-4])))-SIN(RADIANS(RC[-14])))/(COS(RADIANS(R2C2))*SIN(RADIANS(RC[-4])))))+180,360),MOD(540-DEGREES(ACOS(((SIN(RADIANS(R2C2))*COS(RADIANS(RC[-4])))-SIN(RADIANS(RC[-14])))/(COS(RADIANS(R2C2))*SIN(RADIANS(RC[-4]))))),360)) -> 177.61889231808459
D54: =R[-1]C+1 -> 2017-02-22T00:00:00.000 | E54: =R5C2 -> 1899-12-31T14:00:00.000 | F54: =RC[-2]+2415018.5+RC[-1]-R4C2/24 -> 2457807.375 | G54: =(RC[-1]-2451545)/36525 -> 0.17145448323066392 | I54: =MOD(280.46646+RC[-2]*(36000.76983 + RC[-2]*0.0003032),360) -> 332.95985602178735 | J54: =357.52911+RC[-3]*(35999.05029 - 0.0001537*RC[-3]) -> 6529.7276697483694 | K54: =0.016708634-RC[-4]*(0.000042037+0.0000001267*RC[-4]) -> 1.6701422843334167E-2 | L54: =SIN(RADIANS(RC[-2]))*(1.914602-RC[-5]*(0.004817+0.000014*RC[-5]))+SIN(RADIANS(2*RC[-2]))*(0.019993-0.000101*RC[-5])+SIN(RADIANS(3*RC[-2]))*0.000289 -> 1.4800260605029179 | M54: =RC[-4]+RC[-1] -> 334.43988208229024 | N54: =RC[-4]+RC[-2] -> 6531.2076958088719 | O54: =(1.000001018*(1-RC[-4]*RC[-4]))/(1+RC[-4]*COS(RADIANS(RC[-1]))) -> 0.98936988083059973 | P54: =RC[-3]-0.00569-0.00478*SIN(RADIANS(125.04-1934.136*RC[-9])) -> 334.43205356283454 | Q54: =23+(26+((21.448-RC[-10]*(46.815+RC[-10]*(0.00059-RC[-10]*0.001813))))/60)/60 -> 23.437061486155944 | R54: =RC[-1]+0.00256*COS(RADIANS(125.04-1934.136*RC[-11])) -> 23.434771977129341 | S54: =DEGREES(ATAN2(COS(RADIANS(RC[-3])),COS(RADIANS(RC[-1]))*SIN(RADIANS(RC[-3])))) -> -23.699928726555815 | T54: =DEGREES(ASIN(SIN(RADIANS(RC[-2]))*SIN(RADIANS(RC[-4])))) -> -9.8832959936619602 | U54: =TAN(RADIANS(RC[-3]/2))*TAN(RADIANS(RC[-3]/2)) -> 4.3017464788077067E-2 | V54: =4*DEGREES(RC[-1]*SIN(2*RADIANS(RC[-13]))-2*RC[-11]*SIN(RADIANS(RC[-12]))+4*RC[-11]*RC[-1]*SIN(RADIANS(RC[-12]))*COS(2*RADIANS(RC[-13]))-0.5*RC[-1]*RC[-1]*SIN(4*RADIANS(RC[-13]))-1.25*RC[-11]*RC[-11]*SIN(2*RADIANS(RC[-12]))) -> -13.40753932115496 | W54: =DEGREES(ACOS(COS(RADIANS(90.833))/(COS(RADIANS(R2C2))*COS(RADIANS(RC[-3])))-TAN(RADIANS(R2C2))*TAN(RADIANS(RC[-3])))) -> 64.180379112074775 | X54: =(720-4*R3C2-RC[-2]+R4C2*60)/1440 -> 1899-12-31T14:09:24.452 | Y54: =(RC[-1]*1440-RC[-2]*4)/1440 -> 1899-12-31T09:52:41.161 | Z54: =(RC[-2]*1440+RC[-3]*4)/1440 -> 1899-12-31T18:26:07.743 | AA54: =8*RC[-4] -> 513.4430328965982 | AB54: =MOD(RC[-23]*1440+RC[-6]+4*R3C2-60*R4C2,1440) -> 710.59246067884499 | AC54: =IF(RC[-1]/4<0,RC[-1]/4+180,RC[-1]/4-180) -> -2.3518848302887534 | AD54: =DEGREES(ACOS(SIN(RADIANS(R2C2))*SIN(RADIANS(RC[-10]))+COS(RADIANS(R2C2))*COS(RADIANS(RC[-10]))*COS(RADIANS(RC[-1])))) -> 79.899814507501418 | AE54: =90-RC[-1] -> 10.100185492498582 | AF54: =IF(RC[-1]>85,0,IF(RC[-1]>5,58.1/TAN(RADIANS(RC[-1]))-0.07/POWER(TAN(RADIANS(RC[-1])),3)+0.000086/POWER(TAN(RADIANS(RC[-1])),5),IF(RC[-1]>-0.575,1735+RC[-1]*(-518.2+RC[-1]*(103.4+RC[-1]*(-12.79+RC[-1]*0.711))),-20.772/TAN(RADIANS(RC[-1])))))/3600 -> 8.7294528410474234E-2 | AG54: =RC[-2]+RC[-1] -> 10.187480020909057 | AH54: =IF(RC[-5]>0,MOD(DEGREES(ACOS(((SIN(RADIANS(R2C2))*COS(RADIANS(RC[-4])))-SIN(RADIANS(RC[-14])))/(COS(RADIANS(R2C2))*SIN(RADIANS(RC[-4])))))+180,360),MOD(540-DEGREES(ACOS(((SIN(RADIANS(R2C2))*COS(RADIANS(RC[-4])))-SIN(RADIANS(RC[-14])))/(COS(RADIANS(R2C2))*SIN(RADIANS(RC[-4]))))),360)) -> 177.64654526205209
D55: =R[-1]C+1 -> 2017-02-23T00:00:00.000 | E55: =R5C2 -> 1899-12-31T14:00:00.000 | F55: =RC[-2]+2415018.5+RC[-1]-R4C2/24 -> 2457808.375 | G55: =(RC[-1]-2451545)/36525 -> 0.17148186173853525 | I55: =MOD(280.46646+RC[-2]*(36000.76983 + RC[-2]*0.0003032),360) -> 333.94550338479803 | J55: =357.52911+RC[-3]*(35999.05029 - 0.0001537*RC[-3]) -> 6530.7132700286502 | K55: =0.016708634-RC[-4]*(0.000042037+0.0000001267*RC[-4]) -> 1.6701421691234234E-2 | L55: =SIN(RADIANS(RC[-2]))*(1.914602-RC[-5]*(0.004817+0.000014*RC[-5]))+SIN(RADIANS(2*RC[-2]))*(0.019993-0.000101*RC[-5])+SIN(RADIANS(3*RC[-2]))*0.000289 -> 1.5009519885395892 | M55: =RC[-4]+RC[-1] -> 335.44645537333764 | N55: =RC[-4]+RC[-2] -> 6532.21422201719 | O55: =(1.000001018*(1-RC[-4]*RC[-4]))/(1+RC[-4]*COS(RADIANS(RC[-1]))) -> 0.98959540875721308 | P55: =RC[-3]-0.00569-0.00478*SIN(RADIANS(125.04-1934.136*RC[-9])) -> 335.43862290381941 | Q55: =23+(26+((21.448-RC[-10]*(46.815+RC[-10]*(0.00059-RC[-10]*0.001813))))/60)/60 -> 23.437061130120941 | R55: =RC[-1]+0.00256*COS(RADIANS(125.04-1934.136*RC[-11])) -> 23.434772680592882 | S55: =DEGREES(ATAN2(COS(RADIANS(RC[-3])),COS(RADIANS(RC[-1]))*SIN(RADIANS(RC[-3])))) -> -22.749402430058659 | T55: =DEGREES(ASIN(SIN(RADIANS(RC[-2]))*SIN(RADIANS(RC[-4])))) -> -9.515422016310163 | U55: =TAN(RADIANS(RC[-3]/2))*TAN(RADIANS(RC[-3]/2)) -> 4.3017467444106942E-2 | V55: =4*DEGREES(RC[-1]*SIN(2*RADIANS(RC[-13]))-2*RC[-11]*SIN(RADIANS(RC[-12]))+4*RC[-11]*RC[-1]*SIN(RADIANS(RC[-12]))*COS(2*RADIANS(RC[-13]))-0.5*RC[-1]*RC[-1]*SIN(4*RADIANS(RC[-13]))-1.25*RC[-11]*RC[-11]*SIN(2*RADIANS(RC[-12]))) -> -13.265276155940287 | W55: =DEGREES(ACOS(COS(RADIANS(90.833))/(COS(RADIANS(R2C2))*COS(RADIANS(RC[-3])))-TAN(RADIANS(R2C2))*TAN(RADIANS(RC[-3])))) -> 65.327510644150948 | X55: =(720-4*R3C2-RC[-2]+R4C2*60)/1440 -> 1899-12-31T14:09:15.917 | Y55: =(RC[-1]*1440-RC[-2]*4)/1440 -> 1899-12-31T09:47:57.314 | Z55: =(RC[-2]*1440+RC[-3]*4)/1440 -> 1899-12-31T18:30:34.519 | AA55: =8*RC[-4] -> 522.62008515320758 | AB55: =MOD(RC[-23]*1440+RC[-6]+4*R3C2-60*R4C2,1440) -> 710.73472384405966 | AC55: =IF(RC[-1]/4<0,RC[-1]/4+180,RC[-1]/4-180) -> -2.3163190389850854 | AD55: =DEGREES(ACOS(SIN(RADIANS(R2C2))*SIN(RADIANS(RC[-10]))+COS(RADIANS(R2C2))*COS(RADIANS(RC[-10]))*COS(RADIANS(RC[-1])))) -> 79.531481099398192 | AE55: =90-RC[-1] -> 10.468518900601808 | AF55: =IF(RC[-1]>85,0,IF(RC[-1]>5,58.1/TAN(RADIANS(RC[-1]))-0.07/POWER(TAN(RADIANS(RC[-1])),3)+0.000086/POWER(TAN(RADIANS(RC[-1])),5),IF(RC[-1]>-0.575,1735+RC[-1]*(-518.2+RC[-1]*(103.4+RC[-1]*(-12.79+RC[-1]*0.711))),-20.772/TAN(RADIANS(RC[-1])))))/3600 -> 8.4373938306486596E-2 | AG55: =RC[-2]+RC[-1] -> 10.552892838908294 | AH55: =IF(RC[-5]>0,MOD(DEGREES(ACOS(((SIN(RADIANS(R2C2))*COS(RADIANS(RC[-4])))-SIN(RADIANS(RC[-14])))/(COS(RADIANS(R2C2))*SIN(RADIANS(RC[-4])))))+180,360),MOD(540-DEGREES(ACOS(((SIN(RADIANS(R2C2))*COS(RADIANS(RC[-4])))-SIN(RADIANS(RC[-14])))/(COS(RADIANS(R2C2))*SIN(RADIANS(RC[-4]))))),360)) -> 177.67687859246746
D56: =R[-1]C+1 -> 2017-02-24T00:00:00.000 | E56: =R5C2 -> 1899-12-31T14:00:00.000 | F56: =RC[-2]+2415018.5+RC[-1]-R4C2/24 -> 2457809.375 | G56: =(RC[-1]-2451545)/36525 -> 0.17150924024640657 | I56: =MOD(280.46646+RC[-2]*(36000.76983 + RC[-2]*0.0003032),360) -> 334.93115074781053 | J56: =357.52911+RC[-3]*(35999.05029 - 0.0001537*RC[-3]) -> 6531.6988703089328 | K56: =0.016708634-RC[-4]*(0.000042037+0.0000001267*RC[-4]) -> 1.6701420539134114E-2 | L56: =SIN(RADIANS(RC[-2]))*(1.914602-RC[-5]*(0.004817+0.000014*RC[-5]))+SIN(RADIANS(2*RC[-2]))*(0.019993-0.000101*RC[-5])+SIN(RADIANS(3*RC[-2]))*0.000289 -> 1.5214160824417928 | M56: =RC[-4]+RC[-1] -> 336.45256683025235 | N56: =RC[-4]+RC[-2] -> 6533.2202863913744 | O56: =(1.000001018*(1-RC[-4]*RC[-4]))/(1+RC[-4]*COS(RADIANS(RC[-1]))) -> 0.98982402866353281 | P56: =RC[-3]-0.00569-0.00478*SIN(RADIANS(125.04-1934.136*RC[-9])) -> 336.4447304125016 | Q56: =23+(26+((21.448-RC[-10]*(46.815+RC[-10]*(0.00059-RC[-10]*0.001813))))/60)/60 -> 23.437060774085939 | R56: =RC[-1]+0.00256*COS(RADIANS(125.04-1934.136*RC[-11])) -> 23.43477338601117 | S56: =DEGREES(ATAN2(COS(RADIANS(RC[-3])),COS(RADIANS(RC[-1]))*SIN(RADIANS(RC[-3])))) -> -21.801361661800094 | T56: =DEGREES(ASIN(SIN(RADIANS(RC[-2]))*SIN(RADIANS(RC[-4])))) -> -9.1451531874316512 | U56: =TAN(RADIANS(RC[-3]/2))*TAN(RADIANS(RC[-3]/2)) -> 4.301747010751733E-2 | V56: =4*DEGREES(RC[-1]*SIN(2*RADIANS(RC[-13]))-2*RC[-11]*SIN(RADIANS(RC[-12]))+4*RC[-11]*RC[-1]*SIN(RADIANS(RC[-12]))*COS(2*RADIANS(RC[-13]))-0.5*RC[-1]*RC[-1]*SIN(4*RADIANS(RC[-13]))-1.25*RC[-11]*RC[-11]*SIN(2*RADIANS(RC[-12]))) -> -13.113004458778708 | W56: =DEGREES(ACOS(COS(RADIANS(90.833))/(COS(RADIANS(R2C2))*COS(RADIANS(RC[-3])))-TAN(RADIANS(R2C2))*TAN(RADIANS(RC[-3])))) -> 66.469208190996255 | X56: =(720-4*R3C2-RC[-2]+R4C2*60)/1440 -> 1899-12-31T14:09:06.780 | Y56: =(RC[-1]*1440-RC[-2]*4)/1440 -> 1899-12-31T09:43:14.170 | Z56: =(RC[-2]*1440+RC[-3]*4)/1440 -> 1899-12-31T18:34:59.390 | AA56: =8*RC[-4] -> 531.75366552797004 | AB56: =MOD(RC[-23]*1440+RC[-6]+4*R3C2-60*R4C2,1440) -> 710.88699554122127 | AC56: =IF(RC[-1]/4<0,RC[-1]/4+180,RC[-1]/4-180) -> -2.2782511146946831 | AD56: =DEGREES(ACOS(SIN(RADIANS(R2C2))*SIN(RADIANS(RC[-10]))+COS(RADIANS(R2C2))*COS(RADIANS(RC[-10]))*COS(RADIANS(RC[-1])))) -> 79.160724275007595 | AE56: =90-RC[-1] -> 10.839275724992405 | AF56: =IF(RC[-1]>85,0,IF(RC[-1]>5,58.1/TAN(RADIANS(RC[-1]))-0.07/POWER(TAN(RADIANS(RC[-1])),3)+0.000086/POWER(TAN(RADIANS(RC[-1])),5),IF(RC[-1]>-0.575,1735+RC[-1]*(-518.2+RC[-1]*(103.4+RC[-1]*(-12.79+RC[-1]*0.711))),-20.772/TAN(RADIANS(RC[-1])))))/3600 -> 8.1611839465377145E-2 | AG56: =RC[-2]+RC[-1] -> 10.920887564457782 | AH56: =IF(RC[-5]>0,MOD(DEGREES(ACOS(((SIN(RADIANS(R2C2))*COS(RADIANS(RC[-4])))-SIN(RADIANS(RC[-14])))/(COS(RADIANS(R2C2))*SIN(RADIANS(RC[-4])))))+180,360),MOD(540-DEGREES(ACOS(((SIN(RADIANS(R2C2))*COS(RADIANS(RC[-4])))-SIN(RADIANS(RC[-14])))/(COS(RADIANS(R2C2))*SIN(RADIANS(RC[-4]))))),360)) -> 177.70984215456883
D57: =R[-1]C+1 -> 2017-02-25T00:00:00.000 | E57: =R5C2 -> 1899-12-31T14:00:00.000 | F57: =RC[-2]+2415018.5+RC[-1]-R4C2/24 -> 2457810.375 | G57: =(RC[-1]-2451545)/36525 -> 0.17153661875427789 | I57: =MOD(280.46646+RC[-2]*(36000.76983 + RC[-2]*0.0003032),360) -> 335.91679811082213 | J57: =357.52911+RC[-3]*(35999.05029 - 0.0001537*RC[-3]) -> 6532.6844705892136 | K57: =0.016708634-RC[-4]*(0.000042037+0.0000001267*RC[-4]) -> 1.6701419387033799E-2 | L57: =SIN(RADIANS(RC[-2]))*(1.914602-RC[-5]*(0.004817+0.000014*RC[-5]))+SIN(RADIANS(2*RC[-2]))*(0.019993-0.000101*RC[-5])+SIN(RADIANS(3*RC[-2]))*0.000289 -> 1.5414124496708375 | M57: =RC[-4]+RC[-1] -> 337.45821056049294 | N57: =RC[-4]+RC[-2] -> 6534.2258830388846 | O57: =(1.000001018*(1-RC[-4]*RC[-4]))/(1+RC[-4]*COS(RADIANS(RC[-1]))) -> 0.99005566865024697 | P57: =RC[-3]-0.00569-0.00478*SIN(RADIANS(125.04-1934.136*RC[-9])) -> 337.4503701963431 | Q57: =23+(26+((21.448-RC[-10]*(46.815+RC[-10]*(0.00059-RC[-10]*0.001813))))/60)/60 -> 23.437060418050937 | R57: =RC[-1]+0.00256*COS(RADIANS(125.04-1934.136*RC[-11])) -> 23.43477409338329 | S57: =DEGREES(ATAN2(COS(RADIANS(RC[-3])),COS(RADIANS(RC[-1]))*SIN(RADIANS(RC[-3])))) -> -20.855737241283808 | T57: =DEGREES(ASIN(SIN(RADIANS(RC[-2]))*SIN(RADIANS(RC[-4])))) -> -8.7726018557665348 | U57: =TAN(RADIANS(RC[-3]/2))*TAN(RADIANS(RC[-3]/2)) -> 4.301747277830479E-2 | V57: =4*DEGREES(RC[-1]*SIN(2*RADIANS(RC[-13]))-2*RC[-11]*SIN(RADIANS(RC[-12]))+4*RC[-11]*RC[-1]*SIN(RADIANS(RC[-12]))*COS(2*RADIANS(RC[-13]))-0.5*RC[-1]*RC[-1]*SIN(4*RADIANS(RC[-13]))-1.25*RC[-11]*RC[-11]*SIN(2*RADIANS(RC[-12]))) -> -12.951012747800759 | W57: =DEGREES(ACOS(COS(RADIANS(90.833))/(COS(RADIANS(R2C2))*COS(RADIANS(RC[-3])))-TAN(RADIANS(R2C2))*TAN(RADIANS(RC[-3])))) -> 67.605778893482778 | X57: =(720-4*R3C2-RC[-2]+R4C2*60)/1440 -> 1899-12-31T14:08:57.061 | Y57: =(RC[-1]*1440-RC[-2]*4)/1440 -> 1899-12-31T09:38:31.674 | Z57: =(RC[-2]*1440+RC[-3]*4)/1440 -> 1899-12-31T18:39:22.448 | AA57: =8*RC[-4] -> 540.84623114786223 | AB57: =MOD(RC[-23]*1440+RC[-6]+4*R3C2-60*R4C2,1440) -> 711.04898725219925 | AC57: =IF(RC[-1]/4<0,RC[-1]/4+180,RC[-1]/4-180) -> -2.2377531869501865 | AD57: =DEGREES(ACOS(SIN(RADIANS(R2C2))*SIN(RADIANS(RC[-10]))+COS(RADIANS(R2C2))*COS(RADIANS(RC[-10]))*COS(RADIANS(RC[-1])))) -> 78.787658851808004 | AE57: =90-RC[-1] -> 11.212341148191996 | AF57: =IF(RC[-1]>85,0,IF(RC[-1]>5,58.1/TAN(RADIANS(RC[-1]))-0.07/POWER(TAN(RADIANS(RC[-1])),3)+0.000086/POWER(TAN(RADIANS(RC[-1])),5),IF(RC[-1]>-0.575,1735+RC[-1]*(-518.2+RC[-1]*(103.4+RC[-1]*(-12.79+RC[-1]*0.711))),-20.772/TAN(RADIANS(RC[-1])))))/3600 -> 7.8997073958883945E-2 | AG57: =RC[-2]+RC[-1] -> 11.29133822215088 | AH57: =IF(RC[-5]>0,MOD(DEGREES(ACOS(((SIN(RADIANS(R2C2))*COS(RADIANS(RC[-4])))-SIN(RADIANS(RC[-14])))/(COS(RADIANS(R2C2))*SIN(RADIANS(RC[-4])))))+180,360),MOD(540-DEGREES(ACOS(((SIN(RADIANS(R2C2))*COS(RADIANS(RC[-4])))-SIN(RADIANS(RC[-14])))/(COS(RADIANS(R2C2))*SIN(RADIANS(RC[-4]))))),360)) -> 177.74538363528609
D58: =R[-1]C+1 -> 2017-02-26T00:00:00.000 | E58: =R5C2 -> 1899-12-31T14:00:00.000 | F58: =RC[-2]+2415018.5+RC[-1]-R4C2/24 -> 2457811.375 | G58: =(RC[-1]-2451545)/36525 -> 0.17156399726214921 | I58: =MOD(280.46646+RC[-2]*(36000.76983 + RC[-2]*0.0003032),360) -> 336.90244547383463 | J58: =357.52911+RC[-3]*(35999.05029 - 0.0001537*RC[-3]) -> 6533.6700708694943 | K58: =0.016708634-RC[-4]*(0.000042037+0.0000001267*RC[-4]) -> 1.6701418234933298E-2 | L58: =SIN(RADIANS(RC[-2]))*(1.914602-RC[-5]*(0.004817+0.000014*RC[-5]))+SIN(RADIANS(2*RC[-2]))*(0.019993-0.000101*RC[-5])+SIN(RADIANS(3*RC[-2]))*0.000289 -> 1.5609353572697573 | M58: =RC[-4]+RC[-1] -> 338.46338083110442 | N58: =RC[-4]+RC[-2] -> 6535.2310062267643 | O58: =(1.000001018*(1-RC[-4]*RC[-4]))/(1+RC[-4]*COS(RADIANS(RC[-1]))) -> 0.99029025596882614 | P58: =RC[-3]-0.00569-0.00478*SIN(RADIANS(125.04-1934.136*RC[-9])) -> 338.45553652239226 | Q58: =23+(26+((21.448-RC[-10]*(46.815+RC[-10]*(0.00059-RC[-10]*0.001813))))/60)/60 -> 23.437060062015934 | R58: =RC[-1]+0.00256*COS(RADIANS(125.04-1934.136*RC[-11])) -> 23.43477480270834 | S58: =DEGREES(ATAN2(COS(RADIANS(RC[-3])),COS(RADIANS(RC[-1]))*SIN(RADIANS(RC[-3])))) -> -19.912458418381824 | T58: =DEGREES(ASIN(SIN(RADIANS(RC[-2]))*SIN(RADIANS(RC[-4])))) -> -8.397879916189197 | U58: =TAN(RADIANS(RC[-3]/2))*TAN(RADIANS(RC[-3]/2)) -> 4.3017475456465913E-2 | V58: =4*DEGREES(RC[-1]*SIN(2*RADIANS(RC[-13]))-2*RC[-11]*SIN(RADIANS(RC[-12]))+4*RC[-11]*RC[-1]*SIN(RADIANS(RC[-12]))*COS(2*RADIANS(RC[-13]))-0.5*RC[-1]*RC[-1]*SIN(4*RADIANS(RC[-13]))-1.25*RC[-11]*RC[-11]*SIN(2*RADIANS(RC[-12]))) -> -12.77959601192512 | W58: =DEGREES(ACOS(COS(RADIANS(90.833))/(COS(RADIANS(R2C2))*COS(RADIANS(RC[-3])))-TAN(RADIANS(R2C2))*TAN(RADIANS(RC[-3])))) -> 68.737517455451567 | X58: =(720-4*R3C2-RC[-2]+R4C2*60)/1440 -> 1899-12-31T14:08:46.776 | Y58: =(RC[-1]*1440-RC[-2]*4)/1440 -> 1899-12-31T09:33:49.772 | Z58: =(RC[-2]*1440+RC[-3]*4)/1440 -> 1899-12-31T18:43:43.780 | AA58: =8*RC[-4] -> 549.90013964361253 | AB58: =MOD(RC[-23]*1440+RC[-6]+4*R3C2-60*R4C2,1440) -> 711.22040398807485 | AC58: =IF(RC[-1]/4<0,RC[-1]/4+180,RC[-1]/4-180) -> -2.1948990029812876 | AD58: =DEGREES(ACOS(SIN(RADIANS(R2C2))*SIN(RADIANS(RC[-10]))+COS(RADIANS(R2C2))*COS(RADIANS(RC[-10]))*COS(RADIANS(RC[-1])))) -> 78.412399275930525 | AE58: =90-RC[-1] -> 11.587600724069475 | AF58: =IF(RC[-1]>85,0,IF(RC[-1]>5,58.1/TAN(RADIANS(RC[-1]))-0.07/POWER(TAN(RADIANS(RC[-1])),3)+0.000086/POWER(TAN(RADIANS(RC[-1])),5),IF(RC[-1]>-0.575,1735+RC[-1]*(-518.2+RC[-1]*(103.4+RC[-1]*(-12.79+RC[-1]*0.711))),-20.772/TAN(RADIANS(RC[-1])))))/3600 -> 7.6519391449640831E-2 | AG58: =RC[-2]+RC[-1] -> 11.664120115519115 | AH58: =IF(RC[-5]>0,MOD(DEGREES(ACOS(((SIN(RADIANS(R2C2))*COS(RADIANS(RC[-4])))-SIN(RADIANS(RC[-14])))/(COS(RADIANS(R2C2))*SIN(RADIANS(RC[-4])))))+180,360),MOD(540-DEGREES(ACOS(((SIN(RADIANS(R2C2))*COS(RADIANS(RC[-4])))-SIN(RADIANS(RC[-14])))/(COS(RADIANS(R2C2))*SIN(RADIANS(RC[-4]))))),360)) -> 177.78344864285498
D59: =R[-1]C+1 -> 2017-02-27T00:00:00.000 | E59: =R5C2 -> 1899-12-31T14:00:00.000 | F59: =RC[-2]+2415018.5+RC[-1]-R4C2/24 -> 2457812.375 | G59: =(RC[-1]-2451545)/36525 -> 0.17159137577002054 | I59: =MOD(280.46646+RC[-2]*(36000.76983 + RC[-2]*0.0003032),360) -> 337.88809283684623 | J59: =357.52911+RC[-3]*(35999.05029 - 0.0001537*RC[-3]) -> 6534.655671149776 | K59: =0.016708634-RC[-4]*(0.000042037+0.0000001267*RC[-4]) -> 1.6701417082832605E-2 | L59: =SIN(RADIANS(RC[-2]))*(1.914602-RC[-5]*(0.004817+0.000014*RC[-5]))+SIN(RADIANS(2*RC[-2]))*(0.019993-0.000101*RC[-5])+SIN(RADIANS(3*RC[-2]))*0.000289 -> 1.5799792332939211 | M59: =RC[-4]+RC[-1] -> 339.46807207014012 | N59: =RC[-4]+RC[-2] -> 6536.2356503830697 | O59: =(1.000001018*(1-RC[-4]*RC[-4]))/(1+RC[-4]*COS(RADIANS(RC[-1]))) -> 0.99052771704813725 | P59: =RC[-3]-0.00569-0.00478*SIN(RADIANS(125.04-1934.136*RC[-9])) -> 339.46022381870586 | Q59: =23+(26+((21.448-RC[-10]*(46.815+RC[-10]*(0.00059-RC[-10]*0.001813))))/60)/60 -> 23.437059705980936 | R59: =RC[-1]+0.00256*COS(RADIANS(125.04-1934.136*RC[-11])) -> 23.434775513985411 | S59: =DEGREES(ATAN2(COS(RADIANS(RC[-3])),COS(RADIANS(RC[-1]))*SIN(RADIANS(RC[-3])))) -> -18.971452967074402 | T59: =DEGREES(ASIN(SIN(RADIANS(RC[-2]))*SIN(RADIANS(RC[-4])))) -> -8.0210987954188937 | U59: =TAN(RADIANS(RC[-3]/2))*TAN(RADIANS(RC[-3]/2)) -> 4.301747814199728E-2 | V59: =4*DEGREES(RC[-1]*SIN(2*RADIANS(RC[-13]))-2*RC[-11]*SIN(RADIANS(RC[-12]))+4*RC[-11]*RC[-1]*SIN(RADIANS(RC[-12]))*COS(2*RADIANS(RC[-13]))-0.5*RC[-1]*RC[-1]*SIN(4*RADIANS(RC[-13]))-1.25*RC[-11]*RC[-11]*SIN(2*RADIANS(RC[-12]))) -> -12.599055238558149 | W59: =DEGREES(ACOS(COS(RADIANS(90.833))/(COS(RADIANS(R2C2))*COS(RADIANS(RC[-3])))-TAN(RADIANS(R2C2))*TAN(RADIANS(RC[-3])))) -> 69.864707503019645 | X59: =(720-4*R3C2-RC[-2]+R4C2*60)/1440 -> 1899-12-31T14:08:35.943 | Y59: =(RC[-1]*1440-RC[-2]*4)/1440 -> 1899-12-31T09:29:08.414 | Z59: =(RC[-2]*1440+RC[-3]*4)/1440 -> 1899-12-31T18:48:03.473 | AA59: =8*RC[-4] -> 558.91766002415716 | AB59: =MOD(RC[-23]*1440+RC[-6]+4*R3C2-60*R4C2,1440) -> 711.40094476144191 | AC59: =IF(RC[-1]/4<0,RC[-1]/4+180,RC[-1]/4-180) -> -2.1497638096395235 | AD59: =DEGREES(ACOS(SIN(RADIANS(R2C2))*SIN(RADIANS(RC[-10]))+COS(RADIANS(R2C2))*COS(RADIANS(RC[-10]))*COS(RADIANS(RC[-1])))) -> 78.035059594999225 | AE59: =90-RC[-1] -> 11.964940405000775 | AF59: =IF(RC[-1]>85,0,IF(RC[-1]>5,58.1/TAN(RADIANS(RC[-1]))-0.07/POWER(TAN(RADIANS(RC[-1])),3)+0.000086/POWER(TAN(RADIANS(RC[-1])),5),IF(RC[-1]>-0.575,1735+RC[-1]*(-518.2+RC[-1]*(103.4+RC[-1]*(-12.79+RC[-1]*0.711))),-20.772/TAN(RADIANS(RC[-1])))))/3600 -> 7.4169373593187329E-2 | AG59: =RC[-2]+RC[-1] -> 12.039109778593962 | AH59: =IF(RC[-5]>0,MOD(DEGREES(ACOS(((SIN(RADIANS(R2C2))*COS(RADIANS(RC[-4])))-SIN(RADIANS(RC[-14])))/(COS(RADIANS(R2C2))*SIN(RADIANS(RC[-4])))))+180,360),MOD(540-DEGREES(ACOS(((SIN(RADIANS(R2C2))*COS(RADIANS(RC[-4])))-SIN(RADIANS(RC[-14])))/(COS(RADIANS(R2C2))*SIN(RADIANS(RC[-4]))))),360)) -> 177.8239807859452
D60: =R[-1]C+1 -> 2017-02-28T00:00:00.000 | E60: =R5C2 -> 1899-12-31T14:00:00.000 | F60: =RC[-2]+2415018.5+RC[-1]-R4C2/24 -> 2457813.375 | G60: =(RC[-1]-2451545)/36525 -> 0.17161875427789186 | I60: =MOD(280.46646+RC[-2]*(36000.76983 + RC[-2]*0.0003032),360) -> 338.87374019986055 | J60: =357.52911+RC[-3]*(35999.05029 - 0.0001537*RC[-3]) -> 6535.6412714300559 | K60: =0.016708634-RC[-4]*(0.000042037+0.0000001267*RC[-4]) -> 1.6701415930731722E-2 | L60: =SIN(RADIANS(RC[-2]))*(1.914602-RC[-5]*(0.004817+0.000014*RC[-5]))+SIN(RADIANS(2*RC[-2]))*(0.019993-0.000101*RC[-5])+SIN(RADIANS(3*RC[-2]))*0.000289 -> 1.5985386681683946 | M60: =RC[-4]+RC[-1] -> 340.47227886802892 | N60: =RC[-4]+RC[-2] -> 6537.2398100982246 | O60: =(1.000001018*(1-RC[-4]*RC[-4]))/(1+RC[-4]*COS(RADIANS(RC[-1]))) -> 0.99076797752123125 | P60: =RC[-3]-0.00569-0.00478*SIN(RADIANS(125.04-1934.136*RC[-9])) -> 340.46442667571603 | Q60: =23+(26+((21.448-RC[-10]*(46.815+RC[-10]*(0.00059-RC[-10]*0.001813))))/60)/60 -> 23.437059349945933 | R60: =RC[-1]+0.00256*COS(RADIANS(125.04-1934.136*RC[-11])) -> 23.434776227213586 | S60: =DEGREES(ATAN2(COS(RADIANS(RC[-3])),COS(RADIANS(RC[-1]))*SIN(RADIANS(RC[-3])))) -> -18.032647276997974 | T60: =DEGREES(ASIN(SIN(RADIANS(RC[-2]))*SIN(RADIANS(RC[-4])))) -> -7.6423694398278883 | U60: =TAN(RADIANS(RC[-3]/2))*TAN(RADIANS(RC[-3]/2)) -> 4.3017480834895414E-2 | V60: =4*DEGREES(RC[-1]*SIN(2*RADIANS(RC[-13]))-2*RC[-11]*SIN(RADIANS(RC[-12]))+4*RC[-11]*RC[-1]*SIN(RADIANS(RC[-12]))*COS(2*RADIANS(RC[-13]))-0.5*RC[-1]*RC[-1]*SIN(4*RADIANS(RC[-13]))-1.25*RC[-11]*RC[-11]*SIN(2*RADIANS(RC[-12]))) -> -12.409696951668748 | W60: =DEGREES(ACOS(COS(RADIANS(90.833))/(COS(RADIANS(R2C2))*COS(RADIANS(RC[-3])))-TAN(RADIANS(R2C2))*TAN(RADIANS(RC[-3])))) -> 70.987622794204526 | X60: =(720-4*R3C2-RC[-2]+R4C2*60)/1440 -> 1899-12-31T14:08:24.582 | Y60: =(RC[-1]*1440-RC[-2]*4)/1440 -> 1899-12-31T09:24:27.552 | Z60: =(RC[-2]*1440+RC[-3]*4)/1440 -> 1899-12-31T18:52:21.611 | AA60: =8*RC[-4] -> 567.90098235363621 | AB60: =MOD(RC[-23]*1440+RC[-6]+4*R3C2-60*R4C2,1440) -> 711.59030304833129 | AC60: =IF(RC[-1]/4<0,RC[-1]/4+180,RC[-1]/4-180) -> -2.1024242379171767 | AD60: =DEGREES(ACOS(SIN(RADIANS(R2C2))*SIN(RADIANS(RC[-10]))+COS(RADIANS(R2C2))*COS(RADIANS(RC[-10]))*COS(RADIANS(RC[-1])))) -> 77.655753433091192 | AE60: =90-RC[-1] -> 12.344246566908808 | AF60: =IF(RC[-1]>85,0,IF(RC[-1]>5,58.1/TAN(RADIANS(RC[-1]))-0.07/POWER(TAN(RADIANS(RC[-1])),3)+0.000086/POWER(TAN(RADIANS(RC[-1])),5),IF(RC[-1]>-0.575,1735+RC[-1]*(-518.2+RC[-1]*(103.4+RC[-1]*(-12.79+RC[-1]*0.711))),-20.772/TAN(RADIANS(RC[-1])))))/3600 -> 7.1938363373813541E-2 | AG60: =RC[-2]+RC[-1] -> 12.416184930282622 | AH60: =IF(RC[-5]>0,MOD(DEGREES(ACOS(((SIN(RADIANS(R2C2))*COS(RADIANS(RC[-4])))-SIN(RADIANS(RC[-14])))/(COS(RADIANS(R2C2))*SIN(RADIANS(RC[-4])))))+180,360),MOD(540-DEGREES(ACOS(((SIN(RADIANS(R2C2))*COS(RADIANS(RC[-4])))-SIN(RADIANS(RC[-14])))/(COS(RADIANS(R2C2))*SIN(RADIANS(RC[-4]))))),360)) -> 177.86692175209691
D61: =R[-1]C+1 -> 2017-03-01T00:00:00.000 | E61: =R5C2 -> 1899-12-31T14:00:00.000 | F61: =RC[-2]+2415018.5+RC[-1]-R4C2/24 -> 2457814.375 | G61: =(RC[-1]-2451545)/36525 -> 0.17164613278576318 | I61: =MOD(280.46646+RC[-2]*(36000.76983 + RC[-2]*0.0003032),360) -> 339.85938756287396 | J61: =357.52911+RC[-3]*(35999.05029 - 0.0001537*RC[-3]) -> 6536.6268717103367 | K61: =0.016708634-RC[-4]*(0.000042037+0.0000001267*RC[-4]) -> 1.6701414778630651E-2 | L61: =SIN(RADIANS(RC[-2]))*(1.914602-RC[-5]*(0.004817+0.000014*RC[-5]))+SIN(RADIANS(2*RC[-2]))*(0.019993-0.000101*RC[-5])+SIN(RADIANS(3*RC[-2]))*0.000289 -> 1.6166084159721621 | M61: =RC[-4]+RC[-1] -> 341.47599597884613 | N61: =RC[-4]+RC[-2] -> 6538.2434801263089 | O61: =(1.000001018*(1-RC[-4]*RC[-4]))/(1+RC[-4]*COS(RADIANS(RC[-1]))) -> 0.99101096225228069 | P61: =RC[-3]-0.00569-0.00478*SIN(RADIANS(125.04-1934.136*RC[-9])) -> 341.4681398475015 | Q61: =23+(26+((21.448-RC[-10]*(46.815+RC[-10]*(0.00059-RC[-10]*0.001813))))/60)/60 -> 23.437058993910931 | R61: =RC[-1]+0.00256*COS(RADIANS(125.04-1934.136*RC[-11])) -> 23.434776942391949 | S61: =DEGREES(ATAN2(COS(RADIANS(RC[-3])),COS(RADIANS(RC[-1]))*SIN(RADIANS(RC[-3])))) -> -17.095966442830377 | T61: =DEGREES(ASIN(SIN(RADIANS(RC[-2]))*SIN(RADIANS(RC[-4])))) -> -7.2618023052675467 | U61: =TAN(RADIANS(RC[-3]/2))*TAN(RADIANS(RC[-3]/2)) -> 4.3017483535156865E-2 | V61: =4*DEGREES(RC[-1]*SIN(2*RADIANS(RC[-13]))-2*RC[-11]*SIN(RADIANS(RC[-12]))+4*RC[-11]*RC[-1]*SIN(RADIANS(RC[-12]))*COS(2*RADIANS(RC[-13]))-0.5*RC[-1]*RC[-1]*SIN(4*RADIANS(RC[-13]))-1.25*RC[-11]*RC[-11]*SIN(2*RADIANS(RC[-12]))) -> -12.21183276106674 | W61: =DEGREES(ACOS(COS(RADIANS(90.833))/(COS(RADIANS(R2C2))*COS(RADIANS(RC[-3])))-TAN(RADIANS(R2C2))*TAN(RADIANS(RC[-3])))) -> 72.106528299423161 | X61: =(720-4*R3C2-RC[-2]+R4C2*60)/1440 -> 1899-12-31T14:08:12.710 | Y61: =(RC[-1]*1440-RC[-2]*4)/1440 -> 1899-12-31T09:19:47.143 | Z61: =(RC[-2]*1440+RC[-3]*4)/1440 -> 1899-12-31T18:56:38.277 | AA61: =8*RC[-4] -> 576.85222639538529 | AB61: =MOD(RC[-23]*1440+RC[-6]+4*R3C2-60*R4C2,1440) -> 711.78816723893328 | AC61: =IF(RC[-1]/4<0,RC[-1]/4+180,RC[-1]/4-180) -> -2.0529581902666791 | AD61: =DEGREES(ACOS(SIN(RADIANS(R2C2))*SIN(RADIANS(RC[-10]))+COS(RADIANS(R2C2))*COS(RADIANS(RC[-10]))*COS(RADIANS(RC[-1])))) -> 77.274593967790281 | AE61: =90-RC[-1] -> 12.725406032209719 | AF61: =IF(RC[-1]>85,0,IF(RC[-1]>5,58.1/TAN(RADIANS(RC[-1]))-0.07/POWER(TAN(RADIANS(RC[-1])),3)+0.000086/POWER(TAN(RADIANS(RC[-1])),5),IF(RC[-1]>-0.575,1735+RC[-1]*(-518.2+RC[-1]*(103.4+RC[-1]*(-12.79+RC[-1]*0.711))),-20.772/TAN(RADIANS(RC[-1])))))/3600 -> 6.9818399566766734E-2 | AG61: =RC[-2]+RC[-1] -> 12.795224431776486 | AH61: =IF(RC[-5]>0,MOD(DEGREES(ACOS(((SIN(RADIANS(R2C2))*COS(RADIANS(RC[-4])))-SIN(RADIANS(RC[-14])))/(COS(RADIANS(R2C2))*SIN(RADIANS(RC[-4])))))+180,360),MOD(540-DEGREES(ACOS(((SIN(RADIANS(R2C2))*COS(RADIANS(RC[-4])))-SIN(RADIANS(RC[-14])))/(COS(RADIANS(R2C2))*SIN(RADIANS(RC[-4]))))),360)) -> 177.91221138521144
D62: =R[-1]C+1 -> 2017-03-02T00:00:00.000 | E62: =R5C2 -> 1899-12-31T14:00:00.000 | F62: =RC[-2]+2415018.5+RC[-1]-R4C2/24 -> 2457815.375 | G62: =(RC[-1]-2451545)/36525 -> 0.17167351129363451 | I62: =MOD(280.46646+RC[-2]*(36000.76983 + RC[-2]*0.0003032),360) -> 340.84503492588829 | J62: =357.52911+RC[-3]*(35999.05029 - 0.0001537*RC[-3]) -> 6537.6124719906175 | K62: =0.016708634-RC[-4]*(0.000042037+0.0000001267*RC[-4]) -> 1.6701413626529389E-2 | L62: =SIN(RADIANS(RC[-2]))*(1.914602-RC[-5]*(0.004817+0.000014*RC[-5]))+SIN(RADIANS(2*RC[-2]))*(0.019993-0.000101*RC[-5])+SIN(RADIANS(3*RC[-2]))*0.000289 -> 1.6341833956488272 | M62: =RC[-4]+RC[-1] -> 342.47921832153713 | N62: =RC[-4]+RC[-2] -> 6539.246655386266 | O62: =(1.000001018*(1-RC[-4]*RC[-4]))/(1+RC[-4]*COS(RADIANS(RC[-1]))) -> 0.99125659536365818 | P62: =RC[-3]-0.00569-0.00478*SIN(RADIANS(125.04-1934.136*RC[-9])) -> 342.47135825301109 | Q62: =23+(26+((21.448-RC[-10]*(46.815+RC[-10]*(0.00059-RC[-10]*0.001813))))/60)/60 -> 23.437058637875932 | R62: =RC[-1]+0.00256*COS(RADIANS(125.04-1934.136*RC[-11])) -> 23.434777659519597 | S62: =DEGREES(ATAN2(COS(RADIANS(RC[-3])),COS(RADIANS(RC[-1]))*SIN(RADIANS(RC[-3])))) -> -16.161334351468735 | T62: =DEGREES(ASIN(SIN(RADIANS(RC[-2]))*SIN(RADIANS(RC[-4])))) -> -6.8795073487984375 | U62: =TAN(RADIANS(RC[-3]/2))*TAN(RADIANS(RC[-3]/2)) -> 4.3017486242778222E-2 | V62: =4*DEGREES(RC[-1]*SIN(2*RADIANS(RC[-13]))-2*RC[-11]*SIN(RADIANS(RC[-12]))+4*RC[-11]*RC[-1]*SIN(RADIANS(RC[-12]))*COS(2*RADIANS(RC[-13]))-0.5*RC[-1]*RC[-1]*SIN(4*RADIANS(RC[-13]))-1.25*RC[-11]*RC[-11]*SIN(2*RADIANS(RC[-12]))) -> -12.005778923594347 | W62: =DEGREES(ACOS(COS(RADIANS(90.833))/(COS(RADIANS(R2C2))*COS(RADIANS(RC[-3])))-TAN(RADIANS(R2C2))*TAN(RADIANS(RC[-3])))) -> 73.221681170507935 | X62: =(720-4*R3C2-RC[-2]+R4C2*60)/1440 -> 1899-12-31T14:08:00.347 | Y62: =(RC[-1]*1440-RC[-2]*4)/1440 -> 1899-12-31T09:15:07.143 | Z62: =(RC[-2]*1440+RC[-3]*4)/1440 -> 1899-12-31T19:00:53.550 | AA62: =8*RC[-4] -> 585.77344936406348 | AB62: =MOD(RC[-23]*1440+RC[-6]+4*R3C2-60*R4C2,1440) -> 711.99422107640567 | AC62: =IF(RC[-1]/4<0,RC[-1]/4+180,RC[-1]/4-180) -> -2.0014447308985837 | AD62: =DEGREES(ACOS(SIN(RADIANS(R2C2))*SIN(RADIANS(RC[-10]))+COS(RADIANS(R2C2))*COS(RADIANS(RC[-10]))*COS(RADIANS(RC[-1])))) -> 76.891693909270657 | AE62: =90-RC[-1] -> 13.108306090729343 | AF62: =IF(RC[-1]>85,0,IF(RC[-1]>5,58.1/TAN(RADIANS(RC[-1]))-0.07/POWER(TAN(RADIANS(RC[-1])),3)+0.000086/POWER(TAN(RADIANS(RC[-1])),5),IF(RC[-1]>-0.575,1735+RC[-1]*(-518.2+RC[-1]*(103.4+RC[-1]*(-12.79+RC[-1]*0.711))),-20.772/TAN(RADIANS(RC[-1])))))/3600 -> 6.7802156317983531E-2 | AG62: =RC[-2]+RC[-1] -> 13.176108247047326 | AH62: =IF(RC[-5]>0,MOD(DEGREES(ACOS(((SIN(RADIANS(R2C2))*COS(RADIANS(RC[-4])))-SIN(RADIANS(RC[-14])))/(COS(RADIANS(R2C2))*SIN(RADIANS(RC[-4])))))+180,360),MOD(540-DEGREES(ACOS(((SIN(RADIANS(R2C2))*COS(RADIANS(RC[-4])))-SIN(RADIANS(RC[-14])))/(COS(RADIANS(R2C2))*SIN(RADIANS(RC[-4]))))),360)) -> 177.95978776190111
D63: =R[-1]C+1 -> 2017-03-03T00:00:00.000 | E63: =R5C2 -> 1899-12-31T14:00:00.000 | F63: =RC[-2]+2415018.5+RC[-1]-R4C2/24 -> 2457816.375 | G63: =(RC[-1]-2451545)/36525 -> 0.17170088980150583 | I63: =MOD(280.46646+RC[-2]*(36000.76983 + RC[-2]*0.0003032),360) -> 341.83068228890352 | J63: =357.52911+RC[-3]*(35999.05029 - 0.0001537*RC[-3]) -> 6538.5980722708964 | K63: =0.016708634-RC[-4]*(0.000042037+0.0000001267*RC[-4]) -> 1.6701412474427937E-2 | L63: =SIN(RADIANS(RC[-2]))*(1.914602-RC[-5]*(0.004817+0.000014*RC[-5]))+SIN(RADIANS(2*RC[-2]))*(0.019993-0.000101*RC[-5])+SIN(RADIANS(3*RC[-2]))*0.000289 -> 1.6512586921445029 | M63: =RC[-4]+RC[-1] -> 343.48194098104801 | N63: =RC[-4]+RC[-2] -> 6540.2493309630408 | O63: =(1.000001018*(1-RC[-4]*RC[-4]))/(1+RC[-4]*COS(RADIANS(RC[-1]))) -> 0.99150480026314225 | P63: =RC[-3]-0.00569-0.00478*SIN(RADIANS(125.04-1934.136*RC[-9])) -> 343.4740769771941 | Q63: =23+(26+((21.448-RC[-10]*(46.815+RC[-10]*(0.00059-RC[-10]*0.001813))))/60)/60 -> 23.43705828184093 | R63: =RC[-1]+0.00256*COS(RADIANS(125.04-1934.136*RC[-11])) -> 23.434778378595603 | S63: =DEGREES(ATAN2(COS(RADIANS(RC[-3])),COS(RADIANS(RC[-1]))*SIN(RADIANS(RC[-3])))) -> -15.228673767057151 | T63: =DEGREES(ASIN(SIN(RADIANS(RC[-2]))*SIN(RADIANS(RC[-4])))) -> -6.4955940222468636 | U63: =TAN(RADIANS(RC[-3]/2))*TAN(RADIANS(RC[-3]/2)) -> 4.3017488957755978E-2 | V63: =4*DEGREES(RC[-1]*SIN(2*RADIANS(RC[-13]))-2*RC[-11]*SIN(RADIANS(RC[-12]))+4*RC[-11]*RC[-1]*SIN(RADIANS(RC[-12]))*COS(2*RADIANS(RC[-13]))-0.5*RC[-1]*RC[-1]*SIN(4*RADIANS(RC[-13]))-1.25*RC[-11]*RC[-11]*SIN(2*RADIANS(RC[-12]))) -> -11.791855916873214 | W63: =DEGREES(ACOS(COS(RADIANS(90.833))/(COS(RADIANS(R2C2))*COS(RADIANS(RC[-3])))-TAN(RADIANS(R2C2))*TAN(RADIANS(RC[-3])))) -> 74.333331613267731 | X63: =(720-4*R3C2-RC[-2]+R4C2*60)/1440 -> 1899-12-31T14:07:47.511 | Y63: =(RC[-1]*1440-RC[-2]*4)/1440 -> 1899-12-31T09:10:27.512 | Z63: =(RC[-2]*1440+RC[-3]*4)/1440 -> 1899-12-31T19:05:07.511 | AA63: =8*RC[-4] -> 594.66665290614185 | AB63: =MOD(RC[-23]*1440+RC[-6]+4*R3C2-60*R4C2,1440) -> 712.20814408312674 | AC63: =IF(RC[-1]/4<0,RC[-1]/4+180,RC[-1]/4-180) -> -1.947963979218315 | AD63: =DEGREES(ACOS(SIN(RADIANS(R2C2))*SIN(RADIANS(RC[-10]))+COS(RADIANS(R2C2))*COS(RADIANS(RC[-10]))*COS(RADIANS(RC[-1])))) -> 76.507165481379602 | AE63: =90-RC[-1] -> 13.492834518620398 | AF63: =IF(RC[-1]>85,0,IF(RC[-1]>5,58.1/TAN(RADIANS(RC[-1]))-0.07/POWER(TAN(RADIANS(RC[-1])),3)+0.000086/POWER(TAN(RADIANS(RC[-1])),5),IF(RC[-1]>-0.575,1735+RC[-1]*(-518.2+RC[-1]*(103.4+RC[-1]*(-12.79+RC[-1]*0.711))),-20.772/TAN(RADIANS(RC[-1])))))/3600 -> 6.5882887696636513E-2 | AG63: =RC[-2]+RC[-1] -> 13.558717406317035 | AH63: =IF(RC[-5]>0,MOD(DEGREES(ACOS(((SIN(RADIANS(R2C2))*COS(RADIANS(RC[-4])))-SIN(RADIANS(RC[-14])))/(COS(RADIANS(R2C2))*SIN(RADIANS(RC[-4])))))+180,360),MOD(540-DEGREES(ACOS(((SIN(RADIANS(R2C2))*COS(RADIANS(RC[-4])))-SIN(RADIANS(RC[-14])))/(COS(RADIANS(R2C2))*SIN(RADIANS(RC[-4]))))),360)) -> 178.00958726653096
D64: =R[-1]C+1 -> 2017-03-04T00:00:00.000 | E64: =R5C2 -> 1899-12-31T14:00:00.000 | F64: =RC[-2]+2415018.5+RC[-1]-R4C2/24 -> 2457817.375 | G64: =(RC[-1]-2451545)/36525 -> 0.17172826830937715 | I64: =MOD(280.46646+RC[-2]*(36000.76983 + RC[-2]*0.0003032),360) -> 342.81632965191875 | J64: =357.52911+RC[-3]*(35999.05029 - 0.0001537*RC[-3]) -> 6539.5836725511763 | K64: =0.016708634-RC[-4]*(0.000042037+0.0000001267*RC[-4]) -> 1.6701411322326293E-2 | L64: =SIN(RADIANS(RC[-2]))*(1.914602-RC[-5]*(0.004817+0.000014*RC[-5]))+SIN(RADIANS(2*RC[-2]))*(0.019993-0.000101*RC[-5])+SIN(RADIANS(3*RC[-2]))*0.000289 -> 1.6678295574729398 | M64: =RC[-4]+RC[-1] -> 344.48415920939169 | N64: =RC[-4]+RC[-2] -> 6541.2515021086492 | O64: =(1.000001018*(1-RC[-4]*RC[-4]))/(1+RC[-4]*COS(RADIANS(RC[-1]))) -> 0.99175549967123666 | P64: =RC[-3]-0.00569-0.00478*SIN(RADIANS(125.04-1934.136*RC[-9])) -> 344.47629127206699 | Q64: =23+(26+((21.448-RC[-10]*(46.815+RC[-10]*(0.00059-RC[-10]*0.001813))))/60)/60 -> 23.437057925805931 | R64: =RC[-1]+0.00256*COS(RADIANS(125.04-1934.136*RC[-11])) -> 23.434779099619053 | S64: =DEGREES(ATAN2(COS(RADIANS(RC[-3])),COS(RADIANS(RC[-1]))*SIN(RADIANS(RC[-3])))) -> -14.297906413860769 | T64: =DEGREES(ASIN(SIN(RADIANS(RC[-2]))*SIN(RADIANS(RC[-4])))) -> -6.1101712674822375 | U64: =TAN(RADIANS(RC[-3]/2))*TAN(RADIANS(RC[-3]/2)) -> 4.3017491680086686E-2 | V64: =4*DEGREES(RC[-1]*SIN(2*RADIANS(RC[-13]))-2*RC[-11]*SIN(RADIANS(RC[-12]))+4*RC[-11]*RC[-1]*SIN(RADIANS(RC[-12]))*COS(2*RADIANS(RC[-13]))-0.5*RC[-1]*RC[-1]*SIN(4*RADIANS(RC[-13]))-1.25*RC[-11]*RC[-11]*SIN(2*RADIANS(RC[-12]))) -> -11.570388026130455 | W64: =DEGREES(ACOS(COS(RADIANS(90.833))/(COS(RADIANS(R2C2))*COS(RADIANS(RC[-3])))-TAN(RADIANS(R2C2))*TAN(RADIANS(RC[-3])))) -> 75.441723676616931 | X64: =(720-4*R3C2-RC[-2]+R4C2*60)/1440 -> 1899-12-31T14:07:34.223 | Y64: =(RC[-1]*1440-RC[-2]*4)/1440 -> 1899-12-31T09:05:48.210 | Z64: =(RC[-2]*1440+RC[-3]*4)/1440 -> 1899-12-31T19:09:20.237 | AA64: =8*RC[-4] -> 603.53378941293545 | AB64: =MOD(RC[-23]*1440+RC[-6]+4*R3C2-60*R4C2,1440) -> 712.42961197386956 | AC64: =IF(RC[-1]/4<0,RC[-1]/4+180,RC[-1]/4-180) -> -1.8925970065326112 | AD64: =DEGREES(ACOS(SIN(RADIANS(R2C2))*SIN(RADIANS(RC[-10]))+COS(RADIANS(R2C2))*COS(RADIANS(RC[-10]))*COS(RADIANS(RC[-1])))) -> 76.121120404658342 | AE64: =90-RC[-1] -> 13.878879595341658 | AF64: =IF(RC[-1]>85,0,IF(RC[-1]>5,58.1/TAN(RADIANS(RC[-1]))-0.07/POWER(TAN(RADIANS(RC[-1])),3)+0.000086/POWER(TAN(RADIANS(RC[-1])),5),IF(RC[-1]>-0.575,1735+RC[-1]*(-518.2+RC[-1]*(103.4+RC[-1]*(-12.79+RC[-1]*0.711))),-20.772/TAN(RADIANS(RC[-1])))))/3600 -> 6.405437698826931E-2 | AG64: =RC[-2]+RC[-1] -> 13.942933972329927 | AH64: =IF(RC[-5]>0,MOD(DEGREES(ACOS(((SIN(RADIANS(R2C2))*COS(RADIANS(RC[-4])))-SIN(RADIANS(RC[-14])))/(COS(RADIANS(R2C2))*SIN(RADIANS(RC[-4])))))+180,360),MOD(540-DEGREES(ACOS(((SIN(RADIANS(R2C2))*COS(RADIANS(RC[-4])))-SIN(RADIANS(RC[-14])))/(COS(RADIANS(R2C2))*SIN(RADIANS(RC[-4]))))),360)) -> 178.06154466473549
D65: =R[-1]C+1 -> 2017-03-05T00:00:00.000 | E65: =R5C2 -> 1899-12-31T14:00:00.000 | F65: =RC[-2]+2415018.5+RC[-1]-R4C2/24 -> 2457818.375 | G65: =(RC[-1]-2451545)/36525 -> 0.17175564681724845 | I65: =MOD(280.46646+RC[-2]*(36000.76983 + RC[-2]*0.0003032),360) -> 343.80197701493307 | J65: =357.52911+RC[-3]*(35999.05029 - 0.0001537*RC[-3]) -> 6540.5692728314552 | K65: =0.016708634-RC[-4]*(0.000042037+0.0000001267*RC[-4]) -> 1.6701410170224463E-2 | L65: =SIN(RADIANS(RC[-2]))*(1.914602-RC[-5]*(0.004817+0.000014*RC[-5]))+SIN(RADIANS(2*RC[-2]))*(0.019993-0.000101*RC[-5])+SIN(RADIANS(3*RC[-2]))*0.000289 -> 1.6838914117079273 | M65: =RC[-4]+RC[-1] -> 345.48586842664099 | N65: =RC[-4]+RC[-2] -> 6542.2531642431632 | O65: =(1.000001018*(1-RC[-4]*RC[-4]))/(1+RC[-4]*COS(RADIANS(RC[-1]))) -> 0.99200861564858178 | P65: =RC[-3]-0.00569-0.00478*SIN(RADIANS(125.04-1934.136*RC[-9])) -> 345.47799655770575 | Q65: =23+(26+((21.448-RC[-10]*(46.815+RC[-10]*(0.00059-RC[-10]*0.001813))))/60)/60 -> 23.437057569770928 | R65: =RC[-1]+0.00256*COS(RADIANS(125.04-1934.136*RC[-11])) -> 23.434779822589022 | S65: =DEGREES(ATAN2(COS(RADIANS(RC[-3])),COS(RADIANS(RC[-1]))*SIN(RADIANS(RC[-3])))) -> -13.368953057030255 | T65: =DEGREES(ASIN(SIN(RADIANS(RC[-2]))*SIN(RADIANS(RC[-4])))) -> -5.7233475133253009 | U65: =TAN(RADIANS(RC[-3]/2))*TAN(RADIANS(RC[-3]/2)) -> 4.3017494409766877E-2 | V65: =4*DEGREES(RC[-1]*SIN(2*RADIANS(RC[-13]))-2*RC[-11]*SIN(RADIANS(RC[-12]))+4*RC[-11]*RC[-1]*SIN(RADIANS(RC[-12]))*COS(2*RADIANS(RC[-13]))-0.5*RC[-1]*RC[-1]*SIN(4*RADIANS(RC[-13]))-1.25*RC[-11]*RC[-11]*SIN(2*RADIANS(RC[-12]))) -> -11.341702944539582 | W65: =DEGREES(ACOS(COS(RADIANS(90.833))/(COS(RADIANS(R2C2))*COS(RADIANS(RC[-3])))-TAN(RADIANS(R2C2))*TAN(RADIANS(RC[-3])))) -> 76.547095969503204 | X65: =(720-4*R3C2-RC[-2]+R4C2*60)/1440 -> 1899-12-31T14:07:20.502 | Y65: =(RC[-1]*1440-RC[-2]*4)/1440 -> 1899-12-31T09:01:09.199 | Z65: =(RC[-2]*1440+RC[-3]*4)/1440 -> 1899-12-31T19:13:31.805 | AA65: =8*RC[-4] -> 612.37676775602563 | AB65: =MOD(RC[-23]*1440+RC[-6]+4*R3C2-60*R4C2,1440) -> 712.65829705546037 | AC65: =IF(RC[-1]/4<0,RC[-1]/4+180,RC[-1]/4-180) -> -1.8354257361349084 | AD65: =DEGREES(ACOS(SIN(RADIANS(R2C2))*SIN(RADIANS(RC[-10]))+COS(RADIANS(R2C2))*COS(RADIANS(RC[-10]))*COS(RADIANS(RC[-1])))) -> 75.733669881251544 | AE65: =90-RC[-1] -> 14.266330118748456 | AF65: =IF(RC[-1]>85,0,IF(RC[-1]>5,58.1/TAN(RADIANS(RC[-1]))-0.07/POWER(TAN(RADIANS(RC[-1])),3)+0.000086/POWER(TAN(RADIANS(RC[-1])),5),IF(RC[-1]>-0.575,1735+RC[-1]*(-518.2+RC[-1]*(103.4+RC[-1]*(-12.79+RC[-1]*0.711))),-20.772/TAN(RADIANS(RC[-1])))))/3600 -> 6.2310890444670357E-2 | AG65: =RC[-2]+RC[-1] -> 14.328641009193127 | AH65: =IF(RC[-5]>0,MOD(DEGREES(ACOS(((SIN(RADIANS(R2C2))*COS(RADIANS(RC[-4])))-SIN(RADIANS(RC[-14])))/(COS(RADIANS(R2C2))*SIN(RADIANS(RC[-4])))))+180,360),MOD(540-DEGREES(ACOS(((SIN(RADIANS(R2C2))*COS(RADIANS(RC[-4])))-SIN(RADIANS(RC[-14])))/(COS(RADIANS(R2C2))*SIN(RADIANS(RC[-4]))))),360)) -> 178.11559317530111
D66: =R[-1]C+1 -> 2017-03-06T00:00:00.000 | E66: =R5C2 -> 1899-12-31T14:00:00.000 | F66: =RC[-2]+2415018.5+RC[-1]-R4C2/24 -> 2457819.375 | G66: =(RC[-1]-2451545)/36525 -> 0.17178302532511977 | I66: =MOD(280.46646+RC[-2]*(36000.76983 + RC[-2]*0.0003032),360) -> 344.78762437795012 | J66: =357.52911+RC[-3]*(35999.05029 - 0.0001537*RC[-3]) -> 6541.5548731117342 | K66: =0.016708634-RC[-4]*(0.000042037+0.0000001267*RC[-4]) -> 1.6701409018122441E-2 | L66: =SIN(RADIANS(RC[-2]))*(1.914602-RC[-5]*(0.004817+0.000014*RC[-5]))+SIN(RADIANS(2*RC[-2]))*(0.019993-0.000101*RC[-5])+SIN(RADIANS(3*RC[-2]))*0.000289 -> 1.699439843903769 | M66: =RC[-4]+RC[-1] -> 346.48706422185387 | N66: =RC[-4]+RC[-2] -> 6543.2543129556379 | O66: =(1.000001018*(1-RC[-4]*RC[-4]))/(1+RC[-4]*COS(RADIANS(RC[-1]))) -> 0.99226406962346048 | P66: =RC[-3]-0.00569-0.00478*SIN(RADIANS(125.04-1934.136*RC[-9])) -> 346.47918842317188 | Q66: =23+(26+((21.448-RC[-10]*(46.815+RC[-10]*(0.00059-RC[-10]*0.001813))))/60)/60 -> 23.43705721373593 | R66: =RC[-1]+0.00256*COS(RADIANS(125.04-1934.136*RC[-11])) -> 23.434780547504598 | S66: =DEGREES(ATAN2(COS(RADIANS(RC[-3])),COS(RADIANS(RC[-1]))*SIN(RADIANS(RC[-3])))) -> -12.441733581293501 | T66: =DEGREES(ASIN(SIN(RADIANS(RC[-2]))*SIN(RADIANS(RC[-4])))) -> -5.3352306739916573 | U66: =TAN(RADIANS(RC[-3]/2))*TAN(RADIANS(RC[-3]/2)) -> 4.3017497146793079E-2 | V66: =4*DEGREES(RC[-1]*SIN(2*RADIANS(RC[-13]))-2*RC[-11]*SIN(RADIANS(RC[-12]))+4*RC[-11]*RC[-1]*SIN(RADIANS(RC[-12]))*COS(2*RADIANS(RC[-13]))-0.5*RC[-1]*RC[-1]*SIN(4*RADIANS(RC[-13]))-1.25*RC[-11]*RC[-11]*SIN(2*RADIANS(RC[-12]))) -> -11.106131387415083 | W66: =DEGREES(ACOS(COS(RADIANS(90.833))/(COS(RADIANS(R2C2))*COS(RADIANS(RC[-3])))-TAN(RADIANS(R2C2))*TAN(RADIANS(RC[-3])))) -> 77.649682315419057 | X66: =(720-4*R3C2-RC[-2]+R4C2*60)/1440 -> 1899-12-31T14:07:06.368 | Y66: =(RC[-1]*1440-RC[-2]*4)/1440 -> 1899-12-31T08:56:30.444 | Z66: =(RC[-2]*1440+RC[-3]*4)/1440 -> 1899-12-31T19:17:42.292 | AA66: =8*RC[-4] -> 621.19745852335245 | AB66: =MOD(RC[-23]*1440+RC[-6]+4*R3C2-60*R4C2,1440) -> 712.89386861258492 | AC66: =IF(RC[-1]/4<0,RC[-1]/4+180,RC[-1]/4-180) -> -1.7765328468537689 | AD66: =DEGREES(ACOS(SIN(RADIANS(R2C2))*SIN(RADIANS(RC[-10]))+COS(RADIANS(R2C2))*COS(RADIANS(RC[-10]))*COS(RADIANS(RC[-1])))) -> 75.344924581647646 | AE66: =90-RC[-1] -> 14.655075418352354 | AF66: =IF(RC[-1]>85,0,IF(RC[-1]>5,58.1/TAN(RADIANS(RC[-1]))-0.07/POWER(TAN(RADIANS(RC[-1])),3)+0.000086/POWER(TAN(RADIANS(RC[-1])),5),IF(RC[-1]>-0.575,1735+RC[-1]*(-518.2+RC[-1]*(103.4+RC[-1]*(-12.79+RC[-1]*0.711))),-20.772/TAN(RADIANS(RC[-1])))))/3600 -> 6.0647135180336202E-2 | AG66: =RC[-2]+RC[-1] -> 14.715722553532689 | AH66: =IF(RC[-5]>0,MOD(DEGREES(ACOS(((SIN(RADIANS(R2C2))*COS(RADIANS(RC[-4])))-SIN(RADIANS(RC[-14])))/(COS(RADIANS(R2C2))*SIN(RADIANS(RC[-4])))))+180,360),MOD(540-DEGREES(ACOS(((SIN(RADIANS(R2C2))*COS(RADIANS(RC[-4])))-SIN(RADIANS(RC[-14])))/(COS(RADIANS(R2C2))*SIN(RADIANS(RC[-4]))))),360)) -> 178.17166454026835
D67: =R[-1]C+1 -> 2017-03-07T00:00:00.000 | E67: =R5C2 -> 1899-12-31T14:00:00.000 | F67: =RC[-2]+2415018.5+RC[-1]-R4C2/24 -> 2457820.375 | G67: =(RC[-1]-2451545)/36525 -> 0.17181040383299109 | I67: =MOD(280.46646+RC[-2]*(36000.76983 + RC[-2]*0.0003032),360) -> 345.77327174096627 | J67: =357.52911+RC[-3]*(35999.05029 - 0.0001537*RC[-3]) -> 6542.5404733920141 | K67: =0.016708634-RC[-4]*(0.000042037+0.0000001267*RC[-4]) -> 1.6701407866020229E-2 | L67: =SIN(RADIANS(RC[-2]))*(1.914602-RC[-5]*(0.004817+0.000014*RC[-5]))+SIN(RADIANS(2*RC[-2]))*(0.019993-0.000101*RC[-5])+SIN(RADIANS(3*RC[-2]))*0.000289 -> 1.7144706129438136 | M67: =RC[-4]+RC[-1] -> 347.48774235391011 | N67: =RC[-4]+RC[-2] -> 6544.2549440049579 | O67: =(1.000001018*(1-RC[-4]*RC[-4]))/(1+RC[-4]*COS(RADIANS(RC[-1]))) -> 0.99252178241936928 | P67: =RC[-3]-0.00569-0.00478*SIN(RADIANS(125.04-1934.136*RC[-9])) -> 347.47986262734838 | Q67: =23+(26+((21.448-RC[-10]*(46.815+RC[-10]*(0.00059-RC[-10]*0.001813))))/60)/60 -> 23.437056857700927 | R67: =RC[-1]+0.00256*COS(RADIANS(125.04-1934.136*RC[-11])) -> 23.434781274364848 | S67: =DEGREES(ATAN2(COS(RADIANS(RC[-3])),COS(RADIANS(RC[-1]))*SIN(RADIANS(RC[-3])))) -> -11.516167067648333 | T67: =DEGREES(ASIN(SIN(RADIANS(RC[-2]))*SIN(RADIANS(RC[-4])))) -> -4.9459281489879254 | U67: =TAN(RADIANS(RC[-3]/2))*TAN(RADIANS(RC[-3]/2)) -> 4.3017499891161777E-2 | V67: =4*DEGREES(RC[-1]*SIN(2*RADIANS(RC[-13]))-2*RC[-11]*SIN(RADIANS(RC[-12]))+4*RC[-11]*RC[-1]*SIN(RADIANS(RC[-12]))*COS(2*RADIANS(RC[-13]))-0.5*RC[-1]*RC[-1]*SIN(4*RADIANS(RC[-13]))-1.25*RC[-11]*RC[-11]*SIN(2*RADIANS(RC[-12]))) -> -10.86400672050673 | W67: =DEGREES(ACOS(COS(RADIANS(90.833))/(COS(RADIANS(R2C2))*COS(RADIANS(RC[-3])))-TAN(RADIANS(R2C2))*TAN(RADIANS(RC[-3])))) -> 78.74971235301895 | X67: =(720-4*R3C2-RC[-2]+R4C2*60)/1440 -> 1899-12-31T14:06:51.840 | Y67: =(RC[-1]*1440-RC[-2]*4)/1440 -> 1899-12-31T08:51:51.909 | Z67: =(RC[-2]*1440+RC[-3]*4)/1440 -> 1899-12-31T19:21:51.771 | AA67: =8*RC[-4] -> 629.9976988241516 | AB67: =MOD(RC[-23]*1440+RC[-6]+4*R3C2-60*R4C2,1440) -> 713.13599327949328 | AC67: =IF(RC[-1]/4<0,RC[-1]/4+180,RC[-1]/4-180) -> -1.7160016801266806 | AD67: =DEGREES(ACOS(SIN(RADIANS(R2C2))*SIN(RADIANS(RC[-10]))+COS(RADIANS(R2C2))*COS(RADIANS(RC[-10]))*COS(RADIANS(RC[-1])))) -> 74.954994633202162 | AE67: =90-RC[-1] -> 15.045005366797838 | AF67: =IF(RC[-1]>85,0,IF(RC[-1]>5,58.1/TAN(RADIANS(RC[-1]))-0.07/POWER(TAN(RADIANS(RC[-1])),3)+0.000086/POWER(TAN(RADIANS(RC[-1])),5),IF(RC[-1]>-0.575,1735+RC[-1]*(-518.2+RC[-1]*(103.4+RC[-1]*(-12.79+RC[-1]*0.711))),-20.772/TAN(RADIANS(RC[-1])))))/3600 -> 5.9058220896900993E-2 | AG67: =RC[-2]+RC[-1] -> 15.104063587694739 | AH67: =IF(RC[-5]>0,MOD(DEGREES(ACOS(((SIN(RADIANS(R2C2))*COS(RADIANS(RC[-4])))-SIN(RADIANS(RC[-14])))/(COS(RADIANS(R2C2))*SIN(RADIANS(RC[-4])))))+180,360),MOD(540-DEGREES(ACOS(((SIN(RADIANS(R2C2))*COS(RADIANS(RC[-4])))-SIN(RADIANS(RC[-14])))/(COS(RADIANS(R2C2))*SIN(RADIANS(RC[-4]))))),360)) -> 178.22968909314261
D68: =R[-1]C+1 -> 2017-03-08T00:00:00.000 | E68: =R5C2 -> 1899-12-31T14:00:00.000 | F68: =RC[-2]+2415018.5+RC[-1]-R4C2/24 -> 2457821.375 | G68: =(RC[-1]-2451545)/36525 -> 0.17183778234086242 | I68: =MOD(280.46646+RC[-2]*(36000.76983 + RC[-2]*0.0003032),360) -> 346.75891910398332 | J68: =357.52911+RC[-3]*(35999.05029 - 0.0001537*RC[-3]) -> 6543.526073672293 | K68: =0.016708634-RC[-4]*(0.000042037+0.0000001267*RC[-4]) -> 1.6701406713917826E-2 | L68: =SIN(RADIANS(RC[-2]))*(1.914602-RC[-5]*(0.004817+0.000014*RC[-5]))+SIN(RADIANS(2*RC[-2]))*(0.019993-0.000101*RC[-5])+SIN(RADIANS(3*RC[-2]))*0.000289 -> 1.7289796483176263 | M68: =RC[-4]+RC[-1] -> 348.48789875230096 | N68: =RC[-4]+RC[-2] -> 6545.2550533206104 | O68: =(1.000001018*(1-RC[-4]*RC[-4]))/(1+RC[-4]*COS(RADIANS(RC[-1]))) -> 0.99278167428264952 | P68: =RC[-3]-0.00569-0.00478*SIN(RADIANS(125.04-1934.136*RC[-9])) -> 348.48001509972988 | Q68: =23+(26+((21.448-RC[-10]*(46.815+RC[-10]*(0.00059-RC[-10]*0.001813))))/60)/60 -> 23.437056501665928 | R68: =RC[-1]+0.00256*COS(RADIANS(125.04-1934.136*RC[-11])) -> 23.434782003168852 | S68: =DEGREES(ATAN2(COS(RADIANS(RC[-3])),COS(RADIANS(RC[-1]))*SIN(RADIANS(RC[-3])))) -> -10.592171868074159 | T68: =DEGREES(ASIN(SIN(RADIANS(RC[-2]))*SIN(RADIANS(RC[-4])))) -> -4.5555468243525503 | U68: =TAN(RADIANS(RC[-3]/2))*TAN(RADIANS(RC[-3]/2)) -> 4.30175026428695E-2 | V68: =4*DEGREES(RC[-1]*SIN(2*RADIANS(RC[-13]))-2*RC[-11]*SIN(RADIANS(RC[-12]))+4*RC[-11]*RC[-1]*SIN(RADIANS(RC[-12]))*COS(2*RADIANS(RC[-13]))-0.5*RC[-1]*RC[-1]*SIN(4*RADIANS(RC[-13]))-1.25*RC[-11]*RC[-11]*SIN(2*RADIANS(RC[-12]))) -> -10.615664602528755 | W68: =DEGREES(ACOS(COS(RADIANS(90.833))/(COS(RADIANS(R2C2))*COS(RADIANS(RC[-3])))-TAN(RADIANS(R2C2))*TAN(RADIANS(RC[-3])))) -> 79.847412090405129 | X68: =(720-4*R3C2-RC[-2]+R4C2*60)/1440 -> 1899-12-31T14:06:36.940 | Y68: =(RC[-1]*1440-RC[-2]*4)/1440 -> 1899-12-31T08:47:13.561 | Z68: =(RC[-2]*1440+RC[-3]*4)/1440 -> 1899-12-31T19:26:00.319 | AA68: =8*RC[-4] -> 638.77929672324103 | AB68: =MOD(RC[-23]*1440+RC[-6]+4*R3C2-60*R4C2,1440) -> 713.3843353974712 | AC68: =IF(RC[-1]/4<0,RC[-1]/4+180,RC[-1]/4-180) -> -1.6539161506321989 | AD68: =DEGREES(ACOS(SIN(RADIANS(R2C2))*SIN(RADIANS(RC[-10]))+COS(RADIANS(R2C2))*COS(RADIANS(RC[-10]))*COS(RADIANS(RC[-1])))) -> 74.56398961036723 | AE68: =90-RC[-1] -> 15.43601038963277 | AF68: =IF(RC[-1]>85,0,IF(RC[-1]>5,58.1/TAN(RADIANS(RC[-1]))-0.07/POWER(TAN(RADIANS(RC[-1])),3)+0.000086/POWER(TAN(RADIANS(RC[-1])),5),IF(RC[-1]>-0.575,1735+RC[-1]*(-518.2+RC[-1]*(103.4+RC[-1]*(-12.79+RC[-1]*0.711))),-20.772/TAN(RADIANS(RC[-1])))))/3600 -> 5.7539625120278826E-2 | AG68: =RC[-2]+RC[-1] -> 15.493550014753049 | AH68: =IF(RC[-5]>0,MOD(DEGREES(ACOS(((SIN(RADIANS(R2C2))*COS(RADIANS(RC[-4])))-SIN(RADIANS(RC[-14])))/(COS(RADIANS(R2C2))*SIN(RADIANS(RC[-4])))))+180,360),MOD(540-DEGREES(ACOS(((SIN(RADIANS(R2C2))*COS(RADIANS(RC[-4])))-SIN(RADIANS(RC[-14])))/(COS(RADIANS(R2C2))*SIN(RADIANS(RC[-4]))))),360)) -> 178.28959582510697
D69: =R[-1]C+1 -> 2017-03-09T00:00:00.000 | E69: =R5C2 -> 1899-12-31T14:00:00.000 | F69: =RC[-2]+2415018.5+RC[-1]-R4C2/24 -> 2457822.375 | G69: =(RC[-1]-2451545)/36525 -> 0.17186516084873374 | I69: =MOD(280.46646+RC[-2]*(36000.76983 + RC[-2]*0.0003032),360) -> 347.74456646699946 | J69: =357.52911+RC[-3]*(35999.05029 - 0.0001537*RC[-3]) -> 6544.5116739525711 | K69: =0.016708634-RC[-4]*(0.000042037+0.0000001267*RC[-4]) -> 1.6701405561815236E-2 | L69: =SIN(RADIANS(RC[-2]))*(1.914602-RC[-5]*(0.004817+0.000014*RC[-5]))+SIN(RADIANS(2*RC[-2]))*(0.019993-0.000101*RC[-5])+SIN(RADIANS(3*RC[-2]))*0.000289 -> 1.7429630508273701 | M69: =RC[-4]+RC[-1] -> 349.48752951782683 | N69: =RC[-4]+RC[-2] -> 6546.2546370033988 | O69: =(1.000001018*(1-RC[-4]*RC[-4]))/(1+RC[-4]*COS(RADIANS(RC[-1]))) -> 0.9930436649101676 | P69: =RC[-3]-0.00569-0.00478*SIN(RADIANS(125.04-1934.136*RC[-9])) -> 349.47964194112024 | Q69: =23+(26+((21.448-RC[-10]*(46.815+RC[-10]*(0.00059-RC[-10]*0.001813))))/60)/60 -> 23.437056145630926 | R69: =RC[-1]+0.00256*COS(RADIANS(125.04-1934.136*RC[-11])) -> 23.434782733915679 | S69: =DEGREES(ATAN2(COS(RADIANS(RC[-3])),COS(RADIANS(RC[-1]))*SIN(RADIANS(RC[-3])))) -> -9.6696656783729225 | T69: =DEGREES(ASIN(SIN(RADIANS(RC[-2]))*SIN(RADIANS(RC[-4])))) -> -4.1641930751702905 | U69: =TAN(RADIANS(RC[-3]/2))*TAN(RADIANS(RC[-3]/2)) -> 4.3017505401912744E-2 | V69: =4*DEGREES(RC[-1]*SIN(2*RADIANS(RC[-13]))-2*RC[-11]*SIN(RADIANS(RC[-12]))+4*RC[-11]*RC[-1]*SIN(RADIANS(RC[-12]))*COS(2*RADIANS(RC[-13]))-0.5*RC[-1]*RC[-1]*SIN(4*RADIANS(RC[-13]))-1.25*RC[-11]*RC[-11]*SIN(2*RADIANS(RC[-12]))) -> -10.361442641990964 | W69: =DEGREES(ACOS(COS(RADIANS(90.833))/(COS(RADIANS(R2C2))*COS(RADIANS(RC[-3])))-TAN(RADIANS(R2C2))*TAN(RADIANS(RC[-3])))) -> 80.94300441967566 | X69: =(720-4*R3C2-RC[-2]+R4C2*60)/1440 -> 1899-12-31T14:06:21.687 | Y69: =(RC[-1]*1440-RC[-2]*4)/1440 -> 1899-12-31T08:42:35.365 | Z69: =(RC[-2]*1440+RC[-3]*4)/1440 -> 1899-12-31T19:30:08.008 | AA69: =8*RC[-4] -> 647.54403535740528 | AB69: =MOD(RC[-23]*1440+RC[-6]+4*R3C2-60*R4C2,1440) -> 713.63855735800905 | AC69: =IF(RC[-1]/4<0,RC[-1]/4+180,RC[-1]/4-180) -> -1.5903606604977369 | AD69: =DEGREES(ACOS(SIN(RADIANS(R2C2))*SIN(RADIANS(RC[-10]))+COS(RADIANS(R2C2))*COS(RADIANS(RC[-10]))*COS(RADIANS(RC[-1])))) -> 74.172018526584807 | AE69: =90-RC[-1] -> 15.827981473415193 | AF69: =IF(RC[-1]>85,0,IF(RC[-1]>5,58.1/TAN(RADIANS(RC[-1]))-0.07/POWER(TAN(RADIANS(RC[-1])),3)+0.000086/POWER(TAN(RADIANS(RC[-1])),5),IF(RC[-1]>-0.575,1735+RC[-1]*(-518.2+RC[-1]*(103.4+RC[-1]*(-12.79+RC[-1]*0.711))),-20.772/TAN(RADIANS(RC[-1])))))/3600 -> 5.6087161646745008E-2 | AG69: =RC[-2]+RC[-1] -> 15.884068635061938 | AH69: =IF(RC[-5]>0,MOD(DEGREES(ACOS(((SIN(RADIANS(R2C2))*COS(RADIANS(RC[-4])))-SIN(RADIANS(RC[-14])))/(COS(RADIANS(R2C2))*SIN(RADIANS(RC[-4])))))+180,360),MOD(540-DEGREES(ACOS(((SIN(RADIANS(R2C2))*COS(RADIANS(RC[-4])))-SIN(RADIANS(RC[-14])))/(COS(RADIANS(R2C2))*SIN(RADIANS(RC[-4]))))),360)) -> 178.35131244922445
D70: =R[-1]C+1 -> 2017-03-10T00:00:00.000 | E70: =R5C2 -> 1899-12-31T14:00:00.000 | F70: =RC[-2]+2415018.5+RC[-1]-R4C2/24 -> 2457823.375 | G70: =(RC[-1]-2451545)/36525 -> 0.17189253935660506 | I70: =MOD(280.46646+RC[-2]*(36000.76983 + RC[-2]*0.0003032),360) -> 348.73021383001833 | J70: =357.52911+RC[-3]*(35999.05029 - 0.0001537*RC[-3]) -> 6545.4972742328491 | K70: =0.016708634-RC[-4]*(0.000042037+0.0000001267*RC[-4]) -> 1.6701404409712454E-2 | L70: =SIN(RADIANS(RC[-2]))*(1.914602-RC[-5]*(0.004817+0.000014*RC[-5]))+SIN(RADIANS(2*RC[-2]))*(0.019993-0.000101*RC[-5])+SIN(RADIANS(3*RC[-2]))*0.000289 -> 1.7564170932237335 | M70: =RC[-4]+RC[-1] -> 350.48663092324205 | N70: =RC[-4]+RC[-2] -> 6547.2536913260728 | O70: =(1.000001018*(1-RC[-4]*RC[-4]))/(1+RC[-4]*COS(RADIANS(RC[-1]))) -> 0.9933076734770232 | P70: =RC[-3]-0.00569-0.00478*SIN(RADIANS(125.04-1934.136*RC[-9])) -> 350.47873942427702 | Q70: =23+(26+((21.448-RC[-10]*(46.815+RC[-10]*(0.00059-RC[-10]*0.001813))))/60)/60 -> 23.437055789595927 | R70: =RC[-1]+0.00256*COS(RADIANS(125.04-1934.136*RC[-11])) -> 23.434783466604408 | S70: =DEGREES(ATAN2(COS(RADIANS(RC[-3])),COS(RADIANS(RC[-1]))*SIN(RADIANS(RC[-3])))) -> -8.7485656091754773 | T70: =DEGREES(ASIN(SIN(RADIANS(RC[-2]))*SIN(RADIANS(RC[-4])))) -> -3.771972769257109 | U70: =TAN(RADIANS(RC[-3]/2))*TAN(RADIANS(RC[-3]/2)) -> 4.3017508168288025E-2 | V70: =4*DEGREES(RC[-1]*SIN(2*RADIANS(RC[-13]))-2*RC[-11]*SIN(RADIANS(RC[-12]))+4*RC[-11]*RC[-1]*SIN(RADIANS(RC[-12]))*COS(2*RADIANS(RC[-13]))-0.5*RC[-1]*RC[-1]*SIN(4*RADIANS(RC[-13]))-1.25*RC[-11]*RC[-11]*SIN(2*RADIANS(RC[-12]))) -> -10.101680068280801 | W70: =DEGREES(ACOS(COS(RADIANS(90.833))/(COS(RADIANS(R2C2))*COS(RADIANS(RC[-3])))-TAN(RADIANS(R2C2))*TAN(RADIANS(RC[-3])))) -> 82.036709597694312 | X70: =(720-4*R3C2-RC[-2]+R4C2*60)/1440 -> 1899-12-31T14:06:06.101 | Y70: =(RC[-1]*1440-RC[-2]*4)/1440 -> 1899-12-31T08:37:57.291 | Z70: =(RC[-2]*1440+RC[-3]*4)/1440 -> 1899-12-31T19:34:14.911 | AA70: =8*RC[-4] -> 656.2936767815545 | AB70: =MOD(RC[-23]*1440+RC[-6]+4*R3C2-60*R4C2,1440) -> 713.89831993171924 | AC70: =IF(RC[-1]/4<0,RC[-1]/4+180,RC[-1]/4-180) -> -1.5254200170701893 | AD70: =DEGREES(ACOS(SIN(RADIANS(R2C2))*SIN(RADIANS(RC[-10]))+COS(RADIANS(R2C2))*COS(RADIANS(RC[-10]))*COS(RADIANS(RC[-1])))) -> 73.779189827766032 | AE70: =90-RC[-1] -> 16.220810172233968 | AF70: =IF(RC[-1]>85,0,IF(RC[-1]>5,58.1/TAN(RADIANS(RC[-1]))-0.07/POWER(TAN(RADIANS(RC[-1])),3)+0.000086/POWER(TAN(RADIANS(RC[-1])),5),IF(RC[-1]>-0.575,1735+RC[-1]*(-518.2+RC[-1]*(103.4+RC[-1]*(-12.79+RC[-1]*0.711))),-20.772/TAN(RADIANS(RC[-1])))))/3600 -> 5.4696951910188793E-2 | AG70: =RC[-2]+RC[-1] -> 16.275507124144156 | AH70: =IF(RC[-5]>0,MOD(DEGREES(ACOS(((SIN(RADIANS(R2C2))*COS(RADIANS(RC[-4])))-SIN(RADIANS(RC[-14])))/(COS(RADIANS(R2C2))*SIN(RADIANS(RC[-4])))))+180,360),MOD(540-DEGREES(ACOS(((SIN(RADIANS(R2C2))*COS(RADIANS(RC[-4])))-SIN(RADIANS(RC[-14])))/(COS(RADIANS(R2C2))*SIN(RADIANS(RC[-4]))))),360)) -> 178.41476546250021
D71: =R[-1]C+1 -> 2017-03-11T00:00:00.000 | E71: =R5C2 -> 1899-12-31T14:00:00.000 | F71: =RC[-2]+2415018.5+RC[-1]-R4C2/24 -> 2457824.375 | G71: =(RC[-1]-2451545)/36525 -> 0.17191991786447638 | I71: =MOD(280.46646+RC[-2]*(36000.76983 + RC[-2]*0.0003032),360) -> 349.71586119303629 | J71: =357.52911+RC[-3]*(35999.05029 - 0.0001537*RC[-3]) -> 6546.4828745131281 | K71: =0.016708634-RC[-4]*(0.000042037+0.0000001267*RC[-4]) -> 1.6701403257609482E-2 | L71: =SIN(RADIANS(RC[-2]))*(1.914602-RC[-5]*(0.004817+0.000014*RC[-5]))+SIN(RADIANS(2*RC[-2]))*(0.019993-0.000101*RC[-5])+SIN(RADIANS(3*RC[-2]))*0.000289 -> 1.7693382207720534 | M71: =RC[-4]+RC[-1] -> 351.48519941380835 | N71: =RC[-4]+RC[-2] -> 6548.2522127338998 | O71: =(1.000001018*(1-RC[-4]*RC[-4]))/(1+RC[-4]*COS(RADIANS(RC[-1]))) -> 0.99357361866428151 | P71: =RC[-3]-0.00569-0.00478*SIN(RADIANS(125.04-1934.136*RC[-9])) -> 351.47730399446539 | Q71: =23+(26+((21.448-RC[-10]*(46.815+RC[-10]*(0.00059-RC[-10]*0.001813))))/60)/60 -> 23.437055433560928 | R71: =RC[-1]+0.00256*COS(RADIANS(125.04-1934.136*RC[-11])) -> 23.434784201234105 | S71: =DEGREES(ATAN2(COS(RADIANS(RC[-3])),COS(RADIANS(RC[-1]))*SIN(RADIANS(RC[-3])))) -> -7.8287882552251107 | T71: =DEGREES(ASIN(SIN(RADIANS(RC[-2]))*SIN(RADIANS(RC[-4])))) -> -3.3789912719430659 | U71: =TAN(RADIANS(RC[-3]/2))*TAN(RADIANS(RC[-3]/2)) -> 4.3017510941991806E-2 | V71: =4*DEGREES(RC[-1]*SIN(2*RADIANS(RC[-13]))-2*RC[-11]*SIN(RADIANS(RC[-12]))+4*RC[-11]*RC[-1]*SIN(RADIANS(RC[-12]))*COS(2*RADIANS(RC[-13]))-0.5*RC[-1]*RC[-1]*SIN(4*RADIANS(RC[-13]))-1.25*RC[-11]*RC[-11]*SIN(2*RADIANS(RC[-12]))) -> -9.8367174168812959 | W71: =DEGREES(ACOS(COS(RADIANS(90.833))/(COS(RADIANS(R2C2))*COS(RADIANS(RC[-3])))-TAN(RADIANS(R2C2))*TAN(RADIANS(RC[-3])))) -> 83.128745698348936 | X71: =(720-4*R3C2-RC[-2]+R4C2*60)/1440 -> 1899-12-31T14:05:50.203 | Y71: =(RC[-1]*1440-RC[-2]*4)/1440 -> 1899-12-31T08:33:19.304 | Z71: =(RC[-2]*1440+RC[-3]*4)/1440 -> 1899-12-31T19:38:21.102 | AA71: =8*RC[-4] -> 665.02996558679149 | AB71: =MOD(RC[-23]*1440+RC[-6]+4*R3C2-60*R4C2,1440) -> 714.16328258311876 | AC71: =IF(RC[-1]/4<0,RC[-1]/4+180,RC[-1]/4-180) -> -1.4591793542203106 | AD71: =DEGREES(ACOS(SIN(RADIANS(R2C2))*SIN(RADIANS(RC[-10]))+COS(RADIANS(R2C2))*COS(RADIANS(RC[-10]))*COS(RADIANS(RC[-1])))) -> 73.385611387306639 | AE71: =90-RC[-1] -> 16.614388612693361 | AF71: =IF(RC[-1]>85,0,IF(RC[-1]>5,58.1/TAN(RADIANS(RC[-1]))-0.07/POWER(TAN(RADIANS(RC[-1])),3)+0.000086/POWER(TAN(RADIANS(RC[-1])),5),IF(RC[-1]>-0.575,1735+RC[-1]*(-518.2+RC[-1]*(103.4+RC[-1]*(-12.79+RC[-1]*0.711))),-20.772/TAN(RADIANS(RC[-1])))))/3600 -> 5.3365399001728778E-2 | AG71: =RC[-2]+RC[-1] -> 16.667754011695088 | AH71: =IF(RC[-5]>0,MOD(DEGREES(ACOS(((SIN(RADIANS(R2C2))*COS(RADIANS(RC[-4])))-SIN(RADIANS(RC[-14])))/(COS(RADIANS(R2C2))*SIN(RADIANS(RC[-4])))))+180,360),MOD(540-DEGREES(ACOS(((SIN(RADIANS(R2C2))*COS(RADIANS(RC[-4])))-SIN(RADIANS(RC[-14])))/(COS(RADIANS(R2C2))*SIN(RADIANS(RC[-4]))))),360)) -> 178.47988020587138
D72: =R[-1]C+1 -> 2017-03-12T00:00:00.000 | E72: =R5C2 -> 1899-12-31T14:00:00.000 | F72: =RC[-2]+2415018.5+RC[-1]-R4C2/24 -> 2457825.375 | G72: =(RC[-1]-2451545)/36525 -> 0.17194729637234771 | I72: =MOD(280.46646+RC[-2]*(36000.76983 + RC[-2]*0.0003032),360) -> 350.70150855605516 | J72: =357.52911+RC[-3]*(35999.05029 - 0.0001537*RC[-3]) -> 6547.4684747934052 | K72: =0.016708634-RC[-4]*(0.000042037+0.0000001267*RC[-4]) -> 1.670140210550632E-2 | L72: =SIN(RADIANS(RC[-2]))*(1.914602-RC[-5]*(0.004817+0.000014*RC[-5]))+SIN(RADIANS(2*RC[-2]))*(0.019993-0.000101*RC[-5])+SIN(RADIANS(3*RC[-2]))*0.000289 -> 1.7817230517491931 | M72: =RC[-4]+RC[-1] -> 352.48323160780433 | N72: =RC[-4]+RC[-2] -> 6549.2501978451546 | O72: =(1.000001018*(1-RC[-4]*RC[-4]))/(1+RC[-4]*COS(RADIANS(RC[-1]))) -> 0.99384141868671183 | P72: =RC[-3]-0.00569-0.00478*SIN(RADIANS(125.04-1934.136*RC[-9])) -> 352.47533226996723 | Q72: =23+(26+((21.448-RC[-10]*(46.815+RC[-10]*(0.00059-RC[-10]*0.001813))))/60)/60 -> 23.43705507752593 | R72: =RC[-1]+0.00256*COS(RADIANS(125.04-1934.136*RC[-11])) -> 23.434784937803837 | S72: =DEGREES(ATAN2(COS(RADIANS(RC[-3])),COS(RADIANS(RC[-1]))*SIN(RADIANS(RC[-3])))) -> -6.9102497629793129 | T72: =DEGREES(ASIN(SIN(RADIANS(RC[-2]))*SIN(RADIANS(RC[-4])))) -> -2.9853534518503375 | U72: =TAN(RADIANS(RC[-3]/2))*TAN(RADIANS(RC[-3]/2)) -> 4.3017513723020581E-2 | V72: =4*DEGREES(RC[-1]*SIN(2*RADIANS(RC[-13]))-2*RC[-11]*SIN(RADIANS(RC[-12]))+4*RC[-11]*RC[-1]*SIN(RADIANS(RC[-12]))*COS(2*RADIANS(RC[-13]))-0.5*RC[-1]*RC[-1]*SIN(4*RADIANS(RC[-13]))-1.25*RC[-11]*RC[-11]*SIN(2*RADIANS(RC[-12]))) -> -9.5668962284963488 | W72: =DEGREES(ACOS(COS(RADIANS(90.833))/(COS(RADIANS(R2C2))*COS(RADIANS(RC[-3])))-TAN(RADIANS(R2C2))*TAN(RADIANS(RC[-3])))) -> 84.219329041146381 | X72: =(720-4*R3C2-RC[-2]+R4C2*60)/1440 -> 1899-12-31T14:05:34.014 | Y72: =(RC[-1]*1440-RC[-2]*4)/1440 -> 1899-12-31T08:28:41.375 | Z72: =(RC[-2]*1440+RC[-3]*4)/1440 -> 1899-12-31T19:42:26.653 | AA72: =8*RC[-4] -> 673.75463232917105 | AB72: =MOD(RC[-23]*1440+RC[-6]+4*R3C2-60*R4C2,1440) -> 714.43310377150362 | AC72: =IF(RC[-1]/4<0,RC[-1]/4+180,RC[-1]/4-180) -> -1.3917240571240939 | AD72: =DEGREES(ACOS(SIN(RADIANS(R2C2))*SIN(RADIANS(RC[-10]))+COS(RADIANS(R2C2))*COS(RADIANS(RC[-10]))*COS(RADIANS(RC[-1])))) -> 72.991390502555802 | AE72: =90-RC[-1] -> 17.008609497444198 | AF72: =IF(RC[-1]>85,0,IF(RC[-1]>5,58.1/TAN(RADIANS(RC[-1]))-0.07/POWER(TAN(RADIANS(RC[-1])),3)+0.000086/POWER(TAN(RADIANS(RC[-1])),5),IF(RC[-1]>-0.575,1735+RC[-1]*(-518.2+RC[-1]*(103.4+RC[-1]*(-12.79+RC[-1]*0.711))),-20.772/TAN(RADIANS(RC[-1])))))/3600 -> 5.2089164092821015E-2 | AG72: =RC[-2]+RC[-1] -> 17.060698661537018 | AH72: =IF(RC[-5]>0,MOD(DEGREES(ACOS(((SIN(RADIANS(R2C2))*COS(RADIANS(RC[-4])))-SIN(RADIANS(RC[-14])))/(COS(RADIANS(R2C2))*SIN(RADIANS(RC[-4])))))+180,360),MOD(540-DEGREES(ACOS(((SIN(RADIANS(R2C2))*COS(RADIANS(RC[-4])))-SIN(RADIANS(RC[-14])))/(COS(RADIANS(R2C2))*SIN(RADIANS(RC[-4]))))),360)) -> 178.54658092204681
D73: =R[-1]C+1 -> 2017-03-13T00:00:00.000 | E73: =R5C2 -> 1899-12-31T14:00:00.000 | F73: =RC[-2]+2415018.5+RC[-1]-R4C2/24 -> 2457826.375 | G73: =(RC[-1]-2451545)/36525 -> 0.17197467488021903 | I73: =MOD(280.46646+RC[-2]*(36000.76983 + RC[-2]*0.0003032),360) -> 351.68715591907494 | J73: =357.52911+RC[-3]*(35999.05029 - 0.0001537*RC[-3]) -> 6548.4540750736833 | K73: =0.016708634-RC[-4]*(0.000042037+0.0000001267*RC[-4]) -> 1.6701400953402969E-2 | L73: =SIN(RADIANS(RC[-2]))*(1.914602-RC[-5]*(0.004817+0.000014*RC[-5]))+SIN(RADIANS(2*RC[-2]))*(0.019993-0.000101*RC[-5])+SIN(RADIANS(3*RC[-2]))*0.000289 -> 1.7935683778720528 | M73: =RC[-4]+RC[-1] -> 353.48072429694702 | N73: =RC[-4]+RC[-2] -> 6550.2476434515556 | O73: =(1.000001018*(1-RC[-4]*RC[-4]))/(1+RC[-4]*COS(RADIANS(RC[-1]))) -> 0.99411099132052205 | P73: =RC[-3]-0.00569-0.00478*SIN(RADIANS(125.04-1934.136*RC[-9])) -> 353.47282104250297 | Q73: =23+(26+((21.448-RC[-10]*(46.815+RC[-10]*(0.00059-RC[-10]*0.001813))))/60)/60 -> 23.437054721490927 | R73: =RC[-1]+0.00256*COS(RADIANS(125.04-1934.136*RC[-11])) -> 23.434785676312671 | S73: =DEGREES(ATAN2(COS(RADIANS(RC[-3])),COS(RADIANS(RC[-1]))*SIN(RADIANS(RC[-3])))) -> -5.9928658966563599 | T73: =DEGREES(ASIN(SIN(RADIANS(RC[-2]))*SIN(RADIANS(RC[-4])))) -> -2.5911636875993667 | U73: =TAN(RADIANS(RC[-3]/2))*TAN(RADIANS(RC[-3]/2)) -> 4.3017516511370819E-2 | V73: =4*DEGREES(RC[-1]*SIN(2*RADIANS(RC[-13]))-2*RC[-11]*SIN(RADIANS(RC[-12]))+4*RC[-11]*RC[-1]*SIN(RADIANS(RC[-12]))*COS(2*RADIANS(RC[-13]))-0.5*RC[-1]*RC[-1]*SIN(4*RADIANS(RC[-13]))-1.25*RC[-11]*RC[-11]*SIN(2*RADIANS(RC[-12]))) -> -9.2925587618023417 | W73: =DEGREES(ACOS(COS(RADIANS(90.833))/(COS(RADIANS(R2C2))*COS(RADIANS(RC[-3])))-TAN(RADIANS(R2C2))*TAN(RADIANS(RC[-3])))) -> 85.308674600476138 | X73: =(720-4*R3C2-RC[-2]+R4C2*60)/1440 -> 1899-12-31T14:05:17.554 | Y73: =(RC[-1]*1440-RC[-2]*4)/1440 -> 1899-12-31T08:24:03.472 | Z73: =(RC[-2]*1440+RC[-3]*4)/1440 -> 1899-12-31T19:46:31.635 | AA73: =8*RC[-4] -> 682.4693968038091 | AB73: =MOD(RC[-23]*1440+RC[-6]+4*R3C2-60*R4C2,1440) -> 714.7074412381977 | AC73: =IF(RC[-1]/4<0,RC[-1]/4+180,RC[-1]/4-180) -> -1.3231396904505743 | AD73: =DEGREES(ACOS(SIN(RADIANS(R2C2))*SIN(RADIANS(RC[-10]))+COS(RADIANS(R2C2))*COS(RADIANS(RC[-10]))*COS(RADIANS(RC[-1])))) -> 72.596633892688686 | AE73: =90-RC[-1] -> 17.403366107311314 | AF73: =IF(RC[-1]>85,0,IF(RC[-1]>5,58.1/TAN(RADIANS(RC[-1]))-0.07/POWER(TAN(RADIANS(RC[-1])),3)+0.000086/POWER(TAN(RADIANS(RC[-1])),5),IF(RC[-1]>-0.575,1735+RC[-1]*(-518.2+RC[-1]*(103.4+RC[-1]*(-12.79+RC[-1]*0.711))),-20.772/TAN(RADIANS(RC[-1])))))/3600 -> 5.086514503336749E-2 | AG73: =RC[-2]+RC[-1] -> 17.45423125234468 | AH73: =IF(RC[-5]>0,MOD(DEGREES(ACOS(((SIN(RADIANS(R2C2))*COS(RADIANS(RC[-4])))-SIN(RADIANS(RC[-14])))/(COS(RADIANS(R2C2))*SIN(RADIANS(RC[-4])))))+180,360),MOD(540-DEGREES(ACOS(((SIN(RADIANS(R2C2))*COS(RADIANS(RC[-4])))-SIN(RADIANS(RC[-14])))/(COS(RADIANS(R2C2))*SIN(RADIANS(RC[-4]))))),360)) -> 178.61479081127197
D74: =R[-1]C+1 -> 2017-03-14T00:00:00.000 | E74: =R5C2 -> 1899-12-31T14:00:00.000 | F74: =RC[-2]+2415018.5+RC[-1]-R4C2/24 -> 2457827.375 | G74: =(RC[-1]-2451545)/36525 -> 0.17200205338809035 | I74: =MOD(280.46646+RC[-2]*(36000.76983 + RC[-2]*0.0003032),360) -> 352.67280328209472 | J74: =357.52911+RC[-3]*(35999.05029 - 0.0001537*RC[-3]) -> 6549.4396753539595 | K74: =0.016708634-RC[-4]*(0.000042037+0.0000001267*RC[-4]) -> 1.6701399801299428E-2 | L74: =SIN(RADIANS(RC[-2]))*(1.914602-RC[-5]*(0.004817+0.000014*RC[-5]))+SIN(RADIANS(2*RC[-2]))*(0.019993-0.000101*RC[-5])+SIN(RADIANS(3*RC[-2]))*0.000289 -> 1.8048711646578715 | M74: =RC[-4]+RC[-1] -> 354.47767444675259 | N74: =RC[-4]+RC[-2] -> 6551.2445465186174 | O74: =(1.000001018*(1-RC[-4]*RC[-4]))/(1+RC[-4]*COS(RADIANS(RC[-1]))) -> 0.9943822539310756 | P74: =RC[-3]-0.00569-0.00478*SIN(RADIANS(125.04-1934.136*RC[-9])) -> 354.46976727759204 | Q74: =23+(26+((21.448-RC[-10]*(46.815+RC[-10]*(0.00059-RC[-10]*0.001813))))/60)/60 -> 23.437054365455928 | R74: =RC[-1]+0.00256*COS(RADIANS(125.04-1934.136*RC[-11])) -> 23.434786416759675 | S74: =DEGREES(ATAN2(COS(RADIANS(RC[-3])),COS(RADIANS(RC[-1]))*SIN(RADIANS(RC[-3])))) -> -5.0765521027922711 | T74: =DEGREES(ASIN(SIN(RADIANS(RC[-2]))*SIN(RADIANS(RC[-4])))) -> -2.1965258753502099 | U74: =TAN(RADIANS(RC[-3]/2))*TAN(RADIANS(RC[-3]/2)) -> 4.3017519307038996E-2 | V74: =4*DEGREES(RC[-1]*SIN(2*RADIANS(RC[-13]))-2*RC[-11]*SIN(RADIANS(RC[-12]))+4*RC[-11]*RC[-1]*SIN(RADIANS(RC[-12]))*COS(2*RADIANS(RC[-13]))-0.5*RC[-1]*RC[-1]*SIN(4*RADIANS(RC[-13]))-1.25*RC[-11]*RC[-11]*SIN(2*RADIANS(RC[-12]))) -> -9.0140477194393487 | W74: =DEGREES(ACOS(COS(RADIANS(90.833))/(COS(RADIANS(R2C2))*COS(RADIANS(RC[-3])))-TAN(RADIANS(R2C2))*TAN(RADIANS(RC[-3])))) -> 86.396996399610487 | X74: =(720-4*R3C2-RC[-2]+R4C2*60)/1440 -> 1899-12-31T14:05:00.843 | Y74: =(RC[-1]*1440-RC[-2]*4)/1440 -> 1899-12-31T08:19:25.564 | Z74: =(RC[-2]*1440+RC[-3]*4)/1440 -> 1899-12-31T19:50:36.122 | AA74: =8*RC[-4] -> 691.17597119688389 | AB74: =MOD(RC[-23]*1440+RC[-6]+4*R3C2-60*R4C2,1440) -> 714.9859522805607 | AC74: =IF(RC[-1]/4<0,RC[-1]/4+180,RC[-1]/4-180) -> -1.2535119298598261 | AD74: =DEGREES(ACOS(SIN(RADIANS(R2C2))*SIN(RADIANS(RC[-10]))+COS(RADIANS(R2C2))*COS(RADIANS(RC[-10]))*COS(RADIANS(RC[-1])))) -> 72.201447697905024 | AE74: =90-RC[-1] -> 17.798552302094976 | AF74: =IF(RC[-1]>85,0,IF(RC[-1]>5,58.1/TAN(RADIANS(RC[-1]))-0.07/POWER(TAN(RADIANS(RC[-1])),3)+0.000086/POWER(TAN(RADIANS(RC[-1])),5),IF(RC[-1]>-0.575,1735+RC[-1]*(-518.2+RC[-1]*(103.4+RC[-1]*(-12.79+RC[-1]*0.711))),-20.772/TAN(RADIANS(RC[-1])))))/3600 -> 4.9690456916023903E-2 | AG74: =RC[-2]+RC[-1] -> 17.848242759011001 | AH74: =IF(RC[-5]>0,MOD(DEGREES(ACOS(((SIN(RADIANS(R2C2))*COS(RADIANS(RC[-4])))-SIN(RADIANS(RC[-14])))/(COS(RADIANS(R2C2))*SIN(RADIANS(RC[-4])))))+180,360),MOD(540-DEGREES(ACOS(((SIN(RADIANS(R2C2))*COS(RADIANS(RC[-4])))-SIN(RADIANS(RC[-14])))/(COS(RADIANS(R2C2))*SIN(RADIANS(RC[-4]))))),360)) -> 178.68443208501037
D75: =R[-1]C+1 -> 2017-03-15T00:00:00.000 | E75: =R5C2 -> 1899-12-31T14:00:00.000 | F75: =RC[-2]+2415018.5+RC[-1]-R4C2/24 -> 2457828.375 | G75: =(RC[-1]-2451545)/36525 -> 0.17202943189596168 | I75: =MOD(280.46646+RC[-2]*(36000.76983 + RC[-2]*0.0003032),360) -> 353.65845064511541 | J75: =357.52911+RC[-3]*(35999.05029 - 0.0001537*RC[-3]) -> 6550.4252756342376 | K75: =0.016708634-RC[-4]*(0.000042037+0.0000001267*RC[-4]) -> 1.6701398649195696E-2 | L75: =SIN(RADIANS(RC[-2]))*(1.914602-RC[-5]*(0.004817+0.000014*RC[-5]))+SIN(RADIANS(2*RC[-2]))*(0.019993-0.000101*RC[-5])+SIN(RADIANS(3*RC[-2]))*0.000289 -> 1.8156285517177193 | M75: =RC[-4]+RC[-1] -> 355.47407919683315 | N75: =RC[-4]+RC[-2] -> 6552.2409041859555 | O75: =(1.000001018*(1-RC[-4]*RC[-4]))/(1+RC[-4]*COS(RADIANS(RC[-1]))) -> 0.99465512350058571 | P75: =RC[-3]-0.00569-0.00478*SIN(RADIANS(125.04-1934.136*RC[-9])) -> 355.46616811485001 | Q75: =23+(26+((21.448-RC[-10]*(46.815+RC[-10]*(0.00059-RC[-10]*0.001813))))/60)/60 -> 23.43705400942093 | R75: =RC[-1]+0.00256*COS(RADIANS(125.04-1934.136*RC[-11])) -> 23.434787159143909 | S75: =DEGREES(ATAN2(COS(RADIANS(RC[-3])),COS(RADIANS(RC[-1]))*SIN(RADIANS(RC[-3])))) -> -4.161223573404599 | T75: =DEGREES(ASIN(SIN(RADIANS(RC[-2]))*SIN(RADIANS(RC[-4])))) -> -1.8015434370993315 | U75: =TAN(RADIANS(RC[-3]/2))*TAN(RADIANS(RC[-3]/2)) -> 4.3017522110021585E-2 | V75: =4*DEGREES(RC[-1]*SIN(2*RADIANS(RC[-13]))-2*RC[-11]*SIN(RADIANS(RC[-12]))+4*RC[-11]*RC[-1]*SIN(RADIANS(RC[-12]))*COS(2*RADIANS(RC[-13]))-0.5*RC[-1]*RC[-1]*SIN(4*RADIANS(RC[-13]))-1.25*RC[-11]*RC[-11]*SIN(2*RADIANS(RC[-12]))) -> -8.7317059867964346 | W75: =DEGREES(ACOS(COS(RADIANS(90.833))/(COS(RADIANS(R2C2))*COS(RADIANS(RC[-3])))-TAN(RADIANS(R2C2))*TAN(RADIANS(RC[-3])))) -> 87.484507893201652 | X75: =(720-4*R3C2-RC[-2]+R4C2*60)/1440 -> 1899-12-31T14:04:43.902 | Y75: =(RC[-1]*1440-RC[-2]*4)/1440 -> 1899-12-31T08:14:47.620 | Z75: =(RC[-2]*1440+RC[-3]*4)/1440 -> 1899-12-31T19:54:40.184 | AA75: =8*RC[-4] -> 699.87606314561322 | AB75: =MOD(RC[-23]*1440+RC[-6]+4*R3C2-60*R4C2,1440) -> 715.26829401320356 | AC75: =IF(RC[-1]/4<0,RC[-1]/4+180,RC[-1]/4-180) -> -1.1829264966991104 | AD75: =DEGREES(ACOS(SIN(RADIANS(R2C2))*SIN(RADIANS(RC[-10]))+COS(RADIANS(R2C2))*COS(RADIANS(RC[-10]))*COS(RADIANS(RC[-1])))) -> 71.805937479886566 | AE75: =90-RC[-1] -> 18.194062520113434 | AF75: =IF(RC[-1]>85,0,IF(RC[-1]>5,58.1/TAN(RADIANS(RC[-1]))-0.07/POWER(TAN(RADIANS(RC[-1])),3)+0.000086/POWER(TAN(RADIANS(RC[-1])),5),IF(RC[-1]>-0.575,1735+RC[-1]*(-518.2+RC[-1]*(103.4+RC[-1]*(-12.79+RC[-1]*0.711))),-20.772/TAN(RADIANS(RC[-1])))))/3600 -> 4.8562414416845182E-2 | AG75: =RC[-2]+RC[-1] -> 18.24262493453028 | AH75: =IF(RC[-5]>0,MOD(DEGREES(ACOS(((SIN(RADIANS(R2C2))*COS(RADIANS(RC[-4])))-SIN(RADIANS(RC[-14])))/(COS(RADIANS(R2C2))*SIN(RADIANS(RC[-4])))))+180,360),MOD(540-DEGREES(ACOS(((SIN(RADIANS(R2C2))*COS(RADIANS(RC[-4])))-SIN(RADIANS(RC[-14])))/(COS(RADIANS(R2C2))*SIN(RADIANS(RC[-4]))))),360)) -> 178.75542601767074
D76: =R[-1]C+1 -> 2017-03-16T00:00:00.000 | E76: =R5C2 -> 1899-12-31T14:00:00.000 | F76: =RC[-2]+2415018.5+RC[-1]-R4C2/24 -> 2457829.375 | G76: =(RC[-1]-2451545)/36525 -> 0.172056810403833 | I76: =MOD(280.46646+RC[-2]*(36000.76983 + RC[-2]*0.0003032),360) -> 354.6440980081361 | J76: =357.52911+RC[-3]*(35999.05029 - 0.0001537*RC[-3]) -> 6551.4108759145147 | K76: =0.016708634-RC[-4]*(0.000042037+0.0000001267*RC[-4]) -> 1.6701397497091774E-2 | L76: =SIN(RADIANS(RC[-2]))*(1.914602-RC[-5]*(0.004817+0.000014*RC[-5]))+SIN(RADIANS(2*RC[-2]))*(0.019993-0.000101*RC[-5])+SIN(RADIANS(3*RC[-2]))*0.000289 -> 1.8258378529832726 | M76: =RC[-4]+RC[-1] -> 356.46993586111938 | N76: =RC[-4]+RC[-2] -> 6553.2367137674983 | O76: =(1.000001018*(1-RC[-4]*RC[-4]))/(1+RC[-4]*COS(RADIANS(RC[-1]))) -> 0.99492951665575968 | P76: =RC[-3]-0.00569-0.00478*SIN(RADIANS(125.04-1934.136*RC[-9])) -> 356.46202086821086 | Q76: =23+(26+((21.448-RC[-10]*(46.815+RC[-10]*(0.00059-RC[-10]*0.001813))))/60)/60 -> 23.437053653385931 | R76: =RC[-1]+0.00256*COS(RADIANS(125.04-1934.136*RC[-11])) -> 23.434787903464439 | S76: =DEGREES(ATAN2(COS(RADIANS(RC[-3])),COS(RADIANS(RC[-1]))*SIN(RADIANS(RC[-3])))) -> -3.246795307869319 | T76: =DEGREES(ASIN(SIN(RADIANS(RC[-2]))*SIN(RADIANS(RC[-4])))) -> -1.4063193296567345 | U76: =TAN(RADIANS(RC[-3]/2))*TAN(RADIANS(RC[-3]/2)) -> 4.3017524920315062E-2 | V76: =4*DEGREES(RC[-1]*SIN(2*RADIANS(RC[-13]))-2*RC[-11]*SIN(RADIANS(RC[-12]))+4*RC[-11]*RC[-1]*SIN(RADIANS(RC[-12]))*COS(2*RADIANS(RC[-13]))-0.5*RC[-1]*RC[-1]*SIN(4*RADIANS(RC[-13]))-1.25*RC[-11]*RC[-11]*SIN(2*RADIANS(RC[-12]))) -> -8.4458763830702246 | W76: =DEGREES(ACOS(COS(RADIANS(90.833))/(COS(RADIANS(R2C2))*COS(RADIANS(RC[-3])))-TAN(RADIANS(R2C2))*TAN(RADIANS(RC[-3])))) -> 88.571422341818163 | X76: =(720-4*R3C2-RC[-2]+R4C2*60)/1440 -> 1899-12-31T14:04:26.753 | Y76: =(RC[-1]*1440-RC[-2]*4)/1440 -> 1899-12-31T08:10:09.611 | Z76: =(RC[-2]*1440+RC[-3]*4)/1440 -> 1899-12-31T19:58:43.894 | AA76: =8*RC[-4] -> 708.57137873454531 | AB76: =MOD(RC[-23]*1440+RC[-6]+4*R3C2-60*R4C2,1440) -> 715.55412361692981 | AC76: =IF(RC[-1]/4<0,RC[-1]/4+180,RC[-1]/4-180) -> -1.1114690957675464 | AD76: =DEGREES(ACOS(SIN(RADIANS(R2C2))*SIN(RADIANS(RC[-10]))+COS(RADIANS(R2C2))*COS(RADIANS(RC[-10]))*COS(RADIANS(RC[-1])))) -> 71.41020822344943 | AE76: =90-RC[-1] -> 18.58979177655057 | AF76: =IF(RC[-1]>85,0,IF(RC[-1]>5,58.1/TAN(RADIANS(RC[-1]))-0.07/POWER(TAN(RADIANS(RC[-1])),3)+0.000086/POWER(TAN(RADIANS(RC[-1])),5),IF(RC[-1]>-0.575,1735+RC[-1]*(-518.2+RC[-1]*(103.4+RC[-1]*(-12.79+RC[-1]*0.711))),-20.772/TAN(RADIANS(RC[-1])))))/3600 -> 4.7478515740174566E-2 | AG76: =RC[-2]+RC[-1] -> 18.637270292290744 | AH76: =IF(RC[-5]>0,MOD(DEGREES(ACOS(((SIN(RADIANS(R2C2))*COS(RADIANS(RC[-4])))-SIN(RADIANS(RC[-14])))/(COS(RADIANS(R2C2))*SIN(RADIANS(RC[-4])))))+180,360),MOD(540-DEGREES(ACOS(((SIN(RADIANS(R2C2))*COS(RADIANS(RC[-4])))-SIN(RADIANS(RC[-14])))/(COS(RADIANS(R2C2))*SIN(RADIANS(RC[-4]))))),360)) -> 178.8276929963896
D77: =R[-1]C+1 -> 2017-03-17T00:00:00.000 | E77: =R5C2 -> 1899-12-31T14:00:00.000 | F77: =RC[-2]+2415018.5+RC[-1]-R4C2/24 -> 2457830.375 | G77: =(RC[-1]-2451545)/36525 -> 0.17208418891170432 | I77: =MOD(280.46646+RC[-2]*(36000.76983 + RC[-2]*0.0003032),360) -> 355.62974537115679 | J77: =357.52911+RC[-3]*(35999.05029 - 0.0001537*RC[-3]) -> 6552.3964761947909 | K77: =0.016708634-RC[-4]*(0.000042037+0.0000001267*RC[-4]) -> 1.6701396344987664E-2 | L77: =SIN(RADIANS(RC[-2]))*(1.914602-RC[-5]*(0.004817+0.000014*RC[-5]))+SIN(RADIANS(2*RC[-2]))*(0.019993-0.000101*RC[-5])+SIN(RADIANS(3*RC[-2]))*0.000289 -> 1.8354965568682458 | M77: =RC[-4]+RC[-1] -> 357.46524192802502 | N77: =RC[-4]+RC[-2] -> 6554.2319727516588 | O77: =(1.000001018*(1-RC[-4]*RC[-4]))/(1+RC[-4]*COS(RADIANS(RC[-1]))) -> 0.99520534969540286 | P77: =RC[-3]-0.00569-0.00478*SIN(RADIANS(125.04-1934.136*RC[-9])) -> 357.45732302609167 | Q77: =23+(26+((21.448-RC[-10]*(46.815+RC[-10]*(0.00059-RC[-10]*0.001813))))/60)/60 -> 23.437053297350932 | R77: =RC[-1]+0.00256*COS(RADIANS(125.04-1934.136*RC[-11])) -> 23.434788649720321 | S77: =DEGREES(ATAN2(COS(RADIANS(RC[-3])),COS(RADIANS(RC[-1]))*SIN(RADIANS(RC[-3])))) -> -2.3331821735932907 | T77: =DEGREES(ASIN(SIN(RADIANS(RC[-2]))*SIN(RADIANS(RC[-4])))) -> -1.0109560542186053 | U77: =TAN(RADIANS(RC[-3]/2))*TAN(RADIANS(RC[-3]/2)) -> 4.3017527737915812E-2 | V77: =4*DEGREES(RC[-1]*SIN(2*RADIANS(RC[-13]))-2*RC[-11]*SIN(RADIANS(RC[-12]))+4*RC[-11]*RC[-1]*SIN(RADIANS(RC[-12]))*COS(2*RADIANS(RC[-13]))-0.5*RC[-1]*RC[-1]*SIN(4*RADIANS(RC[-13]))-1.25*RC[-11]*RC[-11]*SIN(2*RADIANS(RC[-12]))) -> -8.1569014240080424 | W77: =DEGREES(ACOS(COS(RADIANS(90.833))/(COS(RADIANS(R2C2))*COS(RADIANS(RC[-3])))-TAN(RADIANS(R2C2))*TAN(RADIANS(RC[-3])))) -> 89.657953181938311 | X77: =(720-4*R3C2-RC[-2]+R4C2*60)/1440 -> 1899-12-31T14:04:09.414 | Y77: =(RC[-1]*1440-RC[-2]*4)/1440 -> 1899-12-31T08:05:31.505 | Z77: =(RC[-2]*1440+RC[-3]*4)/1440 -> 1899-12-31T20:02:47.323 | AA77: =8*RC[-4] -> 717.26362545550649 | AB77: =MOD(RC[-23]*1440+RC[-6]+4*R3C2-60*R4C2,1440) -> 715.84309857599192 | AC77: =IF(RC[-1]/4<0,RC[-1]/4+180,RC[-1]/4-180) -> -1.0392253560020208 | AD77: =DEGREES(ACOS(SIN(RADIANS(R2C2))*SIN(RADIANS(RC[-10]))+COS(RADIANS(R2C2))*COS(RADIANS(RC[-10]))*COS(RADIANS(RC[-1])))) -> 71.014364339315208 | AE77: =90-RC[-1] -> 18.985635660684792 | AF77: =IF(RC[-1]>85,0,IF(RC[-1]>5,58.1/TAN(RADIANS(RC[-1]))-0.07/POWER(TAN(RADIANS(RC[-1])),3)+0.000086/POWER(TAN(RADIANS(RC[-1])),5),IF(RC[-1]>-0.575,1735+RC[-1]*(-518.2+RC[-1]*(103.4+RC[-1]*(-12.79+RC[-1]*0.711))),-20.772/TAN(RADIANS(RC[-1])))))/3600 -> 4.6436428012137251E-2 | AG77: =RC[-2]+RC[-1] -> 19.032072088696928 | AH77: =IF(RC[-5]>0,MOD(DEGREES(ACOS(((SIN(RADIANS(R2C2))*COS(RADIANS(RC[-4])))-SIN(RADIANS(RC[-14])))/(COS(RADIANS(R2C2))*SIN(RADIANS(RC[-4])))))+180,360),MOD(540-DEGREES(ACOS(((SIN(RADIANS(R2C2))*COS(RADIANS(RC[-4])))-SIN(RADIANS(RC[-14])))/(COS(RADIANS(R2C2))*SIN(RADIANS(RC[-4]))))),360)) -> 178.90115256903584
D78: =R[-1]C+1 -> 2017-03-18T00:00:00.000 | E78: =R5C2 -> 1899-12-31T14:00:00.000 | F78: =RC[-2]+2415018.5+RC[-1]-R4C2/24 -> 2457831.375 | G78: =(RC[-1]-2451545)/36525 -> 0.17211156741957565 | I78: =MOD(280.46646+RC[-2]*(36000.76983 + RC[-2]*0.0003032),360) -> 356.61539273417839 | J78: =357.52911+RC[-3]*(35999.05029 - 0.0001537*RC[-3]) -> 6553.3820764750681 | K78: =0.016708634-RC[-4]*(0.000042037+0.0000001267*RC[-4]) -> 1.6701395192883363E-2 | L78: =SIN(RADIANS(RC[-2]))*(1.914602-RC[-5]*(0.004817+0.000014*RC[-5]))+SIN(RADIANS(2*RC[-2]))*(0.019993-0.000101*RC[-5])+SIN(RADIANS(3*RC[-2]))*0.000289 -> 1.8446023263648468 | M78: =RC[-4]+RC[-1] -> 358.45999506054324 | N78: =RC[-4]+RC[-2] -> 6555.2266788014331 | O78: =(1.000001018*(1-RC[-4]*RC[-4]))/(1+RC[-4]*COS(RADIANS(RC[-1]))) -> 0.9954825386179561 | P78: =RC[-3]-0.00569-0.00478*SIN(RADIANS(125.04-1934.136*RC[-9])) -> 358.45207225148891 | Q78: =23+(26+((21.448-RC[-10]*(46.815+RC[-10]*(0.00059-RC[-10]*0.001813))))/60)/60 -> 23.437052941315933 | R78: =RC[-1]+0.00256*COS(RADIANS(125.04-1934.136*RC[-11])) -> 23.434789397910613 | S78: =DEGREES(ATAN2(COS(RADIANS(RC[-3])),COS(RADIANS(RC[-1]))*SIN(RADIANS(RC[-3])))) -> -1.4202989655916807 | T78: =DEGREES(ASIN(SIN(RADIANS(RC[-2]))*SIN(RADIANS(RC[-4])))) -> -0.61555566646289117 | U78: =TAN(RADIANS(RC[-3]/2))*TAN(RADIANS(RC[-3]/2)) -> 4.3017530562820344E-2 | V78: =4*DEGREES(RC[-1]*SIN(2*RADIANS(RC[-13]))-2*RC[-11]*SIN(RADIANS(RC[-12]))+4*RC[-11]*RC[-1]*SIN(RADIANS(RC[-12]))*COS(2*RADIANS(RC[-13]))-0.5*RC[-1]*RC[-1]*SIN(4*RADIANS(RC[-13]))-1.25*RC[-11]*RC[-11]*SIN(2*RADIANS(RC[-12]))) -> -7.8651230956901079 | W78: =DEGREES(ACOS(COS(RADIANS(90.833))/(COS(RADIANS(R2C2))*COS(RADIANS(RC[-3])))-TAN(RADIANS(R2C2))*TAN(RADIANS(RC[-3])))) -> 90.744314394686654 | X78: =(720-4*R3C2-RC[-2]+R4C2*60)/1440 -> 1899-12-31T14:03:51.907 | Y78: =(RC[-1]*1440-RC[-2]*4)/1440 -> 1899-12-31T08:00:53.272 | Z78: =(RC[-2]*1440+RC[-3]*4)/1440 -> 1899-12-31T20:06:50.543 | AA78: =8*RC[-4] -> 725.95451515749323 | AB78: =MOD(RC[-23]*1440+RC[-6]+4*R3C2-60*R4C2,1440) -> 716.13487690430986 | AC78: =IF(RC[-1]/4<0,RC[-1]/4+180,RC[-1]/4-180) -> -0.96628077392253431 | AD78: =DEGREES(ACOS(SIN(RADIANS(R2C2))*SIN(RADIANS(RC[-10]))+COS(RADIANS(R2C2))*COS(RADIANS(RC[-10]))*COS(RADIANS(RC[-1])))) -> 70.618509667935868 | AE78: =90-RC[-1] -> 19.381490332064132 | AF78: =IF(RC[-1]>85,0,IF(RC[-1]>5,58.1/TAN(RADIANS(RC[-1]))-0.07/POWER(TAN(RADIANS(RC[-1])),3)+0.000086/POWER(TAN(RADIANS(RC[-1])),5),IF(RC[-1]>-0.575,1735+RC[-1]*(-518.2+RC[-1]*(103.4+RC[-1]*(-12.79+RC[-1]*0.711))),-20.772/TAN(RADIANS(RC[-1])))))/3600 -> 4.5433973982310701E-2 | AG78: =RC[-2]+RC[-1] -> 19.426924306046441 | AH78: =IF(RC[-5]>0,MOD(DEGREES(ACOS(((SIN(RADIANS(R2C2))*COS(RADIANS(RC[-4])))-SIN(RADIANS(RC[-14])))/(COS(RADIANS(R2C2))*SIN(RADIANS(RC[-4])))))+180,360),MOD(540-DEGREES(ACOS(((SIN(RADIANS(R2C2))*COS(RADIANS(RC[-4])))-SIN(RADIANS(RC[-14])))/(COS(RADIANS(R2C2))*SIN(RADIANS(RC[-4]))))),360)) -> 178.97572349053439
D79: =R[-1]C+1 -> 2017-03-19T00:00:00.000 | E79: =R5C2 -> 1899-12-31T14:00:00.000 | F79: =RC[-2]+2415018.5+RC[-1]-R4C2/24 -> 2457832.375 | G79: =(RC[-1]-2451545)/36525 -> 0.17213894592744697 | I79: =MOD(280.46646+RC[-2]*(36000.76983 + RC[-2]*0.0003032),360) -> 357.60104009719998 | J79: =357.52911+RC[-3]*(35999.05029 - 0.0001537*RC[-3]) -> 6554.3676767553443 | K79: =0.016708634-RC[-4]*(0.000042037+0.0000001267*RC[-4]) -> 1.6701394040778871E-2 | L79: =SIN(RADIANS(RC[-2]))*(1.914602-RC[-5]*(0.004817+0.000014*RC[-5]))+SIN(RADIANS(2*RC[-2]))*(0.019993-0.000101*RC[-5])+SIN(RADIANS(3*RC[-2]))*0.000289 -> 1.8531529990763347 | M79: =RC[-4]+RC[-1] -> 359.4541930962763 | N79: =RC[-4]+RC[-2] -> 6556.2208297544203 | O79: =(1.000001018*(1-RC[-4]*RC[-4]))/(1+RC[-4]*COS(RADIANS(RC[-1]))) -> 0.99576099914895599 | P79: =RC[-3]-0.00569-0.00478*SIN(RADIANS(125.04-1934.136*RC[-9])) -> 359.44626638200816 | Q79: =23+(26+((21.448-RC[-10]*(46.815+RC[-10]*(0.00059-RC[-10]*0.001813))))/60)/60 -> 23.437052585280934 | R79: =RC[-1]+0.00256*COS(RADIANS(125.04-1934.136*RC[-11])) -> 23.434790148034374 | S79: =DEGREES(ATAN2(COS(RADIANS(RC[-3])),COS(RADIANS(RC[-1]))*SIN(RADIANS(RC[-3])))) -> -0.50806046507018898 | T79: =DEGREES(ASIN(SIN(RADIANS(RC[-2]))*SIN(RADIANS(RC[-4])))) -> -0.2202197870920273 | U79: =TAN(RADIANS(RC[-3]/2))*TAN(RADIANS(RC[-3]/2)) -> 4.3017533395025079E-2 | V79: =4*DEGREES(RC[-1]*SIN(2*RADIANS(RC[-13]))-2*RC[-11]*SIN(RADIANS(RC[-12]))+4*RC[-11]*RC[-1]*SIN(RADIANS(RC[-12]))*COS(2*RADIANS(RC[-13]))-0.5*RC[-1]*RC[-1]*SIN(4*RADIANS(RC[-13]))-1.25*RC[-11]*RC[-11]*SIN(2*RADIANS(RC[-12]))) -> -7.5708826386490724 | W79: =DEGREES(ACOS(COS(RADIANS(90.833))/(COS(RADIANS(R2C2))*COS(RADIANS(RC[-3])))-TAN(RADIANS(R2C2))*TAN(RADIANS(RC[-3])))) -> 91.830720876561955 | X79: =(720-4*R3C2-RC[-2]+R4C2*60)/1440 -> 1899-12-31T14:03:34.253 | Y79: =(RC[-1]*1440-RC[-2]*4)/1440 -> 1899-12-31T07:56:14.880 | Z79: =(RC[-2]*1440+RC[-3]*4)/1440 -> 1899-12-31T20:10:53.626 | AA79: =8*RC[-4] -> 734.64576701249564 | AB79: =MOD(RC[-23]*1440+RC[-6]+4*R3C2-60*R4C2,1440) -> 716.4291173613509 | AC79: =IF(RC[-1]/4<0,RC[-1]/4+180,RC[-1]/4-180) -> -0.89272065966227387 | AD79: =DEGREES(ACOS(SIN(RADIANS(R2C2))*SIN(RADIANS(RC[-10]))+COS(RADIANS(R2C2))*COS(RADIANS(RC[-10]))*COS(RADIANS(RC[-1])))) -> 70.222747484302403 | AE79: =90-RC[-1] -> 19.777252515697597 | AF79: =IF(RC[-1]>85,0,IF(RC[-1]>5,58.1/TAN(RADIANS(RC[-1]))-0.07/POWER(TAN(RADIANS(RC[-1])),3)+0.000086/POWER(TAN(RADIANS(RC[-1])),5),IF(RC[-1]>-0.575,1735+RC[-1]*(-518.2+RC[-1]*(103.4+RC[-1]*(-12.79+RC[-1]*0.711))),-20.772/TAN(RADIANS(RC[-1])))))/3600 -> 4.4469119907001316E-2 | AG79: =RC[-2]+RC[-1] -> 19.8217216356046 | AH79: =IF(RC[-5]>0,MOD(DEGREES(ACOS(((SIN(RADIANS(R2C2))*COS(RADIANS(RC[-4])))-SIN(RADIANS(RC[-14])))/(COS(RADIANS(R2C2))*SIN(RADIANS(RC[-4])))))+180,360),MOD(540-DEGREES(ACOS(((SIN(RADIANS(R2C2))*COS(RADIANS(RC[-4])))-SIN(RADIANS(RC[-14])))/(COS(RADIANS(R2C2))*SIN(RADIANS(RC[-4]))))),360)) -> 179.05132376762049
D80: =R[-1]C+1 -> 2017-03-20T00:00:00.000 | E80: =R5C2 -> 1899-12-31T14:00:00.000 | F80: =RC[-2]+2415018.5+RC[-1]-R4C2/24 -> 2457833.375 | G80: =(RC[-1]-2451545)/36525 -> 0.17216632443531826 | I80: =MOD(280.46646+RC[-2]*(36000.76983 + RC[-2]*0.0003032),360) -> 358.58668746022158 | J80: =357.52911+RC[-3]*(35999.05029 - 0.0001537*RC[-3]) -> 6555.3532770356187 | K80: =0.016708634-RC[-4]*(0.000042037+0.0000001267*RC[-4]) -> 1.6701392888674189E-2 | L80: =SIN(RADIANS(RC[-2]))*(1.914602-RC[-5]*(0.004817+0.000014*RC[-5]))+SIN(RADIANS(2*RC[-2]))*(0.019993-0.000101*RC[-5])+SIN(RADIANS(3*RC[-2]))*0.000289 -> 1.8611465871866015 | M80: =RC[-4]+RC[-1] -> 360.44783404740821 | N80: =RC[-4]+RC[-2] -> 6557.214423622805 | O80: =(1.000001018*(1-RC[-4]*RC[-4]))/(1+RC[-4]*COS(RADIANS(RC[-1]))) -> 0.99604064676842141 | P80: =RC[-3]-0.00569-0.00478*SIN(RADIANS(125.04-1934.136*RC[-9])) -> 360.43990342983687 | Q80: =23+(26+((21.448-RC[-10]*(46.815+RC[-10]*(0.00059-RC[-10]*0.001813))))/60)/60 -> 23.437052229245936 | R80: =RC[-1]+0.00256*COS(RADIANS(125.04-1934.136*RC[-11])) -> 23.434790900090661 | S80: =DEGREES(ATAN2(COS(RADIANS(RC[-3])),COS(RADIANS(RC[-1]))*SIN(RADIANS(RC[-3])))) -> 0.40361850289648654 | T80: =DEGREES(ASIN(SIN(RADIANS(RC[-2]))*SIN(RADIANS(RC[-4])))) -> 0.17495038725567488 | U80: =TAN(RADIANS(RC[-3]/2))*TAN(RADIANS(RC[-3]/2)) -> 4.3017536234526442E-2 | V80: =4*DEGREES(RC[-1]*SIN(2*RADIANS(RC[-13]))-2*RC[-11]*SIN(RADIANS(RC[-12]))+4*RC[-11]*RC[-1]*SIN(RADIANS(RC[-12]))*COS(2*RADIANS(RC[-13]))-0.5*RC[-1]*RC[-1]*SIN(4*RADIANS(RC[-13]))-1.25*RC[-11]*RC[-11]*SIN(2*RADIANS(RC[-12]))) -> -7.2745203415725479 | W80: =DEGREES(ACOS(COS(RADIANS(90.833))/(COS(RADIANS(R2C2))*COS(RADIANS(RC[-3])))-TAN(RADIANS(R2C2))*TAN(RADIANS(RC[-3])))) -> 92.917388815412394 | X80: =(720-4*R3C2-RC[-2]+R4C2*60)/1440 -> 1899-12-31T14:03:16.471 | Y80: =(RC[-1]*1440-RC[-2]*4)/1440 -> 1899-12-31T07:51:36.298 | Z80: =(RC[-2]*1440+RC[-3]*4)/1440 -> 1899-12-31T20:14:56.645 | AA80: =8*RC[-4] -> 743.33911052329915 | AB80: =MOD(RC[-23]*1440+RC[-6]+4*R3C2-60*R4C2,1440) -> 716.7254796584275 | AC80: =IF(RC[-1]/4<0,RC[-1]/4+180,RC[-1]/4-180) -> -0.81863008539312432 | AD80: =DEGREES(ACOS(SIN(RADIANS(R2C2))*SIN(RADIANS(RC[-10]))+COS(RADIANS(R2C2))*COS(RADIANS(RC[-10]))*COS(RADIANS(RC[-1])))) -> 69.827180503663158 | AE80: =90-RC[-1] -> 20.172819496336842 | AF80: =IF(RC[-1]>85,0,IF(RC[-1]>5,58.1/TAN(RADIANS(RC[-1]))-0.07/POWER(TAN(RADIANS(RC[-1])),3)+0.000086/POWER(TAN(RADIANS(RC[-1])),5),IF(RC[-1]>-0.575,1735+RC[-1]*(-518.2+RC[-1]*(103.4+RC[-1]*(-12.79+RC[-1]*0.711))),-20.772/TAN(RADIANS(RC[-1])))))/3600 -> 4.3539964500164209E-2 | AG80: =RC[-2]+RC[-1] -> 20.216359460837008 | AH80: =IF(RC[-5]>0,MOD(DEGREES(ACOS(((SIN(RADIANS(R2C2))*COS(RADIANS(RC[-4])))-SIN(RADIANS(RC[-14])))/(COS(RADIANS(R2C2))*SIN(RADIANS(RC[-4])))))+180,360),MOD(540-DEGREES(ACOS(((SIN(RADIANS(R2C2))*COS(RADIANS(RC[-4])))-SIN(RADIANS(RC[-14])))/(COS(RADIANS(R2C2))*SIN(RADIANS(RC[-4]))))),360)) -> 179.12787070227728
D81: =R[-1]C+1 -> 2017-03-21T00:00:00.000 | E81: =R5C2 -> 1899-12-31T14:00:00.000 | F81: =RC[-2]+2415018.5+RC[-1]-R4C2/24 -> 2457834.375 | G81: =(RC[-1]-2451545)/36525 -> 0.17219370294318959 | I81: =MOD(280.46646+RC[-2]*(36000.76983 + RC[-2]*0.0003032),360) -> 359.57233482324409 | J81: =357.52911+RC[-3]*(35999.05029 - 0.0001537*RC[-3]) -> 6556.3388773158949 | K81: =0.016708634-RC[-4]*(0.000042037+0.0000001267*RC[-4]) -> 1.6701391736569319E-2 | L81: =SIN(RADIANS(RC[-2]))*(1.914602-RC[-5]*(0.004817+0.000014*RC[-5]))+SIN(RADIANS(2*RC[-2]))*(0.019993-0.000101*RC[-5])+SIN(RADIANS(3*RC[-2]))*0.000289 -> 1.868581277367555 | M81: =RC[-4]+RC[-1] -> 361.44091610061167 | N81: =RC[-4]+RC[-2] -> 6558.2074585932623 | O81: =(1.000001018*(1-RC[-4]*RC[-4]))/(1+RC[-4]*COS(RADIANS(RC[-1]))) -> 0.99632139673813824 | P81: =RC[-3]-0.00569-0.00478*SIN(RADIANS(125.04-1934.136*RC[-9])) -> 361.43298158165101 | Q81: =23+(26+((21.448-RC[-10]*(46.815+RC[-10]*(0.00059-RC[-10]*0.001813))))/60)/60 -> 23.437051873210937 | R81: =RC[-1]+0.00256*COS(RADIANS(125.04-1934.136*RC[-11])) -> 23.434791654078523 | S81: =DEGREES(ATAN2(COS(RADIANS(RC[-3])),COS(RADIANS(RC[-1]))*SIN(RADIANS(RC[-3])))) -> 1.314823012478239 | T81: =DEGREES(ASIN(SIN(RADIANS(RC[-2]))*SIN(RADIANS(RC[-4])))) -> 0.56985407279455691 | U81: =TAN(RADIANS(RC[-3]/2))*TAN(RADIANS(RC[-3]/2)) -> 4.3017539081320881E-2 | V81: =4*DEGREES(RC[-1]*SIN(2*RADIANS(RC[-13]))-2*RC[-11]*SIN(RADIANS(RC[-12]))+4*RC[-11]*RC[-1]*SIN(RADIANS(RC[-12]))*COS(2*RADIANS(RC[-13]))-0.5*RC[-1]*RC[-1]*SIN(4*RADIANS(RC[-13]))-1.25*RC[-11]*RC[-11]*SIN(2*RADIANS(RC[-12]))) -> -6.9763753437952429 | W81: =DEGREES(ACOS(COS(RADIANS(90.833))/(COS(RADIANS(R2C2))*COS(RADIANS(RC[-3])))-TAN(RADIANS(R2C2))*TAN(RADIANS(RC[-3])))) -> 94.00453607493688 | X81: =(720-4*R3C2-RC[-2]+R4C2*60)/1440 -> 1899-12-31T14:02:58.583 | Y81: =(RC[-1]*1440-RC[-2]*4)/1440 -> 1899-12-31T07:46:57.494 | Z81: =(RC[-2]*1440+RC[-3]*4)/1440 -> 1899-12-31T20:18:59.671 | AA81: =8*RC[-4] -> 752.03628859949504 | AB81: =MOD(RC[-23]*1440+RC[-6]+4*R3C2-60*R4C2,1440) -> 717.02362465620479 | AC81: =IF(RC[-1]/4<0,RC[-1]/4+180,RC[-1]/4-180) -> -0.74409383594880296 | AD81: =DEGREES(ACOS(SIN(RADIANS(R2C2))*SIN(RADIANS(RC[-10]))+COS(RADIANS(R2C2))*COS(RADIANS(RC[-10]))*COS(RADIANS(RC[-1])))) -> 69.431910888086875 | AE81: =90-RC[-1] -> 20.568089111913125 | AF81: =IF(RC[-1]>85,0,IF(RC[-1]>5,58.1/TAN(RADIANS(RC[-1]))-0.07/POWER(TAN(RADIANS(RC[-1])),3)+0.000086/POWER(TAN(RADIANS(RC[-1])),5),IF(RC[-1]>-0.575,1735+RC[-1]*(-518.2+RC[-1]*(103.4+RC[-1]*(-12.79+RC[-1]*0.711))),-20.772/TAN(RADIANS(RC[-1])))))/3600 -> 4.2644728849452009E-2 | AG81: =RC[-2]+RC[-1] -> 20.610733840762578 | AH81: =IF(RC[-5]>0,MOD(DEGREES(ACOS(((SIN(RADIANS(R2C2))*COS(RADIANS(RC[-4])))-SIN(RADIANS(RC[-14])))/(COS(RADIANS(R2C2))*SIN(RADIANS(RC[-4])))))+180,360),MOD(540-DEGREES(ACOS(((SIN(RADIANS(R2C2))*COS(RADIANS(RC[-4])))-SIN(RADIANS(RC[-14])))/(COS(RADIANS(R2C2))*SIN(RADIANS(RC[-4]))))),360)) -> 179.20528093391499
D82: =R[-1]C+1 -> 2017-03-22T00:00:00.000 | E82: =R5C2 -> 1899-12-31T14:00:00.000 | F82: =RC[-2]+2415018.5+RC[-1]-R4C2/24 -> 2457835.375 | G82: =(RC[-1]-2451545)/36525 -> 0.17222108145106091 | I82: =MOD(280.46646+RC[-2]*(36000.76983 + RC[-2]*0.0003032),360) -> 0.55798218626750895 | J82: =357.52911+RC[-3]*(35999.05029 - 0.0001537*RC[-3]) -> 6557.3244775961712 | K82: =0.016708634-RC[-4]*(0.000042037+0.0000001267*RC[-4]) -> 1.6701390584464258E-2 | L82: =SIN(RADIANS(RC[-2]))*(1.914602-RC[-5]*(0.004817+0.000014*RC[-5]))+SIN(RADIANS(2*RC[-2]))*(0.019993-0.000101*RC[-5])+SIN(RADIANS(3*RC[-2]))*0.000289 -> 1.8754554306252134 | M82: =RC[-4]+RC[-1] -> 2.4334376168927223 | N82: =RC[-4]+RC[-2] -> 6559.1999330267963 | O82: =(1.000001018*(1-RC[-4]*RC[-4]))/(1+RC[-4]*COS(RADIANS(RC[-1]))) -> 0.99660316412883965 | P82: =RC[-3]-0.00569-0.00478*SIN(RADIANS(125.04-1934.136*RC[-9])) -> 2.4254991984599852 | Q82: =23+(26+((21.448-RC[-10]*(46.815+RC[-10]*(0.00059-RC[-10]*0.001813))))/60)/60 -> 23.437051517175941 | R82: =RC[-1]+0.00256*COS(RADIANS(125.04-1934.136*RC[-11])) -> 23.434792409997019 | S82: =DEGREES(ATAN2(COS(RADIANS(RC[-3])),COS(RADIANS(RC[-1]))*SIN(RADIANS(RC[-3])))) -> 2.2256379808991276 | T82: =DEGREES(ASIN(SIN(RADIANS(RC[-2]))*SIN(RADIANS(RC[-4])))) -> 0.96439088715418919 | U82: =TAN(RADIANS(RC[-3]/2))*TAN(RADIANS(RC[-3]/2)) -> 4.3017541935404809E-2 | V82: =4*DEGREES(RC[-1]*SIN(2*RADIANS(RC[-13]))-2*RC[-11]*SIN(RADIANS(RC[-12]))+4*RC[-11]*RC[-1]*SIN(RADIANS(RC[-12]))*COS(2*RADIANS(RC[-13]))-0.5*RC[-1]*RC[-1]*SIN(4*RADIANS(RC[-13]))-1.25*RC[-11]*RC[-11]*SIN(2*RADIANS(RC[-12]))) -> -6.6767854457469724 | W82: =DEGREES(ACOS(COS(RADIANS(90.833))/(COS(RADIANS(R2C2))*COS(RADIANS(RC[-3])))-TAN(RADIANS(R2C2))*TAN(RADIANS(RC[-3])))) -> 95.092382591105959 | X82: =(720-4*R3C2-RC[-2]+R4C2*60)/1440 -> 1899-12-31T14:02:40.607 | Y82: =(RC[-1]*1440-RC[-2]*4)/1440 -> 1899-12-31T07:42:18.435 | Z82: =(RC[-2]*1440+RC[-3]*4)/1440 -> 1899-12-31T20:23:02.779 | AA82: =8*RC[-4] -> 760.73906072884768 | AB82: =MOD(RC[-23]*1440+RC[-6]+4*R3C2-60*R4C2,1440) -> 717.32321455425301 | AC82: =IF(RC[-1]/4<0,RC[-1]/4+180,RC[-1]/4-180) -> -0.66919636143674666 | AD82: =DEGREES(ACOS(SIN(RADIANS(R2C2))*SIN(RADIANS(RC[-10]))+COS(RADIANS(R2C2))*COS(RADIANS(RC[-10]))*COS(RADIANS(RC[-1])))) -> 69.037040253798509 | AE82: =90-RC[-1] -> 20.962959746201491 | AF82: =IF(RC[-1]>85,0,IF(RC[-1]>5,58.1/TAN(RADIANS(RC[-1]))-0.07/POWER(TAN(RADIANS(RC[-1])),3)+0.000086/POWER(TAN(RADIANS(RC[-1])),5),IF(RC[-1]>-0.575,1735+RC[-1]*(-518.2+RC[-1]*(103.4+RC[-1]*(-12.79+RC[-1]*0.711))),-20.772/TAN(RADIANS(RC[-1])))))/3600 -> 4.1781747205176585E-2 | AG82: =RC[-2]+RC[-1] -> 21.004741493406669 | AH82: =IF(RC[-5]>0,MOD(DEGREES(ACOS(((SIN(RADIANS(R2C2))*COS(RADIANS(RC[-4])))-SIN(RADIANS(RC[-14])))/(COS(RADIANS(R2C2))*SIN(RADIANS(RC[-4])))))+180,360),MOD(540-DEGREES(ACOS(((SIN(RADIANS(R2C2))*COS(RADIANS(RC[-4])))-SIN(RADIANS(RC[-14])))/(COS(RADIANS(R2C2))*SIN(RADIANS(RC[-4]))))),360)) -> 179.28347048057799
D83: =R[-1]C+1 -> 2017-03-23T00:00:00.000 | E83: =R5C2 -> 1899-12-31T14:00:00.000 | F83: =RC[-2]+2415018.5+RC[-1]-R4C2/24 -> 2457836.375 | G83: =(RC[-1]-2451545)/36525 -> 0.17224845995893223 | I83: =MOD(280.46646+RC[-2]*(36000.76983 + RC[-2]*0.0003032),360) -> 1.5436295492918362 | J83: =357.52911+RC[-3]*(35999.05029 - 0.0001537*RC[-3]) -> 6558.3100778764456 | K83: =0.016708634-RC[-4]*(0.000042037+0.0000001267*RC[-4]) -> 1.6701389432359007E-2 | L83: =SIN(RADIANS(RC[-2]))*(1.914602-RC[-5]*(0.004817+0.000014*RC[-5]))+SIN(RADIANS(2*RC[-2]))*(0.019993-0.000101*RC[-5])+SIN(RADIANS(3*RC[-2]))*0.000289 -> 1.8817675820856896 | M83: =RC[-4]+RC[-1] -> 3.425397131377526 | N83: =RC[-4]+RC[-2] -> 6560.1918454585311 | O83: =(1.000001018*(1-RC[-4]*RC[-4]))/(1+RC[-4]*COS(RADIANS(RC[-1]))) -> 0.99688586384728017 | P83: =RC[-3]-0.00569-0.00478*SIN(RADIANS(125.04-1934.136*RC[-9])) -> 3.4174548153932318 | Q83: =23+(26+((21.448-RC[-10]*(46.815+RC[-10]*(0.00059-RC[-10]*0.001813))))/60)/60 -> 23.437051161140943 | R83: =RC[-1]+0.00256*COS(RADIANS(125.04-1934.136*RC[-11])) -> 23.434793167845189 | S83: =DEGREES(ATAN2(COS(RADIANS(RC[-3])),COS(RADIANS(RC[-1]))*SIN(RADIANS(RC[-3])))) -> 3.1361481128438999 | T83: =DEGREES(ASIN(SIN(RADIANS(RC[-2]))*SIN(RADIANS(RC[-4])))) -> 1.3584608377875047 | U83: =TAN(RADIANS(RC[-3]/2))*TAN(RADIANS(RC[-3]/2)) -> 4.3017544796774609E-2 | V83: =4*DEGREES(RC[-1]*SIN(2*RADIANS(RC[-13]))-2*RC[-11]*SIN(RADIANS(RC[-12]))+4*RC[-11]*RC[-1]*SIN(RADIANS(RC[-12]))*COS(2*RADIANS(RC[-13]))-0.5*RC[-1]*RC[-1]*SIN(4*RADIANS(RC[-13]))-1.25*RC[-11]*RC[-11]*SIN(2*RADIANS(RC[-12]))) -> -6.3760869264911522 | W83: =DEGREES(ACOS(COS(RADIANS(90.833))/(COS(RADIANS(R2C2))*COS(RADIANS(RC[-3])))-TAN(RADIANS(R2C2))*TAN(RADIANS(RC[-3])))) -> 96.181150784038167 | X83: =(720-4*R3C2-RC[-2]+R4C2*60)/1440 -> 1899-12-31T14:02:22.565 | Y83: =(RC[-1]*1440-RC[-2]*4)/1440 -> 1899-12-31T07:37:39.089 | Z83: =(RC[-2]*1440+RC[-3]*4)/1440 -> 1899-12-31T20:27:06.041 | AA83: =8*RC[-4] -> 769.44920627230533 | AB83: =MOD(RC[-23]*1440+RC[-6]+4*R3C2-60*R4C2,1440) -> 717.6239130735089 | AC83: =IF(RC[-1]/4<0,RC[-1]/4+180,RC[-1]/4-180) -> -0.5940217316227745 | AD83: =DEGREES(ACOS(SIN(RADIANS(R2C2))*SIN(RADIANS(RC[-10]))+COS(RADIANS(R2C2))*COS(RADIANS(RC[-10]))*COS(RADIANS(RC[-1])))) -> 68.642669679218116 | AE83: =90-RC[-1] -> 21.357330320781884 | AF83: =IF(RC[-1]>85,0,IF(RC[-1]>5,58.1/TAN(RADIANS(RC[-1]))-0.07/POWER(TAN(RADIANS(RC[-1])),3)+0.000086/POWER(TAN(RADIANS(RC[-1])),5),IF(RC[-1]>-0.575,1735+RC[-1]*(-518.2+RC[-1]*(103.4+RC[-1]*(-12.79+RC[-1]*0.711))),-20.772/TAN(RADIANS(RC[-1])))))/3600 -> 4.0949458559266225E-2 | AG83: =RC[-2]+RC[-1] -> 21.398279779341149 | AH83: =IF(RC[-5]>0,MOD(DEGREES(ACOS(((SIN(RADIANS(R2C2))*COS(RADIANS(RC[-4])))-SIN(RADIANS(RC[-14])))/(COS(RADIANS(R2C2))*SIN(RADIANS(RC[-4])))))+180,360),MOD(540-DEGREES(ACOS(((SIN(RADIANS(R2C2))*COS(RADIANS(RC[-4])))-SIN(RADIANS(RC[-14])))/(COS(RADIANS(R2C2))*SIN(RADIANS(RC[-4]))))),360)) -> 179.36235477935338
D84: =R[-1]C+1 -> 2017-03-24T00:00:00.000 | E84: =R5C2 -> 1899-12-31T14:00:00.000 | F84: =RC[-2]+2415018.5+RC[-1]-R4C2/24 -> 2457837.375 | G84: =(RC[-1]-2451545)/36525 -> 0.17227583846680355 | I84: =MOD(280.46646+RC[-2]*(36000.76983 + RC[-2]*0.0003032),360) -> 2.5292769123161634 | J84: =357.52911+RC[-3]*(35999.05029 - 0.0001537*RC[-3]) -> 6559.2956781567209 | K84: =0.016708634-RC[-4]*(0.000042037+0.0000001267*RC[-4]) -> 1.6701388280253568E-2 | L84: =SIN(RADIANS(RC[-2]))*(1.914602-RC[-5]*(0.004817+0.000014*RC[-5]))+SIN(RADIANS(2*RC[-2]))*(0.019993-0.000101*RC[-5])+SIN(RADIANS(3*RC[-2]))*0.000289 -> 1.8875164407218952 | M84: =RC[-4]+RC[-1] -> 4.4167933530380585 | N84: =RC[-4]+RC[-2] -> 6561.1831945974427 | O84: =(1.000001018*(1-RC[-4]*RC[-4]))/(1+RC[-4]*COS(RADIANS(RC[-1]))) -> 0.99716941066317977 | P84: =RC[-3]-0.00569-0.00478*SIN(RADIANS(125.04-1934.136*RC[-9])) -> 4.4088471414260848 | Q84: =23+(26+((21.448-RC[-10]*(46.815+RC[-10]*(0.00059-RC[-10]*0.001813))))/60)/60 -> 23.437050805105944 | R84: =RC[-1]+0.00256*COS(RADIANS(125.04-1934.136*RC[-11])) -> 23.434793927622088 | S84: =DEGREES(ATAN2(COS(RADIANS(RC[-3])),COS(RADIANS(RC[-1]))*SIN(RADIANS(RC[-3])))) -> 4.0464378453598808 | T84: =DEGREES(ASIN(SIN(RADIANS(RC[-2]))*SIN(RADIANS(RC[-4])))) -> 1.7519643102934719 | U84: =TAN(RADIANS(RC[-3]/2))*TAN(RADIANS(RC[-3]/2)) -> 4.3017547665426724E-2 | V84: =4*DEGREES(RC[-1]*SIN(2*RADIANS(RC[-13]))-2*RC[-11]*SIN(RADIANS(RC[-12]))+4*RC[-11]*RC[-1]*SIN(RADIANS(RC[-12]))*COS(2*RADIANS(RC[-13]))-0.5*RC[-1]*RC[-1]*SIN(4*RADIANS(RC[-13]))-1.25*RC[-11]*RC[-11]*SIN(2*RADIANS(RC[-12]))) -> -6.0746143674645481 | W84: =DEGREES(ACOS(COS(RADIANS(90.833))/(COS(RADIANS(R2C2))*COS(RADIANS(RC[-3])))-TAN(RADIANS(R2C2))*TAN(RADIANS(RC[-3])))) -> 97.271065989067253 | X84: =(720-4*R3C2-RC[-2]+R4C2*60)/1440 -> 1899-12-31T14:02:04.477 | Y84: =(RC[-1]*1440-RC[-2]*4)/1440 -> 1899-12-31T07:32:59.421 | Z84: =(RC[-2]*1440+RC[-3]*4)/1440 -> 1899-12-31T20:31:09.533 | AA84: =8*RC[-4] -> 778.16852791253802 | AB84: =MOD(RC[-23]*1440+RC[-6]+4*R3C2-60*R4C2,1440) -> 717.92538563253549 | AC84: =IF(RC[-1]/4<0,RC[-1]/4+180,RC[-1]/4-180) -> -0.51865359186612636 | AD84: =DEGREES(ACOS(SIN(RADIANS(R2C2))*SIN(RADIANS(RC[-10]))+COS(RADIANS(R2C2))*COS(RADIANS(RC[-10]))*COS(RADIANS(RC[-1])))) -> 68.248899713634515 | AE84: =90-RC[-1] -> 21.751100286365485 | AF84: =IF(RC[-1]>85,0,IF(RC[-1]>5,58.1/TAN(RADIANS(RC[-1]))-0.07/POWER(TAN(RADIANS(RC[-1])),3)+0.000086/POWER(TAN(RADIANS(RC[-1])),5),IF(RC[-1]>-0.575,1735+RC[-1]*(-518.2+RC[-1]*(103.4+RC[-1]*(-12.79+RC[-1]*0.711))),-20.772/TAN(RADIANS(RC[-1])))))/3600 -> 4.0146398939658316E-2 | AG84: =RC[-2]+RC[-1] -> 21.791246685305143 | AH84: =IF(RC[-5]>0,MOD(DEGREES(ACOS(((SIN(RADIANS(R2C2))*COS(RADIANS(RC[-4])))-SIN(RADIANS(RC[-14])))/(COS(RADIANS(R2C2))*SIN(RADIANS(RC[-4])))))+180,360),MOD(540-DEGREES(ACOS(((SIN(RADIANS(R2C2))*COS(RADIANS(RC[-4])))-SIN(RADIANS(RC[-14])))/(COS(RADIANS(R2C2))*SIN(RADIANS(RC[-4]))))),360)) -> 179.44184872615995
D85: =R[-1]C+1 -> 2017-03-25T00:00:00.000 | E85: =R5C2 -> 1899-12-31T14:00:00.000 | F85: =RC[-2]+2415018.5+RC[-1]-R4C2/24 -> 2457838.375 | G85: =(RC[-1]-2451545)/36525 -> 0.17230321697467488 | I85: =MOD(280.46646+RC[-2]*(36000.76983 + RC[-2]*0.0003032),360) -> 3.5149242753414001 | J85: =357.52911+RC[-3]*(35999.05029 - 0.0001537*RC[-3]) -> 6560.2812784369962 | K85: =0.016708634-RC[-4]*(0.000042037+0.0000001267*RC[-4]) -> 1.6701387128147935E-2 | L85: =SIN(RADIANS(RC[-2]))*(1.914602-RC[-5]*(0.004817+0.000014*RC[-5]))+SIN(RADIANS(2*RC[-2]))*(0.019993-0.000101*RC[-5])+SIN(RADIANS(3*RC[-2]))*0.000289 -> 1.8927008890218904 | M85: =RC[-4]+RC[-1] -> 5.4076251643632904 | N85: =RC[-4]+RC[-2] -> 6562.1739793260185 | O85: =(1.000001018*(1-RC[-4]*RC[-4]))/(1+RC[-4]*COS(RADIANS(RC[-1]))) -> 0.99745371923603676 | P85: =RC[-3]-0.00569-0.00478*SIN(RADIANS(125.04-1934.136*RC[-9])) -> 5.3996750590508436 | Q85: =23+(26+((21.448-RC[-10]*(46.815+RC[-10]*(0.00059-RC[-10]*0.001813))))/60)/60 -> 23.437050449070945 | R85: =RC[-1]+0.00256*COS(RADIANS(125.04-1934.136*RC[-11])) -> 23.434794689326761 | S85: =DEGREES(ATAN2(COS(RADIANS(RC[-3])),COS(RADIANS(RC[-1]))*SIN(RADIANS(RC[-3])))) -> 4.9565912931602218 | T85: =DEGREES(ASIN(SIN(RADIANS(RC[-2]))*SIN(RADIANS(RC[-4])))) -> 2.1448020567250414 | U85: =TAN(RADIANS(RC[-3]/2))*TAN(RADIANS(RC[-3]/2)) -> 4.301755054135753E-2 | V85: =4*DEGREES(RC[-1]*SIN(2*RADIANS(RC[-13]))-2*RC[-11]*SIN(RADIANS(RC[-12]))+4*RC[-11]*RC[-1]*SIN(RADIANS(RC[-12]))*COS(2*RADIANS(RC[-13]))-0.5*RC[-1]*RC[-1]*SIN(4*RADIANS(RC[-13]))-1.25*RC[-11]*RC[-11]*SIN(2*RADIANS(RC[-12]))) -> -5.7727004815076457 | W85: =DEGREES(ACOS(COS(RADIANS(90.833))/(COS(RADIANS(R2C2))*COS(RADIANS(RC[-3])))-TAN(RADIANS(R2C2))*TAN(RADIANS(RC[-3])))) -> 98.362356911003616 | X85: =(720-4*R3C2-RC[-2]+R4C2*60)/1440 -> 1899-12-31T14:01:46.362 | Y85: =(RC[-1]*1440-RC[-2]*4)/1440 -> 1899-12-31T07:28:19.396 | Z85: =(RC[-2]*1440+RC[-3]*4)/1440 -> 1899-12-31T20:35:13.328 | AA85: =8*RC[-4] -> 786.89885528802893 | AB85: =MOD(RC[-23]*1440+RC[-6]+4*R3C2-60*R4C2,1440) -> 718.22729951849237 | AC85: =IF(RC[-1]/4<0,RC[-1]/4+180,RC[-1]/4-180) -> -0.44317512037690676 | AD85: =DEGREES(ACOS(SIN(RADIANS(R2C2))*SIN(RADIANS(RC[-10]))+COS(RADIANS(R2C2))*COS(RADIANS(RC[-10]))*COS(RADIANS(RC[-1])))) -> 67.855830386443301 | AE85: =90-RC[-1] -> 22.144169613556699 | AF85: =IF(RC[-1]>85,0,IF(RC[-1]>5,58.1/TAN(RADIANS(RC[-1]))-0.07/POWER(TAN(RADIANS(RC[-1])),3)+0.000086/POWER(TAN(RADIANS(RC[-1])),5),IF(RC[-1]>-0.575,1735+RC[-1]*(-518.2+RC[-1]*(103.4+RC[-1]*(-12.79+RC[-1]*0.711))),-20.772/TAN(RADIANS(RC[-1])))))/3600 -> 3.9371194353064902E-2 | AG85: =RC[-2]+RC[-1] -> 22.183540807909765 | AH85: =IF(RC[-5]>0,MOD(DEGREES(ACOS(((SIN(RADIANS(R2C2))*COS(RADIANS(RC[-4])))-SIN(RADIANS(RC[-14])))/(COS(RADIANS(R2C2))*SIN(RADIANS(RC[-4])))))+180,360),MOD(540-DEGREES(ACOS(((SIN(RADIANS(R2C2))*COS(RADIANS(RC[-4])))-SIN(RADIANS(RC[-14])))/(COS(RADIANS(R2C2))*SIN(RADIANS(RC[-4]))))),360)) -> 179.52186671523816
D86: =R[-1]C+1 -> 2017-03-26T00:00:00.000 | E86: =R5C2 -> 1899-12-31T14:00:00.000 | F86: =RC[-2]+2415018.5+RC[-1]-R4C2/24 -> 2457839.375 | G86: =(RC[-1]-2451545)/36525 -> 0.1723305954825462 | I86: =MOD(280.46646+RC[-2]*(36000.76983 + RC[-2]*0.0003032),360) -> 4.5005716383666368 | J86: =357.52911+RC[-3]*(35999.05029 - 0.0001537*RC[-3]) -> 6561.2668787172706 | K86: =0.016708634-RC[-4]*(0.000042037+0.0000001267*RC[-4]) -> 1.6701385976042114E-2 | L86: =SIN(RADIANS(RC[-2]))*(1.914602-RC[-5]*(0.004817+0.000014*RC[-5]))+SIN(RADIANS(2*RC[-2]))*(0.019993-0.000101*RC[-5])+SIN(RADIANS(3*RC[-2]))*0.000289 -> 1.8973199826000826 | M86: =RC[-4]+RC[-1] -> 6.3978916209667194 | N86: =RC[-4]+RC[-2] -> 6563.1641986998711 | O86: =(1.000001018*(1-RC[-4]*RC[-4]))/(1+RC[-4]*COS(RADIANS(RC[-1]))) -> 0.99773870414180021 | P86: =RC[-3]-0.00569-0.00478*SIN(RADIANS(125.04-1934.136*RC[-9])) -> 6.3899376238843306 | Q86: =23+(26+((21.448-RC[-10]*(46.815+RC[-10]*(0.00059-RC[-10]*0.001813))))/60)/60 -> 23.43705009303595 | R86: =RC[-1]+0.00256*COS(RADIANS(125.04-1934.136*RC[-11])) -> 23.434795452958255 | S86: =DEGREES(ATAN2(COS(RADIANS(RC[-3])),COS(RADIANS(RC[-1]))*SIN(RADIANS(RC[-3])))) -> 5.8666921942235648 | T86: =DEGREES(ASIN(SIN(RADIANS(RC[-2]))*SIN(RADIANS(RC[-4])))) -> 2.5368751839467492 | U86: =TAN(RADIANS(RC[-3]/2))*TAN(RADIANS(RC[-3]/2)) -> 4.3017553424563461E-2 | V86: =4*DEGREES(RC[-1]*SIN(2*RADIANS(RC[-13]))-2*RC[-11]*SIN(RADIANS(RC[-12]))+4*RC[-11]*RC[-1]*SIN(RADIANS(RC[-12]))*COS(2*RADIANS(RC[-13]))-0.5*RC[-1]*RC[-1]*SIN(4*RADIANS(RC[-13]))-1.25*RC[-11]*RC[-11]*SIN(2*RADIANS(RC[-12]))) -> -5.4706759462683152 | W86: =DEGREES(ACOS(COS(RADIANS(90.833))/(COS(RADIANS(R2C2))*COS(RADIANS(RC[-3])))-TAN(RADIANS(R2C2))*TAN(RADIANS(RC[-3])))) -> 99.455256105907239 | X86: =(720-4*R3C2-RC[-2]+R4C2*60)/1440 -> 1899-12-31T14:01:28.241 | Y86: =(RC[-1]*1440-RC[-2]*4)/1440 -> 1899-12-31T07:23:38.979 | Z86: =(RC[-2]*1440+RC[-3]*4)/1440 -> 1899-12-31T20:39:17.502 | AA86: =8*RC[-4] -> 795.64204884725791 | AB86: =MOD(RC[-23]*1440+RC[-6]+4*R3C2-60*R4C2,1440) -> 718.52932405373167 | AC86: =IF(RC[-1]/4<0,RC[-1]/4+180,RC[-1]/4-180) -> -0.36766898656708236 | AD86: =DEGREES(ACOS(SIN(RADIANS(R2C2))*SIN(RADIANS(RC[-10]))+COS(RADIANS(R2C2))*COS(RADIANS(RC[-10]))*COS(RADIANS(RC[-1])))) -> 67.463561216884557 | AE86: =90-RC[-1] -> 22.536438783115443 | AF86: =IF(RC[-1]>85,0,IF(RC[-1]>5,58.1/TAN(RADIANS(RC[-1]))-0.07/POWER(TAN(RADIANS(RC[-1])),3)+0.000086/POWER(TAN(RADIANS(RC[-1])),5),IF(RC[-1]>-0.575,1735+RC[-1]*(-518.2+RC[-1]*(103.4+RC[-1]*(-12.79+RC[-1]*0.711))),-20.772/TAN(RADIANS(RC[-1])))))/3600 -> 3.8622554315789204E-2 | AG86: =RC[-2]+RC[-1] -> 22.575061337431233 | AH86: =IF(RC[-5]>0,MOD(DEGREES(ACOS(((SIN(RADIANS(R2C2))*COS(RADIANS(RC[-4])))-SIN(RADIANS(RC[-14])))/(COS(RADIANS(R2C2))*SIN(RADIANS(RC[-4])))))+180,360),MOD(540-DEGREES(ACOS(((SIN(RADIANS(R2C2))*COS(RADIANS(RC[-4])))-SIN(RADIANS(RC[-14])))/(COS(RADIANS(R2C2))*SIN(RADIANS(RC[-4]))))),360)) -> 179.60232267851791
D87: =R[-1]C+1 -> 2017-03-27T00:00:00.000 | E87: =R5C2 -> 1899-12-31T14:00:00.000 | F87: =RC[-2]+2415018.5+RC[-1]-R4C2/24 -> 2457840.375 | G87: =(RC[-1]-2451545)/36525 -> 0.17235797399041752 | I87: =MOD(280.46646+RC[-2]*(36000.76983 + RC[-2]*0.0003032),360) -> 5.4862190013918735 | J87: =357.52911+RC[-3]*(35999.05029 - 0.0001537*RC[-3]) -> 6562.252478997545 | K87: =0.016708634-RC[-4]*(0.000042037+0.0000001267*RC[-4]) -> 1.6701384823936103E-2 | L87: =SIN(RADIANS(RC[-2]))*(1.914602-RC[-5]*(0.004817+0.000014*RC[-5]))+SIN(RADIANS(2*RC[-2]))*(0.019993-0.000101*RC[-5])+SIN(RADIANS(3*RC[-2]))*0.000289 -> 1.9013729497522553 | M87: =RC[-4]+RC[-1] -> 7.3875919511441293 | N87: =RC[-4]+RC[-2] -> 6564.153851947297 | O87: =(1.000001018*(1-RC[-4]*RC[-4]))/(1+RC[-4]*COS(RADIANS(RC[-1]))) -> 0.99802427989939124 | P87: =RC[-3]-0.00569-0.00478*SIN(RADIANS(125.04-1934.136*RC[-9])) -> 7.3796340642256553 | Q87: =23+(26+((21.448-RC[-10]*(46.815+RC[-10]*(0.00059-RC[-10]*0.001813))))/60)/60 -> 23.437049737000951 | R87: =RC[-1]+0.00256*COS(RADIANS(125.04-1934.136*RC[-11])) -> 23.434796218515615 | S87: =DEGREES(ATAN2(COS(RADIANS(RC[-3])),COS(RADIANS(RC[-1]))*SIN(RADIANS(RC[-3])))) -> 6.7768238556072458 | T87: =DEGREES(ASIN(SIN(RADIANS(RC[-2]))*SIN(RADIANS(RC[-4])))) -> 2.9280851421142255 | U87: =TAN(RADIANS(RC[-3]/2))*TAN(RADIANS(RC[-3]/2)) -> 4.3017556315040895E-2 | V87: =4*DEGREES(RC[-1]*SIN(2*RADIANS(RC[-13]))-2*RC[-11]*SIN(RADIANS(RC[-12]))+4*RC[-11]*RC[-1]*SIN(RADIANS(RC[-12]))*COS(2*RADIANS(RC[-13]))-0.5*RC[-1]*RC[-1]*SIN(4*RADIANS(RC[-13]))-1.25*RC[-11]*RC[-11]*SIN(2*RADIANS(RC[-12]))) -> -5.1688692410474788 | W87: =DEGREES(ACOS(COS(RADIANS(90.833))/(COS(RADIANS(R2C2))*COS(RADIANS(RC[-3])))-TAN(RADIANS(R2C2))*TAN(RADIANS(RC[-3])))) -> 100.55000049511287 | X87: =(720-4*R3C2-RC[-2]+R4C2*60)/1440 -> 1899-12-31T14:01:10.132 | Y87: =(RC[-1]*1440-RC[-2]*4)/1440 -> 1899-12-31T07:18:58.132 | Z87: =(RC[-2]*1440+RC[-3]*4)/1440 -> 1899-12-31T20:43:22.132 | AA87: =8*RC[-4] -> 804.40000396090295 | AB87: =MOD(RC[-23]*1440+RC[-6]+4*R3C2-60*R4C2,1440) -> 718.83113075895255 | AC87: =IF(RC[-1]/4<0,RC[-1]/4+180,RC[-1]/4-180) -> -0.29221731026186148 | AD87: =DEGREES(ACOS(SIN(RADIANS(R2C2))*SIN(RADIANS(RC[-10]))+COS(RADIANS(R2C2))*COS(RADIANS(RC[-10]))*COS(RADIANS(RC[-1])))) -> 67.072191224207586 | AE87: =90-RC[-1] -> 22.927808775792414 | AF87: =IF(RC[-1]>85,0,IF(RC[-1]>5,58.1/TAN(RADIANS(RC[-1]))-0.07/POWER(TAN(RADIANS(RC[-1])),3)+0.000086/POWER(TAN(RADIANS(RC[-1])),5),IF(RC[-1]>-0.575,1735+RC[-1]*(-518.2+RC[-1]*(103.4+RC[-1]*(-12.79+RC[-1]*0.711))),-20.772/TAN(RADIANS(RC[-1])))))/3600 -> 3.7899265918287219E-2 | AG87: =RC[-2]+RC[-1] -> 22.965708041710702 | AH87: =IF(RC[-5]>0,MOD(DEGREES(ACOS(((SIN(RADIANS(R2C2))*COS(RADIANS(RC[-4])))-SIN(RADIANS(RC[-14])))/(COS(RADIANS(R2C2))*SIN(RADIANS(RC[-4])))))+180,360),MOD(540-DEGREES(ACOS(((SIN(RADIANS(R2C2))*COS(RADIANS(RC[-4])))-SIN(RADIANS(RC[-14])))/(COS(RADIANS(R2C2))*SIN(RADIANS(RC[-4]))))),360)) -> 179.68313012507394
D88: =R[-1]C+1 -> 2017-03-28T00:00:00.000 | E88: =R5C2 -> 1899-12-31T14:00:00.000 | F88: =RC[-2]+2415018.5+RC[-1]-R4C2/24 -> 2457841.375 | G88: =(RC[-1]-2451545)/36525 -> 0.17238535249828885 | I88: =MOD(280.46646+RC[-2]*(36000.76983 + RC[-2]*0.0003032),360) -> 6.4718663644180197 | J88: =357.52911+RC[-3]*(35999.05029 - 0.0001537*RC[-3]) -> 6563.2380792778195 | K88: =0.016708634-RC[-4]*(0.000042037+0.0000001267*RC[-4]) -> 1.6701383671829904E-2 | L88: =SIN(RADIANS(RC[-2]))*(1.914602-RC[-5]*(0.004817+0.000014*RC[-5]))+SIN(RADIANS(2*RC[-2]))*(0.019993-0.000101*RC[-5])+SIN(RADIANS(3*RC[-2]))*0.000289 -> 1.9048591909554149 | M88: =RC[-4]+RC[-1] -> 8.3767255553734348 | N88: =RC[-4]+RC[-2] -> 6565.1429384687744 | O88: =(1.000001018*(1-RC[-4]*RC[-4]))/(1+RC[-4]*COS(RADIANS(RC[-1]))) -> 0.9983103609970656 | P88: =RC[-3]-0.00569-0.00478*SIN(RADIANS(125.04-1934.136*RC[-9])) -> 8.3687637805560549 | Q88: =23+(26+((21.448-RC[-10]*(46.815+RC[-10]*(0.00059-RC[-10]*0.001813))))/60)/60 -> 23.437049380965956 | R88: =RC[-1]+0.00256*COS(RADIANS(125.04-1934.136*RC[-11])) -> 23.434796985997878 | S88: =DEGREES(ATAN2(COS(RADIANS(RC[-3])),COS(RADIANS(RC[-1]))*SIN(RADIANS(RC[-3])))) -> 7.6870690993735744 | T88: =DEGREES(ASIN(SIN(RADIANS(RC[-2]))*SIN(RADIANS(RC[-4])))) -> 3.318333713338435 | U88: =TAN(RADIANS(RC[-3]/2))*TAN(RADIANS(RC[-3]/2)) -> 4.3017559212786188E-2 | V88: =4*DEGREES(RC[-1]*SIN(2*RADIANS(RC[-13]))-2*RC[-11]*SIN(RADIANS(RC[-12]))+4*RC[-11]*RC[-1]*SIN(RADIANS(RC[-12]))*COS(2*RADIANS(RC[-13]))-0.5*RC[-1]*RC[-1]*SIN(4*RADIANS(RC[-13]))-1.25*RC[-11]*RC[-11]*SIN(2*RADIANS(RC[-12]))) -> -4.8676064861631945 | W88: =DEGREES(ACOS(COS(RADIANS(90.833))/(COS(RADIANS(R2C2))*COS(RADIANS(RC[-3])))-TAN(RADIANS(R2C2))*TAN(RADIANS(RC[-3])))) -> 101.6468319167095 | X88: =(720-4*R3C2-RC[-2]+R4C2*60)/1440 -> 1899-12-31T14:00:52.056 | Y88: =(RC[-1]*1440-RC[-2]*4)/1440 -> 1899-12-31T07:14:16.817 | Z88: =(RC[-2]*1440+RC[-3]*4)/1440 -> 1899-12-31T20:47:27.296 | AA88: =8*RC[-4] -> 813.17465533367601 | AB88: =MOD(RC[-23]*1440+RC[-6]+4*R3C2-60*R4C2,1440) -> 719.13239351383686 | AC88: =IF(RC[-1]/4<0,RC[-1]/4+180,RC[-1]/4-180) -> -0.21690162154078507 | AD88: =DEGREES(ACOS(SIN(RADIANS(R2C2))*SIN(RADIANS(RC[-10]))+COS(RADIANS(R2C2))*COS(RADIANS(RC[-10]))*COS(RADIANS(RC[-1])))) -> 66.681818938198433 | AE88: =90-RC[-1] -> 23.318181061801567 | AF88: =IF(RC[-1]>85,0,IF(RC[-1]>5,58.1/TAN(RADIANS(RC[-1]))-0.07/POWER(TAN(RADIANS(RC[-1])),3)+0.000086/POWER(TAN(RADIANS(RC[-1])),5),IF(RC[-1]>-0.575,1735+RC[-1]*(-518.2+RC[-1]*(103.4+RC[-1]*(-12.79+RC[-1]*0.711))),-20.772/TAN(RADIANS(RC[-1])))))/3600 -> 3.7200188374591305E-2 | AG88: =RC[-2]+RC[-1] -> 23.355381250176158 | AH88: =IF(RC[-5]>0,MOD(DEGREES(ACOS(((SIN(RADIANS(R2C2))*COS(RADIANS(RC[-4])))-SIN(RADIANS(RC[-14])))/(COS(RADIANS(R2C2))*SIN(RADIANS(RC[-4])))))+180,360),MOD(540-DEGREES(ACOS(((SIN(RADIANS(R2C2))*COS(RADIANS(RC[-4])))-SIN(RADIANS(RC[-14])))/(COS(RADIANS(R2C2))*SIN(RADIANS(RC[-4]))))),360)) -> 179.7642021811057
D89: =R[-1]C+1 -> 2017-03-29T00:00:00.000 | E89: =R5C2 -> 1899-12-31T14:00:00.000 | F89: =RC[-2]+2415018.5+RC[-1]-R4C2/24 -> 2457842.375 | G89: =(RC[-1]-2451545)/36525 -> 0.17241273100616017 | I89: =MOD(280.46646+RC[-2]*(36000.76983 + RC[-2]*0.0003032),360) -> 7.4575137274450753 | J89: =357.52911+RC[-3]*(35999.05029 - 0.0001537*RC[-3]) -> 6564.223679558093 | K89: =0.016708634-RC[-4]*(0.000042037+0.0000001267*RC[-4]) -> 1.6701382519723511E-2 | L89: =SIN(RADIANS(RC[-2]))*(1.914602-RC[-5]*(0.004817+0.000014*RC[-5]))+SIN(RADIANS(2*RC[-2]))*(0.019993-0.000101*RC[-5])+SIN(RADIANS(3*RC[-2]))*0.000289 -> 1.9077782783136059 | M89: =RC[-4]+RC[-1] -> 9.3652920057586808 | N89: =RC[-4]+RC[-2] -> 6566.1314578364063 | O89: =(1.000001018*(1-RC[-4]*RC[-4]))/(1+RC[-4]*COS(RADIANS(RC[-1]))) -> 0.99859686191860708 | P89: =RC[-3]-0.00569-0.00478*SIN(RADIANS(125.04-1934.136*RC[-9])) -> 9.3573263449828943 | Q89: =23+(26+((21.448-RC[-10]*(46.815+RC[-10]*(0.00059-RC[-10]*0.001813))))/60)/60 -> 23.437049024930957 | R89: =RC[-1]+0.00256*COS(RADIANS(125.04-1934.136*RC[-11])) -> 23.434797755404087 | S89: =DEGREES(ATAN2(COS(RADIANS(RC[-3])),COS(RADIANS(RC[-1]))*SIN(RADIANS(RC[-3])))) -> 8.5975102085406334 | T89: =DEGREES(ASIN(SIN(RADIANS(RC[-2]))*SIN(RADIANS(RC[-4])))) -> 3.7075230006007898 | U89: =TAN(RADIANS(RC[-3]/2))*TAN(RADIANS(RC[-3]/2)) -> 4.3017562117795734E-2 | V89: =4*DEGREES(RC[-1]*SIN(2*RADIANS(RC[-13]))-2*RC[-11]*SIN(RADIANS(RC[-12]))+4*RC[-11]*RC[-1]*SIN(RADIANS(RC[-12]))*COS(2*RADIANS(RC[-13]))-0.5*RC[-1]*RC[-1]*SIN(4*RADIANS(RC[-13]))-1.25*RC[-11]*RC[-11]*SIN(2*RADIANS(RC[-12]))) -> -4.5672112839137924 | W89: =DEGREES(ACOS(COS(RADIANS(90.833))/(COS(RADIANS(R2C2))*COS(RADIANS(RC[-3])))-TAN(RADIANS(R2C2))*TAN(RADIANS(RC[-3])))) -> 102.74599772026623 | X89: =(720-4*R3C2-RC[-2]+R4C2*60)/1440 -> 1899-12-31T14:00:34.033 | Y89: =(RC[-1]*1440-RC[-2]*4)/1440 -> 1899-12-31T07:09:34.993 | Z89: =(RC[-2]*1440+RC[-3]*4)/1440 -> 1899-12-31T20:51:33.072 | AA89: =8*RC[-4] -> 821.96798176212985 | AB89: =MOD(RC[-23]*1440+RC[-6]+4*R3C2-60*R4C2,1440) -> 719.43278871608618 | AC89: =IF(RC[-1]/4<0,RC[-1]/4+180,RC[-1]/4-180) -> -0.1418028209784552 | AD89: =DEGREES(ACOS(SIN(RADIANS(R2C2))*SIN(RADIANS(RC[-10]))+COS(RADIANS(R2C2))*COS(RADIANS(RC[-10]))*COS(RADIANS(RC[-1])))) -> 66.292542410003136 | AE89: =90-RC[-1] -> 23.707457589996864 | AF89: =IF(RC[-1]>85,0,IF(RC[-1]>5,58.1/TAN(RADIANS(RC[-1]))-0.07/POWER(TAN(RADIANS(RC[-1])),3)+0.000086/POWER(TAN(RADIANS(RC[-1])),5),IF(RC[-1]>-0.575,1735+RC[-1]*(-518.2+RC[-1]*(103.4+RC[-1]*(-12.79+RC[-1]*0.711))),-20.772/TAN(RADIANS(RC[-1])))))/3600 -> 3.6524248012548818E-2 | AG89: =RC[-2]+RC[-1] -> 23.743981838009411 | AH89: =IF(RC[-5]>0,MOD(DEGREES(ACOS(((SIN(RADIANS(R2C2))*COS(RADIANS(RC[-4])))-SIN(RADIANS(RC[-14])))/(COS(RADIANS(R2C2))*SIN(RADIANS(RC[-4])))))+180,360),MOD(540-DEGREES(ACOS(((SIN(RADIANS(R2C2))*COS(RADIANS(RC[-4])))-SIN(RADIANS(RC[-14])))/(COS(RADIANS(R2C2))*SIN(RADIANS(RC[-4]))))),360)) -> 179.84545163038865
D90: =R[-1]C+1 -> 2017-03-30T00:00:00.000 | E90: =R5C2 -> 1899-12-31T14:00:00.000 | F90: =RC[-2]+2415018.5+RC[-1]-R4C2/24 -> 2457843.375 | G90: =(RC[-1]-2451545)/36525 -> 0.17244010951403149 | I90: =MOD(280.46646+RC[-2]*(36000.76983 + RC[-2]*0.0003032),360) -> 8.4431610904712215 | J90: =357.52911+RC[-3]*(35999.05029 - 0.0001537*RC[-3]) -> 6565.2092798383674 | K90: =0.016708634-RC[-4]*(0.000042037+0.0000001267*RC[-4]) -> 1.6701381367616931E-2 | L90: =SIN(RADIANS(RC[-2]))*(1.914602-RC[-5]*(0.004817+0.000014*RC[-5]))+SIN(RADIANS(2*RC[-2]))*(0.019993-0.000101*RC[-5])+SIN(RADIANS(3*RC[-2]))*0.000289 -> 1.9101299549507946 | M90: =RC[-4]+RC[-1] -> 10.353291045422017 | N90: =RC[-4]+RC[-2] -> 6567.1194097933185 | O90: =(1.000001018*(1-RC[-4]*RC[-4]))/(1+RC[-4]*COS(RADIANS(RC[-1]))) -> 0.99888369716935077 | P90: =RC[-3]-0.00569-0.00478*SIN(RADIANS(125.04-1934.136*RC[-9])) -> 10.345321500631641 | Q90: =23+(26+((21.448-RC[-10]*(46.815+RC[-10]*(0.00059-RC[-10]*0.001813))))/60)/60 -> 23.437048668895962 | R90: =RC[-1]+0.00256*COS(RADIANS(125.04-1934.136*RC[-11])) -> 23.434798526733282 | S90: =DEGREES(ATAN2(COS(RADIANS(RC[-3])),COS(RADIANS(RC[-1]))*SIN(RADIANS(RC[-3])))) -> 9.5082288729736071 | T90: =DEGREES(ASIN(SIN(RADIANS(RC[-2]))*SIN(RADIANS(RC[-4])))) -> 4.0955554169852624 | U90: =TAN(RADIANS(RC[-3]/2))*TAN(RADIANS(RC[-3]/2)) -> 4.3017565030065923E-2 | V90: =4*DEGREES(RC[-1]*SIN(2*RADIANS(RC[-13]))-2*RC[-11]*SIN(RADIANS(RC[-12]))+4*RC[-11]*RC[-1]*SIN(RADIANS(RC[-12]))*COS(2*RADIANS(RC[-13]))-0.5*RC[-1]*RC[-1]*SIN(4*RADIANS(RC[-13]))-1.25*RC[-11]*RC[-11]*SIN(2*RADIANS(RC[-12]))) -> -4.2680045602334209 | W90: =DEGREES(ACOS(COS(RADIANS(90.833))/(COS(RADIANS(R2C2))*COS(RADIANS(RC[-3])))-TAN(RADIANS(R2C2))*TAN(RADIANS(RC[-3])))) -> 103.84775141128839 | X90: =(720-4*R3C2-RC[-2]+R4C2*60)/1440 -> 1899-12-31T14:00:16.080 | Y90: =(RC[-1]*1440-RC[-2]*4)/1440 -> 1899-12-31T07:04:52.620 | Z90: =(RC[-2]*1440+RC[-3]*4)/1440 -> 1899-12-31T20:55:39.541 | AA90: =8*RC[-4] -> 830.78201129030708 | AB90: =MOD(RC[-23]*1440+RC[-6]+4*R3C2-60*R4C2,1440) -> 719.73199543976659 | AC90: =IF(RC[-1]/4<0,RC[-1]/4+180,RC[-1]/4-180) -> -6.7001140058351893E-2 | AD90: =DEGREES(ACOS(SIN(RADIANS(R2C2))*SIN(RADIANS(RC[-10]))+COS(RADIANS(R2C2))*COS(RADIANS(RC[-10]))*COS(RADIANS(RC[-1])))) -> 65.904459223178748 | AE90: =90-RC[-1] -> 24.095540776821252 | AF90: =IF(RC[-1]>85,0,IF(RC[-1]>5,58.1/TAN(RADIANS(RC[-1]))-0.07/POWER(TAN(RADIANS(RC[-1])),3)+0.000086/POWER(TAN(RADIANS(RC[-1])),5),IF(RC[-1]>-0.575,1735+RC[-1]*(-518.2+RC[-1]*(103.4+RC[-1]*(-12.79+RC[-1]*0.711))),-20.772/TAN(RADIANS(RC[-1])))))/3600 -> 3.5870433665165957E-2 | AG90: =RC[-2]+RC[-1] -> 24.131411210486419 | AH90: =IF(RC[-5]>0,MOD(DEGREES(ACOS(((SIN(RADIANS(R2C2))*COS(RADIANS(RC[-4])))-SIN(RADIANS(RC[-14])))/(COS(RADIANS(R2C2))*SIN(RADIANS(RC[-4])))))+180,360),MOD(540-DEGREES(ACOS(((SIN(RADIANS(R2C2))*COS(RADIANS(RC[-4])))-SIN(RADIANS(RC[-14])))/(COS(RADIANS(R2C2))*SIN(RADIANS(RC[-4]))))),360)) -> 179.92679095579615
D91: =R[-1]C+1 -> 2017-03-31T00:00:00.000 | E91: =R5C2 -> 1899-12-31T14:00:00.000 | F91: =RC[-2]+2415018.5+RC[-1]-R4C2/24 -> 2457844.375 | G91: =(RC[-1]-2451545)/36525 -> 0.17246748802190282 | I91: =MOD(280.46646+RC[-2]*(36000.76983 + RC[-2]*0.0003032),360) -> 9.4288084534982772 | J91: =357.52911+RC[-3]*(35999.05029 - 0.0001537*RC[-3]) -> 6566.19488011864 | K91: =0.016708634-RC[-4]*(0.000042037+0.0000001267*RC[-4]) -> 1.670138021551016E-2 | L91: =SIN(RADIANS(RC[-2]))*(1.914602-RC[-5]*(0.004817+0.000014*RC[-5]))+SIN(RADIANS(2*RC[-2]))*(0.019993-0.000101*RC[-5])+SIN(RADIANS(3*RC[-2]))*0.000289 -> 1.9119141343518347 | M91: =RC[-4]+RC[-1] -> 11.340722587850111 | N91: =RC[-4]+RC[-2] -> 6568.1067942529917 | O91: =(1.000001018*(1-RC[-4]*RC[-4]))/(1+RC[-4]*COS(RADIANS(RC[-1]))) -> 0.99917078130201531 | P91: =RC[-3]-0.00569-0.00478*SIN(RADIANS(125.04-1934.136*RC[-9])) -> 11.332749160992284 | Q91: =23+(26+((21.448-RC[-10]*(46.815+RC[-10]*(0.00059-RC[-10]*0.001813))))/60)/60 -> 23.437048312860963 | R91: =RC[-1]+0.00256*COS(RADIANS(125.04-1934.136*RC[-11])) -> 23.434799299984494 | S91: =DEGREES(ATAN2(COS(RADIANS(RC[-3])),COS(RADIANS(RC[-1]))*SIN(RADIANS(RC[-3])))) -> 10.41930613513845 | T91: =DEGREES(ASIN(SIN(RADIANS(RC[-2]))*SIN(RADIANS(RC[-4])))) -> 4.4823336752940079 | U91: =TAN(RADIANS(RC[-3]/2))*TAN(RADIANS(RC[-3]/2)) -> 4.3017567949593077E-2 | V91: =4*DEGREES(RC[-1]*SIN(2*RADIANS(RC[-13]))-2*RC[-11]*SIN(RADIANS(RC[-12]))+4*RC[-11]*RC[-1]*SIN(RADIANS(RC[-12]))*COS(2*RADIANS(RC[-13]))-0.5*RC[-1]*RC[-1]*SIN(4*RADIANS(RC[-13]))-1.25*RC[-11]*RC[-11]*SIN(2*RADIANS(RC[-12]))) -> -3.9703044061517505 | W91: =DEGREES(ACOS(COS(RADIANS(90.833))/(COS(RADIANS(R2C2))*COS(RADIANS(RC[-3])))-TAN(RADIANS(R2C2))*TAN(RADIANS(RC[-3])))) -> 104.95235335270945 | X91: =(720-4*R3C2-RC[-2]+R4C2*60)/1440 -> 1899-12-31T13:59:58.218 | Y91: =(RC[-1]*1440-RC[-2]*4)/1440 -> 1899-12-31T07:00:09.653 | Z91: =(RC[-2]*1440+RC[-3]*4)/1440 -> 1899-12-31T20:59:46.783 | AA91: =8*RC[-4] -> 839.61882682167561 | AB91: =MOD(RC[-23]*1440+RC[-6]+4*R3C2-60*R4C2,1440) -> 720.02969559384826 | AC91: =IF(RC[-1]/4<0,RC[-1]/4+180,RC[-1]/4-180) -> 7.4238984620649262E-3 | AD91: =DEGREES(ACOS(SIN(RADIANS(R2C2))*SIN(RADIANS(RC[-10]))+COS(RADIANS(R2C2))*COS(RADIANS(RC[-10]))*COS(RADIANS(RC[-1])))) -> 65.517666504903517 | AE91: =90-RC[-1] -> 24.482333495096483 | AF91: =IF(RC[-1]>85,0,IF(RC[-1]>5,58.1/TAN(RADIANS(RC[-1]))-0.07/POWER(TAN(RADIANS(RC[-1])),3)+0.000086/POWER(TAN(RADIANS(RC[-1])),5),IF(RC[-1]>-0.575,1735+RC[-1]*(-518.2+RC[-1]*(103.4+RC[-1]*(-12.79+RC[-1]*0.711))),-20.772/TAN(RADIANS(RC[-1])))))/3600 -> 3.5237792427234051E-2 | AG91: =RC[-2]+RC[-1] -> 24.517571287523719 | AH91: =IF(RC[-5]>0,MOD(DEGREES(ACOS(((SIN(RADIANS(R2C2))*COS(RADIANS(RC[-4])))-SIN(RADIANS(RC[-14])))/(COS(RADIANS(R2C2))*SIN(RADIANS(RC[-4])))))+180,360),MOD(540-DEGREES(ACOS(((SIN(RADIANS(R2C2))*COS(RADIANS(RC[-4])))-SIN(RADIANS(RC[-14])))/(COS(RADIANS(R2C2))*SIN(RADIANS(RC[-4]))))),360)) -> 180.00813238194985
D92: =R[-1]C+1 -> 2017-04-01T00:00:00.000 | E92: =R5C2 -> 1899-12-31T14:00:00.000 | F92: =RC[-2]+2415018.5+RC[-1]-R4C2/24 -> 2457845.375 | G92: =(RC[-1]-2451545)/36525 -> 0.17249486652977414 | I92: =MOD(280.46646+RC[-2]*(36000.76983 + RC[-2]*0.0003032),360) -> 10.414455816526242 | J92: =357.52911+RC[-3]*(35999.05029 - 0.0001537*RC[-3]) -> 6567.1804803989135 | K92: =0.016708634-RC[-4]*(0.000042037+0.0000001267*RC[-4]) -> 1.6701379063403202E-2 | L92: =SIN(RADIANS(RC[-2]))*(1.914602-RC[-5]*(0.004817+0.000014*RC[-5]))+SIN(RADIANS(2*RC[-2]))*(0.019993-0.000101*RC[-5])+SIN(RADIANS(3*RC[-2]))*0.000289 -> 1.9131308996527301 | M92: =RC[-4]+RC[-1] -> 12.327586716178972 | N92: =RC[-4]+RC[-2] -> 6569.0936112985664 | O92: =(1.000001018*(1-RC[-4]*RC[-4]))/(1+RC[-4]*COS(RADIANS(RC[-1]))) -> 0.99945802894235536 | P92: =RC[-3]-0.00569-0.00478*SIN(RADIANS(125.04-1934.136*RC[-9])) -> 12.319609409204146 | Q92: =23+(26+((21.448-RC[-10]*(46.815+RC[-10]*(0.00059-RC[-10]*0.001813))))/60)/60 -> 23.437047956825968 | R92: =RC[-1]+0.00256*COS(RADIANS(125.04-1934.136*RC[-11])) -> 23.434800075156769 | S92: =DEGREES(ATAN2(COS(RADIANS(RC[-3])),COS(RADIANS(RC[-1]))*SIN(RADIANS(RC[-3])))) -> 11.330822335622397 | T92: =DEGREES(ASIN(SIN(RADIANS(RC[-2]))*SIN(RADIANS(RC[-4])))) -> 4.8677607781035563 | U92: =TAN(RADIANS(RC[-3]/2))*TAN(RADIANS(RC[-3]/2)) -> 4.3017570876373597E-2 | V92: =4*DEGREES(RC[-1]*SIN(2*RADIANS(RC[-13]))-2*RC[-11]*SIN(RADIANS(RC[-12]))+4*RC[-11]*RC[-1]*SIN(RADIANS(RC[-12]))*COS(2*RADIANS(RC[-13]))-0.5*RC[-1]*RC[-1]*SIN(4*RADIANS(RC[-13]))-1.25*RC[-11]*RC[-11]*SIN(2*RADIANS(RC[-12]))) -> -3.6744259182032399 | W92: =DEGREES(ACOS(COS(RADIANS(90.833))/(COS(RADIANS(R2C2))*COS(RADIANS(RC[-3])))-TAN(RADIANS(R2C2))*TAN(RADIANS(RC[-3])))) -> 106.06007153166969 | X92: =(720-4*R3C2-RC[-2]+R4C2*60)/1440 -> 1899-12-31T13:59:40.466 | Y92: =(RC[-1]*1440-RC[-2]*4)/1440 -> 1899-12-31T06:55:26.048 | Z92: =(RC[-2]*1440+RC[-3]*4)/1440 -> 1899-12-31T21:03:54.883 | AA92: =8*RC[-4] -> 848.48057225335754 | AB92: =MOD(RC[-23]*1440+RC[-6]+4*R3C2-60*R4C2,1440) -> 720.32557408179673 | AC92: =IF(RC[-1]/4<0,RC[-1]/4+180,RC[-1]/4-180) -> 8.1393520449182688E-2 | AD92: =DEGREES(ACOS(SIN(RADIANS(R2C2))*SIN(RADIANS(RC[-10]))+COS(RADIANS(R2C2))*COS(RADIANS(RC[-10]))*COS(RADIANS(RC[-1])))) -> 65.132260937287583 | AE92: =90-RC[-1] -> 24.867739062712417 | AF92: =IF(RC[-1]>85,0,IF(RC[-1]>5,58.1/TAN(RADIANS(RC[-1]))-0.07/POWER(TAN(RADIANS(RC[-1])),3)+0.000086/POWER(TAN(RADIANS(RC[-1])),5),IF(RC[-1]>-0.575,1735+RC[-1]*(-518.2+RC[-1]*(103.4+RC[-1]*(-12.79+RC[-1]*0.711))),-20.772/TAN(RADIANS(RC[-1])))))/3600 -> 3.4625425744915617E-2 | AG92: =RC[-2]+RC[-1] -> 24.902364488457334 | AH92: =IF(RC[-5]>0,MOD(DEGREES(ACOS(((SIN(RADIANS(R2C2))*COS(RADIANS(RC[-4])))-SIN(RADIANS(RC[-14])))/(COS(RADIANS(R2C2))*SIN(RADIANS(RC[-4])))))+180,360),MOD(540-DEGREES(ACOS(((SIN(RADIANS(R2C2))*COS(RADIANS(RC[-4])))-SIN(RADIANS(RC[-14])))/(COS(RADIANS(R2C2))*SIN(RADIANS(RC[-4]))))),360)) -> 180.08938792001837
D93: =R[-1]C+1 -> 2017-04-02T00:00:00.000 | E93: =R5C2 -> 1899-12-31T14:00:00.000 | F93: =RC[-2]+2415018.5+RC[-1]-R4C2/24 -> 2457846.375 | G93: =(RC[-1]-2451545)/36525 -> 0.17252224503764546 | I93: =MOD(280.46646+RC[-2]*(36000.76983 + RC[-2]*0.0003032),360) -> 11.400103179555117 | J93: =357.52911+RC[-3]*(35999.05029 - 0.0001537*RC[-3]) -> 6568.166080679187 | K93: =0.016708634-RC[-4]*(0.000042037+0.0000001267*RC[-4]) -> 1.6701377911296052E-2 | L93: =SIN(RADIANS(RC[-2]))*(1.914602-RC[-5]*(0.004817+0.000014*RC[-5]))+SIN(RADIANS(2*RC[-2]))*(0.019993-0.000101*RC[-5])+SIN(RADIANS(3*RC[-2]))*0.000289 -> 1.9137805028812178 | M93: =RC[-4]+RC[-1] -> 13.313883682436336 | N93: =RC[-4]+RC[-2] -> 6570.0798611820683 | O93: =(1.000001018*(1-RC[-4]*RC[-4]))/(1+RC[-4]*COS(RADIANS(RC[-1]))) -> 0.99974535481460614 | P93: =RC[-3]-0.00569-0.00478*SIN(RADIANS(125.04-1934.136*RC[-9])) -> 13.305902497298277 | Q93: =23+(26+((21.448-RC[-10]*(46.815+RC[-10]*(0.00059-RC[-10]*0.001813))))/60)/60 -> 23.437047600790969 | R93: =RC[-1]+0.00256*COS(RADIANS(125.04-1934.136*RC[-11])) -> 23.434800852249129 | S93: =DEGREES(ATAN2(COS(RADIANS(RC[-3])),COS(RADIANS(RC[-1]))*SIN(RADIANS(RC[-3])))) -> 12.242857058362384 | T93: =DEGREES(ASIN(SIN(RADIANS(RC[-2]))*SIN(RADIANS(RC[-4])))) -> 5.2517400083319199 | U93: =TAN(RADIANS(RC[-3]/2))*TAN(RADIANS(RC[-3]/2)) -> 4.3017573810403824E-2 | V93: =4*DEGREES(RC[-1]*SIN(2*RADIANS(RC[-13]))-2*RC[-11]*SIN(RADIANS(RC[-12]))+4*RC[-11]*RC[-1]*SIN(RADIANS(RC[-12]))*COS(2*RADIANS(RC[-13]))-0.5*RC[-1]*RC[-1]*SIN(4*RADIANS(RC[-13]))-1.25*RC[-11]*RC[-11]*SIN(2*RADIANS(RC[-12]))) -> -3.3806810369511191 | W93: =DEGREES(ACOS(COS(RADIANS(90.833))/(COS(RADIANS(R2C2))*COS(RADIANS(RC[-3])))-TAN(RADIANS(R2C2))*TAN(RADIANS(RC[-3])))) -> 107.17118240102023 | X93: =(720-4*R3C2-RC[-2]+R4C2*60)/1440 -> 1899-12-31T13:59:22.841 | Y93: =(RC[-1]*1440-RC[-2]*4)/1440 -> 1899-12-31T06:50:41.757 | Z93: =(RC[-2]*1440+RC[-3]*4)/1440 -> 1899-12-31T21:08:03.925 | AA93: =8*RC[-4] -> 857.36945920816186 | AB93: =MOD(RC[-23]*1440+RC[-6]+4*R3C2-60*R4C2,1440) -> 720.61931896304884 | AC93: =IF(RC[-1]/4<0,RC[-1]/4+180,RC[-1]/4-180) -> 0.15482974076221012 | AD93: =DEGREES(ACOS(SIN(RADIANS(R2C2))*SIN(RADIANS(RC[-10]))+COS(RADIANS(R2C2))*COS(RADIANS(RC[-10]))*COS(RADIANS(RC[-1])))) -> 64.748338768710255 | AE93: =90-RC[-1] -> 25.251661231289745 | AF93: =IF(RC[-1]>85,0,IF(RC[-1]>5,58.1/TAN(RADIANS(RC[-1]))-0.07/POWER(TAN(RADIANS(RC[-1])),3)+0.000086/POWER(TAN(RADIANS(RC[-1])),5),IF(RC[-1]>-0.575,1735+RC[-1]*(-518.2+RC[-1]*(103.4+RC[-1]*(-12.79+RC[-1]*0.711))),-20.772/TAN(RADIANS(RC[-1])))))/3600 -> 3.4032485809064532E-2 | AG93: =RC[-2]+RC[-1] -> 25.285693717098809 | AH93: =IF(RC[-5]>0,MOD(DEGREES(ACOS(((SIN(RADIANS(R2C2))*COS(RADIANS(RC[-4])))-SIN(RADIANS(RC[-14])))/(COS(RADIANS(R2C2))*SIN(RADIANS(RC[-4])))))+180,360),MOD(540-DEGREES(ACOS(((SIN(RADIANS(R2C2))*COS(RADIANS(RC[-4])))-SIN(RADIANS(RC[-14])))/(COS(RADIANS(R2C2))*SIN(RADIANS(RC[-4]))))),360)) -> 180.17046941188769
D94: =R[-1]C+1 -> 2017-04-03T00:00:00.000 | E94: =R5C2 -> 1899-12-31T14:00:00.000 | F94: =RC[-2]+2415018.5+RC[-1]-R4C2/24 -> 2457847.375 | G94: =(RC[-1]-2451545)/36525 -> 0.17254962354551676 | I94: =MOD(280.46646+RC[-2]*(36000.76983 + RC[-2]*0.0003032),360) -> 12.385750542583082 | J94: =357.52911+RC[-3]*(35999.05029 - 0.0001537*RC[-3]) -> 6569.1516809594586 | K94: =0.016708634-RC[-4]*(0.000042037+0.0000001267*RC[-4]) -> 1.6701376759188709E-2 | L94: =SIN(RADIANS(RC[-2]))*(1.914602-RC[-5]*(0.004817+0.000014*RC[-5]))+SIN(RADIANS(2*RC[-2]))*(0.019993-0.000101*RC[-5])+SIN(RADIANS(3*RC[-2]))*0.000289 -> 1.9138633641488751 | M94: =RC[-4]+RC[-1] -> 14.299613906731958 | N94: =RC[-4]+RC[-2] -> 6571.0655443236074 | O94: =(1.000001018*(1-RC[-4]*RC[-4]))/(1+RC[-4]*COS(RADIANS(RC[-1]))) -> 1.0000326737667302 | P94: =RC[-3]-0.00569-0.00478*SIN(RADIANS(125.04-1934.136*RC[-9])) -> 14.291628845387745 | Q94: =23+(26+((21.448-RC[-10]*(46.815+RC[-10]*(0.00059-RC[-10]*0.001813))))/60)/60 -> 23.437047244755973 | R94: =RC[-1]+0.00256*COS(RADIANS(125.04-1934.136*RC[-11])) -> 23.434801631260616 | S94: =DEGREES(ATAN2(COS(RADIANS(RC[-3])),COS(RADIANS(RC[-1]))*SIN(RADIANS(RC[-3])))) -> 13.155489075499998 | T94: =DEGREES(ASIN(SIN(RADIANS(RC[-2]))*SIN(RADIANS(RC[-4])))) -> 5.6341749203750791 | U94: =TAN(RADIANS(RC[-3]/2))*TAN(RADIANS(RC[-3]/2)) -> 4.3017576751680081E-2 | V94: =4*DEGREES(RC[-1]*SIN(2*RADIANS(RC[-13]))-2*RC[-11]*SIN(RADIANS(RC[-12]))+4*RC[-11]*RC[-1]*SIN(RADIANS(RC[-12]))*COS(2*RADIANS(RC[-13]))-0.5*RC[-1]*RC[-1]*SIN(4*RADIANS(RC[-13]))-1.25*RC[-11]*RC[-11]*SIN(2*RADIANS(RC[-12]))) -> -3.0893783828384831 | W94: =DEGREES(ACOS(COS(RADIANS(90.833))/(COS(RADIANS(R2C2))*COS(RADIANS(RC[-3])))-TAN(RADIANS(R2C2))*TAN(RADIANS(RC[-3])))) -> 108.28597180632235 | X94: =(720-4*R3C2-RC[-2]+R4C2*60)/1440 -> 1899-12-31T13:59:05.363 | Y94: =(RC[-1]*1440-RC[-2]*4)/1440 -> 1899-12-31T06:45:56.729 | Z94: =(RC[-2]*1440+RC[-3]*4)/1440 -> 1899-12-31T21:12:13.996 | AA94: =8*RC[-4] -> 866.28777445057881 | AB94: =MOD(RC[-23]*1440+RC[-6]+4*R3C2-60*R4C2,1440) -> 720.9106216171615 | AC94: =IF(RC[-1]/4<0,RC[-1]/4+180,RC[-1]/4-180) -> 0.22765540429037401 | AD94: =DEGREES(ACOS(SIN(RADIANS(R2C2))*SIN(RADIANS(RC[-10]))+COS(RADIANS(R2C2))*COS(RADIANS(RC[-10]))*COS(RADIANS(RC[-1])))) -> 64.365995825123264 | AE94: =90-RC[-1] -> 25.634004174876736 | AF94: =IF(RC[-1]>85,0,IF(RC[-1]>5,58.1/TAN(RADIANS(RC[-1]))-0.07/POWER(TAN(RADIANS(RC[-1])),3)+0.000086/POWER(TAN(RADIANS(RC[-1])),5),IF(RC[-1]>-0.575,1735+RC[-1]*(-518.2+RC[-1]*(103.4+RC[-1]*(-12.79+RC[-1]*0.711))),-20.772/TAN(RADIANS(RC[-1])))))/3600 -> 3.3458172225879851E-2 | AG94: =RC[-2]+RC[-1] -> 25.667462347102617 | AH94: =IF(RC[-5]>0,MOD(DEGREES(ACOS(((SIN(RADIANS(R2C2))*COS(RADIANS(RC[-4])))-SIN(RADIANS(RC[-14])))/(COS(RADIANS(R2C2))*SIN(RADIANS(RC[-4])))))+180,360),MOD(540-DEGREES(ACOS(((SIN(RADIANS(R2C2))*COS(RADIANS(RC[-4])))-SIN(RADIANS(RC[-14])))/(COS(RADIANS(R2C2))*SIN(RADIANS(RC[-4]))))),360)) -> 180.25128857981059
D95: =R[-1]C+1 -> 2017-04-04T00:00:00.000 | E95: =R5C2 -> 1899-12-31T14:00:00.000 | F95: =RC[-2]+2415018.5+RC[-1]-R4C2/24 -> 2457848.375 | G95: =(RC[-1]-2451545)/36525 -> 0.17257700205338808 | I95: =MOD(280.46646+RC[-2]*(36000.76983 + RC[-2]*0.0003032),360) -> 13.371397905611957 | J95: =357.52911+RC[-3]*(35999.05029 - 0.0001537*RC[-3]) -> 6570.1372812397312 | K95: =0.016708634-RC[-4]*(0.000042037+0.0000001267*RC[-4]) -> 1.6701375607081181E-2 | L95: =SIN(RADIANS(RC[-2]))*(1.914602-RC[-5]*(0.004817+0.000014*RC[-5]))+SIN(RADIANS(2*RC[-2]))*(0.019993-0.000101*RC[-5])+SIN(RADIANS(3*RC[-2]))*0.000289 -> 1.9133800707958279 | M95: =RC[-4]+RC[-1] -> 15.284777976407785 | N95: =RC[-4]+RC[-2] -> 6572.0506613105272 | O95: =(1.000001018*(1-RC[-4]*RC[-4]))/(1+RC[-4]*COS(RADIANS(RC[-1]))) -> 1.0003199007954535 | P95: =RC[-3]-0.00569-0.00478*SIN(RADIANS(125.04-1934.136*RC[-9])) -> 15.276789040817809 | Q95: =23+(26+((21.448-RC[-10]*(46.815+RC[-10]*(0.00059-RC[-10]*0.001813))))/60)/60 -> 23.437046888720978 | R95: =RC[-1]+0.00256*COS(RADIANS(125.04-1934.136*RC[-11])) -> 23.434802412190258 | S95: =DEGREES(ATAN2(COS(RADIANS(RC[-3])),COS(RADIANS(RC[-1]))*SIN(RADIANS(RC[-3])))) -> 14.068796291806189 | T95: =DEGREES(ASIN(SIN(RADIANS(RC[-2]))*SIN(RADIANS(RC[-4])))) -> 6.0149693318792377 | U95: =TAN(RADIANS(RC[-3]/2))*TAN(RADIANS(RC[-3]/2)) -> 4.3017579700198746E-2 | V95: =4*DEGREES(RC[-1]*SIN(2*RADIANS(RC[-13]))-2*RC[-11]*SIN(RADIANS(RC[-12]))+4*RC[-11]*RC[-1]*SIN(RADIANS(RC[-12]))*COS(2*RADIANS(RC[-13]))-0.5*RC[-1]*RC[-1]*SIN(4*RADIANS(RC[-13]))-1.25*RC[-11]*RC[-11]*SIN(2*RADIANS(RC[-12]))) -> -2.8008230886146634 | W95: =DEGREES(ACOS(COS(RADIANS(90.833))/(COS(RADIANS(R2C2))*COS(RADIANS(RC[-3])))-TAN(RADIANS(R2C2))*TAN(RADIANS(RC[-3])))) -> 109.40473601075419 | X95: =(720-4*R3C2-RC[-2]+R4C2*60)/1440 -> 1899-12-31T13:58:48.049 | Y95: =(RC[-1]*1440-RC[-2]*4)/1440 -> 1899-12-31T06:41:10.913 | Z95: =(RC[-2]*1440+RC[-3]*4)/1440 -> 1899-12-31T21:16:25.186 | AA95: =8*RC[-4] -> 875.23788808603354 | AB95: =MOD(RC[-23]*1440+RC[-6]+4*R3C2-60*R4C2,1440) -> 721.19917691138539 | AC95: =IF(RC[-1]/4<0,RC[-1]/4+180,RC[-1]/4-180) -> 0.29979422784634835 | AD95: =DEGREES(ACOS(SIN(RADIANS(R2C2))*SIN(RADIANS(RC[-10]))+COS(RADIANS(R2C2))*COS(RADIANS(RC[-10]))*COS(RADIANS(RC[-1])))) -> 63.985327521249616 | AE95: =90-RC[-1] -> 26.014672478750384 | AF95: =IF(RC[-1]>85,0,IF(RC[-1]>5,58.1/TAN(RADIANS(RC[-1]))-0.07/POWER(TAN(RADIANS(RC[-1])),3)+0.000086/POWER(TAN(RADIANS(RC[-1])),5),IF(RC[-1]>-0.575,1735+RC[-1]*(-518.2+RC[-1]*(103.4+RC[-1]*(-12.79+RC[-1]*0.711))),-20.772/TAN(RADIANS(RC[-1])))))/3600 -> 3.2901728940989687E-2 | AG95: =RC[-2]+RC[-1] -> 26.047574207691373 | AH95: =IF(RC[-5]>0,MOD(DEGREES(ACOS(((SIN(RADIANS(R2C2))*COS(RADIANS(RC[-4])))-SIN(RADIANS(RC[-14])))/(COS(RADIANS(R2C2))*SIN(RADIANS(RC[-4])))))+180,360),MOD(540-DEGREES(ACOS(((SIN(RADIANS(R2C2))*COS(RADIANS(RC[-4])))-SIN(RADIANS(RC[-14])))/(COS(RADIANS(R2C2))*SIN(RADIANS(RC[-4]))))),360)) -> 180.33175707570473
D96: =R[-1]C+1 -> 2017-04-05T00:00:00.000 | E96: =R5C2 -> 1899-12-31T14:00:00.000 | F96: =RC[-2]+2415018.5+RC[-1]-R4C2/24 -> 2457849.375 | G96: =(RC[-1]-2451545)/36525 -> 0.1726043805612594 | I96: =MOD(280.46646+RC[-2]*(36000.76983 + RC[-2]*0.0003032),360) -> 14.357045268642651 | J96: =357.52911+RC[-3]*(35999.05029 - 0.0001537*RC[-3]) -> 6571.1228815200038 | K96: =0.016708634-RC[-4]*(0.000042037+0.0000001267*RC[-4]) -> 1.670137445497346E-2 | L96: =SIN(RADIANS(RC[-2]))*(1.914602-RC[-5]*(0.004817+0.000014*RC[-5]))+SIN(RADIANS(2*RC[-2]))*(0.019993-0.000101*RC[-5])+SIN(RADIANS(3*RC[-2]))*0.000289 -> 1.9123313764892171 | M96: =RC[-4]+RC[-1] -> 16.269376645131867 | N96: =RC[-4]+RC[-2] -> 6573.0352128964932 | O96: =(1.000001018*(1-RC[-4]*RC[-4]))/(1+RC[-4]*COS(RADIANS(RC[-1]))) -> 1.0006069510710776 | P96: =RC[-3]-0.00569-0.00478*SIN(RADIANS(125.04-1934.136*RC[-9])) -> 16.261383837259828 | Q96: =23+(26+((21.448-RC[-10]*(46.815+RC[-10]*(0.00059-RC[-10]*0.001813))))/60)/60 -> 23.437046532685979 | R96: =RC[-1]+0.00256*COS(RADIANS(125.04-1934.136*RC[-11])) -> 23.434803195037077 | S96: =DEGREES(ATAN2(COS(RADIANS(RC[-3])),COS(RADIANS(RC[-1]))*SIN(RADIANS(RC[-3])))) -> 14.982855688597983 | T96: =DEGREES(ASIN(SIN(RADIANS(RC[-2]))*SIN(RADIANS(RC[-4])))) -> 6.3940273162038155 | U96: =TAN(RADIANS(RC[-3]/2))*TAN(RADIANS(RC[-3]/2)) -> 4.3017582655956121E-2 | V96: =4*DEGREES(RC[-1]*SIN(2*RADIANS(RC[-13]))-2*RC[-11]*SIN(RADIANS(RC[-12]))+4*RC[-11]*RC[-1]*SIN(RADIANS(RC[-12]))*COS(2*RADIANS(RC[-13]))-0.5*RC[-1]*RC[-1]*SIN(4*RADIANS(RC[-13]))-1.25*RC[-11]*RC[-11]*SIN(2*RADIANS(RC[-12]))) -> -2.5153166276418935 | W96: =DEGREES(ACOS(COS(RADIANS(90.833))/(COS(RADIANS(R2C2))*COS(RADIANS(RC[-3])))-TAN(RADIANS(R2C2))*TAN(RADIANS(RC[-3])))) -> 110.52778283223077 | X96: =(720-4*R3C2-RC[-2]+R4C2*60)/1440 -> 1899-12-31T13:58:30.919 | Y96: =(RC[-1]*1440-RC[-2]*4)/1440 -> 1899-12-31T06:36:24.251 | Z96: =(RC[-2]*1440+RC[-3]*4)/1440 -> 1899-12-31T21:20:37.587 | AA96: =8*RC[-4] -> 884.22226265784616 | AB96: =MOD(RC[-23]*1440+RC[-6]+4*R3C2-60*R4C2,1440) -> 721.48468337235806 | AC96: =IF(RC[-1]/4<0,RC[-1]/4+180,RC[-1]/4-180) -> 0.37117084308951576 | AD96: =DEGREES(ACOS(SIN(RADIANS(R2C2))*SIN(RADIANS(RC[-10]))+COS(RADIANS(R2C2))*COS(RADIANS(RC[-10]))*COS(RADIANS(RC[-1])))) -> 63.60642887161891 | AE96: =90-RC[-1] -> 26.39357112838109 | AF96: =IF(RC[-1]>85,0,IF(RC[-1]>5,58.1/TAN(RADIANS(RC[-1]))-0.07/POWER(TAN(RADIANS(RC[-1])),3)+0.000086/POWER(TAN(RADIANS(RC[-1])),5),IF(RC[-1]>-0.575,1735+RC[-1]*(-518.2+RC[-1]*(103.4+RC[-1]*(-12.79+RC[-1]*0.711))),-20.772/TAN(RADIANS(RC[-1])))))/3600 -> 3.2362441395337081E-2 | AG96: =RC[-2]+RC[-1] -> 26.425933569776426 | AH96: =IF(RC[-5]>0,MOD(DEGREES(ACOS(((SIN(RADIANS(R2C2))*COS(RADIANS(RC[-4])))-SIN(RADIANS(RC[-14])))/(COS(RADIANS(R2C2))*SIN(RADIANS(RC[-4])))))+180,360),MOD(540-DEGREES(ACOS(((SIN(RADIANS(R2C2))*COS(RADIANS(RC[-4])))-SIN(RADIANS(RC[-14])))/(COS(RADIANS(R2C2))*SIN(RADIANS(RC[-4]))))),360)) -> 180.41178653380746
D97: =R[-1]C+1 -> 2017-04-06T00:00:00.000 | E97: =R5C2 -> 1899-12-31T14:00:00.000 | F97: =RC[-2]+2415018.5+RC[-1]-R4C2/24 -> 2457850.375 | G97: =(RC[-1]-2451545)/36525 -> 0.17263175906913072 | I97: =MOD(280.46646+RC[-2]*(36000.76983 + RC[-2]*0.0003032),360) -> 15.342692631672435 | J97: =357.52911+RC[-3]*(35999.05029 - 0.0001537*RC[-3]) -> 6572.1084818002755 | K97: =0.016708634-RC[-4]*(0.000042037+0.0000001267*RC[-4]) -> 1.6701373302865551E-2 | L97: =SIN(RADIANS(RC[-2]))*(1.914602-RC[-5]*(0.004817+0.000014*RC[-5]))+SIN(RADIANS(2*RC[-2]))*(0.019993-0.000101*RC[-5])+SIN(RADIANS(3*RC[-2]))*0.000289 -> 1.9107182002765657 | M97: =RC[-4]+RC[-1] -> 17.253410831949001 | N97: =RC[-4]+RC[-2] -> 6574.0192000005518 | O97: =(1.000001018*(1-RC[-4]*RC[-4]))/(1+RC[-4]*COS(RADIANS(RC[-1]))) -> 1.0008937399620772 | P97: =RC[-3]-0.00569-0.00478*SIN(RADIANS(125.04-1934.136*RC[-9])) -> 17.245414153761907 | Q97: =23+(26+((21.448-RC[-10]*(46.815+RC[-10]*(0.00059-RC[-10]*0.001813))))/60)/60 -> 23.437046176650984 | R97: =RC[-1]+0.00256*COS(RADIANS(125.04-1934.136*RC[-11])) -> 23.434803979800108 | S97: =DEGREES(ATAN2(COS(RADIANS(RC[-3])),COS(RADIANS(RC[-1]))*SIN(RADIANS(RC[-3])))) -> 15.897743267101543 | T97: =DEGREES(ASIN(SIN(RADIANS(RC[-2]))*SIN(RADIANS(RC[-4])))) -> 6.771253195640984 | U97: =TAN(RADIANS(RC[-3]/2))*TAN(RADIANS(RC[-3]/2)) -> 4.3017585618948563E-2 | V97: =4*DEGREES(RC[-1]*SIN(2*RADIANS(RC[-13]))-2*RC[-11]*SIN(RADIANS(RC[-12]))+4*RC[-11]*RC[-1]*SIN(RADIANS(RC[-12]))*COS(2*RADIANS(RC[-13]))-0.5*RC[-1]*RC[-1]*SIN(4*RADIANS(RC[-13]))-1.25*RC[-11]*RC[-11]*SIN(2*RADIANS(RC[-12]))) -> -2.2331566374316294 | W97: =DEGREES(ACOS(COS(RADIANS(90.833))/(COS(RADIANS(R2C2))*COS(RADIANS(RC[-3])))-TAN(RADIANS(R2C2))*TAN(RADIANS(RC[-3])))) -> 111.6554329093733 | X97: =(720-4*R3C2-RC[-2]+R4C2*60)/1440 -> 1899-12-31T13:58:13.989 | Y97: =(RC[-1]*1440-RC[-2]*4)/1440 -> 1899-12-31T06:31:36.685 | Z97: =(RC[-2]*1440+RC[-3]*4)/1440 -> 1899-12-31T21:24:51.293 | AA97: =8*RC[-4] -> 893.24346327498642 | AB97: =MOD(RC[-23]*1440+RC[-6]+4*R3C2-60*R4C2,1440) -> 721.76684336256835 | AC97: =IF(RC[-1]/4<0,RC[-1]/4+180,RC[-1]/4-180) -> 0.44171084064208799 | AD97: =DEGREES(ACOS(SIN(RADIANS(R2C2))*SIN(RADIANS(RC[-10]))+COS(RADIANS(R2C2))*COS(RADIANS(RC[-10]))*COS(RADIANS(RC[-1])))) -> 63.229394501368574 | AE97: =90-RC[-1] -> 26.770605498631426 | AF97: =IF(RC[-1]>85,0,IF(RC[-1]>5,58.1/TAN(RADIANS(RC[-1]))-0.07/POWER(TAN(RADIANS(RC[-1])),3)+0.000086/POWER(TAN(RADIANS(RC[-1])),5),IF(RC[-1]>-0.575,1735+RC[-1]*(-518.2+RC[-1]*(103.4+RC[-1]*(-12.79+RC[-1]*0.711))),-20.772/TAN(RADIANS(RC[-1])))))/3600 -> 3.183963389324973E-2 | AG97: =RC[-2]+RC[-1] -> 26.802445132524674 | AH97: =IF(RC[-5]>0,MOD(DEGREES(ACOS(((SIN(RADIANS(R2C2))*COS(RADIANS(RC[-4])))-SIN(RADIANS(RC[-14])))/(COS(RADIANS(R2C2))*SIN(RADIANS(RC[-4])))))+180,360),MOD(540-DEGREES(ACOS(((SIN(RADIANS(R2C2))*COS(RADIANS(RC[-4])))-SIN(RADIANS(RC[-14])))/(COS(RADIANS(R2C2))*SIN(RADIANS(RC[-4]))))),360)) -> 180.49128862604954
D98: =R[-1]C+1 -> 2017-04-07T00:00:00.000 | E98: =R5C2 -> 1899-12-31T14:00:00.000 | F98: =RC[-2]+2415018.5+RC[-1]-R4C2/24 -> 2457851.375 | G98: =(RC[-1]-2451545)/36525 -> 0.17265913757700205 | I98: =MOD(280.46646+RC[-2]*(36000.76983 + RC[-2]*0.0003032),360) -> 16.328339994703128 | J98: =357.52911+RC[-3]*(35999.05029 - 0.0001537*RC[-3]) -> 6573.0940820805481 | K98: =0.016708634-RC[-4]*(0.000042037+0.0000001267*RC[-4]) -> 1.6701372150757451E-2 | L98: =SIN(RADIANS(RC[-2]))*(1.914602-RC[-5]*(0.004817+0.000014*RC[-5]))+SIN(RADIANS(2*RC[-2]))*(0.019993-0.000101*RC[-5])+SIN(RADIANS(3*RC[-2]))*0.000289 -> 1.9085416255951644 | M98: =RC[-4]+RC[-1] -> 18.236881620298291 | N98: =RC[-4]+RC[-2] -> 6575.0026237061429 | O98: =(1.000001018*(1-RC[-4]*RC[-4]))/(1+RC[-4]*COS(RADIANS(RC[-1]))) -> 1.0011801830594638 | P98: =RC[-3]-0.00569-0.00478*SIN(RADIANS(125.04-1934.136*RC[-9])) -> 18.228881073766452 | Q98: =23+(26+((21.448-RC[-10]*(46.815+RC[-10]*(0.00059-RC[-10]*0.001813))))/60)/60 -> 23.437045820615989 | R98: =RC[-1]+0.00256*COS(RADIANS(125.04-1934.136*RC[-11])) -> 23.434804766478372 | S98: =DEGREES(ATAN2(COS(RADIANS(RC[-3])),COS(RADIANS(RC[-1]))*SIN(RADIANS(RC[-3])))) -> 16.813533991219135 | T98: =DEGREES(ASIN(SIN(RADIANS(RC[-2]))*SIN(RADIANS(RC[-4])))) -> 7.1465515354557878 | U98: =TAN(RADIANS(RC[-3]/2))*TAN(RADIANS(RC[-3]/2)) -> 4.3017588589172352E-2 | V98: =4*DEGREES(RC[-1]*SIN(2*RADIANS(RC[-13]))-2*RC[-11]*SIN(RADIANS(RC[-12]))+4*RC[-11]*RC[-1]*SIN(RADIANS(RC[-12]))*COS(2*RADIANS(RC[-13]))-0.5*RC[-1]*RC[-1]*SIN(4*RADIANS(RC[-13]))-1.25*RC[-11]*RC[-11]*SIN(2*RADIANS(RC[-12]))) -> -1.9546367378187617 | W98: =DEGREES(ACOS(COS(RADIANS(90.833))/(COS(RADIANS(R2C2))*COS(RADIANS(RC[-3])))-TAN(RADIANS(R2C2))*TAN(RADIANS(RC[-3])))) -> 112.78802111571183 | X98: =(720-4*R3C2-RC[-2]+R4C2*60)/1440 -> 1899-12-31T13:57:57.278 | Y98: =(RC[-1]*1440-RC[-2]*4)/1440 -> 1899-12-31T06:26:48.153 | Z98: =(RC[-2]*1440+RC[-3]*4)/1440 -> 1899-12-31T21:29:06.403 | AA98: =8*RC[-4] -> 902.30416892569463 | AB98: =MOD(RC[-23]*1440+RC[-6]+4*R3C2-60*R4C2,1440) -> 722.04536326218124 | AC98: =IF(RC[-1]/4<0,RC[-1]/4+180,RC[-1]/4-180) -> 0.51134081554531008 | AD98: =DEGREES(ACOS(SIN(RADIANS(R2C2))*SIN(RADIANS(RC[-10]))+COS(RADIANS(R2C2))*COS(RADIANS(RC[-10]))*COS(RADIANS(RC[-1])))) -> 62.854318656741349 | AE98: =90-RC[-1] -> 27.145681343258651 | AF98: =IF(RC[-1]>85,0,IF(RC[-1]>5,58.1/TAN(RADIANS(RC[-1]))-0.07/POWER(TAN(RADIANS(RC[-1])),3)+0.000086/POWER(TAN(RADIANS(RC[-1])),5),IF(RC[-1]>-0.575,1735+RC[-1]*(-518.2+RC[-1]*(103.4+RC[-1]*(-12.79+RC[-1]*0.711))),-20.772/TAN(RADIANS(RC[-1])))))/3600 -> 3.1332667164901601E-2 | AG98: =RC[-2]+RC[-1] -> 27.177014010423552 | AH98: =IF(RC[-5]>0,MOD(DEGREES(ACOS(((SIN(RADIANS(R2C2))*COS(RADIANS(RC[-4])))-SIN(RADIANS(RC[-14])))/(COS(RADIANS(R2C2))*SIN(RADIANS(RC[-4])))))+180,360),MOD(540-DEGREES(ACOS(((SIN(RADIANS(R2C2))*COS(RADIANS(RC[-4])))-SIN(RADIANS(RC[-14])))/(COS(RADIANS(R2C2))*SIN(RADIANS(RC[-4]))))),360)) -> 180.57017512040886
D99: =R[-1]C+1 -> 2017-04-08T00:00:00.000 | E99: =R5C2 -> 1899-12-31T14:00:00.000 | F99: =RC[-2]+2415018.5+RC[-1]-R4C2/24 -> 2457852.375 | G99: =(RC[-1]-2451545)/36525 -> 0.17268651608487337 | I99: =MOD(280.46646+RC[-2]*(36000.76983 + RC[-2]*0.0003032),360) -> 17.313987357734732 | J99: =357.52911+RC[-3]*(35999.05029 - 0.0001537*RC[-3]) -> 6574.0796823608198 | K99: =0.016708634-RC[-4]*(0.000042037+0.0000001267*RC[-4]) -> 1.670137099864916E-2 | L99: =SIN(RADIANS(RC[-2]))*(1.914602-RC[-5]*(0.004817+0.000014*RC[-5]))+SIN(RADIANS(2*RC[-2]))*(0.019993-0.000101*RC[-5])+SIN(RADIANS(3*RC[-2]))*0.000289 -> 1.9058028992386498 | M99: =RC[-4]+RC[-1] -> 19.219790256973383 | N99: =RC[-4]+RC[-2] -> 6575.9854852600583 | O99: =(1.000001018*(1-RC[-4]*RC[-4]))/(1+RC[-4]*COS(RADIANS(RC[-1]))) -> 1.0014661962009113 | P99: =RC[-3]-0.00569-0.00478*SIN(RADIANS(125.04-1934.136*RC[-9])) -> 19.21178584407042 | Q99: =23+(26+((21.448-RC[-10]*(46.815+RC[-10]*(0.00059-RC[-10]*0.001813))))/60)/60 -> 23.437045464580994 | R99: =RC[-1]+0.00256*COS(RADIANS(125.04-1934.136*RC[-11])) -> 23.434805555070898 | S99: =DEGREES(ATAN2(COS(RADIANS(RC[-3])),COS(RADIANS(RC[-1]))*SIN(RADIANS(RC[-3])))) -> 17.730301729631478 | T99: =DEGREES(ASIN(SIN(RADIANS(RC[-2]))*SIN(RADIANS(RC[-4])))) -> 7.5198271387972753 | U99: =TAN(RADIANS(RC[-3]/2))*TAN(RADIANS(RC[-3]/2)) -> 4.301759156662386E-2 | V99: =4*DEGREES(RC[-1]*SIN(2*RADIANS(RC[-13]))-2*RC[-11]*SIN(RADIANS(RC[-12]))+4*RC[-11]*RC[-1]*SIN(RADIANS(RC[-12]))*COS(2*RADIANS(RC[-13]))-0.5*RC[-1]*RC[-1]*SIN(4*RADIANS(RC[-13]))-1.25*RC[-11]*RC[-11]*SIN(2*RADIANS(RC[-12]))) -> -1.6800463432538792 | W99: =DEGREES(ACOS(COS(RADIANS(90.833))/(COS(RADIANS(R2C2))*COS(RADIANS(RC[-3])))-TAN(RADIANS(R2C2))*TAN(RADIANS(RC[-3])))) -> 113.92589814476842 | X99: =(720-4*R3C2-RC[-2]+R4C2*60)/1440 -> 1899-12-31T13:57:40.803 | Y99: =(RC[-1]*1440-RC[-2]*4)/1440 -> 1899-12-31T06:21:58.587 | Z99: =(RC[-2]*1440+RC[-3]*4)/1440 -> 1899-12-31T21:33:23.018 | AA99: =8*RC[-4] -> 911.4071851581474 | AB99: =MOD(RC[-23]*1440+RC[-6]+4*R3C2-60*R4C2,1440) -> 722.31995365674607 | AC99: =IF(RC[-1]/4<0,RC[-1]/4+180,RC[-1]/4-180) -> 0.57998841418651637 | AD99: =DEGREES(ACOS(SIN(RADIANS(R2C2))*SIN(RADIANS(RC[-10]))+COS(RADIANS(R2C2))*COS(RADIANS(RC[-10]))*COS(RADIANS(RC[-1])))) -> 62.481295215221635 | AE99: =90-RC[-1] -> 27.518704784778365 | AF99: =IF(RC[-1]>85,0,IF(RC[-1]>5,58.1/TAN(RADIANS(RC[-1]))-0.07/POWER(TAN(RADIANS(RC[-1])),3)+0.000086/POWER(TAN(RADIANS(RC[-1])),5),IF(RC[-1]>-0.575,1735+RC[-1]*(-518.2+RC[-1]*(103.4+RC[-1]*(-12.79+RC[-1]*0.711))),-20.772/TAN(RADIANS(RC[-1])))))/3600 -> 3.0840936107031716E-2 | AG99: =RC[-2]+RC[-1] -> 27.549545720885398 | AH99: =IF(RC[-5]>0,MOD(DEGREES(ACOS(((SIN(RADIANS(R2C2))*COS(RADIANS(RC[-4])))-SIN(RADIANS(RC[-14])))/(COS(RADIANS(R2C2))*SIN(RADIANS(RC[-4])))))+180,360),MOD(540-DEGREES(ACOS(((SIN(RADIANS(R2C2))*COS(RADIANS(RC[-4])))-SIN(RADIANS(RC[-14])))/(COS(RADIANS(R2C2))*SIN(RADIANS(RC[-4]))))),360)) -> 180.64835794240517
D100: =R[-1]C+1 -> 2017-04-09T00:00:00.000 | E100: =R5C2 -> 1899-12-31T14:00:00.000 | F100: =RC[-2]+2415018.5+RC[-1]-R4C2/24 -> 2457853.375 | G100: =(RC[-1]-2451545)/36525 -> 0.17271389459274469 | I100: =MOD(280.46646+RC[-2]*(36000.76983 + RC[-2]*0.0003032),360) -> 18.299634720765425 | J100: =357.52911+RC[-3]*(35999.05029 - 0.0001537*RC[-3]) -> 6575.0652826410906 | K100: =0.016708634-RC[-4]*(0.000042037+0.0000001267*RC[-4]) -> 1.6701369846540678E-2 | L100: =SIN(RADIANS(RC[-2]))*(1.914602-RC[-5]*(0.004817+0.000014*RC[-5]))+SIN(RADIANS(2*RC[-2]))*(0.019993-0.000101*RC[-5])+SIN(RADIANS(3*RC[-2]))*0.000289 -> 1.9025034302818689 | M100: =RC[-4]+RC[-1] -> 20.202138151047293 | N100: =RC[-4]+RC[-2] -> 6576.9677860713728 | O100: =(1.000001018*(1-RC[-4]*RC[-4]))/(1+RC[-4]*COS(RADIANS(RC[-1]))) -> 1.0017516954946499 | P100: =RC[-3]-0.00569-0.00478*SIN(RADIANS(125.04-1934.136*RC[-9])) -> 20.194129873750125 | Q100: =23+(26+((21.448-RC[-10]*(46.815+RC[-10]*(0.00059-RC[-10]*0.001813))))/60)/60 -> 23.437045108545998 | R100: =RC[-1]+0.00256*COS(RADIANS(125.04-1934.136*RC[-11])) -> 23.434806345576703 | S100: =DEGREES(ATAN2(COS(RADIANS(RC[-3])),COS(RADIANS(RC[-1]))*SIN(RADIANS(RC[-3])))) -> 18.648119197216271 | T100: =DEGREES(ASIN(SIN(RADIANS(RC[-2]))*SIN(RADIANS(RC[-4])))) -> 7.8909850425481141 | U100: =TAN(RADIANS(RC[-3]/2))*TAN(RADIANS(RC[-3]/2)) -> 4.3017594551299332E-2 | V100: =4*DEGREES(RC[-1]*SIN(2*RADIANS(RC[-13]))-2*RC[-11]*SIN(RADIANS(RC[-12]))+4*RC[-11]*RC[-1]*SIN(RADIANS(RC[-12]))*COS(2*RADIANS(RC[-13]))-0.5*RC[-1]*RC[-1]*SIN(4*RADIANS(RC[-13]))-1.25*RC[-11]*RC[-11]*SIN(2*RADIANS(RC[-12]))) -> -1.4096704687464312 | W100: =DEGREES(ACOS(COS(RADIANS(90.833))/(COS(RADIANS(R2C2))*COS(RADIANS(RC[-3])))-TAN(RADIANS(R2C2))*TAN(RADIANS(RC[-3])))) -> 115.06943229270419 | X100: =(720-4*R3C2-RC[-2]+R4C2*60)/1440 -> 1899-12-31T13:57:24.580 | Y100: =(RC[-1]*1440-RC[-2]*4)/1440 -> 1899-12-31T06:17:07.916 | Z100: =(RC[-2]*1440+RC[-3]*4)/1440 -> 1899-12-31T21:37:41.244 | AA100: =8*RC[-4] -> 920.55545834163354 | AB100: =MOD(RC[-23]*1440+RC[-6]+4*R3C2-60*R4C2,1440) -> 722.59032953125359 | AC100: =IF(RC[-1]/4<0,RC[-1]/4+180,RC[-1]/4-180) -> 0.64758238281339686 | AD100: =DEGREES(ACOS(SIN(RADIANS(R2C2))*SIN(RADIANS(RC[-10]))+COS(RADIANS(R2C2))*COS(RADIANS(RC[-10]))*COS(RADIANS(RC[-1])))) -> 62.110417695235562 | AE100: =90-RC[-1] -> 27.889582304764438 | AF100: =IF(RC[-1]>85,0,IF(RC[-1]>5,58.1/TAN(RADIANS(RC[-1]))-0.07/POWER(TAN(RADIANS(RC[-1])),3)+0.000086/POWER(TAN(RADIANS(RC[-1])),5),IF(RC[-1]>-0.575,1735+RC[-1]*(-518.2+RC[-1]*(103.4+RC[-1]*(-12.79+RC[-1]*0.711))),-20.772/TAN(RADIANS(RC[-1])))))/3600 -> 3.0363867687237381E-2 | AG100: =RC[-2]+RC[-1] -> 27.919946172451677 | AH100: =IF(RC[-5]>0,MOD(DEGREES(ACOS(((SIN(RADIANS(R2C2))*COS(RADIANS(RC[-4])))-SIN(RADIANS(RC[-14])))/(COS(RADIANS(R2C2))*SIN(RADIANS(RC[-4])))))+180,360),MOD(540-DEGREES(ACOS(((SIN(RADIANS(R2C2))*COS(RADIANS(RC[-4])))-SIN(RADIANS(RC[-14])))/(COS(RADIANS(R2C2))*SIN(RADIANS(RC[-4]))))),360)) -> 180.72574923998332
D101: =R[-1]C+1 -> 2017-04-10T00:00:00.000 | E101: =R5C2 -> 1899-12-31T14:00:00.000 | F101: =RC[-2]+2415018.5+RC[-1]-R4C2/24 -> 2457854.375 | G101: =(RC[-1]-2451545)/36525 -> 0.17274127310061602 | I101: =MOD(280.46646+RC[-2]*(36000.76983 + RC[-2]*0.0003032),360) -> 19.285282083797028 | J101: =357.52911+RC[-3]*(35999.05029 - 0.0001537*RC[-3]) -> 6576.0508829213622 | K101: =0.016708634-RC[-4]*(0.000042037+0.0000001267*RC[-4]) -> 1.670136869443201E-2 | L101: =SIN(RADIANS(RC[-2]))*(1.914602-RC[-5]*(0.004817+0.000014*RC[-5]))+SIN(RADIANS(2*RC[-2]))*(0.019993-0.000101*RC[-5])+SIN(RADIANS(3*RC[-2]))*0.000289 -> 1.8986447889651936 | M101: =RC[-4]+RC[-1] -> 21.183926872762221 | N101: =RC[-4]+RC[-2] -> 6577.9495277103279 | O101: =(1.000001018*(1-RC[-4]*RC[-4]))/(1+RC[-4]*COS(RADIANS(RC[-1]))) -> 1.0020365973431087 | P101: =RC[-3]-0.00569-0.00478*SIN(RADIANS(125.04-1934.136*RC[-9])) -> 21.175914733051069 | Q101: =23+(26+((21.448-RC[-10]*(46.815+RC[-10]*(0.00059-RC[-10]*0.001813))))/60)/60 -> 23.437044752511003 | R101: =RC[-1]+0.00256*COS(RADIANS(125.04-1934.136*RC[-11])) -> 23.434807137994813 | S101: =DEGREES(ATAN2(COS(RADIANS(RC[-3])),COS(RADIANS(RC[-1]))*SIN(RADIANS(RC[-3])))) -> 19.567057895750281 | T101: =DEGREES(ASIN(SIN(RADIANS(RC[-2]))*SIN(RADIANS(RC[-4])))) -> 8.259930514171371 | U101: =TAN(RADIANS(RC[-3]/2))*TAN(RADIANS(RC[-3]/2)) -> 4.3017597543195132E-2 | V101: =4*DEGREES(RC[-1]*SIN(2*RADIANS(RC[-13]))-2*RC[-11]*SIN(RADIANS(RC[-12]))+4*RC[-11]*RC[-1]*SIN(RADIANS(RC[-12]))*COS(2*RADIANS(RC[-13]))-0.5*RC[-1]*RC[-1]*SIN(4*RADIANS(RC[-13]))-1.25*RC[-11]*RC[-11]*SIN(2*RADIANS(RC[-12]))) -> -1.1437895290678495 | W101: =DEGREES(ACOS(COS(RADIANS(90.833))/(COS(RADIANS(R2C2))*COS(RADIANS(RC[-3])))-TAN(RADIANS(R2C2))*TAN(RADIANS(RC[-3])))) -> 116.2190114700136 | X101: =(720-4*R3C2-RC[-2]+R4C2*60)/1440 -> 1899-12-31T13:57:08.627 | Y101: =(RC[-1]*1440-RC[-2]*4)/1440 -> 1899-12-31T06:12:16.065 | Z101: =(RC[-2]*1440+RC[-3]*4)/1440 -> 1899-12-31T21:42:01.190 | AA101: =8*RC[-4] -> 929.75209176010878 | AB101: =MOD(RC[-23]*1440+RC[-6]+4*R3C2-60*R4C2,1440) -> 722.85621047093218 | AC101: =IF(RC[-1]/4<0,RC[-1]/4+180,RC[-1]/4-180) -> 0.71405261773304574 | AD101: =DEGREES(ACOS(SIN(RADIANS(R2C2))*SIN(RADIANS(RC[-10]))+COS(RADIANS(R2C2))*COS(RADIANS(RC[-10]))*COS(RADIANS(RC[-1])))) -> 61.74177926534697 | AE101: =90-RC[-1] -> 28.25822073465303 | AF101: =IF(RC[-1]>85,0,IF(RC[-1]>5,58.1/TAN(RADIANS(RC[-1]))-0.07/POWER(TAN(RADIANS(RC[-1])),3)+0.000086/POWER(TAN(RADIANS(RC[-1])),5),IF(RC[-1]>-0.575,1735+RC[-1]*(-518.2+RC[-1]*(103.4+RC[-1]*(-12.79+RC[-1]*0.711))),-20.772/TAN(RADIANS(RC[-1])))))/3600 -> 2.9900918998500902E-2 | AG101: =RC[-2]+RC[-1] -> 28.28812165365153 | AH101: =IF(RC[-5]>0,MOD(DEGREES(ACOS(((SIN(RADIANS(R2C2))*COS(RADIANS(RC[-4])))-SIN(RADIANS(RC[-14])))/(COS(RADIANS(R2C2))*SIN(RADIANS(RC[-4])))))+180,360),MOD(540-DEGREES(ACOS(((SIN(RADIANS(R2C2))*COS(RADIANS(RC[-4])))-SIN(RADIANS(RC[-14])))/(COS(RADIANS(R2C2))*SIN(RADIANS(RC[-4]))))),360)) -> 180.80226145203497
D102: =R[-1]C+1 -> 2017-04-11T00:00:00.000 | E102: =R5C2 -> 1899-12-31T14:00:00.000 | F102: =RC[-2]+2415018.5+RC[-1]-R4C2/24 -> 2457855.375 | G102: =(RC[-1]-2451545)/36525 -> 0.17276865160848734 | I102: =MOD(280.46646+RC[-2]*(36000.76983 + RC[-2]*0.0003032),360) -> 20.270929446829541 | J102: =357.52911+RC[-3]*(35999.05029 - 0.0001537*RC[-3]) -> 6577.0364832016339 | K102: =0.016708634-RC[-4]*(0.000042037+0.0000001267*RC[-4]) -> 1.670136754232315E-2 | L102: =SIN(RADIANS(RC[-2]))*(1.914602-RC[-5]*(0.004817+0.000014*RC[-5]))+SIN(RADIANS(2*RC[-2]))*(0.019993-0.000101*RC[-5])+SIN(RADIANS(3*RC[-2]))*0.000289 -> 1.8942287055394293 | M102: =RC[-4]+RC[-1] -> 22.165158152368971 | N102: =RC[-4]+RC[-2] -> 6578.9307119071736 | O102: =(1.000001018*(1-RC[-4]*RC[-4]))/(1+RC[-4]*COS(RADIANS(RC[-1]))) -> 1.0023208184663084 | P102: =RC[-3]-0.00569-0.00478*SIN(RADIANS(125.04-1934.136*RC[-9])) -> 22.157142152227355 | Q102: =23+(26+((21.448-RC[-10]*(46.815+RC[-10]*(0.00059-RC[-10]*0.001813))))/60)/60 -> 23.437044396476008 | R102: =RC[-1]+0.00256*COS(RADIANS(125.04-1934.136*RC[-11])) -> 23.43480793232424 | S102: =DEGREES(ATAN2(COS(RADIANS(RC[-3])),COS(RADIANS(RC[-1]))*SIN(RADIANS(RC[-3])))) -> 20.487188053854929 | T102: =DEGREES(ASIN(SIN(RADIANS(RC[-2]))*SIN(RADIANS(RC[-4])))) -> 8.6265690496064025 | U102: =TAN(RADIANS(RC[-3]/2))*TAN(RADIANS(RC[-3]/2)) -> 4.3017600542307508E-2 | V102: =4*DEGREES(RC[-1]*SIN(2*RADIANS(RC[-13]))-2*RC[-11]*SIN(RADIANS(RC[-12]))+4*RC[-11]*RC[-1]*SIN(RADIANS(RC[-12]))*COS(2*RADIANS(RC[-13]))-0.5*RC[-1]*RC[-1]*SIN(4*RADIANS(RC[-13]))-1.25*RC[-11]*RC[-11]*SIN(2*RADIANS(RC[-12]))) -> -0.88267913090055472 | W102: =DEGREES(ACOS(COS(RADIANS(90.833))/(COS(RADIANS(R2C2))*COS(RADIANS(RC[-3])))-TAN(RADIANS(R2C2))*TAN(RADIANS(RC[-3])))) -> 117.37504547959783 | X102: =(720-4*R3C2-RC[-2]+R4C2*60)/1440 -> 1899-12-31T13:56:52.961 | Y102: =(RC[-1]*1440-RC[-2]*4)/1440 -> 1899-12-31T06:07:22.950 | Z102: =(RC[-2]*1440+RC[-3]*4)/1440 -> 1899-12-31T21:46:22.972 | AA102: =8*RC[-4] -> 939.00036383678264 | AB102: =MOD(RC[-23]*1440+RC[-6]+4*R3C2-60*R4C2,1440) -> 723.11732086909944 | AC102: =IF(RC[-1]/4<0,RC[-1]/4+180,RC[-1]/4-180) -> 0.77933021727486107 | AD102: =DEGREES(ACOS(SIN(RADIANS(R2C2))*SIN(RADIANS(RC[-10]))+COS(RADIANS(R2C2))*COS(RADIANS(RC[-10]))*COS(RADIANS(RC[-1])))) -> 61.375472752886665 | AE102: =90-RC[-1] -> 28.624527247113335 | AF102: =IF(RC[-1]>85,0,IF(RC[-1]>5,58.1/TAN(RADIANS(RC[-1]))-0.07/POWER(TAN(RADIANS(RC[-1])),3)+0.000086/POWER(TAN(RADIANS(RC[-1])),5),IF(RC[-1]>-0.575,1735+RC[-1]*(-518.2+RC[-1]*(103.4+RC[-1]*(-12.79+RC[-1]*0.711))),-20.772/TAN(RADIANS(RC[-1])))))/3600 -> 2.9451575451815242E-2 | AG102: =RC[-2]+RC[-1] -> 28.653978822565151 | AH102: =IF(RC[-5]>0,MOD(DEGREES(ACOS(((SIN(RADIANS(R2C2))*COS(RADIANS(RC[-4])))-SIN(RADIANS(RC[-14])))/(COS(RADIANS(R2C2))*SIN(RADIANS(RC[-4])))))+180,360),MOD(540-DEGREES(ACOS(((SIN(RADIANS(R2C2))*COS(RADIANS(RC[-4])))-SIN(RADIANS(RC[-14])))/(COS(RADIANS(R2C2))*SIN(RADIANS(RC[-4]))))),360)) -> 180.87780738064632
D103: =R[-1]C+1 -> 2017-04-12T00:00:00.000 | E103: =R5C2 -> 1899-12-31T14:00:00.000 | F103: =RC[-2]+2415018.5+RC[-1]-R4C2/24 -> 2457856.375 | G103: =(RC[-1]-2451545)/36525 -> 0.17279603011635866 | I103: =MOD(280.46646+RC[-2]*(36000.76983 + RC[-2]*0.0003032),360) -> 21.256576809862963 | J103: =357.52911+RC[-3]*(35999.05029 - 0.0001537*RC[-3]) -> 6578.0220834819038 | K103: =0.016708634-RC[-4]*(0.000042037+0.0000001267*RC[-4]) -> 1.6701366390214099E-2 | L103: =SIN(RADIANS(RC[-2]))*(1.914602-RC[-5]*(0.004817+0.000014*RC[-5]))+SIN(RADIANS(2*RC[-2]))*(0.019993-0.000101*RC[-5])+SIN(RADIANS(3*RC[-2]))*0.000289 -> 1.8892570690724082 | M103: =RC[-4]+RC[-1] -> 23.14583387893537 | N103: =RC[-4]+RC[-2] -> 6579.9113405509761 | O103: =(1.000001018*(1-RC[-4]*RC[-4]))/(1+RC[-4]*COS(RADIANS(RC[-1]))) -> 1.0026042759250025 | P103: =RC[-3]-0.00569-0.00478*SIN(RADIANS(125.04-1934.136*RC[-9])) -> 23.13781402035011 | Q103: =23+(26+((21.448-RC[-10]*(46.815+RC[-10]*(0.00059-RC[-10]*0.001813))))/60)/60 -> 23.437044040441013 | R103: =RC[-1]+0.00256*COS(RADIANS(125.04-1934.136*RC[-11])) -> 23.434808728564004 | S103: =DEGREES(ATAN2(COS(RADIANS(RC[-3])),COS(RADIANS(RC[-1]))*SIN(RADIANS(RC[-3])))) -> 21.408578566185128 | T103: =DEGREES(ASIN(SIN(RADIANS(RC[-2]))*SIN(RADIANS(RC[-4])))) -> 8.9908063722784153 | U103: =TAN(RADIANS(RC[-3]/2))*TAN(RADIANS(RC[-3]/2)) -> 4.301760354863278E-2 | V103: =4*DEGREES(RC[-1]*SIN(2*RADIANS(RC[-13]))-2*RC[-11]*SIN(RADIANS(RC[-12]))+4*RC[-11]*RC[-1]*SIN(RADIANS(RC[-12]))*COS(2*RADIANS(RC[-13]))-0.5*RC[-1]*RC[-1]*SIN(4*RADIANS(RC[-13]))-1.25*RC[-11]*RC[-11]*SIN(2*RADIANS(RC[-12]))) -> -0.62660985768483479 | W103: =DEGREES(ACOS(COS(RADIANS(90.833))/(COS(RADIANS(R2C2))*COS(RADIANS(RC[-3])))-TAN(RADIANS(R2C2))*TAN(RADIANS(RC[-3])))) -> 118.5379686057652 | X103: =(720-4*R3C2-RC[-2]+R4C2*60)/1440 -> 1899-12-31T13:56:37.597 | Y103: =(RC[-1]*1440-RC[-2]*4)/1440 -> 1899-12-31T06:02:28.484 | Z103: =(RC[-2]*1440+RC[-3]*4)/1440 -> 1899-12-31T21:50:46.709 | AA103: =8*RC[-4] -> 948.30374884612161 | AB103: =MOD(RC[-23]*1440+RC[-6]+4*R3C2-60*R4C2,1440) -> 723.3733901423152 | AC103: =IF(RC[-1]/4<0,RC[-1]/4+180,RC[-1]/4-180) -> 0.84334753557880049 | AD103: =DEGREES(ACOS(SIN(RADIANS(R2C2))*SIN(RADIANS(RC[-10]))+COS(RADIANS(R2C2))*COS(RADIANS(RC[-10]))*COS(RADIANS(RC[-1])))) -> 61.011590651938135 | AE103: =90-RC[-1] -> 28.988409348061865 | AF103: =IF(RC[-1]>85,0,IF(RC[-1]>5,58.1/TAN(RADIANS(RC[-1]))-0.07/POWER(TAN(RADIANS(RC[-1])),3)+0.000086/POWER(TAN(RADIANS(RC[-1])),5),IF(RC[-1]>-0.575,1735+RC[-1]*(-518.2+RC[-1]*(103.4+RC[-1]*(-12.79+RC[-1]*0.711))),-20.772/TAN(RADIANS(RC[-1])))))/3600 -> 2.9015349095838569E-2 | AG103: =RC[-2]+RC[-1] -> 29.017424697157704 | AH103: =IF(RC[-5]>0,MOD(DEGREES(ACOS(((SIN(RADIANS(R2C2))*COS(RADIANS(RC[-4])))-SIN(RADIANS(RC[-14])))/(COS(RADIANS(R2C2))*SIN(RADIANS(RC[-4])))))+180,360),MOD(540-DEGREES(ACOS(((SIN(RADIANS(R2C2))*COS(RADIANS(RC[-4])))-SIN(RADIANS(RC[-14])))/(COS(RADIANS(R2C2))*SIN(RADIANS(RC[-4]))))),360)) -> 180.9523002672648
D104: =R[-1]C+1 -> 2017-04-13T00:00:00.000 | E104: =R5C2 -> 1899-12-31T14:00:00.000 | F104: =RC[-2]+2415018.5+RC[-1]-R4C2/24 -> 2457857.375 | G104: =(RC[-1]-2451545)/36525 -> 0.17282340862422998 | I104: =MOD(280.46646+RC[-2]*(36000.76983 + RC[-2]*0.0003032),360) -> 22.242224172896385 | J104: =357.52911+RC[-3]*(35999.05029 - 0.0001537*RC[-3]) -> 6579.0076837621746 | K104: =0.016708634-RC[-4]*(0.000042037+0.0000001267*RC[-4]) -> 1.6701365238104861E-2 | L104: =SIN(RADIANS(RC[-2]))*(1.914602-RC[-5]*(0.004817+0.000014*RC[-5]))+SIN(RADIANS(2*RC[-2]))*(0.019993-0.000101*RC[-5])+SIN(RADIANS(3*RC[-2]))*0.000289 -> 1.8837319262183789 | M104: =RC[-4]+RC[-1] -> 24.125956099114763 | N104: =RC[-4]+RC[-2] -> 6580.891415688393 | O104: =(1.000001018*(1-RC[-4]*RC[-4]))/(1+RC[-4]*COS(RADIANS(RC[-1]))) -> 1.002886887143559 | P104: =RC[-3]-0.00569-0.00478*SIN(RADIANS(125.04-1934.136*RC[-9])) -> 24.117932384075967 | Q104: =23+(26+((21.448-RC[-10]*(46.815+RC[-10]*(0.00059-RC[-10]*0.001813))))/60)/60 -> 23.437043684406017 | R104: =RC[-1]+0.00256*COS(RADIANS(125.04-1934.136*RC[-11])) -> 23.434809526713124 | S104: =DEGREES(ATAN2(COS(RADIANS(RC[-3])),COS(RADIANS(RC[-1]))*SIN(RADIANS(RC[-3])))) -> 22.331296931842335 | T104: =DEGREES(ASIN(SIN(RADIANS(RC[-2]))*SIN(RADIANS(RC[-4])))) -> 9.3525484332745492 | U104: =TAN(RADIANS(RC[-3]/2))*TAN(RADIANS(RC[-3]/2)) -> 4.3017606562167215E-2 | V104: =4*DEGREES(RC[-1]*SIN(2*RADIANS(RC[-13]))-2*RC[-11]*SIN(RADIANS(RC[-12]))+4*RC[-11]*RC[-1]*SIN(RADIANS(RC[-12]))*COS(2*RADIANS(RC[-13]))-0.5*RC[-1]*RC[-1]*SIN(4*RADIANS(RC[-13]))-1.25*RC[-11]*RC[-11]*SIN(2*RADIANS(RC[-12]))) -> -0.37584704700142546 | W104: =DEGREES(ACOS(COS(RADIANS(90.833))/(COS(RADIANS(R2C2))*COS(RADIANS(RC[-3])))-TAN(RADIANS(R2C2))*TAN(RADIANS(RC[-3])))) -> 119.70824256748809 | X104: =(720-4*R3C2-RC[-2]+R4C2*60)/1440 -> 1899-12-31T13:56:22.551 | Y104: =(RC[-1]*1440-RC[-2]*4)/1440 -> 1899-12-31T05:57:32.573 | Z104: =(RC[-2]*1440+RC[-3]*4)/1440 -> 1899-12-31T21:55:12.529 | AA104: =8*RC[-4] -> 957.66594053990468 | AB104: =MOD(RC[-23]*1440+RC[-6]+4*R3C2-60*R4C2,1440) -> 723.62415295299854 | AC104: =IF(RC[-1]/4<0,RC[-1]/4+180,RC[-1]/4-180) -> 0.9060382382496357 | AD104: =DEGREES(ACOS(SIN(RADIANS(R2C2))*SIN(RADIANS(RC[-10]))+COS(RADIANS(R2C2))*COS(RADIANS(RC[-10]))*COS(RADIANS(RC[-1])))) -> 60.650225130612917 | AE104: =90-RC[-1] -> 29.349774869387083 | AF104: =IF(RC[-1]>85,0,IF(RC[-1]>5,58.1/TAN(RADIANS(RC[-1]))-0.07/POWER(TAN(RADIANS(RC[-1])),3)+0.000086/POWER(TAN(RADIANS(RC[-1])),5),IF(RC[-1]>-0.575,1735+RC[-1]*(-518.2+RC[-1]*(103.4+RC[-1]*(-12.79+RC[-1]*0.711))),-20.772/TAN(RADIANS(RC[-1])))))/3600 -> 2.8591777053498871E-2 | AG104: =RC[-2]+RC[-1] -> 29.378366646440583 | AH104: =IF(RC[-5]>0,MOD(DEGREES(ACOS(((SIN(RADIANS(R2C2))*COS(RADIANS(RC[-4])))-SIN(RADIANS(RC[-14])))/(COS(RADIANS(R2C2))*SIN(RADIANS(RC[-4])))))+180,360),MOD(540-DEGREES(ACOS(((SIN(RADIANS(R2C2))*COS(RADIANS(RC[-4])))-SIN(RADIANS(RC[-14])))/(COS(RADIANS(R2C2))*SIN(RADIANS(RC[-4]))))),360)) -> 181.02565387291503
D105: =R[-1]C+1 -> 2017-04-14T00:00:00.000 | E105: =R5C2 -> 1899-12-31T14:00:00.000 | F105: =RC[-2]+2415018.5+RC[-1]-R4C2/24 -> 2457858.375 | G105: =(RC[-1]-2451545)/36525 -> 0.17285078713210131 | I105: =MOD(280.46646+RC[-2]*(36000.76983 + RC[-2]*0.0003032),360) -> 23.227871535930717 | J105: =357.52911+RC[-3]*(35999.05029 - 0.0001537*RC[-3]) -> 6579.9932840424453 | K105: =0.016708634-RC[-4]*(0.000042037+0.0000001267*RC[-4]) -> 1.6701364085995429E-2 | L105: =SIN(RADIANS(RC[-2]))*(1.914602-RC[-5]*(0.004817+0.000014*RC[-5]))+SIN(RADIANS(2*RC[-2]))*(0.019993-0.000101*RC[-5])+SIN(RADIANS(3*RC[-2]))*0.000289 -> 1.8776554799513965 | M105: =RC[-4]+RC[-1] -> 25.105527015882114 | N105: =RC[-4]+RC[-2] -> 6581.8709395223968 | O105: =(1.000001018*(1-RC[-4]*RC[-4]))/(1+RC[-4]*COS(RADIANS(RC[-1]))) -> 1.0031685699325763 | P105: =RC[-3]-0.00569-0.00478*SIN(RADIANS(125.04-1934.136*RC[-9])) -> 25.097499446383196 | Q105: =23+(26+((21.448-RC[-10]*(46.815+RC[-10]*(0.00059-RC[-10]*0.001813))))/60)/60 -> 23.437043328371022 | R105: =RC[-1]+0.00256*COS(RADIANS(125.04-1934.136*RC[-11])) -> 23.434810326770613 | S105: =DEGREES(ATAN2(COS(RADIANS(RC[-3])),COS(RADIANS(RC[-1]))*SIN(RADIANS(RC[-3])))) -> 23.255409192016884 | T105: =DEGREES(ASIN(SIN(RADIANS(RC[-2]))*SIN(RADIANS(RC[-4])))) -> 9.7117014127448194 | U105: =TAN(RADIANS(RC[-3]/2))*TAN(RADIANS(RC[-3]/2)) -> 4.301760958290711E-2 | V105: =4*DEGREES(RC[-1]*SIN(2*RADIANS(RC[-13]))-2*RC[-11]*SIN(RADIANS(RC[-12]))+4*RC[-11]*RC[-1]*SIN(RADIANS(RC[-12]))*COS(2*RADIANS(RC[-13]))-0.5*RC[-1]*RC[-1]*SIN(4*RADIANS(RC[-13]))-1.25*RC[-11]*RC[-11]*SIN(2*RADIANS(RC[-12]))) -> -0.13065056040354386 | W105: =DEGREES(ACOS(COS(RADIANS(90.833))/(COS(RADIANS(R2C2))*COS(RADIANS(RC[-3])))-TAN(RADIANS(R2C2))*TAN(RADIANS(RC[-3])))) -> 120.88635990016236 | X105: =(720-4*R3C2-RC[-2]+R4C2*60)/1440 -> 1899-12-31T13:56:07.839 | Y105: =(RC[-1]*1440-RC[-2]*4)/1440 -> 1899-12-31T05:52:35.113 | Z105: =(RC[-2]*1440+RC[-3]*4)/1440 -> 1899-12-31T21:59:40.565 | AA105: =8*RC[-4] -> 967.09087920129889 | AB105: =MOD(RC[-23]*1440+RC[-6]+4*R3C2-60*R4C2,1440) -> 723.86934943959648 | AC105: =IF(RC[-1]/4<0,RC[-1]/4+180,RC[-1]/4-180) -> 0.96733735989911906 | AD105: =DEGREES(ACOS(SIN(RADIANS(R2C2))*SIN(RADIANS(RC[-10]))+COS(RADIANS(R2C2))*COS(RADIANS(RC[-10]))*COS(RADIANS(RC[-1])))) -> 60.2914680375413 | AE105: =90-RC[-1] -> 29.7085319624587 | AF105: =IF(RC[-1]>85,0,IF(RC[-1]>5,58.1/TAN(RADIANS(RC[-1]))-0.07/POWER(TAN(RADIANS(RC[-1])),3)+0.000086/POWER(TAN(RADIANS(RC[-1])),5),IF(RC[-1]>-0.575,1735+RC[-1]*(-518.2+RC[-1]*(103.4+RC[-1]*(-12.79+RC[-1]*0.711))),-20.772/TAN(RADIANS(RC[-1])))))/3600 -> 2.8180420066344695E-2 | AG105: =RC[-2]+RC[-1] -> 29.736712382525045 | AH105: =IF(RC[-5]>0,MOD(DEGREES(ACOS(((SIN(RADIANS(R2C2))*COS(RADIANS(RC[-4])))-SIN(RADIANS(RC[-14])))/(COS(RADIANS(R2C2))*SIN(RADIANS(RC[-4])))))+180,360),MOD(540-DEGREES(ACOS(((SIN(RADIANS(R2C2))*COS(RADIANS(RC[-4])))-SIN(RADIANS(RC[-14])))/(COS(RADIANS(R2C2))*SIN(RADIANS(RC[-4]))))),360)) -> 181.09778256259975
D106: =R[-1]C+1 -> 2017-04-15T00:00:00.000 | E106: =R5C2 -> 1899-12-31T14:00:00.000 | F106: =RC[-2]+2415018.5+RC[-1]-R4C2/24 -> 2457859.375 | G106: =(RC[-1]-2451545)/36525 -> 0.17287816563997263 | I106: =MOD(280.46646+RC[-2]*(36000.76983 + RC[-2]*0.0003032),360) -> 24.213518898965049 | J106: =357.52911+RC[-3]*(35999.05029 - 0.0001537*RC[-3]) -> 6580.9788843227143 | K106: =0.016708634-RC[-4]*(0.000042037+0.0000001267*RC[-4]) -> 1.670136293388581E-2 | L106: =SIN(RADIANS(RC[-2]))*(1.914602-RC[-5]*(0.004817+0.000014*RC[-5]))+SIN(RADIANS(2*RC[-2]))*(0.019993-0.000101*RC[-5])+SIN(RADIANS(3*RC[-2]))*0.000289 -> 1.8710300882636797 | M106: =RC[-4]+RC[-1] -> 26.084548987228729 | N106: =RC[-4]+RC[-2] -> 6582.8499144109783 | O106: =(1.000001018*(1-RC[-4]*RC[-4]))/(1+RC[-4]*COS(RADIANS(RC[-1]))) -> 1.0034492425112358 | P106: =RC[-3]-0.00569-0.00478*SIN(RADIANS(125.04-1934.136*RC[-9])) -> 26.076517565266386 | Q106: =23+(26+((21.448-RC[-10]*(46.815+RC[-10]*(0.00059-RC[-10]*0.001813))))/60)/60 -> 23.437042972336027 | R106: =RC[-1]+0.00256*COS(RADIANS(125.04-1934.136*RC[-11])) -> 23.434811128735483 | S106: =DEGREES(ATAN2(COS(RADIANS(RC[-3])),COS(RADIANS(RC[-1]))*SIN(RADIANS(RC[-3])))) -> 24.180979866857115 | T106: =DEGREES(ASIN(SIN(RADIANS(RC[-2]))*SIN(RADIANS(RC[-4])))) -> 10.068171722578878 | U106: =TAN(RADIANS(RC[-3]/2))*TAN(RADIANS(RC[-3]/2)) -> 4.3017612610848736E-2 | V106: =4*DEGREES(RC[-1]*SIN(2*RADIANS(RC[-13]))-2*RC[-11]*SIN(RADIANS(RC[-12]))+4*RC[-11]*RC[-1]*SIN(RADIANS(RC[-12]))*COS(2*RADIANS(RC[-13]))-0.5*RC[-1]*RC[-1]*SIN(4*RADIANS(RC[-13]))-1.25*RC[-11]*RC[-11]*SIN(2*RADIANS(RC[-12]))) -> 0.10872545430331718 | W106: =DEGREES(ACOS(COS(RADIANS(90.833))/(COS(RADIANS(R2C2))*COS(RADIANS(RC[-3])))-TAN(RADIANS(R2C2))*TAN(RADIANS(RC[-3])))) -> 122.07284784363986 | X106: =(720-4*R3C2-RC[-2]+R4C2*60)/1440 -> 1899-12-31T13:55:53.476 | Y106: =(RC[-1]*1440-RC[-2]*4)/1440 -> 1899-12-31T05:47:35.993 | Z106: =(RC[-2]*1440+RC[-3]*4)/1440 -> 1899-12-31T22:04:10.960 | AA106: =8*RC[-4] -> 976.58278274911891 | AB106: =MOD(RC[-23]*1440+RC[-6]+4*R3C2-60*R4C2,1440) -> 724.10872545430334 | AC106: =IF(RC[-1]/4<0,RC[-1]/4+180,RC[-1]/4-180) -> 1.0271813635758349 | AD106: =DEGREES(ACOS(SIN(RADIANS(R2C2))*SIN(RADIANS(RC[-10]))+COS(RADIANS(R2C2))*COS(RADIANS(RC[-10]))*COS(RADIANS(RC[-1])))) -> 59.935410907509045 | AE106: =90-RC[-1] -> 30.064589092490955 | AF106: =IF(RC[-1]>85,0,IF(RC[-1]>5,58.1/TAN(RADIANS(RC[-1]))-0.07/POWER(TAN(RADIANS(RC[-1])),3)+0.000086/POWER(TAN(RADIANS(RC[-1])),5),IF(RC[-1]>-0.575,1735+RC[-1]*(-518.2+RC[-1]*(103.4+RC[-1]*(-12.79+RC[-1]*0.711))),-20.772/TAN(RADIANS(RC[-1])))))/3600 -> 2.7780861138243372E-2 | AG106: =RC[-2]+RC[-1] -> 30.092369953629198 | AH106: =IF(RC[-5]>0,MOD(DEGREES(ACOS(((SIN(RADIANS(R2C2))*COS(RADIANS(RC[-4])))-SIN(RADIANS(RC[-14])))/(COS(RADIANS(R2C2))*SIN(RADIANS(RC[-4])))))+180,360),MOD(540-DEGREES(ACOS(((SIN(RADIANS(R2C2))*COS(RADIANS(RC[-4])))-SIN(RADIANS(RC[-14])))/(COS(RADIANS(R2C2))*SIN(RADIANS(RC[-4]))))),360)) -> 181.16860139391792
D107: =R[-1]C+1 -> 2017-04-16T00:00:00.000 | E107: =R5C2 -> 1899-12-31T14:00:00.000 | F107: =RC[-2]+2415018.5+RC[-1]-R4C2/24 -> 2457860.375 | G107: =(RC[-1]-2451545)/36525 -> 0.17290554414784395 | I107: =MOD(280.46646+RC[-2]*(36000.76983 + RC[-2]*0.0003032),360) -> 25.19916626199938 | J107: =357.52911+RC[-3]*(35999.05029 - 0.0001537*RC[-3]) -> 6581.9644846029851 | K107: =0.016708634-RC[-4]*(0.000042037+0.0000001267*RC[-4]) -> 1.6701361781775999E-2 | L107: =SIN(RADIANS(RC[-2]))*(1.914602-RC[-5]*(0.004817+0.000014*RC[-5]))+SIN(RADIANS(2*RC[-2]))*(0.019993-0.000101*RC[-5])+SIN(RADIANS(3*RC[-2]))*0.000289 -> 1.8638582628301184 | M107: =RC[-4]+RC[-1] -> 27.063024524829498 | N107: =RC[-4]+RC[-2] -> 6583.8283428658151 | O107: =(1.000001018*(1-RC[-4]*RC[-4]))/(1+RC[-4]*COS(RADIANS(RC[-1]))) -> 1.0037288235293842 | P107: =RC[-3]-0.00569-0.00478*SIN(RADIANS(125.04-1934.136*RC[-9])) -> 27.054989252403718 | Q107: =23+(26+((21.448-RC[-10]*(46.815+RC[-10]*(0.00059-RC[-10]*0.001813))))/60)/60 -> 23.437042616301031 | R107: =RC[-1]+0.00256*COS(RADIANS(125.04-1934.136*RC[-11])) -> 23.434811932606738 | S107: =DEGREES(ATAN2(COS(RADIANS(RC[-3])),COS(RADIANS(RC[-1]))*SIN(RADIANS(RC[-3])))) -> 25.10807189159388 | T107: =DEGREES(ASIN(SIN(RADIANS(RC[-2]))*SIN(RADIANS(RC[-4])))) -> 10.421866010417171 | U107: =TAN(RADIANS(RC[-3]/2))*TAN(RADIANS(RC[-3]/2)) -> 4.3017615645988334E-2 | V107: =4*DEGREES(RC[-1]*SIN(2*RADIANS(RC[-13]))-2*RC[-11]*SIN(RADIANS(RC[-12]))+4*RC[-11]*RC[-1]*SIN(RADIANS(RC[-12]))*COS(2*RADIANS(RC[-13]))-0.5*RC[-1]*RC[-1]*SIN(4*RADIANS(RC[-13]))-1.25*RC[-11]*RC[-11]*SIN(2*RADIANS(RC[-12]))) -> 0.34203280825764865 | W107: =DEGREES(ACOS(COS(RADIANS(90.833))/(COS(RADIANS(R2C2))*COS(RADIANS(RC[-3])))-TAN(RADIANS(R2C2))*TAN(RADIANS(RC[-3])))) -> 123.26827283127822 | X107: =(720-4*R3C2-RC[-2]+R4C2*60)/1440 -> 1899-12-31T13:55:39.478 | Y107: =(RC[-1]*1440-RC[-2]*4)/1440 -> 1899-12-31T05:42:35.093 | Z107: =(RC[-2]*1440+RC[-3]*4)/1440 -> 1899-12-31T22:08:43.864 | AA107: =8*RC[-4] -> 986.1461826502258 | AB107: =MOD(RC[-23]*1440+RC[-6]+4*R3C2-60*R4C2,1440) -> 724.34203280825761 | AC107: =IF(RC[-1]/4<0,RC[-1]/4+180,RC[-1]/4-180) -> 1.0855082020644033 | AD107: =DEGREES(ACOS(SIN(RADIANS(R2C2))*SIN(RADIANS(RC[-10]))+COS(RADIANS(R2C2))*COS(RADIANS(RC[-10]))*COS(RADIANS(RC[-1])))) -> 59.582144966161486 | AE107: =90-RC[-1] -> 30.417855033838514 | AF107: =IF(RC[-1]>85,0,IF(RC[-1]>5,58.1/TAN(RADIANS(RC[-1]))-0.07/POWER(TAN(RADIANS(RC[-1])),3)+0.000086/POWER(TAN(RADIANS(RC[-1])),5),IF(RC[-1]>-0.575,1735+RC[-1]*(-518.2+RC[-1]*(103.4+RC[-1]*(-12.79+RC[-1]*0.711))),-20.772/TAN(RADIANS(RC[-1])))))/3600 -> 2.7392704270741659E-2 | AG107: =RC[-2]+RC[-1] -> 30.445247738109256 | AH107: =IF(RC[-5]>0,MOD(DEGREES(ACOS(((SIN(RADIANS(R2C2))*COS(RADIANS(RC[-4])))-SIN(RADIANS(RC[-14])))/(COS(RADIANS(R2C2))*SIN(RADIANS(RC[-4])))))+180,360),MOD(540-DEGREES(ACOS(((SIN(RADIANS(R2C2))*COS(RADIANS(RC[-4])))-SIN(RADIANS(RC[-14])))/(COS(RADIANS(R2C2))*SIN(RADIANS(RC[-4]))))),360)) -> 181.23802621003327
D108: =R[-1]C+1 -> 2017-04-17T00:00:00.000 | E108: =R5C2 -> 1899-12-31T14:00:00.000 | F108: =RC[-2]+2415018.5+RC[-1]-R4C2/24 -> 2457861.375 | G108: =(RC[-1]-2451545)/36525 -> 0.17293292265571528 | I108: =MOD(280.46646+RC[-2]*(36000.76983 + RC[-2]*0.0003032),360) -> 26.184813625034622 | J108: =357.52911+RC[-3]*(35999.05029 - 0.0001537*RC[-3]) -> 6582.9500848832531 | K108: =0.016708634-RC[-4]*(0.000042037+0.0000001267*RC[-4]) -> 1.6701360629666002E-2 | L108: =SIN(RADIANS(RC[-2]))*(1.914602-RC[-5]*(0.004817+0.000014*RC[-5]))+SIN(RADIANS(2*RC[-2]))*(0.019993-0.000101*RC[-5])+SIN(RADIANS(3*RC[-2]))*0.000289 -> 1.8561426676400699 | M108: =RC[-4]+RC[-1] -> 28.040956292674693 | N108: =RC[-4]+RC[-2] -> 6584.8062275508928 | O108: =(1.000001018*(1-RC[-4]*RC[-4]))/(1+RC[-4]*COS(RADIANS(RC[-1]))) -> 1.0040072320893372 | P108: =RC[-3]-0.00569-0.00478*SIN(RADIANS(125.04-1934.136*RC[-9])) -> 28.03291717178876 | Q108: =23+(26+((21.448-RC[-10]*(46.815+RC[-10]*(0.00059-RC[-10]*0.001813))))/60)/60 -> 23.43704226026604 | R108: =RC[-1]+0.00256*COS(RADIANS(125.04-1934.136*RC[-11])) -> 23.434812738383403 | S108: =DEGREES(ATAN2(COS(RADIANS(RC[-3])),COS(RADIANS(RC[-1]))*SIN(RADIANS(RC[-3])))) -> 26.036746551937291 | T108: =DEGREES(ASIN(SIN(RADIANS(RC[-2]))*SIN(RADIANS(RC[-4])))) -> 10.772691165045433 | U108: =TAN(RADIANS(RC[-3]/2))*TAN(RADIANS(RC[-3]/2)) -> 4.3017618688322191E-2 | V108: =4*DEGREES(RC[-1]*SIN(2*RADIANS(RC[-13]))-2*RC[-11]*SIN(RADIANS(RC[-12]))+4*RC[-11]*RC[-1]*SIN(RADIANS(RC[-12]))*COS(2*RADIANS(RC[-13]))-0.5*RC[-1]*RC[-1]*SIN(4*RADIANS(RC[-13]))-1.25*RC[-11]*RC[-11]*SIN(2*RADIANS(RC[-12]))) -> 0.56902952404995355 | W108: =DEGREES(ACOS(COS(RADIANS(90.833))/(COS(RADIANS(R2C2))*COS(RADIANS(RC[-3])))-TAN(RADIANS(R2C2))*TAN(RADIANS(RC[-3])))) -> 124.47324569607197 | X108: =(720-4*R3C2-RC[-2]+R4C2*60)/1440 -> 1899-12-31T13:55:25.858 | Y108: =(RC[-1]*1440-RC[-2]*4)/1440 -> 1899-12-31T05:37:32.279 | Z108: =(RC[-2]*1440+RC[-3]*4)/1440 -> 1899-12-31T22:13:19.437 | AA108: =8*RC[-4] -> 995.78596556857576 | AB108: =MOD(RC[-23]*1440+RC[-6]+4*R3C2-60*R4C2,1440) -> 724.56902952404994 | AC108: =IF(RC[-1]/4<0,RC[-1]/4+180,RC[-1]/4-180) -> 1.1422573810124845 | AD108: =DEGREES(ACOS(SIN(RADIANS(R2C2))*SIN(RADIANS(RC[-10]))+COS(RADIANS(R2C2))*COS(RADIANS(RC[-10]))*COS(RADIANS(RC[-1])))) -> 59.231761133702754 | AE108: =90-RC[-1] -> 30.768238866297246 | AF108: =IF(RC[-1]>85,0,IF(RC[-1]>5,58.1/TAN(RADIANS(RC[-1]))-0.07/POWER(TAN(RADIANS(RC[-1])),3)+0.000086/POWER(TAN(RADIANS(RC[-1])),5),IF(RC[-1]>-0.575,1735+RC[-1]*(-518.2+RC[-1]*(103.4+RC[-1]*(-12.79+RC[-1]*0.711))),-20.772/TAN(RADIANS(RC[-1])))))/3600 -> 2.7015573283066967E-2 | AG108: =RC[-2]+RC[-1] -> 30.795254439580312 | AH108: =IF(RC[-5]>0,MOD(DEGREES(ACOS(((SIN(RADIANS(R2C2))*COS(RADIANS(RC[-4])))-SIN(RADIANS(RC[-14])))/(COS(RADIANS(R2C2))*SIN(RADIANS(RC[-4])))))+180,360),MOD(540-DEGREES(ACOS(((SIN(RADIANS(R2C2))*COS(RADIANS(RC[-4])))-SIN(RADIANS(RC[-14])))/(COS(RADIANS(R2C2))*SIN(RADIANS(RC[-4]))))),360)) -> 181.30597373696364
D109: =R[-1]C+1 -> 2017-04-18T00:00:00.000 | E109: =R5C2 -> 1899-12-31T14:00:00.000 | F109: =RC[-2]+2415018.5+RC[-1]-R4C2/24 -> 2457862.375 | G109: =(RC[-1]-2451545)/36525 -> 0.17296030116358657 | I109: =MOD(280.46646+RC[-2]*(36000.76983 + RC[-2]*0.0003032),360) -> 27.170460988069863 | J109: =357.52911+RC[-3]*(35999.05029 - 0.0001537*RC[-3]) -> 6583.9356851635221 | K109: =0.016708634-RC[-4]*(0.000042037+0.0000001267*RC[-4]) -> 1.6701359477555813E-2 | L109: =SIN(RADIANS(RC[-2]))*(1.914602-RC[-5]*(0.004817+0.000014*RC[-5]))+SIN(RADIANS(2*RC[-2]))*(0.019993-0.000101*RC[-5])+SIN(RADIANS(3*RC[-2]))*0.000289 -> 1.8478861175972854 | M109: =RC[-4]+RC[-1] -> 29.018347105667146 | N109: =RC[-4]+RC[-2] -> 6585.7835712811193 | O109: =(1.000001018*(1-RC[-4]*RC[-4]))/(1+RC[-4]*COS(RADIANS(RC[-1]))) -> 1.0042843877674157 | P109: =RC[-3]-0.00569-0.00478*SIN(RADIANS(125.04-1934.136*RC[-9])) -> 29.010304138327626 | Q109: =23+(26+((21.448-RC[-10]*(46.815+RC[-10]*(0.00059-RC[-10]*0.001813))))/60)/60 -> 23.437041904231044 | R109: =RC[-1]+0.00256*COS(RADIANS(125.04-1934.136*RC[-11])) -> 23.434813546064472 | S109: =DEGREES(ATAN2(COS(RADIANS(RC[-3])),COS(RADIANS(RC[-1]))*SIN(RADIANS(RC[-3])))) -> 26.967063418780917 | T109: =DEGREES(ASIN(SIN(RADIANS(RC[-2]))*SIN(RADIANS(RC[-4])))) -> 11.120554323223557 | U109: =TAN(RADIANS(RC[-3]/2))*TAN(RADIANS(RC[-3]/2)) -> 4.3017621737846568E-2 | V109: =4*DEGREES(RC[-1]*SIN(2*RADIANS(RC[-13]))-2*RC[-11]*SIN(RADIANS(RC[-12]))+4*RC[-11]*RC[-1]*SIN(RADIANS(RC[-12]))*COS(2*RADIANS(RC[-13]))-0.5*RC[-1]*RC[-1]*SIN(4*RADIANS(RC[-13]))-1.25*RC[-11]*RC[-11]*SIN(2*RADIANS(RC[-12]))) -> 0.7894800952986204 | W109: =DEGREES(ACOS(COS(RADIANS(90.833))/(COS(RADIANS(R2C2))*COS(RADIANS(RC[-3])))-TAN(RADIANS(R2C2))*TAN(RADIANS(RC[-3])))) -> 125.68842773701806 | X109: =(720-4*R3C2-RC[-2]+R4C2*60)/1440 -> 1899-12-31T13:55:12.631 | Y109: =(RC[-1]*1440-RC[-2]*4)/1440 -> 1899-12-31T05:32:27.409 | Z109: =(RC[-2]*1440+RC[-3]*4)/1440 -> 1899-12-31T22:17:57.854 | AA109: =8*RC[-4] -> 1005.5074218961445 | AB109: =MOD(RC[-23]*1440+RC[-6]+4*R3C2-60*R4C2,1440) -> 724.78948009529859 | AC109: =IF(RC[-1]/4<0,RC[-1]/4+180,RC[-1]/4-180) -> 1.1973700238246465 | AD109: =DEGREES(ACOS(SIN(RADIANS(R2C2))*SIN(RADIANS(RC[-10]))+COS(RADIANS(R2C2))*COS(RADIANS(RC[-10]))*COS(RADIANS(RC[-1])))) -> 58.884350027514394 | AE109: =90-RC[-1] -> 31.115649972485606 | AF109: =IF(RC[-1]>85,0,IF(RC[-1]>5,58.1/TAN(RADIANS(RC[-1]))-0.07/POWER(TAN(RADIANS(RC[-1])),3)+0.000086/POWER(TAN(RADIANS(RC[-1])),5),IF(RC[-1]>-0.575,1735+RC[-1]*(-518.2+RC[-1]*(103.4+RC[-1]*(-12.79+RC[-1]*0.711))),-20.772/TAN(RADIANS(RC[-1])))))/3600 -> 2.6649110710337993E-2 | AG109: =RC[-2]+RC[-1] -> 31.142299083195944 | AH109: =IF(RC[-5]>0,MOD(DEGREES(ACOS(((SIN(RADIANS(R2C2))*COS(RADIANS(RC[-4])))-SIN(RADIANS(RC[-14])))/(COS(RADIANS(R2C2))*SIN(RADIANS(RC[-4])))))+180,360),MOD(540-DEGREES(ACOS(((SIN(RADIANS(R2C2))*COS(RADIANS(RC[-4])))-SIN(RADIANS(RC[-14])))/(COS(RADIANS(R2C2))*SIN(RADIANS(RC[-4]))))),360)) -> 181.37236168528125
D110: =R[-1]C+1 -> 2017-04-19T00:00:00.000 | E110: =R5C2 -> 1899-12-31T14:00:00.000 | F110: =RC[-2]+2415018.5+RC[-1]-R4C2/24 -> 2457863.375 | G110: =(RC[-1]-2451545)/36525 -> 0.17298767967145789 | I110: =MOD(280.46646+RC[-2]*(36000.76983 + RC[-2]*0.0003032),360) -> 28.156108351104194 | J110: =357.52911+RC[-3]*(35999.05029 - 0.0001537*RC[-3]) -> 6584.9212854437919 | K110: =0.016708634-RC[-4]*(0.000042037+0.0000001267*RC[-4]) -> 1.6701358325445434E-2 | L110: =SIN(RADIANS(RC[-2]))*(1.914602-RC[-5]*(0.004817+0.000014*RC[-5]))+SIN(RADIANS(2*RC[-2]))*(0.019993-0.000101*RC[-5])+SIN(RADIANS(3*RC[-2]))*0.000289 -> 1.839091577089321 | M110: =RC[-4]+RC[-1] -> 29.995199928193514 | N110: =RC[-4]+RC[-2] -> 6586.7603770208816 | O110: =(1.000001018*(1-RC[-4]*RC[-4]))/(1+RC[-4]*COS(RADIANS(RC[-1]))) -> 1.0045602106351914 | P110: =RC[-3]-0.00569-0.00478*SIN(RADIANS(125.04-1934.136*RC[-9])) -> 29.987153116410258 | Q110: =23+(26+((21.448-RC[-10]*(46.815+RC[-10]*(0.00059-RC[-10]*0.001813))))/60)/60 -> 23.437041548196049 | R110: =RC[-1]+0.00256*COS(RADIANS(125.04-1934.136*RC[-11])) -> 23.434814355648953 | S110: =DEGREES(ATAN2(COS(RADIANS(RC[-3])),COS(RADIANS(RC[-1]))*SIN(RADIANS(RC[-3])))) -> 27.8990802822658 | T110: =DEGREES(ASIN(SIN(RADIANS(RC[-2]))*SIN(RADIANS(RC[-4])))) -> 11.465362878001002 | U110: =TAN(RADIANS(RC[-3]/2))*TAN(RADIANS(RC[-3]/2)) -> 4.3017624794557674E-2 | V110: =4*DEGREES(RC[-1]*SIN(2*RADIANS(RC[-13]))-2*RC[-11]*SIN(RADIANS(RC[-12]))+4*RC[-11]*RC[-1]*SIN(RADIANS(RC[-12]))*COS(2*RADIANS(RC[-13]))-0.5*RC[-1]*RC[-1]*SIN(4*RADIANS(RC[-13]))-1.25*RC[-11]*RC[-11]*SIN(2*RADIANS(RC[-12]))) -> 1.0031557529661983 | W110: =DEGREES(ACOS(COS(RADIANS(90.833))/(COS(RADIANS(R2C2))*COS(RADIANS(RC[-3])))-TAN(RADIANS(R2C2))*TAN(RADIANS(RC[-3])))) -> 126.91453782350044 | X110: =(720-4*R3C2-RC[-2]+R4C2*60)/1440 -> 1899-12-31T13:54:59.811 | Y110: =(RC[-1]*1440-RC[-2]*4)/1440 -> 1899-12-31T05:27:20.322 | Z110: =(RC[-2]*1440+RC[-3]*4)/1440 -> 1899-12-31T22:22:39.300 | AA110: =8*RC[-4] -> 1015.3163025880035 | AB110: =MOD(RC[-23]*1440+RC[-6]+4*R3C2-60*R4C2,1440) -> 725.00315575296622 | AC110: =IF(RC[-1]/4<0,RC[-1]/4+180,RC[-1]/4-180) -> 1.2507889382415556 | AD110: =DEGREES(ACOS(SIN(RADIANS(R2C2))*SIN(RADIANS(RC[-10]))+COS(RADIANS(R2C2))*COS(RADIANS(RC[-10]))*COS(RADIANS(RC[-1])))) -> 58.540001963612447 | AE110: =90-RC[-1] -> 31.459998036387553 | AF110: =IF(RC[-1]>85,0,IF(RC[-1]>5,58.1/TAN(RADIANS(RC[-1]))-0.07/POWER(TAN(RADIANS(RC[-1])),3)+0.000086/POWER(TAN(RADIANS(RC[-1])),5),IF(RC[-1]>-0.575,1735+RC[-1]*(-518.2+RC[-1]*(103.4+RC[-1]*(-12.79+RC[-1]*0.711))),-20.772/TAN(RADIANS(RC[-1])))))/3600 -> 2.629297677408815E-2 | AG110: =RC[-2]+RC[-1] -> 31.48629101316164 | AH110: =IF(RC[-5]>0,MOD(DEGREES(ACOS(((SIN(RADIANS(R2C2))*COS(RADIANS(RC[-4])))-SIN(RADIANS(RC[-14])))/(COS(RADIANS(R2C2))*SIN(RADIANS(RC[-4])))))+180,360),MOD(540-DEGREES(ACOS(((SIN(RADIANS(R2C2))*COS(RADIANS(RC[-4])))-SIN(RADIANS(RC[-14])))/(COS(RADIANS(R2C2))*SIN(RADIANS(RC[-4]))))),360)) -> 181.43710885614294
D111: =R[-1]C+1 -> 2017-04-20T00:00:00.000 | E111: =R5C2 -> 1899-12-31T14:00:00.000 | F111: =RC[-2]+2415018.5+RC[-1]-R4C2/24 -> 2457864.375 | G111: =(RC[-1]-2451545)/36525 -> 0.17301505817932922 | I111: =MOD(280.46646+RC[-2]*(36000.76983 + RC[-2]*0.0003032),360) -> 29.141755714141254 | J111: =357.52911+RC[-3]*(35999.05029 - 0.0001537*RC[-3]) -> 6585.90688572406 | K111: =0.016708634-RC[-4]*(0.000042037+0.0000001267*RC[-4]) -> 1.6701357173334864E-2 | L111: =SIN(RADIANS(RC[-2]))*(1.914602-RC[-5]*(0.004817+0.000014*RC[-5]))+SIN(RADIANS(2*RC[-2]))*(0.019993-0.000101*RC[-5])+SIN(RADIANS(3*RC[-2]))*0.000289 -> 1.8297621585273491 | M111: =RC[-4]+RC[-1] -> 30.971517872668603 | N111: =RC[-4]+RC[-2] -> 6587.736647882587 | O111: =(1.000001018*(1-RC[-4]*RC[-4]))/(1+RC[-4]*COS(RADIANS(RC[-1]))) -> 1.0048346212804578 | P111: =RC[-3]-0.00569-0.00478*SIN(RADIANS(125.04-1934.136*RC[-9])) -> 30.963467218454745 | Q111: =23+(26+((21.448-RC[-10]*(46.815+RC[-10]*(0.00059-RC[-10]*0.001813))))/60)/60 -> 23.437041192161058 | R111: =RC[-1]+0.00256*COS(RADIANS(125.04-1934.136*RC[-11])) -> 23.434815167135856 | S111: =DEGREES(ATAN2(COS(RADIANS(RC[-3])),COS(RADIANS(RC[-1]))*SIN(RADIANS(RC[-3])))) -> 28.832853085258137 | T111: =DEGREES(ASIN(SIN(RADIANS(RC[-2]))*SIN(RADIANS(RC[-4])))) -> 11.80702448856548 | U111: =TAN(RADIANS(RC[-3]/2))*TAN(RADIANS(RC[-3]/2)) -> 4.3017627858451785E-2 | V111: =4*DEGREES(RC[-1]*SIN(2*RADIANS(RC[-13]))-2*RC[-11]*SIN(RADIANS(RC[-12]))+4*RC[-11]*RC[-1]*SIN(RADIANS(RC[-12]))*COS(2*RADIANS(RC[-13]))-0.5*RC[-1]*RC[-1]*SIN(4*RADIANS(RC[-13]))-1.25*RC[-11]*RC[-11]*SIN(2*RADIANS(RC[-12]))) -> 1.2098347380064101 | W111: =DEGREES(ACOS(COS(RADIANS(90.833))/(COS(RADIANS(R2C2))*COS(RADIANS(RC[-3])))-TAN(RADIANS(R2C2))*TAN(RADIANS(RC[-3])))) -> 128.15236076009134 | X111: =(720-4*R3C2-RC[-2]+R4C2*60)/1440 -> 1899-12-31T13:54:47.410 | Y111: =(RC[-1]*1440-RC[-2]*4)/1440 -> 1899-12-31T05:22:10.843 | Z111: =(RC[-2]*1440+RC[-3]*4)/1440 -> 1899-12-31T22:27:23.976 | AA111: =8*RC[-4] -> 1025.2188860807307 | AB111: =MOD(RC[-23]*1440+RC[-6]+4*R3C2-60*R4C2,1440) -> 725.20983473800641 | AC111: =IF(RC[-1]/4<0,RC[-1]/4+180,RC[-1]/4-180) -> 1.3024586845016017 | AD111: =DEGREES(ACOS(SIN(RADIANS(R2C2))*SIN(RADIANS(RC[-10]))+COS(RADIANS(R2C2))*COS(RADIANS(RC[-10]))*COS(RADIANS(RC[-1])))) -> 58.198806956866115 | AE111: =90-RC[-1] -> 31.801193043133885 | AF111: =IF(RC[-1]>85,0,IF(RC[-1]>5,58.1/TAN(RADIANS(RC[-1]))-0.07/POWER(TAN(RADIANS(RC[-1])),3)+0.000086/POWER(TAN(RADIANS(RC[-1])),5),IF(RC[-1]>-0.575,1735+RC[-1]*(-518.2+RC[-1]*(103.4+RC[-1]*(-12.79+RC[-1]*0.711))),-20.772/TAN(RADIANS(RC[-1])))))/3600 -> 2.5946848419699475E-2 | AG111: =RC[-2]+RC[-1] -> 31.827139891553585 | AH111: =IF(RC[-5]>0,MOD(DEGREES(ACOS(((SIN(RADIANS(R2C2))*COS(RADIANS(RC[-4])))-SIN(RADIANS(RC[-14])))/(COS(RADIANS(R2C2))*SIN(RADIANS(RC[-4])))))+180,360),MOD(540-DEGREES(ACOS(((SIN(RADIANS(R2C2))*COS(RADIANS(RC[-4])))-SIN(RADIANS(RC[-14])))/(COS(RADIANS(R2C2))*SIN(RADIANS(RC[-4]))))),360)) -> 181.50013525163362
D112: =R[-1]C+1 -> 2017-04-21T00:00:00.000 | E112: =R5C2 -> 1899-12-31T14:00:00.000 | F112: =RC[-2]+2415018.5+RC[-1]-R4C2/24 -> 2457865.375 | G112: =(RC[-1]-2451545)/36525 -> 0.17304243668720054 | I112: =MOD(280.46646+RC[-2]*(36000.76983 + RC[-2]*0.0003032),360) -> 30.127403077178315 | J112: =357.52911+RC[-3]*(35999.05029 - 0.0001537*RC[-3]) -> 6586.8924860043289 | K112: =0.016708634-RC[-4]*(0.000042037+0.0000001267*RC[-4]) -> 1.6701356021224103E-2 | L112: =SIN(RADIANS(RC[-2]))*(1.914602-RC[-5]*(0.004817+0.000014*RC[-5]))+SIN(RADIANS(2*RC[-2]))*(0.019993-0.000101*RC[-5])+SIN(RADIANS(3*RC[-2]))*0.000289 -> 1.8199011208572131 | M112: =RC[-4]+RC[-1] -> 31.947304198035528 | N112: =RC[-4]+RC[-2] -> 6588.7123871251861 | O112: =(1.000001018*(1-RC[-4]*RC[-4]))/(1+RC[-4]*COS(RADIANS(RC[-1]))) -> 1.0051075408279142 | P112: =RC[-3]-0.00569-0.00478*SIN(RADIANS(125.04-1934.136*RC[-9])) -> 31.939249703407491 | Q112: =23+(26+((21.448-RC[-10]*(46.815+RC[-10]*(0.00059-RC[-10]*0.001813))))/60)/60 -> 23.437040836126062 | R112: =RC[-1]+0.00256*COS(RADIANS(125.04-1934.136*RC[-11])) -> 23.434815980524178 | S112: =DEGREES(ATAN2(COS(RADIANS(RC[-3])),COS(RADIANS(RC[-1]))*SIN(RADIANS(RC[-3])))) -> 29.76843585628944 | T112: =DEGREES(ASIN(SIN(RADIANS(RC[-2]))*SIN(RADIANS(RC[-4])))) -> 12.145447091664343 | U112: =TAN(RADIANS(RC[-3]/2))*TAN(RADIANS(RC[-3]/2)) -> 4.3017630929525104E-2 | V112: =4*DEGREES(RC[-1]*SIN(2*RADIANS(RC[-13]))-2*RC[-11]*SIN(RADIANS(RC[-12]))+4*RC[-11]*RC[-1]*SIN(RADIANS(RC[-12]))*COS(2*RADIANS(RC[-13]))-0.5*RC[-1]*RC[-1]*SIN(4*RADIANS(RC[-13]))-1.25*RC[-11]*RC[-11]*SIN(2*RADIANS(RC[-12]))) -> 1.4093025798490249 | W112: =DEGREES(ACOS(COS(RADIANS(90.833))/(COS(RADIANS(R2C2))*COS(RADIANS(RC[-3])))-TAN(RADIANS(R2C2))*TAN(RADIANS(RC[-3])))) -> 129.40275719217712 | X112: =(720-4*R3C2-RC[-2]+R4C2*60)/1440 -> 1899-12-31T13:54:35.442 | Y112: =(RC[-1]*1440-RC[-2]*4)/1440 -> 1899-12-31T05:16:58.780 | Z112: =(RC[-2]*1440+RC[-3]*4)/1440 -> 1899-12-31T22:32:12.104 | AA112: =8*RC[-4] -> 1035.222057537417 | AB112: =MOD(RC[-23]*1440+RC[-6]+4*R3C2-60*R4C2,1440) -> 725.40930257984905 | AC112: =IF(RC[-1]/4<0,RC[-1]/4+180,RC[-1]/4-180) -> 1.3523256449622636 | AD112: =DEGREES(ACOS(SIN(RADIANS(R2C2))*SIN(RADIANS(RC[-10]))+COS(RADIANS(R2C2))*COS(RADIANS(RC[-10]))*COS(RADIANS(RC[-1])))) -> 57.860854719904644 | AE112: =90-RC[-1] -> 32.139145280095356 | AF112: =IF(RC[-1]>85,0,IF(RC[-1]>5,58.1/TAN(RADIANS(RC[-1]))-0.07/POWER(TAN(RADIANS(RC[-1])),3)+0.000086/POWER(TAN(RADIANS(RC[-1])),5),IF(RC[-1]>-0.575,1735+RC[-1]*(-518.2+RC[-1]*(103.4+RC[-1]*(-12.79+RC[-1]*0.711))),-20.772/TAN(RADIANS(RC[-1])))))/3600 -> 2.5610418415793732E-2 | AG112: =RC[-2]+RC[-1] -> 32.164755698511151 | AH112: =IF(RC[-5]>0,MOD(DEGREES(ACOS(((SIN(RADIANS(R2C2))*COS(RADIANS(RC[-4])))-SIN(RADIANS(RC[-14])))/(COS(RADIANS(R2C2))*SIN(RADIANS(RC[-4])))))+180,360),MOD(540-DEGREES(ACOS(((SIN(RADIANS(R2C2))*COS(RADIANS(RC[-4])))-SIN(RADIANS(RC[-14])))/(COS(RADIANS(R2C2))*SIN(RADIANS(RC[-4]))))),360)) -> 181.56136218936655
D113: =R[-1]C+1 -> 2017-04-22T00:00:00.000 | E113: =R5C2 -> 1899-12-31T14:00:00.000 | F113: =RC[-2]+2415018.5+RC[-1]-R4C2/24 -> 2457866.375 | G113: =(RC[-1]-2451545)/36525 -> 0.17306981519507186 | I113: =MOD(280.46646+RC[-2]*(36000.76983 + RC[-2]*0.0003032),360) -> 31.113050440216284 | J113: =357.52911+RC[-3]*(35999.05029 - 0.0001537*RC[-3]) -> 6587.8780862845979 | K113: =0.016708634-RC[-4]*(0.000042037+0.0000001267*RC[-4]) -> 1.6701354869113155E-2 | L113: =SIN(RADIANS(RC[-2]))*(1.914602-RC[-5]*(0.004817+0.000014*RC[-5]))+SIN(RADIANS(2*RC[-2]))*(0.019993-0.000101*RC[-5])+SIN(RADIANS(3*RC[-2]))*0.000289 -> 1.8095118680431792 | M113: =RC[-4]+RC[-1] -> 32.922562308259465 | N113: =RC[-4]+RC[-2] -> 6589.6875981526409 | O113: =(1.000001018*(1-RC[-4]*RC[-4]))/(1+RC[-4]*COS(RADIANS(RC[-1]))) -> 1.0053788909595611 | P113: =RC[-3]-0.00569-0.00478*SIN(RADIANS(125.04-1934.136*RC[-9])) -> 32.914503975236947 | Q113: =23+(26+((21.448-RC[-10]*(46.815+RC[-10]*(0.00059-RC[-10]*0.001813))))/60)/60 -> 23.437040480091071 | R113: =RC[-1]+0.00256*COS(RADIANS(125.04-1934.136*RC[-11])) -> 23.434816795812925 | S113: =DEGREES(ATAN2(COS(RADIANS(RC[-3])),COS(RADIANS(RC[-1]))*SIN(RADIANS(RC[-3])))) -> 30.705880642071563 | T113: =DEGREES(ASIN(SIN(RADIANS(RC[-2]))*SIN(RADIANS(RC[-4])))) -> 12.480538914654995 | U113: =TAN(RADIANS(RC[-3]/2))*TAN(RADIANS(RC[-3]/2)) -> 4.3017634007773906E-2 | V113: =4*DEGREES(RC[-1]*SIN(2*RADIANS(RC[-13]))-2*RC[-11]*SIN(RADIANS(RC[-12]))+4*RC[-11]*RC[-1]*SIN(RADIANS(RC[-12]))*COS(2*RADIANS(RC[-13]))-0.5*RC[-1]*RC[-1]*SIN(4*RADIANS(RC[-13]))-1.25*RC[-11]*RC[-11]*SIN(2*RADIANS(RC[-12]))) -> 1.6013523801582334 | W113: =DEGREES(ACOS(COS(RADIANS(90.833))/(COS(RADIANS(R2C2))*COS(RADIANS(RC[-3])))-TAN(RADIANS(R2C2))*TAN(RADIANS(RC[-3])))) -> 130.66667540906673 | X113: =(720-4*R3C2-RC[-2]+R4C2*60)/1440 -> 1899-12-31T13:54:23.919 | Y113: =(RC[-1]*1440-RC[-2]*4)/1440 -> 1899-12-31T05:11:43.917 | Z113: =(RC[-2]*1440+RC[-3]*4)/1440 -> 1899-12-31T22:37:03.921 | AA113: =8*RC[-4] -> 1045.3334032725338 | AB113: =MOD(RC[-23]*1440+RC[-6]+4*R3C2-60*R4C2,1440) -> 725.60135238015823 | AC113: =IF(RC[-1]/4<0,RC[-1]/4+180,RC[-1]/4-180) -> 1.4003380950395581 | AD113: =DEGREES(ACOS(SIN(RADIANS(R2C2))*SIN(RADIANS(RC[-10]))+COS(RADIANS(R2C2))*COS(RADIANS(RC[-10]))*COS(RADIANS(RC[-1])))) -> 57.526234660619899 | AE113: =90-RC[-1] -> 32.473765339380101 | AF113: =IF(RC[-1]>85,0,IF(RC[-1]>5,58.1/TAN(RADIANS(RC[-1]))-0.07/POWER(TAN(RADIANS(RC[-1])),3)+0.000086/POWER(TAN(RADIANS(RC[-1])),5),IF(RC[-1]>-0.575,1735+RC[-1]*(-518.2+RC[-1]*(103.4+RC[-1]*(-12.79+RC[-1]*0.711))),-20.772/TAN(RADIANS(RC[-1])))))/3600 -> 2.5283394511013069E-2 | AG113: =RC[-2]+RC[-1] -> 32.499048733891115 | AH113: =IF(RC[-5]>0,MOD(DEGREES(ACOS(((SIN(RADIANS(R2C2))*COS(RADIANS(RC[-4])))-SIN(RADIANS(RC[-14])))/(COS(RADIANS(R2C2))*SIN(RADIANS(RC[-4])))))+180,360),MOD(540-DEGREES(ACOS(((SIN(RADIANS(R2C2))*COS(RADIANS(RC[-4])))-SIN(RADIANS(RC[-14])))/(COS(RADIANS(R2C2))*SIN(RADIANS(RC[-4]))))),360)) -> 181.62071242119347
D114: =R[-1]C+1 -> 2017-04-23T00:00:00.000 | E114: =R5C2 -> 1899-12-31T14:00:00.000 | F114: =RC[-2]+2415018.5+RC[-1]-R4C2/24 -> 2457867.375 | G114: =(RC[-1]-2451545)/36525 -> 0.17309719370294319 | I114: =MOD(280.46646+RC[-2]*(36000.76983 + RC[-2]*0.0003032),360) -> 32.098697803254254 | J114: =357.52911+RC[-3]*(35999.05029 - 0.0001537*RC[-3]) -> 6588.863686564865 | K114: =0.016708634-RC[-4]*(0.000042037+0.0000001267*RC[-4]) -> 1.6701353717002015E-2 | L114: =SIN(RADIANS(RC[-2]))*(1.914602-RC[-5]*(0.004817+0.000014*RC[-5]))+SIN(RADIANS(2*RC[-2]))*(0.019993-0.000101*RC[-5])+SIN(RADIANS(3*RC[-2]))*0.000289 -> 1.7985979475249683 | M114: =RC[-4]+RC[-1] -> 33.897295750779222 | N114: =RC[-4]+RC[-2] -> 6590.6622845123902 | O114: =(1.000001018*(1-RC[-4]*RC[-4]))/(1+RC[-4]*COS(RADIANS(RC[-1]))) -> 1.0056485939348072 | P114: =RC[-3]-0.00569-0.00478*SIN(RADIANS(125.04-1934.136*RC[-9])) -> 33.889233581385199 | Q114: =23+(26+((21.448-RC[-10]*(46.815+RC[-10]*(0.00059-RC[-10]*0.001813))))/60)/60 -> 23.437040124056075 | R114: =RC[-1]+0.00256*COS(RADIANS(125.04-1934.136*RC[-11])) -> 23.434817613001091 | S114: =DEGREES(ATAN2(COS(RADIANS(RC[-3])),COS(RADIANS(RC[-1]))*SIN(RADIANS(RC[-3])))) -> 31.645237439639899 | T114: =DEGREES(ASIN(SIN(RADIANS(RC[-2]))*SIN(RADIANS(RC[-4])))) -> 12.812208490212464 | U114: =TAN(RADIANS(RC[-3]/2))*TAN(RADIANS(RC[-3]/2)) -> 4.3017637093194366E-2 | V114: =4*DEGREES(RC[-1]*SIN(2*RADIANS(RC[-13]))-2*RC[-11]*SIN(RADIANS(RC[-12]))+4*RC[-11]*RC[-1]*SIN(RADIANS(RC[-12]))*COS(2*RADIANS(RC[-13]))-0.5*RC[-1]*RC[-1]*SIN(4*RADIANS(RC[-13]))-1.25*RC[-11]*RC[-11]*SIN(2*RADIANS(RC[-12]))) -> 1.7857851012134442 | W114: =DEGREES(ACOS(COS(RADIANS(90.833))/(COS(RADIANS(R2C2))*COS(RADIANS(RC[-3])))-TAN(RADIANS(R2C2))*TAN(RADIANS(RC[-3])))) -> 131.94516550217384 | X114: =(720-4*R3C2-RC[-2]+R4C2*60)/1440 -> 1899-12-31T13:54:12.853 | Y114: =(RC[-1]*1440-RC[-2]*4)/1440 -> 1899-12-31T05:06:26.013 | Z114: =(RC[-2]*1440+RC[-3]*4)/1440 -> 1899-12-31T22:41:59.693 | AA114: =8*RC[-4] -> 1055.5613240173907 | AB114: =MOD(RC[-23]*1440+RC[-6]+4*R3C2-60*R4C2,1440) -> 725.78578510121349 | AC114: =IF(RC[-1]/4<0,RC[-1]/4+180,RC[-1]/4-180) -> 1.4464462753033729 | AD114: =DEGREES(ACOS(SIN(RADIANS(R2C2))*SIN(RADIANS(RC[-10]))+COS(RADIANS(R2C2))*COS(RADIANS(RC[-10]))*COS(RADIANS(RC[-1])))) -> 57.195035878197281 | AE114: =90-RC[-1] -> 32.804964121802719 | AF114: =IF(RC[-1]>85,0,IF(RC[-1]>5,58.1/TAN(RADIANS(RC[-1]))-0.07/POWER(TAN(RADIANS(RC[-1])),3)+0.000086/POWER(TAN(RADIANS(RC[-1])),5),IF(RC[-1]>-0.575,1735+RC[-1]*(-518.2+RC[-1]*(103.4+RC[-1]*(-12.79+RC[-1]*0.711))),-20.772/TAN(RADIANS(RC[-1])))))/3600 -> 2.4965498644016752E-2 | AG114: =RC[-2]+RC[-1] -> 32.829929620446734 | AH114: =IF(RC[-5]>0,MOD(DEGREES(ACOS(((SIN(RADIANS(R2C2))*COS(RADIANS(RC[-4])))-SIN(RADIANS(RC[-14])))/(COS(RADIANS(R2C2))*SIN(RADIANS(RC[-4])))))+180,360),MOD(540-DEGREES(ACOS(((SIN(RADIANS(R2C2))*COS(RADIANS(RC[-4])))-SIN(RADIANS(RC[-14])))/(COS(RADIANS(R2C2))*SIN(RADIANS(RC[-4]))))),360)) -> 181.67811025593721
D115: =R[-1]C+1 -> 2017-04-24T00:00:00.000 | E115: =R5C2 -> 1899-12-31T14:00:00.000 | F115: =RC[-2]+2415018.5+RC[-1]-R4C2/24 -> 2457868.375 | G115: =(RC[-1]-2451545)/36525 -> 0.17312457221081451 | I115: =MOD(280.46646+RC[-2]*(36000.76983 + RC[-2]*0.0003032),360) -> 33.084345166292223 | J115: =357.52911+RC[-3]*(35999.05029 - 0.0001537*RC[-3]) -> 6589.849286845134 | K115: =0.016708634-RC[-4]*(0.000042037+0.0000001267*RC[-4]) -> 1.6701352564890685E-2 | L115: =SIN(RADIANS(RC[-2]))*(1.914602-RC[-5]*(0.004817+0.000014*RC[-5]))+SIN(RADIANS(2*RC[-2]))*(0.019993-0.000101*RC[-5])+SIN(RADIANS(3*RC[-2]))*0.000289 -> 1.787163048649157 | M115: =RC[-4]+RC[-1] -> 34.871508214941379 | N115: =RC[-4]+RC[-2] -> 6591.6364498937828 | O115: =(1.000001018*(1-RC[-4]*RC[-4]))/(1+RC[-4]*COS(RADIANS(RC[-1]))) -> 1.0059165726102866 | P115: =RC[-3]-0.00569-0.00478*SIN(RADIANS(125.04-1934.136*RC[-9])) -> 34.863442211202106 | Q115: =23+(26+((21.448-RC[-10]*(46.815+RC[-10]*(0.00059-RC[-10]*0.001813))))/60)/60 -> 23.437039768021084 | R115: =RC[-1]+0.00256*COS(RADIANS(125.04-1934.136*RC[-11])) -> 23.434818432087678 | S115: =DEGREES(ATAN2(COS(RADIANS(RC[-3])),COS(RADIANS(RC[-1]))*SIN(RADIANS(RC[-3])))) -> 32.586554128247734 | T115: =DEGREES(ASIN(SIN(RADIANS(RC[-2]))*SIN(RADIANS(RC[-4])))) -> 13.140364672741038 | U115: =TAN(RADIANS(RC[-3]/2))*TAN(RADIANS(RC[-3]/2)) -> 4.3017640185782732E-2 | V115: =4*DEGREES(RC[-1]*SIN(2*RADIANS(RC[-13]))-2*RC[-11]*SIN(RADIANS(RC[-12]))+4*RC[-11]*RC[-1]*SIN(RADIANS(RC[-12]))*COS(2*RADIANS(RC[-13]))-0.5*RC[-1]*RC[-1]*SIN(4*RADIANS(RC[-13]))-1.25*RC[-11]*RC[-11]*SIN(2*RADIANS(RC[-12]))) -> 1.9624098581960601 | W115: =DEGREES(ACOS(COS(RADIANS(90.833))/(COS(RADIANS(R2C2))*COS(RADIANS(RC[-3])))-TAN(RADIANS(R2C2))*TAN(RADIANS(RC[-3])))) -> 133.23939647140128 | X115: =(720-4*R3C2-RC[-2]+R4C2*60)/1440 -> 1899-12-31T13:54:02.255 | Y115: =(RC[-1]*1440-RC[-2]*4)/1440 -> 1899-12-31T05:01:04.800 | Z115: =(RC[-2]*1440+RC[-3]*4)/1440 -> 1899-12-31T22:46:59.711 | AA115: =8*RC[-4] -> 1065.9151717712102 | AB115: =MOD(RC[-23]*1440+RC[-6]+4*R3C2-60*R4C2,1440) -> 725.96240985819611 | AC115: =IF(RC[-1]/4<0,RC[-1]/4+180,RC[-1]/4-180) -> 1.4906024645490277 | AD115: =DEGREES(ACOS(SIN(RADIANS(R2C2))*SIN(RADIANS(RC[-10]))+COS(RADIANS(R2C2))*COS(RADIANS(RC[-10]))*COS(RADIANS(RC[-1])))) -> 56.867347157586003 | AE115: =90-RC[-1] -> 33.132652842413997 | AF115: =IF(RC[-1]>85,0,IF(RC[-1]>5,58.1/TAN(RADIANS(RC[-1]))-0.07/POWER(TAN(RADIANS(RC[-1])),3)+0.000086/POWER(TAN(RADIANS(RC[-1])),5),IF(RC[-1]>-0.575,1735+RC[-1]*(-518.2+RC[-1]*(103.4+RC[-1]*(-12.79+RC[-1]*0.711))),-20.772/TAN(RADIANS(RC[-1])))))/3600 -> 2.4656466202834699E-2 | AG115: =RC[-2]+RC[-1] -> 33.157309308616831 | AH115: =IF(RC[-5]>0,MOD(DEGREES(ACOS(((SIN(RADIANS(R2C2))*COS(RADIANS(RC[-4])))-SIN(RADIANS(RC[-14])))/(COS(RADIANS(R2C2))*SIN(RADIANS(RC[-4])))))+180,360),MOD(540-DEGREES(ACOS(((SIN(RADIANS(R2C2))*COS(RADIANS(RC[-4])))-SIN(RADIANS(RC[-14])))/(COS(RADIANS(R2C2))*SIN(RADIANS(RC[-4]))))),360)) -> 181.73348168596368
D116: =R[-1]C+1 -> 2017-04-25T00:00:00.000 | E116: =R5C2 -> 1899-12-31T14:00:00.000 | F116: =RC[-2]+2415018.5+RC[-1]-R4C2/24 -> 2457869.375 | G116: =(RC[-1]-2451545)/36525 -> 0.17315195071868583 | I116: =MOD(280.46646+RC[-2]*(36000.76983 + RC[-2]*0.0003032),360) -> 34.069992529332012 | J116: =357.52911+RC[-3]*(35999.05029 - 0.0001537*RC[-3]) -> 6590.834887125402 | K116: =0.016708634-RC[-4]*(0.000042037+0.0000001267*RC[-4]) -> 1.6701351412779168E-2 | L116: =SIN(RADIANS(RC[-2]))*(1.914602-RC[-5]*(0.004817+0.000014*RC[-5]))+SIN(RADIANS(2*RC[-2]))*(0.019993-0.000101*RC[-5])+SIN(RADIANS(3*RC[-2]))*0.000289 -> 1.7752110010762572 | M116: =RC[-4]+RC[-1] -> 35.84520353040827 | N116: =RC[-4]+RC[-2] -> 6592.6100981264781 | O116: =(1.000001018*(1-RC[-4]*RC[-4]))/(1+RC[-4]*COS(RADIANS(RC[-1]))) -> 1.0061827504593805 | P116: =RC[-3]-0.00569-0.00478*SIN(RADIANS(125.04-1934.136*RC[-9])) -> 35.837133694353277 | Q116: =23+(26+((21.448-RC[-10]*(46.815+RC[-10]*(0.00059-RC[-10]*0.001813))))/60)/60 -> 23.437039411986088 | R116: =RC[-1]+0.00256*COS(RADIANS(125.04-1934.136*RC[-11])) -> 23.43481925307168 | S116: =DEGREES(ATAN2(COS(RADIANS(RC[-3])),COS(RADIANS(RC[-1]))*SIN(RADIANS(RC[-3])))) -> 33.529876401113647 | T116: =DEGREES(ASIN(SIN(RADIANS(RC[-2]))*SIN(RADIANS(RC[-4])))) -> 13.464916656521883 | U116: =TAN(RADIANS(RC[-3]/2))*TAN(RADIANS(RC[-3]/2)) -> 4.3017643285535208E-2 | V116: =4*DEGREES(RC[-1]*SIN(2*RADIANS(RC[-13]))-2*RC[-11]*SIN(RADIANS(RC[-12]))+4*RC[-11]*RC[-1]*SIN(RADIANS(RC[-12]))*COS(2*RADIANS(RC[-13]))-0.5*RC[-1]*RC[-1]*SIN(4*RADIANS(RC[-13]))-1.25*RC[-11]*RC[-11]*SIN(2*RADIANS(RC[-12]))) -> 2.1310442145875976 | W116: =DEGREES(ACOS(COS(RADIANS(90.833))/(COS(RADIANS(R2C2))*COS(RADIANS(RC[-3])))-TAN(RADIANS(R2C2))*TAN(RADIANS(RC[-3])))) -> 134.55067705660667 | X116: =(720-4*R3C2-RC[-2]+R4C2*60)/1440 -> 1899-12-31T13:53:52.137 | Y116: =(RC[-1]*1440-RC[-2]*4)/1440 -> 1899-12-31T04:55:39.975 | Z116: =(RC[-2]*1440+RC[-3]*4)/1440 -> 1899-12-31T22:52:04.300 | AA116: =8*RC[-4] -> 1076.4054164528534 | AB116: =MOD(RC[-23]*1440+RC[-6]+4*R3C2-60*R4C2,1440) -> 726.13104421458763 | AC116: =IF(RC[-1]/4<0,RC[-1]/4+180,RC[-1]/4-180) -> 1.5327610536469081 | AD116: =DEGREES(ACOS(SIN(RADIANS(R2C2))*SIN(RADIANS(RC[-10]))+COS(RADIANS(R2C2))*COS(RADIANS(RC[-10]))*COS(RADIANS(RC[-1])))) -> 56.543256962331895 | AE116: =90-RC[-1] -> 33.456743037668105 | AF116: =IF(RC[-1]>85,0,IF(RC[-1]>5,58.1/TAN(RADIANS(RC[-1]))-0.07/POWER(TAN(RADIANS(RC[-1])),3)+0.000086/POWER(TAN(RADIANS(RC[-1])),5),IF(RC[-1]>-0.575,1735+RC[-1]*(-518.2+RC[-1]*(103.4+RC[-1]*(-12.79+RC[-1]*0.711))),-20.772/TAN(RADIANS(RC[-1])))))/3600 -> 2.4356045330036394E-2 | AG116: =RC[-2]+RC[-1] -> 33.481099082998142 | AH116: =IF(RC[-5]>0,MOD(DEGREES(ACOS(((SIN(RADIANS(R2C2))*COS(RADIANS(RC[-4])))-SIN(RADIANS(RC[-14])))/(COS(RADIANS(R2C2))*SIN(RADIANS(RC[-4])))))+180,360),MOD(540-DEGREES(ACOS(((SIN(RADIANS(R2C2))*COS(RADIANS(RC[-4])))-SIN(RADIANS(RC[-14])))/(COS(RADIANS(R2C2))*SIN(RADIANS(RC[-4]))))),360)) -> 181.78675451736316
D117: =R[-1]C+1 -> 2017-04-26T00:00:00.000 | E117: =R5C2 -> 1899-12-31T14:00:00.000 | F117: =RC[-2]+2415018.5+RC[-1]-R4C2/24 -> 2457870.375 | G117: =(RC[-1]-2451545)/36525 -> 0.17317932922655715 | I117: =MOD(280.46646+RC[-2]*(36000.76983 + RC[-2]*0.0003032),360) -> 35.055639892370891 | J117: =357.52911+RC[-3]*(35999.05029 - 0.0001537*RC[-3]) -> 6591.8204874056692 | K117: =0.016708634-RC[-4]*(0.000042037+0.0000001267*RC[-4]) -> 1.6701350260667457E-2 | L117: =SIN(RADIANS(RC[-2]))*(1.914602-RC[-5]*(0.004817+0.000014*RC[-5]))+SIN(RADIANS(2*RC[-2]))*(0.019993-0.000101*RC[-5])+SIN(RADIANS(3*RC[-2]))*0.000289 -> 1.7627457731637961 | M117: =RC[-4]+RC[-1] -> 36.818385665534684 | N117: =RC[-4]+RC[-2] -> 6593.5832331788333 | O117: =(1.000001018*(1-RC[-4]*RC[-4]))/(1+RC[-4]*COS(RADIANS(RC[-1]))) -> 1.0064470515914465 | P117: =RC[-3]-0.00569-0.00478*SIN(RADIANS(125.04-1934.136*RC[-9])) -> 36.81031199919677 | Q117: =23+(26+((21.448-RC[-10]*(46.815+RC[-10]*(0.00059-RC[-10]*0.001813))))/60)/60 -> 23.437039055951097 | R117: =RC[-1]+0.00256*COS(RADIANS(125.04-1934.136*RC[-11])) -> 23.434820075952093 | S117: =DEGREES(ATAN2(COS(RADIANS(RC[-3])),COS(RADIANS(RC[-1]))*SIN(RADIANS(RC[-3])))) -> 34.475247697139963 | T117: =DEGREES(ASIN(SIN(RADIANS(RC[-2]))*SIN(RADIANS(RC[-4])))) -> 13.785773995627258 | U117: =TAN(RADIANS(RC[-3]/2))*TAN(RADIANS(RC[-3]/2)) -> 4.3017646392447997E-2 | V117: =4*DEGREES(RC[-1]*SIN(2*RADIANS(RC[-13]))-2*RC[-11]*SIN(RADIANS(RC[-12]))+4*RC[-11]*RC[-1]*SIN(RADIANS(RC[-12]))*COS(2*RADIANS(RC[-13]))-0.5*RC[-1]*RC[-1]*SIN(4*RADIANS(RC[-13]))-1.25*RC[-11]*RC[-11]*SIN(2*RADIANS(RC[-12]))) -> 2.2915144798220179 | W117: =DEGREES(ACOS(COS(RADIANS(90.833))/(COS(RADIANS(R2C2))*COS(RADIANS(RC[-3])))-TAN(RADIANS(R2C2))*TAN(RADIANS(RC[-3])))) -> 135.88048132365876 | X117: =(720-4*R3C2-RC[-2]+R4C2*60)/1440 -> 1899-12-31T13:53:42.509 | Y117: =(RC[-1]*1440-RC[-2]*4)/1440 -> 1899-12-31T04:50:11.194 | Z117: =(RC[-2]*1440+RC[-3]*4)/1440 -> 1899-12-31T22:57:13.825 | AA117: =8*RC[-4] -> 1087.0438505892701 | AB117: =MOD(RC[-23]*1440+RC[-6]+4*R3C2-60*R4C2,1440) -> 726.29151447982201 | AC117: =IF(RC[-1]/4<0,RC[-1]/4+180,RC[-1]/4-180) -> 1.5728786199555032 | AD117: =DEGREES(ACOS(SIN(RADIANS(R2C2))*SIN(RADIANS(RC[-10]))+COS(RADIANS(R2C2))*COS(RADIANS(RC[-10]))*COS(RADIANS(RC[-1])))) -> 56.222853425694908 | AE117: =90-RC[-1] -> 33.777146574305092 | AF117: =IF(RC[-1]>85,0,IF(RC[-1]>5,58.1/TAN(RADIANS(RC[-1]))-0.07/POWER(TAN(RADIANS(RC[-1])),3)+0.000086/POWER(TAN(RADIANS(RC[-1])),5),IF(RC[-1]>-0.575,1735+RC[-1]*(-518.2+RC[-1]*(103.4+RC[-1]*(-12.79+RC[-1]*0.711))),-20.772/TAN(RADIANS(RC[-1])))))/3600 -> 2.4063996270451561E-2 | AG117: =RC[-2]+RC[-1] -> 33.801210570575542 | AH117: =IF(RC[-5]>0,MOD(DEGREES(ACOS(((SIN(RADIANS(R2C2))*COS(RADIANS(RC[-4])))-SIN(RADIANS(RC[-14])))/(COS(RADIANS(R2C2))*SIN(RADIANS(RC[-4])))))+180,360),MOD(540-DEGREES(ACOS(((SIN(RADIANS(R2C2))*COS(RADIANS(RC[-4])))-SIN(RADIANS(RC[-14])))/(COS(RADIANS(R2C2))*SIN(RADIANS(RC[-4]))))),360)) -> 181.83785850357859
D118: =R[-1]C+1 -> 2017-04-27T00:00:00.000 | E118: =R5C2 -> 1899-12-31T14:00:00.000 | F118: =RC[-2]+2415018.5+RC[-1]-R4C2/24 -> 2457871.375 | G118: =(RC[-1]-2451545)/36525 -> 0.17320670773442848 | I118: =MOD(280.46646+RC[-2]*(36000.76983 + RC[-2]*0.0003032),360) -> 36.04128725541068 | J118: =357.52911+RC[-3]*(35999.05029 - 0.0001537*RC[-3]) -> 6592.8060876859363 | K118: =0.016708634-RC[-4]*(0.000042037+0.0000001267*RC[-4]) -> 1.6701349108555558E-2 | L118: =SIN(RADIANS(RC[-2]))*(1.914602-RC[-5]*(0.004817+0.000014*RC[-5]))+SIN(RADIANS(2*RC[-2]))*(0.019993-0.000101*RC[-5])+SIN(RADIANS(3*RC[-2]))*0.000289 -> 1.7497714703269334 | M118: =RC[-4]+RC[-1] -> 37.791058725737614 | N118: =RC[-4]+RC[-2] -> 6594.5558591562631 | O118: =(1.000001018*(1-RC[-4]*RC[-4]))/(1+RC[-4]*COS(RADIANS(RC[-1]))) -> 1.0067094007707504 | P118: =RC[-3]-0.00569-0.00478*SIN(RADIANS(125.04-1934.136*RC[-9])) -> 37.78298123115286 | Q118: =23+(26+((21.448-RC[-10]*(46.815+RC[-10]*(0.00059-RC[-10]*0.001813))))/60)/60 -> 23.437038699916101 | R118: =RC[-1]+0.00256*COS(RADIANS(125.04-1934.136*RC[-11])) -> 23.434820900727907 | S118: =DEGREES(ATAN2(COS(RADIANS(RC[-3])),COS(RADIANS(RC[-1]))*SIN(RADIANS(RC[-3])))) -> 35.422709132760154 | T118: =DEGREES(ASIN(SIN(RADIANS(RC[-2]))*SIN(RADIANS(RC[-4])))) -> 14.102846625637977 | U118: =TAN(RADIANS(RC[-3]/2))*TAN(RADIANS(RC[-3]/2)) -> 4.3017649506517298E-2 | V118: =4*DEGREES(RC[-1]*SIN(2*RADIANS(RC[-13]))-2*RC[-11]*SIN(RADIANS(RC[-12]))+4*RC[-11]*RC[-1]*SIN(RADIANS(RC[-12]))*COS(2*RADIANS(RC[-13]))-0.5*RC[-1]*RC[-1]*SIN(4*RADIANS(RC[-13]))-1.25*RC[-11]*RC[-11]*SIN(2*RADIANS(RC[-12]))) -> 2.4436560082694574 | W118: =DEGREES(ACOS(COS(RADIANS(90.833))/(COS(RADIANS(R2C2))*COS(RADIANS(RC[-3])))-TAN(RADIANS(R2C2))*TAN(RADIANS(RC[-3])))) -> 137.23048038677962 | X118: =(720-4*R3C2-RC[-2]+R4C2*60)/1440 -> 1899-12-31T13:53:33.381 | Y118: =(RC[-1]*1440-RC[-2]*4)/1440 -> 1899-12-31T04:44:38.065 | Z118: =(RC[-2]*1440+RC[-3]*4)/1440 -> 1899-12-31T23:02:28.696 | AA118: =8*RC[-4] -> 1097.8438430942369 | AB118: =MOD(RC[-23]*1440+RC[-6]+4*R3C2-60*R4C2,1440) -> 726.4436560082695 | AC118: =IF(RC[-1]/4<0,RC[-1]/4+180,RC[-1]/4-180) -> 1.6109140020673749 | AD118: =DEGREES(ACOS(SIN(RADIANS(R2C2))*SIN(RADIANS(RC[-10]))+COS(RADIANS(R2C2))*COS(RADIANS(RC[-10]))*COS(RADIANS(RC[-1])))) -> 55.906224339964368 | AE118: =90-RC[-1] -> 34.093775660035632 | AF118: =IF(RC[-1]>85,0,IF(RC[-1]>5,58.1/TAN(RADIANS(RC[-1]))-0.07/POWER(TAN(RADIANS(RC[-1])),3)+0.000086/POWER(TAN(RADIANS(RC[-1])),5),IF(RC[-1]>-0.575,1735+RC[-1]*(-518.2+RC[-1]*(103.4+RC[-1]*(-12.79+RC[-1]*0.711))),-20.772/TAN(RADIANS(RC[-1])))))/3600 -> 2.3780090758425299E-2 | AG118: =RC[-2]+RC[-1] -> 34.117555750794061 | AH118: =IF(RC[-5]>0,MOD(DEGREES(ACOS(((SIN(RADIANS(R2C2))*COS(RADIANS(RC[-4])))-SIN(RADIANS(RC[-14])))/(COS(RADIANS(R2C2))*SIN(RADIANS(RC[-4])))))+180,360),MOD(540-DEGREES(ACOS(((SIN(RADIANS(R2C2))*COS(RADIANS(RC[-4])))-SIN(RADIANS(RC[-14])))/(COS(RADIANS(R2C2))*SIN(RADIANS(RC[-4]))))),360)) -> 181.88672548213901
D119: =R[-1]C+1 -> 2017-04-28T00:00:00.000 | E119: =R5C2 -> 1899-12-31T14:00:00.000 | F119: =RC[-2]+2415018.5+RC[-1]-R4C2/24 -> 2457872.375 | G119: =(RC[-1]-2451545)/36525 -> 0.1732340862422998 | I119: =MOD(280.46646+RC[-2]*(36000.76983 + RC[-2]*0.0003032),360) -> 37.026934618451378 | J119: =357.52911+RC[-3]*(35999.05029 - 0.0001537*RC[-3]) -> 6593.7916879662043 | K119: =0.016708634-RC[-4]*(0.000042037+0.0000001267*RC[-4]) -> 1.6701347956443471E-2 | L119: =SIN(RADIANS(RC[-2]))*(1.914602-RC[-5]*(0.004817+0.000014*RC[-5]))+SIN(RADIANS(2*RC[-2]))*(0.019993-0.000101*RC[-5])+SIN(RADIANS(3*RC[-2]))*0.000289 -> 1.7362923333771114 | M119: =RC[-4]+RC[-1] -> 38.763226951828486 | N119: =RC[-4]+RC[-2] -> 6595.527980299581 | O119: =(1.000001018*(1-RC[-4]*RC[-4]))/(1+RC[-4]*COS(RADIANS(RC[-1]))) -> 1.0069697234351058 | P119: =RC[-3]-0.00569-0.00478*SIN(RADIANS(125.04-1934.136*RC[-9])) -> 38.755145631036235 | Q119: =23+(26+((21.448-RC[-10]*(46.815+RC[-10]*(0.00059-RC[-10]*0.001813))))/60)/60 -> 23.43703834388111 | R119: =RC[-1]+0.00256*COS(RADIANS(125.04-1934.136*RC[-11])) -> 23.43482172739812 | S119: =DEGREES(ATAN2(COS(RADIANS(RC[-3])),COS(RADIANS(RC[-1]))*SIN(RADIANS(RC[-3])))) -> 36.37229943403193 | T119: =DEGREES(ASIN(SIN(RADIANS(RC[-2]))*SIN(RADIANS(RC[-4])))) -> 14.416044887178776 | U119: =TAN(RADIANS(RC[-3]/2))*TAN(RADIANS(RC[-3]/2)) -> 4.3017652627739301E-2 | V119: =4*DEGREES(RC[-1]*SIN(2*RADIANS(RC[-13]))-2*RC[-11]*SIN(RADIANS(RC[-12]))+4*RC[-11]*RC[-1]*SIN(RADIANS(RC[-12]))*COS(2*RADIANS(RC[-13]))-0.5*RC[-1]*RC[-1]*SIN(4*RADIANS(RC[-13]))-1.25*RC[-11]*RC[-11]*SIN(2*RADIANS(RC[-12]))) -> 2.5873134985663189 | W119: =DEGREES(ACOS(COS(RADIANS(90.833))/(COS(RADIANS(R2C2))*COS(RADIANS(RC[-3])))-TAN(RADIANS(R2C2))*TAN(RADIANS(RC[-3])))) -> 138.60258214729512 | X119: =(720-4*R3C2-RC[-2]+R4C2*60)/1440 -> 1899-12-31T13:53:24.761 | Y119: =(RC[-1]*1440-RC[-2]*4)/1440 -> 1899-12-31T04:39:00.141 | Z119: =(RC[-2]*1440+RC[-3]*4)/1440 -> 1899-12-31T23:07:49.381 | AA119: =8*RC[-4] -> 1108.820657178361 | AB119: =MOD(RC[-23]*1440+RC[-6]+4*R3C2-60*R4C2,1440) -> 726.58731349856635 | AC119: =IF(RC[-1]/4<0,RC[-1]/4+180,RC[-1]/4-180) -> 1.6468283746415864 | AD119: =DEGREES(ACOS(SIN(RADIANS(R2C2))*SIN(RADIANS(RC[-10]))+COS(RADIANS(R2C2))*COS(RADIANS(RC[-10]))*COS(RADIANS(RC[-1])))) -> 55.593457143905212 | AE119: =90-RC[-1] -> 34.406542856094788 | AF119: =IF(RC[-1]>85,0,IF(RC[-1]>5,58.1/TAN(RADIANS(RC[-1]))-0.07/POWER(TAN(RADIANS(RC[-1])),3)+0.000086/POWER(TAN(RADIANS(RC[-1])),5),IF(RC[-1]>-0.575,1735+RC[-1]*(-518.2+RC[-1]*(103.4+RC[-1]*(-12.79+RC[-1]*0.711))),-20.772/TAN(RADIANS(RC[-1])))))/3600 -> 2.3504111441840975E-2 | AG119: =RC[-2]+RC[-1] -> 34.430046967536626 | AH119: =IF(RC[-5]>0,MOD(DEGREES(ACOS(((SIN(RADIANS(R2C2))*COS(RADIANS(RC[-4])))-SIN(RADIANS(RC[-14])))/(COS(RADIANS(R2C2))*SIN(RADIANS(RC[-4])))))+180,360),MOD(540-DEGREES(ACOS(((SIN(RADIANS(R2C2))*COS(RADIANS(RC[-4])))-SIN(RADIANS(RC[-14])))/(COS(RADIANS(R2C2))*SIN(RADIANS(RC[-4]))))),360)) -> 181.93328951427242
D120: =R[-1]C+1 -> 2017-04-29T00:00:00.000 | E120: =R5C2 -> 1899-12-31T14:00:00.000 | F120: =RC[-2]+2415018.5+RC[-1]-R4C2/24 -> 2457873.375 | G120: =(RC[-1]-2451545)/36525 -> 0.17326146475017112 | I120: =MOD(280.46646+RC[-2]*(36000.76983 + RC[-2]*0.0003032),360) -> 38.012581981492076 | J120: =357.52911+RC[-3]*(35999.05029 - 0.0001537*RC[-3]) -> 6594.7772882464697 | K120: =0.016708634-RC[-4]*(0.000042037+0.0000001267*RC[-4]) -> 1.6701346804331191E-2 | L120: =SIN(RADIANS(RC[-2]))*(1.914602-RC[-5]*(0.004817+0.000014*RC[-5]))+SIN(RADIANS(2*RC[-2]))*(0.019993-0.000101*RC[-5])+SIN(RADIANS(3*RC[-2]))*0.000289 -> 1.7223127368400095 | M120: =RC[-4]+RC[-1] -> 39.734894718332086 | N120: =RC[-4]+RC[-2] -> 6596.4996009833094 | O120: =(1.000001018*(1-RC[-4]*RC[-4]))/(1+RC[-4]*COS(RADIANS(RC[-1]))) -> 1.0072279457142062 | P120: =RC[-3]-0.00569-0.00478*SIN(RADIANS(125.04-1934.136*RC[-9])) -> 39.72680957337495 | Q120: =23+(26+((21.448-RC[-10]*(46.815+RC[-10]*(0.00059-RC[-10]*0.001813))))/60)/60 -> 23.437037987846118 | R120: =RC[-1]+0.00256*COS(RADIANS(125.04-1934.136*RC[-11])) -> 23.434822555961716 | S120: =DEGREES(ATAN2(COS(RADIANS(RC[-3])),COS(RADIANS(RC[-1]))*SIN(RADIANS(RC[-3])))) -> 37.324054869158239 | T120: =DEGREES(ASIN(SIN(RADIANS(RC[-2]))*SIN(RADIANS(RC[-4])))) -> 14.725279551300705 | U120: =TAN(RADIANS(RC[-3]/2))*TAN(RADIANS(RC[-3]/2)) -> 4.3017655756110197E-2 | V120: =4*DEGREES(RC[-1]*SIN(2*RADIANS(RC[-13]))-2*RC[-11]*SIN(RADIANS(RC[-12]))+4*RC[-11]*RC[-1]*SIN(RADIANS(RC[-12]))*COS(2*RADIANS(RC[-13]))-0.5*RC[-1]*RC[-1]*SIN(4*RADIANS(RC[-13]))-1.25*RC[-11]*RC[-11]*SIN(2*RADIANS(RC[-12]))) -> 2.7223412922549106 | W120: =DEGREES(ACOS(COS(RADIANS(90.833))/(COS(RADIANS(R2C2))*COS(RADIANS(RC[-3])))-TAN(RADIANS(R2C2))*TAN(RADIANS(RC[-3])))) -> 139.99898164672081 | X120: =(720-4*R3C2-RC[-2]+R4C2*60)/1440 -> 1899-12-31T13:53:16.660 | Y120: =(RC[-1]*1440-RC[-2]*4)/1440 -> 1899-12-31T04:33:16.904 | Z120: =(RC[-2]*1440+RC[-3]*4)/1440 -> 1899-12-31T23:13:16.415 | AA120: =8*RC[-4] -> 1119.9918531737665 | AB120: =MOD(RC[-23]*1440+RC[-6]+4*R3C2-60*R4C2,1440) -> 726.7223412922549 | AC120: =IF(RC[-1]/4<0,RC[-1]/4+180,RC[-1]/4-180) -> 1.680585323063724 | AD120: =DEGREES(ACOS(SIN(RADIANS(R2C2))*SIN(RADIANS(RC[-10]))+COS(RADIANS(R2C2))*COS(RADIANS(RC[-10]))*COS(RADIANS(RC[-1])))) -> 55.284638908251182 | AE120: =90-RC[-1] -> 34.715361091748818 | AF120: =IF(RC[-1]>85,0,IF(RC[-1]>5,58.1/TAN(RADIANS(RC[-1]))-0.07/POWER(TAN(RADIANS(RC[-1])),3)+0.000086/POWER(TAN(RADIANS(RC[-1])),5),IF(RC[-1]>-0.575,1735+RC[-1]*(-518.2+RC[-1]*(103.4+RC[-1]*(-12.79+RC[-1]*0.711))),-20.772/TAN(RADIANS(RC[-1])))))/3600 -> 2.3235851340340473E-2 | AG120: =RC[-2]+RC[-1] -> 34.738596943089156 | AH120: =IF(RC[-5]>0,MOD(DEGREES(ACOS(((SIN(RADIANS(R2C2))*COS(RADIANS(RC[-4])))-SIN(RADIANS(RC[-14])))/(COS(RADIANS(R2C2))*SIN(RADIANS(RC[-4])))))+180,360),MOD(540-DEGREES(ACOS(((SIN(RADIANS(R2C2))*COS(RADIANS(RC[-4])))-SIN(RADIANS(RC[-14])))/(COS(RADIANS(R2C2))*SIN(RADIANS(RC[-4]))))),360)) -> 181.9774870270175
D121: =R[-1]C+1 -> 2017-04-30T00:00:00.000 | E121: =R5C2 -> 1899-12-31T14:00:00.000 | F121: =RC[-2]+2415018.5+RC[-1]-R4C2/24 -> 2457874.375 | G121: =(RC[-1]-2451545)/36525 -> 0.17328884325804245 | I121: =MOD(280.46646+RC[-2]*(36000.76983 + RC[-2]*0.0003032),360) -> 38.998229344531865 | J121: =357.52911+RC[-3]*(35999.05029 - 0.0001537*RC[-3]) -> 6595.7628885267368 | K121: =0.016708634-RC[-4]*(0.000042037+0.0000001267*RC[-4]) -> 1.6701345652218723E-2 | L121: =SIN(RADIANS(RC[-2]))*(1.914602-RC[-5]*(0.004817+0.000014*RC[-5]))+SIN(RADIANS(2*RC[-2]))*(0.019993-0.000101*RC[-5])+SIN(RADIANS(3*RC[-2]))*0.000289 -> 1.7078371872530842 | M121: =RC[-4]+RC[-1] -> 40.706066531784948 | N121: =RC[-4]+RC[-2] -> 6597.4707257139899 | O121: =(1.000001018*(1-RC[-4]*RC[-4]))/(1+RC[-4]*COS(RADIANS(RC[-1]))) -> 1.0074839944476708 | P121: =RC[-3]-0.00569-0.00478*SIN(RADIANS(125.04-1934.136*RC[-9])) -> 40.697977564708808 | Q121: =23+(26+((21.448-RC[-10]*(46.815+RC[-10]*(0.00059-RC[-10]*0.001813))))/60)/60 -> 23.437037631811126 | R121: =RC[-1]+0.00256*COS(RADIANS(125.04-1934.136*RC[-11])) -> 23.434823386417687 | S121: =DEGREES(ATAN2(COS(RADIANS(RC[-3])),COS(RADIANS(RC[-1]))*SIN(RADIANS(RC[-3])))) -> 38.278009181599536 | T121: =DEGREES(ASIN(SIN(RADIANS(RC[-2]))*SIN(RADIANS(RC[-4])))) -> 15.030461846724522 | U121: =TAN(RADIANS(RC[-3]/2))*TAN(RADIANS(RC[-3]/2)) -> 4.3017658891626176E-2 | V121: =4*DEGREES(RC[-1]*SIN(2*RADIANS(RC[-13]))-2*RC[-11]*SIN(RADIANS(RC[-12]))+4*RC[-11]*RC[-1]*SIN(RADIANS(RC[-12]))*COS(2*RADIANS(RC[-13]))-0.5*RC[-1]*RC[-1]*SIN(4*RADIANS(RC[-13]))-1.25*RC[-11]*RC[-11]*SIN(2*RADIANS(RC[-12]))) -> 2.8486036706454114 | W121: =DEGREES(ACOS(COS(RADIANS(90.833))/(COS(RADIANS(R2C2))*COS(RADIANS(RC[-3])))-TAN(RADIANS(R2C2))*TAN(RADIANS(RC[-3])))) -> 141.42222568495663 | X121: =(720-4*R3C2-RC[-2]+R4C2*60)/1440 -> 1899-12-31T13:53:09.084 | Y121: =(RC[-1]*1440-RC[-2]*4)/1440 -> 1899-12-31T04:27:27.750 | Z121: =(RC[-2]*1440+RC[-3]*4)/1440 -> 1899-12-31T23:18:50.418 | AA121: =8*RC[-4] -> 1131.377805479653 | AB121: =MOD(RC[-23]*1440+RC[-6]+4*R3C2-60*R4C2,1440) -> 726.84860367064539 | AC121: =IF(RC[-1]/4<0,RC[-1]/4+180,RC[-1]/4-180) -> 1.7121509176613472 | AD121: =DEGREES(ACOS(SIN(RADIANS(R2C2))*SIN(RADIANS(RC[-10]))+COS(RADIANS(R2C2))*COS(RADIANS(RC[-10]))*COS(RADIANS(RC[-1])))) -> 54.979856319174871 | AE121: =90-RC[-1] -> 35.020143680825129 | AF121: =IF(RC[-1]>85,0,IF(RC[-1]>5,58.1/TAN(RADIANS(RC[-1]))-0.07/POWER(TAN(RADIANS(RC[-1])),3)+0.000086/POWER(TAN(RADIANS(RC[-1])),5),IF(RC[-1]>-0.575,1735+RC[-1]*(-518.2+RC[-1]*(103.4+RC[-1]*(-12.79+RC[-1]*0.711))),-20.772/TAN(RADIANS(RC[-1])))))/3600 -> 2.2975113335378043E-2 | AG121: =RC[-2]+RC[-1] -> 35.043118794160506 | AH121: =IF(RC[-5]>0,MOD(DEGREES(ACOS(((SIN(RADIANS(R2C2))*COS(RADIANS(RC[-4])))-SIN(RADIANS(RC[-14])))/(COS(RADIANS(R2C2))*SIN(RADIANS(RC[-4])))))+180,360),MOD(540-DEGREES(ACOS(((SIN(RADIANS(R2C2))*COS(RADIANS(RC[-4])))-SIN(RADIANS(RC[-14])))/(COS(RADIANS(R2C2))*SIN(RADIANS(RC[-4]))))),360)) -> 182.019256957512
D122: =R[-1]C+1 -> 2017-05-01T00:00:00.000 | E122: =R5C2 -> 1899-12-31T14:00:00.000 | F122: =RC[-2]+2415018.5+RC[-1]-R4C2/24 -> 2457875.375 | G122: =(RC[-1]-2451545)/36525 -> 0.17331622176591377 | I122: =MOD(280.46646+RC[-2]*(36000.76983 + RC[-2]*0.0003032),360) -> 39.983876707573472 | J122: =357.52911+RC[-3]*(35999.05029 - 0.0001537*RC[-3]) -> 6596.748488807003 | K122: =0.016708634-RC[-4]*(0.000042037+0.0000001267*RC[-4]) -> 1.6701344500106064E-2 | L122: =SIN(RADIANS(RC[-2]))*(1.914602-RC[-5]*(0.004817+0.000014*RC[-5]))+SIN(RADIANS(2*RC[-2]))*(0.019993-0.000101*RC[-5])+SIN(RADIANS(3*RC[-2]))*0.000289 -> 1.6928703214444085 | M122: =RC[-4]+RC[-1] -> 41.676747029017882 | N122: =RC[-4]+RC[-2] -> 6598.4413591284474 | O122: =(1.000001018*(1-RC[-4]*RC[-4]))/(1+RC[-4]*COS(RADIANS(RC[-1]))) -> 1.0077377972027801 | P122: =RC[-3]-0.00569-0.00478*SIN(RADIANS(125.04-1934.136*RC[-9])) -> 41.668654241871877 | Q122: =23+(26+((21.448-RC[-10]*(46.815+RC[-10]*(0.00059-RC[-10]*0.001813))))/60)/60 -> 23.437037275776131 | R122: =RC[-1]+0.00256*COS(RADIANS(125.04-1934.136*RC[-11])) -> 23.434824218765012 | S122: =DEGREES(ATAN2(COS(RADIANS(RC[-3])),COS(RADIANS(RC[-1]))*SIN(RADIANS(RC[-3])))) -> 39.23419352396423 | T122: =DEGREES(ASIN(SIN(RADIANS(RC[-2]))*SIN(RADIANS(RC[-4])))) -> 15.331503488958706 | U122: =TAN(RADIANS(RC[-3]/2))*TAN(RADIANS(RC[-3]/2)) -> 4.301766203428338E-2 | V122: =4*DEGREES(RC[-1]*SIN(2*RADIANS(RC[-13]))-2*RC[-11]*SIN(RADIANS(RC[-12]))+4*RC[-11]*RC[-1]*SIN(RADIANS(RC[-12]))*COS(2*RADIANS(RC[-13]))-0.5*RC[-1]*RC[-1]*SIN(4*RADIANS(RC[-13]))-1.25*RC[-11]*RC[-11]*SIN(2*RADIANS(RC[-12]))) -> 2.9659751487631372 | W122: =DEGREES(ACOS(COS(RADIANS(90.833))/(COS(RADIANS(R2C2))*COS(RADIANS(RC[-3])))-TAN(RADIANS(R2C2))*TAN(RADIANS(RC[-3])))) -> 142.87529693136332 | X122: =(720-4*R3C2-RC[-2]+R4C2*60)/1440 -> 1899-12-31T13:53:02.041 | Y122: =(RC[-1]*1440-RC[-2]*4)/1440 -> 1899-12-31T04:21:31.970 | Z122: =(RC[-2]*1440+RC[-3]*4)/1440 -> 1899-12-31T23:24:32.113 | AA122: =8*RC[-4] -> 1143.0023754509066 | AB122: =MOD(RC[-23]*1440+RC[-6]+4*R3C2-60*R4C2,1440) -> 726.96597514876316 | AC122: =IF(RC[-1]/4<0,RC[-1]/4+180,RC[-1]/4-180) -> 1.741493787190791 | AD122: =DEGREES(ACOS(SIN(RADIANS(R2C2))*SIN(RADIANS(RC[-10]))+COS(RADIANS(R2C2))*COS(RADIANS(RC[-10]))*COS(RADIANS(RC[-1])))) -> 54.679195659662589 | AE122: =90-RC[-1] -> 35.320804340337411 | AF122: =IF(RC[-1]>85,0,IF(RC[-1]>5,58.1/TAN(RADIANS(RC[-1]))-0.07/POWER(TAN(RADIANS(RC[-1])),3)+0.000086/POWER(TAN(RADIANS(RC[-1])),5),IF(RC[-1]>-0.575,1735+RC[-1]*(-518.2+RC[-1]*(103.4+RC[-1]*(-12.79+RC[-1]*0.711))),-20.772/TAN(RADIANS(RC[-1])))))/3600 -> 2.2721709689918723E-2 | AG122: =RC[-2]+RC[-1] -> 35.343526050027329 | AH122: =IF(RC[-5]>0,MOD(DEGREES(ACOS(((SIN(RADIANS(R2C2))*COS(RADIANS(RC[-4])))-SIN(RADIANS(RC[-14])))/(COS(RADIANS(R2C2))*SIN(RADIANS(RC[-4])))))+180,360),MOD(540-DEGREES(ACOS(((SIN(RADIANS(R2C2))*COS(RADIANS(RC[-4])))-SIN(RADIANS(RC[-14])))/(COS(RADIANS(R2C2))*SIN(RADIANS(RC[-4]))))),360)) -> 182.05854089903798
D123: =R[-1]C+1 -> 2017-05-02T00:00:00.000 | E123: =R5C2 -> 1899-12-31T14:00:00.000 | F123: =RC[-2]+2415018.5+RC[-1]-R4C2/24 -> 2457876.375 | G123: =(RC[-1]-2451545)/36525 -> 0.17334360027378509 | I123: =MOD(280.46646+RC[-2]*(36000.76983 + RC[-2]*0.0003032),360) -> 40.969524070615989 | J123: =357.52911+RC[-3]*(35999.05029 - 0.0001537*RC[-3]) -> 6597.7340890872692 | K123: =0.016708634-RC[-4]*(0.000042037+0.0000001267*RC[-4]) -> 1.6701343347993215E-2 | L123: =SIN(RADIANS(RC[-2]))*(1.914602-RC[-5]*(0.004817+0.000014*RC[-5]))+SIN(RADIANS(2*RC[-2]))*(0.019993-0.000101*RC[-5])+SIN(RADIANS(3*RC[-2]))*0.000289 -> 1.677416904792763 | M123: =RC[-4]+RC[-1] -> 42.646940975408754 | N123: =RC[-4]+RC[-2] -> 6599.4115059920623 | O123: =(1.000001018*(1-RC[-4]*RC[-4]))/(1+RC[-4]*COS(RADIANS(RC[-1]))) -> 1.0079892822919185 | P123: =RC[-3]-0.00569-0.00478*SIN(RADIANS(125.04-1934.136*RC[-9])) -> 42.638844370245295 | Q123: =23+(26+((21.448-RC[-10]*(46.815+RC[-10]*(0.00059-RC[-10]*0.001813))))/60)/60 -> 23.437036919741139 | R123: =RC[-1]+0.00256*COS(RADIANS(125.04-1934.136*RC[-11])) -> 23.434825053002687 | S123: =DEGREES(ATAN2(COS(RADIANS(RC[-3])),COS(RADIANS(RC[-1]))*SIN(RADIANS(RC[-3])))) -> 40.192636392857494 | T123: =DEGREES(ASIN(SIN(RADIANS(RC[-2]))*SIN(RADIANS(RC[-4])))) -> 15.628316711294621 | U123: =TAN(RADIANS(RC[-3]/2))*TAN(RADIANS(RC[-3]/2)) -> 4.301766518407802E-2 | V123: =4*DEGREES(RC[-1]*SIN(2*RADIANS(RC[-13]))-2*RC[-11]*SIN(RADIANS(RC[-12]))+4*RC[-11]*RC[-1]*SIN(RADIANS(RC[-12]))*COS(2*RADIANS(RC[-13]))-0.5*RC[-1]*RC[-1]*SIN(4*RADIANS(RC[-13]))-1.25*RC[-11]*RC[-11]*SIN(2*RADIANS(RC[-12]))) -> 3.0743407652101702 | W123: =DEGREES(ACOS(COS(RADIANS(90.833))/(COS(RADIANS(R2C2))*COS(RADIANS(RC[-3])))-TAN(RADIANS(R2C2))*TAN(RADIANS(RC[-3])))) -> 144.36172517390722 | X123: =(720-4*R3C2-RC[-2]+R4C2*60)/1440 -> 1899-12-31T13:52:55.540 | Y123: =(RC[-1]*1440-RC[-2]*4)/1440 -> 1899-12-31T04:15:28.726 | Z123: =(RC[-2]*1440+RC[-3]*4)/1440 -> 1899-12-31T23:30:22.354 | AA123: =8*RC[-4] -> 1154.8938013912577 | AB123: =MOD(RC[-23]*1440+RC[-6]+4*R3C2-60*R4C2,1440) -> 727.0743407652102 | AC123: =IF(RC[-1]/4<0,RC[-1]/4+180,RC[-1]/4-180) -> 1.7685851913025488 | AD123: =DEGREES(ACOS(SIN(RADIANS(R2C2))*SIN(RADIANS(RC[-10]))+COS(RADIANS(R2C2))*COS(RADIANS(RC[-10]))*COS(RADIANS(RC[-1])))) -> 54.382742788732045 | AE123: =90-RC[-1] -> 35.617257211267955 | AF123: =IF(RC[-1]>85,0,IF(RC[-1]>5,58.1/TAN(RADIANS(RC[-1]))-0.07/POWER(TAN(RADIANS(RC[-1])),3)+0.000086/POWER(TAN(RADIANS(RC[-1])),5),IF(RC[-1]>-0.575,1735+RC[-1]*(-518.2+RC[-1]*(103.4+RC[-1]*(-12.79+RC[-1]*0.711))),-20.772/TAN(RADIANS(RC[-1])))))/3600 -> 2.2475461595763271E-2 | AG123: =RC[-2]+RC[-1] -> 35.639732672863715 | AH123: =IF(RC[-5]>0,MOD(DEGREES(ACOS(((SIN(RADIANS(R2C2))*COS(RADIANS(RC[-4])))-SIN(RADIANS(RC[-14])))/(COS(RADIANS(R2C2))*SIN(RADIANS(RC[-4])))))+180,360),MOD(540-DEGREES(ACOS(((SIN(RADIANS(R2C2))*COS(RADIANS(RC[-4])))-SIN(RADIANS(RC[-14])))/(COS(RADIANS(R2C2))*SIN(RADIANS(RC[-4]))))),360)) -> 182.09528324840468
D124: =R[-1]C+1 -> 2017-05-03T00:00:00.000 | E124: =R5C2 -> 1899-12-31T14:00:00.000 | F124: =RC[-2]+2415018.5+RC[-1]-R4C2/24 -> 2457877.375 | G124: =(RC[-1]-2451545)/36525 -> 0.17337097878165639 | I124: =MOD(280.46646+RC[-2]*(36000.76983 + RC[-2]*0.0003032),360) -> 41.955171433657597 | J124: =357.52911+RC[-3]*(35999.05029 - 0.0001537*RC[-3]) -> 6598.7196893675346 | K124: =0.016708634-RC[-4]*(0.000042037+0.0000001267*RC[-4]) -> 1.6701342195880178E-2 | L124: =SIN(RADIANS(RC[-2]))*(1.914602-RC[-5]*(0.004817+0.000014*RC[-5]))+SIN(RADIANS(2*RC[-2]))*(0.019993-0.000101*RC[-5])+SIN(RADIANS(3*RC[-2]))*0.000289 -> 1.6614818294704883 | M124: =RC[-4]+RC[-1] -> 43.616653263128086 | N124: =RC[-4]+RC[-2] -> 6600.3811711970047 | O124: =(1.000001018*(1-RC[-4]*RC[-4]))/(1+RC[-4]*COS(RADIANS(RC[-1]))) -> 1.0082383787897129 | P124: =RC[-3]-0.00569-0.00478*SIN(RADIANS(125.04-1934.136*RC[-9])) -> 43.608552842002844 | Q124: =23+(26+((21.448-RC[-10]*(46.815+RC[-10]*(0.00059-RC[-10]*0.001813))))/60)/60 -> 23.437036563706148 | R124: =RC[-1]+0.00256*COS(RADIANS(125.04-1934.136*RC[-11])) -> 23.434825889129687 | S124: =DEGREES(ATAN2(COS(RADIANS(RC[-3])),COS(RADIANS(RC[-1]))*SIN(RADIANS(RC[-3])))) -> 41.153363564915999 | T124: =DEGREES(ASIN(SIN(RADIANS(RC[-2]))*SIN(RADIANS(RC[-4])))) -> 15.92081429768785 | U124: =TAN(RADIANS(RC[-3]/2))*TAN(RADIANS(RC[-3]/2)) -> 4.3017668341006232E-2 | V124: =4*DEGREES(RC[-1]*SIN(2*RADIANS(RC[-13]))-2*RC[-11]*SIN(RADIANS(RC[-12]))+4*RC[-11]*RC[-1]*SIN(RADIANS(RC[-12]))*COS(2*RADIANS(RC[-13]))-0.5*RC[-1]*RC[-1]*SIN(4*RADIANS(RC[-13]))-1.25*RC[-11]*RC[-11]*SIN(2*RADIANS(RC[-12]))) -> 3.1735963667323195 | W124: =DEGREES(ACOS(COS(RADIANS(90.833))/(COS(RADIANS(R2C2))*COS(RADIANS(RC[-3])))-TAN(RADIANS(R2C2))*TAN(RADIANS(RC[-3])))) -> 145.88573715553451 | X124: =(720-4*R3C2-RC[-2]+R4C2*60)/1440 -> 1899-12-31T13:52:49.584 | Y124: =(RC[-1]*1440-RC[-2]*4)/1440 -> 1899-12-31T04:09:17.007 | Z124: =(RC[-2]*1440+RC[-3]*4)/1440 -> 1899-12-31T23:36:22.161 | AA124: =8*RC[-4] -> 1167.0858972442761 | AB124: =MOD(RC[-23]*1440+RC[-6]+4*R3C2-60*R4C2,1440) -> 727.17359636673234 | AC124: =IF(RC[-1]/4<0,RC[-1]/4+180,RC[-1]/4-180) -> 1.7933990916830851 | AD124: =DEGREES(ACOS(SIN(RADIANS(R2C2))*SIN(RADIANS(RC[-10]))+COS(RADIANS(R2C2))*COS(RADIANS(RC[-10]))*COS(RADIANS(RC[-1])))) -> 54.090583118423496 | AE124: =90-RC[-1] -> 35.909416881576504 | AF124: =IF(RC[-1]>85,0,IF(RC[-1]>5,58.1/TAN(RADIANS(RC[-1]))-0.07/POWER(TAN(RADIANS(RC[-1])),3)+0.000086/POWER(TAN(RADIANS(RC[-1])),5),IF(RC[-1]>-0.575,1735+RC[-1]*(-518.2+RC[-1]*(103.4+RC[-1]*(-12.79+RC[-1]*0.711))),-20.772/TAN(RADIANS(RC[-1])))))/3600 -> 2.2236198746622846E-2 | AG124: =RC[-2]+RC[-1] -> 35.93165308032313 | AH124: =IF(RC[-5]>0,MOD(DEGREES(ACOS(((SIN(RADIANS(R2C2))*COS(RADIANS(RC[-4])))-SIN(RADIANS(RC[-14])))/(COS(RADIANS(R2C2))*SIN(RADIANS(RC[-4])))))+180,360),MOD(540-DEGREES(ACOS(((SIN(RADIANS(R2C2))*COS(RADIANS(RC[-4])))-SIN(RADIANS(RC[-14])))/(COS(RADIANS(R2C2))*SIN(RADIANS(RC[-4]))))),360)) -> 182.12943135423444
D125: =R[-1]C+1 -> 2017-05-04T00:00:00.000 | E125: =R5C2 -> 1899-12-31T14:00:00.000 | F125: =RC[-2]+2415018.5+RC[-1]-R4C2/24 -> 2457878.375 | G125: =(RC[-1]-2451545)/36525 -> 0.17339835728952771 | I125: =MOD(280.46646+RC[-2]*(36000.76983 + RC[-2]*0.0003032),360) -> 42.940818796700114 | J125: =357.52911+RC[-3]*(35999.05029 - 0.0001537*RC[-3]) -> 6599.7052896477999 | K125: =0.016708634-RC[-4]*(0.000042037+0.0000001267*RC[-4]) -> 1.6701341043766946E-2 | L125: =SIN(RADIANS(RC[-2]))*(1.914602-RC[-5]*(0.004817+0.000014*RC[-5]))+SIN(RADIANS(2*RC[-2]))*(0.019993-0.000101*RC[-5])+SIN(RADIANS(3*RC[-2]))*0.000289 -> 1.6450701126693545 | M125: =RC[-4]+RC[-1] -> 44.585888909369466 | N125: =RC[-4]+RC[-2] -> 6601.3503597604695 | O125: =(1.000001018*(1-RC[-4]*RC[-4]))/(1+RC[-4]*COS(RADIANS(RC[-1]))) -> 1.0084850165498735 | P125: =RC[-3]-0.00569-0.00478*SIN(RADIANS(125.04-1934.136*RC[-9])) -> 44.577784674341366 | Q125: =23+(26+((21.448-RC[-10]*(46.815+RC[-10]*(0.00059-RC[-10]*0.001813))))/60)/60 -> 23.437036207671156 | R125: =RC[-1]+0.00256*COS(RADIANS(125.04-1934.136*RC[-11])) -> 23.434826727144998 | S125: =DEGREES(ATAN2(COS(RADIANS(RC[-3])),COS(RADIANS(RC[-1]))*SIN(RADIANS(RC[-3])))) -> 42.116398034236852 | T125: =DEGREES(ASIN(SIN(RADIANS(RC[-2]))*SIN(RADIANS(RC[-4])))) -> 16.208909617519243 | U125: =TAN(RADIANS(RC[-3]/2))*TAN(RADIANS(RC[-3]/2)) -> 4.3017671505064178E-2 | V125: =4*DEGREES(RC[-1]*SIN(2*RADIANS(RC[-13]))-2*RC[-11]*SIN(RADIANS(RC[-12]))+4*RC[-11]*RC[-1]*SIN(RADIANS(RC[-12]))*COS(2*RADIANS(RC[-13]))-0.5*RC[-1]*RC[-1]*SIN(4*RADIANS(RC[-13]))-1.25*RC[-11]*RC[-11]*SIN(2*RADIANS(RC[-12]))) -> 3.2636488862566679 | W125: =DEGREES(ACOS(COS(RADIANS(90.833))/(COS(RADIANS(R2C2))*COS(RADIANS(RC[-3])))-TAN(RADIANS(R2C2))*TAN(RADIANS(RC[-3])))) -> 147.45246261249491 | X125: =(720-4*R3C2-RC[-2]+R4C2*60)/1440 -> 1899-12-31T13:52:44.181 | Y125: =(RC[-1]*1440-RC[-2]*4)/1440 -> 1899-12-31T04:02:55.590 | Z125: =(RC[-2]*1440+RC[-3]*4)/1440 -> 1899-12-31T23:42:32.772 | AA125: =8*RC[-4] -> 1179.6197008999593 | AB125: =MOD(RC[-23]*1440+RC[-6]+4*R3C2-60*R4C2,1440) -> 727.26364888625665 | AC125: =IF(RC[-1]/4<0,RC[-1]/4+180,RC[-1]/4-180) -> 1.8159122215641617 | AD125: =DEGREES(ACOS(SIN(RADIANS(R2C2))*SIN(RADIANS(RC[-10]))+COS(RADIANS(R2C2))*COS(RADIANS(RC[-10]))*COS(RADIANS(RC[-1])))) -> 53.802801588509595 | AE125: =90-RC[-1] -> 36.197198411490405 | AF125: =IF(RC[-1]>85,0,IF(RC[-1]>5,58.1/TAN(RADIANS(RC[-1]))-0.07/POWER(TAN(RADIANS(RC[-1])),3)+0.000086/POWER(TAN(RADIANS(RC[-1])),5),IF(RC[-1]>-0.575,1735+RC[-1]*(-518.2+RC[-1]*(103.4+RC[-1]*(-12.79+RC[-1]*0.711))),-20.772/TAN(RADIANS(RC[-1])))))/3600 -> 2.2003758935214432E-2 | AG125: =RC[-2]+RC[-1] -> 36.219202170425618 | AH125: =IF(RC[-5]>0,MOD(DEGREES(ACOS(((SIN(RADIANS(R2C2))*COS(RADIANS(RC[-4])))-SIN(RADIANS(RC[-14])))/(COS(RADIANS(R2C2))*SIN(RADIANS(RC[-4])))))+180,360),MOD(540-DEGREES(ACOS(((SIN(RADIANS(R2C2))*COS(RADIANS(RC[-4])))-SIN(RADIANS(RC[-14])))/(COS(RADIANS(R2C2))*SIN(RADIANS(RC[-4]))))),360)) -> 182.16093566563688
D126: =R[-1]C+1 -> 2017-05-05T00:00:00.000 | E126: =R5C2 -> 1899-12-31T14:00:00.000 | F126: =RC[-2]+2415018.5+RC[-1]-R4C2/24 -> 2457879.375 | G126: =(RC[-1]-2451545)/36525 -> 0.17342573579739903 | I126: =MOD(280.46646+RC[-2]*(36000.76983 + RC[-2]*0.0003032),360) -> 43.926466159743541 | J126: =357.52911+RC[-3]*(35999.05029 - 0.0001537*RC[-3]) -> 6600.6908899280652 | K126: =0.016708634-RC[-4]*(0.000042037+0.0000001267*RC[-4]) -> 1.6701339891653528E-2 | L126: =SIN(RADIANS(RC[-2]))*(1.914602-RC[-5]*(0.004817+0.000014*RC[-5]))+SIN(RADIANS(2*RC[-2]))*(0.019993-0.000101*RC[-5])+SIN(RADIANS(3*RC[-2]))*0.000289 -> 1.6281868948106846 | M126: =RC[-4]+RC[-1] -> 45.554653054554223 | N126: =RC[-4]+RC[-2] -> 6602.319076822876 | O126: =(1.000001018*(1-RC[-4]*RC[-4]))/(1+RC[-4]*COS(RADIANS(RC[-1]))) -> 1.0087291262217311 | P126: =RC[-3]-0.00569-0.00478*SIN(RADIANS(125.04-1934.136*RC[-9])) -> 45.546545007685452 | Q126: =23+(26+((21.448-RC[-10]*(46.815+RC[-10]*(0.00059-RC[-10]*0.001813))))/60)/60 -> 23.437035851636164 | R126: =RC[-1]+0.00256*COS(RADIANS(125.04-1934.136*RC[-11])) -> 23.434827567047595 | S126: =DEGREES(ATAN2(COS(RADIANS(RC[-3])),COS(RADIANS(RC[-1]))*SIN(RADIANS(RC[-3])))) -> 43.081759951417084 | T126: =DEGREES(ASIN(SIN(RADIANS(RC[-2]))*SIN(RADIANS(RC[-4])))) -> 16.492516662222911 | U126: =TAN(RADIANS(RC[-3]/2))*TAN(RADIANS(RC[-3]/2)) -> 4.3017674676247994E-2 | V126: =4*DEGREES(RC[-1]*SIN(2*RADIANS(RC[-13]))-2*RC[-11]*SIN(RADIANS(RC[-12]))+4*RC[-11]*RC[-1]*SIN(RADIANS(RC[-12]))*COS(2*RADIANS(RC[-13]))-0.5*RC[-1]*RC[-1]*SIN(4*RADIANS(RC[-13]))-1.25*RC[-11]*RC[-11]*SIN(2*RADIANS(RC[-12]))) -> 3.3444166131394129 | W126: =DEGREES(ACOS(COS(RADIANS(90.833))/(COS(RADIANS(R2C2))*COS(RADIANS(RC[-3])))-TAN(RADIANS(R2C2))*TAN(RADIANS(RC[-3])))) -> 149.06822446752759 | X126: =(720-4*R3C2-RC[-2]+R4C2*60)/1440 -> 1899-12-31T13:52:39.335 | Y126: =(RC[-1]*1440-RC[-2]*4)/1440 -> 1899-12-31T03:56:22.961 | Z126: =(RC[-2]*1440+RC[-3]*4)/1440 -> 1899-12-31T23:48:55.709 | AA126: =8*RC[-4] -> 1192.5457957402207 | AB126: =MOD(RC[-23]*1440+RC[-6]+4*R3C2-60*R4C2,1440) -> 727.3444166131394 | AC126: =IF(RC[-1]/4<0,RC[-1]/4+180,RC[-1]/4-180) -> 1.8361041532848503 | AD126: =DEGREES(ACOS(SIN(RADIANS(R2C2))*SIN(RADIANS(RC[-10]))+COS(RADIANS(R2C2))*COS(RADIANS(RC[-10]))*COS(RADIANS(RC[-1])))) -> 53.519482638875509 | AE126: =90-RC[-1] -> 36.480517361124491 | AF126: =IF(RC[-1]>85,0,IF(RC[-1]>5,58.1/TAN(RADIANS(RC[-1]))-0.07/POWER(TAN(RADIANS(RC[-1])),3)+0.000086/POWER(TAN(RADIANS(RC[-1])),5),IF(RC[-1]>-0.575,1735+RC[-1]*(-518.2+RC[-1]*(103.4+RC[-1]*(-12.79+RC[-1]*0.711))),-20.772/TAN(RADIANS(RC[-1])))))/3600 -> 2.177798767277692E-2 | AG126: =RC[-2]+RC[-1] -> 36.502295348797269 | AH126: =IF(RC[-5]>0,MOD(DEGREES(ACOS(((SIN(RADIANS(R2C2))*COS(RADIANS(RC[-4])))-SIN(RADIANS(RC[-14])))/(COS(RADIANS(R2C2))*SIN(RADIANS(RC[-4])))))+180,360),MOD(540-DEGREES(ACOS(((SIN(RADIANS(R2C2))*COS(RADIANS(RC[-4])))-SIN(RADIANS(RC[-14])))/(COS(RADIANS(R2C2))*SIN(RADIANS(RC[-4]))))),360)) -> 182.18974988077247
D127: =R[-1]C+1 -> 2017-05-06T00:00:00.000 | E127: =R5C2 -> 1899-12-31T14:00:00.000 | F127: =RC[-2]+2415018.5+RC[-1]-R4C2/24 -> 2457880.375 | G127: =(RC[-1]-2451545)/36525 -> 0.17345311430527036 | I127: =MOD(280.46646+RC[-2]*(36000.76983 + RC[-2]*0.0003032),360) -> 44.912113522787877 | J127: =357.52911+RC[-3]*(35999.05029 - 0.0001537*RC[-3]) -> 6601.6764902083314 | K127: =0.016708634-RC[-4]*(0.000042037+0.0000001267*RC[-4]) -> 1.6701338739539922E-2 | L127: =SIN(RADIANS(RC[-2]))*(1.914602-RC[-5]*(0.004817+0.000014*RC[-5]))+SIN(RADIANS(2*RC[-2]))*(0.019993-0.000101*RC[-5])+SIN(RADIANS(3*RC[-2]))*0.000289 -> 1.6108374377401464 | M127: =RC[-4]+RC[-1] -> 46.522950960528021 | N127: =RC[-4]+RC[-2] -> 6603.2873276460714 | O127: =(1.000001018*(1-RC[-4]*RC[-4]))/(1+RC[-4]*COS(RADIANS(RC[-1]))) -> 1.0089706392664775 | P127: =RC[-3]-0.00569-0.00478*SIN(RADIANS(125.04-1934.136*RC[-9])) -> 46.514839103884022 | Q127: =23+(26+((21.448-RC[-10]*(46.815+RC[-10]*(0.00059-RC[-10]*0.001813))))/60)/60 -> 23.437035495601172 | R127: =RC[-1]+0.00256*COS(RADIANS(125.04-1934.136*RC[-11])) -> 23.434828408836463 | S127: =DEGREES(ATAN2(COS(RADIANS(RC[-3])),COS(RADIANS(RC[-1]))*SIN(RADIANS(RC[-3])))) -> 44.049466564457717 | T127: =DEGREES(ASIN(SIN(RADIANS(RC[-2]))*SIN(RADIANS(RC[-4])))) -> 16.77155008377072 | U127: =TAN(RADIANS(RC[-3]/2))*TAN(RADIANS(RC[-3]/2)) -> 4.3017677854553849E-2 | V127: =4*DEGREES(RC[-1]*SIN(2*RADIANS(RC[-13]))-2*RC[-11]*SIN(RADIANS(RC[-12]))+4*RC[-11]*RC[-1]*SIN(RADIANS(RC[-12]))*COS(2*RADIANS(RC[-13]))-0.5*RC[-1]*RC[-1]*SIN(4*RADIANS(RC[-13]))-1.25*RC[-11]*RC[-11]*SIN(2*RADIANS(RC[-12]))) -> 3.4158294543521048 | W127: =DEGREES(ACOS(COS(RADIANS(90.833))/(COS(RADIANS(R2C2))*COS(RADIANS(RC[-3])))-TAN(RADIANS(R2C2))*TAN(RADIANS(RC[-3])))) -> 150.74095915875384 | X127: =(720-4*R3C2-RC[-2]+R4C2*60)/1440 -> 1899-12-31T13:52:35.050 | Y127: =(RC[-1]*1440-RC[-2]*4)/1440 -> 1899-12-31T03:49:37.220 | Z127: =(RC[-2]*1440+RC[-3]*4)/1440 -> 1899-12-31T23:55:32.880 | AA127: =8*RC[-4] -> 1205.9276732700307 | AB127: =MOD(RC[-23]*1440+RC[-6]+4*R3C2-60*R4C2,1440) -> 727.41582945435209 | AC127: =IF(RC[-1]/4<0,RC[-1]/4+180,RC[-1]/4-180) -> 1.8539573635880231 | AD127: =DEGREES(ACOS(SIN(RADIANS(R2C2))*SIN(RADIANS(RC[-10]))+COS(RADIANS(R2C2))*COS(RADIANS(RC[-10]))*COS(RADIANS(RC[-1])))) -> 53.240710179518842 | AE127: =90-RC[-1] -> 36.759289820481158 | AF127: =IF(RC[-1]>85,0,IF(RC[-1]>5,58.1/TAN(RADIANS(RC[-1]))-0.07/POWER(TAN(RADIANS(RC[-1])),3)+0.000086/POWER(TAN(RADIANS(RC[-1])),5),IF(RC[-1]>-0.575,1735+RC[-1]*(-518.2+RC[-1]*(103.4+RC[-1]*(-12.79+RC[-1]*0.711))),-20.772/TAN(RADIANS(RC[-1])))))/3600 -> 2.1558737829518993E-2 | AG127: =RC[-2]+RC[-1] -> 36.780848558310673 | AH127: =IF(RC[-5]>0,MOD(DEGREES(ACOS(((SIN(RADIANS(R2C2))*COS(RADIANS(RC[-4])))-SIN(RADIANS(RC[-14])))/(COS(RADIANS(R2C2))*SIN(RADIANS(RC[-4])))))+180,360),MOD(540-DEGREES(ACOS(((SIN(RADIANS(R2C2))*COS(RADIANS(RC[-4])))-SIN(RADIANS(RC[-14])))/(COS(RADIANS(R2C2))*SIN(RADIANS(RC[-4]))))),360)) -> 182.21583109477163
D128: =R[-1]C+1 -> 2017-05-07T00:00:00.000 | E128: =R5C2 -> 1899-12-31T14:00:00.000 | F128: =RC[-2]+2415018.5+RC[-1]-R4C2/24 -> 2457881.375 | G128: =(RC[-1]-2451545)/36525 -> 0.17348049281314168 | I128: =MOD(280.46646+RC[-2]*(36000.76983 + RC[-2]*0.0003032),360) -> 45.897760885832213 | J128: =357.52911+RC[-3]*(35999.05029 - 0.0001537*RC[-3]) -> 6602.6620904885949 | K128: =0.016708634-RC[-4]*(0.000042037+0.0000001267*RC[-4]) -> 1.6701337587426122E-2 | L128: =SIN(RADIANS(RC[-2]))*(1.914602-RC[-5]*(0.004817+0.000014*RC[-5]))+SIN(RADIANS(2*RC[-2]))*(0.019993-0.000101*RC[-5])+SIN(RADIANS(3*RC[-2]))*0.000289 -> 1.5930271229081936 | M128: =RC[-4]+RC[-1] -> 47.49078800874041 | N128: =RC[-4]+RC[-2] -> 6604.255117611503 | O128: =(1.000001018*(1-RC[-4]*RC[-4]))/(1+RC[-4]*COS(RADIANS(RC[-1]))) -> 1.0092094879731013 | P128: =RC[-3]-0.00569-0.00478*SIN(RADIANS(125.04-1934.136*RC[-9])) -> 47.482672344389876 | Q128: =23+(26+((21.448-RC[-10]*(46.815+RC[-10]*(0.00059-RC[-10]*0.001813))))/60)/60 -> 23.437035139566181 | R128: =RC[-1]+0.00256*COS(RADIANS(125.04-1934.136*RC[-11])) -> 23.434829252510575 | S128: =DEGREES(ATAN2(COS(RADIANS(RC[-3])),COS(RADIANS(RC[-1]))*SIN(RADIANS(RC[-3])))) -> 45.01953216176981 | T128: =DEGREES(ASIN(SIN(RADIANS(RC[-2]))*SIN(RADIANS(RC[-4])))) -> 17.04592523498831 | U128: =TAN(RADIANS(RC[-3]/2))*TAN(RADIANS(RC[-3]/2)) -> 4.3017681039977863E-2 | V128: =4*DEGREES(RC[-1]*SIN(2*RADIANS(RC[-13]))-2*RC[-11]*SIN(RADIANS(RC[-12]))+4*RC[-11]*RC[-1]*SIN(RADIANS(RC[-12]))*COS(2*RADIANS(RC[-13]))-0.5*RC[-1]*RC[-1]*SIN(4*RADIANS(RC[-13]))-1.25*RC[-11]*RC[-11]*SIN(2*RADIANS(RC[-12]))) -> 3.4778291853212808 | W128: =DEGREES(ACOS(COS(RADIANS(90.833))/(COS(RADIANS(R2C2))*COS(RADIANS(RC[-3])))-TAN(RADIANS(R2C2))*TAN(RADIANS(RC[-3])))) -> 152.48084599954055 | X128: =(720-4*R3C2-RC[-2]+R4C2*60)/1440 -> 1899-12-31T13:52:31.330 | Y128: =(RC[-1]*1440-RC[-2]*4)/1440 -> 1899-12-31T03:42:35.927 | Z128: =(RC[-2]*1440+RC[-3]*4)/1440 -> 1900-01-01T00:02:26.733 | AA128: =8*RC[-4] -> 1219.8467679963244 | AB128: =MOD(RC[-23]*1440+RC[-6]+4*R3C2-60*R4C2,1440) -> 727.4778291853213 | AC128: =IF(RC[-1]/4<0,RC[-1]/4+180,RC[-1]/4-180) -> 1.8694572963303244 | AD128: =DEGREES(ACOS(SIN(RADIANS(R2C2))*SIN(RADIANS(RC[-10]))+COS(RADIANS(R2C2))*COS(RADIANS(RC[-10]))*COS(RADIANS(RC[-1])))) -> 52.966567558134059 | AE128: =90-RC[-1] -> 37.033432441865941 | AF128: =IF(RC[-1]>85,0,IF(RC[-1]>5,58.1/TAN(RADIANS(RC[-1]))-0.07/POWER(TAN(RADIANS(RC[-1])),3)+0.000086/POWER(TAN(RADIANS(RC[-1])),5),IF(RC[-1]>-0.575,1735+RC[-1]*(-518.2+RC[-1]*(103.4+RC[-1]*(-12.79+RC[-1]*0.711))),-20.772/TAN(RADIANS(RC[-1])))))/3600 -> 2.1345869294625851E-2 | AG128: =RC[-2]+RC[-1] -> 37.054778311160568 | AH128: =IF(RC[-5]>0,MOD(DEGREES(ACOS(((SIN(RADIANS(R2C2))*COS(RADIANS(RC[-4])))-SIN(RADIANS(RC[-14])))/(COS(RADIANS(R2C2))*SIN(RADIANS(RC[-4])))))+180,360),MOD(540-DEGREES(ACOS(((SIN(RADIANS(R2C2))*COS(RADIANS(RC[-4])))-SIN(RADIANS(RC[-14])))/(COS(RADIANS(R2C2))*SIN(RADIANS(RC[-4]))))),360)) -> 182.23913994641592
D129: =R[-1]C+1 -> 2017-05-08T00:00:00.000 | E129: =R5C2 -> 1899-12-31T14:00:00.000 | F129: =RC[-2]+2415018.5+RC[-1]-R4C2/24 -> 2457882.375 | G129: =(RC[-1]-2451545)/36525 -> 0.173507871321013 | I129: =MOD(280.46646+RC[-2]*(36000.76983 + RC[-2]*0.0003032),360) -> 46.883408248877458 | J129: =357.52911+RC[-3]*(35999.05029 - 0.0001537*RC[-3]) -> 6603.6476907688602 | K129: =0.016708634-RC[-4]*(0.000042037+0.0000001267*RC[-4]) -> 1.6701336435312134E-2 | L129: =SIN(RADIANS(RC[-2]))*(1.914602-RC[-5]*(0.004817+0.000014*RC[-5]))+SIN(RADIANS(2*RC[-2]))*(0.019993-0.000101*RC[-5])+SIN(RADIANS(3*RC[-2]))*0.000289 -> 1.5747614495364359 | M129: =RC[-4]+RC[-1] -> 48.458169698413897 | N129: =RC[-4]+RC[-2] -> 6605.2224522183969 | O129: =(1.000001018*(1-RC[-4]*RC[-4]))/(1+RC[-4]*COS(RADIANS(RC[-1]))) -> 1.0094456054740293 | P129: =RC[-3]-0.00569-0.00478*SIN(RADIANS(125.04-1934.136*RC[-9])) -> 48.450050228428779 | Q129: =23+(26+((21.448-RC[-10]*(46.815+RC[-10]*(0.00059-RC[-10]*0.001813))))/60)/60 -> 23.437034783531189 | R129: =RC[-1]+0.00256*COS(RADIANS(125.04-1934.136*RC[-11])) -> 23.434830098068904 | S129: =DEGREES(ATAN2(COS(RADIANS(RC[-3])),COS(RADIANS(RC[-1]))*SIN(RADIANS(RC[-3])))) -> 45.991968017543122 | T129: =DEGREES(ASIN(SIN(RADIANS(RC[-2]))*SIN(RADIANS(RC[-4])))) -> 17.315558211675476 | U129: =TAN(RADIANS(RC[-3]/2))*TAN(RADIANS(RC[-3]/2)) -> 4.301768423251616E-2 | V129: =4*DEGREES(RC[-1]*SIN(2*RADIANS(RC[-13]))-2*RC[-11]*SIN(RADIANS(RC[-12]))+4*RC[-11]*RC[-1]*SIN(RADIANS(RC[-12]))*COS(2*RADIANS(RC[-13]))-0.5*RC[-1]*RC[-1]*SIN(4*RADIANS(RC[-13]))-1.25*RC[-11]*RC[-11]*SIN(2*RADIANS(RC[-12]))) -> 3.5303696891367449 | W129: =DEGREES(ACOS(COS(RADIANS(90.833))/(COS(RADIANS(R2C2))*COS(RADIANS(RC[-3])))-TAN(RADIANS(R2C2))*TAN(RADIANS(RC[-3])))) -> 154.30128792958465 | X129: =(720-4*R3C2-RC[-2]+R4C2*60)/1440 -> 1899-12-31T13:52:28.178 | Y129: =(RC[-1]*1440-RC[-2]*4)/1440 -> 1899-12-31T03:35:15.869 | Z129: =(RC[-2]*1440+RC[-3]*4)/1440 -> 1900-01-01T00:09:40.487 | AA129: =8*RC[-4] -> 1234.4103034366772 | AB129: =MOD(RC[-23]*1440+RC[-6]+4*R3C2-60*R4C2,1440) -> 727.53036968913671 | AC129: =IF(RC[-1]/4<0,RC[-1]/4+180,RC[-1]/4-180) -> 1.8825924222841763 | AD129: =DEGREES(ACOS(SIN(RADIANS(R2C2))*SIN(RADIANS(RC[-10]))+COS(RADIANS(R2C2))*COS(RADIANS(RC[-10]))*COS(RADIANS(RC[-1])))) -> 52.697137525249673 | AE129: =90-RC[-1] -> 37.302862474750327 | AF129: =IF(RC[-1]>85,0,IF(RC[-1]>5,58.1/TAN(RADIANS(RC[-1]))-0.07/POWER(TAN(RADIANS(RC[-1])),3)+0.000086/POWER(TAN(RADIANS(RC[-1])),5),IF(RC[-1]>-0.575,1735+RC[-1]*(-518.2+RC[-1]*(103.4+RC[-1]*(-12.79+RC[-1]*0.711))),-20.772/TAN(RADIANS(RC[-1])))))/3600 -> 2.1139248654549223E-2 | AG129: =RC[-2]+RC[-1] -> 37.324001723404876 | AH129: =IF(RC[-5]>0,MOD(DEGREES(ACOS(((SIN(RADIANS(R2C2))*COS(RADIANS(RC[-4])))-SIN(RADIANS(RC[-14])))/(COS(RADIANS(R2C2))*SIN(RADIANS(RC[-4])))))+180,360),MOD(540-DEGREES(ACOS(((SIN(RADIANS(R2C2))*COS(RADIANS(RC[-4])))-SIN(RADIANS(RC[-14])))/(COS(RADIANS(R2C2))*SIN(RADIANS(RC[-4]))))),360)) -> 182.25964076301378
D130: =R[-1]C+1 -> 2017-05-09T00:00:00.000 | E130: =R5C2 -> 1899-12-31T14:00:00.000 | F130: =RC[-2]+2415018.5+RC[-1]-R4C2/24 -> 2457883.375 | G130: =(RC[-1]-2451545)/36525 -> 0.17353524982888432 | I130: =MOD(280.46646+RC[-2]*(36000.76983 + RC[-2]*0.0003032),360) -> 47.869055611922704 | J130: =357.52911+RC[-3]*(35999.05029 - 0.0001537*RC[-3]) -> 6604.6332910491255 | K130: =0.016708634-RC[-4]*(0.000042037+0.0000001267*RC[-4]) -> 1.6701335283197956E-2 | L130: =SIN(RADIANS(RC[-2]))*(1.914602-RC[-5]*(0.004817+0.000014*RC[-5]))+SIN(RADIANS(2*RC[-2]))*(0.019993-0.000101*RC[-5])+SIN(RADIANS(3*RC[-2]))*0.000289 -> 1.5560460327714494 | M130: =RC[-4]+RC[-1] -> 49.425101644694152 | N130: =RC[-4]+RC[-2] -> 6606.1893370818971 | O130: =(1.000001018*(1-RC[-4]*RC[-4]))/(1+RC[-4]*COS(RADIANS(RC[-1]))) -> 1.0096789257604606 | P130: =RC[-3]-0.00569-0.00478*SIN(RADIANS(125.04-1934.136*RC[-9])) -> 49.416978371149654 | Q130: =23+(26+((21.448-RC[-10]*(46.815+RC[-10]*(0.00059-RC[-10]*0.001813))))/60)/60 -> 23.437034427496201 | R130: =RC[-1]+0.00256*COS(RADIANS(125.04-1934.136*RC[-11])) -> 23.434830945510434 | S130: =DEGREES(ATAN2(COS(RADIANS(RC[-3])),COS(RADIANS(RC[-1]))*SIN(RADIANS(RC[-3])))) -> 46.966782339731616 | T130: =DEGREES(ASIN(SIN(RADIANS(RC[-2]))*SIN(RADIANS(RC[-4])))) -> 17.580365896492587 | U130: =TAN(RADIANS(RC[-3]/2))*TAN(RADIANS(RC[-3]/2)) -> 4.3017687432164914E-2 | V130: =4*DEGREES(RC[-1]*SIN(2*RADIANS(RC[-13]))-2*RC[-11]*SIN(RADIANS(RC[-12]))+4*RC[-11]*RC[-1]*SIN(RADIANS(RC[-12]))*COS(2*RADIANS(RC[-13]))-0.5*RC[-1]*RC[-1]*SIN(4*RADIANS(RC[-13]))-1.25*RC[-11]*RC[-11]*SIN(2*RADIANS(RC[-12]))) -> 3.5734171828423129 | W130: =DEGREES(ACOS(COS(RADIANS(90.833))/(COS(RADIANS(R2C2))*COS(RADIANS(RC[-3])))-TAN(RADIANS(R2C2))*TAN(RADIANS(RC[-3])))) -> 156.22051675060928 | X130: =(720-4*R3C2-RC[-2]+R4C2*60)/1440 -> 1899-12-31T13:52:25.595 | Y130: =(RC[-1]*1440-RC[-2]*4)/1440 -> 1899-12-31T03:27:32.671 | Z130: =(RC[-2]*1440+RC[-3]*4)/1440 -> 1900-01-01T00:17:18.519 | AA130: =8*RC[-4] -> 1249.7641340048742 | AB130: =MOD(RC[-23]*1440+RC[-6]+4*R3C2-60*R4C2,1440) -> 727.57341718284226 | AC130: =IF(RC[-1]/4<0,RC[-1]/4+180,RC[-1]/4-180) -> 1.8933542957105658 | AD130: =DEGREES(ACOS(SIN(RADIANS(R2C2))*SIN(RADIANS(RC[-10]))+COS(RADIANS(R2C2))*COS(RADIANS(RC[-10]))*COS(RADIANS(RC[-1])))) -> 52.432502196899414 | AE130: =90-RC[-1] -> 37.567497803100586 | AF130: =IF(RC[-1]>85,0,IF(RC[-1]>5,58.1/TAN(RADIANS(RC[-1]))-0.07/POWER(TAN(RADIANS(RC[-1])),3)+0.000086/POWER(TAN(RADIANS(RC[-1])),5),IF(RC[-1]>-0.575,1735+RC[-1]*(-518.2+RC[-1]*(103.4+RC[-1]*(-12.79+RC[-1]*0.711))),-20.772/TAN(RADIANS(RC[-1])))))/3600 -> 2.0938748888401641E-2 | AG130: =RC[-2]+RC[-1] -> 37.588436551988991 | AH130: =IF(RC[-5]>0,MOD(DEGREES(ACOS(((SIN(RADIANS(R2C2))*COS(RADIANS(RC[-4])))-SIN(RADIANS(RC[-14])))/(COS(RADIANS(R2C2))*SIN(RADIANS(RC[-4])))))+180,360),MOD(540-DEGREES(ACOS(((SIN(RADIANS(R2C2))*COS(RADIANS(RC[-4])))-SIN(RADIANS(RC[-14])))/(COS(RADIANS(R2C2))*SIN(RADIANS(RC[-4]))))),360)) -> 182.2773017028409
D131: =R[-1]C+1 -> 2017-05-10T00:00:00.000 | E131: =R5C2 -> 1899-12-31T14:00:00.000 | F131: =RC[-2]+2415018.5+RC[-1]-R4C2/24 -> 2457884.375 | G131: =(RC[-1]-2451545)/36525 -> 0.17356262833675565 | I131: =MOD(280.46646+RC[-2]*(36000.76983 + RC[-2]*0.0003032),360) -> 48.85470297496704 | J131: =357.52911+RC[-3]*(35999.05029 - 0.0001537*RC[-3]) -> 6605.618891329389 | K131: =0.016708634-RC[-4]*(0.000042037+0.0000001267*RC[-4]) -> 1.6701334131083587E-2 | L131: =SIN(RADIANS(RC[-2]))*(1.914602-RC[-5]*(0.004817+0.000014*RC[-5]))+SIN(RADIANS(2*RC[-2]))*(0.019993-0.000101*RC[-5])+SIN(RADIANS(3*RC[-2]))*0.000289 -> 1.536886601825689 | M131: =RC[-4]+RC[-1] -> 50.391589576792732 | N131: =RC[-4]+RC[-2] -> 6607.1557779312143 | O131: =(1.000001018*(1-RC[-4]*RC[-4]))/(1+RC[-4]*COS(RADIANS(RC[-1]))) -> 1.0099093836974089 | P131: =RC[-3]-0.00569-0.00478*SIN(RADIANS(125.04-1934.136*RC[-9])) -> 50.383462501767298 | Q131: =23+(26+((21.448-RC[-10]*(46.815+RC[-10]*(0.00059-RC[-10]*0.001813))))/60)/60 -> 23.437034071461209 | R131: =RC[-1]+0.00256*COS(RADIANS(125.04-1934.136*RC[-11])) -> 23.434831794834121 | S131: =DEGREES(ATAN2(COS(RADIANS(RC[-3])),COS(RADIANS(RC[-1]))*SIN(RADIANS(RC[-3])))) -> 47.943980220935913 | T131: =DEGREES(ASIN(SIN(RADIANS(RC[-2]))*SIN(RADIANS(RC[-4])))) -> 17.840266004572833 | U131: =TAN(RADIANS(RC[-3]/2))*TAN(RADIANS(RC[-3]/2)) -> 4.3017690638920171E-2 | V131: =4*DEGREES(RC[-1]*SIN(2*RADIANS(RC[-13]))-2*RC[-11]*SIN(RADIANS(RC[-12]))+4*RC[-11]*RC[-1]*SIN(RADIANS(RC[-12]))*COS(2*RADIANS(RC[-13]))-0.5*RC[-1]*RC[-1]*SIN(4*RADIANS(RC[-13]))-1.25*RC[-11]*RC[-11]*SIN(2*RADIANS(RC[-12]))) -> 3.6069504295400083 | W131: =DEGREES(ACOS(COS(RADIANS(90.833))/(COS(RADIANS(R2C2))*COS(RADIANS(RC[-3])))-TAN(RADIANS(R2C2))*TAN(RADIANS(RC[-3])))) -> 158.26438823477514 | X131: =(720-4*R3C2-RC[-2]+R4C2*60)/1440 -> 1899-12-31T13:52:23.583 | Y131: =(RC[-1]*1440-RC[-2]*4)/1440 -> 1899-12-31T03:19:20.130 | Z131: =(RC[-2]*1440+RC[-3]*4)/1440 -> 1900-01-01T00:25:27.036 | AA131: =8*RC[-4] -> 1266.1151058782011 | AB131: =MOD(RC[-23]*1440+RC[-6]+4*R3C2-60*R4C2,1440) -> 727.60695042954001 | AC131: =IF(RC[-1]/4<0,RC[-1]/4+180,RC[-1]/4-180) -> 1.9017376073850016 | AD131: =DEGREES(ACOS(SIN(RADIANS(R2C2))*SIN(RADIANS(RC[-10]))+COS(RADIANS(R2C2))*COS(RADIANS(RC[-10]))*COS(RADIANS(RC[-1])))) -> 52.17274301481266 | AE131: =90-RC[-1] -> 37.82725698518734 | AF131: =IF(RC[-1]>85,0,IF(RC[-1]>5,58.1/TAN(RADIANS(RC[-1]))-0.07/POWER(TAN(RADIANS(RC[-1])),3)+0.000086/POWER(TAN(RADIANS(RC[-1])),5),IF(RC[-1]>-0.575,1735+RC[-1]*(-518.2+RC[-1]*(103.4+RC[-1]*(-12.79+RC[-1]*0.711))),-20.772/TAN(RADIANS(RC[-1])))))/3600 -> 2.0744249079358245E-2 | AG131: =RC[-2]+RC[-1] -> 37.848001234266697 | AH131: =IF(RC[-5]>0,MOD(DEGREES(ACOS(((SIN(RADIANS(R2C2))*COS(RADIANS(RC[-4])))-SIN(RADIANS(RC[-14])))/(COS(RADIANS(R2C2))*SIN(RADIANS(RC[-4])))))+180,360),MOD(540-DEGREES(ACOS(((SIN(RADIANS(R2C2))*COS(RADIANS(RC[-4])))-SIN(RADIANS(RC[-14])))/(COS(RADIANS(R2C2))*SIN(RADIANS(RC[-4]))))),360)) -> 182.29209489450284
D132: =R[-1]C+1 -> 2017-05-11T00:00:00.000 | E132: =R5C2 -> 1899-12-31T14:00:00.000 | F132: =RC[-2]+2415018.5+RC[-1]-R4C2/24 -> 2457885.375 | G132: =(RC[-1]-2451545)/36525 -> 0.17359000684462697 | I132: =MOD(280.46646+RC[-2]*(36000.76983 + RC[-2]*0.0003032),360) -> 49.840350338013195 | J132: =357.52911+RC[-3]*(35999.05029 - 0.0001537*RC[-3]) -> 6606.6044916096535 | K132: =0.016708634-RC[-4]*(0.000042037+0.0000001267*RC[-4]) -> 1.670133297896903E-2 | L132: =SIN(RADIANS(RC[-2]))*(1.914602-RC[-5]*(0.004817+0.000014*RC[-5]))+SIN(RADIANS(2*RC[-2]))*(0.019993-0.000101*RC[-5])+SIN(RADIANS(3*RC[-2]))*0.000289 -> 1.5172889981068161 | M132: =RC[-4]+RC[-1] -> 51.357639336120009 | N132: =RC[-4]+RC[-2] -> 6608.1217806077602 | O132: =(1.000001018*(1-RC[-4]*RC[-4]))/(1+RC[-4]*COS(RADIANS(RC[-1]))) -> 1.0101369150384445 | P132: =RC[-3]-0.00569-0.00478*SIN(RADIANS(125.04-1934.136*RC[-9])) -> 51.349508461695329 | Q132: =23+(26+((21.448-RC[-10]*(46.815+RC[-10]*(0.00059-RC[-10]*0.001813))))/60)/60 -> 23.437033715426217 | R132: =RC[-1]+0.00256*COS(RADIANS(125.04-1934.136*RC[-11])) -> 23.434832646038949 | S132: =DEGREES(ATAN2(COS(RADIANS(RC[-3])),COS(RADIANS(RC[-1]))*SIN(RADIANS(RC[-3])))) -> 48.923563592454997 | T132: =DEGREES(ASIN(SIN(RADIANS(RC[-2]))*SIN(RADIANS(RC[-4])))) -> 18.095177130808967 | U132: =TAN(RADIANS(RC[-3]/2))*TAN(RADIANS(RC[-3]/2)) -> 4.3017693852778101E-2 | V132: =4*DEGREES(RC[-1]*SIN(2*RADIANS(RC[-13]))-2*RC[-11]*SIN(RADIANS(RC[-12]))+4*RC[-11]*RC[-1]*SIN(RADIANS(RC[-12]))*COS(2*RADIANS(RC[-13]))-0.5*RC[-1]*RC[-1]*SIN(4*RADIANS(RC[-13]))-1.25*RC[-11]*RC[-11]*SIN(2*RADIANS(RC[-12]))) -> 3.6309609350488956 | W132: =DEGREES(ACOS(COS(RADIANS(90.833))/(COS(RADIANS(R2C2))*COS(RADIANS(RC[-3])))-TAN(RADIANS(R2C2))*TAN(RADIANS(RC[-3])))) -> 160.47165818893822 | X132: =(720-4*R3C2-RC[-2]+R4C2*60)/1440 -> 1899-12-31T13:52:22.142 | Y132: =(RC[-1]*1440-RC[-2]*4)/1440 -> 1899-12-31T03:10:28.944 | Z132: =(RC[-2]*1440+RC[-3]*4)/1440 -> 1900-01-01T00:34:15.340 | AA132: =8*RC[-4] -> 1283.7732655115058 | AB132: =MOD(RC[-23]*1440+RC[-6]+4*R3C2-60*R4C2,1440) -> 727.63096093504885 | AC132: =IF(RC[-1]/4<0,RC[-1]/4+180,RC[-1]/4-180) -> 1.9077402337622118 | AD132: =DEGREES(ACOS(SIN(RADIANS(R2C2))*SIN(RADIANS(RC[-10]))+COS(RADIANS(R2C2))*COS(RADIANS(RC[-10]))*COS(RADIANS(RC[-1])))) -> 51.917940704123673 | AE132: =90-RC[-1] -> 38.082059295876327 | AF132: =IF(RC[-1]>85,0,IF(RC[-1]>5,58.1/TAN(RADIANS(RC[-1]))-0.07/POWER(TAN(RADIANS(RC[-1])),3)+0.000086/POWER(TAN(RADIANS(RC[-1])),5),IF(RC[-1]>-0.575,1735+RC[-1]*(-518.2+RC[-1]*(103.4+RC[-1]*(-12.79+RC[-1]*0.711))),-20.772/TAN(RADIANS(RC[-1])))))/3600 -> 2.055563414105269E-2 | AG132: =RC[-2]+RC[-1] -> 38.102614930017381 | AH132: =IF(RC[-5]>0,MOD(DEGREES(ACOS(((SIN(RADIANS(R2C2))*COS(RADIANS(RC[-4])))-SIN(RADIANS(RC[-14])))/(COS(RADIANS(R2C2))*SIN(RADIANS(RC[-4])))))+180,360),MOD(540-DEGREES(ACOS(((SIN(RADIANS(R2C2))*COS(RADIANS(RC[-4])))-SIN(RADIANS(RC[-14])))/(COS(RADIANS(R2C2))*SIN(RADIANS(RC[-4]))))),360)) -> 182.30399657258249
D133: =R[-1]C+1 -> 2017-05-12T00:00:00.000 | E133: =R5C2 -> 1899-12-31T14:00:00.000 | F133: =RC[-2]+2415018.5+RC[-1]-R4C2/24 -> 2457886.375 | G133: =(RC[-1]-2451545)/36525 -> 0.17361738535249829 | I133: =MOD(280.46646+RC[-2]*(36000.76983 + RC[-2]*0.0003032),360) -> 50.82599770106026 | J133: =357.52911+RC[-3]*(35999.05029 - 0.0001537*RC[-3]) -> 6607.5900918899179 | K133: =0.016708634-RC[-4]*(0.000042037+0.0000001267*RC[-4]) -> 1.6701331826854279E-2 | L133: =SIN(RADIANS(RC[-2]))*(1.914602-RC[-5]*(0.004817+0.000014*RC[-5]))+SIN(RADIANS(2*RC[-2]))*(0.019993-0.000101*RC[-5])+SIN(RADIANS(3*RC[-2]))*0.000289 -> 1.4972591733360279 | M133: =RC[-4]+RC[-1] -> 52.323256874396286 | N133: =RC[-4]+RC[-2] -> 6609.0873510632537 | O133: =(1.000001018*(1-RC[-4]*RC[-4]))/(1+RC[-4]*COS(RADIANS(RC[-1]))) -> 1.0103614564401329 | P133: =RC[-3]-0.00569-0.00478*SIN(RADIANS(125.04-1934.136*RC[-9])) -> 52.315122202657307 | Q133: =23+(26+((21.448-RC[-10]*(46.815+RC[-10]*(0.00059-RC[-10]*0.001813))))/60)/60 -> 23.437033359391226 | R133: =RC[-1]+0.00256*COS(RADIANS(125.04-1934.136*RC[-11])) -> 23.434833499123879 | S133: =DEGREES(ATAN2(COS(RADIANS(RC[-3])),COS(RADIANS(RC[-1]))*SIN(RADIANS(RC[-3])))) -> 49.905531181773945 | T133: =DEGREES(ASIN(SIN(RADIANS(RC[-2]))*SIN(RADIANS(RC[-4])))) -> 18.345018798752779 | U133: =TAN(RADIANS(RC[-3]/2))*TAN(RADIANS(RC[-3]/2)) -> 4.3017697073734797E-2 | V133: =4*DEGREES(RC[-1]*SIN(2*RADIANS(RC[-13]))-2*RC[-11]*SIN(RADIANS(RC[-12]))+4*RC[-11]*RC[-1]*SIN(RADIANS(RC[-12]))*COS(2*RADIANS(RC[-13]))-0.5*RC[-1]*RC[-1]*SIN(4*RADIANS(RC[-13]))-1.25*RC[-11]*RC[-11]*SIN(2*RADIANS(RC[-12]))) -> 3.6454531278863742 | W133: =DEGREES(ACOS(COS(RADIANS(90.833))/(COS(RADIANS(R2C2))*COS(RADIANS(RC[-3])))-TAN(RADIANS(R2C2))*TAN(RADIANS(RC[-3])))) -> 162.90510275929154 | X133: =(720-4*R3C2-RC[-2]+R4C2*60)/1440 -> 1899-12-31T13:52:21.273 | Y133: =(RC[-1]*1440-RC[-2]*4)/1440 -> 1899-12-31T03:00:44.048 | Z133: =(RC[-2]*1440+RC[-3]*4)/1440 -> 1900-01-01T00:43:58.497 | AA133: =8*RC[-4] -> 1303.2408220743323 | AB133: =MOD(RC[-23]*1440+RC[-6]+4*R3C2-60*R4C2,1440) -> 727.64545312788641 | AC133: =IF(RC[-1]/4<0,RC[-1]/4+180,RC[-1]/4-180) -> 1.9113632819716031 | AD133: =DEGREES(ACOS(SIN(RADIANS(R2C2))*SIN(RADIANS(RC[-10]))+COS(RADIANS(R2C2))*COS(RADIANS(RC[-10]))*COS(RADIANS(RC[-1])))) -> 51.668175228612945 | AE133: =90-RC[-1] -> 38.331824771387055 | AF133: =IF(RC[-1]>85,0,IF(RC[-1]>5,58.1/TAN(RADIANS(RC[-1]))-0.07/POWER(TAN(RADIANS(RC[-1])),3)+0.000086/POWER(TAN(RADIANS(RC[-1])),5),IF(RC[-1]>-0.575,1735+RC[-1]*(-518.2+RC[-1]*(103.4+RC[-1]*(-12.79+RC[-1]*0.711))),-20.772/TAN(RADIANS(RC[-1])))))/3600 -> 2.0372794558029955E-2 | AG133: =RC[-2]+RC[-1] -> 38.352197565945083 | AH133: =IF(RC[-5]>0,MOD(DEGREES(ACOS(((SIN(RADIANS(R2C2))*COS(RADIANS(RC[-4])))-SIN(RADIANS(RC[-14])))/(COS(RADIANS(R2C2))*SIN(RADIANS(RC[-4])))))+180,360),MOD(540-DEGREES(ACOS(((SIN(RADIANS(R2C2))*COS(RADIANS(RC[-4])))-SIN(RADIANS(RC[-14])))/(COS(RADIANS(R2C2))*SIN(RADIANS(RC[-4]))))),360)) -> 182.31298720888793
D134: =R[-1]C+1 -> 2017-05-13T00:00:00.000 | E134: =R5C2 -> 1899-12-31T14:00:00.000 | F134: =RC[-2]+2415018.5+RC[-1]-R4C2/24 -> 2457887.375 | G134: =(RC[-1]-2451545)/36525 -> 0.17364476386036962 | I134: =MOD(280.46646+RC[-2]*(36000.76983 + RC[-2]*0.0003032),360) -> 51.811645064107324 | J134: =357.52911+RC[-3]*(35999.05029 - 0.0001537*RC[-3]) -> 6608.5756921701804 | K134: =0.016708634-RC[-4]*(0.000042037+0.0000001267*RC[-4]) -> 1.6701330674739341E-2 | L134: =SIN(RADIANS(RC[-2]))*(1.914602-RC[-5]*(0.004817+0.000014*RC[-5]))+SIN(RADIANS(2*RC[-2]))*(0.019993-0.000101*RC[-5])+SIN(RADIANS(3*RC[-2]))*0.000289 -> 1.476803187655696 | M134: =RC[-4]+RC[-1] -> 53.288448251763022 | N134: =RC[-4]+RC[-2] -> 6610.0524953578361 | O134: =(1.000001018*(1-RC[-4]*RC[-4]))/(1+RC[-4]*COS(RADIANS(RC[-1]))) -> 1.0105829454761848 | P134: =RC[-3]-0.00569-0.00478*SIN(RADIANS(125.04-1934.136*RC[-9])) -> 53.280309784797929 | Q134: =23+(26+((21.448-RC[-10]*(46.815+RC[-10]*(0.00059-RC[-10]*0.001813))))/60)/60 -> 23.437033003356238 | R134: =RC[-1]+0.00256*COS(RADIANS(125.04-1934.136*RC[-11])) -> 23.434834354087883 | S134: =DEGREES(ATAN2(COS(RADIANS(RC[-3])),COS(RADIANS(RC[-1]))*SIN(RADIANS(RC[-3])))) -> 50.889878473792109 | T134: =DEGREES(ASIN(SIN(RADIANS(RC[-2]))*SIN(RADIANS(RC[-4])))) -> 18.589711511066902 | U134: =TAN(RADIANS(RC[-3]/2))*TAN(RADIANS(RC[-3]/2)) -> 4.3017700301786352E-2 | V134: =4*DEGREES(RC[-1]*SIN(2*RADIANS(RC[-13]))-2*RC[-11]*SIN(RADIANS(RC[-12]))+4*RC[-11]*RC[-1]*SIN(RADIANS(RC[-12]))*COS(2*RADIANS(RC[-13]))-0.5*RC[-1]*RC[-1]*SIN(4*RADIANS(RC[-13]))-1.25*RC[-11]*RC[-11]*SIN(2*RADIANS(RC[-12]))) -> 3.6504445213693955 | W134: =DEGREES(ACOS(COS(RADIANS(90.833))/(COS(RADIANS(R2C2))*COS(RADIANS(RC[-3])))-TAN(RADIANS(R2C2))*TAN(RADIANS(RC[-3])))) -> 165.6790692228231 | X134: =(720-4*R3C2-RC[-2]+R4C2*60)/1440 -> 1899-12-31T13:52:20.973 | Y134: =(RC[-1]*1440-RC[-2]*4)/1440 -> 1899-12-31T02:49:37.997 | Z134: =(RC[-2]*1440+RC[-3]*4)/1440 -> 1900-01-01T00:55:03.950 | AA134: =8*RC[-4] -> 1325.4325537825848 | AB134: =MOD(RC[-23]*1440+RC[-6]+4*R3C2-60*R4C2,1440) -> 727.65044452136942 | AC134: =IF(RC[-1]/4<0,RC[-1]/4+180,RC[-1]/4-180) -> 1.9126111303423556 | AD134: =DEGREES(ACOS(SIN(RADIANS(R2C2))*SIN(RADIANS(RC[-10]))+COS(RADIANS(R2C2))*COS(RADIANS(RC[-10]))*COS(RADIANS(RC[-1])))) -> 51.423525743496263 | AE134: =90-RC[-1] -> 38.576474256503737 | AF134: =IF(RC[-1]>85,0,IF(RC[-1]>5,58.1/TAN(RADIANS(RC[-1]))-0.07/POWER(TAN(RADIANS(RC[-1])),3)+0.000086/POWER(TAN(RADIANS(RC[-1])),5),IF(RC[-1]>-0.575,1735+RC[-1]*(-518.2+RC[-1]*(103.4+RC[-1]*(-12.79+RC[-1]*0.711))),-20.772/TAN(RADIANS(RC[-1])))))/3600 -> 2.0195626139381053E-2 | AG134: =RC[-2]+RC[-1] -> 38.59666988264312 | AH134: =IF(RC[-5]>0,MOD(DEGREES(ACOS(((SIN(RADIANS(R2C2))*COS(RADIANS(RC[-4])))-SIN(RADIANS(RC[-14])))/(COS(RADIANS(R2C2))*SIN(RADIANS(RC[-4])))))+180,360),MOD(540-DEGREES(ACOS(((SIN(RADIANS(R2C2))*COS(RADIANS(RC[-4])))-SIN(RADIANS(RC[-14])))/(COS(RADIANS(R2C2))*SIN(RADIANS(RC[-4]))))),360)) -> 182.31905163860023
D135: =R[-1]C+1 -> 2017-05-14T00:00:00.000 | E135: =R5C2 -> 1899-12-31T14:00:00.000 | F135: =RC[-2]+2415018.5+RC[-1]-R4C2/24 -> 2457888.375 | G135: =(RC[-1]-2451545)/36525 -> 0.17367214236824094 | I135: =MOD(280.46646+RC[-2]*(36000.76983 + RC[-2]*0.0003032),360) -> 52.797292427154389 | J135: =357.52911+RC[-3]*(35999.05029 - 0.0001537*RC[-3]) -> 6609.5612924504439 | K135: =0.016708634-RC[-4]*(0.000042037+0.0000001267*RC[-4]) -> 1.6701329522624216E-2 | L135: =SIN(RADIANS(RC[-2]))*(1.914602-RC[-5]*(0.004817+0.000014*RC[-5]))+SIN(RADIANS(2*RC[-2]))*(0.019993-0.000101*RC[-5])+SIN(RADIANS(3*RC[-2]))*0.000289 -> 1.4559272077270049 | M135: =RC[-4]+RC[-1] -> 54.253219634881397 | N135: =RC[-4]+RC[-2] -> 6611.0172196581707 | O135: =(1.000001018*(1-RC[-4]*RC[-4]))/(1+RC[-4]*COS(RADIANS(RC[-1]))) -> 1.0108013206513058 | P135: =RC[-3]-0.00569-0.00478*SIN(RADIANS(125.04-1934.136*RC[-9])) -> 54.245077374781609 | Q135: =23+(26+((21.448-RC[-10]*(46.815+RC[-10]*(0.00059-RC[-10]*0.001813))))/60)/60 -> 23.437032647321246 | R135: =RC[-1]+0.00256*COS(RADIANS(125.04-1934.136*RC[-11])) -> 23.434835210929922 | S135: =DEGREES(ATAN2(COS(RADIANS(RC[-3])),COS(RADIANS(RC[-1]))*SIN(RADIANS(RC[-3])))) -> 51.876597676062417 | T135: =DEGREES(ASIN(SIN(RADIANS(RC[-2]))*SIN(RADIANS(RC[-4])))) -> 18.829176801451233 | U135: =TAN(RADIANS(RC[-3]/2))*TAN(RADIANS(RC[-3]/2)) -> 4.3017703536928853E-2 | V135: =4*DEGREES(RC[-1]*SIN(2*RADIANS(RC[-13]))-2*RC[-11]*SIN(RADIANS(RC[-12]))+4*RC[-11]*RC[-1]*SIN(RADIANS(RC[-12]))*COS(2*RADIANS(RC[-13]))-0.5*RC[-1]*RC[-1]*SIN(4*RADIANS(RC[-13]))-1.25*RC[-11]*RC[-11]*SIN(2*RADIANS(RC[-12]))) -> 3.6459658566686128 | W135: =DEGREES(ACOS(COS(RADIANS(90.833))/(COS(RADIANS(R2C2))*COS(RADIANS(RC[-3])))-TAN(RADIANS(R2C2))*TAN(RADIANS(RC[-3])))) -> 169.04868915703915 | X135: =(720-4*R3C2-RC[-2]+R4C2*60)/1440 -> 1899-12-31T13:52:21.242 | Y135: =(RC[-1]*1440-RC[-2]*4)/1440 -> 1899-12-31T02:36:09.557 | Z135: =(RC[-2]*1440+RC[-3]*4)/1440 -> 1900-01-01T01:08:32.927 | AA135: =8*RC[-4] -> 1352.3895132563132 | AB135: =MOD(RC[-23]*1440+RC[-6]+4*R3C2-60*R4C2,1440) -> 727.64596585666857 | AC135: =IF(RC[-1]/4<0,RC[-1]/4+180,RC[-1]/4-180) -> 1.9114914641671419 | AD135: =DEGREES(ACOS(SIN(RADIANS(R2C2))*SIN(RADIANS(RC[-10]))+COS(RADIANS(R2C2))*COS(RADIANS(RC[-10]))*COS(RADIANS(RC[-1])))) -> 51.184070545799713 | AE135: =90-RC[-1] -> 38.815929454200287 | AF135: =IF(RC[-1]>85,0,IF(RC[-1]>5,58.1/TAN(RADIANS(RC[-1]))-0.07/POWER(TAN(RADIANS(RC[-1])),3)+0.000086/POWER(TAN(RADIANS(RC[-1])),5),IF(RC[-1]>-0.575,1735+RC[-1]*(-518.2+RC[-1]*(103.4+RC[-1]*(-12.79+RC[-1]*0.711))),-20.772/TAN(RADIANS(RC[-1])))))/3600 -> 2.0024029784756505E-2 | AG135: =RC[-2]+RC[-1] -> 38.835953483985044 | AH135: =IF(RC[-5]>0,MOD(DEGREES(ACOS(((SIN(RADIANS(R2C2))*COS(RADIANS(RC[-4])))-SIN(RADIANS(RC[-14])))/(COS(RADIANS(R2C2))*SIN(RADIANS(RC[-4])))))+180,360),MOD(540-DEGREES(ACOS(((SIN(RADIANS(R2C2))*COS(RADIANS(RC[-4])))-SIN(RADIANS(RC[-14])))/(COS(RADIANS(R2C2))*SIN(RADIANS(RC[-4]))))),360)) -> 182.32217918066058
D136: =R[-1]C+1 -> 2017-05-15T00:00:00.000 | E136: =R5C2 -> 1899-12-31T14:00:00.000 | F136: =RC[-2]+2415018.5+RC[-1]-R4C2/24 -> 2457889.375 | G136: =(RC[-1]-2451545)/36525 -> 0.17369952087611226 | I136: =MOD(280.46646+RC[-2]*(36000.76983 + RC[-2]*0.0003032),360) -> 53.782939790202363 | J136: =357.52911+RC[-3]*(35999.05029 - 0.0001537*RC[-3]) -> 6610.5468927307074 | K136: =0.016708634-RC[-4]*(0.000042037+0.0000001267*RC[-4]) -> 1.6701328370508896E-2 | L136: =SIN(RADIANS(RC[-2]))*(1.914602-RC[-5]*(0.004817+0.000014*RC[-5]))+SIN(RADIANS(2*RC[-2]))*(0.019993-0.000101*RC[-5])+SIN(RADIANS(3*RC[-2]))*0.000289 -> 1.4346375048183755 | M136: =RC[-4]+RC[-1] -> 55.217577295020739 | N136: =RC[-4]+RC[-2] -> 6611.9815302355255 | O136: =(1.000001018*(1-RC[-4]*RC[-4]))/(1+RC[-4]*COS(RADIANS(RC[-1]))) -> 1.0110165214147493 | P136: =RC[-3]-0.00569-0.00478*SIN(RADIANS(125.04-1934.136*RC[-9])) -> 55.209431243880928 | Q136: =23+(26+((21.448-RC[-10]*(46.815+RC[-10]*(0.00059-RC[-10]*0.001813))))/60)/60 -> 23.437032291286254 | R136: =RC[-1]+0.00256*COS(RADIANS(125.04-1934.136*RC[-11])) -> 23.434836069648963 | S136: =DEGREES(ATAN2(COS(RADIANS(RC[-3])),COS(RADIANS(RC[-1]))*SIN(RADIANS(RC[-3])))) -> 52.865677688328837 | T136: =DEGREES(ASIN(SIN(RADIANS(RC[-2]))*SIN(RADIANS(RC[-4])))) -> 19.063337287962185 | U136: =TAN(RADIANS(RC[-3]/2))*TAN(RADIANS(RC[-3]/2)) -> 4.3017706779158407E-2 | V136: =4*DEGREES(RC[-1]*SIN(2*RADIANS(RC[-13]))-2*RC[-11]*SIN(RADIANS(RC[-12]))+4*RC[-11]*RC[-1]*SIN(RADIANS(RC[-12]))*COS(2*RADIANS(RC[-13]))-0.5*RC[-1]*RC[-1]*SIN(4*RADIANS(RC[-13]))-1.25*RC[-11]*RC[-11]*SIN(2*RADIANS(RC[-12]))) -> 3.6320612256903155 | W136: =DEGREES(ACOS(COS(RADIANS(90.833))/(COS(RADIANS(R2C2))*COS(RADIANS(RC[-3])))-TAN(RADIANS(R2C2))*TAN(RADIANS(RC[-3])))) -> 173.93562092288852 | X136: =(720-4*R3C2-RC[-2]+R4C2*60)/1440 -> 1899-12-31T13:52:22.076 | Y136: =(RC[-1]*1440-RC[-2]*4)/1440 -> 1899-12-31T02:16:37.527 | Z136: =(RC[-2]*1440+RC[-3]*4)/1440 -> 1900-01-01T01:28:06.625 | AA136: =8*RC[-4] -> 1391.4849673831081 | AB136: =MOD(RC[-23]*1440+RC[-6]+4*R3C2-60*R4C2,1440) -> 727.63206122569034 | AC136: =IF(RC[-1]/4<0,RC[-1]/4+180,RC[-1]/4-180) -> 1.908015306422584 | AD136: =DEGREES(ACOS(SIN(RADIANS(R2C2))*SIN(RADIANS(RC[-10]))+COS(RADIANS(R2C2))*COS(RADIANS(RC[-10]))*COS(RADIANS(RC[-1])))) -> 50.949887022367157 | AE136: =90-RC[-1] -> 39.050112977632843 | AF136: =IF(RC[-1]>85,0,IF(RC[-1]>5,58.1/TAN(RADIANS(RC[-1]))-0.07/POWER(TAN(RADIANS(RC[-1])),3)+0.000086/POWER(TAN(RADIANS(RC[-1])),5),IF(RC[-1]>-0.575,1735+RC[-1]*(-518.2+RC[-1]*(103.4+RC[-1]*(-12.79+RC[-1]*0.711))),-20.772/TAN(RADIANS(RC[-1])))))/3600 -> 1.9857911262011835E-2 | AG136: =RC[-2]+RC[-1] -> 39.069970888894858 | AH136: =IF(RC[-5]>0,MOD(DEGREES(ACOS(((SIN(RADIANS(R2C2))*COS(RADIANS(RC[-4])))-SIN(RADIANS(RC[-14])))/(COS(RADIANS(R2C2))*SIN(RADIANS(RC[-4])))))+180,360),MOD(540-DEGREES(ACOS(((SIN(RADIANS(R2C2))*COS(RADIANS(RC[-4])))-SIN(RADIANS(RC[-14])))/(COS(RADIANS(R2C2))*SIN(RADIANS(RC[-4]))))),360)) -> 182.32236375166514
D137: =R[-1]C+1 -> 2017-05-16T00:00:00.000 | E137: =R5C2 -> 1899-12-31T14:00:00.000 | F137: =RC[-2]+2415018.5+RC[-1]-R4C2/24 -> 2457890.375 | G137: =(RC[-1]-2451545)/36525 -> 0.17372689938398359 | I137: =MOD(280.46646+RC[-2]*(36000.76983 + RC[-2]*0.0003032),360) -> 54.768587153251246 | J137: =357.52911+RC[-3]*(35999.05029 - 0.0001537*RC[-3]) -> 6611.53249301097 | K137: =0.016708634-RC[-4]*(0.000042037+0.0000001267*RC[-4]) -> 1.6701327218393389E-2 | L137: =SIN(RADIANS(RC[-2]))*(1.914602-RC[-5]*(0.004817+0.000014*RC[-5]))+SIN(RADIANS(2*RC[-2]))*(0.019993-0.000101*RC[-5])+SIN(RADIANS(3*RC[-2]))*0.000289 -> 1.4129404528850036 | M137: =RC[-4]+RC[-1] -> 56.18152760613625 | N137: =RC[-4]+RC[-2] -> 6612.9454334638549 | O137: =(1.000001018*(1-RC[-4]*RC[-4]))/(1+RC[-4]*COS(RADIANS(RC[-1]))) -> 1.0112284881735798 | P137: =RC[-3]-0.00569-0.00478*SIN(RADIANS(125.04-1934.136*RC[-9])) -> 56.173377766054323 | Q137: =23+(26+((21.448-RC[-10]*(46.815+RC[-10]*(0.00059-RC[-10]*0.001813))))/60)/60 -> 23.437031935251266 | R137: =RC[-1]+0.00256*COS(RADIANS(125.04-1934.136*RC[-11])) -> 23.434836930243971 | S137: =DEGREES(ATAN2(COS(RADIANS(RC[-3])),COS(RADIANS(RC[-1]))*SIN(RADIANS(RC[-3])))) -> 53.857104076643637 | T137: =DEGREES(ASIN(SIN(RADIANS(RC[-2]))*SIN(RADIANS(RC[-4])))) -> 19.292116727634145 | U137: =TAN(RADIANS(RC[-3]/2))*TAN(RADIANS(RC[-3]/2)) -> 4.3017710028471115E-2 | V137: =4*DEGREES(RC[-1]*SIN(2*RADIANS(RC[-13]))-2*RC[-11]*SIN(RADIANS(RC[-12]))+4*RC[-11]*RC[-1]*SIN(RADIANS(RC[-12]))*COS(2*RADIANS(RC[-13]))-0.5*RC[-1]*RC[-1]*SIN(4*RADIANS(RC[-13]))-1.25*RC[-11]*RC[-11]*SIN(2*RADIANS(RC[-12]))) -> 3.6087881727114781 | W137: =DEGREES(ACOS(COS(RADIANS(90.833))/(COS(RADIANS(R2C2))*COS(RADIANS(RC[-3])))-TAN(RADIANS(R2C2))*TAN(RADIANS(RC[-3])))) -> #NUM! | X137: =(720-4*R3C2-RC[-2]+R4C2*60)/1440 -> 1899-12-31T13:52:23.473 | Y137: =(RC[-1]*1440-RC[-2]*4)/1440 -> #NUM! | Z137: =(RC[-2]*1440+RC[-3]*4)/1440 -> #NUM! | AA137: =8*RC[-4] -> #NUM! | AB137: =MOD(RC[-23]*1440+RC[-6]+4*R3C2-60*R4C2,1440) -> 727.60878817271146 | AC137: =IF(RC[-1]/4<0,RC[-1]/4+180,RC[-1]/4-180) -> 1.9021970431778641 | AD137: =DEGREES(ACOS(SIN(RADIANS(R2C2))*SIN(RADIANS(RC[-10]))+COS(RADIANS(R2C2))*COS(RADIANS(RC[-10]))*COS(RADIANS(RC[-1])))) -> 50.721051595561896 | AE137: =90-RC[-1] -> 39.278948404438104 | AF137: =IF(RC[-1]>85,0,IF(RC[-1]>5,58.1/TAN(RADIANS(RC[-1]))-0.07/POWER(TAN(RADIANS(RC[-1])),3)+0.000086/POWER(TAN(RADIANS(RC[-1])),5),IF(RC[-1]>-0.575,1735+RC[-1]*(-518.2+RC[-1]*(103.4+RC[-1]*(-12.79+RC[-1]*0.711))),-20.772/TAN(RADIANS(RC[-1])))))/3600 -> 1.9697180995795288E-2 | AG137: =RC[-2]+RC[-1] -> 39.298645585433903 | AH137: =IF(RC[-5]>0,MOD(DEGREES(ACOS(((SIN(RADIANS(R2C2))*COS(RADIANS(RC[-4])))-SIN(RADIANS(RC[-14])))/(COS(RADIANS(R2C2))*SIN(RADIANS(RC[-4])))))+180,360),MOD(540-DEGREES(ACOS(((SIN(RADIANS(R2C2))*COS(RADIANS(RC[-4])))-SIN(RADIANS(RC[-14])))/(COS(RADIANS(R2C2))*SIN(RADIANS(RC[-4]))))),360)) -> 182.31960397256009
D138: =R[-1]C+1 -> 2017-05-17T00:00:00.000 | E138: =R5C2 -> 1899-12-31T14:00:00.000 | F138: =RC[-2]+2415018.5+RC[-1]-R4C2/24 -> 2457891.375 | G138: =(RC[-1]-2451545)/36525 -> 0.17375427789185488 | I138: =MOD(280.46646+RC[-2]*(36000.76983 + RC[-2]*0.0003032),360) -> 55.754234516299221 | J138: =357.52911+RC[-3]*(35999.05029 - 0.0001537*RC[-3]) -> 6612.5180932912317 | K138: =0.016708634-RC[-4]*(0.000042037+0.0000001267*RC[-4]) -> 1.6701326066277691E-2 | L138: =SIN(RADIANS(RC[-2]))*(1.914602-RC[-5]*(0.004817+0.000014*RC[-5]))+SIN(RADIANS(2*RC[-2]))*(0.019993-0.000101*RC[-5])+SIN(RADIANS(3*RC[-2]))*0.000289 -> 1.3908425266399431 | M138: =RC[-4]+RC[-1] -> 57.145077042939164 | N138: =RC[-4]+RC[-2] -> 6613.9089358178717 | O138: =(1.000001018*(1-RC[-4]*RC[-4]))/(1+RC[-4]*COS(RADIANS(RC[-1]))) -> 1.0114371623056395 | P138: =RC[-3]-0.00569-0.00478*SIN(RADIANS(125.04-1934.136*RC[-9])) -> 57.136923416016259 | Q138: =23+(26+((21.448-RC[-10]*(46.815+RC[-10]*(0.00059-RC[-10]*0.001813))))/60)/60 -> 23.437031579216274 | R138: =RC[-1]+0.00256*COS(RADIANS(125.04-1934.136*RC[-11])) -> 23.4348377927139 | S138: =DEGREES(ATAN2(COS(RADIANS(RC[-3])),COS(RADIANS(RC[-1]))*SIN(RADIANS(RC[-3])))) -> 54.850859052347452 | T138: =DEGREES(ASIN(SIN(RADIANS(RC[-2]))*SIN(RADIANS(RC[-4])))) -> 19.51544007230526 | U138: =TAN(RADIANS(RC[-3]/2))*TAN(RADIANS(RC[-3]/2)) -> 4.3017713284863007E-2 | V138: =4*DEGREES(RC[-1]*SIN(2*RADIANS(RC[-13]))-2*RC[-11]*SIN(RADIANS(RC[-12]))+4*RC[-11]*RC[-1]*SIN(RADIANS(RC[-12]))*COS(2*RADIANS(RC[-13]))-0.5*RC[-1]*RC[-1]*SIN(4*RADIANS(RC[-13]))-1.25*RC[-11]*RC[-11]*SIN(2*RADIANS(RC[-12]))) -> 3.5762177737469067 | W138: =DEGREES(ACOS(COS(RADIANS(90.833))/(COS(RADIANS(R2C2))*COS(RADIANS(RC[-3])))-TAN(RADIANS(R2C2))*TAN(RADIANS(RC[-3])))) -> #NUM! | X138: =(720-4*R3C2-RC[-2]+R4C2*60)/1440 -> 1899-12-31T13:52:25.427 | Y138: =(RC[-1]*1440-RC[-2]*4)/1440 -> #NUM! | Z138: =(RC[-2]*1440+RC[-3]*4)/1440 -> #NUM! | AA138: =8*RC[-4] -> #NUM! | AB138: =MOD(RC[-23]*1440+RC[-6]+4*R3C2-60*R4C2,1440) -> 727.57621777374686 | AC138: =IF(RC[-1]/4<0,RC[-1]/4+180,RC[-1]/4-180) -> 1.8940544434367155 | AD138: =DEGREES(ACOS(SIN(RADIANS(R2C2))*SIN(RADIANS(RC[-10]))+COS(RADIANS(R2C2))*COS(RADIANS(RC[-10]))*COS(RADIANS(RC[-1])))) -> 50.497639666736866 | AE138: =90-RC[-1] -> 39.502360333263134 | AF138: =IF(RC[-1]>85,0,IF(RC[-1]>5,58.1/TAN(RADIANS(RC[-1]))-0.07/POWER(TAN(RADIANS(RC[-1])),3)+0.000086/POWER(TAN(RADIANS(RC[-1])),5),IF(RC[-1]>-0.575,1735+RC[-1]*(-518.2+RC[-1]*(103.4+RC[-1]*(-12.79+RC[-1]*0.711))),-20.772/TAN(RADIANS(RC[-1])))))/3600 -> 1.9541753866438978E-2 | AG138: =RC[-2]+RC[-1] -> 39.521902087129575 | AH138: =IF(RC[-5]>0,MOD(DEGREES(ACOS(((SIN(RADIANS(R2C2))*COS(RADIANS(RC[-4])))-SIN(RADIANS(RC[-14])))/(COS(RADIANS(R2C2))*SIN(RADIANS(RC[-4])))))+180,360),MOD(540-DEGREES(ACOS(((SIN(RADIANS(R2C2))*COS(RADIANS(RC[-4])))-SIN(RADIANS(RC[-14])))/(COS(RADIANS(R2C2))*SIN(RADIANS(RC[-4]))))),360)) -> 182.31390326745381
D139: =R[-1]C+1 -> 2017-05-18T00:00:00.000 | E139: =R5C2 -> 1899-12-31T14:00:00.000 | F139: =RC[-2]+2415018.5+RC[-1]-R4C2/24 -> 2457892.375 | G139: =(RC[-1]-2451545)/36525 -> 0.1737816563997262 | I139: =MOD(280.46646+RC[-2]*(36000.76983 + RC[-2]*0.0003032),360) -> 56.739881879348104 | J139: =357.52911+RC[-3]*(35999.05029 - 0.0001537*RC[-3]) -> 6613.5036935714934 | K139: =0.016708634-RC[-4]*(0.000042037+0.0000001267*RC[-4]) -> 1.6701324914161802E-2 | L139: =SIN(RADIANS(RC[-2]))*(1.914602-RC[-5]*(0.004817+0.000014*RC[-5]))+SIN(RADIANS(2*RC[-2]))*(0.019993-0.000101*RC[-5])+SIN(RADIANS(3*RC[-2]))*0.000289 -> 1.3683502996174759 | M139: =RC[-4]+RC[-1] -> 58.108232178965579 | N139: =RC[-4]+RC[-2] -> 6614.8720438711107 | O139: =(1.000001018*(1-RC[-4]*RC[-4]))/(1+RC[-4]*COS(RADIANS(RC[-1]))) -> 1.0116424861722262 | P139: =RC[-3]-0.00569-0.00478*SIN(RADIANS(125.04-1934.136*RC[-9])) -> 58.100074767306069 | Q139: =23+(26+((21.448-RC[-10]*(46.815+RC[-10]*(0.00059-RC[-10]*0.001813))))/60)/60 -> 23.437031223181286 | R139: =RC[-1]+0.00256*COS(RADIANS(125.04-1934.136*RC[-11])) -> 23.434838657057714 | S139: =DEGREES(ATAN2(COS(RADIANS(RC[-3])),COS(RADIANS(RC[-1]))*SIN(RADIANS(RC[-3])))) -> 55.846921456193506 | T139: =DEGREES(ASIN(SIN(RADIANS(RC[-2]))*SIN(RADIANS(RC[-4])))) -> 19.73323352554209 | U139: =TAN(RADIANS(RC[-3]/2))*TAN(RADIANS(RC[-3]/2)) -> 4.3017716548330177E-2 | V139: =4*DEGREES(RC[-1]*SIN(2*RADIANS(RC[-13]))-2*RC[-11]*SIN(RADIANS(RC[-12]))+4*RC[-11]*RC[-1]*SIN(RADIANS(RC[-12]))*COS(2*RADIANS(RC[-13]))-0.5*RC[-1]*RC[-1]*SIN(4*RADIANS(RC[-13]))-1.25*RC[-11]*RC[-11]*SIN(2*RADIANS(RC[-12]))) -> 3.5344346926858234 | W139: =DEGREES(ACOS(COS(RADIANS(90.833))/(COS(RADIANS(R2C2))*COS(RADIANS(RC[-3])))-TAN(RADIANS(R2C2))*TAN(RADIANS(RC[-3])))) -> #NUM! | X139: =(720-4*R3C2-RC[-2]+R4C2*60)/1440 -> 1899-12-31T13:52:27.934 | Y139: =(RC[-1]*1440-RC[-2]*4)/1440 -> #NUM! | Z139: =(RC[-2]*1440+RC[-3]*4)/1440 -> #NUM! | AA139: =8*RC[-4] -> #NUM! | AB139: =MOD(RC[-23]*1440+RC[-6]+4*R3C2-60*R4C2,1440) -> 727.53443469268586 | AC139: =IF(RC[-1]/4<0,RC[-1]/4+180,RC[-1]/4-180) -> 1.8836086731714659 | AD139: =DEGREES(ACOS(SIN(RADIANS(R2C2))*SIN(RADIANS(RC[-10]))+COS(RADIANS(R2C2))*COS(RADIANS(RC[-10]))*COS(RADIANS(RC[-1])))) -> 50.279725557562543 | AE139: =90-RC[-1] -> 39.720274442437457 | AF139: =IF(RC[-1]>85,0,IF(RC[-1]>5,58.1/TAN(RADIANS(RC[-1]))-0.07/POWER(TAN(RADIANS(RC[-1])),3)+0.000086/POWER(TAN(RADIANS(RC[-1])),5),IF(RC[-1]>-0.575,1735+RC[-1]*(-518.2+RC[-1]*(103.4+RC[-1]*(-12.79+RC[-1]*0.711))),-20.772/TAN(RADIANS(RC[-1])))))/3600 -> 1.9391549018563641E-2 | AG139: =RC[-2]+RC[-1] -> 39.739665991456022 | AH139: =IF(RC[-5]>0,MOD(DEGREES(ACOS(((SIN(RADIANS(R2C2))*COS(RADIANS(RC[-4])))-SIN(RADIANS(RC[-14])))/(COS(RADIANS(R2C2))*SIN(RADIANS(RC[-4])))))+180,360),MOD(540-DEGREES(ACOS(((SIN(RADIANS(R2C2))*COS(RADIANS(RC[-4])))-SIN(RADIANS(RC[-14])))/(COS(RADIANS(R2C2))*SIN(RADIANS(RC[-4]))))),360)) -> 182.3052699538072
D140: =R[-1]C+1 -> 2017-05-19T00:00:00.000 | E140: =R5C2 -> 1899-12-31T14:00:00.000 | F140: =RC[-2]+2415018.5+RC[-1]-R4C2/24 -> 2457893.375 | G140: =(RC[-1]-2451545)/36525 -> 0.17380903490759753 | I140: =MOD(280.46646+RC[-2]*(36000.76983 + RC[-2]*0.0003032),360) -> 57.725529242398807 | J140: =357.52911+RC[-3]*(35999.05029 - 0.0001537*RC[-3]) -> 6614.489293851756 | K140: =0.016708634-RC[-4]*(0.000042037+0.0000001267*RC[-4]) -> 1.6701323762045726E-2 | L140: =SIN(RADIANS(RC[-2]))*(1.914602-RC[-5]*(0.004817+0.000014*RC[-5]))+SIN(RADIANS(2*RC[-2]))*(0.019993-0.000101*RC[-5])+SIN(RADIANS(3*RC[-2]))*0.000289 -> 1.3454704422291615 | M140: =RC[-4]+RC[-1] -> 59.070999684627971 | N140: =RC[-4]+RC[-2] -> 6615.8347642939852 | O140: =(1.000001018*(1-RC[-4]*RC[-4]))/(1+RC[-4]*COS(RADIANS(RC[-1]))) -> 1.0118444031304794 | P140: =RC[-3]-0.00569-0.00478*SIN(RADIANS(125.04-1934.136*RC[-9])) -> 59.062838490339466 | Q140: =23+(26+((21.448-RC[-10]*(46.815+RC[-10]*(0.00059-RC[-10]*0.001813))))/60)/60 -> 23.437030867146294 | R140: =RC[-1]+0.00256*COS(RADIANS(125.04-1934.136*RC[-11])) -> 23.43483952327437 | S140: =DEGREES(ATAN2(COS(RADIANS(RC[-3])),COS(RADIANS(RC[-1]))*SIN(RADIANS(RC[-3])))) -> 56.845266747867029 | T140: =DEGREES(ASIN(SIN(RADIANS(RC[-2]))*SIN(RADIANS(RC[-4])))) -> 19.945424600544474 | U140: =TAN(RADIANS(RC[-3]/2))*TAN(RADIANS(RC[-3]/2)) -> 4.3017719818868705E-2 | V140: =4*DEGREES(RC[-1]*SIN(2*RADIANS(RC[-13]))-2*RC[-11]*SIN(RADIANS(RC[-12]))+4*RC[-11]*RC[-1]*SIN(RADIANS(RC[-12]))*COS(2*RADIANS(RC[-13]))-0.5*RC[-1]*RC[-1]*SIN(4*RADIANS(RC[-13]))-1.25*RC[-11]*RC[-11]*SIN(2*RADIANS(RC[-12]))) -> 3.4835372133050311 | W140: =DEGREES(ACOS(COS(RADIANS(90.833))/(COS(RADIANS(R2C2))*COS(RADIANS(RC[-3])))-TAN(RADIANS(R2C2))*TAN(RADIANS(RC[-3])))) -> #NUM! | X140: =(720-4*R3C2-RC[-2]+R4C2*60)/1440 -> 1899-12-31T13:52:30.988 | Y140: =(RC[-1]*1440-RC[-2]*4)/1440 -> #NUM! | Z140: =(RC[-2]*1440+RC[-3]*4)/1440 -> #NUM! | AA140: =8*RC[-4] -> #NUM! | AB140: =MOD(RC[-23]*1440+RC[-6]+4*R3C2-60*R4C2,1440) -> 727.483537213305 | AC140: =IF(RC[-1]/4<0,RC[-1]/4+180,RC[-1]/4-180) -> 1.8708843033262497 | AD140: =DEGREES(ACOS(SIN(RADIANS(R2C2))*SIN(RADIANS(RC[-10]))+COS(RADIANS(R2C2))*COS(RADIANS(RC[-10]))*COS(RADIANS(RC[-1])))) -> 50.067382449321421 | AE140: =90-RC[-1] -> 39.932617550678579 | AF140: =IF(RC[-1]>85,0,IF(RC[-1]>5,58.1/TAN(RADIANS(RC[-1]))-0.07/POWER(TAN(RADIANS(RC[-1])),3)+0.000086/POWER(TAN(RADIANS(RC[-1])),5),IF(RC[-1]>-0.575,1735+RC[-1]*(-518.2+RC[-1]*(103.4+RC[-1]*(-12.79+RC[-1]*0.711))),-20.772/TAN(RADIANS(RC[-1])))))/3600 -> 1.9246489678856067E-2 | AG140: =RC[-2]+RC[-1] -> 39.951864040357435 | AH140: =IF(RC[-5]>0,MOD(DEGREES(ACOS(((SIN(RADIANS(R2C2))*COS(RADIANS(RC[-4])))-SIN(RADIANS(RC[-14])))/(COS(RADIANS(R2C2))*SIN(RADIANS(RC[-4])))))+180,360),MOD(540-DEGREES(ACOS(((SIN(RADIANS(R2C2))*COS(RADIANS(RC[-4])))-SIN(RADIANS(RC[-14])))/(COS(RADIANS(R2C2))*SIN(RADIANS(RC[-4]))))),360)) -> 182.29371732333848
D141: =R[-1]C+1 -> 2017-05-20T00:00:00.000 | E141: =R5C2 -> 1899-12-31T14:00:00.000 | F141: =RC[-2]+2415018.5+RC[-1]-R4C2/24 -> 2457894.375 | G141: =(RC[-1]-2451545)/36525 -> 0.17383641341546885 | I141: =MOD(280.46646+RC[-2]*(36000.76983 + RC[-2]*0.0003032),360) -> 58.71117660544769 | J141: =357.52911+RC[-3]*(35999.05029 - 0.0001537*RC[-3]) -> 6615.4748941320186 | K141: =0.016708634-RC[-4]*(0.000042037+0.0000001267*RC[-4]) -> 1.6701322609929459E-2 | L141: =SIN(RADIANS(RC[-2]))*(1.914602-RC[-5]*(0.004817+0.000014*RC[-5]))+SIN(RADIANS(2*RC[-2]))*(0.019993-0.000101*RC[-5])+SIN(RADIANS(3*RC[-2]))*0.000289 -> 1.3222097198129295 | M141: =RC[-4]+RC[-1] -> 60.033386325260622 | N141: =RC[-4]+RC[-2] -> 6616.7971038518317 | O141: =(1.000001018*(1-RC[-4]*RC[-4]))/(1+RC[-4]*COS(RADIANS(RC[-1]))) -> 1.0120428575454765 | P141: =RC[-3]-0.00569-0.00478*SIN(RADIANS(125.04-1934.136*RC[-9])) -> 60.025221350453961 | Q141: =23+(26+((21.448-RC[-10]*(46.815+RC[-10]*(0.00059-RC[-10]*0.001813))))/60)/60 -> 23.437030511111306 | R141: =RC[-1]+0.00256*COS(RADIANS(125.04-1934.136*RC[-11])) -> 23.434840391362822 | S141: =DEGREES(ATAN2(COS(RADIANS(RC[-3])),COS(RADIANS(RC[-1]))*SIN(RADIANS(RC[-3])))) -> 57.845867001171371 | T141: =DEGREES(ASIN(SIN(RADIANS(RC[-2]))*SIN(RADIANS(RC[-4])))) -> 20.151942178910616 | U141: =TAN(RADIANS(RC[-3]/2))*TAN(RADIANS(RC[-3]/2)) -> 4.3017723096474628E-2 | V141: =4*DEGREES(RC[-1]*SIN(2*RADIANS(RC[-13]))-2*RC[-11]*SIN(RADIANS(RC[-12]))+4*RC[-11]*RC[-1]*SIN(RADIANS(RC[-12]))*COS(2*RADIANS(RC[-13]))-0.5*RC[-1]*RC[-1]*SIN(4*RADIANS(RC[-13]))-1.25*RC[-11]*RC[-11]*SIN(2*RADIANS(RC[-12]))) -> 3.4236372463339064 | W141: =DEGREES(ACOS(COS(RADIANS(90.833))/(COS(RADIANS(R2C2))*COS(RADIANS(RC[-3])))-TAN(RADIANS(R2C2))*TAN(RADIANS(RC[-3])))) -> #NUM! | X141: =(720-4*R3C2-RC[-2]+R4C2*60)/1440 -> 1899-12-31T13:52:34.582 | Y141: =(RC[-1]*1440-RC[-2]*4)/1440 -> #NUM! | Z141: =(RC[-2]*1440+RC[-3]*4)/1440 -> #NUM! | AA141: =8*RC[-4] -> #NUM! | AB141: =MOD(RC[-23]*1440+RC[-6]+4*R3C2-60*R4C2,1440) -> 727.4236372463339 | AC141: =IF(RC[-1]/4<0,RC[-1]/4+180,RC[-1]/4-180) -> 1.8559093115834742 | AD141: =DEGREES(ACOS(SIN(RADIANS(R2C2))*SIN(RADIANS(RC[-10]))+COS(RADIANS(R2C2))*COS(RADIANS(RC[-10]))*COS(RADIANS(RC[-1])))) -> 49.86068232028672 | AE141: =90-RC[-1] -> 40.13931767971328 | AF141: =IF(RC[-1]>85,0,IF(RC[-1]>5,58.1/TAN(RADIANS(RC[-1]))-0.07/POWER(TAN(RADIANS(RC[-1])),3)+0.000086/POWER(TAN(RADIANS(RC[-1])),5),IF(RC[-1]>-0.575,1735+RC[-1]*(-518.2+RC[-1]*(103.4+RC[-1]*(-12.79+RC[-1]*0.711))),-20.772/TAN(RADIANS(RC[-1])))))/3600 -> 1.9106502982516291E-2 | AG141: =RC[-2]+RC[-1] -> 40.158424182695796 | AH141: =IF(RC[-5]>0,MOD(DEGREES(ACOS(((SIN(RADIANS(R2C2))*COS(RADIANS(RC[-4])))-SIN(RADIANS(RC[-14])))/(COS(RADIANS(R2C2))*SIN(RADIANS(RC[-4])))))+180,360),MOD(540-DEGREES(ACOS(((SIN(RADIANS(R2C2))*COS(RADIANS(RC[-4])))-SIN(RADIANS(RC[-14])))/(COS(RADIANS(R2C2))*SIN(RADIANS(RC[-4]))))),360)) -> 182.27926371293768
D142: =R[-1]C+1 -> 2017-05-21T00:00:00.000 | E142: =R5C2 -> 1899-12-31T14:00:00.000 | F142: =RC[-2]+2415018.5+RC[-1]-R4C2/24 -> 2457895.375 | G142: =(RC[-1]-2451545)/36525 -> 0.17386379192334017 | I142: =MOD(280.46646+RC[-2]*(36000.76983 + RC[-2]*0.0003032),360) -> 59.696823968498393 | J142: =357.52911+RC[-3]*(35999.05029 - 0.0001537*RC[-3]) -> 6616.4604944122802 | K142: =0.016708634-RC[-4]*(0.000042037+0.0000001267*RC[-4]) -> 1.6701321457813001E-2 | L142: =SIN(RADIANS(RC[-2]))*(1.914602-RC[-5]*(0.004817+0.000014*RC[-5]))+SIN(RADIANS(2*RC[-2]))*(0.019993-0.000101*RC[-5])+SIN(RADIANS(3*RC[-2]))*0.000289 -> 1.2985749906758548 | M142: =RC[-4]+RC[-1] -> 60.995398959174246 | N142: =RC[-4]+RC[-2] -> 6617.7590694029559 | O142: =(1.000001018*(1-RC[-4]*RC[-4]))/(1+RC[-4]*COS(RADIANS(RC[-1]))) -> 1.0122377948020425 | P142: =RC[-3]-0.00569-0.00478*SIN(RADIANS(125.04-1934.136*RC[-9])) -> 60.987230205963499 | Q142: =23+(26+((21.448-RC[-10]*(46.815+RC[-10]*(0.00059-RC[-10]*0.001813))))/60)/60 -> 23.437030155076318 | R142: =RC[-1]+0.00256*COS(RADIANS(125.04-1934.136*RC[-11])) -> 23.434841261322031 | S142: =DEGREES(ATAN2(COS(RADIANS(RC[-3])),COS(RADIANS(RC[-1]))*SIN(RADIANS(RC[-3])))) -> 58.848690905144721 | T142: =DEGREES(ASIN(SIN(RADIANS(RC[-2]))*SIN(RADIANS(RC[-4])))) -> 20.352716570135037 | U142: =TAN(RADIANS(RC[-3]/2))*TAN(RADIANS(RC[-3]/2)) -> 4.3017726381144025E-2 | V142: =4*DEGREES(RC[-1]*SIN(2*RADIANS(RC[-13]))-2*RC[-11]*SIN(RADIANS(RC[-12]))+4*RC[-11]*RC[-1]*SIN(RADIANS(RC[-12]))*COS(2*RADIANS(RC[-13]))-0.5*RC[-1]*RC[-1]*SIN(4*RADIANS(RC[-13]))-1.25*RC[-11]*RC[-11]*SIN(2*RADIANS(RC[-12]))) -> 3.3548603108194159 | W142: =DEGREES(ACOS(COS(RADIANS(90.833))/(COS(RADIANS(R2C2))*COS(RADIANS(RC[-3])))-TAN(RADIANS(R2C2))*TAN(RADIANS(RC[-3])))) -> #NUM! | X142: =(720-4*R3C2-RC[-2]+R4C2*60)/1440 -> 1899-12-31T13:52:38.708 | Y142: =(RC[-1]*1440-RC[-2]*4)/1440 -> #NUM! | Z142: =(RC[-2]*1440+RC[-3]*4)/1440 -> #NUM! | AA142: =8*RC[-4] -> #NUM! | AB142: =MOD(RC[-23]*1440+RC[-6]+4*R3C2-60*R4C2,1440) -> 727.35486031081939 | AC142: =IF(RC[-1]/4<0,RC[-1]/4+180,RC[-1]/4-180) -> 1.8387150777048475 | AD142: =DEGREES(ACOS(SIN(RADIANS(R2C2))*SIN(RADIANS(RC[-10]))+COS(RADIANS(R2C2))*COS(RADIANS(RC[-10]))*COS(RADIANS(RC[-1])))) -> 49.659695881318179 | AE142: =90-RC[-1] -> 40.340304118681821 | AF142: =IF(RC[-1]>85,0,IF(RC[-1]>5,58.1/TAN(RADIANS(RC[-1]))-0.07/POWER(TAN(RADIANS(RC[-1])),3)+0.000086/POWER(TAN(RADIANS(RC[-1])),5),IF(RC[-1]>-0.575,1735+RC[-1]*(-518.2+RC[-1]*(103.4+RC[-1]*(-12.79+RC[-1]*0.711))),-20.772/TAN(RADIANS(RC[-1])))))/3600 -> 1.8971519807911723E-2 | AG142: =RC[-2]+RC[-1] -> 40.359275638489734 | AH142: =IF(RC[-5]>0,MOD(DEGREES(ACOS(((SIN(RADIANS(R2C2))*COS(RADIANS(RC[-4])))-SIN(RADIANS(RC[-14])))/(COS(RADIANS(R2C2))*SIN(RADIANS(RC[-4])))))+180,360),MOD(540-DEGREES(ACOS(((SIN(RADIANS(R2C2))*COS(RADIANS(RC[-4])))-SIN(RADIANS(RC[-14])))/(COS(RADIANS(R2C2))*SIN(RADIANS(RC[-4]))))),360)) -> 182.26193256493198
D143: =R[-1]C+1 -> 2017-05-22T00:00:00.000 | E143: =R5C2 -> 1899-12-31T14:00:00.000 | F143: =RC[-2]+2415018.5+RC[-1]-R4C2/24 -> 2457896.375 | G143: =(RC[-1]-2451545)/36525 -> 0.17389117043121149 | I143: =MOD(280.46646+RC[-2]*(36000.76983 + RC[-2]*0.0003032),360) -> 60.682471331549095 | J143: =357.52911+RC[-3]*(35999.05029 - 0.0001537*RC[-3]) -> 6617.4460946925419 | K143: =0.016708634-RC[-4]*(0.000042037+0.0000001267*RC[-4]) -> 1.6701320305696352E-2 | L143: =SIN(RADIANS(RC[-2]))*(1.914602-RC[-5]*(0.004817+0.000014*RC[-5]))+SIN(RADIANS(2*RC[-2]))*(0.019993-0.000101*RC[-5])+SIN(RADIANS(3*RC[-2]))*0.000289 -> 1.2745732041307229 | M143: =RC[-4]+RC[-1] -> 61.95704453567982 | N143: =RC[-4]+RC[-2] -> 6618.7206678966722 | O143: =(1.000001018*(1-RC[-4]*RC[-4]))/(1+RC[-4]*COS(RADIANS(RC[-1]))) -> 1.0124291613162746 | P143: =RC[-3]-0.00569-0.00478*SIN(RADIANS(125.04-1934.136*RC[-9])) -> 61.948872006182278 | Q143: =23+(26+((21.448-RC[-10]*(46.815+RC[-10]*(0.00059-RC[-10]*0.001813))))/60)/60 -> 23.437029799041326 | R143: =RC[-1]+0.00256*COS(RADIANS(125.04-1934.136*RC[-11])) -> 23.434842133150937 | S143: =DEGREES(ATAN2(COS(RADIANS(RC[-3])),COS(RADIANS(RC[-1]))*SIN(RADIANS(RC[-3])))) -> 59.853703771302669 | T143: =DEGREES(ASIN(SIN(RADIANS(RC[-2]))*SIN(RADIANS(RC[-4])))) -> 20.547679571692687 | U143: =TAN(RADIANS(RC[-3]/2))*TAN(RADIANS(RC[-3]/2)) -> 4.3017729672872887E-2 | V143: =4*DEGREES(RC[-1]*SIN(2*RADIANS(RC[-13]))-2*RC[-11]*SIN(RADIANS(RC[-12]))+4*RC[-11]*RC[-1]*SIN(RADIANS(RC[-12]))*COS(2*RADIANS(RC[-13]))-0.5*RC[-1]*RC[-1]*SIN(4*RADIANS(RC[-13]))-1.25*RC[-11]*RC[-11]*SIN(2*RADIANS(RC[-12]))) -> 3.2773454891307092 | W143: =DEGREES(ACOS(COS(RADIANS(90.833))/(COS(RADIANS(R2C2))*COS(RADIANS(RC[-3])))-TAN(RADIANS(R2C2))*TAN(RADIANS(RC[-3])))) -> #NUM! | X143: =(720-4*R3C2-RC[-2]+R4C2*60)/1440 -> 1899-12-31T13:52:43.359 | Y143: =(RC[-1]*1440-RC[-2]*4)/1440 -> #NUM! | Z143: =(RC[-2]*1440+RC[-3]*4)/1440 -> #NUM! | AA143: =8*RC[-4] -> #NUM! | AB143: =MOD(RC[-23]*1440+RC[-6]+4*R3C2-60*R4C2,1440) -> 727.27734548913065 | AC143: =IF(RC[-1]/4<0,RC[-1]/4+180,RC[-1]/4-180) -> 1.8193363722826632 | AD143: =DEGREES(ACOS(SIN(RADIANS(R2C2))*SIN(RADIANS(RC[-10]))+COS(RADIANS(R2C2))*COS(RADIANS(RC[-10]))*COS(RADIANS(RC[-1])))) -> 49.464492509834741 | AE143: =90-RC[-1] -> 40.535507490165259 | AF143: =IF(RC[-1]>85,0,IF(RC[-1]>5,58.1/TAN(RADIANS(RC[-1]))-0.07/POWER(TAN(RADIANS(RC[-1])),3)+0.000086/POWER(TAN(RADIANS(RC[-1])),5),IF(RC[-1]>-0.575,1735+RC[-1]*(-518.2+RC[-1]*(103.4+RC[-1]*(-12.79+RC[-1]*0.711))),-20.772/TAN(RADIANS(RC[-1])))))/3600 -> 1.8841474619020488E-2 | AG143: =RC[-2]+RC[-1] -> 40.554348964784282 | AH143: =IF(RC[-5]>0,MOD(DEGREES(ACOS(((SIN(RADIANS(R2C2))*COS(RADIANS(RC[-4])))-SIN(RADIANS(RC[-14])))/(COS(RADIANS(R2C2))*SIN(RADIANS(RC[-4])))))+180,360),MOD(540-DEGREES(ACOS(((SIN(RADIANS(R2C2))*COS(RADIANS(RC[-4])))-SIN(RADIANS(RC[-14])))/(COS(RADIANS(R2C2))*SIN(RADIANS(RC[-4]))))),360)) -> 182.24175247605379
D144: =R[-1]C+1 -> 2017-05-23T00:00:00.000 | E144: =R5C2 -> 1899-12-31T14:00:00.000 | F144: =RC[-2]+2415018.5+RC[-1]-R4C2/24 -> 2457897.375 | G144: =(RC[-1]-2451545)/36525 -> 0.17391854893908282 | I144: =MOD(280.46646+RC[-2]*(36000.76983 + RC[-2]*0.0003032),360) -> 61.668118694601617 | J144: =357.52911+RC[-3]*(35999.05029 - 0.0001537*RC[-3]) -> 6618.4316949728036 | K144: =0.016708634-RC[-4]*(0.000042037+0.0000001267*RC[-4]) -> 1.6701319153579516E-2 | L144: =SIN(RADIANS(RC[-2]))*(1.914602-RC[-5]*(0.004817+0.000014*RC[-5]))+SIN(RADIANS(2*RC[-2]))*(0.019993-0.000101*RC[-5])+SIN(RADIANS(3*RC[-2]))*0.000289 -> 1.2502113985272008 | M144: =RC[-4]+RC[-1] -> 62.918330093128816 | N144: =RC[-4]+RC[-2] -> 6619.681906371331 | O144: =(1.000001018*(1-RC[-4]*RC[-4]))/(1+RC[-4]*COS(RADIANS(RC[-1]))) -> 1.0126169045467799 | P144: =RC[-3]-0.00569-0.00478*SIN(RADIANS(125.04-1934.136*RC[-9])) -> 62.910153789465006 | Q144: =23+(26+((21.448-RC[-10]*(46.815+RC[-10]*(0.00059-RC[-10]*0.001813))))/60)/60 -> 23.437029443006338 | R144: =RC[-1]+0.00256*COS(RADIANS(125.04-1934.136*RC[-11])) -> 23.434843006848503 | S144: =DEGREES(ATAN2(COS(RADIANS(RC[-3])),COS(RADIANS(RC[-1]))*SIN(RADIANS(RC[-3])))) -> 60.860867547276364 | T144: =DEGREES(ASIN(SIN(RADIANS(RC[-2]))*SIN(RADIANS(RC[-4])))) -> 20.736764529574355 | U144: =TAN(RADIANS(RC[-3]/2))*TAN(RADIANS(RC[-3]/2)) -> 4.3017732971657327E-2 | V144: =4*DEGREES(RC[-1]*SIN(2*RADIANS(RC[-13]))-2*RC[-11]*SIN(RADIANS(RC[-12]))+4*RC[-11]*RC[-1]*SIN(RADIANS(RC[-12]))*COS(2*RADIANS(RC[-13]))-0.5*RC[-1]*RC[-1]*SIN(4*RADIANS(RC[-13]))-1.25*RC[-11]*RC[-11]*SIN(2*RADIANS(RC[-12]))) -> 3.1912453550110924 | W144: =DEGREES(ACOS(COS(RADIANS(90.833))/(COS(RADIANS(R2C2))*COS(RADIANS(RC[-3])))-TAN(RADIANS(R2C2))*TAN(RADIANS(RC[-3])))) -> #NUM! | X144: =(720-4*R3C2-RC[-2]+R4C2*60)/1440 -> 1899-12-31T13:52:48.525 | Y144: =(RC[-1]*1440-RC[-2]*4)/1440 -> #NUM! | Z144: =(RC[-2]*1440+RC[-3]*4)/1440 -> #NUM! | AA144: =8*RC[-4] -> #NUM! | AB144: =MOD(RC[-23]*1440+RC[-6]+4*R3C2-60*R4C2,1440) -> 727.19124535501112 | AC144: =IF(RC[-1]/4<0,RC[-1]/4+180,RC[-1]/4-180) -> 1.7978113387527799 | AD144: =DEGREES(ACOS(SIN(RADIANS(R2C2))*SIN(RADIANS(RC[-10]))+COS(RADIANS(R2C2))*COS(RADIANS(RC[-10]))*COS(RADIANS(RC[-1])))) -> 49.275140182320492 | AE144: =90-RC[-1] -> 40.724859817679508 | AF144: =IF(RC[-1]>85,0,IF(RC[-1]>5,58.1/TAN(RADIANS(RC[-1]))-0.07/POWER(TAN(RADIANS(RC[-1])),3)+0.000086/POWER(TAN(RADIANS(RC[-1])),5),IF(RC[-1]>-0.575,1735+RC[-1]*(-518.2+RC[-1]*(103.4+RC[-1]*(-12.79+RC[-1]*0.711))),-20.772/TAN(RADIANS(RC[-1])))))/3600 -> 1.8716305315268772E-2 | AG144: =RC[-2]+RC[-1] -> 40.743576122994774 | AH144: =IF(RC[-5]>0,MOD(DEGREES(ACOS(((SIN(RADIANS(R2C2))*COS(RADIANS(RC[-4])))-SIN(RADIANS(RC[-14])))/(COS(RADIANS(R2C2))*SIN(RADIANS(RC[-4])))))+180,360),MOD(540-DEGREES(ACOS(((SIN(RADIANS(R2C2))*COS(RADIANS(RC[-4])))-SIN(RADIANS(RC[-14])))/(COS(RADIANS(R2C2))*SIN(RADIANS(RC[-4]))))),360)) -> 182.21875723449403
D145: =R[-1]C+1 -> 2017-05-24T00:00:00.000 | E145: =R5C2 -> 1899-12-31T14:00:00.000 | F145: =RC[-2]+2415018.5+RC[-1]-R4C2/24 -> 2457898.375 | G145: =(RC[-1]-2451545)/36525 -> 0.17394592744695414 | I145: =MOD(280.46646+RC[-2]*(36000.76983 + RC[-2]*0.0003032),360) -> 62.653766057653229 | J145: =357.52911+RC[-3]*(35999.05029 - 0.0001537*RC[-3]) -> 6619.4172952530635 | K145: =0.016708634-RC[-4]*(0.000042037+0.0000001267*RC[-4]) -> 1.6701318001462486E-2 | L145: =SIN(RADIANS(RC[-2]))*(1.914602-RC[-5]*(0.004817+0.000014*RC[-5]))+SIN(RADIANS(2*RC[-2]))*(0.019993-0.000101*RC[-5])+SIN(RADIANS(3*RC[-2]))*0.000289 -> 1.2254966992776253 | M145: =RC[-4]+RC[-1] -> 63.879262756930856 | N145: =RC[-4]+RC[-2] -> 6620.6427919523412 | O145: =(1.000001018*(1-RC[-4]*RC[-4]))/(1+RC[-4]*COS(RADIANS(RC[-1]))) -> 1.0128009730056309 | P145: =RC[-3]-0.00569-0.00478*SIN(RADIANS(125.04-1934.136*RC[-9])) -> 63.871082681224522 | Q145: =23+(26+((21.448-RC[-10]*(46.815+RC[-10]*(0.00059-RC[-10]*0.001813))))/60)/60 -> 23.43702908697135 | R145: =RC[-1]+0.00256*COS(RADIANS(125.04-1934.136*RC[-11])) -> 23.434843882413674 | S145: =DEGREES(ATAN2(COS(RADIANS(RC[-3])),COS(RADIANS(RC[-1]))*SIN(RADIANS(RC[-3])))) -> 61.870140837010965 | T145: =DEGREES(ASIN(SIN(RADIANS(RC[-2]))*SIN(RADIANS(RC[-4])))) -> 20.919906399113191 | U145: =TAN(RADIANS(RC[-3]/2))*TAN(RADIANS(RC[-3]/2)) -> 4.3017736277493328E-2 | V145: =4*DEGREES(RC[-1]*SIN(2*RADIANS(RC[-13]))-2*RC[-11]*SIN(RADIANS(RC[-12]))+4*RC[-11]*RC[-1]*SIN(RADIANS(RC[-12]))*COS(2*RADIANS(RC[-13]))-0.5*RC[-1]*RC[-1]*SIN(4*RADIANS(RC[-13]))-1.25*RC[-11]*RC[-11]*SIN(2*RADIANS(RC[-12]))) -> 3.09672587419037 | W145: =DEGREES(ACOS(COS(RADIANS(90.833))/(COS(RADIANS(R2C2))*COS(RADIANS(RC[-3])))-TAN(RADIANS(R2C2))*TAN(RADIANS(RC[-3])))) -> #NUM! | X145: =(720-4*R3C2-RC[-2]+R4C2*60)/1440 -> 1899-12-31T13:52:54.196 | Y145: =(RC[-1]*1440-RC[-2]*4)/1440 -> #NUM! | Z145: =(RC[-2]*1440+RC[-3]*4)/1440 -> #NUM! | AA145: =8*RC[-4] -> #NUM! | AB145: =MOD(RC[-23]*1440+RC[-6]+4*R3C2-60*R4C2,1440) -> 727.09672587419038 | AC145: =IF(RC[-1]/4<0,RC[-1]/4+180,RC[-1]/4-180) -> 1.7741814685475958 | AD145: =DEGREES(ACOS(SIN(RADIANS(R2C2))*SIN(RADIANS(RC[-10]))+COS(RADIANS(R2C2))*COS(RADIANS(RC[-10]))*COS(RADIANS(RC[-1])))) -> 49.091705405553689 | AE145: =90-RC[-1] -> 40.908294594446311 | AF145: =IF(RC[-1]>85,0,IF(RC[-1]>5,58.1/TAN(RADIANS(RC[-1]))-0.07/POWER(TAN(RADIANS(RC[-1])),3)+0.000086/POWER(TAN(RADIANS(RC[-1])),5),IF(RC[-1]>-0.575,1735+RC[-1]*(-518.2+RC[-1]*(103.4+RC[-1]*(-12.79+RC[-1]*0.711))),-20.772/TAN(RADIANS(RC[-1])))))/3600 -> 1.8595953088412234E-2 | AG145: =RC[-2]+RC[-1] -> 40.926890547534725 | AH145: =IF(RC[-5]>0,MOD(DEGREES(ACOS(((SIN(RADIANS(R2C2))*COS(RADIANS(RC[-4])))-SIN(RADIANS(RC[-14])))/(COS(RADIANS(R2C2))*SIN(RADIANS(RC[-4])))))+180,360),MOD(540-DEGREES(ACOS(((SIN(RADIANS(R2C2))*COS(RADIANS(RC[-4])))-SIN(RADIANS(RC[-14])))/(COS(RADIANS(R2C2))*SIN(RADIANS(RC[-4]))))),360)) -> 182.19298584445355
D146: =R[-1]C+1 -> 2017-05-25T00:00:00.000 | E146: =R5C2 -> 1899-12-31T14:00:00.000 | F146: =RC[-2]+2415018.5+RC[-1]-R4C2/24 -> 2457899.375 | G146: =(RC[-1]-2451545)/36525 -> 0.17397330595482546 | I146: =MOD(280.46646+RC[-2]*(36000.76983 + RC[-2]*0.0003032),360) -> 63.63941342070575 | J146: =357.52911+RC[-3]*(35999.05029 - 0.0001537*RC[-3]) -> 6620.4028955333251 | K146: =0.016708634-RC[-4]*(0.000042037+0.0000001267*RC[-4]) -> 1.6701316849345269E-2 | L146: =SIN(RADIANS(RC[-2]))*(1.914602-RC[-5]*(0.004817+0.000014*RC[-5]))+SIN(RADIANS(2*RC[-2]))*(0.019993-0.000101*RC[-5])+SIN(RADIANS(3*RC[-2]))*0.000289 -> 1.2004363168779546 | M146: =RC[-4]+RC[-1] -> 64.839849737583705 | N146: =RC[-4]+RC[-2] -> 6621.6033318502032 | O146: =(1.000001018*(1-RC[-4]*RC[-4]))/(1+RC[-4]*COS(RADIANS(RC[-1]))) -> 1.0129813162690402 | P146: =RC[-3]-0.00569-0.00478*SIN(RADIANS(125.04-1934.136*RC[-9])) -> 64.831665891961805 | Q146: =23+(26+((21.448-RC[-10]*(46.815+RC[-10]*(0.00059-RC[-10]*0.001813))))/60)/60 -> 23.437028730936362 | R146: =RC[-1]+0.00256*COS(RADIANS(125.04-1934.136*RC[-11])) -> 23.434844759845397 | S146: =DEGREES(ATAN2(COS(RADIANS(RC[-3])),COS(RADIANS(RC[-1]))*SIN(RADIANS(RC[-3])))) -> 62.881478927746144 | T146: =DEGREES(ASIN(SIN(RADIANS(RC[-2]))*SIN(RADIANS(RC[-4])))) -> 21.097041805951076 | U146: =TAN(RADIANS(RC[-3]/2))*TAN(RADIANS(RC[-3]/2)) -> 4.3017739590376941E-2 | V146: =4*DEGREES(RC[-1]*SIN(2*RADIANS(RC[-13]))-2*RC[-11]*SIN(RADIANS(RC[-12]))+4*RC[-11]*RC[-1]*SIN(RADIANS(RC[-12]))*COS(2*RADIANS(RC[-13]))-0.5*RC[-1]*RC[-1]*SIN(4*RADIANS(RC[-13]))-1.25*RC[-11]*RC[-11]*SIN(2*RADIANS(RC[-12]))) -> 2.9939662771479001 | W146: =DEGREES(ACOS(COS(RADIANS(90.833))/(COS(RADIANS(R2C2))*COS(RADIANS(RC[-3])))-TAN(RADIANS(R2C2))*TAN(RADIANS(RC[-3])))) -> #NUM! | X146: =(720-4*R3C2-RC[-2]+R4C2*60)/1440 -> 1899-12-31T13:53:00.362 | Y146: =(RC[-1]*1440-RC[-2]*4)/1440 -> #NUM! | Z146: =(RC[-2]*1440+RC[-3]*4)/1440 -> #NUM! | AA146: =8*RC[-4] -> #NUM! | AB146: =MOD(RC[-23]*1440+RC[-6]+4*R3C2-60*R4C2,1440) -> 726.99396627714793 | AC146: =IF(RC[-1]/4<0,RC[-1]/4+180,RC[-1]/4-180) -> 1.7484915692869833 | AD146: =DEGREES(ACOS(SIN(RADIANS(R2C2))*SIN(RADIANS(RC[-10]))+COS(RADIANS(R2C2))*COS(RADIANS(RC[-10]))*COS(RADIANS(RC[-1])))) -> 48.914253146747832 | AE146: =90-RC[-1] -> 41.085746853252168 | AF146: =IF(RC[-1]>85,0,IF(RC[-1]>5,58.1/TAN(RADIANS(RC[-1]))-0.07/POWER(TAN(RADIANS(RC[-1])),3)+0.000086/POWER(TAN(RADIANS(RC[-1])),5),IF(RC[-1]>-0.575,1735+RC[-1]*(-518.2+RC[-1]*(103.4+RC[-1]*(-12.79+RC[-1]*0.711))),-20.772/TAN(RADIANS(RC[-1])))))/3600 -> 1.8480362286131886E-2 | AG146: =RC[-2]+RC[-1] -> 41.104227215538302 | AH146: =IF(RC[-5]>0,MOD(DEGREES(ACOS(((SIN(RADIANS(R2C2))*COS(RADIANS(RC[-4])))-SIN(RADIANS(RC[-14])))/(COS(RADIANS(R2C2))*SIN(RADIANS(RC[-4])))))+180,360),MOD(540-DEGREES(ACOS(((SIN(RADIANS(R2C2))*COS(RADIANS(RC[-4])))-SIN(RADIANS(RC[-14])))/(COS(RADIANS(R2C2))*SIN(RADIANS(RC[-4]))))),360)) -> 182.16448253762741
D147: =R[-1]C+1 -> 2017-05-26T00:00:00.000 | E147: =R5C2 -> 1899-12-31T14:00:00.000 | F147: =RC[-2]+2415018.5+RC[-1]-R4C2/24 -> 2457900.375 | G147: =(RC[-1]-2451545)/36525 -> 0.17400068446269679 | I147: =MOD(280.46646+RC[-2]*(36000.76983 + RC[-2]*0.0003032),360) -> 64.625060783759182 | J147: =357.52911+RC[-3]*(35999.05029 - 0.0001537*RC[-3]) -> 6621.3884958135859 | K147: =0.016708634-RC[-4]*(0.000042037+0.0000001267*RC[-4]) -> 1.6701315697227864E-2 | L147: =SIN(RADIANS(RC[-2]))*(1.914602-RC[-5]*(0.004817+0.000014*RC[-5]))+SIN(RADIANS(2*RC[-2]))*(0.019993-0.000101*RC[-5])+SIN(RADIANS(3*RC[-2]))*0.000289 -> 1.1750375449244641 | M147: =RC[-4]+RC[-1] -> 65.800098328683646 | N147: =RC[-4]+RC[-2] -> 6622.5635333585105 | O147: =(1.000001018*(1-RC[-4]*RC[-4]))/(1+RC[-4]*COS(RADIANS(RC[-1]))) -> 1.0131578849877518 | P147: =RC[-3]-0.00569-0.00478*SIN(RADIANS(125.04-1934.136*RC[-9])) -> 65.791910715276387 | Q147: =23+(26+((21.448-RC[-10]*(46.815+RC[-10]*(0.00059-RC[-10]*0.001813))))/60)/60 -> 23.43702837490137 | R147: =RC[-1]+0.00256*COS(RADIANS(125.04-1934.136*RC[-11])) -> 23.434845639142619 | S147: =DEGREES(ATAN2(COS(RADIANS(RC[-3])),COS(RADIANS(RC[-1]))*SIN(RADIANS(RC[-3])))) -> 63.894833823910915 | T147: =DEGREES(ASIN(SIN(RADIANS(RC[-2]))*SIN(RADIANS(RC[-4])))) -> 21.268109106974492 | U147: =TAN(RADIANS(RC[-3]/2))*TAN(RADIANS(RC[-3]/2)) -> 4.3017742910304191E-2 | V147: =4*DEGREES(RC[-1]*SIN(2*RADIANS(RC[-13]))-2*RC[-11]*SIN(RADIANS(RC[-12]))+4*RC[-11]*RC[-1]*SIN(RADIANS(RC[-12]))*COS(2*RADIANS(RC[-13]))-0.5*RC[-1]*RC[-1]*SIN(4*RADIANS(RC[-13]))-1.25*RC[-11]*RC[-11]*SIN(2*RADIANS(RC[-12]))) -> 2.8831589037234258 | W147: =DEGREES(ACOS(COS(RADIANS(90.833))/(COS(RADIANS(R2C2))*COS(RADIANS(RC[-3])))-TAN(RADIANS(R2C2))*TAN(RADIANS(RC[-3])))) -> #NUM! | X147: =(720-4*R3C2-RC[-2]+R4C2*60)/1440 -> 1899-12-31T13:53:07.010 | Y147: =(RC[-1]*1440-RC[-2]*4)/1440 -> #NUM! | Z147: =(RC[-2]*1440+RC[-3]*4)/1440 -> #NUM! | AA147: =8*RC[-4] -> #NUM! | AB147: =MOD(RC[-23]*1440+RC[-6]+4*R3C2-60*R4C2,1440) -> 726.88315890372337 | AC147: =IF(RC[-1]/4<0,RC[-1]/4+180,RC[-1]/4-180) -> 1.7207897259308425 | AD147: =DEGREES(ACOS(SIN(RADIANS(R2C2))*SIN(RADIANS(RC[-10]))+COS(RADIANS(R2C2))*COS(RADIANS(RC[-10]))*COS(RADIANS(RC[-1])))) -> 48.742846762821451 | AE147: =90-RC[-1] -> 41.257153237178549 | AF147: =IF(RC[-1]>85,0,IF(RC[-1]>5,58.1/TAN(RADIANS(RC[-1]))-0.07/POWER(TAN(RADIANS(RC[-1])),3)+0.000086/POWER(TAN(RADIANS(RC[-1])),5),IF(RC[-1]>-0.575,1735+RC[-1]*(-518.2+RC[-1]*(103.4+RC[-1]*(-12.79+RC[-1]*0.711))),-20.772/TAN(RADIANS(RC[-1])))))/3600 -> 1.8369480282052809E-2 | AG147: =RC[-2]+RC[-1] -> 41.275522717460603 | AH147: =IF(RC[-5]>0,MOD(DEGREES(ACOS(((SIN(RADIANS(R2C2))*COS(RADIANS(RC[-4])))-SIN(RADIANS(RC[-14])))/(COS(RADIANS(R2C2))*SIN(RADIANS(RC[-4])))))+180,360),MOD(540-DEGREES(ACOS(((SIN(RADIANS(R2C2))*COS(RADIANS(RC[-4])))-SIN(RADIANS(RC[-14])))/(COS(RADIANS(R2C2))*SIN(RADIANS(RC[-4]))))),360)) -> 182.13329677113776
D148: =R[-1]C+1 -> 2017-05-27T00:00:00.000 | E148: =R5C2 -> 1899-12-31T14:00:00.000 | F148: =RC[-2]+2415018.5+RC[-1]-R4C2/24 -> 2457901.375 | G148: =(RC[-1]-2451545)/36525 -> 0.17402806297056811 | I148: =MOD(280.46646+RC[-2]*(36000.76983 + RC[-2]*0.0003032),360) -> 65.610708146812613 | J148: =357.52911+RC[-3]*(35999.05029 - 0.0001537*RC[-3]) -> 6622.3740960938458 | K148: =0.016708634-RC[-4]*(0.000042037+0.0000001267*RC[-4]) -> 1.6701314545110264E-2 | L148: =SIN(RADIANS(RC[-2]))*(1.914602-RC[-5]*(0.004817+0.000014*RC[-5]))+SIN(RADIANS(2*RC[-2]))*(0.019993-0.000101*RC[-5])+SIN(RADIANS(3*RC[-2]))*0.000289 -> 1.1493077581257924 | M148: =RC[-4]+RC[-1] -> 66.760015904938399 | N148: =RC[-4]+RC[-2] -> 6623.5234038519711 | O148: =(1.000001018*(1-RC[-4]*RC[-4]))/(1+RC[-4]*COS(RADIANS(RC[-1]))) -> 1.0133306308971597 | P148: =RC[-3]-0.00569-0.00478*SIN(RADIANS(125.04-1934.136*RC[-9])) -> 66.751824525879172 | Q148: =23+(26+((21.448-RC[-10]*(46.815+RC[-10]*(0.00059-RC[-10]*0.001813))))/60)/60 -> 23.437028018866382 | R148: =RC[-1]+0.00256*COS(RADIANS(125.04-1934.136*RC[-11])) -> 23.434846520304287 | S148: =DEGREES(ATAN2(COS(RADIANS(RC[-3])),COS(RADIANS(RC[-1]))*SIN(RADIANS(RC[-3])))) -> 64.910154288097871 | T148: =DEGREES(ASIN(SIN(RADIANS(RC[-2]))*SIN(RADIANS(RC[-4])))) -> 21.433048451054717 | U148: =TAN(RADIANS(RC[-3]/2))*TAN(RADIANS(RC[-3]/2)) -> 4.3017746237271087E-2 | V148: =4*DEGREES(RC[-1]*SIN(2*RADIANS(RC[-13]))-2*RC[-11]*SIN(RADIANS(RC[-12]))+4*RC[-11]*RC[-1]*SIN(RADIANS(RC[-12]))*COS(2*RADIANS(RC[-13]))-0.5*RC[-1]*RC[-1]*SIN(4*RADIANS(RC[-13]))-1.25*RC[-11]*RC[-11]*SIN(2*RADIANS(RC[-12]))) -> 2.7645090193643105 | W148: =DEGREES(ACOS(COS(RADIANS(90.833))/(COS(RADIANS(R2C2))*COS(RADIANS(RC[-3])))-TAN(RADIANS(R2C2))*TAN(RADIANS(RC[-3])))) -> #NUM! | X148: =(720-4*R3C2-RC[-2]+R4C2*60)/1440 -> 1899-12-31T13:53:14.129 | Y148: =(RC[-1]*1440-RC[-2]*4)/1440 -> #NUM! | Z148: =(RC[-2]*1440+RC[-3]*4)/1440 -> #NUM! | AA148: =8*RC[-4] -> #NUM! | AB148: =MOD(RC[-23]*1440+RC[-6]+4*R3C2-60*R4C2,1440) -> 726.76450901936425 | AC148: =IF(RC[-1]/4<0,RC[-1]/4+180,RC[-1]/4-180) -> 1.6911272548410636 | AD148: =DEGREES(ACOS(SIN(RADIANS(R2C2))*SIN(RADIANS(RC[-10]))+COS(RADIANS(R2C2))*COS(RADIANS(RC[-10]))*COS(RADIANS(RC[-1])))) -> 48.577547929016013 | AE148: =90-RC[-1] -> 41.422452070983987 | AF148: =IF(RC[-1]>85,0,IF(RC[-1]>5,58.1/TAN(RADIANS(RC[-1]))-0.07/POWER(TAN(RADIANS(RC[-1])),3)+0.000086/POWER(TAN(RADIANS(RC[-1])),5),IF(RC[-1]>-0.575,1735+RC[-1]*(-518.2+RC[-1]*(103.4+RC[-1]*(-12.79+RC[-1]*0.711))),-20.772/TAN(RADIANS(RC[-1])))))/3600 -> 1.8263257351913947E-2 | AG148: =RC[-2]+RC[-1] -> 41.440715328335898 | AH148: =IF(RC[-5]>0,MOD(DEGREES(ACOS(((SIN(RADIANS(R2C2))*COS(RADIANS(RC[-4])))-SIN(RADIANS(RC[-14])))/(COS(RADIANS(R2C2))*SIN(RADIANS(RC[-4])))))+180,360),MOD(540-DEGREES(ACOS(((SIN(RADIANS(R2C2))*COS(RADIANS(RC[-4])))-SIN(RADIANS(RC[-14])))/(COS(RADIANS(R2C2))*SIN(RADIANS(RC[-4]))))),360)) -> 182.09948321141846
D149: =R[-1]C+1 -> 2017-05-28T00:00:00.000 | E149: =R5C2 -> 1899-12-31T14:00:00.000 | F149: =RC[-2]+2415018.5+RC[-1]-R4C2/24 -> 2457902.375 | G149: =(RC[-1]-2451545)/36525 -> 0.17405544147843943 | I149: =MOD(280.46646+RC[-2]*(36000.76983 + RC[-2]*0.0003032),360) -> 66.596355509866044 | J149: =357.52911+RC[-3]*(35999.05029 - 0.0001537*RC[-3]) -> 6623.3596963741065 | K149: =0.016708634-RC[-4]*(0.000042037+0.0000001267*RC[-4]) -> 1.6701313392992478E-2 | L149: =SIN(RADIANS(RC[-2]))*(1.914602-RC[-5]*(0.004817+0.000014*RC[-5]))+SIN(RADIANS(2*RC[-2]))*(0.019993-0.000101*RC[-5])+SIN(RADIANS(3*RC[-2]))*0.000289 -> 1.1232544103115698 | M149: =RC[-4]+RC[-1] -> 67.719609920177618 | N149: =RC[-4]+RC[-2] -> 6624.4829507844179 | O149: =(1.000001018*(1-RC[-4]*RC[-4]))/(1+RC[-4]*COS(RADIANS(RC[-1]))) -> 1.0134995068271446 | P149: =RC[-3]-0.00569-0.00478*SIN(RADIANS(125.04-1934.136*RC[-9])) -> 67.711414777603053 | Q149: =23+(26+((21.448-RC[-10]*(46.815+RC[-10]*(0.00059-RC[-10]*0.001813))))/60)/60 -> 23.437027662831394 | R149: =RC[-1]+0.00256*COS(RADIANS(125.04-1934.136*RC[-11])) -> 23.434847403329343 | S149: =DEGREES(ATAN2(COS(RADIANS(RC[-3])),COS(RADIANS(RC[-1]))*SIN(RADIANS(RC[-3])))) -> 65.927385889230081 | T149: =DEGREES(ASIN(SIN(RADIANS(RC[-2]))*SIN(RADIANS(RC[-4])))) -> 21.591801839417275 | U149: =TAN(RADIANS(RC[-3]/2))*TAN(RADIANS(RC[-3]/2)) -> 4.3017749571273634E-2 | V149: =4*DEGREES(RC[-1]*SIN(2*RADIANS(RC[-13]))-2*RC[-11]*SIN(RADIANS(RC[-12]))+4*RC[-11]*RC[-1]*SIN(RADIANS(RC[-12]))*COS(2*RADIANS(RC[-13]))-0.5*RC[-1]*RC[-1]*SIN(4*RADIANS(RC[-13]))-1.25*RC[-11]*RC[-11]*SIN(2*RADIANS(RC[-12]))) -> 2.6382346028958192 | W149: =DEGREES(ACOS(COS(RADIANS(90.833))/(COS(RADIANS(R2C2))*COS(RADIANS(RC[-3])))-TAN(RADIANS(R2C2))*TAN(RADIANS(RC[-3])))) -> #NUM! | X149: =(720-4*R3C2-RC[-2]+R4C2*60)/1440 -> 1899-12-31T13:53:21.706 | Y149: =(RC[-1]*1440-RC[-2]*4)/1440 -> #NUM! | Z149: =(RC[-2]*1440+RC[-3]*4)/1440 -> #NUM! | AA149: =8*RC[-4] -> #NUM! | AB149: =MOD(RC[-23]*1440+RC[-6]+4*R3C2-60*R4C2,1440) -> 726.63823460289586 | AC149: =IF(RC[-1]/4<0,RC[-1]/4+180,RC[-1]/4-180) -> 1.6595586507239659 | AD149: =DEGREES(ACOS(SIN(RADIANS(R2C2))*SIN(RADIANS(RC[-10]))+COS(RADIANS(R2C2))*COS(RADIANS(RC[-10]))*COS(RADIANS(RC[-1])))) -> 48.418416567098973 | AE149: =90-RC[-1] -> 41.581583432901027 | AF149: =IF(RC[-1]>85,0,IF(RC[-1]>5,58.1/TAN(RADIANS(RC[-1]))-0.07/POWER(TAN(RADIANS(RC[-1])),3)+0.000086/POWER(TAN(RADIANS(RC[-1])),5),IF(RC[-1]>-0.575,1735+RC[-1]*(-518.2+RC[-1]*(103.4+RC[-1]*(-12.79+RC[-1]*0.711))),-20.772/TAN(RADIANS(RC[-1])))))/3600 -> 1.8161646555645786E-2 | AG149: =RC[-2]+RC[-1] -> 41.599745079456675 | AH149: =IF(RC[-5]>0,MOD(DEGREES(ACOS(((SIN(RADIANS(R2C2))*COS(RADIANS(RC[-4])))-SIN(RADIANS(RC[-14])))/(COS(RADIANS(R2C2))*SIN(RADIANS(RC[-4])))))+180,360),MOD(540-DEGREES(ACOS(((SIN(RADIANS(R2C2))*COS(RADIANS(RC[-4])))-SIN(RADIANS(RC[-14])))/(COS(RADIANS(R2C2))*SIN(RADIANS(RC[-4]))))),360)) -> 182.06310170366822
D150: =R[-1]C+1 -> 2017-05-29T00:00:00.000 | E150: =R5C2 -> 1899-12-31T14:00:00.000 | F150: =RC[-2]+2415018.5+RC[-1]-R4C2/24 -> 2457903.375 | G150: =(RC[-1]-2451545)/36525 -> 0.17408281998631076 | I150: =MOD(280.46646+RC[-2]*(36000.76983 + RC[-2]*0.0003032),360) -> 67.582002872921294 | J150: =357.52911+RC[-3]*(35999.05029 - 0.0001537*RC[-3]) -> 6624.3452966543664 | K150: =0.016708634-RC[-4]*(0.000042037+0.0000001267*RC[-4]) -> 1.67013122408745E-2 | L150: =SIN(RADIANS(RC[-2]))*(1.914602-RC[-5]*(0.004817+0.000014*RC[-5]))+SIN(RADIANS(2*RC[-2]))*(0.019993-0.000101*RC[-5])+SIN(RADIANS(3*RC[-2]))*0.000289 -> 1.0968850324372792 | M150: =RC[-4]+RC[-1] -> 68.678887905358579 | N150: =RC[-4]+RC[-2] -> 6625.4421816868035 | O150: =(1.000001018*(1-RC[-4]*RC[-4]))/(1+RC[-4]*COS(RADIANS(RC[-1]))) -> 1.0136644667116361 | P150: =RC[-3]-0.00569-0.00478*SIN(RADIANS(125.04-1934.136*RC[-9])) -> 68.670689001408505 | Q150: =23+(26+((21.448-RC[-10]*(46.815+RC[-10]*(0.00059-RC[-10]*0.001813))))/60)/60 -> 23.437027306796406 | R150: =RC[-1]+0.00256*COS(RADIANS(125.04-1934.136*RC[-11])) -> 23.434848288216727 | S150: =DEGREES(ATAN2(COS(RADIANS(RC[-3])),COS(RADIANS(RC[-1]))*SIN(RADIANS(RC[-3])))) -> 66.946471058009067 | T150: =DEGREES(ASIN(SIN(RADIANS(RC[-2]))*SIN(RADIANS(RC[-4])))) -> 21.744313185461987 | U150: =TAN(RADIANS(RC[-3]/2))*TAN(RADIANS(RC[-3]/2)) -> 4.301775291230784E-2 | V150: =4*DEGREES(RC[-1]*SIN(2*RADIANS(RC[-13]))-2*RC[-11]*SIN(RADIANS(RC[-12]))+4*RC[-11]*RC[-1]*SIN(RADIANS(RC[-12]))*COS(2*RADIANS(RC[-13]))-0.5*RC[-1]*RC[-1]*SIN(4*RADIANS(RC[-13]))-1.25*RC[-11]*RC[-11]*SIN(2*RADIANS(RC[-12]))) -> 2.504566105808677 | W150: =DEGREES(ACOS(COS(RADIANS(90.833))/(COS(RADIANS(R2C2))*COS(RADIANS(RC[-3])))-TAN(RADIANS(R2C2))*TAN(RADIANS(RC[-3])))) -> #NUM! | X150: =(720-4*R3C2-RC[-2]+R4C2*60)/1440 -> 1899-12-31T13:53:29.726 | Y150: =(RC[-1]*1440-RC[-2]*4)/1440 -> #NUM! | Z150: =(RC[-2]*1440+RC[-3]*4)/1440 -> #NUM! | AA150: =8*RC[-4] -> #NUM! | AB150: =MOD(RC[-23]*1440+RC[-6]+4*R3C2-60*R4C2,1440) -> 726.50456610580864 | AC150: =IF(RC[-1]/4<0,RC[-1]/4+180,RC[-1]/4-180) -> 1.6261415264521588 | AD150: =DEGREES(ACOS(SIN(RADIANS(R2C2))*SIN(RADIANS(RC[-10]))+COS(RADIANS(R2C2))*COS(RADIANS(RC[-10]))*COS(RADIANS(RC[-1])))) -> 48.265510773400671 | AE150: =90-RC[-1] -> 41.734489226599329 | AF150: =IF(RC[-1]>85,0,IF(RC[-1]>5,58.1/TAN(RADIANS(RC[-1]))-0.07/POWER(TAN(RADIANS(RC[-1])),3)+0.000086/POWER(TAN(RADIANS(RC[-1])),5),IF(RC[-1]>-0.575,1735+RC[-1]*(-518.2+RC[-1]*(103.4+RC[-1]*(-12.79+RC[-1]*0.711))),-20.772/TAN(RADIANS(RC[-1])))))/3600 -> 1.8064603625136174E-2 | AG150: =RC[-2]+RC[-1] -> 41.752553830224464 | AH150: =IF(RC[-5]>0,MOD(DEGREES(ACOS(((SIN(RADIANS(R2C2))*COS(RADIANS(RC[-4])))-SIN(RADIANS(RC[-14])))/(COS(RADIANS(R2C2))*SIN(RADIANS(RC[-4])))))+180,360),MOD(540-DEGREES(ACOS(((SIN(RADIANS(R2C2))*COS(RADIANS(RC[-4])))-SIN(RADIANS(RC[-14])))/(COS(RADIANS(R2C2))*SIN(RADIANS(RC[-4]))))),360)) -> 182.02421722649373
D151: =R[-1]C+1 -> 2017-05-30T00:00:00.000 | E151: =R5C2 -> 1899-12-31T14:00:00.000 | F151: =RC[-2]+2415018.5+RC[-1]-R4C2/24 -> 2457904.375 | G151: =(RC[-1]-2451545)/36525 -> 0.17411019849418208 | I151: =MOD(280.46646+RC[-2]*(36000.76983 + RC[-2]*0.0003032),360) -> 68.567650235975634 | J151: =357.52911+RC[-3]*(35999.05029 - 0.0001537*RC[-3]) -> 6625.3308969346253 | K151: =0.016708634-RC[-4]*(0.000042037+0.0000001267*RC[-4]) -> 1.6701311088756332E-2 | L151: =SIN(RADIANS(RC[-2]))*(1.914602-RC[-5]*(0.004817+0.000014*RC[-5]))+SIN(RADIANS(2*RC[-2]))*(0.019993-0.000101*RC[-5])+SIN(RADIANS(3*RC[-2]))*0.000289 -> 1.0702072305859356 | M151: =RC[-4]+RC[-1] -> 69.63785746656157 | N151: =RC[-4]+RC[-2] -> 6626.4011041652111 | O151: =(1.000001018*(1-RC[-4]*RC[-4]))/(1+RC[-4]*COS(RADIANS(RC[-1]))) -> 1.0138254655979047 | P151: =RC[-3]-0.00569-0.00478*SIN(RADIANS(125.04-1934.136*RC[-9])) -> 69.62965480337904 | Q151: =23+(26+((21.448-RC[-10]*(46.815+RC[-10]*(0.00059-RC[-10]*0.001813))))/60)/60 -> 23.437026950761418 | R151: =RC[-1]+0.00256*COS(RADIANS(125.04-1934.136*RC[-11])) -> 23.434849174965382 | S151: =DEGREES(ATAN2(COS(RADIANS(RC[-3])),COS(RADIANS(RC[-1]))*SIN(RADIANS(RC[-3])))) -> 67.967349149702088 | T151: =DEGREES(ASIN(SIN(RADIANS(RC[-2]))*SIN(RADIANS(RC[-4])))) -> 21.89052837385151 | U151: =TAN(RADIANS(RC[-3]/2))*TAN(RADIANS(RC[-3]/2)) -> 4.301775626036973E-2 | V151: =4*DEGREES(RC[-1]*SIN(2*RADIANS(RC[-13]))-2*RC[-11]*SIN(RADIANS(RC[-12]))+4*RC[-11]*RC[-1]*SIN(RADIANS(RC[-12]))*COS(2*RADIANS(RC[-13]))-0.5*RC[-1]*RC[-1]*SIN(4*RADIANS(RC[-13]))-1.25*RC[-11]*RC[-11]*SIN(2*RADIANS(RC[-12]))) -> 2.3637461831582693 | W151: =DEGREES(ACOS(COS(RADIANS(90.833))/(COS(RADIANS(R2C2))*COS(RADIANS(RC[-3])))-TAN(RADIANS(R2C2))*TAN(RADIANS(RC[-3])))) -> #NUM! | X151: =(720-4*R3C2-RC[-2]+R4C2*60)/1440 -> 1899-12-31T13:53:38.175 | Y151: =(RC[-1]*1440-RC[-2]*4)/1440 -> #NUM! | Z151: =(RC[-2]*1440+RC[-3]*4)/1440 -> #NUM! | AA151: =8*RC[-4] -> #NUM! | AB151: =MOD(RC[-23]*1440+RC[-6]+4*R3C2-60*R4C2,1440) -> 726.36374618315824 | AC151: =IF(RC[-1]/4<0,RC[-1]/4+180,RC[-1]/4-180) -> 1.5909365457895603 | AD151: =DEGREES(ACOS(SIN(RADIANS(R2C2))*SIN(RADIANS(RC[-10]))+COS(RADIANS(R2C2))*COS(RADIANS(RC[-10]))*COS(RADIANS(RC[-1])))) -> 48.118886746943957 | AE151: =90-RC[-1] -> 41.881113253056043 | AF151: =IF(RC[-1]>85,0,IF(RC[-1]>5,58.1/TAN(RADIANS(RC[-1]))-0.07/POWER(TAN(RADIANS(RC[-1])),3)+0.000086/POWER(TAN(RADIANS(RC[-1])),5),IF(RC[-1]>-0.575,1735+RC[-1]*(-518.2+RC[-1]*(103.4+RC[-1]*(-12.79+RC[-1]*0.711))),-20.772/TAN(RADIANS(RC[-1])))))/3600 -> 1.7972086857486583E-2 | AG151: =RC[-2]+RC[-1] -> 41.899085339913526 | AH151: =IF(RC[-5]>0,MOD(DEGREES(ACOS(((SIN(RADIANS(R2C2))*COS(RADIANS(RC[-4])))-SIN(RADIANS(RC[-14])))/(COS(RADIANS(R2C2))*SIN(RADIANS(RC[-4])))))+180,360),MOD(540-DEGREES(ACOS(((SIN(RADIANS(R2C2))*COS(RADIANS(RC[-4])))-SIN(RADIANS(RC[-14])))/(COS(RADIANS(R2C2))*SIN(RADIANS(RC[-4]))))),360)) -> 181.98289983145173
D152: =R[-1]C+1 -> 2017-05-31T00:00:00.000 | E152: =R5C2 -> 1899-12-31T14:00:00.000 | F152: =RC[-2]+2415018.5+RC[-1]-R4C2/24 -> 2457905.375 | G152: =(RC[-1]-2451545)/36525 -> 0.1741375770020534 | I152: =MOD(280.46646+RC[-2]*(36000.76983 + RC[-2]*0.0003032),360) -> 69.553297599029975 | J152: =357.52911+RC[-3]*(35999.05029 - 0.0001537*RC[-3]) -> 6626.3164972148852 | K152: =0.016708634-RC[-4]*(0.000042037+0.0000001267*RC[-4]) -> 1.6701309936637976E-2 | L152: =SIN(RADIANS(RC[-2]))*(1.914602-RC[-5]*(0.004817+0.000014*RC[-5]))+SIN(RADIANS(2*RC[-2]))*(0.019993-0.000101*RC[-5])+SIN(RADIANS(3*RC[-2]))*0.000289 -> 1.0432286839665601 | M152: =RC[-4]+RC[-1] -> 70.596526282996535 | N152: =RC[-4]+RC[-2] -> 6627.359725898852 | O152: =(1.000001018*(1-RC[-4]*RC[-4]))/(1+RC[-4]*COS(RADIANS(RC[-1]))) -> 1.0139824596555786 | P152: =RC[-3]-0.00569-0.00478*SIN(RADIANS(125.04-1934.136*RC[-9])) -> 70.588319862727815 | Q152: =23+(26+((21.448-RC[-10]*(46.815+RC[-10]*(0.00059-RC[-10]*0.001813))))/60)/60 -> 23.437026594726429 | R152: =RC[-1]+0.00256*COS(RADIANS(125.04-1934.136*RC[-11])) -> 23.434850063574245 | S152: =DEGREES(ATAN2(COS(RADIANS(RC[-3])),COS(RADIANS(RC[-1]))*SIN(RADIANS(RC[-3])))) -> 68.989956514324916 | T152: =DEGREES(ASIN(SIN(RADIANS(RC[-2]))*SIN(RADIANS(RC[-4])))) -> 22.030395318687873 | U152: =TAN(RADIANS(RC[-3]/2))*TAN(RADIANS(RC[-3]/2)) -> 4.3017759615455259E-2 | V152: =4*DEGREES(RC[-1]*SIN(2*RADIANS(RC[-13]))-2*RC[-11]*SIN(RADIANS(RC[-12]))+4*RC[-11]*RC[-1]*SIN(RADIANS(RC[-12]))*COS(2*RADIANS(RC[-13]))-0.5*RC[-1]*RC[-1]*SIN(4*RADIANS(RC[-13]))-1.25*RC[-11]*RC[-11]*SIN(2*RADIANS(RC[-12]))) -> 2.2160293962687443 | W152: =DEGREES(ACOS(COS(RADIANS(90.833))/(COS(RADIANS(R2C2))*COS(RADIANS(RC[-3])))-TAN(RADIANS(R2C2))*TAN(RADIANS(RC[-3])))) -> #NUM! | X152: =(720-4*R3C2-RC[-2]+R4C2*60)/1440 -> 1899-12-31T13:53:47.038 | Y152: =(RC[-1]*1440-RC[-2]*4)/1440 -> #NUM! | Z152: =(RC[-2]*1440+RC[-3]*4)/1440 -> #NUM! | AA152: =8*RC[-4] -> #NUM! | AB152: =MOD(RC[-23]*1440+RC[-6]+4*R3C2-60*R4C2,1440) -> 726.21602939626871 | AC152: =IF(RC[-1]/4<0,RC[-1]/4+180,RC[-1]/4-180) -> 1.5540073490671773 | AD152: =DEGREES(ACOS(SIN(RADIANS(R2C2))*SIN(RADIANS(RC[-10]))+COS(RADIANS(R2C2))*COS(RADIANS(RC[-10]))*COS(RADIANS(RC[-1])))) -> 47.97859871793095 | AE152: =90-RC[-1] -> 42.02140128206905 | AF152: =IF(RC[-1]>85,0,IF(RC[-1]>5,58.1/TAN(RADIANS(RC[-1]))-0.07/POWER(TAN(RADIANS(RC[-1])),3)+0.000086/POWER(TAN(RADIANS(RC[-1])),5),IF(RC[-1]>-0.575,1735+RC[-1]*(-518.2+RC[-1]*(103.4+RC[-1]*(-12.79+RC[-1]*0.711))),-20.772/TAN(RADIANS(RC[-1])))))/3600 -> 1.7884057013578737E-2 | AG152: =RC[-2]+RC[-1] -> 42.039285339082632 | AH152: =IF(RC[-5]>0,MOD(DEGREES(ACOS(((SIN(RADIANS(R2C2))*COS(RADIANS(RC[-4])))-SIN(RADIANS(RC[-14])))/(COS(RADIANS(R2C2))*SIN(RADIANS(RC[-4])))))+180,360),MOD(540-DEGREES(ACOS(((SIN(RADIANS(R2C2))*COS(RADIANS(RC[-4])))-SIN(RADIANS(RC[-14])))/(COS(RADIANS(R2C2))*SIN(RADIANS(RC[-4]))))),360)) -> 181.93922456727017
D153: =R[-1]C+1 -> 2017-06-01T00:00:00.000 | E153: =R5C2 -> 1899-12-31T14:00:00.000 | F153: =RC[-2]+2415018.5+RC[-1]-R4C2/24 -> 2457906.375 | G153: =(RC[-1]-2451545)/36525 -> 0.1741649555099247 | I153: =MOD(280.46646+RC[-2]*(36000.76983 + RC[-2]*0.0003032),360) -> 70.538944962084315 | J153: =357.52911+RC[-3]*(35999.05029 - 0.0001537*RC[-3]) -> 6627.3020974951442 | K153: =0.016708634-RC[-4]*(0.000042037+0.0000001267*RC[-4]) -> 1.670130878451943E-2 | L153: =SIN(RADIANS(RC[-2]))*(1.914602-RC[-5]*(0.004817+0.000014*RC[-5]))+SIN(RADIANS(2*RC[-2]))*(0.019993-0.000101*RC[-5])+SIN(RADIANS(3*RC[-2]))*0.000289 -> 1.0159571429102559 | M153: =RC[-4]+RC[-1] -> 71.554902104994568 | N153: =RC[-4]+RC[-2] -> 6628.3180546380545 | O153: =(1.000001018*(1-RC[-4]*RC[-4]))/(1+RC[-4]*COS(RADIANS(RC[-1]))) -> 1.014135406185392 | P153: =RC[-3]-0.00569-0.00478*SIN(RADIANS(125.04-1934.136*RC[-9])) -> 71.54669192978912 | Q153: =23+(26+((21.448-RC[-10]*(46.815+RC[-10]*(0.00059-RC[-10]*0.001813))))/60)/60 -> 23.437026238691445 | R153: =RC[-1]+0.00256*COS(RADIANS(125.04-1934.136*RC[-11])) -> 23.434850954042258 | S153: =DEGREES(ATAN2(COS(RADIANS(RC[-3])),COS(RADIANS(RC[-1]))*SIN(RADIANS(RC[-3])))) -> 70.014226574195519 | T153: =DEGREES(ASIN(SIN(RADIANS(RC[-2]))*SIN(RADIANS(RC[-4])))) -> 22.163864020587241 | U153: =TAN(RADIANS(RC[-3]/2))*TAN(RADIANS(RC[-3]/2)) -> 4.301776297756045E-2 | V153: =4*DEGREES(RC[-1]*SIN(2*RADIANS(RC[-13]))-2*RC[-11]*SIN(RADIANS(RC[-12]))+4*RC[-11]*RC[-1]*SIN(RADIANS(RC[-12]))*COS(2*RADIANS(RC[-13]))-0.5*RC[-1]*RC[-1]*SIN(4*RADIANS(RC[-13]))-1.25*RC[-11]*RC[-11]*SIN(2*RADIANS(RC[-12]))) -> 2.0616818875480232 | W153: =DEGREES(ACOS(COS(RADIANS(90.833))/(COS(RADIANS(R2C2))*COS(RADIANS(RC[-3])))-TAN(RADIANS(R2C2))*TAN(RADIANS(RC[-3])))) -> #NUM! | X153: =(720-4*R3C2-RC[-2]+R4C2*60)/1440 -> 1899-12-31T13:53:56.299 | Y153: =(RC[-1]*1440-RC[-2]*4)/1440 -> #NUM! | Z153: =(RC[-2]*1440+RC[-3]*4)/1440 -> #NUM! | AA153: =8*RC[-4] -> #NUM! | AB153: =MOD(RC[-23]*1440+RC[-6]+4*R3C2-60*R4C2,1440) -> 726.06168188754805 | AC153: =IF(RC[-1]/4<0,RC[-1]/4+180,RC[-1]/4-180) -> 1.5154204718870119 | AD153: =DEGREES(ACOS(SIN(RADIANS(R2C2))*SIN(RADIANS(RC[-10]))+COS(RADIANS(R2C2))*COS(RADIANS(RC[-10]))*COS(RADIANS(RC[-1])))) -> 47.844698876866531 | AE153: =90-RC[-1] -> 42.155301123133469 | AF153: =IF(RC[-1]>85,0,IF(RC[-1]>5,58.1/TAN(RADIANS(RC[-1]))-0.07/POWER(TAN(RADIANS(RC[-1])),3)+0.000086/POWER(TAN(RADIANS(RC[-1])),5),IF(RC[-1]>-0.575,1735+RC[-1]*(-518.2+RC[-1]*(103.4+RC[-1]*(-12.79+RC[-1]*0.711))),-20.772/TAN(RADIANS(RC[-1])))))/3600 -> 1.7800477221795532E-2 | AG153: =RC[-2]+RC[-1] -> 42.173101600355267 | AH153: =IF(RC[-5]>0,MOD(DEGREES(ACOS(((SIN(RADIANS(R2C2))*COS(RADIANS(RC[-4])))-SIN(RADIANS(RC[-14])))/(COS(RADIANS(R2C2))*SIN(RADIANS(RC[-4])))))+180,360),MOD(540-DEGREES(ACOS(((SIN(RADIANS(R2C2))*COS(RADIANS(RC[-4])))-SIN(RADIANS(RC[-14])))/(COS(RADIANS(R2C2))*SIN(RADIANS(RC[-4]))))),360)) -> 181.89327138856447
D154: =R[-1]C+1 -> 2017-06-02T00:00:00.000 | E154: =R5C2 -> 1899-12-31T14:00:00.000 | F154: =RC[-2]+2415018.5+RC[-1]-R4C2/24 -> 2457907.375 | G154: =(RC[-1]-2451545)/36525 -> 0.17419233401779602 | I154: =MOD(280.46646+RC[-2]*(36000.76983 + RC[-2]*0.0003032),360) -> 71.524592325140475 | J154: =357.52911+RC[-3]*(35999.05029 - 0.0001537*RC[-3]) -> 6628.2876977754022 | K154: =0.016708634-RC[-4]*(0.000042037+0.0000001267*RC[-4]) -> 1.6701307632400693E-2 | L154: =SIN(RADIANS(RC[-2]))*(1.914602-RC[-5]*(0.004817+0.000014*RC[-5]))+SIN(RADIANS(2*RC[-2]))*(0.019993-0.000101*RC[-5])+SIN(RADIANS(3*RC[-2]))*0.000289 -> 0.98840042686351293 | M154: =RC[-4]+RC[-1] -> 72.512992752003981 | N154: =RC[-4]+RC[-2] -> 6629.2760982022655 | O154: =(1.000001018*(1-RC[-4]*RC[-4]))/(1+RC[-4]*COS(RADIANS(RC[-1]))) -> 1.0142842636276632 | P154: =RC[-3]-0.00569-0.00478*SIN(RADIANS(125.04-1934.136*RC[-9])) -> 72.504778824014494 | Q154: =23+(26+((21.448-RC[-10]*(46.815+RC[-10]*(0.00059-RC[-10]*0.001813))))/60)/60 -> 23.437025882656457 | R154: =RC[-1]+0.00256*COS(RADIANS(125.04-1934.136*RC[-11])) -> 23.434851846368343 | S154: =DEGREES(ATAN2(COS(RADIANS(RC[-3])),COS(RADIANS(RC[-1]))*SIN(RADIANS(RC[-3])))) -> 71.040089908850305 | T154: =DEGREES(ASIN(SIN(RADIANS(RC[-2]))*SIN(RADIANS(RC[-4])))) -> 22.290886622469674 | U154: =TAN(RADIANS(RC[-3]/2))*TAN(RADIANS(RC[-3]/2)) -> 4.3017766346681238E-2 | V154: =4*DEGREES(RC[-1]*SIN(2*RADIANS(RC[-13]))-2*RC[-11]*SIN(RADIANS(RC[-12]))+4*RC[-11]*RC[-1]*SIN(RADIANS(RC[-12]))*COS(2*RADIANS(RC[-13]))-0.5*RC[-1]*RC[-1]*SIN(4*RADIANS(RC[-13]))-1.25*RC[-11]*RC[-11]*SIN(2*RADIANS(RC[-12]))) -> 1.9009810278166126 | W154: =DEGREES(ACOS(COS(RADIANS(90.833))/(COS(RADIANS(R2C2))*COS(RADIANS(RC[-3])))-TAN(RADIANS(R2C2))*TAN(RADIANS(RC[-3])))) -> #NUM! | X154: =(720-4*R3C2-RC[-2]+R4C2*60)/1440 -> 1899-12-31T13:54:05.941 | Y154: =(RC[-1]*1440-RC[-2]*4)/1440 -> #NUM! | Z154: =(RC[-2]*1440+RC[-3]*4)/1440 -> #NUM! | AA154: =8*RC[-4] -> #NUM! | AB154: =MOD(RC[-23]*1440+RC[-6]+4*R3C2-60*R4C2,1440) -> 725.90098102781656 | AC154: =IF(RC[-1]/4<0,RC[-1]/4+180,RC[-1]/4-180) -> 1.475245256954139 | AD154: =DEGREES(ACOS(SIN(RADIANS(R2C2))*SIN(RADIANS(RC[-10]))+COS(RADIANS(R2C2))*COS(RADIANS(RC[-10]))*COS(RADIANS(RC[-1])))) -> 47.717237304597575 | AE154: =90-RC[-1] -> 42.282762695402425 | AF154: =IF(RC[-1]>85,0,IF(RC[-1]>5,58.1/TAN(RADIANS(RC[-1]))-0.07/POWER(TAN(RADIANS(RC[-1])),3)+0.000086/POWER(TAN(RADIANS(RC[-1])),5),IF(RC[-1]>-0.575,1735+RC[-1]*(-518.2+RC[-1]*(103.4+RC[-1]*(-12.79+RC[-1]*0.711))),-20.772/TAN(RADIANS(RC[-1])))))/3600 -> 1.7721312886753233E-2 | AG154: =RC[-2]+RC[-1] -> 42.300484008289182 | AH154: =IF(RC[-5]>0,MOD(DEGREES(ACOS(((SIN(RADIANS(R2C2))*COS(RADIANS(RC[-4])))-SIN(RADIANS(RC[-14])))/(COS(RADIANS(R2C2))*SIN(RADIANS(RC[-4])))))+180,360),MOD(540-DEGREES(ACOS(((SIN(RADIANS(R2C2))*COS(RADIANS(RC[-4])))-SIN(RADIANS(RC[-14])))/(COS(RADIANS(R2C2))*SIN(RADIANS(RC[-4]))))),360)) -> 181.84512504899027
D155: =R[-1]C+1 -> 2017-06-03T00:00:00.000 | E155: =R5C2 -> 1899-12-31T14:00:00.000 | F155: =RC[-2]+2415018.5+RC[-1]-R4C2/24 -> 2457908.375 | G155: =(RC[-1]-2451545)/36525 -> 0.17421971252566734 | I155: =MOD(280.46646+RC[-2]*(36000.76983 + RC[-2]*0.0003032),360) -> 72.510239688197544 | J155: =357.52911+RC[-3]*(35999.05029 - 0.0001537*RC[-3]) -> 6629.2732980556611 | K155: =0.016708634-RC[-4]*(0.000042037+0.0000001267*RC[-4]) -> 1.6701306480281765E-2 | L155: =SIN(RADIANS(RC[-2]))*(1.914602-RC[-5]*(0.004817+0.000014*RC[-5]))+SIN(RADIANS(2*RC[-2]))*(0.019993-0.000101*RC[-5])+SIN(RADIANS(3*RC[-2]))*0.000289 -> 0.96056642237914835 | M155: =RC[-4]+RC[-1] -> 73.470806110576689 | N155: =RC[-4]+RC[-2] -> 6630.2338644780402 | O155: =(1.000001018*(1-RC[-4]*RC[-4]))/(1+RC[-4]*COS(RADIANS(RC[-1]))) -> 1.0144289915705098 | P155: =RC[-3]-0.00569-0.00478*SIN(RADIANS(125.04-1934.136*RC[-9])) -> 73.462588431959034 | Q155: =23+(26+((21.448-RC[-10]*(46.815+RC[-10]*(0.00059-RC[-10]*0.001813))))/60)/60 -> 23.437025526621468 | R155: =RC[-1]+0.00256*COS(RADIANS(125.04-1934.136*RC[-11])) -> 23.434852740551442 | S155: =DEGREES(ATAN2(COS(RADIANS(RC[-3])),COS(RADIANS(RC[-1]))*SIN(RADIANS(RC[-3])))) -> 72.06747434724538 | T155: =DEGREES(ASIN(SIN(RADIANS(RC[-2]))*SIN(RADIANS(RC[-4])))) -> 22.411417463875743 | U155: =TAN(RADIANS(RC[-3]/2))*TAN(RADIANS(RC[-3]/2)) -> 4.3017769722813626E-2 | V155: =4*DEGREES(RC[-1]*SIN(2*RADIANS(RC[-13]))-2*RC[-11]*SIN(RADIANS(RC[-12]))+4*RC[-11]*RC[-1]*SIN(RADIANS(RC[-12]))*COS(2*RADIANS(RC[-13]))-0.5*RC[-1]*RC[-1]*SIN(4*RADIANS(RC[-13]))-1.25*RC[-11]*RC[-11]*SIN(2*RADIANS(RC[-12]))) -> 1.7342150366620295 | W155: =DEGREES(ACOS(COS(RADIANS(90.833))/(COS(RADIANS(R2C2))*COS(RADIANS(RC[-3])))-TAN(RADIANS(R2C2))*TAN(RADIANS(RC[-3])))) -> #NUM! | X155: =(720-4*R3C2-RC[-2]+R4C2*60)/1440 -> 1899-12-31T13:54:15.947 | Y155: =(RC[-1]*1440-RC[-2]*4)/1440 -> #NUM! | Z155: =(RC[-2]*1440+RC[-3]*4)/1440 -> #NUM! | AA155: =8*RC[-4] -> #NUM! | AB155: =MOD(RC[-23]*1440+RC[-6]+4*R3C2-60*R4C2,1440) -> 725.73421503666202 | AC155: =IF(RC[-1]/4<0,RC[-1]/4+180,RC[-1]/4-180) -> 1.4335537591655054 | AD155: =DEGREES(ACOS(SIN(RADIANS(R2C2))*SIN(RADIANS(RC[-10]))+COS(RADIANS(R2C2))*COS(RADIANS(RC[-10]))*COS(RADIANS(RC[-1])))) -> 47.596261903556034 | AE155: =90-RC[-1] -> 42.403738096443966 | AF155: =IF(RC[-1]>85,0,IF(RC[-1]>5,58.1/TAN(RADIANS(RC[-1]))-0.07/POWER(TAN(RADIANS(RC[-1])),3)+0.000086/POWER(TAN(RADIANS(RC[-1])),5),IF(RC[-1]>-0.575,1735+RC[-1]*(-518.2+RC[-1]*(103.4+RC[-1]*(-12.79+RC[-1]*0.711))),-20.772/TAN(RADIANS(RC[-1])))))/3600 -> 1.7646531602920623E-2 | AG155: =RC[-2]+RC[-1] -> 42.421384628046887 | AH155: =IF(RC[-5]>0,MOD(DEGREES(ACOS(((SIN(RADIANS(R2C2))*COS(RADIANS(RC[-4])))-SIN(RADIANS(RC[-14])))/(COS(RADIANS(R2C2))*SIN(RADIANS(RC[-4])))))+180,360),MOD(540-DEGREES(ACOS(((SIN(RADIANS(R2C2))*COS(RADIANS(RC[-4])))-SIN(RADIANS(RC[-14])))/(COS(RADIANS(R2C2))*SIN(RADIANS(RC[-4]))))),360)) -> 181.79487497878253
D156: =R[-1]C+1 -> 2017-06-04T00:00:00.000 | E156: =R5C2 -> 1899-12-31T14:00:00.000 | F156: =RC[-2]+2415018.5+RC[-1]-R4C2/24 -> 2457909.375 | G156: =(RC[-1]-2451545)/36525 -> 0.17424709103353866 | I156: =MOD(280.46646+RC[-2]*(36000.76983 + RC[-2]*0.0003032),360) -> 73.495887051254613 | J156: =357.52911+RC[-3]*(35999.05029 - 0.0001537*RC[-3]) -> 6630.2588983359192 | K156: =0.016708634-RC[-4]*(0.000042037+0.0000001267*RC[-4]) -> 1.6701305328162649E-2 | L156: =SIN(RADIANS(RC[-2]))*(1.914602-RC[-5]*(0.004817+0.000014*RC[-5]))+SIN(RADIANS(2*RC[-2]))*(0.019993-0.000101*RC[-5])+SIN(RADIANS(3*RC[-2]))*0.000289 -> 0.93246308110551401 | M156: =RC[-4]+RC[-1] -> 74.428350132360123 | N156: =RC[-4]+RC[-2] -> 6631.1913614170244 | O156: =(1.000001018*(1-RC[-4]*RC[-4]))/(1+RC[-4]*COS(RADIANS(RC[-1]))) -> 1.014569550757793 | P156: =RC[-3]-0.00569-0.00478*SIN(RADIANS(125.04-1934.136*RC[-9])) -> 74.420128705273399 | Q156: =23+(26+((21.448-RC[-10]*(46.815+RC[-10]*(0.00059-RC[-10]*0.001813))))/60)/60 -> 23.43702517058648 | R156: =RC[-1]+0.00256*COS(RADIANS(125.04-1934.136*RC[-11])) -> 23.434853636590489 | S156: =DEGREES(ATAN2(COS(RADIANS(RC[-3])),COS(RADIANS(RC[-1]))*SIN(RADIANS(RC[-3])))) -> 73.096305067163115 | T156: =DEGREES(ASIN(SIN(RADIANS(RC[-2]))*SIN(RADIANS(RC[-4])))) -> 22.525413133626905 | U156: =TAN(RADIANS(RC[-3]/2))*TAN(RADIANS(RC[-3]/2)) -> 4.3017773105953595E-2 | V156: =4*DEGREES(RC[-1]*SIN(2*RADIANS(RC[-13]))-2*RC[-11]*SIN(RADIANS(RC[-12]))+4*RC[-11]*RC[-1]*SIN(RADIANS(RC[-12]))*COS(2*RADIANS(RC[-13]))-0.5*RC[-1]*RC[-1]*SIN(4*RADIANS(RC[-13]))-1.25*RC[-11]*RC[-11]*SIN(2*RADIANS(RC[-12]))) -> 1.5616825764237252 | W156: =DEGREES(ACOS(COS(RADIANS(90.833))/(COS(RADIANS(R2C2))*COS(RADIANS(RC[-3])))-TAN(RADIANS(R2C2))*TAN(RADIANS(RC[-3])))) -> #NUM! | X156: =(720-4*R3C2-RC[-2]+R4C2*60)/1440 -> 1899-12-31T13:54:26.299 | Y156: =(RC[-1]*1440-RC[-2]*4)/1440 -> #NUM! | Z156: =(RC[-2]*1440+RC[-3]*4)/1440 -> #NUM! | AA156: =8*RC[-4] -> #NUM! | AB156: =MOD(RC[-23]*1440+RC[-6]+4*R3C2-60*R4C2,1440) -> 725.56168257642378 | AC156: =IF(RC[-1]/4<0,RC[-1]/4+180,RC[-1]/4-180) -> 1.3904206441059443 | AD156: =DEGREES(ACOS(SIN(RADIANS(R2C2))*SIN(RADIANS(RC[-10]))+COS(RADIANS(R2C2))*COS(RADIANS(RC[-10]))*COS(RADIANS(RC[-1])))) -> 47.481818330493866 | AE156: =90-RC[-1] -> 42.518181669506134 | AF156: =IF(RC[-1]>85,0,IF(RC[-1]>5,58.1/TAN(RADIANS(RC[-1]))-0.07/POWER(TAN(RADIANS(RC[-1])),3)+0.000086/POWER(TAN(RADIANS(RC[-1])),5),IF(RC[-1]>-0.575,1735+RC[-1]*(-518.2+RC[-1]*(103.4+RC[-1]*(-12.79+RC[-1]*0.711))),-20.772/TAN(RADIANS(RC[-1])))))/3600 -> 1.7576103073014243E-2 | AG156: =RC[-2]+RC[-1] -> 42.535757772579146 | AH156: =IF(RC[-5]>0,MOD(DEGREES(ACOS(((SIN(RADIANS(R2C2))*COS(RADIANS(RC[-4])))-SIN(RADIANS(RC[-14])))/(COS(RADIANS(R2C2))*SIN(RADIANS(RC[-4])))))+180,360),MOD(540-DEGREES(ACOS(((SIN(RADIANS(R2C2))*COS(RADIANS(RC[-4])))-SIN(RADIANS(RC[-14])))/(COS(RADIANS(R2C2))*SIN(RADIANS(RC[-4]))))),360)) -> 181.74261514679333
D157: =R[-1]C+1 -> 2017-06-05T00:00:00.000 | E157: =R5C2 -> 1899-12-31T14:00:00.000 | F157: =RC[-2]+2415018.5+RC[-1]-R4C2/24 -> 2457910.375 | G157: =(RC[-1]-2451545)/36525 -> 0.17427446954140999 | I157: =MOD(280.46646+RC[-2]*(36000.76983 + RC[-2]*0.0003032),360) -> 74.481534414312591 | J157: =357.52911+RC[-3]*(35999.05029 - 0.0001537*RC[-3]) -> 6631.2444986161781 | K157: =0.016708634-RC[-4]*(0.000042037+0.0000001267*RC[-4]) -> 1.6701304176043343E-2 | L157: =SIN(RADIANS(RC[-2]))*(1.914602-RC[-5]*(0.004817+0.000014*RC[-5]))+SIN(RADIANS(2*RC[-2]))*(0.019993-0.000101*RC[-5])+SIN(RADIANS(3*RC[-2]))*0.000289 -> 0.90409841777350497 | M157: =RC[-4]+RC[-1] -> 75.385632832086102 | N157: =RC[-4]+RC[-2] -> 6632.1485970339518 | O157: =(1.000001018*(1-RC[-4]*RC[-4]))/(1+RC[-4]*COS(RADIANS(RC[-1]))) -> 1.0147059030968044 | P157: =RC[-3]-0.00569-0.00478*SIN(RADIANS(125.04-1934.136*RC[-9])) -> 75.37740765869259 | Q157: =23+(26+((21.448-RC[-10]*(46.815+RC[-10]*(0.00059-RC[-10]*0.001813))))/60)/60 -> 23.437024814551492 | R157: =RC[-1]+0.00256*COS(RADIANS(125.04-1934.136*RC[-11])) -> 23.434854534484412 | S157: =DEGREES(ATAN2(COS(RADIANS(RC[-3])),COS(RADIANS(RC[-1]))*SIN(RADIANS(RC[-3])))) -> 74.126504701683885 | T157: =DEGREES(ASIN(SIN(RADIANS(RC[-2]))*SIN(RADIANS(RC[-4])))) -> 22.632832520645401 | U157: =TAN(RADIANS(RC[-3]/2))*TAN(RADIANS(RC[-3]/2)) -> 4.3017776496097074E-2 | V157: =4*DEGREES(RC[-1]*SIN(2*RADIANS(RC[-13]))-2*RC[-11]*SIN(RADIANS(RC[-12]))+4*RC[-11]*RC[-1]*SIN(RADIANS(RC[-12]))*COS(2*RADIANS(RC[-13]))-0.5*RC[-1]*RC[-1]*SIN(4*RADIANS(RC[-13]))-1.25*RC[-11]*RC[-11]*SIN(2*RADIANS(RC[-12]))) -> 1.3836923205249376 | W157: =DEGREES(ACOS(COS(RADIANS(90.833))/(COS(RADIANS(R2C2))*COS(RADIANS(RC[-3])))-TAN(RADIANS(R2C2))*TAN(RADIANS(RC[-3])))) -> #NUM! | X157: =(720-4*R3C2-RC[-2]+R4C2*60)/1440 -> 1899-12-31T13:54:36.978 | Y157: =(RC[-1]*1440-RC[-2]*4)/1440 -> #NUM! | Z157: =(RC[-2]*1440+RC[-3]*4)/1440 -> #NUM! | AA157: =8*RC[-4] -> #NUM! | AB157: =MOD(RC[-23]*1440+RC[-6]+4*R3C2-60*R4C2,1440) -> 725.38369232052491 | AC157: =IF(RC[-1]/4<0,RC[-1]/4+180,RC[-1]/4-180) -> 1.3459230801312287 | AD157: =DEGREES(ACOS(SIN(RADIANS(R2C2))*SIN(RADIANS(RC[-10]))+COS(RADIANS(R2C2))*COS(RADIANS(RC[-10]))*COS(RADIANS(RC[-1])))) -> 47.373949931001249 | AE157: =90-RC[-1] -> 42.626050068998751 | AF157: =IF(RC[-1]>85,0,IF(RC[-1]>5,58.1/TAN(RADIANS(RC[-1]))-0.07/POWER(TAN(RADIANS(RC[-1])),3)+0.000086/POWER(TAN(RADIANS(RC[-1])),5),IF(RC[-1]>-0.575,1735+RC[-1]*(-518.2+RC[-1]*(103.4+RC[-1]*(-12.79+RC[-1]*0.711))),-20.772/TAN(RADIANS(RC[-1])))))/3600 -> 1.7509999031073482E-2 | AG157: =RC[-2]+RC[-1] -> 42.643560068029828 | AH157: =IF(RC[-5]>0,MOD(DEGREES(ACOS(((SIN(RADIANS(R2C2))*COS(RADIANS(RC[-4])))-SIN(RADIANS(RC[-14])))/(COS(RADIANS(R2C2))*SIN(RADIANS(RC[-4])))))+180,360),MOD(540-DEGREES(ACOS(((SIN(RADIANS(R2C2))*COS(RADIANS(RC[-4])))-SIN(RADIANS(RC[-14])))/(COS(RADIANS(R2C2))*SIN(RADIANS(RC[-4]))))),360)) -> 181.68844390714003
D158: =R[-1]C+1 -> 2017-06-06T00:00:00.000 | E158: =R5C2 -> 1899-12-31T14:00:00.000 | F158: =RC[-2]+2415018.5+RC[-1]-R4C2/24 -> 2457911.375 | G158: =(RC[-1]-2451545)/36525 -> 0.17430184804928131 | I158: =MOD(280.46646+RC[-2]*(36000.76983 + RC[-2]*0.0003032),360) -> 75.46718177737057 | J158: =357.52911+RC[-3]*(35999.05029 - 0.0001537*RC[-3]) -> 6632.2300988964362 | K158: =0.016708634-RC[-4]*(0.000042037+0.0000001267*RC[-4]) -> 1.6701303023923846E-2 | L158: =SIN(RADIANS(RC[-2]))*(1.914602-RC[-5]*(0.004817+0.000014*RC[-5]))+SIN(RADIANS(2*RC[-2]))*(0.019993-0.000101*RC[-5])+SIN(RADIANS(3*RC[-2]))*0.000289 -> 0.87548050818203305 | M158: =RC[-4]+RC[-1] -> 76.342662285552606 | N158: =RC[-4]+RC[-2] -> 6633.1055794046179 | O158: =(1.000001018*(1-RC[-4]*RC[-4]))/(1+RC[-4]*COS(RADIANS(RC[-1]))) -> 1.0148380116656863 | P158: =RC[-3]-0.00569-0.00478*SIN(RADIANS(125.04-1934.136*RC[-9])) -> 76.334433368017798 | Q158: =23+(26+((21.448-RC[-10]*(46.815+RC[-10]*(0.00059-RC[-10]*0.001813))))/60)/60 -> 23.437024458516508 | R158: =RC[-1]+0.00256*COS(RADIANS(125.04-1934.136*RC[-11])) -> 23.434855434232141 | S158: =DEGREES(ATAN2(COS(RADIANS(RC[-3])),COS(RADIANS(RC[-1]))*SIN(RADIANS(RC[-3])))) -> 75.157993452553697 | T158: =DEGREES(ASIN(SIN(RADIANS(RC[-2]))*SIN(RADIANS(RC[-4])))) -> 22.733636862753393 | U158: =TAN(RADIANS(RC[-3]/2))*TAN(RADIANS(RC[-3]/2)) -> 4.301777989324005E-2 | V158: =4*DEGREES(RC[-1]*SIN(2*RADIANS(RC[-13]))-2*RC[-11]*SIN(RADIANS(RC[-12]))+4*RC[-11]*RC[-1]*SIN(RADIANS(RC[-12]))*COS(2*RADIANS(RC[-13]))-0.5*RC[-1]*RC[-1]*SIN(4*RADIANS(RC[-13]))-1.25*RC[-11]*RC[-11]*SIN(2*RADIANS(RC[-12]))) -> 1.2005624969607913 | W158: =DEGREES(ACOS(COS(RADIANS(90.833))/(COS(RADIANS(R2C2))*COS(RADIANS(RC[-3])))-TAN(RADIANS(R2C2))*TAN(RADIANS(RC[-3])))) -> #NUM! | X158: =(720-4*R3C2-RC[-2]+R4C2*60)/1440 -> 1899-12-31T13:54:47.966 | Y158: =(RC[-1]*1440-RC[-2]*4)/1440 -> #NUM! | Z158: =(RC[-2]*1440+RC[-3]*4)/1440 -> #NUM! | AA158: =8*RC[-4] -> #NUM! | AB158: =MOD(RC[-23]*1440+RC[-6]+4*R3C2-60*R4C2,1440) -> 725.20056249696074 | AC158: =IF(RC[-1]/4<0,RC[-1]/4+180,RC[-1]/4-180) -> 1.3001406242401856 | AD158: =DEGREES(ACOS(SIN(RADIANS(R2C2))*SIN(RADIANS(RC[-10]))+COS(RADIANS(R2C2))*COS(RADIANS(RC[-10]))*COS(RADIANS(RC[-1])))) -> 47.272697676098531 | AE158: =90-RC[-1] -> 42.727302323901469 | AF158: =IF(RC[-1]>85,0,IF(RC[-1]>5,58.1/TAN(RADIANS(RC[-1]))-0.07/POWER(TAN(RADIANS(RC[-1])),3)+0.000086/POWER(TAN(RADIANS(RC[-1])),5),IF(RC[-1]>-0.575,1735+RC[-1]*(-518.2+RC[-1]*(103.4+RC[-1]*(-12.79+RC[-1]*0.711))),-20.772/TAN(RADIANS(RC[-1])))))/3600 -> 1.7448193170131687E-2 | AG158: =RC[-2]+RC[-1] -> 42.744750517071601 | AH158: =IF(RC[-5]>0,MOD(DEGREES(ACOS(((SIN(RADIANS(R2C2))*COS(RADIANS(RC[-4])))-SIN(RADIANS(RC[-14])))/(COS(RADIANS(R2C2))*SIN(RADIANS(RC[-4])))))+180,360),MOD(540-DEGREES(ACOS(((SIN(RADIANS(R2C2))*COS(RADIANS(RC[-4])))-SIN(RADIANS(RC[-14])))/(COS(RADIANS(R2C2))*SIN(RADIANS(RC[-4]))))),360)) -> 181.63246383071763
D159: =R[-1]C+1 -> 2017-06-07T00:00:00.000 | E159: =R5C2 -> 1899-12-31T14:00:00.000 | F159: =RC[-2]+2415018.5+RC[-1]-R4C2/24 -> 2457912.375 | G159: =(RC[-1]-2451545)/36525 -> 0.17432922655715263 | I159: =MOD(280.46646+RC[-2]*(36000.76983 + RC[-2]*0.0003032),360) -> 76.452829140428548 | J159: =357.52911+RC[-3]*(35999.05029 - 0.0001537*RC[-3]) -> 6633.2156991766933 | K159: =0.016708634-RC[-4]*(0.000042037+0.0000001267*RC[-4]) -> 1.6701301871804158E-2 | L159: =SIN(RADIANS(RC[-2]))*(1.914602-RC[-5]*(0.004817+0.000014*RC[-5]))+SIN(RADIANS(2*RC[-2]))*(0.019993-0.000101*RC[-5])+SIN(RADIANS(3*RC[-2]))*0.000289 -> 0.8466174871818829 | M159: =RC[-4]+RC[-1] -> 77.299446627610436 | N159: =RC[-4]+RC[-2] -> 6634.0623166638752 | O159: =(1.000001018*(1-RC[-4]*RC[-4]))/(1+RC[-4]*COS(RADIANS(RC[-1]))) -> 1.014965840720595 | P159: =RC[-3]-0.00569-0.00478*SIN(RADIANS(125.04-1934.136*RC[-9])) -> 77.291213968103008 | Q159: =23+(26+((21.448-RC[-10]*(46.815+RC[-10]*(0.00059-RC[-10]*0.001813))))/60)/60 -> 23.437024102481519 | R159: =RC[-1]+0.00256*COS(RADIANS(125.04-1934.136*RC[-11])) -> 23.434856335832603 | S159: =DEGREES(ATAN2(COS(RADIANS(RC[-3])),COS(RADIANS(RC[-1]))*SIN(RADIANS(RC[-3])))) -> 76.190689210259791 | T159: =DEGREES(ASIN(SIN(RADIANS(RC[-2]))*SIN(RADIANS(RC[-4])))) -> 22.827789793276803 | U159: =TAN(RADIANS(RC[-3]/2))*TAN(RADIANS(RC[-3]/2)) -> 4.3017783297378466E-2 | V159: =4*DEGREES(RC[-1]*SIN(2*RADIANS(RC[-13]))-2*RC[-11]*SIN(RADIANS(RC[-12]))+4*RC[-11]*RC[-1]*SIN(RADIANS(RC[-12]))*COS(2*RADIANS(RC[-13]))-0.5*RC[-1]*RC[-1]*SIN(4*RADIANS(RC[-13]))-1.25*RC[-11]*RC[-11]*SIN(2*RADIANS(RC[-12]))) -> 1.0126204078462422 | W159: =DEGREES(ACOS(COS(RADIANS(90.833))/(COS(RADIANS(R2C2))*COS(RADIANS(RC[-3])))-TAN(RADIANS(R2C2))*TAN(RADIANS(RC[-3])))) -> #NUM! | X159: =(720-4*R3C2-RC[-2]+R4C2*60)/1440 -> 1899-12-31T13:54:59.243 | Y159: =(RC[-1]*1440-RC[-2]*4)/1440 -> #NUM! | Z159: =(RC[-2]*1440+RC[-3]*4)/1440 -> #NUM! | AA159: =8*RC[-4] -> #NUM! | AB159: =MOD(RC[-23]*1440+RC[-6]+4*R3C2-60*R4C2,1440) -> 725.01262040784627 | AC159: =IF(RC[-1]/4<0,RC[-1]/4+180,RC[-1]/4-180) -> 1.2531551019615677 | AD159: =DEGREES(ACOS(SIN(RADIANS(R2C2))*SIN(RADIANS(RC[-10]))+COS(RADIANS(R2C2))*COS(RADIANS(RC[-10]))*COS(RADIANS(RC[-1])))) -> 47.178100101187447 | AE159: =90-RC[-1] -> 42.821899898812553 | AF159: =IF(RC[-1]>85,0,IF(RC[-1]>5,58.1/TAN(RADIANS(RC[-1]))-0.07/POWER(TAN(RADIANS(RC[-1])),3)+0.000086/POWER(TAN(RADIANS(RC[-1])),5),IF(RC[-1]>-0.575,1735+RC[-1]*(-518.2+RC[-1]*(103.4+RC[-1]*(-12.79+RC[-1]*0.711))),-20.772/TAN(RADIANS(RC[-1])))))/3600 -> 1.7390661074409529E-2 | AG159: =RC[-2]+RC[-1] -> 42.839290559886962 | AH159: =IF(RC[-5]>0,MOD(DEGREES(ACOS(((SIN(RADIANS(R2C2))*COS(RADIANS(RC[-4])))-SIN(RADIANS(RC[-14])))/(COS(RADIANS(R2C2))*SIN(RADIANS(RC[-4])))))+180,360),MOD(540-DEGREES(ACOS(((SIN(RADIANS(R2C2))*COS(RADIANS(RC[-4])))-SIN(RADIANS(RC[-14])))/(COS(RADIANS(R2C2))*SIN(RADIANS(RC[-4]))))),360)) -> 181.57478152189117
D160: =R[-1]C+1 -> 2017-06-08T00:00:00.000 | E160: =R5C2 -> 1899-12-31T14:00:00.000 | F160: =RC[-2]+2415018.5+RC[-1]-R4C2/24 -> 2457913.375 | G160: =(RC[-1]-2451545)/36525 -> 0.17435660506502396 | I160: =MOD(280.46646+RC[-2]*(36000.76983 + RC[-2]*0.0003032),360) -> 77.438476503487436 | J160: =357.52911+RC[-3]*(35999.05029 - 0.0001537*RC[-3]) -> 6634.2012994569513 | K160: =0.016708634-RC[-4]*(0.000042037+0.0000001267*RC[-4]) -> 1.6701300719684283E-2 | L160: =SIN(RADIANS(RC[-2]))*(1.914602-RC[-5]*(0.004817+0.000014*RC[-5]))+SIN(RADIANS(2*RC[-2]))*(0.019993-0.000101*RC[-5])+SIN(RADIANS(3*RC[-2]))*0.000289 -> 0.81751754665822618 | M160: =RC[-4]+RC[-1] -> 78.255994050145659 | N160: =RC[-4]+RC[-2] -> 6635.0188170036099 | O160: =(1.000001018*(1-RC[-4]*RC[-4]))/(1+RC[-4]*COS(RADIANS(RC[-1]))) -> 1.0150893557026044 | P160: =RC[-3]-0.00569-0.00478*SIN(RADIANS(125.04-1934.136*RC[-9])) -> 78.247757650837514 | Q160: =23+(26+((21.448-RC[-10]*(46.815+RC[-10]*(0.00059-RC[-10]*0.001813))))/60)/60 -> 23.437023746446531 | R160: =RC[-1]+0.00256*COS(RADIANS(125.04-1934.136*RC[-11])) -> 23.434857239284717 | S160: =DEGREES(ATAN2(COS(RADIANS(RC[-3])),COS(RADIANS(RC[-1]))*SIN(RADIANS(RC[-3])))) -> 77.224507680570213 | T160: =DEGREES(ASIN(SIN(RADIANS(RC[-2]))*SIN(RADIANS(RC[-4])))) -> 22.915257385281965 | U160: =TAN(RADIANS(RC[-3]/2))*TAN(RADIANS(RC[-3]/2)) -> 4.3017786708508247E-2 | V160: =4*DEGREES(RC[-1]*SIN(2*RADIANS(RC[-13]))-2*RC[-11]*SIN(RADIANS(RC[-12]))+4*RC[-11]*RC[-1]*SIN(RADIANS(RC[-12]))*COS(2*RADIANS(RC[-13]))-0.5*RC[-1]*RC[-1]*SIN(4*RADIANS(RC[-13]))-1.25*RC[-11]*RC[-11]*SIN(2*RADIANS(RC[-12]))) -> 0.8202019260252732 | W160: =DEGREES(ACOS(COS(RADIANS(90.833))/(COS(RADIANS(R2C2))*COS(RADIANS(RC[-3])))-TAN(RADIANS(R2C2))*TAN(RADIANS(RC[-3])))) -> #NUM! | X160: =(720-4*R3C2-RC[-2]+R4C2*60)/1440 -> 1899-12-31T13:55:10.788 | Y160: =(RC[-1]*1440-RC[-2]*4)/1440 -> #NUM! | Z160: =(RC[-2]*1440+RC[-3]*4)/1440 -> #NUM! | AA160: =8*RC[-4] -> #NUM! | AB160: =MOD(RC[-23]*1440+RC[-6]+4*R3C2-60*R4C2,1440) -> 724.82020192602522 | AC160: =IF(RC[-1]/4<0,RC[-1]/4+180,RC[-1]/4-180) -> 1.205050481506305 | AD160: =DEGREES(ACOS(SIN(RADIANS(R2C2))*SIN(RADIANS(RC[-10]))+COS(RADIANS(R2C2))*COS(RADIANS(RC[-10]))*COS(RADIANS(RC[-1])))) -> 47.090193247645111 | AE160: =90-RC[-1] -> 42.909806752354889 | AF160: =IF(RC[-1]>85,0,IF(RC[-1]>5,58.1/TAN(RADIANS(RC[-1]))-0.07/POWER(TAN(RADIANS(RC[-1])),3)+0.000086/POWER(TAN(RADIANS(RC[-1])),5),IF(RC[-1]>-0.575,1735+RC[-1]*(-518.2+RC[-1]*(103.4+RC[-1]*(-12.79+RC[-1]*0.711))),-20.772/TAN(RADIANS(RC[-1])))))/3600 -> 1.733738015596837E-2 | AG160: =RC[-2]+RC[-1] -> 42.927144132510854 | AH160: =IF(RC[-5]>0,MOD(DEGREES(ACOS(((SIN(RADIANS(R2C2))*COS(RADIANS(RC[-4])))-SIN(RADIANS(RC[-14])))/(COS(RADIANS(R2C2))*SIN(RADIANS(RC[-4])))))+180,360),MOD(540-DEGREES(ACOS(((SIN(RADIANS(R2C2))*COS(RADIANS(RC[-4])))-SIN(RADIANS(RC[-14])))/(COS(RADIANS(R2C2))*SIN(RADIANS(RC[-4]))))),360)) -> 181.51550742077015
D161: =R[-1]C+1 -> 2017-06-09T00:00:00.000 | E161: =R5C2 -> 1899-12-31T14:00:00.000 | F161: =RC[-2]+2415018.5+RC[-1]-R4C2/24 -> 2457914.375 | G161: =(RC[-1]-2451545)/36525 -> 0.17438398357289528 | I161: =MOD(280.46646+RC[-2]*(36000.76983 + RC[-2]*0.0003032),360) -> 78.424123866547234 | J161: =357.52911+RC[-3]*(35999.05029 - 0.0001537*RC[-3]) -> 6635.1868997372094 | K161: =0.016708634-RC[-4]*(0.000042037+0.0000001267*RC[-4]) -> 1.6701299567564214E-2 | L161: =SIN(RADIANS(RC[-2]))*(1.914602-RC[-5]*(0.004817+0.000014*RC[-5]))+SIN(RADIANS(2*RC[-2]))*(0.019993-0.000101*RC[-5])+SIN(RADIANS(3*RC[-2]))*0.000289 -> 0.78818893351204022 | M161: =RC[-4]+RC[-1] -> 79.21231280005928 | N161: =RC[-4]+RC[-2] -> 6635.9750886707216 | O161: =(1.000001018*(1-RC[-4]*RC[-4]))/(1+RC[-4]*COS(RADIANS(RC[-1]))) -> 1.0152085232443511 | P161: =RC[-3]-0.00569-0.00478*SIN(RADIANS(125.04-1934.136*RC[-9])) -> 79.204072663125487 | Q161: =23+(26+((21.448-RC[-10]*(46.815+RC[-10]*(0.00059-RC[-10]*0.001813))))/60)/60 -> 23.437023390411547 | R161: =RC[-1]+0.00256*COS(RADIANS(125.04-1934.136*RC[-11])) -> 23.434858144587423 | S161: =DEGREES(ATAN2(COS(RADIANS(RC[-3])),COS(RADIANS(RC[-1]))*SIN(RADIANS(RC[-3])))) -> 78.259362517269352 | T161: =DEGREES(ASIN(SIN(RADIANS(RC[-2]))*SIN(RADIANS(RC[-4])))) -> 22.99600819328057 | U161: =TAN(RADIANS(RC[-3]/2))*TAN(RADIANS(RC[-3]/2)) -> 4.3017790126625377E-2 | V161: =4*DEGREES(RC[-1]*SIN(2*RADIANS(RC[-13]))-2*RC[-11]*SIN(RADIANS(RC[-12]))+4*RC[-11]*RC[-1]*SIN(RADIANS(RC[-12]))*COS(2*RADIANS(RC[-13]))-0.5*RC[-1]*RC[-1]*SIN(4*RADIANS(RC[-13]))-1.25*RC[-11]*RC[-11]*SIN(2*RADIANS(RC[-12]))) -> 0.62365096982970958 | W161: =DEGREES(ACOS(COS(RADIANS(90.833))/(COS(RADIANS(R2C2))*COS(RADIANS(RC[-3])))-TAN(RADIANS(R2C2))*TAN(RADIANS(RC[-3])))) -> #NUM! | X161: =(720-4*R3C2-RC[-2]+R4C2*60)/1440 -> 1899-12-31T13:55:22.581 | Y161: =(RC[-1]*1440-RC[-2]*4)/1440 -> #NUM! | Z161: =(RC[-2]*1440+RC[-3]*4)/1440 -> #NUM! | AA161: =8*RC[-4] -> #NUM! | AB161: =MOD(RC[-23]*1440+RC[-6]+4*R3C2-60*R4C2,1440) -> 724.62365096982967 | AC161: =IF(RC[-1]/4<0,RC[-1]/4+180,RC[-1]/4-180) -> 1.1559127424574172 | AD161: =DEGREES(ACOS(SIN(RADIANS(R2C2))*SIN(RADIANS(RC[-10]))+COS(RADIANS(R2C2))*COS(RADIANS(RC[-10]))*COS(RADIANS(RC[-1])))) -> 47.009010607335973 | AE161: =90-RC[-1] -> 42.990989392664027 | AF161: =IF(RC[-1]>85,0,IF(RC[-1]>5,58.1/TAN(RADIANS(RC[-1]))-0.07/POWER(TAN(RADIANS(RC[-1])),3)+0.000086/POWER(TAN(RADIANS(RC[-1])),5),IF(RC[-1]>-0.575,1735+RC[-1]*(-518.2+RC[-1]*(103.4+RC[-1]*(-12.79+RC[-1]*0.711))),-20.772/TAN(RADIANS(RC[-1])))))/3600 -> 1.7288329595769619E-2 | AG161: =RC[-2]+RC[-1] -> 43.008277722259798 | AH161: =IF(RC[-5]>0,MOD(DEGREES(ACOS(((SIN(RADIANS(R2C2))*COS(RADIANS(RC[-4])))-SIN(RADIANS(RC[-14])))/(COS(RADIANS(R2C2))*SIN(RADIANS(RC[-4])))))+180,360),MOD(540-DEGREES(ACOS(((SIN(RADIANS(R2C2))*COS(RADIANS(RC[-4])))-SIN(RADIANS(RC[-14])))/(COS(RADIANS(R2C2))*SIN(RADIANS(RC[-4]))))),360)) -> 181.45475559155599
D162: =R[-1]C+1 -> 2017-06-10T00:00:00.000 | E162: =R5C2 -> 1899-12-31T14:00:00.000 | F162: =RC[-2]+2415018.5+RC[-1]-R4C2/24 -> 2457915.375 | G162: =(RC[-1]-2451545)/36525 -> 0.1744113620807666 | I162: =MOD(280.46646+RC[-2]*(36000.76983 + RC[-2]*0.0003032),360) -> 79.409771229606122 | J162: =357.52911+RC[-3]*(35999.05029 - 0.0001537*RC[-3]) -> 6636.1725000174656 | K162: =0.016708634-RC[-4]*(0.000042037+0.0000001267*RC[-4]) -> 1.6701298415443957E-2 | L162: =SIN(RADIANS(RC[-2]))*(1.914602-RC[-5]*(0.004817+0.000014*RC[-5]))+SIN(RADIANS(2*RC[-2]))*(0.019993-0.000101*RC[-5])+SIN(RADIANS(3*RC[-2]))*0.000289 -> 0.7586399476404061 | M162: =RC[-4]+RC[-1] -> 80.168411177246526 | N162: =RC[-4]+RC[-2] -> 6636.931139965106 | O162: =(1.000001018*(1-RC[-4]*RC[-4]))/(1+RC[-4]*COS(RADIANS(RC[-1]))) -> 1.0153233111764277 | P162: =RC[-3]-0.00569-0.00478*SIN(RADIANS(125.04-1934.136*RC[-9])) -> 80.160167304865354 | Q162: =23+(26+((21.448-RC[-10]*(46.815+RC[-10]*(0.00059-RC[-10]*0.001813))))/60)/60 -> 23.437023034376558 | R162: =RC[-1]+0.00256*COS(RADIANS(125.04-1934.136*RC[-11])) -> 23.434859051739625 | S162: =DEGREES(ATAN2(COS(RADIANS(RC[-3])),COS(RADIANS(RC[-1]))*SIN(RADIANS(RC[-3])))) -> 79.295165460790528 | T162: =DEGREES(ASIN(SIN(RADIANS(RC[-2]))*SIN(RADIANS(RC[-4])))) -> 23.070013292245562 | U162: =TAN(RADIANS(RC[-3]/2))*TAN(RADIANS(RC[-3]/2)) -> 4.3017793551725733E-2 | V162: =4*DEGREES(RC[-1]*SIN(2*RADIANS(RC[-13]))-2*RC[-11]*SIN(RADIANS(RC[-12]))+4*RC[-11]*RC[-1]*SIN(RADIANS(RC[-12]))*COS(2*RADIANS(RC[-13]))-0.5*RC[-1]*RC[-1]*SIN(4*RADIANS(RC[-13]))-1.25*RC[-11]*RC[-11]*SIN(2*RADIANS(RC[-12]))) -> 0.42331895716254414 | W162: =DEGREES(ACOS(COS(RADIANS(90.833))/(COS(RADIANS(R2C2))*COS(RADIANS(RC[-3])))-TAN(RADIANS(R2C2))*TAN(RADIANS(RC[-3])))) -> #NUM! | X162: =(720-4*R3C2-RC[-2]+R4C2*60)/1440 -> 1899-12-31T13:55:34.601 | Y162: =(RC[-1]*1440-RC[-2]*4)/1440 -> #NUM! | Z162: =(RC[-2]*1440+RC[-3]*4)/1440 -> #NUM! | AA162: =8*RC[-4] -> #NUM! | AB162: =MOD(RC[-23]*1440+RC[-6]+4*R3C2-60*R4C2,1440) -> 724.42331895716256 | AC162: =IF(RC[-1]/4<0,RC[-1]/4+180,RC[-1]/4-180) -> 1.1058297392906411 | AD162: =DEGREES(ACOS(SIN(RADIANS(R2C2))*SIN(RADIANS(RC[-10]))+COS(RADIANS(R2C2))*COS(RADIANS(RC[-10]))*COS(RADIANS(RC[-1])))) -> 46.934583070308037 | AE162: =90-RC[-1] -> 43.065416929691963 | AF162: =IF(RC[-1]>85,0,IF(RC[-1]>5,58.1/TAN(RADIANS(RC[-1]))-0.07/POWER(TAN(RADIANS(RC[-1])),3)+0.000086/POWER(TAN(RADIANS(RC[-1])),5),IF(RC[-1]>-0.575,1735+RC[-1]*(-518.2+RC[-1]*(103.4+RC[-1]*(-12.79+RC[-1]*0.711))),-20.772/TAN(RADIANS(RC[-1])))))/3600 -> 1.7243490289094051E-2 | AG162: =RC[-2]+RC[-1] -> 43.08266041998106 | AH162: =IF(RC[-5]>0,MOD(DEGREES(ACOS(((SIN(RADIANS(R2C2))*COS(RADIANS(RC[-4])))-SIN(RADIANS(RC[-14])))/(COS(RADIANS(R2C2))*SIN(RADIANS(RC[-4])))))+180,360),MOD(540-DEGREES(ACOS(((SIN(RADIANS(R2C2))*COS(RADIANS(RC[-4])))-SIN(RADIANS(RC[-14])))/(COS(RADIANS(R2C2))*SIN(RADIANS(RC[-4]))))),360)) -> 181.39264349752824
D163: =R[-1]C+1 -> 2017-06-11T00:00:00.000 | E163: =R5C2 -> 1899-12-31T14:00:00.000 | F163: =RC[-2]+2415018.5+RC[-1]-R4C2/24 -> 2457916.375 | G163: =(RC[-1]-2451545)/36525 -> 0.17443874058863792 | I163: =MOD(280.46646+RC[-2]*(36000.76983 + RC[-2]*0.0003032),360) -> 80.395418592665919 | J163: =357.52911+RC[-3]*(35999.05029 - 0.0001537*RC[-3]) -> 6637.1581002977227 | K163: =0.016708634-RC[-4]*(0.000042037+0.0000001267*RC[-4]) -> 1.6701297263323513E-2 | L163: =SIN(RADIANS(RC[-2]))*(1.914602-RC[-5]*(0.004817+0.000014*RC[-5]))+SIN(RADIANS(2*RC[-2]))*(0.019993-0.000101*RC[-5])+SIN(RADIANS(3*RC[-2]))*0.000289 -> 0.72887893991550912 | M163: =RC[-4]+RC[-1] -> 81.124297532581423 | N163: =RC[-4]+RC[-2] -> 6637.8869792376381 | O163: =(1.000001018*(1-RC[-4]*RC[-4]))/(1+RC[-4]*COS(RADIANS(RC[-1]))) -> 1.0154336885335198 | P163: =RC[-3]-0.00569-0.00478*SIN(RADIANS(125.04-1934.136*RC[-9])) -> 81.116049926934323 | Q163: =23+(26+((21.448-RC[-10]*(46.815+RC[-10]*(0.00059-RC[-10]*0.001813))))/60)/60 -> 23.437022678341574 | R163: =RC[-1]+0.00256*COS(RADIANS(125.04-1934.136*RC[-11])) -> 23.434859960740258 | S163: =DEGREES(ATAN2(COS(RADIANS(RC[-3])),COS(RADIANS(RC[-1]))*SIN(RADIANS(RC[-3])))) -> 80.331826482416545 | T163: =DEGREES(ASIN(SIN(RADIANS(RC[-2]))*SIN(RADIANS(RC[-4])))) -> 23.13724631378868 | U163: =TAN(RADIANS(RC[-3]/2))*TAN(RADIANS(RC[-3]/2)) -> 4.3017796983805277E-2 | V163: =4*DEGREES(RC[-1]*SIN(2*RADIANS(RC[-13]))-2*RC[-11]*SIN(RADIANS(RC[-12]))+4*RC[-11]*RC[-1]*SIN(RADIANS(RC[-12]))*COS(2*RADIANS(RC[-13]))-0.5*RC[-1]*RC[-1]*SIN(4*RADIANS(RC[-13]))-1.25*RC[-11]*RC[-11]*SIN(2*RADIANS(RC[-12]))) -> 0.21956424016205978 | W163: =DEGREES(ACOS(COS(RADIANS(90.833))/(COS(RADIANS(R2C2))*COS(RADIANS(RC[-3])))-TAN(RADIANS(R2C2))*TAN(RADIANS(RC[-3])))) -> #NUM! | X163: =(720-4*R3C2-RC[-2]+R4C2*60)/1440 -> 1899-12-31T13:55:46.826 | Y163: =(RC[-1]*1440-RC[-2]*4)/1440 -> #NUM! | Z163: =(RC[-2]*1440+RC[-3]*4)/1440 -> #NUM! | AA163: =8*RC[-4] -> #NUM! | AB163: =MOD(RC[-23]*1440+RC[-6]+4*R3C2-60*R4C2,1440) -> 724.21956424016207 | AC163: =IF(RC[-1]/4<0,RC[-1]/4+180,RC[-1]/4-180) -> 1.0548910600405179 | AD163: =DEGREES(ACOS(SIN(RADIANS(R2C2))*SIN(RADIANS(RC[-10]))+COS(RADIANS(R2C2))*COS(RADIANS(RC[-10]))*COS(RADIANS(RC[-1])))) -> 46.866938875928774 | AE163: =90-RC[-1] -> 43.133061124071226 | AF163: =IF(RC[-1]>85,0,IF(RC[-1]>5,58.1/TAN(RADIANS(RC[-1]))-0.07/POWER(TAN(RADIANS(RC[-1])),3)+0.000086/POWER(TAN(RADIANS(RC[-1])),5),IF(RC[-1]>-0.575,1735+RC[-1]*(-518.2+RC[-1]*(103.4+RC[-1]*(-12.79+RC[-1]*0.711))),-20.772/TAN(RADIANS(RC[-1])))))/3600 -> 1.720284479528204E-2 | AG163: =RC[-2]+RC[-1] -> 43.150263968866511 | AH163: =IF(RC[-5]>0,MOD(DEGREES(ACOS(((SIN(RADIANS(R2C2))*COS(RADIANS(RC[-4])))-SIN(RADIANS(RC[-14])))/(COS(RADIANS(R2C2))*SIN(RADIANS(RC[-4])))))+180,360),MOD(540-DEGREES(ACOS(((SIN(RADIANS(R2C2))*COS(RADIANS(RC[-4])))-SIN(RADIANS(RC[-14])))/(COS(RADIANS(R2C2))*SIN(RADIANS(RC[-4]))))),360)) -> 181.32929176336339
D164: =R[-1]C+1 -> 2017-06-12T00:00:00.000 | E164: =R5C2 -> 1899-12-31T14:00:00.000 | F164: =RC[-2]+2415018.5+RC[-1]-R4C2/24 -> 2457917.375 | G164: =(RC[-1]-2451545)/36525 -> 0.17446611909650925 | I164: =MOD(280.46646+RC[-2]*(36000.76983 + RC[-2]*0.0003032),360) -> 81.381065955726626 | J164: =357.52911+RC[-3]*(35999.05029 - 0.0001537*RC[-3]) -> 6638.1437005779799 | K164: =0.016708634-RC[-4]*(0.000042037+0.0000001267*RC[-4]) -> 1.6701296111202874E-2 | L164: =SIN(RADIANS(RC[-2]))*(1.914602-RC[-5]*(0.004817+0.000014*RC[-5]))+SIN(RADIANS(2*RC[-2]))*(0.019993-0.000101*RC[-5])+SIN(RADIANS(3*RC[-2]))*0.000289 -> 0.69891431016341687 | M164: =RC[-4]+RC[-1] -> 82.079980265890043 | N164: =RC[-4]+RC[-2] -> 6638.8426148881435 | O164: =(1.000001018*(1-RC[-4]*RC[-4]))/(1+RC[-4]*COS(RADIANS(RC[-1]))) -> 1.0155396255602895 | P164: =RC[-3]-0.00569-0.00478*SIN(RADIANS(125.04-1934.136*RC[-9])) -> 82.071728929161679 | Q164: =23+(26+((21.448-RC[-10]*(46.815+RC[-10]*(0.00059-RC[-10]*0.001813))))/60)/60 -> 23.437022322306589 | R164: =RC[-1]+0.00256*COS(RADIANS(125.04-1934.136*RC[-11])) -> 23.434860871588238 | S164: =DEGREES(ATAN2(COS(RADIANS(RC[-3])),COS(RADIANS(RC[-1]))*SIN(RADIANS(RC[-3])))) -> 81.369253933665433 | T164: =DEGREES(ASIN(SIN(RADIANS(RC[-2]))*SIN(RADIANS(RC[-4])))) -> 23.197683479357565 | U164: =TAN(RADIANS(RC[-3]/2))*TAN(RADIANS(RC[-3]/2)) -> 4.3017800422859936E-2 | V164: =4*DEGREES(RC[-1]*SIN(2*RADIANS(RC[-13]))-2*RC[-11]*SIN(RADIANS(RC[-12]))+4*RC[-11]*RC[-1]*SIN(RADIANS(RC[-12]))*COS(2*RADIANS(RC[-13]))-0.5*RC[-1]*RC[-1]*SIN(4*RADIANS(RC[-13]))-1.25*RC[-11]*RC[-11]*SIN(2*RADIANS(RC[-12]))) -> 1.2751521782525857E-2 | W164: =DEGREES(ACOS(COS(RADIANS(90.833))/(COS(RADIANS(R2C2))*COS(RADIANS(RC[-3])))-TAN(RADIANS(R2C2))*TAN(RADIANS(RC[-3])))) -> #NUM! | X164: =(720-4*R3C2-RC[-2]+R4C2*60)/1440 -> 1899-12-31T13:55:59.235 | Y164: =(RC[-1]*1440-RC[-2]*4)/1440 -> #NUM! | Z164: =(RC[-2]*1440+RC[-3]*4)/1440 -> #NUM! | AA164: =8*RC[-4] -> #NUM! | AB164: =MOD(RC[-23]*1440+RC[-6]+4*R3C2-60*R4C2,1440) -> 724.01275152178255 | AC164: =IF(RC[-1]/4<0,RC[-1]/4+180,RC[-1]/4-180) -> 1.0031878804456369 | AD164: =DEGREES(ACOS(SIN(RADIANS(R2C2))*SIN(RADIANS(RC[-10]))+COS(RADIANS(R2C2))*COS(RADIANS(RC[-10]))*COS(RADIANS(RC[-1])))) -> 46.806103567704923 | AE164: =90-RC[-1] -> 43.193896432295077 | AF164: =IF(RC[-1]>85,0,IF(RC[-1]>5,58.1/TAN(RADIANS(RC[-1]))-0.07/POWER(TAN(RADIANS(RC[-1])),3)+0.000086/POWER(TAN(RADIANS(RC[-1])),5),IF(RC[-1]>-0.575,1735+RC[-1]*(-518.2+RC[-1]*(103.4+RC[-1]*(-12.79+RC[-1]*0.711))),-20.772/TAN(RADIANS(RC[-1])))))/3600 -> 1.7166377291762583E-2 | AG164: =RC[-2]+RC[-1] -> 43.211062809586842 | AH164: =IF(RC[-5]>0,MOD(DEGREES(ACOS(((SIN(RADIANS(R2C2))*COS(RADIANS(RC[-4])))-SIN(RADIANS(RC[-14])))/(COS(RADIANS(R2C2))*SIN(RADIANS(RC[-4])))))+180,360),MOD(540-DEGREES(ACOS(((SIN(RADIANS(R2C2))*COS(RADIANS(RC[-4])))-SIN(RADIANS(RC[-14])))/(COS(RADIANS(R2C2))*SIN(RADIANS(RC[-4]))))),360)) -> 181.26482392544463
D165: =R[-1]C+1 -> 2017-06-13T00:00:00.000 | E165: =R5C2 -> 1899-12-31T14:00:00.000 | F165: =RC[-2]+2415018.5+RC[-1]-R4C2/24 -> 2457918.375 | G165: =(RC[-1]-2451545)/36525 -> 0.17449349760438057 | I165: =MOD(280.46646+RC[-2]*(36000.76983 + RC[-2]*0.0003032),360) -> 82.366713318788243 | J165: =357.52911+RC[-3]*(35999.05029 - 0.0001537*RC[-3]) -> 6639.1293008582361 | K165: =0.016708634-RC[-4]*(0.000042037+0.0000001267*RC[-4]) -> 1.6701294959082048E-2 | L165: =SIN(RADIANS(RC[-2]))*(1.914602-RC[-5]*(0.004817+0.000014*RC[-5]))+SIN(RADIANS(2*RC[-2]))*(0.019993-0.000101*RC[-5])+SIN(RADIANS(3*RC[-2]))*0.000289 -> 0.66875450514168899 | M165: =RC[-4]+RC[-1] -> 83.035467823929935 | N165: =RC[-4]+RC[-2] -> 6639.7980553633779 | O165: =(1.000001018*(1-RC[-4]*RC[-4]))/(1+RC[-4]*COS(RADIANS(RC[-1]))) -> 1.0156410937170117 | P165: =RC[-3]-0.00569-0.00478*SIN(RADIANS(125.04-1934.136*RC[-9])) -> 83.027212758308139 | Q165: =23+(26+((21.448-RC[-10]*(46.815+RC[-10]*(0.00059-RC[-10]*0.001813))))/60)/60 -> 23.437021966271601 | R165: =RC[-1]+0.00256*COS(RADIANS(125.04-1934.136*RC[-11])) -> 23.434861784282479 | S165: =DEGREES(ATAN2(COS(RADIANS(RC[-3])),COS(RADIANS(RC[-1]))*SIN(RADIANS(RC[-3])))) -> 82.407354700485214 | T165: =DEGREES(ASIN(SIN(RADIANS(RC[-2]))*SIN(RADIANS(RC[-4])))) -> 23.251303630323235 | U165: =TAN(RADIANS(RC[-3]/2))*TAN(RADIANS(RC[-3]/2)) -> 4.301780386888561E-2 | V165: =4*DEGREES(RC[-1]*SIN(2*RADIANS(RC[-13]))-2*RC[-11]*SIN(RADIANS(RC[-12]))+4*RC[-11]*RC[-1]*SIN(RADIANS(RC[-12]))*COS(2*RADIANS(RC[-13]))-0.5*RC[-1]*RC[-1]*SIN(4*RADIANS(RC[-13]))-1.25*RC[-11]*RC[-11]*SIN(2*RADIANS(RC[-12]))) -> -0.19674874430350042 | W165: =DEGREES(ACOS(COS(RADIANS(90.833))/(COS(RADIANS(R2C2))*COS(RADIANS(RC[-3])))-TAN(RADIANS(R2C2))*TAN(RADIANS(RC[-3])))) -> #NUM! | X165: =(720-4*R3C2-RC[-2]+R4C2*60)/1440 -> 1899-12-31T13:56:11.805 | Y165: =(RC[-1]*1440-RC[-2]*4)/1440 -> #NUM! | Z165: =(RC[-2]*1440+RC[-3]*4)/1440 -> #NUM! | AA165: =8*RC[-4] -> #NUM! | AB165: =MOD(RC[-23]*1440+RC[-6]+4*R3C2-60*R4C2,1440) -> 723.80325125569652 | AC165: =IF(RC[-1]/4<0,RC[-1]/4+180,RC[-1]/4-180) -> 0.95081281392413075 | AD165: =DEGREES(ACOS(SIN(RADIANS(R2C2))*SIN(RADIANS(RC[-10]))+COS(RADIANS(R2C2))*COS(RADIANS(RC[-10]))*COS(RADIANS(RC[-1])))) -> 46.75209995201282 | AE165: =90-RC[-1] -> 43.24790004798718 | AF165: =IF(RC[-1]>85,0,IF(RC[-1]>5,58.1/TAN(RADIANS(RC[-1]))-0.07/POWER(TAN(RADIANS(RC[-1])),3)+0.000086/POWER(TAN(RADIANS(RC[-1])),5),IF(RC[-1]>-0.575,1735+RC[-1]*(-518.2+RC[-1]*(103.4+RC[-1]*(-12.79+RC[-1]*0.711))),-20.772/TAN(RADIANS(RC[-1])))))/3600 -> 1.7134073532342795E-2 | AG165: =RC[-2]+RC[-1] -> 43.26503412151952 | AH165: =IF(RC[-5]>0,MOD(DEGREES(ACOS(((SIN(RADIANS(R2C2))*COS(RADIANS(RC[-4])))-SIN(RADIANS(RC[-14])))/(COS(RADIANS(R2C2))*SIN(RADIANS(RC[-4])))))+180,360),MOD(540-DEGREES(ACOS(((SIN(RADIANS(R2C2))*COS(RADIANS(RC[-4])))-SIN(RADIANS(RC[-14])))/(COS(RADIANS(R2C2))*SIN(RADIANS(RC[-4]))))),360)) -> 181.19936617108499
D166: =R[-1]C+1 -> 2017-06-14T00:00:00.000 | E166: =R5C2 -> 1899-12-31T14:00:00.000 | F166: =RC[-2]+2415018.5+RC[-1]-R4C2/24 -> 2457919.375 | G166: =(RC[-1]-2451545)/36525 -> 0.17452087611225189 | I166: =MOD(280.46646+RC[-2]*(36000.76983 + RC[-2]*0.0003032),360) -> 83.352360681849859 | J166: =357.52911+RC[-3]*(35999.05029 - 0.0001537*RC[-3]) -> 6640.1149011384923 | K166: =0.016708634-RC[-4]*(0.000042037+0.0000001267*RC[-4]) -> 1.6701293806961032E-2 | L166: =SIN(RADIANS(RC[-2]))*(1.914602-RC[-5]*(0.004817+0.000014*RC[-5]))+SIN(RADIANS(2*RC[-2]))*(0.019993-0.000101*RC[-5])+SIN(RADIANS(3*RC[-2]))*0.000289 -> 0.63840801651643075 | M166: =RC[-4]+RC[-1] -> 83.990768698366296 | N166: =RC[-4]+RC[-2] -> 6640.7533091550085 | O166: =(1.000001018*(1-RC[-4]*RC[-4]))/(1+RC[-4]*COS(RADIANS(RC[-1]))) -> 1.0157380656849582 | P166: =RC[-3]-0.00569-0.00478*SIN(RADIANS(125.04-1934.136*RC[-9])) -> 83.982509906042097 | Q166: =23+(26+((21.448-RC[-10]*(46.815+RC[-10]*(0.00059-RC[-10]*0.001813))))/60)/60 -> 23.437021610236616 | R166: =RC[-1]+0.00256*COS(RADIANS(125.04-1934.136*RC[-11])) -> 23.434862698821899 | S166: =DEGREES(ATAN2(COS(RADIANS(RC[-3])),COS(RADIANS(RC[-1]))*SIN(RADIANS(RC[-3])))) -> 83.446034361825426 | T166: =DEGREES(ASIN(SIN(RADIANS(RC[-2]))*SIN(RADIANS(RC[-4])))) -> 23.298088254836884 | U166: =TAN(RADIANS(RC[-3]/2))*TAN(RADIANS(RC[-3]/2)) -> 4.3017807321878182E-2 | V166: =4*DEGREES(RC[-1]*SIN(2*RADIANS(RC[-13]))-2*RC[-11]*SIN(RADIANS(RC[-12]))+4*RC[-11]*RC[-1]*SIN(RADIANS(RC[-12]))*COS(2*RADIANS(RC[-13]))-0.5*RC[-1]*RC[-1]*SIN(4*RADIANS(RC[-13]))-1.25*RC[-11]*RC[-11]*SIN(2*RADIANS(RC[-12]))) -> -0.40856096900659633 | W166: =DEGREES(ACOS(COS(RADIANS(90.833))/(COS(RADIANS(R2C2))*COS(RADIANS(RC[-3])))-TAN(RADIANS(R2C2))*TAN(RADIANS(RC[-3])))) -> #NUM! | X166: =(720-4*R3C2-RC[-2]+R4C2*60)/1440 -> 1899-12-31T13:56:24.514 | Y166: =(RC[-1]*1440-RC[-2]*4)/1440 -> #NUM! | Z166: =(RC[-2]*1440+RC[-3]*4)/1440 -> #NUM! | AA166: =8*RC[-4] -> #NUM! | AB166: =MOD(RC[-23]*1440+RC[-6]+4*R3C2-60*R4C2,1440) -> 723.59143903099346 | AC166: =IF(RC[-1]/4<0,RC[-1]/4+180,RC[-1]/4-180) -> 0.89785975774836402 | AD166: =DEGREES(ACOS(SIN(RADIANS(R2C2))*SIN(RADIANS(RC[-10]))+COS(RADIANS(R2C2))*COS(RADIANS(RC[-10]))*COS(RADIANS(RC[-1])))) -> 46.704948060951423 | AE166: =90-RC[-1] -> 43.295051939048577 | AF166: =IF(RC[-1]>85,0,IF(RC[-1]>5,58.1/TAN(RADIANS(RC[-1]))-0.07/POWER(TAN(RADIANS(RC[-1])),3)+0.000086/POWER(TAN(RADIANS(RC[-1])),5),IF(RC[-1]>-0.575,1735+RC[-1]*(-518.2+RC[-1]*(103.4+RC[-1]*(-12.79+RC[-1]*0.711))),-20.772/TAN(RADIANS(RC[-1])))))/3600 -> 1.7105920809734904E-2 | AG166: =RC[-2]+RC[-1] -> 43.31215785985831 | AH166: =IF(RC[-5]>0,MOD(DEGREES(ACOS(((SIN(RADIANS(R2C2))*COS(RADIANS(RC[-4])))-SIN(RADIANS(RC[-14])))/(COS(RADIANS(R2C2))*SIN(RADIANS(RC[-4])))))+180,360),MOD(540-DEGREES(ACOS(((SIN(RADIANS(R2C2))*COS(RADIANS(RC[-4])))-SIN(RADIANS(RC[-14])))/(COS(RADIANS(R2C2))*SIN(RADIANS(RC[-4]))))),360)) -> 181.13304706745134
D167: =R[-1]C+1 -> 2017-06-15T00:00:00.000 | E167: =R5C2 -> 1899-12-31T14:00:00.000 | F167: =RC[-2]+2415018.5+RC[-1]-R4C2/24 -> 2457920.375 | G167: =(RC[-1]-2451545)/36525 -> 0.17454825462012322 | I167: =MOD(280.46646+RC[-2]*(36000.76983 + RC[-2]*0.0003032),360) -> 84.338008044911476 | J167: =357.52911+RC[-3]*(35999.05029 - 0.0001537*RC[-3]) -> 6641.1005014187494 | K167: =0.016708634-RC[-4]*(0.000042037+0.0000001267*RC[-4]) -> 1.6701292654839828E-2 | L167: =SIN(RADIANS(RC[-2]))*(1.914602-RC[-5]*(0.004817+0.000014*RC[-5]))+SIN(RADIANS(2*RC[-2]))*(0.019993-0.000101*RC[-5])+SIN(RADIANS(3*RC[-2]))*0.000289 -> 0.6078833788389022 | M167: =RC[-4]+RC[-1] -> 84.945891423750382 | N167: =RC[-4]+RC[-2] -> 6641.7083847975882 | O167: =(1.000001018*(1-RC[-4]*RC[-4]))/(1+RC[-4]*COS(RADIANS(RC[-1]))) -> 1.0158305153715341 | P167: =RC[-3]-0.00569-0.00478*SIN(RADIANS(125.04-1934.136*RC[-9])) -> 84.937628906917979 | Q167: =23+(26+((21.448-RC[-10]*(46.815+RC[-10]*(0.00059-RC[-10]*0.001813))))/60)/60 -> 23.437021254201628 | R167: =RC[-1]+0.00256*COS(RADIANS(125.04-1934.136*RC[-11])) -> 23.434863615205412 | S167: =DEGREES(ATAN2(COS(RADIANS(RC[-3])),COS(RADIANS(RC[-1]))*SIN(RADIANS(RC[-3])))) -> 84.485197352143828 | T167: =DEGREES(ASIN(SIN(RADIANS(RC[-2]))*SIN(RADIANS(RC[-4])))) -> 23.338021511347769 | U167: =TAN(RADIANS(RC[-3]/2))*TAN(RADIANS(RC[-3]/2)) -> 4.3017810781833601E-2 | V167: =4*DEGREES(RC[-1]*SIN(2*RADIANS(RC[-13]))-2*RC[-11]*SIN(RADIANS(RC[-12]))+4*RC[-11]*RC[-1]*SIN(RADIANS(RC[-12]))*COS(2*RADIANS(RC[-13]))-0.5*RC[-1]*RC[-1]*SIN(4*RADIANS(RC[-13]))-1.25*RC[-11]*RC[-11]*SIN(2*RADIANS(RC[-12]))) -> -0.62230505679242121 | W167: =DEGREES(ACOS(COS(RADIANS(90.833))/(COS(RADIANS(R2C2))*COS(RADIANS(RC[-3])))-TAN(RADIANS(R2C2))*TAN(RADIANS(RC[-3])))) -> #NUM! | X167: =(720-4*R3C2-RC[-2]+R4C2*60)/1440 -> 1899-12-31T13:56:37.338 | Y167: =(RC[-1]*1440-RC[-2]*4)/1440 -> #NUM! | Z167: =(RC[-2]*1440+RC[-3]*4)/1440 -> #NUM! | AA167: =8*RC[-4] -> #NUM! | AB167: =MOD(RC[-23]*1440+RC[-6]+4*R3C2-60*R4C2,1440) -> 723.37769494320753 | AC167: =IF(RC[-1]/4<0,RC[-1]/4+180,RC[-1]/4-180) -> 0.84442373580188246 | AD167: =DEGREES(ACOS(SIN(RADIANS(R2C2))*SIN(RADIANS(RC[-10]))+COS(RADIANS(R2C2))*COS(RADIANS(RC[-10]))*COS(RADIANS(RC[-1])))) -> 46.66466511951085 | AE167: =90-RC[-1] -> 43.33533488048915 | AF167: =IF(RC[-1]>85,0,IF(RC[-1]>5,58.1/TAN(RADIANS(RC[-1]))-0.07/POWER(TAN(RADIANS(RC[-1])),3)+0.000086/POWER(TAN(RADIANS(RC[-1])),5),IF(RC[-1]>-0.575,1735+RC[-1]*(-518.2+RC[-1]*(103.4+RC[-1]*(-12.79+RC[-1]*0.711))),-20.772/TAN(RADIANS(RC[-1])))))/3600 -> 1.7081907922301059E-2 | AG167: =RC[-2]+RC[-1] -> 43.352416788411453 | AH167: =IF(RC[-5]>0,MOD(DEGREES(ACOS(((SIN(RADIANS(R2C2))*COS(RADIANS(RC[-4])))-SIN(RADIANS(RC[-14])))/(COS(RADIANS(R2C2))*SIN(RADIANS(RC[-4])))))+180,360),MOD(540-DEGREES(ACOS(((SIN(RADIANS(R2C2))*COS(RADIANS(RC[-4])))-SIN(RADIANS(RC[-14])))/(COS(RADIANS(R2C2))*SIN(RADIANS(RC[-4]))))),360)) -> 181.0659972811838
D168: =R[-1]C+1 -> 2017-06-16T00:00:00.000 | E168: =R5C2 -> 1899-12-31T14:00:00.000 | F168: =RC[-2]+2415018.5+RC[-1]-R4C2/24 -> 2457921.375 | G168: =(RC[-1]-2451545)/36525 -> 0.17457563312799451 | I168: =MOD(280.46646+RC[-2]*(36000.76983 + RC[-2]*0.0003032),360) -> 85.323655407973092 | J168: =357.52911+RC[-3]*(35999.05029 - 0.0001537*RC[-3]) -> 6642.0861016990029 | K168: =0.016708634-RC[-4]*(0.000042037+0.0000001267*RC[-4]) -> 1.6701291502718429E-2 | L168: =SIN(RADIANS(RC[-2]))*(1.914602-RC[-5]*(0.004817+0.000014*RC[-5]))+SIN(RADIANS(2*RC[-2]))*(0.019993-0.000101*RC[-5])+SIN(RADIANS(3*RC[-2]))*0.000289 -> 0.57718916752177196 | M168: =RC[-4]+RC[-1] -> 85.900844575494858 | N168: =RC[-4]+RC[-2] -> 6642.6632908665251 | O168: =(1.000001018*(1-RC[-4]*RC[-4]))/(1+RC[-4]*COS(RADIANS(RC[-1]))) -> 1.0159184179151686 | P168: =RC[-3]-0.00569-0.00478*SIN(RADIANS(125.04-1934.136*RC[-9])) -> 85.892578336351633 | Q168: =23+(26+((21.448-RC[-10]*(46.815+RC[-10]*(0.00059-RC[-10]*0.001813))))/60)/60 -> 23.437020898166644 | R168: =RC[-1]+0.00256*COS(RADIANS(125.04-1934.136*RC[-11])) -> 23.434864533431934 | S168: =DEGREES(ATAN2(COS(RADIANS(RC[-3])),COS(RADIANS(RC[-1]))*SIN(RADIANS(RC[-3])))) -> 85.524747127372109 | T168: =DEGREES(ASIN(SIN(RADIANS(RC[-2]))*SIN(RADIANS(RC[-4])))) -> 23.371090248685395 | U168: =TAN(RADIANS(RC[-3]/2))*TAN(RADIANS(RC[-3]/2)) -> 4.3017814248747753E-2 | V168: =4*DEGREES(RC[-1]*SIN(2*RADIANS(RC[-13]))-2*RC[-11]*SIN(RADIANS(RC[-12]))+4*RC[-11]*RC[-1]*SIN(RADIANS(RC[-12]))*COS(2*RADIANS(RC[-13]))-0.5*RC[-1]*RC[-1]*SIN(4*RADIANS(RC[-13]))-1.25*RC[-11]*RC[-11]*SIN(2*RADIANS(RC[-12]))) -> -0.83759704673174373 | W168: =DEGREES(ACOS(COS(RADIANS(90.833))/(COS(RADIANS(R2C2))*COS(RADIANS(RC[-3])))-TAN(RADIANS(R2C2))*TAN(RADIANS(RC[-3])))) -> #NUM! | X168: =(720-4*R3C2-RC[-2]+R4C2*60)/1440 -> 1899-12-31T13:56:50.256 | Y168: =(RC[-1]*1440-RC[-2]*4)/1440 -> #NUM! | Z168: =(RC[-2]*1440+RC[-3]*4)/1440 -> #NUM! | AA168: =8*RC[-4] -> #NUM! | AB168: =MOD(RC[-23]*1440+RC[-6]+4*R3C2-60*R4C2,1440) -> 723.16240295326827 | AC168: =IF(RC[-1]/4<0,RC[-1]/4+180,RC[-1]/4-180) -> 0.79060073831706745 | AD168: =DEGREES(ACOS(SIN(RADIANS(R2C2))*SIN(RADIANS(RC[-10]))+COS(RADIANS(R2C2))*COS(RADIANS(RC[-10]))*COS(RADIANS(RC[-1])))) -> 46.631265517230247 | AE168: =90-RC[-1] -> 43.368734482769753 | AF168: =IF(RC[-1]>85,0,IF(RC[-1]>5,58.1/TAN(RADIANS(RC[-1]))-0.07/POWER(TAN(RADIANS(RC[-1])),3)+0.000086/POWER(TAN(RADIANS(RC[-1])),5),IF(RC[-1]>-0.575,1735+RC[-1]*(-518.2+RC[-1]*(103.4+RC[-1]*(-12.79+RC[-1]*0.711))),-20.772/TAN(RADIANS(RC[-1])))))/3600 -> 1.7062025144999673E-2 | AG168: =RC[-2]+RC[-1] -> 43.385796507914755 | AH168: =IF(RC[-5]>0,MOD(DEGREES(ACOS(((SIN(RADIANS(R2C2))*COS(RADIANS(RC[-4])))-SIN(RADIANS(RC[-14])))/(COS(RADIANS(R2C2))*SIN(RADIANS(RC[-4])))))+180,360),MOD(540-DEGREES(ACOS(((SIN(RADIANS(R2C2))*COS(RADIANS(RC[-4])))-SIN(RADIANS(RC[-14])))/(COS(RADIANS(R2C2))*SIN(RADIANS(RC[-4]))))),360)) -> 180.99834928977941
D169: =R[-1]C+1 -> 2017-06-17T00:00:00.000 | E169: =R5C2 -> 1899-12-31T14:00:00.000 | F169: =RC[-2]+2415018.5+RC[-1]-R4C2/24 -> 2457922.375 | G169: =(RC[-1]-2451545)/36525 -> 0.17460301163586583 | I169: =MOD(280.46646+RC[-2]*(36000.76983 + RC[-2]*0.0003032),360) -> 86.309302771036528 | J169: =357.52911+RC[-3]*(35999.05029 - 0.0001537*RC[-3]) -> 6643.0717019792592 | K169: =0.016708634-RC[-4]*(0.000042037+0.0000001267*RC[-4]) -> 1.6701290350596844E-2 | L169: =SIN(RADIANS(RC[-2]))*(1.914602-RC[-5]*(0.004817+0.000014*RC[-5]))+SIN(RADIANS(2*RC[-2]))*(0.019993-0.000101*RC[-5])+SIN(RADIANS(3*RC[-2]))*0.000289 -> 0.54633399681437289 | M169: =RC[-4]+RC[-1] -> 86.855636767850896 | N169: =RC[-4]+RC[-2] -> 6643.6180359760738 | O169: =(1.000001018*(1-RC[-4]*RC[-4]))/(1+RC[-4]*COS(RADIANS(RC[-1]))) -> 1.0160017496899598 | P169: =RC[-3]-0.00569-0.00478*SIN(RADIANS(125.04-1934.136*RC[-9])) -> 86.847366808597414 | Q169: =23+(26+((21.448-RC[-10]*(46.815+RC[-10]*(0.00059-RC[-10]*0.001813))))/60)/60 -> 23.437020542131659 | R169: =RC[-1]+0.00256*COS(RADIANS(125.04-1934.136*RC[-11])) -> 23.434865453500379 | S169: =DEGREES(ATAN2(COS(RADIANS(RC[-3])),COS(RADIANS(RC[-1]))*SIN(RADIANS(RC[-3])))) -> 86.564586333854763 | T169: =DEGREES(ASIN(SIN(RADIANS(RC[-2]))*SIN(RADIANS(RC[-4])))) -> 23.397284022622706 | U169: =TAN(RADIANS(RC[-3]/2))*TAN(RADIANS(RC[-3]/2)) -> 4.3017817722616522E-2 | V169: =4*DEGREES(RC[-1]*SIN(2*RADIANS(RC[-13]))-2*RC[-11]*SIN(RADIANS(RC[-12]))+4*RC[-11]*RC[-1]*SIN(RADIANS(RC[-12]))*COS(2*RADIANS(RC[-13]))-0.5*RC[-1]*RC[-1]*SIN(4*RADIANS(RC[-13]))-1.25*RC[-11]*RC[-11]*SIN(2*RADIANS(RC[-12]))) -> -1.0540497639870416 | W169: =DEGREES(ACOS(COS(RADIANS(90.833))/(COS(RADIANS(R2C2))*COS(RADIANS(RC[-3])))-TAN(RADIANS(R2C2))*TAN(RADIANS(RC[-3])))) -> #NUM! | X169: =(720-4*R3C2-RC[-2]+R4C2*60)/1440 -> 1899-12-31T13:57:03.243 | Y169: =(RC[-1]*1440-RC[-2]*4)/1440 -> #NUM! | Z169: =(RC[-2]*1440+RC[-3]*4)/1440 -> #NUM! | AA169: =8*RC[-4] -> #NUM! | AB169: =MOD(RC[-23]*1440+RC[-6]+4*R3C2-60*R4C2,1440) -> 722.945950236013 | AC169: =IF(RC[-1]/4<0,RC[-1]/4+180,RC[-1]/4-180) -> 0.73648755900325114 | AD169: =DEGREES(ACOS(SIN(RADIANS(R2C2))*SIN(RADIANS(RC[-10]))+COS(RADIANS(R2C2))*COS(RADIANS(RC[-10]))*COS(RADIANS(RC[-1])))) -> 46.604760784495831 | AE169: =90-RC[-1] -> 43.395239215504169 | AF169: =IF(RC[-1]>85,0,IF(RC[-1]>5,58.1/TAN(RADIANS(RC[-1]))-0.07/POWER(TAN(RADIANS(RC[-1])),3)+0.000086/POWER(TAN(RADIANS(RC[-1])),5),IF(RC[-1]>-0.575,1735+RC[-1]*(-518.2+RC[-1]*(103.4+RC[-1]*(-12.79+RC[-1]*0.711))),-20.772/TAN(RADIANS(RC[-1])))))/3600 -> 1.7046264204518338E-2 | AG169: =RC[-2]+RC[-1] -> 43.412285479708686 | AH169: =IF(RC[-5]>0,MOD(DEGREES(ACOS(((SIN(RADIANS(R2C2))*COS(RADIANS(RC[-4])))-SIN(RADIANS(RC[-14])))/(COS(RADIANS(R2C2))*SIN(RADIANS(RC[-4])))))+180,360),MOD(540-DEGREES(ACOS(((SIN(RADIANS(R2C2))*COS(RADIANS(RC[-4])))-SIN(RADIANS(RC[-14])))/(COS(RADIANS(R2C2))*SIN(RADIANS(RC[-4]))))),360)) -> 180.9302370856941
D170: =R[-1]C+1 -> 2017-06-18T00:00:00.000 | E170: =R5C2 -> 1899-12-31T14:00:00.000 | F170: =RC[-2]+2415018.5+RC[-1]-R4C2/24 -> 2457923.375 | G170: =(RC[-1]-2451545)/36525 -> 0.17463039014373716 | I170: =MOD(280.46646+RC[-2]*(36000.76983 + RC[-2]*0.0003032),360) -> 87.294950134099963 | J170: =357.52911+RC[-3]*(35999.05029 - 0.0001537*RC[-3]) -> 6644.0573022595145 | K170: =0.016708634-RC[-4]*(0.000042037+0.0000001267*RC[-4]) -> 1.6701289198475067E-2 | L170: =SIN(RADIANS(RC[-2]))*(1.914602-RC[-5]*(0.004817+0.000014*RC[-5]))+SIN(RADIANS(2*RC[-2]))*(0.019993-0.000101*RC[-5])+SIN(RADIANS(3*RC[-2]))*0.000289 -> 0.51532651777867378 | M170: =RC[-4]+RC[-1] -> 87.810276651878638 | N170: =RC[-4]+RC[-2] -> 6644.5726287772932 | O170: =(1.000001018*(1-RC[-4]*RC[-4]))/(1+RC[-4]*COS(RADIANS(RC[-1]))) -> 1.0160804883100747 | P170: =RC[-3]-0.00569-0.00478*SIN(RADIANS(125.04-1934.136*RC[-9])) -> 87.802002974718647 | Q170: =23+(26+((21.448-RC[-10]*(46.815+RC[-10]*(0.00059-RC[-10]*0.001813))))/60)/60 -> 23.437020186096674 | R170: =RC[-1]+0.00256*COS(RADIANS(125.04-1934.136*RC[-11])) -> 23.434866375409648 | S170: =DEGREES(ATAN2(COS(RADIANS(RC[-3])),COS(RADIANS(RC[-1]))*SIN(RADIANS(RC[-3])))) -> 87.604616979743611 | T170: =DEGREES(ASIN(SIN(RADIANS(RC[-2]))*SIN(RADIANS(RC[-4])))) -> 23.416595108849734 | U170: =TAN(RADIANS(RC[-3]/2))*TAN(RADIANS(RC[-3]/2)) -> 4.301782120343578E-2 | V170: =4*DEGREES(RC[-1]*SIN(2*RADIANS(RC[-13]))-2*RC[-11]*SIN(RADIANS(RC[-12]))+4*RC[-11]*RC[-1]*SIN(RADIANS(RC[-12]))*COS(2*RADIANS(RC[-13]))-0.5*RC[-1]*RC[-1]*SIN(4*RADIANS(RC[-13]))-1.25*RC[-11]*RC[-11]*SIN(2*RADIANS(RC[-12]))) -> -1.2712734800560188 | W170: =DEGREES(ACOS(COS(RADIANS(90.833))/(COS(RADIANS(R2C2))*COS(RADIANS(RC[-3])))-TAN(RADIANS(R2C2))*TAN(RADIANS(RC[-3])))) -> #NUM! | X170: =(720-4*R3C2-RC[-2]+R4C2*60)/1440 -> 1899-12-31T13:57:16.276 | Y170: =(RC[-1]*1440-RC[-2]*4)/1440 -> #NUM! | Z170: =(RC[-2]*1440+RC[-3]*4)/1440 -> #NUM! | AA170: =8*RC[-4] -> #NUM! | AB170: =MOD(RC[-23]*1440+RC[-6]+4*R3C2-60*R4C2,1440) -> 722.72872651994396 | AC170: =IF(RC[-1]/4<0,RC[-1]/4+180,RC[-1]/4-180) -> 0.68218162998599041 | AD170: =DEGREES(ACOS(SIN(RADIANS(R2C2))*SIN(RADIANS(RC[-10]))+COS(RADIANS(R2C2))*COS(RADIANS(RC[-10]))*COS(RADIANS(RC[-1])))) -> 46.585159573609225 | AE170: =90-RC[-1] -> 43.414840426390775 | AF170: =IF(RC[-1]>85,0,IF(RC[-1]>5,58.1/TAN(RADIANS(RC[-1]))-0.07/POWER(TAN(RADIANS(RC[-1])),3)+0.000086/POWER(TAN(RADIANS(RC[-1])),5),IF(RC[-1]>-0.575,1735+RC[-1]*(-518.2+RC[-1]*(103.4+RC[-1]*(-12.79+RC[-1]*0.711))),-20.772/TAN(RADIANS(RC[-1])))))/3600 -> 1.7034618258581536E-2 | AG170: =RC[-2]+RC[-1] -> 43.43187504464936 | AH170: =IF(RC[-5]>0,MOD(DEGREES(ACOS(((SIN(RADIANS(R2C2))*COS(RADIANS(RC[-4])))-SIN(RADIANS(RC[-14])))/(COS(RADIANS(R2C2))*SIN(RADIANS(RC[-4])))))+180,360),MOD(540-DEGREES(ACOS(((SIN(RADIANS(R2C2))*COS(RADIANS(RC[-4])))-SIN(RADIANS(RC[-14])))/(COS(RADIANS(R2C2))*SIN(RADIANS(RC[-4]))))),360)) -> 180.86179587441438
D171: =R[-1]C+1 -> 2017-06-19T00:00:00.000 | E171: =R5C2 -> 1899-12-31T14:00:00.000 | F171: =RC[-2]+2415018.5+RC[-1]-R4C2/24 -> 2457924.375 | G171: =(RC[-1]-2451545)/36525 -> 0.17465776865160848 | I171: =MOD(280.46646+RC[-2]*(36000.76983 + RC[-2]*0.0003032),360) -> 88.280597497164308 | J171: =357.52911+RC[-3]*(35999.05029 - 0.0001537*RC[-3]) -> 6645.0429025397689 | K171: =0.016708634-RC[-4]*(0.000042037+0.0000001267*RC[-4]) -> 1.6701288046353104E-2 | L171: =SIN(RADIANS(RC[-2]))*(1.914602-RC[-5]*(0.004817+0.000014*RC[-5]))+SIN(RADIANS(2*RC[-2]))*(0.019993-0.000101*RC[-5])+SIN(RADIANS(3*RC[-2]))*0.000289 -> 0.48417541626404786 | M171: =RC[-4]+RC[-1] -> 88.764772913428359 | N171: =RC[-4]+RC[-2] -> 6645.5270779560333 | O171: =(1.000001018*(1-RC[-4]*RC[-4]))/(1+RC[-4]*COS(RADIANS(RC[-1]))) -> 1.0161546126339078 | P171: =RC[-3]-0.00569-0.00478*SIN(RADIANS(125.04-1934.136*RC[-9])) -> 88.756495520568791 | Q171: =23+(26+((21.448-RC[-10]*(46.815+RC[-10]*(0.00059-RC[-10]*0.001813))))/60)/60 -> 23.43701983006169 | R171: =RC[-1]+0.00256*COS(RADIANS(125.04-1934.136*RC[-11])) -> 23.434867299158658 | S171: =DEGREES(ATAN2(COS(RADIANS(RC[-3])),COS(RADIANS(RC[-1]))*SIN(RADIANS(RC[-3])))) -> 88.644740608343383 | T171: =DEGREES(ASIN(SIN(RADIANS(RC[-2]))*SIN(RADIANS(RC[-4])))) -> 23.429018512301973 | U171: =TAN(RADIANS(RC[-3]/2))*TAN(RADIANS(RC[-3]/2)) -> 4.3017824691201439E-2 | V171: =4*DEGREES(RC[-1]*SIN(2*RADIANS(RC[-13]))-2*RC[-11]*SIN(RADIANS(RC[-12]))+4*RC[-11]*RC[-1]*SIN(RADIANS(RC[-12]))*COS(2*RADIANS(RC[-13]))-0.5*RC[-1]*RC[-1]*SIN(4*RADIANS(RC[-13]))-1.25*RC[-11]*RC[-11]*SIN(2*RADIANS(RC[-12]))) -> -1.4888765800504107 | W171: =DEGREES(ACOS(COS(RADIANS(90.833))/(COS(RADIANS(R2C2))*COS(RADIANS(RC[-3])))-TAN(RADIANS(R2C2))*TAN(RADIANS(RC[-3])))) -> #NUM! | X171: =(720-4*R3C2-RC[-2]+R4C2*60)/1440 -> 1899-12-31T13:57:29.333 | Y171: =(RC[-1]*1440-RC[-2]*4)/1440 -> #NUM! | Z171: =(RC[-2]*1440+RC[-3]*4)/1440 -> #NUM! | AA171: =8*RC[-4] -> #NUM! | AB171: =MOD(RC[-23]*1440+RC[-6]+4*R3C2-60*R4C2,1440) -> 722.51112341994963 | AC171: =IF(RC[-1]/4<0,RC[-1]/4+180,RC[-1]/4-180) -> 0.62778085498740666 | AD171: =DEGREES(ACOS(SIN(RADIANS(R2C2))*SIN(RADIANS(RC[-10]))+COS(RADIANS(R2C2))*COS(RADIANS(RC[-10]))*COS(RADIANS(RC[-1])))) -> 46.57246764473048 | AE171: =90-RC[-1] -> 43.42753235526952 | AF171: =IF(RC[-1]>85,0,IF(RC[-1]>5,58.1/TAN(RADIANS(RC[-1]))-0.07/POWER(TAN(RADIANS(RC[-1])),3)+0.000086/POWER(TAN(RADIANS(RC[-1])),5),IF(RC[-1]>-0.575,1735+RC[-1]*(-518.2+RC[-1]*(103.4+RC[-1]*(-12.79+RC[-1]*0.711))),-20.772/TAN(RADIANS(RC[-1])))))/3600 -> 1.7027081879421337E-2 | AG171: =RC[-2]+RC[-1] -> 43.444559437148939 | AH171: =IF(RC[-5]>0,MOD(DEGREES(ACOS(((SIN(RADIANS(R2C2))*COS(RADIANS(RC[-4])))-SIN(RADIANS(RC[-14])))/(COS(RADIANS(R2C2))*SIN(RADIANS(RC[-4])))))+180,360),MOD(540-DEGREES(ACOS(((SIN(RADIANS(R2C2))*COS(RADIANS(RC[-4])))-SIN(RADIANS(RC[-14])))/(COS(RADIANS(R2C2))*SIN(RADIANS(RC[-4]))))),360)) -> 180.79316176757888
D172: =R[-1]C+1 -> 2017-06-20T00:00:00.000 | E172: =R5C2 -> 1899-12-31T14:00:00.000 | F172: =RC[-2]+2415018.5+RC[-1]-R4C2/24 -> 2457925.375 | G172: =(RC[-1]-2451545)/36525 -> 0.1746851471594798 | I172: =MOD(280.46646+RC[-2]*(36000.76983 + RC[-2]*0.0003032),360) -> 89.266244860226834 | J172: =357.52911+RC[-3]*(35999.05029 - 0.0001537*RC[-3]) -> 6646.0285028200242 | K172: =0.016708634-RC[-4]*(0.000042037+0.0000001267*RC[-4]) -> 1.6701286894230945E-2 | L172: =SIN(RADIANS(RC[-2]))*(1.914602-RC[-5]*(0.004817+0.000014*RC[-5]))+SIN(RADIANS(2*RC[-2]))*(0.019993-0.000101*RC[-5])+SIN(RADIANS(3*RC[-2]))*0.000289 -> 0.45288941088212786 | M172: =RC[-4]+RC[-1] -> 89.719134271108956 | N172: =RC[-4]+RC[-2] -> 6646.4813922309067 | O172: =(1.000001018*(1-RC[-4]*RC[-4]))/(1+RC[-4]*COS(RADIANS(RC[-1]))) -> 1.0162241027679966 | P172: =RC[-3]-0.00569-0.00478*SIN(RADIANS(125.04-1934.136*RC[-9])) -> 89.710853164759882 | Q172: =23+(26+((21.448-RC[-10]*(46.815+RC[-10]*(0.00059-RC[-10]*0.001813))))/60)/60 -> 23.437019474026705 | R172: =RC[-1]+0.00256*COS(RADIANS(125.04-1934.136*RC[-11])) -> 23.43486822474631 | S172: =DEGREES(ATAN2(COS(RADIANS(RC[-3])),COS(RADIANS(RC[-1]))*SIN(RADIANS(RC[-3])))) -> 89.684858472848063 | T172: =DEGREES(ASIN(SIN(RADIANS(RC[-2]))*SIN(RADIANS(RC[-4])))) -> 23.434551972800683 | U172: =TAN(RADIANS(RC[-3]/2))*TAN(RADIANS(RC[-3]/2)) -> 4.3017828185909344E-2 | V172: =4*DEGREES(RC[-1]*SIN(2*RADIANS(RC[-13]))-2*RC[-11]*SIN(RADIANS(RC[-12]))+4*RC[-11]*RC[-1]*SIN(RADIANS(RC[-12]))*COS(2*RADIANS(RC[-13]))-0.5*RC[-1]*RC[-1]*SIN(4*RADIANS(RC[-13]))-1.25*RC[-11]*RC[-11]*SIN(2*RADIANS(RC[-12]))) -> -1.7064662352571309 | W172: =DEGREES(ACOS(COS(RADIANS(90.833))/(COS(RADIANS(R2C2))*COS(RADIANS(RC[-3])))-TAN(RADIANS(R2C2))*TAN(RADIANS(RC[-3])))) -> #NUM! | X172: =(720-4*R3C2-RC[-2]+R4C2*60)/1440 -> 1899-12-31T13:57:42.388 | Y172: =(RC[-1]*1440-RC[-2]*4)/1440 -> #NUM! | Z172: =(RC[-2]*1440+RC[-3]*4)/1440 -> #NUM! | AA172: =8*RC[-4] -> #NUM! | AB172: =MOD(RC[-23]*1440+RC[-6]+4*R3C2-60*R4C2,1440) -> 722.29353376474285 | AC172: =IF(RC[-1]/4<0,RC[-1]/4+180,RC[-1]/4-180) -> 0.57338344118571172 | AD172: =DEGREES(ACOS(SIN(RADIANS(R2C2))*SIN(RADIANS(RC[-10]))+COS(RADIANS(R2C2))*COS(RADIANS(RC[-10]))*COS(RADIANS(RC[-1])))) -> 46.566687856777051 | AE172: =90-RC[-1] -> 43.433312143222949 | AF172: =IF(RC[-1]>85,0,IF(RC[-1]>5,58.1/TAN(RADIANS(RC[-1]))-0.07/POWER(TAN(RADIANS(RC[-1])),3)+0.000086/POWER(TAN(RADIANS(RC[-1])),5),IF(RC[-1]>-0.575,1735+RC[-1]*(-518.2+RC[-1]*(103.4+RC[-1]*(-12.79+RC[-1]*0.711))),-20.772/TAN(RADIANS(RC[-1])))))/3600 -> 1.7023651041401269E-2 | AG172: =RC[-2]+RC[-1] -> 43.450335794264348 | AH172: =IF(RC[-5]>0,MOD(DEGREES(ACOS(((SIN(RADIANS(R2C2))*COS(RADIANS(RC[-4])))-SIN(RADIANS(RC[-14])))/(COS(RADIANS(R2C2))*SIN(RADIANS(RC[-4])))))+180,360),MOD(540-DEGREES(ACOS(((SIN(RADIANS(R2C2))*COS(RADIANS(RC[-4])))-SIN(RADIANS(RC[-14])))/(COS(RADIANS(R2C2))*SIN(RADIANS(RC[-4]))))),360)) -> 180.72447147238393
D173: =R[-1]C+1 -> 2017-06-21T00:00:00.000 | E173: =R5C2 -> 1899-12-31T14:00:00.000 | F173: =RC[-2]+2415018.5+RC[-1]-R4C2/24 -> 2457926.375 | G173: =(RC[-1]-2451545)/36525 -> 0.17471252566735113 | I173: =MOD(280.46646+RC[-2]*(36000.76983 + RC[-2]*0.0003032),360) -> 90.251892223292089 | J173: =357.52911+RC[-3]*(35999.05029 - 0.0001537*RC[-3]) -> 6647.0141031002786 | K173: =0.016708634-RC[-4]*(0.000042037+0.0000001267*RC[-4]) -> 1.67012857421086E-2 | L173: =SIN(RADIANS(RC[-2]))*(1.914602-RC[-5]*(0.004817+0.000014*RC[-5]))+SIN(RADIANS(2*RC[-2]))*(0.019993-0.000101*RC[-5])+SIN(RADIANS(3*RC[-2]))*0.000289 -> 0.42147725098185373 | M173: =RC[-4]+RC[-1] -> 90.67336947427394 | N173: =RC[-4]+RC[-2] -> 6647.4355803512608 | O173: =(1.000001018*(1-RC[-4]*RC[-4]))/(1+RC[-4]*COS(RADIANS(RC[-1]))) -> 1.0162889400706976 | P173: =RC[-3]-0.00569-0.00478*SIN(RADIANS(125.04-1934.136*RC[-9])) -> 90.665084656648645 | Q173: =23+(26+((21.448-RC[-10]*(46.815+RC[-10]*(0.00059-RC[-10]*0.001813))))/60)/60 -> 23.437019117991721 | R173: =RC[-1]+0.00256*COS(RADIANS(125.04-1934.136*RC[-11])) -> 23.434869152171512 | S173: =DEGREES(ATAN2(COS(RADIANS(RC[-3])),COS(RADIANS(RC[-1]))*SIN(RADIANS(RC[-3])))) -> 90.724871711957817 | T173: =DEGREES(ASIN(SIN(RADIANS(RC[-2]))*SIN(RADIANS(RC[-4])))) -> 23.433195966978346 | U173: =TAN(RADIANS(RC[-3]/2))*TAN(RADIANS(RC[-3]/2)) -> 4.301783168755538E-2 | V173: =4*DEGREES(RC[-1]*SIN(2*RADIANS(RC[-13]))-2*RC[-11]*SIN(RADIANS(RC[-12]))+4*RC[-11]*RC[-1]*SIN(RADIANS(RC[-12]))*COS(2*RADIANS(RC[-13]))-0.5*RC[-1]*RC[-1]*SIN(4*RADIANS(RC[-13]))-1.25*RC[-11]*RC[-11]*SIN(2*RADIANS(RC[-12]))) -> -1.9236490792202441 | W173: =DEGREES(ACOS(COS(RADIANS(90.833))/(COS(RADIANS(R2C2))*COS(RADIANS(RC[-3])))-TAN(RADIANS(R2C2))*TAN(RADIANS(RC[-3])))) -> #NUM! | X173: =(720-4*R3C2-RC[-2]+R4C2*60)/1440 -> 1899-12-31T13:57:55.419 | Y173: =(RC[-1]*1440-RC[-2]*4)/1440 -> #NUM! | Z173: =(RC[-2]*1440+RC[-3]*4)/1440 -> #NUM! | AA173: =8*RC[-4] -> #NUM! | AB173: =MOD(RC[-23]*1440+RC[-6]+4*R3C2-60*R4C2,1440) -> 722.07635092077976 | AC173: =IF(RC[-1]/4<0,RC[-1]/4+180,RC[-1]/4-180) -> 0.51908773019493992 | AD173: =DEGREES(ACOS(SIN(RADIANS(R2C2))*SIN(RADIANS(RC[-10]))+COS(RADIANS(R2C2))*COS(RADIANS(RC[-10]))*COS(RADIANS(RC[-1])))) -> 46.567820163333451 | AE173: =90-RC[-1] -> 43.432179836666549 | AF173: =IF(RC[-1]>85,0,IF(RC[-1]>5,58.1/TAN(RADIANS(RC[-1]))-0.07/POWER(TAN(RADIANS(RC[-1])),3)+0.000086/POWER(TAN(RADIANS(RC[-1])),5),IF(RC[-1]>-0.575,1735+RC[-1]*(-518.2+RC[-1]*(103.4+RC[-1]*(-12.79+RC[-1]*0.711))),-20.772/TAN(RADIANS(RC[-1])))))/3600 -> 1.702432311278354E-2 | AG173: =RC[-2]+RC[-1] -> 43.449204159779335 | AH173: =IF(RC[-5]>0,MOD(DEGREES(ACOS(((SIN(RADIANS(R2C2))*COS(RADIANS(RC[-4])))-SIN(RADIANS(RC[-14])))/(COS(RADIANS(R2C2))*SIN(RADIANS(RC[-4])))))+180,360),MOD(540-DEGREES(ACOS(((SIN(RADIANS(R2C2))*COS(RADIANS(RC[-4])))-SIN(RADIANS(RC[-14])))/(COS(RADIANS(R2C2))*SIN(RADIANS(RC[-4]))))),360)) -> 180.65586197849859
D174: =R[-1]C+1 -> 2017-06-22T00:00:00.000 | E174: =R5C2 -> 1899-12-31T14:00:00.000 | F174: =RC[-2]+2415018.5+RC[-1]-R4C2/24 -> 2457927.375 | G174: =(RC[-1]-2451545)/36525 -> 0.17473990417522245 | I174: =MOD(280.46646+RC[-2]*(36000.76983 + RC[-2]*0.0003032),360) -> 91.237539586357343 | J174: =357.52911+RC[-3]*(35999.05029 - 0.0001537*RC[-3]) -> 6647.999703380533 | K174: =0.016708634-RC[-4]*(0.000042037+0.0000001267*RC[-4]) -> 1.6701284589986064E-2 | L174: =SIN(RADIANS(RC[-2]))*(1.914602-RC[-5]*(0.004817+0.000014*RC[-5]))+SIN(RADIANS(2*RC[-2]))*(0.019993-0.000101*RC[-5])+SIN(RADIANS(3*RC[-2]))*0.000289 -> 0.38994771462379718 | M174: =RC[-4]+RC[-1] -> 91.627487300981144 | N174: =RC[-4]+RC[-2] -> 6648.3896510951572 | O174: =(1.000001018*(1-RC[-4]*RC[-4]))/(1+RC[-4]*COS(RADIANS(RC[-1]))) -> 1.0163491071556214 | P174: =RC[-3]-0.00569-0.00478*SIN(RADIANS(125.04-1934.136*RC[-9])) -> 91.619198774296052 | Q174: =23+(26+((21.448-RC[-10]*(46.815+RC[-10]*(0.00059-RC[-10]*0.001813))))/60)/60 -> 23.437018761956736 | R174: =RC[-1]+0.00256*COS(RADIANS(125.04-1934.136*RC[-11])) -> 23.434870081433168 | S174: =DEGREES(ATAN2(COS(RADIANS(RC[-3])),COS(RADIANS(RC[-1]))*SIN(RADIANS(RC[-3])))) -> 91.76468152577938 | T174: =DEGREES(ASIN(SIN(RADIANS(RC[-2]))*SIN(RADIANS(RC[-4])))) -> 23.424953706475875 | U174: =TAN(RADIANS(RC[-3]/2))*TAN(RADIANS(RC[-3]/2)) -> 4.3017835196135404E-2 | V174: =4*DEGREES(RC[-1]*SIN(2*RADIANS(RC[-13]))-2*RC[-11]*SIN(RADIANS(RC[-12]))+4*RC[-11]*RC[-1]*SIN(RADIANS(RC[-12]))*COS(2*RADIANS(RC[-13]))-0.5*RC[-1]*RC[-1]*SIN(4*RADIANS(RC[-13]))-1.25*RC[-11]*RC[-11]*SIN(2*RADIANS(RC[-12]))) -> -2.1400318855360805 | W174: =DEGREES(ACOS(COS(RADIANS(90.833))/(COS(RADIANS(R2C2))*COS(RADIANS(RC[-3])))-TAN(RADIANS(R2C2))*TAN(RADIANS(RC[-3])))) -> #NUM! | X174: =(720-4*R3C2-RC[-2]+R4C2*60)/1440 -> 1899-12-31T13:58:08.402 | Y174: =(RC[-1]*1440-RC[-2]*4)/1440 -> #NUM! | Z174: =(RC[-2]*1440+RC[-3]*4)/1440 -> #NUM! | AA174: =8*RC[-4] -> #NUM! | AB174: =MOD(RC[-23]*1440+RC[-6]+4*R3C2-60*R4C2,1440) -> 721.85996811446387 | AC174: =IF(RC[-1]/4<0,RC[-1]/4+180,RC[-1]/4-180) -> 0.464992028615967 | AD174: =DEGREES(ACOS(SIN(RADIANS(R2C2))*SIN(RADIANS(RC[-10]))+COS(RADIANS(R2C2))*COS(RADIANS(RC[-10]))*COS(RADIANS(RC[-1])))) -> 46.575861613601226 | AE174: =90-RC[-1] -> 43.424138386398774 | AF174: =IF(RC[-1]>85,0,IF(RC[-1]>5,58.1/TAN(RADIANS(RC[-1]))-0.07/POWER(TAN(RADIANS(RC[-1])),3)+0.000086/POWER(TAN(RADIANS(RC[-1])),5),IF(RC[-1]>-0.575,1735+RC[-1]*(-518.2+RC[-1]*(103.4+RC[-1]*(-12.79+RC[-1]*0.711))),-20.772/TAN(RADIANS(RC[-1])))))/3600 -> 1.7029096851630662E-2 | AG174: =RC[-2]+RC[-1] -> 43.441167483250403 | AH174: =IF(RC[-5]>0,MOD(DEGREES(ACOS(((SIN(RADIANS(R2C2))*COS(RADIANS(RC[-4])))-SIN(RADIANS(RC[-14])))/(COS(RADIANS(R2C2))*SIN(RADIANS(RC[-4])))))+180,360),MOD(540-DEGREES(ACOS(((SIN(RADIANS(R2C2))*COS(RADIANS(RC[-4])))-SIN(RADIANS(RC[-14])))/(COS(RADIANS(R2C2))*SIN(RADIANS(RC[-4]))))),360)) -> 180.5874702437182
D175: =R[-1]C+1 -> 2017-06-23T00:00:00.000 | E175: =R5C2 -> 1899-12-31T14:00:00.000 | F175: =RC[-2]+2415018.5+RC[-1]-R4C2/24 -> 2457928.375 | G175: =(RC[-1]-2451545)/36525 -> 0.17476728268309377 | I175: =MOD(280.46646+RC[-2]*(36000.76983 + RC[-2]*0.0003032),360) -> 92.223186949423507 | J175: =357.52911+RC[-3]*(35999.05029 - 0.0001537*RC[-3]) -> 6648.9853036607874 | K175: =0.016708634-RC[-4]*(0.000042037+0.0000001267*RC[-4]) -> 1.670128343786334E-2 | L175: =SIN(RADIANS(RC[-2]))*(1.914602-RC[-5]*(0.004817+0.000014*RC[-5]))+SIN(RADIANS(2*RC[-2]))*(0.019993-0.000101*RC[-5])+SIN(RADIANS(3*RC[-2]))*0.000289 -> 0.35830960655482613 | M175: =RC[-4]+RC[-1] -> 92.581496555978333 | N175: =RC[-4]+RC[-2] -> 6649.3436132673423 | O175: =(1.000001018*(1-RC[-4]*RC[-4]))/(1+RC[-4]*COS(RADIANS(RC[-1]))) -> 1.0164045878948305 | P175: =RC[-3]-0.00569-0.00478*SIN(RADIANS(125.04-1934.136*RC[-9])) -> 92.573204322453051 | Q175: =23+(26+((21.448-RC[-10]*(46.815+RC[-10]*(0.00059-RC[-10]*0.001813))))/60)/60 -> 23.437018405921751 | R175: =RC[-1]+0.00256*COS(RADIANS(125.04-1934.136*RC[-11])) -> 23.434871012530177 | S175: =DEGREES(ATAN2(COS(RADIANS(RC[-3])),COS(RADIANS(RC[-1]))*SIN(RADIANS(RC[-3])))) -> 92.804189351517209 | T175: =DEGREES(ASIN(SIN(RADIANS(RC[-2]))*SIN(RADIANS(RC[-4])))) -> 23.40983113241434 | U175: =TAN(RADIANS(RC[-3]/2))*TAN(RADIANS(RC[-3]/2)) -> 4.3017838711645252E-2 | V175: =4*DEGREES(RC[-1]*SIN(2*RADIANS(RC[-13]))-2*RC[-11]*SIN(RADIANS(RC[-12]))+4*RC[-11]*RC[-1]*SIN(RADIANS(RC[-12]))*COS(2*RADIANS(RC[-13]))-0.5*RC[-1]*RC[-1]*SIN(4*RADIANS(RC[-13]))-1.25*RC[-11]*RC[-11]*SIN(2*RADIANS(RC[-12]))) -> -2.3552222455870715 | W175: =DEGREES(ACOS(COS(RADIANS(90.833))/(COS(RADIANS(R2C2))*COS(RADIANS(RC[-3])))-TAN(RADIANS(R2C2))*TAN(RADIANS(RC[-3])))) -> #NUM! | X175: =(720-4*R3C2-RC[-2]+R4C2*60)/1440 -> 1899-12-31T13:58:21.313 | Y175: =(RC[-1]*1440-RC[-2]*4)/1440 -> #NUM! | Z175: =(RC[-2]*1440+RC[-3]*4)/1440 -> #NUM! | AA175: =8*RC[-4] -> #NUM! | AB175: =MOD(RC[-23]*1440+RC[-6]+4*R3C2-60*R4C2,1440) -> 721.64477775441298 | AC175: =IF(RC[-1]/4<0,RC[-1]/4+180,RC[-1]/4-180) -> 0.41119443860324623 | AD175: =DEGREES(ACOS(SIN(RADIANS(R2C2))*SIN(RADIANS(RC[-10]))+COS(RADIANS(R2C2))*COS(RADIANS(RC[-10]))*COS(RADIANS(RC[-1])))) -> 46.590806358391937 | AE175: =90-RC[-1] -> 43.409193641608063 | AF175: =IF(RC[-1]>85,0,IF(RC[-1]>5,58.1/TAN(RADIANS(RC[-1]))-0.07/POWER(TAN(RADIANS(RC[-1])),3)+0.000086/POWER(TAN(RADIANS(RC[-1])),5),IF(RC[-1]>-0.575,1735+RC[-1]*(-518.2+RC[-1]*(103.4+RC[-1]*(-12.79+RC[-1]*0.711))),-20.772/TAN(RADIANS(RC[-1])))))/3600 -> 1.7037972405832408E-2 | AG175: =RC[-2]+RC[-1] -> 43.426231614013894 | AH175: =IF(RC[-5]>0,MOD(DEGREES(ACOS(((SIN(RADIANS(R2C2))*COS(RADIANS(RC[-4])))-SIN(RADIANS(RC[-14])))/(COS(RADIANS(R2C2))*SIN(RADIANS(RC[-4])))))+180,360),MOD(540-DEGREES(ACOS(((SIN(RADIANS(R2C2))*COS(RADIANS(RC[-4])))-SIN(RADIANS(RC[-14])))/(COS(RADIANS(R2C2))*SIN(RADIANS(RC[-4]))))),360)) -> 180.51943287965631
D176: =R[-1]C+1 -> 2017-06-24T00:00:00.000 | E176: =R5C2 -> 1899-12-31T14:00:00.000 | F176: =RC[-2]+2415018.5+RC[-1]-R4C2/24 -> 2457929.375 | G176: =(RC[-1]-2451545)/36525 -> 0.17479466119096509 | I176: =MOD(280.46646+RC[-2]*(36000.76983 + RC[-2]*0.0003032),360) -> 93.208834312489671 | J176: =357.52911+RC[-3]*(35999.05029 - 0.0001537*RC[-3]) -> 6649.9709039410409 | K176: =0.016708634-RC[-4]*(0.000042037+0.0000001267*RC[-4]) -> 1.6701282285740422E-2 | L176: =SIN(RADIANS(RC[-2]))*(1.914602-RC[-5]*(0.004817+0.000014*RC[-5]))+SIN(RADIANS(2*RC[-2]))*(0.019993-0.000101*RC[-5])+SIN(RADIANS(3*RC[-2]))*0.000289 -> 0.326571756182442 | M176: =RC[-4]+RC[-1] -> 93.535406068672117 | N176: =RC[-4]+RC[-2] -> 6650.2974756972235 | O176: =(1.000001018*(1-RC[-4]*RC[-4]))/(1+RC[-4]*COS(RADIANS(RC[-1]))) -> 1.016455367421798 | P176: =RC[-3]-0.00569-0.00478*SIN(RADIANS(125.04-1934.136*RC[-9])) -> 93.527110130529422 | Q176: =23+(26+((21.448-RC[-10]*(46.815+RC[-10]*(0.00059-RC[-10]*0.001813))))/60)/60 -> 23.437018049886767 | R176: =RC[-1]+0.00256*COS(RADIANS(125.04-1934.136*RC[-11])) -> 23.434871945461442 | S176: =DEGREES(ATAN2(COS(RADIANS(RC[-3])),COS(RADIANS(RC[-1]))*SIN(RADIANS(RC[-3])))) -> 93.84329703835941 | T176: =DEGREES(ASIN(SIN(RADIANS(RC[-2]))*SIN(RADIANS(RC[-4])))) -> 23.387836906157748 | U176: =TAN(RADIANS(RC[-3]/2))*TAN(RADIANS(RC[-3]/2)) -> 4.3017842234080797E-2 | V176: =4*DEGREES(RC[-1]*SIN(2*RADIANS(RC[-13]))-2*RC[-11]*SIN(RADIANS(RC[-12]))+4*RC[-11]*RC[-1]*SIN(RADIANS(RC[-12]))*COS(2*RADIANS(RC[-13]))-0.5*RC[-1]*RC[-1]*SIN(4*RADIANS(RC[-13]))-1.25*RC[-11]*RC[-11]*SIN(2*RADIANS(RC[-12]))) -> -2.5688292443977176 | W176: =DEGREES(ACOS(COS(RADIANS(90.833))/(COS(RADIANS(R2C2))*COS(RADIANS(RC[-3])))-TAN(RADIANS(R2C2))*TAN(RADIANS(RC[-3])))) -> #NUM! | X176: =(720-4*R3C2-RC[-2]+R4C2*60)/1440 -> 1899-12-31T13:58:34.130 | Y176: =(RC[-1]*1440-RC[-2]*4)/1440 -> #NUM! | Z176: =(RC[-2]*1440+RC[-3]*4)/1440 -> #NUM! | AA176: =8*RC[-4] -> #NUM! | AB176: =MOD(RC[-23]*1440+RC[-6]+4*R3C2-60*R4C2,1440) -> 721.43117075560224 | AC176: =IF(RC[-1]/4<0,RC[-1]/4+180,RC[-1]/4-180) -> 0.3577926889005596 | AD176: =DEGREES(ACOS(SIN(RADIANS(R2C2))*SIN(RADIANS(RC[-10]))+COS(RADIANS(R2C2))*COS(RADIANS(RC[-10]))*COS(RADIANS(RC[-1])))) -> 46.612645661140029 | AE176: =90-RC[-1] -> 43.387354338859971 | AF176: =IF(RC[-1]>85,0,IF(RC[-1]>5,58.1/TAN(RADIANS(RC[-1]))-0.07/POWER(TAN(RADIANS(RC[-1])),3)+0.000086/POWER(TAN(RADIANS(RC[-1])),5),IF(RC[-1]>-0.575,1735+RC[-1]*(-518.2+RC[-1]*(103.4+RC[-1]*(-12.79+RC[-1]*0.711))),-20.772/TAN(RADIANS(RC[-1])))))/3600 -> 1.705095131724944E-2 | AG176: =RC[-2]+RC[-1] -> 43.404405290177223 | AH176: =IF(RC[-5]>0,MOD(DEGREES(ACOS(((SIN(RADIANS(R2C2))*COS(RADIANS(RC[-4])))-SIN(RADIANS(RC[-14])))/(COS(RADIANS(R2C2))*SIN(RADIANS(RC[-4])))))+180,360),MOD(540-DEGREES(ACOS(((SIN(RADIANS(R2C2))*COS(RADIANS(RC[-4])))-SIN(RADIANS(RC[-14])))/(COS(RADIANS(R2C2))*SIN(RADIANS(RC[-4]))))),360)) -> 180.45188583863896
D177: =R[-1]C+1 -> 2017-06-25T00:00:00.000 | E177: =R5C2 -> 1899-12-31T14:00:00.000 | F177: =RC[-2]+2415018.5+RC[-1]-R4C2/24 -> 2457930.375 | G177: =(RC[-1]-2451545)/36525 -> 0.17482203969883642 | I177: =MOD(280.46646+RC[-2]*(36000.76983 + RC[-2]*0.0003032),360) -> 94.194481675555835 | J177: =357.52911+RC[-3]*(35999.05029 - 0.0001537*RC[-3]) -> 6650.9565042212953 | K177: =0.016708634-RC[-4]*(0.000042037+0.0000001267*RC[-4]) -> 1.6701281133617317E-2 | L177: =SIN(RADIANS(RC[-2]))*(1.914602-RC[-5]*(0.004817+0.000014*RC[-5]))+SIN(RADIANS(2*RC[-2]))*(0.019993-0.000101*RC[-5])+SIN(RADIANS(3*RC[-2]))*0.000289 -> 0.29474301554922538 | M177: =RC[-4]+RC[-1] -> 94.489224691105065 | N177: =RC[-4]+RC[-2] -> 6651.2512472368444 | O177: =(1.000001018*(1-RC[-4]*RC[-4]))/(1+RC[-4]*COS(RADIANS(RC[-1]))) -> 1.0165014321341319 | P177: =RC[-3]-0.00569-0.00478*SIN(RADIANS(125.04-1934.136*RC[-9])) -> 94.480925050570889 | Q177: =23+(26+((21.448-RC[-10]*(46.815+RC[-10]*(0.00059-RC[-10]*0.001813))))/60)/60 -> 23.437017693851782 | R177: =RC[-1]+0.00256*COS(RADIANS(125.04-1934.136*RC[-11])) -> 23.434872880225864 | S177: =DEGREES(ATAN2(COS(RADIANS(RC[-3])),COS(RADIANS(RC[-1]))*SIN(RADIANS(RC[-3])))) -> 94.881907021041641 | T177: =DEGREES(ASIN(SIN(RADIANS(RC[-2]))*SIN(RADIANS(RC[-4])))) -> 23.358982396398698 | U177: =TAN(RADIANS(RC[-3]/2))*TAN(RADIANS(RC[-3]/2)) -> 4.3017845763437867E-2 | V177: =4*DEGREES(RC[-1]*SIN(2*RADIANS(RC[-13]))-2*RC[-11]*SIN(RADIANS(RC[-12]))+4*RC[-11]*RC[-1]*SIN(RADIANS(RC[-12]))*COS(2*RADIANS(RC[-13]))-0.5*RC[-1]*RC[-1]*SIN(4*RADIANS(RC[-13]))-1.25*RC[-11]*RC[-11]*SIN(2*RADIANS(RC[-12]))) -> -2.7804641328302013 | W177: =DEGREES(ACOS(COS(RADIANS(90.833))/(COS(RADIANS(R2C2))*COS(RADIANS(RC[-3])))-TAN(RADIANS(R2C2))*TAN(RADIANS(RC[-3])))) -> #NUM! | X177: =(720-4*R3C2-RC[-2]+R4C2*60)/1440 -> 1899-12-31T13:58:46.828 | Y177: =(RC[-1]*1440-RC[-2]*4)/1440 -> #NUM! | Z177: =(RC[-2]*1440+RC[-3]*4)/1440 -> #NUM! | AA177: =8*RC[-4] -> #NUM! | AB177: =MOD(RC[-23]*1440+RC[-6]+4*R3C2-60*R4C2,1440) -> 721.21953586716984 | AC177: =IF(RC[-1]/4<0,RC[-1]/4+180,RC[-1]/4-180) -> 0.30488396679245966 | AD177: =DEGREES(ACOS(SIN(RADIANS(R2C2))*SIN(RADIANS(RC[-10]))+COS(RADIANS(R2C2))*COS(RADIANS(RC[-10]))*COS(RADIANS(RC[-1])))) -> 46.641367913886413 | AE177: =90-RC[-1] -> 43.358632086113587 | AF177: =IF(RC[-1]>85,0,IF(RC[-1]>5,58.1/TAN(RADIANS(RC[-1]))-0.07/POWER(TAN(RADIANS(RC[-1])),3)+0.000086/POWER(TAN(RADIANS(RC[-1])),5),IF(RC[-1]>-0.575,1735+RC[-1]*(-518.2+RC[-1]*(103.4+RC[-1]*(-12.79+RC[-1]*0.711))),-20.772/TAN(RADIANS(RC[-1])))))/3600 -> 1.7068036529965306E-2 | AG177: =RC[-2]+RC[-1] -> 43.375700122643551 | AH177: =IF(RC[-5]>0,MOD(DEGREES(ACOS(((SIN(RADIANS(R2C2))*COS(RADIANS(RC[-4])))-SIN(RADIANS(RC[-14])))/(COS(RADIANS(R2C2))*SIN(RADIANS(RC[-4])))))+180,360),MOD(540-DEGREES(ACOS(((SIN(RADIANS(R2C2))*COS(RADIANS(RC[-4])))-SIN(RADIANS(RC[-14])))/(COS(RADIANS(R2C2))*SIN(RADIANS(RC[-4]))))),360)) -> 180.38496410316
D178: =R[-1]C+1 -> 2017-06-26T00:00:00.000 | E178: =R5C2 -> 1899-12-31T14:00:00.000 | F178: =RC[-2]+2415018.5+RC[-1]-R4C2/24 -> 2457931.375 | G178: =(RC[-1]-2451545)/36525 -> 0.17484941820670774 | I178: =MOD(280.46646+RC[-2]*(36000.76983 + RC[-2]*0.0003032),360) -> 95.180129038622908 | J178: =357.52911+RC[-3]*(35999.05029 - 0.0001537*RC[-3]) -> 6651.9421045015488 | K178: =0.016708634-RC[-4]*(0.000042037+0.0000001267*RC[-4]) -> 1.6701279981494021E-2 | L178: =SIN(RADIANS(RC[-2]))*(1.914602-RC[-5]*(0.004817+0.000014*RC[-5]))+SIN(RADIANS(2*RC[-2]))*(0.019993-0.000101*RC[-5])+SIN(RADIANS(3*RC[-2]))*0.000289 -> 0.26283225730728388 | M178: =RC[-4]+RC[-1] -> 95.442961295930189 | N178: =RC[-4]+RC[-2] -> 6652.2049367588561 | O178: =(1.000001018*(1-RC[-4]*RC[-4]))/(1+RC[-4]*COS(RADIANS(RC[-1]))) -> 1.0165427696960598 | P178: =RC[-3]-0.00569-0.00478*SIN(RADIANS(125.04-1934.136*RC[-9])) -> 95.434657955233618 | Q178: =23+(26+((21.448-RC[-10]*(46.815+RC[-10]*(0.00059-RC[-10]*0.001813))))/60)/60 -> 23.437017337816798 | R178: =RC[-1]+0.00256*COS(RADIANS(125.04-1934.136*RC[-11])) -> 23.434873816822336 | S178: =DEGREES(ATAN2(COS(RADIANS(RC[-3])),COS(RADIANS(RC[-1]))*SIN(RADIANS(RC[-3])))) -> 95.919922491540831 | T178: =DEGREES(ASIN(SIN(RADIANS(RC[-2]))*SIN(RADIANS(RC[-4])))) -> 23.323281662613205 | U178: =TAN(RADIANS(RC[-3]/2))*TAN(RADIANS(RC[-3]/2)) -> 4.3017849299712321E-2 | V178: =4*DEGREES(RC[-1]*SIN(2*RADIANS(RC[-13]))-2*RC[-11]*SIN(RADIANS(RC[-12]))+4*RC[-11]*RC[-1]*SIN(RADIANS(RC[-12]))*COS(2*RADIANS(RC[-13]))-0.5*RC[-1]*RC[-1]*SIN(4*RADIANS(RC[-13]))-1.25*RC[-11]*RC[-11]*SIN(2*RADIANS(RC[-12]))) -> -2.9897409943347251 | W178: =DEGREES(ACOS(COS(RADIANS(90.833))/(COS(RADIANS(R2C2))*COS(RADIANS(RC[-3])))-TAN(RADIANS(R2C2))*TAN(RADIANS(RC[-3])))) -> #NUM! | X178: =(720-4*R3C2-RC[-2]+R4C2*60)/1440 -> 1899-12-31T13:58:59.384 | Y178: =(RC[-1]*1440-RC[-2]*4)/1440 -> #NUM! | Z178: =(RC[-2]*1440+RC[-3]*4)/1440 -> #NUM! | AA178: =8*RC[-4] -> #NUM! | AB178: =MOD(RC[-23]*1440+RC[-6]+4*R3C2-60*R4C2,1440) -> 721.01025900566526 | AC178: =IF(RC[-1]/4<0,RC[-1]/4+180,RC[-1]/4-180) -> 0.2525647514163154 | AD178: =DEGREES(ACOS(SIN(RADIANS(R2C2))*SIN(RADIANS(RC[-10]))+COS(RADIANS(R2C2))*COS(RADIANS(RC[-10]))*COS(RADIANS(RC[-1])))) -> 46.676958658157666 | AE178: =90-RC[-1] -> 43.323041341842334 | AF178: =IF(RC[-1]>85,0,IF(RC[-1]>5,58.1/TAN(RADIANS(RC[-1]))-0.07/POWER(TAN(RADIANS(RC[-1])),3)+0.000086/POWER(TAN(RADIANS(RC[-1])),5),IF(RC[-1]>-0.575,1735+RC[-1]*(-518.2+RC[-1]*(103.4+RC[-1]*(-12.79+RC[-1]*0.711))),-20.772/TAN(RADIANS(RC[-1])))))/3600 -> 1.7089232402638665E-2 | AG178: =RC[-2]+RC[-1] -> 43.340130574244974 | AH178: =IF(RC[-5]>0,MOD(DEGREES(ACOS(((SIN(RADIANS(R2C2))*COS(RADIANS(RC[-4])))-SIN(RADIANS(RC[-14])))/(COS(RADIANS(R2C2))*SIN(RADIANS(RC[-4])))))+180,360),MOD(540-DEGREES(ACOS(((SIN(RADIANS(R2C2))*COS(RADIANS(RC[-4])))-SIN(RADIANS(RC[-14])))/(COS(RADIANS(R2C2))*SIN(RADIANS(RC[-4]))))),360)) -> 180.31880137903309
D179: =R[-1]C+1 -> 2017-06-27T00:00:00.000 | E179: =R5C2 -> 1899-12-31T14:00:00.000 | F179: =RC[-2]+2415018.5+RC[-1]-R4C2/24 -> 2457932.375 | G179: =(RC[-1]-2451545)/36525 -> 0.17487679671457906 | I179: =MOD(280.46646+RC[-2]*(36000.76983 + RC[-2]*0.0003032),360) -> 96.165776401690891 | J179: =357.52911+RC[-3]*(35999.05029 - 0.0001537*RC[-3]) -> 6652.9277047818014 | K179: =0.016708634-RC[-4]*(0.000042037+0.0000001267*RC[-4]) -> 1.6701278829370534E-2 | L179: =SIN(RADIANS(RC[-2]))*(1.914602-RC[-5]*(0.004817+0.000014*RC[-5]))+SIN(RADIANS(2*RC[-2]))*(0.019993-0.000101*RC[-5])+SIN(RADIANS(3*RC[-2]))*0.000289 -> 0.23084837269250325 | M179: =RC[-4]+RC[-1] -> 96.396624774383397 | N179: =RC[-4]+RC[-2] -> 6653.1585531544943 | O179: =(1.000001018*(1-RC[-4]*RC[-4]))/(1+RC[-4]*COS(RADIANS(RC[-1]))) -> 1.0165793690406819 | P179: =RC[-3]-0.00569-0.00478*SIN(RADIANS(125.04-1934.136*RC[-9])) -> 96.388317735756701 | Q179: =23+(26+((21.448-RC[-10]*(46.815+RC[-10]*(0.00059-RC[-10]*0.001813))))/60)/60 -> 23.437016981781813 | R179: =RC[-1]+0.00256*COS(RADIANS(125.04-1934.136*RC[-11])) -> 23.434874755249755 | S179: =DEGREES(ATAN2(COS(RADIANS(RC[-3])),COS(RADIANS(RC[-1]))*SIN(RADIANS(RC[-3])))) -> 96.957247568374697 | T179: =DEGREES(ASIN(SIN(RADIANS(RC[-2]))*SIN(RADIANS(RC[-4])))) -> 23.280751434945127 | U179: =TAN(RADIANS(RC[-3]/2))*TAN(RADIANS(RC[-3]/2)) -> 4.3017852842899981E-2 | V179: =4*DEGREES(RC[-1]*SIN(2*RADIANS(RC[-13]))-2*RC[-11]*SIN(RADIANS(RC[-12]))+4*RC[-11]*RC[-1]*SIN(RADIANS(RC[-12]))*COS(2*RADIANS(RC[-13]))-0.5*RC[-1]*RC[-1]*SIN(4*RADIANS(RC[-13]))-1.25*RC[-11]*RC[-11]*SIN(2*RADIANS(RC[-12]))) -> -3.1962774044934692 | W179: =DEGREES(ACOS(COS(RADIANS(90.833))/(COS(RADIANS(R2C2))*COS(RADIANS(RC[-3])))-TAN(RADIANS(R2C2))*TAN(RADIANS(RC[-3])))) -> #NUM! | X179: =(720-4*R3C2-RC[-2]+R4C2*60)/1440 -> 1899-12-31T13:59:11.777 | Y179: =(RC[-1]*1440-RC[-2]*4)/1440 -> #NUM! | Z179: =(RC[-2]*1440+RC[-3]*4)/1440 -> #NUM! | AA179: =8*RC[-4] -> #NUM! | AB179: =MOD(RC[-23]*1440+RC[-6]+4*R3C2-60*R4C2,1440) -> 720.80372259550654 | AC179: =IF(RC[-1]/4<0,RC[-1]/4+180,RC[-1]/4-180) -> 0.20093064887663559 | AD179: =DEGREES(ACOS(SIN(RADIANS(R2C2))*SIN(RADIANS(RC[-10]))+COS(RADIANS(R2C2))*COS(RADIANS(RC[-10]))*COS(RADIANS(RC[-1])))) -> 46.719400610640776 | AE179: =90-RC[-1] -> 43.280599389359224 | AF179: =IF(RC[-1]>85,0,IF(RC[-1]>5,58.1/TAN(RADIANS(RC[-1]))-0.07/POWER(TAN(RADIANS(RC[-1])),3)+0.000086/POWER(TAN(RADIANS(RC[-1])),5),IF(RC[-1]>-0.575,1735+RC[-1]*(-518.2+RC[-1]*(103.4+RC[-1]*(-12.79+RC[-1]*0.711))),-20.772/TAN(RADIANS(RC[-1])))))/3600 -> 1.7114544724948218E-2 | AG179: =RC[-2]+RC[-1] -> 43.297713934084172 | AH179: =IF(RC[-5]>0,MOD(DEGREES(ACOS(((SIN(RADIANS(R2C2))*COS(RADIANS(RC[-4])))-SIN(RADIANS(RC[-14])))/(COS(RADIANS(R2C2))*SIN(RADIANS(RC[-4])))))+180,360),MOD(540-DEGREES(ACOS(((SIN(RADIANS(R2C2))*COS(RADIANS(RC[-4])))-SIN(RADIANS(RC[-14])))/(COS(RADIANS(R2C2))*SIN(RADIANS(RC[-4]))))),360)) -> 180.25352979349816
D180: =R[-1]C+1 -> 2017-06-28T00:00:00.000 | E180: =R5C2 -> 1899-12-31T14:00:00.000 | F180: =RC[-2]+2415018.5+RC[-1]-R4C2/24 -> 2457933.375 | G180: =(RC[-1]-2451545)/36525 -> 0.17490417522245039 | I180: =MOD(280.46646+RC[-2]*(36000.76983 + RC[-2]*0.0003032),360) -> 97.151423764758874 | J180: =357.52911+RC[-3]*(35999.05029 - 0.0001537*RC[-3]) -> 6653.9133050620549 | K180: =0.016708634-RC[-4]*(0.000042037+0.0000001267*RC[-4]) -> 1.670127767724686E-2 | L180: =SIN(RADIANS(RC[-2]))*(1.914602-RC[-5]*(0.004817+0.000014*RC[-5]))+SIN(RADIANS(2*RC[-2]))*(0.019993-0.000101*RC[-5])+SIN(RADIANS(3*RC[-2]))*0.000289 -> 0.19880026949879673 | M180: =RC[-4]+RC[-1] -> 97.350224034257664 | N180: =RC[-4]+RC[-2] -> 6654.1121053315537 | O180: =(1.000001018*(1-RC[-4]*RC[-4]))/(1+RC[-4]*COS(RADIANS(RC[-1]))) -> 1.0166112203719868 | P180: =RC[-3]-0.00569-0.00478*SIN(RADIANS(125.04-1934.136*RC[-9])) -> 97.341913299936252 | Q180: =23+(26+((21.448-RC[-10]*(46.815+RC[-10]*(0.00059-RC[-10]*0.001813))))/60)/60 -> 23.437016625746828 | R180: =RC[-1]+0.00256*COS(RADIANS(125.04-1934.136*RC[-11])) -> 23.434875695507021 | S180: =DEGREES(ATAN2(COS(RADIANS(RC[-3])),COS(RADIANS(RC[-1]))*SIN(RADIANS(RC[-3])))) -> 97.993787463000302 | T180: =DEGREES(ASIN(SIN(RADIANS(RC[-2]))*SIN(RADIANS(RC[-4])))) -> 23.231411090594491 | U180: =TAN(RADIANS(RC[-3]/2))*TAN(RADIANS(RC[-3]/2)) -> 4.3017856392996663E-2 | V180: =4*DEGREES(RC[-1]*SIN(2*RADIANS(RC[-13]))-2*RC[-11]*SIN(RADIANS(RC[-12]))+4*RC[-11]*RC[-1]*SIN(RADIANS(RC[-12]))*COS(2*RADIANS(RC[-13]))-0.5*RC[-1]*RC[-1]*SIN(4*RADIANS(RC[-13]))-1.25*RC[-11]*RC[-11]*SIN(2*RADIANS(RC[-12]))) -> -3.3996950816264935 | W180: =DEGREES(ACOS(COS(RADIANS(90.833))/(COS(RADIANS(R2C2))*COS(RADIANS(RC[-3])))-TAN(RADIANS(R2C2))*TAN(RADIANS(RC[-3])))) -> #NUM! | X180: =(720-4*R3C2-RC[-2]+R4C2*60)/1440 -> 1899-12-31T13:59:23.982 | Y180: =(RC[-1]*1440-RC[-2]*4)/1440 -> #NUM! | Z180: =(RC[-2]*1440+RC[-3]*4)/1440 -> #NUM! | AA180: =8*RC[-4] -> #NUM! | AB180: =MOD(RC[-23]*1440+RC[-6]+4*R3C2-60*R4C2,1440) -> 720.60030491837347 | AC180: =IF(RC[-1]/4<0,RC[-1]/4+180,RC[-1]/4-180) -> 0.15007622959336686 | AD180: =DEGREES(ACOS(SIN(RADIANS(R2C2))*SIN(RADIANS(RC[-10]))+COS(RADIANS(R2C2))*COS(RADIANS(RC[-10]))*COS(RADIANS(RC[-1])))) -> 46.768673693529145 | AE180: =90-RC[-1] -> 43.231326306470855 | AF180: =IF(RC[-1]>85,0,IF(RC[-1]>5,58.1/TAN(RADIANS(RC[-1]))-0.07/POWER(TAN(RADIANS(RC[-1])),3)+0.000086/POWER(TAN(RADIANS(RC[-1])),5),IF(RC[-1]>-0.575,1735+RC[-1]*(-518.2+RC[-1]*(103.4+RC[-1]*(-12.79+RC[-1]*0.711))),-20.772/TAN(RADIANS(RC[-1])))))/3600 -> 1.7143980738123659E-2 | AG180: =RC[-2]+RC[-1] -> 43.248470287208981 | AH180: =IF(RC[-5]>0,MOD(DEGREES(ACOS(((SIN(RADIANS(R2C2))*COS(RADIANS(RC[-4])))-SIN(RADIANS(RC[-14])))/(COS(RADIANS(R2C2))*SIN(RADIANS(RC[-4])))))+180,360),MOD(540-DEGREES(ACOS(((SIN(RADIANS(R2C2))*COS(RADIANS(RC[-4])))-SIN(RADIANS(RC[-14])))/(COS(RADIANS(R2C2))*SIN(RADIANS(RC[-4]))))),360)) -> 180.18927959945657
D181: =R[-1]C+1 -> 2017-06-29T00:00:00.000 | E181: =R5C2 -> 1899-12-31T14:00:00.000 | F181: =RC[-2]+2415018.5+RC[-1]-R4C2/24 -> 2457934.375 | G181: =(RC[-1]-2451545)/36525 -> 0.17493155373032171 | I181: =MOD(280.46646+RC[-2]*(36000.76983 + RC[-2]*0.0003032),360) -> 98.137071127827767 | J181: =357.52911+RC[-3]*(35999.05029 - 0.0001537*RC[-3]) -> 6654.8989053423074 | K181: =0.016708634-RC[-4]*(0.000042037+0.0000001267*RC[-4]) -> 1.6701276525122995E-2 | L181: =SIN(RADIANS(RC[-2]))*(1.914602-RC[-5]*(0.004817+0.000014*RC[-5]))+SIN(RADIANS(2*RC[-2]))*(0.019993-0.000101*RC[-5])+SIN(RADIANS(3*RC[-2]))*0.000289 -> 0.16669687005281414 | M181: =RC[-4]+RC[-1] -> 98.303767997880584 | N181: =RC[-4]+RC[-2] -> 6655.0656022123603 | O181: =(1.000001018*(1-RC[-4]*RC[-4]))/(1+RC[-4]*COS(RADIANS(RC[-1]))) -> 1.0166383151666349 | P181: =RC[-3]-0.00569-0.00478*SIN(RADIANS(125.04-1934.136*RC[-9])) -> 98.295453570103035 | Q181: =23+(26+((21.448-RC[-10]*(46.815+RC[-10]*(0.00059-RC[-10]*0.001813))))/60)/60 -> 23.437016269711847 | R181: =RC[-1]+0.00256*COS(RADIANS(125.04-1934.136*RC[-11])) -> 23.434876637593021 | S181: =DEGREES(ATAN2(COS(RADIANS(RC[-3])),COS(RADIANS(RC[-1]))*SIN(RADIANS(RC[-3])))) -> 99.029448642820711 | T181: =DEGREES(ASIN(SIN(RADIANS(RC[-2]))*SIN(RADIANS(RC[-4])))) -> 23.175282626797124 | U181: =TAN(RADIANS(RC[-3]/2))*TAN(RADIANS(RC[-3]/2)) -> 4.3017859949998218E-2 | V181: =4*DEGREES(RC[-1]*SIN(2*RADIANS(RC[-13]))-2*RC[-11]*SIN(RADIANS(RC[-12]))+4*RC[-11]*RC[-1]*SIN(RADIANS(RC[-12]))*COS(2*RADIANS(RC[-13]))-0.5*RC[-1]*RC[-1]*SIN(4*RADIANS(RC[-13]))-1.25*RC[-11]*RC[-11]*SIN(2*RADIANS(RC[-12]))) -> -3.5996205267616621 | W181: =DEGREES(ACOS(COS(RADIANS(90.833))/(COS(RADIANS(R2C2))*COS(RADIANS(RC[-3])))-TAN(RADIANS(R2C2))*TAN(RADIANS(RC[-3])))) -> #NUM! | X181: =(720-4*R3C2-RC[-2]+R4C2*60)/1440 -> 1899-12-31T13:59:35.977 | Y181: =(RC[-1]*1440-RC[-2]*4)/1440 -> #NUM! | Z181: =(RC[-2]*1440+RC[-3]*4)/1440 -> #NUM! | AA181: =8*RC[-4] -> #NUM! | AB181: =MOD(RC[-23]*1440+RC[-6]+4*R3C2-60*R4C2,1440) -> 720.40037947323833 | AC181: =IF(RC[-1]/4<0,RC[-1]/4+180,RC[-1]/4-180) -> 0.10009486830958281 | AD181: =DEGREES(ACOS(SIN(RADIANS(R2C2))*SIN(RADIANS(RC[-10]))+COS(RADIANS(R2C2))*COS(RADIANS(RC[-10]))*COS(RADIANS(RC[-1])))) -> 46.824755069392587 | AE181: =90-RC[-1] -> 43.175244930607413 | AF181: =IF(RC[-1]>85,0,IF(RC[-1]>5,58.1/TAN(RADIANS(RC[-1]))-0.07/POWER(TAN(RADIANS(RC[-1])),3)+0.000086/POWER(TAN(RADIANS(RC[-1])),5),IF(RC[-1]>-0.575,1735+RC[-1]*(-518.2+RC[-1]*(103.4+RC[-1]*(-12.79+RC[-1]*0.711))),-20.772/TAN(RADIANS(RC[-1])))))/3600 -> 1.717754915955726E-2 | AG181: =RC[-2]+RC[-1] -> 43.192422479766968 | AH181: =IF(RC[-5]>0,MOD(DEGREES(ACOS(((SIN(RADIANS(R2C2))*COS(RADIANS(RC[-4])))-SIN(RADIANS(RC[-14])))/(COS(RADIANS(R2C2))*SIN(RADIANS(RC[-4])))))+180,360),MOD(540-DEGREES(ACOS(((SIN(RADIANS(R2C2))*COS(RADIANS(RC[-4])))-SIN(RADIANS(RC[-14])))/(COS(RADIANS(R2C2))*SIN(RADIANS(RC[-4]))))),360)) -> 180.12617888688962
D182: =R[-1]C+1 -> 2017-06-30T00:00:00.000 | E182: =R5C2 -> 1899-12-31T14:00:00.000 | F182: =RC[-2]+2415018.5+RC[-1]-R4C2/24 -> 2457935.375 | G182: =(RC[-1]-2451545)/36525 -> 0.17495893223819303 | I182: =MOD(280.46646+RC[-2]*(36000.76983 + RC[-2]*0.0003032),360) -> 99.122718490896659 | J182: =357.52911+RC[-3]*(35999.05029 - 0.0001537*RC[-3]) -> 6655.88450562256 | K182: =0.016708634-RC[-4]*(0.000042037+0.0000001267*RC[-4]) -> 1.6701275372998939E-2 | L182: =SIN(RADIANS(RC[-2]))*(1.914602-RC[-5]*(0.004817+0.000014*RC[-5]))+SIN(RADIANS(2*RC[-2]))*(0.019993-0.000101*RC[-5])+SIN(RADIANS(3*RC[-2]))*0.000289 -> 0.13454710918792265 | M182: =RC[-4]+RC[-1] -> 99.25726560008458 | N182: =RC[-4]+RC[-2] -> 6656.0190527317482 | O182: =(1.000001018*(1-RC[-4]*RC[-4]))/(1+RC[-4]*COS(RADIANS(RC[-1]))) -> 1.0166606461755072 | P182: =RC[-3]-0.00569-0.00478*SIN(RADIANS(125.04-1934.136*RC[-9])) -> 99.248947481092614 | Q182: =23+(26+((21.448-RC[-10]*(46.815+RC[-10]*(0.00059-RC[-10]*0.001813))))/60)/60 -> 23.437015913676863 | R182: =RC[-1]+0.00256*COS(RADIANS(125.04-1934.136*RC[-11])) -> 23.434877581506644 | S182: =DEGREES(ATAN2(COS(RADIANS(RC[-3])),COS(RADIANS(RC[-1]))*SIN(RADIANS(RC[-3])))) -> 100.06413899031416 | T182: =DEGREES(ASIN(SIN(RADIANS(RC[-2]))*SIN(RADIANS(RC[-4])))) -> 23.112390630496375 | U182: =TAN(RADIANS(RC[-3]/2))*TAN(RADIANS(RC[-3]/2)) -> 4.3017863513900412E-2 | V182: =4*DEGREES(RC[-1]*SIN(2*RADIANS(RC[-13]))-2*RC[-11]*SIN(RADIANS(RC[-12]))+4*RC[-11]*RC[-1]*SIN(RADIANS(RC[-12]))*COS(2*RADIANS(RC[-13]))-0.5*RC[-1]*RC[-1]*SIN(4*RADIANS(RC[-13]))-1.25*RC[-11]*RC[-11]*SIN(2*RADIANS(RC[-12]))) -> -3.7956856513007158 | W182: =DEGREES(ACOS(COS(RADIANS(90.833))/(COS(RADIANS(R2C2))*COS(RADIANS(RC[-3])))-TAN(RADIANS(R2C2))*TAN(RADIANS(RC[-3])))) -> #NUM! | X182: =(720-4*R3C2-RC[-2]+R4C2*60)/1440 -> 1899-12-31T13:59:47.741 | Y182: =(RC[-1]*1440-RC[-2]*4)/1440 -> #NUM! | Z182: =(RC[-2]*1440+RC[-3]*4)/1440 -> #NUM! | AA182: =8*RC[-4] -> #NUM! | AB182: =MOD(RC[-23]*1440+RC[-6]+4*R3C2-60*R4C2,1440) -> 720.20431434869931 | AC182: =IF(RC[-1]/4<0,RC[-1]/4+180,RC[-1]/4-180) -> 5.1078587174828272E-2 | AD182: =DEGREES(ACOS(SIN(RADIANS(R2C2))*SIN(RADIANS(RC[-10]))+COS(RADIANS(R2C2))*COS(RADIANS(RC[-10]))*COS(RADIANS(RC[-1])))) -> 46.887619180401252 | AE182: =90-RC[-1] -> 43.112380819598748 | AF182: =IF(RC[-1]>85,0,IF(RC[-1]>5,58.1/TAN(RADIANS(RC[-1]))-0.07/POWER(TAN(RADIANS(RC[-1])),3)+0.000086/POWER(TAN(RADIANS(RC[-1])),5),IF(RC[-1]>-0.575,1735+RC[-1]*(-518.2+RC[-1]*(103.4+RC[-1]*(-12.79+RC[-1]*0.711))),-20.772/TAN(RADIANS(RC[-1])))))/3600 -> 1.7215260211491886E-2 | AG182: =RC[-2]+RC[-1] -> 43.129596079810241 | AH182: =IF(RC[-5]>0,MOD(DEGREES(ACOS(((SIN(RADIANS(R2C2))*COS(RADIANS(RC[-4])))-SIN(RADIANS(RC[-14])))/(COS(RADIANS(R2C2))*SIN(RADIANS(RC[-4])))))+180,360),MOD(540-DEGREES(ACOS(((SIN(RADIANS(R2C2))*COS(RADIANS(RC[-4])))-SIN(RADIANS(RC[-14])))/(COS(RADIANS(R2C2))*SIN(RADIANS(RC[-4]))))),360)) -> 180.06435330254305
D183: =R[-1]C+1 -> 2017-07-01T00:00:00.000 | E183: =R5C2 -> 1899-12-31T14:00:00.000 | F183: =RC[-2]+2415018.5+RC[-1]-R4C2/24 -> 2457936.375 | G183: =(RC[-1]-2451545)/36525 -> 0.17498631074606433 | I183: =MOD(280.46646+RC[-2]*(36000.76983 + RC[-2]*0.0003032),360) -> 100.10836585396373 | J183: =357.52911+RC[-3]*(35999.05029 - 0.0001537*RC[-3]) -> 6656.8701059028117 | K183: =0.016708634-RC[-4]*(0.000042037+0.0000001267*RC[-4]) -> 1.6701274220874696E-2 | L183: =SIN(RADIANS(RC[-2]))*(1.914602-RC[-5]*(0.004817+0.000014*RC[-5]))+SIN(RADIANS(2*RC[-2]))*(0.019993-0.000101*RC[-5])+SIN(RADIANS(3*RC[-2]))*0.000289 -> 0.10235993221894611 | M183: =RC[-4]+RC[-1] -> 100.21072578618268 | N183: =RC[-4]+RC[-2] -> 6656.9724658350306 | O183: =(1.000001018*(1-RC[-4]*RC[-4]))/(1+RC[-4]*COS(RADIANS(RC[-1]))) -> 1.0166782074250227 | P183: =RC[-3]-0.00569-0.00478*SIN(RADIANS(125.04-1934.136*RC[-9])) -> 100.20240397822118 | Q183: =23+(26+((21.448-RC[-10]*(46.815+RC[-10]*(0.00059-RC[-10]*0.001813))))/60)/60 -> 23.437015557641878 | R183: =RC[-1]+0.00256*COS(RADIANS(125.04-1934.136*RC[-11])) -> 23.434878527246784 | S183: =DEGREES(ATAN2(COS(RADIANS(RC[-3])),COS(RADIANS(RC[-1]))*SIN(RADIANS(RC[-3])))) -> 101.09776795785035 | T183: =DEGREES(ASIN(SIN(RADIANS(RC[-2]))*SIN(RADIANS(RC[-4])))) -> 23.042762244819023 | U183: =TAN(RADIANS(RC[-3]/2))*TAN(RADIANS(RC[-3]/2)) -> 4.3017867084699075E-2 | V183: =4*DEGREES(RC[-1]*SIN(2*RADIANS(RC[-13]))-2*RC[-11]*SIN(RADIANS(RC[-12]))+4*RC[-11]*RC[-1]*SIN(RADIANS(RC[-12]))*COS(2*RADIANS(RC[-13]))-0.5*RC[-1]*RC[-1]*SIN(4*RADIANS(RC[-13]))-1.25*RC[-11]*RC[-11]*SIN(2*RADIANS(RC[-12]))) -> -3.9875283907789578 | W183: =DEGREES(ACOS(COS(RADIANS(90.833))/(COS(RADIANS(R2C2))*COS(RADIANS(RC[-3])))-TAN(RADIANS(R2C2))*TAN(RADIANS(RC[-3])))) -> #NUM! | X183: =(720-4*R3C2-RC[-2]+R4C2*60)/1440 -> 1899-12-31T13:59:59.252 | Y183: =(RC[-1]*1440-RC[-2]*4)/1440 -> #NUM! | Z183: =(RC[-2]*1440+RC[-3]*4)/1440 -> #NUM! | AA183: =8*RC[-4] -> #NUM! | AB183: =MOD(RC[-23]*1440+RC[-6]+4*R3C2-60*R4C2,1440) -> 720.01247160922105 | AC183: =IF(RC[-1]/4<0,RC[-1]/4+180,RC[-1]/4-180) -> 3.1179023052629873E-3 | AD183: =DEGREES(ACOS(SIN(RADIANS(R2C2))*SIN(RADIANS(RC[-10]))+COS(RADIANS(R2C2))*COS(RADIANS(RC[-10]))*COS(RADIANS(RC[-1])))) -> 46.957237791714142 | AE183: =90-RC[-1] -> 43.042762208285858 | AF183: =IF(RC[-1]>85,0,IF(RC[-1]>5,58.1/TAN(RADIANS(RC[-1]))-0.07/POWER(TAN(RADIANS(RC[-1])),3)+0.000086/POWER(TAN(RADIANS(RC[-1])),5),IF(RC[-1]>-0.575,1735+RC[-1]*(-518.2+RC[-1]*(103.4+RC[-1]*(-12.79+RC[-1]*0.711))),-20.772/TAN(RADIANS(RC[-1])))))/3600 -> 1.7257125653784025E-2 | AG183: =RC[-2]+RC[-1] -> 43.060019333939643 | AH183: =IF(RC[-5]>0,MOD(DEGREES(ACOS(((SIN(RADIANS(R2C2))*COS(RADIANS(RC[-4])))-SIN(RADIANS(RC[-14])))/(COS(RADIANS(R2C2))*SIN(RADIANS(RC[-4])))))+180,360),MOD(540-DEGREES(ACOS(((SIN(RADIANS(R2C2))*COS(RADIANS(RC[-4])))-SIN(RADIANS(RC[-14])))/(COS(RADIANS(R2C2))*SIN(RADIANS(RC[-4]))))),360)) -> 180.00392577925305
D184: =R[-1]C+1 -> 2017-07-02T00:00:00.000 | E184: =R5C2 -> 1899-12-31T14:00:00.000 | F184: =RC[-2]+2415018.5+RC[-1]-R4C2/24 -> 2457937.375 | G184: =(RC[-1]-2451545)/36525 -> 0.17501368925393565 | I184: =MOD(280.46646+RC[-2]*(36000.76983 + RC[-2]*0.0003032),360) -> 101.09401321703353 | J184: =357.52911+RC[-3]*(35999.05029 - 0.0001537*RC[-3]) -> 6657.8557061830643 | K184: =0.016708634-RC[-4]*(0.000042037+0.0000001267*RC[-4]) -> 1.6701273068750258E-2 | L184: =SIN(RADIANS(RC[-2]))*(1.914602-RC[-5]*(0.004817+0.000014*RC[-5]))+SIN(RADIANS(2*RC[-2]))*(0.019993-0.000101*RC[-5])+SIN(RADIANS(3*RC[-2]))*0.000289 -> 7.0144292916232129E-2 | M184: =RC[-4]+RC[-1] -> 101.16415750994976 | N184: =RC[-4]+RC[-2] -> 6657.925850475981 | O184: =(1.000001018*(1-RC[-4]*RC[-4]))/(1+RC[-4]*COS(RADIANS(RC[-1]))) -> 1.0166909942182212 | P184: =RC[-3]-0.00569-0.00478*SIN(RADIANS(125.04-1934.136*RC[-9])) -> 101.15583201526675 | Q184: =23+(26+((21.448-RC[-10]*(46.815+RC[-10]*(0.00059-RC[-10]*0.001813))))/60)/60 -> 23.437015201606897 | R184: =RC[-1]+0.00256*COS(RADIANS(125.04-1934.136*RC[-11])) -> 23.434879474812334 | S184: =DEGREES(ATAN2(COS(RADIANS(RC[-3])),COS(RADIANS(RC[-1]))*SIN(RADIANS(RC[-3])))) -> 102.13024671776716 | T184: =DEGREES(ASIN(SIN(RADIANS(RC[-2]))*SIN(RADIANS(RC[-4])))) -> 22.966427132478682 | U184: =TAN(RADIANS(RC[-3]/2))*TAN(RADIANS(RC[-3]/2)) -> 4.3017870662390052E-2 | V184: =4*DEGREES(RC[-1]*SIN(2*RADIANS(RC[-13]))-2*RC[-11]*SIN(RADIANS(RC[-12]))+4*RC[-11]*RC[-1]*SIN(RADIANS(RC[-12]))*COS(2*RADIANS(RC[-13]))-0.5*RC[-1]*RC[-1]*SIN(4*RADIANS(RC[-13]))-1.25*RC[-11]*RC[-11]*SIN(2*RADIANS(RC[-12]))) -> -4.1747933031535913 | W184: =DEGREES(ACOS(COS(RADIANS(90.833))/(COS(RADIANS(R2C2))*COS(RADIANS(RC[-3])))-TAN(RADIANS(R2C2))*TAN(RADIANS(RC[-3])))) -> #NUM! | X184: =(720-4*R3C2-RC[-2]+R4C2*60)/1440 -> 1899-12-31T14:00:10.488 | Y184: =(RC[-1]*1440-RC[-2]*4)/1440 -> #NUM! | Z184: =(RC[-2]*1440+RC[-3]*4)/1440 -> #NUM! | AA184: =8*RC[-4] -> #NUM! | AB184: =MOD(RC[-23]*1440+RC[-6]+4*R3C2-60*R4C2,1440) -> 719.82520669684641 | AC184: =IF(RC[-1]/4<0,RC[-1]/4+180,RC[-1]/4-180) -> -4.3698325788398051E-2 | AD184: =DEGREES(ACOS(SIN(RADIANS(R2C2))*SIN(RADIANS(RC[-10]))+COS(RADIANS(R2C2))*COS(RADIANS(RC[-10]))*COS(RADIANS(RC[-1])))) -> 47.033580038822976 | AE184: =90-RC[-1] -> 42.966419961177024 | AF184: =IF(RC[-1]>85,0,IF(RC[-1]>5,58.1/TAN(RADIANS(RC[-1]))-0.07/POWER(TAN(RADIANS(RC[-1])),3)+0.000086/POWER(TAN(RADIANS(RC[-1])),5),IF(RC[-1]>-0.575,1735+RC[-1]*(-518.2+RC[-1]*(103.4+RC[-1]*(-12.79+RC[-1]*0.711))),-20.772/TAN(RADIANS(RC[-1])))))/3600 -> 1.7303158820742726E-2 | AG184: =RC[-2]+RC[-1] -> 42.983723119997769 | AH184: =IF(RC[-5]>0,MOD(DEGREES(ACOS(((SIN(RADIANS(R2C2))*COS(RADIANS(RC[-4])))-SIN(RADIANS(RC[-14])))/(COS(RADIANS(R2C2))*SIN(RADIANS(RC[-4])))))+180,360),MOD(540-DEGREES(ACOS(((SIN(RADIANS(R2C2))*COS(RADIANS(RC[-4])))-SIN(RADIANS(RC[-14])))/(COS(RADIANS(R2C2))*SIN(RADIANS(RC[-4]))))),360)) -> 179.94501627521367
D185: =R[-1]C+1 -> 2017-07-03T00:00:00.000 | E185: =R5C2 -> 1899-12-31T14:00:00.000 | F185: =RC[-2]+2415018.5+RC[-1]-R4C2/24 -> 2457938.375 | G185: =(RC[-1]-2451545)/36525 -> 0.17504106776180697 | I185: =MOD(280.46646+RC[-2]*(36000.76983 + RC[-2]*0.0003032),360) -> 102.07966058010334 | J185: =357.52911+RC[-3]*(35999.05029 - 0.0001537*RC[-3]) -> 6658.841306463315 | K185: =0.016708634-RC[-4]*(0.000042037+0.0000001267*RC[-4]) -> 1.6701271916625633E-2 | L185: =SIN(RADIANS(RC[-2]))*(1.914602-RC[-5]*(0.004817+0.000014*RC[-5]))+SIN(RADIANS(2*RC[-2]))*(0.019993-0.000101*RC[-5])+SIN(RADIANS(3*RC[-2]))*0.000289 -> 3.7909151480505852E-2 | M185: =RC[-4]+RC[-1] -> 102.11756973158384 | N185: =RC[-4]+RC[-2] -> 6658.8792156147956 | O185: =(1.000001018*(1-RC[-4]*RC[-4]))/(1+RC[-4]*COS(RADIANS(RC[-1]))) -> 1.0166990031356151 | P185: =RC[-3]-0.00569-0.00478*SIN(RADIANS(125.04-1934.136*RC[-9])) -> 102.10924055243052 | Q185: =23+(26+((21.448-RC[-10]*(46.815+RC[-10]*(0.00059-RC[-10]*0.001813))))/60)/60 -> 23.437014845571913 | R185: =RC[-1]+0.00256*COS(RADIANS(125.04-1934.136*RC[-11])) -> 23.434880424202166 | S185: =DEGREES(ATAN2(COS(RADIANS(RC[-3])),COS(RADIANS(RC[-1]))*SIN(RADIANS(RC[-3])))) -> 103.16148830728316 | T185: =DEGREES(ASIN(SIN(RADIANS(RC[-2]))*SIN(RADIANS(RC[-4])))) -> 22.883417436243214 | U185: =TAN(RADIANS(RC[-3]/2))*TAN(RADIANS(RC[-3]/2)) -> 4.3017874246969068E-2 | V185: =4*DEGREES(RC[-1]*SIN(2*RADIANS(RC[-13]))-2*RC[-11]*SIN(RADIANS(RC[-12]))+4*RC[-11]*RC[-1]*SIN(RADIANS(RC[-12]))*COS(2*RADIANS(RC[-13]))-0.5*RC[-1]*RC[-1]*SIN(4*RADIANS(RC[-13]))-1.25*RC[-11]*RC[-11]*SIN(2*RADIANS(RC[-12]))) -> -4.3571321501180291 | W185: =DEGREES(ACOS(COS(RADIANS(90.833))/(COS(RADIANS(R2C2))*COS(RADIANS(RC[-3])))-TAN(RADIANS(R2C2))*TAN(RADIANS(RC[-3])))) -> #NUM! | X185: =(720-4*R3C2-RC[-2]+R4C2*60)/1440 -> 1899-12-31T14:00:21.428 | Y185: =(RC[-1]*1440-RC[-2]*4)/1440 -> #NUM! | Z185: =(RC[-2]*1440+RC[-3]*4)/1440 -> #NUM! | AA185: =8*RC[-4] -> #NUM! | AB185: =MOD(RC[-23]*1440+RC[-6]+4*R3C2-60*R4C2,1440) -> 719.64286784988201 | AC185: =IF(RC[-1]/4<0,RC[-1]/4+180,RC[-1]/4-180) -> -8.9283037529497733E-2 | AD185: =DEGREES(ACOS(SIN(RADIANS(R2C2))*SIN(RADIANS(RC[-10]))+COS(RADIANS(R2C2))*COS(RADIANS(RC[-10]))*COS(RADIANS(RC[-1])))) -> 47.116612478623317 | AE185: =90-RC[-1] -> 42.883387521376683 | AF185: =IF(RC[-1]>85,0,IF(RC[-1]>5,58.1/TAN(RADIANS(RC[-1]))-0.07/POWER(TAN(RADIANS(RC[-1])),3)+0.000086/POWER(TAN(RADIANS(RC[-1])),5),IF(RC[-1]>-0.575,1735+RC[-1]*(-518.2+RC[-1]*(103.4+RC[-1]*(-12.79+RC[-1]*0.711))),-20.772/TAN(RADIANS(RC[-1])))))/3600 -> 1.7353374662047682E-2 | AG185: =RC[-2]+RC[-1] -> 42.900740896038734 | AH185: =IF(RC[-5]>0,MOD(DEGREES(ACOS(((SIN(RADIANS(R2C2))*COS(RADIANS(RC[-4])))-SIN(RADIANS(RC[-14])))/(COS(RADIANS(R2C2))*SIN(RADIANS(RC[-4])))))+180,360),MOD(540-DEGREES(ACOS(((SIN(RADIANS(R2C2))*COS(RADIANS(RC[-4])))-SIN(RADIANS(RC[-14])))/(COS(RADIANS(R2C2))*SIN(RADIANS(RC[-4]))))),360)) -> 179.88774152437566
D186: =R[-1]C+1 -> 2017-07-04T00:00:00.000 | E186: =R5C2 -> 1899-12-31T14:00:00.000 | F186: =RC[-2]+2415018.5+RC[-1]-R4C2/24 -> 2457939.375 | G186: =(RC[-1]-2451545)/36525 -> 0.1750684462696783 | I186: =MOD(280.46646+RC[-2]*(36000.76983 + RC[-2]*0.0003032),360) -> 103.06530794317405 | J186: =357.52911+RC[-3]*(35999.05029 - 0.0001537*RC[-3]) -> 6659.8269067435667 | K186: =0.016708634-RC[-4]*(0.000042037+0.0000001267*RC[-4]) -> 1.6701270764500818E-2 | L186: =SIN(RADIANS(RC[-2]))*(1.914602-RC[-5]*(0.004817+0.000014*RC[-5]))+SIN(RADIANS(2*RC[-2]))*(0.019993-0.000101*RC[-5])+SIN(RADIANS(3*RC[-2]))*0.000289 -> 5.6634725168337677E-3 | M186: =RC[-4]+RC[-1] -> 103.07097141569088 | N186: =RC[-4]+RC[-2] -> 6659.8325702160837 | O186: =(1.000001018*(1-RC[-4]*RC[-4]))/(1+RC[-4]*COS(RADIANS(RC[-1]))) -> 1.0167022320358095 | P186: =RC[-3]-0.00569-0.00478*SIN(RADIANS(125.04-1934.136*RC[-9])) -> 103.06263855432157 | Q186: =23+(26+((21.448-RC[-10]*(46.815+RC[-10]*(0.00059-RC[-10]*0.001813))))/60)/60 -> 23.437014489536931 | R186: =RC[-1]+0.00256*COS(RADIANS(125.04-1934.136*RC[-11])) -> 23.434881375415181 | S186: =DEGREES(ATAN2(COS(RADIANS(RC[-3])),COS(RADIANS(RC[-1]))*SIN(RADIANS(RC[-3])))) -> 104.19140776792302 | T186: =DEGREES(ASIN(SIN(RADIANS(RC[-2]))*SIN(RADIANS(RC[-4])))) -> 22.79376773660718 | U186: =TAN(RADIANS(RC[-3]/2))*TAN(RADIANS(RC[-3]/2)) -> 4.3017877838431966E-2 | V186: =4*DEGREES(RC[-1]*SIN(2*RADIANS(RC[-13]))-2*RC[-11]*SIN(RADIANS(RC[-12]))+4*RC[-11]*RC[-1]*SIN(RADIANS(RC[-12]))*COS(2*RADIANS(RC[-13]))-0.5*RC[-1]*RC[-1]*SIN(4*RADIANS(RC[-13]))-1.25*RC[-11]*RC[-11]*SIN(2*RADIANS(RC[-12]))) -> -4.5342044600155518 | W186: =DEGREES(ACOS(COS(RADIANS(90.833))/(COS(RADIANS(R2C2))*COS(RADIANS(RC[-3])))-TAN(RADIANS(R2C2))*TAN(RADIANS(RC[-3])))) -> #NUM! | X186: =(720-4*R3C2-RC[-2]+R4C2*60)/1440 -> 1899-12-31T14:00:32.052 | Y186: =(RC[-1]*1440-RC[-2]*4)/1440 -> #NUM! | Z186: =(RC[-2]*1440+RC[-3]*4)/1440 -> #NUM! | AA186: =8*RC[-4] -> #NUM! | AB186: =MOD(RC[-23]*1440+RC[-6]+4*R3C2-60*R4C2,1440) -> 719.46579553998447 | AC186: =IF(RC[-1]/4<0,RC[-1]/4+180,RC[-1]/4-180) -> -0.13355111500388261 | AD186: =DEGREES(ACOS(SIN(RADIANS(R2C2))*SIN(RADIANS(RC[-10]))+COS(RADIANS(R2C2))*COS(RADIANS(RC[-10]))*COS(RADIANS(RC[-1])))) -> 47.206299143973688 | AE186: =90-RC[-1] -> 42.793700856026312 | AF186: =IF(RC[-1]>85,0,IF(RC[-1]>5,58.1/TAN(RADIANS(RC[-1]))-0.07/POWER(TAN(RADIANS(RC[-1])),3)+0.000086/POWER(TAN(RADIANS(RC[-1])),5),IF(RC[-1]>-0.575,1735+RC[-1]*(-518.2+RC[-1]*(103.4+RC[-1]*(-12.79+RC[-1]*0.711))),-20.772/TAN(RADIANS(RC[-1])))))/3600 -> 1.7407789787756204E-2 | AG186: =RC[-2]+RC[-1] -> 42.811108645814066 | AH186: =IF(RC[-5]>0,MOD(DEGREES(ACOS(((SIN(RADIANS(R2C2))*COS(RADIANS(RC[-4])))-SIN(RADIANS(RC[-14])))/(COS(RADIANS(R2C2))*SIN(RADIANS(RC[-4])))))+180,360),MOD(540-DEGREES(ACOS(((SIN(RADIANS(R2C2))*COS(RADIANS(RC[-4])))-SIN(RADIANS(RC[-14])))/(COS(RADIANS(R2C2))*SIN(RADIANS(RC[-4]))))),360)) -> 179.83221479958024
D187: =R[-1]C+1 -> 2017-07-05T00:00:00.000 | E187: =R5C2 -> 1899-12-31T14:00:00.000 | F187: =RC[-2]+2415018.5+RC[-1]-R4C2/24 -> 2457940.375 | G187: =(RC[-1]-2451545)/36525 -> 0.17509582477754962 | I187: =MOD(280.46646+RC[-2]*(36000.76983 + RC[-2]*0.0003032),360) -> 104.05095530624567 | J187: =357.52911+RC[-3]*(35999.05029 - 0.0001537*RC[-3]) -> 6660.8125070238193 | K187: =0.016708634-RC[-4]*(0.000042037+0.0000001267*RC[-4]) -> 1.6701269612375814E-2 | L187: =SIN(RADIANS(RC[-2]))*(1.914602-RC[-5]*(0.004817+0.000014*RC[-5]))+SIN(RADIANS(2*RC[-2]))*(0.019993-0.000101*RC[-5])+SIN(RADIANS(3*RC[-2]))*0.000289 -> -2.6583776990604553E-2 | M187: =RC[-4]+RC[-1] -> 104.02437152925506 | N187: =RC[-4]+RC[-2] -> 6660.785923246829 | O187: =(1.000001018*(1-RC[-4]*RC[-4]))/(1+RC[-4]*COS(RADIANS(RC[-1]))) -> 1.0167006800558891 | P187: =RC[-3]-0.00569-0.00478*SIN(RADIANS(125.04-1934.136*RC[-9])) -> 104.01603498792724 | Q187: =23+(26+((21.448-RC[-10]*(46.815+RC[-10]*(0.00059-RC[-10]*0.001813))))/60)/60 -> 23.437014133501947 | R187: =RC[-1]+0.00256*COS(RADIANS(125.04-1934.136*RC[-11])) -> 23.434882328450247 | S187: =DEGREES(ATAN2(COS(RADIANS(RC[-3])),COS(RADIANS(RC[-1]))*SIN(RADIANS(RC[-3])))) -> 105.2199222790772 | T187: =DEGREES(ASIN(SIN(RADIANS(RC[-2]))*SIN(RADIANS(RC[-4])))) -> 22.697515006824673 | U187: =TAN(RADIANS(RC[-3]/2))*TAN(RADIANS(RC[-3]/2)) -> 4.3017881436774486E-2 | V187: =4*DEGREES(RC[-1]*SIN(2*RADIANS(RC[-13]))-2*RC[-11]*SIN(RADIANS(RC[-12]))+4*RC[-11]*RC[-1]*SIN(RADIANS(RC[-12]))*COS(2*RADIANS(RC[-13]))-0.5*RC[-1]*RC[-1]*SIN(4*RADIANS(RC[-13]))-1.25*RC[-11]*RC[-11]*SIN(2*RADIANS(RC[-12]))) -> -4.7056780709825947 | W187: =DEGREES(ACOS(COS(RADIANS(90.833))/(COS(RADIANS(R2C2))*COS(RADIANS(RC[-3])))-TAN(RADIANS(R2C2))*TAN(RADIANS(RC[-3])))) -> #NUM! | X187: =(720-4*R3C2-RC[-2]+R4C2*60)/1440 -> 1899-12-31T14:00:42.341 | Y187: =(RC[-1]*1440-RC[-2]*4)/1440 -> #NUM! | Z187: =(RC[-2]*1440+RC[-3]*4)/1440 -> #NUM! | AA187: =8*RC[-4] -> #NUM! | AB187: =MOD(RC[-23]*1440+RC[-6]+4*R3C2-60*R4C2,1440) -> 719.29432192901743 | AC187: =IF(RC[-1]/4<0,RC[-1]/4+180,RC[-1]/4-180) -> -0.17641951774564291 | AD187: =DEGREES(ACOS(SIN(RADIANS(R2C2))*SIN(RADIANS(RC[-10]))+COS(RADIANS(R2C2))*COS(RADIANS(RC[-10]))*COS(RADIANS(RC[-1])))) -> 47.302601601484689 | AE187: =90-RC[-1] -> 42.697398398515311 | AF187: =IF(RC[-1]>85,0,IF(RC[-1]>5,58.1/TAN(RADIANS(RC[-1]))-0.07/POWER(TAN(RADIANS(RC[-1])),3)+0.000086/POWER(TAN(RADIANS(RC[-1])),5),IF(RC[-1]>-0.575,1735+RC[-1]*(-518.2+RC[-1]*(103.4+RC[-1]*(-12.79+RC[-1]*0.711))),-20.772/TAN(RADIANS(RC[-1])))))/3600 -> 1.746642251741096E-2 | AG187: =RC[-2]+RC[-1] -> 42.71486482103272 | AH187: =IF(RC[-5]>0,MOD(DEGREES(ACOS(((SIN(RADIANS(R2C2))*COS(RADIANS(RC[-4])))-SIN(RADIANS(RC[-14])))/(COS(RADIANS(R2C2))*SIN(RADIANS(RC[-4])))))+180,360),MOD(540-DEGREES(ACOS(((SIN(RADIANS(R2C2))*COS(RADIANS(RC[-4])))-SIN(RADIANS(RC[-14])))/(COS(RADIANS(R2C2))*SIN(RADIANS(RC[-4]))))),360)) -> 179.77854568741361
D188: =R[-1]C+1 -> 2017-07-06T00:00:00.000 | E188: =R5C2 -> 1899-12-31T14:00:00.000 | F188: =RC[-2]+2415018.5+RC[-1]-R4C2/24 -> 2457941.375 | G188: =(RC[-1]-2451545)/36525 -> 0.17512320328542094 | I188: =MOD(280.46646+RC[-2]*(36000.76983 + RC[-2]*0.0003032),360) -> 105.03660266931729 | J188: =357.52911+RC[-3]*(35999.05029 - 0.0001537*RC[-3]) -> 6661.7981073040692 | K188: =0.016708634-RC[-4]*(0.000042037+0.0000001267*RC[-4]) -> 1.6701268460250617E-2 | L188: =SIN(RADIANS(RC[-2]))*(1.914602-RC[-5]*(0.004817+0.000014*RC[-5]))+SIN(RADIANS(2*RC[-2]))*(0.019993-0.000101*RC[-5])+SIN(RADIANS(3*RC[-2]))*0.000289 -> -5.882362970395074E-2 | M188: =RC[-4]+RC[-1] -> 104.97777903961334 | N188: =RC[-4]+RC[-2] -> 6661.7392836743657 | O188: =(1.000001018*(1-RC[-4]*RC[-4]))/(1+RC[-4]*COS(RADIANS(RC[-1]))) -> 1.0166943476115753 | P188: =RC[-3]-0.00569-0.00478*SIN(RADIANS(125.04-1934.136*RC[-9])) -> 104.96943882058761 | Q188: =23+(26+((21.448-RC[-10]*(46.815+RC[-10]*(0.00059-RC[-10]*0.001813))))/60)/60 -> 23.437013777466966 | R188: =RC[-1]+0.00256*COS(RADIANS(125.04-1934.136*RC[-11])) -> 23.434883283306259 | S188: =DEGREES(ATAN2(COS(RADIANS(RC[-3])),COS(RADIANS(RC[-1]))*SIN(RADIANS(RC[-3])))) -> 106.24695128540927 | T188: =DEGREES(ASIN(SIN(RADIANS(RC[-2]))*SIN(RADIANS(RC[-4])))) -> 22.594698565462512 | U188: =TAN(RADIANS(RC[-3]/2))*TAN(RADIANS(RC[-3]/2)) -> 4.3017885041992471E-2 | V188: =4*DEGREES(RC[-1]*SIN(2*RADIANS(RC[-13]))-2*RC[-11]*SIN(RADIANS(RC[-12]))+4*RC[-11]*RC[-1]*SIN(RADIANS(RC[-12]))*COS(2*RADIANS(RC[-13]))-0.5*RC[-1]*RC[-1]*SIN(4*RADIANS(RC[-13]))-1.25*RC[-11]*RC[-11]*SIN(2*RADIANS(RC[-12]))) -> -4.8712296530361385 | W188: =DEGREES(ACOS(COS(RADIANS(90.833))/(COS(RADIANS(R2C2))*COS(RADIANS(RC[-3])))-TAN(RADIANS(R2C2))*TAN(RADIANS(RC[-3])))) -> #NUM! | X188: =(720-4*R3C2-RC[-2]+R4C2*60)/1440 -> 1899-12-31T14:00:52.274 | Y188: =(RC[-1]*1440-RC[-2]*4)/1440 -> #NUM! | Z188: =(RC[-2]*1440+RC[-3]*4)/1440 -> #NUM! | AA188: =8*RC[-4] -> #NUM! | AB188: =MOD(RC[-23]*1440+RC[-6]+4*R3C2-60*R4C2,1440) -> 719.12877034696385 | AC188: =IF(RC[-1]/4<0,RC[-1]/4+180,RC[-1]/4-180) -> -0.21780741325903819 | AD188: =DEGREES(ACOS(SIN(RADIANS(R2C2))*SIN(RADIANS(RC[-10]))+COS(RADIANS(R2C2))*COS(RADIANS(RC[-10]))*COS(RADIANS(RC[-1])))) -> 47.405479012271307 | AE188: =90-RC[-1] -> 42.594520987728693 | AF188: =IF(RC[-1]>85,0,IF(RC[-1]>5,58.1/TAN(RADIANS(RC[-1]))-0.07/POWER(TAN(RADIANS(RC[-1])),3)+0.000086/POWER(TAN(RADIANS(RC[-1])),5),IF(RC[-1]>-0.575,1735+RC[-1]*(-518.2+RC[-1]*(103.4+RC[-1]*(-12.79+RC[-1]*0.711))),-20.772/TAN(RADIANS(RC[-1])))))/3600 -> 1.7529292933267077E-2 | AG188: =RC[-2]+RC[-1] -> 42.612050280661961 | AH188: =IF(RC[-5]>0,MOD(DEGREES(ACOS(((SIN(RADIANS(R2C2))*COS(RADIANS(RC[-4])))-SIN(RADIANS(RC[-14])))/(COS(RADIANS(R2C2))*SIN(RADIANS(RC[-4])))))+180,360),MOD(540-DEGREES(ACOS(((SIN(RADIANS(R2C2))*COS(RADIANS(RC[-4])))-SIN(RADIANS(RC[-14])))/(COS(RADIANS(R2C2))*SIN(RADIANS(RC[-4]))))),360)) -> 179.72683987735616
D189: =R[-1]C+1 -> 2017-07-07T00:00:00.000 | E189: =R5C2 -> 1899-12-31T14:00:00.000 | F189: =RC[-2]+2415018.5+RC[-1]-R4C2/24 -> 2457942.375 | G189: =(RC[-1]-2451545)/36525 -> 0.17515058179329226 | I189: =MOD(280.46646+RC[-2]*(36000.76983 + RC[-2]*0.0003032),360) -> 106.02225003238982 | J189: =357.52911+RC[-3]*(35999.05029 - 0.0001537*RC[-3]) -> 6662.7837075843208 | K189: =0.016708634-RC[-4]*(0.000042037+0.0000001267*RC[-4]) -> 1.6701267308125232E-2 | L189: =SIN(RADIANS(RC[-2]))*(1.914602-RC[-5]*(0.004817+0.000014*RC[-5]))+SIN(RADIANS(2*RC[-2]))*(0.019993-0.000101*RC[-5])+SIN(RADIANS(3*RC[-2]))*0.000289 -> -9.1047119957740508E-2 | M189: =RC[-4]+RC[-1] -> 105.93120291243208 | N189: =RC[-4]+RC[-2] -> 6662.6926604643631 | O189: =(1.000001018*(1-RC[-4]*RC[-4]))/(1+RC[-4]*COS(RADIANS(RC[-1]))) -> 1.0166832363971499 | P189: =RC[-3]-0.00569-0.00478*SIN(RADIANS(125.04-1934.136*RC[-9])) -> 105.92285901797221 | Q189: =23+(26+((21.448-RC[-10]*(46.815+RC[-10]*(0.00059-RC[-10]*0.001813))))/60)/60 -> 23.437013421431985 | R189: =RC[-1]+0.00256*COS(RADIANS(125.04-1934.136*RC[-11])) -> 23.434884239982093 | S189: =DEGREES(ATAN2(COS(RADIANS(RC[-3])),COS(RADIANS(RC[-1]))*SIN(RADIANS(RC[-3])))) -> 107.2724166178365 | T189: =DEGREES(ASIN(SIN(RADIANS(RC[-2]))*SIN(RADIANS(RC[-4])))) -> 22.485360026641004 | U189: =TAN(RADIANS(RC[-3]/2))*TAN(RADIANS(RC[-3]/2)) -> 4.3017888654081647E-2 | V189: =4*DEGREES(RC[-1]*SIN(2*RADIANS(RC[-13]))-2*RC[-11]*SIN(RADIANS(RC[-12]))+4*RC[-11]*RC[-1]*SIN(RADIANS(RC[-12]))*COS(2*RADIANS(RC[-13]))-0.5*RC[-1]*RC[-1]*SIN(4*RADIANS(RC[-13]))-1.25*RC[-11]*RC[-11]*SIN(2*RADIANS(RC[-12]))) -> -5.0305452078960302 | W189: =DEGREES(ACOS(COS(RADIANS(90.833))/(COS(RADIANS(R2C2))*COS(RADIANS(RC[-3])))-TAN(RADIANS(R2C2))*TAN(RADIANS(RC[-3])))) -> #NUM! | X189: =(720-4*R3C2-RC[-2]+R4C2*60)/1440 -> 1899-12-31T14:01:01.833 | Y189: =(RC[-1]*1440-RC[-2]*4)/1440 -> #NUM! | Z189: =(RC[-2]*1440+RC[-3]*4)/1440 -> #NUM! | AA189: =8*RC[-4] -> #NUM! | AB189: =MOD(RC[-23]*1440+RC[-6]+4*R3C2-60*R4C2,1440) -> 718.96945479210399 | AC189: =IF(RC[-1]/4<0,RC[-1]/4+180,RC[-1]/4-180) -> -0.25763630197400289 | AD189: =DEGREES(ACOS(SIN(RADIANS(R2C2))*SIN(RADIANS(RC[-10]))+COS(RADIANS(R2C2))*COS(RADIANS(RC[-10]))*COS(RADIANS(RC[-1])))) -> 47.514888195392054 | AE189: =90-RC[-1] -> 42.485111804607946 | AF189: =IF(RC[-1]>85,0,IF(RC[-1]>5,58.1/TAN(RADIANS(RC[-1]))-0.07/POWER(TAN(RADIANS(RC[-1])),3)+0.000086/POWER(TAN(RADIANS(RC[-1])),5),IF(RC[-1]>-0.575,1735+RC[-1]*(-518.2+RC[-1]*(103.4+RC[-1]*(-12.79+RC[-1]*0.711))),-20.772/TAN(RADIANS(RC[-1])))))/3600 -> 1.7596422937664304E-2 | AG189: =RC[-2]+RC[-1] -> 42.502708227545611 | AH189: =IF(RC[-5]>0,MOD(DEGREES(ACOS(((SIN(RADIANS(R2C2))*COS(RADIANS(RC[-4])))-SIN(RADIANS(RC[-14])))/(COS(RADIANS(R2C2))*SIN(RADIANS(RC[-4])))))+180,360),MOD(540-DEGREES(ACOS(((SIN(RADIANS(R2C2))*COS(RADIANS(RC[-4])))-SIN(RADIANS(RC[-14])))/(COS(RADIANS(R2C2))*SIN(RADIANS(RC[-4]))))),360)) -> 179.67719896453116
D190: =R[-1]C+1 -> 2017-07-08T00:00:00.000 | E190: =R5C2 -> 1899-12-31T14:00:00.000 | F190: =RC[-2]+2415018.5+RC[-1]-R4C2/24 -> 2457943.375 | G190: =(RC[-1]-2451545)/36525 -> 0.17517796030116359 | I190: =MOD(280.46646+RC[-2]*(36000.76983 + RC[-2]*0.0003032),360) -> 107.00789739546235 | J190: =357.52911+RC[-3]*(35999.05029 - 0.0001537*RC[-3]) -> 6663.7693078645707 | K190: =0.016708634-RC[-4]*(0.000042037+0.0000001267*RC[-4]) -> 1.6701266155999657E-2 | L190: =SIN(RADIANS(RC[-2]))*(1.914602-RC[-5]*(0.004817+0.000014*RC[-5]))+SIN(RADIANS(2*RC[-2]))*(0.019993-0.000101*RC[-5])+SIN(RADIANS(3*RC[-2]))*0.000289 -> -0.12324528578375483 | M190: =RC[-4]+RC[-1] -> 106.8846521096786 | N190: =RC[-4]+RC[-2] -> 6663.6460625787868 | O190: =(1.000001018*(1-RC[-4]*RC[-4]))/(1+RC[-4]*COS(RADIANS(RC[-1]))) -> 1.0166673493851479 | P190: =RC[-3]-0.00569-0.00478*SIN(RADIANS(125.04-1934.136*RC[-9])) -> 106.87630454205149 | Q190: =23+(26+((21.448-RC[-10]*(46.815+RC[-10]*(0.00059-RC[-10]*0.001813))))/60)/60 -> 23.437013065397 | R190: =RC[-1]+0.00256*COS(RADIANS(125.04-1934.136*RC[-11])) -> 23.434885198476621 | S190: =DEGREES(ATAN2(COS(RADIANS(RC[-3])),COS(RADIANS(RC[-1]))*SIN(RADIANS(RC[-3])))) -> 108.29624260783612 | T190: =DEGREES(ASIN(SIN(RADIANS(RC[-2]))*SIN(RADIANS(RC[-4])))) -> 22.369543248137177 | U190: =TAN(RADIANS(RC[-3]/2))*TAN(RADIANS(RC[-3]/2)) -> 4.3017892273037761E-2 | V190: =4*DEGREES(RC[-1]*SIN(2*RADIANS(RC[-13]))-2*RC[-11]*SIN(RADIANS(RC[-12]))+4*RC[-11]*RC[-1]*SIN(RADIANS(RC[-12]))*COS(2*RADIANS(RC[-13]))-0.5*RC[-1]*RC[-1]*SIN(4*RADIANS(RC[-13]))-1.25*RC[-11]*RC[-11]*SIN(2*RADIANS(RC[-12]))) -> -5.1833205454260201 | W190: =DEGREES(ACOS(COS(RADIANS(90.833))/(COS(RADIANS(R2C2))*COS(RADIANS(RC[-3])))-TAN(RADIANS(R2C2))*TAN(RADIANS(RC[-3])))) -> #NUM! | X190: =(720-4*R3C2-RC[-2]+R4C2*60)/1440 -> 1899-12-31T14:01:10.999 | Y190: =(RC[-1]*1440-RC[-2]*4)/1440 -> #NUM! | Z190: =(RC[-2]*1440+RC[-3]*4)/1440 -> #NUM! | AA190: =8*RC[-4] -> #NUM! | AB190: =MOD(RC[-23]*1440+RC[-6]+4*R3C2-60*R4C2,1440) -> 718.816679454574 | AC190: =IF(RC[-1]/4<0,RC[-1]/4+180,RC[-1]/4-180) -> -0.29583013635649991 | AD190: =DEGREES(ACOS(SIN(RADIANS(R2C2))*SIN(RADIANS(RC[-10]))+COS(RADIANS(R2C2))*COS(RADIANS(RC[-10]))*COS(RADIANS(RC[-1])))) -> 47.630783693688969 | AE190: =90-RC[-1] -> 42.369216306311031 | AF190: =IF(RC[-1]>85,0,IF(RC[-1]>5,58.1/TAN(RADIANS(RC[-1]))-0.07/POWER(TAN(RADIANS(RC[-1])),3)+0.000086/POWER(TAN(RADIANS(RC[-1])),5),IF(RC[-1]>-0.575,1735+RC[-1]*(-518.2+RC[-1]*(103.4+RC[-1]*(-12.79+RC[-1]*0.711))),-20.772/TAN(RADIANS(RC[-1])))))/3600 -> 1.7667836314575552E-2 | AG190: =RC[-2]+RC[-1] -> 42.386884142625604 | AH190: =IF(RC[-5]>0,MOD(DEGREES(ACOS(((SIN(RADIANS(R2C2))*COS(RADIANS(RC[-4])))-SIN(RADIANS(RC[-14])))/(COS(RADIANS(R2C2))*SIN(RADIANS(RC[-4])))))+180,360),MOD(540-DEGREES(ACOS(((SIN(RADIANS(R2C2))*COS(RADIANS(RC[-4])))-SIN(RADIANS(RC[-14])))/(COS(RADIANS(R2C2))*SIN(RADIANS(RC[-4]))))),360)) -> 179.62972026705438
D191: =R[-1]C+1 -> 2017-07-09T00:00:00.000 | E191: =R5C2 -> 1899-12-31T14:00:00.000 | F191: =RC[-2]+2415018.5+RC[-1]-R4C2/24 -> 2457944.375 | G191: =(RC[-1]-2451545)/36525 -> 0.17520533880903491 | I191: =MOD(280.46646+RC[-2]*(36000.76983 + RC[-2]*0.0003032),360) -> 107.99354475853488 | J191: =357.52911+RC[-3]*(35999.05029 - 0.0001537*RC[-3]) -> 6664.7549081448215 | K191: =0.016708634-RC[-4]*(0.000042037+0.0000001267*RC[-4]) -> 1.6701265003873894E-2 | L191: =SIN(RADIANS(RC[-2]))*(1.914602-RC[-5]*(0.004817+0.000014*RC[-5]))+SIN(RADIANS(2*RC[-2]))*(0.019993-0.000101*RC[-5])+SIN(RADIANS(3*RC[-2]))*0.000289 -> -0.15540917093718407 | M191: =RC[-4]+RC[-1] -> 107.83813558759769 | N191: =RC[-4]+RC[-2] -> 6664.5994989738847 | O191: =(1.000001018*(1-RC[-4]*RC[-4]))/(1+RC[-4]*COS(RADIANS(RC[-1]))) -> 1.0166466908258198 | P191: =RC[-3]-0.00569-0.00478*SIN(RADIANS(125.04-1934.136*RC[-9])) -> 107.82978434907336 | Q191: =23+(26+((21.448-RC[-10]*(46.815+RC[-10]*(0.00059-RC[-10]*0.001813))))/60)/60 -> 23.437012709362019 | R191: =RC[-1]+0.00256*COS(RADIANS(125.04-1934.136*RC[-11])) -> 23.434886158788732 | S191: =DEGREES(ATAN2(COS(RADIANS(RC[-3])),COS(RADIANS(RC[-1]))*SIN(RADIANS(RC[-3])))) -> 109.31835619488479 | T191: =DEGREES(ASIN(SIN(RADIANS(RC[-2]))*SIN(RADIANS(RC[-4])))) -> 22.247294277527672 | U191: =TAN(RADIANS(RC[-3]/2))*TAN(RADIANS(RC[-3]/2)) -> 4.3017895898856642E-2 | V191: =4*DEGREES(RC[-1]*SIN(2*RADIANS(RC[-13]))-2*RC[-11]*SIN(RADIANS(RC[-12]))+4*RC[-11]*RC[-1]*SIN(RADIANS(RC[-12]))*COS(2*RADIANS(RC[-13]))-0.5*RC[-1]*RC[-1]*SIN(4*RADIANS(RC[-13]))-1.25*RC[-11]*RC[-11]*SIN(2*RADIANS(RC[-12]))) -> -5.3292617356548355 | W191: =DEGREES(ACOS(COS(RADIANS(90.833))/(COS(RADIANS(R2C2))*COS(RADIANS(RC[-3])))-TAN(RADIANS(R2C2))*TAN(RADIANS(RC[-3])))) -> #NUM! | X191: =(720-4*R3C2-RC[-2]+R4C2*60)/1440 -> 1899-12-31T14:01:19.756 | Y191: =(RC[-1]*1440-RC[-2]*4)/1440 -> #NUM! | Z191: =(RC[-2]*1440+RC[-3]*4)/1440 -> #NUM! | AA191: =8*RC[-4] -> #NUM! | AB191: =MOD(RC[-23]*1440+RC[-6]+4*R3C2-60*R4C2,1440) -> 718.67073826434512 | AC191: =IF(RC[-1]/4<0,RC[-1]/4+180,RC[-1]/4-180) -> -0.33231543391372043 | AD191: =DEGREES(ACOS(SIN(RADIANS(R2C2))*SIN(RADIANS(RC[-10]))+COS(RADIANS(R2C2))*COS(RADIANS(RC[-10]))*COS(RADIANS(RC[-1])))) -> 47.753117841739517 | AE191: =90-RC[-1] -> 42.246882158260483 | AF191: =IF(RC[-1]>85,0,IF(RC[-1]>5,58.1/TAN(RADIANS(RC[-1]))-0.07/POWER(TAN(RADIANS(RC[-1])),3)+0.000086/POWER(TAN(RADIANS(RC[-1])),5),IF(RC[-1]>-0.575,1735+RC[-1]*(-518.2+RC[-1]*(103.4+RC[-1]*(-12.79+RC[-1]*0.711))),-20.772/TAN(RADIANS(RC[-1])))))/3600 -> 1.7743558795373291E-2 | AG191: =RC[-2]+RC[-1] -> 42.264625717055857 | AH191: =IF(RC[-5]>0,MOD(DEGREES(ACOS(((SIN(RADIANS(R2C2))*COS(RADIANS(RC[-4])))-SIN(RADIANS(RC[-14])))/(COS(RADIANS(R2C2))*SIN(RADIANS(RC[-4])))))+180,360),MOD(540-DEGREES(ACOS(((SIN(RADIANS(R2C2))*COS(RADIANS(RC[-4])))-SIN(RADIANS(RC[-14])))/(COS(RADIANS(R2C2))*SIN(RADIANS(RC[-4]))))),360)) -> 179.58449665830699
D192: =R[-1]C+1 -> 2017-07-10T00:00:00.000 | E192: =R5C2 -> 1899-12-31T14:00:00.000 | F192: =RC[-2]+2415018.5+RC[-1]-R4C2/24 -> 2457945.375 | G192: =(RC[-1]-2451545)/36525 -> 0.17523271731690623 | I192: =MOD(280.46646+RC[-2]*(36000.76983 + RC[-2]*0.0003032),360) -> 108.97919212160832 | J192: =357.52911+RC[-3]*(35999.05029 - 0.0001537*RC[-3]) -> 6665.7405084250722 | K192: =0.016708634-RC[-4]*(0.000042037+0.0000001267*RC[-4]) -> 1.6701263851747937E-2 | L192: =SIN(RADIANS(RC[-2]))*(1.914602-RC[-5]*(0.004817+0.000014*RC[-5]))+SIN(RADIANS(2*RC[-2]))*(0.019993-0.000101*RC[-5])+SIN(RADIANS(3*RC[-2]))*0.000289 -> -0.18752982692179188 | M192: =RC[-4]+RC[-1] -> 108.79166229468653 | N192: =RC[-4]+RC[-2] -> 6665.5529785981507 | O192: =(1.000001018*(1-RC[-4]*RC[-4]))/(1+RC[-4]*COS(RADIANS(RC[-1]))) -> 1.016621266246359 | P192: =RC[-3]-0.00569-0.00478*SIN(RADIANS(125.04-1934.136*RC[-9])) -> 108.78330738753817 | Q192: =23+(26+((21.448-RC[-10]*(46.815+RC[-10]*(0.00059-RC[-10]*0.001813))))/60)/60 -> 23.437012353327038 | R192: =RC[-1]+0.00256*COS(RADIANS(125.04-1934.136*RC[-11])) -> 23.434887120917292 | S192: =DEGREES(ATAN2(COS(RADIANS(RC[-3])),COS(RADIANS(RC[-1]))*SIN(RADIANS(RC[-3])))) -> 110.33868702685413 | T192: =DEGREES(ASIN(SIN(RADIANS(RC[-2]))*SIN(RADIANS(RC[-4])))) -> 22.118661296554411 | U192: =TAN(RADIANS(RC[-3]/2))*TAN(RADIANS(RC[-3]/2)) -> 4.3017899531534003E-2 | V192: =4*DEGREES(RC[-1]*SIN(2*RADIANS(RC[-13]))-2*RC[-11]*SIN(RADIANS(RC[-12]))+4*RC[-11]*RC[-1]*SIN(RADIANS(RC[-12]))*COS(2*RADIANS(RC[-13]))-0.5*RC[-1]*RC[-1]*SIN(4*RADIANS(RC[-13]))-1.25*RC[-11]*RC[-11]*SIN(2*RADIANS(RC[-12]))) -> -5.4680855354457645 | W192: =DEGREES(ACOS(COS(RADIANS(90.833))/(COS(RADIANS(R2C2))*COS(RADIANS(RC[-3])))-TAN(RADIANS(R2C2))*TAN(RADIANS(RC[-3])))) -> #NUM! | X192: =(720-4*R3C2-RC[-2]+R4C2*60)/1440 -> 1899-12-31T14:01:28.085 | Y192: =(RC[-1]*1440-RC[-2]*4)/1440 -> #NUM! | Z192: =(RC[-2]*1440+RC[-3]*4)/1440 -> #NUM! | AA192: =8*RC[-4] -> #NUM! | AB192: =MOD(RC[-23]*1440+RC[-6]+4*R3C2-60*R4C2,1440) -> 718.53191446455423 | AC192: =IF(RC[-1]/4<0,RC[-1]/4+180,RC[-1]/4-180) -> -0.36702138386144156 | AD192: =DEGREES(ACOS(SIN(RADIANS(R2C2))*SIN(RADIANS(RC[-10]))+COS(RADIANS(R2C2))*COS(RADIANS(RC[-10]))*COS(RADIANS(RC[-1])))) -> 47.881840835626029 | AE192: =90-RC[-1] -> 42.118159164373971 | AF192: =IF(RC[-1]>85,0,IF(RC[-1]>5,58.1/TAN(RADIANS(RC[-1]))-0.07/POWER(TAN(RADIANS(RC[-1])),3)+0.000086/POWER(TAN(RADIANS(RC[-1])),5),IF(RC[-1]>-0.575,1735+RC[-1]*(-518.2+RC[-1]*(103.4+RC[-1]*(-12.79+RC[-1]*0.711))),-20.772/TAN(RADIANS(RC[-1])))))/3600 -> 1.7823618128863263E-2 | AG192: =RC[-2]+RC[-1] -> 42.135982782502836 | AH192: =IF(RC[-5]>0,MOD(DEGREES(ACOS(((SIN(RADIANS(R2C2))*COS(RADIANS(RC[-4])))-SIN(RADIANS(RC[-14])))/(COS(RADIANS(R2C2))*SIN(RADIANS(RC[-4])))))+180,360),MOD(540-DEGREES(ACOS(((SIN(RADIANS(R2C2))*COS(RADIANS(RC[-4])))-SIN(RADIANS(RC[-14])))/(COS(RADIANS(R2C2))*SIN(RADIANS(RC[-4]))))),360)) -> 179.54161641453686
D193: =R[-1]C+1 -> 2017-07-11T00:00:00.000 | E193: =R5C2 -> 1899-12-31T14:00:00.000 | F193: =RC[-2]+2415018.5+RC[-1]-R4C2/24 -> 2457946.375 | G193: =(RC[-1]-2451545)/36525 -> 0.17526009582477756 | I193: =MOD(280.46646+RC[-2]*(36000.76983 + RC[-2]*0.0003032),360) -> 109.96483948468176 | J193: =357.52911+RC[-3]*(35999.05029 - 0.0001537*RC[-3]) -> 6666.7261087053212 | K193: =0.016708634-RC[-4]*(0.000042037+0.0000001267*RC[-4]) -> 1.6701262699621792E-2 | L193: =SIN(RADIANS(RC[-2]))*(1.914602-RC[-5]*(0.004817+0.000014*RC[-5]))+SIN(RADIANS(2*RC[-2]))*(0.019993-0.000101*RC[-5])+SIN(RADIANS(3*RC[-2]))*0.000289 -> -0.21959831501560087 | M193: =RC[-4]+RC[-1] -> 109.74524116966616 | N193: =RC[-4]+RC[-2] -> 6666.5065103903053 | O193: =(1.000001018*(1-RC[-4]*RC[-4]))/(1+RC[-4]*COS(RADIANS(RC[-1]))) -> 1.0165910824499003 | P193: =RC[-3]-0.00569-0.00478*SIN(RADIANS(125.04-1934.136*RC[-9])) -> 109.73688259617006 | Q193: =23+(26+((21.448-RC[-10]*(46.815+RC[-10]*(0.00059-RC[-10]*0.001813))))/60)/60 -> 23.437011997292053 | R193: =RC[-1]+0.00256*COS(RADIANS(125.04-1934.136*RC[-11])) -> 23.434888084861178 | S193: =DEGREES(ATAN2(COS(RADIANS(RC[-3])),COS(RADIANS(RC[-1]))*SIN(RADIANS(RC[-3])))) -> 111.35716755322613 | T193: =DEGREES(ASIN(SIN(RADIANS(RC[-2]))*SIN(RADIANS(RC[-4])))) -> 21.983694563898858 | U193: =TAN(RADIANS(RC[-3]/2))*TAN(RADIANS(RC[-3]/2)) -> 4.3017903171065582E-2 | V193: =4*DEGREES(RC[-1]*SIN(2*RADIANS(RC[-13]))-2*RC[-11]*SIN(RADIANS(RC[-12]))+4*RC[-11]*RC[-1]*SIN(RADIANS(RC[-12]))*COS(2*RADIANS(RC[-13]))-0.5*RC[-1]*RC[-1]*SIN(4*RADIANS(RC[-13]))-1.25*RC[-11]*RC[-11]*SIN(2*RADIANS(RC[-12]))) -> -5.5995197889665631 | W193: =DEGREES(ACOS(COS(RADIANS(90.833))/(COS(RADIANS(R2C2))*COS(RADIANS(RC[-3])))-TAN(RADIANS(R2C2))*TAN(RADIANS(RC[-3])))) -> #NUM! | X193: =(720-4*R3C2-RC[-2]+R4C2*60)/1440 -> 1899-12-31T14:01:35.971 | Y193: =(RC[-1]*1440-RC[-2]*4)/1440 -> #NUM! | Z193: =(RC[-2]*1440+RC[-3]*4)/1440 -> #NUM! | AA193: =8*RC[-4] -> #NUM! | AB193: =MOD(RC[-23]*1440+RC[-6]+4*R3C2-60*R4C2,1440) -> 718.40048021103348 | AC193: =IF(RC[-1]/4<0,RC[-1]/4+180,RC[-1]/4-180) -> -0.39987994724162945 | AD193: =DEGREES(ACOS(SIN(RADIANS(R2C2))*SIN(RADIANS(RC[-10]))+COS(RADIANS(R2C2))*COS(RADIANS(RC[-10]))*COS(RADIANS(RC[-1])))) -> 48.016900804227234 | AE193: =90-RC[-1] -> 41.983099195772766 | AF193: =IF(RC[-1]>85,0,IF(RC[-1]>5,58.1/TAN(RADIANS(RC[-1]))-0.07/POWER(TAN(RADIANS(RC[-1])),3)+0.000086/POWER(TAN(RADIANS(RC[-1])),5),IF(RC[-1]>-0.575,1735+RC[-1]*(-518.2+RC[-1]*(103.4+RC[-1]*(-12.79+RC[-1]*0.711))),-20.772/TAN(RADIANS(RC[-1])))))/3600 -> 1.7908044155645585E-2 | AG193: =RC[-2]+RC[-1] -> 42.001007239928413 | AH193: =IF(RC[-5]>0,MOD(DEGREES(ACOS(((SIN(RADIANS(R2C2))*COS(RADIANS(RC[-4])))-SIN(RADIANS(RC[-14])))/(COS(RADIANS(R2C2))*SIN(RADIANS(RC[-4])))))+180,360),MOD(540-DEGREES(ACOS(((SIN(RADIANS(R2C2))*COS(RADIANS(RC[-4])))-SIN(RADIANS(RC[-14])))/(COS(RADIANS(R2C2))*SIN(RADIANS(RC[-4]))))),360)) -> 179.50116307787061
D194: =R[-1]C+1 -> 2017-07-12T00:00:00.000 | E194: =R5C2 -> 1899-12-31T14:00:00.000 | F194: =RC[-2]+2415018.5+RC[-1]-R4C2/24 -> 2457947.375 | G194: =(RC[-1]-2451545)/36525 -> 0.17528747433264888 | I194: =MOD(280.46646+RC[-2]*(36000.76983 + RC[-2]*0.0003032),360) -> 110.95048684775611 | J194: =357.52911+RC[-3]*(35999.05029 - 0.0001537*RC[-3]) -> 6667.7117089855719 | K194: =0.016708634-RC[-4]*(0.000042037+0.0000001267*RC[-4]) -> 1.6701261547495457E-2 | L194: =SIN(RADIANS(RC[-2]))*(1.914602-RC[-5]*(0.004817+0.000014*RC[-5]))+SIN(RADIANS(2*RC[-2]))*(0.019993-0.000101*RC[-5])+SIN(RADIANS(3*RC[-2]))*0.000289 -> -0.25160570829669893 | M194: =RC[-4]+RC[-1] -> 110.69888113945942 | N194: =RC[-4]+RC[-2] -> 6667.4601032772753 | O194: =(1.000001018*(1-RC[-4]*RC[-4]))/(1+RC[-4]*COS(RADIANS(RC[-1]))) -> 1.0165561475142837 | P194: =RC[-3]-0.00569-0.00478*SIN(RADIANS(125.04-1934.136*RC[-9])) -> 110.69051890189502 | Q194: =23+(26+((21.448-RC[-10]*(46.815+RC[-10]*(0.00059-RC[-10]*0.001813))))/60)/60 -> 23.437011641257072 | R194: =RC[-1]+0.00256*COS(RADIANS(125.04-1934.136*RC[-11])) -> 23.434889050619265 | S194: =DEGREES(ATAN2(COS(RADIANS(RC[-3])),COS(RADIANS(RC[-1]))*SIN(RADIANS(RC[-3])))) -> 112.37373311103887 | T194: =DEGREES(ASIN(SIN(RADIANS(RC[-2]))*SIN(RADIANS(RC[-4])))) -> 21.842446356550482 | U194: =TAN(RADIANS(RC[-3]/2))*TAN(RADIANS(RC[-3]/2)) -> 4.301790681744716E-2 | V194: =4*DEGREES(RC[-1]*SIN(2*RADIANS(RC[-13]))-2*RC[-11]*SIN(RADIANS(RC[-12]))+4*RC[-11]*RC[-1]*SIN(RADIANS(RC[-12]))*COS(2*RADIANS(RC[-13]))-0.5*RC[-1]*RC[-1]*SIN(4*RADIANS(RC[-13]))-1.25*RC[-11]*RC[-11]*SIN(2*RADIANS(RC[-12]))) -> -5.7233038012211876 | W194: =DEGREES(ACOS(COS(RADIANS(90.833))/(COS(RADIANS(R2C2))*COS(RADIANS(RC[-3])))-TAN(RADIANS(R2C2))*TAN(RADIANS(RC[-3])))) -> #NUM! | X194: =(720-4*R3C2-RC[-2]+R4C2*60)/1440 -> 1899-12-31T14:01:43.398 | Y194: =(RC[-1]*1440-RC[-2]*4)/1440 -> #NUM! | Z194: =(RC[-2]*1440+RC[-3]*4)/1440 -> #NUM! | AA194: =8*RC[-4] -> #NUM! | AB194: =MOD(RC[-23]*1440+RC[-6]+4*R3C2-60*R4C2,1440) -> 718.27669619877884 | AC194: =IF(RC[-1]/4<0,RC[-1]/4+180,RC[-1]/4-180) -> -0.43082595030529092 | AD194: =DEGREES(ACOS(SIN(RADIANS(R2C2))*SIN(RADIANS(RC[-10]))+COS(RADIANS(R2C2))*COS(RADIANS(RC[-10]))*COS(RADIANS(RC[-1])))) -> 48.158243881738663 | AE194: =90-RC[-1] -> 41.841756118261337 | AF194: =IF(RC[-1]>85,0,IF(RC[-1]>5,58.1/TAN(RADIANS(RC[-1]))-0.07/POWER(TAN(RADIANS(RC[-1])),3)+0.000086/POWER(TAN(RADIANS(RC[-1])),5),IF(RC[-1]>-0.575,1735+RC[-1]*(-518.2+RC[-1]*(103.4+RC[-1]*(-12.79+RC[-1]*0.711))),-20.772/TAN(RADIANS(RC[-1])))))/3600 -> 1.7996868886875506E-2 | AG194: =RC[-2]+RC[-1] -> 41.859752987148212 | AH194: =IF(RC[-5]>0,MOD(DEGREES(ACOS(((SIN(RADIANS(R2C2))*COS(RADIANS(RC[-4])))-SIN(RADIANS(RC[-14])))/(COS(RADIANS(R2C2))*SIN(RADIANS(RC[-4])))))+180,360),MOD(540-DEGREES(ACOS(((SIN(RADIANS(R2C2))*COS(RADIANS(RC[-4])))-SIN(RADIANS(RC[-14])))/(COS(RADIANS(R2C2))*SIN(RADIANS(RC[-4]))))),360)) -> 179.46321533506341
D195: =R[-1]C+1 -> 2017-07-13T00:00:00.000 | E195: =R5C2 -> 1899-12-31T14:00:00.000 | F195: =RC[-2]+2415018.5+RC[-1]-R4C2/24 -> 2457948.375 | G195: =(RC[-1]-2451545)/36525 -> 0.1753148528405202 | I195: =MOD(280.46646+RC[-2]*(36000.76983 + RC[-2]*0.0003032),360) -> 111.93613421083046 | J195: =357.52911+RC[-3]*(35999.05029 - 0.0001537*RC[-3]) -> 6668.6973092658218 | K195: =0.016708634-RC[-4]*(0.000042037+0.0000001267*RC[-4]) -> 1.6701260395368935E-2 | L195: =SIN(RADIANS(RC[-2]))*(1.914602-RC[-5]*(0.004817+0.000014*RC[-5]))+SIN(RADIANS(2*RC[-2]))*(0.019993-0.000101*RC[-5])+SIN(RADIANS(3*RC[-2]))*0.000289 -> -0.28354309366840041 | M195: =RC[-4]+RC[-1] -> 111.65259111716206 | N195: =RC[-4]+RC[-2] -> 6668.4137661721534 | O195: =(1.000001018*(1-RC[-4]*RC[-4]))/(1+RC[-4]*COS(RADIANS(RC[-1]))) -> 1.016516470790586 | P195: =RC[-3]-0.00569-0.00478*SIN(RADIANS(125.04-1934.136*RC[-9])) -> 111.64422521781194 | Q195: =23+(26+((21.448-RC[-10]*(46.815+RC[-10]*(0.00059-RC[-10]*0.001813))))/60)/60 -> 23.437011285222091 | R195: =RC[-1]+0.00256*COS(RADIANS(125.04-1934.136*RC[-11])) -> 23.434890018190423 | S195: =DEGREES(ATAN2(COS(RADIANS(RC[-3])),COS(RADIANS(RC[-1]))*SIN(RADIANS(RC[-3])))) -> 113.38832200348249 | T195: =DEGREES(ASIN(SIN(RADIANS(RC[-2]))*SIN(RADIANS(RC[-4])))) -> 21.694970909959558 | U195: =TAN(RADIANS(RC[-3]/2))*TAN(RADIANS(RC[-3]/2)) -> 4.3017910470674443E-2 | V195: =4*DEGREES(RC[-1]*SIN(2*RADIANS(RC[-13]))-2*RC[-11]*SIN(RADIANS(RC[-12]))+4*RC[-11]*RC[-1]*SIN(RADIANS(RC[-12]))*COS(2*RADIANS(RC[-13]))-0.5*RC[-1]*RC[-1]*SIN(4*RADIANS(RC[-13]))-1.25*RC[-11]*RC[-11]*SIN(2*RADIANS(RC[-12]))) -> -5.8391886840021181 | W195: =DEGREES(ACOS(COS(RADIANS(90.833))/(COS(RADIANS(R2C2))*COS(RADIANS(RC[-3])))-TAN(RADIANS(R2C2))*TAN(RADIANS(RC[-3])))) -> #NUM! | X195: =(720-4*R3C2-RC[-2]+R4C2*60)/1440 -> 1899-12-31T14:01:50.351 | Y195: =(RC[-1]*1440-RC[-2]*4)/1440 -> #NUM! | Z195: =(RC[-2]*1440+RC[-3]*4)/1440 -> #NUM! | AA195: =8*RC[-4] -> #NUM! | AB195: =MOD(RC[-23]*1440+RC[-6]+4*R3C2-60*R4C2,1440) -> 718.16081131599788 | AC195: =IF(RC[-1]/4<0,RC[-1]/4+180,RC[-1]/4-180) -> -0.45979717100053108 | AD195: =DEGREES(ACOS(SIN(RADIANS(R2C2))*SIN(RADIANS(RC[-10]))+COS(RADIANS(R2C2))*COS(RADIANS(RC[-10]))*COS(RADIANS(RC[-1])))) -> 48.305814281127823 | AE195: =90-RC[-1] -> 41.694185718872177 | AF195: =IF(RC[-1]>85,0,IF(RC[-1]>5,58.1/TAN(RADIANS(RC[-1]))-0.07/POWER(TAN(RADIANS(RC[-1])),3)+0.000086/POWER(TAN(RADIANS(RC[-1])),5),IF(RC[-1]>-0.575,1735+RC[-1]*(-518.2+RC[-1]*(103.4+RC[-1]*(-12.79+RC[-1]*0.711))),-20.772/TAN(RADIANS(RC[-1])))))/3600 -> 1.8090126587506992E-2 | AG195: =RC[-2]+RC[-1] -> 41.712275845459686 | AH195: =IF(RC[-5]>0,MOD(DEGREES(ACOS(((SIN(RADIANS(R2C2))*COS(RADIANS(RC[-4])))-SIN(RADIANS(RC[-14])))/(COS(RADIANS(R2C2))*SIN(RADIANS(RC[-4])))))+180,360),MOD(540-DEGREES(ACOS(((SIN(RADIANS(R2C2))*COS(RADIANS(RC[-4])))-SIN(RADIANS(RC[-14])))/(COS(RADIANS(R2C2))*SIN(RADIANS(RC[-4]))))),360)) -> 179.42784691194618
D196: =R[-1]C+1 -> 2017-07-14T00:00:00.000 | E196: =R5C2 -> 1899-12-31T14:00:00.000 | F196: =RC[-2]+2415018.5+RC[-1]-R4C2/24 -> 2457949.375 | G196: =(RC[-1]-2451545)/36525 -> 0.17534223134839153 | I196: =MOD(280.46646+RC[-2]*(36000.76983 + RC[-2]*0.0003032),360) -> 112.92178157390572 | J196: =357.52911+RC[-3]*(35999.05029 - 0.0001537*RC[-3]) -> 6669.6829095460698 | K196: =0.016708634-RC[-4]*(0.000042037+0.0000001267*RC[-4]) -> 1.6701259243242218E-2 | L196: =SIN(RADIANS(RC[-2]))*(1.914602-RC[-5]*(0.004817+0.000014*RC[-5]))+SIN(RADIANS(2*RC[-2]))*(0.019993-0.000101*RC[-5])+SIN(RADIANS(3*RC[-2]))*0.000289 -> -0.31540157388526918 | M196: =RC[-4]+RC[-1] -> 112.60638000002045 | N196: =RC[-4]+RC[-2] -> 6669.3675079721843 | O196: =(1.000001018*(1-RC[-4]*RC[-4]))/(1+RC[-4]*COS(RADIANS(RC[-1]))) -> 1.0164720629014208 | P196: =RC[-3]-0.00569-0.00478*SIN(RADIANS(125.04-1934.136*RC[-9])) -> 112.59801044117029 | Q196: =23+(26+((21.448-RC[-10]*(46.815+RC[-10]*(0.00059-RC[-10]*0.001813))))/60)/60 -> 23.43701092918711 | R196: =RC[-1]+0.00256*COS(RADIANS(125.04-1934.136*RC[-11])) -> 23.434890987573517 | S196: =DEGREES(ATAN2(COS(RADIANS(RC[-3])),COS(RADIANS(RC[-1]))*SIN(RADIANS(RC[-3])))) -> 114.40087557112695 | T196: =DEGREES(ASIN(SIN(RADIANS(RC[-2]))*SIN(RADIANS(RC[-4])))) -> 21.541324357160303 | U196: =TAN(RADIANS(RC[-3]/2))*TAN(RADIANS(RC[-3]/2)) -> 4.3017914130743184E-2 | V196: =4*DEGREES(RC[-1]*SIN(2*RADIANS(RC[-13]))-2*RC[-11]*SIN(RADIANS(RC[-12]))+4*RC[-11]*RC[-1]*SIN(RADIANS(RC[-12]))*COS(2*RADIANS(RC[-13]))-0.5*RC[-1]*RC[-1]*SIN(4*RADIANS(RC[-13]))-1.25*RC[-11]*RC[-11]*SIN(2*RADIANS(RC[-12]))) -> -5.9469376737236708 | W196: =DEGREES(ACOS(COS(RADIANS(90.833))/(COS(RADIANS(R2C2))*COS(RADIANS(RC[-3])))-TAN(RADIANS(R2C2))*TAN(RADIANS(RC[-3])))) -> #NUM! | X196: =(720-4*R3C2-RC[-2]+R4C2*60)/1440 -> 1899-12-31T14:01:56.816 | Y196: =(RC[-1]*1440-RC[-2]*4)/1440 -> #NUM! | Z196: =(RC[-2]*1440+RC[-3]*4)/1440 -> #NUM! | AA196: =8*RC[-4] -> #NUM! | AB196: =MOD(RC[-23]*1440+RC[-6]+4*R3C2-60*R4C2,1440) -> 718.05306232627629 | AC196: =IF(RC[-1]/4<0,RC[-1]/4+180,RC[-1]/4-180) -> -0.48673441843092746 | AD196: =DEGREES(ACOS(SIN(RADIANS(R2C2))*SIN(RADIANS(RC[-10]))+COS(RADIANS(R2C2))*COS(RADIANS(RC[-10]))*COS(RADIANS(RC[-1])))) -> 48.459554368238173 | AE196: =90-RC[-1] -> 41.540445631761827 | AF196: =IF(RC[-1]>85,0,IF(RC[-1]>5,58.1/TAN(RADIANS(RC[-1]))-0.07/POWER(TAN(RADIANS(RC[-1])),3)+0.000086/POWER(TAN(RADIANS(RC[-1])),5),IF(RC[-1]>-0.575,1735+RC[-1]*(-518.2+RC[-1]*(103.4+RC[-1]*(-12.79+RC[-1]*0.711))),-20.772/TAN(RADIANS(RC[-1])))))/3600 -> 1.8187853864117885E-2 | AG196: =RC[-2]+RC[-1] -> 41.558633485625947 | AH196: =IF(RC[-5]>0,MOD(DEGREES(ACOS(((SIN(RADIANS(R2C2))*COS(RADIANS(RC[-4])))-SIN(RADIANS(RC[-14])))/(COS(RADIANS(R2C2))*SIN(RADIANS(RC[-4])))))+180,360),MOD(540-DEGREES(ACOS(((SIN(RADIANS(R2C2))*COS(RADIANS(RC[-4])))-SIN(RADIANS(RC[-14])))/(COS(RADIANS(R2C2))*SIN(RADIANS(RC[-4]))))),360)) -> 179.39512648367406
D197: =R[-1]C+1 -> 2017-07-15T00:00:00.000 | E197: =R5C2 -> 1899-12-31T14:00:00.000 | F197: =RC[-2]+2415018.5+RC[-1]-R4C2/24 -> 2457950.375 | G197: =(RC[-1]-2451545)/36525 -> 0.17536960985626282 | I197: =MOD(280.46646+RC[-2]*(36000.76983 + RC[-2]*0.0003032),360) -> 113.90742893698098 | J197: =357.52911+RC[-3]*(35999.05029 - 0.0001537*RC[-3]) -> 6670.6685098263188 | K197: =0.016708634-RC[-4]*(0.000042037+0.0000001267*RC[-4]) -> 1.6701258091115313E-2 | L197: =SIN(RADIANS(RC[-2]))*(1.914602-RC[-5]*(0.004817+0.000014*RC[-5]))+SIN(RADIANS(2*RC[-2]))*(0.019993-0.000101*RC[-5])+SIN(RADIANS(3*RC[-2]))*0.000289 -> -0.34717226957869879 | M197: =RC[-4]+RC[-1] -> 113.56025666740229 | N197: =RC[-4]+RC[-2] -> 6670.3213375567402 | O197: =(1.000001018*(1-RC[-4]*RC[-4]))/(1+RC[-4]*COS(RADIANS(RC[-1]))) -> 1.0164229357390007 | P197: =RC[-3]-0.00569-0.00478*SIN(RADIANS(125.04-1934.136*RC[-9])) -> 113.5518834513409 | Q197: =23+(26+((21.448-RC[-10]*(46.815+RC[-10]*(0.00059-RC[-10]*0.001813))))/60)/60 -> 23.437010573152129 | R197: =RC[-1]+0.00256*COS(RADIANS(125.04-1934.136*RC[-11])) -> 23.43489195876742 | S197: =DEGREES(ATAN2(COS(RADIANS(RC[-3])),COS(RADIANS(RC[-1]))*SIN(RADIANS(RC[-3])))) -> 115.41133825576709 | T197: =DEGREES(ASIN(SIN(RADIANS(RC[-2]))*SIN(RADIANS(RC[-4])))) -> 21.381564667053549 | U197: =TAN(RADIANS(RC[-3]/2))*TAN(RADIANS(RC[-3]/2)) -> 4.3017917797649095E-2 | V197: =4*DEGREES(RC[-1]*SIN(2*RADIANS(RC[-13]))-2*RC[-11]*SIN(RADIANS(RC[-12]))+4*RC[-11]*RC[-1]*SIN(RADIANS(RC[-12]))*COS(2*RADIANS(RC[-13]))-0.5*RC[-1]*RC[-1]*SIN(4*RADIANS(RC[-13]))-1.25*RC[-11]*RC[-11]*SIN(2*RADIANS(RC[-12]))) -> -6.0463264207060936 | W197: =DEGREES(ACOS(COS(RADIANS(90.833))/(COS(RADIANS(R2C2))*COS(RADIANS(RC[-3])))-TAN(RADIANS(R2C2))*TAN(RADIANS(RC[-3])))) -> #NUM! | X197: =(720-4*R3C2-RC[-2]+R4C2*60)/1440 -> 1899-12-31T14:02:02.780 | Y197: =(RC[-1]*1440-RC[-2]*4)/1440 -> #NUM! | Z197: =(RC[-2]*1440+RC[-3]*4)/1440 -> #NUM! | AA197: =8*RC[-4] -> #NUM! | AB197: =MOD(RC[-23]*1440+RC[-6]+4*R3C2-60*R4C2,1440) -> 717.95367357929388 | AC197: =IF(RC[-1]/4<0,RC[-1]/4+180,RC[-1]/4-180) -> -0.51158160517653073 | AD197: =DEGREES(ACOS(SIN(RADIANS(R2C2))*SIN(RADIANS(RC[-10]))+COS(RADIANS(R2C2))*COS(RADIANS(RC[-10]))*COS(RADIANS(RC[-1])))) -> 48.619404736258197 | AE197: =90-RC[-1] -> 41.380595263741803 | AF197: =IF(RC[-1]>85,0,IF(RC[-1]>5,58.1/TAN(RADIANS(RC[-1]))-0.07/POWER(TAN(RADIANS(RC[-1])),3)+0.000086/POWER(TAN(RADIANS(RC[-1])),5),IF(RC[-1]>-0.575,1735+RC[-1]*(-518.2+RC[-1]*(103.4+RC[-1]*(-12.79+RC[-1]*0.711))),-20.772/TAN(RADIANS(RC[-1])))))/3600 -> 1.829008975742806E-2 | AG197: =RC[-2]+RC[-1] -> 41.398885353499232 | AH197: =IF(RC[-5]>0,MOD(DEGREES(ACOS(((SIN(RADIANS(R2C2))*COS(RADIANS(RC[-4])))-SIN(RADIANS(RC[-14])))/(COS(RADIANS(R2C2))*SIN(RADIANS(RC[-4])))))+180,360),MOD(540-DEGREES(ACOS(((SIN(RADIANS(R2C2))*COS(RADIANS(RC[-4])))-SIN(RADIANS(RC[-14])))/(COS(RADIANS(R2C2))*SIN(RADIANS(RC[-4]))))),360)) -> 179.36511760054657
D198: =R[-1]C+1 -> 2017-07-16T00:00:00.000 | E198: =R5C2 -> 1899-12-31T14:00:00.000 | F198: =RC[-2]+2415018.5+RC[-1]-R4C2/24 -> 2457951.375 | G198: =(RC[-1]-2451545)/36525 -> 0.17539698836413414 | I198: =MOD(280.46646+RC[-2]*(36000.76983 + RC[-2]*0.0003032),360) -> 114.89307630005715 | J198: =357.52911+RC[-3]*(35999.05029 - 0.0001537*RC[-3]) -> 6671.6541101065677 | K198: =0.016708634-RC[-4]*(0.000042037+0.0000001267*RC[-4]) -> 1.6701256938988222E-2 | L198: =SIN(RADIANS(RC[-2]))*(1.914602-RC[-5]*(0.004817+0.000014*RC[-5]))+SIN(RADIANS(2*RC[-2]))*(0.019993-0.000101*RC[-5])+SIN(RADIANS(3*RC[-2]))*0.000289 -> -0.37884632128236695 | M198: =RC[-4]+RC[-1] -> 114.51422997877478 | N198: =RC[-4]+RC[-2] -> 6671.2752637852855 | O198: =(1.000001018*(1-RC[-4]*RC[-4]))/(1+RC[-4]*COS(RADIANS(RC[-1]))) -> 1.0163691024629693 | P198: =RC[-3]-0.00569-0.00478*SIN(RADIANS(125.04-1934.136*RC[-9])) -> 114.50585310779412 | Q198: =23+(26+((21.448-RC[-10]*(46.815+RC[-10]*(0.00059-RC[-10]*0.001813))))/60)/60 -> 23.437010217117148 | R198: =RC[-1]+0.00256*COS(RADIANS(125.04-1934.136*RC[-11])) -> 23.434892931770996 | S198: =DEGREES(ATAN2(COS(RADIANS(RC[-3])),COS(RADIANS(RC[-1]))*SIN(RADIANS(RC[-3])))) -> 116.41965765693102 | T198: =DEGREES(ASIN(SIN(RADIANS(RC[-2]))*SIN(RADIANS(RC[-4])))) -> 21.215751582031913 | U198: =TAN(RADIANS(RC[-3]/2))*TAN(RADIANS(RC[-3]/2)) -> 4.3017921471387902E-2 | V198: =4*DEGREES(RC[-1]*SIN(2*RADIANS(RC[-13]))-2*RC[-11]*SIN(RADIANS(RC[-12]))+4*RC[-11]*RC[-1]*SIN(RADIANS(RC[-12]))*COS(2*RADIANS(RC[-13]))-0.5*RC[-1]*RC[-1]*SIN(4*RADIANS(RC[-13]))-1.25*RC[-11]*RC[-11]*SIN(2*RADIANS(RC[-12]))) -> -6.1371432495870213 | W198: =DEGREES(ACOS(COS(RADIANS(90.833))/(COS(RADIANS(R2C2))*COS(RADIANS(RC[-3])))-TAN(RADIANS(R2C2))*TAN(RADIANS(RC[-3])))) -> #NUM! | X198: =(720-4*R3C2-RC[-2]+R4C2*60)/1440 -> 1899-12-31T14:02:08.229 | Y198: =(RC[-1]*1440-RC[-2]*4)/1440 -> #NUM! | Z198: =(RC[-2]*1440+RC[-3]*4)/1440 -> #NUM! | AA198: =8*RC[-4] -> #NUM! | AB198: =MOD(RC[-23]*1440+RC[-6]+4*R3C2-60*R4C2,1440) -> 717.86285675041302 | AC198: =IF(RC[-1]/4<0,RC[-1]/4+180,RC[-1]/4-180) -> -0.534285812396746 | AD198: =DEGREES(ACOS(SIN(RADIANS(R2C2))*SIN(RADIANS(RC[-10]))+COS(RADIANS(R2C2))*COS(RADIANS(RC[-10]))*COS(RADIANS(RC[-1])))) -> 48.785304280282851 | AE198: =90-RC[-1] -> 41.214695719717149 | AF198: =IF(RC[-1]>85,0,IF(RC[-1]>5,58.1/TAN(RADIANS(RC[-1]))-0.07/POWER(TAN(RADIANS(RC[-1])),3)+0.000086/POWER(TAN(RADIANS(RC[-1])),5),IF(RC[-1]>-0.575,1735+RC[-1]*(-518.2+RC[-1]*(103.4+RC[-1]*(-12.79+RC[-1]*0.711))),-20.772/TAN(RADIANS(RC[-1])))))/3600 -> 1.839687583964035E-2 | AG198: =RC[-2]+RC[-1] -> 41.233092595556791 | AH198: =IF(RC[-5]>0,MOD(DEGREES(ACOS(((SIN(RADIANS(R2C2))*COS(RADIANS(RC[-4])))-SIN(RADIANS(RC[-14])))/(COS(RADIANS(R2C2))*SIN(RADIANS(RC[-4])))))+180,360),MOD(540-DEGREES(ACOS(((SIN(RADIANS(R2C2))*COS(RADIANS(RC[-4])))-SIN(RADIANS(RC[-14])))/(COS(RADIANS(R2C2))*SIN(RADIANS(RC[-4]))))),360)) -> 179.3378786294362
D199: =R[-1]C+1 -> 2017-07-17T00:00:00.000 | E199: =R5C2 -> 1899-12-31T14:00:00.000 | F199: =RC[-2]+2415018.5+RC[-1]-R4C2/24 -> 2457952.375 | G199: =(RC[-1]-2451545)/36525 -> 0.17542436687200547 | I199: =MOD(280.46646+RC[-2]*(36000.76983 + RC[-2]*0.0003032),360) -> 115.87872366313331 | J199: =357.52911+RC[-3]*(35999.05029 - 0.0001537*RC[-3]) -> 6672.6397103868158 | K199: =0.016708634-RC[-4]*(0.000042037+0.0000001267*RC[-4]) -> 1.6701255786860936E-2 | L199: =SIN(RADIANS(RC[-2]))*(1.914602-RC[-5]*(0.004817+0.000014*RC[-5]))+SIN(RADIANS(2*RC[-2]))*(0.019993-0.000101*RC[-5])+SIN(RADIANS(3*RC[-2]))*0.000289 -> -0.41041489145796944 | M199: =RC[-4]+RC[-1] -> 115.46830877167534 | N199: =RC[-4]+RC[-2] -> 6672.2292954953582 | O199: =(1.000001018*(1-RC[-4]*RC[-4]))/(1+RC[-4]*COS(RADIANS(RC[-1]))) -> 1.0163105774979966 | P199: =RC[-3]-0.00569-0.00478*SIN(RADIANS(125.04-1934.136*RC[-9])) -> 115.45992824807047 | Q199: =23+(26+((21.448-RC[-10]*(46.815+RC[-10]*(0.00059-RC[-10]*0.001813))))/60)/60 -> 23.437009861082167 | R199: =RC[-1]+0.00256*COS(RADIANS(125.04-1934.136*RC[-11])) -> 23.43489390658311 | S199: =DEGREES(ATAN2(COS(RADIANS(RC[-3])),COS(RADIANS(RC[-1]))*SIN(RADIANS(RC[-3])))) -> 117.42578458109644 | T199: =DEGREES(ASIN(SIN(RADIANS(RC[-2]))*SIN(RADIANS(RC[-4])))) -> 21.043946555132518 | U199: =TAN(RADIANS(RC[-3]/2))*TAN(RADIANS(RC[-3]/2)) -> 4.3017925151955315E-2 | V199: =4*DEGREES(RC[-1]*SIN(2*RADIANS(RC[-13]))-2*RC[-11]*SIN(RADIANS(RC[-12]))+4*RC[-11]*RC[-1]*SIN(RADIANS(RC[-12]))*COS(2*RADIANS(RC[-13]))-0.5*RC[-1]*RC[-1]*SIN(4*RADIANS(RC[-13]))-1.25*RC[-11]*RC[-11]*SIN(2*RADIANS(RC[-12]))) -> -6.2191893906358242 | W199: =DEGREES(ACOS(COS(RADIANS(90.833))/(COS(RADIANS(R2C2))*COS(RADIANS(RC[-3])))-TAN(RADIANS(R2C2))*TAN(RADIANS(RC[-3])))) -> #NUM! | X199: =(720-4*R3C2-RC[-2]+R4C2*60)/1440 -> 1899-12-31T14:02:13.151 | Y199: =(RC[-1]*1440-RC[-2]*4)/1440 -> #NUM! | Z199: =(RC[-2]*1440+RC[-3]*4)/1440 -> #NUM! | AA199: =8*RC[-4] -> #NUM! | AB199: =MOD(RC[-23]*1440+RC[-6]+4*R3C2-60*R4C2,1440) -> 717.78081060936415 | AC199: =IF(RC[-1]/4<0,RC[-1]/4+180,RC[-1]/4-180) -> -0.55479734765896183 | AD199: =DEGREES(ACOS(SIN(RADIANS(R2C2))*SIN(RADIANS(RC[-10]))+COS(RADIANS(R2C2))*COS(RADIANS(RC[-10]))*COS(RADIANS(RC[-1])))) -> 48.957190271700128 | AE199: =90-RC[-1] -> 41.042809728299872 | AF199: =IF(RC[-1]>85,0,IF(RC[-1]>5,58.1/TAN(RADIANS(RC[-1]))-0.07/POWER(TAN(RADIANS(RC[-1])),3)+0.000086/POWER(TAN(RADIANS(RC[-1])),5),IF(RC[-1]>-0.575,1735+RC[-1]*(-518.2+RC[-1]*(103.4+RC[-1]*(-12.79+RC[-1]*0.711))),-20.772/TAN(RADIANS(RC[-1])))))/3600 -> 1.8508256316748677E-2 | AG199: =RC[-2]+RC[-1] -> 41.061317984616622 | AH199: =IF(RC[-5]>0,MOD(DEGREES(ACOS(((SIN(RADIANS(R2C2))*COS(RADIANS(RC[-4])))-SIN(RADIANS(RC[-14])))/(COS(RADIANS(R2C2))*SIN(RADIANS(RC[-4])))))+180,360),MOD(540-DEGREES(ACOS(((SIN(RADIANS(R2C2))*COS(RADIANS(RC[-4])))-SIN(RADIANS(RC[-14])))/(COS(RADIANS(R2C2))*SIN(RADIANS(RC[-4]))))),360)) -> 179.31346271045015
D200: =R[-1]C+1 -> 2017-07-18T00:00:00.000 | E200: =R5C2 -> 1899-12-31T14:00:00.000 | F200: =RC[-2]+2415018.5+RC[-1]-R4C2/24 -> 2457953.375 | G200: =(RC[-1]-2451545)/36525 -> 0.17545174537987679 | I200: =MOD(280.46646+RC[-2]*(36000.76983 + RC[-2]*0.0003032),360) -> 116.86437102621039 | J200: =357.52911+RC[-3]*(35999.05029 - 0.0001537*RC[-3]) -> 6673.6253106670647 | K200: =0.016708634-RC[-4]*(0.000042037+0.0000001267*RC[-4]) -> 1.6701254634733462E-2 | L200: =SIN(RADIANS(RC[-2]))*(1.914602-RC[-5]*(0.004817+0.000014*RC[-5]))+SIN(RADIANS(2*RC[-2]))*(0.019993-0.000101*RC[-5])+SIN(RADIANS(3*RC[-2]))*0.000289 -> -0.44186916652090635 | M200: =RC[-4]+RC[-1] -> 116.42250185968949 | N200: =RC[-4]+RC[-2] -> 6673.1834415005442 | O200: =(1.000001018*(1-RC[-4]*RC[-4]))/(1+RC[-4]*COS(RADIANS(RC[-1]))) -> 1.0162473765311379 | P200: =RC[-3]-0.00569-0.00478*SIN(RADIANS(125.04-1934.136*RC[-9])) -> 116.4141176857586 | Q200: =23+(26+((21.448-RC[-10]*(46.815+RC[-10]*(0.00059-RC[-10]*0.001813))))/60)/60 -> 23.437009505047186 | R200: =RC[-1]+0.00256*COS(RADIANS(125.04-1934.136*RC[-11])) -> 23.434894883202624 | S200: =DEGREES(ATAN2(COS(RADIANS(RC[-3])),COS(RADIANS(RC[-1]))*SIN(RADIANS(RC[-3])))) -> 118.42967308371995 | T200: =DEGREES(ASIN(SIN(RADIANS(RC[-2]))*SIN(RADIANS(RC[-4])))) -> 20.866212686893906 | U200: =TAN(RADIANS(RC[-3]/2))*TAN(RADIANS(RC[-3]/2)) -> 4.3017928839347047E-2 | V200: =4*DEGREES(RC[-1]*SIN(2*RADIANS(RC[-13]))-2*RC[-11]*SIN(RADIANS(RC[-12]))+4*RC[-11]*RC[-1]*SIN(RADIANS(RC[-12]))*COS(2*RADIANS(RC[-13]))-0.5*RC[-1]*RC[-1]*SIN(4*RADIANS(RC[-13]))-1.25*RC[-11]*RC[-11]*SIN(2*RADIANS(RC[-12]))) -> -6.2922791818631296 | W200: =DEGREES(ACOS(COS(RADIANS(90.833))/(COS(RADIANS(R2C2))*COS(RADIANS(RC[-3])))-TAN(RADIANS(R2C2))*TAN(RADIANS(RC[-3])))) -> #NUM! | X200: =(720-4*R3C2-RC[-2]+R4C2*60)/1440 -> 1899-12-31T14:02:17.537 | Y200: =(RC[-1]*1440-RC[-2]*4)/1440 -> #NUM! | Z200: =(RC[-2]*1440+RC[-3]*4)/1440 -> #NUM! | AA200: =8*RC[-4] -> #NUM! | AB200: =MOD(RC[-23]*1440+RC[-6]+4*R3C2-60*R4C2,1440) -> 717.70772081813686 | AC200: =IF(RC[-1]/4<0,RC[-1]/4+180,RC[-1]/4-180) -> -0.57306979546578418 | AD200: =DEGREES(ACOS(SIN(RADIANS(R2C2))*SIN(RADIANS(RC[-10]))+COS(RADIANS(R2C2))*COS(RADIANS(RC[-10]))*COS(RADIANS(RC[-1])))) -> 49.134998432149978 | AE200: =90-RC[-1] -> 40.865001567850022 | AF200: =IF(RC[-1]>85,0,IF(RC[-1]>5,58.1/TAN(RADIANS(RC[-1]))-0.07/POWER(TAN(RADIANS(RC[-1])),3)+0.000086/POWER(TAN(RADIANS(RC[-1])),5),IF(RC[-1]>-0.575,1735+RC[-1]*(-518.2+RC[-1]*(103.4+RC[-1]*(-12.79+RC[-1]*0.711))),-20.772/TAN(RADIANS(RC[-1])))))/3600 -> 1.8624278135979288E-2 | AG200: =RC[-2]+RC[-1] -> 40.883625845986003 | AH200: =IF(RC[-5]>0,MOD(DEGREES(ACOS(((SIN(RADIANS(R2C2))*COS(RADIANS(RC[-4])))-SIN(RADIANS(RC[-14])))/(COS(RADIANS(R2C2))*SIN(RADIANS(RC[-4])))))+180,360),MOD(540-DEGREES(ACOS(((SIN(RADIANS(R2C2))*COS(RADIANS(RC[-4])))-SIN(RADIANS(RC[-14])))/(COS(RADIANS(R2C2))*SIN(RADIANS(RC[-4]))))),360)) -> 179.29191772859599
D201: =R[-1]C+1 -> 2017-07-19T00:00:00.000 | E201: =R5C2 -> 1899-12-31T14:00:00.000 | F201: =RC[-2]+2415018.5+RC[-1]-R4C2/24 -> 2457954.375 | G201: =(RC[-1]-2451545)/36525 -> 0.17547912388774811 | I201: =MOD(280.46646+RC[-2]*(36000.76983 + RC[-2]*0.0003032),360) -> 117.85001838928838 | J201: =357.52911+RC[-3]*(35999.05029 - 0.0001537*RC[-3]) -> 6674.6109109473127 | K201: =0.016708634-RC[-4]*(0.000042037+0.0000001267*RC[-4]) -> 1.6701253482605798E-2 | L201: =SIN(RADIANS(RC[-2]))*(1.914602-RC[-5]*(0.004817+0.000014*RC[-5]))+SIN(RADIANS(2*RC[-2]))*(0.019993-0.000101*RC[-5])+SIN(RADIANS(3*RC[-2]))*0.000289 -> -0.47320035886566658 | M201: =RC[-4]+RC[-1] -> 117.37681803042271 | N201: =RC[-4]+RC[-2] -> 6674.1377105884467 | O201: =(1.000001018*(1-RC[-4]*RC[-4]))/(1+RC[-4]*COS(RADIANS(RC[-1]))) -> 1.0161795165089562 | P201: =RC[-3]-0.00569-0.00478*SIN(RADIANS(125.04-1934.136*RC[-9])) -> 117.36843020846709 | Q201: =23+(26+((21.448-RC[-10]*(46.815+RC[-10]*(0.00059-RC[-10]*0.001813))))/60)/60 -> 23.437009149012205 | R201: =RC[-1]+0.00256*COS(RADIANS(125.04-1934.136*RC[-11])) -> 23.434895861628402 | S201: =DEGREES(ATAN2(COS(RADIANS(RC[-3])),COS(RADIANS(RC[-1]))*SIN(RADIANS(RC[-3])))) -> 119.43128050418059 | T201: =DEGREES(ASIN(SIN(RADIANS(RC[-2]))*SIN(RADIANS(RC[-4])))) -> 20.682614662094419 | U201: =TAN(RADIANS(RC[-3]/2))*TAN(RADIANS(RC[-3]/2)) -> 4.3017932533558796E-2 | V201: =4*DEGREES(RC[-1]*SIN(2*RADIANS(RC[-13]))-2*RC[-11]*SIN(RADIANS(RC[-12]))+4*RC[-11]*RC[-1]*SIN(RADIANS(RC[-12]))*COS(2*RADIANS(RC[-13]))-0.5*RC[-1]*RC[-1]*SIN(4*RADIANS(RC[-13]))-1.25*RC[-11]*RC[-11]*SIN(2*RADIANS(RC[-12]))) -> -6.3562402419171278 | W201: =DEGREES(ACOS(COS(RADIANS(90.833))/(COS(RADIANS(R2C2))*COS(RADIANS(RC[-3])))-TAN(RADIANS(R2C2))*TAN(RADIANS(RC[-3])))) -> #NUM! | X201: =(720-4*R3C2-RC[-2]+R4C2*60)/1440 -> 1899-12-31T14:02:21.374 | Y201: =(RC[-1]*1440-RC[-2]*4)/1440 -> #NUM! | Z201: =(RC[-2]*1440+RC[-3]*4)/1440 -> #NUM! | AA201: =8*RC[-4] -> #NUM! | AB201: =MOD(RC[-23]*1440+RC[-6]+4*R3C2-60*R4C2,1440) -> 717.64375975808287 | AC201: =IF(RC[-1]/4<0,RC[-1]/4+180,RC[-1]/4-180) -> -0.58906006047928372 | AD201: =DEGREES(ACOS(SIN(RADIANS(R2C2))*SIN(RADIANS(RC[-10]))+COS(RADIANS(R2C2))*COS(RADIANS(RC[-10]))*COS(RADIANS(RC[-1])))) -> 49.3186630068098 | AE201: =90-RC[-1] -> 40.6813369931902 | AF201: =IF(RC[-1]>85,0,IF(RC[-1]>5,58.1/TAN(RADIANS(RC[-1]))-0.07/POWER(TAN(RADIANS(RC[-1])),3)+0.000086/POWER(TAN(RADIANS(RC[-1])),5),IF(RC[-1]>-0.575,1735+RC[-1]*(-518.2+RC[-1]*(103.4+RC[-1]*(-12.79+RC[-1]*0.711))),-20.772/TAN(RADIANS(RC[-1])))))/3600 -> 1.8744991098547801E-2 | AG201: =RC[-2]+RC[-1] -> 40.700081984288751 | AH201: =IF(RC[-5]>0,MOD(DEGREES(ACOS(((SIN(RADIANS(R2C2))*COS(RADIANS(RC[-4])))-SIN(RADIANS(RC[-14])))/(COS(RADIANS(R2C2))*SIN(RADIANS(RC[-4])))))+180,360),MOD(540-DEGREES(ACOS(((SIN(RADIANS(R2C2))*COS(RADIANS(RC[-4])))-SIN(RADIANS(RC[-14])))/(COS(RADIANS(R2C2))*SIN(RADIANS(RC[-4]))))),360)) -> 179.2732863001047
D202: =R[-1]C+1 -> 2017-07-20T00:00:00.000 | E202: =R5C2 -> 1899-12-31T14:00:00.000 | F202: =RC[-2]+2415018.5+RC[-1]-R4C2/24 -> 2457955.375 | G202: =(RC[-1]-2451545)/36525 -> 0.17550650239561943 | I202: =MOD(280.46646+RC[-2]*(36000.76983 + RC[-2]*0.0003032),360) -> 118.83566575236637 | J202: =357.52911+RC[-3]*(35999.05029 - 0.0001537*RC[-3]) -> 6675.5965112275599 | K202: =0.016708634-RC[-4]*(0.000042037+0.0000001267*RC[-4]) -> 1.6701252330477943E-2 | L202: =SIN(RADIANS(RC[-2]))*(1.914602-RC[-5]*(0.004817+0.000014*RC[-5]))+SIN(RADIANS(2*RC[-2]))*(0.019993-0.000101*RC[-5])+SIN(RADIANS(3*RC[-2]))*0.000289 -> -0.50439970889149155 | M202: =RC[-4]+RC[-1] -> 118.33126604347487 | N202: =RC[-4]+RC[-2] -> 6675.0921115186684 | O202: =(1.000001018*(1-RC[-4]*RC[-4]))/(1+RC[-4]*COS(RADIANS(RC[-1]))) -> 1.0161070156344092 | P202: =RC[-3]-0.00569-0.00478*SIN(RADIANS(125.04-1934.136*RC[-9])) -> 118.32287457579895 | Q202: =23+(26+((21.448-RC[-10]*(46.815+RC[-10]*(0.00059-RC[-10]*0.001813))))/60)/60 -> 23.437008792977228 | R202: =RC[-1]+0.00256*COS(RADIANS(125.04-1934.136*RC[-11])) -> 23.43489684185931 | S202: =DEGREES(ATAN2(COS(RADIANS(RC[-3])),COS(RADIANS(RC[-1]))*SIN(RADIANS(RC[-3])))) -> 120.43056749378739 | T202: =DEGREES(ASIN(SIN(RADIANS(RC[-2]))*SIN(RADIANS(RC[-4])))) -> 20.493218686540651 | U202: =TAN(RADIANS(RC[-3]/2))*TAN(RADIANS(RC[-3]/2)) -> 4.3017936234586301E-2 | V202: =4*DEGREES(RC[-1]*SIN(2*RADIANS(RC[-13]))-2*RC[-11]*SIN(RADIANS(RC[-12]))+4*RC[-11]*RC[-1]*SIN(RADIANS(RC[-12]))*COS(2*RADIANS(RC[-13]))-0.5*RC[-1]*RC[-1]*SIN(4*RADIANS(RC[-13]))-1.25*RC[-11]*RC[-11]*SIN(2*RADIANS(RC[-12]))) -> -6.410913613865211 | W202: =DEGREES(ACOS(COS(RADIANS(90.833))/(COS(RADIANS(R2C2))*COS(RADIANS(RC[-3])))-TAN(RADIANS(R2C2))*TAN(RADIANS(RC[-3])))) -> #NUM! | X202: =(720-4*R3C2-RC[-2]+R4C2*60)/1440 -> 1899-12-31T14:02:24.655 | Y202: =(RC[-1]*1440-RC[-2]*4)/1440 -> #NUM! | Z202: =(RC[-2]*1440+RC[-3]*4)/1440 -> #NUM! | AA202: =8*RC[-4] -> #NUM! | AB202: =MOD(RC[-23]*1440+RC[-6]+4*R3C2-60*R4C2,1440) -> 717.5890863861348 | AC202: =IF(RC[-1]/4<0,RC[-1]/4+180,RC[-1]/4-180) -> -0.60272840346630119 | AD202: =DEGREES(ACOS(SIN(RADIANS(R2C2))*SIN(RADIANS(RC[-10]))+COS(RADIANS(R2C2))*COS(RADIANS(RC[-10]))*COS(RADIANS(RC[-1])))) -> 49.508116836777347 | AE202: =90-RC[-1] -> 40.491883163222653 | AF202: =IF(RC[-1]>85,0,IF(RC[-1]>5,58.1/TAN(RADIANS(RC[-1]))-0.07/POWER(TAN(RADIANS(RC[-1])),3)+0.000086/POWER(TAN(RADIANS(RC[-1])),5),IF(RC[-1]>-0.575,1735+RC[-1]*(-518.2+RC[-1]*(103.4+RC[-1]*(-12.79+RC[-1]*0.711))),-20.772/TAN(RADIANS(RC[-1])))))/3600 -> 1.8870447977938624E-2 | AG202: =RC[-2]+RC[-1] -> 40.510753611200592 | AH202: =IF(RC[-5]>0,MOD(DEGREES(ACOS(((SIN(RADIANS(R2C2))*COS(RADIANS(RC[-4])))-SIN(RADIANS(RC[-14])))/(COS(RADIANS(R2C2))*SIN(RADIANS(RC[-4])))))+180,360),MOD(540-DEGREES(ACOS(((SIN(RADIANS(R2C2))*COS(RADIANS(RC[-4])))-SIN(RADIANS(RC[-14])))/(COS(RADIANS(R2C2))*SIN(RADIANS(RC[-4]))))),360)) -> 179.25760577297604
D203: =R[-1]C+1 -> 2017-07-21T00:00:00.000 | E203: =R5C2 -> 1899-12-31T14:00:00.000 | F203: =RC[-2]+2415018.5+RC[-1]-R4C2/24 -> 2457956.375 | G203: =(RC[-1]-2451545)/36525 -> 0.17553388090349076 | I203: =MOD(280.46646+RC[-2]*(36000.76983 + RC[-2]*0.0003032),360) -> 119.82131311544344 | J203: =357.52911+RC[-3]*(35999.05029 - 0.0001537*RC[-3]) -> 6676.5821115078088 | K203: =0.016708634-RC[-4]*(0.000042037+0.0000001267*RC[-4]) -> 1.6701251178349898E-2 | L203: =SIN(RADIANS(RC[-2]))*(1.914602-RC[-5]*(0.004817+0.000014*RC[-5]))+SIN(RADIANS(2*RC[-2]))*(0.019993-0.000101*RC[-5])+SIN(RADIANS(3*RC[-2]))*0.000289 -> -0.53545848702781729 | M203: =RC[-4]+RC[-1] -> 119.28585462841563 | N203: =RC[-4]+RC[-2] -> 6676.0466530207814 | O203: =(1.000001018*(1-RC[-4]*RC[-4]))/(1+RC[-4]*COS(RADIANS(RC[-1]))) -> 1.0160298933634959 | P203: =RC[-3]-0.00569-0.00478*SIN(RADIANS(125.04-1934.136*RC[-9])) -> 119.27745951732695 | Q203: =23+(26+((21.448-RC[-10]*(46.815+RC[-10]*(0.00059-RC[-10]*0.001813))))/60)/60 -> 23.437008436942246 | R203: =RC[-1]+0.00256*COS(RADIANS(125.04-1934.136*RC[-11])) -> 23.434897823894193 | S203: =DEGREES(ATAN2(COS(RADIANS(RC[-3])),COS(RADIANS(RC[-1]))*SIN(RADIANS(RC[-3])))) -> 121.42749803701281 | T203: =DEGREES(ASIN(SIN(RADIANS(RC[-2]))*SIN(RADIANS(RC[-4])))) -> 20.29809242407083 | U203: =TAN(RADIANS(RC[-3]/2))*TAN(RADIANS(RC[-3]/2)) -> 4.3017939942425192E-2 | V203: =4*DEGREES(RC[-1]*SIN(2*RADIANS(RC[-13]))-2*RC[-11]*SIN(RADIANS(RC[-12]))+4*RC[-11]*RC[-1]*SIN(RADIANS(RC[-12]))*COS(2*RADIANS(RC[-13]))-0.5*RC[-1]*RC[-1]*SIN(4*RADIANS(RC[-13]))-1.25*RC[-11]*RC[-11]*SIN(2*RADIANS(RC[-12]))) -> -6.4561538800650604 | W203: =DEGREES(ACOS(COS(RADIANS(90.833))/(COS(RADIANS(R2C2))*COS(RADIANS(RC[-3])))-TAN(RADIANS(R2C2))*TAN(RADIANS(RC[-3])))) -> #NUM! | X203: =(720-4*R3C2-RC[-2]+R4C2*60)/1440 -> 1899-12-31T14:02:27.369 | Y203: =(RC[-1]*1440-RC[-2]*4)/1440 -> #NUM! | Z203: =(RC[-2]*1440+RC[-3]*4)/1440 -> #NUM! | AA203: =8*RC[-4] -> #NUM! | AB203: =MOD(RC[-23]*1440+RC[-6]+4*R3C2-60*R4C2,1440) -> 717.54384611993498 | AC203: =IF(RC[-1]/4<0,RC[-1]/4+180,RC[-1]/4-180) -> -0.61403847001625422 | AD203: =DEGREES(ACOS(SIN(RADIANS(R2C2))*SIN(RADIANS(RC[-10]))+COS(RADIANS(R2C2))*COS(RADIANS(RC[-10]))*COS(RADIANS(RC[-1])))) -> 49.703291430333429 | AE203: =90-RC[-1] -> 40.296708569666571 | AF203: =IF(RC[-1]>85,0,IF(RC[-1]>5,58.1/TAN(RADIANS(RC[-1]))-0.07/POWER(TAN(RADIANS(RC[-1])),3)+0.000086/POWER(TAN(RADIANS(RC[-1])),5),IF(RC[-1]>-0.575,1735+RC[-1]*(-518.2+RC[-1]*(103.4+RC[-1]*(-12.79+RC[-1]*0.711))),-20.772/TAN(RADIANS(RC[-1])))))/3600 -> 1.9000704643934985E-2 | AG203: =RC[-2]+RC[-1] -> 40.315709274310507 | AH203: =IF(RC[-5]>0,MOD(DEGREES(ACOS(((SIN(RADIANS(R2C2))*COS(RADIANS(RC[-4])))-SIN(RADIANS(RC[-14])))/(COS(RADIANS(R2C2))*SIN(RADIANS(RC[-4])))))+180,360),MOD(540-DEGREES(ACOS(((SIN(RADIANS(R2C2))*COS(RADIANS(RC[-4])))-SIN(RADIANS(RC[-14])))/(COS(RADIANS(R2C2))*SIN(RADIANS(RC[-4]))))),360)) -> 179.24490824132977
D204: =R[-1]C+1 -> 2017-07-22T00:00:00.000 | E204: =R5C2 -> 1899-12-31T14:00:00.000 | F204: =RC[-2]+2415018.5+RC[-1]-R4C2/24 -> 2457957.375 | G204: =(RC[-1]-2451545)/36525 -> 0.17556125941136208 | I204: =MOD(280.46646+RC[-2]*(36000.76983 + RC[-2]*0.0003032),360) -> 120.80696047852234 | J204: =357.52911+RC[-3]*(35999.05029 - 0.0001537*RC[-3]) -> 6677.567711788055 | K204: =0.016708634-RC[-4]*(0.000042037+0.0000001267*RC[-4]) -> 1.6701250026221665E-2 | L204: =SIN(RADIANS(RC[-2]))*(1.914602-RC[-5]*(0.004817+0.000014*RC[-5]))+SIN(RADIANS(2*RC[-2]))*(0.019993-0.000101*RC[-5])+SIN(RADIANS(3*RC[-2]))*0.000289 -> -0.56636799575926533 | M204: =RC[-4]+RC[-1] -> 120.24059248276308 | N204: =RC[-4]+RC[-2] -> 6677.0013437922953 | O204: =(1.000001018*(1-RC[-4]*RC[-4]))/(1+RC[-4]*COS(RADIANS(RC[-1]))) -> 1.0159481704016646 | P204: =RC[-3]-0.00569-0.00478*SIN(RADIANS(125.04-1934.136*RC[-9])) -> 120.23219373057228 | Q204: =23+(26+((21.448-RC[-10]*(46.815+RC[-10]*(0.00059-RC[-10]*0.001813))))/60)/60 -> 23.437008080907265 | R204: =RC[-1]+0.00256*COS(RADIANS(125.04-1934.136*RC[-11])) -> 23.434898807731912 | S204: =DEGREES(ATAN2(COS(RADIANS(RC[-3])),COS(RADIANS(RC[-1]))*SIN(RADIANS(RC[-3])))) -> 122.42203946613886 | T204: =DEGREES(ASIN(SIN(RADIANS(RC[-2]))*SIN(RADIANS(RC[-4])))) -> 20.097304933931358 | U204: =TAN(RADIANS(RC[-3]/2))*TAN(RADIANS(RC[-3]/2)) -> 4.3017943657071171E-2 | V204: =4*DEGREES(RC[-1]*SIN(2*RADIANS(RC[-13]))-2*RC[-11]*SIN(RADIANS(RC[-12]))+4*RC[-11]*RC[-1]*SIN(RADIANS(RC[-12]))*COS(2*RADIANS(RC[-13]))-0.5*RC[-1]*RC[-1]*SIN(4*RADIANS(RC[-13]))-1.25*RC[-11]*RC[-11]*SIN(2*RADIANS(RC[-12]))) -> -6.4918292484310545 | W204: =DEGREES(ACOS(COS(RADIANS(90.833))/(COS(RADIANS(R2C2))*COS(RADIANS(RC[-3])))-TAN(RADIANS(R2C2))*TAN(RADIANS(RC[-3])))) -> #NUM! | X204: =(720-4*R3C2-RC[-2]+R4C2*60)/1440 -> 1899-12-31T14:02:29.510 | Y204: =(RC[-1]*1440-RC[-2]*4)/1440 -> #NUM! | Z204: =(RC[-2]*1440+RC[-3]*4)/1440 -> #NUM! | AA204: =8*RC[-4] -> #NUM! | AB204: =MOD(RC[-23]*1440+RC[-6]+4*R3C2-60*R4C2,1440) -> 717.50817075156897 | AC204: =IF(RC[-1]/4<0,RC[-1]/4+180,RC[-1]/4-180) -> -0.62295731210775784 | AD204: =DEGREES(ACOS(SIN(RADIANS(R2C2))*SIN(RADIANS(RC[-10]))+COS(RADIANS(R2C2))*COS(RADIANS(RC[-10]))*COS(RADIANS(RC[-1])))) -> 49.904117032881935 | AE204: =90-RC[-1] -> 40.095882967118065 | AF204: =IF(RC[-1]>85,0,IF(RC[-1]>5,58.1/TAN(RADIANS(RC[-1]))-0.07/POWER(TAN(RADIANS(RC[-1])),3)+0.000086/POWER(TAN(RADIANS(RC[-1])),5),IF(RC[-1]>-0.575,1735+RC[-1]*(-518.2+RC[-1]*(103.4+RC[-1]*(-12.79+RC[-1]*0.711))),-20.772/TAN(RADIANS(RC[-1])))))/3600 -> 1.9135820192652257E-2 | AG204: =RC[-2]+RC[-1] -> 40.115018787310717 | AH204: =IF(RC[-5]>0,MOD(DEGREES(ACOS(((SIN(RADIANS(R2C2))*COS(RADIANS(RC[-4])))-SIN(RADIANS(RC[-14])))/(COS(RADIANS(R2C2))*SIN(RADIANS(RC[-4])))))+180,360),MOD(540-DEGREES(ACOS(((SIN(RADIANS(R2C2))*COS(RADIANS(RC[-4])))-SIN(RADIANS(RC[-14])))/(COS(RADIANS(R2C2))*SIN(RADIANS(RC[-4]))))),360)) -> 179.23522057299681
D205: =R[-1]C+1 -> 2017-07-23T00:00:00.000 | E205: =R5C2 -> 1899-12-31T14:00:00.000 | F205: =RC[-2]+2415018.5+RC[-1]-R4C2/24 -> 2457958.375 | G205: =(RC[-1]-2451545)/36525 -> 0.1755886379192334 | I205: =MOD(280.46646+RC[-2]*(36000.76983 + RC[-2]*0.0003032),360) -> 121.79260784160215 | J205: =357.52911+RC[-3]*(35999.05029 - 0.0001537*RC[-3]) -> 6678.5533120683031 | K205: =0.016708634-RC[-4]*(0.000042037+0.0000001267*RC[-4]) -> 1.6701248874093241E-2 | L205: =SIN(RADIANS(RC[-2]))*(1.914602-RC[-5]*(0.004817+0.000014*RC[-5]))+SIN(RADIANS(2*RC[-2]))*(0.019993-0.000101*RC[-5])+SIN(RADIANS(3*RC[-2]))*0.000289 -> -0.59711957165134821 | M205: =RC[-4]+RC[-1] -> 121.1954882699508 | N205: =RC[-4]+RC[-2] -> 6677.956192496652 | O205: =(1.000001018*(1-RC[-4]*RC[-4]))/(1+RC[-4]*COS(RADIANS(RC[-1]))) -> 1.0158618686999812 | P205: =RC[-3]-0.00569-0.00478*SIN(RADIANS(125.04-1934.136*RC[-9])) -> 121.18708587897163 | Q205: =23+(26+((21.448-RC[-10]*(46.815+RC[-10]*(0.00059-RC[-10]*0.001813))))/60)/60 -> 23.437007724872284 | R205: =RC[-1]+0.00256*COS(RADIANS(125.04-1934.136*RC[-11])) -> 23.434899793371329 | S205: =DEGREES(ATAN2(COS(RADIANS(RC[-3])),COS(RADIANS(RC[-1]))*SIN(RADIANS(RC[-3])))) -> 123.41416246950473 | T205: =DEGREES(ASIN(SIN(RADIANS(RC[-2]))*SIN(RADIANS(RC[-4])))) -> 19.890926608681614 | U205: =TAN(RADIANS(RC[-3]/2))*TAN(RADIANS(RC[-3]/2)) -> 4.3017947378519932E-2 | V205: =4*DEGREES(RC[-1]*SIN(2*RADIANS(RC[-13]))-2*RC[-11]*SIN(RADIANS(RC[-12]))+4*RC[-11]*RC[-1]*SIN(RADIANS(RC[-12]))*COS(2*RADIANS(RC[-13]))-0.5*RC[-1]*RC[-1]*SIN(4*RADIANS(RC[-13]))-1.25*RC[-11]*RC[-11]*SIN(2*RADIANS(RC[-12]))) -> -6.5178216104927857 | W205: =DEGREES(ACOS(COS(RADIANS(90.833))/(COS(RADIANS(R2C2))*COS(RADIANS(RC[-3])))-TAN(RADIANS(R2C2))*TAN(RADIANS(RC[-3])))) -> #NUM! | X205: =(720-4*R3C2-RC[-2]+R4C2*60)/1440 -> 1899-12-31T14:02:31.069 | Y205: =(RC[-1]*1440-RC[-2]*4)/1440 -> #NUM! | Z205: =(RC[-2]*1440+RC[-3]*4)/1440 -> #NUM! | AA205: =8*RC[-4] -> #NUM! | AB205: =MOD(RC[-23]*1440+RC[-6]+4*R3C2-60*R4C2,1440) -> 717.48217838950723 | AC205: =IF(RC[-1]/4<0,RC[-1]/4+180,RC[-1]/4-180) -> -0.62945540262319355 | AD205: =DEGREES(ACOS(SIN(RADIANS(R2C2))*SIN(RADIANS(RC[-10]))+COS(RADIANS(R2C2))*COS(RADIANS(RC[-10]))*COS(RADIANS(RC[-1])))) -> 50.110522695375948 | AE205: =90-RC[-1] -> 39.889477304624052 | AF205: =IF(RC[-1]>85,0,IF(RC[-1]>5,58.1/TAN(RADIANS(RC[-1]))-0.07/POWER(TAN(RADIANS(RC[-1])),3)+0.000086/POWER(TAN(RADIANS(RC[-1])),5),IF(RC[-1]>-0.575,1735+RC[-1]*(-518.2+RC[-1]*(103.4+RC[-1]*(-12.79+RC[-1]*0.711))),-20.772/TAN(RADIANS(RC[-1])))))/3600 -> 1.9275857082850976E-2 | AG205: =RC[-2]+RC[-1] -> 39.908753161706905 | AH205: =IF(RC[-5]>0,MOD(DEGREES(ACOS(((SIN(RADIANS(R2C2))*COS(RADIANS(RC[-4])))-SIN(RADIANS(RC[-14])))/(COS(RADIANS(R2C2))*SIN(RADIANS(RC[-4])))))+180,360),MOD(540-DEGREES(ACOS(((SIN(RADIANS(R2C2))*COS(RADIANS(RC[-4])))-SIN(RADIANS(RC[-14])))/(COS(RADIANS(R2C2))*SIN(RADIANS(RC[-4]))))),360)) -> 179.22856444982267
D206: =R[-1]C+1 -> 2017-07-24T00:00:00.000 | E206: =R5C2 -> 1899-12-31T14:00:00.000 | F206: =RC[-2]+2415018.5+RC[-1]-R4C2/24 -> 2457959.375 | G206: =(RC[-1]-2451545)/36525 -> 0.17561601642710473 | I206: =MOD(280.46646+RC[-2]*(36000.76983 + RC[-2]*0.0003032),360) -> 122.77825520468195 | J206: =357.52911+RC[-3]*(35999.05029 - 0.0001537*RC[-3]) -> 6679.5389123485502 | K206: =0.016708634-RC[-4]*(0.000042037+0.0000001267*RC[-4]) -> 1.6701247721964626E-2 | L206: =SIN(RADIANS(RC[-2]))*(1.914602-RC[-5]*(0.004817+0.000014*RC[-5]))+SIN(RADIANS(2*RC[-2]))*(0.019993-0.000101*RC[-5])+SIN(RADIANS(3*RC[-2]))*0.000289 -> -0.62770458737479951 | M206: =RC[-4]+RC[-1] -> 122.15055061730716 | N206: =RC[-4]+RC[-2] -> 6678.9112077611753 | O206: =(1.000001018*(1-RC[-4]*RC[-4]))/(1+RC[-4]*COS(RADIANS(RC[-1]))) -> 1.0157710114510552 | P206: =RC[-3]-0.00569-0.00478*SIN(RADIANS(125.04-1934.136*RC[-9])) -> 122.14214458985649 | Q206: =23+(26+((21.448-RC[-10]*(46.815+RC[-10]*(0.00059-RC[-10]*0.001813))))/60)/60 -> 23.437007368837307 | R206: =RC[-1]+0.00256*COS(RADIANS(125.04-1934.136*RC[-11])) -> 23.434900780811297 | S206: =DEGREES(ATAN2(COS(RADIANS(RC[-3])),COS(RADIANS(RC[-1]))*SIN(RADIANS(RC[-3])))) -> 124.40384109360146 | T206: =DEGREES(ASIN(SIN(RADIANS(RC[-2]))*SIN(RADIANS(RC[-4])))) -> 19.67902911276742 | U206: =TAN(RADIANS(RC[-3]/2))*TAN(RADIANS(RC[-3]/2)) -> 4.3017951106767149E-2 | V206: =4*DEGREES(RC[-1]*SIN(2*RADIANS(RC[-13]))-2*RC[-11]*SIN(RADIANS(RC[-12]))+4*RC[-11]*RC[-1]*SIN(RADIANS(RC[-12]))*COS(2*RADIANS(RC[-13]))-0.5*RC[-1]*RC[-1]*SIN(4*RADIANS(RC[-13]))-1.25*RC[-11]*RC[-11]*SIN(2*RADIANS(RC[-12]))) -> -6.534026571759072 | W206: =DEGREES(ACOS(COS(RADIANS(90.833))/(COS(RADIANS(R2C2))*COS(RADIANS(RC[-3])))-TAN(RADIANS(R2C2))*TAN(RADIANS(RC[-3])))) -> #NUM! | X206: =(720-4*R3C2-RC[-2]+R4C2*60)/1440 -> 1899-12-31T14:02:32.042 | Y206: =(RC[-1]*1440-RC[-2]*4)/1440 -> #NUM! | Z206: =(RC[-2]*1440+RC[-3]*4)/1440 -> #NUM! | AA206: =8*RC[-4] -> #NUM! | AB206: =MOD(RC[-23]*1440+RC[-6]+4*R3C2-60*R4C2,1440) -> 717.46597342824089 | AC206: =IF(RC[-1]/4<0,RC[-1]/4+180,RC[-1]/4-180) -> -0.63350664293977843 | AD206: =DEGREES(ACOS(SIN(RADIANS(R2C2))*SIN(RADIANS(RC[-10]))+COS(RADIANS(R2C2))*COS(RADIANS(RC[-10]))*COS(RADIANS(RC[-1])))) -> 50.322436341061916 | AE206: =90-RC[-1] -> 39.677563658938084 | AF206: =IF(RC[-1]>85,0,IF(RC[-1]>5,58.1/TAN(RADIANS(RC[-1]))-0.07/POWER(TAN(RADIANS(RC[-1])),3)+0.000086/POWER(TAN(RADIANS(RC[-1])),5),IF(RC[-1]>-0.575,1735+RC[-1]*(-518.2+RC[-1]*(103.4+RC[-1]*(-12.79+RC[-1]*0.711))),-20.772/TAN(RADIANS(RC[-1])))))/3600 -> 1.9420881278838707E-2 | AG206: =RC[-2]+RC[-1] -> 39.696984540216924 | AH206: =IF(RC[-5]>0,MOD(DEGREES(ACOS(((SIN(RADIANS(R2C2))*COS(RADIANS(RC[-4])))-SIN(RADIANS(RC[-14])))/(COS(RADIANS(R2C2))*SIN(RADIANS(RC[-4])))))+180,360),MOD(540-DEGREES(ACOS(((SIN(RADIANS(R2C2))*COS(RADIANS(RC[-4])))-SIN(RADIANS(RC[-14])))/(COS(RADIANS(R2C2))*SIN(RADIANS(RC[-4]))))),360)) -> 179.22495642014405
D207: =R[-1]C+1 -> 2017-07-25T00:00:00.000 | E207: =R5C2 -> 1899-12-31T14:00:00.000 | F207: =RC[-2]+2415018.5+RC[-1]-R4C2/24 -> 2457960.375 | G207: =(RC[-1]-2451545)/36525 -> 0.17564339493497605 | I207: =MOD(280.46646+RC[-2]*(36000.76983 + RC[-2]*0.0003032),360) -> 123.76390256776267 | J207: =357.52911+RC[-3]*(35999.05029 - 0.0001537*RC[-3]) -> 6680.5245126287964 | K207: =0.016708634-RC[-4]*(0.000042037+0.0000001267*RC[-4]) -> 1.670124656983582E-2 | L207: =SIN(RADIANS(RC[-2]))*(1.914602-RC[-5]*(0.004817+0.000014*RC[-5]))+SIN(RADIANS(2*RC[-2]))*(0.019993-0.000101*RC[-5])+SIN(RADIANS(3*RC[-2]))*0.000289 -> -0.65811445373065036 | M207: =RC[-4]+RC[-1] -> 123.10578811403202 | N207: =RC[-4]+RC[-2] -> 6679.866398175066 | O207: =(1.000001018*(1-RC[-4]*RC[-4]))/(1+RC[-4]*COS(RADIANS(RC[-1]))) -> 1.0156756230847241 | P207: =RC[-3]-0.00569-0.00478*SIN(RADIANS(125.04-1934.136*RC[-9])) -> 123.09737845242982 | Q207: =23+(26+((21.448-RC[-10]*(46.815+RC[-10]*(0.00059-RC[-10]*0.001813))))/60)/60 -> 23.437007012802326 | R207: =RC[-1]+0.00256*COS(RADIANS(125.04-1934.136*RC[-11])) -> 23.434901770050665 | S207: =DEGREES(ATAN2(COS(RADIANS(RC[-3])),COS(RADIANS(RC[-1]))*SIN(RADIANS(RC[-3])))) -> 125.3910527392333 | T207: =DEGREES(ASIN(SIN(RADIANS(RC[-2]))*SIN(RADIANS(RC[-4])))) -> 19.461685321904078 | U207: =TAN(RADIANS(RC[-3]/2))*TAN(RADIANS(RC[-3]/2)) -> 4.3017954841808502E-2 | V207: =4*DEGREES(RC[-1]*SIN(2*RADIANS(RC[-13]))-2*RC[-11]*SIN(RADIANS(RC[-12]))+4*RC[-11]*RC[-1]*SIN(RADIANS(RC[-12]))*COS(2*RADIANS(RC[-13]))-0.5*RC[-1]*RC[-1]*SIN(4*RADIANS(RC[-13]))-1.25*RC[-11]*RC[-11]*SIN(2*RADIANS(RC[-12]))) -> -6.5403534549704379 | W207: =DEGREES(ACOS(COS(RADIANS(90.833))/(COS(RADIANS(R2C2))*COS(RADIANS(RC[-3])))-TAN(RADIANS(R2C2))*TAN(RADIANS(RC[-3])))) -> #NUM! | X207: =(720-4*R3C2-RC[-2]+R4C2*60)/1440 -> 1899-12-31T14:02:32.421 | Y207: =(RC[-1]*1440-RC[-2]*4)/1440 -> #NUM! | Z207: =(RC[-2]*1440+RC[-3]*4)/1440 -> #NUM! | AA207: =8*RC[-4] -> #NUM! | AB207: =MOD(RC[-23]*1440+RC[-6]+4*R3C2-60*R4C2,1440) -> 717.45964654502961 | AC207: =IF(RC[-1]/4<0,RC[-1]/4+180,RC[-1]/4-180) -> -0.63508836374259658 | AD207: =DEGREES(ACOS(SIN(RADIANS(R2C2))*SIN(RADIANS(RC[-10]))+COS(RADIANS(R2C2))*COS(RADIANS(RC[-10]))*COS(RADIANS(RC[-1])))) -> 50.53978483038194 | AE207: =90-RC[-1] -> 39.46021516961806 | AF207: =IF(RC[-1]>85,0,IF(RC[-1]>5,58.1/TAN(RADIANS(RC[-1]))-0.07/POWER(TAN(RADIANS(RC[-1])),3)+0.000086/POWER(TAN(RADIANS(RC[-1])),5),IF(RC[-1]>-0.575,1735+RC[-1]*(-518.2+RC[-1]*(103.4+RC[-1]*(-12.79+RC[-1]*0.711))),-20.772/TAN(RADIANS(RC[-1])))))/3600 -> 1.9570962400293809E-2 | AG207: =RC[-2]+RC[-1] -> 39.479786132018354 | AH207: =IF(RC[-5]>0,MOD(DEGREES(ACOS(((SIN(RADIANS(R2C2))*COS(RADIANS(RC[-4])))-SIN(RADIANS(RC[-14])))/(COS(RADIANS(R2C2))*SIN(RADIANS(RC[-4])))))+180,360),MOD(540-DEGREES(ACOS(((SIN(RADIANS(R2C2))*COS(RADIANS(RC[-4])))-SIN(RADIANS(RC[-14])))/(COS(RADIANS(R2C2))*SIN(RADIANS(RC[-4]))))),360)) -> 179.2244079627103
D208: =R[-1]C+1 -> 2017-07-26T00:00:00.000 | E208: =R5C2 -> 1899-12-31T14:00:00.000 | F208: =RC[-2]+2415018.5+RC[-1]-R4C2/24 -> 2457961.375 | G208: =(RC[-1]-2451545)/36525 -> 0.17567077344284737 | I208: =MOD(280.46646+RC[-2]*(36000.76983 + RC[-2]*0.0003032),360) -> 124.74954993084339 | J208: =357.52911+RC[-3]*(35999.05029 - 0.0001537*RC[-3]) -> 6681.5101129090435 | K208: =0.016708634-RC[-4]*(0.000042037+0.0000001267*RC[-4]) -> 1.6701245417706827E-2 | L208: =SIN(RADIANS(RC[-2]))*(1.914602-RC[-5]*(0.004817+0.000014*RC[-5]))+SIN(RADIANS(2*RC[-2]))*(0.019993-0.000101*RC[-5])+SIN(RADIANS(3*RC[-2]))*0.000289 -> -0.68834062167457066 | M208: =RC[-4]+RC[-1] -> 124.06120930916882 | N208: =RC[-4]+RC[-2] -> 6680.8217722873687 | O208: =(1.000001018*(1-RC[-4]*RC[-4]))/(1+RC[-4]*COS(RADIANS(RC[-1]))) -> 1.0155757292634933 | P208: =RC[-3]-0.00569-0.00478*SIN(RADIANS(125.04-1934.136*RC[-9])) -> 124.05279601573815 | Q208: =23+(26+((21.448-RC[-10]*(46.815+RC[-10]*(0.00059-RC[-10]*0.001813))))/60)/60 -> 23.437006656767348 | R208: =RC[-1]+0.00256*COS(RADIANS(125.04-1934.136*RC[-11])) -> 23.434902761088285 | S208: =DEGREES(ATAN2(COS(RADIANS(RC[-3])),COS(RADIANS(RC[-1]))*SIN(RADIANS(RC[-3])))) -> 126.3757781519939 | T208: =DEGREES(ASIN(SIN(RADIANS(RC[-2]))*SIN(RADIANS(RC[-4])))) -> 19.238969263399778 | U208: =TAN(RADIANS(RC[-3]/2))*TAN(RADIANS(RC[-3]/2)) -> 4.3017958583639611E-2 | V208: =4*DEGREES(RC[-1]*SIN(2*RADIANS(RC[-13]))-2*RC[-11]*SIN(RADIANS(RC[-12]))+4*RC[-11]*RC[-1]*SIN(RADIANS(RC[-12]))*COS(2*RADIANS(RC[-13]))-0.5*RC[-1]*RC[-1]*SIN(4*RADIANS(RC[-13]))-1.25*RC[-11]*RC[-11]*SIN(2*RADIANS(RC[-12]))) -> -6.5367252769300306 | W208: =DEGREES(ACOS(COS(RADIANS(90.833))/(COS(RADIANS(R2C2))*COS(RADIANS(RC[-3])))-TAN(RADIANS(R2C2))*TAN(RADIANS(RC[-3])))) -> #NUM! | X208: =(720-4*R3C2-RC[-2]+R4C2*60)/1440 -> 1899-12-31T14:02:32.204 | Y208: =(RC[-1]*1440-RC[-2]*4)/1440 -> #NUM! | Z208: =(RC[-2]*1440+RC[-3]*4)/1440 -> #NUM! | AA208: =8*RC[-4] -> #NUM! | AB208: =MOD(RC[-23]*1440+RC[-6]+4*R3C2-60*R4C2,1440) -> 717.46327472306996 | AC208: =IF(RC[-1]/4<0,RC[-1]/4+180,RC[-1]/4-180) -> -0.63418131923251053 | AD208: =DEGREES(ACOS(SIN(RADIANS(R2C2))*SIN(RADIANS(RC[-10]))+COS(RADIANS(R2C2))*COS(RADIANS(RC[-10]))*COS(RADIANS(RC[-1])))) -> 50.762494023891946 | AE208: =90-RC[-1] -> 39.237505976108054 | AF208: =IF(RC[-1]>85,0,IF(RC[-1]>5,58.1/TAN(RADIANS(RC[-1]))-0.07/POWER(TAN(RADIANS(RC[-1])),3)+0.000086/POWER(TAN(RADIANS(RC[-1])),5),IF(RC[-1]>-0.575,1735+RC[-1]*(-518.2+RC[-1]*(103.4+RC[-1]*(-12.79+RC[-1]*0.711))),-20.772/TAN(RADIANS(RC[-1])))))/3600 -> 1.9726173879377105E-2 | AG208: =RC[-2]+RC[-1] -> 39.257232149987431 | AH208: =IF(RC[-5]>0,MOD(DEGREES(ACOS(((SIN(RADIANS(R2C2))*COS(RADIANS(RC[-4])))-SIN(RADIANS(RC[-14])))/(COS(RADIANS(R2C2))*SIN(RADIANS(RC[-4])))))+180,360),MOD(540-DEGREES(ACOS(((SIN(RADIANS(R2C2))*COS(RADIANS(RC[-4])))-SIN(RADIANS(RC[-14])))/(COS(RADIANS(R2C2))*SIN(RADIANS(RC[-4]))))),360)) -> 179.22692556150673
D209: =R[-1]C+1 -> 2017-07-27T00:00:00.000 | E209: =R5C2 -> 1899-12-31T14:00:00.000 | F209: =RC[-2]+2415018.5+RC[-1]-R4C2/24 -> 2457962.375 | G209: =(RC[-1]-2451545)/36525 -> 0.1756981519507187 | I209: =MOD(280.46646+RC[-2]*(36000.76983 + RC[-2]*0.0003032),360) -> 125.7351972939241 | J209: =357.52911+RC[-3]*(35999.05029 - 0.0001537*RC[-3]) -> 6682.4957131892897 | K209: =0.016708634-RC[-4]*(0.000042037+0.0000001267*RC[-4]) -> 1.6701244265577644E-2 | L209: =SIN(RADIANS(RC[-2]))*(1.914602-RC[-5]*(0.004817+0.000014*RC[-5]))+SIN(RADIANS(2*RC[-2]))*(0.019993-0.000101*RC[-5])+SIN(RADIANS(3*RC[-2]))*0.000289 -> -0.71837458434071821 | M209: =RC[-4]+RC[-1] -> 125.01682270958338 | N209: =RC[-4]+RC[-2] -> 6681.7773386049494 | O209: =(1.000001018*(1-RC[-4]*RC[-4]))/(1+RC[-4]*COS(RADIANS(RC[-1]))) -> 1.015471356877732 | P209: =RC[-3]-0.00569-0.00478*SIN(RADIANS(125.04-1934.136*RC[-9])) -> 125.00840578665044 | Q209: =23+(26+((21.448-RC[-10]*(46.815+RC[-10]*(0.00059-RC[-10]*0.001813))))/60)/60 -> 23.437006300732367 | R209: =RC[-1]+0.00256*COS(RADIANS(125.04-1934.136*RC[-11])) -> 23.434903753923003 | S209: =DEGREES(ATAN2(COS(RADIANS(RC[-3])),COS(RADIANS(RC[-1]))*SIN(RADIANS(RC[-3])))) -> 127.35800140732819 | T209: =DEGREES(ASIN(SIN(RADIANS(RC[-2]))*SIN(RADIANS(RC[-4])))) -> 19.010956057539467 | U209: =TAN(RADIANS(RC[-3]/2))*TAN(RADIANS(RC[-3]/2)) -> 4.3017962332256167E-2 | V209: =4*DEGREES(RC[-1]*SIN(2*RADIANS(RC[-13]))-2*RC[-11]*SIN(RADIANS(RC[-12]))+4*RC[-11]*RC[-1]*SIN(RADIANS(RC[-12]))*COS(2*RADIANS(RC[-13]))-0.5*RC[-1]*RC[-1]*SIN(4*RADIANS(RC[-13]))-1.25*RC[-11]*RC[-11]*SIN(2*RADIANS(RC[-12]))) -> -6.52307869968348 | W209: =DEGREES(ACOS(COS(RADIANS(90.833))/(COS(RADIANS(R2C2))*COS(RADIANS(RC[-3])))-TAN(RADIANS(R2C2))*TAN(RADIANS(RC[-3])))) -> 172.5590064751714 | X209: =(720-4*R3C2-RC[-2]+R4C2*60)/1440 -> 1899-12-31T14:02:31.385 | Y209: =(RC[-1]*1440-RC[-2]*4)/1440 -> 1899-12-31T02:32:17.223 | Z209: =(RC[-2]*1440+RC[-3]*4)/1440 -> 1900-01-01T01:32:45.546 | AA209: =8*RC[-4] -> 1380.4720518013712 | AB209: =MOD(RC[-23]*1440+RC[-6]+4*R3C2-60*R4C2,1440) -> 717.47692130031658 | AC209: =IF(RC[-1]/4<0,RC[-1]/4+180,RC[-1]/4-180) -> -0.630769674920856 | AD209: =DEGREES(ACOS(SIN(RADIANS(R2C2))*SIN(RADIANS(RC[-10]))+COS(RADIANS(R2C2))*COS(RADIANS(RC[-10]))*COS(RADIANS(RC[-1])))) -> 50.990488843072932 | AE209: =90-RC[-1] -> 39.009511156927068 | AF209: =IF(RC[-1]>85,0,IF(RC[-1]>5,58.1/TAN(RADIANS(RC[-1]))-0.07/POWER(TAN(RADIANS(RC[-1])),3)+0.000086/POWER(TAN(RADIANS(RC[-1])),5),IF(RC[-1]>-0.575,1735+RC[-1]*(-518.2+RC[-1]*(103.4+RC[-1]*(-12.79+RC[-1]*0.711))),-20.772/TAN(RADIANS(RC[-1])))))/3600 -> 1.9886593125532516E-2 | AG209: =RC[-2]+RC[-1] -> 39.029397750052603 | AH209: =IF(RC[-5]>0,MOD(DEGREES(ACOS(((SIN(RADIANS(R2C2))*COS(RADIANS(RC[-4])))-SIN(RADIANS(RC[-14])))/(COS(RADIANS(R2C2))*SIN(RADIANS(RC[-4])))))+180,360),MOD(540-DEGREES(ACOS(((SIN(RADIANS(R2C2))*COS(RADIANS(RC[-4])))-SIN(RADIANS(RC[-14])))/(COS(RADIANS(R2C2))*SIN(RADIANS(RC[-4]))))),360)) -> 179.2325107907227
D210: =R[-1]C+1 -> 2017-07-28T00:00:00.000 | E210: =R5C2 -> 1899-12-31T14:00:00.000 | F210: =RC[-2]+2415018.5+RC[-1]-R4C2/24 -> 2457963.375 | G210: =(RC[-1]-2451545)/36525 -> 0.17572553045859002 | I210: =MOD(280.46646+RC[-2]*(36000.76983 + RC[-2]*0.0003032),360) -> 126.72084465700573 | J210: =357.52911+RC[-3]*(35999.05029 - 0.0001537*RC[-3]) -> 6683.4813134695351 | K210: =0.016708634-RC[-4]*(0.000042037+0.0000001267*RC[-4]) -> 1.6701243113448269E-2 | L210: =SIN(RADIANS(RC[-2]))*(1.914602-RC[-5]*(0.004817+0.000014*RC[-5]))+SIN(RADIANS(2*RC[-2]))*(0.019993-0.000101*RC[-5])+SIN(RADIANS(3*RC[-2]))*0.000289 -> -0.74820787906557962 | M210: =RC[-4]+RC[-1] -> 125.97263677794015 | N210: =RC[-4]+RC[-2] -> 6682.7331055904697 | O210: =(1.000001018*(1-RC[-4]*RC[-4]))/(1+RC[-4]*COS(RADIANS(RC[-1]))) -> 1.0153625340406223 | P210: =RC[-3]-0.00569-0.00478*SIN(RADIANS(125.04-1934.136*RC[-9])) -> 125.96421622783421 | Q210: =23+(26+((21.448-RC[-10]*(46.815+RC[-10]*(0.00059-RC[-10]*0.001813))))/60)/60 -> 23.43700594469739 | R210: =RC[-1]+0.00256*COS(RADIANS(125.04-1934.136*RC[-11])) -> 23.434904748553674 | S210: =DEGREES(ATAN2(COS(RADIANS(RC[-3])),COS(RADIANS(RC[-1]))*SIN(RADIANS(RC[-3])))) -> 128.3377098904391 | T210: =DEGREES(ASIN(SIN(RADIANS(RC[-2]))*SIN(RADIANS(RC[-4])))) -> 18.777721860145569 | U210: =TAN(RADIANS(RC[-3]/2))*TAN(RADIANS(RC[-3]/2)) -> 4.3017966087653813E-2 | V210: =4*DEGREES(RC[-1]*SIN(2*RADIANS(RC[-13]))-2*RC[-11]*SIN(RADIANS(RC[-12]))+4*RC[-11]*RC[-1]*SIN(RADIANS(RC[-12]))*COS(2*RADIANS(RC[-13]))-0.5*RC[-1]*RC[-1]*SIN(4*RADIANS(RC[-13]))-1.25*RC[-11]*RC[-11]*SIN(2*RADIANS(RC[-12]))) -> -6.499363956895591 | W210: =DEGREES(ACOS(COS(RADIANS(90.833))/(COS(RADIANS(R2C2))*COS(RADIANS(RC[-3])))-TAN(RADIANS(R2C2))*TAN(RADIANS(RC[-3])))) -> 168.24333827503287 | X210: =(720-4*R3C2-RC[-2]+R4C2*60)/1440 -> 1899-12-31T14:02:29.962 | Y210: =(RC[-1]*1440-RC[-2]*4)/1440 -> 1899-12-31T02:49:31.561 | Z210: =(RC[-2]*1440+RC[-3]*4)/1440 -> 1900-01-01T01:15:28.363 | AA210: =8*RC[-4] -> 1345.946706200263 | AB210: =MOD(RC[-23]*1440+RC[-6]+4*R3C2-60*R4C2,1440) -> 717.50063604310446 | AC210: =IF(RC[-1]/4<0,RC[-1]/4+180,RC[-1]/4-180) -> -0.62484098922388398 | AD210: =DEGREES(ACOS(SIN(RADIANS(R2C2))*SIN(RADIANS(RC[-10]))+COS(RADIANS(R2C2))*COS(RADIANS(RC[-10]))*COS(RADIANS(RC[-1])))) -> 51.223693328923233 | AE210: =90-RC[-1] -> 38.776306671076767 | AF210: =IF(RC[-1]>85,0,IF(RC[-1]>5,58.1/TAN(RADIANS(RC[-1]))-0.07/POWER(TAN(RADIANS(RC[-1])),3)+0.000086/POWER(TAN(RADIANS(RC[-1])),5),IF(RC[-1]>-0.575,1735+RC[-1]*(-518.2+RC[-1]*(103.4+RC[-1]*(-12.79+RC[-1]*0.711))),-20.772/TAN(RADIANS(RC[-1])))))/3600 -> 2.0052301698409963E-2 | AG210: =RC[-2]+RC[-1] -> 38.796358972775174 | AH210: =IF(RC[-5]>0,MOD(DEGREES(ACOS(((SIN(RADIANS(R2C2))*COS(RADIANS(RC[-4])))-SIN(RADIANS(RC[-14])))/(COS(RADIANS(R2C2))*SIN(RADIANS(RC[-4])))))+180,360),MOD(540-DEGREES(ACOS(((SIN(RADIANS(R2C2))*COS(RADIANS(RC[-4])))-SIN(RADIANS(RC[-14])))/(COS(RADIANS(R2C2))*SIN(RADIANS(RC[-4]))))),360)) -> 179.24116040926344
D211: =R[-1]C+1 -> 2017-07-29T00:00:00.000 | E211: =R5C2 -> 1899-12-31T14:00:00.000 | F211: =RC[-2]+2415018.5+RC[-1]-R4C2/24 -> 2457964.375 | G211: =(RC[-1]-2451545)/36525 -> 0.17575290896646134 | I211: =MOD(280.46646+RC[-2]*(36000.76983 + RC[-2]*0.0003032),360) -> 127.70649202008826 | J211: =357.52911+RC[-3]*(35999.05029 - 0.0001537*RC[-3]) -> 6684.4669137497813 | K211: =0.016708634-RC[-4]*(0.000042037+0.0000001267*RC[-4]) -> 1.6701241961318707E-2 | L211: =SIN(RADIANS(RC[-2]))*(1.914602-RC[-5]*(0.004817+0.000014*RC[-5]))+SIN(RADIANS(2*RC[-2]))*(0.019993-0.000101*RC[-5])+SIN(RADIANS(3*RC[-2]))*0.000289 -> -0.77783208941089621 | M211: =RC[-4]+RC[-1] -> 126.92865993067737 | N211: =RC[-4]+RC[-2] -> 6683.68908166037 | O211: =(1.000001018*(1-RC[-4]*RC[-4]))/(1+RC[-4]*COS(RADIANS(RC[-1]))) -> 1.0152492900828605 | P211: =RC[-3]-0.00569-0.00478*SIN(RADIANS(125.04-1934.136*RC[-9])) -> 126.9202357557308 | Q211: =23+(26+((21.448-RC[-10]*(46.815+RC[-10]*(0.00059-RC[-10]*0.001813))))/60)/60 -> 23.437005588662409 | R211: =RC[-1]+0.00256*COS(RADIANS(125.04-1934.136*RC[-11])) -> 23.434905744979133 | S211: =DEGREES(ATAN2(COS(RADIANS(RC[-3])),COS(RADIANS(RC[-1]))*SIN(RADIANS(RC[-3])))) -> 129.31489427131731 | T211: =DEGREES(ASIN(SIN(RADIANS(RC[-2]))*SIN(RADIANS(RC[-4])))) -> 18.539343806421758 | U211: =TAN(RADIANS(RC[-3]/2))*TAN(RADIANS(RC[-3]/2)) -> 4.3017969849828169E-2 | V211: =4*DEGREES(RC[-1]*SIN(2*RADIANS(RC[-13]))-2*RC[-11]*SIN(RADIANS(RC[-12]))+4*RC[-11]*RC[-1]*SIN(RADIANS(RC[-12]))*COS(2*RADIANS(RC[-13]))-0.5*RC[-1]*RC[-1]*SIN(4*RADIANS(RC[-13]))-1.25*RC[-11]*RC[-11]*SIN(2*RADIANS(RC[-12]))) -> -6.4655447563556585 | W211: =DEGREES(ACOS(COS(RADIANS(90.833))/(COS(RADIANS(R2C2))*COS(RADIANS(RC[-3])))-TAN(RADIANS(R2C2))*TAN(RADIANS(RC[-3])))) -> 165.06626410466285 | X211: =(720-4*R3C2-RC[-2]+R4C2*60)/1440 -> 1899-12-31T14:02:27.933 | Y211: =(RC[-1]*1440-RC[-2]*4)/1440 -> 1899-12-31T03:02:12.029 | Z211: =(RC[-2]*1440+RC[-3]*4)/1440 -> 1900-01-01T01:02:43.836 | AA211: =8*RC[-4] -> 1320.5301128373028 | AB211: =MOD(RC[-23]*1440+RC[-6]+4*R3C2-60*R4C2,1440) -> 717.53445524364429 | AC211: =IF(RC[-1]/4<0,RC[-1]/4+180,RC[-1]/4-180) -> -0.61638618908892795 | AD211: =DEGREES(ACOS(SIN(RADIANS(R2C2))*SIN(RADIANS(RC[-10]))+COS(RADIANS(R2C2))*COS(RADIANS(RC[-10]))*COS(RADIANS(RC[-1])))) -> 51.462030698237889 | AE211: =90-RC[-1] -> 38.537969301762111 | AF211: =IF(RC[-1]>85,0,IF(RC[-1]>5,58.1/TAN(RADIANS(RC[-1]))-0.07/POWER(TAN(RADIANS(RC[-1])),3)+0.000086/POWER(TAN(RADIANS(RC[-1])),5),IF(RC[-1]>-0.575,1735+RC[-1]*(-518.2+RC[-1]*(103.4+RC[-1]*(-12.79+RC[-1]*0.711))),-20.772/TAN(RADIANS(RC[-1])))))/3600 -> 2.0223385489382992E-2 | AG211: =RC[-2]+RC[-1] -> 38.558192687251491 | AH211: =IF(RC[-5]>0,MOD(DEGREES(ACOS(((SIN(RADIANS(R2C2))*COS(RADIANS(RC[-4])))-SIN(RADIANS(RC[-14])))/(COS(RADIANS(R2C2))*SIN(RADIANS(RC[-4])))))+180,360),MOD(540-DEGREES(ACOS(((SIN(RADIANS(R2C2))*COS(RADIANS(RC[-4])))-SIN(RADIANS(RC[-14])))/(COS(RADIANS(R2C2))*SIN(RADIANS(RC[-4]))))),360)) -> 179.25286646396171
D212: =R[-1]C+1 -> 2017-07-30T00:00:00.000 | E212: =R5C2 -> 1899-12-31T14:00:00.000 | F212: =RC[-2]+2415018.5+RC[-1]-R4C2/24 -> 2457965.375 | G212: =(RC[-1]-2451545)/36525 -> 0.17578028747433264 | I212: =MOD(280.46646+RC[-2]*(36000.76983 + RC[-2]*0.0003032),360) -> 128.69213938316989 | J212: =357.52911+RC[-3]*(35999.05029 - 0.0001537*RC[-3]) -> 6685.4525140300266 | K212: =0.016708634-RC[-4]*(0.000042037+0.0000001267*RC[-4]) -> 1.6701240809188951E-2 | L212: =SIN(RADIANS(RC[-2]))*(1.914602-RC[-5]*(0.004817+0.000014*RC[-5]))+SIN(RADIANS(2*RC[-2]))*(0.019993-0.000101*RC[-5])+SIN(RADIANS(3*RC[-2]))*0.000289 -> -0.80723884718607064 | M212: =RC[-4]+RC[-1] -> 127.88490053598382 | N212: =RC[-4]+RC[-2] -> 6684.6452751828401 | O212: =(1.000001018*(1-RC[-4]*RC[-4]))/(1+RC[-4]*COS(RADIANS(RC[-1]))) -> 1.0151316555471099 | P212: =RC[-3]-0.00569-0.00478*SIN(RADIANS(125.04-1934.136*RC[-9])) -> 127.87647273853209 | Q212: =23+(26+((21.448-RC[-10]*(46.815+RC[-10]*(0.00059-RC[-10]*0.001813))))/60)/60 -> 23.437005232627431 | R212: =RC[-1]+0.00256*COS(RADIANS(125.04-1934.136*RC[-11])) -> 23.434906743198241 | S212: =DEGREES(ATAN2(COS(RADIANS(RC[-3])),COS(RADIANS(RC[-1]))*SIN(RADIANS(RC[-3])))) -> 130.2895484751775 | T212: =DEGREES(ASIN(SIN(RADIANS(RC[-2]))*SIN(RADIANS(RC[-4])))) -> 18.295899956177269 | U212: =TAN(RADIANS(RC[-3]/2))*TAN(RADIANS(RC[-3]/2)) -> 4.3017973618774928E-2 | V212: =4*DEGREES(RC[-1]*SIN(2*RADIANS(RC[-13]))-2*RC[-11]*SIN(RADIANS(RC[-12]))+4*RC[-11]*RC[-1]*SIN(RADIANS(RC[-12]))*COS(2*RADIANS(RC[-13]))-0.5*RC[-1]*RC[-1]*SIN(4*RADIANS(RC[-13]))-1.25*RC[-11]*RC[-11]*SIN(2*RADIANS(RC[-12]))) -> -6.4215981596094762 | W212: =DEGREES(ACOS(COS(RADIANS(90.833))/(COS(RADIANS(R2C2))*COS(RADIANS(RC[-3])))-TAN(RADIANS(R2C2))*TAN(RADIANS(RC[-3])))) -> 162.40041912029355 | X212: =(720-4*R3C2-RC[-2]+R4C2*60)/1440 -> 1899-12-31T14:02:25.296 | Y212: =(RC[-1]*1440-RC[-2]*4)/1440 -> 1899-12-31T03:12:49.195 | Z212: =(RC[-2]*1440+RC[-3]*4)/1440 -> 1900-01-01T00:52:01.396 | AA212: =8*RC[-4] -> 1299.2033529623484 | AB212: =MOD(RC[-23]*1440+RC[-6]+4*R3C2-60*R4C2,1440) -> 717.57840184039048 | AC212: =IF(RC[-1]/4<0,RC[-1]/4+180,RC[-1]/4-180) -> -0.60539953990237905 | AD212: =DEGREES(ACOS(SIN(RADIANS(R2C2))*SIN(RADIANS(RC[-10]))+COS(RADIANS(R2C2))*COS(RADIANS(RC[-10]))*COS(RADIANS(RC[-1])))) -> 51.705423397496403 | AE212: =90-RC[-1] -> 38.294576602503597 | AF212: =IF(RC[-1]>85,0,IF(RC[-1]>5,58.1/TAN(RADIANS(RC[-1]))-0.07/POWER(TAN(RADIANS(RC[-1])),3)+0.000086/POWER(TAN(RADIANS(RC[-1])),5),IF(RC[-1]>-0.575,1735+RC[-1]*(-518.2+RC[-1]*(103.4+RC[-1]*(-12.79+RC[-1]*0.711))),-20.772/TAN(RADIANS(RC[-1])))))/3600 -> 2.039993491217363E-2 | AG212: =RC[-2]+RC[-1] -> 38.314976537415767 | AH212: =IF(RC[-5]>0,MOD(DEGREES(ACOS(((SIN(RADIANS(R2C2))*COS(RADIANS(RC[-4])))-SIN(RADIANS(RC[-14])))/(COS(RADIANS(R2C2))*SIN(RADIANS(RC[-4])))))+180,360),MOD(540-DEGREES(ACOS(((SIN(RADIANS(R2C2))*COS(RADIANS(RC[-4])))-SIN(RADIANS(RC[-14])))/(COS(RADIANS(R2C2))*SIN(RADIANS(RC[-4]))))),360)) -> 179.26761640094219
D213: =R[-1]C+1 -> 2017-07-31T00:00:00.000 | E213: =R5C2 -> 1899-12-31T14:00:00.000 | F213: =RC[-2]+2415018.5+RC[-1]-R4C2/24 -> 2457966.375 | G213: =(RC[-1]-2451545)/36525 -> 0.17580766598220396 | I213: =MOD(280.46646+RC[-2]*(36000.76983 + RC[-2]*0.0003032),360) -> 129.67778674625242 | J213: =357.52911+RC[-3]*(35999.05029 - 0.0001537*RC[-3]) -> 6686.438114310271 | K213: =0.016708634-RC[-4]*(0.000042037+0.0000001267*RC[-4]) -> 1.6701239657059008E-2 | L213: =SIN(RADIANS(RC[-2]))*(1.914602-RC[-5]*(0.004817+0.000014*RC[-5]))+SIN(RADIANS(2*RC[-2]))*(0.019993-0.000101*RC[-5])+SIN(RADIANS(3*RC[-2]))*0.000289 -> -0.8364198344701711 | M213: =RC[-4]+RC[-1] -> 128.84136691178225 | N213: =RC[-4]+RC[-2] -> 6685.6016944758012 | O213: =(1.000001018*(1-RC[-4]*RC[-4]))/(1+RC[-4]*COS(RADIANS(RC[-1]))) -> 1.0150096621822036 | P213: =RC[-3]-0.00569-0.00478*SIN(RADIANS(125.04-1934.136*RC[-9])) -> 128.83293549416393 | Q213: =23+(26+((21.448-RC[-10]*(46.815+RC[-10]*(0.00059-RC[-10]*0.001813))))/60)/60 -> 23.43700487659245 | R213: =RC[-1]+0.00256*COS(RADIANS(125.04-1934.136*RC[-11])) -> 23.434907743209823 | S213: =DEGREES(ATAN2(COS(RADIANS(RC[-3])),COS(RADIANS(RC[-1]))*SIN(RADIANS(RC[-3])))) -> 131.26166964859107 | T213: =DEGREES(ASIN(SIN(RADIANS(RC[-2]))*SIN(RADIANS(RC[-4])))) -> 18.047469240520112 | U213: =TAN(RADIANS(RC[-3]/2))*TAN(RADIANS(RC[-3]/2)) -> 4.3017977394489676E-2 | V213: =4*DEGREES(RC[-1]*SIN(2*RADIANS(RC[-13]))-2*RC[-11]*SIN(RADIANS(RC[-12]))+4*RC[-11]*RC[-1]*SIN(RADIANS(RC[-12]))*COS(2*RADIANS(RC[-13]))-0.5*RC[-1]*RC[-1]*SIN(4*RADIANS(RC[-13]))-1.25*RC[-11]*RC[-11]*SIN(2*RADIANS(RC[-12]))) -> -6.3675144397828927 | W213: =DEGREES(ACOS(COS(RADIANS(90.833))/(COS(RADIANS(R2C2))*COS(RADIANS(RC[-3])))-TAN(RADIANS(R2C2))*TAN(RADIANS(RC[-3])))) -> 160.04027779171909 | X213: =(720-4*R3C2-RC[-2]+R4C2*60)/1440 -> 1899-12-31T14:02:22.051 | Y213: =(RC[-1]*1440-RC[-2]*4)/1440 -> 1899-12-31T03:22:12.384 | Z213: =(RC[-2]*1440+RC[-3]*4)/1440 -> 1900-01-01T00:42:31.718 | AA213: =8*RC[-4] -> 1280.3222223337527 | AB213: =MOD(RC[-23]*1440+RC[-6]+4*R3C2-60*R4C2,1440) -> 717.63248556021711 | AC213: =IF(RC[-1]/4<0,RC[-1]/4+180,RC[-1]/4-180) -> -0.59187860994572361 | AD213: =DEGREES(ACOS(SIN(RADIANS(R2C2))*SIN(RADIANS(RC[-10]))+COS(RADIANS(R2C2))*COS(RADIANS(RC[-10]))*COS(RADIANS(RC[-1])))) -> 51.95379315429615 | AE213: =90-RC[-1] -> 38.04620684570385 | AF213: =IF(RC[-1]>85,0,IF(RC[-1]>5,58.1/TAN(RADIANS(RC[-1]))-0.07/POWER(TAN(RADIANS(RC[-1])),3)+0.000086/POWER(TAN(RADIANS(RC[-1])),5),IF(RC[-1]>-0.575,1735+RC[-1]*(-518.2+RC[-1]*(103.4+RC[-1]*(-12.79+RC[-1]*0.711))),-20.772/TAN(RADIANS(RC[-1])))))/3600 -> 2.0582045103140541E-2 | AG213: =RC[-2]+RC[-1] -> 38.06678889080699 | AH213: =IF(RC[-5]>0,MOD(DEGREES(ACOS(((SIN(RADIANS(R2C2))*COS(RADIANS(RC[-4])))-SIN(RADIANS(RC[-14])))/(COS(RADIANS(R2C2))*SIN(RADIANS(RC[-4])))))+180,360),MOD(540-DEGREES(ACOS(((SIN(RADIANS(R2C2))*COS(RADIANS(RC[-4])))-SIN(RADIANS(RC[-14])))/(COS(RADIANS(R2C2))*SIN(RADIANS(RC[-4]))))),360)) -> 179.28539318429
D214: =R[-1]C+1 -> 2017-08-01T00:00:00.000 | E214: =R5C2 -> 1899-12-31T14:00:00.000 | F214: =RC[-2]+2415018.5+RC[-1]-R4C2/24 -> 2457967.375 | G214: =(RC[-1]-2451545)/36525 -> 0.17583504449007528 | I214: =MOD(280.46646+RC[-2]*(36000.76983 + RC[-2]*0.0003032),360) -> 130.66343410933496 | J214: =357.52911+RC[-3]*(35999.05029 - 0.0001537*RC[-3]) -> 6687.4237145905172 | K214: =0.016708634-RC[-4]*(0.000042037+0.0000001267*RC[-4]) -> 1.6701238504928877E-2 | L214: =SIN(RADIANS(RC[-2]))*(1.914602-RC[-5]*(0.004817+0.000014*RC[-5]))+SIN(RADIANS(2*RC[-2]))*(0.019993-0.000101*RC[-5])+SIN(RADIANS(3*RC[-2]))*0.000289 -> -0.86536678563277092 | M214: =RC[-4]+RC[-1] -> 129.79806732370218 | N214: =RC[-4]+RC[-2] -> 6686.5583478048848 | O214: =(1.000001018*(1-RC[-4]*RC[-4]))/(1+RC[-4]*COS(RADIANS(RC[-1]))) -> 1.0148833429370951 | P214: =RC[-3]-0.00569-0.00478*SIN(RADIANS(125.04-1934.136*RC[-9])) -> 129.78963228825896 | Q214: =23+(26+((21.448-RC[-10]*(46.815+RC[-10]*(0.00059-RC[-10]*0.001813))))/60)/60 -> 23.437004520557473 | R214: =RC[-1]+0.00256*COS(RADIANS(125.04-1934.136*RC[-11])) -> 23.434908745012738 | S214: =DEGREES(ATAN2(COS(RADIANS(RC[-3])),COS(RADIANS(RC[-1]))*SIN(RADIANS(RC[-3])))) -> 132.23125812158398 | T214: =DEGREES(ASIN(SIN(RADIANS(RC[-2]))*SIN(RADIANS(RC[-4])))) -> 17.794131410105621 | U214: =TAN(RADIANS(RC[-3]/2))*TAN(RADIANS(RC[-3]/2)) -> 4.3017981176968062E-2 | V214: =4*DEGREES(RC[-1]*SIN(2*RADIANS(RC[-13]))-2*RC[-11]*SIN(RADIANS(RC[-12]))+4*RC[-11]*RC[-1]*SIN(RADIANS(RC[-12]))*COS(2*RADIANS(RC[-13]))-0.5*RC[-1]*RC[-1]*SIN(4*RADIANS(RC[-13]))-1.25*RC[-11]*RC[-11]*SIN(2*RADIANS(RC[-12]))) -> -6.3032969187244587 | W214: =DEGREES(ACOS(COS(RADIANS(90.833))/(COS(RADIANS(R2C2))*COS(RADIANS(RC[-3])))-TAN(RADIANS(R2C2))*TAN(RADIANS(RC[-3])))) -> 157.88806425224936 | X214: =(720-4*R3C2-RC[-2]+R4C2*60)/1440 -> 1899-12-31T14:02:18.198 | Y214: =(RC[-1]*1440-RC[-2]*4)/1440 -> 1899-12-31T03:30:45.062 | Z214: =(RC[-2]*1440+RC[-3]*4)/1440 -> 1900-01-01T00:33:51.333 | AA214: =8*RC[-4] -> 1263.1045140179949 | AB214: =MOD(RC[-23]*1440+RC[-6]+4*R3C2-60*R4C2,1440) -> 717.69670308127559 | AC214: =IF(RC[-1]/4<0,RC[-1]/4+180,RC[-1]/4-180) -> -0.57582422968110336 | AD214: =DEGREES(ACOS(SIN(RADIANS(R2C2))*SIN(RADIANS(RC[-10]))+COS(RADIANS(R2C2))*COS(RADIANS(RC[-10]))*COS(RADIANS(RC[-1])))) -> 52.207061026276754 | AE214: =90-RC[-1] -> 37.792938973723246 | AF214: =IF(RC[-1]>85,0,IF(RC[-1]>5,58.1/TAN(RADIANS(RC[-1]))-0.07/POWER(TAN(RADIANS(RC[-1])),3)+0.000086/POWER(TAN(RADIANS(RC[-1])),5),IF(RC[-1]>-0.575,1735+RC[-1]*(-518.2+RC[-1]*(103.4+RC[-1]*(-12.79+RC[-1]*0.711))),-20.772/TAN(RADIANS(RC[-1])))))/3600 -> 2.0769816131827594E-2 | AG214: =RC[-2]+RC[-1] -> 37.81370878985507 | AH214: =IF(RC[-5]>0,MOD(DEGREES(ACOS(((SIN(RADIANS(R2C2))*COS(RADIANS(RC[-4])))-SIN(RADIANS(RC[-14])))/(COS(RADIANS(R2C2))*SIN(RADIANS(RC[-4])))))+180,360),MOD(540-DEGREES(ACOS(((SIN(RADIANS(R2C2))*COS(RADIANS(RC[-4])))-SIN(RADIANS(RC[-14])))/(COS(RADIANS(R2C2))*SIN(RADIANS(RC[-4]))))),360)) -> 179.30617542134621
D215: =R[-1]C+1 -> 2017-08-02T00:00:00.000 | E215: =R5C2 -> 1899-12-31T14:00:00.000 | F215: =RC[-2]+2415018.5+RC[-1]-R4C2/24 -> 2457968.375 | G215: =(RC[-1]-2451545)/36525 -> 0.1758624229979466 | I215: =MOD(280.46646+RC[-2]*(36000.76983 + RC[-2]*0.0003032),360) -> 131.64908147241931 | J215: =357.52911+RC[-3]*(35999.05029 - 0.0001537*RC[-3]) -> 6688.4093148707625 | K215: =0.016708634-RC[-4]*(0.000042037+0.0000001267*RC[-4]) -> 1.6701237352798552E-2 | L215: =SIN(RADIANS(RC[-2]))*(1.914602-RC[-5]*(0.004817+0.000014*RC[-5]))+SIN(RADIANS(2*RC[-2]))*(0.019993-0.000101*RC[-5])+SIN(RADIANS(3*RC[-2]))*0.000289 -> -0.89407148935400249 | M215: =RC[-4]+RC[-1] -> 130.75500998306532 | N215: =RC[-4]+RC[-2] -> 6687.5152433814083 | O215: =(1.000001018*(1-RC[-4]*RC[-4]))/(1+RC[-4]*COS(RADIANS(RC[-1]))) -> 1.0147527319545551 | P215: =RC[-3]-0.00569-0.00478*SIN(RADIANS(125.04-1934.136*RC[-9])) -> 130.74657133214191 | Q215: =23+(26+((21.448-RC[-10]*(46.815+RC[-10]*(0.00059-RC[-10]*0.001813))))/60)/60 -> 23.437004164522495 | R215: =RC[-1]+0.00256*COS(RADIANS(125.04-1934.136*RC[-11])) -> 23.434909748605815 | S215: =DEGREES(ATAN2(COS(RADIANS(RC[-3])),COS(RADIANS(RC[-1]))*SIN(RADIANS(RC[-3])))) -> 133.19831736600995 | T215: =DEGREES(ASIN(SIN(RADIANS(RC[-2]))*SIN(RADIANS(RC[-4])))) -> 17.535966985007626 | U215: =TAN(RADIANS(RC[-3]/2))*TAN(RADIANS(RC[-3]/2)) -> 4.3017984966205708E-2 | V215: =4*DEGREES(RC[-1]*SIN(2*RADIANS(RC[-13]))-2*RC[-11]*SIN(RADIANS(RC[-12]))+4*RC[-11]*RC[-1]*SIN(RADIANS(RC[-12]))*COS(2*RADIANS(RC[-13]))-0.5*RC[-1]*RC[-1]*SIN(4*RADIANS(RC[-13]))-1.25*RC[-11]*RC[-11]*SIN(2*RADIANS(RC[-12]))) -> -6.2289617846471836 | W215: =DEGREES(ACOS(COS(RADIANS(90.833))/(COS(RADIANS(R2C2))*COS(RADIANS(RC[-3])))-TAN(RADIANS(R2C2))*TAN(RADIANS(RC[-3])))) -> 155.88832926919417 | X215: =(720-4*R3C2-RC[-2]+R4C2*60)/1440 -> 1899-12-31T14:02:13.738 | Y215: =(RC[-1]*1440-RC[-2]*4)/1440 -> 1899-12-31T03:38:40.539 | Z215: =(RC[-2]*1440+RC[-3]*4)/1440 -> 1900-01-01T00:25:46.937 | AA215: =8*RC[-4] -> 1247.1066341535534 | AB215: =MOD(RC[-23]*1440+RC[-6]+4*R3C2-60*R4C2,1440) -> 717.77103821535286 | AC215: =IF(RC[-1]/4<0,RC[-1]/4+180,RC[-1]/4-180) -> -0.55724044616178503 | AD215: =DEGREES(ACOS(SIN(RADIANS(R2C2))*SIN(RADIANS(RC[-10]))+COS(RADIANS(R2C2))*COS(RADIANS(RC[-10]))*COS(RADIANS(RC[-1])))) -> 52.465147447505132 | AE215: =90-RC[-1] -> 37.534852552494868 | AF215: =IF(RC[-1]>85,0,IF(RC[-1]>5,58.1/TAN(RADIANS(RC[-1]))-0.07/POWER(TAN(RADIANS(RC[-1])),3)+0.000086/POWER(TAN(RADIANS(RC[-1])),5),IF(RC[-1]>-0.575,1735+RC[-1]*(-518.2+RC[-1]*(103.4+RC[-1]*(-12.79+RC[-1]*0.711))),-20.772/TAN(RADIANS(RC[-1])))))/3600 -> 2.0963353222426252E-2 | AG215: =RC[-2]+RC[-1] -> 37.555815905717296 | AH215: =IF(RC[-5]>0,MOD(DEGREES(ACOS(((SIN(RADIANS(R2C2))*COS(RADIANS(RC[-4])))-SIN(RADIANS(RC[-14])))/(COS(RADIANS(R2C2))*SIN(RADIANS(RC[-4])))))+180,360),MOD(540-DEGREES(ACOS(((SIN(RADIANS(R2C2))*COS(RADIANS(RC[-4])))-SIN(RADIANS(RC[-14])))/(COS(RADIANS(R2C2))*SIN(RADIANS(RC[-4]))))),360)) -> 179.32993749389391
D216: =R[-1]C+1 -> 2017-08-03T00:00:00.000 | E216: =R5C2 -> 1899-12-31T14:00:00.000 | F216: =RC[-2]+2415018.5+RC[-1]-R4C2/24 -> 2457969.375 | G216: =(RC[-1]-2451545)/36525 -> 0.17588980150581793 | I216: =MOD(280.46646+RC[-2]*(36000.76983 + RC[-2]*0.0003032),360) -> 132.63472883550367 | J216: =357.52911+RC[-3]*(35999.05029 - 0.0001537*RC[-3]) -> 6689.394915151006 | K216: =0.016708634-RC[-4]*(0.000042037+0.0000001267*RC[-4]) -> 1.6701236200668039E-2 | L216: =SIN(RADIANS(RC[-2]))*(1.914602-RC[-5]*(0.004817+0.000014*RC[-5]))+SIN(RADIANS(2*RC[-2]))*(0.019993-0.000101*RC[-5])+SIN(RADIANS(3*RC[-2]))*0.000289 -> -0.92252579064360307 | M216: =RC[-4]+RC[-1] -> 131.71220304486008 | N216: =RC[-4]+RC[-2] -> 6688.4723893603623 | O216: =(1.000001018*(1-RC[-4]*RC[-4]))/(1+RC[-4]*COS(RADIANS(RC[-1]))) -> 1.0146178645646142 | P216: =RC[-3]-0.00569-0.00478*SIN(RADIANS(125.04-1934.136*RC[-9])) -> 131.70376078080432 | Q216: =23+(26+((21.448-RC[-10]*(46.815+RC[-10]*(0.00059-RC[-10]*0.001813))))/60)/60 -> 23.437003808487518 | R216: =RC[-1]+0.00256*COS(RADIANS(125.04-1934.136*RC[-11])) -> 23.434910753987896 | S216: =DEGREES(ATAN2(COS(RADIANS(RC[-3])),COS(RADIANS(RC[-1]))*SIN(RADIANS(RC[-3])))) -> 134.16285395046032 | T216: =DEGREES(ASIN(SIN(RADIANS(RC[-2]))*SIN(RADIANS(RC[-4])))) -> 17.273057206284065 | U216: =TAN(RADIANS(RC[-3]/2))*TAN(RADIANS(RC[-3]/2)) -> 4.3017988762198221E-2 | V216: =4*DEGREES(RC[-1]*SIN(2*RADIANS(RC[-13]))-2*RC[-11]*SIN(RADIANS(RC[-12]))+4*RC[-11]*RC[-1]*SIN(RADIANS(RC[-12]))*COS(2*RADIANS(RC[-13]))-0.5*RC[-1]*RC[-1]*SIN(4*RADIANS(RC[-13]))-1.25*RC[-11]*RC[-11]*SIN(2*RADIANS(RC[-12]))) -> -6.1445378914969826 | W216: =DEGREES(ACOS(COS(RADIANS(90.833))/(COS(RADIANS(R2C2))*COS(RADIANS(RC[-3])))-TAN(RADIANS(R2C2))*TAN(RADIANS(RC[-3])))) -> 154.00612242759433 | X216: =(720-4*R3C2-RC[-2]+R4C2*60)/1440 -> 1899-12-31T14:02:08.672 | Y216: =(RC[-1]*1440-RC[-2]*4)/1440 -> 1899-12-31T03:46:07.203 | Z216: =(RC[-2]*1440+RC[-3]*4)/1440 -> 1900-01-01T00:18:10.142 | AA216: =8*RC[-4] -> 1232.0489794207547 | AB216: =MOD(RC[-23]*1440+RC[-6]+4*R3C2-60*R4C2,1440) -> 717.85546210850305 | AC216: =IF(RC[-1]/4<0,RC[-1]/4+180,RC[-1]/4-180) -> -0.5361344728742381 | AD216: =DEGREES(ACOS(SIN(RADIANS(R2C2))*SIN(RADIANS(RC[-10]))+COS(RADIANS(R2C2))*COS(RADIANS(RC[-10]))*COS(RADIANS(RC[-1])))) -> 52.72797227229141 | AE216: =90-RC[-1] -> 37.27202772770859 | AF216: =IF(RC[-1]>85,0,IF(RC[-1]>5,58.1/TAN(RADIANS(RC[-1]))-0.07/POWER(TAN(RADIANS(RC[-1])),3)+0.000086/POWER(TAN(RADIANS(RC[-1])),5),IF(RC[-1]>-0.575,1735+RC[-1]*(-518.2+RC[-1]*(103.4+RC[-1]*(-12.79+RC[-1]*0.711))),-20.772/TAN(RADIANS(RC[-1])))))/3600 -> 2.1162766986848103E-2 | AG216: =RC[-2]+RC[-1] -> 37.293190494695438 | AH216: =IF(RC[-5]>0,MOD(DEGREES(ACOS(((SIN(RADIANS(R2C2))*COS(RADIANS(RC[-4])))-SIN(RADIANS(RC[-14])))/(COS(RADIANS(R2C2))*SIN(RADIANS(RC[-4])))))+180,360),MOD(540-DEGREES(ACOS(((SIN(RADIANS(R2C2))*COS(RADIANS(RC[-4])))-SIN(RADIANS(RC[-14])))/(COS(RADIANS(R2C2))*SIN(RADIANS(RC[-4]))))),360)) -> 179.35664969458173
D217: =R[-1]C+1 -> 2017-08-04T00:00:00.000 | E217: =R5C2 -> 1899-12-31T14:00:00.000 | F217: =RC[-2]+2415018.5+RC[-1]-R4C2/24 -> 2457970.375 | G217: =(RC[-1]-2451545)/36525 -> 0.17591718001368925 | I217: =MOD(280.46646+RC[-2]*(36000.76983 + RC[-2]*0.0003032),360) -> 133.62037619858802 | J217: =357.52911+RC[-3]*(35999.05029 - 0.0001537*RC[-3]) -> 6690.3805154312513 | K217: =0.016708634-RC[-4]*(0.000042037+0.0000001267*RC[-4]) -> 1.6701235048537336E-2 | L217: =SIN(RADIANS(RC[-2]))*(1.914602-RC[-5]*(0.004817+0.000014*RC[-5]))+SIN(RADIANS(2*RC[-2]))*(0.019993-0.000101*RC[-5])+SIN(RADIANS(3*RC[-2]))*0.000289 -> -0.95072159285904856 | M217: =RC[-4]+RC[-1] -> 132.66965460572897 | N217: =RC[-4]+RC[-2] -> 6689.4297938383925 | O217: =(1.000001018*(1-RC[-4]*RC[-4]))/(1+RC[-4]*COS(RADIANS(RC[-1]))) -> 1.0144787772777495 | P217: =RC[-3]-0.00569-0.00478*SIN(RADIANS(125.04-1934.136*RC[-9])) -> 132.66120873089176 | Q217: =23+(26+((21.448-RC[-10]*(46.815+RC[-10]*(0.00059-RC[-10]*0.001813))))/60)/60 -> 23.43700345245254 | R217: =RC[-1]+0.00256*COS(RADIANS(125.04-1934.136*RC[-11])) -> 23.434911761157817 | S217: =DEGREES(ATAN2(COS(RADIANS(RC[-3])),COS(RADIANS(RC[-1]))*SIN(RADIANS(RC[-3])))) -> 135.12487749201611 | T217: =DEGREES(ASIN(SIN(RADIANS(RC[-2]))*SIN(RADIANS(RC[-4])))) -> 17.005483989288383 | U217: =TAN(RADIANS(RC[-3]/2))*TAN(RADIANS(RC[-3]/2)) -> 4.3017992564941217E-2 | V217: =4*DEGREES(RC[-1]*SIN(2*RADIANS(RC[-13]))-2*RC[-11]*SIN(RADIANS(RC[-12]))+4*RC[-11]*RC[-1]*SIN(RADIANS(RC[-12]))*COS(2*RADIANS(RC[-13]))-0.5*RC[-1]*RC[-1]*SIN(4*RADIANS(RC[-13]))-1.25*RC[-11]*RC[-11]*SIN(2*RADIANS(RC[-12]))) -> -6.0500665413185919 | W217: =DEGREES(ACOS(COS(RADIANS(90.833))/(COS(RADIANS(R2C2))*COS(RADIANS(RC[-3])))-TAN(RADIANS(R2C2))*TAN(RADIANS(RC[-3])))) -> 152.21778534994465 | X217: =(720-4*R3C2-RC[-2]+R4C2*60)/1440 -> 1899-12-31T14:02:03.004 | Y217: =(RC[-1]*1440-RC[-2]*4)/1440 -> 1899-12-31T03:53:10.736 | Z217: =(RC[-2]*1440+RC[-3]*4)/1440 -> 1900-01-01T00:10:55.272 | AA217: =8*RC[-4] -> 1217.7422827995572 | AB217: =MOD(RC[-23]*1440+RC[-6]+4*R3C2-60*R4C2,1440) -> 717.94993345868136 | AC217: =IF(RC[-1]/4<0,RC[-1]/4+180,RC[-1]/4-180) -> -0.51251663532966063 | AD217: =DEGREES(ACOS(SIN(RADIANS(R2C2))*SIN(RADIANS(RC[-10]))+COS(RADIANS(R2C2))*COS(RADIANS(RC[-10]))*COS(RADIANS(RC[-1])))) -> 52.995454816431419 | AE217: =90-RC[-1] -> 37.004545183568581 | AF217: =IF(RC[-1]>85,0,IF(RC[-1]>5,58.1/TAN(RADIANS(RC[-1]))-0.07/POWER(TAN(RADIANS(RC[-1])),3)+0.000086/POWER(TAN(RADIANS(RC[-1])),5),IF(RC[-1]>-0.575,1735+RC[-1]*(-518.2+RC[-1]*(103.4+RC[-1]*(-12.79+RC[-1]*0.711))),-20.772/TAN(RADIANS(RC[-1])))))/3600 -> 2.1368173670169292E-2 | AG217: =RC[-2]+RC[-1] -> 37.02591335723875 | AH217: =IF(RC[-5]>0,MOD(DEGREES(ACOS(((SIN(RADIANS(R2C2))*COS(RADIANS(RC[-4])))-SIN(RADIANS(RC[-14])))/(COS(RADIANS(R2C2))*SIN(RADIANS(RC[-4])))))+180,360),MOD(540-DEGREES(ACOS(((SIN(RADIANS(R2C2))*COS(RADIANS(RC[-4])))-SIN(RADIANS(RC[-14])))/(COS(RADIANS(R2C2))*SIN(RADIANS(RC[-4]))))),360)) -> 179.38627836775902
D218: =R[-1]C+1 -> 2017-08-05T00:00:00.000 | E218: =R5C2 -> 1899-12-31T14:00:00.000 | F218: =RC[-2]+2415018.5+RC[-1]-R4C2/24 -> 2457971.375 | G218: =(RC[-1]-2451545)/36525 -> 0.17594455852156057 | I218: =MOD(280.46646+RC[-2]*(36000.76983 + RC[-2]*0.0003032),360) -> 134.60602356167328 | J218: =357.52911+RC[-3]*(35999.05029 - 0.0001537*RC[-3]) -> 6691.3661157114957 | K218: =0.016708634-RC[-4]*(0.000042037+0.0000001267*RC[-4]) -> 1.6701233896406441E-2 | L218: =SIN(RADIANS(RC[-2]))*(1.914602-RC[-5]*(0.004817+0.000014*RC[-5]))+SIN(RADIANS(2*RC[-2]))*(0.019993-0.000101*RC[-5])+SIN(RADIANS(3*RC[-2]))*0.000289 -> -0.97865085972164767 | M218: =RC[-4]+RC[-1] -> 133.62737270195163 | N218: =RC[-4]+RC[-2] -> 6690.387464851774 | O218: =(1.000001018*(1-RC[-4]*RC[-4]))/(1+RC[-4]*COS(RADIANS(RC[-1]))) -> 1.014335507777812 | P218: =RC[-3]-0.00569-0.00478*SIN(RADIANS(125.04-1934.136*RC[-9])) -> 133.61892321868703 | Q218: =23+(26+((21.448-RC[-10]*(46.815+RC[-10]*(0.00059-RC[-10]*0.001813))))/60)/60 -> 23.437003096417559 | R218: =RC[-1]+0.00256*COS(RADIANS(125.04-1934.136*RC[-11])) -> 23.434912770114412 | S218: =DEGREES(ATAN2(COS(RADIANS(RC[-3])),COS(RADIANS(RC[-1]))*SIN(RADIANS(RC[-3])))) -> 136.08440060510424 | T218: =DEGREES(ASIN(SIN(RADIANS(RC[-2]))*SIN(RADIANS(RC[-4])))) -> 16.733329878781145 | U218: =TAN(RADIANS(RC[-3]/2))*TAN(RADIANS(RC[-3]/2)) -> 4.3017996374430288E-2 | V218: =4*DEGREES(RC[-1]*SIN(2*RADIANS(RC[-13]))-2*RC[-11]*SIN(RADIANS(RC[-12]))+4*RC[-11]*RC[-1]*SIN(RADIANS(RC[-12]))*COS(2*RADIANS(RC[-13]))-0.5*RC[-1]*RC[-1]*SIN(4*RADIANS(RC[-13]))-1.25*RC[-11]*RC[-11]*SIN(2*RADIANS(RC[-12]))) -> -5.9456012509276075 | W218: =DEGREES(ACOS(COS(RADIANS(90.833))/(COS(RADIANS(R2C2))*COS(RADIANS(RC[-3])))-TAN(RADIANS(R2C2))*TAN(RADIANS(RC[-3])))) -> 150.50645455365606 | X218: =(720-4*R3C2-RC[-2]+R4C2*60)/1440 -> 1899-12-31T14:01:56.736 | Y218: =(RC[-1]*1440-RC[-2]*4)/1440 -> 1899-12-31T03:59:55.187 | Z218: =(RC[-2]*1440+RC[-3]*4)/1440 -> 1900-01-01T00:03:58.285 | AA218: =8*RC[-4] -> 1204.0516364292484 | AB218: =MOD(RC[-23]*1440+RC[-6]+4*R3C2-60*R4C2,1440) -> 718.05439874907245 | AC218: =IF(RC[-1]/4<0,RC[-1]/4+180,RC[-1]/4-180) -> -0.48640031273188811 | AD218: =DEGREES(ACOS(SIN(RADIANS(R2C2))*SIN(RADIANS(RC[-10]))+COS(RADIANS(R2C2))*COS(RADIANS(RC[-10]))*COS(RADIANS(RC[-1])))) -> 53.267513895871296 | AE218: =90-RC[-1] -> 36.732486104128704 | AF218: =IF(RC[-1]>85,0,IF(RC[-1]>5,58.1/TAN(RADIANS(RC[-1]))-0.07/POWER(TAN(RADIANS(RC[-1])),3)+0.000086/POWER(TAN(RADIANS(RC[-1])),5),IF(RC[-1]>-0.575,1735+RC[-1]*(-518.2+RC[-1]*(103.4+RC[-1]*(-12.79+RC[-1]*0.711))),-20.772/TAN(RADIANS(RC[-1])))))/3600 -> 2.1579695409259372E-2 | AG218: =RC[-2]+RC[-1] -> 36.754065799537962 | AH218: =IF(RC[-5]>0,MOD(DEGREES(ACOS(((SIN(RADIANS(R2C2))*COS(RADIANS(RC[-4])))-SIN(RADIANS(RC[-14])))/(COS(RADIANS(R2C2))*SIN(RADIANS(RC[-4])))))+180,360),MOD(540-DEGREES(ACOS(((SIN(RADIANS(R2C2))*COS(RADIANS(RC[-4])))-SIN(RADIANS(RC[-14])))/(COS(RADIANS(R2C2))*SIN(RADIANS(RC[-4]))))),360)) -> 179.41878605414911
D219: =R[-1]C+1 -> 2017-08-06T00:00:00.000 | E219: =R5C2 -> 1899-12-31T14:00:00.000 | F219: =RC[-2]+2415018.5+RC[-1]-R4C2/24 -> 2457972.375 | G219: =(RC[-1]-2451545)/36525 -> 0.1759719370294319 | I219: =MOD(280.46646+RC[-2]*(36000.76983 + RC[-2]*0.0003032),360) -> 135.59167092475946 | J219: =357.52911+RC[-3]*(35999.05029 - 0.0001537*RC[-3]) -> 6692.3517159917392 | K219: =0.016708634-RC[-4]*(0.000042037+0.0000001267*RC[-4]) -> 1.6701232744275357E-2 | L219: =SIN(RADIANS(RC[-2]))*(1.914602-RC[-5]*(0.004817+0.000014*RC[-5]))+SIN(RADIANS(2*RC[-2]))*(0.019993-0.000101*RC[-5])+SIN(RADIANS(3*RC[-2]))*0.000289 -> -1.0063056173320615 | M219: =RC[-4]+RC[-1] -> 134.5853653074274 | N219: =RC[-4]+RC[-2] -> 6691.345410374407 | O219: =(1.000001018*(1-RC[-4]*RC[-4]))/(1+RC[-4]*COS(RADIANS(RC[-1]))) -> 1.0141880949146955 | P219: =RC[-3]-0.00569-0.00478*SIN(RADIANS(125.04-1934.136*RC[-9])) -> 134.57691221809245 | Q219: =23+(26+((21.448-RC[-10]*(46.815+RC[-10]*(0.00059-RC[-10]*0.001813))))/60)/60 -> 23.437002740382582 | R219: =RC[-1]+0.00256*COS(RADIANS(125.04-1934.136*RC[-11])) -> 23.434913780856519 | S219: =DEGREES(ATAN2(COS(RADIANS(RC[-3])),COS(RADIANS(RC[-1]))*SIN(RADIANS(RC[-3])))) -> 137.04143884773293 | T219: =DEGREES(ASIN(SIN(RADIANS(RC[-2]))*SIN(RADIANS(RC[-4])))) -> 16.456678005883518 | U219: =TAN(RADIANS(RC[-3]/2))*TAN(RADIANS(RC[-3]/2)) -> 4.3018000190661036E-2 | V219: =4*DEGREES(RC[-1]*SIN(2*RADIANS(RC[-13]))-2*RC[-11]*SIN(RADIANS(RC[-12]))+4*RC[-11]*RC[-1]*SIN(RADIANS(RC[-12]))*COS(2*RADIANS(RC[-13]))-0.5*RC[-1]*RC[-1]*SIN(4*RADIANS(RC[-13]))-1.25*RC[-11]*RC[-11]*SIN(2*RADIANS(RC[-12]))) -> -5.8312075042169758 | W219: =DEGREES(ACOS(COS(RADIANS(90.833))/(COS(RADIANS(R2C2))*COS(RADIANS(RC[-3])))-TAN(RADIANS(R2C2))*TAN(RADIANS(RC[-3])))) -> 148.85962874335416 | X219: =(720-4*R3C2-RC[-2]+R4C2*60)/1440 -> 1899-12-31T14:01:49.872 | Y219: =(RC[-1]*1440-RC[-2]*4)/1440 -> 1899-12-31T04:06:23.562 | Z219: =(RC[-2]*1440+RC[-3]*4)/1440 -> 1899-12-31T23:57:16.183 | AA219: =8*RC[-4] -> 1190.8770299468333 | AB219: =MOD(RC[-23]*1440+RC[-6]+4*R3C2-60*R4C2,1440) -> 718.16879249578301 | AC219: =IF(RC[-1]/4<0,RC[-1]/4+180,RC[-1]/4-180) -> -0.45780187605424771 | AD219: =DEGREES(ACOS(SIN(RADIANS(R2C2))*SIN(RADIANS(RC[-10]))+COS(RADIANS(R2C2))*COS(RADIANS(RC[-10]))*COS(RADIANS(RC[-1])))) -> 53.544067862806578 | AE219: =90-RC[-1] -> 36.455932137193422 | AF219: =IF(RC[-1]>85,0,IF(RC[-1]>5,58.1/TAN(RADIANS(RC[-1]))-0.07/POWER(TAN(RADIANS(RC[-1])),3)+0.000086/POWER(TAN(RADIANS(RC[-1])),5),IF(RC[-1]>-0.575,1735+RC[-1]*(-518.2+RC[-1]*(103.4+RC[-1]*(-12.79+RC[-1]*0.711))),-20.772/TAN(RADIANS(RC[-1])))))/3600 -> 2.1797460505475926E-2 | AG219: =RC[-2]+RC[-1] -> 36.477729597698897 | AH219: =IF(RC[-5]>0,MOD(DEGREES(ACOS(((SIN(RADIANS(R2C2))*COS(RADIANS(RC[-4])))-SIN(RADIANS(RC[-14])))/(COS(RADIANS(R2C2))*SIN(RADIANS(RC[-4])))))+180,360),MOD(540-DEGREES(ACOS(((SIN(RADIANS(R2C2))*COS(RADIANS(RC[-4])))-SIN(RADIANS(RC[-14])))/(COS(RADIANS(R2C2))*SIN(RADIANS(RC[-4]))))),360)) -> 179.45413163861167
D220: =R[-1]C+1 -> 2017-08-07T00:00:00.000 | E220: =R5C2 -> 1899-12-31T14:00:00.000 | F220: =RC[-2]+2415018.5+RC[-1]-R4C2/24 -> 2457973.375 | G220: =(RC[-1]-2451545)/36525 -> 0.17599931553730322 | I220: =MOD(280.46646+RC[-2]*(36000.76983 + RC[-2]*0.0003032),360) -> 136.57731828784563 | J220: =357.52911+RC[-3]*(35999.05029 - 0.0001537*RC[-3]) -> 6693.3373162719836 | K220: =0.016708634-RC[-4]*(0.000042037+0.0000001267*RC[-4]) -> 1.6701231592144084E-2 | L220: =SIN(RADIANS(RC[-2]))*(1.914602-RC[-5]*(0.004817+0.000014*RC[-5]))+SIN(RADIANS(2*RC[-2]))*(0.019993-0.000101*RC[-5])+SIN(RADIANS(3*RC[-2]))*0.000289 -> -1.0336779561835543 | M220: =RC[-4]+RC[-1] -> 135.54364033166206 | N220: =RC[-4]+RC[-2] -> 6692.3036383157996 | O220: =(1.000001018*(1-RC[-4]*RC[-4]))/(1+RC[-4]*COS(RADIANS(RC[-1]))) -> 1.0140365786967445 | P220: =RC[-3]-0.00569-0.00478*SIN(RADIANS(125.04-1934.136*RC[-9])) -> 135.53518363861696 | Q220: =23+(26+((21.448-RC[-10]*(46.815+RC[-10]*(0.00059-RC[-10]*0.001813))))/60)/60 -> 23.437002384347604 | R220: =RC[-1]+0.00256*COS(RADIANS(125.04-1934.136*RC[-11])) -> 23.434914793382973 | S220: =DEGREES(ATAN2(COS(RADIANS(RC[-3])),COS(RADIANS(RC[-1]))*SIN(RADIANS(RC[-3])))) -> 137.99601066537875 | T220: =DEGREES(ASIN(SIN(RADIANS(RC[-2]))*SIN(RADIANS(RC[-4])))) -> 16.175612046906288 | U220: =TAN(RADIANS(RC[-3]/2))*TAN(RADIANS(RC[-3]/2)) -> 4.3018004013629089E-2 | V220: =4*DEGREES(RC[-1]*SIN(2*RADIANS(RC[-13]))-2*RC[-11]*SIN(RADIANS(RC[-12]))+4*RC[-11]*RC[-1]*SIN(RADIANS(RC[-12]))*COS(2*RADIANS(RC[-13]))-0.5*RC[-1]*RC[-1]*SIN(4*RADIANS(RC[-13]))-1.25*RC[-11]*RC[-11]*SIN(2*RADIANS(RC[-12]))) -> -5.7069624914602608 | W220: =DEGREES(ACOS(COS(RADIANS(90.833))/(COS(RADIANS(R2C2))*COS(RADIANS(RC[-3])))-TAN(RADIANS(R2C2))*TAN(RADIANS(RC[-3])))) -> 147.26774947181326 | X220: =(720-4*R3C2-RC[-2]+R4C2*60)/1440 -> 1899-12-31T14:01:42.418 | Y220: =(RC[-1]*1440-RC[-2]*4)/1440 -> 1899-12-31T04:12:38.158 | Z220: =(RC[-2]*1440+RC[-3]*4)/1440 -> 1899-12-31T23:50:46.678 | AA220: =8*RC[-4] -> 1178.1419957745061 | AB220: =MOD(RC[-23]*1440+RC[-6]+4*R3C2-60*R4C2,1440) -> 718.29303750853978 | AC220: =IF(RC[-1]/4<0,RC[-1]/4+180,RC[-1]/4-180) -> -0.42674062286505432 | AD220: =DEGREES(ACOS(SIN(RADIANS(R2C2))*SIN(RADIANS(RC[-10]))+COS(RADIANS(R2C2))*COS(RADIANS(RC[-10]))*COS(RADIANS(RC[-1])))) -> 53.825034639238446 | AE220: =90-RC[-1] -> 36.174965360761554 | AF220: =IF(RC[-1]>85,0,IF(RC[-1]>5,58.1/TAN(RADIANS(RC[-1]))-0.07/POWER(TAN(RADIANS(RC[-1])),3)+0.000086/POWER(TAN(RADIANS(RC[-1])),5),IF(RC[-1]>-0.575,1735+RC[-1]*(-518.2+RC[-1]*(103.4+RC[-1]*(-12.79+RC[-1]*0.711))),-20.772/TAN(RADIANS(RC[-1])))))/3600 -> 2.202160371237509E-2 | AG220: =RC[-2]+RC[-1] -> 36.196986964473929 | AH220: =IF(RC[-5]>0,MOD(DEGREES(ACOS(((SIN(RADIANS(R2C2))*COS(RADIANS(RC[-4])))-SIN(RADIANS(RC[-14])))/(COS(RADIANS(R2C2))*SIN(RADIANS(RC[-4])))))+180,360),MOD(540-DEGREES(ACOS(((SIN(RADIANS(R2C2))*COS(RADIANS(RC[-4])))-SIN(RADIANS(RC[-14])))/(COS(RADIANS(R2C2))*SIN(RADIANS(RC[-4]))))),360)) -> 179.49227050034949
D221: =R[-1]C+1 -> 2017-08-08T00:00:00.000 | E221: =R5C2 -> 1899-12-31T14:00:00.000 | F221: =RC[-2]+2415018.5+RC[-1]-R4C2/24 -> 2457974.375 | G221: =(RC[-1]-2451545)/36525 -> 0.17602669404517454 | I221: =MOD(280.46646+RC[-2]*(36000.76983 + RC[-2]*0.0003032),360) -> 137.5629656509318 | J221: =357.52911+RC[-3]*(35999.05029 - 0.0001537*RC[-3]) -> 6694.3229165522262 | K221: =0.016708634-RC[-4]*(0.000042037+0.0000001267*RC[-4]) -> 1.6701230440012621E-2 | L221: =SIN(RADIANS(RC[-2]))*(1.914602-RC[-5]*(0.004817+0.000014*RC[-5]))+SIN(RADIANS(2*RC[-2]))*(0.019993-0.000101*RC[-5])+SIN(RADIANS(3*RC[-2]))*0.000289 -> -1.0607600331736644 | M221: =RC[-4]+RC[-1] -> 136.50220561775814 | N221: =RC[-4]+RC[-2] -> 6693.262156519053 | O221: =(1.000001018*(1-RC[-4]*RC[-4]))/(1+RC[-4]*COS(RADIANS(RC[-1]))) -> 1.0138810002828968 | P221: =RC[-3]-0.00569-0.00478*SIN(RADIANS(125.04-1934.136*RC[-9])) -> 136.49374532336611 | Q221: =23+(26+((21.448-RC[-10]*(46.815+RC[-10]*(0.00059-RC[-10]*0.001813))))/60)/60 -> 23.437002028312627 | R221: =RC[-1]+0.00256*COS(RADIANS(125.04-1934.136*RC[-11])) -> 23.434915807692597 | S221: =DEGREES(ATAN2(COS(RADIANS(RC[-3])),COS(RADIANS(RC[-1]))*SIN(RADIANS(RC[-3])))) -> 138.94813733278224 | T221: =DEGREES(ASIN(SIN(RADIANS(RC[-2]))*SIN(RADIANS(RC[-4])))) -> 15.890216184083046 | U221: =TAN(RADIANS(RC[-3]/2))*TAN(RADIANS(RC[-3]/2)) -> 4.3018007843329993E-2 | V221: =4*DEGREES(RC[-1]*SIN(2*RADIANS(RC[-13]))-2*RC[-11]*SIN(RADIANS(RC[-12]))+4*RC[-11]*RC[-1]*SIN(RADIANS(RC[-12]))*COS(2*RADIANS(RC[-13]))-0.5*RC[-1]*RC[-1]*SIN(4*RADIANS(RC[-13]))-1.25*RC[-11]*RC[-11]*SIN(2*RADIANS(RC[-12]))) -> -5.5729548369792035 | W221: =DEGREES(ACOS(COS(RADIANS(90.833))/(COS(RADIANS(R2C2))*COS(RADIANS(RC[-3])))-TAN(RADIANS(R2C2))*TAN(RADIANS(RC[-3])))) -> 145.72332315017513 | X221: =(720-4*R3C2-RC[-2]+R4C2*60)/1440 -> 1899-12-31T14:01:34.377 | Y221: =(RC[-1]*1440-RC[-2]*4)/1440 -> 1899-12-31T04:18:40.780 | Z221: =(RC[-2]*1440+RC[-3]*4)/1440 -> 1899-12-31T23:44:27.975 | AA221: =8*RC[-4] -> 1165.7865852014011 | AB221: =MOD(RC[-23]*1440+RC[-6]+4*R3C2-60*R4C2,1440) -> 718.42704516302081 | AC221: =IF(RC[-1]/4<0,RC[-1]/4+180,RC[-1]/4-180) -> -0.3932387092447982 | AD221: =DEGREES(ACOS(SIN(RADIANS(R2C2))*SIN(RADIANS(RC[-10]))+COS(RADIANS(R2C2))*COS(RADIANS(RC[-10]))*COS(RADIANS(RC[-1])))) -> 54.110331748017167 | AE221: =90-RC[-1] -> 35.889668251982833 | AF221: =IF(RC[-1]>85,0,IF(RC[-1]>5,58.1/TAN(RADIANS(RC[-1]))-0.07/POWER(TAN(RADIANS(RC[-1])),3)+0.000086/POWER(TAN(RADIANS(RC[-1])),5),IF(RC[-1]>-0.575,1735+RC[-1]*(-518.2+RC[-1]*(103.4+RC[-1]*(-12.79+RC[-1]*0.711))),-20.772/TAN(RADIANS(RC[-1])))))/3600 -> 2.2252266539461069E-2 | AG221: =RC[-2]+RC[-1] -> 35.911920518522294 | AH221: =IF(RC[-5]>0,MOD(DEGREES(ACOS(((SIN(RADIANS(R2C2))*COS(RADIANS(RC[-4])))-SIN(RADIANS(RC[-14])))/(COS(RADIANS(R2C2))*SIN(RADIANS(RC[-4])))))+180,360),MOD(540-DEGREES(ACOS(((SIN(RADIANS(R2C2))*COS(RADIANS(RC[-4])))-SIN(RADIANS(RC[-14])))/(COS(RADIANS(R2C2))*SIN(RADIANS(RC[-4]))))),360)) -> 179.5331546648988
D222: =R[-1]C+1 -> 2017-08-09T00:00:00.000 | E222: =R5C2 -> 1899-12-31T14:00:00.000 | F222: =RC[-2]+2415018.5+RC[-1]-R4C2/24 -> 2457975.375 | G222: =(RC[-1]-2451545)/36525 -> 0.17605407255304587 | I222: =MOD(280.46646+RC[-2]*(36000.76983 + RC[-2]*0.0003032),360) -> 138.54861301401979 | J222: =357.52911+RC[-3]*(35999.05029 - 0.0001537*RC[-3]) -> 6695.3085168324696 | K222: =0.016708634-RC[-4]*(0.000042037+0.0000001267*RC[-4]) -> 1.6701229287880967E-2 | L222: =SIN(RADIANS(RC[-2]))*(1.914602-RC[-5]*(0.004817+0.000014*RC[-5]))+SIN(RADIANS(2*RC[-2]))*(0.019993-0.000101*RC[-5])+SIN(RADIANS(3*RC[-2]))*0.000289 -> -1.087544073613909 | M222: =RC[-4]+RC[-1] -> 137.46106894040588 | N222: =RC[-4]+RC[-2] -> 6694.2209727588561 | O222: =(1.000001018*(1-RC[-4]*RC[-4]))/(1+RC[-4]*COS(RADIANS(RC[-1]))) -> 1.0137214019745668 | P222: =RC[-3]-0.00569-0.00478*SIN(RADIANS(125.04-1934.136*RC[-9])) -> 137.45260504703327 | Q222: =23+(26+((21.448-RC[-10]*(46.815+RC[-10]*(0.00059-RC[-10]*0.001813))))/60)/60 -> 23.437001672277649 | R222: =RC[-1]+0.00256*COS(RADIANS(125.04-1934.136*RC[-11])) -> 23.434916823784224 | S222: =DEGREES(ATAN2(COS(RADIANS(RC[-3])),COS(RADIANS(RC[-1]))*SIN(RADIANS(RC[-3])))) -> 139.89784289390087 | T222: =DEGREES(ASIN(SIN(RADIANS(RC[-2]))*SIN(RADIANS(RC[-4])))) -> 15.600575068229615 | U222: =TAN(RADIANS(RC[-3]/2))*TAN(RADIANS(RC[-3]/2)) -> 4.3018011679759348E-2 | V222: =4*DEGREES(RC[-1]*SIN(2*RADIANS(RC[-13]))-2*RC[-11]*SIN(RADIANS(RC[-12]))+4*RC[-11]*RC[-1]*SIN(RADIANS(RC[-12]))*COS(2*RADIANS(RC[-13]))-0.5*RC[-1]*RC[-1]*SIN(4*RADIANS(RC[-13]))-1.25*RC[-11]*RC[-11]*SIN(2*RADIANS(RC[-12]))) -> -5.4292843165557549 | W222: =DEGREES(ACOS(COS(RADIANS(90.833))/(COS(RADIANS(R2C2))*COS(RADIANS(RC[-3])))-TAN(RADIANS(R2C2))*TAN(RADIANS(RC[-3])))) -> 144.22035196308244 | X222: =(720-4*R3C2-RC[-2]+R4C2*60)/1440 -> 1899-12-31T14:01:25.757 | Y222: =(RC[-1]*1440-RC[-2]*4)/1440 -> 1899-12-31T04:24:32.873 | Z222: =(RC[-2]*1440+RC[-3]*4)/1440 -> 1899-12-31T23:38:18.642 | AA222: =8*RC[-4] -> 1153.7628157046595 | AB222: =MOD(RC[-23]*1440+RC[-6]+4*R3C2-60*R4C2,1440) -> 718.57071568344429 | AC222: =IF(RC[-1]/4<0,RC[-1]/4+180,RC[-1]/4-180) -> -0.35732107913892719 | AD222: =DEGREES(ACOS(SIN(RADIANS(R2C2))*SIN(RADIANS(RC[-10]))+COS(RADIANS(R2C2))*COS(RADIANS(RC[-10]))*COS(RADIANS(RC[-1])))) -> 54.399876341410589 | AE222: =90-RC[-1] -> 35.600123658589411 | AF222: =IF(RC[-1]>85,0,IF(RC[-1]>5,58.1/TAN(RADIANS(RC[-1]))-0.07/POWER(TAN(RADIANS(RC[-1])),3)+0.000086/POWER(TAN(RADIANS(RC[-1])),5),IF(RC[-1]>-0.575,1735+RC[-1]*(-518.2+RC[-1]*(103.4+RC[-1]*(-12.79+RC[-1]*0.711))),-20.772/TAN(RADIANS(RC[-1])))))/3600 -> 2.2489597573076933E-2 | AG222: =RC[-2]+RC[-1] -> 35.622613256162488 | AH222: =IF(RC[-5]>0,MOD(DEGREES(ACOS(((SIN(RADIANS(R2C2))*COS(RADIANS(RC[-4])))-SIN(RADIANS(RC[-14])))/(COS(RADIANS(R2C2))*SIN(RADIANS(RC[-4])))))+180,360),MOD(540-DEGREES(ACOS(((SIN(RADIANS(R2C2))*COS(RADIANS(RC[-4])))-SIN(RADIANS(RC[-14])))/(COS(RADIANS(R2C2))*SIN(RADIANS(RC[-4]))))),360)) -> 179.57673295734151
D223: =R[-1]C+1 -> 2017-08-10T00:00:00.000 | E223: =R5C2 -> 1899-12-31T14:00:00.000 | F223: =RC[-2]+2415018.5+RC[-1]-R4C2/24 -> 2457976.375 | G223: =(RC[-1]-2451545)/36525 -> 0.17608145106091719 | I223: =MOD(280.46646+RC[-2]*(36000.76983 + RC[-2]*0.0003032),360) -> 139.53426037710688 | J223: =357.52911+RC[-3]*(35999.05029 - 0.0001537*RC[-3]) -> 6696.2941171127131 | K223: =0.016708634-RC[-4]*(0.000042037+0.0000001267*RC[-4]) -> 1.6701228135749126E-2 | L223: =SIN(RADIANS(RC[-2]))*(1.914602-RC[-5]*(0.004817+0.000014*RC[-5]))+SIN(RADIANS(2*RC[-2]))*(0.019993-0.000101*RC[-5])+SIN(RADIANS(3*RC[-2]))*0.000289 -> -1.1140223732371446 | M223: =RC[-4]+RC[-1] -> 138.42023800386974 | N223: =RC[-4]+RC[-2] -> 6695.1800947394759 | O223: =(1.000001018*(1-RC[-4]*RC[-4]))/(1+RC[-4]*COS(RADIANS(RC[-1]))) -> 1.0135578272072563 | P223: =RC[-3]-0.00569-0.00478*SIN(RADIANS(125.04-1934.136*RC[-9])) -> 138.41177051388595 | Q223: =23+(26+((21.448-RC[-10]*(46.815+RC[-10]*(0.00059-RC[-10]*0.001813))))/60)/60 -> 23.437001316242672 | R223: =RC[-1]+0.00256*COS(RADIANS(125.04-1934.136*RC[-11])) -> 23.434917841656684 | S223: =DEGREES(ATAN2(COS(RADIANS(RC[-3])),COS(RADIANS(RC[-1]))*SIN(RADIANS(RC[-3])))) -> 140.84515410025469 | T223: =DEGREES(ASIN(SIN(RADIANS(RC[-2]))*SIN(RADIANS(RC[-4])))) -> 15.30677378334663 | U223: =TAN(RADIANS(RC[-3]/2))*TAN(RADIANS(RC[-3]/2)) -> 4.3018015522912727E-2 | V223: =4*DEGREES(RC[-1]*SIN(2*RADIANS(RC[-13]))-2*RC[-11]*SIN(RADIANS(RC[-12]))+4*RC[-11]*RC[-1]*SIN(RADIANS(RC[-12]))*COS(2*RADIANS(RC[-13]))-0.5*RC[-1]*RC[-1]*SIN(4*RADIANS(RC[-13]))-1.25*RC[-11]*RC[-11]*SIN(2*RADIANS(RC[-12]))) -> -5.2760615659701813 | W223: =DEGREES(ACOS(COS(RADIANS(90.833))/(COS(RADIANS(R2C2))*COS(RADIANS(RC[-3])))-TAN(RADIANS(R2C2))*TAN(RADIANS(RC[-3])))) -> 142.7539506418839 | X223: =(720-4*R3C2-RC[-2]+R4C2*60)/1440 -> 1899-12-31T14:01:16.564 | Y223: =(RC[-1]*1440-RC[-2]*4)/1440 -> 1899-12-31T04:30:15.616 | Z223: =(RC[-2]*1440+RC[-3]*4)/1440 -> 1899-12-31T23:32:17.512 | AA223: =8*RC[-4] -> 1142.0316051350712 | AB223: =MOD(RC[-23]*1440+RC[-6]+4*R3C2-60*R4C2,1440) -> 718.72393843402983 | AC223: =IF(RC[-1]/4<0,RC[-1]/4+180,RC[-1]/4-180) -> -0.31901539149254177 | AD223: =DEGREES(ACOS(SIN(RADIANS(R2C2))*SIN(RADIANS(RC[-10]))+COS(RADIANS(R2C2))*COS(RADIANS(RC[-10]))*COS(RADIANS(RC[-1])))) -> 54.69358522724216 | AE223: =90-RC[-1] -> 35.30641477275784 | AF223: =IF(RC[-1]>85,0,IF(RC[-1]>5,58.1/TAN(RADIANS(RC[-1]))-0.07/POWER(TAN(RADIANS(RC[-1])),3)+0.000086/POWER(TAN(RADIANS(RC[-1])),5),IF(RC[-1]>-0.575,1735+RC[-1]*(-518.2+RC[-1]*(103.4+RC[-1]*(-12.79+RC[-1]*0.711))),-20.772/TAN(RADIANS(RC[-1])))))/3600 -> 2.2733752815624265E-2 | AG223: =RC[-2]+RC[-1] -> 35.329148525573466 | AH223: =IF(RC[-5]>0,MOD(DEGREES(ACOS(((SIN(RADIANS(R2C2))*COS(RADIANS(RC[-4])))-SIN(RADIANS(RC[-14])))/(COS(RADIANS(R2C2))*SIN(RADIANS(RC[-4])))))+180,360),MOD(540-DEGREES(ACOS(((SIN(RADIANS(R2C2))*COS(RADIANS(RC[-4])))-SIN(RADIANS(RC[-14])))/(COS(RADIANS(R2C2))*SIN(RADIANS(RC[-4]))))),360)) -> 179.62295115604684
D224: =R[-1]C+1 -> 2017-08-11T00:00:00.000 | E224: =R5C2 -> 1899-12-31T14:00:00.000 | F224: =RC[-2]+2415018.5+RC[-1]-R4C2/24 -> 2457977.375 | G224: =(RC[-1]-2451545)/36525 -> 0.17610882956878851 | I224: =MOD(280.46646+RC[-2]*(36000.76983 + RC[-2]*0.0003032),360) -> 140.51990774019396 | J224: =357.52911+RC[-3]*(35999.05029 - 0.0001537*RC[-3]) -> 6697.2797173929557 | K224: =0.016708634-RC[-4]*(0.000042037+0.0000001267*RC[-4]) -> 1.670122698361709E-2 | L224: =SIN(RADIANS(RC[-2]))*(1.914602-RC[-5]*(0.004817+0.000014*RC[-5]))+SIN(RADIANS(2*RC[-2]))*(0.019993-0.000101*RC[-5])+SIN(RADIANS(3*RC[-2]))*0.000289 -> -1.1401873002025771 | M224: =RC[-4]+RC[-1] -> 139.37972043999139 | N224: =RC[-4]+RC[-2] -> 6696.1395300927534 | O224: =(1.000001018*(1-RC[-4]*RC[-4]))/(1+RC[-4]*COS(RADIANS(RC[-1]))) -> 1.013390320541901 | P224: =RC[-3]-0.00569-0.00478*SIN(RADIANS(125.04-1934.136*RC[-9])) -> 139.3712493557689 | Q224: =23+(26+((21.448-RC[-10]*(46.815+RC[-10]*(0.00059-RC[-10]*0.001813))))/60)/60 -> 23.437000960207698 | R224: =RC[-1]+0.00256*COS(RADIANS(125.04-1934.136*RC[-11])) -> 23.434918861308805 | S224: =DEGREES(ATAN2(COS(RADIANS(RC[-3])),COS(RADIANS(RC[-1]))*SIN(RADIANS(RC[-3])))) -> 141.79010034791804 | T224: =DEGREES(ASIN(SIN(RADIANS(RC[-2]))*SIN(RADIANS(RC[-4])))) -> 15.008897813167788 | U224: =TAN(RADIANS(RC[-3]/2))*TAN(RADIANS(RC[-3]/2)) -> 4.3018019372785696E-2 | V224: =4*DEGREES(RC[-1]*SIN(2*RADIANS(RC[-13]))-2*RC[-11]*SIN(RADIANS(RC[-12]))+4*RC[-11]*RC[-1]*SIN(RADIANS(RC[-12]))*COS(2*RADIANS(RC[-13]))-0.5*RC[-1]*RC[-1]*SIN(4*RADIANS(RC[-13]))-1.25*RC[-11]*RC[-11]*SIN(2*RADIANS(RC[-12]))) -> -5.1134077820385899 | W224: =DEGREES(ACOS(COS(RADIANS(90.833))/(COS(RADIANS(R2C2))*COS(RADIANS(RC[-3])))-TAN(RADIANS(R2C2))*TAN(RADIANS(RC[-3])))) -> 141.32008004322097 | X224: =(720-4*R3C2-RC[-2]+R4C2*60)/1440 -> 1899-12-31T14:01:06.804 | Y224: =(RC[-1]*1440-RC[-2]*4)/1440 -> 1899-12-31T04:35:49.985 | Z224: =(RC[-2]*1440+RC[-3]*4)/1440 -> 1899-12-31T23:26:23.624 | AA224: =8*RC[-4] -> 1130.5606403457678 | AB224: =MOD(RC[-23]*1440+RC[-6]+4*R3C2-60*R4C2,1440) -> 718.88659221796138 | AC224: =IF(RC[-1]/4<0,RC[-1]/4+180,RC[-1]/4-180) -> -0.27835194550965525 | AD224: =DEGREES(ACOS(SIN(RADIANS(R2C2))*SIN(RADIANS(RC[-10]))+COS(RADIANS(R2C2))*COS(RADIANS(RC[-10]))*COS(RADIANS(RC[-1])))) -> 54.991374892657404 | AE224: =90-RC[-1] -> 35.008625107342596 | AF224: =IF(RC[-1]>85,0,IF(RC[-1]>5,58.1/TAN(RADIANS(RC[-1]))-0.07/POWER(TAN(RADIANS(RC[-1])),3)+0.000086/POWER(TAN(RADIANS(RC[-1])),5),IF(RC[-1]>-0.575,1735+RC[-1]*(-518.2+RC[-1]*(103.4+RC[-1]*(-12.79+RC[-1]*0.711))),-20.772/TAN(RADIANS(RC[-1])))))/3600 -> 2.2984896044398503E-2 | AG224: =RC[-2]+RC[-1] -> 35.031610003386994 | AH224: =IF(RC[-5]>0,MOD(DEGREES(ACOS(((SIN(RADIANS(R2C2))*COS(RADIANS(RC[-4])))-SIN(RADIANS(RC[-14])))/(COS(RADIANS(R2C2))*SIN(RADIANS(RC[-4])))))+180,360),MOD(540-DEGREES(ACOS(((SIN(RADIANS(R2C2))*COS(RADIANS(RC[-4])))-SIN(RADIANS(RC[-14])))/(COS(RADIANS(R2C2))*SIN(RADIANS(RC[-4]))))),360)) -> 179.6717521464883
D225: =R[-1]C+1 -> 2017-08-12T00:00:00.000 | E225: =R5C2 -> 1899-12-31T14:00:00.000 | F225: =RC[-2]+2415018.5+RC[-1]-R4C2/24 -> 2457978.375 | G225: =(RC[-1]-2451545)/36525 -> 0.17613620807665983 | I225: =MOD(280.46646+RC[-2]*(36000.76983 + RC[-2]*0.0003032),360) -> 141.50555510328195 | J225: =357.52911+RC[-3]*(35999.05029 - 0.0001537*RC[-3]) -> 6698.2653176731983 | K225: =0.016708634-RC[-4]*(0.000042037+0.0000001267*RC[-4]) -> 1.6701225831484867E-2 | L225: =SIN(RADIANS(RC[-2]))*(1.914602-RC[-5]*(0.004817+0.000014*RC[-5]))+SIN(RADIANS(2*RC[-2]))*(0.019993-0.000101*RC[-5])+SIN(RADIANS(3*RC[-2]))*0.000289 -> -1.1660312970980697 | M225: =RC[-4]+RC[-1] -> 140.33952380618388 | N225: =RC[-4]+RC[-2] -> 6697.0992863761003 | O225: =(1.000001018*(1-RC[-4]*RC[-4]))/(1+RC[-4]*COS(RADIANS(RC[-1]))) -> 1.0132189276559489 | P225: =RC[-3]-0.00569-0.00478*SIN(RADIANS(125.04-1934.136*RC[-9])) -> 140.33104913009819 | Q225: =23+(26+((21.448-RC[-10]*(46.815+RC[-10]*(0.00059-RC[-10]*0.001813))))/60)/60 -> 23.43700060417272 | R225: =RC[-1]+0.00256*COS(RADIANS(125.04-1934.136*RC[-11])) -> 23.434919882739408 | S225: =DEGREES(ATAN2(COS(RADIANS(RC[-3])),COS(RADIANS(RC[-1]))*SIN(RADIANS(RC[-3])))) -> 142.73271361335307 | T225: =DEGREES(ASIN(SIN(RADIANS(RC[-2]))*SIN(RADIANS(RC[-4])))) -> 14.707033009664569 | U225: =TAN(RADIANS(RC[-3]/2))*TAN(RADIANS(RC[-3]/2)) -> 4.3018023229373835E-2 | V225: =4*DEGREES(RC[-1]*SIN(2*RADIANS(RC[-13]))-2*RC[-11]*SIN(RADIANS(RC[-12]))+4*RC[-11]*RC[-1]*SIN(RADIANS(RC[-12]))*COS(2*RADIANS(RC[-13]))-0.5*RC[-1]*RC[-1]*SIN(4*RADIANS(RC[-13]))-1.25*RC[-11]*RC[-11]*SIN(2*RADIANS(RC[-12]))) -> -4.9414544175139685 | W225: =DEGREES(ACOS(COS(RADIANS(90.833))/(COS(RADIANS(R2C2))*COS(RADIANS(RC[-3])))-TAN(RADIANS(R2C2))*TAN(RADIANS(RC[-3])))) -> 139.91535686576321 | X225: =(720-4*R3C2-RC[-2]+R4C2*60)/1440 -> 1899-12-31T14:00:56.487 | Y225: =(RC[-1]*1440-RC[-2]*4)/1440 -> 1899-12-31T04:41:16.802 | Z225: =(RC[-2]*1440+RC[-3]*4)/1440 -> 1899-12-31T23:20:36.173 | AA225: =8*RC[-4] -> 1119.3228549261057 | AB225: =MOD(RC[-23]*1440+RC[-6]+4*R3C2-60*R4C2,1440) -> 719.05854558248598 | AC225: =IF(RC[-1]/4<0,RC[-1]/4+180,RC[-1]/4-180) -> -0.2353636043785059 | AD225: =DEGREES(ACOS(SIN(RADIANS(R2C2))*SIN(RADIANS(RC[-10]))+COS(RADIANS(R2C2))*COS(RADIANS(RC[-10]))*COS(RADIANS(RC[-1])))) -> 55.293161525569872 | AE225: =90-RC[-1] -> 34.706838474430128 | AF225: =IF(RC[-1]>85,0,IF(RC[-1]>5,58.1/TAN(RADIANS(RC[-1]))-0.07/POWER(TAN(RADIANS(RC[-1])),3)+0.000086/POWER(TAN(RADIANS(RC[-1])),5),IF(RC[-1]>-0.575,1735+RC[-1]*(-518.2+RC[-1]*(103.4+RC[-1]*(-12.79+RC[-1]*0.711))),-20.772/TAN(RADIANS(RC[-1])))))/3600 -> 2.3243199191416184E-2 | AG225: =RC[-2]+RC[-1] -> 34.730081673621548 | AH225: =IF(RC[-5]>0,MOD(DEGREES(ACOS(((SIN(RADIANS(R2C2))*COS(RADIANS(RC[-4])))-SIN(RADIANS(RC[-14])))/(COS(RADIANS(R2C2))*SIN(RADIANS(RC[-4])))))+180,360),MOD(540-DEGREES(ACOS(((SIN(RADIANS(R2C2))*COS(RADIANS(RC[-4])))-SIN(RADIANS(RC[-14])))/(COS(RADIANS(R2C2))*SIN(RADIANS(RC[-4]))))),360)) -> 179.72307607442735
D226: =R[-1]C+1 -> 2017-08-13T00:00:00.000 | E226: =R5C2 -> 1899-12-31T14:00:00.000 | F226: =RC[-2]+2415018.5+RC[-1]-R4C2/24 -> 2457979.375 | G226: =(RC[-1]-2451545)/36525 -> 0.17616358658453116 | I226: =MOD(280.46646+RC[-2]*(36000.76983 + RC[-2]*0.0003032),360) -> 142.49120246637085 | J226: =357.52911+RC[-3]*(35999.05029 - 0.0001537*RC[-3]) -> 6699.2509179534409 | K226: =0.016708634-RC[-4]*(0.000042037+0.0000001267*RC[-4]) -> 1.6701224679352457E-2 | L226: =SIN(RADIANS(RC[-2]))*(1.914602-RC[-5]*(0.004817+0.000014*RC[-5]))+SIN(RADIANS(2*RC[-2]))*(0.019993-0.000101*RC[-5])+SIN(RADIANS(3*RC[-2]))*0.000289 -> -1.1915468829396167 | M226: =RC[-4]+RC[-1] -> 141.29965558343125 | N226: =RC[-4]+RC[-2] -> 6698.0593710705016 | O226: =(1.000001018*(1-RC[-4]*RC[-4]))/(1+RC[-4]*COS(RADIANS(RC[-1]))) -> 1.0130436953341622 | P226: =RC[-3]-0.00569-0.00478*SIN(RADIANS(125.04-1934.136*RC[-9])) -> 141.29117731786098 | Q226: =23+(26+((21.448-RC[-10]*(46.815+RC[-10]*(0.00059-RC[-10]*0.001813))))/60)/60 -> 23.437000248137743 | R226: =RC[-1]+0.00256*COS(RADIANS(125.04-1934.136*RC[-11])) -> 23.434920905947312 | S226: =DEGREES(ATAN2(COS(RADIANS(RC[-3])),COS(RADIANS(RC[-1]))*SIN(RADIANS(RC[-3])))) -> 143.67302838831034 | T226: =DEGREES(ASIN(SIN(RADIANS(RC[-2]))*SIN(RADIANS(RC[-4])))) -> 14.401265563500933 | U226: =TAN(RADIANS(RC[-3]/2))*TAN(RADIANS(RC[-3]/2)) -> 4.3018027092672662E-2 | V226: =4*DEGREES(RC[-1]*SIN(2*RADIANS(RC[-13]))-2*RC[-11]*SIN(RADIANS(RC[-12]))+4*RC[-11]*RC[-1]*SIN(RADIANS(RC[-12]))*COS(2*RADIANS(RC[-13]))-0.5*RC[-1]*RC[-1]*SIN(4*RADIANS(RC[-13]))-1.25*RC[-11]*RC[-11]*SIN(2*RADIANS(RC[-12]))) -> -4.7603428711935409 | W226: =DEGREES(ACOS(COS(RADIANS(90.833))/(COS(RADIANS(R2C2))*COS(RADIANS(RC[-3])))-TAN(RADIANS(R2C2))*TAN(RADIANS(RC[-3])))) -> 138.53691456252261 | X226: =(720-4*R3C2-RC[-2]+R4C2*60)/1440 -> 1899-12-31T14:00:45.621 | Y226: =(RC[-1]*1440-RC[-2]*4)/1440 -> 1899-12-31T04:46:36.761 | Z226: =(RC[-2]*1440+RC[-3]*4)/1440 -> 1899-12-31T23:14:54.480 | AA226: =8*RC[-4] -> 1108.2953165001809 | AB226: =MOD(RC[-23]*1440+RC[-6]+4*R3C2-60*R4C2,1440) -> 719.23965712880647 | AC226: =IF(RC[-1]/4<0,RC[-1]/4+180,RC[-1]/4-180) -> -0.19008571779838235 | AD226: =DEGREES(ACOS(SIN(RADIANS(R2C2))*SIN(RADIANS(RC[-10]))+COS(RADIANS(R2C2))*COS(RADIANS(RC[-10]))*COS(RADIANS(RC[-1])))) -> 55.598861033854021 | AE226: =90-RC[-1] -> 34.401138966145979 | AF226: =IF(RC[-1]>85,0,IF(RC[-1]>5,58.1/TAN(RADIANS(RC[-1]))-0.07/POWER(TAN(RADIANS(RC[-1])),3)+0.000086/POWER(TAN(RADIANS(RC[-1])),5),IF(RC[-1]>-0.575,1735+RC[-1]*(-518.2+RC[-1]*(103.4+RC[-1]*(-12.79+RC[-1]*0.711))),-20.772/TAN(RADIANS(RC[-1])))))/3600 -> 2.3508842745727905E-2 | AG226: =RC[-2]+RC[-1] -> 34.424647808891706 | AH226: =IF(RC[-5]>0,MOD(DEGREES(ACOS(((SIN(RADIANS(R2C2))*COS(RADIANS(RC[-4])))-SIN(RADIANS(RC[-14])))/(COS(RADIANS(R2C2))*SIN(RADIANS(RC[-4])))))+180,360),MOD(540-DEGREES(ACOS(((SIN(RADIANS(R2C2))*COS(RADIANS(RC[-4])))-SIN(RADIANS(RC[-14])))/(COS(RADIANS(R2C2))*SIN(RADIANS(RC[-4]))))),360)) -> 179.77686049815418
D227: =R[-1]C+1 -> 2017-08-14T00:00:00.000 | E227: =R5C2 -> 1899-12-31T14:00:00.000 | F227: =RC[-2]+2415018.5+RC[-1]-R4C2/24 -> 2457980.375 | G227: =(RC[-1]-2451545)/36525 -> 0.17619096509240245 | I227: =MOD(280.46646+RC[-2]*(36000.76983 + RC[-2]*0.0003032),360) -> 143.47684982945975 | J227: =357.52911+RC[-3]*(35999.05029 - 0.0001537*RC[-3]) -> 6700.2365182336816 | K227: =0.016708634-RC[-4]*(0.000042037+0.0000001267*RC[-4]) -> 1.6701223527219852E-2 | L227: =SIN(RADIANS(RC[-2]))*(1.914602-RC[-5]*(0.004817+0.000014*RC[-5]))+SIN(RADIANS(2*RC[-2]))*(0.019993-0.000101*RC[-5])+SIN(RADIANS(3*RC[-2]))*0.000289 -> -1.2167266551674687 | M227: =RC[-4]+RC[-1] -> 142.26012317429229 | N227: =RC[-4]+RC[-2] -> 6699.0197915785138 | O227: =(1.000001018*(1-RC[-4]*RC[-4]))/(1+RC[-4]*COS(RADIANS(RC[-1]))) -> 1.012864671459154 | P227: =RC[-3]-0.00569-0.00478*SIN(RADIANS(125.04-1934.136*RC[-9])) -> 142.25164132161913 | Q227: =23+(26+((21.448-RC[-10]*(46.815+RC[-10]*(0.00059-RC[-10]*0.001813))))/60)/60 -> 23.436999892102765 | R227: =RC[-1]+0.00256*COS(RADIANS(125.04-1934.136*RC[-11])) -> 23.434921930931345 | S227: =DEGREES(ATAN2(COS(RADIANS(RC[-3])),COS(RADIANS(RC[-1]))*SIN(RADIANS(RC[-3])))) -> 144.61108161399446 | T227: =DEGREES(ASIN(SIN(RADIANS(RC[-2]))*SIN(RADIANS(RC[-4])))) -> 14.091681976430833 | U227: =TAN(RADIANS(RC[-3]/2))*TAN(RADIANS(RC[-3]/2)) -> 4.3018030962677777E-2 | V227: =4*DEGREES(RC[-1]*SIN(2*RADIANS(RC[-13]))-2*RC[-11]*SIN(RADIANS(RC[-12]))+4*RC[-11]*RC[-1]*SIN(RADIANS(RC[-12]))*COS(2*RADIANS(RC[-13]))-0.5*RC[-1]*RC[-1]*SIN(4*RADIANS(RC[-13]))-1.25*RC[-11]*RC[-11]*SIN(2*RADIANS(RC[-12]))) -> -4.5702241745516501 | W227: =DEGREES(ACOS(COS(RADIANS(90.833))/(COS(RADIANS(R2C2))*COS(RADIANS(RC[-3])))-TAN(RADIANS(R2C2))*TAN(RADIANS(RC[-3])))) -> 137.18229961106869 | X227: =(720-4*R3C2-RC[-2]+R4C2*60)/1440 -> 1899-12-31T14:00:34.213 | Y227: =(RC[-1]*1440-RC[-2]*4)/1440 -> 1899-12-31T04:51:50.462 | Z227: =(RC[-2]*1440+RC[-3]*4)/1440 -> 1899-12-31T23:09:17.965 | AA227: =8*RC[-4] -> 1097.4583968885495 | AB227: =MOD(RC[-23]*1440+RC[-6]+4*R3C2-60*R4C2,1440) -> 719.42977582544836 | AC227: =IF(RC[-1]/4<0,RC[-1]/4+180,RC[-1]/4-180) -> -0.14255604363791008 | AD227: =DEGREES(ACOS(SIN(RADIANS(R2C2))*SIN(RADIANS(RC[-10]))+COS(RADIANS(R2C2))*COS(RADIANS(RC[-10]))*COS(RADIANS(RC[-1])))) -> 55.90838906235264 | AE227: =90-RC[-1] -> 34.09161093764736 | AF227: =IF(RC[-1]>85,0,IF(RC[-1]>5,58.1/TAN(RADIANS(RC[-1]))-0.07/POWER(TAN(RADIANS(RC[-1])),3)+0.000086/POWER(TAN(RADIANS(RC[-1])),5),IF(RC[-1]>-0.575,1735+RC[-1]*(-518.2+RC[-1]*(103.4+RC[-1]*(-12.79+RC[-1]*0.711))),-20.772/TAN(RADIANS(RC[-1])))))/3600 -> 2.3782016179825519E-2 | AG227: =RC[-2]+RC[-1] -> 34.115392953827183 | AH227: =IF(RC[-5]>0,MOD(DEGREES(ACOS(((SIN(RADIANS(R2C2))*COS(RADIANS(RC[-4])))-SIN(RADIANS(RC[-14])))/(COS(RADIANS(R2C2))*SIN(RADIANS(RC[-4])))))+180,360),MOD(540-DEGREES(ACOS(((SIN(RADIANS(R2C2))*COS(RADIANS(RC[-4])))-SIN(RADIANS(RC[-14])))/(COS(RADIANS(R2C2))*SIN(RADIANS(RC[-4]))))),360)) -> 179.8330405391672
D228: =R[-1]C+1 -> 2017-08-15T00:00:00.000 | E228: =R5C2 -> 1899-12-31T14:00:00.000 | F228: =RC[-2]+2415018.5+RC[-1]-R4C2/24 -> 2457981.375 | G228: =(RC[-1]-2451545)/36525 -> 0.17621834360027377 | I228: =MOD(280.46646+RC[-2]*(36000.76983 + RC[-2]*0.0003032),360) -> 144.46249719254956 | J228: =357.52911+RC[-3]*(35999.05029 - 0.0001537*RC[-3]) -> 6701.2221185139242 | K228: =0.016708634-RC[-4]*(0.000042037+0.0000001267*RC[-4]) -> 1.670122237508706E-2 | L228: =SIN(RADIANS(RC[-2]))*(1.914602-RC[-5]*(0.004817+0.000014*RC[-5]))+SIN(RADIANS(2*RC[-2]))*(0.019993-0.000101*RC[-5])+SIN(RADIANS(3*RC[-2]))*0.000289 -> -1.2415632916391006 | M228: =RC[-4]+RC[-1] -> 143.22093390091047 | N228: =RC[-4]+RC[-2] -> 6699.9805552222851 | O228: =(1.000001018*(1-RC[-4]*RC[-4]))/(1+RC[-4]*COS(RADIANS(RC[-1]))) -> 1.0126819050016396 | P228: =RC[-3]-0.00569-0.00478*SIN(RADIANS(125.04-1934.136*RC[-9])) -> 143.21244846351917 | Q228: =23+(26+((21.448-RC[-10]*(46.815+RC[-10]*(0.00059-RC[-10]*0.001813))))/60)/60 -> 23.436999536067788 | R228: =RC[-1]+0.00256*COS(RADIANS(125.04-1934.136*RC[-11])) -> 23.434922957690329 | S228: =DEGREES(ATAN2(COS(RADIANS(RC[-3])),COS(RADIANS(RC[-1]))*SIN(RADIANS(RC[-3])))) -> 145.54691261468474 | T228: =DEGREES(ASIN(SIN(RADIANS(RC[-2]))*SIN(RADIANS(RC[-4])))) -> 13.778369035625552 | U228: =TAN(RADIANS(RC[-3]/2))*TAN(RADIANS(RC[-3]/2)) -> 4.3018034839384697E-2 | V228: =4*DEGREES(RC[-1]*SIN(2*RADIANS(RC[-13]))-2*RC[-11]*SIN(RADIANS(RC[-12]))+4*RC[-11]*RC[-1]*SIN(RADIANS(RC[-12]))*COS(2*RADIANS(RC[-13]))-0.5*RC[-1]*RC[-1]*SIN(4*RADIANS(RC[-13]))-1.25*RC[-11]*RC[-11]*SIN(2*RADIANS(RC[-12]))) -> -4.3712586761821912 | W228: =DEGREES(ACOS(COS(RADIANS(90.833))/(COS(RADIANS(R2C2))*COS(RADIANS(RC[-3])))-TAN(RADIANS(R2C2))*TAN(RADIANS(RC[-3])))) -> 135.84939277933017 | X228: =(720-4*R3C2-RC[-2]+R4C2*60)/1440 -> 1899-12-31T14:00:22.276 | Y228: =(RC[-1]*1440-RC[-2]*4)/1440 -> 1899-12-31T04:56:58.421 | Z228: =(RC[-2]*1440+RC[-3]*4)/1440 -> 1899-12-31T23:03:46.130 | AA228: =8*RC[-4] -> 1086.7951422346414 | AB228: =MOD(RC[-23]*1440+RC[-6]+4*R3C2-60*R4C2,1440) -> 719.62874132381785 | AC228: =IF(RC[-1]/4<0,RC[-1]/4+180,RC[-1]/4-180) -> -9.2814669045537812E-2 | AD228: =DEGREES(ACOS(SIN(RADIANS(R2C2))*SIN(RADIANS(RC[-10]))+COS(RADIANS(R2C2))*COS(RADIANS(RC[-10]))*COS(RADIANS(RC[-1])))) -> 56.221661007770741 | AE228: =90-RC[-1] -> 33.778338992229259 | AF228: =IF(RC[-1]>85,0,IF(RC[-1]>5,58.1/TAN(RADIANS(RC[-1]))-0.07/POWER(TAN(RADIANS(RC[-1])),3)+0.000086/POWER(TAN(RADIANS(RC[-1])),5),IF(RC[-1]>-0.575,1735+RC[-1]*(-518.2+RC[-1]*(103.4+RC[-1]*(-12.79+RC[-1]*0.711))),-20.772/TAN(RADIANS(RC[-1])))))/3600 -> 2.4062918401880521E-2 | AG228: =RC[-2]+RC[-1] -> 33.80240191063114 | AH228: =IF(RC[-5]>0,MOD(DEGREES(ACOS(((SIN(RADIANS(R2C2))*COS(RADIANS(RC[-4])))-SIN(RADIANS(RC[-14])))/(COS(RADIANS(R2C2))*SIN(RADIANS(RC[-4])))))+180,360),MOD(540-DEGREES(ACOS(((SIN(RADIANS(R2C2))*COS(RADIANS(RC[-4])))-SIN(RADIANS(RC[-14])))/(COS(RADIANS(R2C2))*SIN(RADIANS(RC[-4]))))),360)) -> 179.89154903075121
D229: =R[-1]C+1 -> 2017-08-16T00:00:00.000 | E229: =R5C2 -> 1899-12-31T14:00:00.000 | F229: =RC[-2]+2415018.5+RC[-1]-R4C2/24 -> 2457982.375 | G229: =(RC[-1]-2451545)/36525 -> 0.1762457221081451 | I229: =MOD(280.46646+RC[-2]*(36000.76983 + RC[-2]*0.0003032),360) -> 145.44814455563937 | J229: =357.52911+RC[-3]*(35999.05029 - 0.0001537*RC[-3]) -> 6702.2077187941659 | K229: =0.016708634-RC[-4]*(0.000042037+0.0000001267*RC[-4]) -> 1.6701221222954078E-2 | L229: =SIN(RADIANS(RC[-2]))*(1.914602-RC[-5]*(0.004817+0.000014*RC[-5]))+SIN(RADIANS(2*RC[-2]))*(0.019993-0.000101*RC[-5])+SIN(RADIANS(3*RC[-2]))*0.000289 -> -1.2660495526179667 | M229: =RC[-4]+RC[-1] -> 144.1820950030214 | N229: =RC[-4]+RC[-2] -> 6700.941669241548 | O229: =(1.000001018*(1-RC[-4]*RC[-4]))/(1+RC[-4]*COS(RADIANS(RC[-1]))) -> 1.012495446010425 | P229: =RC[-3]-0.00569-0.00478*SIN(RADIANS(125.04-1934.136*RC[-9])) -> 144.17360598329975 | Q229: =23+(26+((21.448-RC[-10]*(46.815+RC[-10]*(0.00059-RC[-10]*0.001813))))/60)/60 -> 23.436999180032814 | R229: =RC[-1]+0.00256*COS(RADIANS(125.04-1934.136*RC[-11])) -> 23.434923986223083 | S229: =DEGREES(ATAN2(COS(RADIANS(RC[-3])),COS(RADIANS(RC[-1]))*SIN(RADIANS(RC[-3])))) -> 146.48056303097937 | T229: =DEGREES(ASIN(SIN(RADIANS(RC[-2]))*SIN(RADIANS(RC[-4])))) -> 13.461413789916893 | U229: =TAN(RADIANS(RC[-3]/2))*TAN(RADIANS(RC[-3]/2)) -> 4.3018038722788983E-2 | V229: =4*DEGREES(RC[-1]*SIN(2*RADIANS(RC[-13]))-2*RC[-11]*SIN(RADIANS(RC[-12]))+4*RC[-11]*RC[-1]*SIN(RADIANS(RC[-12]))*COS(2*RADIANS(RC[-13]))-0.5*RC[-1]*RC[-1]*SIN(4*RADIANS(RC[-13]))-1.25*RC[-11]*RC[-11]*SIN(2*RADIANS(RC[-12]))) -> -4.1636157253027859 | W229: =DEGREES(ACOS(COS(RADIANS(90.833))/(COS(RADIANS(R2C2))*COS(RADIANS(RC[-3])))-TAN(RADIANS(R2C2))*TAN(RADIANS(RC[-3])))) -> 134.53634842730298 | X229: =(720-4*R3C2-RC[-2]+R4C2*60)/1440 -> 1899-12-31T14:00:09.817 | Y229: =(RC[-1]*1440-RC[-2]*4)/1440 -> 1899-12-31T05:02:01.093 | Z229: =(RC[-2]*1440+RC[-3]*4)/1440 -> 1899-12-31T22:58:18.541 | AA229: =8*RC[-4] -> 1076.2907874184239 | AB229: =MOD(RC[-23]*1440+RC[-6]+4*R3C2-60*R4C2,1440) -> 719.83638427469725 | AC229: =IF(RC[-1]/4<0,RC[-1]/4+180,RC[-1]/4-180) -> -4.0903931325686926E-2 | AD229: =DEGREES(ACOS(SIN(RADIANS(R2C2))*SIN(RADIANS(RC[-10]))+COS(RADIANS(R2C2))*COS(RADIANS(RC[-10]))*COS(RADIANS(RC[-1])))) -> 56.538592031527031 | AE229: =90-RC[-1] -> 33.461407968472969 | AF229: =IF(RC[-1]>85,0,IF(RC[-1]>5,58.1/TAN(RADIANS(RC[-1]))-0.07/POWER(TAN(RADIANS(RC[-1])),3)+0.000086/POWER(TAN(RADIANS(RC[-1])),5),IF(RC[-1]>-0.575,1735+RC[-1]*(-518.2+RC[-1]*(103.4+RC[-1]*(-12.79+RC[-1]*0.711))),-20.772/TAN(RADIANS(RC[-1])))))/3600 -> 2.4351758235685746E-2 | AG229: =RC[-2]+RC[-1] -> 33.485759726708658 | AH229: =IF(RC[-5]>0,MOD(DEGREES(ACOS(((SIN(RADIANS(R2C2))*COS(RADIANS(RC[-4])))-SIN(RADIANS(RC[-14])))/(COS(RADIANS(R2C2))*SIN(RADIANS(RC[-4])))))+180,360),MOD(540-DEGREES(ACOS(((SIN(RADIANS(R2C2))*COS(RADIANS(RC[-4])))-SIN(RADIANS(RC[-14])))/(COS(RADIANS(R2C2))*SIN(RADIANS(RC[-4]))))),360)) -> 179.95231666433676
D230: =R[-1]C+1 -> 2017-08-17T00:00:00.000 | E230: =R5C2 -> 1899-12-31T14:00:00.000 | F230: =RC[-2]+2415018.5+RC[-1]-R4C2/24 -> 2457983.375 | G230: =(RC[-1]-2451545)/36525 -> 0.17627310061601642 | I230: =MOD(280.46646+RC[-2]*(36000.76983 + RC[-2]*0.0003032),360) -> 146.433791918731 | J230: =357.52911+RC[-3]*(35999.05029 - 0.0001537*RC[-3]) -> 6703.1933190744066 | K230: =0.016708634-RC[-4]*(0.000042037+0.0000001267*RC[-4]) -> 1.6701220070820904E-2 | L230: =SIN(RADIANS(RC[-2]))*(1.914602-RC[-5]*(0.004817+0.000014*RC[-5]))+SIN(RADIANS(2*RC[-2]))*(0.019993-0.000101*RC[-5])+SIN(RADIANS(3*RC[-2]))*0.000289 -> -1.2901782827586739 | M230: =RC[-4]+RC[-1] -> 145.14361363597234 | N230: =RC[-4]+RC[-2] -> 6701.9031407916482 | O230: =(1.000001018*(1-RC[-4]*RC[-4]))/(1+RC[-4]*COS(RADIANS(RC[-1]))) -> 1.0123053456021058 | P230: =RC[-3]-0.00569-0.00478*SIN(RADIANS(125.04-1934.136*RC[-9])) -> 145.13512103631118 | Q230: =23+(26+((21.448-RC[-10]*(46.815+RC[-10]*(0.00059-RC[-10]*0.001813))))/60)/60 -> 23.436998823997836 | R230: =RC[-1]+0.00256*COS(RADIANS(125.04-1934.136*RC[-11])) -> 23.434925016528414 | S230: =DEGREES(ATAN2(COS(RADIANS(RC[-3])),COS(RADIANS(RC[-1]))*SIN(RADIANS(RC[-3])))) -> 147.41207675284141 | T230: =DEGREES(ASIN(SIN(RADIANS(RC[-2]))*SIN(RADIANS(RC[-4])))) -> 13.140903527930465 | U230: =TAN(RADIANS(RC[-3]/2))*TAN(RADIANS(RC[-3]/2)) -> 4.3018042612886137E-2 | V230: =4*DEGREES(RC[-1]*SIN(2*RADIANS(RC[-13]))-2*RC[-11]*SIN(RADIANS(RC[-12]))+4*RC[-11]*RC[-1]*SIN(RADIANS(RC[-12]))*COS(2*RADIANS(RC[-13]))-0.5*RC[-1]*RC[-1]*SIN(4*RADIANS(RC[-13]))-1.25*RC[-11]*RC[-11]*SIN(2*RADIANS(RC[-12]))) -> -3.9474733555196533 | W230: =DEGREES(ACOS(COS(RADIANS(90.833))/(COS(RADIANS(R2C2))*COS(RADIANS(RC[-3])))-TAN(RADIANS(R2C2))*TAN(RADIANS(RC[-3])))) -> 133.24154706116914 | X230: =(720-4*R3C2-RC[-2]+R4C2*60)/1440 -> 1899-12-31T13:59:56.848 | Y230: =(RC[-1]*1440-RC[-2]*4)/1440 -> 1899-12-31T05:06:58.877 | Z230: =(RC[-2]*1440+RC[-3]*4)/1440 -> 1899-12-31T22:52:54.820 | AA230: =8*RC[-4] -> 1065.9323764893531 | AB230: =MOD(RC[-23]*1440+RC[-6]+4*R3C2-60*R4C2,1440) -> 720.05252664448039 | AC230: =IF(RC[-1]/4<0,RC[-1]/4+180,RC[-1]/4-180) -> 1.313166112009867E-2 | AD230: =DEGREES(ACOS(SIN(RADIANS(R2C2))*SIN(RADIANS(RC[-10]))+COS(RADIANS(R2C2))*COS(RADIANS(RC[-10]))*COS(RADIANS(RC[-1])))) -> 56.85909707064431 | AE230: =90-RC[-1] -> 33.14090292935569 | AF230: =IF(RC[-1]>85,0,IF(RC[-1]>5,58.1/TAN(RADIANS(RC[-1]))-0.07/POWER(TAN(RADIANS(RC[-1])),3)+0.000086/POWER(TAN(RADIANS(RC[-1])),5),IF(RC[-1]>-0.575,1735+RC[-1]*(-518.2+RC[-1]*(103.4+RC[-1]*(-12.79+RC[-1]*0.711))),-20.772/TAN(RADIANS(RC[-1])))))/3600 -> 2.4648754930330759E-2 | AG230: =RC[-2]+RC[-1] -> 33.165551684286022 | AH230: =IF(RC[-5]>0,MOD(DEGREES(ACOS(((SIN(RADIANS(R2C2))*COS(RADIANS(RC[-4])))-SIN(RADIANS(RC[-14])))/(COS(RADIANS(R2C2))*SIN(RADIANS(RC[-4])))))+180,360),MOD(540-DEGREES(ACOS(((SIN(RADIANS(R2C2))*COS(RADIANS(RC[-4])))-SIN(RADIANS(RC[-14])))/(COS(RADIANS(R2C2))*SIN(RADIANS(RC[-4]))))),360)) -> 180.01527213282733
D231: =R[-1]C+1 -> 2017-08-18T00:00:00.000 | E231: =R5C2 -> 1899-12-31T14:00:00.000 | F231: =RC[-2]+2415018.5+RC[-1]-R4C2/24 -> 2457984.375 | G231: =(RC[-1]-2451545)/36525 -> 0.17630047912388774 | I231: =MOD(280.46646+RC[-2]*(36000.76983 + RC[-2]*0.0003032),360) -> 147.41943928182172 | J231: =357.52911+RC[-3]*(35999.05029 - 0.0001537*RC[-3]) -> 6704.1789193546483 | K231: =0.016708634-RC[-4]*(0.000042037+0.0000001267*RC[-4]) -> 1.6701218918687543E-2 | L231: =SIN(RADIANS(RC[-2]))*(1.914602-RC[-5]*(0.004817+0.000014*RC[-5]))+SIN(RADIANS(2*RC[-2]))*(0.019993-0.000101*RC[-5])+SIN(RADIANS(3*RC[-2]))*0.000289 -> -1.313942413087559 | M231: =RC[-4]+RC[-1] -> 146.10549686873418 | N231: =RC[-4]+RC[-2] -> 6702.8649769415606 | O231: =(1.000001018*(1-RC[-4]*RC[-4]))/(1+RC[-4]*COS(RADIANS(RC[-1]))) -> 1.0121116559504928 | P231: =RC[-3]-0.00569-0.00478*SIN(RADIANS(125.04-1934.136*RC[-9])) -> 146.09700069152746 | Q231: =23+(26+((21.448-RC[-10]*(46.815+RC[-10]*(0.00059-RC[-10]*0.001813))))/60)/60 -> 23.436998467962862 | R231: =RC[-1]+0.00256*COS(RADIANS(125.04-1934.136*RC[-11])) -> 23.434926048605153 | S231: =DEGREES(ATAN2(COS(RADIANS(RC[-3])),COS(RADIANS(RC[-1]))*SIN(RADIANS(RC[-3])))) -> 148.34149985258085 | T231: =DEGREES(ASIN(SIN(RADIANS(RC[-2]))*SIN(RADIANS(RC[-4])))) -> 12.816925758090614 | U231: =TAN(RADIANS(RC[-3]/2))*TAN(RADIANS(RC[-3]/2)) -> 4.3018046509671733E-2 | V231: =4*DEGREES(RC[-1]*SIN(2*RADIANS(RC[-13]))-2*RC[-11]*SIN(RADIANS(RC[-12]))+4*RC[-11]*RC[-1]*SIN(RADIANS(RC[-12]))*COS(2*RADIANS(RC[-13]))-0.5*RC[-1]*RC[-1]*SIN(4*RADIANS(RC[-13]))-1.25*RC[-11]*RC[-11]*SIN(2*RADIANS(RC[-12]))) -> -3.7230179700126271 | W231: =DEGREES(ACOS(COS(RADIANS(90.833))/(COS(RADIANS(R2C2))*COS(RADIANS(RC[-3])))-TAN(RADIANS(R2C2))*TAN(RADIANS(RC[-3])))) -> 131.96355778403893 | X231: =(720-4*R3C2-RC[-2]+R4C2*60)/1440 -> 1899-12-31T13:59:43.381 | Y231: =(RC[-1]*1440-RC[-2]*4)/1440 -> 1899-12-31T05:11:52.127 | Z231: =(RC[-2]*1440+RC[-3]*4)/1440 -> 1899-12-31T22:47:34.635 | AA231: =8*RC[-4] -> 1055.7084622723114 | AB231: =MOD(RC[-23]*1440+RC[-6]+4*R3C2-60*R4C2,1440) -> 720.27698202998738 | AC231: =IF(RC[-1]/4<0,RC[-1]/4+180,RC[-1]/4-180) -> 6.9245507496844994E-2 | AD231: =DEGREES(ACOS(SIN(RADIANS(R2C2))*SIN(RADIANS(RC[-10]))+COS(RADIANS(R2C2))*COS(RADIANS(RC[-10]))*COS(RADIANS(RC[-1])))) -> 57.183090846750098 | AE231: =90-RC[-1] -> 32.816909153249902 | AF231: =IF(RC[-1]>85,0,IF(RC[-1]>5,58.1/TAN(RADIANS(RC[-1]))-0.07/POWER(TAN(RADIANS(RC[-1])),3)+0.000086/POWER(TAN(RADIANS(RC[-1])),5),IF(RC[-1]>-0.575,1735+RC[-1]*(-518.2+RC[-1]*(103.4+RC[-1]*(-12.79+RC[-1]*0.711))),-20.772/TAN(RADIANS(RC[-1])))))/3600 -> 2.4954138701794647E-2 | AG231: =RC[-2]+RC[-1] -> 32.841863291951697 | AH231: =IF(RC[-5]>0,MOD(DEGREES(ACOS(((SIN(RADIANS(R2C2))*COS(RADIANS(RC[-4])))-SIN(RADIANS(RC[-14])))/(COS(RADIANS(R2C2))*SIN(RADIANS(RC[-4])))))+180,360),MOD(540-DEGREES(ACOS(((SIN(RADIANS(R2C2))*COS(RADIANS(RC[-4])))-SIN(RADIANS(RC[-14])))/(COS(RADIANS(R2C2))*SIN(RADIANS(RC[-4]))))),360)) -> 180.08034227104963
D232: =R[-1]C+1 -> 2017-08-19T00:00:00.000 | E232: =R5C2 -> 1899-12-31T14:00:00.000 | F232: =RC[-2]+2415018.5+RC[-1]-R4C2/24 -> 2457985.375 | G232: =(RC[-1]-2451545)/36525 -> 0.17632785763175907 | I232: =MOD(280.46646+RC[-2]*(36000.76983 + RC[-2]*0.0003032),360) -> 148.40508664491335 | J232: =357.52911+RC[-3]*(35999.05029 - 0.0001537*RC[-3]) -> 6705.16451963489 | K232: =0.016708634-RC[-4]*(0.000042037+0.0000001267*RC[-4]) -> 1.6701217766553988E-2 | L232: =SIN(RADIANS(RC[-2]))*(1.914602-RC[-5]*(0.004817+0.000014*RC[-5]))+SIN(RADIANS(2*RC[-2]))*(0.019993-0.000101*RC[-5])+SIN(RADIANS(3*RC[-2]))*0.000289 -> -1.3373349629783544 | M232: =RC[-4]+RC[-1] -> 147.06775168193499 | N232: =RC[-4]+RC[-2] -> 6703.8271846719117 | O232: =(1.000001018*(1-RC[-4]*RC[-4]))/(1+RC[-4]*COS(RADIANS(RC[-1]))) -> 1.0119144302757543 | P232: =RC[-3]-0.00569-0.00478*SIN(RADIANS(125.04-1934.136*RC[-9])) -> 147.05925192957966 | Q232: =23+(26+((21.448-RC[-10]*(46.815+RC[-10]*(0.00059-RC[-10]*0.001813))))/60)/60 -> 23.436998111927885 | R232: =RC[-1]+0.00256*COS(RADIANS(125.04-1934.136*RC[-11])) -> 23.434927082452102 | S232: =DEGREES(ATAN2(COS(RADIANS(RC[-3])),COS(RADIANS(RC[-1]))*SIN(RADIANS(RC[-3])))) -> 149.26888051794111 | T232: =DEGREES(ASIN(SIN(RADIANS(RC[-2]))*SIN(RADIANS(RC[-4])))) -> 12.489568190458961 | U232: =TAN(RADIANS(RC[-3]/2))*TAN(RADIANS(RC[-3]/2)) -> 4.3018050413141259E-2 | V232: =4*DEGREES(RC[-1]*SIN(2*RADIANS(RC[-13]))-2*RC[-11]*SIN(RADIANS(RC[-12]))+4*RC[-11]*RC[-1]*SIN(RADIANS(RC[-12]))*COS(2*RADIANS(RC[-13]))-0.5*RC[-1]*RC[-1]*SIN(4*RADIANS(RC[-13]))-1.25*RC[-11]*RC[-11]*SIN(2*RADIANS(RC[-12]))) -> -3.4904440292360466 | W232: =DEGREES(ACOS(COS(RADIANS(90.833))/(COS(RADIANS(R2C2))*COS(RADIANS(RC[-3])))-TAN(RADIANS(R2C2))*TAN(RADIANS(RC[-3])))) -> 130.70110824547126 | X232: =(720-4*R3C2-RC[-2]+R4C2*60)/1440 -> 1899-12-31T13:59:29.427 | Y232: =(RC[-1]*1440-RC[-2]*4)/1440 -> 1899-12-31T05:16:41.161 | Z232: =(RC[-2]*1440+RC[-3]*4)/1440 -> 1899-12-31T22:42:17.693 | AA232: =8*RC[-4] -> 1045.6088659637701 | AB232: =MOD(RC[-23]*1440+RC[-6]+4*R3C2-60*R4C2,1440) -> 720.50955597076393 | AC232: =IF(RC[-1]/4<0,RC[-1]/4+180,RC[-1]/4-180) -> 0.12738899269098169 | AD232: =DEGREES(ACOS(SIN(RADIANS(R2C2))*SIN(RADIANS(RC[-10]))+COS(RADIANS(R2C2))*COS(RADIANS(RC[-10]))*COS(RADIANS(RC[-1])))) -> 57.510487873276226 | AE232: =90-RC[-1] -> 32.489512126723774 | AF232: =IF(RC[-1]>85,0,IF(RC[-1]>5,58.1/TAN(RADIANS(RC[-1]))-0.07/POWER(TAN(RADIANS(RC[-1])),3)+0.000086/POWER(TAN(RADIANS(RC[-1])),5),IF(RC[-1]>-0.575,1735+RC[-1]*(-518.2+RC[-1]*(103.4+RC[-1]*(-12.79+RC[-1]*0.711))),-20.772/TAN(RADIANS(RC[-1])))))/3600 -> 2.526815130883384E-2 | AG232: =RC[-2]+RC[-1] -> 32.51478027803261 | AH232: =IF(RC[-5]>0,MOD(DEGREES(ACOS(((SIN(RADIANS(R2C2))*COS(RADIANS(RC[-4])))-SIN(RADIANS(RC[-14])))/(COS(RADIANS(R2C2))*SIN(RADIANS(RC[-4])))))+180,360),MOD(540-DEGREES(ACOS(((SIN(RADIANS(R2C2))*COS(RADIANS(RC[-4])))-SIN(RADIANS(RC[-14])))/(COS(RADIANS(R2C2))*SIN(RADIANS(RC[-4]))))),360)) -> 180.14745219227069
D233: =R[-1]C+1 -> 2017-08-20T00:00:00.000 | E233: =R5C2 -> 1899-12-31T14:00:00.000 | F233: =RC[-2]+2415018.5+RC[-1]-R4C2/24 -> 2457986.375 | G233: =(RC[-1]-2451545)/36525 -> 0.17635523613963039 | I233: =MOD(280.46646+RC[-2]*(36000.76983 + RC[-2]*0.0003032),360) -> 149.39073400800589 | J233: =357.52911+RC[-3]*(35999.05029 - 0.0001537*RC[-3]) -> 6706.1501199151298 | K233: =0.016708634-RC[-4]*(0.000042037+0.0000001267*RC[-4]) -> 1.6701216614420245E-2 | L233: =SIN(RADIANS(RC[-2]))*(1.914602-RC[-5]*(0.004817+0.000014*RC[-5]))+SIN(RADIANS(2*RC[-2]))*(0.019993-0.000101*RC[-5])+SIN(RADIANS(3*RC[-2]))*0.000289 -> -1.3603490421231008 | M233: =RC[-4]+RC[-1] -> 148.0303849658828 | N233: =RC[-4]+RC[-2] -> 6704.789770873007 | O233: =(1.000001018*(1-RC[-4]*RC[-4]))/(1+RC[-4]*COS(RADIANS(RC[-1]))) -> 1.0117137228332782 | P233: =RC[-3]-0.00569-0.00478*SIN(RADIANS(125.04-1934.136*RC[-9])) -> 148.0218816407789 | Q233: =23+(26+((21.448-RC[-10]*(46.815+RC[-10]*(0.00059-RC[-10]*0.001813))))/60)/60 -> 23.436997755892911 | R233: =RC[-1]+0.00256*COS(RADIANS(125.04-1934.136*RC[-11])) -> 23.434928118068083 | S233: =DEGREES(ATAN2(COS(RADIANS(RC[-3])),COS(RADIANS(RC[-1]))*SIN(RADIANS(RC[-3])))) -> 150.19426898538947 | T233: =DEGREES(ASIN(SIN(RADIANS(RC[-2]))*SIN(RADIANS(RC[-4])))) -> 12.158918720385309 | U233: =TAN(RADIANS(RC[-3]/2))*TAN(RADIANS(RC[-3]/2)) -> 4.3018054323290277E-2 | V233: =4*DEGREES(RC[-1]*SIN(2*RADIANS(RC[-13]))-2*RC[-11]*SIN(RADIANS(RC[-12]))+4*RC[-11]*RC[-1]*SIN(RADIANS(RC[-12]))*COS(2*RADIANS(RC[-13]))-0.5*RC[-1]*RC[-1]*SIN(4*RADIANS(RC[-13]))-1.25*RC[-11]*RC[-11]*SIN(2*RADIANS(RC[-12]))) -> -3.2499537421766815 | W233: =DEGREES(ACOS(COS(RADIANS(90.833))/(COS(RADIANS(R2C2))*COS(RADIANS(RC[-3])))-TAN(RADIANS(R2C2))*TAN(RADIANS(RC[-3])))) -> 129.45306034802923 | X233: =(720-4*R3C2-RC[-2]+R4C2*60)/1440 -> 1899-12-31T13:59:14.997 | Y233: =(RC[-1]*1440-RC[-2]*4)/1440 -> 1899-12-31T05:21:26.263 | Z233: =(RC[-2]*1440+RC[-3]*4)/1440 -> 1899-12-31T22:37:03.732 | AA233: =8*RC[-4] -> 1035.6244827842338 | AB233: =MOD(RC[-23]*1440+RC[-6]+4*R3C2-60*R4C2,1440) -> 720.75004625782333 | AC233: =IF(RC[-1]/4<0,RC[-1]/4+180,RC[-1]/4-180) -> 0.18751156445583206 | AD233: =DEGREES(ACOS(SIN(RADIANS(R2C2))*SIN(RADIANS(RC[-10]))+COS(RADIANS(R2C2))*COS(RADIANS(RC[-10]))*COS(RADIANS(RC[-1])))) -> 57.841202460926354 | AE233: =90-RC[-1] -> 32.158797539073646 | AF233: =IF(RC[-1]>85,0,IF(RC[-1]>5,58.1/TAN(RADIANS(RC[-1]))-0.07/POWER(TAN(RADIANS(RC[-1])),3)+0.000086/POWER(TAN(RADIANS(RC[-1])),5),IF(RC[-1]>-0.575,1735+RC[-1]*(-518.2+RC[-1]*(103.4+RC[-1]*(-12.79+RC[-1]*0.711))),-20.772/TAN(RADIANS(RC[-1])))))/3600 -> 2.559104666571867E-2 | AG233: =RC[-2]+RC[-1] -> 32.184388585739363 | AH233: =IF(RC[-5]>0,MOD(DEGREES(ACOS(((SIN(RADIANS(R2C2))*COS(RADIANS(RC[-4])))-SIN(RADIANS(RC[-14])))/(COS(RADIANS(R2C2))*SIN(RADIANS(RC[-4])))))+180,360),MOD(540-DEGREES(ACOS(((SIN(RADIANS(R2C2))*COS(RADIANS(RC[-4])))-SIN(RADIANS(RC[-14])))/(COS(RADIANS(R2C2))*SIN(RADIANS(RC[-4]))))),360)) -> 180.21652542139981
D234: =R[-1]C+1 -> 2017-08-21T00:00:00.000 | E234: =R5C2 -> 1899-12-31T14:00:00.000 | F234: =RC[-2]+2415018.5+RC[-1]-R4C2/24 -> 2457987.375 | G234: =(RC[-1]-2451545)/36525 -> 0.17638261464750171 | I234: =MOD(280.46646+RC[-2]*(36000.76983 + RC[-2]*0.0003032),360) -> 150.37638137109661 | J234: =357.52911+RC[-3]*(35999.05029 - 0.0001537*RC[-3]) -> 6707.1357201953715 | K234: =0.016708634-RC[-4]*(0.000042037+0.0000001267*RC[-4]) -> 1.6701215462286315E-2 | L234: =SIN(RADIANS(RC[-2]))*(1.914602-RC[-5]*(0.004817+0.000014*RC[-5]))+SIN(RADIANS(2*RC[-2]))*(0.019993-0.000101*RC[-5])+SIN(RADIANS(3*RC[-2]))*0.000289 -> -1.382977852497479 | M234: =RC[-4]+RC[-1] -> 148.99340351859914 | N234: =RC[-4]+RC[-2] -> 6705.7527423428737 | O234: =(1.000001018*(1-RC[-4]*RC[-4]))/(1+RC[-4]*COS(RADIANS(RC[-1]))) -> 1.0115095889022454 | P234: =RC[-3]-0.00569-0.00478*SIN(RADIANS(125.04-1934.136*RC[-9])) -> 148.98489662314972 | Q234: =23+(26+((21.448-RC[-10]*(46.815+RC[-10]*(0.00059-RC[-10]*0.001813))))/60)/60 -> 23.436997399857933 | R234: =RC[-1]+0.00256*COS(RADIANS(125.04-1934.136*RC[-11])) -> 23.434929155451897 | S234: =DEGREES(ATAN2(COS(RADIANS(RC[-3])),COS(RADIANS(RC[-1]))*SIN(RADIANS(RC[-3])))) -> 151.11771747374772 | T234: =DEGREES(ASIN(SIN(RADIANS(RC[-2]))*SIN(RADIANS(RC[-4])))) -> 11.82506541392943 | U234: =TAN(RADIANS(RC[-3]/2))*TAN(RADIANS(RC[-3]/2)) -> 4.3018058240114246E-2 | V234: =4*DEGREES(RC[-1]*SIN(2*RADIANS(RC[-13]))-2*RC[-11]*SIN(RADIANS(RC[-12]))+4*RC[-11]*RC[-1]*SIN(RADIANS(RC[-12]))*COS(2*RADIANS(RC[-13]))-0.5*RC[-1]*RC[-1]*SIN(4*RADIANS(RC[-13]))-1.25*RC[-11]*RC[-11]*SIN(2*RADIANS(RC[-12]))) -> -3.0017567621420307 | W234: =DEGREES(ACOS(COS(RADIANS(90.833))/(COS(RADIANS(R2C2))*COS(RADIANS(RC[-3])))-TAN(RADIANS(R2C2))*TAN(RADIANS(RC[-3])))) -> 128.21839042656629 | X234: =(720-4*R3C2-RC[-2]+R4C2*60)/1440 -> 1899-12-31T13:59:00.105 | Y234: =(RC[-1]*1440-RC[-2]*4)/1440 -> 1899-12-31T05:26:07.692 | Z234: =(RC[-2]*1440+RC[-3]*4)/1440 -> 1899-12-31T22:31:52.519 | AA234: =8*RC[-4] -> 1025.7471234125303 | AB234: =MOD(RC[-23]*1440+RC[-6]+4*R3C2-60*R4C2,1440) -> 720.99824323785799 | AC234: =IF(RC[-1]/4<0,RC[-1]/4+180,RC[-1]/4-180) -> 0.24956080946449788 | AD234: =DEGREES(ACOS(SIN(RADIANS(R2C2))*SIN(RADIANS(RC[-10]))+COS(RADIANS(R2C2))*COS(RADIANS(RC[-10]))*COS(RADIANS(RC[-1])))) -> 58.175148721498289 | AE234: =90-RC[-1] -> 31.824851278501711 | AF234: =IF(RC[-1]>85,0,IF(RC[-1]>5,58.1/TAN(RADIANS(RC[-1]))-0.07/POWER(TAN(RADIANS(RC[-1])),3)+0.000086/POWER(TAN(RADIANS(RC[-1])),5),IF(RC[-1]>-0.575,1735+RC[-1]*(-518.2+RC[-1]*(103.4+RC[-1]*(-12.79+RC[-1]*0.711))),-20.772/TAN(RADIANS(RC[-1])))))/3600 -> 2.5923091494601629E-2 | AG234: =RC[-2]+RC[-1] -> 31.850774369996312 | AH234: =IF(RC[-5]>0,MOD(DEGREES(ACOS(((SIN(RADIANS(R2C2))*COS(RADIANS(RC[-4])))-SIN(RADIANS(RC[-14])))/(COS(RADIANS(R2C2))*SIN(RADIANS(RC[-4])))))+180,360),MOD(540-DEGREES(ACOS(((SIN(RADIANS(R2C2))*COS(RADIANS(RC[-4])))-SIN(RADIANS(RC[-14])))/(COS(RADIANS(R2C2))*SIN(RADIANS(RC[-4]))))),360)) -> 180.28748402393379
D235: =R[-1]C+1 -> 2017-08-22T00:00:00.000 | E235: =R5C2 -> 1899-12-31T14:00:00.000 | F235: =RC[-2]+2415018.5+RC[-1]-R4C2/24 -> 2457988.375 | G235: =(RC[-1]-2451545)/36525 -> 0.17640999315537303 | I235: =MOD(280.46646+RC[-2]*(36000.76983 + RC[-2]*0.0003032),360) -> 151.36202873419006 | J235: =357.52911+RC[-3]*(35999.05029 - 0.0001537*RC[-3]) -> 6708.1213204756123 | K235: =0.016708634-RC[-4]*(0.000042037+0.0000001267*RC[-4]) -> 1.6701214310152191E-2 | L235: =SIN(RADIANS(RC[-2]))*(1.914602-RC[-5]*(0.004817+0.000014*RC[-5]))+SIN(RADIANS(2*RC[-2]))*(0.019993-0.000101*RC[-5])+SIN(RADIANS(3*RC[-2]))*0.000289 -> -1.4052146903199889 | M235: =RC[-4]+RC[-1] -> 149.95681404387008 | N235: =RC[-4]+RC[-2] -> 6706.7161057852927 | O235: =(1.000001018*(1-RC[-4]*RC[-4]))/(1+RC[-4]*COS(RADIANS(RC[-1]))) -> 1.0113020847739227 | P235: =RC[-3]-0.00569-0.00478*SIN(RADIANS(125.04-1934.136*RC[-9])) -> 149.94830358048131 | Q235: =23+(26+((21.448-RC[-10]*(46.815+RC[-10]*(0.00059-RC[-10]*0.001813))))/60)/60 -> 23.436997043822959 | R235: =RC[-1]+0.00256*COS(RADIANS(125.04-1934.136*RC[-11])) -> 23.434930194602362 | S235: =DEGREES(ATAN2(COS(RADIANS(RC[-3])),COS(RADIANS(RC[-1]))*SIN(RADIANS(RC[-3])))) -> 152.03928011827713 | T235: =DEGREES(ASIN(SIN(RADIANS(RC[-2]))*SIN(RADIANS(RC[-4])))) -> 11.488096495013309 | U235: =TAN(RADIANS(RC[-3]/2))*TAN(RADIANS(RC[-3]/2)) -> 4.3018062163608706E-2 | V235: =4*DEGREES(RC[-1]*SIN(2*RADIANS(RC[-13]))-2*RC[-11]*SIN(RADIANS(RC[-12]))+4*RC[-11]*RC[-1]*SIN(RADIANS(RC[-12]))*COS(2*RADIANS(RC[-13]))-0.5*RC[-1]*RC[-1]*SIN(4*RADIANS(RC[-13]))-1.25*RC[-11]*RC[-11]*SIN(2*RADIANS(RC[-12]))) -> -2.7460698879831349 | W235: =DEGREES(ACOS(COS(RADIANS(90.833))/(COS(RADIANS(R2C2))*COS(RADIANS(RC[-3])))-TAN(RADIANS(R2C2))*TAN(RADIANS(RC[-3])))) -> 126.99617294035355 | X235: =(720-4*R3C2-RC[-2]+R4C2*60)/1440 -> 1899-12-31T13:58:44.764 | Y235: =(RC[-1]*1440-RC[-2]*4)/1440 -> 1899-12-31T05:30:45.683 | Z235: =(RC[-2]*1440+RC[-3]*4)/1440 -> 1899-12-31T22:26:43.846 | AA235: =8*RC[-4] -> 1015.9693835228284 | AB235: =MOD(RC[-23]*1440+RC[-6]+4*R3C2-60*R4C2,1440) -> 721.25393011201686 | AC235: =IF(RC[-1]/4<0,RC[-1]/4+180,RC[-1]/4-180) -> 0.31348252800421506 | AD235: =DEGREES(ACOS(SIN(RADIANS(R2C2))*SIN(RADIANS(RC[-10]))+COS(RADIANS(R2C2))*COS(RADIANS(RC[-10]))*COS(RADIANS(RC[-1])))) -> 58.512240570143156 | AE235: =90-RC[-1] -> 31.487759429856844 | AF235: =IF(RC[-1]>85,0,IF(RC[-1]>5,58.1/TAN(RADIANS(RC[-1]))-0.07/POWER(TAN(RADIANS(RC[-1])),3)+0.000086/POWER(TAN(RADIANS(RC[-1])),5),IF(RC[-1]>-0.575,1735+RC[-1]*(-518.2+RC[-1]*(103.4+RC[-1]*(-12.79+RC[-1]*0.711))),-20.772/TAN(RADIANS(RC[-1])))))/3600 -> 2.6264566020528658E-2 | AG235: =RC[-2]+RC[-1] -> 31.514023995877373 | AH235: =IF(RC[-5]>0,MOD(DEGREES(ACOS(((SIN(RADIANS(R2C2))*COS(RADIANS(RC[-4])))-SIN(RADIANS(RC[-14])))/(COS(RADIANS(R2C2))*SIN(RADIANS(RC[-4])))))+180,360),MOD(540-DEGREES(ACOS(((SIN(RADIANS(R2C2))*COS(RADIANS(RC[-4])))-SIN(RADIANS(RC[-14])))/(COS(RADIANS(R2C2))*SIN(RADIANS(RC[-4]))))),360)) -> 180.36024873054106
D236: =R[-1]C+1 -> 2017-08-23T00:00:00.000 | E236: =R5C2 -> 1899-12-31T14:00:00.000 | F236: =RC[-2]+2415018.5+RC[-1]-R4C2/24 -> 2457989.375 | G236: =(RC[-1]-2451545)/36525 -> 0.17643737166324436 | I236: =MOD(280.46646+RC[-2]*(36000.76983 + RC[-2]*0.0003032),360) -> 152.34767609728351 | J236: =357.52911+RC[-3]*(35999.05029 - 0.0001537*RC[-3]) -> 6709.1069207558512 | K236: =0.016708634-RC[-4]*(0.000042037+0.0000001267*RC[-4]) -> 1.670121315801788E-2 | L236: =SIN(RADIANS(RC[-2]))*(1.914602-RC[-5]*(0.004817+0.000014*RC[-5]))+SIN(RADIANS(2*RC[-2]))*(0.019993-0.000101*RC[-5])+SIN(RADIANS(3*RC[-2]))*0.000289 -> -1.4270529480052241 | M236: =RC[-4]+RC[-1] -> 150.9206231492783 | N236: =RC[-4]+RC[-2] -> 6707.6798678078458 | O236: =(1.000001018*(1-RC[-4]*RC[-4]))/(1+RC[-4]*COS(RADIANS(RC[-1]))) -> 1.0110912677396657 | P236: =RC[-3]-0.00569-0.00478*SIN(RADIANS(125.04-1934.136*RC[-9])) -> 150.91210912035933 | Q236: =23+(26+((21.448-RC[-10]*(46.815+RC[-10]*(0.00059-RC[-10]*0.001813))))/60)/60 -> 23.436996687787982 | R236: =RC[-1]+0.00256*COS(RADIANS(125.04-1934.136*RC[-11])) -> 23.434931235518281 | S236: =DEGREES(ATAN2(COS(RADIANS(RC[-3])),COS(RADIANS(RC[-1]))*SIN(RADIANS(RC[-3])))) -> 152.95901290527635 | T236: =DEGREES(ASIN(SIN(RADIANS(RC[-2]))*SIN(RADIANS(RC[-4])))) -> 11.148100334277025 | U236: =TAN(RADIANS(RC[-3]/2))*TAN(RADIANS(RC[-3]/2)) -> 4.3018066093769132E-2 | V236: =4*DEGREES(RC[-1]*SIN(2*RADIANS(RC[-13]))-2*RC[-11]*SIN(RADIANS(RC[-12]))+4*RC[-11]*RC[-1]*SIN(RADIANS(RC[-12]))*COS(2*RADIANS(RC[-13]))-0.5*RC[-1]*RC[-1]*SIN(4*RADIANS(RC[-13]))-1.25*RC[-11]*RC[-11]*SIN(2*RADIANS(RC[-12]))) -> -2.4831167715865377 | W236: =DEGREES(ACOS(COS(RADIANS(90.833))/(COS(RADIANS(R2C2))*COS(RADIANS(RC[-3])))-TAN(RADIANS(R2C2))*TAN(RADIANS(RC[-3])))) -> 125.78556695172253 | X236: =(720-4*R3C2-RC[-2]+R4C2*60)/1440 -> 1899-12-31T13:58:28.987 | Y236: =(RC[-1]*1440-RC[-2]*4)/1440 -> 1899-12-31T05:35:20.451 | Z236: =(RC[-2]*1440+RC[-3]*4)/1440 -> 1899-12-31T22:21:37.523 | AA236: =8*RC[-4] -> 1006.2845356137802 | AB236: =MOD(RC[-23]*1440+RC[-6]+4*R3C2-60*R4C2,1440) -> 721.51688322841346 | AC236: =IF(RC[-1]/4<0,RC[-1]/4+180,RC[-1]/4-180) -> 0.37922080710336559 | AD236: =DEGREES(ACOS(SIN(RADIANS(R2C2))*SIN(RADIANS(RC[-10]))+COS(RADIANS(R2C2))*COS(RADIANS(RC[-10]))*COS(RADIANS(RC[-1])))) -> 58.8523917261276 | AE236: =90-RC[-1] -> 31.1476082738724 | AF236: =IF(RC[-1]>85,0,IF(RC[-1]>5,58.1/TAN(RADIANS(RC[-1]))-0.07/POWER(TAN(RADIANS(RC[-1])),3)+0.000086/POWER(TAN(RADIANS(RC[-1])),5),IF(RC[-1]>-0.575,1735+RC[-1]*(-518.2+RC[-1]*(103.4+RC[-1]*(-12.79+RC[-1]*0.711))),-20.772/TAN(RADIANS(RC[-1])))))/3600 -> 2.6615764712344007E-2 | AG236: =RC[-2]+RC[-1] -> 31.174224038584743 | AH236: =IF(RC[-5]>0,MOD(DEGREES(ACOS(((SIN(RADIANS(R2C2))*COS(RADIANS(RC[-4])))-SIN(RADIANS(RC[-14])))/(COS(RADIANS(R2C2))*SIN(RADIANS(RC[-4])))))+180,360),MOD(540-DEGREES(ACOS(((SIN(RADIANS(R2C2))*COS(RADIANS(RC[-4])))-SIN(RADIANS(RC[-14])))/(COS(RADIANS(R2C2))*SIN(RADIANS(RC[-4]))))),360)) -> 180.43473905733461
D237: =R[-1]C+1 -> 2017-08-24T00:00:00.000 | E237: =R5C2 -> 1899-12-31T14:00:00.000 | F237: =RC[-2]+2415018.5+RC[-1]-R4C2/24 -> 2457990.375 | G237: =(RC[-1]-2451545)/36525 -> 0.17646475017111568 | I237: =MOD(280.46646+RC[-2]*(36000.76983 + RC[-2]*0.0003032),360) -> 153.33332346037787 | J237: =357.52911+RC[-3]*(35999.05029 - 0.0001537*RC[-3]) -> 6710.0925210360911 | K237: =0.016708634-RC[-4]*(0.000042037+0.0000001267*RC[-4]) -> 1.6701212005883377E-2 | L237: =SIN(RADIANS(RC[-2]))*(1.914602-RC[-5]*(0.004817+0.000014*RC[-5]))+SIN(RADIANS(2*RC[-2]))*(0.019993-0.000101*RC[-5])+SIN(RADIANS(3*RC[-2]))*0.000289 -> -1.4484861161103684 | M237: =RC[-4]+RC[-1] -> 151.88483734426751 | N237: =RC[-4]+RC[-2] -> 6708.6440349199811 | O237: =(1.000001018*(1-RC[-4]*RC[-4]))/(1+RC[-4]*COS(RADIANS(RC[-1]))) -> 1.0108771960786316 | P237: =RC[-3]-0.00569-0.00478*SIN(RADIANS(125.04-1934.136*RC[-9])) -> 151.87631975223059 | Q237: =23+(26+((21.448-RC[-10]*(46.815+RC[-10]*(0.00059-RC[-10]*0.001813))))/60)/60 -> 23.436996331753008 | R237: =RC[-1]+0.00256*COS(RADIANS(125.04-1934.136*RC[-11])) -> 23.43493227819847 | S237: =DEGREES(ATAN2(COS(RADIANS(RC[-3])),COS(RADIANS(RC[-1]))*SIN(RADIANS(RC[-3])))) -> 153.8769736073256 | T237: =DEGREES(ASIN(SIN(RADIANS(RC[-2]))*SIN(RADIANS(RC[-4])))) -> 10.805165439577889 | U237: =TAN(RADIANS(RC[-3]/2))*TAN(RADIANS(RC[-3]/2)) -> 4.3018070030591084E-2 | V237: =4*DEGREES(RC[-1]*SIN(2*RADIANS(RC[-13]))-2*RC[-11]*SIN(RADIANS(RC[-12]))+4*RC[-11]*RC[-1]*SIN(RADIANS(RC[-12]))*COS(2*RADIANS(RC[-13]))-0.5*RC[-1]*RC[-1]*SIN(4*RADIANS(RC[-13]))-1.25*RC[-11]*RC[-11]*SIN(2*RADIANS(RC[-12]))) -> -2.2131276323832716 | W237: =DEGREES(ACOS(COS(RADIANS(90.833))/(COS(RADIANS(R2C2))*COS(RADIANS(RC[-3])))-TAN(RADIANS(R2C2))*TAN(RADIANS(RC[-3])))) -> 124.58580483520066 | X237: =(720-4*R3C2-RC[-2]+R4C2*60)/1440 -> 1899-12-31T13:58:12.788 | Y237: =(RC[-1]*1440-RC[-2]*4)/1440 -> 1899-12-31T05:39:52.194 | Z237: =(RC[-2]*1440+RC[-3]*4)/1440 -> 1899-12-31T22:16:33.381 | AA237: =8*RC[-4] -> 996.6864386816053 | AB237: =MOD(RC[-23]*1440+RC[-6]+4*R3C2-60*R4C2,1440) -> 721.78687236761675 | AC237: =IF(RC[-1]/4<0,RC[-1]/4+180,RC[-1]/4-180) -> 0.44671809190418799 | AD237: =DEGREES(ACOS(SIN(RADIANS(R2C2))*SIN(RADIANS(RC[-10]))+COS(RADIANS(R2C2))*COS(RADIANS(RC[-10]))*COS(RADIANS(RC[-1])))) -> 59.195515712195387 | AE237: =90-RC[-1] -> 30.804484287804613 | AF237: =IF(RC[-1]>85,0,IF(RC[-1]>5,58.1/TAN(RADIANS(RC[-1]))-0.07/POWER(TAN(RADIANS(RC[-1])),3)+0.000086/POWER(TAN(RADIANS(RC[-1])),5),IF(RC[-1]>-0.575,1735+RC[-1]*(-518.2+RC[-1]*(103.4+RC[-1]*(-12.79+RC[-1]*0.711))),-20.772/TAN(RADIANS(RC[-1])))))/3600 -> 2.6976997073047793E-2 | AG237: =RC[-2]+RC[-1] -> 30.831461284877662 | AH237: =IF(RC[-5]>0,MOD(DEGREES(ACOS(((SIN(RADIANS(R2C2))*COS(RADIANS(RC[-4])))-SIN(RADIANS(RC[-14])))/(COS(RADIANS(R2C2))*SIN(RADIANS(RC[-4])))))+180,360),MOD(540-DEGREES(ACOS(((SIN(RADIANS(R2C2))*COS(RADIANS(RC[-4])))-SIN(RADIANS(RC[-14])))/(COS(RADIANS(R2C2))*SIN(RADIANS(RC[-4]))))),360)) -> 180.51087342149742
D238: =R[-1]C+1 -> 2017-08-25T00:00:00.000 | E238: =R5C2 -> 1899-12-31T14:00:00.000 | F238: =RC[-2]+2415018.5+RC[-1]-R4C2/24 -> 2457991.375 | G238: =(RC[-1]-2451545)/36525 -> 0.176492128678987 | I238: =MOD(280.46646+RC[-2]*(36000.76983 + RC[-2]*0.0003032),360) -> 154.31897082347223 | J238: =357.52911+RC[-3]*(35999.05029 - 0.0001537*RC[-3]) -> 6711.07812131633 | K238: =0.016708634-RC[-4]*(0.000042037+0.0000001267*RC[-4]) -> 1.6701210853748684E-2 | L238: =SIN(RADIANS(RC[-2]))*(1.914602-RC[-5]*(0.004817+0.000014*RC[-5]))+SIN(RADIANS(2*RC[-2]))*(0.019993-0.000101*RC[-5])+SIN(RADIANS(3*RC[-2]))*0.000289 -> -1.4695077852741445 | M238: =RC[-4]+RC[-1] -> 152.84946303819808 | N238: =RC[-4]+RC[-2] -> 6709.6086135310561 | O238: =(1.000001018*(1-RC[-4]*RC[-4]))/(1+RC[-4]*COS(RADIANS(RC[-1]))) -> 1.0106599290452063 | P238: =RC[-3]-0.00569-0.00478*SIN(RADIANS(125.04-1934.136*RC[-9])) -> 152.84094188545845 | Q238: =23+(26+((21.448-RC[-10]*(46.815+RC[-10]*(0.00059-RC[-10]*0.001813))))/60)/60 -> 23.436995975718034 | R238: =RC[-1]+0.00256*COS(RADIANS(125.04-1934.136*RC[-11])) -> 23.434933322641726 | S238: =DEGREES(ATAN2(COS(RADIANS(RC[-3])),COS(RADIANS(RC[-1]))*SIN(RADIANS(RC[-3])))) -> 154.79322171920975 | T238: =DEGREES(ASIN(SIN(RADIANS(RC[-2]))*SIN(RADIANS(RC[-4])))) -> 10.459380448103369 | U238: =TAN(RADIANS(RC[-3]/2))*TAN(RADIANS(RC[-3]/2)) -> 4.3018073974069995E-2 | V238: =4*DEGREES(RC[-1]*SIN(2*RADIANS(RC[-13]))-2*RC[-11]*SIN(RADIANS(RC[-12]))+4*RC[-11]*RC[-1]*SIN(RADIANS(RC[-12]))*COS(2*RADIANS(RC[-13]))-0.5*RC[-1]*RC[-1]*SIN(4*RADIANS(RC[-13]))-1.25*RC[-11]*RC[-11]*SIN(2*RADIANS(RC[-12]))) -> -1.9363389795569308 | W238: =DEGREES(ACOS(COS(RADIANS(90.833))/(COS(RADIANS(R2C2))*COS(RADIANS(RC[-3])))-TAN(RADIANS(R2C2))*TAN(RADIANS(RC[-3])))) -> 123.39618278719746 | X238: =(720-4*R3C2-RC[-2]+R4C2*60)/1440 -> 1899-12-31T13:57:56.180 | Y238: =(RC[-1]*1440-RC[-2]*4)/1440 -> 1899-12-31T05:44:21.096 | Z238: =(RC[-2]*1440+RC[-3]*4)/1440 -> 1899-12-31T22:11:31.264 | AA238: =8*RC[-4] -> 987.16946229757968 | AB238: =MOD(RC[-23]*1440+RC[-6]+4*R3C2-60*R4C2,1440) -> 722.06366102044308 | AC238: =IF(RC[-1]/4<0,RC[-1]/4+180,RC[-1]/4-180) -> 0.51591525511076952 | AD238: =DEGREES(ACOS(SIN(RADIANS(R2C2))*SIN(RADIANS(RC[-10]))+COS(RADIANS(R2C2))*COS(RADIANS(RC[-10]))*COS(RADIANS(RC[-1])))) -> 59.541525852590681 | AE238: =90-RC[-1] -> 30.458474147409319 | AF238: =IF(RC[-1]>85,0,IF(RC[-1]>5,58.1/TAN(RADIANS(RC[-1]))-0.07/POWER(TAN(RADIANS(RC[-1])),3)+0.000086/POWER(TAN(RADIANS(RC[-1])),5),IF(RC[-1]>-0.575,1735+RC[-1]*(-518.2+RC[-1]*(103.4+RC[-1]*(-12.79+RC[-1]*0.711))),-20.772/TAN(RADIANS(RC[-1])))))/3600 -> 2.7348588483437568E-2 | AG238: =RC[-2]+RC[-1] -> 30.485822735892757 | AH238: =IF(RC[-5]>0,MOD(DEGREES(ACOS(((SIN(RADIANS(R2C2))*COS(RADIANS(RC[-4])))-SIN(RADIANS(RC[-14])))/(COS(RADIANS(R2C2))*SIN(RADIANS(RC[-4])))))+180,360),MOD(540-DEGREES(ACOS(((SIN(RADIANS(R2C2))*COS(RADIANS(RC[-4])))-SIN(RADIANS(RC[-14])))/(COS(RADIANS(R2C2))*SIN(RADIANS(RC[-4]))))),360)) -> 180.58856925210992
D239: =R[-1]C+1 -> 2017-08-26T00:00:00.000 | E239: =R5C2 -> 1899-12-31T14:00:00.000 | F239: =RC[-2]+2415018.5+RC[-1]-R4C2/24 -> 2457992.375 | G239: =(RC[-1]-2451545)/36525 -> 0.17651950718685833 | I239: =MOD(280.46646+RC[-2]*(36000.76983 + RC[-2]*0.0003032),360) -> 155.30461818656659 | J239: =357.52911+RC[-3]*(35999.05029 - 0.0001537*RC[-3]) -> 6712.0637215965698 | K239: =0.016708634-RC[-4]*(0.000042037+0.0000001267*RC[-4]) -> 1.6701209701613803E-2 | L239: =SIN(RADIANS(RC[-2]))*(1.914602-RC[-5]*(0.004817+0.000014*RC[-5]))+SIN(RADIANS(2*RC[-2]))*(0.019993-0.000101*RC[-5])+SIN(RADIANS(3*RC[-2]))*0.000289 -> -1.4901116481486112 | M239: =RC[-4]+RC[-1] -> 153.81450653841799 | N239: =RC[-4]+RC[-2] -> 6710.5736099484211 | O239: =(1.000001018*(1-RC[-4]*RC[-4]))/(1+RC[-4]*COS(RADIANS(RC[-1]))) -> 1.0104395268561377 | P239: =RC[-3]-0.00569-0.00478*SIN(RADIANS(125.04-1934.136*RC[-9])) -> 153.80598182739396 | Q239: =23+(26+((21.448-RC[-10]*(46.815+RC[-10]*(0.00059-RC[-10]*0.001813))))/60)/60 -> 23.43699561968306 | R239: =RC[-1]+0.00256*COS(RADIANS(125.04-1934.136*RC[-11])) -> 23.434934368846854 | S239: =DEGREES(ATAN2(COS(RADIANS(RC[-3])),COS(RADIANS(RC[-1]))*SIN(RADIANS(RC[-3])))) -> 155.70781839460628 | T239: =DEGREES(ASIN(SIN(RADIANS(RC[-2]))*SIN(RADIANS(RC[-4])))) -> 10.110834120043137 | U239: =TAN(RADIANS(RC[-3]/2))*TAN(RADIANS(RC[-3]/2)) -> 4.3018077924201342E-2 | V239: =4*DEGREES(RC[-1]*SIN(2*RADIANS(RC[-13]))-2*RC[-11]*SIN(RADIANS(RC[-12]))+4*RC[-11]*RC[-1]*SIN(RADIANS(RC[-12]))*COS(2*RADIANS(RC[-13]))-0.5*RC[-1]*RC[-1]*SIN(4*RADIANS(RC[-13]))-1.25*RC[-11]*RC[-11]*SIN(2*RADIANS(RC[-12]))) -> -1.6529933425344274 | W239: =DEGREES(ACOS(COS(RADIANS(90.833))/(COS(RADIANS(R2C2))*COS(RADIANS(RC[-3])))-TAN(RADIANS(R2C2))*TAN(RADIANS(RC[-3])))) -> 122.21605280040376 | X239: =(720-4*R3C2-RC[-2]+R4C2*60)/1440 -> 1899-12-31T13:57:39.180 | Y239: =(RC[-1]*1440-RC[-2]*4)/1440 -> 1899-12-31T05:48:47.327 | Z239: =(RC[-2]*1440+RC[-3]*4)/1440 -> 1899-12-31T22:06:31.032 | AA239: =8*RC[-4] -> 977.72842240323007 | AB239: =MOD(RC[-23]*1440+RC[-6]+4*R3C2-60*R4C2,1440) -> 722.34700665746561 | AC239: =IF(RC[-1]/4<0,RC[-1]/4+180,RC[-1]/4-180) -> 0.58675166436640325 | AD239: =DEGREES(ACOS(SIN(RADIANS(R2C2))*SIN(RADIANS(RC[-10]))+COS(RADIANS(R2C2))*COS(RADIANS(RC[-10]))*COS(RADIANS(RC[-1])))) -> 59.890335269827624 | AE239: =90-RC[-1] -> 30.109664730172376 | AF239: =IF(RC[-1]>85,0,IF(RC[-1]>5,58.1/TAN(RADIANS(RC[-1]))-0.07/POWER(TAN(RADIANS(RC[-1])),3)+0.000086/POWER(TAN(RADIANS(RC[-1])),5),IF(RC[-1]>-0.575,1735+RC[-1]*(-518.2+RC[-1]*(103.4+RC[-1]*(-12.79+RC[-1]*0.711))),-20.772/TAN(RADIANS(RC[-1])))))/3600 -> 2.7730881103222842E-2 | AG239: =RC[-2]+RC[-1] -> 30.137395611275601 | AH239: =IF(RC[-5]>0,MOD(DEGREES(ACOS(((SIN(RADIANS(R2C2))*COS(RADIANS(RC[-4])))-SIN(RADIANS(RC[-14])))/(COS(RADIANS(R2C2))*SIN(RADIANS(RC[-4])))))+180,360),MOD(540-DEGREES(ACOS(((SIN(RADIANS(R2C2))*COS(RADIANS(RC[-4])))-SIN(RADIANS(RC[-14])))/(COS(RADIANS(R2C2))*SIN(RADIANS(RC[-4]))))),360)) -> 180.66774309618228
D240: =R[-1]C+1 -> 2017-08-27T00:00:00.000 | E240: =R5C2 -> 1899-12-31T14:00:00.000 | F240: =RC[-2]+2415018.5+RC[-1]-R4C2/24 -> 2457993.375 | G240: =(RC[-1]-2451545)/36525 -> 0.17654688569472965 | I240: =MOD(280.46646+RC[-2]*(36000.76983 + RC[-2]*0.0003032),360) -> 156.29026554966185 | J240: =357.52911+RC[-3]*(35999.05029 - 0.0001537*RC[-3]) -> 6713.0493218768097 | K240: =0.016708634-RC[-4]*(0.000042037+0.0000001267*RC[-4]) -> 1.6701208549478729E-2 | L240: =SIN(RADIANS(RC[-2]))*(1.914602-RC[-5]*(0.004817+0.000014*RC[-5]))+SIN(RADIANS(2*RC[-2]))*(0.019993-0.000101*RC[-5])+SIN(RADIANS(3*RC[-2]))*0.000289 -> -1.5102915013224383 | M240: =RC[-4]+RC[-1] -> 154.77997404833943 | N240: =RC[-4]+RC[-2] -> 6711.5390303754875 | O240: =(1.000001018*(1-RC[-4]*RC[-4]))/(1+RC[-4]*COS(RADIANS(RC[-1]))) -> 1.0102160506773763 | P240: =RC[-3]-0.00569-0.00478*SIN(RADIANS(125.04-1934.136*RC[-9])) -> 154.77144578145237 | Q240: =23+(26+((21.448-RC[-10]*(46.815+RC[-10]*(0.00059-RC[-10]*0.001813))))/60)/60 -> 23.436995263648082 | R240: =RC[-1]+0.00256*COS(RADIANS(125.04-1934.136*RC[-11])) -> 23.434935416812653 | S240: =DEGREES(ATAN2(COS(RADIANS(RC[-3])),COS(RADIANS(RC[-1]))*SIN(RADIANS(RC[-3])))) -> 156.62082638358018 | T240: =DEGREES(ASIN(SIN(RADIANS(RC[-2]))*SIN(RADIANS(RC[-4])))) -> 9.7596153337763987 | U240: =TAN(RADIANS(RC[-3]/2))*TAN(RADIANS(RC[-3]/2)) -> 4.3018081880980628E-2 | V240: =4*DEGREES(RC[-1]*SIN(2*RADIANS(RC[-13]))-2*RC[-11]*SIN(RADIANS(RC[-12]))+4*RC[-11]*RC[-1]*SIN(RADIANS(RC[-12]))*COS(2*RADIANS(RC[-13]))-0.5*RC[-1]*RC[-1]*SIN(4*RADIANS(RC[-13]))-1.25*RC[-11]*RC[-11]*SIN(2*RADIANS(RC[-12]))) -> -1.3633390102701852 | W240: =DEGREES(ACOS(COS(RADIANS(90.833))/(COS(RADIANS(R2C2))*COS(RADIANS(RC[-3])))-TAN(RADIANS(R2C2))*TAN(RADIANS(RC[-3])))) -> 121.04481583831161 | X240: =(720-4*R3C2-RC[-2]+R4C2*60)/1440 -> 1899-12-31T13:57:21.800 | Y240: =(RC[-1]*1440-RC[-2]*4)/1440 -> 1899-12-31T05:53:11.045 | Z240: =(RC[-2]*1440+RC[-3]*4)/1440 -> 1899-12-31T22:01:32.556 | AA240: =8*RC[-4] -> 968.35852670649285 | AB240: =MOD(RC[-23]*1440+RC[-6]+4*R3C2-60*R4C2,1440) -> 722.63666098972976 | AC240: =IF(RC[-1]/4<0,RC[-1]/4+180,RC[-1]/4-180) -> 0.65916524743244054 | AD240: =DEGREES(ACOS(SIN(RADIANS(R2C2))*SIN(RADIANS(RC[-10]))+COS(RADIANS(R2C2))*COS(RADIANS(RC[-10]))*COS(RADIANS(RC[-1])))) -> 60.241856880277005 | AE240: =90-RC[-1] -> 29.758143119722995 | AF240: =IF(RC[-1]>85,0,IF(RC[-1]>5,58.1/TAN(RADIANS(RC[-1]))-0.07/POWER(TAN(RADIANS(RC[-1])),3)+0.000086/POWER(TAN(RADIANS(RC[-1])),5),IF(RC[-1]>-0.575,1735+RC[-1]*(-518.2+RC[-1]*(103.4+RC[-1]*(-12.79+RC[-1]*0.711))),-20.772/TAN(RADIANS(RC[-1])))))/3600 -> 2.8124234834155742E-2 | AG240: =RC[-2]+RC[-1] -> 29.78626735455715 | AH240: =IF(RC[-5]>0,MOD(DEGREES(ACOS(((SIN(RADIANS(R2C2))*COS(RADIANS(RC[-4])))-SIN(RADIANS(RC[-14])))/(COS(RADIANS(R2C2))*SIN(RADIANS(RC[-4])))))+180,360),MOD(540-DEGREES(ACOS(((SIN(RADIANS(R2C2))*COS(RADIANS(RC[-4])))-SIN(RADIANS(RC[-14])))/(COS(RADIANS(R2C2))*SIN(RADIANS(RC[-4]))))),360)) -> 180.74831071976459
D241: =R[-1]C+1 -> 2017-08-28T00:00:00.000 | E241: =R5C2 -> 1899-12-31T14:00:00.000 | F241: =RC[-2]+2415018.5+RC[-1]-R4C2/24 -> 2457994.375 | G241: =(RC[-1]-2451545)/36525 -> 0.17657426420260094 | I241: =MOD(280.46646+RC[-2]*(36000.76983 + RC[-2]*0.0003032),360) -> 157.27591291275712 | J241: =357.52911+RC[-3]*(35999.05029 - 0.0001537*RC[-3]) -> 6714.0349221570468 | K241: =0.016708634-RC[-4]*(0.000042037+0.0000001267*RC[-4]) -> 1.6701207397343466E-2 | L241: =SIN(RADIANS(RC[-2]))*(1.914602-RC[-5]*(0.004817+0.000014*RC[-5]))+SIN(RADIANS(2*RC[-2]))*(0.019993-0.000101*RC[-5])+SIN(RADIANS(3*RC[-2]))*0.000289 -> -1.5300412472356704 | M241: =RC[-4]+RC[-1] -> 155.74587166552146 | N241: =RC[-4]+RC[-2] -> 6712.5048809098107 | O241: =(1.000001018*(1-RC[-4]*RC[-4]))/(1+RC[-4]*COS(RADIANS(RC[-1]))) -> 1.0099895626106246 | P241: =RC[-3]-0.00569-0.00478*SIN(RADIANS(125.04-1934.136*RC[-9])) -> 155.73733984519572 | Q241: =23+(26+((21.448-RC[-10]*(46.815+RC[-10]*(0.00059-RC[-10]*0.001813))))/60)/60 -> 23.436994907613109 | R241: =RC[-1]+0.00256*COS(RADIANS(125.04-1934.136*RC[-11])) -> 23.43493646653793 | S241: =DEGREES(ATAN2(COS(RADIANS(RC[-3])),COS(RADIANS(RC[-1]))*SIN(RADIANS(RC[-3])))) -> 157.53230997092797 | T241: =DEGREES(ASIN(SIN(RADIANS(RC[-2]))*SIN(RADIANS(RC[-4])))) -> 9.4058130825254658 | U241: =TAN(RADIANS(RC[-3]/2))*TAN(RADIANS(RC[-3]/2)) -> 4.3018085844403316E-2 | V241: =4*DEGREES(RC[-1]*SIN(2*RADIANS(RC[-13]))-2*RC[-11]*SIN(RADIANS(RC[-12]))+4*RC[-11]*RC[-1]*SIN(RADIANS(RC[-12]))*COS(2*RADIANS(RC[-13]))-0.5*RC[-1]*RC[-1]*SIN(4*RADIANS(RC[-13]))-1.25*RC[-11]*RC[-11]*SIN(2*RADIANS(RC[-12]))) -> -1.0676297797404251 | W241: =DEGREES(ACOS(COS(RADIANS(90.833))/(COS(RADIANS(R2C2))*COS(RADIANS(RC[-3])))-TAN(RADIANS(R2C2))*TAN(RADIANS(RC[-3])))) -> 119.88191599960861 | X241: =(720-4*R3C2-RC[-2]+R4C2*60)/1440 -> 1899-12-31T13:57:04.058 | Y241: =(RC[-1]*1440-RC[-2]*4)/1440 -> 1899-12-31T05:57:32.398 | Z241: =(RC[-2]*1440+RC[-3]*4)/1440 -> 1899-12-31T21:56:35.718 | AA241: =8*RC[-4] -> 959.05532799686887 | AB241: =MOD(RC[-23]*1440+RC[-6]+4*R3C2-60*R4C2,1440) -> 722.9323702202596 | AC241: =IF(RC[-1]/4<0,RC[-1]/4+180,RC[-1]/4-180) -> 0.7330925550648999 | AD241: =DEGREES(ACOS(SIN(RADIANS(R2C2))*SIN(RADIANS(RC[-10]))+COS(RADIANS(R2C2))*COS(RADIANS(RC[-10]))*COS(RADIANS(RC[-1])))) -> 60.59600338864324 | AE241: =90-RC[-1] -> 29.40399661135676 | AF241: =IF(RC[-1]>85,0,IF(RC[-1]>5,58.1/TAN(RADIANS(RC[-1]))-0.07/POWER(TAN(RADIANS(RC[-1])),3)+0.000086/POWER(TAN(RADIANS(RC[-1])),5),IF(RC[-1]>-0.575,1735+RC[-1]*(-518.2+RC[-1]*(103.4+RC[-1]*(-12.79+RC[-1]*0.711))),-20.772/TAN(RADIANS(RC[-1])))))/3600 -> 2.8529028350127102E-2 | AG241: =RC[-2]+RC[-1] -> 29.432525639706888 | AH241: =IF(RC[-5]>0,MOD(DEGREES(ACOS(((SIN(RADIANS(R2C2))*COS(RADIANS(RC[-4])))-SIN(RADIANS(RC[-14])))/(COS(RADIANS(R2C2))*SIN(RADIANS(RC[-4])))))+180,360),MOD(540-DEGREES(ACOS(((SIN(RADIANS(R2C2))*COS(RADIANS(RC[-4])))-SIN(RADIANS(RC[-14])))/(COS(RADIANS(R2C2))*SIN(RADIANS(RC[-4]))))),360)) -> 180.83018720414924
D242: =R[-1]C+1 -> 2017-08-29T00:00:00.000 | E242: =R5C2 -> 1899-12-31T14:00:00.000 | F242: =RC[-2]+2415018.5+RC[-1]-R4C2/24 -> 2457995.375 | G242: =(RC[-1]-2451545)/36525 -> 0.17660164271047227 | I242: =MOD(280.46646+RC[-2]*(36000.76983 + RC[-2]*0.0003032),360) -> 158.2615602758533 | J242: =357.52911+RC[-3]*(35999.05029 - 0.0001537*RC[-3]) -> 6715.0205224372858 | K242: =0.016708634-RC[-4]*(0.000042037+0.0000001267*RC[-4]) -> 1.6701206245208017E-2 | L242: =SIN(RADIANS(RC[-2]))*(1.914602-RC[-5]*(0.004817+0.000014*RC[-5]))+SIN(RADIANS(2*RC[-2]))*(0.019993-0.000101*RC[-5])+SIN(RADIANS(3*RC[-2]))*0.000289 -> -1.5493548960855128 | M242: =RC[-4]+RC[-1] -> 156.71220537976779 | N242: =RC[-4]+RC[-2] -> 6713.4711675412 | O242: =(1.000001018*(1-RC[-4]*RC[-4]))/(1+RC[-4]*COS(RADIANS(RC[-1]))) -> 1.0097601256795858 | P242: =RC[-3]-0.00569-0.00478*SIN(RADIANS(125.04-1934.136*RC[-9])) -> 156.70367000843083 | Q242: =23+(26+((21.448-RC[-10]*(46.815+RC[-10]*(0.00059-RC[-10]*0.001813))))/60)/60 -> 23.436994551578135 | R242: =RC[-1]+0.00256*COS(RADIANS(125.04-1934.136*RC[-11])) -> 23.434937518021481 | S242: =DEGREES(ATAN2(COS(RADIANS(RC[-3])),COS(RADIANS(RC[-1]))*SIN(RADIANS(RC[-3])))) -> 158.44233491541297 | T242: =DEGREES(ASIN(SIN(RADIANS(RC[-2]))*SIN(RADIANS(RC[-4])))) -> 9.0495164724221535 | U242: =TAN(RADIANS(RC[-3]/2))*TAN(RADIANS(RC[-3]/2)) -> 4.301808981446488E-2 | V242: =4*DEGREES(RC[-1]*SIN(2*RADIANS(RC[-13]))-2*RC[-11]*SIN(RADIANS(RC[-12]))+4*RC[-11]*RC[-1]*SIN(RADIANS(RC[-12]))*COS(2*RADIANS(RC[-13]))-0.5*RC[-1]*RC[-1]*SIN(4*RADIANS(RC[-13]))-1.25*RC[-11]*RC[-11]*SIN(2*RADIANS(RC[-12]))) -> -0.76612471397487536 | W242: =DEGREES(ACOS(COS(RADIANS(90.833))/(COS(RADIANS(R2C2))*COS(RADIANS(RC[-3])))-TAN(RADIANS(R2C2))*TAN(RADIANS(RC[-3])))) -> 118.72683550408242 | X242: =(720-4*R3C2-RC[-2]+R4C2*60)/1440 -> 1899-12-31T13:56:45.967 | Y242: =(RC[-1]*1440-RC[-2]*4)/1440 -> 1899-12-31T06:01:51.527 | Z242: =(RC[-2]*1440+RC[-3]*4)/1440 -> 1899-12-31T21:51:40.408 | AA242: =8*RC[-4] -> 949.81468403265933 | AB242: =MOD(RC[-23]*1440+RC[-6]+4*R3C2-60*R4C2,1440) -> 723.23387528602507 | AC242: =IF(RC[-1]/4<0,RC[-1]/4+180,RC[-1]/4-180) -> 0.80846882150626698 | AD242: =DEGREES(ACOS(SIN(RADIANS(R2C2))*SIN(RADIANS(RC[-10]))+COS(RADIANS(R2C2))*COS(RADIANS(RC[-10]))*COS(RADIANS(RC[-1])))) -> 60.952687281406192 | AE242: =90-RC[-1] -> 29.047312718593808 | AF242: =IF(RC[-1]>85,0,IF(RC[-1]>5,58.1/TAN(RADIANS(RC[-1]))-0.07/POWER(TAN(RADIANS(RC[-1])),3)+0.000086/POWER(TAN(RADIANS(RC[-1])),5),IF(RC[-1]>-0.575,1735+RC[-1]*(-518.2+RC[-1]*(103.4+RC[-1]*(-12.79+RC[-1]*0.711))),-20.772/TAN(RADIANS(RC[-1])))))/3600 -> 2.8945660199623652E-2 | AG242: =RC[-2]+RC[-1] -> 29.076258378793433 | AH242: =IF(RC[-5]>0,MOD(DEGREES(ACOS(((SIN(RADIANS(R2C2))*COS(RADIANS(RC[-4])))-SIN(RADIANS(RC[-14])))/(COS(RADIANS(R2C2))*SIN(RADIANS(RC[-4])))))+180,360),MOD(540-DEGREES(ACOS(((SIN(RADIANS(R2C2))*COS(RADIANS(RC[-4])))-SIN(RADIANS(RC[-14])))/(COS(RADIANS(R2C2))*SIN(RADIANS(RC[-4]))))),360)) -> 180.9132870371044
D243: =R[-1]C+1 -> 2017-08-30T00:00:00.000 | E243: =R5C2 -> 1899-12-31T14:00:00.000 | F243: =RC[-2]+2415018.5+RC[-1]-R4C2/24 -> 2457996.375 | G243: =(RC[-1]-2451545)/36525 -> 0.17662902121834359 | I243: =MOD(280.46646+RC[-2]*(36000.76983 + RC[-2]*0.0003032),360) -> 159.24720763894948 | J243: =357.52911+RC[-3]*(35999.05029 - 0.0001537*RC[-3]) -> 6716.0061227175247 | K243: =0.016708634-RC[-4]*(0.000042037+0.0000001267*RC[-4]) -> 1.6701205093072373E-2 | L243: =SIN(RADIANS(RC[-2]))*(1.914602-RC[-5]*(0.004817+0.000014*RC[-5]))+SIN(RADIANS(2*RC[-2]))*(0.019993-0.000101*RC[-5])+SIN(RADIANS(3*RC[-2]))*0.000289 -> -1.5682265677218012 | M243: =RC[-4]+RC[-1] -> 157.67898107122767 | N243: =RC[-4]+RC[-2] -> 6714.4378961498032 | O243: =(1.000001018*(1-RC[-4]*RC[-4]))/(1+RC[-4]*COS(RADIANS(RC[-1]))) -> 1.0095278038159277 | P243: =RC[-3]-0.00569-0.00478*SIN(RADIANS(125.04-1934.136*RC[-9])) -> 157.67044215130991 | Q243: =23+(26+((21.448-RC[-10]*(46.815+RC[-10]*(0.00059-RC[-10]*0.001813))))/60)/60 -> 23.436994195543161 | R243: =RC[-1]+0.00256*COS(RADIANS(125.04-1934.136*RC[-11])) -> 23.434938571262109 | S243: =DEGREES(ATAN2(COS(RADIANS(RC[-3])),COS(RADIANS(RC[-1]))*SIN(RADIANS(RC[-3])))) -> 159.35096838990177 | T243: =DEGREES(ASIN(SIN(RADIANS(RC[-2]))*SIN(RADIANS(RC[-4])))) -> 8.6908147219405318 | U243: =TAN(RADIANS(RC[-3]/2))*TAN(RADIANS(RC[-3]/2)) -> 4.3018093791160797E-2 | V243: =4*DEGREES(RC[-1]*SIN(2*RADIANS(RC[-13]))-2*RC[-11]*SIN(RADIANS(RC[-12]))+4*RC[-11]*RC[-1]*SIN(RADIANS(RC[-12]))*COS(2*RADIANS(RC[-13]))-0.5*RC[-1]*RC[-1]*SIN(4*RADIANS(RC[-13]))-1.25*RC[-11]*RC[-11]*SIN(2*RADIANS(RC[-12]))) -> -0.45908790987207992 | W243: =DEGREES(ACOS(COS(RADIANS(90.833))/(COS(RADIANS(R2C2))*COS(RADIANS(RC[-3])))-TAN(RADIANS(R2C2))*TAN(RADIANS(RC[-3])))) -> 117.57909036426138 | X243: =(720-4*R3C2-RC[-2]+R4C2*60)/1440 -> 1899-12-31T13:56:27.545 | Y243: =(RC[-1]*1440-RC[-2]*4)/1440 -> 1899-12-31T06:06:08.564 | Z243: =(RC[-2]*1440+RC[-3]*4)/1440 -> 1899-12-31T21:46:46.527 | AA243: =8*RC[-4] -> 940.632722914091 | AB243: =MOD(RC[-23]*1440+RC[-6]+4*R3C2-60*R4C2,1440) -> 723.5409120901279 | AC243: =IF(RC[-1]/4<0,RC[-1]/4+180,RC[-1]/4-180) -> 0.88522802253197597 | AD243: =DEGREES(ACOS(SIN(RADIANS(R2C2))*SIN(RADIANS(RC[-10]))+COS(RADIANS(R2C2))*COS(RADIANS(RC[-10]))*COS(RADIANS(RC[-1])))) -> 61.311820819293303 | AE243: =90-RC[-1] -> 28.688179180706697 | AF243: =IF(RC[-1]>85,0,IF(RC[-1]>5,58.1/TAN(RADIANS(RC[-1]))-0.07/POWER(TAN(RADIANS(RC[-1])),3)+0.000086/POWER(TAN(RADIANS(RC[-1])),5),IF(RC[-1]>-0.575,1735+RC[-1]*(-518.2+RC[-1]*(103.4+RC[-1]*(-12.79+RC[-1]*0.711))),-20.772/TAN(RADIANS(RC[-1])))))/3600 -> 2.937454998642005E-2 | AG243: =RC[-2]+RC[-1] -> 28.717553730693119 | AH243: =IF(RC[-5]>0,MOD(DEGREES(ACOS(((SIN(RADIANS(R2C2))*COS(RADIANS(RC[-4])))-SIN(RADIANS(RC[-14])))/(COS(RADIANS(R2C2))*SIN(RADIANS(RC[-4])))))+180,360),MOD(540-DEGREES(ACOS(((SIN(RADIANS(R2C2))*COS(RADIANS(RC[-4])))-SIN(RADIANS(RC[-14])))/(COS(RADIANS(R2C2))*SIN(RADIANS(RC[-4]))))),360)) -> 180.9975241992351
D244: =R[-1]C+1 -> 2017-08-31T00:00:00.000 | E244: =R5C2 -> 1899-12-31T14:00:00.000 | F244: =RC[-2]+2415018.5+RC[-1]-R4C2/24 -> 2457997.375 | G244: =(RC[-1]-2451545)/36525 -> 0.17665639972621491 | I244: =MOD(280.46646+RC[-2]*(36000.76983 + RC[-2]*0.0003032),360) -> 160.23285500204656 | J244: =357.52911+RC[-3]*(35999.05029 - 0.0001537*RC[-3]) -> 6716.9917229977627 | K244: =0.016708634-RC[-4]*(0.000042037+0.0000001267*RC[-4]) -> 1.6701203940936542E-2 | L244: =SIN(RADIANS(RC[-2]))*(1.914602-RC[-5]*(0.004817+0.000014*RC[-5]))+SIN(RADIANS(2*RC[-2]))*(0.019993-0.000101*RC[-5])+SIN(RADIANS(3*RC[-2]))*0.000289 -> -1.5866504935326786 | M244: =RC[-4]+RC[-1] -> 158.64620450851388 | N244: =RC[-4]+RC[-2] -> 6715.4050725042298 | O244: =(1.000001018*(1-RC[-4]*RC[-4]))/(1+RC[-4]*COS(RADIANS(RC[-1]))) -> 1.0092926618449383 | P244: =RC[-3]-0.00569-0.00478*SIN(RADIANS(125.04-1934.136*RC[-9])) -> 158.63766204244882 | Q244: =23+(26+((21.448-RC[-10]*(46.815+RC[-10]*(0.00059-RC[-10]*0.001813))))/60)/60 -> 23.436993839508187 | R244: =RC[-1]+0.00256*COS(RADIANS(125.04-1934.136*RC[-11])) -> 23.4349396262586 | S244: =DEGREES(ATAN2(COS(RADIANS(RC[-3])),COS(RADIANS(RC[-1]))*SIN(RADIANS(RC[-3])))) -> 160.25827892243151 | T244: =DEGREES(ASIN(SIN(RADIANS(RC[-2]))*SIN(RADIANS(RC[-4])))) -> 8.3297971626386129 | U244: =TAN(RADIANS(RC[-3]/2))*TAN(RADIANS(RC[-3]/2)) -> 4.3018097774486494E-2 | V244: =4*DEGREES(RC[-1]*SIN(2*RADIANS(RC[-13]))-2*RC[-11]*SIN(RADIANS(RC[-12]))+4*RC[-11]*RC[-1]*SIN(RADIANS(RC[-12]))*COS(2*RADIANS(RC[-13]))-0.5*RC[-1]*RC[-1]*SIN(4*RADIANS(RC[-13]))-1.25*RC[-11]*RC[-11]*SIN(2*RADIANS(RC[-12]))) -> -0.14678827594071556 | W244: =DEGREES(ACOS(COS(RADIANS(90.833))/(COS(RADIANS(R2C2))*COS(RADIANS(RC[-3])))-TAN(RADIANS(R2C2))*TAN(RADIANS(RC[-3])))) -> 116.43822663250312 | X244: =(720-4*R3C2-RC[-2]+R4C2*60)/1440 -> 1899-12-31T13:56:08.807 | Y244: =(RC[-1]*1440-RC[-2]*4)/1440 -> 1899-12-31T06:10:23.633 | Z244: =(RC[-2]*1440+RC[-3]*4)/1440 -> 1899-12-31T21:41:53.982 | AA244: =8*RC[-4] -> 931.50581306002493 | AB244: =MOD(RC[-23]*1440+RC[-6]+4*R3C2-60*R4C2,1440) -> 723.85321172405929 | AC244: =IF(RC[-1]/4<0,RC[-1]/4+180,RC[-1]/4-180) -> 0.96330293101482312 | AD244: =DEGREES(ACOS(SIN(RADIANS(R2C2))*SIN(RADIANS(RC[-10]))+COS(RADIANS(R2C2))*COS(RADIANS(RC[-10]))*COS(RADIANS(RC[-1])))) -> 61.673316028855673 | AE244: =90-RC[-1] -> 28.326683971144327 | AF244: =IF(RC[-1]>85,0,IF(RC[-1]>5,58.1/TAN(RADIANS(RC[-1]))-0.07/POWER(TAN(RADIANS(RC[-1])),3)+0.000086/POWER(TAN(RADIANS(RC[-1])),5),IF(RC[-1]>-0.575,1735+RC[-1]*(-518.2+RC[-1]*(103.4+RC[-1]*(-12.79+RC[-1]*0.711))),-20.772/TAN(RADIANS(RC[-1])))))/3600 -> 2.9816139634926669E-2 | AG244: =RC[-2]+RC[-1] -> 28.356500110779255 | AH244: =IF(RC[-5]>0,MOD(DEGREES(ACOS(((SIN(RADIANS(R2C2))*COS(RADIANS(RC[-4])))-SIN(RADIANS(RC[-14])))/(COS(RADIANS(R2C2))*SIN(RADIANS(RC[-4])))))+180,360),MOD(540-DEGREES(ACOS(((SIN(RADIANS(R2C2))*COS(RADIANS(RC[-4])))-SIN(RADIANS(RC[-14])))/(COS(RADIANS(R2C2))*SIN(RADIANS(RC[-4]))))),360)) -> 181.08281224549194
D245: =R[-1]C+1 -> 2017-09-01T00:00:00.000 | E245: =R5C2 -> 1899-12-31T14:00:00.000 | F245: =RC[-2]+2415018.5+RC[-1]-R4C2/24 -> 2457998.375 | G245: =(RC[-1]-2451545)/36525 -> 0.17668377823408624 | I245: =MOD(280.46646+RC[-2]*(36000.76983 + RC[-2]*0.0003032),360) -> 161.21850236514365 | J245: =357.52911+RC[-3]*(35999.05029 - 0.0001537*RC[-3]) -> 6717.9773232780008 | K245: =0.016708634-RC[-4]*(0.000042037+0.0000001267*RC[-4]) -> 1.670120278880052E-2 | L245: =SIN(RADIANS(RC[-2]))*(1.914602-RC[-5]*(0.004817+0.000014*RC[-5]))+SIN(RADIANS(2*RC[-2]))*(0.019993-0.000101*RC[-5])+SIN(RADIANS(3*RC[-2]))*0.000289 -> -1.6046210183191421 | M245: =RC[-4]+RC[-1] -> 159.61388134682451 | N245: =RC[-4]+RC[-2] -> 6716.3727022596813 | O245: =(1.000001018*(1-RC[-4]*RC[-4]))/(1+RC[-4]*COS(RADIANS(RC[-1]))) -> 1.0090547654708906 | P245: =RC[-3]-0.00569-0.00478*SIN(RADIANS(125.04-1934.136*RC[-9])) -> 159.60533533704867 | Q245: =23+(26+((21.448-RC[-10]*(46.815+RC[-10]*(0.00059-RC[-10]*0.001813))))/60)/60 -> 23.436993483473213 | R245: =RC[-1]+0.00256*COS(RADIANS(125.04-1934.136*RC[-11])) -> 23.434940683009756 | S245: =DEGREES(ATAN2(COS(RADIANS(RC[-3])),COS(RADIANS(RC[-1]))*SIN(RADIANS(RC[-3])))) -> 161.16433633819909 | T245: =DEGREES(ASIN(SIN(RADIANS(RC[-2]))*SIN(RADIANS(RC[-4])))) -> 7.9665532411615319 | U245: =TAN(RADIANS(RC[-3]/2))*TAN(RADIANS(RC[-3]/2)) -> 4.3018101764437433E-2 | V245: =4*DEGREES(RC[-1]*SIN(2*RADIANS(RC[-13]))-2*RC[-11]*SIN(RADIANS(RC[-12]))+4*RC[-11]*RC[-1]*SIN(RADIANS(RC[-12]))*COS(2*RADIANS(RC[-13]))-0.5*RC[-1]*RC[-1]*SIN(4*RADIANS(RC[-13]))-1.25*RC[-11]*RC[-11]*SIN(2*RADIANS(RC[-12]))) -> 0.1705006799666676 | W245: =DEGREES(ACOS(COS(RADIANS(90.833))/(COS(RADIANS(R2C2))*COS(RADIANS(RC[-3])))-TAN(RADIANS(R2C2))*TAN(RADIANS(RC[-3])))) -> 115.30381713342736 | X245: =(720-4*R3C2-RC[-2]+R4C2*60)/1440 -> 1899-12-31T13:55:49.770 | Y245: =(RC[-1]*1440-RC[-2]*4)/1440 -> 1899-12-31T06:14:36.854 | Z245: =(RC[-2]*1440+RC[-3]*4)/1440 -> 1899-12-31T21:37:02.686 | AA245: =8*RC[-4] -> 922.43053706741887 | AB245: =MOD(RC[-23]*1440+RC[-6]+4*R3C2-60*R4C2,1440) -> 724.17050067996672 | AC245: =IF(RC[-1]/4<0,RC[-1]/4+180,RC[-1]/4-180) -> 1.0426251699916804 | AD245: =DEGREES(ACOS(SIN(RADIANS(R2C2))*SIN(RADIANS(RC[-10]))+COS(RADIANS(R2C2))*COS(RADIANS(RC[-10]))*COS(RADIANS(RC[-1])))) -> 62.037084693209401 | AE245: =90-RC[-1] -> 27.962915306790599 | AF245: =IF(RC[-1]>85,0,IF(RC[-1]>5,58.1/TAN(RADIANS(RC[-1]))-0.07/POWER(TAN(RADIANS(RC[-1])),3)+0.000086/POWER(TAN(RADIANS(RC[-1])),5),IF(RC[-1]>-0.575,1735+RC[-1]*(-518.2+RC[-1]*(103.4+RC[-1]*(-12.79+RC[-1]*0.711))),-20.772/TAN(RADIANS(RC[-1])))))/3600 -> 3.0270894747191926E-2 | AG245: =RC[-2]+RC[-1] -> 27.993186201537792 | AH245: =IF(RC[-5]>0,MOD(DEGREES(ACOS(((SIN(RADIANS(R2C2))*COS(RADIANS(RC[-4])))-SIN(RADIANS(RC[-14])))/(COS(RADIANS(R2C2))*SIN(RADIANS(RC[-4])))))+180,360),MOD(540-DEGREES(ACOS(((SIN(RADIANS(R2C2))*COS(RADIANS(RC[-4])))-SIN(RADIANS(RC[-14])))/(COS(RADIANS(R2C2))*SIN(RADIANS(RC[-4]))))),360)) -> 181.16906438187451
D246: =R[-1]C+1 -> 2017-09-02T00:00:00.000 | E246: =R5C2 -> 1899-12-31T14:00:00.000 | F246: =RC[-2]+2415018.5+RC[-1]-R4C2/24 -> 2457999.375 | G246: =(RC[-1]-2451545)/36525 -> 0.17671115674195756 | I246: =MOD(280.46646+RC[-2]*(36000.76983 + RC[-2]*0.0003032),360) -> 162.20414972824165 | J246: =357.52911+RC[-3]*(35999.05029 - 0.0001537*RC[-3]) -> 6718.9629235582388 | K246: =0.016708634-RC[-4]*(0.000042037+0.0000001267*RC[-4]) -> 1.6701201636664307E-2 | L246: =SIN(RADIANS(RC[-2]))*(1.914602-RC[-5]*(0.004817+0.000014*RC[-5]))+SIN(RADIANS(2*RC[-2]))*(0.019993-0.000101*RC[-5])+SIN(RADIANS(3*RC[-2]))*0.000289 -> -1.6221326021580693 | M246: =RC[-4]+RC[-1] -> 160.58201712608357 | N246: =RC[-4]+RC[-2] -> 6717.340790956081 | O246: =(1.000001018*(1-RC[-4]*RC[-4]))/(1+RC[-4]*COS(RADIANS(RC[-1]))) -> 1.0088141812621083 | P246: =RC[-3]-0.00569-0.00478*SIN(RADIANS(125.04-1934.136*RC[-9])) -> 160.57346757503646 | Q246: =23+(26+((21.448-RC[-10]*(46.815+RC[-10]*(0.00059-RC[-10]*0.001813))))/60)/60 -> 23.436993127438239 | R246: =RC[-1]+0.00256*COS(RADIANS(125.04-1934.136*RC[-11])) -> 23.434941741514372 | S246: =DEGREES(ATAN2(COS(RADIANS(RC[-3])),COS(RADIANS(RC[-1]))*SIN(RADIANS(RC[-3])))) -> 162.069211702486 | T246: =DEGREES(ASIN(SIN(RADIANS(RC[-2]))*SIN(RADIANS(RC[-4])))) -> 7.6011725224469284 | U246: =TAN(RADIANS(RC[-3]/2))*TAN(RADIANS(RC[-3]/2)) -> 4.3018105761009069E-2 | V246: =4*DEGREES(RC[-1]*SIN(2*RADIANS(RC[-13]))-2*RC[-11]*SIN(RADIANS(RC[-12]))+4*RC[-11]*RC[-1]*SIN(RADIANS(RC[-12]))*COS(2*RADIANS(RC[-13]))-0.5*RC[-1]*RC[-1]*SIN(4*RADIANS(RC[-13]))-1.25*RC[-11]*RC[-11]*SIN(2*RADIANS(RC[-12]))) -> 0.4925010529616014 | W246: =DEGREES(ACOS(COS(RADIANS(90.833))/(COS(RADIANS(R2C2))*COS(RADIANS(RC[-3])))-TAN(RADIANS(R2C2))*TAN(RADIANS(RC[-3])))) -> 114.17545860757707 | X246: =(720-4*R3C2-RC[-2]+R4C2*60)/1440 -> 1899-12-31T13:55:30.450 | Y246: =(RC[-1]*1440-RC[-2]*4)/1440 -> 1899-12-31T06:18:48.340 | Z246: =(RC[-2]*1440+RC[-3]*4)/1440 -> 1899-12-31T21:32:12.560 | AA246: =8*RC[-4] -> 913.40366886061656 | AB246: =MOD(RC[-23]*1440+RC[-6]+4*R3C2-60*R4C2,1440) -> 724.49250105296164 | AC246: =IF(RC[-1]/4<0,RC[-1]/4+180,RC[-1]/4-180) -> 1.1231252632404107 | AD246: =DEGREES(ACOS(SIN(RADIANS(R2C2))*SIN(RADIANS(RC[-10]))+COS(RADIANS(R2C2))*COS(RADIANS(RC[-10]))*COS(RADIANS(RC[-1])))) -> 62.403038342013886 | AE246: =90-RC[-1] -> 27.596961657986114 | AF246: =IF(RC[-1]>85,0,IF(RC[-1]>5,58.1/TAN(RADIANS(RC[-1]))-0.07/POWER(TAN(RADIANS(RC[-1])),3)+0.000086/POWER(TAN(RADIANS(RC[-1])),5),IF(RC[-1]>-0.575,1735+RC[-1]*(-518.2+RC[-1]*(103.4+RC[-1]*(-12.79+RC[-1]*0.711))),-20.772/TAN(RADIANS(RC[-1])))))/3600 -> 3.0739306059223405E-2 | AG246: =RC[-2]+RC[-1] -> 27.627700964045339 | AH246: =IF(RC[-5]>0,MOD(DEGREES(ACOS(((SIN(RADIANS(R2C2))*COS(RADIANS(RC[-4])))-SIN(RADIANS(RC[-14])))/(COS(RADIANS(R2C2))*SIN(RADIANS(RC[-4])))))+180,360),MOD(540-DEGREES(ACOS(((SIN(RADIANS(R2C2))*COS(RADIANS(RC[-4])))-SIN(RADIANS(RC[-14])))/(COS(RADIANS(R2C2))*SIN(RADIANS(RC[-4]))))),360)) -> 181.25619353753243
D247: =R[-1]C+1 -> 2017-09-03T00:00:00.000 | E247: =R5C2 -> 1899-12-31T14:00:00.000 | F247: =RC[-2]+2415018.5+RC[-1]-R4C2/24 -> 2458000.375 | G247: =(RC[-1]-2451545)/36525 -> 0.17673853524982888 | I247: =MOD(280.46646+RC[-2]*(36000.76983 + RC[-2]*0.0003032),360) -> 163.18979709133964 | J247: =357.52911+RC[-3]*(35999.05029 - 0.0001537*RC[-3]) -> 6719.9485238384759 | K247: =0.016708634-RC[-4]*(0.000042037+0.0000001267*RC[-4]) -> 1.6701200484527907E-2 | L247: =SIN(RADIANS(RC[-2]))*(1.914602-RC[-5]*(0.004817+0.000014*RC[-5]))+SIN(RADIANS(2*RC[-2]))*(0.019993-0.000101*RC[-5])+SIN(RADIANS(3*RC[-2]))*0.000289 -> -1.6391798222529597 | M247: =RC[-4]+RC[-1] -> 161.55061726908667 | N247: =RC[-4]+RC[-2] -> 6718.3093440162229 | O247: =(1.000001018*(1-RC[-4]*RC[-4]))/(1+RC[-4]*COS(RADIANS(RC[-1]))) -> 1.0085709766357316 | P247: =RC[-3]-0.00569-0.00478*SIN(RADIANS(125.04-1934.136*RC[-9])) -> 161.54206417921088 | Q247: =23+(26+((21.448-RC[-10]*(46.815+RC[-10]*(0.00059-RC[-10]*0.001813))))/60)/60 -> 23.436992771403265 | R247: =RC[-1]+0.00256*COS(RADIANS(125.04-1934.136*RC[-11])) -> 23.434942801771232 | S247: =DEGREES(ATAN2(COS(RADIANS(RC[-3])),COS(RADIANS(RC[-1]))*SIN(RADIANS(RC[-3])))) -> 162.97297726449455 | T247: =DEGREES(ASIN(SIN(RADIANS(RC[-2]))*SIN(RADIANS(RC[-4])))) -> 7.2337446940838657 | U247: =TAN(RADIANS(RC[-3]/2))*TAN(RADIANS(RC[-3]/2)) -> 4.3018109764196809E-2 | V247: =4*DEGREES(RC[-1]*SIN(2*RADIANS(RC[-13]))-2*RC[-11]*SIN(RADIANS(RC[-12]))+4*RC[-11]*RC[-1]*SIN(RADIANS(RC[-12]))*COS(2*RADIANS(RC[-13]))-0.5*RC[-1]*RC[-1]*SIN(4*RADIANS(RC[-13]))-1.25*RC[-11]*RC[-11]*SIN(2*RADIANS(RC[-12]))) -> 0.81893073358331969 | W247: =DEGREES(ACOS(COS(RADIANS(90.833))/(COS(RADIANS(R2C2))*COS(RADIANS(RC[-3])))-TAN(RADIANS(R2C2))*TAN(RADIANS(RC[-3])))) -> 113.0527692050541 | X247: =(720-4*R3C2-RC[-2]+R4C2*60)/1440 -> 1899-12-31T13:55:10.864 | Y247: =(RC[-1]*1440-RC[-2]*4)/1440 -> 1899-12-31T06:22:58.200 | Z247: =(RC[-2]*1440+RC[-3]*4)/1440 -> 1899-12-31T21:27:23.529 | AA247: =8*RC[-4] -> 904.42215364043284 | AB247: =MOD(RC[-23]*1440+RC[-6]+4*R3C2-60*R4C2,1440) -> 724.81893073358333 | AC247: =IF(RC[-1]/4<0,RC[-1]/4+180,RC[-1]/4-180) -> 1.2047326833958323 | AD247: =DEGREES(ACOS(SIN(RADIANS(R2C2))*SIN(RADIANS(RC[-10]))+COS(RADIANS(R2C2))*COS(RADIANS(RC[-10]))*COS(RADIANS(RC[-1])))) -> 62.771088240745534 | AE247: =90-RC[-1] -> 27.228911759254466 | AF247: =IF(RC[-1]>85,0,IF(RC[-1]>5,58.1/TAN(RADIANS(RC[-1]))-0.07/POWER(TAN(RADIANS(RC[-1])),3)+0.000086/POWER(TAN(RADIANS(RC[-1])),5),IF(RC[-1]>-0.575,1735+RC[-1]*(-518.2+RC[-1]*(103.4+RC[-1]*(-12.79+RC[-1]*0.711))),-20.772/TAN(RADIANS(RC[-1])))))/3600 -> 3.1221891004996106E-2 | AG247: =RC[-2]+RC[-1] -> 27.260133650259462 | AH247: =IF(RC[-5]>0,MOD(DEGREES(ACOS(((SIN(RADIANS(R2C2))*COS(RADIANS(RC[-4])))-SIN(RADIANS(RC[-14])))/(COS(RADIANS(R2C2))*SIN(RADIANS(RC[-4])))))+180,360),MOD(540-DEGREES(ACOS(((SIN(RADIANS(R2C2))*COS(RADIANS(RC[-4])))-SIN(RADIANS(RC[-14])))/(COS(RADIANS(R2C2))*SIN(RADIANS(RC[-4]))))),360)) -> 181.34411243230943
D248: =R[-1]C+1 -> 2017-09-04T00:00:00.000 | E248: =R5C2 -> 1899-12-31T14:00:00.000 | F248: =RC[-2]+2415018.5+RC[-1]-R4C2/24 -> 2458001.375 | G248: =(RC[-1]-2451545)/36525 -> 0.1767659137577002 | I248: =MOD(280.46646+RC[-2]*(36000.76983 + RC[-2]*0.0003032),360) -> 164.17544445443855 | J248: =357.52911+RC[-3]*(35999.05029 - 0.0001537*RC[-3]) -> 6720.934124118714 | K248: =0.016708634-RC[-4]*(0.000042037+0.0000001267*RC[-4]) -> 1.6701199332391316E-2 | L248: =SIN(RADIANS(RC[-2]))*(1.914602-RC[-5]*(0.004817+0.000014*RC[-5]))+SIN(RADIANS(2*RC[-2]))*(0.019993-0.000101*RC[-5])+SIN(RADIANS(3*RC[-2]))*0.000289 -> -1.6557573747720986 | M248: =RC[-4]+RC[-1] -> 162.51968707966645 | N248: =RC[-4]+RC[-2] -> 6719.2783667439417 | O248: =(1.000001018*(1-RC[-4]*RC[-4]))/(1+RC[-4]*COS(RADIANS(RC[-1]))) -> 1.0083252198421826 | P248: =RC[-3]-0.00569-0.00478*SIN(RADIANS(125.04-1934.136*RC[-9])) -> 162.51113045340756 | Q248: =23+(26+((21.448-RC[-10]*(46.815+RC[-10]*(0.00059-RC[-10]*0.001813))))/60)/60 -> 23.436992415368294 | R248: =RC[-1]+0.00256*COS(RADIANS(125.04-1934.136*RC[-11])) -> 23.434943863779136 | S248: =DEGREES(ATAN2(COS(RADIANS(RC[-3])),COS(RADIANS(RC[-1]))*SIN(RADIANS(RC[-3])))) -> 163.87570640209205 | T248: =DEGREES(ASIN(SIN(RADIANS(RC[-2]))*SIN(RADIANS(RC[-4])))) -> 6.8643595717655179 | U248: =TAN(RADIANS(RC[-3]/2))*TAN(RADIANS(RC[-3]/2)) -> 4.3018113773996135E-2 | V248: =4*DEGREES(RC[-1]*SIN(2*RADIANS(RC[-13]))-2*RC[-11]*SIN(RADIANS(RC[-12]))+4*RC[-11]*RC[-1]*SIN(RADIANS(RC[-12]))*COS(2*RADIANS(RC[-13]))-0.5*RC[-1]*RC[-1]*SIN(4*RADIANS(RC[-13]))-1.25*RC[-11]*RC[-11]*SIN(2*RADIANS(RC[-12]))) -> 1.1495035906283169 | W248: =DEGREES(ACOS(COS(RADIANS(90.833))/(COS(RADIANS(R2C2))*COS(RADIANS(RC[-3])))-TAN(RADIANS(R2C2))*TAN(RADIANS(RC[-3])))) -> 111.93538627817655 | X248: =(720-4*R3C2-RC[-2]+R4C2*60)/1440 -> 1899-12-31T13:54:51.030 | Y248: =(RC[-1]*1440-RC[-2]*4)/1440 -> 1899-12-31T06:27:06.537 | Z248: =(RC[-2]*1440+RC[-3]*4)/1440 -> 1899-12-31T21:22:35.522 | AA248: =8*RC[-4] -> 895.48309022541241 | AB248: =MOD(RC[-23]*1440+RC[-6]+4*R3C2-60*R4C2,1440) -> 725.14950359062834 | AC248: =IF(RC[-1]/4<0,RC[-1]/4+180,RC[-1]/4-180) -> 1.2873758976570855 | AD248: =DEGREES(ACOS(SIN(RADIANS(R2C2))*SIN(RADIANS(RC[-10]))+COS(RADIANS(R2C2))*COS(RADIANS(RC[-10]))*COS(RADIANS(RC[-1])))) -> 63.141145379335278 | AE248: =90-RC[-1] -> 26.858854620664722 | AF248: =IF(RC[-1]>85,0,IF(RC[-1]>5,58.1/TAN(RADIANS(RC[-1]))-0.07/POWER(TAN(RADIANS(RC[-1])),3)+0.000086/POWER(TAN(RADIANS(RC[-1])),5),IF(RC[-1]>-0.575,1735+RC[-1]*(-518.2+RC[-1]*(103.4+RC[-1]*(-12.79+RC[-1]*0.711))),-20.772/TAN(RADIANS(RC[-1])))))/3600 -> 3.1719195397323992E-2 | AG248: =RC[-2]+RC[-1] -> 26.890573816062048 | AH248: =IF(RC[-5]>0,MOD(DEGREES(ACOS(((SIN(RADIANS(R2C2))*COS(RADIANS(RC[-4])))-SIN(RADIANS(RC[-14])))/(COS(RADIANS(R2C2))*SIN(RADIANS(RC[-4])))))+180,360),MOD(540-DEGREES(ACOS(((SIN(RADIANS(R2C2))*COS(RADIANS(RC[-4])))-SIN(RADIANS(RC[-14])))/(COS(RADIANS(R2C2))*SIN(RADIANS(RC[-4]))))),360)) -> 181.43273363992151
D249: =R[-1]C+1 -> 2017-09-05T00:00:00.000 | E249: =R5C2 -> 1899-12-31T14:00:00.000 | F249: =RC[-2]+2415018.5+RC[-1]-R4C2/24 -> 2458002.375 | G249: =(RC[-1]-2451545)/36525 -> 0.17679329226557153 | I249: =MOD(280.46646+RC[-2]*(36000.76983 + RC[-2]*0.0003032),360) -> 165.16109181753836 | J249: =357.52911+RC[-3]*(35999.05029 - 0.0001537*RC[-3]) -> 6721.9197243989511 | K249: =0.016708634-RC[-4]*(0.000042037+0.0000001267*RC[-4]) -> 1.6701198180254534E-2 | L249: =SIN(RADIANS(RC[-2]))*(1.914602-RC[-5]*(0.004817+0.000014*RC[-5]))+SIN(RADIANS(2*RC[-2]))*(0.019993-0.000101*RC[-5])+SIN(RADIANS(3*RC[-2]))*0.000289 -> -1.6718600766728366 | M249: =RC[-4]+RC[-1] -> 163.48923174086553 | N249: =RC[-4]+RC[-2] -> 6720.2478643222785 | O249: =(1.000001018*(1-RC[-4]*RC[-4]))/(1+RC[-4]*COS(RADIANS(RC[-1]))) -> 1.0080769799493334 | P249: =RC[-3]-0.00569-0.00478*SIN(RADIANS(125.04-1934.136*RC[-9])) -> 163.48067158067215 | Q249: =23+(26+((21.448-RC[-10]*(46.815+RC[-10]*(0.00059-RC[-10]*0.001813))))/60)/60 -> 23.436992059333321 | R249: =RC[-1]+0.00256*COS(RADIANS(125.04-1934.136*RC[-11])) -> 23.434944927536865 | S249: =DEGREES(ATAN2(COS(RADIANS(RC[-3])),COS(RADIANS(RC[-1]))*SIN(RADIANS(RC[-3])))) -> 164.77747356742714 | T249: =DEGREES(ASIN(SIN(RADIANS(RC[-2]))*SIN(RADIANS(RC[-4])))) -> 6.4931071057851337 | U249: =TAN(RADIANS(RC[-3]/2))*TAN(RADIANS(RC[-3]/2)) -> 4.3018117790402426E-2 | V249: =4*DEGREES(RC[-1]*SIN(2*RADIANS(RC[-13]))-2*RC[-11]*SIN(RADIANS(RC[-12]))+4*RC[-11]*RC[-1]*SIN(RADIANS(RC[-12]))*COS(2*RADIANS(RC[-13]))-0.5*RC[-1]*RC[-1]*SIN(4*RADIANS(RC[-13]))-1.25*RC[-11]*RC[-11]*SIN(2*RADIANS(RC[-12]))) -> 1.4839296446304988 | W249: =DEGREES(ACOS(COS(RADIANS(90.833))/(COS(RADIANS(R2C2))*COS(RADIANS(RC[-3])))-TAN(RADIANS(R2C2))*TAN(RADIANS(RC[-3])))) -> 110.82296443060683 | X249: =(720-4*R3C2-RC[-2]+R4C2*60)/1440 -> 1899-12-31T13:54:30.964 | Y249: =(RC[-1]*1440-RC[-2]*4)/1440 -> 1899-12-31T06:31:13.453 | Z249: =(RC[-2]*1440+RC[-3]*4)/1440 -> 1899-12-31T21:17:48.476 | AA249: =8*RC[-4] -> 886.58371544485465 | AB249: =MOD(RC[-23]*1440+RC[-6]+4*R3C2-60*R4C2,1440) -> 725.48392964463051 | AC249: =IF(RC[-1]/4<0,RC[-1]/4+180,RC[-1]/4-180) -> 1.3709824111576268 | AD249: =DEGREES(ACOS(SIN(RADIANS(R2C2))*SIN(RADIANS(RC[-10]))+COS(RADIANS(R2C2))*COS(RADIANS(RC[-10]))*COS(RADIANS(RC[-1])))) -> 63.513120460227498 | AE249: =90-RC[-1] -> 26.486879539772502 | AF249: =IF(RC[-1]>85,0,IF(RC[-1]>5,58.1/TAN(RADIANS(RC[-1]))-0.07/POWER(TAN(RADIANS(RC[-1])),3)+0.000086/POWER(TAN(RADIANS(RC[-1])),5),IF(RC[-1]>-0.575,1735+RC[-1]*(-518.2+RC[-1]*(103.4+RC[-1]*(-12.79+RC[-1]*0.711))),-20.772/TAN(RADIANS(RC[-1])))))/3600 -> 3.2231795235636206E-2 | AG249: =RC[-2]+RC[-1] -> 26.519111335008137 | AH249: =IF(RC[-5]>0,MOD(DEGREES(ACOS(((SIN(RADIANS(R2C2))*COS(RADIANS(RC[-4])))-SIN(RADIANS(RC[-14])))/(COS(RADIANS(R2C2))*SIN(RADIANS(RC[-4])))))+180,360),MOD(540-DEGREES(ACOS(((SIN(RADIANS(R2C2))*COS(RADIANS(RC[-4])))-SIN(RADIANS(RC[-14])))/(COS(RADIANS(R2C2))*SIN(RADIANS(RC[-4]))))),360)) -> 181.5219696469529
D250: =R[-1]C+1 -> 2017-09-06T00:00:00.000 | E250: =R5C2 -> 1899-12-31T14:00:00.000 | F250: =RC[-2]+2415018.5+RC[-1]-R4C2/24 -> 2458003.375 | G250: =(RC[-1]-2451545)/36525 -> 0.17682067077344285 | I250: =MOD(280.46646+RC[-2]*(36000.76983 + RC[-2]*0.0003032),360) -> 166.14673918063818 | J250: =357.52911+RC[-3]*(35999.05029 - 0.0001537*RC[-3]) -> 6722.9053246791873 | K250: =0.016708634-RC[-4]*(0.000042037+0.0000001267*RC[-4]) -> 1.6701197028117561E-2 | L250: =SIN(RADIANS(RC[-2]))*(1.914602-RC[-5]*(0.004817+0.000014*RC[-5]))+SIN(RADIANS(2*RC[-2]))*(0.019993-0.000101*RC[-5])+SIN(RADIANS(3*RC[-2]))*0.000289 -> -1.6874828675119671 | M250: =RC[-4]+RC[-1] -> 164.45925631312622 | N250: =RC[-4]+RC[-2] -> 6721.2178418116755 | O250: =(1.000001018*(1-RC[-4]*RC[-4]))/(1+RC[-4]*COS(RADIANS(RC[-1]))) -> 1.0078263268263739 | P250: =RC[-3]-0.00569-0.00478*SIN(RADIANS(125.04-1934.136*RC[-9])) -> 164.45069262144997 | Q250: =23+(26+((21.448-RC[-10]*(46.815+RC[-10]*(0.00059-RC[-10]*0.001813))))/60)/60 -> 23.436991703298347 | R250: =RC[-1]+0.00256*COS(RADIANS(125.04-1934.136*RC[-11])) -> 23.434945993043208 | S250: =DEGREES(ATAN2(COS(RADIANS(RC[-3])),COS(RADIANS(RC[-1]))*SIN(RADIANS(RC[-3])))) -> 165.67835423339548 | T250: =DEGREES(ASIN(SIN(RADIANS(RC[-2]))*SIN(RADIANS(RC[-4])))) -> 6.1200773885170277 | U250: =TAN(RADIANS(RC[-3]/2))*TAN(RADIANS(RC[-3]/2)) -> 4.3018121813411143E-2 | V250: =4*DEGREES(RC[-1]*SIN(2*RADIANS(RC[-13]))-2*RC[-11]*SIN(RADIANS(RC[-12]))+4*RC[-11]*RC[-1]*SIN(RADIANS(RC[-12]))*COS(2*RADIANS(RC[-13]))-0.5*RC[-1]*RC[-1]*SIN(4*RADIANS(RC[-13]))-1.25*RC[-11]*RC[-11]*SIN(2*RADIANS(RC[-12]))) -> 1.8219152323700141 | W250: =DEGREES(ACOS(COS(RADIANS(90.833))/(COS(RADIANS(R2C2))*COS(RADIANS(RC[-3])))-TAN(RADIANS(R2C2))*TAN(RADIANS(RC[-3])))) -> 109.71517378720014 | X250: =(720-4*R3C2-RC[-2]+R4C2*60)/1440 -> 1899-12-31T13:54:10.685 | Y250: =(RC[-1]*1440-RC[-2]*4)/1440 -> 1899-12-31T06:35:19.043 | Z250: =(RC[-2]*1440+RC[-3]*4)/1440 -> 1899-12-31T21:13:02.327 | AA250: =8*RC[-4] -> 877.72139029760115 | AB250: =MOD(RC[-23]*1440+RC[-6]+4*R3C2-60*R4C2,1440) -> 725.82191523236997 | AC250: =IF(RC[-1]/4<0,RC[-1]/4+180,RC[-1]/4-180) -> 1.4554788080924936 | AD250: =DEGREES(ACOS(SIN(RADIANS(R2C2))*SIN(RADIANS(RC[-10]))+COS(RADIANS(R2C2))*COS(RADIANS(RC[-10]))*COS(RADIANS(RC[-1])))) -> 63.886923885924467 | AE250: =90-RC[-1] -> 26.113076114075533 | AF250: =IF(RC[-1]>85,0,IF(RC[-1]>5,58.1/TAN(RADIANS(RC[-1]))-0.07/POWER(TAN(RADIANS(RC[-1])),3)+0.000086/POWER(TAN(RADIANS(RC[-1])),5),IF(RC[-1]>-0.575,1735+RC[-1]*(-518.2+RC[-1]*(103.4+RC[-1]*(-12.79+RC[-1]*0.711))),-20.772/TAN(RADIANS(RC[-1])))))/3600 -> 3.2760298651679509E-2 | AG250: =RC[-2]+RC[-1] -> 26.145836412727213 | AH250: =IF(RC[-5]>0,MOD(DEGREES(ACOS(((SIN(RADIANS(R2C2))*COS(RADIANS(RC[-4])))-SIN(RADIANS(RC[-14])))/(COS(RADIANS(R2C2))*SIN(RADIANS(RC[-4])))))+180,360),MOD(540-DEGREES(ACOS(((SIN(RADIANS(R2C2))*COS(RADIANS(RC[-4])))-SIN(RADIANS(RC[-14])))/(COS(RADIANS(R2C2))*SIN(RADIANS(RC[-4]))))),360)) -> 181.6117329078597
D251: =R[-1]C+1 -> 2017-09-07T00:00:00.000 | E251: =R5C2 -> 1899-12-31T14:00:00.000 | F251: =RC[-2]+2415018.5+RC[-1]-R4C2/24 -> 2458004.375 | G251: =(RC[-1]-2451545)/36525 -> 0.17684804928131417 | I251: =MOD(280.46646+RC[-2]*(36000.76983 + RC[-2]*0.0003032),360) -> 167.13238654373799 | J251: =357.52911+RC[-3]*(35999.05029 - 0.0001537*RC[-3]) -> 6723.8909249594244 | K251: =0.016708634-RC[-4]*(0.000042037+0.0000001267*RC[-4]) -> 1.6701195875980398E-2 | L251: =SIN(RADIANS(RC[-2]))*(1.914602-RC[-5]*(0.004817+0.000014*RC[-5]))+SIN(RADIANS(2*RC[-2]))*(0.019993-0.000101*RC[-5])+SIN(RADIANS(3*RC[-2]))*0.000289 -> -1.7026208112410579 | M251: =RC[-4]+RC[-1] -> 165.42976573249695 | N251: =RC[-4]+RC[-2] -> 6722.1883041481833 | O251: =(1.000001018*(1-RC[-4]*RC[-4]))/(1+RC[-4]*COS(RADIANS(RC[-1]))) -> 1.0075733311273745 | P251: =RC[-3]-0.00569-0.00478*SIN(RADIANS(125.04-1934.136*RC[-9])) -> 165.42119851179248 | Q251: =23+(26+((21.448-RC[-10]*(46.815+RC[-10]*(0.00059-RC[-10]*0.001813))))/60)/60 -> 23.436991347263373 | R251: =RC[-1]+0.00256*COS(RADIANS(125.04-1934.136*RC[-11])) -> 23.434947060296949 | S251: =DEGREES(ATAN2(COS(RADIANS(RC[-3])),COS(RADIANS(RC[-1]))*SIN(RADIANS(RC[-3])))) -> 166.57842484091722 | T251: =DEGREES(ASIN(SIN(RADIANS(RC[-2]))*SIN(RADIANS(RC[-4])))) -> 5.7453606628268963 | U251: =TAN(RADIANS(RC[-3]/2))*TAN(RADIANS(RC[-3]/2)) -> 4.301812584301766E-2 | V251: =4*DEGREES(RC[-1]*SIN(2*RADIANS(RC[-13]))-2*RC[-11]*SIN(RADIANS(RC[-12]))+4*RC[-11]*RC[-1]*SIN(RADIANS(RC[-12]))*COS(2*RADIANS(RC[-13]))-0.5*RC[-1]*RC[-1]*SIN(4*RADIANS(RC[-13]))-1.25*RC[-11]*RC[-11]*SIN(2*RADIANS(RC[-12]))) -> 2.1631631628622983 | W251: =DEGREES(ACOS(COS(RADIANS(90.833))/(COS(RADIANS(R2C2))*COS(RADIANS(RC[-3])))-TAN(RADIANS(R2C2))*TAN(RADIANS(RC[-3])))) -> 108.6116984544186 | X251: =(720-4*R3C2-RC[-2]+R4C2*60)/1440 -> 1899-12-31T13:53:50.210 | Y251: =(RC[-1]*1440-RC[-2]*4)/1440 -> 1899-12-31T06:39:23.403 | Z251: =(RC[-2]*1440+RC[-3]*4)/1440 -> 1899-12-31T21:08:17.018 | AA251: =8*RC[-4] -> 868.89358763534881 | AB251: =MOD(RC[-23]*1440+RC[-6]+4*R3C2-60*R4C2,1440) -> 726.16316316286225 | AC251: =IF(RC[-1]/4<0,RC[-1]/4+180,RC[-1]/4-180) -> 1.5407907907155618 | AD251: =DEGREES(ACOS(SIN(RADIANS(R2C2))*SIN(RADIANS(RC[-10]))+COS(RADIANS(R2C2))*COS(RADIANS(RC[-10]))*COS(RADIANS(RC[-1])))) -> 64.262465746076629 | AE251: =90-RC[-1] -> 25.737534253923371 | AF251: =IF(RC[-1]>85,0,IF(RC[-1]>5,58.1/TAN(RADIANS(RC[-1]))-0.07/POWER(TAN(RADIANS(RC[-1])),3)+0.000086/POWER(TAN(RADIANS(RC[-1])),5),IF(RC[-1]>-0.575,1735+RC[-1]*(-518.2+RC[-1]*(103.4+RC[-1]*(-12.79+RC[-1]*0.711))),-20.772/TAN(RADIANS(RC[-1])))))/3600 -> 3.3305348005239842E-2 | AG251: =RC[-2]+RC[-1] -> 25.770839601928611 | AH251: =IF(RC[-5]>0,MOD(DEGREES(ACOS(((SIN(RADIANS(R2C2))*COS(RADIANS(RC[-4])))-SIN(RADIANS(RC[-14])))/(COS(RADIANS(R2C2))*SIN(RADIANS(RC[-4])))))+180,360),MOD(540-DEGREES(ACOS(((SIN(RADIANS(R2C2))*COS(RADIANS(RC[-4])))-SIN(RADIANS(RC[-14])))/(COS(RADIANS(R2C2))*SIN(RADIANS(RC[-4]))))),360)) -> 181.7019358961837
D252: =R[-1]C+1 -> 2017-09-08T00:00:00.000 | E252: =R5C2 -> 1899-12-31T14:00:00.000 | F252: =RC[-2]+2415018.5+RC[-1]-R4C2/24 -> 2458005.375 | G252: =(RC[-1]-2451545)/36525 -> 0.1768754277891855 | I252: =MOD(280.46646+RC[-2]*(36000.76983 + RC[-2]*0.0003032),360) -> 168.11803390683872 | J252: =357.52911+RC[-3]*(35999.05029 - 0.0001537*RC[-3]) -> 6724.8765252396615 | K252: =0.016708634-RC[-4]*(0.000042037+0.0000001267*RC[-4]) -> 1.6701194723843047E-2 | L252: =SIN(RADIANS(RC[-2]))*(1.914602-RC[-5]*(0.004817+0.000014*RC[-5]))+SIN(RADIANS(2*RC[-2]))*(0.019993-0.000101*RC[-5])+SIN(RADIANS(3*RC[-2]))*0.000289 -> -1.7172690979859038 | M252: =RC[-4]+RC[-1] -> 166.40076480885281 | N252: =RC[-4]+RC[-2] -> 6723.1592561416755 | O252: =(1.000001018*(1-RC[-4]*RC[-4]))/(1+RC[-4]*COS(RADIANS(RC[-1]))) -> 1.0073180642745541 | P252: =RC[-3]-0.00569-0.00478*SIN(RADIANS(125.04-1934.136*RC[-9])) -> 166.39219406157781 | Q252: =23+(26+((21.448-RC[-10]*(46.815+RC[-10]*(0.00059-RC[-10]*0.001813))))/60)/60 -> 23.436990991228402 | R252: =RC[-1]+0.00256*COS(RADIANS(125.04-1934.136*RC[-11])) -> 23.434948129296878 | S252: =DEGREES(ATAN2(COS(RADIANS(RC[-3])),COS(RADIANS(RC[-1]))*SIN(RADIANS(RC[-3])))) -> 167.47776274697998 | T252: =DEGREES(ASIN(SIN(RADIANS(RC[-2]))*SIN(RADIANS(RC[-4])))) -> 5.3690473313570513 | U252: =TAN(RADIANS(RC[-3]/2))*TAN(RADIANS(RC[-3]/2)) -> 4.3018129879217444E-2 | V252: =4*DEGREES(RC[-1]*SIN(2*RADIANS(RC[-13]))-2*RC[-11]*SIN(RADIANS(RC[-12]))+4*RC[-11]*RC[-1]*SIN(RADIANS(RC[-12]))*COS(2*RADIANS(RC[-13]))-0.5*RC[-1]*RC[-1]*SIN(4*RADIANS(RC[-13]))-1.25*RC[-11]*RC[-11]*SIN(2*RADIANS(RC[-12]))) -> 2.5073728653559622 | W252: =DEGREES(ACOS(COS(RADIANS(90.833))/(COS(RADIANS(R2C2))*COS(RADIANS(RC[-3])))-TAN(RADIANS(R2C2))*TAN(RADIANS(RC[-3])))) -> 107.5122351457601 | X252: =(720-4*R3C2-RC[-2]+R4C2*60)/1440 -> 1899-12-31T13:53:29.558 | Y252: =(RC[-1]*1440-RC[-2]*4)/1440 -> 1899-12-31T06:43:26.621 | Z252: =(RC[-2]*1440+RC[-3]*4)/1440 -> 1899-12-31T21:03:32.494 | AA252: =8*RC[-4] -> 860.09788116608081 | AB252: =MOD(RC[-23]*1440+RC[-6]+4*R3C2-60*R4C2,1440) -> 726.50737286535593 | AC252: =IF(RC[-1]/4<0,RC[-1]/4+180,RC[-1]/4-180) -> 1.6268432163389832 | AD252: =DEGREES(ACOS(SIN(RADIANS(R2C2))*SIN(RADIANS(RC[-10]))+COS(RADIANS(R2C2))*COS(RADIANS(RC[-10]))*COS(RADIANS(RC[-1])))) -> 64.639655804177607 | AE252: =90-RC[-1] -> 25.360344195822393 | AF252: =IF(RC[-1]>85,0,IF(RC[-1]>5,58.1/TAN(RADIANS(RC[-1]))-0.07/POWER(TAN(RADIANS(RC[-1])),3)+0.000086/POWER(TAN(RADIANS(RC[-1])),5),IF(RC[-1]>-0.575,1735+RC[-1]*(-518.2+RC[-1]*(103.4+RC[-1]*(-12.79+RC[-1]*0.711))),-20.772/TAN(RADIANS(RC[-1])))))/3600 -> 3.3867622143165188E-2 | AG252: =RC[-2]+RC[-1] -> 25.394211817965559 | AH252: =IF(RC[-5]>0,MOD(DEGREES(ACOS(((SIN(RADIANS(R2C2))*COS(RADIANS(RC[-4])))-SIN(RADIANS(RC[-14])))/(COS(RADIANS(R2C2))*SIN(RADIANS(RC[-4])))))+180,360),MOD(540-DEGREES(ACOS(((SIN(RADIANS(R2C2))*COS(RADIANS(RC[-4])))-SIN(RADIANS(RC[-14])))/(COS(RADIANS(R2C2))*SIN(RADIANS(RC[-4]))))),360)) -> 181.79249115224863
D253: =R[-1]C+1 -> 2017-09-09T00:00:00.000 | E253: =R5C2 -> 1899-12-31T14:00:00.000 | F253: =RC[-2]+2415018.5+RC[-1]-R4C2/24 -> 2458006.375 | G253: =(RC[-1]-2451545)/36525 -> 0.17690280629705682 | I253: =MOD(280.46646+RC[-2]*(36000.76983 + RC[-2]*0.0003032),360) -> 169.10368126994035 | J253: =357.52911+RC[-3]*(35999.05029 - 0.0001537*RC[-3]) -> 6725.8621255198968 | K253: =0.016708634-RC[-4]*(0.000042037+0.0000001267*RC[-4]) -> 1.6701193571705505E-2 | L253: =SIN(RADIANS(RC[-2]))*(1.914602-RC[-5]*(0.004817+0.000014*RC[-5]))+SIN(RADIANS(2*RC[-2]))*(0.019993-0.000101*RC[-5])+SIN(RADIANS(3*RC[-2]))*0.000289 -> -1.7314230458097897 | M253: =RC[-4]+RC[-1] -> 167.37225822413058 | N253: =RC[-4]+RC[-2] -> 6724.1307024740872 | O253: =(1.000001018*(1-RC[-4]*RC[-4]))/(1+RC[-4]*COS(RADIANS(RC[-1]))) -> 1.0070605984412451 | P253: =RC[-3]-0.00569-0.00478*SIN(RADIANS(125.04-1934.136*RC[-9])) -> 167.36368395274567 | Q253: =23+(26+((21.448-RC[-10]*(46.815+RC[-10]*(0.00059-RC[-10]*0.001813))))/60)/60 -> 23.436990635193428 | R253: =RC[-1]+0.00256*COS(RADIANS(125.04-1934.136*RC[-11])) -> 23.434949200041775 | S253: =DEGREES(ATAN2(COS(RADIANS(RC[-3])),COS(RADIANS(RC[-1]))*SIN(RADIANS(RC[-3])))) -> 168.37644617339862 | T253: =DEGREES(ASIN(SIN(RADIANS(RC[-2]))*SIN(RADIANS(RC[-4])))) -> 4.9912279666303583 | U253: =TAN(RADIANS(RC[-3]/2))*TAN(RADIANS(RC[-3]/2)) -> 4.3018133922005861E-2 | V253: =4*DEGREES(RC[-1]*SIN(2*RADIANS(RC[-13]))-2*RC[-11]*SIN(RADIANS(RC[-12]))+4*RC[-11]*RC[-1]*SIN(RADIANS(RC[-12]))*COS(2*RADIANS(RC[-13]))-0.5*RC[-1]*RC[-1]*SIN(4*RADIANS(RC[-13]))-1.25*RC[-11]*RC[-11]*SIN(2*RADIANS(RC[-12]))) -> 2.854240529944247 | W253: =DEGREES(ACOS(COS(RADIANS(90.833))/(COS(RADIANS(R2C2))*COS(RADIANS(RC[-3])))-TAN(RADIANS(R2C2))*TAN(RADIANS(RC[-3])))) -> 106.41649195044846 | X253: =(720-4*R3C2-RC[-2]+R4C2*60)/1440 -> 1899-12-31T13:53:08.746 | Y253: =(RC[-1]*1440-RC[-2]*4)/1440 -> 1899-12-31T06:47:28.788 | Z253: =(RC[-2]*1440+RC[-3]*4)/1440 -> 1899-12-31T20:58:48.704 | AA253: =8*RC[-4] -> 851.33193560358768 | AB253: =MOD(RC[-23]*1440+RC[-6]+4*R3C2-60*R4C2,1440) -> 726.85424052994426 | AC253: =IF(RC[-1]/4<0,RC[-1]/4+180,RC[-1]/4-180) -> 1.7135601324860659 | AD253: =DEGREES(ACOS(SIN(RADIANS(R2C2))*SIN(RADIANS(RC[-10]))+COS(RADIANS(R2C2))*COS(RADIANS(RC[-10]))*COS(RADIANS(RC[-1])))) -> 65.018403483922995 | AE253: =90-RC[-1] -> 24.981596516077005 | AF253: =IF(RC[-1]>85,0,IF(RC[-1]>5,58.1/TAN(RADIANS(RC[-1]))-0.07/POWER(TAN(RADIANS(RC[-1])),3)+0.000086/POWER(TAN(RADIANS(RC[-1])),5),IF(RC[-1]>-0.575,1735+RC[-1]*(-518.2+RC[-1]*(103.4+RC[-1]*(-12.79+RC[-1]*0.711))),-20.772/TAN(RADIANS(RC[-1])))))/3600 -> 3.4447838836293196E-2 | AG253: =RC[-2]+RC[-1] -> 25.016044354913298 | AH253: =IF(RC[-5]>0,MOD(DEGREES(ACOS(((SIN(RADIANS(R2C2))*COS(RADIANS(RC[-4])))-SIN(RADIANS(RC[-14])))/(COS(RADIANS(R2C2))*SIN(RADIANS(RC[-4])))))+180,360),MOD(540-DEGREES(ACOS(((SIN(RADIANS(R2C2))*COS(RADIANS(RC[-4])))-SIN(RADIANS(RC[-14])))/(COS(RADIANS(R2C2))*SIN(RADIANS(RC[-4]))))),360)) -> 181.88331132753112
D254: =R[-1]C+1 -> 2017-09-10T00:00:00.000 | E254: =R5C2 -> 1899-12-31T14:00:00.000 | F254: =RC[-2]+2415018.5+RC[-1]-R4C2/24 -> 2458007.375 | G254: =(RC[-1]-2451545)/36525 -> 0.17693018480492814 | I254: =MOD(280.46646+RC[-2]*(36000.76983 + RC[-2]*0.0003032),360) -> 170.08932863304199 | J254: =357.52911+RC[-3]*(35999.05029 - 0.0001537*RC[-3]) -> 6726.847725800133 | K254: =0.016708634-RC[-4]*(0.000042037+0.0000001267*RC[-4]) -> 1.6701192419567776E-2 | L254: =SIN(RADIANS(RC[-2]))*(1.914602-RC[-5]*(0.004817+0.000014*RC[-5]))+SIN(RADIANS(2*RC[-2]))*(0.019993-0.000101*RC[-5])+SIN(RADIANS(3*RC[-2]))*0.000289 -> -1.7450781024594124 | M254: =RC[-4]+RC[-1] -> 168.34425053058257 | N254: =RC[-4]+RC[-2] -> 6725.102647697674 | O254: =(1.000001018*(1-RC[-4]*RC[-4]))/(1+RC[-4]*COS(RADIANS(RC[-1]))) -> 1.0068010065345572 | P254: =RC[-3]-0.00569-0.00478*SIN(RADIANS(125.04-1934.136*RC[-9])) -> 168.33567273755145 | Q254: =23+(26+((21.448-RC[-10]*(46.815+RC[-10]*(0.00059-RC[-10]*0.001813))))/60)/60 -> 23.436990279158454 | R254: =RC[-1]+0.00256*COS(RADIANS(125.04-1934.136*RC[-11])) -> 23.434950272530415 | S254: =DEGREES(ATAN2(COS(RADIANS(RC[-3])),COS(RADIANS(RC[-1]))*SIN(RADIANS(RC[-3])))) -> 169.27455415624161 | T254: =DEGREES(ASIN(SIN(RADIANS(RC[-2]))*SIN(RADIANS(RC[-4])))) -> 4.6119933219151932 | U254: =TAN(RADIANS(RC[-3]/2))*TAN(RADIANS(RC[-3]/2)) -> 4.3018137971378288E-2 | V254: =4*DEGREES(RC[-1]*SIN(2*RADIANS(RC[-13]))-2*RC[-11]*SIN(RADIANS(RC[-12]))+4*RC[-11]*RC[-1]*SIN(RADIANS(RC[-12]))*COS(2*RADIANS(RC[-13]))-0.5*RC[-1]*RC[-1]*SIN(4*RADIANS(RC[-13]))-1.25*RC[-11]*RC[-11]*SIN(2*RADIANS(RC[-12]))) -> 3.2034592414617369 | W254: =DEGREES(ACOS(COS(RADIANS(90.833))/(COS(RADIANS(R2C2))*COS(RADIANS(RC[-3])))-TAN(RADIANS(R2C2))*TAN(RADIANS(RC[-3])))) -> 105.32418722678449 | X254: =(720-4*R3C2-RC[-2]+R4C2*60)/1440 -> 1899-12-31T13:52:47.792 | Y254: =(RC[-1]*1440-RC[-2]*4)/1440 -> 1899-12-31T06:51:29.988 | Z254: =(RC[-2]*1440+RC[-3]*4)/1440 -> 1899-12-31T20:54:05.597 | AA254: =8*RC[-4] -> 842.59349781427591 | AB254: =MOD(RC[-23]*1440+RC[-6]+4*R3C2-60*R4C2,1440) -> 727.2034592414617 | AC254: =IF(RC[-1]/4<0,RC[-1]/4+180,RC[-1]/4-180) -> 1.8008648103654252 | AD254: =DEGREES(ACOS(SIN(RADIANS(R2C2))*SIN(RADIANS(RC[-10]))+COS(RADIANS(R2C2))*COS(RADIANS(RC[-10]))*COS(RADIANS(RC[-1])))) -> 65.398617855294162 | AE254: =90-RC[-1] -> 24.601382144705838 | AF254: =IF(RC[-1]>85,0,IF(RC[-1]>5,58.1/TAN(RADIANS(RC[-1]))-0.07/POWER(TAN(RADIANS(RC[-1])),3)+0.000086/POWER(TAN(RADIANS(RC[-1])),5),IF(RC[-1]>-0.575,1735+RC[-1]*(-518.2+RC[-1]*(103.4+RC[-1]*(-12.79+RC[-1]*0.711))),-20.772/TAN(RADIANS(RC[-1])))))/3600 -> 3.5046757410355817E-2 | AG254: =RC[-2]+RC[-1] -> 24.636428902116194 | AH254: =IF(RC[-5]>0,MOD(DEGREES(ACOS(((SIN(RADIANS(R2C2))*COS(RADIANS(RC[-4])))-SIN(RADIANS(RC[-14])))/(COS(RADIANS(R2C2))*SIN(RADIANS(RC[-4])))))+180,360),MOD(540-DEGREES(ACOS(((SIN(RADIANS(R2C2))*COS(RADIANS(RC[-4])))-SIN(RADIANS(RC[-14])))/(COS(RADIANS(R2C2))*SIN(RADIANS(RC[-4]))))),360)) -> 181.97430922603067
D255: =R[-1]C+1 -> 2017-09-11T00:00:00.000 | E255: =R5C2 -> 1899-12-31T14:00:00.000 | F255: =RC[-2]+2415018.5+RC[-1]-R4C2/24 -> 2458008.375 | G255: =(RC[-1]-2451545)/36525 -> 0.17695756331279947 | I255: =MOD(280.46646+RC[-2]*(36000.76983 + RC[-2]*0.0003032),360) -> 171.07497599614271 | J255: =357.52911+RC[-3]*(35999.05029 - 0.0001537*RC[-3]) -> 6727.8333260803684 | K255: =0.016708634-RC[-4]*(0.000042037+0.0000001267*RC[-4]) -> 1.6701191267429853E-2 | L255: =SIN(RADIANS(RC[-2]))*(1.914602-RC[-5]*(0.004817+0.000014*RC[-5]))+SIN(RADIANS(2*RC[-2]))*(0.019993-0.000101*RC[-5])+SIN(RADIANS(3*RC[-2]))*0.000289 -> -1.7582298470925755 | M255: =RC[-4]+RC[-1] -> 169.31674614905015 | N255: =RC[-4]+RC[-2] -> 6726.0750962332759 | O255: =(1.000001018*(1-RC[-4]*RC[-4]))/(1+RC[-4]*COS(RADIANS(RC[-1]))) -> 1.0065393621777428 | P255: =RC[-3]-0.00569-0.00478*SIN(RADIANS(125.04-1934.136*RC[-9])) -> 169.30816483683952 | Q255: =23+(26+((21.448-RC[-10]*(46.815+RC[-10]*(0.00059-RC[-10]*0.001813))))/60)/60 -> 23.436989923123484 | R255: =RC[-1]+0.00256*COS(RADIANS(125.04-1934.136*RC[-11])) -> 23.43495134676159 | S255: =DEGREES(ATAN2(COS(RADIANS(RC[-3])),COS(RADIANS(RC[-1]))*SIN(RADIANS(RC[-3])))) -> 170.17216649586416 | T255: =DEGREES(ASIN(SIN(RADIANS(RC[-2]))*SIN(RADIANS(RC[-4])))) -> 4.2314343427948629 | U255: =TAN(RADIANS(RC[-3]/2))*TAN(RADIANS(RC[-3]/2)) -> 4.3018142027330182E-2 | V255: =4*DEGREES(RC[-1]*SIN(2*RADIANS(RC[-13]))-2*RC[-11]*SIN(RADIANS(RC[-12]))+4*RC[-11]*RC[-1]*SIN(RADIANS(RC[-12]))*COS(2*RADIANS(RC[-13]))-0.5*RC[-1]*RC[-1]*SIN(4*RADIANS(RC[-13]))-1.25*RC[-11]*RC[-11]*SIN(2*RADIANS(RC[-12]))) -> 3.5547191074024478 | W255: =DEGREES(ACOS(COS(RADIANS(90.833))/(COS(RADIANS(R2C2))*COS(RADIANS(RC[-3])))-TAN(RADIANS(R2C2))*TAN(RADIANS(RC[-3])))) -> 104.23504860419267 | X255: =(720-4*R3C2-RC[-2]+R4C2*60)/1440 -> 1899-12-31T13:52:26.717 | Y255: =(RC[-1]*1440-RC[-2]*4)/1440 -> 1899-12-31T06:55:30.305 | Z255: =(RC[-2]*1440+RC[-3]*4)/1440 -> 1899-12-31T20:49:23.129 | AA255: =8*RC[-4] -> 833.88038883354136 | AB255: =MOD(RC[-23]*1440+RC[-6]+4*R3C2-60*R4C2,1440) -> 727.55471910740243 | AC255: =IF(RC[-1]/4<0,RC[-1]/4+180,RC[-1]/4-180) -> 1.8886797768506085 | AD255: =DEGREES(ACOS(SIN(RADIANS(R2C2))*SIN(RADIANS(RC[-10]))+COS(RADIANS(R2C2))*COS(RADIANS(RC[-10]))*COS(RADIANS(RC[-1])))) -> 65.78020762042587 | AE255: =90-RC[-1] -> 24.21979237957413 | AF255: =IF(RC[-1]>85,0,IF(RC[-1]>5,58.1/TAN(RADIANS(RC[-1]))-0.07/POWER(TAN(RADIANS(RC[-1])),3)+0.000086/POWER(TAN(RADIANS(RC[-1])),5),IF(RC[-1]>-0.575,1735+RC[-1]*(-518.2+RC[-1]*(103.4+RC[-1]*(-12.79+RC[-1]*0.711))),-20.772/TAN(RADIANS(RC[-1])))))/3600 -> 3.5665181588556943E-2 | AG255: =RC[-2]+RC[-1] -> 24.255457561162686 | AH255: =IF(RC[-5]>0,MOD(DEGREES(ACOS(((SIN(RADIANS(R2C2))*COS(RADIANS(RC[-4])))-SIN(RADIANS(RC[-14])))/(COS(RADIANS(R2C2))*SIN(RADIANS(RC[-4])))))+180,360),MOD(540-DEGREES(ACOS(((SIN(RADIANS(R2C2))*COS(RADIANS(RC[-4])))-SIN(RADIANS(RC[-14])))/(COS(RADIANS(R2C2))*SIN(RADIANS(RC[-4]))))),360)) -> 182.0653978428499
D256: =R[-1]C+1 -> 2017-09-12T00:00:00.000 | E256: =R5C2 -> 1899-12-31T14:00:00.000 | F256: =RC[-2]+2415018.5+RC[-1]-R4C2/24 -> 2458009.375 | G256: =(RC[-1]-2451545)/36525 -> 0.17698494182067076 | I256: =MOD(280.46646+RC[-2]*(36000.76983 + RC[-2]*0.0003032),360) -> 172.06062335924435 | J256: =357.52911+RC[-3]*(35999.05029 - 0.0001537*RC[-3]) -> 6728.8189263606027 | K256: =0.016708634-RC[-4]*(0.000042037+0.0000001267*RC[-4]) -> 1.6701190115291743E-2 | L256: =SIN(RADIANS(RC[-2]))*(1.914602-RC[-5]*(0.004817+0.000014*RC[-5]))+SIN(RADIANS(2*RC[-2]))*(0.019993-0.000101*RC[-5])+SIN(RADIANS(3*RC[-2]))*0.000289 -> -1.7708739919872925 | M256: =RC[-4]+RC[-1] -> 170.28974936725706 | N256: =RC[-4]+RC[-2] -> 6727.0480523686156 | O256: =(1.000001018*(1-RC[-4]*RC[-4]))/(1+RC[-4]*COS(RADIANS(RC[-1]))) -> 1.0062757396922621 | P256: =RC[-3]-0.00569-0.00478*SIN(RADIANS(125.04-1934.136*RC[-9])) -> 170.28116453833661 | Q256: =23+(26+((21.448-RC[-10]*(46.815+RC[-10]*(0.00059-RC[-10]*0.001813))))/60)/60 -> 23.43698956708851 | R256: =RC[-1]+0.00256*COS(RADIANS(125.04-1934.136*RC[-11])) -> 23.434952422734067 | S256: =DEGREES(ATAN2(COS(RADIANS(RC[-3])),COS(RADIANS(RC[-1]))*SIN(RADIANS(RC[-3])))) -> 171.06936370748431 | T256: =DEGREES(ASIN(SIN(RADIANS(RC[-2]))*SIN(RADIANS(RC[-4])))) -> 3.8496421793847548 | U256: =TAN(RADIANS(RC[-3]/2))*TAN(RADIANS(RC[-3]/2)) -> 4.3018146089856886E-2 | V256: =4*DEGREES(RC[-1]*SIN(2*RADIANS(RC[-13]))-2*RC[-11]*SIN(RADIANS(RC[-12]))+4*RC[-11]*RC[-1]*SIN(RADIANS(RC[-12]))*COS(2*RADIANS(RC[-13]))-0.5*RC[-1]*RC[-1]*SIN(4*RADIANS(RC[-13]))-1.25*RC[-11]*RC[-11]*SIN(2*RADIANS(RC[-12]))) -> 3.9077073806577087 | W256: =DEGREES(ACOS(COS(RADIANS(90.833))/(COS(RADIANS(R2C2))*COS(RADIANS(RC[-3])))-TAN(RADIANS(R2C2))*TAN(RADIANS(RC[-3])))) -> 103.14881208019989 | X256: =(720-4*R3C2-RC[-2]+R4C2*60)/1440 -> 1899-12-31T13:52:05.538 | Y256: =(RC[-1]*1440-RC[-2]*4)/1440 -> 1899-12-31T06:59:29.823 | Z256: =(RC[-2]*1440+RC[-3]*4)/1440 -> 1899-12-31T20:44:41.252 | AA256: =8*RC[-4] -> 825.19049664159911 | AB256: =MOD(RC[-23]*1440+RC[-6]+4*R3C2-60*R4C2,1440) -> 727.90770738065771 | AC256: =IF(RC[-1]/4<0,RC[-1]/4+180,RC[-1]/4-180) -> 1.976926845164428 | AD256: =DEGREES(ACOS(SIN(RADIANS(R2C2))*SIN(RADIANS(RC[-10]))+COS(RADIANS(R2C2))*COS(RADIANS(RC[-10]))*COS(RADIANS(RC[-1])))) -> 66.16308109931758 | AE256: =90-RC[-1] -> 23.83691890068242 | AF256: =IF(RC[-1]>85,0,IF(RC[-1]>5,58.1/TAN(RADIANS(RC[-1]))-0.07/POWER(TAN(RADIANS(RC[-1])),3)+0.000086/POWER(TAN(RADIANS(RC[-1])),5),IF(RC[-1]>-0.575,1735+RC[-1]*(-518.2+RC[-1]*(103.4+RC[-1]*(-12.79+RC[-1]*0.711))),-20.772/TAN(RADIANS(RC[-1])))))/3600 -> 3.6303962565328467E-2 | AG256: =RC[-2]+RC[-1] -> 23.873222863247747 | AH256: =IF(RC[-5]>0,MOD(DEGREES(ACOS(((SIN(RADIANS(R2C2))*COS(RADIANS(RC[-4])))-SIN(RADIANS(RC[-14])))/(COS(RADIANS(R2C2))*SIN(RADIANS(RC[-4])))))+180,360),MOD(540-DEGREES(ACOS(((SIN(RADIANS(R2C2))*COS(RADIANS(RC[-4])))-SIN(RADIANS(RC[-14])))/(COS(RADIANS(R2C2))*SIN(RADIANS(RC[-4]))))),360)) -> 182.15649040032648
D257: =R[-1]C+1 -> 2017-09-13T00:00:00.000 | E257: =R5C2 -> 1899-12-31T14:00:00.000 | F257: =RC[-2]+2415018.5+RC[-1]-R4C2/24 -> 2458010.375 | G257: =(RC[-1]-2451545)/36525 -> 0.17701232032854208 | I257: =MOD(280.46646+RC[-2]*(36000.76983 + RC[-2]*0.0003032),360) -> 173.0462707223478 | J257: =357.52911+RC[-3]*(35999.05029 - 0.0001537*RC[-3]) -> 6729.804526640839 | K257: =0.016708634-RC[-4]*(0.000042037+0.0000001267*RC[-4]) -> 1.6701188963153441E-2 | L257: =SIN(RADIANS(RC[-2]))*(1.914602-RC[-5]*(0.004817+0.000014*RC[-5]))+SIN(RADIANS(2*RC[-2]))*(0.019993-0.000101*RC[-5])+SIN(RADIANS(3*RC[-2]))*0.000289 -> -1.7830063842309793 | M257: =RC[-4]+RC[-1] -> 171.26326433811681 | N257: =RC[-4]+RC[-2] -> 6728.0215202566078 | O257: =(1.000001018*(1-RC[-4]*RC[-4]))/(1+RC[-4]*COS(RADIANS(RC[-1]))) -> 1.0060102140795484 | P257: =RC[-3]-0.00569-0.00478*SIN(RADIANS(125.04-1934.136*RC[-9])) -> 171.25467599495923 | Q257: =23+(26+((21.448-RC[-10]*(46.815+RC[-10]*(0.00059-RC[-10]*0.001813))))/60)/60 -> 23.43698921105354 | R257: =RC[-1]+0.00256*COS(RADIANS(125.04-1934.136*RC[-11])) -> 23.434953500446632 | S257: =DEGREES(ATAN2(COS(RADIANS(RC[-3])),COS(RADIANS(RC[-1]))*SIN(RADIANS(RC[-3])))) -> 171.96622697222855 | T257: =DEGREES(ASIN(SIN(RADIANS(RC[-2]))*SIN(RADIANS(RC[-4])))) -> 3.4667081991426967 | U257: =TAN(RADIANS(RC[-3]/2))*TAN(RADIANS(RC[-3]/2)) -> 4.30181501589538E-2 | V257: =4*DEGREES(RC[-1]*SIN(2*RADIANS(RC[-13]))-2*RC[-11]*SIN(RADIANS(RC[-12]))+4*RC[-11]*RC[-1]*SIN(RADIANS(RC[-12]))*COS(2*RADIANS(RC[-13]))-0.5*RC[-1]*RC[-1]*SIN(4*RADIANS(RC[-13]))-1.25*RC[-11]*RC[-11]*SIN(2*RADIANS(RC[-12]))) -> 4.2621085779204284 | W257: =DEGREES(ACOS(COS(RADIANS(90.833))/(COS(RADIANS(R2C2))*COS(RADIANS(RC[-3])))-TAN(RADIANS(R2C2))*TAN(RADIANS(RC[-3])))) -> 102.06522120043572 | X257: =(720-4*R3C2-RC[-2]+R4C2*60)/1440 -> 1899-12-31T13:51:44.273 | Y257: =(RC[-1]*1440-RC[-2]*4)/1440 -> 1899-12-31T07:03:28.620 | Z257: =(RC[-2]*1440+RC[-3]*4)/1440 -> 1899-12-31T20:39:59.927 | AA257: =8*RC[-4] -> 816.52176960348572 | AB257: =MOD(RC[-23]*1440+RC[-6]+4*R3C2-60*R4C2,1440) -> 728.26210857792046 | AC257: =IF(RC[-1]/4<0,RC[-1]/4+180,RC[-1]/4-180) -> 2.0655271444801144 | AD257: =DEGREES(ACOS(SIN(RADIANS(R2C2))*SIN(RADIANS(RC[-10]))+COS(RADIANS(R2C2))*COS(RADIANS(RC[-10]))*COS(RADIANS(RC[-1])))) -> 66.547146215445025 | AE257: =90-RC[-1] -> 23.452853784554975 | AF257: =IF(RC[-1]>85,0,IF(RC[-1]>5,58.1/TAN(RADIANS(RC[-1]))-0.07/POWER(TAN(RADIANS(RC[-1])),3)+0.000086/POWER(TAN(RADIANS(RC[-1])),5),IF(RC[-1]>-0.575,1735+RC[-1]*(-518.2+RC[-1]*(103.4+RC[-1]*(-12.79+RC[-1]*0.711))),-20.772/TAN(RADIANS(RC[-1])))))/3600 -> 3.696400233277472E-2 | AG257: =RC[-2]+RC[-1] -> 23.489817786887748 | AH257: =IF(RC[-5]>0,MOD(DEGREES(ACOS(((SIN(RADIANS(R2C2))*COS(RADIANS(RC[-4])))-SIN(RADIANS(RC[-14])))/(COS(RADIANS(R2C2))*SIN(RADIANS(RC[-4])))))+180,360),MOD(540-DEGREES(ACOS(((SIN(RADIANS(R2C2))*COS(RADIANS(RC[-4])))-SIN(RADIANS(RC[-14])))/(COS(RADIANS(R2C2))*SIN(RADIANS(RC[-4]))))),360)) -> 182.24750038196501
D258: =R[-1]C+1 -> 2017-09-14T00:00:00.000 | E258: =R5C2 -> 1899-12-31T14:00:00.000 | F258: =RC[-2]+2415018.5+RC[-1]-R4C2/24 -> 2458011.375 | G258: =(RC[-1]-2451545)/36525 -> 0.17703969883641341 | I258: =MOD(280.46646+RC[-2]*(36000.76983 + RC[-2]*0.0003032),360) -> 174.03191808545125 | J258: =357.52911+RC[-3]*(35999.05029 - 0.0001537*RC[-3]) -> 6730.7901269210724 | K258: =0.016708634-RC[-4]*(0.000042037+0.0000001267*RC[-4]) -> 1.6701187811014949E-2 | L258: =SIN(RADIANS(RC[-2]))*(1.914602-RC[-5]*(0.004817+0.000014*RC[-5]))+SIN(RADIANS(2*RC[-2]))*(0.019993-0.000101*RC[-5])+SIN(RADIANS(3*RC[-2]))*0.000289 -> -1.7946230073889362 | M258: =RC[-4]+RC[-1] -> 172.23729507806232 | N258: =RC[-4]+RC[-2] -> 6728.9955039136839 | O258: =(1.000001018*(1-RC[-4]*RC[-4]))/(1+RC[-4]*COS(RADIANS(RC[-1]))) -> 1.0057428610024783 | P258: =RC[-3]-0.00569-0.00478*SIN(RADIANS(125.04-1934.136*RC[-9])) -> 172.2287032231433 | Q258: =23+(26+((21.448-RC[-10]*(46.815+RC[-10]*(0.00059-RC[-10]*0.001813))))/60)/60 -> 23.436988855018569 | R258: =RC[-1]+0.00256*COS(RADIANS(125.04-1934.136*RC[-11])) -> 23.434954579898058 | S258: =DEGREES(ATAN2(COS(RADIANS(RC[-3])),COS(RADIANS(RC[-1]))*SIN(RADIANS(RC[-3])))) -> 172.86283808858016 | T258: =DEGREES(ASIN(SIN(RADIANS(RC[-2]))*SIN(RADIANS(RC[-4])))) -> 3.0827240002124441 | U258: =TAN(RADIANS(RC[-3]/2))*TAN(RADIANS(RC[-3]/2)) -> 4.3018154234616322E-2 | V258: =4*DEGREES(RC[-1]*SIN(2*RADIANS(RC[-13]))-2*RC[-11]*SIN(RADIANS(RC[-12]))+4*RC[-11]*RC[-1]*SIN(RADIANS(RC[-12]))*COS(2*RADIANS(RC[-13]))-0.5*RC[-1]*RC[-1]*SIN(4*RADIANS(RC[-13]))-1.25*RC[-11]*RC[-11]*SIN(2*RADIANS(RC[-12]))) -> 4.6176045946586166 | W258: =DEGREES(ACOS(COS(RADIANS(90.833))/(COS(RADIANS(R2C2))*COS(RADIANS(RC[-3])))-TAN(RADIANS(R2C2))*TAN(RADIANS(RC[-3])))) -> 100.98402631128342 | X258: =(720-4*R3C2-RC[-2]+R4C2*60)/1440 -> 1899-12-31T13:51:22.944 | Y258: =(RC[-1]*1440-RC[-2]*4)/1440 -> 1899-12-31T07:07:26.777 | Z258: =(RC[-2]*1440+RC[-3]*4)/1440 -> 1899-12-31T20:35:19.110 | AA258: =8*RC[-4] -> 807.87221049026732 | AB258: =MOD(RC[-23]*1440+RC[-6]+4*R3C2-60*R4C2,1440) -> 728.61760459465859 | AC258: =IF(RC[-1]/4<0,RC[-1]/4+180,RC[-1]/4-180) -> 2.1544011486646468 | AD258: =DEGREES(ACOS(SIN(RADIANS(R2C2))*SIN(RADIANS(RC[-10]))+COS(RADIANS(R2C2))*COS(RADIANS(RC[-10]))*COS(RADIANS(RC[-1])))) -> 66.93231048133535 | AE258: =90-RC[-1] -> 23.06768951866465 | AF258: =IF(RC[-1]>85,0,IF(RC[-1]>5,58.1/TAN(RADIANS(RC[-1]))-0.07/POWER(TAN(RADIANS(RC[-1])),3)+0.000086/POWER(TAN(RADIANS(RC[-1])),5),IF(RC[-1]>-0.575,1735+RC[-1]*(-518.2+RC[-1]*(103.4+RC[-1]*(-12.79+RC[-1]*0.711))),-20.772/TAN(RADIANS(RC[-1])))))/3600 -> 3.7646257283561392E-2 | AG258: =RC[-2]+RC[-1] -> 23.105335775948213 | AH258: =IF(RC[-5]>0,MOD(DEGREES(ACOS(((SIN(RADIANS(R2C2))*COS(RADIANS(RC[-4])))-SIN(RADIANS(RC[-14])))/(COS(RADIANS(R2C2))*SIN(RADIANS(RC[-4])))))+180,360),MOD(540-DEGREES(ACOS(((SIN(RADIANS(R2C2))*COS(RADIANS(RC[-4])))-SIN(RADIANS(RC[-14])))/(COS(RADIANS(R2C2))*SIN(RADIANS(RC[-4]))))),360)) -> 182.33834156447503
D259: =R[-1]C+1 -> 2017-09-15T00:00:00.000 | E259: =R5C2 -> 1899-12-31T14:00:00.000 | F259: =RC[-2]+2415018.5+RC[-1]-R4C2/24 -> 2458012.375 | G259: =(RC[-1]-2451545)/36525 -> 0.17706707734428473 | I259: =MOD(280.46646+RC[-2]*(36000.76983 + RC[-2]*0.0003032),360) -> 175.01756544855471 | J259: =357.52911+RC[-3]*(35999.05029 - 0.0001537*RC[-3]) -> 6731.7757272013077 | K259: =0.016708634-RC[-4]*(0.000042037+0.0000001267*RC[-4]) -> 1.6701186658876269E-2 | L259: =SIN(RADIANS(RC[-2]))*(1.914602-RC[-5]*(0.004817+0.000014*RC[-5]))+SIN(RADIANS(2*RC[-2]))*(0.019993-0.000101*RC[-5])+SIN(RADIANS(3*RC[-2]))*0.000289 -> -1.8057199831517168 | M259: =RC[-4]+RC[-1] -> 173.211845465403 | N259: =RC[-4]+RC[-2] -> 6729.9700072181558 | O259: =(1.000001018*(1-RC[-4]*RC[-4]))/(1+RC[-4]*COS(RADIANS(RC[-1]))) -> 1.0054737567665397 | P259: =RC[-3]-0.00569-0.00478*SIN(RADIANS(125.04-1934.136*RC[-9])) -> 173.20325010120126 | Q259: =23+(26+((21.448-RC[-10]*(46.815+RC[-10]*(0.00059-RC[-10]*0.001813))))/60)/60 -> 23.436988498983595 | R259: =RC[-1]+0.00256*COS(RADIANS(125.04-1934.136*RC[-11])) -> 23.434955661087109 | S259: =DEGREES(ATAN2(COS(RADIANS(RC[-3])),COS(RADIANS(RC[-1]))*SIN(RADIANS(RC[-3])))) -> 173.75927942415959 | T259: =DEGREES(ASIN(SIN(RADIANS(RC[-2]))*SIN(RADIANS(RC[-4])))) -> 2.6977814252407182 | U259: =TAN(RADIANS(RC[-3]/2))*TAN(RADIANS(RC[-3]/2)) -> 4.301815831683975E-2 | V259: =4*DEGREES(RC[-1]*SIN(2*RADIANS(RC[-13]))-2*RC[-11]*SIN(RADIANS(RC[-12]))+4*RC[-11]*RC[-1]*SIN(RADIANS(RC[-12]))*COS(2*RADIANS(RC[-13]))-0.5*RC[-1]*RC[-1]*SIN(4*RADIANS(RC[-13]))-1.25*RC[-11]*RC[-11]*SIN(2*RADIANS(RC[-12]))) -> 4.9738748176050356 | W259: =DEGREES(ACOS(COS(RADIANS(90.833))/(COS(RADIANS(R2C2))*COS(RADIANS(RC[-3])))-TAN(RADIANS(R2C2))*TAN(RADIANS(RC[-3])))) -> 99.904983876123708 | X259: =(720-4*R3C2-RC[-2]+R4C2*60)/1440 -> 1899-12-31T13:51:01.568 | Y259: =(RC[-1]*1440-RC[-2]*4)/1440 -> 1899-12-31T07:11:24.371 | Z259: =(RC[-2]*1440+RC[-3]*4)/1440 -> 1899-12-31T20:30:38.764 | AA259: =8*RC[-4] -> 799.23987100898967 | AB259: =MOD(RC[-23]*1440+RC[-6]+4*R3C2-60*R4C2,1440) -> 728.97387481760506 | AC259: =IF(RC[-1]/4<0,RC[-1]/4+180,RC[-1]/4-180) -> 2.2434687044012662 | AD259: =DEGREES(ACOS(SIN(RADIANS(R2C2))*SIN(RADIANS(RC[-10]))+COS(RADIANS(R2C2))*COS(RADIANS(RC[-10]))*COS(RADIANS(RC[-1])))) -> 67.31848098416836 | AE259: =90-RC[-1] -> 22.68151901583164 | AF259: =IF(RC[-1]>85,0,IF(RC[-1]>5,58.1/TAN(RADIANS(RC[-1]))-0.07/POWER(TAN(RADIANS(RC[-1])),3)+0.000086/POWER(TAN(RADIANS(RC[-1])),5),IF(RC[-1]>-0.575,1735+RC[-1]*(-518.2+RC[-1]*(103.4+RC[-1]*(-12.79+RC[-1]*0.711))),-20.772/TAN(RADIANS(RC[-1])))))/3600 -> 3.8351742116494732E-2 | AG259: =RC[-2]+RC[-1] -> 22.719870757948133 | AH259: =IF(RC[-5]>0,MOD(DEGREES(ACOS(((SIN(RADIANS(R2C2))*COS(RADIANS(RC[-4])))-SIN(RADIANS(RC[-14])))/(COS(RADIANS(R2C2))*SIN(RADIANS(RC[-4])))))+180,360),MOD(540-DEGREES(ACOS(((SIN(RADIANS(R2C2))*COS(RADIANS(RC[-4])))-SIN(RADIANS(RC[-14])))/(COS(RADIANS(R2C2))*SIN(RADIANS(RC[-4]))))),360)) -> 182.42892804825132
D260: =R[-1]C+1 -> 2017-09-16T00:00:00.000 | E260: =R5C2 -> 1899-12-31T14:00:00.000 | F260: =RC[-2]+2415018.5+RC[-1]-R4C2/24 -> 2458013.375 | G260: =(RC[-1]-2451545)/36525 -> 0.17709445585215605 | I260: =MOD(280.46646+RC[-2]*(36000.76983 + RC[-2]*0.0003032),360) -> 176.00321281165907 | J260: =357.52911+RC[-3]*(35999.05029 - 0.0001537*RC[-3]) -> 6732.761327481543 | K260: =0.016708634-RC[-4]*(0.000042037+0.0000001267*RC[-4]) -> 1.6701185506737399E-2 | L260: =SIN(RADIANS(RC[-2]))*(1.914602-RC[-5]*(0.004817+0.000014*RC[-5]))+SIN(RADIANS(2*RC[-2]))*(0.019993-0.000101*RC[-5])+SIN(RADIANS(3*RC[-2]))*0.000289 -> -1.8162935729596534 | M260: =RC[-4]+RC[-1] -> 174.1869192386994 | N260: =RC[-4]+RC[-2] -> 6730.9450339085834 | O260: =(1.000001018*(1-RC[-4]*RC[-4]))/(1+RC[-4]*COS(RADIANS(RC[-1]))) -> 1.0052029783007093 | P260: =RC[-3]-0.00569-0.00478*SIN(RADIANS(125.04-1934.136*RC[-9])) -> 174.17832036769664 | Q260: =23+(26+((21.448-RC[-10]*(46.815+RC[-10]*(0.00059-RC[-10]*0.001813))))/60)/60 -> 23.436988142948625 | R260: =RC[-1]+0.00256*COS(RADIANS(125.04-1934.136*RC[-11])) -> 23.43495674401257 | S260: =DEGREES(ATAN2(COS(RADIANS(RC[-3])),COS(RADIANS(RC[-1]))*SIN(RADIANS(RC[-3])))) -> 174.65563386774625 | T260: =DEGREES(ASIN(SIN(RADIANS(RC[-2]))*SIN(RADIANS(RC[-4])))) -> 2.3119725756141545 | U260: =TAN(RADIANS(RC[-3]/2))*TAN(RADIANS(RC[-3]/2)) -> 4.3018162405619516E-2 | V260: =4*DEGREES(RC[-1]*SIN(2*RADIANS(RC[-13]))-2*RC[-11]*SIN(RADIANS(RC[-12]))+4*RC[-11]*RC[-1]*SIN(RADIANS(RC[-12]))*COS(2*RADIANS(RC[-13]))-0.5*RC[-1]*RC[-1]*SIN(4*RADIANS(RC[-13]))-1.25*RC[-11]*RC[-11]*SIN(2*RADIANS(RC[-12]))) -> 5.3305962357372882 | W260: =DEGREES(ACOS(COS(RADIANS(90.833))/(COS(RADIANS(R2C2))*COS(RADIANS(RC[-3])))-TAN(RADIANS(R2C2))*TAN(RADIANS(RC[-3])))) -> 98.827855847238453 | X260: =(720-4*R3C2-RC[-2]+R4C2*60)/1440 -> 1899-12-31T13:50:40.164 | Y260: =(RC[-1]*1440-RC[-2]*4)/1440 -> 1899-12-31T07:15:21.479 | Z260: =(RC[-2]*1440+RC[-3]*4)/1440 -> 1899-12-31T20:25:58.850 | AA260: =8*RC[-4] -> 790.62284677790763 | AB260: =MOD(RC[-23]*1440+RC[-6]+4*R3C2-60*R4C2,1440) -> 729.33059623573729 | AC260: =IF(RC[-1]/4<0,RC[-1]/4+180,RC[-1]/4-180) -> 2.3326490589343223 | AD260: =DEGREES(ACOS(SIN(RADIANS(R2C2))*SIN(RADIANS(RC[-10]))+COS(RADIANS(R2C2))*COS(RADIANS(RC[-10]))*COS(RADIANS(RC[-1])))) -> 67.705564371460625 | AE260: =90-RC[-1] -> 22.294435628539375 | AF260: =IF(RC[-1]>85,0,IF(RC[-1]>5,58.1/TAN(RADIANS(RC[-1]))-0.07/POWER(TAN(RADIANS(RC[-1])),3)+0.000086/POWER(TAN(RADIANS(RC[-1])),5),IF(RC[-1]>-0.575,1735+RC[-1]*(-518.2+RC[-1]*(103.4+RC[-1]*(-12.79+RC[-1]*0.711))),-20.772/TAN(RADIANS(RC[-1])))))/3600 -> 3.9081534073797886E-2 | AG260: =RC[-2]+RC[-1] -> 22.333517162613173 | AH260: =IF(RC[-5]>0,MOD(DEGREES(ACOS(((SIN(RADIANS(R2C2))*COS(RADIANS(RC[-4])))-SIN(RADIANS(RC[-14])))/(COS(RADIANS(R2C2))*SIN(RADIANS(RC[-4])))))+180,360),MOD(540-DEGREES(ACOS(((SIN(RADIANS(R2C2))*COS(RADIANS(RC[-4])))-SIN(RADIANS(RC[-14])))/(COS(RADIANS(R2C2))*SIN(RADIANS(RC[-4]))))),360)) -> 182.51917428653957
D261: =R[-1]C+1 -> 2017-09-17T00:00:00.000 | E261: =R5C2 -> 1899-12-31T14:00:00.000 | F261: =RC[-2]+2415018.5+RC[-1]-R4C2/24 -> 2458014.375 | G261: =(RC[-1]-2451545)/36525 -> 0.17712183436002737 | I261: =MOD(280.46646+RC[-2]*(36000.76983 + RC[-2]*0.0003032),360) -> 176.98886017476434 | J261: =357.52911+RC[-3]*(35999.05029 - 0.0001537*RC[-3]) -> 6733.7469277617765 | K261: =0.016708634-RC[-4]*(0.000042037+0.0000001267*RC[-4]) -> 1.6701184354598338E-2 | L261: =SIN(RADIANS(RC[-2]))*(1.914602-RC[-5]*(0.004817+0.000014*RC[-5]))+SIN(RADIANS(2*RC[-2]))*(0.019993-0.000101*RC[-5])+SIN(RADIANS(3*RC[-2]))*0.000289 -> -1.8263401796043546 | M261: =RC[-4]+RC[-1] -> 175.16251999515998 | N261: =RC[-4]+RC[-2] -> 6731.9205875821726 | O261: =(1.000001018*(1-RC[-4]*RC[-4]))/(1+RC[-4]*COS(RADIANS(RC[-1]))) -> 1.0049306031380307 | P261: =RC[-3]-0.00569-0.00478*SIN(RADIANS(125.04-1934.136*RC[-9])) -> 175.15391761984088 | Q261: =23+(26+((21.448-RC[-10]*(46.815+RC[-10]*(0.00059-RC[-10]*0.001813))))/60)/60 -> 23.436987786913654 | R261: =RC[-1]+0.00256*COS(RADIANS(125.04-1934.136*RC[-11])) -> 23.434957828673205 | S261: =DEGREES(ATAN2(COS(RADIANS(RC[-3])),COS(RADIANS(RC[-1]))*SIN(RADIANS(RC[-3])))) -> 175.55198478146329 | T261: =DEGREES(ASIN(SIN(RADIANS(RC[-2]))*SIN(RADIANS(RC[-4])))) -> 1.925389826056116 | U261: =TAN(RADIANS(RC[-3]/2))*TAN(RADIANS(RC[-3]/2)) -> 4.3018166500950972E-2 | V261: =4*DEGREES(RC[-1]*SIN(2*RADIANS(RC[-13]))-2*RC[-11]*SIN(RADIANS(RC[-12]))+4*RC[-11]*RC[-1]*SIN(RADIANS(RC[-12]))*COS(2*RADIANS(RC[-13]))-0.5*RC[-1]*RC[-1]*SIN(4*RADIANS(RC[-13]))-1.25*RC[-11]*RC[-11]*SIN(2*RADIANS(RC[-12]))) -> 5.6874435507646135 | W261: =DEGREES(ACOS(COS(RADIANS(90.833))/(COS(RADIANS(R2C2))*COS(RADIANS(RC[-3])))-TAN(RADIANS(R2C2))*TAN(RADIANS(RC[-3])))) -> 97.752409086360814 | X261: =(720-4*R3C2-RC[-2]+R4C2*60)/1440 -> 1899-12-31T13:50:18.753 | Y261: =(RC[-1]*1440-RC[-2]*4)/1440 -> 1899-12-31T07:19:18.175 | Z261: =(RC[-2]*1440+RC[-3]*4)/1440 -> 1899-12-31T20:21:19.332 | AA261: =8*RC[-4] -> 782.01927269088651 | AB261: =MOD(RC[-23]*1440+RC[-6]+4*R3C2-60*R4C2,1440) -> 729.68744355076467 | AC261: =IF(RC[-1]/4<0,RC[-1]/4+180,RC[-1]/4-180) -> 2.4218608876911674 | AD261: =DEGREES(ACOS(SIN(RADIANS(R2C2))*SIN(RADIANS(RC[-10]))+COS(RADIANS(R2C2))*COS(RADIANS(RC[-10]))*COS(RADIANS(RC[-1])))) -> 68.093466836896297 | AE261: =90-RC[-1] -> 21.906533163103703 | AF261: =IF(RC[-1]>85,0,IF(RC[-1]>5,58.1/TAN(RADIANS(RC[-1]))-0.07/POWER(TAN(RADIANS(RC[-1])),3)+0.000086/POWER(TAN(RADIANS(RC[-1])),5),IF(RC[-1]>-0.575,1735+RC[-1]*(-518.2+RC[-1]*(103.4+RC[-1]*(-12.79+RC[-1]*0.711))),-20.772/TAN(RADIANS(RC[-1])))))/3600 -> 3.9836777542193218E-2 | AG261: =RC[-2]+RC[-1] -> 21.946369940645894 | AH261: =IF(RC[-5]>0,MOD(DEGREES(ACOS(((SIN(RADIANS(R2C2))*COS(RADIANS(RC[-4])))-SIN(RADIANS(RC[-14])))/(COS(RADIANS(R2C2))*SIN(RADIANS(RC[-4])))))+180,360),MOD(540-DEGREES(ACOS(((SIN(RADIANS(R2C2))*COS(RADIANS(RC[-4])))-SIN(RADIANS(RC[-14])))/(COS(RADIANS(R2C2))*SIN(RADIANS(RC[-4]))))),360)) -> 182.60899511365278
D262: =R[-1]C+1 -> 2017-09-18T00:00:00.000 | E262: =R5C2 -> 1899-12-31T14:00:00.000 | F262: =RC[-2]+2415018.5+RC[-1]-R4C2/24 -> 2458015.375 | G262: =(RC[-1]-2451545)/36525 -> 0.1771492128678987 | I262: =MOD(280.46646+RC[-2]*(36000.76983 + RC[-2]*0.0003032),360) -> 177.97450753786961 | J262: =357.52911+RC[-3]*(35999.05029 - 0.0001537*RC[-3]) -> 6734.7325280420109 | K262: =0.016708634-RC[-4]*(0.000042037+0.0000001267*RC[-4]) -> 1.6701183202459086E-2 | L262: =SIN(RADIANS(RC[-2]))*(1.914602-RC[-5]*(0.004817+0.000014*RC[-5]))+SIN(RADIANS(2*RC[-2]))*(0.019993-0.000101*RC[-5])+SIN(RADIANS(3*RC[-2]))*0.000289 -> -1.8358563488058524 | M262: =RC[-4]+RC[-1] -> 176.13865118906375 | N262: =RC[-4]+RC[-2] -> 6732.8966716932055 | O262: =(1.000001018*(1-RC[-4]*RC[-4]))/(1+RC[-4]*COS(RADIANS(RC[-1]))) -> 1.0046567093959009 | P262: =RC[-3]-0.00569-0.00478*SIN(RADIANS(125.04-1934.136*RC[-9])) -> 176.13004531191598 | Q262: =23+(26+((21.448-RC[-10]*(46.815+RC[-10]*(0.00059-RC[-10]*0.001813))))/60)/60 -> 23.436987430878681 | R262: =RC[-1]+0.00256*COS(RADIANS(125.04-1934.136*RC[-11])) -> 23.434958915067785 | S262: =DEGREES(ATAN2(COS(RADIANS(RC[-3])),COS(RADIANS(RC[-1]))*SIN(RADIANS(RC[-3])))) -> 176.44841595304129 | T262: =DEGREES(ASIN(SIN(RADIANS(RC[-2]))*SIN(RADIANS(RC[-4])))) -> 1.5381258395235125 | U262: =TAN(RADIANS(RC[-3]/2))*TAN(RADIANS(RC[-3]/2)) -> 4.3018170602829447E-2 | V262: =4*DEGREES(RC[-1]*SIN(2*RADIANS(RC[-13]))-2*RC[-11]*SIN(RADIANS(RC[-12]))+4*RC[-11]*RC[-1]*SIN(RADIANS(RC[-12]))*COS(2*RADIANS(RC[-13]))-0.5*RC[-1]*RC[-1]*SIN(4*RADIANS(RC[-13]))-1.25*RC[-11]*RC[-11]*SIN(2*RADIANS(RC[-12]))) -> 6.0440892881581449 | W262: =DEGREES(ACOS(COS(RADIANS(90.833))/(COS(RADIANS(R2C2))*COS(RADIANS(RC[-3])))-TAN(RADIANS(R2C2))*TAN(RADIANS(RC[-3])))) -> 96.67841482765283 | X262: =(720-4*R3C2-RC[-2]+R4C2*60)/1440 -> 1899-12-31T13:49:57.355 | Y262: =(RC[-1]*1440-RC[-2]*4)/1440 -> 1899-12-31T07:23:14.535 | Z262: =(RC[-2]*1440+RC[-3]*4)/1440 -> 1899-12-31T20:16:40.174 | AA262: =8*RC[-4] -> 773.42731862122264 | AB262: =MOD(RC[-23]*1440+RC[-6]+4*R3C2-60*R4C2,1440) -> 730.04408928815815 | AC262: =IF(RC[-1]/4<0,RC[-1]/4+180,RC[-1]/4-180) -> 2.5110223220395369 | AD262: =DEGREES(ACOS(SIN(RADIANS(R2C2))*SIN(RADIANS(RC[-10]))+COS(RADIANS(R2C2))*COS(RADIANS(RC[-10]))*COS(RADIANS(RC[-1])))) -> 68.482094106368535 | AE262: =90-RC[-1] -> 21.517905893631465 | AF262: =IF(RC[-1]>85,0,IF(RC[-1]>5,58.1/TAN(RADIANS(RC[-1]))-0.07/POWER(TAN(RADIANS(RC[-1])),3)+0.000086/POWER(TAN(RADIANS(RC[-1])),5),IF(RC[-1]>-0.575,1735+RC[-1]*(-518.2+RC[-1]*(103.4+RC[-1]*(-12.79+RC[-1]*0.711))),-20.772/TAN(RADIANS(RC[-1])))))/3600 -> 4.061868905334317E-2 | AG262: =RC[-2]+RC[-1] -> 21.558524582684807 | AH262: =IF(RC[-5]>0,MOD(DEGREES(ACOS(((SIN(RADIANS(R2C2))*COS(RADIANS(RC[-4])))-SIN(RADIANS(RC[-14])))/(COS(RADIANS(R2C2))*SIN(RADIANS(RC[-4])))))+180,360),MOD(540-DEGREES(ACOS(((SIN(RADIANS(R2C2))*COS(RADIANS(RC[-4])))-SIN(RADIANS(RC[-14])))/(COS(RADIANS(R2C2))*SIN(RADIANS(RC[-4]))))),360)) -> 182.69830577249365
D263: =R[-1]C+1 -> 2017-09-19T00:00:00.000 | E263: =R5C2 -> 1899-12-31T14:00:00.000 | F263: =RC[-2]+2415018.5+RC[-1]-R4C2/24 -> 2458016.375 | G263: =(RC[-1]-2451545)/36525 -> 0.17717659137577002 | I263: =MOD(280.46646+RC[-2]*(36000.76983 + RC[-2]*0.0003032),360) -> 178.96015490097579 | J263: =357.52911+RC[-3]*(35999.05029 - 0.0001537*RC[-3]) -> 6735.7181283222453 | K263: =0.016708634-RC[-4]*(0.000042037+0.0000001267*RC[-4]) -> 1.6701182050319646E-2 | L263: =SIN(RADIANS(RC[-2]))*(1.914602-RC[-5]*(0.004817+0.000014*RC[-5]))+SIN(RADIANS(2*RC[-2]))*(0.019993-0.000101*RC[-5])+SIN(RADIANS(3*RC[-2]))*0.000289 -> -1.8448387707644844 | M263: =RC[-4]+RC[-1] -> 177.11531613021131 | N263: =RC[-4]+RC[-2] -> 6733.8732895514804 | O263: =(1.000001018*(1-RC[-4]*RC[-4]))/(1+RC[-4]*COS(RADIANS(RC[-1]))) -> 1.0043813757560656 | P263: =RC[-3]-0.00569-0.00478*SIN(RADIANS(125.04-1934.136*RC[-9])) -> 177.10670675372558 | Q263: =23+(26+((21.448-RC[-10]*(46.815+RC[-10]*(0.00059-RC[-10]*0.001813))))/60)/60 -> 23.43698707484371 | R263: =RC[-1]+0.00256*COS(RADIANS(125.04-1934.136*RC[-11])) -> 23.43496000319508 | S263: =DEGREES(ATAN2(COS(RADIANS(RC[-3])),COS(RADIANS(RC[-1]))*SIN(RADIANS(RC[-3])))) -> 177.3450115480741 | T263: =DEGREES(ASIN(SIN(RADIANS(RC[-2]))*SIN(RADIANS(RC[-4])))) -> 1.1502735823435244 | U263: =TAN(RADIANS(RC[-3]/2))*TAN(RADIANS(RC[-3]/2)) -> 4.3018174711250308E-2 | V263: =4*DEGREES(RC[-1]*SIN(2*RADIANS(RC[-13]))-2*RC[-11]*SIN(RADIANS(RC[-12]))+4*RC[-11]*RC[-1]*SIN(RADIANS(RC[-12]))*COS(2*RADIANS(RC[-13]))-0.5*RC[-1]*RC[-1]*SIN(4*RADIANS(RC[-13]))-1.25*RC[-11]*RC[-11]*SIN(2*RADIANS(RC[-12]))) -> 6.4002039097804033 | W263: =DEGREES(ACOS(COS(RADIANS(90.833))/(COS(RADIANS(R2C2))*COS(RADIANS(RC[-3])))-TAN(RADIANS(R2C2))*TAN(RADIANS(RC[-3])))) -> 95.605648177560909 | X263: =(720-4*R3C2-RC[-2]+R4C2*60)/1440 -> 1899-12-31T13:49:35.988 | Y263: =(RC[-1]*1440-RC[-2]*4)/1440 -> 1899-12-31T07:27:10.632 | Z263: =(RC[-2]*1440+RC[-3]*4)/1440 -> 1899-12-31T20:12:01.343 | AA263: =8*RC[-4] -> 764.84518542048727 | AB263: =MOD(RC[-23]*1440+RC[-6]+4*R3C2-60*R4C2,1440) -> 730.40020390978043 | AC263: =IF(RC[-1]/4<0,RC[-1]/4+180,RC[-1]/4-180) -> 2.6000509774451075 | AD263: =DEGREES(ACOS(SIN(RADIANS(R2C2))*SIN(RADIANS(RC[-10]))+COS(RADIANS(R2C2))*COS(RADIANS(RC[-10]))*COS(RADIANS(RC[-1])))) -> 68.871351424296009 | AE263: =90-RC[-1] -> 21.128648575703991 | AF263: =IF(RC[-1]>85,0,IF(RC[-1]>5,58.1/TAN(RADIANS(RC[-1]))-0.07/POWER(TAN(RADIANS(RC[-1])),3)+0.000086/POWER(TAN(RADIANS(RC[-1])),5),IF(RC[-1]>-0.575,1735+RC[-1]*(-518.2+RC[-1]*(103.4+RC[-1]*(-12.79+RC[-1]*0.711))),-20.772/TAN(RADIANS(RC[-1])))))/3600 -> 4.1428562723044432E-2 | AG263: =RC[-2]+RC[-1] -> 21.170077138427036 | AH263: =IF(RC[-5]>0,MOD(DEGREES(ACOS(((SIN(RADIANS(R2C2))*COS(RADIANS(RC[-4])))-SIN(RADIANS(RC[-14])))/(COS(RADIANS(R2C2))*SIN(RADIANS(RC[-4])))))+180,360),MOD(540-DEGREES(ACOS(((SIN(RADIANS(R2C2))*COS(RADIANS(RC[-4])))-SIN(RADIANS(RC[-14])))/(COS(RADIANS(R2C2))*SIN(RADIANS(RC[-4]))))),360)) -> 182.78702194172149
D264: =R[-1]C+1 -> 2017-09-20T00:00:00.000 | E264: =R5C2 -> 1899-12-31T14:00:00.000 | F264: =RC[-2]+2415018.5+RC[-1]-R4C2/24 -> 2458017.375 | G264: =(RC[-1]-2451545)/36525 -> 0.17720396988364134 | I264: =MOD(280.46646+RC[-2]*(36000.76983 + RC[-2]*0.0003032),360) -> 179.94580226408198 | J264: =357.52911+RC[-3]*(35999.05029 - 0.0001537*RC[-3]) -> 6736.7037286024788 | K264: =0.016708634-RC[-4]*(0.000042037+0.0000001267*RC[-4]) -> 1.6701180898180013E-2 | L264: =SIN(RADIANS(RC[-2]))*(1.914602-RC[-5]*(0.004817+0.000014*RC[-5]))+SIN(RADIANS(2*RC[-2]))*(0.019993-0.000101*RC[-5])+SIN(RADIANS(3*RC[-2]))*0.000289 -> -1.8532842816865955 | M264: =RC[-4]+RC[-1] -> 178.09251798239538 | N264: =RC[-4]+RC[-2] -> 6734.8504443207921 | O264: =(1.000001018*(1-RC[-4]*RC[-4]))/(1+RC[-4]*COS(RADIANS(RC[-1]))) -> 1.0041046814443235 | P264: =RC[-3]-0.00569-0.00478*SIN(RADIANS(125.04-1934.136*RC[-9])) -> 178.08390510906534 | Q264: =23+(26+((21.448-RC[-10]*(46.815+RC[-10]*(0.00059-RC[-10]*0.001813))))/60)/60 -> 23.43698671880874 | R264: =RC[-1]+0.00256*COS(RADIANS(125.04-1934.136*RC[-11])) -> 23.434961093053854 | S264: =DEGREES(ATAN2(COS(RADIANS(RC[-3])),COS(RADIANS(RC[-1]))*SIN(RADIANS(RC[-3])))) -> 178.24185606216639 | T264: =DEGREES(ASIN(SIN(RADIANS(RC[-2]))*SIN(RADIANS(RC[-4])))) -> 0.76192633953419298 | U264: =TAN(RADIANS(RC[-3]/2))*TAN(RADIANS(RC[-3]/2)) -> 4.3018178826208911E-2 | V264: =4*DEGREES(RC[-1]*SIN(2*RADIANS(RC[-13]))-2*RC[-11]*SIN(RADIANS(RC[-12]))+4*RC[-11]*RC[-1]*SIN(RADIANS(RC[-12]))*COS(2*RADIANS(RC[-13]))-0.5*RC[-1]*RC[-1]*SIN(4*RADIANS(RC[-13]))-1.25*RC[-11]*RC[-11]*SIN(2*RADIANS(RC[-12]))) -> 6.7554559291784892 | W264: =DEGREES(ACOS(COS(RADIANS(90.833))/(COS(RADIANS(R2C2))*COS(RADIANS(RC[-3])))-TAN(RADIANS(R2C2))*TAN(RADIANS(RC[-3])))) -> 94.533887646577966 | X264: =(720-4*R3C2-RC[-2]+R4C2*60)/1440 -> 1899-12-31T13:49:14.673 | Y264: =(RC[-1]*1440-RC[-2]*4)/1440 -> 1899-12-31T07:31:06.540 | Z264: =(RC[-2]*1440+RC[-3]*4)/1440 -> 1899-12-31T20:07:22.806 | AA264: =8*RC[-4] -> 756.27110117262373 | AB264: =MOD(RC[-23]*1440+RC[-6]+4*R3C2-60*R4C2,1440) -> 730.75545592917854 | AC264: =IF(RC[-1]/4<0,RC[-1]/4+180,RC[-1]/4-180) -> 2.6888639822946345 | AD264: =DEGREES(ACOS(SIN(RADIANS(R2C2))*SIN(RADIANS(RC[-10]))+COS(RADIANS(R2C2))*COS(RADIANS(RC[-10]))*COS(RADIANS(RC[-1])))) -> 69.261143540275228 | AE264: =90-RC[-1] -> 20.738856459724772 | AF264: =IF(RC[-1]>85,0,IF(RC[-1]>5,58.1/TAN(RADIANS(RC[-1]))-0.07/POWER(TAN(RADIANS(RC[-1])),3)+0.000086/POWER(TAN(RADIANS(RC[-1])),5),IF(RC[-1]>-0.575,1735+RC[-1]*(-518.2+RC[-1]*(103.4+RC[-1]*(-12.79+RC[-1]*0.711))),-20.772/TAN(RADIANS(RC[-1])))))/3600 -> 4.2267776172845217E-2 | AG264: =RC[-2]+RC[-1] -> 20.781124235897618 | AH264: =IF(RC[-5]>0,MOD(DEGREES(ACOS(((SIN(RADIANS(R2C2))*COS(RADIANS(RC[-4])))-SIN(RADIANS(RC[-14])))/(COS(RADIANS(R2C2))*SIN(RADIANS(RC[-4])))))+180,360),MOD(540-DEGREES(ACOS(((SIN(RADIANS(R2C2))*COS(RADIANS(RC[-4])))-SIN(RADIANS(RC[-14])))/(COS(RADIANS(R2C2))*SIN(RADIANS(RC[-4]))))),360)) -> 182.8750597628316
D265: =R[-1]C+1 -> 2017-09-21T00:00:00.000 | E265: =R5C2 -> 1899-12-31T14:00:00.000 | F265: =RC[-2]+2415018.5+RC[-1]-R4C2/24 -> 2458018.375 | G265: =(RC[-1]-2451545)/36525 -> 0.17723134839151267 | I265: =MOD(280.46646+RC[-2]*(36000.76983 + RC[-2]*0.0003032),360) -> 180.93144962718725 | J265: =357.52911+RC[-3]*(35999.05029 - 0.0001537*RC[-3]) -> 6737.6893288827123 | K265: =0.016708634-RC[-4]*(0.000042037+0.0000001267*RC[-4]) -> 1.6701179746040191E-2 | L265: =SIN(RADIANS(RC[-2]))*(1.914602-RC[-5]*(0.004817+0.000014*RC[-5]))+SIN(RADIANS(2*RC[-2]))*(0.019993-0.000101*RC[-5])+SIN(RADIANS(3*RC[-2]))*0.000289 -> -1.8611898652830541 | M265: =RC[-4]+RC[-1] -> 179.0702597619042 | N265: =RC[-4]+RC[-2] -> 6735.8281390174288 | O265: =(1.000001018*(1-RC[-4]*RC[-4]))/(1+RC[-4]*COS(RADIANS(RC[-1]))) -> 1.0038267062099433 | P265: =RC[-3]-0.00569-0.00478*SIN(RADIANS(125.04-1934.136*RC[-9])) -> 179.06164339422651 | Q265: =23+(26+((21.448-RC[-10]*(46.815+RC[-10]*(0.00059-RC[-10]*0.001813))))/60)/60 -> 23.436986362773769 | R265: =RC[-1]+0.00256*COS(RADIANS(125.04-1934.136*RC[-11])) -> 23.434962184642874 | S265: =DEGREES(ATAN2(COS(RADIANS(RC[-3])),COS(RADIANS(RC[-1]))*SIN(RADIANS(RC[-3])))) -> 179.13903427289151 | T265: =DEGREES(ASIN(SIN(RADIANS(RC[-2]))*SIN(RADIANS(RC[-4])))) -> 0.37317773024321982 | U265: =TAN(RADIANS(RC[-3]/2))*TAN(RADIANS(RC[-3]/2)) -> 4.3018182947700566E-2 | V265: =4*DEGREES(RC[-1]*SIN(2*RADIANS(RC[-13]))-2*RC[-11]*SIN(RADIANS(RC[-12]))+4*RC[-11]*RC[-1]*SIN(RADIANS(RC[-12]))*COS(2*RADIANS(RC[-13]))-0.5*RC[-1]*RC[-1]*SIN(4*RADIANS(RC[-13]))-1.25*RC[-11]*RC[-11]*SIN(2*RADIANS(RC[-12]))) -> 7.1095120306165045 | W265: =DEGREES(ACOS(COS(RADIANS(90.833))/(COS(RADIANS(R2C2))*COS(RADIANS(RC[-3])))-TAN(RADIANS(R2C2))*TAN(RADIANS(RC[-3])))) -> 93.46291470838878 | X265: =(720-4*R3C2-RC[-2]+R4C2*60)/1440 -> 1899-12-31T13:48:53.429 | Y265: =(RC[-1]*1440-RC[-2]*4)/1440 -> 1899-12-31T07:35:02.330 | Z265: =(RC[-2]*1440+RC[-3]*4)/1440 -> 1899-12-31T20:02:44.529 | AA265: =8*RC[-4] -> 747.70331766711024 | AB265: =MOD(RC[-23]*1440+RC[-6]+4*R3C2-60*R4C2,1440) -> 731.10951203061654 | AC265: =IF(RC[-1]/4<0,RC[-1]/4+180,RC[-1]/4-180) -> 2.7773780076541357 | AD265: =DEGREES(ACOS(SIN(RADIANS(R2C2))*SIN(RADIANS(RC[-10]))+COS(RADIANS(R2C2))*COS(RADIANS(RC[-10]))*COS(RADIANS(RC[-1])))) -> 69.651374696139328 | AE265: =90-RC[-1] -> 20.348625303860672 | AF265: =IF(RC[-1]>85,0,IF(RC[-1]>5,58.1/TAN(RADIANS(RC[-1]))-0.07/POWER(TAN(RADIANS(RC[-1])),3)+0.000086/POWER(TAN(RADIANS(RC[-1])),5),IF(RC[-1]>-0.575,1735+RC[-1]*(-518.2+RC[-1]*(103.4+RC[-1]*(-12.79+RC[-1]*0.711))),-20.772/TAN(RADIANS(RC[-1])))))/3600 -> 4.3137796982553059E-2 | AG265: =RC[-2]+RC[-1] -> 20.391763100843225 | AH265: =IF(RC[-5]>0,MOD(DEGREES(ACOS(((SIN(RADIANS(R2C2))*COS(RADIANS(RC[-4])))-SIN(RADIANS(RC[-14])))/(COS(RADIANS(R2C2))*SIN(RADIANS(RC[-4])))))+180,360),MOD(540-DEGREES(ACOS(((SIN(RADIANS(R2C2))*COS(RADIANS(RC[-4])))-SIN(RADIANS(RC[-14])))/(COS(RADIANS(R2C2))*SIN(RADIANS(RC[-4]))))),360)) -> 182.96233586744736
D266: =R[-1]C+1 -> 2017-09-22T00:00:00.000 | E266: =R5C2 -> 1899-12-31T14:00:00.000 | F266: =RC[-2]+2415018.5+RC[-1]-R4C2/24 -> 2458019.375 | G266: =(RC[-1]-2451545)/36525 -> 0.17725872689938399 | I266: =MOD(280.46646+RC[-2]*(36000.76983 + RC[-2]*0.0003032),360) -> 181.91709699029434 | J266: =357.52911+RC[-3]*(35999.05029 - 0.0001537*RC[-3]) -> 6738.6749291629458 | K266: =0.016708634-RC[-4]*(0.000042037+0.0000001267*RC[-4]) -> 1.6701178593900183E-2 | L266: =SIN(RADIANS(RC[-2]))*(1.914602-RC[-5]*(0.004817+0.000014*RC[-5]))+SIN(RADIANS(2*RC[-2]))*(0.019993-0.000101*RC[-5])+SIN(RADIANS(3*RC[-2]))*0.000289 -> -1.8685526542395037 | M266: =RC[-4]+RC[-1] -> 180.04854433605485 | N266: =RC[-4]+RC[-2] -> 6736.8063765087063 | O266: =(1.000001018*(1-RC[-4]*RC[-4]))/(1+RC[-4]*COS(RADIANS(RC[-1]))) -> 1.0035475303047936 | P266: =RC[-3]-0.00569-0.00478*SIN(RADIANS(125.04-1934.136*RC[-9])) -> 180.03992447652914 | Q266: =23+(26+((21.448-RC[-10]*(46.815+RC[-10]*(0.00059-RC[-10]*0.001813))))/60)/60 -> 23.436986006738799 | R266: =RC[-1]+0.00256*COS(RADIANS(125.04-1934.136*RC[-11])) -> 23.4349632779609 | S266: =DEGREES(ATAN2(COS(RADIANS(RC[-3])),COS(RADIANS(RC[-1]))*SIN(RADIANS(RC[-3])))) -> -179.96336880854003 | T266: =DEGREES(ASIN(SIN(RADIANS(RC[-2]))*SIN(RADIANS(RC[-4])))) -> -1.5878276754724953E-2 | U266: =TAN(RADIANS(RC[-3]/2))*TAN(RADIANS(RC[-3]/2)) -> 4.3018187075720624E-2 | V266: =4*DEGREES(RC[-1]*SIN(2*RADIANS(RC[-13]))-2*RC[-11]*SIN(RADIANS(RC[-12]))+4*RC[-11]*RC[-1]*SIN(RADIANS(RC[-12]))*COS(2*RADIANS(RC[-13]))-0.5*RC[-1]*RC[-1]*SIN(4*RADIANS(RC[-13]))-1.25*RC[-11]*RC[-11]*SIN(2*RADIANS(RC[-12]))) -> 7.4620371929157443 | W266: =DEGREES(ACOS(COS(RADIANS(90.833))/(COS(RADIANS(R2C2))*COS(RADIANS(RC[-3])))-TAN(RADIANS(R2C2))*TAN(RADIANS(RC[-3])))) -> 92.392513382289934 | X266: =(720-4*R3C2-RC[-2]+R4C2*60)/1440 -> 1899-12-31T13:48:32.278 | Y266: =(RC[-1]*1440-RC[-2]*4)/1440 -> 1899-12-31T07:38:58.075 | Z266: =(RC[-2]*1440+RC[-3]*4)/1440 -> 1899-12-31T19:58:06.481 | AA266: =8*RC[-4] -> 739.14010705831947 | AB266: =MOD(RC[-23]*1440+RC[-6]+4*R3C2-60*R4C2,1440) -> 731.46203719291577 | AC266: =IF(RC[-1]/4<0,RC[-1]/4+180,RC[-1]/4-180) -> 2.8655092982289432 | AD266: =DEGREES(ACOS(SIN(RADIANS(R2C2))*SIN(RADIANS(RC[-10]))+COS(RADIANS(R2C2))*COS(RADIANS(RC[-10]))*COS(RADIANS(RC[-1])))) -> 70.04194861348833 | AE266: =90-RC[-1] -> 19.95805138651167 | AF266: =IF(RC[-1]>85,0,IF(RC[-1]>5,58.1/TAN(RADIANS(RC[-1]))-0.07/POWER(TAN(RADIANS(RC[-1])),3)+0.000086/POWER(TAN(RADIANS(RC[-1])),5),IF(RC[-1]>-0.575,1735+RC[-1]*(-518.2+RC[-1]*(103.4+RC[-1]*(-12.79+RC[-1]*0.711))),-20.772/TAN(RADIANS(RC[-1])))))/3600 -> 4.4040189727418154E-2 | AG266: =RC[-2]+RC[-1] -> 20.002091576239089 | AH266: =IF(RC[-5]>0,MOD(DEGREES(ACOS(((SIN(RADIANS(R2C2))*COS(RADIANS(RC[-4])))-SIN(RADIANS(RC[-14])))/(COS(RADIANS(R2C2))*SIN(RADIANS(RC[-4])))))+180,360),MOD(540-DEGREES(ACOS(((SIN(RADIANS(R2C2))*COS(RADIANS(RC[-4])))-SIN(RADIANS(RC[-14])))/(COS(RADIANS(R2C2))*SIN(RADIANS(RC[-4]))))),360)) -> 183.04876740510815
D267: =R[-1]C+1 -> 2017-09-23T00:00:00.000 | E267: =R5C2 -> 1899-12-31T14:00:00.000 | F267: =RC[-2]+2415018.5+RC[-1]-R4C2/24 -> 2458020.375 | G267: =(RC[-1]-2451545)/36525 -> 0.17728610540725531 | I267: =MOD(280.46646+RC[-2]*(36000.76983 + RC[-2]*0.0003032),360) -> 182.90274435340143 | J267: =357.52911+RC[-3]*(35999.05029 - 0.0001537*RC[-3]) -> 6739.6605294431783 | K267: =0.016708634-RC[-4]*(0.000042037+0.0000001267*RC[-4]) -> 1.670117744175998E-2 | L267: =SIN(RADIANS(RC[-2]))*(1.914602-RC[-5]*(0.004817+0.000014*RC[-5]))+SIN(RADIANS(2*RC[-2]))*(0.019993-0.000101*RC[-5])+SIN(RADIANS(3*RC[-2]))*0.000289 -> -1.8753699316573971 | M267: =RC[-4]+RC[-1] -> 181.02737442174404 | N267: =RC[-4]+RC[-2] -> 6737.7851595115208 | O267: =(1.000001018*(1-RC[-4]*RC[-4]))/(1+RC[-4]*COS(RADIANS(RC[-1]))) -> 1.0032672344621927 | P267: =RC[-3]-0.00569-0.00478*SIN(RADIANS(125.04-1934.136*RC[-9])) -> 181.01875107287293 | Q267: =23+(26+((21.448-RC[-10]*(46.815+RC[-10]*(0.00059-RC[-10]*0.001813))))/60)/60 -> 23.436985650703829 | R267: =RC[-1]+0.00256*COS(RADIANS(125.04-1934.136*RC[-11])) -> 23.4349643730067 | S267: =DEGREES(ATAN2(COS(RADIANS(RC[-3])),COS(RADIANS(RC[-1]))*SIN(RADIANS(RC[-3])))) -> -179.06526798600987 | T267: =DEGREES(ASIN(SIN(RADIANS(RC[-2]))*SIN(RADIANS(RC[-4])))) -> -0.40514734755897541 | U267: =TAN(RADIANS(RC[-3]/2))*TAN(RADIANS(RC[-3]/2)) -> 4.3018191210264407E-2 | V267: =4*DEGREES(RC[-1]*SIN(2*RADIANS(RC[-13]))-2*RC[-11]*SIN(RADIANS(RC[-12]))+4*RC[-11]*RC[-1]*SIN(RADIANS(RC[-12]))*COS(2*RADIANS(RC[-13]))-0.5*RC[-1]*RC[-1]*SIN(4*RADIANS(RC[-13]))-1.25*RC[-11]*RC[-11]*SIN(2*RADIANS(RC[-12]))) -> 7.8126948191593462 | W267: =DEGREES(ACOS(COS(RADIANS(90.833))/(COS(RADIANS(R2C2))*COS(RADIANS(RC[-3])))-TAN(RADIANS(R2C2))*TAN(RADIANS(RC[-3])))) -> 91.32246983511034 | X267: =(720-4*R3C2-RC[-2]+R4C2*60)/1440 -> 1899-12-31T13:48:11.238 | Y267: =(RC[-1]*1440-RC[-2]*4)/1440 -> 1899-12-31T07:42:53.846 | Z267: =(RC[-2]*1440+RC[-3]*4)/1440 -> 1899-12-31T19:53:28.631 | AA267: =8*RC[-4] -> 730.57975868088272 | AB267: =MOD(RC[-23]*1440+RC[-6]+4*R3C2-60*R4C2,1440) -> 731.81269481915933 | AC267: =IF(RC[-1]/4<0,RC[-1]/4+180,RC[-1]/4-180) -> 2.9531737047898332 | AD267: =DEGREES(ACOS(SIN(RADIANS(R2C2))*SIN(RADIANS(RC[-10]))+COS(RADIANS(R2C2))*COS(RADIANS(RC[-10]))*COS(RADIANS(RC[-1])))) -> 70.432768481752788 | AE267: =90-RC[-1] -> 19.567231518247212 | AF267: =IF(RC[-1]>85,0,IF(RC[-1]>5,58.1/TAN(RADIANS(RC[-1]))-0.07/POWER(TAN(RADIANS(RC[-1])),3)+0.000086/POWER(TAN(RADIANS(RC[-1])),5),IF(RC[-1]>-0.575,1735+RC[-1]*(-518.2+RC[-1]*(103.4+RC[-1]*(-12.79+RC[-1]*0.711))),-20.772/TAN(RADIANS(RC[-1])))))/3600 -> 4.4976623659710571E-2 | AG267: =RC[-2]+RC[-1] -> 19.612208141906923 | AH267: =IF(RC[-5]>0,MOD(DEGREES(ACOS(((SIN(RADIANS(R2C2))*COS(RADIANS(RC[-4])))-SIN(RADIANS(RC[-14])))/(COS(RADIANS(R2C2))*SIN(RADIANS(RC[-4])))))+180,360),MOD(540-DEGREES(ACOS(((SIN(RADIANS(R2C2))*COS(RADIANS(RC[-4])))-SIN(RADIANS(RC[-14])))/(COS(RADIANS(R2C2))*SIN(RADIANS(RC[-4]))))),360)) -> 183.13427207181655
D268: =R[-1]C+1 -> 2017-09-24T00:00:00.000 | E268: =R5C2 -> 1899-12-31T14:00:00.000 | F268: =RC[-2]+2415018.5+RC[-1]-R4C2/24 -> 2458021.375 | G268: =(RC[-1]-2451545)/36525 -> 0.17731348391512664 | I268: =MOD(280.46646+RC[-2]*(36000.76983 + RC[-2]*0.0003032),360) -> 183.88839171651034 | J268: =357.52911+RC[-3]*(35999.05029 - 0.0001537*RC[-3]) -> 6740.6461297234109 | K268: =0.016708634-RC[-4]*(0.000042037+0.0000001267*RC[-4]) -> 1.670117628961959E-2 | L268: =SIN(RADIANS(RC[-2]))*(1.914602-RC[-5]*(0.004817+0.000014*RC[-5]))+SIN(RADIANS(2*RC[-2]))*(0.019993-0.000101*RC[-5])+SIN(RADIANS(3*RC[-2]))*0.000289 -> -1.8816391324647592 | M268: =RC[-4]+RC[-1] -> 182.00675258404559 | N268: =RC[-4]+RC[-2] -> 6738.7644905909465 | O268: =(1.000001018*(1-RC[-4]*RC[-4]))/(1+RC[-4]*COS(RADIANS(RC[-1]))) -> 1.0029858998754733 | P268: =RC[-3]-0.00569-0.00478*SIN(RADIANS(125.04-1934.136*RC[-9])) -> 181.9981257483347 | Q268: =23+(26+((21.448-RC[-10]*(46.815+RC[-10]*(0.00059-RC[-10]*0.001813))))/60)/60 -> 23.436985294668858 | R268: =RC[-1]+0.00256*COS(RADIANS(125.04-1934.136*RC[-11])) -> 23.434965469779026 | S268: =DEGREES(ATAN2(COS(RADIANS(RC[-3])),COS(RADIANS(RC[-1]))*SIN(RADIANS(RC[-3])))) -> -178.16657792769212 | T268: =DEGREES(ASIN(SIN(RADIANS(RC[-2]))*SIN(RADIANS(RC[-4])))) -> -0.79453476771652343 | U268: =TAN(RADIANS(RC[-3]/2))*TAN(RADIANS(RC[-3]/2)) -> 4.3018195351327219E-2 | V268: =4*DEGREES(RC[-1]*SIN(2*RADIANS(RC[-13]))-2*RC[-11]*SIN(RADIANS(RC[-12]))+4*RC[-11]*RC[-1]*SIN(RADIANS(RC[-12]))*COS(2*RADIANS(RC[-13]))-0.5*RC[-1]*RC[-1]*SIN(4*RADIANS(RC[-13]))-1.25*RC[-11]*RC[-11]*SIN(2*RADIANS(RC[-12]))) -> 8.1611468733158397 | W268: =DEGREES(ACOS(COS(RADIANS(90.833))/(COS(RADIANS(R2C2))*COS(RADIANS(RC[-3])))-TAN(RADIANS(R2C2))*TAN(RADIANS(RC[-3])))) -> 90.252571999077759 | X268: =(720-4*R3C2-RC[-2]+R4C2*60)/1440 -> 1899-12-31T13:47:50.331 | Y268: =(RC[-1]*1440-RC[-2]*4)/1440 -> 1899-12-31T07:46:49.714 | Z268: =(RC[-2]*1440+RC[-3]*4)/1440 -> 1899-12-31T19:48:50.948 | AA268: =8*RC[-4] -> 722.02057599262207 | AB268: =MOD(RC[-23]*1440+RC[-6]+4*R3C2-60*R4C2,1440) -> 732.16114687331583 | AC268: =IF(RC[-1]/4<0,RC[-1]/4+180,RC[-1]/4-180) -> 3.0402867183289572 | AD268: =DEGREES(ACOS(SIN(RADIANS(R2C2))*SIN(RADIANS(RC[-10]))+COS(RADIANS(R2C2))*COS(RADIANS(RC[-10]))*COS(RADIANS(RC[-1])))) -> 70.823736946870739 | AE268: =90-RC[-1] -> 19.176263053129261 | AF268: =IF(RC[-1]>85,0,IF(RC[-1]>5,58.1/TAN(RADIANS(RC[-1]))-0.07/POWER(TAN(RADIANS(RC[-1])),3)+0.000086/POWER(TAN(RADIANS(RC[-1])),5),IF(RC[-1]>-0.575,1735+RC[-1]*(-518.2+RC[-1]*(103.4+RC[-1]*(-12.79+RC[-1]*0.711))),-20.772/TAN(RADIANS(RC[-1])))))/3600 -> 4.5948881101072328E-2 | AG268: =RC[-2]+RC[-1] -> 19.222211934230334 | AH268: =IF(RC[-5]>0,MOD(DEGREES(ACOS(((SIN(RADIANS(R2C2))*COS(RADIANS(RC[-4])))-SIN(RADIANS(RC[-14])))/(COS(RADIANS(R2C2))*SIN(RADIANS(RC[-4])))))+180,360),MOD(540-DEGREES(ACOS(((SIN(RADIANS(R2C2))*COS(RADIANS(RC[-4])))-SIN(RADIANS(RC[-14])))/(COS(RADIANS(R2C2))*SIN(RADIANS(RC[-4]))))),360)) -> 183.21876813960773
D269: =R[-1]C+1 -> 2017-09-25T00:00:00.000 | E269: =R5C2 -> 1899-12-31T14:00:00.000 | F269: =RC[-2]+2415018.5+RC[-1]-R4C2/24 -> 2458022.375 | G269: =(RC[-1]-2451545)/36525 -> 0.17734086242299796 | I269: =MOD(280.46646+RC[-2]*(36000.76983 + RC[-2]*0.0003032),360) -> 184.87403907961834 | J269: =357.52911+RC[-3]*(35999.05029 - 0.0001537*RC[-3]) -> 6741.6317300036444 | K269: =0.016708634-RC[-4]*(0.000042037+0.0000001267*RC[-4]) -> 1.6701175137479009E-2 | L269: =SIN(RADIANS(RC[-2]))*(1.914602-RC[-5]*(0.004817+0.000014*RC[-5]))+SIN(RADIANS(2*RC[-2]))*(0.019993-0.000101*RC[-5])+SIN(RADIANS(3*RC[-2]))*0.000289 -> -1.8873578447955752 | M269: =RC[-4]+RC[-1] -> 182.98668123482275 | N269: =RC[-4]+RC[-2] -> 6739.7443721588488 | O269: =(1.000001018*(1-RC[-4]*RC[-4]))/(1+RC[-4]*COS(RADIANS(RC[-1]))) -> 1.0027036081762732 | P269: =RC[-3]-0.00569-0.00478*SIN(RADIANS(125.04-1934.136*RC[-9])) -> 182.97805091478065 | Q269: =23+(26+((21.448-RC[-10]*(46.815+RC[-10]*(0.00059-RC[-10]*0.001813))))/60)/60 -> 23.436984938633888 | R269: =RC[-1]+0.00256*COS(RADIANS(125.04-1934.136*RC[-11])) -> 23.434966568276643 | S269: =DEGREES(ATAN2(COS(RADIANS(RC[-3])),COS(RADIANS(RC[-1]))*SIN(RADIANS(RC[-3])))) -> -177.26721321585407 | T269: =DEGREES(ASIN(SIN(RADIANS(RC[-2]))*SIN(RADIANS(RC[-4])))) -> -1.1839454269189749 | U269: =TAN(RADIANS(RC[-3]/2))*TAN(RADIANS(RC[-3]/2)) -> 4.3018199498904397E-2 | V269: =4*DEGREES(RC[-1]*SIN(2*RADIANS(RC[-13]))-2*RC[-11]*SIN(RADIANS(RC[-12]))+4*RC[-11]*RC[-1]*SIN(RADIANS(RC[-12]))*COS(2*RADIANS(RC[-13]))-0.5*RC[-1]*RC[-1]*SIN(4*RADIANS(RC[-13]))-1.25*RC[-11]*RC[-11]*SIN(2*RADIANS(RC[-12]))) -> 8.5070540247932573 | W269: =DEGREES(ACOS(COS(RADIANS(90.833))/(COS(RADIANS(R2C2))*COS(RADIANS(RC[-3])))-TAN(RADIANS(R2C2))*TAN(RADIANS(RC[-3])))) -> 89.182609202351969 | X269: =(720-4*R3C2-RC[-2]+R4C2*60)/1440 -> 1899-12-31T13:47:29.577 | Y269: =(RC[-1]*1440-RC[-2]*4)/1440 -> 1899-12-31T07:50:45.751 | Z269: =(RC[-2]*1440+RC[-3]*4)/1440 -> 1899-12-31T19:44:13.403 | AA269: =8*RC[-4] -> 713.46087361881575 | AB269: =MOD(RC[-23]*1440+RC[-6]+4*R3C2-60*R4C2,1440) -> 732.50705402479321 | AC269: =IF(RC[-1]/4<0,RC[-1]/4+180,RC[-1]/4-180) -> 3.1267635061983015 | AD269: =DEGREES(ACOS(SIN(RADIANS(R2C2))*SIN(RADIANS(RC[-10]))+COS(RADIANS(R2C2))*COS(RADIANS(RC[-10]))*COS(RADIANS(RC[-1])))) -> 71.214756100633352 | AE269: =90-RC[-1] -> 18.785243899366648 | AF269: =IF(RC[-1]>85,0,IF(RC[-1]>5,58.1/TAN(RADIANS(RC[-1]))-0.07/POWER(TAN(RADIANS(RC[-1])),3)+0.000086/POWER(TAN(RADIANS(RC[-1])),5),IF(RC[-1]>-0.575,1735+RC[-1]*(-518.2+RC[-1]*(103.4+RC[-1]*(-12.79+RC[-1]*0.711))),-20.772/TAN(RADIANS(RC[-1])))))/3600 -> 4.6958866619343266E-2 | AG269: =RC[-2]+RC[-1] -> 18.83220276598599 | AH269: =IF(RC[-5]>0,MOD(DEGREES(ACOS(((SIN(RADIANS(R2C2))*COS(RADIANS(RC[-4])))-SIN(RADIANS(RC[-14])))/(COS(RADIANS(R2C2))*SIN(RADIANS(RC[-4])))))+180,360),MOD(540-DEGREES(ACOS(((SIN(RADIANS(R2C2))*COS(RADIANS(RC[-4])))-SIN(RADIANS(RC[-14])))/(COS(RADIANS(R2C2))*SIN(RADIANS(RC[-4]))))),360)) -> 183.30217448738296
D270: =R[-1]C+1 -> 2017-09-26T00:00:00.000 | E270: =R5C2 -> 1899-12-31T14:00:00.000 | F270: =RC[-2]+2415018.5+RC[-1]-R4C2/24 -> 2458023.375 | G270: =(RC[-1]-2451545)/36525 -> 0.17736824093086928 | I270: =MOD(280.46646+RC[-2]*(36000.76983 + RC[-2]*0.0003032),360) -> 185.85968644272725 | J270: =357.52911+RC[-3]*(35999.05029 - 0.0001537*RC[-3]) -> 6742.6173302838761 | K270: =0.016708634-RC[-4]*(0.000042037+0.0000001267*RC[-4]) -> 1.6701173985338241E-2 | L270: =SIN(RADIANS(RC[-2]))*(1.914602-RC[-5]*(0.004817+0.000014*RC[-5]))+SIN(RADIANS(2*RC[-2]))*(0.019993-0.000101*RC[-5])+SIN(RADIANS(3*RC[-2]))*0.000289 -> -1.8925238113367704 | M270: =RC[-4]+RC[-1] -> 183.96716263139049 | N270: =RC[-4]+RC[-2] -> 6740.7248064725391 | O270: =(1.000001018*(1-RC[-4]*RC[-4]))/(1+RC[-4]*COS(RADIANS(RC[-1]))) -> 1.0024204414125504 | P270: =RC[-3]-0.00569-0.00478*SIN(RADIANS(125.04-1934.136*RC[-9])) -> 183.95852882952875 | Q270: =23+(26+((21.448-RC[-10]*(46.815+RC[-10]*(0.00059-RC[-10]*0.001813))))/60)/60 -> 23.436984582598917 | R270: =RC[-1]+0.00256*COS(RADIANS(125.04-1934.136*RC[-11])) -> 23.434967668498309 | S270: =DEGREES(ATAN2(COS(RADIANS(RC[-3])),COS(RADIANS(RC[-1]))*SIN(RADIANS(RC[-3])))) -> -176.367088397326 | T270: =DEGREES(ASIN(SIN(RADIANS(RC[-2]))*SIN(RADIANS(RC[-4])))) -> -1.5732838039017778 | U270: =TAN(RADIANS(RC[-3]/2))*TAN(RADIANS(RC[-3]/2)) -> 4.3018203652991263E-2 | V270: =4*DEGREES(RC[-1]*SIN(2*RADIANS(RC[-13]))-2*RC[-11]*SIN(RADIANS(RC[-12]))+4*RC[-11]*RC[-1]*SIN(RADIANS(RC[-12]))*COS(2*RADIANS(RC[-13]))-0.5*RC[-1]*RC[-1]*SIN(4*RADIANS(RC[-13]))-1.25*RC[-11]*RC[-11]*SIN(2*RADIANS(RC[-12]))) -> 8.8500758019284724 | W270: =DEGREES(ACOS(COS(RADIANS(90.833))/(COS(RADIANS(R2C2))*COS(RADIANS(RC[-3])))-TAN(RADIANS(R2C2))*TAN(RADIANS(RC[-3])))) -> 88.112371809029312 | X270: =(720-4*R3C2-RC[-2]+R4C2*60)/1440 -> 1899-12-31T13:47:08.995 | Y270: =(RC[-1]*1440-RC[-2]*4)/1440 -> 1899-12-31T07:54:42.026 | Z270: =(RC[-2]*1440+RC[-3]*4)/1440 -> 1899-12-31T19:39:35.965 | AA270: =8*RC[-4] -> 704.8989744722345 | AB270: =MOD(RC[-23]*1440+RC[-6]+4*R3C2-60*R4C2,1440) -> 732.85007580192848 | AC270: =IF(RC[-1]/4<0,RC[-1]/4+180,RC[-1]/4-180) -> 3.2125189504821208 | AD270: =DEGREES(ACOS(SIN(RADIANS(R2C2))*SIN(RADIANS(RC[-10]))+COS(RADIANS(R2C2))*COS(RADIANS(RC[-10]))*COS(RADIANS(RC[-1])))) -> 71.605727470783435 | AE270: =90-RC[-1] -> 18.394272529216565 | AF270: =IF(RC[-1]>85,0,IF(RC[-1]>5,58.1/TAN(RADIANS(RC[-1]))-0.07/POWER(TAN(RADIANS(RC[-1])),3)+0.000086/POWER(TAN(RADIANS(RC[-1])),5),IF(RC[-1]>-0.575,1735+RC[-1]*(-518.2+RC[-1]*(103.4+RC[-1]*(-12.79+RC[-1]*0.711))),-20.772/TAN(RADIANS(RC[-1])))))/3600 -> 4.8008617071831183E-2 | AG270: =RC[-2]+RC[-1] -> 18.442281146288394 | AH270: =IF(RC[-5]>0,MOD(DEGREES(ACOS(((SIN(RADIANS(R2C2))*COS(RADIANS(RC[-4])))-SIN(RADIANS(RC[-14])))/(COS(RADIANS(R2C2))*SIN(RADIANS(RC[-4])))))+180,360),MOD(540-DEGREES(ACOS(((SIN(RADIANS(R2C2))*COS(RADIANS(RC[-4])))-SIN(RADIANS(RC[-14])))/(COS(RADIANS(R2C2))*SIN(RADIANS(RC[-4]))))),360)) -> 183.38441063325376
D271: =R[-1]C+1 -> 2017-09-27T00:00:00.000 | E271: =R5C2 -> 1899-12-31T14:00:00.000 | F271: =RC[-2]+2415018.5+RC[-1]-R4C2/24 -> 2458024.375 | G271: =(RC[-1]-2451545)/36525 -> 0.17739561943874058 | I271: =MOD(280.46646+RC[-2]*(36000.76983 + RC[-2]*0.0003032),360) -> 186.84533380583616 | J271: =357.52911+RC[-3]*(35999.05029 - 0.0001537*RC[-3]) -> 6743.6029305641068 | K271: =0.016708634-RC[-4]*(0.000042037+0.0000001267*RC[-4]) -> 1.6701172833197279E-2 | L271: =SIN(RADIANS(RC[-2]))*(1.914602-RC[-5]*(0.004817+0.000014*RC[-5]))+SIN(RADIANS(2*RC[-2]))*(0.019993-0.000101*RC[-5])+SIN(RADIANS(3*RC[-2]))*0.000289 -> -1.8971349306417526 | M271: =RC[-4]+RC[-1] -> 184.94819887519441 | N271: =RC[-4]+RC[-2] -> 6741.7057956334647 | O271: =(1.000001018*(1-RC[-4]*RC[-4]))/(1+RC[-4]*COS(RADIANS(RC[-1]))) -> 1.0021364820263237 | P271: =RC[-3]-0.00569-0.00478*SIN(RADIANS(125.04-1934.136*RC[-9])) -> 184.93956159402751 | Q271: =23+(26+((21.448-RC[-10]*(46.815+RC[-10]*(0.00059-RC[-10]*0.001813))))/60)/60 -> 23.436984226563947 | R271: =RC[-1]+0.00256*COS(RADIANS(125.04-1934.136*RC[-11])) -> 23.434968770442776 | S271: =DEGREES(ATAN2(COS(RADIANS(RC[-3])),COS(RADIANS(RC[-1]))*SIN(RADIANS(RC[-3])))) -> -175.46611803477339 | T271: =DEGREES(ASIN(SIN(RADIANS(RC[-2]))*SIN(RADIANS(RC[-4])))) -> -1.9624539515976671 | U271: =TAN(RADIANS(RC[-3]/2))*TAN(RADIANS(RC[-3]/2)) -> 4.3018207813583086E-2 | V271: =4*DEGREES(RC[-1]*SIN(2*RADIANS(RC[-13]))-2*RC[-11]*SIN(RADIANS(RC[-12]))+4*RC[-11]*RC[-1]*SIN(RADIANS(RC[-12]))*COS(2*RADIANS(RC[-13]))-0.5*RC[-1]*RC[-1]*SIN(4*RADIANS(RC[-13]))-1.25*RC[-11]*RC[-11]*SIN(2*RADIANS(RC[-12]))) -> 9.1898707553579353 | W271: =DEGREES(ACOS(COS(RADIANS(90.833))/(COS(RADIANS(R2C2))*COS(RADIANS(RC[-3])))-TAN(RADIANS(R2C2))*TAN(RADIANS(RC[-3])))) -> 87.041650865609725 | X271: =(720-4*R3C2-RC[-2]+R4C2*60)/1440 -> 1899-12-31T13:46:48.608 | Y271: =(RC[-1]*1440-RC[-2]*4)/1440 -> 1899-12-31T07:58:38.612 | Z271: =(RC[-2]*1440+RC[-3]*4)/1440 -> 1899-12-31T19:34:58.604 | AA271: =8*RC[-4] -> 696.3332069248778 | AB271: =MOD(RC[-23]*1440+RC[-6]+4*R3C2-60*R4C2,1440) -> 733.1898707553579 | AC271: =IF(RC[-1]/4<0,RC[-1]/4+180,RC[-1]/4-180) -> 3.2974676888394754 | AD271: =DEGREES(ACOS(SIN(RADIANS(R2C2))*SIN(RADIANS(RC[-10]))+COS(RADIANS(R2C2))*COS(RADIANS(RC[-10]))*COS(RADIANS(RC[-1])))) -> 71.996552011922461 | AE271: =90-RC[-1] -> 18.003447988077539 | AF271: =IF(RC[-1]>85,0,IF(RC[-1]>5,58.1/TAN(RADIANS(RC[-1]))-0.07/POWER(TAN(RADIANS(RC[-1])),3)+0.000086/POWER(TAN(RADIANS(RC[-1])),5),IF(RC[-1]>-0.575,1735+RC[-1]*(-518.2+RC[-1]*(103.4+RC[-1]*(-12.79+RC[-1]*0.711))),-20.772/TAN(RADIANS(RC[-1])))))/3600 -> 4.910031260603917E-2 | AG271: =RC[-2]+RC[-1] -> 18.052548300683579 | AH271: =IF(RC[-5]>0,MOD(DEGREES(ACOS(((SIN(RADIANS(R2C2))*COS(RADIANS(RC[-4])))-SIN(RADIANS(RC[-14])))/(COS(RADIANS(R2C2))*SIN(RADIANS(RC[-4])))))+180,360),MOD(540-DEGREES(ACOS(((SIN(RADIANS(R2C2))*COS(RADIANS(RC[-4])))-SIN(RADIANS(RC[-14])))/(COS(RADIANS(R2C2))*SIN(RADIANS(RC[-4]))))),360)) -> 183.4653967685787
D272: =R[-1]C+1 -> 2017-09-28T00:00:00.000 | E272: =R5C2 -> 1899-12-31T14:00:00.000 | F272: =RC[-2]+2415018.5+RC[-1]-R4C2/24 -> 2458025.375 | G272: =(RC[-1]-2451545)/36525 -> 0.1774229979466119 | I272: =MOD(280.46646+RC[-2]*(36000.76983 + RC[-2]*0.0003032),360) -> 187.83098116894598 | J272: =357.52911+RC[-3]*(35999.05029 - 0.0001537*RC[-3]) -> 6744.5885308443385 | K272: =0.016708634-RC[-4]*(0.000042037+0.0000001267*RC[-4]) -> 1.6701171681056129E-2 | L272: =SIN(RADIANS(RC[-2]))*(1.914602-RC[-5]*(0.004817+0.000014*RC[-5]))+SIN(RADIANS(2*RC[-2]))*(0.019993-0.000101*RC[-5])+SIN(RADIANS(3*RC[-2]))*0.000289 -> -1.90118925840932 | M272: =RC[-4]+RC[-1] -> 185.92979191053666 | N272: =RC[-4]+RC[-2] -> 6742.6873415859291 | O272: =(1.000001018*(1-RC[-4]*RC[-4]))/(1+RC[-4]*COS(RADIANS(RC[-1]))) -> 1.0018518128311484 | P272: =RC[-3]-0.00569-0.00478*SIN(RADIANS(125.04-1934.136*RC[-9])) -> 185.92115115258215 | Q272: =23+(26+((21.448-RC[-10]*(46.815+RC[-10]*(0.00059-RC[-10]*0.001813))))/60)/60 -> 23.43698387052898 | R272: =RC[-1]+0.00256*COS(RADIANS(125.04-1934.136*RC[-11])) -> 23.434969874108805 | S272: =DEGREES(ATAN2(COS(RADIANS(RC[-3])),COS(RADIANS(RC[-1]))*SIN(RADIANS(RC[-3])))) -> -174.56421675884468 | T272: =DEGREES(ASIN(SIN(RADIANS(RC[-2]))*SIN(RADIANS(RC[-4])))) -> -2.3513594826238289 | U272: =TAN(RADIANS(RC[-3]/2))*TAN(RADIANS(RC[-3]/2)) -> 4.3018211980675194E-2 | V272: =4*DEGREES(RC[-1]*SIN(2*RADIANS(RC[-13]))-2*RC[-11]*SIN(RADIANS(RC[-12]))+4*RC[-11]*RC[-1]*SIN(RADIANS(RC[-12]))*COS(2*RADIANS(RC[-13]))-0.5*RC[-1]*RC[-1]*SIN(4*RADIANS(RC[-13]))-1.25*RC[-11]*RC[-11]*SIN(2*RADIANS(RC[-12]))) -> 9.5260966321938607 | W272: =DEGREES(ACOS(COS(RADIANS(90.833))/(COS(RADIANS(R2C2))*COS(RADIANS(RC[-3])))-TAN(RADIANS(R2C2))*TAN(RADIANS(RC[-3])))) -> 85.970237750911267 | X272: =(720-4*R3C2-RC[-2]+R4C2*60)/1440 -> 1899-12-31T13:46:28.434 | Y272: =(RC[-1]*1440-RC[-2]*4)/1440 -> 1899-12-31T08:02:35.577 | Z272: =(RC[-2]*1440+RC[-3]*4)/1440 -> 1899-12-31T19:30:21.291 | AA272: =8*RC[-4] -> 687.76190200729013 | AB272: =MOD(RC[-23]*1440+RC[-6]+4*R3C2-60*R4C2,1440) -> 733.52609663219391 | AC272: =IF(RC[-1]/4<0,RC[-1]/4+180,RC[-1]/4-180) -> 3.3815241580484781 | AD272: =DEGREES(ACOS(SIN(RADIANS(R2C2))*SIN(RADIANS(RC[-10]))+COS(RADIANS(R2C2))*COS(RADIANS(RC[-10]))*COS(RADIANS(RC[-1])))) -> 72.387130097309495 | AE272: =90-RC[-1] -> 17.612869902690505 | AF272: =IF(RC[-1]>85,0,IF(RC[-1]>5,58.1/TAN(RADIANS(RC[-1]))-0.07/POWER(TAN(RADIANS(RC[-1])),3)+0.000086/POWER(TAN(RADIANS(RC[-1])),5),IF(RC[-1]>-0.575,1735+RC[-1]*(-518.2+RC[-1]*(103.4+RC[-1]*(-12.79+RC[-1]*0.711))),-20.772/TAN(RADIANS(RC[-1])))))/3600 -> 5.0236288719034732E-2 | AG272: =RC[-2]+RC[-1] -> 17.66310619140954 | AH272: =IF(RC[-5]>0,MOD(DEGREES(ACOS(((SIN(RADIANS(R2C2))*COS(RADIANS(RC[-4])))-SIN(RADIANS(RC[-14])))/(COS(RADIANS(R2C2))*SIN(RADIANS(RC[-4])))))+180,360),MOD(540-DEGREES(ACOS(((SIN(RADIANS(R2C2))*COS(RADIANS(RC[-4])))-SIN(RADIANS(RC[-14])))/(COS(RADIANS(R2C2))*SIN(RADIANS(RC[-4]))))),360)) -> 183.54505379392572
D273: =R[-1]C+1 -> 2017-09-29T00:00:00.000 | E273: =R5C2 -> 1899-12-31T14:00:00.000 | F273: =RC[-2]+2415018.5+RC[-1]-R4C2/24 -> 2458026.375 | G273: =(RC[-1]-2451545)/36525 -> 0.17745037645448322 | I273: =MOD(280.46646+RC[-2]*(36000.76983 + RC[-2]*0.0003032),360) -> 188.8166285320558 | J273: =357.52911+RC[-3]*(35999.05029 - 0.0001537*RC[-3]) -> 6745.5741311245702 | K273: =0.016708634-RC[-4]*(0.000042037+0.0000001267*RC[-4]) -> 1.6701170528914788E-2 | L273: =SIN(RADIANS(RC[-2]))*(1.914602-RC[-5]*(0.004817+0.000014*RC[-5]))+SIN(RADIANS(2*RC[-2]))*(0.019993-0.000101*RC[-5])+SIN(RADIANS(3*RC[-2]))*0.000289 -> -1.904685008726904 | M273: =RC[-4]+RC[-1] -> 186.91194352332889 | N273: =RC[-4]+RC[-2] -> 6743.6694461158431 | O273: =(1.000001018*(1-RC[-4]*RC[-4]))/(1+RC[-4]*COS(RADIANS(RC[-1]))) -> 1.00156651698933 | P273: =RC[-3]-0.00569-0.00478*SIN(RADIANS(125.04-1934.136*RC[-9])) -> 186.90329929110723 | Q273: =23+(26+((21.448-RC[-10]*(46.815+RC[-10]*(0.00059-RC[-10]*0.001813))))/60)/60 -> 23.43698351449401 | R273: =RC[-1]+0.00256*COS(RADIANS(125.04-1934.136*RC[-11])) -> 23.434970979495141 | S273: =DEGREES(ATAN2(COS(RADIANS(RC[-3])),COS(RADIANS(RC[-1]))*SIN(RADIANS(RC[-3])))) -> -173.66129932131599 | T273: =DEGREES(ASIN(SIN(RADIANS(RC[-2]))*SIN(RADIANS(RC[-4])))) -> -2.739903555162384 | U273: =TAN(RADIANS(RC[-3]/2))*TAN(RADIANS(RC[-3]/2)) -> 4.3018216154262864E-2 | V273: =4*DEGREES(RC[-1]*SIN(2*RADIANS(RC[-13]))-2*RC[-11]*SIN(RADIANS(RC[-12]))+4*RC[-11]*RC[-1]*SIN(RADIANS(RC[-12]))*COS(2*RADIANS(RC[-13]))-0.5*RC[-1]*RC[-1]*SIN(4*RADIANS(RC[-13]))-1.25*RC[-11]*RC[-11]*SIN(2*RADIANS(RC[-12]))) -> 9.85841056186554 | W273: =DEGREES(ACOS(COS(RADIANS(90.833))/(COS(RADIANS(R2C2))*COS(RADIANS(RC[-3])))-TAN(RADIANS(R2C2))*TAN(RADIANS(RC[-3])))) -> 84.897923826495912 | X273: =(720-4*R3C2-RC[-2]+R4C2*60)/1440 -> 1899-12-31T13:46:08.495 | Y273: =(RC[-1]*1440-RC[-2]*4)/1440 -> 1899-12-31T08:06:32.994 | Z273: =(RC[-2]*1440+RC[-3]*4)/1440 -> 1899-12-31T19:25:43.997 | AA273: =8*RC[-4] -> 679.1833906119673 | AB273: =MOD(RC[-23]*1440+RC[-6]+4*R3C2-60*R4C2,1440) -> 733.85841056186553 | AC273: =IF(RC[-1]/4<0,RC[-1]/4+180,RC[-1]/4-180) -> 3.4646026404663814 | AD273: =DEGREES(ACOS(SIN(RADIANS(R2C2))*SIN(RADIANS(RC[-10]))+COS(RADIANS(R2C2))*COS(RADIANS(RC[-10]))*COS(RADIANS(RC[-1])))) -> 72.777361511614117 | AE273: =90-RC[-1] -> 17.222638488385883 | AF273: =IF(RC[-1]>85,0,IF(RC[-1]>5,58.1/TAN(RADIANS(RC[-1]))-0.07/POWER(TAN(RADIANS(RC[-1])),3)+0.000086/POWER(TAN(RADIANS(RC[-1])),5),IF(RC[-1]>-0.575,1735+RC[-1]*(-518.2+RC[-1]*(103.4+RC[-1]*(-12.79+RC[-1]*0.711))),-20.772/TAN(RADIANS(RC[-1])))))/3600 -> 5.1419049487761645E-2 | AG273: =RC[-2]+RC[-1] -> 17.274057537873645 | AH273: =IF(RC[-5]>0,MOD(DEGREES(ACOS(((SIN(RADIANS(R2C2))*COS(RADIANS(RC[-4])))-SIN(RADIANS(RC[-14])))/(COS(RADIANS(R2C2))*SIN(RADIANS(RC[-4])))))+180,360),MOD(540-DEGREES(ACOS(((SIN(RADIANS(R2C2))*COS(RADIANS(RC[-4])))-SIN(RADIANS(RC[-14])))/(COS(RADIANS(R2C2))*SIN(RADIANS(RC[-4]))))),360)) -> 183.6233033571261
D274: =R[-1]C+1 -> 2017-09-30T00:00:00.000 | E274: =R5C2 -> 1899-12-31T14:00:00.000 | F274: =RC[-2]+2415018.5+RC[-1]-R4C2/24 -> 2458027.375 | G274: =(RC[-1]-2451545)/36525 -> 0.17747775496235454 | I274: =MOD(280.46646+RC[-2]*(36000.76983 + RC[-2]*0.0003032),360) -> 189.80227589516653 | J274: =357.52911+RC[-3]*(35999.05029 - 0.0001537*RC[-3]) -> 6746.5597314048018 | K274: =0.016708634-RC[-4]*(0.000042037+0.0000001267*RC[-4]) -> 1.6701169376773257E-2 | L274: =SIN(RADIANS(RC[-2]))*(1.914602-RC[-5]*(0.004817+0.000014*RC[-5]))+SIN(RADIANS(2*RC[-2]))*(0.019993-0.000101*RC[-5])+SIN(RADIANS(3*RC[-2]))*0.000289 -> -1.9076205552770278 | M274: =RC[-4]+RC[-1] -> 187.89465533988951 | N274: =RC[-4]+RC[-2] -> 6744.6521108495244 | O274: =(1.000001018*(1-RC[-4]*RC[-4]))/(1+RC[-4]*COS(RADIANS(RC[-1]))) -> 1.0012806779888712 | P274: =RC[-3]-0.00569-0.00478*SIN(RADIANS(125.04-1934.136*RC[-9])) -> 187.88600763592413 | Q274: =23+(26+((21.448-RC[-10]*(46.815+RC[-10]*(0.00059-RC[-10]*0.001813))))/60)/60 -> 23.436983158459039 | R274: =RC[-1]+0.00256*COS(RADIANS(125.04-1934.136*RC[-11])) -> 23.434972086600542 | S274: =DEGREES(ATAN2(COS(RADIANS(RC[-3])),COS(RADIANS(RC[-1]))*SIN(RADIANS(RC[-3])))) -> -172.75728064931752 | T274: =DEGREES(ASIN(SIN(RADIANS(RC[-2]))*SIN(RADIANS(RC[-4])))) -> -3.1279888593111154 | U274: =TAN(RADIANS(RC[-3]/2))*TAN(RADIANS(RC[-3]/2)) -> 4.3018220334341398E-2 | V274: =4*DEGREES(RC[-1]*SIN(2*RADIANS(RC[-13]))-2*RC[-11]*SIN(RADIANS(RC[-12]))+4*RC[-11]*RC[-1]*SIN(RADIANS(RC[-12]))*COS(2*RADIANS(RC[-13]))-0.5*RC[-1]*RC[-1]*SIN(4*RADIANS(RC[-13]))-1.25*RC[-11]*RC[-11]*SIN(2*RADIANS(RC[-12]))) -> 10.186469254441974 | W274: =DEGREES(ACOS(COS(RADIANS(90.833))/(COS(RADIANS(R2C2))*COS(RADIANS(RC[-3])))-TAN(RADIANS(R2C2))*TAN(RADIANS(RC[-3])))) -> 83.82450008460539 | X274: =(720-4*R3C2-RC[-2]+R4C2*60)/1440 -> 1899-12-31T13:45:48.812 | Y274: =(RC[-1]*1440-RC[-2]*4)/1440 -> 1899-12-31T08:10:30.932 | Z274: =(RC[-2]*1440+RC[-3]*4)/1440 -> 1899-12-31T19:21:06.692 | AA274: =8*RC[-4] -> 670.59600067684312 | AB274: =MOD(RC[-23]*1440+RC[-6]+4*R3C2-60*R4C2,1440) -> 734.18646925444193 | AC274: =IF(RC[-1]/4<0,RC[-1]/4+180,RC[-1]/4-180) -> 3.5466173136104828 | AD274: =DEGREES(ACOS(SIN(RADIANS(R2C2))*SIN(RADIANS(RC[-10]))+COS(RADIANS(R2C2))*COS(RADIANS(RC[-10]))*COS(RADIANS(RC[-1])))) -> 73.167145444701447 | AE274: =90-RC[-1] -> 16.832854555298553 | AF274: =IF(RC[-1]>85,0,IF(RC[-1]>5,58.1/TAN(RADIANS(RC[-1]))-0.07/POWER(TAN(RADIANS(RC[-1])),3)+0.000086/POWER(TAN(RADIANS(RC[-1])),5),IF(RC[-1]>-0.575,1735+RC[-1]*(-518.2+RC[-1]*(103.4+RC[-1]*(-12.79+RC[-1]*0.711))),-20.772/TAN(RADIANS(RC[-1])))))/3600 -> 5.2651282094949355E-2 | AG274: =RC[-2]+RC[-1] -> 16.885505837393502 | AH274: =IF(RC[-5]>0,MOD(DEGREES(ACOS(((SIN(RADIANS(R2C2))*COS(RADIANS(RC[-4])))-SIN(RADIANS(RC[-14])))/(COS(RADIANS(R2C2))*SIN(RADIANS(RC[-4])))))+180,360),MOD(540-DEGREES(ACOS(((SIN(RADIANS(R2C2))*COS(RADIANS(RC[-4])))-SIN(RADIANS(RC[-14])))/(COS(RADIANS(R2C2))*SIN(RADIANS(RC[-4]))))),360)) -> 183.700067893567
D275: =R[-1]C+1 -> 2017-10-01T00:00:00.000 | E275: =R5C2 -> 1899-12-31T14:00:00.000 | F275: =RC[-2]+2415018.5+RC[-1]-R4C2/24 -> 2458028.375 | G275: =(RC[-1]-2451545)/36525 -> 0.17750513347022587 | I275: =MOD(280.46646+RC[-2]*(36000.76983 + RC[-2]*0.0003032),360) -> 190.78792325827817 | J275: =357.52911+RC[-3]*(35999.05029 - 0.0001537*RC[-3]) -> 6747.5453316850326 | K275: =0.016708634-RC[-4]*(0.000042037+0.0000001267*RC[-4]) -> 1.6701168224631538E-2 | L275: =SIN(RADIANS(RC[-2]))*(1.914602-RC[-5]*(0.004817+0.000014*RC[-5]))+SIN(RADIANS(2*RC[-2]))*(0.019993-0.000101*RC[-5])+SIN(RADIANS(3*RC[-2]))*0.000289 -> -1.909994432505864 | M275: =RC[-4]+RC[-1] -> 188.8779288257723 | N275: =RC[-4]+RC[-2] -> 6745.6353372525264 | O275: =(1.000001018*(1-RC[-4]*RC[-4]))/(1+RC[-4]*COS(RADIANS(RC[-1]))) -> 1.0009943796201681 | P275: =RC[-3]-0.00569-0.00478*SIN(RADIANS(125.04-1934.136*RC[-9])) -> 188.8692776525896 | Q275: =23+(26+((21.448-RC[-10]*(46.815+RC[-10]*(0.00059-RC[-10]*0.001813))))/60)/60 -> 23.436982802424073 | R275: =RC[-1]+0.00256*COS(RADIANS(125.04-1934.136*RC[-11])) -> 23.434973195423755 | S275: =DEGREES(ATAN2(COS(RADIANS(RC[-3])),COS(RADIANS(RC[-1]))*SIN(RADIANS(RC[-3])))) -> -171.85207590075493 | T275: =DEGREES(ASIN(SIN(RADIANS(RC[-2]))*SIN(RADIANS(RC[-4])))) -> -3.5155176039696823 | U275: =TAN(RADIANS(RC[-3]/2))*TAN(RADIANS(RC[-3]/2)) -> 4.3018224520906055E-2 | V275: =4*DEGREES(RC[-1]*SIN(2*RADIANS(RC[-13]))-2*RC[-11]*SIN(RADIANS(RC[-12]))+4*RC[-11]*RC[-1]*SIN(RADIANS(RC[-12]))*COS(2*RADIANS(RC[-13]))-0.5*RC[-1]*RC[-1]*SIN(4*RADIANS(RC[-13]))-1.25*RC[-11]*RC[-11]*SIN(2*RADIANS(RC[-12]))) -> 10.509929212181872 | W275: =DEGREES(ACOS(COS(RADIANS(90.833))/(COS(RADIANS(R2C2))*COS(RADIANS(RC[-3])))-TAN(RADIANS(R2C2))*TAN(RADIANS(RC[-3])))) -> 82.749756790574907 | X275: =(720-4*R3C2-RC[-2]+R4C2*60)/1440 -> 1899-12-31T13:45:29.404 | Y275: =(RC[-1]*1440-RC[-2]*4)/1440 -> 1899-12-31T08:14:29.463 | Z275: =(RC[-2]*1440+RC[-3]*4)/1440 -> 1899-12-31T19:16:29.346 | AA275: =8*RC[-4] -> 661.99805432459925 | AB275: =MOD(RC[-23]*1440+RC[-6]+4*R3C2-60*R4C2,1440) -> 734.50992921218187 | AC275: =IF(RC[-1]/4<0,RC[-1]/4+180,RC[-1]/4-180) -> 3.6274823030454684 | AD275: =DEGREES(ACOS(SIN(RADIANS(R2C2))*SIN(RADIANS(RC[-10]))+COS(RADIANS(R2C2))*COS(RADIANS(RC[-10]))*COS(RADIANS(RC[-1])))) -> 73.556380486514755 | AE275: =90-RC[-1] -> 16.443619513485245 | AF275: =IF(RC[-1]>85,0,IF(RC[-1]>5,58.1/TAN(RADIANS(RC[-1]))-0.07/POWER(TAN(RADIANS(RC[-1])),3)+0.000086/POWER(TAN(RADIANS(RC[-1])),5),IF(RC[-1]>-0.575,1735+RC[-1]*(-518.2+RC[-1]*(103.4+RC[-1]*(-12.79+RC[-1]*0.711))),-20.772/TAN(RADIANS(RC[-1])))))/3600 -> 5.3935872788748715E-2 | AG275: =RC[-2]+RC[-1] -> 16.497555386273994 | AH275: =IF(RC[-5]>0,MOD(DEGREES(ACOS(((SIN(RADIANS(R2C2))*COS(RADIANS(RC[-4])))-SIN(RADIANS(RC[-14])))/(COS(RADIANS(R2C2))*SIN(RADIANS(RC[-4])))))+180,360),MOD(540-DEGREES(ACOS(((SIN(RADIANS(R2C2))*COS(RADIANS(RC[-4])))-SIN(RADIANS(RC[-14])))/(COS(RADIANS(R2C2))*SIN(RADIANS(RC[-4]))))),360)) -> 183.7752706688855
D276: =R[-1]C+1 -> 2017-10-02T00:00:00.000 | E276: =R5C2 -> 1899-12-31T14:00:00.000 | F276: =RC[-2]+2415018.5+RC[-1]-R4C2/24 -> 2458029.375 | G276: =(RC[-1]-2451545)/36525 -> 0.17753251197809719 | I276: =MOD(280.46646+RC[-2]*(36000.76983 + RC[-2]*0.0003032),360) -> 191.77357062138799 | J276: =357.52911+RC[-3]*(35999.05029 - 0.0001537*RC[-3]) -> 6748.5309319652633 | K276: =0.016708634-RC[-4]*(0.000042037+0.0000001267*RC[-4]) -> 1.6701167072489628E-2 | L276: =SIN(RADIANS(RC[-2]))*(1.914602-RC[-5]*(0.004817+0.000014*RC[-5]))+SIN(RADIANS(2*RC[-2]))*(0.019993-0.000101*RC[-5])+SIN(RADIANS(3*RC[-2]))*0.000289 -> -1.9118053367527592 | M276: =RC[-4]+RC[-1] -> 189.86176528463523 | N276: =RC[-4]+RC[-2] -> 6746.6191266285105 | O276: =(1.000001018*(1-RC[-4]*RC[-4]))/(1+RC[-4]*COS(RADIANS(RC[-1]))) -> 1.0007077059524527 | P276: =RC[-3]-0.00569-0.00478*SIN(RADIANS(125.04-1934.136*RC[-9])) -> 189.8531106447646 | Q276: =23+(26+((21.448-RC[-10]*(46.815+RC[-10]*(0.00059-RC[-10]*0.001813))))/60)/60 -> 23.436982446389102 | R276: =RC[-1]+0.00256*COS(RADIANS(125.04-1934.136*RC[-11])) -> 23.434974305963529 | S276: =DEGREES(ATAN2(COS(RADIANS(RC[-3])),COS(RADIANS(RC[-1]))*SIN(RADIANS(RC[-3])))) -> -170.9456005210171 | T276: =DEGREES(ASIN(SIN(RADIANS(RC[-2]))*SIN(RADIANS(RC[-4])))) -> -3.902391504337356 | U276: =TAN(RADIANS(RC[-3]/2))*TAN(RADIANS(RC[-3]/2)) -> 4.3018228713952118E-2 | V276: =4*DEGREES(RC[-1]*SIN(2*RADIANS(RC[-13]))-2*RC[-11]*SIN(RADIANS(RC[-12]))+4*RC[-11]*RC[-1]*SIN(RADIANS(RC[-12]))*COS(2*RADIANS(RC[-13]))-0.5*RC[-1]*RC[-1]*SIN(4*RADIANS(RC[-13]))-1.25*RC[-11]*RC[-11]*SIN(2*RADIANS(RC[-12]))) -> 10.828446954997569 | W276: =DEGREES(ACOS(COS(RADIANS(90.833))/(COS(RADIANS(R2C2))*COS(RADIANS(RC[-3])))-TAN(RADIANS(R2C2))*TAN(RADIANS(RC[-3])))) -> 81.673483116556142 | X276: =(720-4*R3C2-RC[-2]+R4C2*60)/1440 -> 1899-12-31T13:45:10.293 | Y276: =(RC[-1]*1440-RC[-2]*4)/1440 -> 1899-12-31T08:18:28.657 | Z276: =(RC[-2]*1440+RC[-3]*4)/1440 -> 1899-12-31T19:11:51.929 | AA276: =8*RC[-4] -> 653.38786493244913 | AB276: =MOD(RC[-23]*1440+RC[-6]+4*R3C2-60*R4C2,1440) -> 734.82844695499762 | AC276: =IF(RC[-1]/4<0,RC[-1]/4+180,RC[-1]/4-180) -> 3.7071117387494041 | AD276: =DEGREES(ACOS(SIN(RADIANS(R2C2))*SIN(RADIANS(RC[-10]))+COS(RADIANS(R2C2))*COS(RADIANS(RC[-10]))*COS(RADIANS(RC[-1])))) -> 73.94496462312982 | AE276: =90-RC[-1] -> 16.05503537687018 | AF276: =IF(RC[-1]>85,0,IF(RC[-1]>5,58.1/TAN(RADIANS(RC[-1]))-0.07/POWER(TAN(RADIANS(RC[-1])),3)+0.000086/POWER(TAN(RADIANS(RC[-1])),5),IF(RC[-1]>-0.575,1735+RC[-1]*(-518.2+RC[-1]*(103.4+RC[-1]*(-12.79+RC[-1]*0.711))),-20.772/TAN(RADIANS(RC[-1])))))/3600 -> 5.5275924428989785E-2 | AG276: =RC[-2]+RC[-1] -> 16.11031130129917 | AH276: =IF(RC[-5]>0,MOD(DEGREES(ACOS(((SIN(RADIANS(R2C2))*COS(RADIANS(RC[-4])))-SIN(RADIANS(RC[-14])))/(COS(RADIANS(R2C2))*SIN(RADIANS(RC[-4])))))+180,360),MOD(540-DEGREES(ACOS(((SIN(RADIANS(R2C2))*COS(RADIANS(RC[-4])))-SIN(RADIANS(RC[-14])))/(COS(RADIANS(R2C2))*SIN(RADIANS(RC[-4]))))),360)) -> 183.84883582416481
D277: =R[-1]C+1 -> 2017-10-03T00:00:00.000 | E277: =R5C2 -> 1899-12-31T14:00:00.000 | F277: =RC[-2]+2415018.5+RC[-1]-R4C2/24 -> 2458030.375 | G277: =(RC[-1]-2451545)/36525 -> 0.17755989048596851 | I277: =MOD(280.46646+RC[-2]*(36000.76983 + RC[-2]*0.0003032),360) -> 192.75921798450054 | J277: =357.52911+RC[-3]*(35999.05029 - 0.0001537*RC[-3]) -> 6749.516532245495 | K277: =0.016708634-RC[-4]*(0.000042037+0.0000001267*RC[-4]) -> 1.6701165920347528E-2 | L277: =SIN(RADIANS(RC[-2]))*(1.914602-RC[-5]*(0.004817+0.000014*RC[-5]))+SIN(RADIANS(2*RC[-2]))*(0.019993-0.000101*RC[-5])+SIN(RADIANS(3*RC[-2]))*0.000289 -> -1.913052127339592 | M277: =RC[-4]+RC[-1] -> 190.84616585716094 | N277: =RC[-4]+RC[-2] -> 6747.6034801181559 | O277: =(1.000001018*(1-RC[-4]*RC[-4]))/(1+RC[-4]*COS(RADIANS(RC[-1]))) -> 1.0004207413099893 | P277: =RC[-3]-0.00569-0.00478*SIN(RADIANS(125.04-1934.136*RC[-9])) -> 190.8375077531347 | Q277: =23+(26+((21.448-RC[-10]*(46.815+RC[-10]*(0.00059-RC[-10]*0.001813))))/60)/60 -> 23.436982090354132 | R277: =RC[-1]+0.00256*COS(RADIANS(125.04-1934.136*RC[-11])) -> 23.434975418218613 | S277: =DEGREES(ATAN2(COS(RADIANS(RC[-3])),COS(RADIANS(RC[-1]))*SIN(RADIANS(RC[-3])))) -> -170.03777030105755 | T277: =DEGREES(ASIN(SIN(RADIANS(RC[-2]))*SIN(RADIANS(RC[-4])))) -> -4.2885117701006559 | U277: =TAN(RADIANS(RC[-3]/2))*TAN(RADIANS(RC[-3]/2)) -> 4.3018232913474889E-2 | V277: =4*DEGREES(RC[-1]*SIN(2*RADIANS(RC[-13]))-2*RC[-11]*SIN(RADIANS(RC[-12]))+4*RC[-11]*RC[-1]*SIN(RADIANS(RC[-12]))*COS(2*RADIANS(RC[-13]))-0.5*RC[-1]*RC[-1]*SIN(4*RADIANS(RC[-13]))-1.25*RC[-11]*RC[-11]*SIN(2*RADIANS(RC[-12]))) -> 11.141679260448486 | W277: =DEGREES(ACOS(COS(RADIANS(90.833))/(COS(RADIANS(R2C2))*COS(RADIANS(RC[-3])))-TAN(RADIANS(R2C2))*TAN(RADIANS(RC[-3])))) -> 80.595466763217203 | X277: =(720-4*R3C2-RC[-2]+R4C2*60)/1440 -> 1899-12-31T13:44:51.499 | Y277: =(RC[-1]*1440-RC[-2]*4)/1440 -> 1899-12-31T08:22:28.587 | Z277: =(RC[-2]*1440+RC[-3]*4)/1440 -> 1899-12-31T19:07:14.411 | AA277: =8*RC[-4] -> 644.76373410573763 | AB277: =MOD(RC[-23]*1440+RC[-6]+4*R3C2-60*R4C2,1440) -> 735.14167926044854 | AC277: =IF(RC[-1]/4<0,RC[-1]/4+180,RC[-1]/4-180) -> 3.7854198151121352 | AD277: =DEGREES(ACOS(SIN(RADIANS(R2C2))*SIN(RADIANS(RC[-10]))+COS(RADIANS(R2C2))*COS(RADIANS(RC[-10]))*COS(RADIANS(RC[-1])))) -> 74.332795234055922 | AE277: =90-RC[-1] -> 15.667204765944078 | AF277: =IF(RC[-1]>85,0,IF(RC[-1]>5,58.1/TAN(RADIANS(RC[-1]))-0.07/POWER(TAN(RADIANS(RC[-1])),3)+0.000086/POWER(TAN(RADIANS(RC[-1])),5),IF(RC[-1]>-0.575,1735+RC[-1]*(-518.2+RC[-1]*(103.4+RC[-1]*(-12.79+RC[-1]*0.711))),-20.772/TAN(RADIANS(RC[-1])))))/3600 -> 5.6674775788933124E-2 | AG277: =RC[-2]+RC[-1] -> 15.723879541733011 | AH277: =IF(RC[-5]>0,MOD(DEGREES(ACOS(((SIN(RADIANS(R2C2))*COS(RADIANS(RC[-4])))-SIN(RADIANS(RC[-14])))/(COS(RADIANS(R2C2))*SIN(RADIANS(RC[-4])))))+180,360),MOD(540-DEGREES(ACOS(((SIN(RADIANS(R2C2))*COS(RADIANS(RC[-4])))-SIN(RADIANS(RC[-14])))/(COS(RADIANS(R2C2))*SIN(RADIANS(RC[-4]))))),360)) -> 183.92068842373456
D278: =R[-1]C+1 -> 2017-10-04T00:00:00.000 | E278: =R5C2 -> 1899-12-31T14:00:00.000 | F278: =RC[-2]+2415018.5+RC[-1]-R4C2/24 -> 2458031.375 | G278: =(RC[-1]-2451545)/36525 -> 0.17758726899383984 | I278: =MOD(280.46646+RC[-2]*(36000.76983 + RC[-2]*0.0003032),360) -> 193.74486534761309 | J278: =357.52911+RC[-3]*(35999.05029 - 0.0001537*RC[-3]) -> 6750.5021325257239 | K278: =0.016708634-RC[-4]*(0.000042037+0.0000001267*RC[-4]) -> 1.6701164768205237E-2 | L278: =SIN(RADIANS(RC[-2]))*(1.914602-RC[-5]*(0.004817+0.000014*RC[-5]))+SIN(RADIANS(2*RC[-2]))*(0.019993-0.000101*RC[-5])+SIN(RADIANS(3*RC[-2]))*0.000289 -> -1.9137338276188423 | M278: =RC[-4]+RC[-1] -> 191.83113151999424 | N278: =RC[-4]+RC[-2] -> 6748.5883986981053 | O278: =(1.000001018*(1-RC[-4]*RC[-4]))/(1+RC[-4]*COS(RADIANS(RC[-1]))) -> 1.0001335702480301 | P278: =RC[-3]-0.00569-0.00478*SIN(RADIANS(125.04-1934.136*RC[-9])) -> 191.8224699543477 | Q278: =23+(26+((21.448-RC[-10]*(46.815+RC[-10]*(0.00059-RC[-10]*0.001813))))/60)/60 -> 23.436981734319165 | R278: =RC[-1]+0.00256*COS(RADIANS(125.04-1934.136*RC[-11])) -> 23.434976532187754 | S278: =DEGREES(ATAN2(COS(RADIANS(RC[-3])),COS(RADIANS(RC[-1]))*SIN(RADIANS(RC[-3])))) -> -169.1285014369777 | T278: =DEGREES(ASIN(SIN(RADIANS(RC[-2]))*SIN(RADIANS(RC[-4])))) -> -4.6737790943723949 | U278: =TAN(RADIANS(RC[-3]/2))*TAN(RADIANS(RC[-3]/2)) -> 4.3018237119469602E-2 | V278: =4*DEGREES(RC[-1]*SIN(2*RADIANS(RC[-13]))-2*RC[-11]*SIN(RADIANS(RC[-12]))+4*RC[-11]*RC[-1]*SIN(RADIANS(RC[-12]))*COS(2*RADIANS(RC[-13]))-0.5*RC[-1]*RC[-1]*SIN(4*RADIANS(RC[-13]))-1.25*RC[-11]*RC[-11]*SIN(2*RADIANS(RC[-12]))) -> 11.449283418788541 | W278: =DEGREES(ACOS(COS(RADIANS(90.833))/(COS(RADIANS(R2C2))*COS(RADIANS(RC[-3])))-TAN(RADIANS(R2C2))*TAN(RADIANS(RC[-3])))) -> 79.515493565926462 | X278: =(720-4*R3C2-RC[-2]+R4C2*60)/1440 -> 1899-12-31T13:44:33.043 | Y278: =(RC[-1]*1440-RC[-2]*4)/1440 -> 1899-12-31T08:26:29.325 | Z278: =(RC[-2]*1440+RC[-3]*4)/1440 -> 1899-12-31T19:02:36.761 | AA278: =8*RC[-4] -> 636.1239485274117 | AB278: =MOD(RC[-23]*1440+RC[-6]+4*R3C2-60*R4C2,1440) -> 735.44928341878858 | AC278: =IF(RC[-1]/4<0,RC[-1]/4+180,RC[-1]/4-180) -> 3.8623208546971455 | AD278: =DEGREES(ACOS(SIN(RADIANS(R2C2))*SIN(RADIANS(RC[-10]))+COS(RADIANS(R2C2))*COS(RADIANS(RC[-10]))*COS(RADIANS(RC[-1])))) -> 74.719769090839279 | AE278: =90-RC[-1] -> 15.280230909160721 | AF278: =IF(RC[-1]>85,0,IF(RC[-1]>5,58.1/TAN(RADIANS(RC[-1]))-0.07/POWER(TAN(RADIANS(RC[-1])),3)+0.000086/POWER(TAN(RADIANS(RC[-1])),5),IF(RC[-1]>-0.575,1735+RC[-1]*(-518.2+RC[-1]*(103.4+RC[-1]*(-12.79+RC[-1]*0.711))),-20.772/TAN(RADIANS(RC[-1])))))/3600 -> 5.8136022798455027E-2 | AG278: =RC[-2]+RC[-1] -> 15.338366931959177 | AH278: =IF(RC[-5]>0,MOD(DEGREES(ACOS(((SIN(RADIANS(R2C2))*COS(RADIANS(RC[-4])))-SIN(RADIANS(RC[-14])))/(COS(RADIANS(R2C2))*SIN(RADIANS(RC[-4])))))+180,360),MOD(540-DEGREES(ACOS(((SIN(RADIANS(R2C2))*COS(RADIANS(RC[-4])))-SIN(RADIANS(RC[-14])))/(COS(RADIANS(R2C2))*SIN(RADIANS(RC[-4]))))),360)) -> 183.99075450564706
D279: =R[-1]C+1 -> 2017-10-05T00:00:00.000 | E279: =R5C2 -> 1899-12-31T14:00:00.000 | F279: =RC[-2]+2415018.5+RC[-1]-R4C2/24 -> 2458032.375 | G279: =(RC[-1]-2451545)/36525 -> 0.17761464750171116 | I279: =MOD(280.46646+RC[-2]*(36000.76983 + RC[-2]*0.0003032),360) -> 194.73051271072654 | J279: =357.52911+RC[-3]*(35999.05029 - 0.0001537*RC[-3]) -> 6751.4877328059547 | K279: =0.016708634-RC[-4]*(0.000042037+0.0000001267*RC[-4]) -> 1.6701163616062758E-2 | L279: =SIN(RADIANS(RC[-2]))*(1.914602-RC[-5]*(0.004817+0.000014*RC[-5]))+SIN(RADIANS(2*RC[-2]))*(0.019993-0.000101*RC[-5])+SIN(RADIANS(3*RC[-2]))*0.000289 -> -1.9138496259792384 | M279: =RC[-4]+RC[-1] -> 192.81666308474732 | N279: =RC[-4]+RC[-2] -> 6749.5738831799754 | O279: =(1.000001018*(1-RC[-4]*RC[-4]))/(1+RC[-4]*COS(RADIANS(RC[-1]))) -> 0.99984627752852961 | P279: =RC[-3]-0.00569-0.00478*SIN(RADIANS(125.04-1934.136*RC[-9])) -> 192.80799806001869 | Q279: =23+(26+((21.448-RC[-10]*(46.815+RC[-10]*(0.00059-RC[-10]*0.001813))))/60)/60 -> 23.436981378284194 | R279: =RC[-1]+0.00256*COS(RADIANS(125.04-1934.136*RC[-11])) -> 23.43497764786969 | S279: =DEGREES(ATAN2(COS(RADIANS(RC[-3])),COS(RADIANS(RC[-1]))*SIN(RADIANS(RC[-3])))) -> -168.21771059115844 | T279: =DEGREES(ASIN(SIN(RADIANS(RC[-2]))*SIN(RADIANS(RC[-4])))) -> -5.0580936434794026 | U279: =TAN(RADIANS(RC[-3]/2))*TAN(RADIANS(RC[-3]/2)) -> 4.3018241331931516E-2 | V279: =4*DEGREES(RC[-1]*SIN(2*RADIANS(RC[-13]))-2*RC[-11]*SIN(RADIANS(RC[-12]))+4*RC[-11]*RC[-1]*SIN(RADIANS(RC[-12]))*COS(2*RADIANS(RC[-13]))-0.5*RC[-1]*RC[-1]*SIN(4*RADIANS(RC[-13]))-1.25*RC[-11]*RC[-11]*SIN(2*RADIANS(RC[-12]))) -> 11.750917503537908 | W279: =DEGREES(ACOS(COS(RADIANS(90.833))/(COS(RADIANS(R2C2))*COS(RADIANS(RC[-3])))-TAN(RADIANS(R2C2))*TAN(RADIANS(RC[-3])))) -> 78.433347081561735 | X279: =(720-4*R3C2-RC[-2]+R4C2*60)/1440 -> 1899-12-31T13:44:14.945 | Y279: =(RC[-1]*1440-RC[-2]*4)/1440 -> 1899-12-31T08:30:30.942 | Z279: =(RC[-2]*1440+RC[-3]*4)/1440 -> 1899-12-31T18:57:58.948 | AA279: =8*RC[-4] -> 627.46677665249388 | AB279: =MOD(RC[-23]*1440+RC[-6]+4*R3C2-60*R4C2,1440) -> 735.75091750353795 | AC279: =IF(RC[-1]/4<0,RC[-1]/4+180,RC[-1]/4-180) -> 3.9377293758844871 | AD279: =DEGREES(ACOS(SIN(RADIANS(R2C2))*SIN(RADIANS(RC[-10]))+COS(RADIANS(R2C2))*COS(RADIANS(RC[-10]))*COS(RADIANS(RC[-1])))) -> 75.105782357058132 | AE279: =90-RC[-1] -> 14.894217642941868 | AF279: =IF(RC[-1]>85,0,IF(RC[-1]>5,58.1/TAN(RADIANS(RC[-1]))-0.07/POWER(TAN(RADIANS(RC[-1])),3)+0.000086/POWER(TAN(RADIANS(RC[-1])),5),IF(RC[-1]>-0.575,1735+RC[-1]*(-518.2+RC[-1]*(103.4+RC[-1]*(-12.79+RC[-1]*0.711))),-20.772/TAN(RADIANS(RC[-1])))))/3600 -> 5.9663541932875812E-2 | AG279: =RC[-2]+RC[-1] -> 14.953881184874744 | AH279: =IF(RC[-5]>0,MOD(DEGREES(ACOS(((SIN(RADIANS(R2C2))*COS(RADIANS(RC[-4])))-SIN(RADIANS(RC[-14])))/(COS(RADIANS(R2C2))*SIN(RADIANS(RC[-4])))))+180,360),MOD(540-DEGREES(ACOS(((SIN(RADIANS(R2C2))*COS(RADIANS(RC[-4])))-SIN(RADIANS(RC[-14])))/(COS(RADIANS(R2C2))*SIN(RADIANS(RC[-4]))))),360)) -> 184.05896113488362
D280: =R[-1]C+1 -> 2017-10-06T00:00:00.000 | E280: =R5C2 -> 1899-12-31T14:00:00.000 | F280: =RC[-2]+2415018.5+RC[-1]-R4C2/24 -> 2458033.375 | G280: =(RC[-1]-2451545)/36525 -> 0.17764202600958248 | I280: =MOD(280.46646+RC[-2]*(36000.76983 + RC[-2]*0.0003032),360) -> 195.71616007384 | J280: =357.52911+RC[-3]*(35999.05029 - 0.0001537*RC[-3]) -> 6752.4733330861854 | K280: =0.016708634-RC[-4]*(0.000042037+0.0000001267*RC[-4]) -> 1.6701162463920088E-2 | L280: =SIN(RADIANS(RC[-2]))*(1.914602-RC[-5]*(0.004817+0.000014*RC[-5]))+SIN(RADIANS(2*RC[-2]))*(0.019993-0.000101*RC[-5])+SIN(RADIANS(3*RC[-2]))*0.000289 -> -1.9133988768078181 | M280: =RC[-4]+RC[-1] -> 193.8027611970322 | N280: =RC[-4]+RC[-2] -> 6750.5599342093774 | O280: =(1.000001018*(1-RC[-4]*RC[-4]))/(1+RC[-4]*COS(RADIANS(RC[-1]))) -> 0.99955894809563428 | P280: =RC[-3]-0.00569-0.00478*SIN(RADIANS(125.04-1934.136*RC[-9])) -> 193.7940927157627 | Q280: =23+(26+((21.448-RC[-10]*(46.815+RC[-10]*(0.00059-RC[-10]*0.001813))))/60)/60 -> 23.436981022249228 | R280: =RC[-1]+0.00256*COS(RADIANS(125.04-1934.136*RC[-11])) -> 23.434978765263171 | S280: =DEGREES(ATAN2(COS(RADIANS(RC[-3])),COS(RADIANS(RC[-1]))*SIN(RADIANS(RC[-3])))) -> -167.30531495506867 | T280: =DEGREES(ASIN(SIN(RADIANS(RC[-2]))*SIN(RADIANS(RC[-4])))) -> -5.4413550476613519 | U280: =TAN(RADIANS(RC[-3]/2))*TAN(RADIANS(RC[-3]/2)) -> 4.3018245550855899E-2 | V280: =4*DEGREES(RC[-1]*SIN(2*RADIANS(RC[-13]))-2*RC[-11]*SIN(RADIANS(RC[-12]))+4*RC[-11]*RC[-1]*SIN(RADIANS(RC[-12]))*COS(2*RADIANS(RC[-13]))-0.5*RC[-1]*RC[-1]*SIN(4*RADIANS(RC[-13]))-1.25*RC[-11]*RC[-11]*SIN(2*RADIANS(RC[-12]))) -> 12.046240657934653 | W280: =DEGREES(ACOS(COS(RADIANS(90.833))/(COS(RADIANS(R2C2))*COS(RADIANS(RC[-3])))-TAN(RADIANS(R2C2))*TAN(RADIANS(RC[-3])))) -> 77.348808151852566 | X280: =(720-4*R3C2-RC[-2]+R4C2*60)/1440 -> 1899-12-31T13:43:57.226 | Y280: =(RC[-1]*1440-RC[-2]*4)/1440 -> 1899-12-31T08:34:33.512 | Z280: =(RC[-2]*1440+RC[-3]*4)/1440 -> 1899-12-31T18:53:20.940 | AA280: =8*RC[-4] -> 618.79046521482053 | AB280: =MOD(RC[-23]*1440+RC[-6]+4*R3C2-60*R4C2,1440) -> 736.04624065793462 | AC280: =IF(RC[-1]/4<0,RC[-1]/4+180,RC[-1]/4-180) -> 4.0115601644836545 | AD280: =DEGREES(ACOS(SIN(RADIANS(R2C2))*SIN(RADIANS(RC[-10]))+COS(RADIANS(R2C2))*COS(RADIANS(RC[-10]))*COS(RADIANS(RC[-1])))) -> 75.490730589761043 | AE280: =90-RC[-1] -> 14.509269410238957 | AF280: =IF(RC[-1]>85,0,IF(RC[-1]>5,58.1/TAN(RADIANS(RC[-1]))-0.07/POWER(TAN(RADIANS(RC[-1])),3)+0.000086/POWER(TAN(RADIANS(RC[-1])),5),IF(RC[-1]>-0.575,1735+RC[-1]*(-518.2+RC[-1]*(103.4+RC[-1]*(-12.79+RC[-1]*0.711))),-20.772/TAN(RADIANS(RC[-1])))))/3600 -> 6.1261515970406411E-2 | AG280: =RC[-2]+RC[-1] -> 14.570530926209363 | AH280: =IF(RC[-5]>0,MOD(DEGREES(ACOS(((SIN(RADIANS(R2C2))*COS(RADIANS(RC[-4])))-SIN(RADIANS(RC[-14])))/(COS(RADIANS(R2C2))*SIN(RADIANS(RC[-4])))))+180,360),MOD(540-DEGREES(ACOS(((SIN(RADIANS(R2C2))*COS(RADIANS(RC[-4])))-SIN(RADIANS(RC[-14])))/(COS(RADIANS(R2C2))*SIN(RADIANS(RC[-4]))))),360)) -> 184.12523645930406
D281: =R[-1]C+1 -> 2017-10-07T00:00:00.000 | E281: =R5C2 -> 1899-12-31T14:00:00.000 | F281: =RC[-2]+2415018.5+RC[-1]-R4C2/24 -> 2458034.375 | G281: =(RC[-1]-2451545)/36525 -> 0.17766940451745381 | I281: =MOD(280.46646+RC[-2]*(36000.76983 + RC[-2]*0.0003032),360) -> 196.70180743695346 | J281: =357.52911+RC[-3]*(35999.05029 - 0.0001537*RC[-3]) -> 6753.4589333664144 | K281: =0.016708634-RC[-4]*(0.000042037+0.0000001267*RC[-4]) -> 1.6701161311777228E-2 | L281: =SIN(RADIANS(RC[-2]))*(1.914602-RC[-5]*(0.004817+0.000014*RC[-5]))+SIN(RADIANS(2*RC[-2]))*(0.019993-0.000101*RC[-5])+SIN(RADIANS(3*RC[-2]))*0.000289 -> -1.9123811014073004 | M281: =RC[-4]+RC[-1] -> 194.78942633554615 | N281: =RC[-4]+RC[-2] -> 6751.5465522650074 | O281: =(1.000001018*(1-RC[-4]*RC[-4]))/(1+RC[-4]*COS(RADIANS(RC[-1]))) -> 0.99927166705094295 | P281: =RC[-3]-0.00569-0.00478*SIN(RADIANS(125.04-1934.136*RC[-9])) -> 194.78075440027993 | Q281: =23+(26+((21.448-RC[-10]*(46.815+RC[-10]*(0.00059-RC[-10]*0.001813))))/60)/60 -> 23.436980666214261 | R281: =RC[-1]+0.00256*COS(RADIANS(125.04-1934.136*RC[-11])) -> 23.434979884366939 | S281: =DEGREES(ATAN2(COS(RADIANS(RC[-3])),COS(RADIANS(RC[-1]))*SIN(RADIANS(RC[-3])))) -> -166.39123231381384 | T281: =DEGREES(ASIN(SIN(RADIANS(RC[-2]))*SIN(RADIANS(RC[-4])))) -> -5.8234623927711242 | U281: =TAN(RADIANS(RC[-3]/2))*TAN(RADIANS(RC[-3]/2)) -> 4.301824977623802E-2 | V281: =4*DEGREES(RC[-1]*SIN(2*RADIANS(RC[-13]))-2*RC[-11]*SIN(RADIANS(RC[-12]))+4*RC[-11]*RC[-1]*SIN(RADIANS(RC[-12]))*COS(2*RADIANS(RC[-13]))-0.5*RC[-1]*RC[-1]*SIN(4*RADIANS(RC[-13]))-1.25*RC[-11]*RC[-11]*SIN(2*RADIANS(RC[-12]))) -> 12.334913397553912 | W281: =DEGREES(ACOS(COS(RADIANS(90.833))/(COS(RADIANS(R2C2))*COS(RADIANS(RC[-3])))-TAN(RADIANS(R2C2))*TAN(RADIANS(RC[-3])))) -> 76.261654438683365 | X281: =(720-4*R3C2-RC[-2]+R4C2*60)/1440 -> 1899-12-31T13:43:39.905 | Y281: =(RC[-1]*1440-RC[-2]*4)/1440 -> 1899-12-31T08:38:37.108 | Z281: =(RC[-2]*1440+RC[-3]*4)/1440 -> 1899-12-31T18:48:42.702 | AA281: =8*RC[-4] -> 610.09323550946692 | AB281: =MOD(RC[-23]*1440+RC[-6]+4*R3C2-60*R4C2,1440) -> 736.33491339755392 | AC281: =IF(RC[-1]/4<0,RC[-1]/4+180,RC[-1]/4-180) -> 4.0837283493884797 | AD281: =DEGREES(ACOS(SIN(RADIANS(R2C2))*SIN(RADIANS(RC[-10]))+COS(RADIANS(R2C2))*COS(RADIANS(RC[-10]))*COS(RADIANS(RC[-1])))) -> 75.874508742425505 | AE281: =90-RC[-1] -> 14.125491257574495 | AF281: =IF(RC[-1]>85,0,IF(RC[-1]>5,58.1/TAN(RADIANS(RC[-1]))-0.07/POWER(TAN(RADIANS(RC[-1])),3)+0.000086/POWER(TAN(RADIANS(RC[-1])),5),IF(RC[-1]>-0.575,1735+RC[-1]*(-518.2+RC[-1]*(103.4+RC[-1]*(-12.79+RC[-1]*0.711))),-20.772/TAN(RADIANS(RC[-1])))))/3600 -> 6.2934462360468305E-2 | AG281: =RC[-2]+RC[-1] -> 14.188425719934964 | AH281: =IF(RC[-5]>0,MOD(DEGREES(ACOS(((SIN(RADIANS(R2C2))*COS(RADIANS(RC[-4])))-SIN(RADIANS(RC[-14])))/(COS(RADIANS(R2C2))*SIN(RADIANS(RC[-4])))))+180,360),MOD(540-DEGREES(ACOS(((SIN(RADIANS(R2C2))*COS(RADIANS(RC[-4])))-SIN(RADIANS(RC[-14])))/(COS(RADIANS(R2C2))*SIN(RADIANS(RC[-4]))))),360)) -> 184.18950976836112
D282: =R[-1]C+1 -> 2017-10-08T00:00:00.000 | E282: =R5C2 -> 1899-12-31T14:00:00.000 | F282: =RC[-2]+2415018.5+RC[-1]-R4C2/24 -> 2458035.375 | G282: =(RC[-1]-2451545)/36525 -> 0.17769678302532513 | I282: =MOD(280.46646+RC[-2]*(36000.76983 + RC[-2]*0.0003032),360) -> 197.68745480006783 | J282: =357.52911+RC[-3]*(35999.05029 - 0.0001537*RC[-3]) -> 6754.4445336466442 | K282: =0.016708634-RC[-4]*(0.000042037+0.0000001267*RC[-4]) -> 1.6701160159634177E-2 | L282: =SIN(RADIANS(RC[-2]))*(1.914602-RC[-5]*(0.004817+0.000014*RC[-5]))+SIN(RADIANS(2*RC[-2]))*(0.019993-0.000101*RC[-5])+SIN(RADIANS(3*RC[-2]))*0.000289 -> -1.9107959888676009 | M282: =RC[-4]+RC[-1] -> 195.77665881120024 | N282: =RC[-4]+RC[-2] -> 6752.5337376577763 | O282: =(1.000001018*(1-RC[-4]*RC[-4]))/(1+RC[-4]*COS(RADIANS(RC[-1]))) -> 0.99898451962854751 | P282: =RC[-3]-0.00569-0.00478*SIN(RADIANS(125.04-1934.136*RC[-9])) -> 195.76798342448438 | Q282: =23+(26+((21.448-RC[-10]*(46.815+RC[-10]*(0.00059-RC[-10]*0.001813))))/60)/60 -> 23.43698031017929 | R282: =RC[-1]+0.00256*COS(RADIANS(125.04-1934.136*RC[-11])) -> 23.434981005179722 | S282: =DEGREES(ATAN2(COS(RADIANS(RC[-3])),COS(RADIANS(RC[-1]))*SIN(RADIANS(RC[-3])))) -> -165.47538111251652 | T282: =DEGREES(ASIN(SIN(RADIANS(RC[-2]))*SIN(RADIANS(RC[-4])))) -> -6.2043142130549596 | U282: =TAN(RADIANS(RC[-3]/2))*TAN(RADIANS(RC[-3]/2)) -> 4.3018254008073055E-2 | V282: =4*DEGREES(RC[-1]*SIN(2*RADIANS(RC[-13]))-2*RC[-11]*SIN(RADIANS(RC[-12]))+4*RC[-11]*RC[-1]*SIN(RADIANS(RC[-12]))*COS(2*RADIANS(RC[-13]))-0.5*RC[-1]*RC[-1]*SIN(4*RADIANS(RC[-13]))-1.25*RC[-11]*RC[-11]*SIN(2*RADIANS(RC[-12]))) -> 12.616597929277688 | W282: =DEGREES(ACOS(COS(RADIANS(90.833))/(COS(RADIANS(R2C2))*COS(RADIANS(RC[-3])))-TAN(RADIANS(R2C2))*TAN(RADIANS(RC[-3])))) -> 75.171659926332282 | X282: =(720-4*R3C2-RC[-2]+R4C2*60)/1440 -> 1899-12-31T13:43:23.004 | Y282: =(RC[-1]*1440-RC[-2]*4)/1440 -> 1899-12-31T08:42:41.806 | Z282: =(RC[-2]*1440+RC[-3]*4)/1440 -> 1899-12-31T18:44:04.203 | AA282: =8*RC[-4] -> 601.37327941065826 | AB282: =MOD(RC[-23]*1440+RC[-6]+4*R3C2-60*R4C2,1440) -> 736.61659792927765 | AC282: =IF(RC[-1]/4<0,RC[-1]/4+180,RC[-1]/4-180) -> 4.1541494823194114 | AD282: =DEGREES(ACOS(SIN(RADIANS(R2C2))*SIN(RADIANS(RC[-10]))+COS(RADIANS(R2C2))*COS(RADIANS(RC[-10]))*COS(RADIANS(RC[-1])))) -> 76.257011169498469 | AE282: =90-RC[-1] -> 13.742988830501531 | AF282: =IF(RC[-1]>85,0,IF(RC[-1]>5,58.1/TAN(RADIANS(RC[-1]))-0.07/POWER(TAN(RADIANS(RC[-1])),3)+0.000086/POWER(TAN(RADIANS(RC[-1])),5),IF(RC[-1]>-0.575,1735+RC[-1]*(-518.2+RC[-1]*(103.4+RC[-1]*(-12.79+RC[-1]*0.711))),-20.772/TAN(RADIANS(RC[-1])))))/3600 -> 6.4687264463869534E-2 | AG282: =RC[-2]+RC[-1] -> 13.8076760949654 | AH282: =IF(RC[-5]>0,MOD(DEGREES(ACOS(((SIN(RADIANS(R2C2))*COS(RADIANS(RC[-4])))-SIN(RADIANS(RC[-14])))/(COS(RADIANS(R2C2))*SIN(RADIANS(RC[-4])))))+180,360),MOD(540-DEGREES(ACOS(((SIN(RADIANS(R2C2))*COS(RADIANS(RC[-4])))-SIN(RADIANS(RC[-14])))/(COS(RADIANS(R2C2))*SIN(RADIANS(RC[-4]))))),360)) -> 184.25171155454009
D283: =R[-1]C+1 -> 2017-10-09T00:00:00.000 | E283: =R5C2 -> 1899-12-31T14:00:00.000 | F283: =RC[-2]+2415018.5+RC[-1]-R4C2/24 -> 2458036.375 | G283: =(RC[-1]-2451545)/36525 -> 0.17772416153319645 | I283: =MOD(280.46646+RC[-2]*(36000.76983 + RC[-2]*0.0003032),360) -> 198.6731021631831 | J283: =357.52911+RC[-3]*(35999.05029 - 0.0001537*RC[-3]) -> 6755.4301339268741 | K283: =0.016708634-RC[-4]*(0.000042037+0.0000001267*RC[-4]) -> 1.6701159007490939E-2 | L283: =SIN(RADIANS(RC[-2]))*(1.914602-RC[-5]*(0.004817+0.000014*RC[-5]))+SIN(RADIANS(2*RC[-2]))*(0.019993-0.000101*RC[-5])+SIN(RADIANS(3*RC[-2]))*0.000289 -> -1.908643396890364 | M283: =RC[-4]+RC[-1] -> 196.76445876629273 | N283: =RC[-4]+RC[-2] -> 6753.5214905299836 | O283: =(1.000001018*(1-RC[-4]*RC[-4]))/(1+RC[-4]*COS(RADIANS(RC[-1]))) -> 0.99869759116986123 | P283: =RC[-3]-0.00569-0.00478*SIN(RADIANS(125.04-1934.136*RC[-9])) -> 196.75577993067731 | Q283: =23+(26+((21.448-RC[-10]*(46.815+RC[-10]*(0.00059-RC[-10]*0.001813))))/60)/60 -> 23.436979954144324 | R283: =RC[-1]+0.00256*COS(RADIANS(125.04-1934.136*RC[-11])) -> 23.434982127700273 | S283: =DEGREES(ATAN2(COS(RADIANS(RC[-3])),COS(RADIANS(RC[-1]))*SIN(RADIANS(RC[-3])))) -> -164.55768052460684 | T283: =DEGREES(ASIN(SIN(RADIANS(RC[-2]))*SIN(RADIANS(RC[-4])))) -> -6.5838084850964167 | U283: =TAN(RADIANS(RC[-3]/2))*TAN(RADIANS(RC[-3]/2)) -> 4.3018258246356314E-2 | V283: =4*DEGREES(RC[-1]*SIN(2*RADIANS(RC[-13]))-2*RC[-11]*SIN(RADIANS(RC[-12]))+4*RC[-11]*RC[-1]*SIN(RADIANS(RC[-12]))*COS(2*RADIANS(RC[-13]))-0.5*RC[-1]*RC[-1]*SIN(4*RADIANS(RC[-13]))-1.25*RC[-11]*RC[-11]*SIN(2*RADIANS(RC[-12]))) -> 12.890958486707033 | W283: =DEGREES(ACOS(COS(RADIANS(90.833))/(COS(RADIANS(R2C2))*COS(RADIANS(RC[-3])))-TAN(RADIANS(R2C2))*TAN(RADIANS(RC[-3])))) -> 74.078594385022598 | X283: =(720-4*R3C2-RC[-2]+R4C2*60)/1440 -> 1899-12-31T13:43:06.542 | Y283: =(RC[-1]*1440-RC[-2]*4)/1440 -> 1899-12-31T08:46:47.680 | Z283: =(RC[-2]*1440+RC[-3]*4)/1440 -> 1899-12-31T18:39:25.405 | AA283: =8*RC[-4] -> 592.62875508018078 | AB283: =MOD(RC[-23]*1440+RC[-6]+4*R3C2-60*R4C2,1440) -> 736.89095848670706 | AC283: =IF(RC[-1]/4<0,RC[-1]/4+180,RC[-1]/4-180) -> 4.2227396216767659 | AD283: =DEGREES(ACOS(SIN(RADIANS(R2C2))*SIN(RADIANS(RC[-10]))+COS(RADIANS(R2C2))*COS(RADIANS(RC[-10]))*COS(RADIANS(RC[-1])))) -> 76.638131632582684 | AE283: =90-RC[-1] -> 13.361868367417316 | AF283: =IF(RC[-1]>85,0,IF(RC[-1]>5,58.1/TAN(RADIANS(RC[-1]))-0.07/POWER(TAN(RADIANS(RC[-1])),3)+0.000086/POWER(TAN(RADIANS(RC[-1])),5),IF(RC[-1]>-0.575,1735+RC[-1]*(-518.2+RC[-1]*(103.4+RC[-1]*(-12.79+RC[-1]*0.711))),-20.772/TAN(RADIANS(RC[-1])))))/3600 -> 6.6525205943156376E-2 | AG283: =RC[-2]+RC[-1] -> 13.428393573360472 | AH283: =IF(RC[-5]>0,MOD(DEGREES(ACOS(((SIN(RADIANS(R2C2))*COS(RADIANS(RC[-4])))-SIN(RADIANS(RC[-14])))/(COS(RADIANS(R2C2))*SIN(RADIANS(RC[-4])))))+180,360),MOD(540-DEGREES(ACOS(((SIN(RADIANS(R2C2))*COS(RADIANS(RC[-4])))-SIN(RADIANS(RC[-14])))/(COS(RADIANS(R2C2))*SIN(RADIANS(RC[-4]))))),360)) -> 184.31177357748302
D284: =R[-1]C+1 -> 2017-10-10T00:00:00.000 | E284: =R5C2 -> 1899-12-31T14:00:00.000 | F284: =RC[-2]+2415018.5+RC[-1]-R4C2/24 -> 2458037.375 | G284: =(RC[-1]-2451545)/36525 -> 0.17775154004106777 | I284: =MOD(280.46646+RC[-2]*(36000.76983 + RC[-2]*0.0003032),360) -> 199.65874952629838 | J284: =357.52911+RC[-3]*(35999.05029 - 0.0001537*RC[-3]) -> 6756.4157342071021 | K284: =0.016708634-RC[-4]*(0.000042037+0.0000001267*RC[-4]) -> 1.6701157855347509E-2 | L284: =SIN(RADIANS(RC[-2]))*(1.914602-RC[-5]*(0.004817+0.000014*RC[-5]))+SIN(RADIANS(2*RC[-2]))*(0.019993-0.000101*RC[-5])+SIN(RADIANS(3*RC[-2]))*0.000289 -> -1.905923352565398 | M284: =RC[-4]+RC[-1] -> 197.75282617373298 | N284: =RC[-4]+RC[-2] -> 6754.5098108545371 | O284: =(1.000001018*(1-RC[-4]*RC[-4]))/(1+RC[-4]*COS(RADIANS(RC[-1]))) -> 0.99841096709824251 | P284: =RC[-3]-0.00569-0.00478*SIN(RADIANS(125.04-1934.136*RC[-9])) -> 197.74414389177099 | Q284: =23+(26+((21.448-RC[-10]*(46.815+RC[-10]*(0.00059-RC[-10]*0.001813))))/60)/60 -> 23.436979598109357 | R284: =RC[-1]+0.00256*COS(RADIANS(125.04-1934.136*RC[-11])) -> 23.434983251927324 | S284: =DEGREES(ATAN2(COS(RADIANS(RC[-3])),COS(RADIANS(RC[-1]))*SIN(RADIANS(RC[-3])))) -> -163.63805052209071 | T284: =DEGREES(ASIN(SIN(RADIANS(RC[-2]))*SIN(RADIANS(RC[-4])))) -> -6.9618426230116857 | U284: =TAN(RADIANS(RC[-3]/2))*TAN(RADIANS(RC[-3]/2)) -> 4.3018262491083009E-2 | V284: =4*DEGREES(RC[-1]*SIN(2*RADIANS(RC[-13]))-2*RC[-11]*SIN(RADIANS(RC[-12]))+4*RC[-11]*RC[-1]*SIN(RADIANS(RC[-12]))*COS(2*RADIANS(RC[-13]))-0.5*RC[-1]*RC[-1]*SIN(4*RADIANS(RC[-13]))-1.25*RC[-11]*RC[-11]*SIN(2*RADIANS(RC[-12]))) -> 13.157661682010216 | W284: =DEGREES(ACOS(COS(RADIANS(90.833))/(COS(RADIANS(R2C2))*COS(RADIANS(RC[-3])))-TAN(RADIANS(R2C2))*TAN(RADIANS(RC[-3])))) -> 72.982222789459357 | X284: =(720-4*R3C2-RC[-2]+R4C2*60)/1440 -> 1899-12-31T13:42:50.540 | Y284: =(RC[-1]*1440-RC[-2]*4)/1440 -> 1899-12-31T08:50:54.807 | Z284: =(RC[-2]*1440+RC[-3]*4)/1440 -> 1899-12-31T18:34:46.274 | AA284: =8*RC[-4] -> 583.85778231567485 | AB284: =MOD(RC[-23]*1440+RC[-6]+4*R3C2-60*R4C2,1440) -> 737.15766168201026 | AC284: =IF(RC[-1]/4<0,RC[-1]/4+180,RC[-1]/4-180) -> 4.2894154205025643 | AD284: =DEGREES(ACOS(SIN(RADIANS(R2C2))*SIN(RADIANS(RC[-10]))+COS(RADIANS(R2C2))*COS(RADIANS(RC[-10]))*COS(RADIANS(RC[-1])))) -> 77.017763308333656 | AE284: =90-RC[-1] -> 12.982236691666344 | AF284: =IF(RC[-1]>85,0,IF(RC[-1]>5,58.1/TAN(RADIANS(RC[-1]))-0.07/POWER(TAN(RADIANS(RC[-1])),3)+0.000086/POWER(TAN(RADIANS(RC[-1])),5),IF(RC[-1]>-0.575,1735+RC[-1]*(-518.2+RC[-1]*(103.4+RC[-1]*(-12.79+RC[-1]*0.711))),-20.772/TAN(RADIANS(RC[-1])))))/3600 -> 6.8454008595821667E-2 | AG284: =RC[-2]+RC[-1] -> 13.050690700262166 | AH284: =IF(RC[-5]>0,MOD(DEGREES(ACOS(((SIN(RADIANS(R2C2))*COS(RADIANS(RC[-4])))-SIN(RADIANS(RC[-14])))/(COS(RADIANS(R2C2))*SIN(RADIANS(RC[-4])))))+180,360),MOD(540-DEGREES(ACOS(((SIN(RADIANS(R2C2))*COS(RADIANS(RC[-4])))-SIN(RADIANS(RC[-14])))/(COS(RADIANS(R2C2))*SIN(RADIANS(RC[-4]))))),360)) -> 184.36962893073314
D285: =R[-1]C+1 -> 2017-10-11T00:00:00.000 | E285: =R5C2 -> 1899-12-31T14:00:00.000 | F285: =RC[-2]+2415018.5+RC[-1]-R4C2/24 -> 2458038.375 | G285: =(RC[-1]-2451545)/36525 -> 0.1777789185489391 | I285: =MOD(280.46646+RC[-2]*(36000.76983 + RC[-2]*0.0003032),360) -> 200.64439688941366 | J285: =357.52911+RC[-3]*(35999.05029 - 0.0001537*RC[-3]) -> 6757.401334487331 | K285: =0.016708634-RC[-4]*(0.000042037+0.0000001267*RC[-4]) -> 1.6701156703203889E-2 | L285: =SIN(RADIANS(RC[-2]))*(1.914602-RC[-5]*(0.004817+0.000014*RC[-5]))+SIN(RADIANS(2*RC[-2]))*(0.019993-0.000101*RC[-5])+SIN(RADIANS(3*RC[-2]))*0.000289 -> -1.9026360530978237 | M285: =RC[-4]+RC[-1] -> 198.74176083631582 | N285: =RC[-4]+RC[-2] -> 6755.4986984342331 | O285: =(1.000001018*(1-RC[-4]*RC[-4]))/(1+RC[-4]*COS(RADIANS(RC[-1]))) -> 0.99812473289341497 | P285: =RC[-3]-0.00569-0.00478*SIN(RADIANS(125.04-1934.136*RC[-9])) -> 198.73307511056319 | Q285: =23+(26+((21.448-RC[-10]*(46.815+RC[-10]*(0.00059-RC[-10]*0.001813))))/60)/60 -> 23.43697924207439 | R285: =RC[-1]+0.00256*COS(RADIANS(125.04-1934.136*RC[-11])) -> 23.43498437785961 | S285: =DEGREES(ATAN2(COS(RADIANS(RC[-3])),COS(RADIANS(RC[-1]))*SIN(RADIANS(RC[-3])))) -> -162.71641194786335 | T285: =DEGREES(ASIN(SIN(RADIANS(RC[-2]))*SIN(RADIANS(RC[-4])))) -> -7.3383134749830283 | U285: =TAN(RADIANS(RC[-3]/2))*TAN(RADIANS(RC[-3]/2)) -> 4.3018266742248366E-2 | V285: =4*DEGREES(RC[-1]*SIN(2*RADIANS(RC[-13]))-2*RC[-11]*SIN(RADIANS(RC[-12]))+4*RC[-11]*RC[-1]*SIN(RADIANS(RC[-12]))*COS(2*RADIANS(RC[-13]))-0.5*RC[-1]*RC[-1]*SIN(4*RADIANS(RC[-13]))-1.25*RC[-11]*RC[-11]*SIN(2*RADIANS(RC[-12]))) -> 13.416376874099342 | W285: =DEGREES(ACOS(COS(RADIANS(90.833))/(COS(RADIANS(R2C2))*COS(RADIANS(RC[-3])))-TAN(RADIANS(R2C2))*TAN(RADIANS(RC[-3])))) -> 71.882304685199031 | X285: =(720-4*R3C2-RC[-2]+R4C2*60)/1440 -> 1899-12-31T13:42:35.017 | Y285: =(RC[-1]*1440-RC[-2]*4)/1440 -> 1899-12-31T08:55:03.264 | Z285: =(RC[-2]*1440+RC[-3]*4)/1440 -> 1899-12-31T18:30:06.771 | AA285: =8*RC[-4] -> 575.05843748159225 | AB285: =MOD(RC[-23]*1440+RC[-6]+4*R3C2-60*R4C2,1440) -> 737.41637687409934 | AC285: =IF(RC[-1]/4<0,RC[-1]/4+180,RC[-1]/4-180) -> 4.3540942185248355 | AD285: =DEGREES(ACOS(SIN(RADIANS(R2C2))*SIN(RADIANS(RC[-10]))+COS(RADIANS(R2C2))*COS(RADIANS(RC[-10]))*COS(RADIANS(RC[-1])))) -> 77.395798798126577 | AE285: =90-RC[-1] -> 12.604201201873423 | AF285: =IF(RC[-1]>85,0,IF(RC[-1]>5,58.1/TAN(RADIANS(RC[-1]))-0.07/POWER(TAN(RADIANS(RC[-1])),3)+0.000086/POWER(TAN(RADIANS(RC[-1])),5),IF(RC[-1]>-0.575,1735+RC[-1]*(-518.2+RC[-1]*(103.4+RC[-1]*(-12.79+RC[-1]*0.711))),-20.772/TAN(RADIANS(RC[-1])))))/3600 -> 7.047987393224002E-2 | AG285: =RC[-2]+RC[-1] -> 12.674681075805662 | AH285: =IF(RC[-5]>0,MOD(DEGREES(ACOS(((SIN(RADIANS(R2C2))*COS(RADIANS(RC[-4])))-SIN(RADIANS(RC[-14])))/(COS(RADIANS(R2C2))*SIN(RADIANS(RC[-4])))))+180,360),MOD(540-DEGREES(ACOS(((SIN(RADIANS(R2C2))*COS(RADIANS(RC[-4])))-SIN(RADIANS(RC[-14])))/(COS(RADIANS(R2C2))*SIN(RADIANS(RC[-4]))))),360)) -> 184.42521211099623
D286: =R[-1]C+1 -> 2017-10-12T00:00:00.000 | E286: =R5C2 -> 1899-12-31T14:00:00.000 | F286: =RC[-2]+2415018.5+RC[-1]-R4C2/24 -> 2458039.375 | G286: =(RC[-1]-2451545)/36525 -> 0.17780629705681039 | I286: =MOD(280.46646+RC[-2]*(36000.76983 + RC[-2]*0.0003032),360) -> 201.63004425252802 | J286: =357.52911+RC[-3]*(35999.05029 - 0.0001537*RC[-3]) -> 6758.3869347675582 | K286: =0.016708634-RC[-4]*(0.000042037+0.0000001267*RC[-4]) -> 1.6701155551060078E-2 | L286: =SIN(RADIANS(RC[-2]))*(1.914602-RC[-5]*(0.004817+0.000014*RC[-5]))+SIN(RADIANS(2*RC[-2]))*(0.019993-0.000101*RC[-5])+SIN(RADIANS(3*RC[-2]))*0.000289 -> -1.8987818664849354 | M286: =RC[-4]+RC[-1] -> 199.73126238604308 | N286: =RC[-4]+RC[-2] -> 6756.4881529010736 | O286: =(1.000001018*(1-RC[-4]*RC[-4]))/(1+RC[-4]*COS(RADIANS(RC[-1]))) -> 0.99783897406569666 | P286: =RC[-3]-0.00569-0.00478*SIN(RADIANS(125.04-1934.136*RC[-9])) -> 199.72257321905872 | Q286: =23+(26+((21.448-RC[-10]*(46.815+RC[-10]*(0.00059-RC[-10]*0.001813))))/60)/60 -> 23.436978886039419 | R286: =RC[-1]+0.00256*COS(RADIANS(125.04-1934.136*RC[-11])) -> 23.43498550549586 | S286: =DEGREES(ATAN2(COS(RADIANS(RC[-3])),COS(RADIANS(RC[-1]))*SIN(RADIANS(RC[-3])))) -> -161.79268659013334 | T286: =DEGREES(ASIN(SIN(RADIANS(RC[-2]))*SIN(RADIANS(RC[-4])))) -> -7.7131173212173838 | U286: =TAN(RADIANS(RC[-3]/2))*TAN(RADIANS(RC[-3]/2)) -> 4.3018270999847577E-2 | V286: =4*DEGREES(RC[-1]*SIN(2*RADIANS(RC[-13]))-2*RC[-11]*SIN(RADIANS(RC[-12]))+4*RC[-11]*RC[-1]*SIN(RADIANS(RC[-12]))*COS(2*RADIANS(RC[-13]))-0.5*RC[-1]*RC[-1]*SIN(4*RADIANS(RC[-13]))-1.25*RC[-11]*RC[-11]*SIN(2*RADIANS(RC[-12]))) -> 13.666776552924649 | W286: =DEGREES(ACOS(COS(RADIANS(90.833))/(COS(RADIANS(R2C2))*COS(RADIANS(RC[-3])))-TAN(RADIANS(R2C2))*TAN(RADIANS(RC[-3])))) -> 70.778593494718308 | X286: =(720-4*R3C2-RC[-2]+R4C2*60)/1440 -> 1899-12-31T13:42:19.993 | Y286: =(RC[-1]*1440-RC[-2]*4)/1440 -> 1899-12-31T08:59:13.131 | Z286: =(RC[-2]*1440+RC[-3]*4)/1440 -> 1899-12-31T18:25:26.856 | AA286: =8*RC[-4] -> 566.22874795774646 | AB286: =MOD(RC[-23]*1440+RC[-6]+4*R3C2-60*R4C2,1440) -> 737.6667765529246 | AC286: =IF(RC[-1]/4<0,RC[-1]/4+180,RC[-1]/4-180) -> 4.4166941382311506 | AD286: =DEGREES(ACOS(SIN(RADIANS(R2C2))*SIN(RADIANS(RC[-10]))+COS(RADIANS(R2C2))*COS(RADIANS(RC[-10]))*COS(RADIANS(RC[-1])))) -> 77.7721301395502 | AE286: =90-RC[-1] -> 12.2278698604498 | AF286: =IF(RC[-1]>85,0,IF(RC[-1]>5,58.1/TAN(RADIANS(RC[-1]))-0.07/POWER(TAN(RADIANS(RC[-1])),3)+0.000086/POWER(TAN(RADIANS(RC[-1])),5),IF(RC[-1]>-0.575,1735+RC[-1]*(-518.2+RC[-1]*(103.4+RC[-1]*(-12.79+RC[-1]*0.711))),-20.772/TAN(RADIANS(RC[-1])))))/3600 -> 7.2609528801210216E-2 | AG286: =RC[-2]+RC[-1] -> 12.300479389251011 | AH286: =IF(RC[-5]>0,MOD(DEGREES(ACOS(((SIN(RADIANS(R2C2))*COS(RADIANS(RC[-4])))-SIN(RADIANS(RC[-14])))/(COS(RADIANS(R2C2))*SIN(RADIANS(RC[-4])))))+180,360),MOD(540-DEGREES(ACOS(((SIN(RADIANS(R2C2))*COS(RADIANS(RC[-4])))-SIN(RADIANS(RC[-14])))/(COS(RADIANS(R2C2))*SIN(RADIANS(RC[-4]))))),360)) -> 184.47845908980918
D287: =R[-1]C+1 -> 2017-10-13T00:00:00.000 | E287: =R5C2 -> 1899-12-31T14:00:00.000 | F287: =RC[-2]+2415018.5+RC[-1]-R4C2/24 -> 2458040.375 | G287: =(RC[-1]-2451545)/36525 -> 0.17783367556468171 | I287: =MOD(280.46646+RC[-2]*(36000.76983 + RC[-2]*0.0003032),360) -> 202.61569161564512 | J287: =357.52911+RC[-3]*(35999.05029 - 0.0001537*RC[-3]) -> 6759.3725350477871 | K287: =0.016708634-RC[-4]*(0.000042037+0.0000001267*RC[-4]) -> 1.670115439891608E-2 | L287: =SIN(RADIANS(RC[-2]))*(1.914602-RC[-5]*(0.004817+0.000014*RC[-5]))+SIN(RADIANS(2*RC[-2]))*(0.019993-0.000101*RC[-5])+SIN(RADIANS(3*RC[-2]))*0.000289 -> -1.8943613321414836 | M287: =RC[-4]+RC[-1] -> 200.72133028350365 | N287: =RC[-4]+RC[-2] -> 6757.4781737156454 | O287: =(1.000001018*(1-RC[-4]*RC[-4]))/(1+RC[-4]*COS(RADIANS(RC[-1]))) -> 0.99755377613004426 | P287: =RC[-3]-0.00569-0.00478*SIN(RADIANS(125.04-1934.136*RC[-9])) -> 200.71263767784933 | Q287: =23+(26+((21.448-RC[-10]*(46.815+RC[-10]*(0.00059-RC[-10]*0.001813))))/60)/60 -> 23.436978530004453 | R287: =RC[-1]+0.00256*COS(RADIANS(125.04-1934.136*RC[-11])) -> 23.434986634834814 | S287: =DEGREES(ATAN2(COS(RADIANS(RC[-3])),COS(RADIANS(RC[-1]))*SIN(RADIANS(RC[-3])))) -> -160.86679725899955 | T287: =DEGREES(ASIN(SIN(RADIANS(RC[-2]))*SIN(RADIANS(RC[-4])))) -> -8.0861498734243824 | U287: =TAN(RADIANS(RC[-3]/2))*TAN(RADIANS(RC[-3]/2)) -> 4.3018275263875881E-2 | V287: =4*DEGREES(RC[-1]*SIN(2*RADIANS(RC[-13]))-2*RC[-11]*SIN(RADIANS(RC[-12]))+4*RC[-11]*RC[-1]*SIN(RADIANS(RC[-12]))*COS(2*RADIANS(RC[-13]))-0.5*RC[-1]*RC[-1]*SIN(4*RADIANS(RC[-13]))-1.25*RC[-11]*RC[-11]*SIN(2*RADIANS(RC[-12]))) -> 13.908536739576556 | W287: =DEGREES(ACOS(COS(RADIANS(90.833))/(COS(RADIANS(R2C2))*COS(RADIANS(RC[-3])))-TAN(RADIANS(R2C2))*TAN(RADIANS(RC[-3])))) -> 69.670835753859222 | X287: =(720-4*R3C2-RC[-2]+R4C2*60)/1440 -> 1899-12-31T13:42:05.488 | Y287: =(RC[-1]*1440-RC[-2]*4)/1440 -> 1899-12-31T09:03:24.487 | Z287: =(RC[-2]*1440+RC[-3]*4)/1440 -> 1899-12-31T18:20:46.488 | AA287: =8*RC[-4] -> 557.36668603087378 | AB287: =MOD(RC[-23]*1440+RC[-6]+4*R3C2-60*R4C2,1440) -> 737.90853673957656 | AC287: =IF(RC[-1]/4<0,RC[-1]/4+180,RC[-1]/4-180) -> 4.4771341848941404 | AD287: =DEGREES(ACOS(SIN(RADIANS(R2C2))*SIN(RADIANS(RC[-10]))+COS(RADIANS(R2C2))*COS(RADIANS(RC[-10]))*COS(RADIANS(RC[-1])))) -> 78.146648819787188 | AE287: =90-RC[-1] -> 11.853351180212812 | AF287: =IF(RC[-1]>85,0,IF(RC[-1]>5,58.1/TAN(RADIANS(RC[-1]))-0.07/POWER(TAN(RADIANS(RC[-1])),3)+0.000086/POWER(TAN(RADIANS(RC[-1])),5),IF(RC[-1]>-0.575,1735+RC[-1]*(-518.2+RC[-1]*(103.4+RC[-1]*(-12.79+RC[-1]*0.711))),-20.772/TAN(RADIANS(RC[-1])))))/3600 -> 7.485027535463698E-2 | AG287: =RC[-2]+RC[-1] -> 11.928201455567448 | AH287: =IF(RC[-5]>0,MOD(DEGREES(ACOS(((SIN(RADIANS(R2C2))*COS(RADIANS(RC[-4])))-SIN(RADIANS(RC[-14])))/(COS(RADIANS(R2C2))*SIN(RADIANS(RC[-4])))))+180,360),MOD(540-DEGREES(ACOS(((SIN(RADIANS(R2C2))*COS(RADIANS(RC[-4])))-SIN(RADIANS(RC[-14])))/(COS(RADIANS(R2C2))*SIN(RADIANS(RC[-4]))))),360)) -> 184.52930738746898
D288: =R[-1]C+1 -> 2017-10-14T00:00:00.000 | E288: =R5C2 -> 1899-12-31T14:00:00.000 | F288: =RC[-2]+2415018.5+RC[-1]-R4C2/24 -> 2458041.375 | G288: =(RC[-1]-2451545)/36525 -> 0.17786105407255304 | I288: =MOD(280.46646+RC[-2]*(36000.76983 + RC[-2]*0.0003032),360) -> 203.60133897876221 | J288: =357.52911+RC[-3]*(35999.05029 - 0.0001537*RC[-3]) -> 6760.358135328016 | K288: =0.016708634-RC[-4]*(0.000042037+0.0000001267*RC[-4]) -> 1.6701153246771891E-2 | L288: =SIN(RADIANS(RC[-2]))*(1.914602-RC[-5]*(0.004817+0.000014*RC[-5]))+SIN(RADIANS(2*RC[-2]))*(0.019993-0.000101*RC[-5])+SIN(RADIANS(3*RC[-2]))*0.000289 -> -1.8893751614725003 | M288: =RC[-4]+RC[-1] -> 201.71196381728973 | N288: =RC[-4]+RC[-2] -> 6758.4687601665437 | O288: =(1.000001018*(1-RC[-4]*RC[-4]))/(1+RC[-4]*COS(RADIANS(RC[-1]))) -> 0.99726922457991884 | P288: =RC[-3]-0.00569-0.00478*SIN(RADIANS(125.04-1934.136*RC[-9])) -> 201.70326777553026 | Q288: =23+(26+((21.448-RC[-10]*(46.815+RC[-10]*(0.00059-RC[-10]*0.001813))))/60)/60 -> 23.436978173969486 | R288: =RC[-1]+0.00256*COS(RADIANS(125.04-1934.136*RC[-11])) -> 23.434987765875199 | S288: =DEGREES(ATAN2(COS(RADIANS(RC[-3])),COS(RADIANS(RC[-1]))*SIN(RADIANS(RC[-3])))) -> -159.9386678652493 | T288: =DEGREES(ASIN(SIN(RADIANS(RC[-2]))*SIN(RADIANS(RC[-4])))) -> -8.4573062758963271 | U288: =TAN(RADIANS(RC[-3]/2))*TAN(RADIANS(RC[-3]/2)) -> 4.3018279534328491E-2 | V288: =4*DEGREES(RC[-1]*SIN(2*RADIANS(RC[-13]))-2*RC[-11]*SIN(RADIANS(RC[-12]))+4*RC[-11]*RC[-1]*SIN(RADIANS(RC[-12]))*COS(2*RADIANS(RC[-13]))-0.5*RC[-1]*RC[-1]*SIN(4*RADIANS(RC[-13]))-1.25*RC[-11]*RC[-11]*SIN(2*RADIANS(RC[-12]))) -> 14.141337401773876 | W288: =DEGREES(ACOS(COS(RADIANS(90.833))/(COS(RADIANS(R2C2))*COS(RADIANS(RC[-3])))-TAN(RADIANS(R2C2))*TAN(RADIANS(RC[-3])))) -> 68.558770267973259 | X288: =(720-4*R3C2-RC[-2]+R4C2*60)/1440 -> 1899-12-31T13:41:51.520 | Y288: =(RC[-1]*1440-RC[-2]*4)/1440 -> 1899-12-31T09:07:37.415 | Z288: =(RC[-2]*1440+RC[-3]*4)/1440 -> 1899-12-31T18:16:05.625 | AA288: =8*RC[-4] -> 548.47016214378607 | AB288: =MOD(RC[-23]*1440+RC[-6]+4*R3C2-60*R4C2,1440) -> 738.14133740177385 | AC288: =IF(RC[-1]/4<0,RC[-1]/4+180,RC[-1]/4-180) -> 4.5353343504434633 | AD288: =DEGREES(ACOS(SIN(RADIANS(R2C2))*SIN(RADIANS(RC[-10]))+COS(RADIANS(R2C2))*COS(RADIANS(RC[-10]))*COS(RADIANS(RC[-1])))) -> 78.519245790925495 | AE288: =90-RC[-1] -> 11.480754209074505 | AF288: =IF(RC[-1]>85,0,IF(RC[-1]>5,58.1/TAN(RADIANS(RC[-1]))-0.07/POWER(TAN(RADIANS(RC[-1])),3)+0.000086/POWER(TAN(RADIANS(RC[-1])),5),IF(RC[-1]>-0.575,1735+RC[-1]*(-518.2+RC[-1]*(103.4+RC[-1]*(-12.79+RC[-1]*0.711))),-20.772/TAN(RADIANS(RC[-1])))))/3600 -> 7.7210045613328782E-2 | AG288: =RC[-2]+RC[-1] -> 11.557964254687834 | AH288: =IF(RC[-5]>0,MOD(DEGREES(ACOS(((SIN(RADIANS(R2C2))*COS(RADIANS(RC[-4])))-SIN(RADIANS(RC[-14])))/(COS(RADIANS(R2C2))*SIN(RADIANS(RC[-4])))))+180,360),MOD(540-DEGREES(ACOS(((SIN(RADIANS(R2C2))*COS(RADIANS(RC[-4])))-SIN(RADIANS(RC[-14])))/(COS(RADIANS(R2C2))*SIN(RADIANS(RC[-4]))))),360)) -> 184.57769614906414
D289: =R[-1]C+1 -> 2017-10-15T00:00:00.000 | E289: =R5C2 -> 1899-12-31T14:00:00.000 | F289: =RC[-2]+2415018.5+RC[-1]-R4C2/24 -> 2458042.375 | G289: =(RC[-1]-2451545)/36525 -> 0.17788843258042436 | I289: =MOD(280.46646+RC[-2]*(36000.76983 + RC[-2]*0.0003032),360) -> 204.58698634187931 | J289: =357.52911+RC[-3]*(35999.05029 - 0.0001537*RC[-3]) -> 6761.3437356082422 | K289: =0.016708634-RC[-4]*(0.000042037+0.0000001267*RC[-4]) -> 1.6701152094627511E-2 | L289: =SIN(RADIANS(RC[-2]))*(1.914602-RC[-5]*(0.004817+0.000014*RC[-5]))+SIN(RADIANS(2*RC[-2]))*(0.019993-0.000101*RC[-5])+SIN(RADIANS(3*RC[-2]))*0.000289 -> -1.8838242383923576 | M289: =RC[-4]+RC[-1] -> 202.70316210348696 | N289: =RC[-4]+RC[-2] -> 6759.4599113698496 | O289: =(1.000001018*(1-RC[-4]*RC[-4]))/(1+RC[-4]*COS(RADIANS(RC[-1]))) -> 0.99698540486098319 | P289: =RC[-3]-0.00569-0.00478*SIN(RADIANS(125.04-1934.136*RC[-9])) -> 202.69446262819002 | Q289: =23+(26+((21.448-RC[-10]*(46.815+RC[-10]*(0.00059-RC[-10]*0.001813))))/60)/60 -> 23.436977817934519 | R289: =RC[-1]+0.00256*COS(RADIANS(125.04-1934.136*RC[-11])) -> 23.43498889861575 | S289: =DEGREES(ATAN2(COS(RADIANS(RC[-3])),COS(RADIANS(RC[-1]))*SIN(RADIANS(RC[-3])))) -> -159.00822350137923 | T289: =DEGREES(ASIN(SIN(RADIANS(RC[-2]))*SIN(RADIANS(RC[-4])))) -> -8.8264811082969121 | U289: =TAN(RADIANS(RC[-3]/2))*TAN(RADIANS(RC[-3]/2)) -> 4.3018283811200611E-2 | V289: =4*DEGREES(RC[-1]*SIN(2*RADIANS(RC[-13]))-2*RC[-11]*SIN(RADIANS(RC[-12]))+4*RC[-11]*RC[-1]*SIN(RADIANS(RC[-12]))*COS(2*RADIANS(RC[-13]))-0.5*RC[-1]*RC[-1]*SIN(4*RADIANS(RC[-13]))-1.25*RC[-11]*RC[-11]*SIN(2*RADIANS(RC[-12]))) -> 14.364862884227545 | W289: =DEGREES(ACOS(COS(RADIANS(90.833))/(COS(RADIANS(R2C2))*COS(RADIANS(RC[-3])))-TAN(RADIANS(R2C2))*TAN(RADIANS(RC[-3])))) -> 67.442127175359971 | X289: =(720-4*R3C2-RC[-2]+R4C2*60)/1440 -> 1899-12-31T13:41:38.108 | Y289: =(RC[-1]*1440-RC[-2]*4)/1440 -> 1899-12-31T09:11:51.998 | Z289: =(RC[-2]*1440+RC[-3]*4)/1440 -> 1899-12-31T18:11:24.219 | AA289: =8*RC[-4] -> 539.53701740287977 | AB289: =MOD(RC[-23]*1440+RC[-6]+4*R3C2-60*R4C2,1440) -> 738.36486288422759 | AC289: =IF(RC[-1]/4<0,RC[-1]/4+180,RC[-1]/4-180) -> 4.5912157210568978 | AD289: =DEGREES(ACOS(SIN(RADIANS(R2C2))*SIN(RADIANS(RC[-10]))+COS(RADIANS(R2C2))*COS(RADIANS(RC[-10]))*COS(RADIANS(RC[-1])))) -> 78.889811487265447 | AE289: =90-RC[-1] -> 11.110188512734553 | AF289: =IF(RC[-1]>85,0,IF(RC[-1]>5,58.1/TAN(RADIANS(RC[-1]))-0.07/POWER(TAN(RADIANS(RC[-1])),3)+0.000086/POWER(TAN(RADIANS(RC[-1])),5),IF(RC[-1]>-0.575,1735+RC[-1]*(-518.2+RC[-1]*(103.4+RC[-1]*(-12.79+RC[-1]*0.711))),-20.772/TAN(RADIANS(RC[-1])))))/3600 -> 7.9697460840784926E-2 | AG289: =RC[-2]+RC[-1] -> 11.189885973575338 | AH289: =IF(RC[-5]>0,MOD(DEGREES(ACOS(((SIN(RADIANS(R2C2))*COS(RADIANS(RC[-4])))-SIN(RADIANS(RC[-14])))/(COS(RADIANS(R2C2))*SIN(RADIANS(RC[-4])))))+180,360),MOD(540-DEGREES(ACOS(((SIN(RADIANS(R2C2))*COS(RADIANS(RC[-4])))-SIN(RADIANS(RC[-14])))/(COS(RADIANS(R2C2))*SIN(RADIANS(RC[-4]))))),360)) -> 184.62356622242766
D290: =R[-1]C+1 -> 2017-10-16T00:00:00.000 | E290: =R5C2 -> 1899-12-31T14:00:00.000 | F290: =RC[-2]+2415018.5+RC[-1]-R4C2/24 -> 2458043.375 | G290: =(RC[-1]-2451545)/36525 -> 0.17791581108829568 | I290: =MOD(280.46646+RC[-2]*(36000.76983 + RC[-2]*0.0003032),360) -> 205.57263370499732 | J290: =357.52911+RC[-3]*(35999.05029 - 0.0001537*RC[-3]) -> 6762.3293358884712 | K290: =0.016708634-RC[-4]*(0.000042037+0.0000001267*RC[-4]) -> 1.670115094248294E-2 | L290: =SIN(RADIANS(RC[-2]))*(1.914602-RC[-5]*(0.004817+0.000014*RC[-5]))+SIN(RADIANS(2*RC[-2]))*(0.019993-0.000101*RC[-5])+SIN(RADIANS(3*RC[-2]))*0.000289 -> -1.8777096197890659 | M290: =RC[-4]+RC[-1] -> 203.69492408520824 | N290: =RC[-4]+RC[-2] -> 6760.451626268682 | O290: =(1.000001018*(1-RC[-4]*RC[-4]))/(1+RC[-4]*COS(RADIANS(RC[-1]))) -> 0.9967024023446297 | P290: =RC[-3]-0.00569-0.00478*SIN(RADIANS(125.04-1934.136*RC[-9])) -> 203.68622117894444 | Q290: =23+(26+((21.448-RC[-10]*(46.815+RC[-10]*(0.00059-RC[-10]*0.001813))))/60)/60 -> 23.436977461899552 | R290: =RC[-1]+0.00256*COS(RADIANS(125.04-1934.136*RC[-11])) -> 23.43499003305519 | S290: =DEGREES(ATAN2(COS(RADIANS(RC[-3])),COS(RADIANS(RC[-1]))*SIN(RADIANS(RC[-3])))) -> -158.07539052489597 | T290: =DEGREES(ASIN(SIN(RADIANS(RC[-2]))*SIN(RADIANS(RC[-4])))) -> -9.1935683902408059 | U290: =TAN(RADIANS(RC[-3]/2))*TAN(RADIANS(RC[-3]/2)) -> 4.3018288094487447E-2 | V290: =4*DEGREES(RC[-1]*SIN(2*RADIANS(RC[-13]))-2*RC[-11]*SIN(RADIANS(RC[-12]))+4*RC[-11]*RC[-1]*SIN(RADIANS(RC[-12]))*COS(2*RADIANS(RC[-13]))-0.5*RC[-1]*RC[-1]*SIN(4*RADIANS(RC[-13]))-1.25*RC[-11]*RC[-11]*SIN(2*RADIANS(RC[-12]))) -> 14.57880235324928 | W290: =DEGREES(ACOS(COS(RADIANS(90.833))/(COS(RADIANS(R2C2))*COS(RADIANS(RC[-3])))-TAN(RADIANS(R2C2))*TAN(RADIANS(RC[-3])))) -> 66.320626903688805 | X290: =(720-4*R3C2-RC[-2]+R4C2*60)/1440 -> 1899-12-31T13:41:25.272 | Y290: =(RC[-1]*1440-RC[-2]*4)/1440 -> 1899-12-31T09:16:08.321 | Z290: =(RC[-2]*1440+RC[-3]*4)/1440 -> 1899-12-31T18:06:42.222 | AA290: =8*RC[-4] -> 530.56501522951044 | AB290: =MOD(RC[-23]*1440+RC[-6]+4*R3C2-60*R4C2,1440) -> 738.57880235324933 | AC290: =IF(RC[-1]/4<0,RC[-1]/4+180,RC[-1]/4-180) -> 4.6447005883123325 | AD290: =DEGREES(ACOS(SIN(RADIANS(R2C2))*SIN(RADIANS(RC[-10]))+COS(RADIANS(R2C2))*COS(RADIANS(RC[-10]))*COS(RADIANS(RC[-1])))) -> 79.2582358446586 | AE290: =90-RC[-1] -> 10.7417641553414 | AF290: =IF(RC[-1]>85,0,IF(RC[-1]>5,58.1/TAN(RADIANS(RC[-1]))-0.07/POWER(TAN(RADIANS(RC[-1])),3)+0.000086/POWER(TAN(RADIANS(RC[-1])),5),IF(RC[-1]>-0.575,1735+RC[-1]*(-518.2+RC[-1]*(103.4+RC[-1]*(-12.79+RC[-1]*0.711))),-20.772/TAN(RADIANS(RC[-1])))))/3600 -> 8.2321895840678325E-2 | AG290: =RC[-2]+RC[-1] -> 10.824086051182078 | AH290: =IF(RC[-5]>0,MOD(DEGREES(ACOS(((SIN(RADIANS(R2C2))*COS(RADIANS(RC[-4])))-SIN(RADIANS(RC[-14])))/(COS(RADIANS(R2C2))*SIN(RADIANS(RC[-4])))))+180,360),MOD(540-DEGREES(ACOS(((SIN(RADIANS(R2C2))*COS(RADIANS(RC[-4])))-SIN(RADIANS(RC[-14])))/(COS(RADIANS(R2C2))*SIN(RADIANS(RC[-4]))))),360)) -> 184.66686023780031
D291: =R[-1]C+1 -> 2017-10-17T00:00:00.000 | E291: =R5C2 -> 1899-12-31T14:00:00.000 | F291: =RC[-2]+2415018.5+RC[-1]-R4C2/24 -> 2458044.375 | G291: =(RC[-1]-2451545)/36525 -> 0.17794318959616701 | I291: =MOD(280.46646+RC[-2]*(36000.76983 + RC[-2]*0.0003032),360) -> 206.55828106811623 | J291: =357.52911+RC[-3]*(35999.05029 - 0.0001537*RC[-3]) -> 6763.3149361686983 | K291: =0.016708634-RC[-4]*(0.000042037+0.0000001267*RC[-4]) -> 1.6701149790338182E-2 | L291: =SIN(RADIANS(RC[-2]))*(1.914602-RC[-5]*(0.004817+0.000014*RC[-5]))+SIN(RADIANS(2*RC[-2]))*(0.019993-0.000101*RC[-5])+SIN(RADIANS(3*RC[-2]))*0.000289 -> -1.8710325359329096 | M291: =RC[-4]+RC[-1] -> 204.68724853218333 | N291: =RC[-4]+RC[-2] -> 6761.4439036327658 | O291: =(1.000001018*(1-RC[-4]*RC[-4]))/(1+RC[-4]*COS(RADIANS(RC[-1]))) -> 0.99642030230136969 | P291: =RC[-3]-0.00569-0.00478*SIN(RADIANS(125.04-1934.136*RC[-9])) -> 204.67854219752624 | Q291: =23+(26+((21.448-RC[-10]*(46.815+RC[-10]*(0.00059-RC[-10]*0.001813))))/60)/60 -> 23.436977105864585 | R291: =RC[-1]+0.00256*COS(RADIANS(125.04-1934.136*RC[-11])) -> 23.434991169192248 | S291: =DEGREES(ATAN2(COS(RADIANS(RC[-3])),COS(RADIANS(RC[-1]))*SIN(RADIANS(RC[-3])))) -> -157.14009664390215 | T291: =DEGREES(ASIN(SIN(RADIANS(RC[-2]))*SIN(RADIANS(RC[-4])))) -> -9.558461587763091 | U291: =TAN(RADIANS(RC[-3]/2))*TAN(RADIANS(RC[-3]/2)) -> 4.3018292384184177E-2 | V291: =4*DEGREES(RC[-1]*SIN(2*RADIANS(RC[-13]))-2*RC[-11]*SIN(RADIANS(RC[-12]))+4*RC[-11]*RC[-1]*SIN(RADIANS(RC[-12]))*COS(2*RADIANS(RC[-13]))-0.5*RC[-1]*RC[-1]*SIN(4*RADIANS(RC[-13]))-1.25*RC[-11]*RC[-11]*SIN(2*RADIANS(RC[-12]))) -> 14.782850254883753 | W291: =DEGREES(ACOS(COS(RADIANS(90.833))/(COS(RADIANS(R2C2))*COS(RADIANS(RC[-3])))-TAN(RADIANS(R2C2))*TAN(RADIANS(RC[-3])))) -> 65.193979002672876 | X291: =(720-4*R3C2-RC[-2]+R4C2*60)/1440 -> 1899-12-31T13:41:13.029 | Y291: =(RC[-1]*1440-RC[-2]*4)/1440 -> 1899-12-31T09:20:26.474 | Z291: =(RC[-2]*1440+RC[-3]*4)/1440 -> 1899-12-31T18:01:59.584 | AA291: =8*RC[-4] -> 521.55183202138301 | AB291: =MOD(RC[-23]*1440+RC[-6]+4*R3C2-60*R4C2,1440) -> 738.78285025488378 | AC291: =IF(RC[-1]/4<0,RC[-1]/4+180,RC[-1]/4-180) -> 4.6957125637209458 | AD291: =DEGREES(ACOS(SIN(RADIANS(R2C2))*SIN(RADIANS(RC[-10]))+COS(RADIANS(R2C2))*COS(RADIANS(RC[-10]))*COS(RADIANS(RC[-1])))) -> 79.624408321927376 | AE291: =90-RC[-1] -> 10.375591678072624 | AF291: =IF(RC[-1]>85,0,IF(RC[-1]>5,58.1/TAN(RADIANS(RC[-1]))-0.07/POWER(TAN(RADIANS(RC[-1])),3)+0.000086/POWER(TAN(RADIANS(RC[-1])),5),IF(RC[-1]>-0.575,1735+RC[-1]*(-518.2+RC[-1]*(103.4+RC[-1]*(-12.79+RC[-1]*0.711))),-20.772/TAN(RADIANS(RC[-1])))))/3600 -> 8.5093548154235935E-2 | AG291: =RC[-2]+RC[-1] -> 10.460685226226859 | AH291: =IF(RC[-5]>0,MOD(DEGREES(ACOS(((SIN(RADIANS(R2C2))*COS(RADIANS(RC[-4])))-SIN(RADIANS(RC[-14])))/(COS(RADIANS(R2C2))*SIN(RADIANS(RC[-4])))))+180,360),MOD(540-DEGREES(ACOS(((SIN(RADIANS(R2C2))*COS(RADIANS(RC[-4])))-SIN(RADIANS(RC[-14])))/(COS(RADIANS(R2C2))*SIN(RADIANS(RC[-4]))))),360)) -> 184.70752268898261
D292: =R[-1]C+1 -> 2017-10-18T00:00:00.000 | E292: =R5C2 -> 1899-12-31T14:00:00.000 | F292: =RC[-2]+2415018.5+RC[-1]-R4C2/24 -> 2458045.375 | G292: =(RC[-1]-2451545)/36525 -> 0.17797056810403833 | I292: =MOD(280.46646+RC[-2]*(36000.76983 + RC[-2]*0.0003032),360) -> 207.54392843123514 | J292: =357.52911+RC[-3]*(35999.05029 - 0.0001537*RC[-3]) -> 6764.3005364489254 | K292: =0.016708634-RC[-4]*(0.000042037+0.0000001267*RC[-4]) -> 1.6701148638193233E-2 | L292: =SIN(RADIANS(RC[-2]))*(1.914602-RC[-5]*(0.004817+0.000014*RC[-5]))+SIN(RADIANS(2*RC[-2]))*(0.019993-0.000101*RC[-5])+SIN(RADIANS(3*RC[-2]))*0.000289 -> -1.8637943908279904 | M292: =RC[-4]+RC[-1] -> 205.68013404040715 | N292: =RC[-4]+RC[-2] -> 6762.4367420580975 | O292: =(1.000001018*(1-RC[-4]*RC[-4]))/(1+RC[-4]*COS(RADIANS(RC[-1]))) -> 0.99613918987406291 | P292: =RC[-3]-0.00569-0.00478*SIN(RADIANS(125.04-1934.136*RC[-9])) -> 205.67142427993326 | Q292: =23+(26+((21.448-RC[-10]*(46.815+RC[-10]*(0.00059-RC[-10]*0.001813))))/60)/60 -> 23.436976749829618 | R292: =RC[-1]+0.00256*COS(RADIANS(125.04-1934.136*RC[-11])) -> 23.434992307025649 | S292: =DEGREES(ATAN2(COS(RADIANS(RC[-3])),COS(RADIANS(RC[-1]))*SIN(RADIANS(RC[-3])))) -> -156.20227100497291 | T292: =DEGREES(ASIN(SIN(RADIANS(RC[-2]))*SIN(RADIANS(RC[-4])))) -> -9.9210536217747478 | U292: =TAN(RADIANS(RC[-3]/2))*TAN(RADIANS(RC[-3]/2)) -> 4.3018296680286006E-2 | V292: =4*DEGREES(RC[-1]*SIN(2*RADIANS(RC[-13]))-2*RC[-11]*SIN(RADIANS(RC[-12]))+4*RC[-11]*RC[-1]*SIN(RADIANS(RC[-12]))*COS(2*RADIANS(RC[-13]))-0.5*RC[-1]*RC[-1]*SIN(4*RADIANS(RC[-13]))-1.25*RC[-11]*RC[-11]*SIN(2*RADIANS(RC[-12]))) -> 14.976706785737829 | W292: =DEGREES(ACOS(COS(RADIANS(90.833))/(COS(RADIANS(R2C2))*COS(RADIANS(RC[-3])))-TAN(RADIANS(R2C2))*TAN(RADIANS(RC[-3])))) -> 64.061880833420034 | X292: =(720-4*R3C2-RC[-2]+R4C2*60)/1440 -> 1899-12-31T13:41:01.398 | Y292: =(RC[-1]*1440-RC[-2]*4)/1440 -> 1899-12-31T09:24:46.546 | Z292: =(RC[-2]*1440+RC[-3]*4)/1440 -> 1899-12-31T17:57:16.249 | AA292: =8*RC[-4] -> 512.49504666736027 | AB292: =MOD(RC[-23]*1440+RC[-6]+4*R3C2-60*R4C2,1440) -> 738.97670678573786 | AC292: =IF(RC[-1]/4<0,RC[-1]/4+180,RC[-1]/4-180) -> 4.7441766964344652 | AD292: =DEGREES(ACOS(SIN(RADIANS(R2C2))*SIN(RADIANS(RC[-10]))+COS(RADIANS(R2C2))*COS(RADIANS(RC[-10]))*COS(RADIANS(RC[-1])))) -> 79.988217924408517 | AE292: =90-RC[-1] -> 10.011782075591483 | AF292: =IF(RC[-1]>85,0,IF(RC[-1]>5,58.1/TAN(RADIANS(RC[-1]))-0.07/POWER(TAN(RADIANS(RC[-1])),3)+0.000086/POWER(TAN(RADIANS(RC[-1])),5),IF(RC[-1]>-0.575,1735+RC[-1]*(-518.2+RC[-1]*(103.4+RC[-1]*(-12.79+RC[-1]*0.711))),-20.772/TAN(RADIANS(RC[-1])))))/3600 -> 8.8023511929874482E-2 | AG292: =RC[-2]+RC[-1] -> 10.099805587521358 | AH292: =IF(RC[-5]>0,MOD(DEGREES(ACOS(((SIN(RADIANS(R2C2))*COS(RADIANS(RC[-4])))-SIN(RADIANS(RC[-14])))/(COS(RADIANS(R2C2))*SIN(RADIANS(RC[-4])))))+180,360),MOD(540-DEGREES(ACOS(((SIN(RADIANS(R2C2))*COS(RADIANS(RC[-4])))-SIN(RADIANS(RC[-14])))/(COS(RADIANS(R2C2))*SIN(RADIANS(RC[-4]))))),360)) -> 184.74550001574084
D293: =R[-1]C+1 -> 2017-10-19T00:00:00.000 | E293: =R5C2 -> 1899-12-31T14:00:00.000 | F293: =RC[-2]+2415018.5+RC[-1]-R4C2/24 -> 2458046.375 | G293: =(RC[-1]-2451545)/36525 -> 0.17799794661190965 | I293: =MOD(280.46646+RC[-2]*(36000.76983 + RC[-2]*0.0003032),360) -> 208.52957579435406 | J293: =357.52911+RC[-3]*(35999.05029 - 0.0001537*RC[-3]) -> 6765.2861367291525 | K293: =0.016708634-RC[-4]*(0.000042037+0.0000001267*RC[-4]) -> 1.6701147486048094E-2 | L293: =SIN(RADIANS(RC[-2]))*(1.914602-RC[-5]*(0.004817+0.000014*RC[-5]))+SIN(RADIANS(2*RC[-2]))*(0.019993-0.000101*RC[-5])+SIN(RADIANS(3*RC[-2]))*0.000289 -> -1.8559967625060556 | M293: =RC[-4]+RC[-1] -> 206.67357903184799 | N293: =RC[-4]+RC[-2] -> 6763.4301399666465 | O293: =(1.000001018*(1-RC[-4]*RC[-4]))/(1+RC[-4]*COS(RADIANS(RC[-1]))) -> 0.99585915005101799 | P293: =RC[-3]-0.00569-0.00478*SIN(RADIANS(125.04-1934.136*RC[-9])) -> 206.66486584813671 | Q293: =23+(26+((21.448-RC[-10]*(46.815+RC[-10]*(0.00059-RC[-10]*0.001813))))/60)/60 -> 23.436976393794652 | R293: =RC[-1]+0.00256*COS(RADIANS(125.04-1934.136*RC[-11])) -> 23.434993446554117 | S293: =DEGREES(ATAN2(COS(RADIANS(RC[-3])),COS(RADIANS(RC[-1]))*SIN(RADIANS(RC[-3])))) -> -155.2618442833157 | T293: =DEGREES(ASIN(SIN(RADIANS(RC[-2]))*SIN(RADIANS(RC[-4])))) -> -10.281236878600378 | U293: =TAN(RADIANS(RC[-3]/2))*TAN(RADIANS(RC[-3]/2)) -> 4.3018300982788103E-2 | V293: =4*DEGREES(RC[-1]*SIN(2*RADIANS(RC[-13]))-2*RC[-11]*SIN(RADIANS(RC[-12]))+4*RC[-11]*RC[-1]*SIN(RADIANS(RC[-12]))*COS(2*RADIANS(RC[-13]))-0.5*RC[-1]*RC[-1]*SIN(4*RADIANS(RC[-13]))-1.25*RC[-11]*RC[-11]*SIN(2*RADIANS(RC[-12]))) -> 15.160078375584083 | W293: =DEGREES(ACOS(COS(RADIANS(90.833))/(COS(RADIANS(R2C2))*COS(RADIANS(RC[-3])))-TAN(RADIANS(R2C2))*TAN(RADIANS(RC[-3])))) -> 62.924016091446568 | X293: =(720-4*R3C2-RC[-2]+R4C2*60)/1440 -> 1899-12-31T13:40:50.395 | Y293: =(RC[-1]*1440-RC[-2]*4)/1440 -> 1899-12-31T09:29:08.631 | Z293: =(RC[-2]*1440+RC[-3]*4)/1440 -> 1899-12-31T17:52:32.159 | AA293: =8*RC[-4] -> 503.39212873157254 | AB293: =MOD(RC[-23]*1440+RC[-6]+4*R3C2-60*R4C2,1440) -> 739.16007837558413 | AC293: =IF(RC[-1]/4<0,RC[-1]/4+180,RC[-1]/4-180) -> 4.7900195938960337 | AD293: =DEGREES(ACOS(SIN(RADIANS(R2C2))*SIN(RADIANS(RC[-10]))+COS(RADIANS(R2C2))*COS(RADIANS(RC[-10]))*COS(RADIANS(RC[-1])))) -> 80.349553229658795 | AE293: =90-RC[-1] -> 9.6504467703412047 | AF293: =IF(RC[-1]>85,0,IF(RC[-1]>5,58.1/TAN(RADIANS(RC[-1]))-0.07/POWER(TAN(RADIANS(RC[-1])),3)+0.000086/POWER(TAN(RADIANS(RC[-1])),5),IF(RC[-1]>-0.575,1735+RC[-1]*(-518.2+RC[-1]*(103.4+RC[-1]*(-12.79+RC[-1]*0.711))),-20.772/TAN(RADIANS(RC[-1])))))/3600 -> 9.1123855951451976E-2 | AG293: =RC[-2]+RC[-1] -> 9.7415706262926562 | AH293: =IF(RC[-5]>0,MOD(DEGREES(ACOS(((SIN(RADIANS(R2C2))*COS(RADIANS(RC[-4])))-SIN(RADIANS(RC[-14])))/(COS(RADIANS(R2C2))*SIN(RADIANS(RC[-4])))))+180,360),MOD(540-DEGREES(ACOS(((SIN(RADIANS(R2C2))*COS(RADIANS(RC[-4])))-SIN(RADIANS(RC[-14])))/(COS(RADIANS(R2C2))*SIN(RADIANS(RC[-4]))))),360)) -> 184.78074068719948
D294: =R[-1]C+1 -> 2017-10-20T00:00:00.000 | E294: =R5C2 -> 1899-12-31T14:00:00.000 | F294: =RC[-2]+2415018.5+RC[-1]-R4C2/24 -> 2458047.375 | G294: =(RC[-1]-2451545)/36525 -> 0.17802532511978097 | I294: =MOD(280.46646+RC[-2]*(36000.76983 + RC[-2]*0.0003032),360) -> 209.51522315747388 | J294: =357.52911+RC[-3]*(35999.05029 - 0.0001537*RC[-3]) -> 6766.2717370093796 | K294: =0.016708634-RC[-4]*(0.000042037+0.0000001267*RC[-4]) -> 1.6701146333902763E-2 | L294: =SIN(RADIANS(RC[-2]))*(1.914602-RC[-5]*(0.004817+0.000014*RC[-5]))+SIN(RADIANS(2*RC[-2]))*(0.019993-0.000101*RC[-5])+SIN(RADIANS(3*RC[-2]))*0.000289 -> -1.8476414032613309 | M294: =RC[-4]+RC[-1] -> 207.66758175421256 | N294: =RC[-4]+RC[-2] -> 6764.4240956061185 | O294: =(1.000001018*(1-RC[-4]*RC[-4]))/(1+RC[-4]*COS(RADIANS(RC[-1]))) -> 0.9955802676389679 | P294: =RC[-3]-0.00569-0.00478*SIN(RADIANS(125.04-1934.136*RC[-9])) -> 207.65886514984624 | Q294: =23+(26+((21.448-RC[-10]*(46.815+RC[-10]*(0.00059-RC[-10]*0.001813))))/60)/60 -> 23.436976037759688 | R294: =RC[-1]+0.00256*COS(RADIANS(125.04-1934.136*RC[-11])) -> 23.434994587776377 | S294: =DEGREES(ATAN2(COS(RADIANS(RC[-3])),COS(RADIANS(RC[-1]))*SIN(RADIANS(RC[-3])))) -> -154.31874877519783 | T294: =DEGREES(ASIN(SIN(RADIANS(RC[-2]))*SIN(RADIANS(RC[-4])))) -> -10.638903222693026 | U294: =TAN(RADIANS(RC[-3]/2))*TAN(RADIANS(RC[-3]/2)) -> 4.3018305291685661E-2 | V294: =4*DEGREES(RC[-1]*SIN(2*RADIANS(RC[-13]))-2*RC[-11]*SIN(RADIANS(RC[-12]))+4*RC[-11]*RC[-1]*SIN(RADIANS(RC[-12]))*COS(2*RADIANS(RC[-13]))-0.5*RC[-1]*RC[-1]*SIN(4*RADIANS(RC[-13]))-1.25*RC[-11]*RC[-11]*SIN(2*RADIANS(RC[-12]))) -> 15.332678180716144 | W294: =DEGREES(ACOS(COS(RADIANS(90.833))/(COS(RADIANS(R2C2))*COS(RADIANS(RC[-3])))-TAN(RADIANS(R2C2))*TAN(RADIANS(RC[-3])))) -> 61.780053136174907 | X294: =(720-4*R3C2-RC[-2]+R4C2*60)/1440 -> 1899-12-31T13:40:40.039 | Y294: =(RC[-1]*1440-RC[-2]*4)/1440 -> 1899-12-31T09:33:32.827 | Z294: =(RC[-2]*1440+RC[-3]*4)/1440 -> 1899-12-31T17:47:47.252 | AA294: =8*RC[-4] -> 494.24042508939925 | AB294: =MOD(RC[-23]*1440+RC[-6]+4*R3C2-60*R4C2,1440) -> 739.33267818071613 | AC294: =IF(RC[-1]/4<0,RC[-1]/4+180,RC[-1]/4-180) -> 4.8331695451790324 | AD294: =DEGREES(ACOS(SIN(RADIANS(R2C2))*SIN(RADIANS(RC[-10]))+COS(RADIANS(R2C2))*COS(RADIANS(RC[-10]))*COS(RADIANS(RC[-1])))) -> 80.708302415357508 | AE294: =90-RC[-1] -> 9.2916975846424918 | AF294: =IF(RC[-1]>85,0,IF(RC[-1]>5,58.1/TAN(RADIANS(RC[-1]))-0.07/POWER(TAN(RADIANS(RC[-1])),3)+0.000086/POWER(TAN(RADIANS(RC[-1])),5),IF(RC[-1]>-0.575,1735+RC[-1]*(-518.2+RC[-1]*(103.4+RC[-1]*(-12.79+RC[-1]*0.711))),-20.772/TAN(RADIANS(RC[-1])))))/3600 -> 9.4407704925454194E-2 | AG294: =RC[-2]+RC[-1] -> 9.3861052895679453 | AH294: =IF(RC[-5]>0,MOD(DEGREES(ACOS(((SIN(RADIANS(R2C2))*COS(RADIANS(RC[-4])))-SIN(RADIANS(RC[-14])))/(COS(RADIANS(R2C2))*SIN(RADIANS(RC[-4])))))+180,360),MOD(540-DEGREES(ACOS(((SIN(RADIANS(R2C2))*COS(RADIANS(RC[-4])))-SIN(RADIANS(RC[-14])))/(COS(RADIANS(R2C2))*SIN(RADIANS(RC[-4]))))),360)) -> 184.81319528595029
D295: =R[-1]C+1 -> 2017-10-21T00:00:00.000 | E295: =R5C2 -> 1899-12-31T14:00:00.000 | F295: =RC[-2]+2415018.5+RC[-1]-R4C2/24 -> 2458048.375 | G295: =(RC[-1]-2451545)/36525 -> 0.1780527036276523 | I295: =MOD(280.46646+RC[-2]*(36000.76983 + RC[-2]*0.0003032),360) -> 210.50087052059462 | J295: =357.52911+RC[-3]*(35999.05029 - 0.0001537*RC[-3]) -> 6767.2573372896049 | K295: =0.016708634-RC[-4]*(0.000042037+0.0000001267*RC[-4]) -> 1.6701145181757245E-2 | L295: =SIN(RADIANS(RC[-2]))*(1.914602-RC[-5]*(0.004817+0.000014*RC[-5]))+SIN(RADIANS(2*RC[-2]))*(0.019993-0.000101*RC[-5])+SIN(RADIANS(3*RC[-2]))*0.000289 -> -1.8387302398255125 | M295: =RC[-4]+RC[-1] -> 208.66214028076911 | N295: =RC[-4]+RC[-2] -> 6765.418607049779 | O295: =(1.000001018*(1-RC[-4]*RC[-4]))/(1+RC[-4]*COS(RADIANS(RC[-1]))) -> 0.99530262723592522 | P295: =RC[-3]-0.00569-0.00478*SIN(RADIANS(125.04-1934.136*RC[-9])) -> 208.65342025833297 | Q295: =23+(26+((21.448-RC[-10]*(46.815+RC[-10]*(0.00059-RC[-10]*0.001813))))/60)/60 -> 23.436975681724721 | R295: =RC[-1]+0.00256*COS(RADIANS(125.04-1934.136*RC[-11])) -> 23.434995730691146 | S295: =DEGREES(ATAN2(COS(RADIANS(RC[-3])),COS(RADIANS(RC[-1]))*SIN(RADIANS(RC[-3])))) -> -153.37291849260927 | T295: =DEGREES(ASIN(SIN(RADIANS(RC[-2]))*SIN(RADIANS(RC[-4])))) -> -10.993944011622171 | U295: =TAN(RADIANS(RC[-3]/2))*TAN(RADIANS(RC[-3]/2)) -> 4.3018309606973837E-2 | V295: =4*DEGREES(RC[-1]*SIN(2*RADIANS(RC[-13]))-2*RC[-11]*SIN(RADIANS(RC[-12]))+4*RC[-11]*RC[-1]*SIN(RADIANS(RC[-12]))*COS(2*RADIANS(RC[-13]))-0.5*RC[-1]*RC[-1]*SIN(4*RADIANS(RC[-13]))-1.25*RC[-11]*RC[-11]*SIN(2*RADIANS(RC[-12]))) -> 15.494226586943164 | W295: =DEGREES(ACOS(COS(RADIANS(90.833))/(COS(RADIANS(R2C2))*COS(RADIANS(RC[-3])))-TAN(RADIANS(R2C2))*TAN(RADIANS(RC[-3])))) -> 60.629643094660871 | X295: =(720-4*R3C2-RC[-2]+R4C2*60)/1440 -> 1899-12-31T13:40:30.346 | Y295: =(RC[-1]*1440-RC[-2]*4)/1440 -> 1899-12-31T09:37:59.232 | Z295: =(RC[-2]*1440+RC[-3]*4)/1440 -> 1899-12-31T17:43:01.461 | AA295: =8*RC[-4] -> 485.03714475728697 | AB295: =MOD(RC[-23]*1440+RC[-6]+4*R3C2-60*R4C2,1440) -> 739.49422658694311 | AC295: =IF(RC[-1]/4<0,RC[-1]/4+180,RC[-1]/4-180) -> 4.8735566467357785 | AD295: =DEGREES(ACOS(SIN(RADIANS(R2C2))*SIN(RADIANS(RC[-10]))+COS(RADIANS(R2C2))*COS(RADIANS(RC[-10]))*COS(RADIANS(RC[-1])))) -> 81.064353289437761 | AE295: =90-RC[-1] -> 8.9356467105622386 | AF295: =IF(RC[-1]>85,0,IF(RC[-1]>5,58.1/TAN(RADIANS(RC[-1]))-0.07/POWER(TAN(RADIANS(RC[-1])),3)+0.000086/POWER(TAN(RADIANS(RC[-1])),5),IF(RC[-1]>-0.575,1735+RC[-1]*(-518.2+RC[-1]*(103.4+RC[-1]*(-12.79+RC[-1]*0.711))),-20.772/TAN(RADIANS(RC[-1])))))/3600 -> 9.7889322629327244E-2 | AG295: =RC[-2]+RC[-1] -> 9.0335360331915666 | AH295: =IF(RC[-5]>0,MOD(DEGREES(ACOS(((SIN(RADIANS(R2C2))*COS(RADIANS(RC[-4])))-SIN(RADIANS(RC[-14])))/(COS(RADIANS(R2C2))*SIN(RADIANS(RC[-4])))))+180,360),MOD(540-DEGREES(ACOS(((SIN(RADIANS(R2C2))*COS(RADIANS(RC[-4])))-SIN(RADIANS(RC[-14])))/(COS(RADIANS(R2C2))*SIN(RADIANS(RC[-4]))))),360)) -> 184.84281659258781
D296: =R[-1]C+1 -> 2017-10-22T00:00:00.000 | E296: =R5C2 -> 1899-12-31T14:00:00.000 | F296: =RC[-2]+2415018.5+RC[-1]-R4C2/24 -> 2458049.375 | G296: =(RC[-1]-2451545)/36525 -> 0.17808008213552362 | I296: =MOD(280.46646+RC[-2]*(36000.76983 + RC[-2]*0.0003032),360) -> 211.48651788371444 | J296: =357.52911+RC[-3]*(35999.05029 - 0.0001537*RC[-3]) -> 6768.2429375698321 | K296: =0.016708634-RC[-4]*(0.000042037+0.0000001267*RC[-4]) -> 1.6701144029611537E-2 | L296: =SIN(RADIANS(RC[-2]))*(1.914602-RC[-5]*(0.004817+0.000014*RC[-5]))+SIN(RADIANS(2*RC[-2]))*(0.019993-0.000101*RC[-5])+SIN(RADIANS(3*RC[-2]))*0.000289 -> -1.8292653734817523 | M296: =RC[-4]+RC[-1] -> 209.65725251023269 | N296: =RC[-4]+RC[-2] -> 6766.4136721963505 | O296: =(1.000001018*(1-RC[-4]*RC[-4]))/(1+RC[-4]*COS(RADIANS(RC[-1]))) -> 0.99502631320392865 | P296: =RC[-3]-0.00569-0.00478*SIN(RADIANS(125.04-1934.136*RC[-9])) -> 209.64852907231494 | Q296: =23+(26+((21.448-RC[-10]*(46.815+RC[-10]*(0.00059-RC[-10]*0.001813))))/60)/60 -> 23.436975325689755 | R296: =RC[-1]+0.00256*COS(RADIANS(125.04-1934.136*RC[-11])) -> 23.434996875297141 | S296: =DEGREES(ATAN2(COS(RADIANS(RC[-3])),COS(RADIANS(RC[-1]))*SIN(RADIANS(RC[-3])))) -> -152.42428926010911 | T296: =DEGREES(ASIN(SIN(RADIANS(RC[-2]))*SIN(RADIANS(RC[-4])))) -> -11.346250113432268 | U296: =TAN(RADIANS(RC[-3]/2))*TAN(RADIANS(RC[-3]/2)) -> 4.3018313928647793E-2 | V296: =4*DEGREES(RC[-1]*SIN(2*RADIANS(RC[-13]))-2*RC[-11]*SIN(RADIANS(RC[-12]))+4*RC[-11]*RC[-1]*SIN(RADIANS(RC[-12]))*COS(2*RADIANS(RC[-13]))-0.5*RC[-1]*RC[-1]*SIN(4*RADIANS(RC[-13]))-1.25*RC[-11]*RC[-11]*SIN(2*RADIANS(RC[-12]))) -> 15.644451721019561 | W296: =DEGREES(ACOS(COS(RADIANS(90.833))/(COS(RADIANS(R2C2))*COS(RADIANS(RC[-3])))-TAN(RADIANS(R2C2))*TAN(RADIANS(RC[-3])))) -> 59.4724177010891 | X296: =(720-4*R3C2-RC[-2]+R4C2*60)/1440 -> 1899-12-31T13:40:21.333 | Y296: =(RC[-1]*1440-RC[-2]*4)/1440 -> 1899-12-31T09:42:27.953 | Z296: =(RC[-2]*1440+RC[-3]*4)/1440 -> 1899-12-31T17:38:14.713 | AA296: =8*RC[-4] -> 475.7793416087128 | AB296: =MOD(RC[-23]*1440+RC[-6]+4*R3C2-60*R4C2,1440) -> 739.64445172101955 | AC296: =IF(RC[-1]/4<0,RC[-1]/4+180,RC[-1]/4-180) -> 4.9111129302548875 | AD296: =DEGREES(ACOS(SIN(RADIANS(R2C2))*SIN(RADIANS(RC[-10]))+COS(RADIANS(R2C2))*COS(RADIANS(RC[-10]))*COS(RADIANS(RC[-1])))) -> 81.417593322476947 | AE296: =90-RC[-1] -> 8.5824066775230534 | AF296: =IF(RC[-1]>85,0,IF(RC[-1]>5,58.1/TAN(RADIANS(RC[-1]))-0.07/POWER(TAN(RADIANS(RC[-1])),3)+0.000086/POWER(TAN(RADIANS(RC[-1])),5),IF(RC[-1]>-0.575,1735+RC[-1]*(-518.2+RC[-1]*(103.4+RC[-1]*(-12.79+RC[-1]*0.711))),-20.772/TAN(RADIANS(RC[-1])))))/3600 -> 0.10158419491985456 | AG296: =RC[-2]+RC[-1] -> 8.6839908724429087 | AH296: =IF(RC[-5]>0,MOD(DEGREES(ACOS(((SIN(RADIANS(R2C2))*COS(RADIANS(RC[-4])))-SIN(RADIANS(RC[-14])))/(COS(RADIANS(R2C2))*SIN(RADIANS(RC[-4])))))+180,360),MOD(540-DEGREES(ACOS(((SIN(RADIANS(R2C2))*COS(RADIANS(RC[-4])))-SIN(RADIANS(RC[-14])))/(COS(RADIANS(R2C2))*SIN(RADIANS(RC[-4]))))),360)) -> 184.86955967037392
D297: =R[-1]C+1 -> 2017-10-23T00:00:00.000 | E297: =R5C2 -> 1899-12-31T14:00:00.000 | F297: =RC[-2]+2415018.5+RC[-1]-R4C2/24 -> 2458050.375 | G297: =(RC[-1]-2451545)/36525 -> 0.17810746064339494 | I297: =MOD(280.46646+RC[-2]*(36000.76983 + RC[-2]*0.0003032),360) -> 212.47216524683517 | J297: =357.52911+RC[-3]*(35999.05029 - 0.0001537*RC[-3]) -> 6769.2285378500583 | K297: =0.016708634-RC[-4]*(0.000042037+0.0000001267*RC[-4]) -> 1.6701142877465637E-2 | L297: =SIN(RADIANS(RC[-2]))*(1.914602-RC[-5]*(0.004817+0.000014*RC[-5]))+SIN(RADIANS(2*RC[-2]))*(0.019993-0.000101*RC[-5])+SIN(RADIANS(3*RC[-2]))*0.000289 -> -1.8192490801170427 | M297: =RC[-4]+RC[-1] -> 210.65291616671814 | N297: =RC[-4]+RC[-2] -> 6767.4092887699417 | O297: =(1.000001018*(1-RC[-4]*RC[-4]))/(1+RC[-4]*COS(RADIANS(RC[-1]))) -> 0.99475140964169806 | P297: =RC[-3]-0.00569-0.00478*SIN(RADIANS(125.04-1934.136*RC[-9])) -> 210.64418931590987 | Q297: =23+(26+((21.448-RC[-10]*(46.815+RC[-10]*(0.00059-RC[-10]*0.001813))))/60)/60 -> 23.436974969654788 | R297: =RC[-1]+0.00256*COS(RADIANS(125.04-1934.136*RC[-11])) -> 23.434998021593088 | S297: =DEGREES(ATAN2(COS(RADIANS(RC[-3])),COS(RADIANS(RC[-1]))*SIN(RADIANS(RC[-3])))) -> -151.47279881378824 | T297: =DEGREES(ASIN(SIN(RADIANS(RC[-2]))*SIN(RADIANS(RC[-4])))) -> -11.695711926468229 | U297: =TAN(RADIANS(RC[-3]/2))*TAN(RADIANS(RC[-3]/2)) -> 4.3018318256702708E-2 | V297: =4*DEGREES(RC[-1]*SIN(2*RADIANS(RC[-13]))-2*RC[-11]*SIN(RADIANS(RC[-12]))+4*RC[-11]*RC[-1]*SIN(RADIANS(RC[-12]))*COS(2*RADIANS(RC[-13]))-0.5*RC[-1]*RC[-1]*SIN(4*RADIANS(RC[-13]))-1.25*RC[-11]*RC[-11]*SIN(2*RADIANS(RC[-12]))) -> 15.783089969223537 | W297: =DEGREES(ACOS(COS(RADIANS(90.833))/(COS(RADIANS(R2C2))*COS(RADIANS(RC[-3])))-TAN(RADIANS(R2C2))*TAN(RADIANS(RC[-3])))) -> 58.307986825954835 | X297: =(720-4*R3C2-RC[-2]+R4C2*60)/1440 -> 1899-12-31T13:40:13.015 | Y297: =(RC[-1]*1440-RC[-2]*4)/1440 -> 1899-12-31T09:46:59.098 | Z297: =(RC[-2]*1440+RC[-3]*4)/1440 -> 1899-12-31T17:33:26.931 | AA297: =8*RC[-4] -> 466.46389460763868 | AB297: =MOD(RC[-23]*1440+RC[-6]+4*R3C2-60*R4C2,1440) -> 739.78308996922351 | AC297: =IF(RC[-1]/4<0,RC[-1]/4+180,RC[-1]/4-180) -> 4.9457724923058777 | AD297: =DEGREES(ACOS(SIN(RADIANS(R2C2))*SIN(RADIANS(RC[-10]))+COS(RADIANS(R2C2))*COS(RADIANS(RC[-10]))*COS(RADIANS(RC[-1])))) -> 81.767909682373201 | AE297: =90-RC[-1] -> 8.232090317626799 | AF297: =IF(RC[-1]>85,0,IF(RC[-1]>5,58.1/TAN(RADIANS(RC[-1]))-0.07/POWER(TAN(RADIANS(RC[-1])),3)+0.000086/POWER(TAN(RADIANS(RC[-1])),5),IF(RC[-1]>-0.575,1735+RC[-1]*(-518.2+RC[-1]*(103.4+RC[-1]*(-12.79+RC[-1]*0.711))),-20.772/TAN(RADIANS(RC[-1])))))/3600 -> 0.10550910994526046 | AG297: =RC[-2]+RC[-1] -> 8.3375994275720586 | AH297: =IF(RC[-5]>0,MOD(DEGREES(ACOS(((SIN(RADIANS(R2C2))*COS(RADIANS(RC[-4])))-SIN(RADIANS(RC[-14])))/(COS(RADIANS(R2C2))*SIN(RADIANS(RC[-4])))))+180,360),MOD(540-DEGREES(ACOS(((SIN(RADIANS(R2C2))*COS(RADIANS(RC[-4])))-SIN(RADIANS(RC[-14])))/(COS(RADIANS(R2C2))*SIN(RADIANS(RC[-4]))))),360)) -> 184.89338194971313
D298: =R[-1]C+1 -> 2017-10-24T00:00:00.000 | E298: =R5C2 -> 1899-12-31T14:00:00.000 | F298: =RC[-2]+2415018.5+RC[-1]-R4C2/24 -> 2458051.375 | G298: =(RC[-1]-2451545)/36525 -> 0.17813483915126627 | I298: =MOD(280.46646+RC[-2]*(36000.76983 + RC[-2]*0.0003032),360) -> 213.45781260995682 | J298: =357.52911+RC[-3]*(35999.05029 - 0.0001537*RC[-3]) -> 6770.2141381302836 | K298: =0.016708634-RC[-4]*(0.000042037+0.0000001267*RC[-4]) -> 1.6701141725319547E-2 | L298: =SIN(RADIANS(RC[-2]))*(1.914602-RC[-5]*(0.004817+0.000014*RC[-5]))+SIN(RADIANS(2*RC[-2]))*(0.019993-0.000101*RC[-5])+SIN(RADIANS(3*RC[-2]))*0.000289 -> -1.8086838102116651 | M298: =RC[-4]+RC[-1] -> 211.64912879974514 | N298: =RC[-4]+RC[-2] -> 6768.4054543200718 | O298: =(1.000001018*(1-RC[-4]*RC[-4]))/(1+RC[-4]*COS(RADIANS(RC[-1]))) -> 0.99447800035719625 | P298: =RC[-3]-0.00569-0.00478*SIN(RADIANS(125.04-1934.136*RC[-9])) -> 211.64039853864034 | Q298: =23+(26+((21.448-RC[-10]*(46.815+RC[-10]*(0.00059-RC[-10]*0.001813))))/60)/60 -> 23.436974613619824 | R298: =RC[-1]+0.00256*COS(RADIANS(125.04-1934.136*RC[-11])) -> 23.434999169577704 | S298: =DEGREES(ATAN2(COS(RADIANS(RC[-3])),COS(RADIANS(RC[-1]))*SIN(RADIANS(RC[-3])))) -> -150.51838690228377 | T298: =DEGREES(ASIN(SIN(RADIANS(RC[-2]))*SIN(RADIANS(RC[-4])))) -> -12.042219401756149 | U298: =TAN(RADIANS(RC[-3]/2))*TAN(RADIANS(RC[-3]/2)) -> 4.3018322591133751E-2 | V298: =4*DEGREES(RC[-1]*SIN(2*RADIANS(RC[-13]))-2*RC[-11]*SIN(RADIANS(RC[-12]))+4*RC[-11]*RC[-1]*SIN(RADIANS(RC[-12]))*COS(2*RADIANS(RC[-13]))-0.5*RC[-1]*RC[-1]*SIN(4*RADIANS(RC[-13]))-1.25*RC[-11]*RC[-11]*SIN(2*RADIANS(RC[-12]))) -> 15.909886501708616 | W298: =DEGREES(ACOS(COS(RADIANS(90.833))/(COS(RADIANS(R2C2))*COS(RADIANS(RC[-3])))-TAN(RADIANS(R2C2))*TAN(RADIANS(RC[-3])))) -> 57.135935639456463 | X298: =(720-4*R3C2-RC[-2]+R4C2*60)/1440 -> 1899-12-31T13:40:05.407 | Y298: =(RC[-1]*1440-RC[-2]*4)/1440 -> 1899-12-31T09:51:32.782 | Z298: =(RC[-2]*1440+RC[-3]*4)/1440 -> 1899-12-31T17:28:38.031 | AA298: =8*RC[-4] -> 457.0874851156517 | AB298: =MOD(RC[-23]*1440+RC[-6]+4*R3C2-60*R4C2,1440) -> 739.90988650170857 | AC298: =IF(RC[-1]/4<0,RC[-1]/4+180,RC[-1]/4-180) -> 4.9774716254271425 | AD298: =DEGREES(ACOS(SIN(RADIANS(R2C2))*SIN(RADIANS(RC[-10]))+COS(RADIANS(R2C2))*COS(RADIANS(RC[-10]))*COS(RADIANS(RC[-1])))) -> 82.115189271324098 | AE298: =90-RC[-1] -> 7.8848107286759017 | AF298: =IF(RC[-1]>85,0,IF(RC[-1]>5,58.1/TAN(RADIANS(RC[-1]))-0.07/POWER(TAN(RADIANS(RC[-1])),3)+0.000086/POWER(TAN(RADIANS(RC[-1])),5),IF(RC[-1]>-0.575,1735+RC[-1]*(-518.2+RC[-1]*(103.4+RC[-1]*(-12.79+RC[-1]*0.711))),-20.772/TAN(RADIANS(RC[-1])))))/3600 -> 0.10968223235379021 | AG298: =RC[-2]+RC[-1] -> 7.9944929610296915 | AH298: =IF(RC[-5]>0,MOD(DEGREES(ACOS(((SIN(RADIANS(R2C2))*COS(RADIANS(RC[-4])))-SIN(RADIANS(RC[-14])))/(COS(RADIANS(R2C2))*SIN(RADIANS(RC[-4])))))+180,360),MOD(540-DEGREES(ACOS(((SIN(RADIANS(R2C2))*COS(RADIANS(RC[-4])))-SIN(RADIANS(RC[-14])))/(COS(RADIANS(R2C2))*SIN(RADIANS(RC[-4]))))),360)) -> 184.91424331212357
D299: =R[-1]C+1 -> 2017-10-25T00:00:00.000 | E299: =R5C2 -> 1899-12-31T14:00:00.000 | F299: =RC[-2]+2415018.5+RC[-1]-R4C2/24 -> 2458052.375 | G299: =(RC[-1]-2451545)/36525 -> 0.17816221765913759 | I299: =MOD(280.46646+RC[-2]*(36000.76983 + RC[-2]*0.0003032),360) -> 214.44345997307937 | J299: =357.52911+RC[-3]*(35999.05029 - 0.0001537*RC[-3]) -> 6771.1997384105098 | K299: =0.016708634-RC[-4]*(0.000042037+0.0000001267*RC[-4]) -> 1.6701140573173269E-2 | L299: =SIN(RADIANS(RC[-2]))*(1.914602-RC[-5]*(0.004817+0.000014*RC[-5]))+SIN(RADIANS(2*RC[-2]))*(0.019993-0.000101*RC[-5])+SIN(RADIANS(3*RC[-2]))*0.000289 -> -1.7975721887650897 | M299: =RC[-4]+RC[-1] -> 212.64588778431428 | N299: =RC[-4]+RC[-2] -> 6769.4021662217447 | O299: =(1.000001018*(1-RC[-4]*RC[-4]))/(1+RC[-4]*COS(RADIANS(RC[-1]))) -> 0.99420616884011614 | P299: =RC[-3]-0.00569-0.00478*SIN(RADIANS(125.04-1934.136*RC[-9])) -> 212.6371541155099 | Q299: =23+(26+((21.448-RC[-10]*(46.815+RC[-10]*(0.00059-RC[-10]*0.001813))))/60)/60 -> 23.436974257584858 | R299: =RC[-1]+0.00256*COS(RADIANS(125.04-1934.136*RC[-11])) -> 23.435000319249696 | S299: =DEGREES(ATAN2(COS(RADIANS(RC[-3])),COS(RADIANS(RC[-1]))*SIN(RADIANS(RC[-3])))) -> -149.56099538973007 | T299: =DEGREES(ASIN(SIN(RADIANS(RC[-2]))*SIN(RADIANS(RC[-4])))) -> -12.385662068038023 | U299: =TAN(RADIANS(RC[-3]/2))*TAN(RADIANS(RC[-3]/2)) -> 4.3018326931936024E-2 | V299: =4*DEGREES(RC[-1]*SIN(2*RADIANS(RC[-13]))-2*RC[-11]*SIN(RADIANS(RC[-12]))+4*RC[-11]*RC[-1]*SIN(RADIANS(RC[-12]))*COS(2*RADIANS(RC[-13]))-0.5*RC[-1]*RC[-1]*SIN(4*RADIANS(RC[-13]))-1.25*RC[-11]*RC[-11]*SIN(2*RADIANS(RC[-12]))) -> 16.024595801185992 | W299: =DEGREES(ACOS(COS(RADIANS(90.833))/(COS(RADIANS(R2C2))*COS(RADIANS(RC[-3])))-TAN(RADIANS(R2C2))*TAN(RADIANS(RC[-3])))) -> 55.955821341878909 | X299: =(720-4*R3C2-RC[-2]+R4C2*60)/1440 -> 1899-12-31T13:39:58.524 | Y299: =(RC[-1]*1440-RC[-2]*4)/1440 -> 1899-12-31T09:56:09.127 | Z299: =(RC[-2]*1440+RC[-3]*4)/1440 -> 1899-12-31T17:23:47.921 | AA299: =8*RC[-4] -> 447.64657073503128 | AB299: =MOD(RC[-23]*1440+RC[-6]+4*R3C2-60*R4C2,1440) -> 740.02459580118602 | AC299: =IF(RC[-1]/4<0,RC[-1]/4+180,RC[-1]/4-180) -> 5.006148950296506 | AD299: =DEGREES(ACOS(SIN(RADIANS(R2C2))*SIN(RADIANS(RC[-10]))+COS(RADIANS(R2C2))*COS(RADIANS(RC[-10]))*COS(RADIANS(RC[-1])))) -> 82.459318765132295 | AE299: =90-RC[-1] -> 7.540681234867705 | AF299: =IF(RC[-1]>85,0,IF(RC[-1]>5,58.1/TAN(RADIANS(RC[-1]))-0.07/POWER(TAN(RADIANS(RC[-1])),3)+0.000086/POWER(TAN(RADIANS(RC[-1])),5),IF(RC[-1]>-0.575,1735+RC[-1]*(-518.2+RC[-1]*(103.4+RC[-1]*(-12.79+RC[-1]*0.711))),-20.772/TAN(RADIANS(RC[-1])))))/3600 -> 0.11412316821825946 | AG299: =RC[-2]+RC[-1] -> 7.6548044030859641 | AH299: =IF(RC[-5]>0,MOD(DEGREES(ACOS(((SIN(RADIANS(R2C2))*COS(RADIANS(RC[-4])))-SIN(RADIANS(RC[-14])))/(COS(RADIANS(R2C2))*SIN(RADIANS(RC[-4])))))+180,360),MOD(540-DEGREES(ACOS(((SIN(RADIANS(R2C2))*COS(RADIANS(RC[-4])))-SIN(RADIANS(RC[-14])))/(COS(RADIANS(R2C2))*SIN(RADIANS(RC[-4]))))),360)) -> 184.93210617337056
D300: =R[-1]C+1 -> 2017-10-26T00:00:00.000 | E300: =R5C2 -> 1899-12-31T14:00:00.000 | F300: =RC[-2]+2415018.5+RC[-1]-R4C2/24 -> 2458053.375 | G300: =(RC[-1]-2451545)/36525 -> 0.17818959616700888 | I300: =MOD(280.46646+RC[-2]*(36000.76983 + RC[-2]*0.0003032),360) -> 215.42910733620101 | J300: =357.52911+RC[-3]*(35999.05029 - 0.0001537*RC[-3]) -> 6772.1853386907342 | K300: =0.016708634-RC[-4]*(0.000042037+0.0000001267*RC[-4]) -> 1.67011394210268E-2 | L300: =SIN(RADIANS(RC[-2]))*(1.914602-RC[-5]*(0.004817+0.000014*RC[-5]))+SIN(RADIANS(2*RC[-2]))*(0.019993-0.000101*RC[-5])+SIN(RADIANS(3*RC[-2]))*0.000289 -> -1.7859170151574435 | M300: =RC[-4]+RC[-1] -> 213.64319032104356 | N300: =RC[-4]+RC[-2] -> 6770.3994216755764 | O300: =(1.000001018*(1-RC[-4]*RC[-4]))/(1+RC[-4]*COS(RADIANS(RC[-1]))) -> 0.99393599823430534 | P300: =RC[-3]-0.00569-0.00478*SIN(RADIANS(125.04-1934.136*RC[-9])) -> 213.63445324713942 | Q300: =23+(26+((21.448-RC[-10]*(46.815+RC[-10]*(0.00059-RC[-10]*0.001813))))/60)/60 -> 23.436973901549894 | R300: =RC[-1]+0.00256*COS(RADIANS(125.04-1934.136*RC[-11])) -> 23.435001470607784 | S300: =DEGREES(ATAN2(COS(RADIANS(RC[-3])),COS(RADIANS(RC[-1]))*SIN(RADIANS(RC[-3])))) -> -148.60056836054153 | T300: =DEGREES(ASIN(SIN(RADIANS(RC[-2]))*SIN(RADIANS(RC[-4])))) -> -12.725929059546878 | U300: =TAN(RADIANS(RC[-3]/2))*TAN(RADIANS(RC[-3]/2)) -> 4.3018331279104705E-2 | V300: =4*DEGREES(RC[-1]*SIN(2*RADIANS(RC[-13]))-2*RC[-11]*SIN(RADIANS(RC[-12]))+4*RC[-11]*RC[-1]*SIN(RADIANS(RC[-12]))*COS(2*RADIANS(RC[-13]))-0.5*RC[-1]*RC[-1]*SIN(4*RADIANS(RC[-13]))-1.25*RC[-11]*RC[-11]*SIN(2*RADIANS(RC[-12]))) -> 16.126982194417074 | W300: =DEGREES(ACOS(COS(RADIANS(90.833))/(COS(RADIANS(R2C2))*COS(RADIANS(RC[-3])))-TAN(RADIANS(R2C2))*TAN(RADIANS(RC[-3])))) -> 54.767169379141812 | X300: =(720-4*R3C2-RC[-2]+R4C2*60)/1440 -> 1899-12-31T13:39:52.381 | Y300: =(RC[-1]*1440-RC[-2]*4)/1440 -> 1899-12-31T10:00:48.260 | Z300: =(RC[-2]*1440+RC[-3]*4)/1440 -> 1899-12-31T17:18:56.502 | AA300: =8*RC[-4] -> 438.1373550331345 | AB300: =MOD(RC[-23]*1440+RC[-6]+4*R3C2-60*R4C2,1440) -> 740.12698219441711 | AC300: =IF(RC[-1]/4<0,RC[-1]/4+180,RC[-1]/4-180) -> 5.0317455486042775 | AD300: =DEGREES(ACOS(SIN(RADIANS(R2C2))*SIN(RADIANS(RC[-10]))+COS(RADIANS(R2C2))*COS(RADIANS(RC[-10]))*COS(RADIANS(RC[-1])))) -> 82.800184654848948 | AE300: =90-RC[-1] -> 7.1998153451510518 | AF300: =IF(RC[-1]>85,0,IF(RC[-1]>5,58.1/TAN(RADIANS(RC[-1]))-0.07/POWER(TAN(RADIANS(RC[-1])),3)+0.000086/POWER(TAN(RADIANS(RC[-1])),5),IF(RC[-1]>-0.575,1735+RC[-1]*(-518.2+RC[-1]*(103.4+RC[-1]*(-12.79+RC[-1]*0.711))),-20.772/TAN(RADIANS(RC[-1])))))/3600 -> 0.11885301861839973 | AG300: =RC[-2]+RC[-1] -> 7.3186683637694516 | AH300: =IF(RC[-5]>0,MOD(DEGREES(ACOS(((SIN(RADIANS(R2C2))*COS(RADIANS(RC[-4])))-SIN(RADIANS(RC[-14])))/(COS(RADIANS(R2C2))*SIN(RADIANS(RC[-4])))))+180,360),MOD(540-DEGREES(ACOS(((SIN(RADIANS(R2C2))*COS(RADIANS(RC[-4])))-SIN(RADIANS(RC[-14])))/(COS(RADIANS(R2C2))*SIN(RADIANS(RC[-4]))))),360)) -> 184.94693556543155
D301: =R[-1]C+1 -> 2017-10-27T00:00:00.000 | E301: =R5C2 -> 1899-12-31T14:00:00.000 | F301: =RC[-2]+2415018.5+RC[-1]-R4C2/24 -> 2458054.375 | G301: =(RC[-1]-2451545)/36525 -> 0.17821697467488021 | I301: =MOD(280.46646+RC[-2]*(36000.76983 + RC[-2]*0.0003032),360) -> 216.41475469932357 | J301: =357.52911+RC[-3]*(35999.05029 - 0.0001537*RC[-3]) -> 6773.1709389709586 | K301: =0.016708634-RC[-4]*(0.000042037+0.0000001267*RC[-4]) -> 1.6701138268880141E-2 | L301: =SIN(RADIANS(RC[-2]))*(1.914602-RC[-5]*(0.004817+0.000014*RC[-5]))+SIN(RADIANS(2*RC[-2]))*(0.019993-0.000101*RC[-5])+SIN(RADIANS(3*RC[-2]))*0.000289 -> -1.7737212629454935 | M301: =RC[-4]+RC[-1] -> 214.64103343637808 | N301: =RC[-4]+RC[-2] -> 6771.3972177080132 | O301: =(1.000001018*(1-RC[-4]*RC[-4]))/(1+RC[-4]*COS(RADIANS(RC[-1]))) -> 0.99366757131012795 | P301: =RC[-3]-0.00569-0.00478*SIN(RADIANS(125.04-1934.136*RC[-9])) -> 214.63229295997692 | Q301: =23+(26+((21.448-RC[-10]*(46.815+RC[-10]*(0.00059-RC[-10]*0.001813))))/60)/60 -> 23.436973545514928 | R301: =RC[-1]+0.00256*COS(RADIANS(125.04-1934.136*RC[-11])) -> 23.435002623650679 | S301: =DEGREES(ATAN2(COS(RADIANS(RC[-3])),COS(RADIANS(RC[-1]))*SIN(RADIANS(RC[-3])))) -> -147.6370522258793 | T301: =DEGREES(ASIN(SIN(RADIANS(RC[-2]))*SIN(RADIANS(RC[-4])))) -> -13.062909146614205 | U301: =TAN(RADIANS(RC[-3]/2))*TAN(RADIANS(RC[-3]/2)) -> 4.3018335632634942E-2 | V301: =4*DEGREES(RC[-1]*SIN(2*RADIANS(RC[-13]))-2*RC[-11]*SIN(RADIANS(RC[-12]))+4*RC[-11]*RC[-1]*SIN(RADIANS(RC[-12]))*COS(2*RADIANS(RC[-13]))-0.5*RC[-1]*RC[-1]*SIN(4*RADIANS(RC[-13]))-1.25*RC[-11]*RC[-11]*SIN(2*RADIANS(RC[-12]))) -> 16.216820384932969 | W301: =DEGREES(ACOS(COS(RADIANS(90.833))/(COS(RADIANS(R2C2))*COS(RADIANS(RC[-3])))-TAN(RADIANS(R2C2))*TAN(RADIANS(RC[-3])))) -> 53.569469043225872 | X301: =(720-4*R3C2-RC[-2]+R4C2*60)/1440 -> 1899-12-31T13:39:46.991 | Y301: =(RC[-1]*1440-RC[-2]*4)/1440 -> 1899-12-31T10:05:30.318 | Z301: =(RC[-2]*1440+RC[-3]*4)/1440 -> 1899-12-31T17:14:03.663 | AA301: =8*RC[-4] -> 428.55575234580698 | AB301: =MOD(RC[-23]*1440+RC[-6]+4*R3C2-60*R4C2,1440) -> 740.21682038493293 | AC301: =IF(RC[-1]/4<0,RC[-1]/4+180,RC[-1]/4-180) -> 5.0542050962332326 | AD301: =DEGREES(ACOS(SIN(RADIANS(R2C2))*SIN(RADIANS(RC[-10]))+COS(RADIANS(R2C2))*COS(RADIANS(RC[-10]))*COS(RADIANS(RC[-1])))) -> 83.137673290770095 | AE301: =90-RC[-1] -> 6.8623267092299045 | AF301: =IF(RC[-1]>85,0,IF(RC[-1]>5,58.1/TAN(RADIANS(RC[-1]))-0.07/POWER(TAN(RADIANS(RC[-1])),3)+0.000086/POWER(TAN(RADIANS(RC[-1])),5),IF(RC[-1]>-0.575,1735+RC[-1]*(-518.2+RC[-1]*(103.4+RC[-1]*(-12.79+RC[-1]*0.711))),-20.772/TAN(RADIANS(RC[-1])))))/3600 -> 0.12389442406298697 | AG301: =RC[-2]+RC[-1] -> 6.9862211332928918 | AH301: =IF(RC[-5]>0,MOD(DEGREES(ACOS(((SIN(RADIANS(R2C2))*COS(RADIANS(RC[-4])))-SIN(RADIANS(RC[-14])))/(COS(RADIANS(R2C2))*SIN(RADIANS(RC[-4])))))+180,360),MOD(540-DEGREES(ACOS(((SIN(RADIANS(R2C2))*COS(RADIANS(RC[-4])))-SIN(RADIANS(RC[-14])))/(COS(RADIANS(R2C2))*SIN(RADIANS(RC[-4]))))),360)) -> 184.95869921695214
D302: =R[-1]C+1 -> 2017-10-28T00:00:00.000 | E302: =R5C2 -> 1899-12-31T14:00:00.000 | F302: =RC[-2]+2415018.5+RC[-1]-R4C2/24 -> 2458055.375 | G302: =(RC[-1]-2451545)/36525 -> 0.17824435318275153 | I302: =MOD(280.46646+RC[-2]*(36000.76983 + RC[-2]*0.0003032),360) -> 217.40040206244703 | J302: =357.52911+RC[-3]*(35999.05029 - 0.0001537*RC[-3]) -> 6774.1565392511839 | K302: =0.016708634-RC[-4]*(0.000042037+0.0000001267*RC[-4]) -> 1.6701137116733291E-2 | L302: =SIN(RADIANS(RC[-2]))*(1.914602-RC[-5]*(0.004817+0.000014*RC[-5]))+SIN(RADIANS(2*RC[-2]))*(0.019993-0.000101*RC[-5])+SIN(RADIANS(3*RC[-2]))*0.000289 -> -1.7609880795926478 | M302: =RC[-4]+RC[-1] -> 215.63941398285439 | N302: =RC[-4]+RC[-2] -> 6772.3955511715913 | O302: =(1.000001018*(1-RC[-4]*RC[-4]))/(1+RC[-4]*COS(RADIANS(RC[-1]))) -> 0.99340097043679332 | P302: =RC[-3]-0.00569-0.00478*SIN(RADIANS(125.04-1934.136*RC[-9])) -> 215.63067010656189 | Q302: =23+(26+((21.448-RC[-10]*(46.815+RC[-10]*(0.00059-RC[-10]*0.001813))))/60)/60 -> 23.436973189479964 | R302: =RC[-1]+0.00256*COS(RADIANS(125.04-1934.136*RC[-11])) -> 23.435003778377091 | S302: =DEGREES(ATAN2(COS(RADIANS(RC[-3])),COS(RADIANS(RC[-1]))*SIN(RADIANS(RC[-3])))) -> -146.67039583166584 | T302: =DEGREES(ASIN(SIN(RADIANS(RC[-2]))*SIN(RADIANS(RC[-4])))) -> -13.396490769187833 | U302: =TAN(RADIANS(RC[-3]/2))*TAN(RADIANS(RC[-3]/2)) -> 4.3018339992521852E-2 | V302: =4*DEGREES(RC[-1]*SIN(2*RADIANS(RC[-13]))-2*RC[-11]*SIN(RADIANS(RC[-12]))+4*RC[-11]*RC[-1]*SIN(RADIANS(RC[-12]))*COS(2*RADIANS(RC[-13]))-0.5*RC[-1]*RC[-1]*SIN(4*RADIANS(RC[-13]))-1.25*RC[-11]*RC[-11]*SIN(2*RADIANS(RC[-12]))) -> 16.293895985335762 | W302: =DEGREES(ACOS(COS(RADIANS(90.833))/(COS(RADIANS(R2C2))*COS(RADIANS(RC[-3])))-TAN(RADIANS(R2C2))*TAN(RADIANS(RC[-3])))) -> 52.362168333851834 | X302: =(720-4*R3C2-RC[-2]+R4C2*60)/1440 -> 1899-12-31T13:39:42.366 | Y302: =(RC[-1]*1440-RC[-2]*4)/1440 -> 1899-12-31T10:10:15.446 | Z302: =(RC[-2]*1440+RC[-3]*4)/1440 -> 1899-12-31T17:09:09.287 | AA302: =8*RC[-4] -> 418.89734667081467 | AB302: =MOD(RC[-23]*1440+RC[-6]+4*R3C2-60*R4C2,1440) -> 740.29389598533578 | AC302: =IF(RC[-1]/4<0,RC[-1]/4+180,RC[-1]/4-180) -> 5.073473996333945 | AD302: =DEGREES(ACOS(SIN(RADIANS(R2C2))*SIN(RADIANS(RC[-10]))+COS(RADIANS(R2C2))*COS(RADIANS(RC[-10]))*COS(RADIANS(RC[-1])))) -> 83.471670928786764 | AE302: =90-RC[-1] -> 6.5283290712132356 | AF302: =IF(RC[-1]>85,0,IF(RC[-1]>5,58.1/TAN(RADIANS(RC[-1]))-0.07/POWER(TAN(RADIANS(RC[-1])),3)+0.000086/POWER(TAN(RADIANS(RC[-1])),5),IF(RC[-1]>-0.575,1735+RC[-1]*(-518.2+RC[-1]*(103.4+RC[-1]*(-12.79+RC[-1]*0.711))),-20.772/TAN(RADIANS(RC[-1])))))/3600 -> 0.12927161274099222 | AG302: =RC[-2]+RC[-1] -> 6.6576006839542279 | AH302: =IF(RC[-5]>0,MOD(DEGREES(ACOS(((SIN(RADIANS(R2C2))*COS(RADIANS(RC[-4])))-SIN(RADIANS(RC[-14])))/(COS(RADIANS(R2C2))*SIN(RADIANS(RC[-4])))))+180,360),MOD(540-DEGREES(ACOS(((SIN(RADIANS(R2C2))*COS(RADIANS(RC[-4])))-SIN(RADIANS(RC[-14])))/(COS(RADIANS(R2C2))*SIN(RADIANS(RC[-4]))))),360)) -> 184.96736763185663
D303: =R[-1]C+1 -> 2017-10-29T00:00:00.000 | E303: =R5C2 -> 1899-12-31T14:00:00.000 | F303: =RC[-2]+2415018.5+RC[-1]-R4C2/24 -> 2458056.375 | G303: =(RC[-1]-2451545)/36525 -> 0.17827173169062285 | I303: =MOD(280.46646+RC[-2]*(36000.76983 + RC[-2]*0.0003032),360) -> 218.3860494255714 | J303: =357.52911+RC[-3]*(35999.05029 - 0.0001537*RC[-3]) -> 6775.1421395314082 | K303: =0.016708634-RC[-4]*(0.000042037+0.0000001267*RC[-4]) -> 1.6701135964586254E-2 | L303: =SIN(RADIANS(RC[-2]))*(1.914602-RC[-5]*(0.004817+0.000014*RC[-5]))+SIN(RADIANS(2*RC[-2]))*(0.019993-0.000101*RC[-5])+SIN(RADIANS(3*RC[-2]))*0.000289 -> -1.7477207861320281 | M303: =RC[-4]+RC[-1] -> 216.63832863943938 | N303: =RC[-4]+RC[-2] -> 6773.3944187452762 | O303: =(1.000001018*(1-RC[-4]*RC[-4]))/(1+RC[-4]*COS(RADIANS(RC[-1]))) -> 0.9931362775546434 | P303: =RC[-3]-0.00569-0.00478*SIN(RADIANS(125.04-1934.136*RC[-9])) -> 216.62958136586406 | Q303: =23+(26+((21.448-RC[-10]*(46.815+RC[-10]*(0.00059-RC[-10]*0.001813))))/60)/60 -> 23.436972833444997 | R303: =RC[-1]+0.00256*COS(RADIANS(125.04-1934.136*RC[-11])) -> 23.435004934785731 | S303: =DEGREES(ATAN2(COS(RADIANS(RC[-3])),COS(RADIANS(RC[-1]))*SIN(RADIANS(RC[-3])))) -> -145.70055056795127 | T303: =DEGREES(ASIN(SIN(RADIANS(RC[-2]))*SIN(RADIANS(RC[-4])))) -> -13.726562073348001 | U303: =TAN(RADIANS(RC[-3]/2))*TAN(RADIANS(RC[-3]/2)) -> 4.301834435876057E-2 | V303: =4*DEGREES(RC[-1]*SIN(2*RADIANS(RC[-13]))-2*RC[-11]*SIN(RADIANS(RC[-12]))+4*RC[-11]*RC[-1]*SIN(RADIANS(RC[-12]))*COS(2*RADIANS(RC[-13]))-0.5*RC[-1]*RC[-1]*SIN(4*RADIANS(RC[-13]))-1.25*RC[-11]*RC[-11]*SIN(2*RADIANS(RC[-12]))) -> 16.358006047486676 | W303: =DEGREES(ACOS(COS(RADIANS(90.833))/(COS(RADIANS(R2C2))*COS(RADIANS(RC[-3])))-TAN(RADIANS(R2C2))*TAN(RADIANS(RC[-3])))) -> 51.144667927872824 | X303: =(720-4*R3C2-RC[-2]+R4C2*60)/1440 -> 1899-12-31T13:39:38.520 | Y303: =(RC[-1]*1440-RC[-2]*4)/1440 -> 1899-12-31T10:15:03.799 | Z303: =(RC[-2]*1440+RC[-3]*4)/1440 -> 1899-12-31T17:04:13.240 | AA303: =8*RC[-4] -> 409.15734342298259 | AB303: =MOD(RC[-23]*1440+RC[-6]+4*R3C2-60*R4C2,1440) -> 740.3580060474867 | AC303: =IF(RC[-1]/4<0,RC[-1]/4+180,RC[-1]/4-180) -> 5.0895015118716742 | AD303: =DEGREES(ACOS(SIN(RADIANS(R2C2))*SIN(RADIANS(RC[-10]))+COS(RADIANS(R2C2))*COS(RADIANS(RC[-10]))*COS(RADIANS(RC[-1])))) -> 83.802063779098958 | AE303: =90-RC[-1] -> 6.1979362209010418 | AF303: =IF(RC[-1]>85,0,IF(RC[-1]>5,58.1/TAN(RADIANS(RC[-1]))-0.07/POWER(TAN(RADIANS(RC[-1])),3)+0.000086/POWER(TAN(RADIANS(RC[-1])),5),IF(RC[-1]>-0.575,1735+RC[-1]*(-518.2+RC[-1]*(103.4+RC[-1]*(-12.79+RC[-1]*0.711))),-20.772/TAN(RADIANS(RC[-1])))))/3600 -> 0.13501049022657272 | AG303: =RC[-2]+RC[-1] -> 6.3329467111276143 | AH303: =IF(RC[-5]>0,MOD(DEGREES(ACOS(((SIN(RADIANS(R2C2))*COS(RADIANS(RC[-4])))-SIN(RADIANS(RC[-14])))/(COS(RADIANS(R2C2))*SIN(RADIANS(RC[-4])))))+180,360),MOD(540-DEGREES(ACOS(((SIN(RADIANS(R2C2))*COS(RADIANS(RC[-4])))-SIN(RADIANS(RC[-14])))/(COS(RADIANS(R2C2))*SIN(RADIANS(RC[-4]))))),360)) -> 184.97291416576891
D304: =R[-1]C+1 -> 2017-10-30T00:00:00.000 | E304: =R5C2 -> 1899-12-31T14:00:00.000 | F304: =RC[-2]+2415018.5+RC[-1]-R4C2/24 -> 2458057.375 | G304: =(RC[-1]-2451545)/36525 -> 0.17829911019849418 | I304: =MOD(280.46646+RC[-2]*(36000.76983 + RC[-2]*0.0003032),360) -> 219.37169678869577 | J304: =357.52911+RC[-3]*(35999.05029 - 0.0001537*RC[-3]) -> 6776.1277398116326 | K304: =0.016708634-RC[-4]*(0.000042037+0.0000001267*RC[-4]) -> 1.6701134812439025E-2 | L304: =SIN(RADIANS(RC[-2]))*(1.914602-RC[-5]*(0.004817+0.000014*RC[-5]))+SIN(RADIANS(2*RC[-2]))*(0.019993-0.000101*RC[-5])+SIN(RADIANS(3*RC[-2]))*0.000289 -> -1.733922876761828 | M304: =RC[-4]+RC[-1] -> 217.63777391193395 | N304: =RC[-4]+RC[-2] -> 6774.3938169348712 | O304: =(1.000001018*(1-RC[-4]*RC[-4]))/(1+RC[-4]*COS(RADIANS(RC[-1]))) -> 0.99287357414742405 | P304: =RC[-3]-0.00569-0.00478*SIN(RADIANS(125.04-1934.136*RC[-9])) -> 217.62902324368727 | Q304: =23+(26+((21.448-RC[-10]*(46.815+RC[-10]*(0.00059-RC[-10]*0.001813))))/60)/60 -> 23.436972477410034 | R304: =RC[-1]+0.00256*COS(RADIANS(125.04-1934.136*RC[-11])) -> 23.435006092875305 | S304: =DEGREES(ATAN2(COS(RADIANS(RC[-3])),COS(RADIANS(RC[-1]))*SIN(RADIANS(RC[-3])))) -> -144.72747047944335 | T304: =DEGREES(ASIN(SIN(RADIANS(RC[-2]))*SIN(RADIANS(RC[-4])))) -> -14.053010950894841 | U304: =TAN(RADIANS(RC[-3]/2))*TAN(RADIANS(RC[-3]/2)) -> 4.3018348731346204E-2 | V304: =4*DEGREES(RC[-1]*SIN(2*RADIANS(RC[-13]))-2*RC[-11]*SIN(RADIANS(RC[-12]))+4*RC[-11]*RC[-1]*SIN(RADIANS(RC[-12]))*COS(2*RADIANS(RC[-13]))-0.5*RC[-1]*RC[-1]*SIN(4*RADIANS(RC[-13]))-1.25*RC[-11]*RC[-11]*SIN(2*RADIANS(RC[-12]))) -> 16.408959588835739 | W304: =DEGREES(ACOS(COS(RADIANS(90.833))/(COS(RADIANS(R2C2))*COS(RADIANS(RC[-3])))-TAN(RADIANS(R2C2))*TAN(RADIANS(RC[-3])))) -> 49.916314064399877 | X304: =(720-4*R3C2-RC[-2]+R4C2*60)/1440 -> 1899-12-31T13:39:35.462 | Y304: =(RC[-1]*1440-RC[-2]*4)/1440 -> 1899-12-31T10:19:55.547 | Z304: =(RC[-2]*1440+RC[-3]*4)/1440 -> 1899-12-31T16:59:15.378 | AA304: =8*RC[-4] -> 399.33051251519902 | AB304: =MOD(RC[-23]*1440+RC[-6]+4*R3C2-60*R4C2,1440) -> 740.40895958883573 | AC304: =IF(RC[-1]/4<0,RC[-1]/4+180,RC[-1]/4-180) -> 5.102239897208932 | AD304: =DEGREES(ACOS(SIN(RADIANS(R2C2))*SIN(RADIANS(RC[-10]))+COS(RADIANS(R2C2))*COS(RADIANS(RC[-10]))*COS(RADIANS(RC[-1])))) -> 84.128738057289723 | AE304: =90-RC[-1] -> 5.8712619427102766 | AF304: =IF(RC[-1]>85,0,IF(RC[-1]>5,58.1/TAN(RADIANS(RC[-1]))-0.07/POWER(TAN(RADIANS(RC[-1])),3)+0.000086/POWER(TAN(RADIANS(RC[-1])),5),IF(RC[-1]>-0.575,1735+RC[-1]*(-518.2+RC[-1]*(103.4+RC[-1]*(-12.79+RC[-1]*0.711))),-20.772/TAN(RADIANS(RC[-1])))))/3600 -> 0.1411388615842723 | AG304: =RC[-2]+RC[-1] -> 6.0124008042945487 | AH304: =IF(RC[-5]>0,MOD(DEGREES(ACOS(((SIN(RADIANS(R2C2))*COS(RADIANS(RC[-4])))-SIN(RADIANS(RC[-14])))/(COS(RADIANS(R2C2))*SIN(RADIANS(RC[-4])))))+180,360),MOD(540-DEGREES(ACOS(((SIN(RADIANS(R2C2))*COS(RADIANS(RC[-4])))-SIN(RADIANS(RC[-14])))/(COS(RADIANS(R2C2))*SIN(RADIANS(RC[-4]))))),360)) -> 184.97531509990898
D305: =R[-1]C+1 -> 2017-10-31T00:00:00.000 | E305: =R5C2 -> 1899-12-31T14:00:00.000 | F305: =RC[-2]+2415018.5+RC[-1]-R4C2/24 -> 2458058.375 | G305: =(RC[-1]-2451545)/36525 -> 0.1783264887063655 | I305: =MOD(280.46646+RC[-2]*(36000.76983 + RC[-2]*0.0003032),360) -> 220.35734415182014 | J305: =357.52911+RC[-3]*(35999.05029 - 0.0001537*RC[-3]) -> 6777.113340091857 | K305: =0.016708634-RC[-4]*(0.000042037+0.0000001267*RC[-4]) -> 1.6701133660291606E-2 | L305: =SIN(RADIANS(RC[-2]))*(1.914602-RC[-5]*(0.004817+0.000014*RC[-5]))+SIN(RADIANS(2*RC[-2]))*(0.019993-0.000101*RC[-5])+SIN(RADIANS(3*RC[-2]))*0.000289 -> -1.7195980183724475 | M305: =RC[-4]+RC[-1] -> 218.63774613344771 | N305: =RC[-4]+RC[-2] -> 6775.3937420734846 | O305: =(1.000001018*(1-RC[-4]*RC[-4]))/(1+RC[-4]*COS(RADIANS(RC[-1]))) -> 0.99261294121454846 | P305: =RC[-3]-0.00569-0.00478*SIN(RADIANS(125.04-1934.136*RC[-9])) -> 218.62899207314402 | Q305: =23+(26+((21.448-RC[-10]*(46.815+RC[-10]*(0.00059-RC[-10]*0.001813))))/60)/60 -> 23.436972121375071 | R305: =RC[-1]+0.00256*COS(RADIANS(125.04-1934.136*RC[-11])) -> 23.435007252644525 | S305: =DEGREES(ATAN2(COS(RADIANS(RC[-3])),COS(RADIANS(RC[-1]))*SIN(RADIANS(RC[-3])))) -> -143.75111237697519 | T305: =DEGREES(ASIN(SIN(RADIANS(RC[-2]))*SIN(RADIANS(RC[-4])))) -> -14.375725082080896 | U305: =TAN(RADIANS(RC[-3]/2))*TAN(RADIANS(RC[-3]/2)) -> 4.3018353110273896E-2 | V305: =4*DEGREES(RC[-1]*SIN(2*RADIANS(RC[-13]))-2*RC[-11]*SIN(RADIANS(RC[-12]))+4*RC[-11]*RC[-1]*SIN(RADIANS(RC[-12]))*COS(2*RADIANS(RC[-13]))-0.5*RC[-1]*RC[-1]*SIN(4*RADIANS(RC[-13]))-1.25*RC[-11]*RC[-11]*SIN(2*RADIANS(RC[-12]))) -> 16.446578113111162 | W305: =DEGREES(ACOS(COS(RADIANS(90.833))/(COS(RADIANS(R2C2))*COS(RADIANS(RC[-3])))-TAN(RADIANS(R2C2))*TAN(RADIANS(RC[-3])))) -> 48.676390103667579 | X305: =(720-4*R3C2-RC[-2]+R4C2*60)/1440 -> 1899-12-31T13:39:33.205 | Y305: =(RC[-1]*1440-RC[-2]*4)/1440 -> 1899-12-31T10:24:50.872 | Z305: =(RC[-2]*1440+RC[-3]*4)/1440 -> 1899-12-31T16:54:15.539 | AA305: =8*RC[-4] -> 389.41112082934063 | AB305: =MOD(RC[-23]*1440+RC[-6]+4*R3C2-60*R4C2,1440) -> 740.44657811311117 | AC305: =IF(RC[-1]/4<0,RC[-1]/4+180,RC[-1]/4-180) -> 5.1116445282777931 | AD305: =DEGREES(ACOS(SIN(RADIANS(R2C2))*SIN(RADIANS(RC[-10]))+COS(RADIANS(R2C2))*COS(RADIANS(RC[-10]))*COS(RADIANS(RC[-1])))) -> 84.451580037756713 | AE305: =90-RC[-1] -> 5.5484199622432868 | AF305: =IF(RC[-1]>85,0,IF(RC[-1]>5,58.1/TAN(RADIANS(RC[-1]))-0.07/POWER(TAN(RADIANS(RC[-1])),3)+0.000086/POWER(TAN(RADIANS(RC[-1])),5),IF(RC[-1]>-0.575,1735+RC[-1]*(-518.2+RC[-1]*(103.4+RC[-1]*(-12.79+RC[-1]*0.711))),-20.772/TAN(RADIANS(RC[-1])))))/3600 -> 0.14768698943973674 | AG305: =RC[-2]+RC[-1] -> 5.6961069516830234 | AH305: =IF(RC[-5]>0,MOD(DEGREES(ACOS(((SIN(RADIANS(R2C2))*COS(RADIANS(RC[-4])))-SIN(RADIANS(RC[-14])))/(COS(RADIANS(R2C2))*SIN(RADIANS(RC[-4])))))+180,360),MOD(540-DEGREES(ACOS(((SIN(RADIANS(R2C2))*COS(RADIANS(RC[-4])))-SIN(RADIANS(RC[-14])))/(COS(RADIANS(R2C2))*SIN(RADIANS(RC[-4]))))),360)) -> 184.97454971213577
D306: =R[-1]C+1 -> 2017-11-01T00:00:00.000 | E306: =R5C2 -> 1899-12-31T14:00:00.000 | F306: =RC[-2]+2415018.5+RC[-1]-R4C2/24 -> 2458059.375 | G306: =(RC[-1]-2451545)/36525 -> 0.17835386721423682 | I306: =MOD(280.46646+RC[-2]*(36000.76983 + RC[-2]*0.0003032),360) -> 221.34299151494542 | J306: =357.52911+RC[-3]*(35999.05029 - 0.0001537*RC[-3]) -> 6778.0989403720805 | K306: =0.016708634-RC[-4]*(0.000042037+0.0000001267*RC[-4]) -> 1.6701132508144E-2 | L306: =SIN(RADIANS(RC[-2]))*(1.914602-RC[-5]*(0.004817+0.000014*RC[-5]))+SIN(RADIANS(2*RC[-2]))*(0.019993-0.000101*RC[-5])+SIN(RADIANS(3*RC[-2]))*0.000289 -> -1.7047500500046069 | M306: =RC[-4]+RC[-1] -> 219.63824146494082 | N306: =RC[-4]+RC[-2] -> 6776.3941903220757 | O306: =(1.000001018*(1-RC[-4]*RC[-4]))/(1+RC[-4]*COS(RADIANS(RC[-1]))) -> 0.99235445924336063 | P306: =RC[-3]-0.00569-0.00478*SIN(RADIANS(125.04-1934.136*RC[-9])) -> 219.62948401519739 | Q306: =23+(26+((21.448-RC[-10]*(46.815+RC[-10]*(0.00059-RC[-10]*0.001813))))/60)/60 -> 23.436971765340104 | R306: =RC[-1]+0.00256*COS(RADIANS(125.04-1934.136*RC[-11])) -> 23.435008414092085 | S306: =DEGREES(ATAN2(COS(RADIANS(RC[-3])),COS(RADIANS(RC[-1]))*SIN(RADIANS(RC[-3])))) -> -142.77143594967038 | T306: =DEGREES(ASIN(SIN(RADIANS(RC[-2]))*SIN(RADIANS(RC[-4])))) -> -14.69459198155378 | U306: =TAN(RADIANS(RC[-3]/2))*TAN(RADIANS(RC[-3]/2)) -> 4.3018357495538735E-2 | V306: =4*DEGREES(RC[-1]*SIN(2*RADIANS(RC[-13]))-2*RC[-11]*SIN(RADIANS(RC[-12]))+4*RC[-11]*RC[-1]*SIN(RADIANS(RC[-12]))*COS(2*RADIANS(RC[-13]))-0.5*RC[-1]*RC[-1]*SIN(4*RADIANS(RC[-13]))-1.25*RC[-11]*RC[-11]*SIN(2*RADIANS(RC[-12]))) -> 16.470696123551594 | W306: =DEGREES(ACOS(COS(RADIANS(90.833))/(COS(RADIANS(R2C2))*COS(RADIANS(RC[-3])))-TAN(RADIANS(R2C2))*TAN(RADIANS(RC[-3])))) -> 47.424106452083919 | X306: =(720-4*R3C2-RC[-2]+R4C2*60)/1440 -> 1899-12-31T13:39:31.758 | Y306: =(RC[-1]*1440-RC[-2]*4)/1440 -> 1899-12-31T10:29:49.973 | Z306: =(RC[-2]*1440+RC[-3]*4)/1440 -> 1899-12-31T16:49:13.544 | AA306: =8*RC[-4] -> 379.39285161667135 | AB306: =MOD(RC[-23]*1440+RC[-6]+4*R3C2-60*R4C2,1440) -> 740.47069612355165 | AC306: =IF(RC[-1]/4<0,RC[-1]/4+180,RC[-1]/4-180) -> 5.1176740308879118 | AD306: =DEGREES(ACOS(SIN(RADIANS(R2C2))*SIN(RADIANS(RC[-10]))+COS(RADIANS(R2C2))*COS(RADIANS(RC[-10]))*COS(RADIANS(RC[-1])))) -> 84.770476109491696 | AE306: =90-RC[-1] -> 5.2295238905083039 | AF306: =IF(RC[-1]>85,0,IF(RC[-1]>5,58.1/TAN(RADIANS(RC[-1]))-0.07/POWER(TAN(RADIANS(RC[-1])),3)+0.000086/POWER(TAN(RADIANS(RC[-1])),5),IF(RC[-1]>-0.575,1735+RC[-1]*(-518.2+RC[-1]*(103.4+RC[-1]*(-12.79+RC[-1]*0.711))),-20.772/TAN(RADIANS(RC[-1])))))/3600 -> 0.15468892731152978 | AG306: =RC[-2]+RC[-1] -> 5.3842128178198339 | AH306: =IF(RC[-5]>0,MOD(DEGREES(ACOS(((SIN(RADIANS(R2C2))*COS(RADIANS(RC[-4])))-SIN(RADIANS(RC[-14])))/(COS(RADIANS(R2C2))*SIN(RADIANS(RC[-4])))))+180,360),MOD(540-DEGREES(ACOS(((SIN(RADIANS(R2C2))*COS(RADIANS(RC[-4])))-SIN(RADIANS(RC[-14])))/(COS(RADIANS(R2C2))*SIN(RADIANS(RC[-4]))))),360)) -> 184.97060034479929
D307: =R[-1]C+1 -> 2017-11-02T00:00:00.000 | E307: =R5C2 -> 1899-12-31T14:00:00.000 | F307: =RC[-2]+2415018.5+RC[-1]-R4C2/24 -> 2458060.375 | G307: =(RC[-1]-2451545)/36525 -> 0.17838124572210814 | I307: =MOD(280.46646+RC[-2]*(36000.76983 + RC[-2]*0.0003032),360) -> 222.32863887807071 | J307: =357.52911+RC[-3]*(35999.05029 - 0.0001537*RC[-3]) -> 6779.0845406523049 | K307: =0.016708634-RC[-4]*(0.000042037+0.0000001267*RC[-4]) -> 1.6701131355996199E-2 | L307: =SIN(RADIANS(RC[-2]))*(1.914602-RC[-5]*(0.004817+0.000014*RC[-5]))+SIN(RADIANS(2*RC[-2]))*(0.019993-0.000101*RC[-5])+SIN(RADIANS(3*RC[-2]))*0.000289 -> -1.6893829822378199 | M307: =RC[-4]+RC[-1] -> 220.63925589583289 | N307: =RC[-4]+RC[-2] -> 6777.3951576700674 | O307: =(1.000001018*(1-RC[-4]*RC[-4]))/(1+RC[-4]*COS(RADIANS(RC[-1]))) -> 0.99209820818141847 | P307: =RC[-3]-0.00569-0.00478*SIN(RADIANS(125.04-1934.136*RC[-9])) -> 220.63049505926986 | Q307: =23+(26+((21.448-RC[-10]*(46.815+RC[-10]*(0.00059-RC[-10]*0.001813))))/60)/60 -> 23.436971409305141 | R307: =RC[-1]+0.00256*COS(RADIANS(125.04-1934.136*RC[-11])) -> 23.435009577216704 | S307: =DEGREES(ATAN2(COS(RADIANS(RC[-3])),COS(RADIANS(RC[-1]))*SIN(RADIANS(RC[-3])))) -> -141.78840387753991 | T307: =DEGREES(ASIN(SIN(RADIANS(RC[-2]))*SIN(RADIANS(RC[-4])))) -> -15.009499047568406 | U307: =TAN(RADIANS(RC[-3]/2))*TAN(RADIANS(RC[-3]/2)) -> 4.3018361887135856E-2 | V307: =4*DEGREES(RC[-1]*SIN(2*RADIANS(RC[-13]))-2*RC[-11]*SIN(RADIANS(RC[-12]))+4*RC[-11]*RC[-1]*SIN(RADIANS(RC[-12]))*COS(2*RADIANS(RC[-13]))-0.5*RC[-1]*RC[-1]*SIN(4*RADIANS(RC[-13]))-1.25*RC[-11]*RC[-11]*SIN(2*RADIANS(RC[-12]))) -> 16.481161626840716 | W307: =DEGREES(ACOS(COS(RADIANS(90.833))/(COS(RADIANS(R2C2))*COS(RADIANS(RC[-3])))-TAN(RADIANS(R2C2))*TAN(RADIANS(RC[-3])))) -> 46.158588459036302 | X307: =(720-4*R3C2-RC[-2]+R4C2*60)/1440 -> 1899-12-31T13:39:31.130 | Y307: =(RC[-1]*1440-RC[-2]*4)/1440 -> 1899-12-31T10:34:53.069 | Z307: =(RC[-2]*1440+RC[-3]*4)/1440 -> 1899-12-31T16:44:09.192 | AA307: =8*RC[-4] -> 369.26870767229042 | AB307: =MOD(RC[-23]*1440+RC[-6]+4*R3C2-60*R4C2,1440) -> 740.48116162684073 | AC307: =IF(RC[-1]/4<0,RC[-1]/4+180,RC[-1]/4-180) -> 5.1202904067101827 | AD307: =DEGREES(ACOS(SIN(RADIANS(R2C2))*SIN(RADIANS(RC[-10]))+COS(RADIANS(R2C2))*COS(RADIANS(RC[-10]))*COS(RADIANS(RC[-1])))) -> 85.085312834195051 | AE307: =90-RC[-1] -> 4.9146871658049491 | AF307: =IF(RC[-1]>85,0,IF(RC[-1]>5,58.1/TAN(RADIANS(RC[-1]))-0.07/POWER(TAN(RADIANS(RC[-1])),3)+0.000086/POWER(TAN(RADIANS(RC[-1])),5),IF(RC[-1]>-0.575,1735+RC[-1]*(-518.2+RC[-1]*(103.4+RC[-1]*(-12.79+RC[-1]*0.711))),-20.772/TAN(RADIANS(RC[-1])))))/3600 -> 0.16173885505300076 | AG307: =RC[-2]+RC[-1] -> 5.0764260208579497 | AH307: =IF(RC[-5]>0,MOD(DEGREES(ACOS(((SIN(RADIANS(R2C2))*COS(RADIANS(RC[-4])))-SIN(RADIANS(RC[-14])))/(COS(RADIANS(R2C2))*SIN(RADIANS(RC[-4])))))+180,360),MOD(540-DEGREES(ACOS(((SIN(RADIANS(R2C2))*COS(RADIANS(RC[-4])))-SIN(RADIANS(RC[-14])))/(COS(RADIANS(R2C2))*SIN(RADIANS(RC[-4]))))),360)) -> 184.96345246909303
D308: =R[-1]C+1 -> 2017-11-03T00:00:00.000 | E308: =R5C2 -> 1899-12-31T14:00:00.000 | F308: =RC[-2]+2415018.5+RC[-1]-R4C2/24 -> 2458061.375 | G308: =(RC[-1]-2451545)/36525 -> 0.17840862422997947 | I308: =MOD(280.46646+RC[-2]*(36000.76983 + RC[-2]*0.0003032),360) -> 223.3142862411969 | J308: =357.52911+RC[-3]*(35999.05029 - 0.0001537*RC[-3]) -> 6780.0701409325284 | K308: =0.016708634-RC[-4]*(0.000042037+0.0000001267*RC[-4]) -> 1.6701130203848211E-2 | L308: =SIN(RADIANS(RC[-2]))*(1.914602-RC[-5]*(0.004817+0.000014*RC[-5]))+SIN(RADIANS(2*RC[-2]))*(0.019993-0.000101*RC[-5])+SIN(RADIANS(3*RC[-2]))*0.000289 -> -1.6735009965087595 | M308: =RC[-4]+RC[-1] -> 221.64078524468815 | N308: =RC[-4]+RC[-2] -> 6778.3966399360197 | O308: =(1.000001018*(1-RC[-4]*RC[-4]))/(1+RC[-4]*COS(RADIANS(RC[-1]))) -> 0.99184426740880394 | P308: =RC[-3]-0.00569-0.00478*SIN(RADIANS(125.04-1934.136*RC[-9])) -> 221.63202102392856 | Q308: =23+(26+((21.448-RC[-10]*(46.815+RC[-10]*(0.00059-RC[-10]*0.001813))))/60)/60 -> 23.436971053270177 | R308: =RC[-1]+0.00256*COS(RADIANS(125.04-1934.136*RC[-11])) -> 23.435010742017074 | S308: =DEGREES(ATAN2(COS(RADIANS(RC[-3])),COS(RADIANS(RC[-1]))*SIN(RADIANS(RC[-3])))) -> -140.8019819442101 | T308: =DEGREES(ASIN(SIN(RADIANS(RC[-2]))*SIN(RADIANS(RC[-4])))) -> -15.320333614524809 | U308: =TAN(RADIANS(RC[-3]/2))*TAN(RADIANS(RC[-3]/2)) -> 4.3018366285060353E-2 | V308: =4*DEGREES(RC[-1]*SIN(2*RADIANS(RC[-13]))-2*RC[-11]*SIN(RADIANS(RC[-12]))+4*RC[-11]*RC[-1]*SIN(RADIANS(RC[-12]))*COS(2*RADIANS(RC[-13]))-0.5*RC[-1]*RC[-1]*SIN(4*RADIANS(RC[-13]))-1.25*RC[-11]*RC[-11]*SIN(2*RADIANS(RC[-12]))) -> 16.477836625887154 | W308: =DEGREES(ACOS(COS(RADIANS(90.833))/(COS(RADIANS(R2C2))*COS(RADIANS(RC[-3])))-TAN(RADIANS(R2C2))*TAN(RADIANS(RC[-3])))) -> 44.878861774672338 | X308: =(720-4*R3C2-RC[-2]+R4C2*60)/1440 -> 1899-12-31T13:39:31.330 | Y308: =(RC[-1]*1440-RC[-2]*4)/1440 -> 1899-12-31T10:40:00.403 | Z308: =(RC[-2]*1440+RC[-3]*4)/1440 -> 1899-12-31T16:39:02.257 | AA308: =8*RC[-4] -> 359.0308941973787 | AB308: =MOD(RC[-23]*1440+RC[-6]+4*R3C2-60*R4C2,1440) -> 740.47783662588711 | AC308: =IF(RC[-1]/4<0,RC[-1]/4+180,RC[-1]/4-180) -> 5.1194591564717769 | AD308: =DEGREES(ACOS(SIN(RADIANS(R2C2))*SIN(RADIANS(RC[-10]))+COS(RADIANS(R2C2))*COS(RADIANS(RC[-10]))*COS(RADIANS(RC[-1])))) -> 85.395977006711306 | AE308: =90-RC[-1] -> 4.6040229932886945 | AF308: =IF(RC[-1]>85,0,IF(RC[-1]>5,58.1/TAN(RADIANS(RC[-1]))-0.07/POWER(TAN(RADIANS(RC[-1])),3)+0.000086/POWER(TAN(RADIANS(RC[-1])),5),IF(RC[-1]>-0.575,1735+RC[-1]*(-518.2+RC[-1]*(103.4+RC[-1]*(-12.79+RC[-1]*0.711))),-20.772/TAN(RADIANS(RC[-1])))))/3600 -> 0.1700648865395579 | AG308: =RC[-2]+RC[-1] -> 4.7740878798282527 | AH308: =IF(RC[-5]>0,MOD(DEGREES(ACOS(((SIN(RADIANS(R2C2))*COS(RADIANS(RC[-4])))-SIN(RADIANS(RC[-14])))/(COS(RADIANS(R2C2))*SIN(RADIANS(RC[-4])))))+180,360),MOD(540-DEGREES(ACOS(((SIN(RADIANS(R2C2))*COS(RADIANS(RC[-4])))-SIN(RADIANS(RC[-14])))/(COS(RADIANS(R2C2))*SIN(RADIANS(RC[-4]))))),360)) -> 184.95309474559062
D309: =R[-1]C+1 -> 2017-11-04T00:00:00.000 | E309: =R5C2 -> 1899-12-31T14:00:00.000 | F309: =RC[-2]+2415018.5+RC[-1]-R4C2/24 -> 2458062.375 | G309: =(RC[-1]-2451545)/36525 -> 0.17843600273785079 | I309: =MOD(280.46646+RC[-2]*(36000.76983 + RC[-2]*0.0003032),360) -> 224.29993360432309 | J309: =357.52911+RC[-3]*(35999.05029 - 0.0001537*RC[-3]) -> 6781.0557412127509 | K309: =0.016708634-RC[-4]*(0.000042037+0.0000001267*RC[-4]) -> 1.6701129051700032E-2 | L309: =SIN(RADIANS(RC[-2]))*(1.914602-RC[-5]*(0.004817+0.000014*RC[-5]))+SIN(RADIANS(2*RC[-2]))*(0.019993-0.000101*RC[-5])+SIN(RADIANS(3*RC[-2]))*0.000289 -> -1.6571084443588844 | M309: =RC[-4]+RC[-1] -> 222.64282515996419 | N309: =RC[-4]+RC[-2] -> 6779.3986327683924 | O309: =(1.000001018*(1-RC[-4]*RC[-4]))/(1+RC[-4]*COS(RADIANS(RC[-1]))) -> 0.99159271571047303 | P309: =RC[-3]-0.00569-0.00478*SIN(RADIANS(125.04-1934.136*RC[-9])) -> 222.63405755763398 | Q309: =23+(26+((21.448-RC[-10]*(46.815+RC[-10]*(0.00059-RC[-10]*0.001813))))/60)/60 -> 23.436970697235214 | R309: =RC[-1]+0.00256*COS(RADIANS(125.04-1934.136*RC[-11])) -> 23.435011908491898 | S309: =DEGREES(ATAN2(COS(RADIANS(RC[-3])),COS(RADIANS(RC[-1]))*SIN(RADIANS(RC[-3])))) -> -139.81213914948052 | T309: =DEGREES(ASIN(SIN(RADIANS(RC[-2]))*SIN(RADIANS(RC[-4])))) -> -15.626983008872093 | U309: =TAN(RADIANS(RC[-3]/2))*TAN(RADIANS(RC[-3]/2)) -> 4.3018370689307292E-2 | V309: =4*DEGREES(RC[-1]*SIN(2*RADIANS(RC[-13]))-2*RC[-11]*SIN(RADIANS(RC[-12]))+4*RC[-11]*RC[-1]*SIN(RADIANS(RC[-12]))*COS(2*RADIANS(RC[-13]))-0.5*RC[-1]*RC[-1]*SIN(4*RADIANS(RC[-13]))-1.25*RC[-11]*RC[-11]*SIN(2*RADIANS(RC[-12]))) -> 16.460597599580776 | W309: =DEGREES(ACOS(COS(RADIANS(90.833))/(COS(RADIANS(R2C2))*COS(RADIANS(RC[-3])))-TAN(RADIANS(R2C2))*TAN(RADIANS(RC[-3])))) -> 43.583834500266718 | X309: =(720-4*R3C2-RC[-2]+R4C2*60)/1440 -> 1899-12-31T13:39:32.364 | Y309: =(RC[-1]*1440-RC[-2]*4)/1440 -> 1899-12-31T10:45:12.244 | Z309: =(RC[-2]*1440+RC[-3]*4)/1440 -> 1899-12-31T16:33:52.484 | AA309: =8*RC[-4] -> 348.67067600213375 | AB309: =MOD(RC[-23]*1440+RC[-6]+4*R3C2-60*R4C2,1440) -> 740.46059759958075 | AC309: =IF(RC[-1]/4<0,RC[-1]/4+180,RC[-1]/4-180) -> 5.1151493998951878 | AD309: =DEGREES(ACOS(SIN(RADIANS(R2C2))*SIN(RADIANS(RC[-10]))+COS(RADIANS(R2C2))*COS(RADIANS(RC[-10]))*COS(RADIANS(RC[-1])))) -> 85.702355717759829 | AE309: =90-RC[-1] -> 4.2976442822401708 | AF309: =IF(RC[-1]>85,0,IF(RC[-1]>5,58.1/TAN(RADIANS(RC[-1]))-0.07/POWER(TAN(RADIANS(RC[-1])),3)+0.000086/POWER(TAN(RADIANS(RC[-1])),5),IF(RC[-1]>-0.575,1735+RC[-1]*(-518.2+RC[-1]*(103.4+RC[-1]*(-12.79+RC[-1]*0.711))),-20.772/TAN(RADIANS(RC[-1])))))/3600 -> 0.17918135337134655 | AG309: =RC[-2]+RC[-1] -> 4.476825635611517 | AH309: =IF(RC[-5]>0,MOD(DEGREES(ACOS(((SIN(RADIANS(R2C2))*COS(RADIANS(RC[-4])))-SIN(RADIANS(RC[-14])))/(COS(RADIANS(R2C2))*SIN(RADIANS(RC[-4])))))+180,360),MOD(540-DEGREES(ACOS(((SIN(RADIANS(R2C2))*COS(RADIANS(RC[-4])))-SIN(RADIANS(RC[-14])))/(COS(RADIANS(R2C2))*SIN(RADIANS(RC[-4]))))),360)) -> 184.93951908067191
D310: =R[-1]C+1 -> 2017-11-05T00:00:00.000 | E310: =R5C2 -> 1899-12-31T14:00:00.000 | F310: =RC[-2]+2415018.5+RC[-1]-R4C2/24 -> 2458063.375 | G310: =(RC[-1]-2451545)/36525 -> 0.17846338124572211 | I310: =MOD(280.46646+RC[-2]*(36000.76983 + RC[-2]*0.0003032),360) -> 225.28558096745019 | J310: =357.52911+RC[-3]*(35999.05029 - 0.0001537*RC[-3]) -> 6782.0413414929744 | K310: =0.016708634-RC[-4]*(0.000042037+0.0000001267*RC[-4]) -> 1.6701127899551665E-2 | L310: =SIN(RADIANS(RC[-2]))*(1.914602-RC[-5]*(0.004817+0.000014*RC[-5]))+SIN(RADIANS(2*RC[-2]))*(0.019993-0.000101*RC[-5])+SIN(RADIANS(3*RC[-2]))*0.000289 -> -1.6402098466107982 | M310: =RC[-4]+RC[-1] -> 223.6453711208394 | N310: =RC[-4]+RC[-2] -> 6780.4011316463639 | O310: =(1.000001018*(1-RC[-4]*RC[-4]))/(1+RC[-4]*COS(RADIANS(RC[-1]))) -> 0.99134363124866265 | P310: =RC[-3]-0.00569-0.00478*SIN(RADIANS(125.04-1934.136*RC[-9])) -> 223.63660013956738 | Q310: =23+(26+((21.448-RC[-10]*(46.815+RC[-10]*(0.00059-RC[-10]*0.001813))))/60)/60 -> 23.436970341200251 | R310: =RC[-1]+0.00256*COS(RADIANS(125.04-1934.136*RC[-11])) -> 23.435013076639876 | S310: =DEGREES(ATAN2(COS(RADIANS(RC[-3])),COS(RADIANS(RC[-1]))*SIN(RADIANS(RC[-3])))) -> -138.81884782135708 | T310: =DEGREES(ASIN(SIN(RADIANS(RC[-2]))*SIN(RADIANS(RC[-4])))) -> -15.929334608419856 | U310: =TAN(RADIANS(RC[-3]/2))*TAN(RADIANS(RC[-3]/2)) -> 4.3018375099871796E-2 | V310: =4*DEGREES(RC[-1]*SIN(2*RADIANS(RC[-13]))-2*RC[-11]*SIN(RADIANS(RC[-12]))+4*RC[-11]*RC[-1]*SIN(RADIANS(RC[-12]))*COS(2*RADIANS(RC[-13]))-0.5*RC[-1]*RC[-1]*SIN(4*RADIANS(RC[-13]))-1.25*RC[-11]*RC[-11]*SIN(2*RADIANS(RC[-12]))) -> 16.42933596765706 | W310: =DEGREES(ACOS(COS(RADIANS(90.833))/(COS(RADIANS(R2C2))*COS(RADIANS(RC[-3])))-TAN(RADIANS(R2C2))*TAN(RADIANS(RC[-3])))) -> 42.272275246418111 | X310: =(720-4*R3C2-RC[-2]+R4C2*60)/1440 -> 1899-12-31T13:39:34.240 | Y310: =(RC[-1]*1440-RC[-2]*4)/1440 -> 1899-12-31T10:50:28.894 | Z310: =(RC[-2]*1440+RC[-3]*4)/1440 -> 1899-12-31T16:28:39.586 | AA310: =8*RC[-4] -> 338.17820197134489 | AB310: =MOD(RC[-23]*1440+RC[-6]+4*R3C2-60*R4C2,1440) -> 740.42933596765704 | AC310: =IF(RC[-1]/4<0,RC[-1]/4+180,RC[-1]/4-180) -> 5.1073339919142597 | AD310: =DEGREES(ACOS(SIN(RADIANS(R2C2))*SIN(RADIANS(RC[-10]))+COS(RADIANS(R2C2))*COS(RADIANS(RC[-10]))*COS(RADIANS(RC[-1])))) -> 86.00433641893963 | AE310: =90-RC[-1] -> 3.99566358106037 | AF310: =IF(RC[-1]>85,0,IF(RC[-1]>5,58.1/TAN(RADIANS(RC[-1]))-0.07/POWER(TAN(RADIANS(RC[-1])),3)+0.000086/POWER(TAN(RADIANS(RC[-1])),5),IF(RC[-1]>-0.575,1735+RC[-1]*(-518.2+RC[-1]*(103.4+RC[-1]*(-12.79+RC[-1]*0.711))),-20.772/TAN(RADIANS(RC[-1])))))/3600 -> 0.18905258476112066 | AG310: =RC[-2]+RC[-1] -> 4.1847161658214906 | AH310: =IF(RC[-5]>0,MOD(DEGREES(ACOS(((SIN(RADIANS(R2C2))*COS(RADIANS(RC[-4])))-SIN(RADIANS(RC[-14])))/(COS(RADIANS(R2C2))*SIN(RADIANS(RC[-4])))))+180,360),MOD(540-DEGREES(ACOS(((SIN(RADIANS(R2C2))*COS(RADIANS(RC[-4])))-SIN(RADIANS(RC[-14])))/(COS(RADIANS(R2C2))*SIN(RADIANS(RC[-4]))))),360)) -> 184.92272067855555
D311: =R[-1]C+1 -> 2017-11-06T00:00:00.000 | E311: =R5C2 -> 1899-12-31T14:00:00.000 | F311: =RC[-2]+2415018.5+RC[-1]-R4C2/24 -> 2458064.375 | G311: =(RC[-1]-2451545)/36525 -> 0.17849075975359344 | I311: =MOD(280.46646+RC[-2]*(36000.76983 + RC[-2]*0.0003032),360) -> 226.2712283305782 | J311: =357.52911+RC[-3]*(35999.05029 - 0.0001537*RC[-3]) -> 6783.0269417731979 | K311: =0.016708634-RC[-4]*(0.000042037+0.0000001267*RC[-4]) -> 1.6701126747403105E-2 | L311: =SIN(RADIANS(RC[-2]))*(1.914602-RC[-5]*(0.004817+0.000014*RC[-5]))+SIN(RADIANS(2*RC[-2]))*(0.019993-0.000101*RC[-5])+SIN(RADIANS(3*RC[-2]))*0.000289 -> -1.6228098924731218 | M311: =RC[-4]+RC[-1] -> 224.64841843810507 | N311: =RC[-4]+RC[-2] -> 6781.4041318807249 | O311: =(1.000001018*(1-RC[-4]*RC[-4]))/(1+RC[-4]*COS(RADIANS(RC[-1]))) -> 0.99109709153536374 | P311: =RC[-3]-0.00569-0.00478*SIN(RADIANS(125.04-1934.136*RC[-9])) -> 224.63964408052294 | Q311: =23+(26+((21.448-RC[-10]*(46.815+RC[-10]*(0.00059-RC[-10]*0.001813))))/60)/60 -> 23.436969985165288 | R311: =RC[-1]+0.00256*COS(RADIANS(125.04-1934.136*RC[-11])) -> 23.435014246459705 | S311: =DEGREES(ATAN2(COS(RADIANS(RC[-3])),COS(RADIANS(RC[-1]))*SIN(RADIANS(RC[-3])))) -> -137.8220837272122 | T311: =DEGREES(ASIN(SIN(RADIANS(RC[-2]))*SIN(RADIANS(RC[-4])))) -> -16.227275905079402 | U311: =TAN(RADIANS(RC[-3]/2))*TAN(RADIANS(RC[-3]/2)) -> 4.3018379516748938E-2 | V311: =4*DEGREES(RC[-1]*SIN(2*RADIANS(RC[-13]))-2*RC[-11]*SIN(RADIANS(RC[-12]))+4*RC[-11]*RC[-1]*SIN(RADIANS(RC[-12]))*COS(2*RADIANS(RC[-13]))-0.5*RC[-1]*RC[-1]*SIN(4*RADIANS(RC[-13]))-1.25*RC[-11]*RC[-11]*SIN(2*RADIANS(RC[-12]))) -> 16.38395853880656 | W311: =DEGREES(ACOS(COS(RADIANS(90.833))/(COS(RADIANS(R2C2))*COS(RADIANS(RC[-3])))-TAN(RADIANS(R2C2))*TAN(RADIANS(RC[-3])))) -> 40.94278591334659 | X311: =(720-4*R3C2-RC[-2]+R4C2*60)/1440 -> 1899-12-31T13:39:36.962 | Y311: =(RC[-1]*1440-RC[-2]*4)/1440 -> 1899-12-31T10:55:50.694 | Z311: =(RC[-2]*1440+RC[-3]*4)/1440 -> 1899-12-31T16:23:23.231 | AA311: =8*RC[-4] -> 327.54228730677272 | AB311: =MOD(RC[-23]*1440+RC[-6]+4*R3C2-60*R4C2,1440) -> 740.38395853880661 | AC311: =IF(RC[-1]/4<0,RC[-1]/4+180,RC[-1]/4-180) -> 5.0959896347016524 | AD311: =DEGREES(ACOS(SIN(RADIANS(R2C2))*SIN(RADIANS(RC[-10]))+COS(RADIANS(R2C2))*COS(RADIANS(RC[-10]))*COS(RADIANS(RC[-1])))) -> 86.30180698997205 | AE311: =90-RC[-1] -> 3.6981930100279499 | AF311: =IF(RC[-1]>85,0,IF(RC[-1]>5,58.1/TAN(RADIANS(RC[-1]))-0.07/POWER(TAN(RADIANS(RC[-1])),3)+0.000086/POWER(TAN(RADIANS(RC[-1])),5),IF(RC[-1]>-0.575,1735+RC[-1]*(-518.2+RC[-1]*(103.4+RC[-1]*(-12.79+RC[-1]*0.711))),-20.772/TAN(RADIANS(RC[-1])))))/3600 -> 0.19968046197333011 | AG311: =RC[-2]+RC[-1] -> 3.89787347200128 | AH311: =IF(RC[-5]>0,MOD(DEGREES(ACOS(((SIN(RADIANS(R2C2))*COS(RADIANS(RC[-4])))-SIN(RADIANS(RC[-14])))/(COS(RADIANS(R2C2))*SIN(RADIANS(RC[-4])))))+180,360),MOD(540-DEGREES(ACOS(((SIN(RADIANS(R2C2))*COS(RADIANS(RC[-4])))-SIN(RADIANS(RC[-14])))/(COS(RADIANS(R2C2))*SIN(RADIANS(RC[-4]))))),360)) -> 184.90269808866344
D312: =R[-1]C+1 -> 2017-11-07T00:00:00.000 | E312: =R5C2 -> 1899-12-31T14:00:00.000 | F312: =RC[-2]+2415018.5+RC[-1]-R4C2/24 -> 2458065.375 | G312: =(RC[-1]-2451545)/36525 -> 0.17851813826146476 | I312: =MOD(280.46646+RC[-2]*(36000.76983 + RC[-2]*0.0003032),360) -> 227.25687569370621 | J312: =357.52911+RC[-3]*(35999.05029 - 0.0001537*RC[-3]) -> 6784.0125420534196 | K312: =0.016708634-RC[-4]*(0.000042037+0.0000001267*RC[-4]) -> 1.6701125595254357E-2 | L312: =SIN(RADIANS(RC[-2]))*(1.914602-RC[-5]*(0.004817+0.000014*RC[-5]))+SIN(RADIANS(2*RC[-2]))*(0.019993-0.000101*RC[-5])+SIN(RADIANS(3*RC[-2]))*0.000289 -> -1.6049134385731392 | M312: =RC[-4]+RC[-1] -> 225.65196225513307 | N312: =RC[-4]+RC[-2] -> 6782.4076286148465 | O312: =(1.000001018*(1-RC[-4]*RC[-4]))/(1+RC[-4]*COS(RADIANS(RC[-1]))) -> 0.99085317340487344 | P312: =RC[-3]-0.00569-0.00478*SIN(RADIANS(125.04-1934.136*RC[-9])) -> 225.64318452387542 | Q312: =23+(26+((21.448-RC[-10]*(46.815+RC[-10]*(0.00059-RC[-10]*0.001813))))/60)/60 -> 23.436969629130324 | R312: =RC[-1]+0.00256*COS(RADIANS(125.04-1934.136*RC[-11])) -> 23.435015417950083 | S312: =DEGREES(ATAN2(COS(RADIANS(RC[-3])),COS(RADIANS(RC[-1]))*SIN(RADIANS(RC[-3])))) -> -136.82182618367364 | T312: =DEGREES(ASIN(SIN(RADIANS(RC[-2]))*SIN(RADIANS(RC[-4])))) -> -16.520694571054811 | U312: =TAN(RADIANS(RC[-3]/2))*TAN(RADIANS(RC[-3]/2)) -> 4.3018383939933784E-2 | V312: =4*DEGREES(RC[-1]*SIN(2*RADIANS(RC[-13]))-2*RC[-11]*SIN(RADIANS(RC[-12]))+4*RC[-11]*RC[-1]*SIN(RADIANS(RC[-12]))*COS(2*RADIANS(RC[-13]))-0.5*RC[-1]*RC[-1]*SIN(4*RADIANS(RC[-13]))-1.25*RC[-11]*RC[-11]*SIN(2*RADIANS(RC[-12]))) -> 16.324387940180525 | W312: =DEGREES(ACOS(COS(RADIANS(90.833))/(COS(RADIANS(R2C2))*COS(RADIANS(RC[-3])))-TAN(RADIANS(R2C2))*TAN(RADIANS(RC[-3])))) -> 39.593767582291086 | X312: =(720-4*R3C2-RC[-2]+R4C2*60)/1440 -> 1899-12-31T13:39:40.537 | Y312: =(RC[-1]*1440-RC[-2]*4)/1440 -> 1899-12-31T11:01:18.033 | Z312: =(RC[-2]*1440+RC[-3]*4)/1440 -> 1899-12-31T16:18:03.041 | AA312: =8*RC[-4] -> 316.75014065832869 | AB312: =MOD(RC[-23]*1440+RC[-6]+4*R3C2-60*R4C2,1440) -> 740.32438794018049 | AC312: =IF(RC[-1]/4<0,RC[-1]/4+180,RC[-1]/4-180) -> 5.0810969850451215 | AD312: =DEGREES(ACOS(SIN(RADIANS(R2C2))*SIN(RADIANS(RC[-10]))+COS(RADIANS(R2C2))*COS(RADIANS(RC[-10]))*COS(RADIANS(RC[-1])))) -> 86.594655808148786 | AE312: =90-RC[-1] -> 3.4053441918512135 | AF312: =IF(RC[-1]>85,0,IF(RC[-1]>5,58.1/TAN(RADIANS(RC[-1]))-0.07/POWER(TAN(RADIANS(RC[-1])),3)+0.000086/POWER(TAN(RADIANS(RC[-1])),5),IF(RC[-1]>-0.575,1735+RC[-1]*(-518.2+RC[-1]*(103.4+RC[-1]*(-12.79+RC[-1]*0.711))),-20.772/TAN(RADIANS(RC[-1])))))/3600 -> 0.21109864856066937 | AG312: =RC[-2]+RC[-1] -> 3.6164428404118829 | AH312: =IF(RC[-5]>0,MOD(DEGREES(ACOS(((SIN(RADIANS(R2C2))*COS(RADIANS(RC[-4])))-SIN(RADIANS(RC[-14])))/(COS(RADIANS(R2C2))*SIN(RADIANS(RC[-4])))))+180,360),MOD(540-DEGREES(ACOS(((SIN(RADIANS(R2C2))*COS(RADIANS(RC[-4])))-SIN(RADIANS(RC[-14])))/(COS(RADIANS(R2C2))*SIN(RADIANS(RC[-4]))))),360)) -> 184.87945324807478
D313: =R[-1]C+1 -> 2017-11-08T00:00:00.000 | E313: =R5C2 -> 1899-12-31T14:00:00.000 | F313: =RC[-2]+2415018.5+RC[-1]-R4C2/24 -> 2458066.375 | G313: =(RC[-1]-2451545)/36525 -> 0.17854551676933608 | I313: =MOD(280.46646+RC[-2]*(36000.76983 + RC[-2]*0.0003032),360) -> 228.24252305683422 | J313: =357.52911+RC[-3]*(35999.05029 - 0.0001537*RC[-3]) -> 6784.998142333643 | K313: =0.016708634-RC[-4]*(0.000042037+0.0000001267*RC[-4]) -> 1.6701124443105422E-2 | L313: =SIN(RADIANS(RC[-2]))*(1.914602-RC[-5]*(0.004817+0.000014*RC[-5]))+SIN(RADIANS(2*RC[-2]))*(0.019993-0.000101*RC[-5])+SIN(RADIANS(3*RC[-2]))*0.000289 -> -1.586525507917111 | M313: =RC[-4]+RC[-1] -> 226.6559975489171 | N313: =RC[-4]+RC[-2] -> 6783.411616825726 | O313: =(1.000001018*(1-RC[-4]*RC[-4]))/(1+RC[-4]*COS(RADIANS(RC[-1]))) -> 0.99061195298644189 | P313: =RC[-3]-0.00569-0.00478*SIN(RADIANS(125.04-1934.136*RC[-9])) -> 226.6472164466214 | Q313: =23+(26+((21.448-RC[-10]*(46.815+RC[-10]*(0.00059-RC[-10]*0.001813))))/60)/60 -> 23.436969273095361 | R313: =RC[-1]+0.00256*COS(RADIANS(125.04-1934.136*RC[-11])) -> 23.435016591109708 | S313: =DEGREES(ATAN2(COS(RADIANS(RC[-3])),COS(RADIANS(RC[-1]))*SIN(RADIANS(RC[-3])))) -> -135.81805816483515 | T313: =DEGREES(ASIN(SIN(RADIANS(RC[-2]))*SIN(RADIANS(RC[-4])))) -> -16.809478528488864 | U313: =TAN(RADIANS(RC[-3]/2))*TAN(RADIANS(RC[-3]/2)) -> 4.3018388369421456E-2 | V313: =4*DEGREES(RC[-1]*SIN(2*RADIANS(RC[-13]))-2*RC[-11]*SIN(RADIANS(RC[-12]))+4*RC[-11]*RC[-1]*SIN(RADIANS(RC[-12]))*COS(2*RADIANS(RC[-13]))-0.5*RC[-1]*RC[-1]*SIN(4*RADIANS(RC[-13]))-1.25*RC[-11]*RC[-11]*SIN(2*RADIANS(RC[-12]))) -> 16.250563026467425 | W313: =DEGREES(ACOS(COS(RADIANS(90.833))/(COS(RADIANS(R2C2))*COS(RADIANS(RC[-3])))-TAN(RADIANS(R2C2))*TAN(RADIANS(RC[-3])))) -> 38.22337729621978 | X313: =(720-4*R3C2-RC[-2]+R4C2*60)/1440 -> 1899-12-31T13:39:44.966 | Y313: =(RC[-1]*1440-RC[-2]*4)/1440 -> 1899-12-31T11:06:51.356 | Z313: =(RC[-2]*1440+RC[-3]*4)/1440 -> 1899-12-31T16:12:38.577 | AA313: =8*RC[-4] -> 305.78701836975824 | AB313: =MOD(RC[-23]*1440+RC[-6]+4*R3C2-60*R4C2,1440) -> 740.25056302646738 | AC313: =IF(RC[-1]/4<0,RC[-1]/4+180,RC[-1]/4-180) -> 5.0626407566168439 | AD313: =DEGREES(ACOS(SIN(RADIANS(R2C2))*SIN(RADIANS(RC[-10]))+COS(RADIANS(R2C2))*COS(RADIANS(RC[-10]))*COS(RADIANS(RC[-1])))) -> 86.882771819942505 | AE313: =90-RC[-1] -> 3.117228180057495 | AF313: =IF(RC[-1]>85,0,IF(RC[-1]>5,58.1/TAN(RADIANS(RC[-1]))-0.07/POWER(TAN(RADIANS(RC[-1])),3)+0.000086/POWER(TAN(RADIANS(RC[-1])),5),IF(RC[-1]>-0.575,1735+RC[-1]*(-518.2+RC[-1]*(103.4+RC[-1]*(-12.79+RC[-1]*0.711))),-20.772/TAN(RADIANS(RC[-1])))))/3600 -> 0.22336694670464258 | AG313: =RC[-2]+RC[-1] -> 3.3405951267621377 | AH313: =IF(RC[-5]>0,MOD(DEGREES(ACOS(((SIN(RADIANS(R2C2))*COS(RADIANS(RC[-4])))-SIN(RADIANS(RC[-14])))/(COS(RADIANS(R2C2))*SIN(RADIANS(RC[-4])))))+180,360),MOD(540-DEGREES(ACOS(((SIN(RADIANS(R2C2))*COS(RADIANS(RC[-4])))-SIN(RADIANS(RC[-14])))/(COS(RADIANS(R2C2))*SIN(RADIANS(RC[-4]))))),360)) -> 184.85299151882626
D314: =R[-1]C+1 -> 2017-11-09T00:00:00.000 | E314: =R5C2 -> 1899-12-31T14:00:00.000 | F314: =RC[-2]+2415018.5+RC[-1]-R4C2/24 -> 2458067.375 | G314: =(RC[-1]-2451545)/36525 -> 0.17857289527720741 | I314: =MOD(280.46646+RC[-2]*(36000.76983 + RC[-2]*0.0003032),360) -> 229.22817041996313 | J314: =357.52911+RC[-3]*(35999.05029 - 0.0001537*RC[-3]) -> 6785.9837426138656 | K314: =0.016708634-RC[-4]*(0.000042037+0.0000001267*RC[-4]) -> 1.6701123290956292E-2 | L314: =SIN(RADIANS(RC[-2]))*(1.914602-RC[-5]*(0.004817+0.000014*RC[-5]))+SIN(RADIANS(2*RC[-2]))*(0.019993-0.000101*RC[-5])+SIN(RADIANS(3*RC[-2]))*0.000289 -> -1.5676512887780711 | M314: =RC[-4]+RC[-1] -> 227.66051913118505 | N314: =RC[-4]+RC[-2] -> 6784.4160913250871 | O314: =(1.000001018*(1-RC[-4]*RC[-4]))/(1+RC[-4]*COS(RADIANS(RC[-1]))) -> 0.99037350567703031 | P314: =RC[-3]-0.00569-0.00478*SIN(RADIANS(125.04-1934.136*RC[-9])) -> 227.65173466049168 | Q314: =23+(26+((21.448-RC[-10]*(46.815+RC[-10]*(0.00059-RC[-10]*0.001813))))/60)/60 -> 23.436968917060398 | R314: =RC[-1]+0.00256*COS(RADIANS(125.04-1934.136*RC[-11])) -> 23.435017765937268 | S314: =DEGREES(ATAN2(COS(RADIANS(RC[-3])),COS(RADIANS(RC[-1]))*SIN(RADIANS(RC[-3])))) -> -134.81076640835775 | T314: =DEGREES(ASIN(SIN(RADIANS(RC[-2]))*SIN(RADIANS(RC[-4])))) -> -17.09351602255656 | U314: =TAN(RADIANS(RC[-3]/2))*TAN(RADIANS(RC[-3]/2)) -> 4.3018392805206973E-2 | V314: =4*DEGREES(RC[-1]*SIN(2*RADIANS(RC[-13]))-2*RC[-11]*SIN(RADIANS(RC[-12]))+4*RC[-11]*RC[-1]*SIN(RADIANS(RC[-12]))*COS(2*RADIANS(RC[-13]))-0.5*RC[-1]*RC[-1]*SIN(4*RADIANS(RC[-13]))-1.25*RC[-11]*RC[-11]*SIN(2*RADIANS(RC[-12]))) -> 16.162439266745452 | W314: =DEGREES(ACOS(COS(RADIANS(90.833))/(COS(RADIANS(R2C2))*COS(RADIANS(RC[-3])))-TAN(RADIANS(R2C2))*TAN(RADIANS(RC[-3])))) -> 36.829472614463562 | X314: =(720-4*R3C2-RC[-2]+R4C2*60)/1440 -> 1899-12-31T13:39:50.254 | Y314: =(RC[-1]*1440-RC[-2]*4)/1440 -> 1899-12-31T11:12:31.180 | Z314: =(RC[-2]*1440+RC[-3]*4)/1440 -> 1899-12-31T16:07:09.327 | AA314: =8*RC[-4] -> 294.63578091570849 | AB314: =MOD(RC[-23]*1440+RC[-6]+4*R3C2-60*R4C2,1440) -> 740.16243926674542 | AC314: =IF(RC[-1]/4<0,RC[-1]/4+180,RC[-1]/4-180) -> 5.0406098166863558 | AD314: =DEGREES(ACOS(SIN(RADIANS(R2C2))*SIN(RADIANS(RC[-10]))+COS(RADIANS(R2C2))*COS(RADIANS(RC[-10]))*COS(RADIANS(RC[-1])))) -> 87.166044614731334 | AE314: =90-RC[-1] -> 2.8339553852686663 | AF314: =IF(RC[-1]>85,0,IF(RC[-1]>5,58.1/TAN(RADIANS(RC[-1]))-0.07/POWER(TAN(RADIANS(RC[-1])),3)+0.000086/POWER(TAN(RADIANS(RC[-1])),5),IF(RC[-1]>-0.575,1735+RC[-1]*(-518.2+RC[-1]*(103.4+RC[-1]*(-12.79+RC[-1]*0.711))),-20.772/TAN(RADIANS(RC[-1])))))/3600 -> 0.23656581289835399 | AG314: =RC[-2]+RC[-1] -> 3.0705211981670204 | AH314: =IF(RC[-5]>0,MOD(DEGREES(ACOS(((SIN(RADIANS(R2C2))*COS(RADIANS(RC[-4])))-SIN(RADIANS(RC[-14])))/(COS(RADIANS(R2C2))*SIN(RADIANS(RC[-4])))))+180,360),MOD(540-DEGREES(ACOS(((SIN(RADIANS(R2C2))*COS(RADIANS(RC[-4])))-SIN(RADIANS(RC[-14])))/(COS(RADIANS(R2C2))*SIN(RADIANS(RC[-4]))))),360)) -> 184.82332171984359
D315: =R[-1]C+1 -> 2017-11-10T00:00:00.000 | E315: =R5C2 -> 1899-12-31T14:00:00.000 | F315: =RC[-2]+2415018.5+RC[-1]-R4C2/24 -> 2458068.375 | G315: =(RC[-1]-2451545)/36525 -> 0.1786002737850787 | I315: =MOD(280.46646+RC[-2]*(36000.76983 + RC[-2]*0.0003032),360) -> 230.21381778309205 | J315: =357.52911+RC[-3]*(35999.05029 - 0.0001537*RC[-3]) -> 6786.9693428940855 | K315: =0.016708634-RC[-4]*(0.000042037+0.0000001267*RC[-4]) -> 1.6701122138806975E-2 | L315: =SIN(RADIANS(RC[-2]))*(1.914602-RC[-5]*(0.004817+0.000014*RC[-5]))+SIN(RADIANS(2*RC[-2]))*(0.019993-0.000101*RC[-5])+SIN(RADIANS(3*RC[-2]))*0.000289 -> -1.5482961335103589 | M315: =RC[-4]+RC[-1] -> 228.66552164958171 | N315: =RC[-4]+RC[-2] -> 6785.4210467605753 | O315: =(1.000001018*(1-RC[-4]*RC[-4]))/(1+RC[-4]*COS(RADIANS(RC[-1]))) -> 0.99013790611418406 | P315: =RC[-3]-0.00569-0.00478*SIN(RADIANS(125.04-1934.136*RC[-9])) -> 228.65673381313385 | Q315: =23+(26+((21.448-RC[-10]*(46.815+RC[-10]*(0.00059-RC[-10]*0.001813))))/60)/60 -> 23.436968561025434 | R315: =RC[-1]+0.00256*COS(RADIANS(125.04-1934.136*RC[-11])) -> 23.435018942431459 | S315: =DEGREES(ATAN2(COS(RADIANS(RC[-3])),COS(RADIANS(RC[-1]))*SIN(RADIANS(RC[-3])))) -> -133.7999415190088 | T315: =DEGREES(ASIN(SIN(RADIANS(RC[-2]))*SIN(RADIANS(RC[-4])))) -> -17.37269569798725 | U315: =TAN(RADIANS(RC[-3]/2))*TAN(RADIANS(RC[-3]/2)) -> 4.3018397247285414E-2 | V315: =4*DEGREES(RC[-1]*SIN(2*RADIANS(RC[-13]))-2*RC[-11]*SIN(RADIANS(RC[-12]))+4*RC[-11]*RC[-1]*SIN(RADIANS(RC[-12]))*COS(2*RADIANS(RC[-13]))-0.5*RC[-1]*RC[-1]*SIN(4*RADIANS(RC[-13]))-1.25*RC[-11]*RC[-11]*SIN(2*RADIANS(RC[-12]))) -> 16.059989107352603 | W315: =DEGREES(ACOS(COS(RADIANS(90.833))/(COS(RADIANS(R2C2))*COS(RADIANS(RC[-3])))-TAN(RADIANS(R2C2))*TAN(RADIANS(RC[-3])))) -> 35.409539491634021 | X315: =(720-4*R3C2-RC[-2]+R4C2*60)/1440 -> 1899-12-31T13:39:56.401 | Y315: =(RC[-1]*1440-RC[-2]*4)/1440 -> 1899-12-31T11:18:18.111 | Z315: =(RC[-2]*1440+RC[-3]*4)/1440 -> 1899-12-31T16:01:34.690 | AA315: =8*RC[-4] -> 283.27631593307217 | AB315: =MOD(RC[-23]*1440+RC[-6]+4*R3C2-60*R4C2,1440) -> 740.05998910735264 | AC315: =IF(RC[-1]/4<0,RC[-1]/4+180,RC[-1]/4-180) -> 5.0149972768381588 | AD315: =DEGREES(ACOS(SIN(RADIANS(R2C2))*SIN(RADIANS(RC[-10]))+COS(RADIANS(R2C2))*COS(RADIANS(RC[-10]))*COS(RADIANS(RC[-1])))) -> 87.444364500583902 | AE315: =90-RC[-1] -> 2.5556354994160984 | AF315: =IF(RC[-1]>85,0,IF(RC[-1]>5,58.1/TAN(RADIANS(RC[-1]))-0.07/POWER(TAN(RADIANS(RC[-1])),3)+0.000086/POWER(TAN(RADIANS(RC[-1])),5),IF(RC[-1]>-0.575,1735+RC[-1]*(-518.2+RC[-1]*(103.4+RC[-1]*(-12.79+RC[-1]*0.711))),-20.772/TAN(RADIANS(RC[-1])))))/3600 -> 0.2507910649919215 | AG315: =RC[-2]+RC[-1] -> 2.80642656440802 | AH315: =IF(RC[-5]>0,MOD(DEGREES(ACOS(((SIN(RADIANS(R2C2))*COS(RADIANS(RC[-4])))-SIN(RADIANS(RC[-14])))/(COS(RADIANS(R2C2))*SIN(RADIANS(RC[-4])))))+180,360),MOD(540-DEGREES(ACOS(((SIN(RADIANS(R2C2))*COS(RADIANS(RC[-4])))-SIN(RADIANS(RC[-14])))/(COS(RADIANS(R2C2))*SIN(RADIANS(RC[-4]))))),360)) -> 184.79045615332927
D316: =R[-1]C+1 -> 2017-11-11T00:00:00.000 | E316: =R5C2 -> 1899-12-31T14:00:00.000 | F316: =RC[-2]+2415018.5+RC[-1]-R4C2/24 -> 2458069.375 | G316: =(RC[-1]-2451545)/36525 -> 0.17862765229295002 | I316: =MOD(280.46646+RC[-2]*(36000.76983 + RC[-2]*0.0003032),360) -> 231.19946514622188 | J316: =357.52911+RC[-3]*(35999.05029 - 0.0001537*RC[-3]) -> 6787.9549431743071 | K316: =0.016708634-RC[-4]*(0.000042037+0.0000001267*RC[-4]) -> 1.6701120986657467E-2 | L316: =SIN(RADIANS(RC[-2]))*(1.914602-RC[-5]*(0.004817+0.000014*RC[-5]))+SIN(RADIANS(2*RC[-2]))*(0.019993-0.000101*RC[-5])+SIN(RADIANS(3*RC[-2]))*0.000289 -> -1.5284655572911798 | M316: =RC[-4]+RC[-1] -> 229.6709995889307 | N316: =RC[-4]+RC[-2] -> 6786.4264776170157 | O316: =(1.000001018*(1-RC[-4]*RC[-4]))/(1+RC[-4]*COS(RADIANS(RC[-1]))) -> 0.98990522814904514 | P316: =RC[-3]-0.00569-0.00478*SIN(RADIANS(125.04-1934.136*RC[-9])) -> 229.66220838937448 | Q316: =23+(26+((21.448-RC[-10]*(46.815+RC[-10]*(0.00059-RC[-10]*0.001813))))/60)/60 -> 23.436968204990471 | R316: =RC[-1]+0.00256*COS(RADIANS(125.04-1934.136*RC[-11])) -> 23.43502012059097 | S316: =DEGREES(ATAN2(COS(RADIANS(RC[-3])),COS(RADIANS(RC[-1]))*SIN(RADIANS(RC[-3])))) -> -132.78557806915458 | T316: =DEGREES(ASIN(SIN(RADIANS(RC[-2]))*SIN(RADIANS(RC[-4])))) -> -17.646906678985239 | U316: =TAN(RADIANS(RC[-3]/2))*TAN(RADIANS(RC[-3]/2)) -> 4.3018401695651853E-2 | V316: =4*DEGREES(RC[-1]*SIN(2*RADIANS(RC[-13]))-2*RC[-11]*SIN(RADIANS(RC[-12]))+4*RC[-11]*RC[-1]*SIN(RADIANS(RC[-12]))*COS(2*RADIANS(RC[-13]))-0.5*RC[-1]*RC[-1]*SIN(4*RADIANS(RC[-13]))-1.25*RC[-11]*RC[-11]*SIN(2*RADIANS(RC[-12]))) -> 15.943202309065827 | W316: =DEGREES(ACOS(COS(RADIANS(90.833))/(COS(RADIANS(R2C2))*COS(RADIANS(RC[-3])))-TAN(RADIANS(R2C2))*TAN(RADIANS(RC[-3])))) -> 33.960596993183955 | X316: =(720-4*R3C2-RC[-2]+R4C2*60)/1440 -> 1899-12-31T13:40:03.408 | Y316: =(RC[-1]*1440-RC[-2]*4)/1440 -> 1899-12-31T11:24:12.865 | Z316: =(RC[-2]*1440+RC[-3]*4)/1440 -> 1899-12-31T15:55:53.951 | AA316: =8*RC[-4] -> 271.68477594547164 | AB316: =MOD(RC[-23]*1440+RC[-6]+4*R3C2-60*R4C2,1440) -> 739.94320230906578 | AC316: =IF(RC[-1]/4<0,RC[-1]/4+180,RC[-1]/4-180) -> 4.9858005772664455 | AD316: =DEGREES(ACOS(SIN(RADIANS(R2C2))*SIN(RADIANS(RC[-10]))+COS(RADIANS(R2C2))*COS(RADIANS(RC[-10]))*COS(RADIANS(RC[-1])))) -> 87.717622582046232 | AE316: =90-RC[-1] -> 2.2823774179537679 | AF316: =IF(RC[-1]>85,0,IF(RC[-1]>5,58.1/TAN(RADIANS(RC[-1]))-0.07/POWER(TAN(RADIANS(RC[-1])),3)+0.000086/POWER(TAN(RADIANS(RC[-1])),5),IF(RC[-1]>-0.575,1735+RC[-1]*(-518.2+RC[-1]*(103.4+RC[-1]*(-12.79+RC[-1]*0.711))),-20.772/TAN(RADIANS(RC[-1])))))/3600 -> 0.26614881117841283 | AG316: =RC[-2]+RC[-1] -> 2.5485262291321806 | AH316: =IF(RC[-5]>0,MOD(DEGREES(ACOS(((SIN(RADIANS(R2C2))*COS(RADIANS(RC[-4])))-SIN(RADIANS(RC[-14])))/(COS(RADIANS(R2C2))*SIN(RADIANS(RC[-4])))))+180,360),MOD(540-DEGREES(ACOS(((SIN(RADIANS(R2C2))*COS(RADIANS(RC[-4])))-SIN(RADIANS(RC[-14])))/(COS(RADIANS(R2C2))*SIN(RADIANS(RC[-4]))))),360)) -> 184.75441062540381
D317: =R[-1]C+1 -> 2017-11-12T00:00:00.000 | E317: =R5C2 -> 1899-12-31T14:00:00.000 | F317: =RC[-2]+2415018.5+RC[-1]-R4C2/24 -> 2458070.375 | G317: =(RC[-1]-2451545)/36525 -> 0.17865503080082135 | I317: =MOD(280.46646+RC[-2]*(36000.76983 + RC[-2]*0.0003032),360) -> 232.1851125093508 | J317: =357.52911+RC[-3]*(35999.05029 - 0.0001537*RC[-3]) -> 6788.9405434545297 | K317: =0.016708634-RC[-4]*(0.000042037+0.0000001267*RC[-4]) -> 1.6701119834507769E-2 | L317: =SIN(RADIANS(RC[-2]))*(1.914602-RC[-5]*(0.004817+0.000014*RC[-5]))+SIN(RADIANS(2*RC[-2]))*(0.019993-0.000101*RC[-5])+SIN(RADIANS(3*RC[-2]))*0.000289 -> -1.5081652367889538 | M317: =RC[-4]+RC[-1] -> 230.67694727256185 | N317: =RC[-4]+RC[-2] -> 6787.4323782177407 | O317: =(1.000001018*(1-RC[-4]*RC[-4]))/(1+RC[-4]*COS(RADIANS(RC[-1]))) -> 0.9896755448195117 | P317: =RC[-3]-0.00569-0.00478*SIN(RADIANS(125.04-1934.136*RC[-9])) -> 230.66815271254626 | Q317: =23+(26+((21.448-RC[-10]*(46.815+RC[-10]*(0.00059-RC[-10]*0.001813))))/60)/60 -> 23.436967848955508 | R317: =RC[-1]+0.00256*COS(RADIANS(125.04-1934.136*RC[-11])) -> 23.43502130041449 | S317: =DEGREES(ATAN2(COS(RADIANS(RC[-3])),COS(RADIANS(RC[-1]))*SIN(RADIANS(RC[-3])))) -> -131.76767469572724 | T317: =DEGREES(ASIN(SIN(RADIANS(RC[-2]))*SIN(RADIANS(RC[-4])))) -> -17.916038652497996 | U317: =TAN(RADIANS(RC[-3]/2))*TAN(RADIANS(RC[-3]/2)) -> 4.3018406150301336E-2 | V317: =4*DEGREES(RC[-1]*SIN(2*RADIANS(RC[-13]))-2*RC[-11]*SIN(RADIANS(RC[-12]))+4*RC[-11]*RC[-1]*SIN(RADIANS(RC[-12]))*COS(2*RADIANS(RC[-13]))-0.5*RC[-1]*RC[-1]*SIN(4*RADIANS(RC[-13]))-1.25*RC[-11]*RC[-11]*SIN(2*RADIANS(RC[-12]))) -> 15.812086256933153 | W317: =DEGREES(ACOS(COS(RADIANS(90.833))/(COS(RADIANS(R2C2))*COS(RADIANS(RC[-3])))-TAN(RADIANS(R2C2))*TAN(RADIANS(RC[-3])))) -> 32.479069166498334 | X317: =(720-4*R3C2-RC[-2]+R4C2*60)/1440 -> 1899-12-31T13:40:11.275 | Y317: =(RC[-1]*1440-RC[-2]*4)/1440 -> 1899-12-31T11:30:16.298 | Z317: =(RC[-2]*1440+RC[-3]*4)/1440 -> 1899-12-31T15:50:06.251 | AA317: =8*RC[-4] -> 259.83255333198667 | AB317: =MOD(RC[-23]*1440+RC[-6]+4*R3C2-60*R4C2,1440) -> 739.81208625693318 | AC317: =IF(RC[-1]/4<0,RC[-1]/4+180,RC[-1]/4-180) -> 4.9530215642332962 | AD317: =DEGREES(ACOS(SIN(RADIANS(R2C2))*SIN(RADIANS(RC[-10]))+COS(RADIANS(R2C2))*COS(RADIANS(RC[-10]))*COS(RADIANS(RC[-1])))) -> 87.985710839860118 | AE317: =90-RC[-1] -> 2.0142891601398816 | AF317: =IF(RC[-1]>85,0,IF(RC[-1]>5,58.1/TAN(RADIANS(RC[-1]))-0.07/POWER(TAN(RADIANS(RC[-1])),3)+0.000086/POWER(TAN(RADIANS(RC[-1])),5),IF(RC[-1]>-0.575,1735+RC[-1]*(-518.2+RC[-1]*(103.4+RC[-1]*(-12.79+RC[-1]*0.711))),-20.772/TAN(RADIANS(RC[-1])))))/3600 -> 0.28275062983397231 | AG317: =RC[-2]+RC[-1] -> 2.2970397899738537 | AH317: =IF(RC[-5]>0,MOD(DEGREES(ACOS(((SIN(RADIANS(R2C2))*COS(RADIANS(RC[-4])))-SIN(RADIANS(RC[-14])))/(COS(RADIANS(R2C2))*SIN(RADIANS(RC[-4])))))+180,360),MOD(540-DEGREES(ACOS(((SIN(RADIANS(R2C2))*COS(RADIANS(RC[-4])))-SIN(RADIANS(RC[-14])))/(COS(RADIANS(R2C2))*SIN(RADIANS(RC[-4]))))),360)) -> 184.71520446088138
D318: =R[-1]C+1 -> 2017-11-13T00:00:00.000 | E318: =R5C2 -> 1899-12-31T14:00:00.000 | F318: =RC[-2]+2415018.5+RC[-1]-R4C2/24 -> 2458071.375 | G318: =(RC[-1]-2451545)/36525 -> 0.17868240930869267 | I318: =MOD(280.46646+RC[-2]*(36000.76983 + RC[-2]*0.0003032),360) -> 233.17075987248154 | J318: =357.52911+RC[-3]*(35999.05029 - 0.0001537*RC[-3]) -> 6789.9261437347495 | K318: =0.016708634-RC[-4]*(0.000042037+0.0000001267*RC[-4]) -> 1.6701118682357879E-2 | L318: =SIN(RADIANS(RC[-2]))*(1.914602-RC[-5]*(0.004817+0.000014*RC[-5]))+SIN(RADIANS(2*RC[-2]))*(0.019993-0.000101*RC[-5])+SIN(RADIANS(3*RC[-2]))*0.000289 -> -1.4874010087582892 | M318: =RC[-4]+RC[-1] -> 231.68335886372324 | N318: =RC[-4]+RC[-2] -> 6788.4387427259917 | O318: =(1.000001018*(1-RC[-4]*RC[-4]))/(1+RC[-4]*COS(RADIANS(RC[-1]))) -> 0.98944892832356435 | P318: =RC[-3]-0.00569-0.00478*SIN(RADIANS(125.04-1934.136*RC[-9])) -> 231.67456094590011 | Q318: =23+(26+((21.448-RC[-10]*(46.815+RC[-10]*(0.00059-RC[-10]*0.001813))))/60)/60 -> 23.436967492920544 | R318: =RC[-1]+0.00256*COS(RADIANS(125.04-1934.136*RC[-11])) -> 23.43502248190071 | S318: =DEGREES(ATAN2(COS(RADIANS(RC[-3])),COS(RADIANS(RC[-1]))*SIN(RADIANS(RC[-3])))) -> -130.74623419313431 | T318: =DEGREES(ASIN(SIN(RADIANS(RC[-2]))*SIN(RADIANS(RC[-4])))) -> -18.179981954775659 | U318: =TAN(RADIANS(RC[-3]/2))*TAN(RADIANS(RC[-3]/2)) -> 4.3018410611228873E-2 | V318: =4*DEGREES(RC[-1]*SIN(2*RADIANS(RC[-13]))-2*RC[-11]*SIN(RADIANS(RC[-12]))+4*RC[-11]*RC[-1]*SIN(RADIANS(RC[-12]))*COS(2*RADIANS(RC[-13]))-0.5*RC[-1]*RC[-1]*SIN(4*RADIANS(RC[-13]))-1.25*RC[-11]*RC[-11]*SIN(2*RADIANS(RC[-12]))) -> 15.666666241163965 | W318: =DEGREES(ACOS(COS(RADIANS(90.833))/(COS(RADIANS(R2C2))*COS(RADIANS(RC[-3])))-TAN(RADIANS(R2C2))*TAN(RADIANS(RC[-3])))) -> 30.960609235244103 | X318: =(720-4*R3C2-RC[-2]+R4C2*60)/1440 -> 1899-12-31T13:40:20.000 | Y318: =(RC[-1]*1440-RC[-2]*4)/1440 -> 1899-12-31T11:36:29.454 | Z318: =(RC[-2]*1440+RC[-3]*4)/1440 -> 1899-12-31T15:44:10.546 | AA318: =8*RC[-4] -> 247.68487388195283 | AB318: =MOD(RC[-23]*1440+RC[-6]+4*R3C2-60*R4C2,1440) -> 739.66666624116397 | AC318: =IF(RC[-1]/4<0,RC[-1]/4+180,RC[-1]/4-180) -> 4.9166665602909916 | AD318: =DEGREES(ACOS(SIN(RADIANS(R2C2))*SIN(RADIANS(RC[-10]))+COS(RADIANS(R2C2))*COS(RADIANS(RC[-10]))*COS(RADIANS(RC[-1])))) -> 88.248522212543435 | AE318: =90-RC[-1] -> 1.7514777874565652 | AF318: =IF(RC[-1]>85,0,IF(RC[-1]>5,58.1/TAN(RADIANS(RC[-1]))-0.07/POWER(TAN(RADIANS(RC[-1])),3)+0.000086/POWER(TAN(RADIANS(RC[-1])),5),IF(RC[-1]>-0.575,1735+RC[-1]*(-518.2+RC[-1]*(103.4+RC[-1]*(-12.79+RC[-1]*0.711))),-20.772/TAN(RADIANS(RC[-1])))))/3600 -> 0.3007090272461585 | AG318: =RC[-2]+RC[-1] -> 2.0521868147027238 | AH318: =IF(RC[-5]>0,MOD(DEGREES(ACOS(((SIN(RADIANS(R2C2))*COS(RADIANS(RC[-4])))-SIN(RADIANS(RC[-14])))/(COS(RADIANS(R2C2))*SIN(RADIANS(RC[-4])))))+180,360),MOD(540-DEGREES(ACOS(((SIN(RADIANS(R2C2))*COS(RADIANS(RC[-4])))-SIN(RADIANS(RC[-14])))/(COS(RADIANS(R2C2))*SIN(RADIANS(RC[-4]))))),360)) -> 184.67286051203862
D319: =R[-1]C+1 -> 2017-11-14T00:00:00.000 | E319: =R5C2 -> 1899-12-31T14:00:00.000 | F319: =RC[-2]+2415018.5+RC[-1]-R4C2/24 -> 2458072.375 | G319: =(RC[-1]-2451545)/36525 -> 0.17870978781656399 | I319: =MOD(280.46646+RC[-2]*(36000.76983 + RC[-2]*0.0003032),360) -> 234.15640723561319 | J319: =357.52911+RC[-3]*(35999.05029 - 0.0001537*RC[-3]) -> 6790.9117440149712 | K319: =0.016708634-RC[-4]*(0.000042037+0.0000001267*RC[-4]) -> 1.6701117530207803E-2 | L319: =SIN(RADIANS(RC[-2]))*(1.914602-RC[-5]*(0.004817+0.000014*RC[-5]))+SIN(RADIANS(2*RC[-2]))*(0.019993-0.000101*RC[-5])+SIN(RADIANS(3*RC[-2]))*0.000289 -> -1.4661788685611079 | M319: =RC[-4]+RC[-1] -> 232.69022836705207 | N319: =RC[-4]+RC[-2] -> 6789.4455651464104 | O319: =(1.000001018*(1-RC[-4]*RC[-4]))/(1+RC[-4]*COS(RADIANS(RC[-1]))) -> 0.98922544999276296 | P319: =RC[-3]-0.00569-0.00478*SIN(RADIANS(125.04-1934.136*RC[-9])) -> 232.68142709407613 | Q319: =23+(26+((21.448-RC[-10]*(46.815+RC[-10]*(0.00059-RC[-10]*0.001813))))/60)/60 -> 23.436967136885585 | R319: =RC[-1]+0.00256*COS(RADIANS(125.04-1934.136*RC[-11])) -> 23.43502366504832 | S319: =DEGREES(ATAN2(COS(RADIANS(RC[-3])),COS(RADIANS(RC[-1]))*SIN(RADIANS(RC[-3])))) -> -129.72126360161099 | T319: =DEGREES(ASIN(SIN(RADIANS(RC[-2]))*SIN(RADIANS(RC[-4])))) -> -18.438627661136849 | U319: =TAN(RADIANS(RC[-3]/2))*TAN(RADIANS(RC[-3]/2)) -> 4.301841507842958E-2 | V319: =4*DEGREES(RC[-1]*SIN(2*RADIANS(RC[-13]))-2*RC[-11]*SIN(RADIANS(RC[-12]))+4*RC[-11]*RC[-1]*SIN(RADIANS(RC[-12]))*COS(2*RADIANS(RC[-13]))-0.5*RC[-1]*RC[-1]*SIN(4*RADIANS(RC[-13]))-1.25*RC[-11]*RC[-11]*SIN(2*RADIANS(RC[-12]))) -> 15.506985707551914 | W319: =DEGREES(ACOS(COS(RADIANS(90.833))/(COS(RADIANS(R2C2))*COS(RADIANS(RC[-3])))-TAN(RADIANS(R2C2))*TAN(RADIANS(RC[-3])))) -> 29.399852696748191 | X319: =(720-4*R3C2-RC[-2]+R4C2*60)/1440 -> 1899-12-31T13:40:29.581 | Y319: =(RC[-1]*1440-RC[-2]*4)/1440 -> 1899-12-31T11:42:53.616 | Z319: =(RC[-2]*1440+RC[-3]*4)/1440 -> 1899-12-31T15:38:05.546 | AA319: =8*RC[-4] -> 235.19882157398553 | AB319: =MOD(RC[-23]*1440+RC[-6]+4*R3C2-60*R4C2,1440) -> 739.50698570755196 | AC319: =IF(RC[-1]/4<0,RC[-1]/4+180,RC[-1]/4-180) -> 4.8767464268879905 | AD319: =DEGREES(ACOS(SIN(RADIANS(R2C2))*SIN(RADIANS(RC[-10]))+COS(RADIANS(R2C2))*COS(RADIANS(RC[-10]))*COS(RADIANS(RC[-1])))) -> 88.505950679743265 | AE319: =90-RC[-1] -> 1.4940493202567353 | AF319: =IF(RC[-1]>85,0,IF(RC[-1]>5,58.1/TAN(RADIANS(RC[-1]))-0.07/POWER(TAN(RADIANS(RC[-1])),3)+0.000086/POWER(TAN(RADIANS(RC[-1])),5),IF(RC[-1]>-0.575,1735+RC[-1]*(-518.2+RC[-1]*(103.4+RC[-1]*(-12.79+RC[-1]*0.711))),-20.772/TAN(RADIANS(RC[-1])))))/3600 -> 0.32013319817502117 | AG319: =RC[-2]+RC[-1] -> 1.8141825184317564 | AH319: =IF(RC[-5]>0,MOD(DEGREES(ACOS(((SIN(RADIANS(R2C2))*COS(RADIANS(RC[-4])))-SIN(RADIANS(RC[-14])))/(COS(RADIANS(R2C2))*SIN(RADIANS(RC[-4])))))+180,360),MOD(540-DEGREES(ACOS(((SIN(RADIANS(R2C2))*COS(RADIANS(RC[-4])))-SIN(RADIANS(RC[-14])))/(COS(RADIANS(R2C2))*SIN(RADIANS(RC[-4]))))),360)) -> 184.62740516128221
D320: =R[-1]C+1 -> 2017-11-15T00:00:00.000 | E320: =R5C2 -> 1899-12-31T14:00:00.000 | F320: =RC[-2]+2415018.5+RC[-1]-R4C2/24 -> 2458073.375 | G320: =(RC[-1]-2451545)/36525 -> 0.17873716632443531 | I320: =MOD(280.46646+RC[-2]*(36000.76983 + RC[-2]*0.0003032),360) -> 235.14205459874483 | J320: =357.52911+RC[-3]*(35999.05029 - 0.0001537*RC[-3]) -> 6791.897344295191 | K320: =0.016708634-RC[-4]*(0.000042037+0.0000001267*RC[-4]) -> 1.6701116378057535E-2 | L320: =SIN(RADIANS(RC[-2]))*(1.914602-RC[-5]*(0.004817+0.000014*RC[-5]))+SIN(RADIANS(2*RC[-2]))*(0.019993-0.000101*RC[-5])+SIN(RADIANS(3*RC[-2]))*0.000289 -> -1.4445049686151576 | M320: =RC[-4]+RC[-1] -> 233.69754963012969 | N320: =RC[-4]+RC[-2] -> 6790.4528393265755 | O320: =(1.000001018*(1-RC[-4]*RC[-4]))/(1+RC[-4]*COS(RADIANS(RC[-1]))) -> 0.98900518026594231 | P320: =RC[-3]-0.00569-0.00478*SIN(RADIANS(125.04-1934.136*RC[-9])) -> 233.6887450046585 | Q320: =23+(26+((21.448-RC[-10]*(46.815+RC[-10]*(0.00059-RC[-10]*0.001813))))/60)/60 -> 23.436966780850621 | R320: =RC[-1]+0.00256*COS(RADIANS(125.04-1934.136*RC[-11])) -> 23.435024849855992 | S320: =DEGREES(ATAN2(COS(RADIANS(RC[-3])),COS(RADIANS(RC[-1]))*SIN(RADIANS(RC[-3])))) -> -128.69277429044888 | T320: =DEGREES(ASIN(SIN(RADIANS(RC[-2]))*SIN(RADIANS(RC[-4])))) -> -18.691867678853889 | U320: =TAN(RADIANS(RC[-3]/2))*TAN(RADIANS(RC[-3]/2)) -> 4.3018419551898425E-2 | V320: =4*DEGREES(RC[-1]*SIN(2*RADIANS(RC[-13]))-2*RC[-11]*SIN(RADIANS(RC[-12]))+4*RC[-11]*RC[-1]*SIN(RADIANS(RC[-12]))*COS(2*RADIANS(RC[-13]))-0.5*RC[-1]*RC[-1]*SIN(4*RADIANS(RC[-13]))-1.25*RC[-11]*RC[-11]*SIN(2*RADIANS(RC[-12]))) -> 15.33310647598595 | W320: =DEGREES(ACOS(COS(RADIANS(90.833))/(COS(RADIANS(R2C2))*COS(RADIANS(RC[-3])))-TAN(RADIANS(R2C2))*TAN(RADIANS(RC[-3])))) -> 27.790061026988599 | X320: =(720-4*R3C2-RC[-2]+R4C2*60)/1440 -> 1899-12-31T13:40:40.014 | Y320: =(RC[-1]*1440-RC[-2]*4)/1440 -> 1899-12-31T11:49:30.399 | Z320: =(RC[-2]*1440+RC[-3]*4)/1440 -> 1899-12-31T15:31:49.628 | AA320: =8*RC[-4] -> 222.3204882159088 | AB320: =MOD(RC[-23]*1440+RC[-6]+4*R3C2-60*R4C2,1440) -> 739.33310647598591 | AC320: =IF(RC[-1]/4<0,RC[-1]/4+180,RC[-1]/4-180) -> 4.8332766189964786 | AD320: =DEGREES(ACOS(SIN(RADIANS(R2C2))*SIN(RADIANS(RC[-10]))+COS(RADIANS(R2C2))*COS(RADIANS(RC[-10]))*COS(RADIANS(RC[-1])))) -> 88.757891347278502 | AE320: =90-RC[-1] -> 1.2421086527214982 | AF320: =IF(RC[-1]>85,0,IF(RC[-1]>5,58.1/TAN(RADIANS(RC[-1]))-0.07/POWER(TAN(RADIANS(RC[-1])),3)+0.000086/POWER(TAN(RADIANS(RC[-1])),5),IF(RC[-1]>-0.575,1735+RC[-1]*(-518.2+RC[-1]*(103.4+RC[-1]*(-12.79+RC[-1]*0.711))),-20.772/TAN(RADIANS(RC[-1])))))/3600 -> 0.34112511190419481 | AG320: =RC[-2]+RC[-1] -> 1.5832337646256929 | AH320: =IF(RC[-5]>0,MOD(DEGREES(ACOS(((SIN(RADIANS(R2C2))*COS(RADIANS(RC[-4])))-SIN(RADIANS(RC[-14])))/(COS(RADIANS(R2C2))*SIN(RADIANS(RC[-4])))))+180,360),MOD(540-DEGREES(ACOS(((SIN(RADIANS(R2C2))*COS(RADIANS(RC[-4])))-SIN(RADIANS(RC[-14])))/(COS(RADIANS(R2C2))*SIN(RADIANS(RC[-4]))))),360)) -> 184.57886831763363
D321: =R[-1]C+1 -> 2017-11-16T00:00:00.000 | E321: =R5C2 -> 1899-12-31T14:00:00.000 | F321: =RC[-2]+2415018.5+RC[-1]-R4C2/24 -> 2458074.375 | G321: =(RC[-1]-2451545)/36525 -> 0.17876454483230664 | I321: =MOD(280.46646+RC[-2]*(36000.76983 + RC[-2]*0.0003032),360) -> 236.12770196187648 | J321: =357.52911+RC[-3]*(35999.05029 - 0.0001537*RC[-3]) -> 6792.8829445754118 | K321: =0.016708634-RC[-4]*(0.000042037+0.0000001267*RC[-4]) -> 1.6701115225907077E-2 | L321: =SIN(RADIANS(RC[-2]))*(1.914602-RC[-5]*(0.004817+0.000014*RC[-5]))+SIN(RADIANS(2*RC[-2]))*(0.019993-0.000101*RC[-5])+SIN(RADIANS(3*RC[-2]))*0.000289 -> -1.4223856167683318 | M321: =RC[-4]+RC[-1] -> 234.70531634510814 | N321: =RC[-4]+RC[-2] -> 6791.4605589586436 | O321: =(1.000001018*(1-RC[-4]*RC[-4]))/(1+RC[-4]*COS(RADIANS(RC[-1]))) -> 0.98878818866310658 | P321: =RC[-3]-0.00569-0.00478*SIN(RADIANS(125.04-1934.136*RC[-9])) -> 234.69650836980216 | Q321: =23+(26+((21.448-RC[-10]*(46.815+RC[-10]*(0.00059-RC[-10]*0.001813))))/60)/60 -> 23.436966424815662 | R321: =RC[-1]+0.00256*COS(RADIANS(125.04-1934.136*RC[-11])) -> 23.435026036322427 | S321: =DEGREES(ATAN2(COS(RADIANS(RC[-3])),COS(RADIANS(RC[-1]))*SIN(RADIANS(RC[-3])))) -> -127.66078203556383 | T321: =DEGREES(ASIN(SIN(RADIANS(RC[-2]))*SIN(RADIANS(RC[-4])))) -> -18.939594843042666 | U321: =TAN(RADIANS(RC[-3]/2))*TAN(RADIANS(RC[-3]/2)) -> 4.3018424031630489E-2 | V321: =4*DEGREES(RC[-1]*SIN(2*RADIANS(RC[-13]))-2*RC[-11]*SIN(RADIANS(RC[-12]))+4*RC[-11]*RC[-1]*SIN(RADIANS(RC[-12]))*COS(2*RADIANS(RC[-13]))-0.5*RC[-1]*RC[-1]*SIN(4*RADIANS(RC[-13]))-1.25*RC[-11]*RC[-11]*SIN(2*RADIANS(RC[-12]))) -> 15.145108925678443 | W321: =DEGREES(ACOS(COS(RADIANS(90.833))/(COS(RADIANS(R2C2))*COS(RADIANS(RC[-3])))-TAN(RADIANS(R2C2))*TAN(RADIANS(RC[-3])))) -> 26.122590758390263 | X321: =(720-4*R3C2-RC[-2]+R4C2*60)/1440 -> 1899-12-31T13:40:51.293 | Y321: =(RC[-1]*1440-RC[-2]*4)/1440 -> 1899-12-31T11:56:21.872 | Z321: =(RC[-2]*1440+RC[-3]*4)/1440 -> 1899-12-31T15:25:20.715 | AA321: =8*RC[-4] -> 208.98072606712211 | AB321: =MOD(RC[-23]*1440+RC[-6]+4*R3C2-60*R4C2,1440) -> 739.14510892567841 | AC321: =IF(RC[-1]/4<0,RC[-1]/4+180,RC[-1]/4-180) -> 4.7862772314196036 | AD321: =DEGREES(ACOS(SIN(RADIANS(R2C2))*SIN(RADIANS(RC[-10]))+COS(RADIANS(R2C2))*COS(RADIANS(RC[-10]))*COS(RADIANS(RC[-1])))) -> 89.004240533769604 | AE321: =90-RC[-1] -> 0.99575946623039613 | AF321: =IF(RC[-1]>85,0,IF(RC[-1]>5,58.1/TAN(RADIANS(RC[-1]))-0.07/POWER(TAN(RADIANS(RC[-1])),3)+0.000086/POWER(TAN(RADIANS(RC[-1])),5),IF(RC[-1]>-0.575,1735+RC[-1]*(-518.2+RC[-1]*(103.4+RC[-1]*(-12.79+RC[-1]*0.711))),-20.772/TAN(RADIANS(RC[-1])))))/3600 -> 0.36377594396295904 | AG321: =RC[-2]+RC[-1] -> 1.3595354101933552 | AH321: =IF(RC[-5]>0,MOD(DEGREES(ACOS(((SIN(RADIANS(R2C2))*COS(RADIANS(RC[-4])))-SIN(RADIANS(RC[-14])))/(COS(RADIANS(R2C2))*SIN(RADIANS(RC[-4])))))+180,360),MOD(540-DEGREES(ACOS(((SIN(RADIANS(R2C2))*COS(RADIANS(RC[-4])))-SIN(RADIANS(RC[-14])))/(COS(RADIANS(R2C2))*SIN(RADIANS(RC[-4]))))),360)) -> 184.52728340698988
D322: =R[-1]C+1 -> 2017-11-17T00:00:00.000 | E322: =R5C2 -> 1899-12-31T14:00:00.000 | F322: =RC[-2]+2415018.5+RC[-1]-R4C2/24 -> 2458075.375 | G322: =(RC[-1]-2451545)/36525 -> 0.17879192334017796 | I322: =MOD(280.46646+RC[-2]*(36000.76983 + RC[-2]*0.0003032),360) -> 237.11334932500904 | J322: =357.52911+RC[-3]*(35999.05029 - 0.0001537*RC[-3]) -> 6793.8685448556325 | K322: =0.016708634-RC[-4]*(0.000042037+0.0000001267*RC[-4]) -> 1.6701114073756428E-2 | L322: =SIN(RADIANS(RC[-2]))*(1.914602-RC[-5]*(0.004817+0.000014*RC[-5]))+SIN(RADIANS(2*RC[-2]))*(0.019993-0.000101*RC[-5])+SIN(RADIANS(3*RC[-2]))*0.000289 -> -1.399827274600548 | M322: =RC[-4]+RC[-1] -> 235.7135220504085 | N322: =RC[-4]+RC[-2] -> 6792.4687175810323 | O322: =(1.000001018*(1-RC[-4]*RC[-4]))/(1+RC[-4]*COS(RADIANS(RC[-1]))) -> 0.98857454375955234 | P322: =RC[-3]-0.00569-0.00478*SIN(RADIANS(125.04-1934.136*RC[-9])) -> 235.704710727931 | Q322: =23+(26+((21.448-RC[-10]*(46.815+RC[-10]*(0.00059-RC[-10]*0.001813))))/60)/60 -> 23.436966068780698 | R322: =RC[-1]+0.00256*COS(RADIANS(125.04-1934.136*RC[-11])) -> 23.435027224446294 | S322: =DEGREES(ATAN2(COS(RADIANS(RC[-3])),COS(RADIANS(RC[-1]))*SIN(RADIANS(RC[-3])))) -> -126.6253070908442 | T322: =DEGREES(ASIN(SIN(RADIANS(RC[-2]))*SIN(RADIANS(RC[-4])))) -> -19.181703015428791 | U322: =TAN(RADIANS(RC[-3]/2))*TAN(RADIANS(RC[-3]/2)) -> 4.301842851762077E-2 | V322: =4*DEGREES(RC[-1]*SIN(2*RADIANS(RC[-13]))-2*RC[-11]*SIN(RADIANS(RC[-12]))+4*RC[-11]*RC[-1]*SIN(RADIANS(RC[-12]))*COS(2*RADIANS(RC[-13]))-0.5*RC[-1]*RC[-1]*SIN(4*RADIANS(RC[-13]))-1.25*RC[-11]*RC[-11]*SIN(2*RADIANS(RC[-12]))) -> 14.943092145842108 | W322: =DEGREES(ACOS(COS(RADIANS(90.833))/(COS(RADIANS(R2C2))*COS(RADIANS(RC[-3])))-TAN(RADIANS(R2C2))*TAN(RADIANS(RC[-3])))) -> 24.386071259532404 | X322: =(720-4*R3C2-RC[-2]+R4C2*60)/1440 -> 1899-12-31T13:41:03.414 | Y322: =(RC[-1]*1440-RC[-2]*4)/1440 -> 1899-12-31T12:03:30.757 | Z322: =(RC[-2]*1440+RC[-3]*4)/1440 -> 1899-12-31T15:18:36.072 | AA322: =8*RC[-4] -> 195.08857007625923 | AB322: =MOD(RC[-23]*1440+RC[-6]+4*R3C2-60*R4C2,1440) -> 738.94309214584212 | AC322: =IF(RC[-1]/4<0,RC[-1]/4+180,RC[-1]/4-180) -> 4.7357730364605288 | AD322: =DEGREES(ACOS(SIN(RADIANS(R2C2))*SIN(RADIANS(RC[-10]))+COS(RADIANS(R2C2))*COS(RADIANS(RC[-10]))*COS(RADIANS(RC[-1])))) -> 89.244895858747952 | AE322: =90-RC[-1] -> 0.75510414125204761 | AF322: =IF(RC[-1]>85,0,IF(RC[-1]>5,58.1/TAN(RADIANS(RC[-1]))-0.07/POWER(TAN(RADIANS(RC[-1])),3)+0.000086/POWER(TAN(RADIANS(RC[-1])),5),IF(RC[-1]>-0.575,1735+RC[-1]*(-518.2+RC[-1]*(103.4+RC[-1]*(-12.79+RC[-1]*0.711))),-20.772/TAN(RADIANS(RC[-1])))))/3600 -> 0.38816287105071873 | AG322: =RC[-2]+RC[-1] -> 1.1432670123027664 | AH322: =IF(RC[-5]>0,MOD(DEGREES(ACOS(((SIN(RADIANS(R2C2))*COS(RADIANS(RC[-4])))-SIN(RADIANS(RC[-14])))/(COS(RADIANS(R2C2))*SIN(RADIANS(RC[-4])))))+180,360),MOD(540-DEGREES(ACOS(((SIN(RADIANS(R2C2))*COS(RADIANS(RC[-4])))-SIN(RADIANS(RC[-14])))/(COS(RADIANS(R2C2))*SIN(RADIANS(RC[-4]))))),360)) -> 184.47268735612414
D323: =R[-1]C+1 -> 2017-11-18T00:00:00.000 | E323: =R5C2 -> 1899-12-31T14:00:00.000 | F323: =RC[-2]+2415018.5+RC[-1]-R4C2/24 -> 2458076.375 | G323: =(RC[-1]-2451545)/36525 -> 0.17881930184804928 | I323: =MOD(280.46646+RC[-2]*(36000.76983 + RC[-2]*0.0003032),360) -> 238.09899668814251 | J323: =357.52911+RC[-3]*(35999.05029 - 0.0001537*RC[-3]) -> 6794.8541451358524 | K323: =0.016708634-RC[-4]*(0.000042037+0.0000001267*RC[-4]) -> 1.6701112921605591E-2 | L323: =SIN(RADIANS(RC[-2]))*(1.914602-RC[-5]*(0.004817+0.000014*RC[-5]))+SIN(RADIANS(2*RC[-2]))*(0.019993-0.000101*RC[-5])+SIN(RADIANS(3*RC[-2]))*0.000289 -> -1.3768365556520892 | M323: =RC[-4]+RC[-1] -> 236.72216013249042 | N323: =RC[-4]+RC[-2] -> 6793.4773085801999 | O323: =(1.000001018*(1-RC[-4]*RC[-4]))/(1+RC[-4]*COS(RADIANS(RC[-1]))) -> 0.98836431316021767 | P323: =RC[-3]-0.00569-0.00478*SIN(RADIANS(125.04-1934.136*RC[-9])) -> 236.71334546550759 | Q323: =23+(26+((21.448-RC[-10]*(46.815+RC[-10]*(0.00059-RC[-10]*0.001813))))/60)/60 -> 23.436965712745735 | R323: =RC[-1]+0.00256*COS(RADIANS(125.04-1934.136*RC[-11])) -> 23.435028414226277 | S323: =DEGREES(ATAN2(COS(RADIANS(RC[-3])),COS(RADIANS(RC[-1]))*SIN(RADIANS(RC[-3])))) -> -125.58637425271574 | T323: =DEGREES(ASIN(SIN(RADIANS(RC[-2]))*SIN(RADIANS(RC[-4])))) -> -19.418087185843603 | U323: =TAN(RADIANS(RC[-3]/2))*TAN(RADIANS(RC[-3]/2)) -> 4.3018433009864278E-2 | V323: =4*DEGREES(RC[-1]*SIN(2*RADIANS(RC[-13]))-2*RC[-11]*SIN(RADIANS(RC[-12]))+4*RC[-11]*RC[-1]*SIN(RADIANS(RC[-12]))*COS(2*RADIANS(RC[-13]))-0.5*RC[-1]*RC[-1]*SIN(4*RADIANS(RC[-13]))-1.25*RC[-11]*RC[-11]*SIN(2*RADIANS(RC[-12]))) -> 14.727174050631968 | W323: =DEGREES(ACOS(COS(RADIANS(90.833))/(COS(RADIANS(R2C2))*COS(RADIANS(RC[-3])))-TAN(RADIANS(R2C2))*TAN(RADIANS(RC[-3])))) -> 22.565069872153298 | X323: =(720-4*R3C2-RC[-2]+R4C2*60)/1440 -> 1899-12-31T13:41:16.370 | Y323: =(RC[-1]*1440-RC[-2]*4)/1440 -> 1899-12-31T12:11:00.753 | Z323: =(RC[-2]*1440+RC[-3]*4)/1440 -> 1899-12-31T15:11:31.986 | AA323: =8*RC[-4] -> 180.52055897722639 | AB323: =MOD(RC[-23]*1440+RC[-6]+4*R3C2-60*R4C2,1440) -> 738.72717405063202 | AC323: =IF(RC[-1]/4<0,RC[-1]/4+180,RC[-1]/4-180) -> 4.6817935126580039 | AD323: =DEGREES(ACOS(SIN(RADIANS(R2C2))*SIN(RADIANS(RC[-10]))+COS(RADIANS(R2C2))*COS(RADIANS(RC[-10]))*COS(RADIANS(RC[-1])))) -> 89.479756332128005 | AE323: =90-RC[-1] -> 0.52024366787199483 | AF323: =IF(RC[-1]>85,0,IF(RC[-1]>5,58.1/TAN(RADIANS(RC[-1]))-0.07/POWER(TAN(RADIANS(RC[-1])),3)+0.000086/POWER(TAN(RADIANS(RC[-1])),5),IF(RC[-1]>-0.575,1735+RC[-1]*(-518.2+RC[-1]*(103.4+RC[-1]*(-12.79+RC[-1]*0.711))),-20.772/TAN(RADIANS(RC[-1])))))/3600 -> 0.4143462438875718 | AG323: =RC[-2]+RC[-1] -> 0.93458991175956663 | AH323: =IF(RC[-5]>0,MOD(DEGREES(ACOS(((SIN(RADIANS(R2C2))*COS(RADIANS(RC[-4])))-SIN(RADIANS(RC[-14])))/(COS(RADIANS(R2C2))*SIN(RADIANS(RC[-4])))))+180,360),MOD(540-DEGREES(ACOS(((SIN(RADIANS(R2C2))*COS(RADIANS(RC[-4])))-SIN(RADIANS(RC[-14])))/(COS(RADIANS(R2C2))*SIN(RADIANS(RC[-4]))))),360)) -> 184.41512057043298
D324: =R[-1]C+1 -> 2017-11-19T00:00:00.000 | E324: =R5C2 -> 1899-12-31T14:00:00.000 | F324: =RC[-2]+2415018.5+RC[-1]-R4C2/24 -> 2458077.375 | G324: =(RC[-1]-2451545)/36525 -> 0.17884668035592061 | I324: =MOD(280.46646+RC[-2]*(36000.76983 + RC[-2]*0.0003032),360) -> 239.08464405127597 | J324: =357.52911+RC[-3]*(35999.05029 - 0.0001537*RC[-3]) -> 6795.8397454160722 | K324: =0.016708634-RC[-4]*(0.000042037+0.0000001267*RC[-4]) -> 1.6701111769454564E-2 | L324: =SIN(RADIANS(RC[-2]))*(1.914602-RC[-5]*(0.004817+0.000014*RC[-5]))+SIN(RADIANS(2*RC[-2]))*(0.019993-0.000101*RC[-5])+SIN(RADIANS(3*RC[-2]))*0.000289 -> -1.3534202235793908 | M324: =RC[-4]+RC[-1] -> 237.7312238276966 | N324: =RC[-4]+RC[-2] -> 6794.4863251924926 | O324: =(1.000001018*(1-RC[-4]*RC[-4]))/(1+RC[-4]*COS(RADIANS(RC[-1]))) -> 0.98815756347428341 | P324: =RC[-3]-0.00569-0.00478*SIN(RADIANS(125.04-1934.136*RC[-9])) -> 237.72240581887746 | Q324: =23+(26+((21.448-RC[-10]*(46.815+RC[-10]*(0.00059-RC[-10]*0.001813))))/60)/60 -> 23.436965356710775 | R324: =RC[-1]+0.00256*COS(RADIANS(125.04-1934.136*RC[-11])) -> 23.435029605661065 | S324: =DEGREES(ATAN2(COS(RADIANS(RC[-3])),COS(RADIANS(RC[-1]))*SIN(RADIANS(RC[-3])))) -> -124.54401291735672 | T324: =DEGREES(ASIN(SIN(RADIANS(RC[-2]))*SIN(RADIANS(RC[-4])))) -> -19.648643576285814 | U324: =TAN(RADIANS(RC[-3]/2))*TAN(RADIANS(RC[-3]/2)) -> 4.3018437508356093E-2 | V324: =4*DEGREES(RC[-1]*SIN(2*RADIANS(RC[-13]))-2*RC[-11]*SIN(RADIANS(RC[-12]))+4*RC[-11]*RC[-1]*SIN(RADIANS(RC[-12]))*COS(2*RADIANS(RC[-13]))-0.5*RC[-1]*RC[-1]*SIN(4*RADIANS(RC[-13]))-1.25*RC[-11]*RC[-11]*SIN(2*RADIANS(RC[-12]))) -> 14.497491457278834 | W324: =DEGREES(ACOS(COS(RADIANS(90.833))/(COS(RADIANS(R2C2))*COS(RADIANS(RC[-3])))-TAN(RADIANS(R2C2))*TAN(RADIANS(RC[-3])))) -> 20.637792610962112 | X324: =(720-4*R3C2-RC[-2]+R4C2*60)/1440 -> 1899-12-31T13:41:30.151 | Y324: =(RC[-1]*1440-RC[-2]*4)/1440 -> 1899-12-31T12:18:57.080 | Z324: =(RC[-2]*1440+RC[-3]*4)/1440 -> 1899-12-31T15:04:03.221 | AA324: =8*RC[-4] -> 165.1023408876969 | AB324: =MOD(RC[-23]*1440+RC[-6]+4*R3C2-60*R4C2,1440) -> 738.49749145727878 | AC324: =IF(RC[-1]/4<0,RC[-1]/4+180,RC[-1]/4-180) -> 4.624372864319696 | AD324: =DEGREES(ACOS(SIN(RADIANS(R2C2))*SIN(RADIANS(RC[-10]))+COS(RADIANS(R2C2))*COS(RADIANS(RC[-10]))*COS(RADIANS(RC[-1])))) -> 89.708722444915978 | AE324: =90-RC[-1] -> 0.29127755508402231 | AF324: =IF(RC[-1]>85,0,IF(RC[-1]>5,58.1/TAN(RADIANS(RC[-1]))-0.07/POWER(TAN(RADIANS(RC[-1])),3)+0.000086/POWER(TAN(RADIANS(RC[-1])),5),IF(RC[-1]>-0.575,1735+RC[-1]*(-518.2+RC[-1]*(103.4+RC[-1]*(-12.79+RC[-1]*0.711))),-20.772/TAN(RADIANS(RC[-1])))))/3600 -> 0.44236714976668268 | AG324: =RC[-2]+RC[-1] -> 0.73364470485070499 | AH324: =IF(RC[-5]>0,MOD(DEGREES(ACOS(((SIN(RADIANS(R2C2))*COS(RADIANS(RC[-4])))-SIN(RADIANS(RC[-14])))/(COS(RADIANS(R2C2))*SIN(RADIANS(RC[-4])))))+180,360),MOD(540-DEGREES(ACOS(((SIN(RADIANS(R2C2))*COS(RADIANS(RC[-4])))-SIN(RADIANS(RC[-14])))/(COS(RADIANS(R2C2))*SIN(RADIANS(RC[-4]))))),360)) -> 184.35462690545148
D325: =R[-1]C+1 -> 2017-11-20T00:00:00.000 | E325: =R5C2 -> 1899-12-31T14:00:00.000 | F325: =RC[-2]+2415018.5+RC[-1]-R4C2/24 -> 2458078.375 | G325: =(RC[-1]-2451545)/36525 -> 0.17887405886379193 | I325: =MOD(280.46646+RC[-2]*(36000.76983 + RC[-2]*0.0003032),360) -> 240.07029141440944 | J325: =357.52911+RC[-3]*(35999.05029 - 0.0001537*RC[-3]) -> 6796.8253456962921 | K325: =0.016708634-RC[-4]*(0.000042037+0.0000001267*RC[-4]) -> 1.6701110617303346E-2 | L325: =SIN(RADIANS(RC[-2]))*(1.914602-RC[-5]*(0.004817+0.000014*RC[-5]))+SIN(RADIANS(2*RC[-2]))*(0.019993-0.000101*RC[-5])+SIN(RADIANS(3*RC[-2]))*0.000289 -> -1.3295851902384803 | M325: =RC[-4]+RC[-1] -> 238.74070622417096 | N325: =RC[-4]+RC[-2] -> 6795.4957605060536 | O325: =(1.000001018*(1-RC[-4]*RC[-4]))/(1+RC[-4]*COS(RADIANS(RC[-1]))) -> 0.98795436029004191 | P325: =RC[-3]-0.00569-0.00478*SIN(RADIANS(125.04-1934.136*RC[-9])) -> 238.73188487618739 | Q325: =23+(26+((21.448-RC[-10]*(46.815+RC[-10]*(0.00059-RC[-10]*0.001813))))/60)/60 -> 23.436965000675816 | R325: =RC[-1]+0.00256*COS(RADIANS(125.04-1934.136*RC[-11])) -> 23.435030798749324 | S325: =DEGREES(ATAN2(COS(RADIANS(RC[-3])),COS(RADIANS(RC[-1]))*SIN(RADIANS(RC[-3])))) -> -123.49825712999983 | T325: =DEGREES(ASIN(SIN(RADIANS(RC[-2]))*SIN(RADIANS(RC[-4])))) -> -19.873269747365519 | U325: =TAN(RADIANS(RC[-3]/2))*TAN(RADIANS(RC[-3]/2)) -> 4.301844201309115E-2 | V325: =4*DEGREES(RC[-1]*SIN(2*RADIANS(RC[-13]))-2*RC[-11]*SIN(RADIANS(RC[-12]))+4*RC[-11]*RC[-1]*SIN(RADIANS(RC[-12]))*COS(2*RADIANS(RC[-13]))-0.5*RC[-1]*RC[-1]*SIN(4*RADIANS(RC[-13]))-1.25*RC[-11]*RC[-11]*SIN(2*RADIANS(RC[-12]))) -> 14.25420012644472 | W325: =DEGREES(ACOS(COS(RADIANS(90.833))/(COS(RADIANS(R2C2))*COS(RADIANS(RC[-3])))-TAN(RADIANS(R2C2))*TAN(RADIANS(RC[-3])))) -> 18.571807927723995 | X325: =(720-4*R3C2-RC[-2]+R4C2*60)/1440 -> 1899-12-31T13:41:44.748 | Y325: =(RC[-1]*1440-RC[-2]*4)/1440 -> 1899-12-31T12:27:27.514 | Z325: =(RC[-2]*1440+RC[-3]*4)/1440 -> 1899-12-31T14:56:01.982 | AA325: =8*RC[-4] -> 148.57446342179196 | AB325: =MOD(RC[-23]*1440+RC[-6]+4*R3C2-60*R4C2,1440) -> 738.25420012644474 | AC325: =IF(RC[-1]/4<0,RC[-1]/4+180,RC[-1]/4-180) -> 4.5635500316111859 | AD325: =DEGREES(ACOS(SIN(RADIANS(R2C2))*SIN(RADIANS(RC[-10]))+COS(RADIANS(R2C2))*COS(RADIANS(RC[-10]))*COS(RADIANS(RC[-1])))) -> 89.931696261018772 | AE325: =90-RC[-1] -> 6.8303738981228435E-2 | AF325: =IF(RC[-1]>85,0,IF(RC[-1]>5,58.1/TAN(RADIANS(RC[-1]))-0.07/POWER(TAN(RADIANS(RC[-1])),3)+0.000086/POWER(TAN(RADIANS(RC[-1])),5),IF(RC[-1]>-0.575,1735+RC[-1]*(-518.2+RC[-1]*(103.4+RC[-1]*(-12.79+RC[-1]*0.711))),-20.772/TAN(RADIANS(RC[-1])))))/3600 -> 0.4722453735159422 | AG325: =RC[-2]+RC[-1] -> 0.54054911249717064 | AH325: =IF(RC[-5]>0,MOD(DEGREES(ACOS(((SIN(RADIANS(R2C2))*COS(RADIANS(RC[-4])))-SIN(RADIANS(RC[-14])))/(COS(RADIANS(R2C2))*SIN(RADIANS(RC[-4])))))+180,360),MOD(540-DEGREES(ACOS(((SIN(RADIANS(R2C2))*COS(RADIANS(RC[-4])))-SIN(RADIANS(RC[-14])))/(COS(RADIANS(R2C2))*SIN(RADIANS(RC[-4]))))),360)) -> 184.29125363217932
D326: =R[-1]C+1 -> 2017-11-21T00:00:00.000 | E326: =R5C2 -> 1899-12-31T14:00:00.000 | F326: =RC[-2]+2415018.5+RC[-1]-R4C2/24 -> 2458079.375 | G326: =(RC[-1]-2451545)/36525 -> 0.17890143737166325 | I326: =MOD(280.46646+RC[-2]*(36000.76983 + RC[-2]*0.0003032),360) -> 241.05593877754382 | J326: =357.52911+RC[-3]*(35999.05029 - 0.0001537*RC[-3]) -> 6797.810945976511 | K326: =0.016708634-RC[-4]*(0.000042037+0.0000001267*RC[-4]) -> 1.670110946515194E-2 | L326: =SIN(RADIANS(RC[-2]))*(1.914602-RC[-5]*(0.004817+0.000014*RC[-5]))+SIN(RADIANS(2*RC[-2]))*(0.019993-0.000101*RC[-5])+SIN(RADIANS(3*RC[-2]))*0.000289 -> -1.3053385136960929 | M326: =RC[-4]+RC[-1] -> 239.75060026384773 | N326: =RC[-4]+RC[-2] -> 6796.5056074628146 | O326: =(1.000001018*(1-RC[-4]*RC[-4]))/(1+RC[-4]*COS(RADIANS(RC[-1]))) -> 0.98775476815003638 | P326: =RC[-3]-0.00569-0.00478*SIN(RADIANS(125.04-1934.136*RC[-9])) -> 239.74177557937446 | Q326: =23+(26+((21.448-RC[-10]*(46.815+RC[-10]*(0.00059-RC[-10]*0.001813))))/60)/60 -> 23.436964644640852 | R326: =RC[-1]+0.00256*COS(RADIANS(125.04-1934.136*RC[-11])) -> 23.435031993489734 | S326: =DEGREES(ATAN2(COS(RADIANS(RC[-3])),COS(RADIANS(RC[-1]))*SIN(RADIANS(RC[-3])))) -> -122.44914562576965 | T326: =DEGREES(ASIN(SIN(RADIANS(RC[-2]))*SIN(RADIANS(RC[-4])))) -> -20.091864706927758 | U326: =TAN(RADIANS(RC[-3]/2))*TAN(RADIANS(RC[-3]/2)) -> 4.3018446524064481E-2 | V326: =4*DEGREES(RC[-1]*SIN(2*RADIANS(RC[-13]))-2*RC[-11]*SIN(RADIANS(RC[-12]))+4*RC[-11]*RC[-1]*SIN(RADIANS(RC[-12]))*COS(2*RADIANS(RC[-13]))-0.5*RC[-1]*RC[-1]*SIN(4*RADIANS(RC[-13]))-1.25*RC[-11]*RC[-11]*SIN(2*RADIANS(RC[-12]))) -> 13.997474763943895 | W326: =DEGREES(ACOS(COS(RADIANS(90.833))/(COS(RADIANS(R2C2))*COS(RADIANS(RC[-3])))-TAN(RADIANS(R2C2))*TAN(RADIANS(RC[-3])))) -> 16.315223845914566 | X326: =(720-4*R3C2-RC[-2]+R4C2*60)/1440 -> 1899-12-31T13:42:00.152 | Y326: =(RC[-1]*1440-RC[-2]*4)/1440 -> 1899-12-31T12:36:44.498 | Z326: =(RC[-2]*1440+RC[-3]*4)/1440 -> 1899-12-31T14:47:15.805 | AA326: =8*RC[-4] -> 130.52179076731653 | AB326: =MOD(RC[-23]*1440+RC[-6]+4*R3C2-60*R4C2,1440) -> 737.99747476394384 | AC326: =IF(RC[-1]/4<0,RC[-1]/4+180,RC[-1]/4-180) -> 4.4993686909859605 | AD326: =DEGREES(ACOS(SIN(RADIANS(R2C2))*SIN(RADIANS(RC[-10]))+COS(RADIANS(R2C2))*COS(RADIANS(RC[-10]))*COS(RADIANS(RC[-1])))) -> 90.148581510005371 | AE326: =90-RC[-1] -> -0.14858151000537134 | AF326: =IF(RC[-1]>85,0,IF(RC[-1]>5,58.1/TAN(RADIANS(RC[-1]))-0.07/POWER(TAN(RADIANS(RC[-1])),3)+0.000086/POWER(TAN(RADIANS(RC[-1])),5),IF(RC[-1]>-0.575,1735+RC[-1]*(-518.2+RC[-1]*(103.4+RC[-1]*(-12.79+RC[-1]*0.711))),-20.772/TAN(RADIANS(RC[-1])))))/3600 -> 0.50397776240954373 | AG326: =RC[-2]+RC[-1] -> 0.35539625240417239 | AH326: =IF(RC[-5]>0,MOD(DEGREES(ACOS(((SIN(RADIANS(R2C2))*COS(RADIANS(RC[-4])))-SIN(RADIANS(RC[-14])))/(COS(RADIANS(R2C2))*SIN(RADIANS(RC[-4])))))+180,360),MOD(540-DEGREES(ACOS(((SIN(RADIANS(R2C2))*COS(RADIANS(RC[-4])))-SIN(RADIANS(RC[-14])))/(COS(RADIANS(R2C2))*SIN(RADIANS(RC[-4]))))),360)) -> 184.22505139629985
D327: =R[-1]C+1 -> 2017-11-22T00:00:00.000 | E327: =R5C2 -> 1899-12-31T14:00:00.000 | F327: =RC[-2]+2415018.5+RC[-1]-R4C2/24 -> 2458080.375 | G327: =(RC[-1]-2451545)/36525 -> 0.17892881587953458 | I327: =MOD(280.46646+RC[-2]*(36000.76983 + RC[-2]*0.0003032),360) -> 242.04158614067819 | J327: =357.52911+RC[-3]*(35999.05029 - 0.0001537*RC[-3]) -> 6798.7965462567308 | K327: =0.016708634-RC[-4]*(0.000042037+0.0000001267*RC[-4]) -> 1.6701108313000344E-2 | L327: =SIN(RADIANS(RC[-2]))*(1.914602-RC[-5]*(0.004817+0.000014*RC[-5]))+SIN(RADIANS(2*RC[-2]))*(0.019993-0.000101*RC[-5])+SIN(RADIANS(3*RC[-2]))*0.000289 -> -1.2806873961692171 | M327: =RC[-4]+RC[-1] -> 240.76089874450898 | N327: =RC[-4]+RC[-2] -> 6797.5158588605618 | O327: =(1.000001018*(1-RC[-4]*RC[-4]))/(1+RC[-4]*COS(RADIANS(RC[-1]))) -> 0.98755885052649706 | P327: =RC[-3]-0.00569-0.00478*SIN(RADIANS(125.04-1934.136*RC[-9])) -> 240.75207072622359 | Q327: =23+(26+((21.448-RC[-10]*(46.815+RC[-10]*(0.00059-RC[-10]*0.001813))))/60)/60 -> 23.436964288605893 | R327: =RC[-1]+0.00256*COS(RADIANS(125.04-1934.136*RC[-11])) -> 23.435033189880976 | S327: =DEGREES(ATAN2(COS(RADIANS(RC[-3])),COS(RADIANS(RC[-1]))*SIN(RADIANS(RC[-3])))) -> -121.39672186151101 | T327: =DEGREES(ASIN(SIN(RADIANS(RC[-2]))*SIN(RADIANS(RC[-4])))) -> -20.304329020634693 | U327: =TAN(RADIANS(RC[-3]/2))*TAN(RADIANS(RC[-3]/2)) -> 4.3018451041271097E-2 | V327: =4*DEGREES(RC[-1]*SIN(2*RADIANS(RC[-13]))-2*RC[-11]*SIN(RADIANS(RC[-12]))+4*RC[-11]*RC[-1]*SIN(RADIANS(RC[-12]))*COS(2*RADIANS(RC[-13]))-0.5*RC[-1]*RC[-1]*SIN(4*RADIANS(RC[-13]))-1.25*RC[-11]*RC[-11]*SIN(2*RADIANS(RC[-12]))) -> 13.727508983092465 | W327: =DEGREES(ACOS(COS(RADIANS(90.833))/(COS(RADIANS(R2C2))*COS(RADIANS(RC[-3])))-TAN(RADIANS(R2C2))*TAN(RADIANS(RC[-3])))) -> 13.775540307885397 | X327: =(720-4*R3C2-RC[-2]+R4C2*60)/1440 -> 1899-12-31T13:42:16.349 | Y327: =(RC[-1]*1440-RC[-2]*4)/1440 -> 1899-12-31T12:47:10.220 | Z327: =(RC[-2]*1440+RC[-3]*4)/1440 -> 1899-12-31T14:37:22.479 | AA327: =8*RC[-4] -> 110.20432246308317 | AB327: =MOD(RC[-23]*1440+RC[-6]+4*R3C2-60*R4C2,1440) -> 737.72750898309243 | AC327: =IF(RC[-1]/4<0,RC[-1]/4+180,RC[-1]/4-180) -> 4.4318772457731086 | AD327: =DEGREES(ACOS(SIN(RADIANS(R2C2))*SIN(RADIANS(RC[-10]))+COS(RADIANS(R2C2))*COS(RADIANS(RC[-10]))*COS(RADIANS(RC[-1])))) -> 90.35928368066277 | AE327: =90-RC[-1] -> -0.35928368066277017 | AF327: =IF(RC[-1]>85,0,IF(RC[-1]>5,58.1/TAN(RADIANS(RC[-1]))-0.07/POWER(TAN(RADIANS(RC[-1])),3)+0.000086/POWER(TAN(RADIANS(RC[-1])),5),IF(RC[-1]>-0.575,1735+RC[-1]*(-518.2+RC[-1]*(103.4+RC[-1]*(-12.79+RC[-1]*0.711))),-20.772/TAN(RADIANS(RC[-1])))))/3600 -> 0.53753699732857585 | AG327: =RC[-2]+RC[-1] -> 0.17825331666580568 | AH327: =IF(RC[-5]>0,MOD(DEGREES(ACOS(((SIN(RADIANS(R2C2))*COS(RADIANS(RC[-4])))-SIN(RADIANS(RC[-14])))/(COS(RADIANS(R2C2))*SIN(RADIANS(RC[-4])))))+180,360),MOD(540-DEGREES(ACOS(((SIN(RADIANS(R2C2))*COS(RADIANS(RC[-4])))-SIN(RADIANS(RC[-14])))/(COS(RADIANS(R2C2))*SIN(RADIANS(RC[-4]))))),360)) -> 184.15607417137173
D328: =R[-1]C+1 -> 2017-11-23T00:00:00.000 | E328: =R5C2 -> 1899-12-31T14:00:00.000 | F328: =RC[-2]+2415018.5+RC[-1]-R4C2/24 -> 2458081.375 | G328: =(RC[-1]-2451545)/36525 -> 0.1789561943874059 | I328: =MOD(280.46646+RC[-2]*(36000.76983 + RC[-2]*0.0003032),360) -> 243.02723350381348 | J328: =357.52911+RC[-3]*(35999.05029 - 0.0001537*RC[-3]) -> 6799.7821465369498 | K328: =0.016708634-RC[-4]*(0.000042037+0.0000001267*RC[-4]) -> 1.6701107160848556E-2 | L328: =SIN(RADIANS(RC[-2]))*(1.914602-RC[-5]*(0.004817+0.000014*RC[-5]))+SIN(RADIANS(2*RC[-2]))*(0.019993-0.000101*RC[-5])+SIN(RADIANS(3*RC[-2]))*0.000289 -> -1.2556391818936925 | M328: =RC[-4]+RC[-1] -> 241.77159432191979 | N328: =RC[-4]+RC[-2] -> 6798.5265073550563 | O328: =(1.000001018*(1-RC[-4]*RC[-4]))/(1+RC[-4]*COS(RADIANS(RC[-1]))) -> 0.98736666979708476 | P328: =RC[-3]-0.00569-0.00478*SIN(RADIANS(125.04-1934.136*RC[-9])) -> 241.76276297250268 | Q328: =23+(26+((21.448-RC[-10]*(46.815+RC[-10]*(0.00059-RC[-10]*0.001813))))/60)/60 -> 23.436963932570933 | R328: =RC[-1]+0.00256*COS(RADIANS(125.04-1934.136*RC[-11])) -> 23.435034387921718 | S328: =DEGREES(ATAN2(COS(RADIANS(RC[-3])),COS(RADIANS(RC[-1]))*SIN(RADIANS(RC[-3])))) -> -120.34103403806775 | T328: =DEGREES(ASIN(SIN(RADIANS(RC[-2]))*SIN(RADIANS(RC[-4])))) -> -20.510564924269516 | U328: =TAN(RADIANS(RC[-3]/2))*TAN(RADIANS(RC[-3]/2)) -> 4.301845556470598E-2 | V328: =4*DEGREES(RC[-1]*SIN(2*RADIANS(RC[-13]))-2*RC[-11]*SIN(RADIANS(RC[-12]))+4*RC[-11]*RC[-1]*SIN(RADIANS(RC[-12]))*COS(2*RADIANS(RC[-13]))-0.5*RC[-1]*RC[-1]*SIN(4*RADIANS(RC[-13]))-1.25*RC[-11]*RC[-11]*SIN(2*RADIANS(RC[-12]))) -> 13.444515227069404 | W328: =DEGREES(ACOS(COS(RADIANS(90.833))/(COS(RADIANS(R2C2))*COS(RADIANS(RC[-3])))-TAN(RADIANS(R2C2))*TAN(RADIANS(RC[-3])))) -> 10.755122545770401 | X328: =(720-4*R3C2-RC[-2]+R4C2*60)/1440 -> 1899-12-31T13:42:33.329 | Y328: =(RC[-1]*1440-RC[-2]*4)/1440 -> 1899-12-31T12:59:32.100 | Z328: =(RC[-2]*1440+RC[-3]*4)/1440 -> 1899-12-31T14:25:34.558 | AA328: =8*RC[-4] -> 86.040980366163211 | AB328: =MOD(RC[-23]*1440+RC[-6]+4*R3C2-60*R4C2,1440) -> 737.44451522706936 | AC328: =IF(RC[-1]/4<0,RC[-1]/4+180,RC[-1]/4-180) -> 4.3611288067673399 | AD328: =DEGREES(ACOS(SIN(RADIANS(R2C2))*SIN(RADIANS(RC[-10]))+COS(RADIANS(R2C2))*COS(RADIANS(RC[-10]))*COS(RADIANS(RC[-1])))) -> 90.563710115181308 | AE328: =90-RC[-1] -> -0.56371011518130842 | AF328: =IF(RC[-1]>85,0,IF(RC[-1]>5,58.1/TAN(RADIANS(RC[-1]))-0.07/POWER(TAN(RADIANS(RC[-1])),3)+0.000086/POWER(TAN(RADIANS(RC[-1])),5),IF(RC[-1]>-0.575,1735+RC[-1]*(-518.2+RC[-1]*(103.4+RC[-1]*(-12.79+RC[-1]*0.711))),-20.772/TAN(RADIANS(RC[-1])))))/3600 -> 0.57287076917930391 | AG328: =RC[-2]+RC[-1] -> 9.1606539979954826E-3 | AH328: =IF(RC[-5]>0,MOD(DEGREES(ACOS(((SIN(RADIANS(R2C2))*COS(RADIANS(RC[-4])))-SIN(RADIANS(RC[-14])))/(COS(RADIANS(R2C2))*SIN(RADIANS(RC[-4])))))+180,360),MOD(540-DEGREES(ACOS(((SIN(RADIANS(R2C2))*COS(RADIANS(RC[-4])))-SIN(RADIANS(RC[-14])))/(COS(RADIANS(R2C2))*SIN(RADIANS(RC[-4]))))),360)) -> 184.08437920612329
D329: =R[-1]C+1 -> 2017-11-24T00:00:00.000 | E329: =R5C2 -> 1899-12-31T14:00:00.000 | F329: =RC[-2]+2415018.5+RC[-1]-R4C2/24 -> 2458082.375 | G329: =(RC[-1]-2451545)/36525 -> 0.17898357289527722 | I329: =MOD(280.46646+RC[-2]*(36000.76983 + RC[-2]*0.0003032),360) -> 244.01288086694876 | J329: =357.52911+RC[-3]*(35999.05029 - 0.0001537*RC[-3]) -> 6800.7677468171678 | K329: =0.016708634-RC[-4]*(0.000042037+0.0000001267*RC[-4]) -> 1.6701106008696578E-2 | L329: =SIN(RADIANS(RC[-2]))*(1.914602-RC[-5]*(0.004817+0.000014*RC[-5]))+SIN(RADIANS(2*RC[-2]))*(0.019993-0.000101*RC[-5])+SIN(RADIANS(3*RC[-2]))*0.000289 -> -1.2302013549217201 | M329: =RC[-4]+RC[-1] -> 242.78267951202704 | N329: =RC[-4]+RC[-2] -> 6799.5375454622463 | O329: =(1.000001018*(1-RC[-4]*RC[-4]))/(1+RC[-4]*COS(RADIANS(RC[-1]))) -> 0.98717828722095069 | P329: =RC[-3]-0.00569-0.00478*SIN(RADIANS(125.04-1934.136*RC[-9])) -> 242.77384483416151 | Q329: =23+(26+((21.448-RC[-10]*(46.815+RC[-10]*(0.00059-RC[-10]*0.001813))))/60)/60 -> 23.43696357653597 | R329: =RC[-1]+0.00256*COS(RADIANS(125.04-1934.136*RC[-11])) -> 23.435035587610631 | S329: =DEGREES(ATAN2(COS(RADIANS(RC[-3])),COS(RADIANS(RC[-1]))*SIN(RADIANS(RC[-3])))) -> -119.28213511251441 | T329: =DEGREES(ASIN(SIN(RADIANS(RC[-2]))*SIN(RADIANS(RC[-4])))) -> -20.710476437501896 | U329: =TAN(RADIANS(RC[-3]/2))*TAN(RADIANS(RC[-3]/2)) -> 4.3018460094364122E-2 | V329: =4*DEGREES(RC[-1]*SIN(2*RADIANS(RC[-13]))-2*RC[-11]*SIN(RADIANS(RC[-12]))+4*RC[-11]*RC[-1]*SIN(RADIANS(RC[-12]))*COS(2*RADIANS(RC[-13]))-0.5*RC[-1]*RC[-1]*SIN(4*RADIANS(RC[-13]))-1.25*RC[-11]*RC[-11]*SIN(2*RADIANS(RC[-12]))) -> 13.148724650797178 | W329: =DEGREES(ACOS(COS(RADIANS(90.833))/(COS(RADIANS(R2C2))*COS(RADIANS(RC[-3])))-TAN(RADIANS(R2C2))*TAN(RADIANS(RC[-3])))) -> 6.6280966395687315 | X329: =(720-4*R3C2-RC[-2]+R4C2*60)/1440 -> 1899-12-31T13:42:51.077 | Y329: =(RC[-1]*1440-RC[-2]*4)/1440 -> 1899-12-31T13:16:20.333 | Z329: =(RC[-2]*1440+RC[-3]*4)/1440 -> 1899-12-31T14:09:21.820 | AA329: =8*RC[-4] -> 53.024773116549852 | AB329: =MOD(RC[-23]*1440+RC[-6]+4*R3C2-60*R4C2,1440) -> 737.14872465079713 | AC329: =IF(RC[-1]/4<0,RC[-1]/4+180,RC[-1]/4-180) -> 4.2871811626992837 | AD329: =DEGREES(ACOS(SIN(RADIANS(R2C2))*SIN(RADIANS(RC[-10]))+COS(RADIANS(R2C2))*COS(RADIANS(RC[-10]))*COS(RADIANS(RC[-1])))) -> 90.761770103787242 | AE329: =90-RC[-1] -> -0.76177010378724219 | AF329: =IF(RC[-1]>85,0,IF(RC[-1]>5,58.1/TAN(RADIANS(RC[-1]))-0.07/POWER(TAN(RADIANS(RC[-1])),3)+0.000086/POWER(TAN(RADIANS(RC[-1])),5),IF(RC[-1]>-0.575,1735+RC[-1]*(-518.2+RC[-1]*(103.4+RC[-1]*(-12.79+RC[-1]*0.711))),-20.772/TAN(RADIANS(RC[-1])))))/3600 -> 0.43395923038862483 | AG329: =RC[-2]+RC[-1] -> -0.32781087339861736 | AH329: =IF(RC[-5]>0,MOD(DEGREES(ACOS(((SIN(RADIANS(R2C2))*COS(RADIANS(RC[-4])))-SIN(RADIANS(RC[-14])))/(COS(RADIANS(R2C2))*SIN(RADIANS(RC[-4])))))+180,360),MOD(540-DEGREES(ACOS(((SIN(RADIANS(R2C2))*COS(RADIANS(RC[-4])))-SIN(RADIANS(RC[-14])))/(COS(RADIANS(R2C2))*SIN(RADIANS(RC[-4]))))),360)) -> 184.01002696597348
D330: =R[-1]C+1 -> 2017-11-25T00:00:00.000 | E330: =R5C2 -> 1899-12-31T14:00:00.000 | F330: =RC[-2]+2415018.5+RC[-1]-R4C2/24 -> 2458083.375 | G330: =(RC[-1]-2451545)/36525 -> 0.17901095140314852 | I330: =MOD(280.46646+RC[-2]*(36000.76983 + RC[-2]*0.0003032),360) -> 244.99852823008405 | J330: =357.52911+RC[-3]*(35999.05029 - 0.0001537*RC[-3]) -> 6801.7533470973858 | K330: =0.016708634-RC[-4]*(0.000042037+0.0000001267*RC[-4]) -> 1.670110485654441E-2 | L330: =SIN(RADIANS(RC[-2]))*(1.914602-RC[-5]*(0.004817+0.000014*RC[-5]))+SIN(RADIANS(2*RC[-2]))*(0.019993-0.000101*RC[-5])+SIN(RADIANS(3*RC[-2]))*0.000289 -> -1.2043815368496977 | M330: =RC[-4]+RC[-1] -> 243.79414669323435 | N330: =RC[-4]+RC[-2] -> 6800.5489655605361 | O330: =(1.000001018*(1-RC[-4]*RC[-4]))/(1+RC[-4]*COS(RADIANS(RC[-1]))) -> 0.98699376291513607 | P330: =RC[-3]-0.00569-0.00478*SIN(RADIANS(125.04-1934.136*RC[-9])) -> 243.7853086896065 | Q330: =23+(26+((21.448-RC[-10]*(46.815+RC[-10]*(0.00059-RC[-10]*0.001813))))/60)/60 -> 23.43696322050101 | R330: =RC[-1]+0.00256*COS(RADIANS(125.04-1934.136*RC[-11])) -> 23.435036788946391 | S330: =DEGREES(ATAN2(COS(RADIANS(RC[-3])),COS(RADIANS(RC[-1]))*SIN(RADIANS(RC[-3])))) -> -118.22008279983989 | T330: =DEGREES(ASIN(SIN(RADIANS(RC[-2]))*SIN(RADIANS(RC[-4])))) -> -20.903969478842697 | U330: =TAN(RADIANS(RC[-3]/2))*TAN(RADIANS(RC[-3]/2)) -> 4.3018464630240491E-2 | V330: =4*DEGREES(RC[-1]*SIN(2*RADIANS(RC[-13]))-2*RC[-11]*SIN(RADIANS(RC[-12]))+4*RC[-11]*RC[-1]*SIN(RADIANS(RC[-12]))*COS(2*RADIANS(RC[-13]))-0.5*RC[-1]*RC[-1]*SIN(4*RADIANS(RC[-13]))-1.25*RC[-11]*RC[-11]*SIN(2*RADIANS(RC[-12]))) -> 12.840386961980712 | W330: =DEGREES(ACOS(COS(RADIANS(90.833))/(COS(RADIANS(R2C2))*COS(RADIANS(RC[-3])))-TAN(RADIANS(R2C2))*TAN(RADIANS(RC[-3])))) -> #NUM! | X330: =(720-4*R3C2-RC[-2]+R4C2*60)/1440 -> 1899-12-31T13:43:09.577 | Y330: =(RC[-1]*1440-RC[-2]*4)/1440 -> #NUM! | Z330: =(RC[-2]*1440+RC[-3]*4)/1440 -> #NUM! | AA330: =8*RC[-4] -> #NUM! | AB330: =MOD(RC[-23]*1440+RC[-6]+4*R3C2-60*R4C2,1440) -> 736.8403869619807 | AC330: =IF(RC[-1]/4<0,RC[-1]/4+180,RC[-1]/4-180) -> 4.2100967404951746 | AD330: =DEGREES(ACOS(SIN(RADIANS(R2C2))*SIN(RADIANS(RC[-10]))+COS(RADIANS(R2C2))*COS(RADIANS(RC[-10]))*COS(RADIANS(RC[-1])))) -> 90.953374979636465 | AE330: =90-RC[-1] -> -0.95337497963646456 | AF330: =IF(RC[-1]>85,0,IF(RC[-1]>5,58.1/TAN(RADIANS(RC[-1]))-0.07/POWER(TAN(RADIANS(RC[-1])),3)+0.000086/POWER(TAN(RADIANS(RC[-1])),5),IF(RC[-1]>-0.575,1735+RC[-1]*(-518.2+RC[-1]*(103.4+RC[-1]*(-12.79+RC[-1]*0.711))),-20.772/TAN(RADIANS(RC[-1])))))/3600 -> 0.346732548135122 | AG330: =RC[-2]+RC[-1] -> -0.60664243150134256 | AH330: =IF(RC[-5]>0,MOD(DEGREES(ACOS(((SIN(RADIANS(R2C2))*COS(RADIANS(RC[-4])))-SIN(RADIANS(RC[-14])))/(COS(RADIANS(R2C2))*SIN(RADIANS(RC[-4])))))+180,360),MOD(540-DEGREES(ACOS(((SIN(RADIANS(R2C2))*COS(RADIANS(RC[-4])))-SIN(RADIANS(RC[-14])))/(COS(RADIANS(R2C2))*SIN(RADIANS(RC[-4]))))),360)) -> 183.93308106893519
D331: =R[-1]C+1 -> 2017-11-26T00:00:00.000 | E331: =R5C2 -> 1899-12-31T14:00:00.000 | F331: =RC[-2]+2415018.5+RC[-1]-R4C2/24 -> 2458084.375 | G331: =(RC[-1]-2451545)/36525 -> 0.17903832991101984 | I331: =MOD(280.46646+RC[-2]*(36000.76983 + RC[-2]*0.0003032),360) -> 245.98417559322115 | J331: =357.52911+RC[-3]*(35999.05029 - 0.0001537*RC[-3]) -> 6802.7389473776038 | K331: =0.016708634-RC[-4]*(0.000042037+0.0000001267*RC[-4]) -> 1.6701103704392053E-2 | L331: =SIN(RADIANS(RC[-2]))*(1.914602-RC[-5]*(0.004817+0.000014*RC[-5]))+SIN(RADIANS(2*RC[-2]))*(0.019993-0.000101*RC[-5])+SIN(RADIANS(3*RC[-2]))*0.000289 -> -1.1781874844766129 | M331: =RC[-4]+RC[-1] -> 244.80598810874454 | N331: =RC[-4]+RC[-2] -> 6801.5607598931274 | O331: =(1.000001018*(1-RC[-4]*RC[-4]))/(1+RC[-4]*COS(RADIANS(RC[-1]))) -> 0.98681315583132045 | P331: =RC[-3]-0.00569-0.00478*SIN(RADIANS(125.04-1934.136*RC[-9])) -> 244.79714678204334 | Q331: =23+(26+((21.448-RC[-10]*(46.815+RC[-10]*(0.00059-RC[-10]*0.001813))))/60)/60 -> 23.43696286446605 | R331: =RC[-1]+0.00256*COS(RADIANS(125.04-1934.136*RC[-11])) -> 23.435037991927668 | S331: =DEGREES(ATAN2(COS(RADIANS(RC[-3])),COS(RADIANS(RC[-1]))*SIN(RADIANS(RC[-3])))) -> -117.15493956363055 | T331: =DEGREES(ASIN(SIN(RADIANS(RC[-2]))*SIN(RADIANS(RC[-4])))) -> -21.090951981494516 | U331: =TAN(RADIANS(RC[-3]/2))*TAN(RADIANS(RC[-3]/2)) -> 4.3018469172330105E-2 | V331: =4*DEGREES(RC[-1]*SIN(2*RADIANS(RC[-13]))-2*RC[-11]*SIN(RADIANS(RC[-12]))+4*RC[-11]*RC[-1]*SIN(RADIANS(RC[-12]))*COS(2*RADIANS(RC[-13]))-0.5*RC[-1]*RC[-1]*SIN(4*RADIANS(RC[-13]))-1.25*RC[-11]*RC[-11]*SIN(2*RADIANS(RC[-12]))) -> 12.519770221073397 | W331: =DEGREES(ACOS(COS(RADIANS(90.833))/(COS(RADIANS(R2C2))*COS(RADIANS(RC[-3])))-TAN(RADIANS(R2C2))*TAN(RADIANS(RC[-3])))) -> #NUM! | X331: =(720-4*R3C2-RC[-2]+R4C2*60)/1440 -> 1899-12-31T13:43:28.814 | Y331: =(RC[-1]*1440-RC[-2]*4)/1440 -> #NUM! | Z331: =(RC[-2]*1440+RC[-3]*4)/1440 -> #NUM! | AA331: =8*RC[-4] -> #NUM! | AB331: =MOD(RC[-23]*1440+RC[-6]+4*R3C2-60*R4C2,1440) -> 736.51977022107337 | AC331: =IF(RC[-1]/4<0,RC[-1]/4+180,RC[-1]/4-180) -> 4.1299425552683431 | AD331: =DEGREES(ACOS(SIN(RADIANS(R2C2))*SIN(RADIANS(RC[-10]))+COS(RADIANS(R2C2))*COS(RADIANS(RC[-10]))*COS(RADIANS(RC[-1])))) -> 91.13843821376841 | AE331: =90-RC[-1] -> -1.1384382137684099 | AF331: =IF(RC[-1]>85,0,IF(RC[-1]>5,58.1/TAN(RADIANS(RC[-1]))-0.07/POWER(TAN(RADIANS(RC[-1])),3)+0.000086/POWER(TAN(RADIANS(RC[-1])),5),IF(RC[-1]>-0.575,1735+RC[-1]*(-518.2+RC[-1]*(103.4+RC[-1]*(-12.79+RC[-1]*0.711))),-20.772/TAN(RADIANS(RC[-1])))))/3600 -> 0.29035668029869749 | AG331: =RC[-2]+RC[-1] -> -0.84808153346971249 | AH331: =IF(RC[-5]>0,MOD(DEGREES(ACOS(((SIN(RADIANS(R2C2))*COS(RADIANS(RC[-4])))-SIN(RADIANS(RC[-14])))/(COS(RADIANS(R2C2))*SIN(RADIANS(RC[-4])))))+180,360),MOD(540-DEGREES(ACOS(((SIN(RADIANS(R2C2))*COS(RADIANS(RC[-4])))-SIN(RADIANS(RC[-14])))/(COS(RADIANS(R2C2))*SIN(RADIANS(RC[-4]))))),360)) -> 183.85360821608356
D332: =R[-1]C+1 -> 2017-11-27T00:00:00.000 | E332: =R5C2 -> 1899-12-31T14:00:00.000 | F332: =RC[-2]+2415018.5+RC[-1]-R4C2/24 -> 2458085.375 | G332: =(RC[-1]-2451545)/36525 -> 0.17906570841889116 | I332: =MOD(280.46646+RC[-2]*(36000.76983 + RC[-2]*0.0003032),360) -> 246.96982295635826 | J332: =357.52911+RC[-3]*(35999.05029 - 0.0001537*RC[-3]) -> 6803.7245476578209 | K332: =0.016708634-RC[-4]*(0.000042037+0.0000001267*RC[-4]) -> 1.6701102552239507E-2 | L332: =SIN(RADIANS(RC[-2]))*(1.914602-RC[-5]*(0.004817+0.000014*RC[-5]))+SIN(RADIANS(2*RC[-2]))*(0.019993-0.000101*RC[-5])+SIN(RADIANS(3*RC[-2]))*0.000289 -> -1.1516270873937831 | M332: =RC[-4]+RC[-1] -> 245.81819586896447 | N332: =RC[-4]+RC[-2] -> 6802.5729205704274 | O332: =(1.000001018*(1-RC[-4]*RC[-4]))/(1+RC[-4]*COS(RADIANS(RC[-1]))) -> 0.98663652373293087 | P332: =RC[-3]-0.00569-0.00478*SIN(RADIANS(125.04-1934.136*RC[-9])) -> 245.80935122188168 | Q332: =23+(26+((21.448-RC[-10]*(46.815+RC[-10]*(0.00059-RC[-10]*0.001813))))/60)/60 -> 23.43696250843109 | R332: =RC[-1]+0.00256*COS(RADIANS(125.04-1934.136*RC[-11])) -> 23.435039196553131 | S332: =DEGREES(ATAN2(COS(RADIANS(RC[-3])),COS(RADIANS(RC[-1]))*SIN(RADIANS(RC[-3])))) -> -116.08677259533303 | T332: =DEGREES(ASIN(SIN(RADIANS(RC[-2]))*SIN(RADIANS(RC[-4])))) -> -21.271334009788742 | U332: =TAN(RADIANS(RC[-3]/2))*TAN(RADIANS(RC[-3]/2)) -> 4.3018473720627906E-2 | V332: =4*DEGREES(RC[-1]*SIN(2*RADIANS(RC[-13]))-2*RC[-11]*SIN(RADIANS(RC[-12]))+4*RC[-11]*RC[-1]*SIN(RADIANS(RC[-12]))*COS(2*RADIANS(RC[-13]))-0.5*RC[-1]*RC[-1]*SIN(4*RADIANS(RC[-13]))-1.25*RC[-11]*RC[-11]*SIN(2*RADIANS(RC[-12]))) -> 12.18716060007419 | W332: =DEGREES(ACOS(COS(RADIANS(90.833))/(COS(RADIANS(R2C2))*COS(RADIANS(RC[-3])))-TAN(RADIANS(R2C2))*TAN(RADIANS(RC[-3])))) -> #NUM! | X332: =(720-4*R3C2-RC[-2]+R4C2*60)/1440 -> 1899-12-31T13:43:48.770 | Y332: =(RC[-1]*1440-RC[-2]*4)/1440 -> #NUM! | Z332: =(RC[-2]*1440+RC[-3]*4)/1440 -> #NUM! | AA332: =8*RC[-4] -> #NUM! | AB332: =MOD(RC[-23]*1440+RC[-6]+4*R3C2-60*R4C2,1440) -> 736.18716060007421 | AC332: =IF(RC[-1]/4<0,RC[-1]/4+180,RC[-1]/4-180) -> 4.0467901500185519 | AD332: =DEGREES(ACOS(SIN(RADIANS(R2C2))*SIN(RADIANS(RC[-10]))+COS(RADIANS(R2C2))*COS(RADIANS(RC[-10]))*COS(RADIANS(RC[-1])))) -> 91.316875509909011 | AE332: =90-RC[-1] -> -1.3168755099090106 | AF332: =IF(RC[-1]>85,0,IF(RC[-1]>5,58.1/TAN(RADIANS(RC[-1]))-0.07/POWER(TAN(RADIANS(RC[-1])),3)+0.000086/POWER(TAN(RADIANS(RC[-1])),5),IF(RC[-1]>-0.575,1735+RC[-1]*(-518.2+RC[-1]*(103.4+RC[-1]*(-12.79+RC[-1]*0.711))),-20.772/TAN(RADIANS(RC[-1])))))/3600 -> 0.25100203479157912 | AG332: =RC[-2]+RC[-1] -> -1.0658734751174315 | AH332: =IF(RC[-5]>0,MOD(DEGREES(ACOS(((SIN(RADIANS(R2C2))*COS(RADIANS(RC[-4])))-SIN(RADIANS(RC[-14])))/(COS(RADIANS(R2C2))*SIN(RADIANS(RC[-4])))))+180,360),MOD(540-DEGREES(ACOS(((SIN(RADIANS(R2C2))*COS(RADIANS(RC[-4])))-SIN(RADIANS(RC[-14])))/(COS(RADIANS(R2C2))*SIN(RADIANS(RC[-4]))))),360)) -> 183.77167811676159
D333: =R[-1]C+1 -> 2017-11-28T00:00:00.000 | E333: =R5C2 -> 1899-12-31T14:00:00.000 | F333: =RC[-2]+2415018.5+RC[-1]-R4C2/24 -> 2458086.375 | G333: =(RC[-1]-2451545)/36525 -> 0.17909308692676248 | I333: =MOD(280.46646+RC[-2]*(36000.76983 + RC[-2]*0.0003032),360) -> 247.95547031949536 | J333: =357.52911+RC[-3]*(35999.05029 - 0.0001537*RC[-3]) -> 6804.7101479380399 | K333: =0.016708634-RC[-4]*(0.000042037+0.0000001267*RC[-4]) -> 1.6701101400086769E-2 | L333: =SIN(RADIANS(RC[-2]))*(1.914602-RC[-5]*(0.004817+0.000014*RC[-5]))+SIN(RADIANS(2*RC[-2]))*(0.019993-0.000101*RC[-5])+SIN(RADIANS(3*RC[-2]))*0.000289 -> -1.1247083655066428 | M333: =RC[-4]+RC[-1] -> 246.83076195398871 | N333: =RC[-4]+RC[-2] -> 6803.5854395725337 | O333: =(1.000001018*(1-RC[-4]*RC[-4]))/(1+RC[-4]*COS(RADIANS(RC[-1]))) -> 0.98646392317263154 | P333: =RC[-3]-0.00569-0.00478*SIN(RADIANS(125.04-1934.136*RC[-9])) -> 246.82191398921898 | Q333: =23+(26+((21.448-RC[-10]*(46.815+RC[-10]*(0.00059-RC[-10]*0.001813))))/60)/60 -> 23.436962152396131 | R333: =RC[-1]+0.00256*COS(RADIANS(125.04-1934.136*RC[-11])) -> 23.435040402821439 | S333: =DEGREES(ATAN2(COS(RADIANS(RC[-3])),COS(RADIANS(RC[-1]))*SIN(RADIANS(RC[-3])))) -> -115.01565378168996 | T333: =DEGREES(ASIN(SIN(RADIANS(RC[-2]))*SIN(RADIANS(RC[-4])))) -> -21.445027875888812 | U333: =TAN(RADIANS(RC[-3]/2))*TAN(RADIANS(RC[-3]/2)) -> 4.301847827512887E-2 | V333: =4*DEGREES(RC[-1]*SIN(2*RADIANS(RC[-13]))-2*RC[-11]*SIN(RADIANS(RC[-12]))+4*RC[-11]*RC[-1]*SIN(RADIANS(RC[-12]))*COS(2*RADIANS(RC[-13]))-0.5*RC[-1]*RC[-1]*SIN(4*RADIANS(RC[-13]))-1.25*RC[-11]*RC[-11]*SIN(2*RADIANS(RC[-12]))) -> 11.842862100189908 | W333: =DEGREES(ACOS(COS(RADIANS(90.833))/(COS(RADIANS(R2C2))*COS(RADIANS(RC[-3])))-TAN(RADIANS(R2C2))*TAN(RADIANS(RC[-3])))) -> #NUM! | X333: =(720-4*R3C2-RC[-2]+R4C2*60)/1440 -> 1899-12-31T13:44:09.428 | Y333: =(RC[-1]*1440-RC[-2]*4)/1440 -> #NUM! | Z333: =(RC[-2]*1440+RC[-3]*4)/1440 -> #NUM! | AA333: =8*RC[-4] -> #NUM! | AB333: =MOD(RC[-23]*1440+RC[-6]+4*R3C2-60*R4C2,1440) -> 735.8428621001899 | AC333: =IF(RC[-1]/4<0,RC[-1]/4+180,RC[-1]/4-180) -> 3.9607155250474761 | AD333: =DEGREES(ACOS(SIN(RADIANS(R2C2))*SIN(RADIANS(RC[-10]))+COS(RADIANS(R2C2))*COS(RADIANS(RC[-10]))*COS(RADIANS(RC[-1])))) -> 91.488604898906672 | AE333: =90-RC[-1] -> -1.4886048989066722 | AF333: =IF(RC[-1]>85,0,IF(RC[-1]>5,58.1/TAN(RADIANS(RC[-1]))-0.07/POWER(TAN(RADIANS(RC[-1])),3)+0.000086/POWER(TAN(RADIANS(RC[-1])),5),IF(RC[-1]>-0.575,1735+RC[-1]*(-518.2+RC[-1]*(103.4+RC[-1]*(-12.79+RC[-1]*0.711))),-20.772/TAN(RADIANS(RC[-1])))))/3600 -> 0.22203491252293922 | AG333: =RC[-2]+RC[-1] -> -1.266569986383733 | AH333: =IF(RC[-5]>0,MOD(DEGREES(ACOS(((SIN(RADIANS(R2C2))*COS(RADIANS(RC[-4])))-SIN(RADIANS(RC[-14])))/(COS(RADIANS(R2C2))*SIN(RADIANS(RC[-4])))))+180,360),MOD(540-DEGREES(ACOS(((SIN(RADIANS(R2C2))*COS(RADIANS(RC[-4])))-SIN(RADIANS(RC[-14])))/(COS(RADIANS(R2C2))*SIN(RADIANS(RC[-4]))))),360)) -> 183.68736340873119
D334: =R[-1]C+1 -> 2017-11-29T00:00:00.000 | E334: =R5C2 -> 1899-12-31T14:00:00.000 | F334: =RC[-2]+2415018.5+RC[-1]-R4C2/24 -> 2458087.375 | G334: =(RC[-1]-2451545)/36525 -> 0.17912046543463381 | I334: =MOD(280.46646+RC[-2]*(36000.76983 + RC[-2]*0.0003032),360) -> 248.94111768263338 | J334: =357.52911+RC[-3]*(35999.05029 - 0.0001537*RC[-3]) -> 6805.6957482182579 | K334: =0.016708634-RC[-4]*(0.000042037+0.0000001267*RC[-4]) -> 1.6701100247933844E-2 | L334: =SIN(RADIANS(RC[-2]))*(1.914602-RC[-5]*(0.004817+0.000014*RC[-5]))+SIN(RADIANS(2*RC[-2]))*(0.019993-0.000101*RC[-5])+SIN(RADIANS(3*RC[-2]))*0.000289 -> -1.0974394664898619 | M334: =RC[-4]+RC[-1] -> 247.8436782161435 | N334: =RC[-4]+RC[-2] -> 6804.5983087517679 | O334: =(1.000001018*(1-RC[-4]*RC[-4]))/(1+RC[-4]*COS(RADIANS(RC[-1]))) -> 0.98629540947020489 | P334: =RC[-3]-0.00569-0.00478*SIN(RADIANS(125.04-1934.136*RC[-9])) -> 247.8348269363843 | Q334: =23+(26+((21.448-RC[-10]*(46.815+RC[-10]*(0.00059-RC[-10]*0.001813))))/60)/60 -> 23.436961796361171 | R334: =RC[-1]+0.00256*COS(RADIANS(125.04-1934.136*RC[-11])) -> 23.435041610731265 | S334: =DEGREES(ATAN2(COS(RADIANS(RC[-3])),COS(RADIANS(RC[-1]))*SIN(RADIANS(RC[-3])))) -> -113.94165966002213 | T334: =DEGREES(ASIN(SIN(RADIANS(RC[-2]))*SIN(RADIANS(RC[-4])))) -> -21.611948256418348 | U334: =TAN(RADIANS(RC[-3]/2))*TAN(RADIANS(RC[-3]/2)) -> 4.3018482835827959E-2 | V334: =4*DEGREES(RC[-1]*SIN(2*RADIANS(RC[-13]))-2*RC[-11]*SIN(RADIANS(RC[-12]))+4*RC[-11]*RC[-1]*SIN(RADIANS(RC[-12]))*COS(2*RADIANS(RC[-13]))-0.5*RC[-1]*RC[-1]*SIN(4*RADIANS(RC[-13]))-1.25*RC[-11]*RC[-11]*SIN(2*RADIANS(RC[-12]))) -> 11.487196228542382 | W334: =DEGREES(ACOS(COS(RADIANS(90.833))/(COS(RADIANS(R2C2))*COS(RADIANS(RC[-3])))-TAN(RADIANS(R2C2))*TAN(RADIANS(RC[-3])))) -> #NUM! | X334: =(720-4*R3C2-RC[-2]+R4C2*60)/1440 -> 1899-12-31T13:44:30.768 | Y334: =(RC[-1]*1440-RC[-2]*4)/1440 -> #NUM! | Z334: =(RC[-2]*1440+RC[-3]*4)/1440 -> #NUM! | AA334: =8*RC[-4] -> #NUM! | AB334: =MOD(RC[-23]*1440+RC[-6]+4*R3C2-60*R4C2,1440) -> 735.48719622854242 | AC334: =IF(RC[-1]/4<0,RC[-1]/4+180,RC[-1]/4-180) -> 3.871799057135604 | AD334: =DEGREES(ACOS(SIN(RADIANS(R2C2))*SIN(RADIANS(RC[-10]))+COS(RADIANS(R2C2))*COS(RADIANS(RC[-10]))*COS(RADIANS(RC[-1])))) -> 91.653546832568907 | AE334: =90-RC[-1] -> -1.6535468325689067 | AF334: =IF(RC[-1]>85,0,IF(RC[-1]>5,58.1/TAN(RADIANS(RC[-1]))-0.07/POWER(TAN(RADIANS(RC[-1])),3)+0.000086/POWER(TAN(RADIANS(RC[-1])),5),IF(RC[-1]>-0.575,1735+RC[-1]*(-518.2+RC[-1]*(103.4+RC[-1]*(-12.79+RC[-1]*0.711))),-20.772/TAN(RADIANS(RC[-1])))))/3600 -> 0.19987632198754596 | AG334: =RC[-2]+RC[-1] -> -1.4536705105813608 | AH334: =IF(RC[-5]>0,MOD(DEGREES(ACOS(((SIN(RADIANS(R2C2))*COS(RADIANS(RC[-4])))-SIN(RADIANS(RC[-14])))/(COS(RADIANS(R2C2))*SIN(RADIANS(RC[-4])))))+180,360),MOD(540-DEGREES(ACOS(((SIN(RADIANS(R2C2))*COS(RADIANS(RC[-4])))-SIN(RADIANS(RC[-14])))/(COS(RADIANS(R2C2))*SIN(RADIANS(RC[-4]))))),360)) -> 183.60073957349263
D335: =R[-1]C+1 -> 2017-11-30T00:00:00.000 | E335: =R5C2 -> 1899-12-31T14:00:00.000 | F335: =RC[-2]+2415018.5+RC[-1]-R4C2/24 -> 2458088.375 | G335: =(RC[-1]-2451545)/36525 -> 0.17914784394250513 | I335: =MOD(280.46646+RC[-2]*(36000.76983 + RC[-2]*0.0003032),360) -> 249.9267650457723 | J335: =357.52911+RC[-3]*(35999.05029 - 0.0001537*RC[-3]) -> 6806.6813484984741 | K335: =0.016708634-RC[-4]*(0.000042037+0.0000001267*RC[-4]) -> 1.6701099095780724E-2 | L335: =SIN(RADIANS(RC[-2]))*(1.914602-RC[-5]*(0.004817+0.000014*RC[-5]))+SIN(RADIANS(2*RC[-2]))*(0.019993-0.000101*RC[-5])+SIN(RADIANS(3*RC[-2]))*0.000289 -> -1.0698286631759852 | M335: =RC[-4]+RC[-1] -> 248.8569363825963 | N335: =RC[-4]+RC[-2] -> 6805.6115198352982 | O335: =(1.000001018*(1-RC[-4]*RC[-4]))/(1+RC[-4]*COS(RADIANS(RC[-1]))) -> 0.98613103669083624 | P335: =RC[-3]-0.00569-0.00478*SIN(RADIANS(125.04-1934.136*RC[-9])) -> 248.84808179054792 | Q335: =23+(26+((21.448-RC[-10]*(46.815+RC[-10]*(0.00059-RC[-10]*0.001813))))/60)/60 -> 23.436961440326211 | R335: =RC[-1]+0.00256*COS(RADIANS(125.04-1934.136*RC[-11])) -> 23.435042820281272 | S335: =DEGREES(ATAN2(COS(RADIANS(RC[-3])),COS(RADIANS(RC[-1]))*SIN(RADIANS(RC[-3])))) -> -112.86487136105305 | T335: =DEGREES(ASIN(SIN(RADIANS(RC[-2]))*SIN(RADIANS(RC[-4])))) -> -21.772012308664625 | U335: =TAN(RADIANS(RC[-3]/2))*TAN(RADIANS(RC[-3]/2)) -> 4.3018487402720129E-2 | V335: =4*DEGREES(RC[-1]*SIN(2*RADIANS(RC[-13]))-2*RC[-11]*SIN(RADIANS(RC[-12]))+4*RC[-11]*RC[-1]*SIN(RADIANS(RC[-12]))*COS(2*RADIANS(RC[-13]))-0.5*RC[-1]*RC[-1]*SIN(4*RADIANS(RC[-13]))-1.25*RC[-11]*RC[-11]*SIN(2*RADIANS(RC[-12]))) -> 11.120501634227741 | W335: =DEGREES(ACOS(COS(RADIANS(90.833))/(COS(RADIANS(R2C2))*COS(RADIANS(RC[-3])))-TAN(RADIANS(R2C2))*TAN(RADIANS(RC[-3])))) -> #NUM! | X335: =(720-4*R3C2-RC[-2]+R4C2*60)/1440 -> 1899-12-31T13:44:52.770 | Y335: =(RC[-1]*1440-RC[-2]*4)/1440 -> #NUM! | Z335: =(RC[-2]*1440+RC[-3]*4)/1440 -> #NUM! | AA335: =8*RC[-4] -> #NUM! | AB335: =MOD(RC[-23]*1440+RC[-6]+4*R3C2-60*R4C2,1440) -> 735.12050163422771 | AC335: =IF(RC[-1]/4<0,RC[-1]/4+180,RC[-1]/4-180) -> 3.7801254085569269 | AD335: =DEGREES(ACOS(SIN(RADIANS(R2C2))*SIN(RADIANS(RC[-10]))+COS(RADIANS(R2C2))*COS(RADIANS(RC[-10]))*COS(RADIANS(RC[-1])))) -> 91.811624276662954 | AE335: =90-RC[-1] -> -1.811624276662954 | AF335: =IF(RC[-1]>85,0,IF(RC[-1]>5,58.1/TAN(RADIANS(RC[-1]))-0.07/POWER(TAN(RADIANS(RC[-1])),3)+0.000086/POWER(TAN(RADIANS(RC[-1])),5),IF(RC[-1]>-0.575,1735+RC[-1]*(-518.2+RC[-1]*(103.4+RC[-1]*(-12.79+RC[-1]*0.711))),-20.772/TAN(RADIANS(RC[-1])))))/3600 -> 0.1824255026145874 | AG335: =RC[-2]+RC[-1] -> -1.6291987740483667 | AH335: =IF(RC[-5]>0,MOD(DEGREES(ACOS(((SIN(RADIANS(R2C2))*COS(RADIANS(RC[-4])))-SIN(RADIANS(RC[-14])))/(COS(RADIANS(R2C2))*SIN(RADIANS(RC[-4])))))+180,360),MOD(540-DEGREES(ACOS(((SIN(RADIANS(R2C2))*COS(RADIANS(RC[-4])))-SIN(RADIANS(RC[-14])))/(COS(RADIANS(R2C2))*SIN(RADIANS(RC[-4]))))),360)) -> 183.51188484697673
D336: =R[-1]C+1 -> 2017-12-01T00:00:00.000 | E336: =R5C2 -> 1899-12-31T14:00:00.000 | F336: =RC[-2]+2415018.5+RC[-1]-R4C2/24 -> 2458089.375 | G336: =(RC[-1]-2451545)/36525 -> 0.17917522245037645 | I336: =MOD(280.46646+RC[-2]*(36000.76983 + RC[-2]*0.0003032),360) -> 250.91241240891122 | J336: =357.52911+RC[-3]*(35999.05029 - 0.0001537*RC[-3]) -> 6807.6669487786912 | K336: =0.016708634-RC[-4]*(0.000042037+0.0000001267*RC[-4]) -> 1.6701097943627417E-2 | L336: =SIN(RADIANS(RC[-2]))*(1.914602-RC[-5]*(0.004817+0.000014*RC[-5]))+SIN(RADIANS(2*RC[-2]))*(0.019993-0.000101*RC[-5])+SIN(RADIANS(3*RC[-2]))*0.000289 -> -1.0418843508790727 | M336: =RC[-4]+RC[-1] -> 249.87052805803216 | N336: =RC[-4]+RC[-2] -> 6806.6250644278125 | O336: =(1.000001018*(1-RC[-4]*RC[-4]))/(1+RC[-4]*COS(RADIANS(RC[-1]))) -> 0.98597085762381831 | P336: =RC[-3]-0.00569-0.00478*SIN(RADIANS(125.04-1934.136*RC[-9])) -> 249.86167015639774 | Q336: =23+(26+((21.448-RC[-10]*(46.815+RC[-10]*(0.00059-RC[-10]*0.001813))))/60)/60 -> 23.436961084291251 | R336: =RC[-1]+0.00256*COS(RADIANS(125.04-1934.136*RC[-11])) -> 23.43504403147012 | S336: =DEGREES(ATAN2(COS(RADIANS(RC[-3])),COS(RADIANS(RC[-1]))*SIN(RADIANS(RC[-3])))) -> -111.78537453902797 | T336: =DEGREES(ASIN(SIN(RADIANS(RC[-2]))*SIN(RADIANS(RC[-4])))) -> -21.925139785995302 | U336: =TAN(RADIANS(RC[-3]/2))*TAN(RADIANS(RC[-3]/2)) -> 4.3018491975800321E-2 | V336: =4*DEGREES(RC[-1]*SIN(2*RADIANS(RC[-13]))-2*RC[-11]*SIN(RADIANS(RC[-12]))+4*RC[-11]*RC[-1]*SIN(RADIANS(RC[-12]))*COS(2*RADIANS(RC[-13]))-0.5*RC[-1]*RC[-1]*SIN(4*RADIANS(RC[-13]))-1.25*RC[-11]*RC[-11]*SIN(2*RADIANS(RC[-12]))) -> 10.743133704177508 | W336: =DEGREES(ACOS(COS(RADIANS(90.833))/(COS(RADIANS(R2C2))*COS(RADIANS(RC[-3])))-TAN(RADIANS(R2C2))*TAN(RADIANS(RC[-3])))) -> #NUM! | X336: =(720-4*R3C2-RC[-2]+R4C2*60)/1440 -> 1899-12-31T13:45:15.412 | Y336: =(RC[-1]*1440-RC[-2]*4)/1440 -> #NUM! | Z336: =(RC[-2]*1440+RC[-3]*4)/1440 -> #NUM! | AA336: =8*RC[-4] -> #NUM! | AB336: =MOD(RC[-23]*1440+RC[-6]+4*R3C2-60*R4C2,1440) -> 734.74313370417747 | AC336: =IF(RC[-1]/4<0,RC[-1]/4+180,RC[-1]/4-180) -> 3.6857834260443667 | AD336: =DEGREES(ACOS(SIN(RADIANS(R2C2))*SIN(RADIANS(RC[-10]))+COS(RADIANS(R2C2))*COS(RADIANS(RC[-10]))*COS(RADIANS(RC[-1])))) -> 91.962762802835243 | AE336: =90-RC[-1] -> -1.9627628028352433 | AF336: =IF(RC[-1]>85,0,IF(RC[-1]>5,58.1/TAN(RADIANS(RC[-1]))-0.07/POWER(TAN(RADIANS(RC[-1])),3)+0.000086/POWER(TAN(RADIANS(RC[-1])),5),IF(RC[-1]>-0.575,1735+RC[-1]*(-518.2+RC[-1]*(103.4+RC[-1]*(-12.79+RC[-1]*0.711))),-20.772/TAN(RADIANS(RC[-1])))))/3600 -> 0.16836844301229234 | AG336: =RC[-2]+RC[-1] -> -1.794394359822951 | AH336: =IF(RC[-5]>0,MOD(DEGREES(ACOS(((SIN(RADIANS(R2C2))*COS(RADIANS(RC[-4])))-SIN(RADIANS(RC[-14])))/(COS(RADIANS(R2C2))*SIN(RADIANS(RC[-4])))))+180,360),MOD(540-DEGREES(ACOS(((SIN(RADIANS(R2C2))*COS(RADIANS(RC[-4])))-SIN(RADIANS(RC[-14])))/(COS(RADIANS(R2C2))*SIN(RADIANS(RC[-4]))))),360)) -> 183.42088012587053
D337: =R[-1]C+1 -> 2017-12-02T00:00:00.000 | E337: =R5C2 -> 1899-12-31T14:00:00.000 | F337: =RC[-2]+2415018.5+RC[-1]-R4C2/24 -> 2458090.375 | G337: =(RC[-1]-2451545)/36525 -> 0.17920260095824778 | I337: =MOD(280.46646+RC[-2]*(36000.76983 + RC[-2]*0.0003032),360) -> 251.89805977205015 | J337: =357.52911+RC[-3]*(35999.05029 - 0.0001537*RC[-3]) -> 6808.6525490589074 | K337: =0.016708634-RC[-4]*(0.000042037+0.0000001267*RC[-4]) -> 1.6701096791473923E-2 | L337: =SIN(RADIANS(RC[-2]))*(1.914602-RC[-5]*(0.004817+0.000014*RC[-5]))+SIN(RADIANS(2*RC[-2]))*(0.019993-0.000101*RC[-5])+SIN(RADIANS(3*RC[-2]))*0.000289 -> -1.0136150446545082 | M337: =RC[-4]+RC[-1] -> 250.88444472739565 | N337: =RC[-4]+RC[-2] -> 6807.6389340142532 | O337: =(1.000001018*(1-RC[-4]*RC[-4]))/(1+RC[-4]*COS(RADIANS(RC[-1]))) -> 0.98581492376168944 | P337: =RC[-3]-0.00569-0.00478*SIN(RADIANS(125.04-1934.136*RC[-9])) -> 250.87558351888109 | Q337: =23+(26+((21.448-RC[-10]*(46.815+RC[-10]*(0.00059-RC[-10]*0.001813))))/60)/60 -> 23.436960728256292 | R337: =RC[-1]+0.00256*COS(RADIANS(125.04-1934.136*RC[-11])) -> 23.435045244296475 | S337: =DEGREES(ATAN2(COS(RADIANS(RC[-3])),COS(RADIANS(RC[-1]))*SIN(RADIANS(RC[-3])))) -> -110.70325928893776 | T337: =DEGREES(ASIN(SIN(RADIANS(RC[-2]))*SIN(RADIANS(RC[-4])))) -> -22.071253152116377 | U337: =TAN(RADIANS(RC[-3]/2))*TAN(RADIANS(RC[-3]/2)) -> 4.3018496555063519E-2 | V337: =4*DEGREES(RC[-1]*SIN(2*RADIANS(RC[-13]))-2*RC[-11]*SIN(RADIANS(RC[-12]))+4*RC[-11]*RC[-1]*SIN(RADIANS(RC[-12]))*COS(2*RADIANS(RC[-13]))-0.5*RC[-1]*RC[-1]*SIN(4*RADIANS(RC[-13]))-1.25*RC[-11]*RC[-11]*SIN(2*RADIANS(RC[-12]))) -> 10.355464119406514 | W337: =DEGREES(ACOS(COS(RADIANS(90.833))/(COS(RADIANS(R2C2))*COS(RADIANS(RC[-3])))-TAN(RADIANS(R2C2))*TAN(RADIANS(RC[-3])))) -> #NUM! | X337: =(720-4*R3C2-RC[-2]+R4C2*60)/1440 -> 1899-12-31T13:45:38.672 | Y337: =(RC[-1]*1440-RC[-2]*4)/1440 -> #NUM! | Z337: =(RC[-2]*1440+RC[-3]*4)/1440 -> #NUM! | AA337: =8*RC[-4] -> #NUM! | AB337: =MOD(RC[-23]*1440+RC[-6]+4*R3C2-60*R4C2,1440) -> 734.35546411940652 | AC337: =IF(RC[-1]/4<0,RC[-1]/4+180,RC[-1]/4-180) -> 3.5888660298516299 | AD337: =DEGREES(ACOS(SIN(RADIANS(R2C2))*SIN(RADIANS(RC[-10]))+COS(RADIANS(R2C2))*COS(RADIANS(RC[-10]))*COS(RADIANS(RC[-1])))) -> 92.106890679196724 | AE337: =90-RC[-1] -> -2.1068906791967237 | AF337: =IF(RC[-1]>85,0,IF(RC[-1]>5,58.1/TAN(RADIANS(RC[-1]))-0.07/POWER(TAN(RADIANS(RC[-1])),3)+0.000086/POWER(TAN(RADIANS(RC[-1])),5),IF(RC[-1]>-0.575,1735+RC[-1]*(-518.2+RC[-1]*(103.4+RC[-1]*(-12.79+RC[-1]*0.711))),-20.772/TAN(RADIANS(RC[-1])))))/3600 -> 0.15684137171528145 | AG337: =RC[-2]+RC[-1] -> -1.9500493074814422 | AH337: =IF(RC[-5]>0,MOD(DEGREES(ACOS(((SIN(RADIANS(R2C2))*COS(RADIANS(RC[-4])))-SIN(RADIANS(RC[-14])))/(COS(RADIANS(R2C2))*SIN(RADIANS(RC[-4])))))+180,360),MOD(540-DEGREES(ACOS(((SIN(RADIANS(R2C2))*COS(RADIANS(RC[-4])))-SIN(RADIANS(RC[-14])))/(COS(RADIANS(R2C2))*SIN(RADIANS(RC[-4]))))),360)) -> 183.3278088697848
D338: =R[-1]C+1 -> 2017-12-03T00:00:00.000 | E338: =R5C2 -> 1899-12-31T14:00:00.000 | F338: =RC[-2]+2415018.5+RC[-1]-R4C2/24 -> 2458091.375 | G338: =(RC[-1]-2451545)/36525 -> 0.1792299794661191 | I338: =MOD(280.46646+RC[-2]*(36000.76983 + RC[-2]*0.0003032),360) -> 252.88370713518907 | J338: =357.52911+RC[-3]*(35999.05029 - 0.0001537*RC[-3]) -> 6809.6381493391245 | K338: =0.016708634-RC[-4]*(0.000042037+0.0000001267*RC[-4]) -> 1.6701095639320235E-2 | L338: =SIN(RADIANS(RC[-2]))*(1.914602-RC[-5]*(0.004817+0.000014*RC[-5]))+SIN(RADIANS(2*RC[-2]))*(0.019993-0.000101*RC[-5])+SIN(RADIANS(3*RC[-2]))*0.000289 -> -0.9850293764953878 | M338: =RC[-4]+RC[-1] -> 251.89867775869368 | N338: =RC[-4]+RC[-2] -> 6808.6531199626288 | O338: =(1.000001018*(1-RC[-4]*RC[-4]))/(1+RC[-4]*COS(RADIANS(RC[-1]))) -> 0.98566328527981462 | P338: =RC[-3]-0.00569-0.00478*SIN(RADIANS(125.04-1934.136*RC[-9])) -> 251.8898132460078 | Q338: =23+(26+((21.448-RC[-10]*(46.815+RC[-10]*(0.00059-RC[-10]*0.001813))))/60)/60 -> 23.436960372221332 | R338: =RC[-1]+0.00256*COS(RADIANS(125.04-1934.136*RC[-11])) -> 23.43504645875899 | S338: =DEGREES(ATAN2(COS(RADIANS(RC[-3])),COS(RADIANS(RC[-1]))*SIN(RADIANS(RC[-3])))) -> -109.61862005072147 | T338: =DEGREES(ASIN(SIN(RADIANS(RC[-2]))*SIN(RADIANS(RC[-4])))) -> -22.210277693790317 | U338: =TAN(RADIANS(RC[-3]/2))*TAN(RADIANS(RC[-3]/2)) -> 4.3018501140504609E-2 | V338: =4*DEGREES(RC[-1]*SIN(2*RADIANS(RC[-13]))-2*RC[-11]*SIN(RADIANS(RC[-12]))+4*RC[-11]*RC[-1]*SIN(RADIANS(RC[-12]))*COS(2*RADIANS(RC[-13]))-0.5*RC[-1]*RC[-1]*SIN(4*RADIANS(RC[-13]))-1.25*RC[-11]*RC[-11]*SIN(2*RADIANS(RC[-12]))) -> 9.957880372365322 | W338: =DEGREES(ACOS(COS(RADIANS(90.833))/(COS(RADIANS(R2C2))*COS(RADIANS(RC[-3])))-TAN(RADIANS(R2C2))*TAN(RADIANS(RC[-3])))) -> #NUM! | X338: =(720-4*R3C2-RC[-2]+R4C2*60)/1440 -> 1899-12-31T13:46:02.527 | Y338: =(RC[-1]*1440-RC[-2]*4)/1440 -> #NUM! | Z338: =(RC[-2]*1440+RC[-3]*4)/1440 -> #NUM! | AA338: =8*RC[-4] -> #NUM! | AB338: =MOD(RC[-23]*1440+RC[-6]+4*R3C2-60*R4C2,1440) -> 733.95788037236537 | AC338: =IF(RC[-1]/4<0,RC[-1]/4+180,RC[-1]/4-180) -> 3.4894700930913416 | AD338: =DEGREES(ACOS(SIN(RADIANS(R2C2))*SIN(RADIANS(RC[-10]))+COS(RADIANS(R2C2))*COS(RADIANS(RC[-10]))*COS(RADIANS(RC[-1])))) -> 92.243938959314761 | AE338: =90-RC[-1] -> -2.243938959314761 | AF338: =IF(RC[-1]>85,0,IF(RC[-1]>5,58.1/TAN(RADIANS(RC[-1]))-0.07/POWER(TAN(RADIANS(RC[-1])),3)+0.000086/POWER(TAN(RADIANS(RC[-1])),5),IF(RC[-1]>-0.575,1735+RC[-1]*(-518.2+RC[-1]*(103.4+RC[-1]*(-12.79+RC[-1]*0.711))),-20.772/TAN(RADIANS(RC[-1])))))/3600 -> 0.14725338358332407 | AG338: =RC[-2]+RC[-1] -> -2.0966855757314367 | AH338: =IF(RC[-5]>0,MOD(DEGREES(ACOS(((SIN(RADIANS(R2C2))*COS(RADIANS(RC[-4])))-SIN(RADIANS(RC[-14])))/(COS(RADIANS(R2C2))*SIN(RADIANS(RC[-4])))))+180,360),MOD(540-DEGREES(ACOS(((SIN(RADIANS(R2C2))*COS(RADIANS(RC[-4])))-SIN(RADIANS(RC[-14])))/(COS(RADIANS(R2C2))*SIN(RADIANS(RC[-4]))))),360)) -> 183.23275699953385
D339: =R[-1]C+1 -> 2017-12-04T00:00:00.000 | E339: =R5C2 -> 1899-12-31T14:00:00.000 | F339: =RC[-2]+2415018.5+RC[-1]-R4C2/24 -> 2458092.375 | G339: =(RC[-1]-2451545)/36525 -> 0.17925735797399042 | I339: =MOD(280.46646+RC[-2]*(36000.76983 + RC[-2]*0.0003032),360) -> 253.86935449832981 | J339: =357.52911+RC[-3]*(35999.05029 - 0.0001537*RC[-3]) -> 6810.6237496193417 | K339: =0.016708634-RC[-4]*(0.000042037+0.0000001267*RC[-4]) -> 1.6701094487166359E-2 | L339: =SIN(RADIANS(RC[-2]))*(1.914602-RC[-5]*(0.004817+0.000014*RC[-5]))+SIN(RADIANS(2*RC[-2]))*(0.019993-0.000101*RC[-5])+SIN(RADIANS(3*RC[-2]))*0.000289 -> -0.9561360924674166 | M339: =RC[-4]+RC[-1] -> 252.91321840586241 | N339: =RC[-4]+RC[-2] -> 6809.6676135268744 | O339: =(1.000001018*(1-RC[-4]*RC[-4]))/(1+RC[-4]*COS(RADIANS(RC[-1]))) -> 0.9855159910164295 | P339: =RC[-3]-0.00569-0.00478*SIN(RADIANS(125.04-1934.136*RC[-9])) -> 252.90435059171679 | Q339: =23+(26+((21.448-RC[-10]*(46.815+RC[-10]*(0.00059-RC[-10]*0.001813))))/60)/60 -> 23.436960016186372 | R339: =RC[-1]+0.00256*COS(RADIANS(125.04-1934.136*RC[-11])) -> 23.435047674856328 | S339: =DEGREES(ATAN2(COS(RADIANS(RC[-3])),COS(RADIANS(RC[-1]))*SIN(RADIANS(RC[-3])))) -> -108.53155550037917 | T339: =DEGREES(ASIN(SIN(RADIANS(RC[-2]))*SIN(RADIANS(RC[-4])))) -> -22.342141631628859 | U339: =TAN(RADIANS(RC[-3]/2))*TAN(RADIANS(RC[-3]/2)) -> 4.301850573211858E-2 | V339: =4*DEGREES(RC[-1]*SIN(2*RADIANS(RC[-13]))-2*RC[-11]*SIN(RADIANS(RC[-12]))+4*RC[-11]*RC[-1]*SIN(RADIANS(RC[-12]))*COS(2*RADIANS(RC[-13]))-0.5*RC[-1]*RC[-1]*SIN(4*RADIANS(RC[-13]))-1.25*RC[-11]*RC[-11]*SIN(2*RADIANS(RC[-12]))) -> 9.5507852462522731 | W339: =DEGREES(ACOS(COS(RADIANS(90.833))/(COS(RADIANS(R2C2))*COS(RADIANS(RC[-3])))-TAN(RADIANS(R2C2))*TAN(RADIANS(RC[-3])))) -> #NUM! | X339: =(720-4*R3C2-RC[-2]+R4C2*60)/1440 -> 1899-12-31T13:46:26.953 | Y339: =(RC[-1]*1440-RC[-2]*4)/1440 -> #NUM! | Z339: =(RC[-2]*1440+RC[-3]*4)/1440 -> #NUM! | AA339: =8*RC[-4] -> #NUM! | AB339: =MOD(RC[-23]*1440+RC[-6]+4*R3C2-60*R4C2,1440) -> 733.5507852462523 | AC339: =IF(RC[-1]/4<0,RC[-1]/4+180,RC[-1]/4-180) -> 3.3876963115630758 | AD339: =DEGREES(ACOS(SIN(RADIANS(R2C2))*SIN(RADIANS(RC[-10]))+COS(RADIANS(R2C2))*COS(RADIANS(RC[-10]))*COS(RADIANS(RC[-1])))) -> 92.373841569348457 | AE339: =90-RC[-1] -> -2.3738415693484569 | AF339: =IF(RC[-1]>85,0,IF(RC[-1]>5,58.1/TAN(RADIANS(RC[-1]))-0.07/POWER(TAN(RADIANS(RC[-1])),3)+0.000086/POWER(TAN(RADIANS(RC[-1])),5),IF(RC[-1]>-0.575,1735+RC[-1]*(-518.2+RC[-1]*(103.4+RC[-1]*(-12.79+RC[-1]*0.711))),-20.772/TAN(RADIANS(RC[-1])))))/3600 -> 0.13918682179843231 | AG339: =RC[-2]+RC[-1] -> -2.2346547475500245 | AH339: =IF(RC[-5]>0,MOD(DEGREES(ACOS(((SIN(RADIANS(R2C2))*COS(RADIANS(RC[-4])))-SIN(RADIANS(RC[-14])))/(COS(RADIANS(R2C2))*SIN(RADIANS(RC[-4])))))+180,360),MOD(540-DEGREES(ACOS(((SIN(RADIANS(R2C2))*COS(RADIANS(RC[-4])))-SIN(RADIANS(RC[-14])))/(COS(RADIANS(R2C2))*SIN(RADIANS(RC[-4]))))),360)) -> 183.13581279176441
D340: =R[-1]C+1 -> 2017-12-05T00:00:00.000 | E340: =R5C2 -> 1899-12-31T14:00:00.000 | F340: =RC[-2]+2415018.5+RC[-1]-R4C2/24 -> 2458093.375 | G340: =(RC[-1]-2451545)/36525 -> 0.17928473648186175 | I340: =MOD(280.46646+RC[-2]*(36000.76983 + RC[-2]*0.0003032),360) -> 254.85500186147056 | J340: =357.52911+RC[-3]*(35999.05029 - 0.0001537*RC[-3]) -> 6811.6093498995569 | K340: =0.016708634-RC[-4]*(0.000042037+0.0000001267*RC[-4]) -> 1.6701093335012292E-2 | L340: =SIN(RADIANS(RC[-2]))*(1.914602-RC[-5]*(0.004817+0.000014*RC[-5]))+SIN(RADIANS(2*RC[-2]))*(0.019993-0.000101*RC[-5])+SIN(RADIANS(3*RC[-2]))*0.000289 -> -0.9269440497829432 | M340: =RC[-4]+RC[-1] -> 253.92805781168761 | N340: =RC[-4]+RC[-2] -> 6810.6824058497741 | O340: =(1.000001018*(1-RC[-4]*RC[-4]))/(1+RC[-4]*COS(RADIANS(RC[-1]))) -> 0.98537308845315197 | P340: =RC[-3]-0.00569-0.00478*SIN(RADIANS(125.04-1934.136*RC[-9])) -> 253.91918669879669 | Q340: =23+(26+((21.448-RC[-10]*(46.815+RC[-10]*(0.00059-RC[-10]*0.001813))))/60)/60 -> 23.436959660151416 | R340: =RC[-1]+0.00256*COS(RADIANS(125.04-1934.136*RC[-11])) -> 23.435048892587151 | S340: =DEGREES(ATAN2(COS(RADIANS(RC[-3])),COS(RADIANS(RC[-1]))*SIN(RADIANS(RC[-3])))) -> -107.44216842800294 | T340: =DEGREES(ASIN(SIN(RADIANS(RC[-2]))*SIN(RADIANS(RC[-4])))) -> -22.46677622856885 | U340: =TAN(RADIANS(RC[-3]/2))*TAN(RADIANS(RC[-3]/2)) -> 4.3018510329900346E-2 | V340: =4*DEGREES(RC[-1]*SIN(2*RADIANS(RC[-13]))-2*RC[-11]*SIN(RADIANS(RC[-12]))+4*RC[-11]*RC[-1]*SIN(RADIANS(RC[-12]))*COS(2*RADIANS(RC[-13]))-0.5*RC[-1]*RC[-1]*SIN(4*RADIANS(RC[-13]))-1.25*RC[-11]*RC[-11]*SIN(2*RADIANS(RC[-12]))) -> 9.1345962572697292 | W340: =DEGREES(ACOS(COS(RADIANS(90.833))/(COS(RADIANS(R2C2))*COS(RADIANS(RC[-3])))-TAN(RADIANS(R2C2))*TAN(RADIANS(RC[-3])))) -> #NUM! | X340: =(720-4*R3C2-RC[-2]+R4C2*60)/1440 -> 1899-12-31T13:46:51.924 | Y340: =(RC[-1]*1440-RC[-2]*4)/1440 -> #NUM! | Z340: =(RC[-2]*1440+RC[-3]*4)/1440 -> #NUM! | AA340: =8*RC[-4] -> #NUM! | AB340: =MOD(RC[-23]*1440+RC[-6]+4*R3C2-60*R4C2,1440) -> 733.13459625726978 | AC340: =IF(RC[-1]/4<0,RC[-1]/4+180,RC[-1]/4-180) -> 3.2836490643174443 | AD340: =DEGREES(ACOS(SIN(RADIANS(R2C2))*SIN(RADIANS(RC[-10]))+COS(RADIANS(R2C2))*COS(RADIANS(RC[-10]))*COS(RADIANS(RC[-1])))) -> 92.496535393059133 | AE340: =90-RC[-1] -> -2.4965353930591334 | AF340: =IF(RC[-1]>85,0,IF(RC[-1]>5,58.1/TAN(RADIANS(RC[-1]))-0.07/POWER(TAN(RADIANS(RC[-1])),3)+0.000086/POWER(TAN(RADIANS(RC[-1])),5),IF(RC[-1]>-0.575,1735+RC[-1]*(-518.2+RC[-1]*(103.4+RC[-1]*(-12.79+RC[-1]*0.711))),-20.772/TAN(RADIANS(RC[-1])))))/3600 -> 0.13233835987558978 | AG340: =RC[-2]+RC[-1] -> -2.3641970331835438 | AH340: =IF(RC[-5]>0,MOD(DEGREES(ACOS(((SIN(RADIANS(R2C2))*COS(RADIANS(RC[-4])))-SIN(RADIANS(RC[-14])))/(COS(RADIANS(R2C2))*SIN(RADIANS(RC[-4])))))+180,360),MOD(540-DEGREES(ACOS(((SIN(RADIANS(R2C2))*COS(RADIANS(RC[-4])))-SIN(RADIANS(RC[-14])))/(COS(RADIANS(R2C2))*SIN(RADIANS(RC[-4]))))),360)) -> 183.03706677018869
D341: =R[-1]C+1 -> 2017-12-06T00:00:00.000 | E341: =R5C2 -> 1899-12-31T14:00:00.000 | F341: =RC[-2]+2415018.5+RC[-1]-R4C2/24 -> 2458094.375 | G341: =(RC[-1]-2451545)/36525 -> 0.17931211498973307 | I341: =MOD(280.46646+RC[-2]*(36000.76983 + RC[-2]*0.0003032),360) -> 255.8406492246113 | J341: =357.52911+RC[-3]*(35999.05029 - 0.0001537*RC[-3]) -> 6812.5949501797732 | K341: =0.016708634-RC[-4]*(0.000042037+0.0000001267*RC[-4]) -> 1.6701092182858035E-2 | L341: =SIN(RADIANS(RC[-2]))*(1.914602-RC[-5]*(0.004817+0.000014*RC[-5]))+SIN(RADIANS(2*RC[-2]))*(0.019993-0.000101*RC[-5])+SIN(RADIANS(3*RC[-2]))*0.000289 -> -0.89746221381551716 | M341: =RC[-4]+RC[-1] -> 254.94318701079578 | N341: =RC[-4]+RC[-2] -> 6811.6974879659574 | O341: =(1.000001018*(1-RC[-4]*RC[-4]))/(1+RC[-4]*COS(RADIANS(RC[-1]))) -> 0.98523462369597981 | P341: =RC[-3]-0.00569-0.00478*SIN(RADIANS(125.04-1934.136*RC[-9])) -> 254.93431260187677 | Q341: =23+(26+((21.448-RC[-10]*(46.815+RC[-10]*(0.00059-RC[-10]*0.001813))))/60)/60 -> 23.436959304116456 | R341: =RC[-1]+0.00256*COS(RADIANS(125.04-1934.136*RC[-11])) -> 23.435050111950105 | S341: =DEGREES(ATAN2(COS(RADIANS(RC[-3])),COS(RADIANS(RC[-1]))*SIN(RADIANS(RC[-3])))) -> -106.35056560278018 | T341: =DEGREES(ASIN(SIN(RADIANS(RC[-2]))*SIN(RADIANS(RC[-4])))) -> -22.584115895641233 | U341: =TAN(RADIANS(RC[-3]/2))*TAN(RADIANS(RC[-3]/2)) -> 4.3018514933844801E-2 | V341: =4*DEGREES(RC[-1]*SIN(2*RADIANS(RC[-13]))-2*RC[-11]*SIN(RADIANS(RC[-12]))+4*RC[-11]*RC[-1]*SIN(RADIANS(RC[-12]))*COS(2*RADIANS(RC[-13]))-0.5*RC[-1]*RC[-1]*SIN(4*RADIANS(RC[-13]))-1.25*RC[-11]*RC[-11]*SIN(2*RADIANS(RC[-12]))) -> 8.7097450609321481 | W341: =DEGREES(ACOS(COS(RADIANS(90.833))/(COS(RADIANS(R2C2))*COS(RADIANS(RC[-3])))-TAN(RADIANS(R2C2))*TAN(RADIANS(RC[-3])))) -> #NUM! | X341: =(720-4*R3C2-RC[-2]+R4C2*60)/1440 -> 1899-12-31T13:47:17.415 | Y341: =(RC[-1]*1440-RC[-2]*4)/1440 -> #NUM! | Z341: =(RC[-2]*1440+RC[-3]*4)/1440 -> #NUM! | AA341: =8*RC[-4] -> #NUM! | AB341: =MOD(RC[-23]*1440+RC[-6]+4*R3C2-60*R4C2,1440) -> 732.70974506093216 | AC341: =IF(RC[-1]/4<0,RC[-1]/4+180,RC[-1]/4-180) -> 3.177436265233041 | AD341: =DEGREES(ACOS(SIN(RADIANS(R2C2))*SIN(RADIANS(RC[-10]))+COS(RADIANS(R2C2))*COS(RADIANS(RC[-10]))*COS(RADIANS(RC[-1])))) -> 92.611960354428376 | AE341: =90-RC[-1] -> -2.6119603544283763 | AF341: =IF(RC[-1]>85,0,IF(RC[-1]>5,58.1/TAN(RADIANS(RC[-1]))-0.07/POWER(TAN(RADIANS(RC[-1])),3)+0.000086/POWER(TAN(RADIANS(RC[-1])),5),IF(RC[-1]>-0.575,1735+RC[-1]*(-518.2+RC[-1]*(103.4+RC[-1]*(-12.79+RC[-1]*0.711))),-20.772/TAN(RADIANS(RC[-1])))))/3600 -> 0.12648262439497465 | AG341: =RC[-2]+RC[-1] -> -2.4854777300334017 | AH341: =IF(RC[-5]>0,MOD(DEGREES(ACOS(((SIN(RADIANS(R2C2))*COS(RADIANS(RC[-4])))-SIN(RADIANS(RC[-14])))/(COS(RADIANS(R2C2))*SIN(RADIANS(RC[-4])))))+180,360),MOD(540-DEGREES(ACOS(((SIN(RADIANS(R2C2))*COS(RADIANS(RC[-4])))-SIN(RADIANS(RC[-14])))/(COS(RADIANS(R2C2))*SIN(RADIANS(RC[-4]))))),360)) -> 182.93661159365314
D342: =R[-1]C+1 -> 2017-12-07T00:00:00.000 | E342: =R5C2 -> 1899-12-31T14:00:00.000 | F342: =RC[-2]+2415018.5+RC[-1]-R4C2/24 -> 2458095.375 | G342: =(RC[-1]-2451545)/36525 -> 0.17933949349760439 | I342: =MOD(280.46646+RC[-2]*(36000.76983 + RC[-2]*0.0003032),360) -> 256.82629658775295 | J342: =357.52911+RC[-3]*(35999.05029 - 0.0001537*RC[-3]) -> 6813.5805504599894 | K342: =0.016708634-RC[-4]*(0.000042037+0.0000001267*RC[-4]) -> 1.670109103070359E-2 | L342: =SIN(RADIANS(RC[-2]))*(1.914602-RC[-5]*(0.004817+0.000014*RC[-5]))+SIN(RADIANS(2*RC[-2]))*(0.019993-0.000101*RC[-5])+SIN(RADIANS(3*RC[-2]))*0.000289 -> -0.86769965505660529 | M342: =RC[-4]+RC[-1] -> 255.95859693269634 | N342: =RC[-4]+RC[-2] -> 6812.7128508049327 | O342: =(1.000001018*(1-RC[-4]*RC[-4]))/(1+RC[-4]*COS(RADIANS(RC[-1]))) -> 0.98510064145678677 | P342: =RC[-3]-0.00569-0.00478*SIN(RADIANS(125.04-1934.136*RC[-9])) -> 255.9497192304693 | Q342: =23+(26+((21.448-RC[-10]*(46.815+RC[-10]*(0.00059-RC[-10]*0.001813))))/60)/60 -> 23.436958948081497 | R342: =RC[-1]+0.00256*COS(RADIANS(125.04-1934.136*RC[-11])) -> 23.43505133294385 | S342: =DEGREES(ATAN2(COS(RADIANS(RC[-3])),COS(RADIANS(RC[-1]))*SIN(RADIANS(RC[-3])))) -> -105.2568576251295 | T342: =DEGREES(ASIN(SIN(RADIANS(RC[-2]))*SIN(RADIANS(RC[-4])))) -> -22.694098294639037 | U342: =TAN(RADIANS(RC[-3]/2))*TAN(RADIANS(RC[-3]/2)) -> 4.3018519543946906E-2 | V342: =4*DEGREES(RC[-1]*SIN(2*RADIANS(RC[-13]))-2*RC[-11]*SIN(RADIANS(RC[-12]))+4*RC[-11]*RC[-1]*SIN(RADIANS(RC[-12]))*COS(2*RADIANS(RC[-13]))-0.5*RC[-1]*RC[-1]*SIN(4*RADIANS(RC[-13]))-1.25*RC[-11]*RC[-11]*SIN(2*RADIANS(RC[-12]))) -> 8.2766768236700674 | W342: =DEGREES(ACOS(COS(RADIANS(90.833))/(COS(RADIANS(R2C2))*COS(RADIANS(RC[-3])))-TAN(RADIANS(R2C2))*TAN(RADIANS(RC[-3])))) -> #NUM! | X342: =(720-4*R3C2-RC[-2]+R4C2*60)/1440 -> 1899-12-31T13:47:43.399 | Y342: =(RC[-1]*1440-RC[-2]*4)/1440 -> #NUM! | Z342: =(RC[-2]*1440+RC[-3]*4)/1440 -> #NUM! | AA342: =8*RC[-4] -> #NUM! | AB342: =MOD(RC[-23]*1440+RC[-6]+4*R3C2-60*R4C2,1440) -> 732.27667682367007 | AC342: =IF(RC[-1]/4<0,RC[-1]/4+180,RC[-1]/4-180) -> 3.0691692059175182 | AD342: =DEGREES(ACOS(SIN(RADIANS(R2C2))*SIN(RADIANS(RC[-10]))+COS(RADIANS(R2C2))*COS(RADIANS(RC[-10]))*COS(RADIANS(RC[-1])))) -> 92.720059497611658 | AE342: =90-RC[-1] -> -2.7200594976116577 | AF342: =IF(RC[-1]>85,0,IF(RC[-1]>5,58.1/TAN(RADIANS(RC[-1]))-0.07/POWER(TAN(RADIANS(RC[-1])),3)+0.000086/POWER(TAN(RADIANS(RC[-1])),5),IF(RC[-1]>-0.575,1735+RC[-1]*(-518.2+RC[-1]*(103.4+RC[-1]*(-12.79+RC[-1]*0.711))),-20.772/TAN(RADIANS(RC[-1])))))/3600 -> 0.12144890459386265 | AG342: =RC[-2]+RC[-1] -> -2.5986105930177952 | AH342: =IF(RC[-5]>0,MOD(DEGREES(ACOS(((SIN(RADIANS(R2C2))*COS(RADIANS(RC[-4])))-SIN(RADIANS(RC[-14])))/(COS(RADIANS(R2C2))*SIN(RADIANS(RC[-4])))))+180,360),MOD(540-DEGREES(ACOS(((SIN(RADIANS(R2C2))*COS(RADIANS(RC[-4])))-SIN(RADIANS(RC[-14])))/(COS(RADIANS(R2C2))*SIN(RADIANS(RC[-4]))))),360)) -> 182.8345419413221
D343: =R[-1]C+1 -> 2017-12-08T00:00:00.000 | E343: =R5C2 -> 1899-12-31T14:00:00.000 | F343: =RC[-2]+2415018.5+RC[-1]-R4C2/24 -> 2458096.375 | G343: =(RC[-1]-2451545)/36525 -> 0.17936687200547571 | I343: =MOD(280.46646+RC[-2]*(36000.76983 + RC[-2]*0.0003032),360) -> 257.81194395089551 | J343: =357.52911+RC[-3]*(35999.05029 - 0.0001537*RC[-3]) -> 6814.5661507402037 | K343: =0.016708634-RC[-4]*(0.000042037+0.0000001267*RC[-4]) -> 1.6701089878548951E-2 | L343: =SIN(RADIANS(RC[-2]))*(1.914602-RC[-5]*(0.004817+0.000014*RC[-5]))+SIN(RADIANS(2*RC[-2]))*(0.019993-0.000101*RC[-5])+SIN(RADIANS(3*RC[-2]))*0.000289 -> -0.83766554601555232 | M343: =RC[-4]+RC[-1] -> 256.97427840487995 | N343: =RC[-4]+RC[-2] -> 6813.7284851941886 | O343: =(1.000001018*(1-RC[-4]*RC[-4]))/(1+RC[-4]*COS(RADIANS(RC[-1]))) -> 0.98497118503532566 | P343: =RC[-3]-0.00569-0.00478*SIN(RADIANS(125.04-1934.136*RC[-9])) -> 256.96539741206772 | Q343: =23+(26+((21.448-RC[-10]*(46.815+RC[-10]*(0.00059-RC[-10]*0.001813))))/60)/60 -> 23.43695859204654 | R343: =RC[-1]+0.00256*COS(RADIANS(125.04-1934.136*RC[-11])) -> 23.435052555567037 | S343: =DEGREES(ATAN2(COS(RADIANS(RC[-3])),COS(RADIANS(RC[-1]))*SIN(RADIANS(RC[-3])))) -> -104.16115876617884 | T343: =DEGREES(ASIN(SIN(RADIANS(RC[-2]))*SIN(RADIANS(RC[-4])))) -> -22.796664437296233 | U343: =TAN(RADIANS(RC[-3]/2))*TAN(RADIANS(RC[-3]/2)) -> 4.3018524160201542E-2 | V343: =4*DEGREES(RC[-1]*SIN(2*RADIANS(RC[-13]))-2*RC[-11]*SIN(RADIANS(RC[-12]))+4*RC[-11]*RC[-1]*SIN(RADIANS(RC[-12]))*COS(2*RADIANS(RC[-13]))-0.5*RC[-1]*RC[-1]*SIN(4*RADIANS(RC[-13]))-1.25*RC[-11]*RC[-11]*SIN(2*RADIANS(RC[-12]))) -> 7.8358495610857757 | W343: =DEGREES(ACOS(COS(RADIANS(90.833))/(COS(RADIANS(R2C2))*COS(RADIANS(RC[-3])))-TAN(RADIANS(R2C2))*TAN(RADIANS(RC[-3])))) -> #NUM! | X343: =(720-4*R3C2-RC[-2]+R4C2*60)/1440 -> 1899-12-31T13:48:09.849 | Y343: =(RC[-1]*1440-RC[-2]*4)/1440 -> #NUM! | Z343: =(RC[-2]*1440+RC[-3]*4)/1440 -> #NUM! | AA343: =8*RC[-4] -> #NUM! | AB343: =MOD(RC[-23]*1440+RC[-6]+4*R3C2-60*R4C2,1440) -> 731.83584956108575 | AC343: =IF(RC[-1]/4<0,RC[-1]/4+180,RC[-1]/4-180) -> 2.9589623902714379 | AD343: =DEGREES(ACOS(SIN(RADIANS(R2C2))*SIN(RADIANS(RC[-10]))+COS(RADIANS(R2C2))*COS(RADIANS(RC[-10]))*COS(RADIANS(RC[-1])))) -> 92.82077906395871 | AE343: =90-RC[-1] -> -2.8207790639587103 | AF343: =IF(RC[-1]>85,0,IF(RC[-1]>5,58.1/TAN(RADIANS(RC[-1]))-0.07/POWER(TAN(RADIANS(RC[-1])),3)+0.000086/POWER(TAN(RADIANS(RC[-1])),5),IF(RC[-1]>-0.575,1735+RC[-1]*(-518.2+RC[-1]*(103.4+RC[-1]*(-12.79+RC[-1]*0.711))),-20.772/TAN(RADIANS(RC[-1])))))/3600 -> 0.11710577095198922 | AG343: =RC[-2]+RC[-1] -> -2.7036732930067209 | AH343: =IF(RC[-5]>0,MOD(DEGREES(ACOS(((SIN(RADIANS(R2C2))*COS(RADIANS(RC[-4])))-SIN(RADIANS(RC[-14])))/(COS(RADIANS(R2C2))*SIN(RADIANS(RC[-4])))))+180,360),MOD(540-DEGREES(ACOS(((SIN(RADIANS(R2C2))*COS(RADIANS(RC[-4])))-SIN(RADIANS(RC[-14])))/(COS(RADIANS(R2C2))*SIN(RADIANS(RC[-4]))))),360)) -> 182.73095439518247
D344: =R[-1]C+1 -> 2017-12-09T00:00:00.000 | E344: =R5C2 -> 1899-12-31T14:00:00.000 | F344: =RC[-2]+2415018.5+RC[-1]-R4C2/24 -> 2458097.375 | G344: =(RC[-1]-2451545)/36525 -> 0.17939425051334701 | I344: =MOD(280.46646+RC[-2]*(36000.76983 + RC[-2]*0.0003032),360) -> 258.79759131403716 | J344: =357.52911+RC[-3]*(35999.05029 - 0.0001537*RC[-3]) -> 6815.5517510204181 | K344: =0.016708634-RC[-4]*(0.000042037+0.0000001267*RC[-4]) -> 1.6701088726394125E-2 | L344: =SIN(RADIANS(RC[-2]))*(1.914602-RC[-5]*(0.004817+0.000014*RC[-5]))+SIN(RADIANS(2*RC[-2]))*(0.019993-0.000101*RC[-5])+SIN(RADIANS(3*RC[-2]))*0.000289 -> -0.80736915806398457 | M344: =RC[-4]+RC[-1] -> 257.99022215597319 | N344: =RC[-4]+RC[-2] -> 6814.7443818623542 | O344: =(1.000001018*(1-RC[-4]*RC[-4]))/(1+RC[-4]*COS(RADIANS(RC[-1]))) -> 0.9848462963017518 | P344: =RC[-3]-0.00569-0.00478*SIN(RADIANS(125.04-1934.136*RC[-9])) -> 257.98133787530151 | Q344: =23+(26+((21.448-RC[-10]*(46.815+RC[-10]*(0.00059-RC[-10]*0.001813))))/60)/60 -> 23.436958236011581 | R344: =RC[-1]+0.00256*COS(RADIANS(125.04-1934.136*RC[-11])) -> 23.435053779818318 | S344: =DEGREES(ATAN2(COS(RADIANS(RC[-3])),COS(RADIANS(RC[-1]))*SIN(RADIANS(RC[-3])))) -> -103.06358679487526 | T344: =DEGREES(ASIN(SIN(RADIANS(RC[-2]))*SIN(RADIANS(RC[-4])))) -> -22.891758780594195 | U344: =TAN(RADIANS(RC[-3]/2))*TAN(RADIANS(RC[-3]/2)) -> 4.3018528782603656E-2 | V344: =4*DEGREES(RC[-1]*SIN(2*RADIANS(RC[-13]))-2*RC[-11]*SIN(RADIANS(RC[-12]))+4*RC[-11]*RC[-1]*SIN(RADIANS(RC[-12]))*COS(2*RADIANS(RC[-13]))-0.5*RC[-1]*RC[-1]*SIN(4*RADIANS(RC[-13]))-1.25*RC[-11]*RC[-11]*SIN(2*RADIANS(RC[-12]))) -> 7.3877334443347396 | W344: =DEGREES(ACOS(COS(RADIANS(90.833))/(COS(RADIANS(R2C2))*COS(RADIANS(RC[-3])))-TAN(RADIANS(R2C2))*TAN(RADIANS(RC[-3])))) -> #NUM! | X344: =(720-4*R3C2-RC[-2]+R4C2*60)/1440 -> 1899-12-31T13:48:36.736 | Y344: =(RC[-1]*1440-RC[-2]*4)/1440 -> #NUM! | Z344: =(RC[-2]*1440+RC[-3]*4)/1440 -> #NUM! | AA344: =8*RC[-4] -> #NUM! | AB344: =MOD(RC[-23]*1440+RC[-6]+4*R3C2-60*R4C2,1440) -> 731.38773344433469 | AC344: =IF(RC[-1]/4<0,RC[-1]/4+180,RC[-1]/4-180) -> 2.8469333610836713 | AD344: =DEGREES(ACOS(SIN(RADIANS(R2C2))*SIN(RADIANS(RC[-10]))+COS(RADIANS(R2C2))*COS(RADIANS(RC[-10]))*COS(RADIANS(RC[-1])))) -> 92.914068565834413 | AE344: =90-RC[-1] -> -2.9140685658344125 | AF344: =IF(RC[-1]>85,0,IF(RC[-1]>5,58.1/TAN(RADIANS(RC[-1]))-0.07/POWER(TAN(RADIANS(RC[-1])),3)+0.000086/POWER(TAN(RADIANS(RC[-1])),5),IF(RC[-1]>-0.575,1735+RC[-1]*(-518.2+RC[-1]*(103.4+RC[-1]*(-12.79+RC[-1]*0.711))),-20.772/TAN(RADIANS(RC[-1])))))/3600 -> 0.11335064166242828 | AG344: =RC[-2]+RC[-1] -> -2.8007179241719844 | AH344: =IF(RC[-5]>0,MOD(DEGREES(ACOS(((SIN(RADIANS(R2C2))*COS(RADIANS(RC[-4])))-SIN(RADIANS(RC[-14])))/(COS(RADIANS(R2C2))*SIN(RADIANS(RC[-4])))))+180,360),MOD(540-DEGREES(ACOS(((SIN(RADIANS(R2C2))*COS(RADIANS(RC[-4])))-SIN(RADIANS(RC[-14])))/(COS(RADIANS(R2C2))*SIN(RADIANS(RC[-4]))))),360)) -> 182.62594732013582
D345: =R[-1]C+1 -> 2017-12-10T00:00:00.000 | E345: =R5C2 -> 1899-12-31T14:00:00.000 | F345: =RC[-2]+2415018.5+RC[-1]-R4C2/24 -> 2458098.375 | G345: =(RC[-1]-2451545)/36525 -> 0.17942162902121833 | I345: =MOD(280.46646+RC[-2]*(36000.76983 + RC[-2]*0.0003032),360) -> 259.78323867717972 | J345: =357.52911+RC[-3]*(35999.05029 - 0.0001537*RC[-3]) -> 6816.5373513006343 | K345: =0.016708634-RC[-4]*(0.000042037+0.0000001267*RC[-4]) -> 1.6701087574239111E-2 | L345: =SIN(RADIANS(RC[-2]))*(1.914602-RC[-5]*(0.004817+0.000014*RC[-5]))+SIN(RADIANS(2*RC[-2]))*(0.019993-0.000101*RC[-5])+SIN(RADIANS(3*RC[-2]))*0.000289 -> -0.77681985822661992 | M345: =RC[-4]+RC[-1] -> 259.00641881895308 | N345: =RC[-4]+RC[-2] -> 6815.7605314424081 | O345: =(1.000001018*(1-RC[-4]*RC[-4]))/(1+RC[-4]*COS(RADIANS(RC[-1]))) -> 0.98472601567968199 | P345: =RC[-3]-0.00569-0.00478*SIN(RADIANS(125.04-1934.136*RC[-9])) -> 258.99753125315038 | Q345: =23+(26+((21.448-RC[-10]*(46.815+RC[-10]*(0.00059-RC[-10]*0.001813))))/60)/60 -> 23.436957879976621 | R345: =RC[-1]+0.00256*COS(RADIANS(125.04-1934.136*RC[-11])) -> 23.435055005696341 | S345: =DEGREES(ATAN2(COS(RADIANS(RC[-3])),COS(RADIANS(RC[-1]))*SIN(RADIANS(RC[-3])))) -> -101.96426279308621 | T345: =DEGREES(ASIN(SIN(RADIANS(RC[-2]))*SIN(RADIANS(RC[-4])))) -> -22.979329317819992 | U345: =TAN(RADIANS(RC[-3]/2))*TAN(RADIANS(RC[-3]/2)) -> 4.3018533411148113E-2 | V345: =4*DEGREES(RC[-1]*SIN(2*RADIANS(RC[-13]))-2*RC[-11]*SIN(RADIANS(RC[-12]))+4*RC[-11]*RC[-1]*SIN(RADIANS(RC[-12]))*COS(2*RADIANS(RC[-13]))-0.5*RC[-1]*RC[-1]*SIN(4*RADIANS(RC[-13]))-1.25*RC[-11]*RC[-11]*SIN(2*RADIANS(RC[-12]))) -> 6.9328100762201172 | W345: =DEGREES(ACOS(COS(RADIANS(90.833))/(COS(RADIANS(R2C2))*COS(RADIANS(RC[-3])))-TAN(RADIANS(R2C2))*TAN(RADIANS(RC[-3])))) -> #NUM! | X345: =(720-4*R3C2-RC[-2]+R4C2*60)/1440 -> 1899-12-31T13:49:04.031 | Y345: =(RC[-1]*1440-RC[-2]*4)/1440 -> #NUM! | Z345: =(RC[-2]*1440+RC[-3]*4)/1440 -> #NUM! | AA345: =8*RC[-4] -> #NUM! | AB345: =MOD(RC[-23]*1440+RC[-6]+4*R3C2-60*R4C2,1440) -> 730.93281007622011 | AC345: =IF(RC[-1]/4<0,RC[-1]/4+180,RC[-1]/4-180) -> 2.7332025190550269 | AD345: =DEGREES(ACOS(SIN(RADIANS(R2C2))*SIN(RADIANS(RC[-10]))+COS(RADIANS(R2C2))*COS(RADIANS(RC[-10]))*COS(RADIANS(RC[-1])))) -> 92.999880856978365 | AE345: =90-RC[-1] -> -2.9998808569783648 | AF345: =IF(RC[-1]>85,0,IF(RC[-1]>5,58.1/TAN(RADIANS(RC[-1]))-0.07/POWER(TAN(RADIANS(RC[-1])),3)+0.000086/POWER(TAN(RADIANS(RC[-1])),5),IF(RC[-1]>-0.575,1735+RC[-1]*(-518.2+RC[-1]*(103.4+RC[-1]*(-12.79+RC[-1]*0.711))),-20.772/TAN(RADIANS(RC[-1])))))/3600 -> 0.11010253933960491 | AG345: =RC[-2]+RC[-1] -> -2.8897783176387599 | AH345: =IF(RC[-5]>0,MOD(DEGREES(ACOS(((SIN(RADIANS(R2C2))*COS(RADIANS(RC[-4])))-SIN(RADIANS(RC[-14])))/(COS(RADIANS(R2C2))*SIN(RADIANS(RC[-4])))))+180,360),MOD(540-DEGREES(ACOS(((SIN(RADIANS(R2C2))*COS(RADIANS(RC[-4])))-SIN(RADIANS(RC[-14])))/(COS(RADIANS(R2C2))*SIN(RADIANS(RC[-4]))))),360)) -> 182.51962074190013
D346: =R[-1]C+1 -> 2017-12-11T00:00:00.000 | E346: =R5C2 -> 1899-12-31T14:00:00.000 | F346: =RC[-2]+2415018.5+RC[-1]-R4C2/24 -> 2458099.375 | G346: =(RC[-1]-2451545)/36525 -> 0.17944900752908965 | I346: =MOD(280.46646+RC[-2]*(36000.76983 + RC[-2]*0.0003032),360) -> 260.7688860403232 | J346: =357.52911+RC[-3]*(35999.05029 - 0.0001537*RC[-3]) -> 6817.5229515808478 | K346: =0.016708634-RC[-4]*(0.000042037+0.0000001267*RC[-4]) -> 1.6701086422083903E-2 | L346: =SIN(RADIANS(RC[-2]))*(1.914602-RC[-5]*(0.004817+0.000014*RC[-5]))+SIN(RADIANS(2*RC[-2]))*(0.019993-0.000101*RC[-5])+SIN(RADIANS(3*RC[-2]))*0.000289 -> -0.74602710592011179 | M346: =RC[-4]+RC[-1] -> 260.02285893440308 | N346: =RC[-4]+RC[-2] -> 6816.7769244749279 | O346: =(1.000001018*(1-RC[-4]*RC[-4]))/(1+RC[-4]*COS(RADIANS(RC[-1]))) -> 0.98461038212979524 | P346: =RC[-3]-0.00569-0.00478*SIN(RADIANS(125.04-1934.136*RC[-9])) -> 260.01396808620063 | Q346: =23+(26+((21.448-RC[-10]*(46.815+RC[-10]*(0.00059-RC[-10]*0.001813))))/60)/60 -> 23.436957523941665 | R346: =RC[-1]+0.00256*COS(RADIANS(125.04-1934.136*RC[-11])) -> 23.435056233199763 | S346: =DEGREES(ATAN2(COS(RADIANS(RC[-3])),COS(RADIANS(RC[-1]))*SIN(RADIANS(RC[-3])))) -> -100.86331095914974 | T346: =DEGREES(ASIN(SIN(RADIANS(RC[-2]))*SIN(RADIANS(RC[-4])))) -> -23.059327665009853 | U346: =TAN(RADIANS(RC[-3]/2))*TAN(RADIANS(RC[-3]/2)) -> 4.3018538045829856E-2 | V346: =4*DEGREES(RC[-1]*SIN(2*RADIANS(RC[-13]))-2*RC[-11]*SIN(RADIANS(RC[-12]))+4*RC[-11]*RC[-1]*SIN(RADIANS(RC[-12]))*COS(2*RADIANS(RC[-13]))-0.5*RC[-1]*RC[-1]*SIN(4*RADIANS(RC[-13]))-1.25*RC[-11]*RC[-11]*SIN(2*RADIANS(RC[-12]))) -> 6.4715717387005771 | W346: =DEGREES(ACOS(COS(RADIANS(90.833))/(COS(RADIANS(R2C2))*COS(RADIANS(RC[-3])))-TAN(RADIANS(R2C2))*TAN(RADIANS(RC[-3])))) -> #NUM! | X346: =(720-4*R3C2-RC[-2]+R4C2*60)/1440 -> 1899-12-31T13:49:31.706 | Y346: =(RC[-1]*1440-RC[-2]*4)/1440 -> #NUM! | Z346: =(RC[-2]*1440+RC[-3]*4)/1440 -> #NUM! | AA346: =8*RC[-4] -> #NUM! | AB346: =MOD(RC[-23]*1440+RC[-6]+4*R3C2-60*R4C2,1440) -> 730.47157173870062 | AC346: =IF(RC[-1]/4<0,RC[-1]/4+180,RC[-1]/4-180) -> 2.6178929346751545 | AD346: =DEGREES(ACOS(SIN(RADIANS(R2C2))*SIN(RADIANS(RC[-10]))+COS(RADIANS(R2C2))*COS(RADIANS(RC[-10]))*COS(RADIANS(RC[-1])))) -> 93.078172199145286 | AE346: =90-RC[-1] -> -3.0781721991452855 | AF346: =IF(RC[-1]>85,0,IF(RC[-1]>5,58.1/TAN(RADIANS(RC[-1]))-0.07/POWER(TAN(RADIANS(RC[-1])),3)+0.000086/POWER(TAN(RADIANS(RC[-1])),5),IF(RC[-1]>-0.575,1735+RC[-1]*(-518.2+RC[-1]*(103.4+RC[-1]*(-12.79+RC[-1]*0.711))),-20.772/TAN(RADIANS(RC[-1])))))/3600 -> 0.10729696028561377 | AG346: =RC[-2]+RC[-1] -> -2.9708752388596715 | AH346: =IF(RC[-5]>0,MOD(DEGREES(ACOS(((SIN(RADIANS(R2C2))*COS(RADIANS(RC[-4])))-SIN(RADIANS(RC[-14])))/(COS(RADIANS(R2C2))*SIN(RADIANS(RC[-4])))))+180,360),MOD(540-DEGREES(ACOS(((SIN(RADIANS(R2C2))*COS(RADIANS(RC[-4])))-SIN(RADIANS(RC[-14])))/(COS(RADIANS(R2C2))*SIN(RADIANS(RC[-4]))))),360)) -> 182.41207622294002
D347: =R[-1]C+1 -> 2017-12-12T00:00:00.000 | E347: =R5C2 -> 1899-12-31T14:00:00.000 | F347: =RC[-2]+2415018.5+RC[-1]-R4C2/24 -> 2458100.375 | G347: =(RC[-1]-2451545)/36525 -> 0.17947638603696098 | I347: =MOD(280.46646+RC[-2]*(36000.76983 + RC[-2]*0.0003032),360) -> 261.75453340346758 | J347: =357.52911+RC[-3]*(35999.05029 - 0.0001537*RC[-3]) -> 6818.5085518610631 | K347: =0.016708634-RC[-4]*(0.000042037+0.0000001267*RC[-4]) -> 1.6701085269928508E-2 | L347: =SIN(RADIANS(RC[-2]))*(1.914602-RC[-5]*(0.004817+0.000014*RC[-5]))+SIN(RADIANS(2*RC[-2]))*(0.019993-0.000101*RC[-5])+SIN(RADIANS(3*RC[-2]))*0.000289 -> -0.7150004496403326 | M347: =RC[-4]+RC[-1] -> 261.03953295382723 | N347: =RC[-4]+RC[-2] -> 6817.7935514114224 | O347: =(1.000001018*(1-RC[-4]*RC[-4]))/(1+RC[-4]*COS(RADIANS(RC[-1]))) -> 0.98449943313398713 | P347: =RC[-3]-0.00569-0.00478*SIN(RADIANS(125.04-1934.136*RC[-9])) -> 261.03063882595922 | Q347: =23+(26+((21.448-RC[-10]*(46.815+RC[-10]*(0.00059-RC[-10]*0.001813))))/60)/60 -> 23.436957167906705 | R347: =RC[-1]+0.00256*COS(RADIANS(125.04-1934.136*RC[-11])) -> 23.435057462327219 | S347: =DEGREES(ATAN2(COS(RADIANS(RC[-3])),COS(RADIANS(RC[-1]))*SIN(RADIANS(RC[-3])))) -> -99.760858400369386 | T347: =DEGREES(ASIN(SIN(RADIANS(RC[-2]))*SIN(RADIANS(RC[-4])))) -> -23.131709142426462 | U347: =TAN(RADIANS(RC[-3]/2))*TAN(RADIANS(RC[-3]/2)) -> 4.3018542686643728E-2 | V347: =4*DEGREES(RC[-1]*SIN(2*RADIANS(RC[-13]))-2*RC[-11]*SIN(RADIANS(RC[-12]))+4*RC[-11]*RC[-1]*SIN(RADIANS(RC[-12]))*COS(2*RADIANS(RC[-13]))-0.5*RC[-1]*RC[-1]*SIN(4*RADIANS(RC[-13]))-1.25*RC[-11]*RC[-11]*SIN(2*RADIANS(RC[-12]))) -> 6.0045206135950222 | W347: =DEGREES(ACOS(COS(RADIANS(90.833))/(COS(RADIANS(R2C2))*COS(RADIANS(RC[-3])))-TAN(RADIANS(R2C2))*TAN(RADIANS(RC[-3])))) -> #NUM! | X347: =(720-4*R3C2-RC[-2]+R4C2*60)/1440 -> 1899-12-31T13:49:59.729 | Y347: =(RC[-1]*1440-RC[-2]*4)/1440 -> #NUM! | Z347: =(RC[-2]*1440+RC[-3]*4)/1440 -> #NUM! | AA347: =8*RC[-4] -> #NUM! | AB347: =MOD(RC[-23]*1440+RC[-6]+4*R3C2-60*R4C2,1440) -> 730.00452061359499 | AC347: =IF(RC[-1]/4<0,RC[-1]/4+180,RC[-1]/4-180) -> 2.5011301533987478 | AD347: =DEGREES(ACOS(SIN(RADIANS(R2C2))*SIN(RADIANS(RC[-10]))+COS(RADIANS(R2C2))*COS(RADIANS(RC[-10]))*COS(RADIANS(RC[-1])))) -> 93.148902324780352 | AE347: =90-RC[-1] -> -3.1489023247803516 | AF347: =IF(RC[-1]>85,0,IF(RC[-1]>5,58.1/TAN(RADIANS(RC[-1]))-0.07/POWER(TAN(RADIANS(RC[-1])),3)+0.000086/POWER(TAN(RADIANS(RC[-1])),5),IF(RC[-1]>-0.575,1735+RC[-1]*(-518.2+RC[-1]*(103.4+RC[-1]*(-12.79+RC[-1]*0.711))),-20.772/TAN(RADIANS(RC[-1])))))/3600 -> 0.10488217650049052 | AG347: =RC[-2]+RC[-1] -> -3.044020148279861 | AH347: =IF(RC[-5]>0,MOD(DEGREES(ACOS(((SIN(RADIANS(R2C2))*COS(RADIANS(RC[-4])))-SIN(RADIANS(RC[-14])))/(COS(RADIANS(R2C2))*SIN(RADIANS(RC[-4])))))+180,360),MOD(540-DEGREES(ACOS(((SIN(RADIANS(R2C2))*COS(RADIANS(RC[-4])))-SIN(RADIANS(RC[-14])))/(COS(RADIANS(R2C2))*SIN(RADIANS(RC[-4]))))),360)) -> 182.30341673666044
D348: =R[-1]C+1 -> 2017-12-13T00:00:00.000 | E348: =R5C2 -> 1899-12-31T14:00:00.000 | F348: =RC[-2]+2415018.5+RC[-1]-R4C2/24 -> 2458101.375 | G348: =(RC[-1]-2451545)/36525 -> 0.1795037645448323 | I348: =MOD(280.46646+RC[-2]*(36000.76983 + RC[-2]*0.0003032),360) -> 262.74018076661014 | J348: =357.52911+RC[-3]*(35999.05029 - 0.0001537*RC[-3]) -> 6819.4941521412775 | K348: =0.016708634-RC[-4]*(0.000042037+0.0000001267*RC[-4]) -> 1.6701084117772921E-2 | L348: =SIN(RADIANS(RC[-2]))*(1.914602-RC[-5]*(0.004817+0.000014*RC[-5]))+SIN(RADIANS(2*RC[-2]))*(0.019993-0.000101*RC[-5])+SIN(RADIANS(3*RC[-2]))*0.000289 -> -0.68374952360163355 | M348: =RC[-4]+RC[-1] -> 262.05643124300849 | N348: =RC[-4]+RC[-2] -> 6818.8104026176761 | O348: =(1.000001018*(1-RC[-4]*RC[-4]))/(1+RC[-4]*COS(RADIANS(RC[-1]))) -> 0.98439320468009406 | P348: =RC[-3]-0.00569-0.00478*SIN(RADIANS(125.04-1934.136*RC[-9])) -> 262.04753383821173 | Q348: =23+(26+((21.448-RC[-10]*(46.815+RC[-10]*(0.00059-RC[-10]*0.001813))))/60)/60 -> 23.436956811871749 | R348: =RC[-1]+0.00256*COS(RADIANS(125.04-1934.136*RC[-11])) -> 23.435058693077366 | S348: =DEGREES(ATAN2(COS(RADIANS(RC[-3])),COS(RADIANS(RC[-1]))*SIN(RADIANS(RC[-3])))) -> -98.657034915051582 | T348: =DEGREES(ASIN(SIN(RADIANS(RC[-2]))*SIN(RADIANS(RC[-4])))) -> -23.196432850732005 | U348: =TAN(RADIANS(RC[-3]/2))*TAN(RADIANS(RC[-3]/2)) -> 4.3018547333584678E-2 | V348: =4*DEGREES(RC[-1]*SIN(2*RADIANS(RC[-13]))-2*RC[-11]*SIN(RADIANS(RC[-12]))+4*RC[-11]*RC[-1]*SIN(RADIANS(RC[-12]))*COS(2*RADIANS(RC[-13]))-0.5*RC[-1]*RC[-1]*SIN(4*RADIANS(RC[-13]))-1.25*RC[-11]*RC[-11]*SIN(2*RADIANS(RC[-12]))) -> 5.5321679783856981 | W348: =DEGREES(ACOS(COS(RADIANS(90.833))/(COS(RADIANS(R2C2))*COS(RADIANS(RC[-3])))-TAN(RADIANS(R2C2))*TAN(RADIANS(RC[-3])))) -> #NUM! | X348: =(720-4*R3C2-RC[-2]+R4C2*60)/1440 -> 1899-12-31T13:50:28.070 | Y348: =(RC[-1]*1440-RC[-2]*4)/1440 -> #NUM! | Z348: =(RC[-2]*1440+RC[-3]*4)/1440 -> #NUM! | AA348: =8*RC[-4] -> #NUM! | AB348: =MOD(RC[-23]*1440+RC[-6]+4*R3C2-60*R4C2,1440) -> 729.5321679783857 | AC348: =IF(RC[-1]/4<0,RC[-1]/4+180,RC[-1]/4-180) -> 2.3830419945964252 | AD348: =DEGREES(ACOS(SIN(RADIANS(R2C2))*SIN(RADIANS(RC[-10]))+COS(RADIANS(R2C2))*COS(RADIANS(RC[-10]))*COS(RADIANS(RC[-1])))) -> 93.21203449548959 | AE348: =90-RC[-1] -> -3.2120344954895899 | AF348: =IF(RC[-1]>85,0,IF(RC[-1]>5,58.1/TAN(RADIANS(RC[-1]))-0.07/POWER(TAN(RADIANS(RC[-1])),3)+0.000086/POWER(TAN(RADIANS(RC[-1])),5),IF(RC[-1]>-0.575,1735+RC[-1]*(-518.2+RC[-1]*(103.4+RC[-1]*(-12.79+RC[-1]*0.711))),-20.772/TAN(RADIANS(RC[-1])))))/3600 -> 0.1028165307387944 | AG348: =RC[-2]+RC[-1] -> -3.1092179647507954 | AH348: =IF(RC[-5]>0,MOD(DEGREES(ACOS(((SIN(RADIANS(R2C2))*COS(RADIANS(RC[-4])))-SIN(RADIANS(RC[-14])))/(COS(RADIANS(R2C2))*SIN(RADIANS(RC[-4])))))+180,360),MOD(540-DEGREES(ACOS(((SIN(RADIANS(R2C2))*COS(RADIANS(RC[-4])))-SIN(RADIANS(RC[-14])))/(COS(RADIANS(R2C2))*SIN(RADIANS(RC[-4]))))),360)) -> 182.19374654005469
D349: =R[-1]C+1 -> 2017-12-14T00:00:00.000 | E349: =R5C2 -> 1899-12-31T14:00:00.000 | F349: =RC[-2]+2415018.5+RC[-1]-R4C2/24 -> 2458102.375 | G349: =(RC[-1]-2451545)/36525 -> 0.17953114305270362 | I349: =MOD(280.46646+RC[-2]*(36000.76983 + RC[-2]*0.0003032),360) -> 263.72582812975543 | J349: =357.52911+RC[-3]*(35999.05029 - 0.0001537*RC[-3]) -> 6820.479752421491 | K349: =0.016708634-RC[-4]*(0.000042037+0.0000001267*RC[-4]) -> 1.6701082965617144E-2 | L349: =SIN(RADIANS(RC[-2]))*(1.914602-RC[-5]*(0.004817+0.000014*RC[-5]))+SIN(RADIANS(2*RC[-2]))*(0.019993-0.000101*RC[-5])+SIN(RADIANS(3*RC[-2]))*0.000289 -> -0.65228404432782272 | M349: =RC[-4]+RC[-1] -> 263.07354408542761 | N349: =RC[-4]+RC[-2] -> 6819.8274683771633 | O349: =(1.000001018*(1-RC[-4]*RC[-4]))/(1+RC[-4]*COS(RADIANS(RC[-1]))) -> 0.98429173124719049 | P349: =RC[-3]-0.00569-0.00478*SIN(RADIANS(125.04-1934.136*RC[-9])) -> 263.0646434064418 | Q349: =23+(26+((21.448-RC[-10]*(46.815+RC[-10]*(0.00059-RC[-10]*0.001813))))/60)/60 -> 23.436956455836793 | R349: =RC[-1]+0.00256*COS(RADIANS(125.04-1934.136*RC[-11])) -> 23.435059925448844 | S349: =DEGREES(ATAN2(COS(RADIANS(RC[-3])),COS(RADIANS(RC[-1]))*SIN(RADIANS(RC[-3])))) -> -97.551972764720247 | T349: =DEGREES(ASIN(SIN(RADIANS(RC[-2]))*SIN(RADIANS(RC[-4])))) -> -23.253461741538533 | U349: =TAN(RADIANS(RC[-3]/2))*TAN(RADIANS(RC[-3]/2)) -> 4.301855198664755E-2 | V349: =4*DEGREES(RC[-1]*SIN(2*RADIANS(RC[-13]))-2*RC[-11]*SIN(RADIANS(RC[-12]))+4*RC[-11]*RC[-1]*SIN(RADIANS(RC[-12]))*COS(2*RADIANS(RC[-13]))-0.5*RC[-1]*RC[-1]*SIN(4*RADIANS(RC[-13]))-1.25*RC[-11]*RC[-11]*SIN(2*RADIANS(RC[-12]))) -> 5.0550333790826985 | W349: =DEGREES(ACOS(COS(RADIANS(90.833))/(COS(RADIANS(R2C2))*COS(RADIANS(RC[-3])))-TAN(RADIANS(R2C2))*TAN(RADIANS(RC[-3])))) -> #NUM! | X349: =(720-4*R3C2-RC[-2]+R4C2*60)/1440 -> 1899-12-31T13:50:56.698 | Y349: =(RC[-1]*1440-RC[-2]*4)/1440 -> #NUM! | Z349: =(RC[-2]*1440+RC[-3]*4)/1440 -> #NUM! | AA349: =8*RC[-4] -> #NUM! | AB349: =MOD(RC[-23]*1440+RC[-6]+4*R3C2-60*R4C2,1440) -> 729.05503337908272 | AC349: =IF(RC[-1]/4<0,RC[-1]/4+180,RC[-1]/4-180) -> 2.2637583447706788 | AD349: =DEGREES(ACOS(SIN(RADIANS(R2C2))*SIN(RADIANS(RC[-10]))+COS(RADIANS(R2C2))*COS(RADIANS(RC[-10]))*COS(RADIANS(RC[-1])))) -> 93.267535556080574 | AE349: =90-RC[-1] -> -3.2675355560805741 | AF349: =IF(RC[-1]>85,0,IF(RC[-1]>5,58.1/TAN(RADIANS(RC[-1]))-0.07/POWER(TAN(RADIANS(RC[-1])),3)+0.000086/POWER(TAN(RADIANS(RC[-1])),5),IF(RC[-1]>-0.575,1735+RC[-1]*(-518.2+RC[-1]*(103.4+RC[-1]*(-12.79+RC[-1]*0.711))),-20.772/TAN(RADIANS(RC[-1])))))/3600 -> 0.10106643389729233 | AG349: =RC[-2]+RC[-1] -> -3.1664691221832819 | AH349: =IF(RC[-5]>0,MOD(DEGREES(ACOS(((SIN(RADIANS(R2C2))*COS(RADIANS(RC[-4])))-SIN(RADIANS(RC[-14])))/(COS(RADIANS(R2C2))*SIN(RADIANS(RC[-4])))))+180,360),MOD(540-DEGREES(ACOS(((SIN(RADIANS(R2C2))*COS(RADIANS(RC[-4])))-SIN(RADIANS(RC[-14])))/(COS(RADIANS(R2C2))*SIN(RADIANS(RC[-4]))))),360)) -> 182.0831710450133
D350: =R[-1]C+1 -> 2017-12-15T00:00:00.000 | E350: =R5C2 -> 1899-12-31T14:00:00.000 | F350: =RC[-2]+2415018.5+RC[-1]-R4C2/24 -> 2458103.375 | G350: =(RC[-1]-2451545)/36525 -> 0.17955852156057495 | I350: =MOD(280.46646+RC[-2]*(36000.76983 + RC[-2]*0.0003032),360) -> 264.71147549290072 | J350: =357.52911+RC[-3]*(35999.05029 - 0.0001537*RC[-3]) -> 6821.4653527017053 | K350: =0.016708634-RC[-4]*(0.000042037+0.0000001267*RC[-4]) -> 1.670108181346118E-2 | L350: =SIN(RADIANS(RC[-2]))*(1.914602-RC[-5]*(0.004817+0.000014*RC[-5]))+SIN(RADIANS(2*RC[-2]))*(0.019993-0.000101*RC[-5])+SIN(RADIANS(3*RC[-2]))*0.000289 -> -0.62061380719807113 | M350: =RC[-4]+RC[-1] -> 264.09086168570263 | N350: =RC[-4]+RC[-2] -> 6820.8447388945069 | O350: =(1.000001018*(1-RC[-4]*RC[-4]))/(1+RC[-4]*COS(RADIANS(RC[-1]))) -> 0.98419504579147155 | P350: =RC[-3]-0.00569-0.00478*SIN(RADIANS(125.04-1934.136*RC[-9])) -> 264.08195773527029 | Q350: =23+(26+((21.448-RC[-10]*(46.815+RC[-10]*(0.00059-RC[-10]*0.001813))))/60)/60 -> 23.436956099801833 | R350: =RC[-1]+0.00256*COS(RADIANS(125.04-1934.136*RC[-11])) -> 23.435061159440291 | S350: =DEGREES(ATAN2(COS(RADIANS(RC[-3])),COS(RADIANS(RC[-1]))*SIN(RADIANS(RC[-3])))) -> -96.445806437272765 | T350: =DEGREES(ASIN(SIN(RADIANS(RC[-2]))*SIN(RADIANS(RC[-4])))) -> -23.302762682033848 | U350: =TAN(RADIANS(RC[-3]/2))*TAN(RADIANS(RC[-3]/2)) -> 4.3018556645827211E-2 | V350: =4*DEGREES(RC[-1]*SIN(2*RADIANS(RC[-13]))-2*RC[-11]*SIN(RADIANS(RC[-12]))+4*RC[-11]*RC[-1]*SIN(RADIANS(RC[-12]))*COS(2*RADIANS(RC[-13]))-0.5*RC[-1]*RC[-1]*SIN(4*RADIANS(RC[-13]))-1.25*RC[-11]*RC[-11]*SIN(2*RADIANS(RC[-12]))) -> 4.5736437822274576 | W350: =DEGREES(ACOS(COS(RADIANS(90.833))/(COS(RADIANS(R2C2))*COS(RADIANS(RC[-3])))-TAN(RADIANS(R2C2))*TAN(RADIANS(RC[-3])))) -> #NUM! | X350: =(720-4*R3C2-RC[-2]+R4C2*60)/1440 -> 1899-12-31T13:51:25.581 | Y350: =(RC[-1]*1440-RC[-2]*4)/1440 -> #NUM! | Z350: =(RC[-2]*1440+RC[-3]*4)/1440 -> #NUM! | AA350: =8*RC[-4] -> #NUM! | AB350: =MOD(RC[-23]*1440+RC[-6]+4*R3C2-60*R4C2,1440) -> 728.57364378222746 | AC350: =IF(RC[-1]/4<0,RC[-1]/4+180,RC[-1]/4-180) -> 2.143410945556866 | AD350: =DEGREES(ACOS(SIN(RADIANS(R2C2))*SIN(RADIANS(RC[-10]))+COS(RADIANS(R2C2))*COS(RADIANS(RC[-10]))*COS(RADIANS(RC[-1])))) -> 93.315375983957736 | AE350: =90-RC[-1] -> -3.3153759839577361 | AF350: =IF(RC[-1]>85,0,IF(RC[-1]>5,58.1/TAN(RADIANS(RC[-1]))-0.07/POWER(TAN(RADIANS(RC[-1])),3)+0.000086/POWER(TAN(RADIANS(RC[-1])),5),IF(RC[-1]>-0.575,1735+RC[-1]*(-518.2+RC[-1]*(103.4+RC[-1]*(-12.79+RC[-1]*0.711))),-20.772/TAN(RADIANS(RC[-1])))))/3600 -> 9.9604868806810187E-2 | AG350: =RC[-2]+RC[-1] -> -3.2157711151509258 | AH350: =IF(RC[-5]>0,MOD(DEGREES(ACOS(((SIN(RADIANS(R2C2))*COS(RADIANS(RC[-4])))-SIN(RADIANS(RC[-14])))/(COS(RADIANS(R2C2))*SIN(RADIANS(RC[-4])))))+180,360),MOD(540-DEGREES(ACOS(((SIN(RADIANS(R2C2))*COS(RADIANS(RC[-4])))-SIN(RADIANS(RC[-14])))/(COS(RADIANS(R2C2))*SIN(RADIANS(RC[-4]))))),360)) -> 181.97179668850302
D351: =R[-1]C+1 -> 2017-12-16T00:00:00.000 | E351: =R5C2 -> 1899-12-31T14:00:00.000 | F351: =RC[-2]+2415018.5+RC[-1]-R4C2/24 -> 2458104.375 | G351: =(RC[-1]-2451545)/36525 -> 0.17958590006844627 | I351: =MOD(280.46646+RC[-2]*(36000.76983 + RC[-2]*0.0003032),360) -> 265.69712285604692 | J351: =357.52911+RC[-3]*(35999.05029 - 0.0001537*RC[-3]) -> 6822.4509529819188 | K351: =0.016708634-RC[-4]*(0.000042037+0.0000001267*RC[-4]) -> 1.6701080661305021E-2 | L351: =SIN(RADIANS(RC[-2]))*(1.914602-RC[-5]*(0.004817+0.000014*RC[-5]))+SIN(RADIANS(2*RC[-2]))*(0.019993-0.000101*RC[-5])+SIN(RADIANS(3*RC[-2]))*0.000289 -> -0.58874868294867144 | M351: =RC[-4]+RC[-1] -> 265.10837417309824 | N351: =RC[-4]+RC[-2] -> 6821.86220429897 | O351: =(1.000001018*(1-RC[-4]*RC[-4]))/(1+RC[-4]*COS(RADIANS(RC[-1]))) -> 0.9841031797327342 | P351: =RC[-3]-0.00569-0.00478*SIN(RADIANS(125.04-1934.136*RC[-9])) -> 265.09946695396462 | Q351: =23+(26+((21.448-RC[-10]*(46.815+RC[-10]*(0.00059-RC[-10]*0.001813))))/60)/60 -> 23.436955743766877 | R351: =RC[-1]+0.00256*COS(RADIANS(125.04-1934.136*RC[-11])) -> 23.435062395050362 | S351: =DEGREES(ATAN2(COS(RADIANS(RC[-3])),COS(RADIANS(RC[-1]))*SIN(RADIANS(RC[-3])))) -> -95.338672401804388 | T351: =DEGREES(ASIN(SIN(RADIANS(RC[-2]))*SIN(RADIANS(RC[-4])))) -> -23.344306513409173 | U351: =TAN(RADIANS(RC[-3]/2))*TAN(RADIANS(RC[-3]/2)) -> 4.3018561311118579E-2 | V351: =4*DEGREES(RC[-1]*SIN(2*RADIANS(RC[-13]))-2*RC[-11]*SIN(RADIANS(RC[-12]))+4*RC[-11]*RC[-1]*SIN(RADIANS(RC[-12]))*COS(2*RADIANS(RC[-13]))-0.5*RC[-1]*RC[-1]*SIN(4*RADIANS(RC[-13]))-1.25*RC[-11]*RC[-11]*SIN(2*RADIANS(RC[-12]))) -> 4.0885327081466736 | W351: =DEGREES(ACOS(COS(RADIANS(90.833))/(COS(RADIANS(R2C2))*COS(RADIANS(RC[-3])))-TAN(RADIANS(R2C2))*TAN(RADIANS(RC[-3])))) -> #NUM! | X351: =(720-4*R3C2-RC[-2]+R4C2*60)/1440 -> 1899-12-31T13:51:54.688 | Y351: =(RC[-1]*1440-RC[-2]*4)/1440 -> #NUM! | Z351: =(RC[-2]*1440+RC[-3]*4)/1440 -> #NUM! | AA351: =8*RC[-4] -> #NUM! | AB351: =MOD(RC[-23]*1440+RC[-6]+4*R3C2-60*R4C2,1440) -> 728.08853270814666 | AC351: =IF(RC[-1]/4<0,RC[-1]/4+180,RC[-1]/4-180) -> 2.0221331770366646 | AD351: =DEGREES(ACOS(SIN(RADIANS(R2C2))*SIN(RADIANS(RC[-10]))+COS(RADIANS(R2C2))*COS(RADIANS(RC[-10]))*COS(RADIANS(RC[-1])))) -> 93.355529933677445 | AE351: =90-RC[-1] -> -3.3555299336774453 | AF351: =IF(RC[-1]>85,0,IF(RC[-1]>5,58.1/TAN(RADIANS(RC[-1]))-0.07/POWER(TAN(RADIANS(RC[-1])),3)+0.000086/POWER(TAN(RADIANS(RC[-1])),5),IF(RC[-1]>-0.575,1735+RC[-1]*(-518.2+RC[-1]*(103.4+RC[-1]*(-12.79+RC[-1]*0.711))),-20.772/TAN(RADIANS(RC[-1])))))/3600 -> 9.8410266224029472E-2 | AG351: =RC[-2]+RC[-1] -> -3.257119667453416 | AH351: =IF(RC[-5]>0,MOD(DEGREES(ACOS(((SIN(RADIANS(R2C2))*COS(RADIANS(RC[-4])))-SIN(RADIANS(RC[-14])))/(COS(RADIANS(R2C2))*SIN(RADIANS(RC[-4])))))+180,360),MOD(540-DEGREES(ACOS(((SIN(RADIANS(R2C2))*COS(RADIANS(RC[-4])))-SIN(RADIANS(RC[-14])))/(COS(RADIANS(R2C2))*SIN(RADIANS(RC[-4]))))),360)) -> 181.85973080176188
D352: =R[-1]C+1 -> 2017-12-17T00:00:00.000 | E352: =R5C2 -> 1899-12-31T14:00:00.000 | F352: =RC[-2]+2415018.5+RC[-1]-R4C2/24 -> 2458105.375 | G352: =(RC[-1]-2451545)/36525 -> 0.17961327857631759 | I352: =MOD(280.46646+RC[-2]*(36000.76983 + RC[-2]*0.0003032),360) -> 266.68277021919312 | J352: =357.52911+RC[-3]*(35999.05029 - 0.0001537*RC[-3]) -> 6823.4365532621314 | K352: =0.016708634-RC[-4]*(0.000042037+0.0000001267*RC[-4]) -> 1.6701079509148675E-2 | L352: =SIN(RADIANS(RC[-2]))*(1.914602-RC[-5]*(0.004817+0.000014*RC[-5]))+SIN(RADIANS(2*RC[-2]))*(0.019993-0.000101*RC[-5])+SIN(RADIANS(3*RC[-2]))*0.000289 -> -0.5566986141328234 | M352: =RC[-4]+RC[-1] -> 266.1260716050603 | N352: =RC[-4]+RC[-2] -> 6822.8798546479984 | O352: =(1.000001018*(1-RC[-4]*RC[-4]))/(1+RC[-4]*COS(RADIANS(RC[-1]))) -> 0.98401616294146221 | P352: =RC[-3]-0.00569-0.00478*SIN(RADIANS(125.04-1934.136*RC[-9])) -> 266.1171611199735 | Q352: =23+(26+((21.448-RC[-10]*(46.815+RC[-10]*(0.00059-RC[-10]*0.001813))))/60)/60 -> 23.436955387731921 | R352: =RC[-1]+0.00256*COS(RADIANS(125.04-1934.136*RC[-11])) -> 23.435063632277686 | S352: =DEGREES(ATAN2(COS(RADIANS(RC[-3])),COS(RADIANS(RC[-1]))*SIN(RADIANS(RC[-3])))) -> -94.230708855988226 | T352: =DEGREES(ASIN(SIN(RADIANS(RC[-2]))*SIN(RADIANS(RC[-4])))) -> -23.378068102833431 | U352: =TAN(RADIANS(RC[-3]/2))*TAN(RADIANS(RC[-3]/2)) -> 4.301856598251648E-2 | V352: =4*DEGREES(RC[-1]*SIN(2*RADIANS(RC[-13]))-2*RC[-11]*SIN(RADIANS(RC[-12]))+4*RC[-11]*RC[-1]*SIN(RADIANS(RC[-12]))*COS(2*RADIANS(RC[-13]))-0.5*RC[-1]*RC[-1]*SIN(4*RADIANS(RC[-13]))-1.25*RC[-11]*RC[-11]*SIN(2*RADIANS(RC[-12]))) -> 3.60023934767064 | W352: =DEGREES(ACOS(COS(RADIANS(90.833))/(COS(RADIANS(R2C2))*COS(RADIANS(RC[-3])))-TAN(RADIANS(R2C2))*TAN(RADIANS(RC[-3])))) -> #NUM! | X352: =(720-4*R3C2-RC[-2]+R4C2*60)/1440 -> 1899-12-31T13:52:23.986 | Y352: =(RC[-1]*1440-RC[-2]*4)/1440 -> #NUM! | Z352: =(RC[-2]*1440+RC[-3]*4)/1440 -> #NUM! | AA352: =8*RC[-4] -> #NUM! | AB352: =MOD(RC[-23]*1440+RC[-6]+4*R3C2-60*R4C2,1440) -> 727.60023934767059 | AC352: =IF(RC[-1]/4<0,RC[-1]/4+180,RC[-1]/4-180) -> 1.9000598369176487 | AD352: =DEGREES(ACOS(SIN(RADIANS(R2C2))*SIN(RADIANS(RC[-10]))+COS(RADIANS(R2C2))*COS(RADIANS(RC[-10]))*COS(RADIANS(RC[-1])))) -> 93.387975276479509 | AE352: =90-RC[-1] -> -3.3879752764795086 | AF352: =IF(RC[-1]>85,0,IF(RC[-1]>5,58.1/TAN(RADIANS(RC[-1]))-0.07/POWER(TAN(RADIANS(RC[-1])),3)+0.000086/POWER(TAN(RADIANS(RC[-1])),5),IF(RC[-1]>-0.575,1735+RC[-1]*(-518.2+RC[-1]*(103.4+RC[-1]*(-12.79+RC[-1]*0.711))),-20.772/TAN(RADIANS(RC[-1])))))/3600 -> 9.7465659907278207E-2 | AG352: =RC[-2]+RC[-1] -> -3.2905096165722303 | AH352: =IF(RC[-5]>0,MOD(DEGREES(ACOS(((SIN(RADIANS(R2C2))*COS(RADIANS(RC[-4])))-SIN(RADIANS(RC[-14])))/(COS(RADIANS(R2C2))*SIN(RADIANS(RC[-4])))))+180,360),MOD(540-DEGREES(ACOS(((SIN(RADIANS(R2C2))*COS(RADIANS(RC[-4])))-SIN(RADIANS(RC[-14])))/(COS(RADIANS(R2C2))*SIN(RADIANS(RC[-4]))))),360)) -> 181.74708147872477
D353: =R[-1]C+1 -> 2017-12-18T00:00:00.000 | E353: =R5C2 -> 1899-12-31T14:00:00.000 | F353: =RC[-2]+2415018.5+RC[-1]-R4C2/24 -> 2458106.375 | G353: =(RC[-1]-2451545)/36525 -> 0.17964065708418891 | I353: =MOD(280.46646+RC[-2]*(36000.76983 + RC[-2]*0.0003032),360) -> 267.66841758233932 | J353: =357.52911+RC[-3]*(35999.05029 - 0.0001537*RC[-3]) -> 6824.4221535423458 | K353: =0.016708634-RC[-4]*(0.000042037+0.0000001267*RC[-4]) -> 1.6701078356992142E-2 | L353: =SIN(RADIANS(RC[-2]))*(1.914602-RC[-5]*(0.004817+0.000014*RC[-5]))+SIN(RADIANS(2*RC[-2]))*(0.019993-0.000101*RC[-5])+SIN(RADIANS(3*RC[-2]))*0.000289 -> -0.52447361153990768 | M353: =RC[-4]+RC[-1] -> 267.1439439707994 | N353: =RC[-4]+RC[-2] -> 6823.8976799308057 | O353: =(1.000001018*(1-RC[-4]*RC[-4]))/(1+RC[-4]*COS(RADIANS(RC[-1]))) -> 0.9839340237265245 | P353: =RC[-3]-0.00569-0.00478*SIN(RADIANS(125.04-1934.136*RC[-9])) -> 267.1350302225103 | Q353: =23+(26+((21.448-RC[-10]*(46.815+RC[-10]*(0.00059-RC[-10]*0.001813))))/60)/60 -> 23.436955031696964 | R353: =RC[-1]+0.00256*COS(RADIANS(125.04-1934.136*RC[-11])) -> 23.435064871120904 | S353: =DEGREES(ATAN2(COS(RADIANS(RC[-3])),COS(RADIANS(RC[-1]))*SIN(RADIANS(RC[-3])))) -> -93.122055466877981 | T353: =DEGREES(ASIN(SIN(RADIANS(RC[-2]))*SIN(RADIANS(RC[-4])))) -> -23.404026388749593 | U353: =TAN(RADIANS(RC[-3]/2))*TAN(RADIANS(RC[-3]/2)) -> 4.301857066001577E-2 | V353: =4*DEGREES(RC[-1]*SIN(2*RADIANS(RC[-13]))-2*RC[-11]*SIN(RADIANS(RC[-12]))+4*RC[-11]*RC[-1]*SIN(RADIANS(RC[-12]))*COS(2*RADIANS(RC[-13]))-0.5*RC[-1]*RC[-1]*SIN(4*RADIANS(RC[-13]))-1.25*RC[-11]*RC[-11]*SIN(2*RADIANS(RC[-12]))) -> 3.1093076645623619 | W353: =DEGREES(ACOS(COS(RADIANS(90.833))/(COS(RADIANS(R2C2))*COS(RADIANS(RC[-3])))-TAN(RADIANS(R2C2))*TAN(RADIANS(RC[-3])))) -> #NUM! | X353: =(720-4*R3C2-RC[-2]+R4C2*60)/1440 -> 1899-12-31T13:52:53.442 | Y353: =(RC[-1]*1440-RC[-2]*4)/1440 -> #NUM! | Z353: =(RC[-2]*1440+RC[-3]*4)/1440 -> #NUM! | AA353: =8*RC[-4] -> #NUM! | AB353: =MOD(RC[-23]*1440+RC[-6]+4*R3C2-60*R4C2,1440) -> 727.10930766456238 | AC353: =IF(RC[-1]/4<0,RC[-1]/4+180,RC[-1]/4-180) -> 1.7773269161405949 | AD353: =DEGREES(ACOS(SIN(RADIANS(R2C2))*SIN(RADIANS(RC[-10]))+COS(RADIANS(R2C2))*COS(RADIANS(RC[-10]))*COS(RADIANS(RC[-1])))) -> 93.412693634633399 | AE353: =90-RC[-1] -> -3.4126936346333991 | AF353: =IF(RC[-1]>85,0,IF(RC[-1]>5,58.1/TAN(RADIANS(RC[-1]))-0.07/POWER(TAN(RADIANS(RC[-1])),3)+0.000086/POWER(TAN(RADIANS(RC[-1])),5),IF(RC[-1]>-0.575,1735+RC[-1]*(-518.2+RC[-1]*(103.4+RC[-1]*(-12.79+RC[-1]*0.711))),-20.772/TAN(RADIANS(RC[-1])))))/3600 -> 9.6758055618738653E-2 | AG353: =RC[-2]+RC[-1] -> -3.3159355790146603 | AH353: =IF(RC[-5]>0,MOD(DEGREES(ACOS(((SIN(RADIANS(R2C2))*COS(RADIANS(RC[-4])))-SIN(RADIANS(RC[-14])))/(COS(RADIANS(R2C2))*SIN(RADIANS(RC[-4])))))+180,360),MOD(540-DEGREES(ACOS(((SIN(RADIANS(R2C2))*COS(RADIANS(RC[-4])))-SIN(RADIANS(RC[-14])))/(COS(RADIANS(R2C2))*SIN(RADIANS(RC[-4]))))),360)) -> 181.63395744381179
D354: =R[-1]C+1 -> 2017-12-19T00:00:00.000 | E354: =R5C2 -> 1899-12-31T14:00:00.000 | F354: =RC[-2]+2415018.5+RC[-1]-R4C2/24 -> 2458107.375 | G354: =(RC[-1]-2451545)/36525 -> 0.17966803559206024 | I354: =MOD(280.46646+RC[-2]*(36000.76983 + RC[-2]*0.0003032),360) -> 268.65406494548643 | J354: =357.52911+RC[-3]*(35999.05029 - 0.0001537*RC[-3]) -> 6825.4077538225574 | K354: =0.016708634-RC[-4]*(0.000042037+0.0000001267*RC[-4]) -> 1.6701077204835414E-2 | L354: =SIN(RADIANS(RC[-2]))*(1.914602-RC[-5]*(0.004817+0.000014*RC[-5]))+SIN(RADIANS(2*RC[-2]))*(0.019993-0.000101*RC[-5])+SIN(RADIANS(3*RC[-2]))*0.000289 -> -0.49208375057717901 | M354: =RC[-4]+RC[-1] -> 268.16198119490923 | N354: =RC[-4]+RC[-2] -> 6824.9156700719805 | O354: =(1.000001018*(1-RC[-4]*RC[-4]))/(1+RC[-4]*COS(RADIANS(RC[-1]))) -> 0.98385678882349725 | P354: =RC[-3]-0.00569-0.00478*SIN(RADIANS(125.04-1934.136*RC[-9])) -> 268.15306418617149 | Q354: =23+(26+((21.448-RC[-10]*(46.815+RC[-10]*(0.00059-RC[-10]*0.001813))))/60)/60 -> 23.436954675662008 | R354: =RC[-1]+0.00256*COS(RADIANS(125.04-1934.136*RC[-11])) -> 23.43506611157866 | S354: =DEGREES(ATAN2(COS(RADIANS(RC[-3])),COS(RADIANS(RC[-1]))*SIN(RADIANS(RC[-3])))) -> -92.012853106085487 | T354: =DEGREES(ASIN(SIN(RADIANS(RC[-2]))*SIN(RADIANS(RC[-4])))) -> -23.422164419294575 | U354: =TAN(RADIANS(RC[-3]/2))*TAN(RADIANS(RC[-3]/2)) -> 4.3018575343611365E-2 | V354: =4*DEGREES(RC[-1]*SIN(2*RADIANS(RC[-13]))-2*RC[-11]*SIN(RADIANS(RC[-12]))+4*RC[-11]*RC[-1]*SIN(RADIANS(RC[-12]))*COS(2*RADIANS(RC[-13]))-0.5*RC[-1]*RC[-1]*SIN(4*RADIANS(RC[-13]))-1.25*RC[-11]*RC[-11]*SIN(2*RADIANS(RC[-12]))) -> 2.6162854859726492 | W354: =DEGREES(ACOS(COS(RADIANS(90.833))/(COS(RADIANS(R2C2))*COS(RADIANS(RC[-3])))-TAN(RADIANS(R2C2))*TAN(RADIANS(RC[-3])))) -> #NUM! | X354: =(720-4*R3C2-RC[-2]+R4C2*60)/1440 -> 1899-12-31T13:53:23.023 | Y354: =(RC[-1]*1440-RC[-2]*4)/1440 -> #NUM! | Z354: =(RC[-2]*1440+RC[-3]*4)/1440 -> #NUM! | AA354: =8*RC[-4] -> #NUM! | AB354: =MOD(RC[-23]*1440+RC[-6]+4*R3C2-60*R4C2,1440) -> 726.61628548597264 | AC354: =IF(RC[-1]/4<0,RC[-1]/4+180,RC[-1]/4-180) -> 1.6540713714931599 | AD354: =DEGREES(ACOS(SIN(RADIANS(R2C2))*SIN(RADIANS(RC[-10]))+COS(RADIANS(R2C2))*COS(RADIANS(RC[-10]))*COS(RADIANS(RC[-1])))) -> 93.429670410455941 | AE354: =90-RC[-1] -> -3.429670410455941 | AF354: =IF(RC[-1]>85,0,IF(RC[-1]>5,58.1/TAN(RADIANS(RC[-1]))-0.07/POWER(TAN(RADIANS(RC[-1])),3)+0.000086/POWER(TAN(RADIANS(RC[-1])),5),IF(RC[-1]>-0.575,1735+RC[-1]*(-518.2+RC[-1]*(103.4+RC[-1]*(-12.79+RC[-1]*0.711))),-20.772/TAN(RADIANS(RC[-1])))))/3600 -> 9.6277968369316694E-2 | AG354: =RC[-2]+RC[-1] -> -3.3333924420866241 | AH354: =IF(RC[-5]>0,MOD(DEGREES(ACOS(((SIN(RADIANS(R2C2))*COS(RADIANS(RC[-4])))-SIN(RADIANS(RC[-14])))/(COS(RADIANS(R2C2))*SIN(RADIANS(RC[-4])))))+180,360),MOD(540-DEGREES(ACOS(((SIN(RADIANS(R2C2))*COS(RADIANS(RC[-4])))-SIN(RADIANS(RC[-14])))/(COS(RADIANS(R2C2))*SIN(RADIANS(RC[-4]))))),360)) -> 181.52046791925594
D355: =R[-1]C+1 -> 2017-12-20T00:00:00.000 | E355: =R5C2 -> 1899-12-31T14:00:00.000 | F355: =RC[-2]+2415018.5+RC[-1]-R4C2/24 -> 2458108.375 | G355: =(RC[-1]-2451545)/36525 -> 0.17969541409993156 | I355: =MOD(280.46646+RC[-2]*(36000.76983 + RC[-2]*0.0003032),360) -> 269.63971230863444 | J355: =357.52911+RC[-3]*(35999.05029 - 0.0001537*RC[-3]) -> 6826.3933541027709 | K355: =0.016708634-RC[-4]*(0.000042037+0.0000001267*RC[-4]) -> 1.6701076052678499E-2 | L355: =SIN(RADIANS(RC[-2]))*(1.914602-RC[-5]*(0.004817+0.000014*RC[-5]))+SIN(RADIANS(2*RC[-2]))*(0.019993-0.000101*RC[-5])+SIN(RADIANS(3*RC[-2]))*0.000289 -> -0.4595391676138994 | M355: =RC[-4]+RC[-1] -> 269.18017314102053 | N355: =RC[-4]+RC[-2] -> 6825.933814935157 | O355: =(1.000001018*(1-RC[-4]*RC[-4]))/(1+RC[-4]*COS(RADIANS(RC[-1]))) -> 0.9837844833836149 | P355: =RC[-3]-0.00569-0.00478*SIN(RADIANS(125.04-1934.136*RC[-9])) -> 269.17125287459055 | Q355: =23+(26+((21.448-RC[-10]*(46.815+RC[-10]*(0.00059-RC[-10]*0.001813))))/60)/60 -> 23.436954319627052 | R355: =RC[-1]+0.00256*COS(RADIANS(125.04-1934.136*RC[-11])) -> 23.435067353649583 | S355: =DEGREES(ATAN2(COS(RADIANS(RC[-3])),COS(RADIANS(RC[-1]))*SIN(RADIANS(RC[-3])))) -> -90.903243580312378 | T355: =DEGREES(ASIN(SIN(RADIANS(RC[-2]))*SIN(RADIANS(RC[-4])))) -> -23.432469383674697 | U355: =TAN(RADIANS(RC[-3]/2))*TAN(RADIANS(RC[-3]/2)) -> 4.3018580033298073E-2 | V355: =4*DEGREES(RC[-1]*SIN(2*RADIANS(RC[-13]))-2*RC[-11]*SIN(RADIANS(RC[-12]))+4*RC[-11]*RC[-1]*SIN(RADIANS(RC[-12]))*COS(2*RADIANS(RC[-13]))-0.5*RC[-1]*RC[-1]*SIN(4*RADIANS(RC[-13]))-1.25*RC[-11]*RC[-11]*SIN(2*RADIANS(RC[-12]))) -> 2.1217235832605481 | W355: =DEGREES(ACOS(COS(RADIANS(90.833))/(COS(RADIANS(R2C2))*COS(RADIANS(RC[-3])))-TAN(RADIANS(R2C2))*TAN(RADIANS(RC[-3])))) -> #NUM! | X355: =(720-4*R3C2-RC[-2]+R4C2*60)/1440 -> 1899-12-31T13:53:52.697 | Y355: =(RC[-1]*1440-RC[-2]*4)/1440 -> #NUM! | Z355: =(RC[-2]*1440+RC[-3]*4)/1440 -> #NUM! | AA355: =8*RC[-4] -> #NUM! | AB355: =MOD(RC[-23]*1440+RC[-6]+4*R3C2-60*R4C2,1440) -> 726.12172358326052 | AC355: =IF(RC[-1]/4<0,RC[-1]/4+180,RC[-1]/4-180) -> 1.5304308958151296 | AD355: =DEGREES(ACOS(SIN(RADIANS(R2C2))*SIN(RADIANS(RC[-10]))+COS(RADIANS(R2C2))*COS(RADIANS(RC[-10]))*COS(RADIANS(RC[-1])))) -> 93.438894809878164 | AE355: =90-RC[-1] -> -3.438894809878164 | AF355: =IF(RC[-1]>85,0,IF(RC[-1]>5,58.1/TAN(RADIANS(RC[-1]))-0.07/POWER(TAN(RADIANS(RC[-1])),3)+0.000086/POWER(TAN(RADIANS(RC[-1])),5),IF(RC[-1]>-0.575,1735+RC[-1]*(-518.2+RC[-1]*(103.4+RC[-1]*(-12.79+RC[-1]*0.711))),-20.772/TAN(RADIANS(RC[-1])))))/3600 -> 9.6019096158793296E-2 | AG355: =RC[-2]+RC[-1] -> -3.3428757137193705 | AH355: =IF(RC[-5]>0,MOD(DEGREES(ACOS(((SIN(RADIANS(R2C2))*COS(RADIANS(RC[-4])))-SIN(RADIANS(RC[-14])))/(COS(RADIANS(R2C2))*SIN(RADIANS(RC[-4])))))+180,360),MOD(540-DEGREES(ACOS(((SIN(RADIANS(R2C2))*COS(RADIANS(RC[-4])))-SIN(RADIANS(RC[-14])))/(COS(RADIANS(R2C2))*SIN(RADIANS(RC[-4]))))),360)) -> 181.40672249211846
D356: =R[-1]C+1 -> 2017-12-21T00:00:00.000 | E356: =R5C2 -> 1899-12-31T14:00:00.000 | F356: =RC[-2]+2415018.5+RC[-1]-R4C2/24 -> 2458109.375 | G356: =(RC[-1]-2451545)/36525 -> 0.17972279260780288 | I356: =MOD(280.46646+RC[-2]*(36000.76983 + RC[-2]*0.0003032),360) -> 270.62535967178246 | J356: =357.52911+RC[-3]*(35999.05029 - 0.0001537*RC[-3]) -> 6827.3789543829835 | K356: =0.016708634-RC[-4]*(0.000042037+0.0000001267*RC[-4]) -> 1.6701074900521393E-2 | L356: =SIN(RADIANS(RC[-2]))*(1.914602-RC[-5]*(0.004817+0.000014*RC[-5]))+SIN(RADIANS(2*RC[-2]))*(0.019993-0.000101*RC[-5])+SIN(RADIANS(3*RC[-2]))*0.000289 -> -0.4268500562922804 | M356: =RC[-4]+RC[-1] -> 270.1985096154902 | N356: =RC[-4]+RC[-2] -> 6826.9521043266914 | O356: =(1.000001018*(1-RC[-4]*RC[-4]))/(1+RC[-4]*COS(RADIANS(RC[-1]))) -> 0.98371713096336355 | P356: =RC[-3]-0.00569-0.00478*SIN(RADIANS(125.04-1934.136*RC[-9])) -> 270.18958609412721 | Q356: =23+(26+((21.448-RC[-10]*(46.815+RC[-10]*(0.00059-RC[-10]*0.001813))))/60)/60 -> 23.436953963592096 | R356: =RC[-1]+0.00256*COS(RADIANS(125.04-1934.136*RC[-11])) -> 23.435068597332307 | S356: =DEGREES(ATAN2(COS(RADIANS(RC[-3])),COS(RADIANS(RC[-1]))*SIN(RADIANS(RC[-3])))) -> -89.793369358247062 | T356: =DEGREES(ASIN(SIN(RADIANS(RC[-2]))*SIN(RADIANS(RC[-4])))) -> -23.434932636359928 | U356: =TAN(RADIANS(RC[-3]/2))*TAN(RADIANS(RC[-3]/2)) -> 4.3018584729070719E-2 | V356: =4*DEGREES(RC[-1]*SIN(2*RADIANS(RC[-13]))-2*RC[-11]*SIN(RADIANS(RC[-12]))+4*RC[-11]*RC[-1]*SIN(RADIANS(RC[-12]))*COS(2*RADIANS(RC[-13]))-0.5*RC[-1]*RC[-1]*SIN(4*RADIANS(RC[-13]))-1.25*RC[-11]*RC[-11]*SIN(2*RADIANS(RC[-12]))) -> 1.6261747455705022 | W356: =DEGREES(ACOS(COS(RADIANS(90.833))/(COS(RADIANS(R2C2))*COS(RADIANS(RC[-3])))-TAN(RADIANS(R2C2))*TAN(RADIANS(RC[-3])))) -> #NUM! | X356: =(720-4*R3C2-RC[-2]+R4C2*60)/1440 -> 1899-12-31T13:54:22.430 | Y356: =(RC[-1]*1440-RC[-2]*4)/1440 -> #NUM! | Z356: =(RC[-2]*1440+RC[-3]*4)/1440 -> #NUM! | AA356: =8*RC[-4] -> #NUM! | AB356: =MOD(RC[-23]*1440+RC[-6]+4*R3C2-60*R4C2,1440) -> 725.62617474557055 | AC356: =IF(RC[-1]/4<0,RC[-1]/4+180,RC[-1]/4-180) -> 1.4065436863926379 | AD356: =DEGREES(ACOS(SIN(RADIANS(R2C2))*SIN(RADIANS(RC[-10]))+COS(RADIANS(R2C2))*COS(RADIANS(RC[-10]))*COS(RADIANS(RC[-1])))) -> 93.440359860461683 | AE356: =90-RC[-1] -> -3.4403598604616832 | AF356: =IF(RC[-1]>85,0,IF(RC[-1]>5,58.1/TAN(RADIANS(RC[-1]))-0.07/POWER(TAN(RADIANS(RC[-1])),3)+0.000086/POWER(TAN(RADIANS(RC[-1])),5),IF(RC[-1]>-0.575,1735+RC[-1]*(-518.2+RC[-1]*(103.4+RC[-1]*(-12.79+RC[-1]*0.711))),-20.772/TAN(RADIANS(RC[-1])))))/3600 -> 9.5978108785415087E-2 | AG356: =RC[-2]+RC[-1] -> -3.3443817516762682 | AH356: =IF(RC[-5]>0,MOD(DEGREES(ACOS(((SIN(RADIANS(R2C2))*COS(RADIANS(RC[-4])))-SIN(RADIANS(RC[-14])))/(COS(RADIANS(R2C2))*SIN(RADIANS(RC[-4])))))+180,360),MOD(540-DEGREES(ACOS(((SIN(RADIANS(R2C2))*COS(RADIANS(RC[-4])))-SIN(RADIANS(RC[-14])))/(COS(RADIANS(R2C2))*SIN(RADIANS(RC[-4]))))),360)) -> 181.29283098112822
D357: =R[-1]C+1 -> 2017-12-22T00:00:00.000 | E357: =R5C2 -> 1899-12-31T14:00:00.000 | F357: =RC[-2]+2415018.5+RC[-1]-R4C2/24 -> 2458110.375 | G357: =(RC[-1]-2451545)/36525 -> 0.17975017111567421 | I357: =MOD(280.46646+RC[-2]*(36000.76983 + RC[-2]*0.0003032),360) -> 271.61100703493048 | J357: =357.52911+RC[-3]*(35999.05029 - 0.0001537*RC[-3]) -> 6828.3645546631951 | K357: =0.016708634-RC[-4]*(0.000042037+0.0000001267*RC[-4]) -> 1.6701073748364097E-2 | L357: =SIN(RADIANS(RC[-2]))*(1.914602-RC[-5]*(0.004817+0.000014*RC[-5]))+SIN(RADIANS(2*RC[-2]))*(0.019993-0.000101*RC[-5])+SIN(RADIANS(3*RC[-2]))*0.000289 -> -0.39402666380524293 | M357: =RC[-4]+RC[-1] -> 271.21698037112526 | N357: =RC[-4]+RC[-2] -> 6827.9705279993896 | O357: =(1.000001018*(1-RC[-4]*RC[-4]))/(1+RC[-4]*COS(RADIANS(RC[-1]))) -> 0.98365475351471443 | P357: =RC[-3]-0.00569-0.00478*SIN(RADIANS(125.04-1934.136*RC[-9])) -> 271.20805359759129 | Q357: =23+(26+((21.448-RC[-10]*(46.815+RC[-10]*(0.00059-RC[-10]*0.001813))))/60)/60 -> 23.43695360755714 | R357: =RC[-1]+0.00256*COS(RADIANS(125.04-1934.136*RC[-11])) -> 23.435069842625474 | S357: =DEGREES(ATAN2(COS(RADIANS(RC[-3])),COS(RADIANS(RC[-1]))*SIN(RADIANS(RC[-3])))) -> -88.683373294867408 | T357: =DEGREES(ASIN(SIN(RADIANS(RC[-2]))*SIN(RADIANS(RC[-4])))) -> -23.429549713991868 | U357: =TAN(RADIANS(RC[-3]/2))*TAN(RADIANS(RC[-3]/2)) -> 4.3018589430924195E-2 | V357: =4*DEGREES(RC[-1]*SIN(2*RADIANS(RC[-13]))-2*RC[-11]*SIN(RADIANS(RC[-12]))+4*RC[-11]*RC[-1]*SIN(RADIANS(RC[-12]))*COS(2*RADIANS(RC[-13]))-0.5*RC[-1]*RC[-1]*SIN(4*RADIANS(RC[-13]))-1.25*RC[-11]*RC[-11]*SIN(2*RADIANS(RC[-12]))) -> 1.1301928485633954 | W357: =DEGREES(ACOS(COS(RADIANS(90.833))/(COS(RADIANS(R2C2))*COS(RADIANS(RC[-3])))-TAN(RADIANS(R2C2))*TAN(RADIANS(RC[-3])))) -> #NUM! | X357: =(720-4*R3C2-RC[-2]+R4C2*60)/1440 -> 1899-12-31T13:54:52.188 | Y357: =(RC[-1]*1440-RC[-2]*4)/1440 -> #NUM! | Z357: =(RC[-2]*1440+RC[-3]*4)/1440 -> #NUM! | AA357: =8*RC[-4] -> #NUM! | AB357: =MOD(RC[-23]*1440+RC[-6]+4*R3C2-60*R4C2,1440) -> 725.13019284856341 | AC357: =IF(RC[-1]/4<0,RC[-1]/4+180,RC[-1]/4-180) -> 1.2825482121408527 | AD357: =DEGREES(ACOS(SIN(RADIANS(R2C2))*SIN(RADIANS(RC[-10]))+COS(RADIANS(R2C2))*COS(RADIANS(RC[-10]))*COS(RADIANS(RC[-1])))) -> 93.434062423787111 | AE357: =90-RC[-1] -> -3.4340624237871111 | AF357: =IF(RC[-1]>85,0,IF(RC[-1]>5,58.1/TAN(RADIANS(RC[-1]))-0.07/POWER(TAN(RADIANS(RC[-1])),3)+0.000086/POWER(TAN(RADIANS(RC[-1])),5),IF(RC[-1]>-0.575,1735+RC[-1]*(-518.2+RC[-1]*(103.4+RC[-1]*(-12.79+RC[-1]*0.711))),-20.772/TAN(RADIANS(RC[-1])))))/3600 -> 9.6154538304470585E-2 | AG357: =RC[-2]+RC[-1] -> -3.3379078854826405 | AH357: =IF(RC[-5]>0,MOD(DEGREES(ACOS(((SIN(RADIANS(R2C2))*COS(RADIANS(RC[-4])))-SIN(RADIANS(RC[-14])))/(COS(RADIANS(R2C2))*SIN(RADIANS(RC[-4])))))+180,360),MOD(540-DEGREES(ACOS(((SIN(RADIANS(R2C2))*COS(RADIANS(RC[-4])))-SIN(RADIANS(RC[-14])))/(COS(RADIANS(R2C2))*SIN(RADIANS(RC[-4]))))),360)) -> 181.17890330349076
D358: =R[-1]C+1 -> 2017-12-23T00:00:00.000 | E358: =R5C2 -> 1899-12-31T14:00:00.000 | F358: =RC[-2]+2415018.5+RC[-1]-R4C2/24 -> 2458111.375 | G358: =(RC[-1]-2451545)/36525 -> 0.17977754962354553 | I358: =MOD(280.46646+RC[-2]*(36000.76983 + RC[-2]*0.0003032),360) -> 272.5966543980785 | J358: =357.52911+RC[-3]*(35999.05029 - 0.0001537*RC[-3]) -> 6829.3501549434077 | K358: =0.016708634-RC[-4]*(0.000042037+0.0000001267*RC[-4]) -> 1.6701072596206613E-2 | L358: =SIN(RADIANS(RC[-2]))*(1.914602-RC[-5]*(0.004817+0.000014*RC[-5]))+SIN(RADIANS(2*RC[-2]))*(0.019993-0.000101*RC[-5])+SIN(RADIANS(3*RC[-2]))*0.000289 -> -0.36107928714385318 | M358: =RC[-4]+RC[-1] -> 272.23557511093463 | N358: =RC[-4]+RC[-2] -> 6828.9890756562636 | O358: =(1.000001018*(1-RC[-4]*RC[-4]))/(1+RC[-4]*COS(RADIANS(RC[-1]))) -> 0.98359737137601411 | P358: =RC[-3]-0.00569-0.00478*SIN(RADIANS(125.04-1934.136*RC[-9])) -> 272.22664508799448 | Q358: =23+(26+((21.448-RC[-10]*(46.815+RC[-10]*(0.00059-RC[-10]*0.001813))))/60)/60 -> 23.436953251522183 | R358: =RC[-1]+0.00256*COS(RADIANS(125.04-1934.136*RC[-11])) -> 23.435071089527707 | S358: =DEGREES(ATAN2(COS(RADIANS(RC[-3])),COS(RADIANS(RC[-1]))*SIN(RADIANS(RC[-3])))) -> -87.573398354213808 | T358: =DEGREES(ASIN(SIN(RADIANS(RC[-2]))*SIN(RADIANS(RC[-4])))) -> -23.416320344933659 | U358: =TAN(RADIANS(RC[-3]/2))*TAN(RADIANS(RC[-3]/2)) -> 4.3018594138853311E-2 | V358: =4*DEGREES(RC[-1]*SIN(2*RADIANS(RC[-13]))-2*RC[-11]*SIN(RADIANS(RC[-12]))+4*RC[-11]*RC[-1]*SIN(RADIANS(RC[-12]))*COS(2*RADIANS(RC[-13]))-0.5*RC[-1]*RC[-1]*SIN(4*RADIANS(RC[-13]))-1.25*RC[-11]*RC[-11]*SIN(2*RADIANS(RC[-12]))) -> 0.63433192072940681 | W358: =DEGREES(ACOS(COS(RADIANS(90.833))/(COS(RADIANS(R2C2))*COS(RADIANS(RC[-3])))-TAN(RADIANS(R2C2))*TAN(RADIANS(RC[-3])))) -> #NUM! | X358: =(720-4*R3C2-RC[-2]+R4C2*60)/1440 -> 1899-12-31T13:55:21.940 | Y358: =(RC[-1]*1440-RC[-2]*4)/1440 -> #NUM! | Z358: =(RC[-2]*1440+RC[-3]*4)/1440 -> #NUM! | AA358: =8*RC[-4] -> #NUM! | AB358: =MOD(RC[-23]*1440+RC[-6]+4*R3C2-60*R4C2,1440) -> 724.63433192072944 | AC358: =IF(RC[-1]/4<0,RC[-1]/4+180,RC[-1]/4-180) -> 1.1585829801823593 | AD358: =DEGREES(ACOS(SIN(RADIANS(R2C2))*SIN(RADIANS(RC[-10]))+COS(RADIANS(R2C2))*COS(RADIANS(RC[-10]))*COS(RADIANS(RC[-1])))) -> 93.420003202161098 | AE358: =90-RC[-1] -> -3.420003202161098 | AF358: =IF(RC[-1]>85,0,IF(RC[-1]>5,58.1/TAN(RADIANS(RC[-1]))-0.07/POWER(TAN(RADIANS(RC[-1])),3)+0.000086/POWER(TAN(RADIANS(RC[-1])),5),IF(RC[-1]>-0.575,1735+RC[-1]*(-518.2+RC[-1]*(103.4+RC[-1]*(-12.79+RC[-1]*0.711))),-20.772/TAN(RADIANS(RC[-1])))))/3600 -> 9.6550764326376007E-2 | AG358: =RC[-2]+RC[-1] -> -3.3234524378347219 | AH358: =IF(RC[-5]>0,MOD(DEGREES(ACOS(((SIN(RADIANS(R2C2))*COS(RADIANS(RC[-4])))-SIN(RADIANS(RC[-14])))/(COS(RADIANS(R2C2))*SIN(RADIANS(RC[-4])))))+180,360),MOD(540-DEGREES(ACOS(((SIN(RADIANS(R2C2))*COS(RADIANS(RC[-4])))-SIN(RADIANS(RC[-14])))/(COS(RADIANS(R2C2))*SIN(RADIANS(RC[-4]))))),360)) -> 181.06504934179247
D359: =R[-1]C+1 -> 2017-12-24T00:00:00.000 | E359: =R5C2 -> 1899-12-31T14:00:00.000 | F359: =RC[-2]+2415018.5+RC[-1]-R4C2/24 -> 2458112.375 | G359: =(RC[-1]-2451545)/36525 -> 0.17980492813141682 | I359: =MOD(280.46646+RC[-2]*(36000.76983 + RC[-2]*0.0003032),360) -> 273.58230176122652 | J359: =357.52911+RC[-3]*(35999.05029 - 0.0001537*RC[-3]) -> 6830.3357552236184 | K359: =0.016708634-RC[-4]*(0.000042037+0.0000001267*RC[-4]) -> 1.6701071444048938E-2 | L359: =SIN(RADIANS(RC[-2]))*(1.914602-RC[-5]*(0.004817+0.000014*RC[-5]))+SIN(RADIANS(2*RC[-2]))*(0.019993-0.000101*RC[-5])+SIN(RADIANS(3*RC[-2]))*0.000289 -> -0.32801826931702954 | M359: =RC[-4]+RC[-1] -> 273.25428349190946 | N359: =RC[-4]+RC[-2] -> 6830.0077369543014 | O359: =(1.000001018*(1-RC[-4]*RC[-4]))/(1+RC[-4]*COS(RADIANS(RC[-1]))) -> 0.98354500326353356 | P359: =RC[-3]-0.00569-0.00478*SIN(RADIANS(125.04-1934.136*RC[-9])) -> 273.24535022233061 | Q359: =23+(26+((21.448-RC[-10]*(46.815+RC[-10]*(0.00059-RC[-10]*0.001813))))/60)/60 -> 23.436952895487227 | R359: =RC[-1]+0.00256*COS(RADIANS(125.04-1934.136*RC[-11])) -> 23.435072338037646 | S359: =DEGREES(ATAN2(COS(RADIANS(RC[-3])),COS(RADIANS(RC[-1]))*SIN(RADIANS(RC[-3])))) -> -86.463587331699927 | T359: =DEGREES(ASIN(SIN(RADIANS(RC[-2]))*SIN(RADIANS(RC[-4])))) -> -23.395248451423655 | U359: =TAN(RADIANS(RC[-3]/2))*TAN(RADIANS(RC[-3]/2)) -> 4.3018598852852925E-2 | V359: =4*DEGREES(RC[-1]*SIN(2*RADIANS(RC[-13]))-2*RC[-11]*SIN(RADIANS(RC[-12]))+4*RC[-11]*RC[-1]*SIN(RADIANS(RC[-12]))*COS(2*RADIANS(RC[-13]))-0.5*RC[-1]*RC[-1]*SIN(4*RADIANS(RC[-13]))-1.25*RC[-11]*RC[-11]*SIN(2*RADIANS(RC[-12]))) -> 0.13914520971286873 | W359: =DEGREES(ACOS(COS(RADIANS(90.833))/(COS(RADIANS(R2C2))*COS(RADIANS(RC[-3])))-TAN(RADIANS(R2C2))*TAN(RADIANS(RC[-3])))) -> #NUM! | X359: =(720-4*R3C2-RC[-2]+R4C2*60)/1440 -> 1899-12-31T13:55:51.651 | Y359: =(RC[-1]*1440-RC[-2]*4)/1440 -> #NUM! | Z359: =(RC[-2]*1440+RC[-3]*4)/1440 -> #NUM! | AA359: =8*RC[-4] -> #NUM! | AB359: =MOD(RC[-23]*1440+RC[-6]+4*R3C2-60*R4C2,1440) -> 724.13914520971286 | AC359: =IF(RC[-1]/4<0,RC[-1]/4+180,RC[-1]/4-180) -> 1.0347863024282162 | AD359: =DEGREES(ACOS(SIN(RADIANS(R2C2))*SIN(RADIANS(RC[-10]))+COS(RADIANS(R2C2))*COS(RADIANS(RC[-10]))*COS(RADIANS(RC[-1])))) -> 93.398186739612584 | AE359: =90-RC[-1] -> -3.3981867396125836 | AF359: =IF(RC[-1]>85,0,IF(RC[-1]>5,58.1/TAN(RADIANS(RC[-1]))-0.07/POWER(TAN(RADIANS(RC[-1])),3)+0.000086/POWER(TAN(RADIANS(RC[-1])),5),IF(RC[-1]>-0.575,1735+RC[-1]*(-518.2+RC[-1]*(103.4+RC[-1]*(-12.79+RC[-1]*0.711))),-20.772/TAN(RADIANS(RC[-1])))))/3600 -> 9.7172093266615425E-2 | AG359: =RC[-2]+RC[-1] -> -3.3010146463459682 | AH359: =IF(RC[-5]>0,MOD(DEGREES(ACOS(((SIN(RADIANS(R2C2))*COS(RADIANS(RC[-4])))-SIN(RADIANS(RC[-14])))/(COS(RADIANS(R2C2))*SIN(RADIANS(RC[-4])))))+180,360),MOD(540-DEGREES(ACOS(((SIN(RADIANS(R2C2))*COS(RADIANS(RC[-4])))-SIN(RADIANS(RC[-14])))/(COS(RADIANS(R2C2))*SIN(RADIANS(RC[-4]))))),360)) -> 180.9513788111523
D360: =R[-1]C+1 -> 2017-12-25T00:00:00.000 | E360: =R5C2 -> 1899-12-31T14:00:00.000 | F360: =RC[-2]+2415018.5+RC[-1]-R4C2/24 -> 2458113.375 | G360: =(RC[-1]-2451545)/36525 -> 0.17983230663928815 | I360: =MOD(280.46646+RC[-2]*(36000.76983 + RC[-2]*0.0003032),360) -> 274.56794912437636 | J360: =357.52911+RC[-3]*(35999.05029 - 0.0001537*RC[-3]) -> 6831.3213555038292 | K360: =0.016708634-RC[-4]*(0.000042037+0.0000001267*RC[-4]) -> 1.6701070291891072E-2 | L360: =SIN(RADIANS(RC[-2]))*(1.914602-RC[-5]*(0.004817+0.000014*RC[-5]))+SIN(RADIANS(2*RC[-2]))*(0.019993-0.000101*RC[-5])+SIN(RADIANS(3*RC[-2]))*0.000289 -> -0.29485399554417779 | M360: =RC[-4]+RC[-1] -> 274.27309512883215 | N360: =RC[-4]+RC[-2] -> 6831.026501508285 | O360: =(1.000001018*(1-RC[-4]*RC[-4]))/(1+RC[-4]*COS(RADIANS(RC[-1]))) -> 0.98349766626367918 | P360: =RC[-3]-0.00569-0.00478*SIN(RADIANS(125.04-1934.136*RC[-9])) -> 274.26415861538499 | Q360: =23+(26+((21.448-RC[-10]*(46.815+RC[-10]*(0.00059-RC[-10]*0.001813))))/60)/60 -> 23.436952539452271 | R360: =RC[-1]+0.00256*COS(RADIANS(125.04-1934.136*RC[-11])) -> 23.435073588153912 | S360: =DEGREES(ATAN2(COS(RADIANS(RC[-3])),COS(RADIANS(RC[-1]))*SIN(RADIANS(RC[-3])))) -> -85.354082577033921 | T360: =DEGREES(ASIN(SIN(RADIANS(RC[-2]))*SIN(RADIANS(RC[-4])))) -> -23.366342144328392 | U360: =TAN(RADIANS(RC[-3]/2))*TAN(RADIANS(RC[-3]/2)) -> 4.3018603572917827E-2 | V360: =4*DEGREES(RC[-1]*SIN(2*RADIANS(RC[-13]))-2*RC[-11]*SIN(RADIANS(RC[-12]))+4*RC[-11]*RC[-1]*SIN(RADIANS(RC[-12]))*COS(2*RADIANS(RC[-13]))-0.5*RC[-1]*RC[-1]*SIN(4*RADIANS(RC[-13]))-1.25*RC[-11]*RC[-11]*SIN(2*RADIANS(RC[-12]))) -> -0.35481574892993589 | W360: =DEGREES(ACOS(COS(RADIANS(90.833))/(COS(RADIANS(R2C2))*COS(RADIANS(RC[-3])))-TAN(RADIANS(R2C2))*TAN(RADIANS(RC[-3])))) -> #NUM! | X360: =(720-4*R3C2-RC[-2]+R4C2*60)/1440 -> 1899-12-31T13:56:21.289 | Y360: =(RC[-1]*1440-RC[-2]*4)/1440 -> #NUM! | Z360: =(RC[-2]*1440+RC[-3]*4)/1440 -> #NUM! | AA360: =8*RC[-4] -> #NUM! | AB360: =MOD(RC[-23]*1440+RC[-6]+4*R3C2-60*R4C2,1440) -> 723.64518425107008 | AC360: =IF(RC[-1]/4<0,RC[-1]/4+180,RC[-1]/4-180) -> 0.91129606276751929 | AD360: =DEGREES(ACOS(SIN(RADIANS(R2C2))*SIN(RADIANS(RC[-10]))+COS(RADIANS(R2C2))*COS(RADIANS(RC[-10]))*COS(RADIANS(RC[-1])))) -> 93.368621417173031 | AE360: =90-RC[-1] -> -3.3686214171730313 | AF360: =IF(RC[-1]>85,0,IF(RC[-1]>5,58.1/TAN(RADIANS(RC[-1]))-0.07/POWER(TAN(RADIANS(RC[-1])),3)+0.000086/POWER(TAN(RADIANS(RC[-1])),5),IF(RC[-1]>-0.575,1735+RC[-1]*(-518.2+RC[-1]*(103.4+RC[-1]*(-12.79+RC[-1]*0.711))),-20.772/TAN(RADIANS(RC[-1])))))/3600 -> 9.8026936493910186E-2 | AG360: =RC[-2]+RC[-1] -> -3.270594480679121 | AH360: =IF(RC[-5]>0,MOD(DEGREES(ACOS(((SIN(RADIANS(R2C2))*COS(RADIANS(RC[-4])))-SIN(RADIANS(RC[-14])))/(COS(RADIANS(R2C2))*SIN(RADIANS(RC[-4])))))+180,360),MOD(540-DEGREES(ACOS(((SIN(RADIANS(R2C2))*COS(RADIANS(RC[-4])))-SIN(RADIANS(RC[-14])))/(COS(RADIANS(R2C2))*SIN(RADIANS(RC[-4]))))),360)) -> 180.83800112672139
D361: =R[-1]C+1 -> 2017-12-26T00:00:00.000 | E361: =R5C2 -> 1899-12-31T14:00:00.000 | F361: =RC[-2]+2415018.5+RC[-1]-R4C2/24 -> 2458114.375 | G361: =(RC[-1]-2451545)/36525 -> 0.17985968514715947 | I361: =MOD(280.46646+RC[-2]*(36000.76983 + RC[-2]*0.0003032),360) -> 275.5535964875271 | J361: =357.52911+RC[-3]*(35999.05029 - 0.0001537*RC[-3]) -> 6832.3069557840408 | K361: =0.016708634-RC[-4]*(0.000042037+0.0000001267*RC[-4]) -> 1.6701069139733016E-2 | L361: =SIN(RADIANS(RC[-2]))*(1.914602-RC[-5]*(0.004817+0.000014*RC[-5]))+SIN(RADIANS(2*RC[-2]))*(0.019993-0.000101*RC[-5])+SIN(RADIANS(3*RC[-2]))*0.000289 -> -0.26159688942448389 | M361: =RC[-4]+RC[-1] -> 275.29199959810262 | N361: =RC[-4]+RC[-2] -> 6832.0453588946166 | O361: =(1.000001018*(1-RC[-4]*RC[-4]))/(1+RC[-4]*COS(RADIANS(RC[-1]))) -> 0.9834553758258785 | P361: =RC[-3]-0.00569-0.00478*SIN(RADIANS(125.04-1934.136*RC[-9])) -> 275.28305984356024 | Q361: =23+(26+((21.448-RC[-10]*(46.815+RC[-10]*(0.00059-RC[-10]*0.001813))))/60)/60 -> 23.436952183417315 | R361: =RC[-1]+0.00256*COS(RADIANS(125.04-1934.136*RC[-11])) -> 23.435074839875135 | S361: =DEGREES(ATAN2(COS(RADIANS(RC[-3])),COS(RADIANS(RC[-1]))*SIN(RADIANS(RC[-3])))) -> -84.245025718830675 | T361: =DEGREES(ASIN(SIN(RADIANS(RC[-2]))*SIN(RADIANS(RC[-4])))) -> -23.329613710524661 | U361: =TAN(RADIANS(RC[-3]/2))*TAN(RADIANS(RC[-3]/2)) -> 4.3018608299042839E-2 | V361: =4*DEGREES(RC[-1]*SIN(2*RADIANS(RC[-13]))-2*RC[-11]*SIN(RADIANS(RC[-12]))+4*RC[-11]*RC[-1]*SIN(RADIANS(RC[-12]))*COS(2*RADIANS(RC[-13]))-0.5*RC[-1]*RC[-1]*SIN(4*RADIANS(RC[-13]))-1.25*RC[-11]*RC[-11]*SIN(2*RADIANS(RC[-12]))) -> -0.84700205811266327 | W361: =DEGREES(ACOS(COS(RADIANS(90.833))/(COS(RADIANS(R2C2))*COS(RADIANS(RC[-3])))-TAN(RADIANS(R2C2))*TAN(RADIANS(RC[-3])))) -> #NUM! | X361: =(720-4*R3C2-RC[-2]+R4C2*60)/1440 -> 1899-12-31T13:56:50.820 | Y361: =(RC[-1]*1440-RC[-2]*4)/1440 -> #NUM! | Z361: =(RC[-2]*1440+RC[-3]*4)/1440 -> #NUM! | AA361: =8*RC[-4] -> #NUM! | AB361: =MOD(RC[-23]*1440+RC[-6]+4*R3C2-60*R4C2,1440) -> 723.15299794188729 | AC361: =IF(RC[-1]/4<0,RC[-1]/4+180,RC[-1]/4-180) -> 0.78824948547182316 | AD361: =DEGREES(ACOS(SIN(RADIANS(R2C2))*SIN(RADIANS(RC[-10]))+COS(RADIANS(R2C2))*COS(RADIANS(RC[-10]))*COS(RADIANS(RC[-1])))) -> 93.331319442460355 | AE361: =90-RC[-1] -> -3.3313194424603552 | AF361: =IF(RC[-1]>85,0,IF(RC[-1]>5,58.1/TAN(RADIANS(RC[-1]))-0.07/POWER(TAN(RADIANS(RC[-1])),3)+0.000086/POWER(TAN(RADIANS(RC[-1])),5),IF(RC[-1]>-0.575,1735+RC[-1]*(-518.2+RC[-1]*(103.4+RC[-1]*(-12.79+RC[-1]*0.711))),-20.772/TAN(RADIANS(RC[-1])))))/3600 -> 9.9127098657644547E-2 | AG361: =RC[-2]+RC[-1] -> -3.2321923438027107 | AH361: =IF(RC[-5]>0,MOD(DEGREES(ACOS(((SIN(RADIANS(R2C2))*COS(RADIANS(RC[-4])))-SIN(RADIANS(RC[-14])))/(COS(RADIANS(R2C2))*SIN(RADIANS(RC[-4])))))+180,360),MOD(540-DEGREES(ACOS(((SIN(RADIANS(R2C2))*COS(RADIANS(RC[-4])))-SIN(RADIANS(RC[-14])))/(COS(RADIANS(R2C2))*SIN(RADIANS(RC[-4]))))),360)) -> 180.72502527167623
D362: =R[-1]C+1 -> 2017-12-27T00:00:00.000 | E362: =R5C2 -> 1899-12-31T14:00:00.000 | F362: =RC[-2]+2415018.5+RC[-1]-R4C2/24 -> 2458115.375 | G362: =(RC[-1]-2451545)/36525 -> 0.17988706365503079 | I362: =MOD(280.46646+RC[-2]*(36000.76983 + RC[-2]*0.0003032),360) -> 276.53924385067785 | J362: =357.52911+RC[-3]*(35999.05029 - 0.0001537*RC[-3]) -> 6833.2925560642525 | K362: =0.016708634-RC[-4]*(0.000042037+0.0000001267*RC[-4]) -> 1.6701067987574768E-2 | L362: =SIN(RADIANS(RC[-2]))*(1.914602-RC[-5]*(0.004817+0.000014*RC[-5]))+SIN(RADIANS(2*RC[-2]))*(0.019993-0.000101*RC[-5])+SIN(RADIANS(3*RC[-2]))*0.000289 -> -0.2282574090840111 | M362: =RC[-4]+RC[-1] -> 276.31098644159385 | N362: =RC[-4]+RC[-2] -> 6833.0642986551684 | O362: =(1.000001018*(1-RC[-4]*RC[-4]))/(1+RC[-4]*COS(RADIANS(RC[-1]))) -> 0.98341814575613717 | P362: =RC[-3]-0.00569-0.00478*SIN(RADIANS(125.04-1934.136*RC[-9])) -> 276.30204344873209 | Q362: =23+(26+((21.448-RC[-10]*(46.815+RC[-10]*(0.00059-RC[-10]*0.001813))))/60)/60 -> 23.436951827382359 | R362: =RC[-1]+0.00256*COS(RADIANS(125.04-1934.136*RC[-11])) -> 23.435076093199946 | S362: =DEGREES(ATAN2(COS(RADIANS(RC[-3])),COS(RADIANS(RC[-1]))*SIN(RADIANS(RC[-3])))) -> -83.136557391955861 | T362: =DEGREES(ASIN(SIN(RADIANS(RC[-2]))*SIN(RADIANS(RC[-4])))) -> -23.285079592973396 | U362: =TAN(RADIANS(RC[-3]/2))*TAN(RADIANS(RC[-3]/2)) -> 4.3018613031222806E-2 | V362: =4*DEGREES(RC[-1]*SIN(2*RADIANS(RC[-13]))-2*RC[-11]*SIN(RADIANS(RC[-12]))+4*RC[-11]*RC[-1]*SIN(RADIANS(RC[-12]))*COS(2*RADIANS(RC[-13]))-0.5*RC[-1]*RC[-1]*SIN(4*RADIANS(RC[-13]))-1.25*RC[-11]*RC[-11]*SIN(2*RADIANS(RC[-12]))) -> -1.3368683783521655 | W362: =DEGREES(ACOS(COS(RADIANS(90.833))/(COS(RADIANS(R2C2))*COS(RADIANS(RC[-3])))-TAN(RADIANS(R2C2))*TAN(RADIANS(RC[-3])))) -> #NUM! | X362: =(720-4*R3C2-RC[-2]+R4C2*60)/1440 -> 1899-12-31T13:57:20.212 | Y362: =(RC[-1]*1440-RC[-2]*4)/1440 -> #NUM! | Z362: =(RC[-2]*1440+RC[-3]*4)/1440 -> #NUM! | AA362: =8*RC[-4] -> #NUM! | AB362: =MOD(RC[-23]*1440+RC[-6]+4*R3C2-60*R4C2,1440) -> 722.66313162164784 | AC362: =IF(RC[-1]/4<0,RC[-1]/4+180,RC[-1]/4-180) -> 0.66578290541195884 | AD362: =DEGREES(ACOS(SIN(RADIANS(R2C2))*SIN(RADIANS(RC[-10]))+COS(RADIANS(R2C2))*COS(RADIANS(RC[-10]))*COS(RADIANS(RC[-1])))) -> 93.286296833609484 | AE362: =90-RC[-1] -> -3.2862968336094838 | AF362: =IF(RC[-1]>85,0,IF(RC[-1]>5,58.1/TAN(RADIANS(RC[-1]))-0.07/POWER(TAN(RADIANS(RC[-1])),3)+0.000086/POWER(TAN(RADIANS(RC[-1])),5),IF(RC[-1]>-0.575,1735+RC[-1]*(-518.2+RC[-1]*(103.4+RC[-1]*(-12.79+RC[-1]*0.711))),-20.772/TAN(RADIANS(RC[-1])))))/3600 -> 0.10048819497458157 | AG362: =RC[-2]+RC[-1] -> -3.185808638634902 | AH362: =IF(RC[-5]>0,MOD(DEGREES(ACOS(((SIN(RADIANS(R2C2))*COS(RADIANS(RC[-4])))-SIN(RADIANS(RC[-14])))/(COS(RADIANS(R2C2))*SIN(RADIANS(RC[-4])))))+180,360),MOD(540-DEGREES(ACOS(((SIN(RADIANS(R2C2))*COS(RADIANS(RC[-4])))-SIN(RADIANS(RC[-14])))/(COS(RADIANS(R2C2))*SIN(RADIANS(RC[-4]))))),360)) -> 180.61255966584275
D363: =R[-1]C+1 -> 2017-12-28T00:00:00.000 | E363: =R5C2 -> 1899-12-31T14:00:00.000 | F363: =RC[-2]+2415018.5+RC[-1]-R4C2/24 -> 2458116.375 | G363: =(RC[-1]-2451545)/36525 -> 0.17991444216290212 | I363: =MOD(280.46646+RC[-2]*(36000.76983 + RC[-2]*0.0003032),360) -> 277.5248912138286 | J363: =357.52911+RC[-3]*(35999.05029 - 0.0001537*RC[-3]) -> 6834.2781563444623 | K363: =0.016708634-RC[-4]*(0.000042037+0.0000001267*RC[-4]) -> 1.6701066835416334E-2 | L363: =SIN(RADIANS(RC[-2]))*(1.914602-RC[-5]*(0.004817+0.000014*RC[-5]))+SIN(RADIANS(2*RC[-2]))*(0.019993-0.000101*RC[-5])+SIN(RADIANS(3*RC[-2]))*0.000289 -> -0.19484604330301561 | M363: =RC[-4]+RC[-1] -> 277.33004517052558 | N363: =RC[-4]+RC[-2] -> 6834.0833103011591 | O363: =(1.000001018*(1-RC[-4]*RC[-4]))/(1+RC[-4]*COS(RADIANS(RC[-1]))) -> 0.98338598821127998 | P363: =RC[-3]-0.00569-0.00478*SIN(RADIANS(125.04-1934.136*RC[-9])) -> 277.32109894212311 | Q363: =23+(26+((21.448-RC[-10]*(46.815+RC[-10]*(0.00059-RC[-10]*0.001813))))/60)/60 -> 23.436951471347406 | R363: =RC[-1]+0.00256*COS(RADIANS(125.04-1934.136*RC[-11])) -> 23.435077348126971 | S363: =DEGREES(ATAN2(COS(RADIANS(RC[-3])),COS(RADIANS(RC[-1]))*SIN(RADIANS(RC[-3])))) -> -82.028816968650958 | T363: =DEGREES(ASIN(SIN(RADIANS(RC[-2]))*SIN(RADIANS(RC[-4])))) -> -23.2327603635819 | U363: =TAN(RADIANS(RC[-3]/2))*TAN(RADIANS(RC[-3]/2)) -> 4.3018617769452525E-2 | V363: =4*DEGREES(RC[-1]*SIN(2*RADIANS(RC[-13]))-2*RC[-11]*SIN(RADIANS(RC[-12]))+4*RC[-11]*RC[-1]*SIN(RADIANS(RC[-12]))*COS(2*RADIANS(RC[-13]))-0.5*RC[-1]*RC[-1]*SIN(4*RADIANS(RC[-13]))-1.25*RC[-11]*RC[-11]*SIN(2*RADIANS(RC[-12]))) -> -1.8238738372787693 | W363: =DEGREES(ACOS(COS(RADIANS(90.833))/(COS(RADIANS(R2C2))*COS(RADIANS(RC[-3])))-TAN(RADIANS(R2C2))*TAN(RADIANS(RC[-3])))) -> #NUM! | X363: =(720-4*R3C2-RC[-2]+R4C2*60)/1440 -> 1899-12-31T13:57:49.432 | Y363: =(RC[-1]*1440-RC[-2]*4)/1440 -> #NUM! | Z363: =(RC[-2]*1440+RC[-3]*4)/1440 -> #NUM! | AA363: =8*RC[-4] -> #NUM! | AB363: =MOD(RC[-23]*1440+RC[-6]+4*R3C2-60*R4C2,1440) -> 722.17612616272118 | AC363: =IF(RC[-1]/4<0,RC[-1]/4+180,RC[-1]/4-180) -> 0.5440315406802938 | AD363: =DEGREES(ACOS(SIN(RADIANS(R2C2))*SIN(RADIANS(RC[-10]))+COS(RADIANS(R2C2))*COS(RADIANS(RC[-10]))*COS(RADIANS(RC[-1])))) -> 93.233573397617604 | AE363: =90-RC[-1] -> -3.2335733976176044 | AF363: =IF(RC[-1]>85,0,IF(RC[-1]>5,58.1/TAN(RADIANS(RC[-1]))-0.07/POWER(TAN(RADIANS(RC[-1])),3)+0.000086/POWER(TAN(RADIANS(RC[-1])),5),IF(RC[-1]>-0.575,1735+RC[-1]*(-518.2+RC[-1]*(103.4+RC[-1]*(-12.79+RC[-1]*0.711))),-20.772/TAN(RADIANS(RC[-1])))))/3600 -> 0.10213022576107485 | AG363: =RC[-2]+RC[-1] -> -3.1314431718565294 | AH363: =IF(RC[-5]>0,MOD(DEGREES(ACOS(((SIN(RADIANS(R2C2))*COS(RADIANS(RC[-4])))-SIN(RADIANS(RC[-14])))/(COS(RADIANS(R2C2))*SIN(RADIANS(RC[-4])))))+180,360),MOD(540-DEGREES(ACOS(((SIN(RADIANS(R2C2))*COS(RADIANS(RC[-4])))-SIN(RADIANS(RC[-14])))/(COS(RADIANS(R2C2))*SIN(RADIANS(RC[-4]))))),360)) -> 180.5007120350642
D364: =R[-1]C+1 -> 2017-12-29T00:00:00.000 | E364: =R5C2 -> 1899-12-31T14:00:00.000 | F364: =RC[-2]+2415018.5+RC[-1]-R4C2/24 -> 2458117.375 | G364: =(RC[-1]-2451545)/36525 -> 0.17994182067077344 | I364: =MOD(280.46646+RC[-2]*(36000.76983 + RC[-2]*0.0003032),360) -> 278.51053857698116 | J364: =357.52911+RC[-3]*(35999.05029 - 0.0001537*RC[-3]) -> 6835.263756624674 | K364: =0.016708634-RC[-4]*(0.000042037+0.0000001267*RC[-4]) -> 1.6701065683257708E-2 | L364: =SIN(RADIANS(RC[-2]))*(1.914602-RC[-5]*(0.004817+0.000014*RC[-5]))+SIN(RADIANS(2*RC[-2]))*(0.019993-0.000101*RC[-5])+SIN(RADIANS(3*RC[-2]))*0.000289 -> -0.16137330762550947 | M364: =RC[-4]+RC[-1] -> 278.34916526935564 | N364: =RC[-4]+RC[-2] -> 6835.1023833170484 | O364: =(1.000001018*(1-RC[-4]*RC[-4]))/(1+RC[-4]*COS(RADIANS(RC[-1]))) -> 0.98335891369387307 | P364: =RC[-3]-0.00569-0.00478*SIN(RADIANS(125.04-1934.136*RC[-9])) -> 278.34021580819382 | Q364: =23+(26+((21.448-RC[-10]*(46.815+RC[-10]*(0.00059-RC[-10]*0.001813))))/60)/60 -> 23.43695111531245 | R364: =RC[-1]+0.00256*COS(RADIANS(125.04-1934.136*RC[-11])) -> 23.435078604654827 | S364: =DEGREES(ATAN2(COS(RADIANS(RC[-3])),COS(RADIANS(RC[-1]))*SIN(RADIANS(RC[-3])))) -> -80.921942294446438 | T364: =DEGREES(ASIN(SIN(RADIANS(RC[-2]))*SIN(RADIANS(RC[-4])))) -> -23.172680688982762 | U364: =TAN(RADIANS(RC[-3]/2))*TAN(RADIANS(RC[-3]/2)) -> 4.3018622513726797E-2 | V364: =4*DEGREES(RC[-1]*SIN(2*RADIANS(RC[-13]))-2*RC[-11]*SIN(RADIANS(RC[-12]))+4*RC[-11]*RC[-1]*SIN(RADIANS(RC[-12]))*COS(2*RADIANS(RC[-13]))-0.5*RC[-1]*RC[-1]*SIN(4*RADIANS(RC[-13]))-1.25*RC[-11]*RC[-11]*SIN(2*RADIANS(RC[-12]))) -> -2.307482927191594 | W364: =DEGREES(ACOS(COS(RADIANS(90.833))/(COS(RADIANS(R2C2))*COS(RADIANS(RC[-3])))-TAN(RADIANS(R2C2))*TAN(RADIANS(RC[-3])))) -> #NUM! | X364: =(720-4*R3C2-RC[-2]+R4C2*60)/1440 -> 1899-12-31T13:58:18.449 | Y364: =(RC[-1]*1440-RC[-2]*4)/1440 -> #NUM! | Z364: =(RC[-2]*1440+RC[-3]*4)/1440 -> #NUM! | AA364: =8*RC[-4] -> #NUM! | AB364: =MOD(RC[-23]*1440+RC[-6]+4*R3C2-60*R4C2,1440) -> 721.69251707280841 | AC364: =IF(RC[-1]/4<0,RC[-1]/4+180,RC[-1]/4-180) -> 0.4231292682021035 | AD364: =DEGREES(ACOS(SIN(RADIANS(R2C2))*SIN(RADIANS(RC[-10]))+COS(RADIANS(R2C2))*COS(RADIANS(RC[-10]))*COS(RADIANS(RC[-1])))) -> 93.17317270319414 | AE364: =90-RC[-1] -> -3.1731727031941404 | AF364: =IF(RC[-1]>85,0,IF(RC[-1]>5,58.1/TAN(RADIANS(RC[-1]))-0.07/POWER(TAN(RADIANS(RC[-1])),3)+0.000086/POWER(TAN(RADIANS(RC[-1])),5),IF(RC[-1]>-0.575,1735+RC[-1]*(-518.2+RC[-1]*(103.4+RC[-1]*(-12.79+RC[-1]*0.711))),-20.772/TAN(RADIANS(RC[-1])))))/3600 -> 0.10407834917543912 | AG364: =RC[-2]+RC[-1] -> -3.0690943540187012 | AH364: =IF(RC[-5]>0,MOD(DEGREES(ACOS(((SIN(RADIANS(R2C2))*COS(RADIANS(RC[-4])))-SIN(RADIANS(RC[-14])))/(COS(RADIANS(R2C2))*SIN(RADIANS(RC[-4])))))+180,360),MOD(540-DEGREES(ACOS(((SIN(RADIANS(R2C2))*COS(RADIANS(RC[-4])))-SIN(RADIANS(RC[-14])))/(COS(RADIANS(R2C2))*SIN(RADIANS(RC[-4]))))),360)) -> 180.38958928143163
D365: =R[-1]C+1 -> 2017-12-30T00:00:00.000 | E365: =R5C2 -> 1899-12-31T14:00:00.000 | F365: =RC[-2]+2415018.5+RC[-1]-R4C2/24 -> 2458118.375 | G365: =(RC[-1]-2451545)/36525 -> 0.17996919917864476 | I365: =MOD(280.46646+RC[-2]*(36000.76983 + RC[-2]*0.0003032),360) -> 279.49618594013282 | J365: =357.52911+RC[-3]*(35999.05029 - 0.0001537*RC[-3]) -> 6836.2493569048847 | K365: =0.016708634-RC[-4]*(0.000042037+0.0000001267*RC[-4]) -> 1.6701064531098896E-2 | L365: =SIN(RADIANS(RC[-2]))*(1.914602-RC[-5]*(0.004817+0.000014*RC[-5]))+SIN(RADIANS(2*RC[-2]))*(0.019993-0.000101*RC[-5])+SIN(RADIANS(3*RC[-2]))*0.000289 -> -0.12784974045416522 | M365: =RC[-4]+RC[-1] -> 279.36833619967865 | N365: =RC[-4]+RC[-2] -> 6836.121507164431 | O365: =(1.000001018*(1-RC[-4]*RC[-4]))/(1+RC[-4]*COS(RADIANS(RC[-1]))) -> 0.98333693104783571 | P365: =RC[-3]-0.00569-0.00478*SIN(RADIANS(125.04-1934.136*RC[-9])) -> 279.35938350854167 | Q365: =23+(26+((21.448-RC[-10]*(46.815+RC[-10]*(0.00059-RC[-10]*0.001813))))/60)/60 -> 23.436950759277494 | R365: =RC[-1]+0.00256*COS(RADIANS(125.04-1934.136*RC[-11])) -> 23.435079862782136 | S365: =DEGREES(ATAN2(COS(RADIANS(RC[-3])),COS(RADIANS(RC[-1]))*SIN(RADIANS(RC[-3])))) -> -79.816069429848298 | T365: =DEGREES(ASIN(SIN(RADIANS(RC[-2]))*SIN(RADIANS(RC[-4])))) -> -23.104869289389882 | U365: =TAN(RADIANS(RC[-3]/2))*TAN(RADIANS(RC[-3]/2)) -> 4.3018627264040397E-2 | V365: =4*DEGREES(RC[-1]*SIN(2*RADIANS(RC[-13]))-2*RC[-11]*SIN(RADIANS(RC[-12]))+4*RC[-11]*RC[-1]*SIN(RADIANS(RC[-12]))*COS(2*RADIANS(RC[-13]))-0.5*RC[-1]*RC[-1]*SIN(4*RADIANS(RC[-13]))-1.25*RC[-11]*RC[-11]*SIN(2*RADIANS(RC[-12]))) -> -2.7871663883641009 | W365: =DEGREES(ACOS(COS(RADIANS(90.833))/(COS(RADIANS(R2C2))*COS(RADIANS(RC[-3])))-TAN(RADIANS(R2C2))*TAN(RADIANS(RC[-3])))) -> #NUM! | X365: =(720-4*R3C2-RC[-2]+R4C2*60)/1440 -> 1899-12-31T13:58:47.230 | Y365: =(RC[-1]*1440-RC[-2]*4)/1440 -> #NUM! | Z365: =(RC[-2]*1440+RC[-3]*4)/1440 -> #NUM! | AA365: =8*RC[-4] -> #NUM! | AB365: =MOD(RC[-23]*1440+RC[-6]+4*R3C2-60*R4C2,1440) -> 721.21283361163592 | AC365: =IF(RC[-1]/4<0,RC[-1]/4+180,RC[-1]/4-180) -> 0.30320840290897877 | AD365: =DEGREES(ACOS(SIN(RADIANS(R2C2))*SIN(RADIANS(RC[-10]))+COS(RADIANS(R2C2))*COS(RADIANS(RC[-10]))*COS(RADIANS(RC[-1])))) -> 93.105122048229717 | AE365: =90-RC[-1] -> -3.1051220482297168 | AF365: =IF(RC[-1]>85,0,IF(RC[-1]>5,58.1/TAN(RADIANS(RC[-1]))-0.07/POWER(TAN(RADIANS(RC[-1])),3)+0.000086/POWER(TAN(RADIANS(RC[-1])),5),IF(RC[-1]>-0.575,1735+RC[-1]*(-518.2+RC[-1]*(103.4+RC[-1]*(-12.79+RC[-1]*0.711))),-20.772/TAN(RADIANS(RC[-1])))))/3600 -> 0.10636391068869706 | AG365: =RC[-2]+RC[-1] -> -2.9987581375410199 | AH365: =IF(RC[-5]>0,MOD(DEGREES(ACOS(((SIN(RADIANS(R2C2))*COS(RADIANS(RC[-4])))-SIN(RADIANS(RC[-14])))/(COS(RADIANS(R2C2))*SIN(RADIANS(RC[-4])))))+180,360),MOD(540-DEGREES(ACOS(((SIN(RADIANS(R2C2))*COS(RADIANS(RC[-4])))-SIN(RADIANS(RC[-14])))/(COS(RADIANS(R2C2))*SIN(RADIANS(RC[-4]))))),360)) -> 180.27929735460251
D366: =R[-1]C+1 -> 2017-12-31T00:00:00.000 | E366: =R5C2 -> 1899-12-31T14:00:00.000 | F366: =RC[-2]+2415018.5+RC[-1]-R4C2/24 -> 2458119.375 | G366: =(RC[-1]-2451545)/36525 -> 0.17999657768651608 | I366: =MOD(280.46646+RC[-2]*(36000.76983 + RC[-2]*0.0003032),360) -> 280.48183330328538 | J366: =357.52911+RC[-3]*(35999.05029 - 0.0001537*RC[-3]) -> 6837.2349571850937 | K366: =0.016708634-RC[-4]*(0.000042037+0.0000001267*RC[-4]) -> 1.6701063378939889E-2 | L366: =SIN(RADIANS(RC[-2]))*(1.914602-RC[-5]*(0.004817+0.000014*RC[-5]))+SIN(RADIANS(2*RC[-2]))*(0.019993-0.000101*RC[-5])+SIN(RADIANS(3*RC[-2]))*0.000289 -> -9.4285899131216155E-2 | M366: =RC[-4]+RC[-1] -> 280.38754740415419 | N366: =RC[-4]+RC[-2] -> 6837.1406712859625 | O366: =(1.000001018*(1-RC[-4]*RC[-4]))/(1+RC[-4]*COS(RADIANS(RC[-1]))) -> 0.98332004745474266 | P366: =RC[-3]-0.00569-0.00478*SIN(RADIANS(125.04-1934.136*RC[-9])) -> 280.37859148582896 | Q366: =23+(26+((21.448-RC[-10]*(46.815+RC[-10]*(0.00059-RC[-10]*0.001813))))/60)/60 -> 23.436950403242541 | R366: =RC[-1]+0.00256*COS(RADIANS(125.04-1934.136*RC[-11])) -> 23.43508112250753 | S366: =DEGREES(ATAN2(COS(RADIANS(RC[-3])),COS(RADIANS(RC[-1]))*SIN(RADIANS(RC[-3])))) -> -78.711332398706446 | T366: =DEGREES(ASIN(SIN(RADIANS(RC[-2]))*SIN(RADIANS(RC[-4])))) -> -23.029358890719905 | U366: =TAN(RADIANS(RC[-3]/2))*TAN(RADIANS(RC[-3]/2)) -> 4.3018632020388199E-2 | V366: =4*DEGREES(RC[-1]*SIN(2*RADIANS(RC[-13]))-2*RC[-11]*SIN(RADIANS(RC[-12]))+4*RC[-11]*RC[-1]*SIN(RADIANS(RC[-12]))*COS(2*RADIANS(RC[-13]))-0.5*RC[-1]*RC[-1]*SIN(4*RADIANS(RC[-13]))-1.25*RC[-11]*RC[-11]*SIN(2*RADIANS(RC[-12]))) -> -3.2624020758792565 | W366: =DEGREES(ACOS(COS(RADIANS(90.833))/(COS(RADIANS(R2C2))*COS(RADIANS(RC[-3])))-TAN(RADIANS(R2C2))*TAN(RADIANS(RC[-3])))) -> #NUM! | X366: =(720-4*R3C2-RC[-2]+R4C2*60)/1440 -> 1899-12-31T13:59:15.744 | Y366: =(RC[-1]*1440-RC[-2]*4)/1440 -> #NUM! | Z366: =(RC[-2]*1440+RC[-3]*4)/1440 -> #NUM! | AA366: =8*RC[-4] -> #NUM! | AB366: =MOD(RC[-23]*1440+RC[-6]+4*R3C2-60*R4C2,1440) -> 720.73759792412079 | AC366: =IF(RC[-1]/4<0,RC[-1]/4+180,RC[-1]/4-180) -> 0.18439948103019788 | AD366: =DEGREES(ACOS(SIN(RADIANS(R2C2))*SIN(RADIANS(RC[-10]))+COS(RADIANS(R2C2))*COS(RADIANS(RC[-10]))*COS(RADIANS(RC[-1])))) -> 93.029452422016988 | AE366: =90-RC[-1] -> -3.0294524220169876 | AF366: =IF(RC[-1]>85,0,IF(RC[-1]>5,58.1/TAN(RADIANS(RC[-1]))-0.07/POWER(TAN(RADIANS(RC[-1])),3)+0.000086/POWER(TAN(RADIANS(RC[-1])),5),IF(RC[-1]>-0.575,1735+RC[-1]*(-518.2+RC[-1]*(103.4+RC[-1]*(-12.79+RC[-1]*0.711))),-20.772/TAN(RADIANS(RC[-1])))))/3600 -> 0.10902581281761119 | AG366: =RC[-2]+RC[-1] -> -2.9204266091993762 | AH366: =IF(RC[-5]>0,MOD(DEGREES(ACOS(((SIN(RADIANS(R2C2))*COS(RADIANS(RC[-4])))-SIN(RADIANS(RC[-14])))/(COS(RADIANS(R2C2))*SIN(RADIANS(RC[-4])))))+180,360),MOD(540-DEGREES(ACOS(((SIN(RADIANS(R2C2))*COS(RADIANS(RC[-4])))-SIN(RADIANS(RC[-14])))/(COS(RADIANS(R2C2))*SIN(RADIANS(RC[-4]))))),360)) -> 180.16994112416143
D367: =R[-1]C+1 -> 2018-01-01T00:00:00.000 | E367: =R5C2 -> 1899-12-31T14:00:00.000 | F367: =RC[-2]+2415018.5+RC[-1]-R4C2/24 -> 2458120.375 | G367: =(RC[-1]-2451545)/36525 -> 0.18002395619438741 | I367: =MOD(280.46646+RC[-2]*(36000.76983 + RC[-2]*0.0003032),360) -> 281.46748066643886 | J367: =357.52911+RC[-3]*(35999.05029 - 0.0001537*RC[-3]) -> 6838.2205574653044 | K367: =0.016708634-RC[-4]*(0.000042037+0.0000001267*RC[-4]) -> 1.6701062226780694E-2 | L367: =SIN(RADIANS(RC[-2]))*(1.914602-RC[-5]*(0.004817+0.000014*RC[-5]))+SIN(RADIANS(2*RC[-2]))*(0.019993-0.000101*RC[-5])+SIN(RADIANS(3*RC[-2]))*0.000289 -> -6.0692356008917314E-2 | M367: =RC[-4]+RC[-1] -> 281.40678831042993 | N367: =RC[-4]+RC[-2] -> 6838.1598651092954 | O367: =(1.000001018*(1-RC[-4]*RC[-4]))/(1+RC[-4]*COS(RADIANS(RC[-1]))) -> 0.98330826843082009 | P367: =RC[-3]-0.00569-0.00478*SIN(RADIANS(125.04-1934.136*RC[-9])) -> 281.39782916770611 | Q367: =23+(26+((21.448-RC[-10]*(46.815+RC[-10]*(0.00059-RC[-10]*0.001813))))/60)/60 -> 23.436950047207585 | R367: =RC[-1]+0.00256*COS(RADIANS(125.04-1934.136*RC[-11])) -> 23.43508238382962 | S367: =DEGREES(ATAN2(COS(RADIANS(RC[-3])),COS(RADIANS(RC[-1]))*SIN(RADIANS(RC[-3])))) -> -77.607862944185541 | T367: =DEGREES(ASIN(SIN(RADIANS(RC[-2]))*SIN(RADIANS(RC[-4])))) -> -22.946186170198789 | U367: =TAN(RADIANS(RC[-3]/2))*TAN(RADIANS(RC[-3]/2)) -> 4.3018636782764921E-2 | V367: =4*DEGREES(RC[-1]*SIN(2*RADIANS(RC[-13]))-2*RC[-11]*SIN(RADIANS(RC[-12]))+4*RC[-11]*RC[-1]*SIN(RADIANS(RC[-12]))*COS(2*RADIANS(RC[-13]))-0.5*RC[-1]*RC[-1]*SIN(4*RADIANS(RC[-13]))-1.25*RC[-11]*RC[-11]*SIN(2*RADIANS(RC[-12]))) -> -3.7326758078032336 | W367: =DEGREES(ACOS(COS(RADIANS(90.833))/(COS(RADIANS(R2C2))*COS(RADIANS(RC[-3])))-TAN(RADIANS(R2C2))*TAN(RADIANS(RC[-3])))) -> #NUM! | X367: =(720-4*R3C2-RC[-2]+R4C2*60)/1440 -> 1899-12-31T13:59:43.961 | Y367: =(RC[-1]*1440-RC[-2]*4)/1440 -> #NUM! | Z367: =(RC[-2]*1440+RC[-3]*4)/1440 -> #NUM! | AA367: =8*RC[-4] -> #NUM! | AB367: =MOD(RC[-23]*1440+RC[-6]+4*R3C2-60*R4C2,1440) -> 720.26732419219672 | AC367: =IF(RC[-1]/4<0,RC[-1]/4+180,RC[-1]/4-180) -> 6.6831048049181163E-2 | AD367: =DEGREES(ACOS(SIN(RADIANS(R2C2))*SIN(RADIANS(RC[-10]))+COS(RADIANS(R2C2))*COS(RADIANS(RC[-10]))*COS(RADIANS(RC[-1])))) -> 92.946198462380238 | AE367: =90-RC[-1] -> -2.946198462380238 | AF367: =IF(RC[-1]>85,0,IF(RC[-1]>5,58.1/TAN(RADIANS(RC[-1]))-0.07/POWER(TAN(RADIANS(RC[-1])),3)+0.000086/POWER(TAN(RADIANS(RC[-1])),5),IF(RC[-1]>-0.575,1735+RC[-1]*(-518.2+RC[-1]*(103.4+RC[-1]*(-12.79+RC[-1]*0.711))),-20.772/TAN(RADIANS(RC[-1])))))/3600 -> 0.11211234517741876 | AG367: =RC[-2]+RC[-1] -> -2.8340861172028191 | AH367: =IF(RC[-5]>0,MOD(DEGREES(ACOS(((SIN(RADIANS(R2C2))*COS(RADIANS(RC[-4])))-SIN(RADIANS(RC[-14])))/(COS(RADIANS(R2C2))*SIN(RADIANS(RC[-4])))))+180,360),MOD(540-DEGREES(ACOS(((SIN(RADIANS(R2C2))*COS(RADIANS(RC[-4])))-SIN(RADIANS(RC[-14])))/(COS(RADIANS(R2C2))*SIN(RADIANS(RC[-4]))))),360)) -> 180.06162425344303